[I 2026-03-12 01:56:56,656] Trial 769 finished with value: 3.484125427035651 and parameters: {'timeframe': 'M8', 'atr_period': 13, 'atr_threshold': 5.0, 'pt_mult': 0.5, 'sl_mult': 5.0, 'td_mins': 120}. Best is trial 398 with value: 3.484125427035651.
[I 2026-03-12 01:56:56,777] Trial 770 finished with value: 3.484125427035651 and parameters: {'timeframe': 'M8', 'atr_period': 13, 'atr_threshold': 5.0, 'pt_mult': 0.5, 'sl_mult': 5.0, 'td_mins': 120}. Best is trial 398 with value: 3.484125427035651.
[I 2026-03-12 01:56:56,905] Trial 771 finished with value: 3.484125427035651 and parameters: {'timeframe': 'M8', 'atr_period': 13, 'atr_threshold': 5.0, 'pt_mult': 0.5, 'sl_mult': 5.0, 'td_mins': 120}. Best is trial 398 with value: 3.484125427035651.
[I 2026-03-12 01:56:56,962] Trial 772 finished with value: 0.0 and parameters: {'timeframe': 'M8', 'atr_period': 13, 'atr_threshold': 10.0, 'pt_mult': 0.5, 'sl_mult': 1.0, 'td_mins': 60}. Best is trial 398 with value: 3.484125427035651.
[I 2026-03-12 01:56:57,090] Trial 773 finished with value: 3.484125427035651 and parameters: {'timeframe': 'M8', 'atr_period': 13, 'atr_threshold': 5.0, 'pt_mult': 0.5, 'sl_mult': 5.0, 'td_mins': 120}. Best is trial 398 with value: 3.484125427035651.
[I 2026-03-12 01:56:57,257] Trial 774 pruned. 
[I 2026-03-12 01:56:57,685] Trial 775 finished with value: 1.7454403254433006 and parameters: {'timeframe': 'M8', 'atr_period': 13, 'atr_threshold': 5.0, 'pt_mult': 2.5, 'sl_mult': 5.0, 'td_mins': 720}. Best is trial 398 with value: 3.484125427035651.
[I 2026-03-12 01:56:57,740] Trial 776 pruned. 
[I 2026-03-12 01:56:57,940] Trial 777 finished with value: 1.4967331369168109 and parameters: {'timeframe': 'M8', 'atr_period': 13, 'atr_threshold': 5.0, 'pt_mult': 0.5, 'sl_mult': 5.0, 'td_mins': 360}. Best is trial 398 with value: 3.484125427035651.
[I 2026-03-12 01:56:58,033] Trial 778 pruned. 
[I 2026-03-12 01:56:58,087] Trial 779 finished with value: 0.0 and parameters: {'timeframe': 'M8', 'atr_period': 13, 'atr_threshold': 8.0, 'pt_mult': 2.5, 'sl_mult': 0.5, 'td_mins': 360}. Best is trial 398 with value: 3.484125427035651.
[I 2026-03-12 01:56:58,381] Trial 780 pruned. 
[I 2026-03-12 01:56:58,432] Trial 781 finished with value: 0.0 and parameters: {'timeframe': 'M8', 'atr_period': 13, 'atr_threshold': 8.0, 'pt_mult': 0.5, 'sl_mult': 1.0, 'td_mins': 60}. Best is trial 398 with value: 3.484125427035651.
[I 2026-03-12 01:56:58,554] Trial 782 finished with value: 3.484125427035651 and parameters: {'timeframe': 'M8', 'atr_period': 13, 'atr_threshold': 5.0, 'pt_mult': 0.5, 'sl_mult': 5.0, 'td_mins': 120}. Best is trial 398 with value: 3.484125427035651.
[I 2026-03-12 01:56:58,664] Trial 783 finished with value: 3.484125427035651 and parameters: {'timeframe': 'M8', 'atr_period': 13, 'atr_threshold': 5.0, 'pt_mult': 0.5, 'sl_mult': 5.0, 'td_mins': 120}. Best is trial 398 with value: 3.484125427035651.
[I 2026-03-12 01:56:58,732] Trial 784 pruned. 
[I 2026-03-12 01:56:58,780] Trial 785 finished with value: 0.0 and parameters: {'timeframe': 'M8', 'atr_period': 13, 'atr_threshold': 8.0, 'pt_mult': 1.0, 'sl_mult': 0.5, 'td_mins': 360}. Best is trial 398 with value: 3.484125427035651.
[I 2026-03-12 01:56:58,894] Trial 786 pruned. 
[I 2026-03-12 01:56:59,005] Trial 787 finished with value: 3.484125427035651 and parameters: {'timeframe': 'M8', 'atr_period': 13, 'atr_threshold': 5.0, 'pt_mult': 0.5, 'sl_mult': 5.0, 'td_mins': 120}. Best is trial 398 with value: 3.484125427035651.
[I 2026-03-12 01:56:59,083] Trial 788 pruned. 
[I 2026-03-12 01:56:59,270] Trial 789 pruned. 
[I 2026-03-12 01:56:59,331] Trial 790 pruned. 
[I 2026-03-12 01:56:59,381] Trial 791 finished with value: 0.0 and parameters: {'timeframe': 'M8', 'atr_period': 13, 'atr_threshold': 8.0, 'pt_mult': 5.0, 'sl_mult': 0.5, 'td_mins': 1080}. Best is trial 398 with value: 3.484125427035651.
[I 2026-03-12 01:56:59,518] Trial 792 pruned. 
[I 2026-03-12 01:56:59,576] Trial 793 finished with value: 0.0 and parameters: {'timeframe': 'M8', 'atr_period': 13, 'atr_threshold': 10.0, 'pt_mult': 2.5, 'sl_mult': 5.0, 'td_mins': 360}. Best is trial 398 with value: 3.484125427035651.
[I 2026-03-12 01:56:59,683] Trial 794 pruned. 
[I 2026-03-12 01:56:59,733] Trial 795 finished with value: 0.0 and parameters: {'timeframe': 'M8', 'atr_period': 13, 'atr_threshold': 15.0, 'pt_mult': 0.5, 'sl_mult': 2.5, 'td_mins': 360}. Best is trial 398 with value: 3.484125427035651.
[I 2026-03-12 01:56:59,847] Trial 796 finished with value: 3.484125427035651 and parameters: {'timeframe': 'M8', 'atr_period': 13, 'atr_threshold': 5.0, 'pt_mult': 0.5, 'sl_mult': 5.0, 'td_mins': 120}. Best is trial 398 with value: 3.484125427035651.
[I 2026-03-12 01:56:59,984] Trial 797 finished with value: 2.85002292450261 and parameters: {'timeframe': 'M8', 'atr_period': 13, 'atr_threshold': 5.0, 'pt_mult': 0.5, 'sl_mult': 5.0, 'td_mins': 180}. Best is trial 398 with value: 3.484125427035651.
[I 2026-03-12 01:57:00,040] Trial 798 finished with value: 0.0 and parameters: {'timeframe': 'M8', 'atr_period': 13, 'atr_threshold': 10.0, 'pt_mult': 1.0, 'sl_mult': 1.0, 'td_mins': 30}. Best is trial 398 with value: 3.484125427035651.
[I 2026-03-12 01:57:00,106] Trial 799 pruned. 
[I 2026-03-12 01:57:00,217] Trial 800 finished with value: 3.484125427035651 and parameters: {'timeframe': 'M8', 'atr_period': 13, 'atr_threshold': 5.0, 'pt_mult': 0.5, 'sl_mult': 5.0, 'td_mins': 120}. Best is trial 398 with value: 3.484125427035651.
[I 2026-03-12 01:57:00,585] Trial 801 pruned. 
[I 2026-03-12 01:57:00,636] Trial 802 finished with value: 0.0 and parameters: {'timeframe': 'M8', 'atr_period': 13, 'atr_threshold': 15.0, 'pt_mult': 1.0, 'sl_mult': 2.5, 'td_mins': 15}. Best is trial 398 with value: 3.484125427035651.
[I 2026-03-12 01:57:00,750] Trial 803 finished with value: 3.484125427035651 and parameters: {'timeframe': 'M8', 'atr_period': 13, 'atr_threshold': 5.0, 'pt_mult': 0.5, 'sl_mult': 5.0, 'td_mins': 120}. Best is trial 398 with value: 3.484125427035651.
[I 2026-03-12 01:57:00,865] Trial 804 finished with value: 3.484125427035651 and parameters: {'timeframe': 'M8', 'atr_period': 13, 'atr_threshold': 5.0, 'pt_mult': 0.5, 'sl_mult': 5.0, 'td_mins': 120}. Best is trial 398 with value: 3.484125427035651.
[I 2026-03-12 01:57:01,088] Trial 805 pruned. 
[I 2026-03-12 01:57:01,143] Trial 806 pruned. 
[I 2026-03-12 01:57:01,195] Trial 807 finished with value: 0.0 and parameters: {'timeframe': 'M8', 'atr_period': 13, 'atr_threshold': 15.0, 'pt_mult': 0.5, 'sl_mult': 2.5, 'td_mins': 1080}. Best is trial 398 with value: 3.484125427035651.
[I 2026-03-12 01:57:01,307] Trial 808 finished with value: 3.484125427035651 and parameters: {'timeframe': 'M8', 'atr_period': 13, 'atr_threshold': 5.0, 'pt_mult': 0.5, 'sl_mult': 5.0, 'td_mins': 120}. Best is trial 398 with value: 3.484125427035651.
[I 2026-03-12 01:57:01,362] Trial 809 pruned. 
[I 2026-03-12 01:57:01,471] Trial 810 finished with value: 3.484125427035651 and parameters: {'timeframe': 'M8', 'atr_period': 13, 'atr_threshold': 5.0, 'pt_mult': 0.5, 'sl_mult': 5.0, 'td_mins': 120}. Best is trial 398 with value: 3.484125427035651.
[I 2026-03-12 01:57:01,582] Trial 811 finished with value: 3.484125427035651 and parameters: {'timeframe': 'M8', 'atr_period': 13, 'atr_threshold': 5.0, 'pt_mult': 0.5, 'sl_mult': 5.0, 'td_mins': 120}. Best is trial 398 with value: 3.484125427035651.
[I 2026-03-12 01:57:01,635] Trial 812 finished with value: 0.0 and parameters: {'timeframe': 'M8', 'atr_period': 13, 'atr_threshold': 10.0, 'pt_mult': 0.5, 'sl_mult': 5.0, 'td_mins': 60}. Best is trial 398 with value: 3.484125427035651.
[I 2026-03-12 01:57:01,776] Trial 813 pruned. 
[I 2026-03-12 01:57:02,003] Trial 814 pruned. 
[I 2026-03-12 01:57:02,110] Trial 815 pruned. 
[I 2026-03-12 01:57:02,231] Trial 816 finished with value: 3.484125427035651 and parameters: {'timeframe': 'M8', 'atr_period': 13, 'atr_threshold': 5.0, 'pt_mult': 0.5, 'sl_mult': 5.0, 'td_mins': 120}. Best is trial 398 with value: 3.484125427035651.
[I 2026-03-12 01:57:02,281] Trial 817 finished with value: 0.0 and parameters: {'timeframe': 'M8', 'atr_period': 13, 'atr_threshold': 10.0, 'pt_mult': 2.5, 'sl_mult': 0.5, 'td_mins': 1200}. Best is trial 398 with value: 3.484125427035651.
[I 2026-03-12 01:57:02,399] Trial 818 finished with value: 3.484125427035651 and parameters: {'timeframe': 'M8', 'atr_period': 13, 'atr_threshold': 5.0, 'pt_mult': 0.5, 'sl_mult': 5.0, 'td_mins': 120}. Best is trial 398 with value: 3.484125427035651.
[I 2026-03-12 01:57:02,453] Trial 819 pruned. 
[I 2026-03-12 01:57:02,502] Trial 820 finished with value: 0.0 and parameters: {'timeframe': 'M8', 'atr_period': 13, 'atr_threshold': 8.0, 'pt_mult': 2.5, 'sl_mult': 1.0, 'td_mins': 60}. Best is trial 398 with value: 3.484125427035651.
[I 2026-03-12 01:57:02,568] Trial 821 pruned. 
[I 2026-03-12 01:57:02,620] Trial 822 finished with value: 0.0 and parameters: {'timeframe': 'M8', 'atr_period': 13, 'atr_threshold': 10.0, 'pt_mult': 0.5, 'sl_mult': 0.5, 'td_mins': 30}. Best is trial 398 with value: 3.484125427035651.
[I 2026-03-12 01:57:02,735] Trial 823 pruned. 
[I 2026-03-12 01:57:02,785] Trial 824 finished with value: 0.0 and parameters: {'timeframe': 'M8', 'atr_period': 13, 'atr_threshold': 15.0, 'pt_mult': 5.0, 'sl_mult': 5.0, 'td_mins': 15}. Best is trial 398 with value: 3.484125427035651.
[I 2026-03-12 01:57:02,834] Trial 825 finished with value: 0.0 and parameters: {'timeframe': 'M8', 'atr_period': 13, 'atr_threshold': 10.0, 'pt_mult': 0.5, 'sl_mult': 5.0, 'td_mins': 120}. Best is trial 398 with value: 3.484125427035651.
[I 2026-03-12 01:57:03,172] Trial 826 pruned. 
[I 2026-03-12 01:57:03,229] Trial 827 pruned. 
[I 2026-03-12 01:57:03,316] Trial 828 pruned. 
[I 2026-03-12 01:57:04,037] Trial 829 pruned. 
[I 2026-03-12 01:57:04,089] Trial 830 finished with value: 0.0 and parameters: {'timeframe': 'M8', 'atr_period': 13, 'atr_threshold': 8.0, 'pt_mult': 1.0, 'sl_mult': 1.0, 'td_mins': 360}. Best is trial 398 with value: 3.484125427035651.
[I 2026-03-12 01:57:04,171] Trial 831 pruned. 
[I 2026-03-12 01:57:04,222] Trial 832 finished with value: 0.0 and parameters: {'timeframe': 'M8', 'atr_period': 13, 'atr_threshold': 8.0, 'pt_mult': 0.5, 'sl_mult': 2.5, 'td_mins': 720}. Best is trial 398 with value: 3.484125427035651.
[I 2026-03-12 01:57:04,479] Trial 833 pruned. 
[I 2026-03-12 01:57:04,529] Trial 834 finished with value: 0.0 and parameters: {'timeframe': 'M8', 'atr_period': 13, 'atr_threshold': 15.0, 'pt_mult': 0.5, 'sl_mult': 5.0, 'td_mins': 120}. Best is trial 398 with value: 3.484125427035651.
[I 2026-03-12 01:57:04,644] Trial 835 finished with value: 3.484125427035651 and parameters: {'timeframe': 'M8', 'atr_period': 13, 'atr_threshold': 5.0, 'pt_mult': 0.5, 'sl_mult': 5.0, 'td_mins': 120}. Best is trial 398 with value: 3.484125427035651.
[I 2026-03-12 01:57:05,370] Trial 836 pruned. 
[I 2026-03-12 01:57:05,443] Trial 837 finished with value: 2.4896042006737558 and parameters: {'timeframe': 'M8', 'atr_period': 13, 'atr_threshold': 5.0, 'pt_mult': 0.5, 'sl_mult': 5.0, 'td_mins': 30}. Best is trial 398 with value: 3.484125427035651.
[I 2026-03-12 01:57:05,553] Trial 838 finished with value: 3.484125427035651 and parameters: {'timeframe': 'M8', 'atr_period': 13, 'atr_threshold': 5.0, 'pt_mult': 0.5, 'sl_mult': 5.0, 'td_mins': 120}. Best is trial 398 with value: 3.484125427035651.
[I 2026-03-12 01:57:06,770] Trial 839 pruned. 
[I 2026-03-12 01:57:07,067] Trial 840 pruned. 
[I 2026-03-12 01:57:07,122] Trial 841 finished with value: 0.0 and parameters: {'timeframe': 'M8', 'atr_period': 13, 'atr_threshold': 10.0, 'pt_mult': 5.0, 'sl_mult': 5.0, 'td_mins': 60}. Best is trial 398 with value: 3.484125427035651.
[I 2026-03-12 01:57:07,245] Trial 842 finished with value: 1.8479405007566938 and parameters: {'timeframe': 'M8', 'atr_period': 13, 'atr_threshold': 5.0, 'pt_mult': 2.5, 'sl_mult': 5.0, 'td_mins': 120}. Best is trial 398 with value: 3.484125427035651.
[I 2026-03-12 01:57:07,510] Trial 843 pruned. 
[I 2026-03-12 01:57:07,767] Trial 844 pruned. 
[I 2026-03-12 01:57:07,822] Trial 845 pruned. 
[I 2026-03-12 01:57:07,875] Trial 846 finished with value: 0.0 and parameters: {'timeframe': 'M8', 'atr_period': 13, 'atr_threshold': 8.0, 'pt_mult': 1.0, 'sl_mult': 5.0, 'td_mins': 720}. Best is trial 398 with value: 3.484125427035651.
[I 2026-03-12 01:57:08,284] Trial 847 pruned. 
[I 2026-03-12 01:57:08,334] Trial 848 finished with value: 0.0 and parameters: {'timeframe': 'M8', 'atr_period': 13, 'atr_threshold': 8.0, 'pt_mult': 0.5, 'sl_mult': 5.0, 'td_mins': 120}. Best is trial 398 with value: 3.484125427035651.
[I 2026-03-12 01:57:08,384] Trial 849 finished with value: 0.0 and parameters: {'timeframe': 'M8', 'atr_period': 13, 'atr_threshold': 15.0, 'pt_mult': 2.5, 'sl_mult': 5.0, 'td_mins': 180}. Best is trial 398 with value: 3.484125427035651.
[I 2026-03-12 01:57:09,771] Trial 850 pruned. 
[I 2026-03-12 01:57:10,792] Trial 851 pruned. 
[I 2026-03-12 01:57:10,844] Trial 852 finished with value: 0.0 and parameters: {'timeframe': 'M8', 'atr_period': 13, 'atr_threshold': 15.0, 'pt_mult': 5.0, 'sl_mult': 5.0, 'td_mins': 180}. Best is trial 398 with value: 3.484125427035651.
[I 2026-03-12 01:57:10,908] Trial 853 pruned. 
[I 2026-03-12 01:57:10,962] Trial 854 pruned. 
[I 2026-03-12 01:57:11,073] Trial 855 finished with value: 3.484125427035651 and parameters: {'timeframe': 'M8', 'atr_period': 13, 'atr_threshold': 5.0, 'pt_mult': 0.5, 'sl_mult': 5.0, 'td_mins': 120}. Best is trial 398 with value: 3.484125427035651.
[I 2026-03-12 01:57:11,187] Trial 856 finished with value: 3.484125427035651 and parameters: {'timeframe': 'M8', 'atr_period': 13, 'atr_threshold': 5.0, 'pt_mult': 0.5, 'sl_mult': 5.0, 'td_mins': 120}. Best is trial 398 with value: 3.484125427035651.
[I 2026-03-12 01:57:11,311] Trial 857 finished with value: 2.7985173655325846 and parameters: {'timeframe': 'M8', 'atr_period': 13, 'atr_threshold': 5.0, 'pt_mult': 1.0, 'sl_mult': 5.0, 'td_mins': 120}. Best is trial 398 with value: 3.484125427035651.
[I 2026-03-12 01:57:11,372] Trial 858 pruned. 
[I 2026-03-12 01:57:11,483] Trial 859 pruned. 
[I 2026-03-12 01:57:11,540] Trial 860 pruned. 
[I 2026-03-12 01:57:11,914] Trial 861 finished with value: 1.5146017913734133 and parameters: {'timeframe': 'M8', 'atr_period': 13, 'atr_threshold': 5.0, 'pt_mult': 0.5, 'sl_mult': 5.0, 'td_mins': 720}. Best is trial 398 with value: 3.484125427035651.
[I 2026-03-12 01:57:12,003] Trial 862 pruned. 
[I 2026-03-12 01:57:12,058] Trial 863 finished with value: 0.0 and parameters: {'timeframe': 'M8', 'atr_period': 13, 'atr_threshold': 15.0, 'pt_mult': 5.0, 'sl_mult': 1.0, 'td_mins': 60}. Best is trial 398 with value: 3.484125427035651.
[I 2026-03-12 01:57:12,113] Trial 864 finished with value: 0.0 and parameters: {'timeframe': 'M8', 'atr_period': 13, 'atr_threshold': 10.0, 'pt_mult': 2.5, 'sl_mult': 0.5, 'td_mins': 120}. Best is trial 398 with value: 3.484125427035651.
[I 2026-03-12 01:57:12,237] Trial 865 finished with value: 3.484125427035651 and parameters: {'timeframe': 'M8', 'atr_period': 13, 'atr_threshold': 5.0, 'pt_mult': 0.5, 'sl_mult': 5.0, 'td_mins': 120}. Best is trial 398 with value: 3.484125427035651.
[I 2026-03-12 01:57:12,348] Trial 866 finished with value: 3.484125427035651 and parameters: {'timeframe': 'M8', 'atr_period': 13, 'atr_threshold': 5.0, 'pt_mult': 0.5, 'sl_mult': 5.0, 'td_mins': 120}. Best is trial 398 with value: 3.484125427035651.
[I 2026-03-12 01:57:12,464] Trial 867 pruned. 
[I 2026-03-12 01:57:12,515] Trial 868 pruned. 
[I 2026-03-12 01:57:12,628] Trial 869 finished with value: 3.484125427035651 and parameters: {'timeframe': 'M8', 'atr_period': 13, 'atr_threshold': 5.0, 'pt_mult': 0.5, 'sl_mult': 5.0, 'td_mins': 120}. Best is trial 398 with value: 3.484125427035651.
[I 2026-03-12 01:57:12,752] Trial 870 pruned. 
[I 2026-03-12 01:57:12,807] Trial 871 pruned. 
[I 2026-03-12 01:57:12,857] Trial 872 pruned. 
[I 2026-03-12 01:57:12,912] Trial 873 pruned. 
[I 2026-03-12 01:57:13,021] Trial 874 finished with value: 3.484125427035651 and parameters: {'timeframe': 'M8', 'atr_period': 13, 'atr_threshold': 5.0, 'pt_mult': 0.5, 'sl_mult': 5.0, 'td_mins': 120}. Best is trial 398 with value: 3.484125427035651.
[I 2026-03-12 01:57:13,129] Trial 875 finished with value: 3.484125427035651 and parameters: {'timeframe': 'M8', 'atr_period': 13, 'atr_threshold': 5.0, 'pt_mult': 0.5, 'sl_mult': 5.0, 'td_mins': 120}. Best is trial 398 with value: 3.484125427035651.
[I 2026-03-12 01:57:13,429] Trial 876 pruned. 
[I 2026-03-12 01:57:13,539] Trial 877 finished with value: 3.484125427035651 and parameters: {'timeframe': 'M8', 'atr_period': 13, 'atr_threshold': 5.0, 'pt_mult': 0.5, 'sl_mult': 5.0, 'td_mins': 120}. Best is trial 398 with value: 3.484125427035651.
[I 2026-03-12 01:57:13,652] Trial 878 finished with value: 3.484125427035651 and parameters: {'timeframe': 'M8', 'atr_period': 13, 'atr_threshold': 5.0, 'pt_mult': 0.5, 'sl_mult': 5.0, 'td_mins': 120}. Best is trial 398 with value: 3.484125427035651.
[I 2026-03-12 01:57:13,702] Trial 879 finished with value: 0.0 and parameters: {'timeframe': 'M8', 'atr_period': 13, 'atr_threshold': 10.0, 'pt_mult': 1.0, 'sl_mult': 0.5, 'td_mins': 180}. Best is trial 398 with value: 3.484125427035651.
[I 2026-03-12 01:57:13,814] Trial 880 finished with value: 3.484125427035651 and parameters: {'timeframe': 'M8', 'atr_period': 13, 'atr_threshold': 5.0, 'pt_mult': 0.5, 'sl_mult': 5.0, 'td_mins': 120}. Best is trial 398 with value: 3.484125427035651.
[I 2026-03-12 01:57:14,315] Trial 881 pruned. 
[I 2026-03-12 01:57:14,427] Trial 882 finished with value: 3.484125427035651 and parameters: {'timeframe': 'M8', 'atr_period': 13, 'atr_threshold': 5.0, 'pt_mult': 0.5, 'sl_mult': 5.0, 'td_mins': 120}. Best is trial 398 with value: 3.484125427035651.
[I 2026-03-12 01:57:14,487] Trial 883 pruned. 
[I 2026-03-12 01:57:14,755] Trial 884 pruned. 
[I 2026-03-12 01:57:14,853] Trial 885 pruned. 
[I 2026-03-12 01:57:14,907] Trial 886 finished with value: 0.0 and parameters: {'timeframe': 'M8', 'atr_period': 13, 'atr_threshold': 15.0, 'pt_mult': 0.5, 'sl_mult': 0.5, 'td_mins': 1080}. Best is trial 398 with value: 3.484125427035651.
[I 2026-03-12 01:57:15,022] Trial 887 finished with value: 3.484125427035651 and parameters: {'timeframe': 'M8', 'atr_period': 13, 'atr_threshold': 5.0, 'pt_mult': 0.5, 'sl_mult': 5.0, 'td_mins': 120}. Best is trial 398 with value: 3.484125427035651.
[I 2026-03-12 01:57:15,218] Trial 888 finished with value: 1.4967331369168109 and parameters: {'timeframe': 'M8', 'atr_period': 13, 'atr_threshold': 5.0, 'pt_mult': 0.5, 'sl_mult': 5.0, 'td_mins': 360}. Best is trial 398 with value: 3.484125427035651.
[I 2026-03-12 01:57:15,268] Trial 889 finished with value: 0.0 and parameters: {'timeframe': 'M8', 'atr_period': 13, 'atr_threshold': 15.0, 'pt_mult': 5.0, 'sl_mult': 0.5, 'td_mins': 5}. Best is trial 398 with value: 3.484125427035651.
[I 2026-03-12 01:57:15,323] Trial 890 pruned. 
[I 2026-03-12 01:57:15,380] Trial 891 pruned. 
[I 2026-03-12 01:57:15,431] Trial 892 finished with value: 0.0 and parameters: {'timeframe': 'M8', 'atr_period': 13, 'atr_threshold': 10.0, 'pt_mult': 0.5, 'sl_mult': 1.0, 'td_mins': 1080}. Best is trial 398 with value: 3.484125427035651.
[I 2026-03-12 01:57:15,479] Trial 893 finished with value: 0.0 and parameters: {'timeframe': 'M8', 'atr_period': 13, 'atr_threshold': 8.0, 'pt_mult': 0.5, 'sl_mult': 5.0, 'td_mins': 1080}. Best is trial 398 with value: 3.484125427035651.
[I 2026-03-12 01:57:15,530] Trial 894 finished with value: 0.0 and parameters: {'timeframe': 'M8', 'atr_period': 13, 'atr_threshold': 15.0, 'pt_mult': 1.0, 'sl_mult': 1.0, 'td_mins': 720}. Best is trial 398 with value: 3.484125427035651.
[I 2026-03-12 01:57:15,626] Trial 895 pruned. 
[I 2026-03-12 01:57:15,739] Trial 896 finished with value: 3.484125427035651 and parameters: {'timeframe': 'M8', 'atr_period': 13, 'atr_threshold': 5.0, 'pt_mult': 0.5, 'sl_mult': 5.0, 'td_mins': 120}. Best is trial 398 with value: 3.484125427035651.
[I 2026-03-12 01:57:15,856] Trial 897 finished with value: 3.484125427035651 and parameters: {'timeframe': 'M8', 'atr_period': 13, 'atr_threshold': 5.0, 'pt_mult': 0.5, 'sl_mult': 5.0, 'td_mins': 120}. Best is trial 398 with value: 3.484125427035651.
[I 2026-03-12 01:57:15,921] Trial 898 pruned. 
[I 2026-03-12 01:57:16,034] Trial 899 finished with value: 3.484125427035651 and parameters: {'timeframe': 'M8', 'atr_period': 13, 'atr_threshold': 5.0, 'pt_mult': 0.5, 'sl_mult': 5.0, 'td_mins': 120}. Best is trial 398 with value: 3.484125427035651.
[I 2026-03-12 01:57:16,086] Trial 900 finished with value: 0.0 and parameters: {'timeframe': 'M8', 'atr_period': 13, 'atr_threshold': 10.0, 'pt_mult': 1.0, 'sl_mult': 0.5, 'td_mins': 120}. Best is trial 398 with value: 3.484125427035651.
[I 2026-03-12 01:57:16,135] Trial 901 finished with value: 0.0 and parameters: {'timeframe': 'M8', 'atr_period': 13, 'atr_threshold': 10.0, 'pt_mult': 5.0, 'sl_mult': 2.5, 'td_mins': 1080}. Best is trial 398 with value: 3.484125427035651.
[I 2026-03-12 01:57:16,266] Trial 902 finished with value: 2.85002292450261 and parameters: {'timeframe': 'M8', 'atr_period': 13, 'atr_threshold': 5.0, 'pt_mult': 0.5, 'sl_mult': 5.0, 'td_mins': 180}. Best is trial 398 with value: 3.484125427035651.
[I 2026-03-12 01:57:16,318] Trial 903 finished with value: 0.0 and parameters: {'timeframe': 'M8', 'atr_period': 13, 'atr_threshold': 8.0, 'pt_mult': 2.5, 'sl_mult': 1.0, 'td_mins': 360}. Best is trial 398 with value: 3.484125427035651.
[I 2026-03-12 01:57:16,368] Trial 904 finished with value: 0.0 and parameters: {'timeframe': 'M8', 'atr_period': 13, 'atr_threshold': 10.0, 'pt_mult': 1.0, 'sl_mult': 5.0, 'td_mins': 5}. Best is trial 398 with value: 3.484125427035651.
[I 2026-03-12 01:57:16,473] Trial 905 pruned. 
[I 2026-03-12 01:57:16,894] Trial 906 pruned. 
