[I 2026-03-12 01:09:02,875] Trial 113 finished with value: 1.1858648687968716 and parameters: {'timeframe': 'M15', 'atr_period': 13, 'atr_threshold': 1.0, 'pt_mult': 0.5, 'sl_mult': 2.5, 'td_mins': 30}. Best is trial 82 with value: 2.454517025102679.
[I 2026-03-12 01:09:02,918] Trial 114 pruned. 
[I 2026-03-12 01:09:03,187] Trial 115 finished with value: 1.062489181770707 and parameters: {'timeframe': 'M15', 'atr_period': 13, 'atr_threshold': 3.0, 'pt_mult': 0.5, 'sl_mult': 1.0, 'td_mins': 180}. Best is trial 82 with value: 2.454517025102679.
[I 2026-03-12 01:09:03,231] Trial 116 finished with value: 0.0 and parameters: {'timeframe': 'M15', 'atr_period': 13, 'atr_threshold': 15.0, 'pt_mult': 5.0, 'sl_mult': 0.5, 'td_mins': 1200}. Best is trial 82 with value: 2.454517025102679.
[I 2026-03-12 01:09:03,329] Trial 117 pruned. 
[I 2026-03-12 01:09:03,372] Trial 118 pruned. 
[I 2026-03-12 01:09:03,578] Trial 119 pruned. 
[I 2026-03-12 01:09:03,658] Trial 120 pruned. 
[I 2026-03-12 01:09:04,345] Trial 121 pruned. 
[I 2026-03-12 01:09:04,388] Trial 122 finished with value: 0.0 and parameters: {'timeframe': 'M15', 'atr_period': 13, 'atr_threshold': 15.0, 'pt_mult': 5.0, 'sl_mult': 2.5, 'td_mins': 120}. Best is trial 82 with value: 2.454517025102679.
[I 2026-03-12 01:09:04,969] Trial 123 pruned. 
[I 2026-03-12 01:09:05,011] Trial 124 finished with value: 0.0 and parameters: {'timeframe': 'M15', 'atr_period': 13, 'atr_threshold': 10.0, 'pt_mult': 0.5, 'sl_mult': 2.5, 'td_mins': 15}. Best is trial 82 with value: 2.454517025102679.
[I 2026-03-12 01:09:05,205] Trial 125 pruned. 
[I 2026-03-12 01:09:05,249] Trial 126 pruned. 
[I 2026-03-12 01:09:05,353] Trial 127 pruned. 
[I 2026-03-12 01:09:07,425] Trial 128 finished with value: 1.271278600530214 and parameters: {'timeframe': 'M15', 'atr_period': 13, 'atr_threshold': 2.0, 'pt_mult': 1.0, 'sl_mult': 5.0, 'td_mins': 720}. Best is trial 82 with value: 2.454517025102679.
[I 2026-03-12 01:09:07,483] Trial 129 pruned. 
[I 2026-03-12 01:09:07,530] Trial 130 pruned. 
[I 2026-03-12 01:09:07,580] Trial 131 pruned. 
[I 2026-03-12 01:09:07,639] Trial 132 pruned. 
[I 2026-03-12 01:09:07,701] Trial 133 pruned. 
[I 2026-03-12 01:09:07,750] Trial 134 pruned. 
[I 2026-03-12 01:09:07,844] Trial 135 pruned. 
[I 2026-03-12 01:09:07,887] Trial 136 finished with value: 0.0 and parameters: {'timeframe': 'M15', 'atr_period': 13, 'atr_threshold': 10.0, 'pt_mult': 0.5, 'sl_mult': 5.0, 'td_mins': 120}. Best is trial 82 with value: 2.454517025102679.
[I 2026-03-12 01:09:08,090] Trial 137 pruned. 
[I 2026-03-12 01:09:08,356] Trial 138 pruned. 
[I 2026-03-12 01:09:08,400] Trial 139 finished with value: 0.0 and parameters: {'timeframe': 'M15', 'atr_period': 13, 'atr_threshold': 15.0, 'pt_mult': 1.0, 'sl_mult': 2.5, 'td_mins': 120}. Best is trial 82 with value: 2.454517025102679.
[I 2026-03-12 01:09:08,449] Trial 140 pruned. 
[I 2026-03-12 01:09:08,502] Trial 141 finished with value: 0.0 and parameters: {'timeframe': 'M15', 'atr_period': 13, 'atr_threshold': 15.0, 'pt_mult': 5.0, 'sl_mult': 0.5, 'td_mins': 15}. Best is trial 82 with value: 2.454517025102679.
[I 2026-03-12 01:09:08,573] Trial 142 pruned. 
[I 2026-03-12 01:09:08,616] Trial 143 finished with value: 0.0 and parameters: {'timeframe': 'M15', 'atr_period': 13, 'atr_threshold': 15.0, 'pt_mult': 2.5, 'sl_mult': 2.5, 'td_mins': 180}. Best is trial 82 with value: 2.454517025102679.
[I 2026-03-12 01:09:08,658] Trial 144 finished with value: 0.0 and parameters: {'timeframe': 'M15', 'atr_period': 13, 'atr_threshold': 15.0, 'pt_mult': 0.5, 'sl_mult': 0.5, 'td_mins': 60}. Best is trial 82 with value: 2.454517025102679.
[I 2026-03-12 01:09:09,405] Trial 145 pruned. 
[I 2026-03-12 01:09:09,510] Trial 146 pruned. 
[I 2026-03-12 01:09:09,569] Trial 147 pruned. 
[I 2026-03-12 01:09:09,839] Trial 148 pruned. 
[I 2026-03-12 01:09:09,900] Trial 149 pruned. 
[I 2026-03-12 01:09:09,957] Trial 150 pruned. 
[I 2026-03-12 01:09:10,007] Trial 151 pruned. 
[I 2026-03-12 01:09:10,985] Trial 152 finished with value: 1.1069415327191812 and parameters: {'timeframe': 'M15', 'atr_period': 13, 'atr_threshold': 2.0, 'pt_mult': 1.0, 'sl_mult': 2.5, 'td_mins': 360}. Best is trial 82 with value: 2.454517025102679.
[I 2026-03-12 01:09:11,034] Trial 153 finished with value: 0.0 and parameters: {'timeframe': 'M15', 'atr_period': 13, 'atr_threshold': 10.0, 'pt_mult': 1.0, 'sl_mult': 0.5, 'td_mins': 720}. Best is trial 82 with value: 2.454517025102679.
[I 2026-03-12 01:09:11,121] Trial 154 pruned. 
[I 2026-03-12 01:09:11,167] Trial 155 finished with value: 0.0 and parameters: {'timeframe': 'M15', 'atr_period': 13, 'atr_threshold': 10.0, 'pt_mult': 5.0, 'sl_mult': 5.0, 'td_mins': 30}. Best is trial 82 with value: 2.454517025102679.
[I 2026-03-12 01:09:11,215] Trial 156 finished with value: 0.0 and parameters: {'timeframe': 'M15', 'atr_period': 13, 'atr_threshold': 15.0, 'pt_mult': 1.0, 'sl_mult': 2.5, 'td_mins': 360}. Best is trial 82 with value: 2.454517025102679.
[I 2026-03-12 01:09:11,282] Trial 157 pruned. 
[I 2026-03-12 01:09:11,327] Trial 158 finished with value: 0.0 and parameters: {'timeframe': 'M15', 'atr_period': 13, 'atr_threshold': 10.0, 'pt_mult': 0.5, 'sl_mult': 0.5, 'td_mins': 60}. Best is trial 82 with value: 2.454517025102679.
[I 2026-03-12 01:09:11,860] Trial 159 pruned. 
[I 2026-03-12 01:09:11,910] Trial 160 pruned. 
[I 2026-03-12 01:09:12,465] Trial 161 finished with value: 2.020570026619987 and parameters: {'timeframe': 'M15', 'atr_period': 13, 'atr_threshold': 2.0, 'pt_mult': 0.5, 'sl_mult': 5.0, 'td_mins': 180}. Best is trial 82 with value: 2.454517025102679.
[I 2026-03-12 01:09:12,621] Trial 162 pruned. 
[I 2026-03-12 01:09:13,164] Trial 163 pruned. 
[I 2026-03-12 01:09:13,210] Trial 164 pruned. 
[I 2026-03-12 01:09:13,488] Trial 165 pruned. 
[I 2026-03-12 01:09:14,447] Trial 166 pruned. 
[I 2026-03-12 01:09:14,495] Trial 167 finished with value: 0.0 and parameters: {'timeframe': 'M15', 'atr_period': 13, 'atr_threshold': 10.0, 'pt_mult': 1.0, 'sl_mult': 5.0, 'td_mins': 120}. Best is trial 82 with value: 2.454517025102679.
[I 2026-03-12 01:09:14,540] Trial 168 finished with value: 0.0 and parameters: {'timeframe': 'M15', 'atr_period': 13, 'atr_threshold': 15.0, 'pt_mult': 0.5, 'sl_mult': 2.5, 'td_mins': 15}. Best is trial 82 with value: 2.454517025102679.
[I 2026-03-12 01:09:14,641] Trial 169 pruned. 
[I 2026-03-12 01:09:14,685] Trial 170 finished with value: 0.0 and parameters: {'timeframe': 'M15', 'atr_period': 13, 'atr_threshold': 15.0, 'pt_mult': 2.5, 'sl_mult': 0.5, 'td_mins': 1080}. Best is trial 82 with value: 2.454517025102679.
[I 2026-03-12 01:09:14,731] Trial 171 pruned. 
[I 2026-03-12 01:09:14,785] Trial 172 pruned. 
[I 2026-03-12 01:09:14,863] Trial 173 pruned. 
[I 2026-03-12 01:09:14,907] Trial 174 finished with value: 0.0 and parameters: {'timeframe': 'M15', 'atr_period': 13, 'atr_threshold': 10.0, 'pt_mult': 5.0, 'sl_mult': 5.0, 'td_mins': 1200}. Best is trial 82 with value: 2.454517025102679.
[I 2026-03-12 01:09:14,949] Trial 175 finished with value: 0.0 and parameters: {'timeframe': 'M15', 'atr_period': 13, 'atr_threshold': 15.0, 'pt_mult': 1.0, 'sl_mult': 0.5, 'td_mins': 120}. Best is trial 82 with value: 2.454517025102679.
[I 2026-03-12 01:09:14,996] Trial 176 pruned. 
[I 2026-03-12 01:09:15,041] Trial 177 finished with value: 0.0 and parameters: {'timeframe': 'M15', 'atr_period': 13, 'atr_threshold': 10.0, 'pt_mult': 2.5, 'sl_mult': 5.0, 'td_mins': 30}. Best is trial 82 with value: 2.454517025102679.
[I 2026-03-12 01:09:15,086] Trial 178 pruned. 
[I 2026-03-12 01:09:15,271] Trial 179 finished with value: 2.3996200894903077 and parameters: {'timeframe': 'M15', 'atr_period': 13, 'atr_threshold': 3.0, 'pt_mult': 0.5, 'sl_mult': 5.0, 'td_mins': 60}. Best is trial 82 with value: 2.454517025102679.
[I 2026-03-12 01:09:15,317] Trial 180 pruned. 
[I 2026-03-12 01:09:15,362] Trial 181 pruned. 
[I 2026-03-12 01:09:15,406] Trial 182 pruned. 
[I 2026-03-12 01:09:15,506] Trial 183 pruned. 
[I 2026-03-12 01:09:15,562] Trial 184 pruned. 
[I 2026-03-12 01:09:15,625] Trial 185 pruned. 
[I 2026-03-12 01:09:15,669] Trial 186 finished with value: 0.0 and parameters: {'timeframe': 'M15', 'atr_period': 13, 'atr_threshold': 10.0, 'pt_mult': 1.0, 'sl_mult': 5.0, 'td_mins': 60}. Best is trial 82 with value: 2.454517025102679.
[I 2026-03-12 01:09:15,866] Trial 187 pruned. 
[I 2026-03-12 01:09:16,138] Trial 188 pruned. 
[I 2026-03-12 01:09:16,223] Trial 189 pruned. 
[I 2026-03-12 01:09:16,308] Trial 190 pruned. 
[I 2026-03-12 01:09:16,580] Trial 191 pruned. 
[I 2026-03-12 01:09:16,671] Trial 192 pruned. 
[I 2026-03-12 01:09:16,764] Trial 193 finished with value: 0.8856374582301172 and parameters: {'timeframe': 'M15', 'atr_period': 13, 'atr_threshold': 5.0, 'pt_mult': 0.5, 'sl_mult': 2.5, 'td_mins': 30}. Best is trial 82 with value: 2.454517025102679.
[I 2026-03-12 01:09:18,175] Trial 194 finished with value: 1.1873183913673118 and parameters: {'timeframe': 'M15', 'atr_period': 13, 'atr_threshold': 3.0, 'pt_mult': 1.0, 'sl_mult': 5.0, 'td_mins': 720}. Best is trial 82 with value: 2.454517025102679.
[I 2026-03-12 01:09:18,265] Trial 195 pruned. 
[I 2026-03-12 01:09:22,346] Trial 196 finished with value: 1.0752012127168715 and parameters: {'timeframe': 'M15', 'atr_period': 13, 'atr_threshold': 1.0, 'pt_mult': 0.5, 'sl_mult': 5.0, 'td_mins': 1200}. Best is trial 82 with value: 2.454517025102679.
[I 2026-03-12 01:09:22,391] Trial 197 finished with value: 0.0 and parameters: {'timeframe': 'M15', 'atr_period': 13, 'atr_threshold': 15.0, 'pt_mult': 0.5, 'sl_mult': 2.5, 'td_mins': 30}. Best is trial 82 with value: 2.454517025102679.
[I 2026-03-12 01:09:22,682] Trial 198 finished with value: 1.062489181770707 and parameters: {'timeframe': 'M15', 'atr_period': 13, 'atr_threshold': 3.0, 'pt_mult': 0.5, 'sl_mult': 1.0, 'td_mins': 180}. Best is trial 82 with value: 2.454517025102679.
[I 2026-03-12 01:09:22,731] Trial 199 finished with value: 0.0 and parameters: {'timeframe': 'M15', 'atr_period': 13, 'atr_threshold': 10.0, 'pt_mult': 1.0, 'sl_mult': 1.0, 'td_mins': 5}. Best is trial 82 with value: 2.454517025102679.
[I 2026-03-12 01:09:22,983] Trial 200 pruned. 
[I 2026-03-12 01:09:23,057] Trial 201 pruned. 
[I 2026-03-12 01:09:23,163] Trial 202 pruned. 
[I 2026-03-12 01:09:23,213] Trial 203 pruned. 
[I 2026-03-12 01:09:24,013] Trial 204 pruned. 
[I 2026-03-12 01:09:24,063] Trial 205 finished with value: 0.0 and parameters: {'timeframe': 'M15', 'atr_period': 13, 'atr_threshold': 10.0, 'pt_mult': 2.5, 'sl_mult': 0.5, 'td_mins': 1080}. Best is trial 82 with value: 2.454517025102679.
[I 2026-03-12 01:09:24,756] Trial 206 finished with value: 1.0718810090392605 and parameters: {'timeframe': 'M15', 'atr_period': 13, 'atr_threshold': 3.0, 'pt_mult': 0.5, 'sl_mult': 1.0, 'td_mins': 720}. Best is trial 82 with value: 2.454517025102679.
[I 2026-03-12 01:09:27,373] Trial 207 finished with value: 1.2158380499288066 and parameters: {'timeframe': 'M15', 'atr_period': 13, 'atr_threshold': 1.0, 'pt_mult': 1.0, 'sl_mult': 5.0, 'td_mins': 720}. Best is trial 82 with value: 2.454517025102679.
[I 2026-03-12 01:09:27,441] Trial 208 pruned. 
[I 2026-03-12 01:09:28,126] Trial 209 pruned. 
[I 2026-03-12 01:09:28,816] Trial 210 pruned. 
[I 2026-03-12 01:09:28,880] Trial 211 pruned. 
[I 2026-03-12 01:09:29,074] Trial 212 finished with value: 1.6267700121182007 and parameters: {'timeframe': 'M15', 'atr_period': 13, 'atr_threshold': 2.0, 'pt_mult': 0.5, 'sl_mult': 5.0, 'td_mins': 30}. Best is trial 82 with value: 2.454517025102679.
[I 2026-03-12 01:09:29,117] Trial 213 finished with value: 0.0 and parameters: {'timeframe': 'M15', 'atr_period': 13, 'atr_threshold': 10.0, 'pt_mult': 5.0, 'sl_mult': 1.0, 'td_mins': 15}. Best is trial 82 with value: 2.454517025102679.
[I 2026-03-12 01:09:29,162] Trial 214 pruned. 
[I 2026-03-12 01:09:32,321] Trial 215 finished with value: 1.1832957545327267 and parameters: {'timeframe': 'M15', 'atr_period': 13, 'atr_threshold': 1.0, 'pt_mult': 2.5, 'sl_mult': 5.0, 'td_mins': 720}. Best is trial 82 with value: 2.454517025102679.
[I 2026-03-12 01:09:32,610] Trial 216 finished with value: 1.8907508323840094 and parameters: {'timeframe': 'M15', 'atr_period': 13, 'atr_threshold': 3.0, 'pt_mult': 1.0, 'sl_mult': 5.0, 'td_mins': 120}. Best is trial 82 with value: 2.454517025102679.
[I 2026-03-12 01:09:32,657] Trial 217 finished with value: 0.0 and parameters: {'timeframe': 'M15', 'atr_period': 13, 'atr_threshold': 15.0, 'pt_mult': 1.0, 'sl_mult': 0.5, 'td_mins': 720}. Best is trial 82 with value: 2.454517025102679.
[I 2026-03-12 01:09:32,703] Trial 218 finished with value: 0.0 and parameters: {'timeframe': 'M15', 'atr_period': 13, 'atr_threshold': 10.0, 'pt_mult': 1.0, 'sl_mult': 5.0, 'td_mins': 360}. Best is trial 82 with value: 2.454517025102679.
[I 2026-03-12 01:09:32,996] Trial 219 pruned. 
[I 2026-03-12 01:09:33,040] Trial 220 finished with value: 0.0 and parameters: {'timeframe': 'M15', 'atr_period': 13, 'atr_threshold': 10.0, 'pt_mult': 5.0, 'sl_mult': 0.5, 'td_mins': 360}. Best is trial 82 with value: 2.454517025102679.
[I 2026-03-12 01:09:33,086] Trial 221 pruned. 
[I 2026-03-12 01:09:33,244] Trial 222 pruned. 
[I 2026-03-12 01:09:33,289] Trial 223 finished with value: 0.0 and parameters: {'timeframe': 'M15', 'atr_period': 13, 'atr_threshold': 15.0, 'pt_mult': 0.5, 'sl_mult': 2.5, 'td_mins': 1200}. Best is trial 82 with value: 2.454517025102679.
[I 2026-03-12 01:09:33,335] Trial 224 finished with value: 0.0 and parameters: {'timeframe': 'M15', 'atr_period': 13, 'atr_threshold': 15.0, 'pt_mult': 2.5, 'sl_mult': 2.5, 'td_mins': 60}. Best is trial 82 with value: 2.454517025102679.
[I 2026-03-12 01:09:33,415] Trial 225 pruned. 
[I 2026-03-12 01:09:33,474] Trial 226 pruned. 
[I 2026-03-12 01:09:33,523] Trial 227 pruned. 
[I 2026-03-12 01:09:33,660] Trial 228 pruned. 
[I 2026-03-12 01:09:33,844] Trial 229 pruned. 
[I 2026-03-12 01:09:34,068] Trial 230 pruned. 
[I 2026-03-12 01:09:34,710] Trial 231 pruned. 
[I 2026-03-12 01:09:35,407] Trial 232 pruned. 
[I 2026-03-12 01:09:35,453] Trial 233 finished with value: 0.0 and parameters: {'timeframe': 'M15', 'atr_period': 13, 'atr_threshold': 15.0, 'pt_mult': 2.5, 'sl_mult': 2.5, 'td_mins': 180}. Best is trial 82 with value: 2.454517025102679.
[I 2026-03-12 01:09:35,547] Trial 234 pruned. 
[I 2026-03-12 01:09:35,924] Trial 235 pruned. 
[I 2026-03-12 01:09:35,974] Trial 236 finished with value: 0.0 and parameters: {'timeframe': 'M15', 'atr_period': 13, 'atr_threshold': 15.0, 'pt_mult': 5.0, 'sl_mult': 0.5, 'td_mins': 360}. Best is trial 82 with value: 2.454517025102679.
[I 2026-03-12 01:09:36,292] Trial 237 finished with value: 1.2793773858857773 and parameters: {'timeframe': 'M15', 'atr_period': 13, 'atr_threshold': 0.5, 'pt_mult': 0.5, 'sl_mult': 2.5, 'td_mins': 60}. Best is trial 82 with value: 2.454517025102679.
[I 2026-03-12 01:09:36,342] Trial 238 pruned. 
[I 2026-03-12 01:09:36,894] Trial 239 pruned. 
[I 2026-03-12 01:09:36,939] Trial 240 pruned. 
[I 2026-03-12 01:09:36,986] Trial 241 pruned. 
[I 2026-03-12 01:09:37,032] Trial 242 finished with value: 0.0 and parameters: {'timeframe': 'M15', 'atr_period': 13, 'atr_threshold': 10.0, 'pt_mult': 1.0, 'sl_mult': 1.0, 'td_mins': 120}. Best is trial 82 with value: 2.454517025102679.
[I 2026-03-12 01:09:37,076] Trial 243 finished with value: 0.0 and parameters: {'timeframe': 'M15', 'atr_period': 13, 'atr_threshold': 15.0, 'pt_mult': 5.0, 'sl_mult': 1.0, 'td_mins': 1200}. Best is trial 82 with value: 2.454517025102679.
[I 2026-03-12 01:09:37,122] Trial 244 finished with value: 0.0 and parameters: {'timeframe': 'M15', 'atr_period': 13, 'atr_threshold': 15.0, 'pt_mult': 0.5, 'sl_mult': 5.0, 'td_mins': 1080}. Best is trial 82 with value: 2.454517025102679.
[I 2026-03-12 01:09:37,166] Trial 245 pruned. 
[I 2026-03-12 01:09:37,505] Trial 246 pruned. 
[I 2026-03-12 01:09:37,604] Trial 247 pruned. 
[I 2026-03-12 01:09:37,666] Trial 248 pruned. 
[I 2026-03-12 01:09:37,713] Trial 249 finished with value: 0.0 and parameters: {'timeframe': 'M15', 'atr_period': 13, 'atr_threshold': 10.0, 'pt_mult': 1.0, 'sl_mult': 5.0, 'td_mins': 120}. Best is trial 82 with value: 2.454517025102679.
[I 2026-03-12 01:09:37,757] Trial 250 pruned. 
[I 2026-03-12 01:09:37,811] Trial 251 pruned. 
[I 2026-03-12 01:09:37,856] Trial 252 finished with value: 0.0 and parameters: {'timeframe': 'M15', 'atr_period': 13, 'atr_threshold': 15.0, 'pt_mult': 1.0, 'sl_mult': 5.0, 'td_mins': 1080}. Best is trial 82 with value: 2.454517025102679.
[I 2026-03-12 01:09:37,901] Trial 253 finished with value: 0.0 and parameters: {'timeframe': 'M15', 'atr_period': 13, 'atr_threshold': 10.0, 'pt_mult': 2.5, 'sl_mult': 0.5, 'td_mins': 60}. Best is trial 82 with value: 2.454517025102679.
[I 2026-03-12 01:09:38,124] Trial 254 finished with value: 1.1858648687968716 and parameters: {'timeframe': 'M15', 'atr_period': 13, 'atr_threshold': 0.5, 'pt_mult': 0.5, 'sl_mult': 2.5, 'td_mins': 30}. Best is trial 82 with value: 2.454517025102679.
[I 2026-03-12 01:09:38,166] Trial 255 finished with value: 0.0 and parameters: {'timeframe': 'M15', 'atr_period': 13, 'atr_threshold': 15.0, 'pt_mult': 5.0, 'sl_mult': 0.5, 'td_mins': 15}. Best is trial 82 with value: 2.454517025102679.
[I 2026-03-12 01:09:38,213] Trial 256 finished with value: 0.0 and parameters: {'timeframe': 'M15', 'atr_period': 13, 'atr_threshold': 15.0, 'pt_mult': 0.5, 'sl_mult': 1.0, 'td_mins': 5}. Best is trial 82 with value: 2.454517025102679.
[I 2026-03-12 01:09:38,272] Trial 257 pruned. 
[I 2026-03-12 01:09:38,319] Trial 258 finished with value: 0.0 and parameters: {'timeframe': 'M15', 'atr_period': 13, 'atr_threshold': 10.0, 'pt_mult': 5.0, 'sl_mult': 2.5, 'td_mins': 720}. Best is trial 82 with value: 2.454517025102679.
[I 2026-03-12 01:09:38,364] Trial 259 pruned. 
[I 2026-03-12 01:09:38,531] Trial 260 pruned. 
[I 2026-03-12 01:09:38,913] Trial 261 pruned. 
[I 2026-03-12 01:09:38,957] Trial 262 pruned. 
[I 2026-03-12 01:09:39,002] Trial 263 finished with value: 0.0 and parameters: {'timeframe': 'M15', 'atr_period': 13, 'atr_threshold': 15.0, 'pt_mult': 1.0, 'sl_mult': 0.5, 'td_mins': 120}. Best is trial 82 with value: 2.454517025102679.
[I 2026-03-12 01:09:39,523] Trial 264 finished with value: 1.2130306381173048 and parameters: {'timeframe': 'M15', 'atr_period': 13, 'atr_threshold': 2.0, 'pt_mult': 0.5, 'sl_mult': 2.5, 'td_mins': 180}. Best is trial 82 with value: 2.454517025102679.
[I 2026-03-12 01:09:39,597] Trial 265 pruned. 
[I 2026-03-12 01:09:39,674] Trial 266 pruned. 
[I 2026-03-12 01:09:39,720] Trial 267 pruned. 
[I 2026-03-12 01:09:39,762] Trial 268 finished with value: 0.0 and parameters: {'timeframe': 'M15', 'atr_period': 13, 'atr_threshold': 15.0, 'pt_mult': 5.0, 'sl_mult': 0.5, 'td_mins': 15}. Best is trial 82 with value: 2.454517025102679.
[I 2026-03-12 01:09:39,890] Trial 269 pruned. 
[I 2026-03-12 01:09:39,964] Trial 270 pruned. 
[I 2026-03-12 01:09:40,008] Trial 271 finished with value: 0.0 and parameters: {'timeframe': 'M15', 'atr_period': 13, 'atr_threshold': 15.0, 'pt_mult': 2.5, 'sl_mult': 5.0, 'td_mins': 15}. Best is trial 82 with value: 2.454517025102679.
[I 2026-03-12 01:09:40,548] Trial 272 finished with value: 1.1169518392602575 and parameters: {'timeframe': 'M15', 'atr_period': 13, 'atr_threshold': 2.0, 'pt_mult': 1.0, 'sl_mult': 2.5, 'td_mins': 180}. Best is trial 82 with value: 2.454517025102679.
[I 2026-03-12 01:09:40,737] Trial 273 pruned. 
[I 2026-03-12 01:09:40,915] Trial 274 pruned. 
[I 2026-03-12 01:09:41,163] Trial 275 pruned. 
[I 2026-03-12 01:09:41,296] Trial 276 pruned. 
[I 2026-03-12 01:09:41,363] Trial 277 pruned. 
[I 2026-03-12 01:09:41,410] Trial 278 pruned. 
[I 2026-03-12 01:09:41,456] Trial 279 finished with value: 0.0 and parameters: {'timeframe': 'M15', 'atr_period': 13, 'atr_threshold': 10.0, 'pt_mult': 0.5, 'sl_mult': 1.0, 'td_mins': 120}. Best is trial 82 with value: 2.454517025102679.
[I 2026-03-12 01:09:41,513] Trial 280 pruned. 
[I 2026-03-12 01:09:41,679] Trial 281 pruned. 
[I 2026-03-12 01:09:42,423] Trial 282 pruned. 
[I 2026-03-12 01:09:42,521] Trial 283 pruned. 
[I 2026-03-12 01:09:42,565] Trial 284 finished with value: 0.0 and parameters: {'timeframe': 'M15', 'atr_period': 13, 'atr_threshold': 10.0, 'pt_mult': 2.5, 'sl_mult': 2.5, 'td_mins': 1080}. Best is trial 82 with value: 2.454517025102679.
[I 2026-03-12 01:09:43,568] Trial 285 pruned. 
[I 2026-03-12 01:09:43,616] Trial 286 pruned. 
[I 2026-03-12 01:09:44,370] Trial 287 pruned. 
[I 2026-03-12 01:09:44,468] Trial 288 pruned. 
[I 2026-03-12 01:09:44,731] Trial 289 pruned. 
[I 2026-03-12 01:09:44,776] Trial 290 finished with value: 0.0 and parameters: {'timeframe': 'M15', 'atr_period': 13, 'atr_threshold': 15.0, 'pt_mult': 0.5, 'sl_mult': 1.0, 'td_mins': 180}. Best is trial 82 with value: 2.454517025102679.
[I 2026-03-12 01:09:44,821] Trial 291 finished with value: 0.0 and parameters: {'timeframe': 'M15', 'atr_period': 13, 'atr_threshold': 15.0, 'pt_mult': 1.0, 'sl_mult': 0.5, 'td_mins': 180}. Best is trial 82 with value: 2.454517025102679.
[I 2026-03-12 01:09:44,868] Trial 292 pruned. 
[I 2026-03-12 01:09:45,115] Trial 293 pruned. 
[I 2026-03-12 01:09:45,157] Trial 294 finished with value: 0.0 and parameters: {'timeframe': 'M15', 'atr_period': 13, 'atr_threshold': 10.0, 'pt_mult': 2.5, 'sl_mult': 5.0, 'td_mins': 720}. Best is trial 82 with value: 2.454517025102679.
[I 2026-03-12 01:09:45,222] Trial 295 pruned. 
[I 2026-03-12 01:09:45,273] Trial 296 pruned. 
[I 2026-03-12 01:09:45,319] Trial 297 finished with value: 0.0 and parameters: {'timeframe': 'M15', 'atr_period': 13, 'atr_threshold': 15.0, 'pt_mult': 1.0, 'sl_mult': 1.0, 'td_mins': 5}. Best is trial 82 with value: 2.454517025102679.
[I 2026-03-12 01:09:45,361] Trial 298 finished with value: 0.0 and parameters: {'timeframe': 'M15', 'atr_period': 13, 'atr_threshold': 10.0, 'pt_mult': 1.0, 'sl_mult': 2.5, 'td_mins': 360}. Best is trial 82 with value: 2.454517025102679.
