[I 2026-03-12 01:23:20,471] Trial 798 finished with value: 2.1354320678443623 and parameters: {'timeframe': 'mixed', 'atr_period': 13, 'atr_threshold': 3.0, 'pt_mult': 0.5, 'sl_mult': 5.0, 'td_mins': 60}. Best is trial 404 with value: 2.1354320678443623.
[I 2026-03-12 01:23:23,255] Trial 799 pruned. 
[I 2026-03-12 01:23:23,425] Trial 800 finished with value: 0.0 and parameters: {'timeframe': 'mixed', 'atr_period': 13, 'atr_threshold': 10.0, 'pt_mult': 1.0, 'sl_mult': 0.5, 'td_mins': 60}. Best is trial 404 with value: 2.1354320678443623.
[I 2026-03-12 01:23:23,646] Trial 801 pruned. 
[I 2026-03-12 01:23:24,207] Trial 802 finished with value: 2.1354320678443623 and parameters: {'timeframe': 'mixed', 'atr_period': 13, 'atr_threshold': 3.0, 'pt_mult': 0.5, 'sl_mult': 5.0, 'td_mins': 60}. Best is trial 404 with value: 2.1354320678443623.
[I 2026-03-12 01:23:24,693] Trial 803 pruned. 
[I 2026-03-12 01:23:24,865] Trial 804 finished with value: 0.0 and parameters: {'timeframe': 'mixed', 'atr_period': 13, 'atr_threshold': 10.0, 'pt_mult': 0.5, 'sl_mult': 5.0, 'td_mins': 60}. Best is trial 404 with value: 2.1354320678443623.
[I 2026-03-12 01:23:25,272] Trial 805 pruned. 
[I 2026-03-12 01:23:25,385] Trial 806 pruned. 
[I 2026-03-12 01:23:25,931] Trial 807 finished with value: 2.1354320678443623 and parameters: {'timeframe': 'mixed', 'atr_period': 13, 'atr_threshold': 3.0, 'pt_mult': 0.5, 'sl_mult': 5.0, 'td_mins': 60}. Best is trial 404 with value: 2.1354320678443623.
[I 2026-03-12 01:23:26,488] Trial 808 finished with value: 2.1354320678443623 and parameters: {'timeframe': 'mixed', 'atr_period': 13, 'atr_threshold': 3.0, 'pt_mult': 0.5, 'sl_mult': 5.0, 'td_mins': 60}. Best is trial 404 with value: 2.1354320678443623.
[I 2026-03-12 01:23:27,040] Trial 809 finished with value: 2.1354320678443623 and parameters: {'timeframe': 'mixed', 'atr_period': 13, 'atr_threshold': 3.0, 'pt_mult': 0.5, 'sl_mult': 5.0, 'td_mins': 60}. Best is trial 404 with value: 2.1354320678443623.
[I 2026-03-12 01:23:27,641] Trial 810 finished with value: 2.1354320678443623 and parameters: {'timeframe': 'mixed', 'atr_period': 13, 'atr_threshold': 3.0, 'pt_mult': 0.5, 'sl_mult': 5.0, 'td_mins': 60}. Best is trial 404 with value: 2.1354320678443623.
[I 2026-03-12 01:23:28,226] Trial 811 finished with value: 2.1354320678443623 and parameters: {'timeframe': 'mixed', 'atr_period': 13, 'atr_threshold': 3.0, 'pt_mult': 0.5, 'sl_mult': 5.0, 'td_mins': 60}. Best is trial 404 with value: 2.1354320678443623.
[I 2026-03-12 01:23:28,974] Trial 812 pruned. 
[I 2026-03-12 01:23:29,579] Trial 813 finished with value: 2.1354320678443623 and parameters: {'timeframe': 'mixed', 'atr_period': 13, 'atr_threshold': 3.0, 'pt_mult': 0.5, 'sl_mult': 5.0, 'td_mins': 60}. Best is trial 404 with value: 2.1354320678443623.
[I 2026-03-12 01:23:29,745] Trial 814 pruned. 
[I 2026-03-12 01:23:30,337] Trial 815 finished with value: 2.1354320678443623 and parameters: {'timeframe': 'mixed', 'atr_period': 13, 'atr_threshold': 3.0, 'pt_mult': 0.5, 'sl_mult': 5.0, 'td_mins': 60}. Best is trial 404 with value: 2.1354320678443623.
[I 2026-03-12 01:23:30,523] Trial 816 finished with value: 0.0 and parameters: {'timeframe': 'mixed', 'atr_period': 13, 'atr_threshold': 10.0, 'pt_mult': 2.5, 'sl_mult': 0.5, 'td_mins': 30}. Best is trial 404 with value: 2.1354320678443623.
[I 2026-03-12 01:23:30,849] Trial 817 pruned. 
[I 2026-03-12 01:23:31,020] Trial 818 pruned. 
[I 2026-03-12 01:23:31,177] Trial 819 pruned. 
[I 2026-03-12 01:23:31,655] Trial 820 pruned. 
[I 2026-03-12 01:23:32,204] Trial 821 finished with value: 2.1354320678443623 and parameters: {'timeframe': 'mixed', 'atr_period': 13, 'atr_threshold': 3.0, 'pt_mult': 0.5, 'sl_mult': 5.0, 'td_mins': 60}. Best is trial 404 with value: 2.1354320678443623.
[I 2026-03-12 01:23:32,342] Trial 822 pruned. 
[I 2026-03-12 01:23:32,928] Trial 823 finished with value: 2.1354320678443623 and parameters: {'timeframe': 'mixed', 'atr_period': 13, 'atr_threshold': 3.0, 'pt_mult': 0.5, 'sl_mult': 5.0, 'td_mins': 60}. Best is trial 404 with value: 2.1354320678443623.
[I 2026-03-12 01:23:33,056] Trial 824 pruned. 
[I 2026-03-12 01:23:33,184] Trial 825 pruned. 
[I 2026-03-12 01:23:33,353] Trial 826 finished with value: 0.0 and parameters: {'timeframe': 'mixed', 'atr_period': 13, 'atr_threshold': 15.0, 'pt_mult': 0.5, 'sl_mult': 5.0, 'td_mins': 60}. Best is trial 404 with value: 2.1354320678443623.
[I 2026-03-12 01:23:33,516] Trial 827 finished with value: 0.0 and parameters: {'timeframe': 'mixed', 'atr_period': 13, 'atr_threshold': 10.0, 'pt_mult': 5.0, 'sl_mult': 5.0, 'td_mins': 180}. Best is trial 404 with value: 2.1354320678443623.
[I 2026-03-12 01:23:33,659] Trial 828 pruned. 
[I 2026-03-12 01:23:34,655] Trial 829 pruned. 
[I 2026-03-12 01:23:34,801] Trial 830 pruned. 
[I 2026-03-12 01:23:34,903] Trial 831 pruned. 
[I 2026-03-12 01:23:35,041] Trial 832 pruned. 
[I 2026-03-12 01:23:35,548] Trial 833 pruned. 
[I 2026-03-12 01:23:35,699] Trial 834 pruned. 
[I 2026-03-12 01:23:36,235] Trial 835 finished with value: 2.1354320678443623 and parameters: {'timeframe': 'mixed', 'atr_period': 13, 'atr_threshold': 3.0, 'pt_mult': 0.5, 'sl_mult': 5.0, 'td_mins': 60}. Best is trial 404 with value: 2.1354320678443623.
[I 2026-03-12 01:23:36,785] Trial 836 finished with value: 2.1354320678443623 and parameters: {'timeframe': 'mixed', 'atr_period': 13, 'atr_threshold': 3.0, 'pt_mult': 0.5, 'sl_mult': 5.0, 'td_mins': 60}. Best is trial 404 with value: 2.1354320678443623.
[I 2026-03-12 01:23:37,459] Trial 837 pruned. 
[I 2026-03-12 01:23:37,614] Trial 838 pruned. 
[I 2026-03-12 01:23:38,487] Trial 839 pruned. 
[I 2026-03-12 01:23:38,975] Trial 840 pruned. 
[I 2026-03-12 01:23:39,126] Trial 841 pruned. 
[I 2026-03-12 01:23:39,480] Trial 842 pruned. 
[I 2026-03-12 01:23:40,382] Trial 843 pruned. 
[I 2026-03-12 01:23:40,648] Trial 844 pruned. 
[I 2026-03-12 01:23:40,795] Trial 845 pruned. 
[I 2026-03-12 01:23:40,965] Trial 846 finished with value: 0.0 and parameters: {'timeframe': 'mixed', 'atr_period': 13, 'atr_threshold': 10.0, 'pt_mult': 2.5, 'sl_mult': 2.5, 'td_mins': 120}. Best is trial 404 with value: 2.1354320678443623.
[I 2026-03-12 01:23:42,242] Trial 847 pruned. 
[I 2026-03-12 01:23:42,363] Trial 848 pruned. 
[I 2026-03-12 01:23:43,301] Trial 849 pruned. 
[I 2026-03-12 01:23:43,415] Trial 850 pruned. 
[I 2026-03-12 01:23:43,974] Trial 851 finished with value: 2.1354320678443623 and parameters: {'timeframe': 'mixed', 'atr_period': 13, 'atr_threshold': 3.0, 'pt_mult': 0.5, 'sl_mult': 5.0, 'td_mins': 60}. Best is trial 404 with value: 2.1354320678443623.
[I 2026-03-12 01:23:44,136] Trial 852 pruned. 
[I 2026-03-12 01:23:44,786] Trial 853 pruned. 
[I 2026-03-12 01:23:44,960] Trial 854 finished with value: 0.0 and parameters: {'timeframe': 'mixed', 'atr_period': 13, 'atr_threshold': 15.0, 'pt_mult': 0.5, 'sl_mult': 2.5, 'td_mins': 1080}. Best is trial 404 with value: 2.1354320678443623.
[I 2026-03-12 01:23:45,208] Trial 855 pruned. 
[I 2026-03-12 01:23:46,102] Trial 856 pruned. 
[I 2026-03-12 01:23:46,659] Trial 857 finished with value: 2.1354320678443623 and parameters: {'timeframe': 'mixed', 'atr_period': 13, 'atr_threshold': 3.0, 'pt_mult': 0.5, 'sl_mult': 5.0, 'td_mins': 60}. Best is trial 404 with value: 2.1354320678443623.
[I 2026-03-12 01:23:46,830] Trial 858 finished with value: 0.0 and parameters: {'timeframe': 'mixed', 'atr_period': 13, 'atr_threshold': 10.0, 'pt_mult': 5.0, 'sl_mult': 2.5, 'td_mins': 5}. Best is trial 404 with value: 2.1354320678443623.
[I 2026-03-12 01:23:47,177] Trial 859 pruned. 
[I 2026-03-12 01:23:47,740] Trial 860 finished with value: 2.1354320678443623 and parameters: {'timeframe': 'mixed', 'atr_period': 13, 'atr_threshold': 3.0, 'pt_mult': 0.5, 'sl_mult': 5.0, 'td_mins': 60}. Best is trial 404 with value: 2.1354320678443623.
[I 2026-03-12 01:23:47,901] Trial 861 pruned. 
[I 2026-03-12 01:23:48,076] Trial 862 finished with value: 0.0 and parameters: {'timeframe': 'mixed', 'atr_period': 13, 'atr_threshold': 10.0, 'pt_mult': 2.5, 'sl_mult': 1.0, 'td_mins': 360}. Best is trial 404 with value: 2.1354320678443623.
[I 2026-03-12 01:23:48,223] Trial 863 pruned. 
[I 2026-03-12 01:23:48,391] Trial 864 pruned. 
[I 2026-03-12 01:23:48,501] Trial 865 pruned. 
[I 2026-03-12 01:23:48,639] Trial 866 pruned. 
[I 2026-03-12 01:23:48,764] Trial 867 pruned. 
[I 2026-03-12 01:23:48,933] Trial 868 finished with value: 0.0 and parameters: {'timeframe': 'mixed', 'atr_period': 13, 'atr_threshold': 15.0, 'pt_mult': 1.0, 'sl_mult': 1.0, 'td_mins': 1200}. Best is trial 404 with value: 2.1354320678443623.
[I 2026-03-12 01:23:49,476] Trial 869 finished with value: 2.1354320678443623 and parameters: {'timeframe': 'mixed', 'atr_period': 13, 'atr_threshold': 3.0, 'pt_mult': 0.5, 'sl_mult': 5.0, 'td_mins': 60}. Best is trial 404 with value: 2.1354320678443623.
[I 2026-03-12 01:23:49,877] Trial 870 pruned. 
[I 2026-03-12 01:23:49,994] Trial 871 pruned. 
[I 2026-03-12 01:23:50,565] Trial 872 finished with value: 2.1354320678443623 and parameters: {'timeframe': 'mixed', 'atr_period': 13, 'atr_threshold': 3.0, 'pt_mult': 0.5, 'sl_mult': 5.0, 'td_mins': 60}. Best is trial 404 with value: 2.1354320678443623.
[I 2026-03-12 01:23:50,735] Trial 873 finished with value: 0.0 and parameters: {'timeframe': 'mixed', 'atr_period': 13, 'atr_threshold': 10.0, 'pt_mult': 5.0, 'sl_mult': 0.5, 'td_mins': 720}. Best is trial 404 with value: 2.1354320678443623.
[I 2026-03-12 01:23:51,293] Trial 874 finished with value: 2.1354320678443623 and parameters: {'timeframe': 'mixed', 'atr_period': 13, 'atr_threshold': 3.0, 'pt_mult': 0.5, 'sl_mult': 5.0, 'td_mins': 60}. Best is trial 404 with value: 2.1354320678443623.
[I 2026-03-12 01:23:51,399] Trial 875 pruned. 
[I 2026-03-12 01:23:51,510] Trial 876 pruned. 
[I 2026-03-12 01:23:51,620] Trial 877 pruned. 
[I 2026-03-12 01:23:51,731] Trial 878 pruned. 
[I 2026-03-12 01:23:51,855] Trial 879 pruned. 
[I 2026-03-12 01:23:52,692] Trial 880 finished with value: 2.0147840062204914 and parameters: {'timeframe': 'mixed', 'atr_period': 13, 'atr_threshold': 3.0, 'pt_mult': 0.5, 'sl_mult': 5.0, 'td_mins': 120}. Best is trial 404 with value: 2.1354320678443623.
[I 2026-03-12 01:23:53,253] Trial 881 finished with value: 2.1354320678443623 and parameters: {'timeframe': 'mixed', 'atr_period': 13, 'atr_threshold': 3.0, 'pt_mult': 0.5, 'sl_mult': 5.0, 'td_mins': 60}. Best is trial 404 with value: 2.1354320678443623.
[I 2026-03-12 01:23:53,421] Trial 882 finished with value: 0.0 and parameters: {'timeframe': 'mixed', 'atr_period': 13, 'atr_threshold': 15.0, 'pt_mult': 5.0, 'sl_mult': 0.5, 'td_mins': 60}. Best is trial 404 with value: 2.1354320678443623.
[I 2026-03-12 01:23:53,956] Trial 883 finished with value: 2.1354320678443623 and parameters: {'timeframe': 'mixed', 'atr_period': 13, 'atr_threshold': 3.0, 'pt_mult': 0.5, 'sl_mult': 5.0, 'td_mins': 60}. Best is trial 404 with value: 2.1354320678443623.
[I 2026-03-12 01:23:54,074] Trial 884 pruned. 
[I 2026-03-12 01:23:54,635] Trial 885 finished with value: 2.1354320678443623 and parameters: {'timeframe': 'mixed', 'atr_period': 13, 'atr_threshold': 3.0, 'pt_mult': 0.5, 'sl_mult': 5.0, 'td_mins': 60}. Best is trial 404 with value: 2.1354320678443623.
[I 2026-03-12 01:23:55,172] Trial 886 finished with value: 2.1354320678443623 and parameters: {'timeframe': 'mixed', 'atr_period': 13, 'atr_threshold': 3.0, 'pt_mult': 0.5, 'sl_mult': 5.0, 'td_mins': 60}. Best is trial 404 with value: 2.1354320678443623.
[I 2026-03-12 01:23:55,734] Trial 887 finished with value: 2.1354320678443623 and parameters: {'timeframe': 'mixed', 'atr_period': 13, 'atr_threshold': 3.0, 'pt_mult': 0.5, 'sl_mult': 5.0, 'td_mins': 60}. Best is trial 404 with value: 2.1354320678443623.
[I 2026-03-12 01:23:56,284] Trial 888 finished with value: 2.1354320678443623 and parameters: {'timeframe': 'mixed', 'atr_period': 13, 'atr_threshold': 3.0, 'pt_mult': 0.5, 'sl_mult': 5.0, 'td_mins': 60}. Best is trial 404 with value: 2.1354320678443623.
[I 2026-03-12 01:23:56,839] Trial 889 finished with value: 2.1354320678443623 and parameters: {'timeframe': 'mixed', 'atr_period': 13, 'atr_threshold': 3.0, 'pt_mult': 0.5, 'sl_mult': 5.0, 'td_mins': 60}. Best is trial 404 with value: 2.1354320678443623.
[I 2026-03-12 01:23:57,004] Trial 890 pruned. 
[I 2026-03-12 01:23:57,154] Trial 891 pruned. 
[I 2026-03-12 01:23:57,307] Trial 892 pruned. 
[I 2026-03-12 01:23:57,898] Trial 893 finished with value: 2.1354320678443623 and parameters: {'timeframe': 'mixed', 'atr_period': 13, 'atr_threshold': 3.0, 'pt_mult': 0.5, 'sl_mult': 5.0, 'td_mins': 60}. Best is trial 404 with value: 2.1354320678443623.
[I 2026-03-12 01:23:58,455] Trial 894 finished with value: 2.1354320678443623 and parameters: {'timeframe': 'mixed', 'atr_period': 13, 'atr_threshold': 3.0, 'pt_mult': 0.5, 'sl_mult': 5.0, 'td_mins': 60}. Best is trial 404 with value: 2.1354320678443623.
[I 2026-03-12 01:23:58,995] Trial 895 finished with value: 2.1354320678443623 and parameters: {'timeframe': 'mixed', 'atr_period': 13, 'atr_threshold': 3.0, 'pt_mult': 0.5, 'sl_mult': 5.0, 'td_mins': 60}. Best is trial 404 with value: 2.1354320678443623.
[I 2026-03-12 01:23:59,167] Trial 896 finished with value: 0.0 and parameters: {'timeframe': 'mixed', 'atr_period': 13, 'atr_threshold': 10.0, 'pt_mult': 0.5, 'sl_mult': 5.0, 'td_mins': 60}. Best is trial 404 with value: 2.1354320678443623.
[I 2026-03-12 01:23:59,719] Trial 897 finished with value: 2.1354320678443623 and parameters: {'timeframe': 'mixed', 'atr_period': 13, 'atr_threshold': 3.0, 'pt_mult': 0.5, 'sl_mult': 5.0, 'td_mins': 60}. Best is trial 404 with value: 2.1354320678443623.
[I 2026-03-12 01:23:59,827] Trial 898 pruned. 
[I 2026-03-12 01:24:00,373] Trial 899 finished with value: 2.1354320678443623 and parameters: {'timeframe': 'mixed', 'atr_period': 13, 'atr_threshold': 3.0, 'pt_mult': 0.5, 'sl_mult': 5.0, 'td_mins': 60}. Best is trial 404 with value: 2.1354320678443623.
[I 2026-03-12 01:24:00,995] Trial 900 pruned. 
[I 2026-03-12 01:24:01,556] Trial 901 finished with value: 2.1354320678443623 and parameters: {'timeframe': 'mixed', 'atr_period': 13, 'atr_threshold': 3.0, 'pt_mult': 0.5, 'sl_mult': 5.0, 'td_mins': 60}. Best is trial 404 with value: 2.1354320678443623.
[I 2026-03-12 01:24:01,723] Trial 902 finished with value: 0.0 and parameters: {'timeframe': 'mixed', 'atr_period': 13, 'atr_threshold': 15.0, 'pt_mult': 0.5, 'sl_mult': 0.5, 'td_mins': 720}. Best is trial 404 with value: 2.1354320678443623.
[I 2026-03-12 01:24:01,889] Trial 903 finished with value: 0.0 and parameters: {'timeframe': 'mixed', 'atr_period': 13, 'atr_threshold': 15.0, 'pt_mult': 2.5, 'sl_mult': 1.0, 'td_mins': 720}. Best is trial 404 with value: 2.1354320678443623.
[I 2026-03-12 01:24:02,458] Trial 904 finished with value: 2.1354320678443623 and parameters: {'timeframe': 'mixed', 'atr_period': 13, 'atr_threshold': 3.0, 'pt_mult': 0.5, 'sl_mult': 5.0, 'td_mins': 60}. Best is trial 404 with value: 2.1354320678443623.
[I 2026-03-12 01:24:02,641] Trial 905 pruned. 
[I 2026-03-12 01:24:02,798] Trial 906 pruned. 
[I 2026-03-12 01:24:03,352] Trial 907 finished with value: 2.1354320678443623 and parameters: {'timeframe': 'mixed', 'atr_period': 13, 'atr_threshold': 3.0, 'pt_mult': 0.5, 'sl_mult': 5.0, 'td_mins': 60}. Best is trial 404 with value: 2.1354320678443623.
[I 2026-03-12 01:24:03,924] Trial 908 finished with value: 2.1354320678443623 and parameters: {'timeframe': 'mixed', 'atr_period': 13, 'atr_threshold': 3.0, 'pt_mult': 0.5, 'sl_mult': 5.0, 'td_mins': 60}. Best is trial 404 with value: 2.1354320678443623.
[I 2026-03-12 01:24:04,092] Trial 909 finished with value: 0.0 and parameters: {'timeframe': 'mixed', 'atr_period': 13, 'atr_threshold': 15.0, 'pt_mult': 0.5, 'sl_mult': 2.5, 'td_mins': 5}. Best is trial 404 with value: 2.1354320678443623.
[I 2026-03-12 01:24:04,225] Trial 910 pruned. 
[I 2026-03-12 01:24:04,374] Trial 911 pruned. 
[I 2026-03-12 01:24:04,500] Trial 912 pruned. 
[I 2026-03-12 01:24:04,652] Trial 913 pruned. 
[I 2026-03-12 01:24:04,818] Trial 914 finished with value: 0.0 and parameters: {'timeframe': 'mixed', 'atr_period': 13, 'atr_threshold': 15.0, 'pt_mult': 2.5, 'sl_mult': 2.5, 'td_mins': 15}. Best is trial 404 with value: 2.1354320678443623.
[I 2026-03-12 01:24:04,982] Trial 915 finished with value: 0.0 and parameters: {'timeframe': 'mixed', 'atr_period': 13, 'atr_threshold': 15.0, 'pt_mult': 0.5, 'sl_mult': 5.0, 'td_mins': 60}. Best is trial 404 with value: 2.1354320678443623.
[I 2026-03-12 01:24:05,528] Trial 916 finished with value: 2.1354320678443623 and parameters: {'timeframe': 'mixed', 'atr_period': 13, 'atr_threshold': 3.0, 'pt_mult': 0.5, 'sl_mult': 5.0, 'td_mins': 60}. Best is trial 404 with value: 2.1354320678443623.
[I 2026-03-12 01:24:06,552] Trial 917 pruned. 
[I 2026-03-12 01:24:06,696] Trial 918 pruned. 
[I 2026-03-12 01:24:07,268] Trial 919 finished with value: 2.1354320678443623 and parameters: {'timeframe': 'mixed', 'atr_period': 13, 'atr_threshold': 3.0, 'pt_mult': 0.5, 'sl_mult': 5.0, 'td_mins': 60}. Best is trial 404 with value: 2.1354320678443623.
[I 2026-03-12 01:24:07,411] Trial 920 pruned. 
[I 2026-03-12 01:24:08,557] Trial 921 pruned. 
[I 2026-03-12 01:24:08,708] Trial 922 pruned. 
[I 2026-03-12 01:24:09,110] Trial 923 pruned. 
[I 2026-03-12 01:24:09,263] Trial 924 pruned. 
[I 2026-03-12 01:24:11,886] Trial 925 pruned. 
[I 2026-03-12 01:24:12,058] Trial 926 finished with value: 0.0 and parameters: {'timeframe': 'mixed', 'atr_period': 13, 'atr_threshold': 15.0, 'pt_mult': 5.0, 'sl_mult': 2.5, 'td_mins': 15}. Best is trial 404 with value: 2.1354320678443623.
[I 2026-03-12 01:24:12,613] Trial 927 finished with value: 2.1354320678443623 and parameters: {'timeframe': 'mixed', 'atr_period': 13, 'atr_threshold': 3.0, 'pt_mult': 0.5, 'sl_mult': 5.0, 'td_mins': 60}. Best is trial 404 with value: 2.1354320678443623.
[I 2026-03-12 01:24:12,771] Trial 928 pruned. 
[I 2026-03-12 01:24:13,298] Trial 929 pruned. 
[I 2026-03-12 01:24:13,849] Trial 930 finished with value: 2.1354320678443623 and parameters: {'timeframe': 'mixed', 'atr_period': 13, 'atr_threshold': 3.0, 'pt_mult': 0.5, 'sl_mult': 5.0, 'td_mins': 60}. Best is trial 404 with value: 2.1354320678443623.
[I 2026-03-12 01:24:14,024] Trial 931 finished with value: 0.0 and parameters: {'timeframe': 'mixed', 'atr_period': 13, 'atr_threshold': 10.0, 'pt_mult': 2.5, 'sl_mult': 5.0, 'td_mins': 1080}. Best is trial 404 with value: 2.1354320678443623.
[I 2026-03-12 01:24:15,278] Trial 932 pruned. 
[I 2026-03-12 01:24:15,837] Trial 933 finished with value: 2.1354320678443623 and parameters: {'timeframe': 'mixed', 'atr_period': 13, 'atr_threshold': 3.0, 'pt_mult': 0.5, 'sl_mult': 5.0, 'td_mins': 60}. Best is trial 404 with value: 2.1354320678443623.
[I 2026-03-12 01:24:16,721] Trial 934 pruned. 
[I 2026-03-12 01:24:17,327] Trial 935 pruned. 
[I 2026-03-12 01:24:17,904] Trial 936 finished with value: 2.1354320678443623 and parameters: {'timeframe': 'mixed', 'atr_period': 13, 'atr_threshold': 3.0, 'pt_mult': 0.5, 'sl_mult': 5.0, 'td_mins': 60}. Best is trial 404 with value: 2.1354320678443623.
[I 2026-03-12 01:24:18,070] Trial 937 pruned. 
[I 2026-03-12 01:24:18,528] Trial 938 pruned. 
[I 2026-03-12 01:24:18,748] Trial 939 pruned. 
[I 2026-03-12 01:24:19,268] Trial 940 pruned. 
[I 2026-03-12 01:24:19,438] Trial 941 finished with value: 0.0 and parameters: {'timeframe': 'mixed', 'atr_period': 13, 'atr_threshold': 15.0, 'pt_mult': 1.0, 'sl_mult': 1.0, 'td_mins': 5}. Best is trial 404 with value: 2.1354320678443623.
[I 2026-03-12 01:24:19,606] Trial 942 finished with value: 0.0 and parameters: {'timeframe': 'mixed', 'atr_period': 13, 'atr_threshold': 15.0, 'pt_mult': 5.0, 'sl_mult': 2.5, 'td_mins': 120}. Best is trial 404 with value: 2.1354320678443623.
[I 2026-03-12 01:24:19,711] Trial 943 pruned. 
[I 2026-03-12 01:24:19,858] Trial 944 pruned. 
[I 2026-03-12 01:24:20,033] Trial 945 pruned. 
[I 2026-03-12 01:24:20,152] Trial 946 pruned. 
[I 2026-03-12 01:24:20,321] Trial 947 finished with value: 0.0 and parameters: {'timeframe': 'mixed', 'atr_period': 13, 'atr_threshold': 10.0, 'pt_mult': 2.5, 'sl_mult': 1.0, 'td_mins': 60}. Best is trial 404 with value: 2.1354320678443623.
[I 2026-03-12 01:24:20,614] Trial 948 pruned. 
[I 2026-03-12 01:24:20,730] Trial 949 pruned. 
[I 2026-03-12 01:24:20,989] Trial 950 pruned. 
[I 2026-03-12 01:24:21,158] Trial 951 finished with value: 0.0 and parameters: {'timeframe': 'mixed', 'atr_period': 13, 'atr_threshold': 10.0, 'pt_mult': 1.0, 'sl_mult': 5.0, 'td_mins': 1080}. Best is trial 404 with value: 2.1354320678443623.
[I 2026-03-12 01:24:21,327] Trial 952 finished with value: 0.0 and parameters: {'timeframe': 'mixed', 'atr_period': 13, 'atr_threshold': 10.0, 'pt_mult': 0.5, 'sl_mult': 0.5, 'td_mins': 360}. Best is trial 404 with value: 2.1354320678443623.
[I 2026-03-12 01:24:21,864] Trial 953 finished with value: 2.1354320678443623 and parameters: {'timeframe': 'mixed', 'atr_period': 13, 'atr_threshold': 3.0, 'pt_mult': 0.5, 'sl_mult': 5.0, 'td_mins': 60}. Best is trial 404 with value: 2.1354320678443623.
[I 2026-03-12 01:24:21,974] Trial 954 pruned. 
[I 2026-03-12 01:24:22,084] Trial 955 pruned. 
[I 2026-03-12 01:24:22,936] Trial 956 pruned. 
[I 2026-03-12 01:24:23,261] Trial 957 pruned. 
[I 2026-03-12 01:24:23,435] Trial 958 finished with value: 0.0 and parameters: {'timeframe': 'mixed', 'atr_period': 13, 'atr_threshold': 10.0, 'pt_mult': 5.0, 'sl_mult': 5.0, 'td_mins': 30}. Best is trial 404 with value: 2.1354320678443623.
[I 2026-03-12 01:24:23,682] Trial 959 pruned. 
[I 2026-03-12 01:24:32,927] Trial 960 pruned. 
[I 2026-03-12 01:24:33,066] Trial 961 pruned. 
[I 2026-03-12 01:24:33,663] Trial 962 finished with value: 2.1354320678443623 and parameters: {'timeframe': 'mixed', 'atr_period': 13, 'atr_threshold': 3.0, 'pt_mult': 0.5, 'sl_mult': 5.0, 'td_mins': 60}. Best is trial 404 with value: 2.1354320678443623.
