[I 2026-03-12 01:34:26,985] Trial 918 finished with value: 2.318948203404773 and parameters: {'timeframe': 'M1', 'atr_period': 13, 'atr_threshold': 2.0, 'pt_mult': 0.5, 'sl_mult': 5.0, 'td_mins': 5}. Best is trial 337 with value: 2.318948203404773.
[I 2026-03-12 01:34:27,041] Trial 919 pruned. 
[I 2026-03-12 01:34:27,143] Trial 920 pruned. 
[I 2026-03-12 01:34:27,209] Trial 921 pruned. 
[I 2026-03-12 01:34:27,327] Trial 922 finished with value: 2.318948203404773 and parameters: {'timeframe': 'M1', 'atr_period': 13, 'atr_threshold': 2.0, 'pt_mult': 0.5, 'sl_mult': 5.0, 'td_mins': 5}. Best is trial 337 with value: 2.318948203404773.
[I 2026-03-12 01:34:27,442] Trial 923 pruned. 
[I 2026-03-12 01:34:27,559] Trial 924 finished with value: 2.318948203404773 and parameters: {'timeframe': 'M1', 'atr_period': 13, 'atr_threshold': 2.0, 'pt_mult': 0.5, 'sl_mult': 5.0, 'td_mins': 5}. Best is trial 337 with value: 2.318948203404773.
[I 2026-03-12 01:34:27,615] Trial 925 finished with value: 0.0 and parameters: {'timeframe': 'M1', 'atr_period': 13, 'atr_threshold': 5.0, 'pt_mult': 0.5, 'sl_mult': 0.5, 'td_mins': 60}. Best is trial 337 with value: 2.318948203404773.
[I 2026-03-12 01:34:27,714] Trial 926 finished with value: 2.318948203404773 and parameters: {'timeframe': 'M1', 'atr_period': 13, 'atr_threshold': 2.0, 'pt_mult': 0.5, 'sl_mult': 5.0, 'td_mins': 5}. Best is trial 337 with value: 2.318948203404773.
[I 2026-03-12 01:34:27,812] Trial 927 finished with value: 2.318948203404773 and parameters: {'timeframe': 'M1', 'atr_period': 13, 'atr_threshold': 2.0, 'pt_mult': 0.5, 'sl_mult': 5.0, 'td_mins': 5}. Best is trial 337 with value: 2.318948203404773.
[I 2026-03-12 01:34:27,904] Trial 928 finished with value: 2.318948203404773 and parameters: {'timeframe': 'M1', 'atr_period': 13, 'atr_threshold': 2.0, 'pt_mult': 0.5, 'sl_mult': 5.0, 'td_mins': 5}. Best is trial 337 with value: 2.318948203404773.
[I 2026-03-12 01:34:27,996] Trial 929 finished with value: 2.318948203404773 and parameters: {'timeframe': 'M1', 'atr_period': 13, 'atr_threshold': 2.0, 'pt_mult': 0.5, 'sl_mult': 5.0, 'td_mins': 5}. Best is trial 337 with value: 2.318948203404773.
[I 2026-03-12 01:34:28,088] Trial 930 finished with value: 2.318948203404773 and parameters: {'timeframe': 'M1', 'atr_period': 13, 'atr_threshold': 2.0, 'pt_mult': 0.5, 'sl_mult': 5.0, 'td_mins': 5}. Best is trial 337 with value: 2.318948203404773.
[I 2026-03-12 01:34:28,181] Trial 931 finished with value: 2.318948203404773 and parameters: {'timeframe': 'M1', 'atr_period': 13, 'atr_threshold': 2.0, 'pt_mult': 0.5, 'sl_mult': 5.0, 'td_mins': 5}. Best is trial 337 with value: 2.318948203404773.
[I 2026-03-12 01:34:28,234] Trial 932 finished with value: 0.0 and parameters: {'timeframe': 'M1', 'atr_period': 13, 'atr_threshold': 5.0, 'pt_mult': 5.0, 'sl_mult': 2.5, 'td_mins': 180}. Best is trial 337 with value: 2.318948203404773.
[I 2026-03-12 01:34:28,285] Trial 933 finished with value: 0.0 and parameters: {'timeframe': 'M1', 'atr_period': 13, 'atr_threshold': 5.0, 'pt_mult': 5.0, 'sl_mult': 5.0, 'td_mins': 15}. Best is trial 337 with value: 2.318948203404773.
[I 2026-03-12 01:34:28,337] Trial 934 finished with value: 0.0 and parameters: {'timeframe': 'M1', 'atr_period': 13, 'atr_threshold': 10.0, 'pt_mult': 0.5, 'sl_mult': 1.0, 'td_mins': 60}. Best is trial 337 with value: 2.318948203404773.
[I 2026-03-12 01:34:28,389] Trial 935 finished with value: 0.0 and parameters: {'timeframe': 'M1', 'atr_period': 13, 'atr_threshold': 3.0, 'pt_mult': 5.0, 'sl_mult': 5.0, 'td_mins': 15}. Best is trial 337 with value: 2.318948203404773.
[I 2026-03-12 01:34:28,441] Trial 936 finished with value: 0.0 and parameters: {'timeframe': 'M1', 'atr_period': 13, 'atr_threshold': 15.0, 'pt_mult': 5.0, 'sl_mult': 0.5, 'td_mins': 1200}. Best is trial 337 with value: 2.318948203404773.
[I 2026-03-12 01:34:28,530] Trial 937 finished with value: 2.318948203404773 and parameters: {'timeframe': 'M1', 'atr_period': 13, 'atr_threshold': 2.0, 'pt_mult': 0.5, 'sl_mult': 5.0, 'td_mins': 5}. Best is trial 337 with value: 2.318948203404773.
[I 2026-03-12 01:34:28,640] Trial 938 pruned. 
[I 2026-03-12 01:34:28,696] Trial 939 finished with value: 0.0 and parameters: {'timeframe': 'M1', 'atr_period': 13, 'atr_threshold': 8.0, 'pt_mult': 0.5, 'sl_mult': 1.0, 'td_mins': 60}. Best is trial 337 with value: 2.318948203404773.
[I 2026-03-12 01:34:28,747] Trial 940 finished with value: 0.0 and parameters: {'timeframe': 'M1', 'atr_period': 13, 'atr_threshold': 10.0, 'pt_mult': 2.5, 'sl_mult': 0.5, 'td_mins': 15}. Best is trial 337 with value: 2.318948203404773.
[I 2026-03-12 01:34:28,838] Trial 941 finished with value: 2.318948203404773 and parameters: {'timeframe': 'M1', 'atr_period': 13, 'atr_threshold': 2.0, 'pt_mult': 0.5, 'sl_mult': 5.0, 'td_mins': 5}. Best is trial 337 with value: 2.318948203404773.
[I 2026-03-12 01:34:28,889] Trial 942 finished with value: 0.0 and parameters: {'timeframe': 'M1', 'atr_period': 13, 'atr_threshold': 10.0, 'pt_mult': 5.0, 'sl_mult': 5.0, 'td_mins': 360}. Best is trial 337 with value: 2.318948203404773.
[I 2026-03-12 01:34:29,153] Trial 943 pruned. 
[I 2026-03-12 01:34:29,376] Trial 944 pruned. 
[I 2026-03-12 01:34:29,428] Trial 945 finished with value: 0.0 and parameters: {'timeframe': 'M1', 'atr_period': 13, 'atr_threshold': 5.0, 'pt_mult': 0.5, 'sl_mult': 0.5, 'td_mins': 720}. Best is trial 337 with value: 2.318948203404773.
[I 2026-03-12 01:34:29,521] Trial 946 finished with value: 2.318948203404773 and parameters: {'timeframe': 'M1', 'atr_period': 13, 'atr_threshold': 2.0, 'pt_mult': 0.5, 'sl_mult': 5.0, 'td_mins': 5}. Best is trial 337 with value: 2.318948203404773.
[I 2026-03-12 01:34:29,659] Trial 947 pruned. 
[I 2026-03-12 01:34:29,807] Trial 948 finished with value: 2.318948203404773 and parameters: {'timeframe': 'M1', 'atr_period': 13, 'atr_threshold': 2.0, 'pt_mult': 0.5, 'sl_mult': 5.0, 'td_mins': 5}. Best is trial 337 with value: 2.318948203404773.
[I 2026-03-12 01:34:29,900] Trial 949 finished with value: 2.318948203404773 and parameters: {'timeframe': 'M1', 'atr_period': 13, 'atr_threshold': 2.0, 'pt_mult': 0.5, 'sl_mult': 5.0, 'td_mins': 5}. Best is trial 337 with value: 2.318948203404773.
[I 2026-03-12 01:34:29,956] Trial 950 finished with value: 0.0 and parameters: {'timeframe': 'M1', 'atr_period': 13, 'atr_threshold': 5.0, 'pt_mult': 1.0, 'sl_mult': 1.0, 'td_mins': 5}. Best is trial 337 with value: 2.318948203404773.
[I 2026-03-12 01:34:30,010] Trial 951 finished with value: 0.0 and parameters: {'timeframe': 'M1', 'atr_period': 13, 'atr_threshold': 8.0, 'pt_mult': 0.5, 'sl_mult': 2.5, 'td_mins': 1200}. Best is trial 337 with value: 2.318948203404773.
[I 2026-03-12 01:34:30,061] Trial 952 finished with value: 0.0 and parameters: {'timeframe': 'M1', 'atr_period': 13, 'atr_threshold': 15.0, 'pt_mult': 5.0, 'sl_mult': 5.0, 'td_mins': 1080}. Best is trial 337 with value: 2.318948203404773.
[I 2026-03-12 01:34:30,113] Trial 953 finished with value: 0.0 and parameters: {'timeframe': 'M1', 'atr_period': 13, 'atr_threshold': 15.0, 'pt_mult': 0.5, 'sl_mult': 0.5, 'td_mins': 5}. Best is trial 337 with value: 2.318948203404773.
[I 2026-03-12 01:34:30,204] Trial 954 finished with value: 2.318948203404773 and parameters: {'timeframe': 'M1', 'atr_period': 13, 'atr_threshold': 2.0, 'pt_mult': 0.5, 'sl_mult': 5.0, 'td_mins': 5}. Best is trial 337 with value: 2.318948203404773.
[I 2026-03-12 01:34:30,296] Trial 955 pruned. 
[I 2026-03-12 01:34:30,389] Trial 956 finished with value: 2.318948203404773 and parameters: {'timeframe': 'M1', 'atr_period': 13, 'atr_threshold': 2.0, 'pt_mult': 0.5, 'sl_mult': 5.0, 'td_mins': 5}. Best is trial 337 with value: 2.318948203404773.
[I 2026-03-12 01:34:30,489] Trial 957 finished with value: 2.318948203404773 and parameters: {'timeframe': 'M1', 'atr_period': 13, 'atr_threshold': 2.0, 'pt_mult': 0.5, 'sl_mult': 5.0, 'td_mins': 5}. Best is trial 337 with value: 2.318948203404773.
[I 2026-03-12 01:34:30,541] Trial 958 finished with value: 0.0 and parameters: {'timeframe': 'M1', 'atr_period': 13, 'atr_threshold': 15.0, 'pt_mult': 0.5, 'sl_mult': 5.0, 'td_mins': 5}. Best is trial 337 with value: 2.318948203404773.
[I 2026-03-12 01:34:31,484] Trial 959 pruned. 
[I 2026-03-12 01:34:31,775] Trial 960 pruned. 
[I 2026-03-12 01:34:31,868] Trial 961 finished with value: 2.318948203404773 and parameters: {'timeframe': 'M1', 'atr_period': 13, 'atr_threshold': 2.0, 'pt_mult': 0.5, 'sl_mult': 5.0, 'td_mins': 5}. Best is trial 337 with value: 2.318948203404773.
[I 2026-03-12 01:34:33,316] Trial 962 pruned. 
[I 2026-03-12 01:34:33,410] Trial 963 finished with value: 2.318948203404773 and parameters: {'timeframe': 'M1', 'atr_period': 13, 'atr_threshold': 2.0, 'pt_mult': 0.5, 'sl_mult': 5.0, 'td_mins': 5}. Best is trial 337 with value: 2.318948203404773.
[I 2026-03-12 01:34:33,501] Trial 964 finished with value: 2.318948203404773 and parameters: {'timeframe': 'M1', 'atr_period': 13, 'atr_threshold': 2.0, 'pt_mult': 0.5, 'sl_mult': 5.0, 'td_mins': 5}. Best is trial 337 with value: 2.318948203404773.
[I 2026-03-12 01:34:34,230] Trial 965 pruned. 
[I 2026-03-12 01:34:34,285] Trial 966 finished with value: 0.0 and parameters: {'timeframe': 'M1', 'atr_period': 13, 'atr_threshold': 5.0, 'pt_mult': 0.5, 'sl_mult': 2.5, 'td_mins': 1080}. Best is trial 337 with value: 2.318948203404773.
[I 2026-03-12 01:34:34,343] Trial 967 pruned. 
[I 2026-03-12 01:34:36,947] Trial 968 pruned. 
[I 2026-03-12 01:34:37,017] Trial 969 finished with value: 0.0 and parameters: {'timeframe': 'M1', 'atr_period': 13, 'atr_threshold': 15.0, 'pt_mult': 0.5, 'sl_mult': 2.5, 'td_mins': 1080}. Best is trial 337 with value: 2.318948203404773.
[I 2026-03-12 01:34:37,111] Trial 970 pruned. 
[I 2026-03-12 01:34:37,341] Trial 971 pruned. 
[I 2026-03-12 01:34:37,398] Trial 972 finished with value: 0.0 and parameters: {'timeframe': 'M1', 'atr_period': 13, 'atr_threshold': 3.0, 'pt_mult': 1.0, 'sl_mult': 2.5, 'td_mins': 720}. Best is trial 337 with value: 2.318948203404773.
[I 2026-03-12 01:34:37,516] Trial 973 finished with value: 2.318948203404773 and parameters: {'timeframe': 'M1', 'atr_period': 13, 'atr_threshold': 2.0, 'pt_mult': 0.5, 'sl_mult': 5.0, 'td_mins': 5}. Best is trial 337 with value: 2.318948203404773.
[I 2026-03-12 01:34:37,585] Trial 974 pruned. 
[I 2026-03-12 01:34:37,701] Trial 975 finished with value: 2.318948203404773 and parameters: {'timeframe': 'M1', 'atr_period': 13, 'atr_threshold': 2.0, 'pt_mult': 0.5, 'sl_mult': 5.0, 'td_mins': 5}. Best is trial 337 with value: 2.318948203404773.
[I 2026-03-12 01:34:37,754] Trial 976 finished with value: 0.0 and parameters: {'timeframe': 'M1', 'atr_period': 13, 'atr_threshold': 3.0, 'pt_mult': 0.5, 'sl_mult': 5.0, 'td_mins': 5}. Best is trial 337 with value: 2.318948203404773.
[I 2026-03-12 01:34:38,178] Trial 977 pruned. 
[I 2026-03-12 01:34:38,234] Trial 978 finished with value: 0.0 and parameters: {'timeframe': 'M1', 'atr_period': 13, 'atr_threshold': 8.0, 'pt_mult': 2.5, 'sl_mult': 1.0, 'td_mins': 5}. Best is trial 337 with value: 2.318948203404773.
[I 2026-03-12 01:34:38,317] Trial 979 pruned. 
[I 2026-03-12 01:34:38,372] Trial 980 finished with value: 0.0 and parameters: {'timeframe': 'M1', 'atr_period': 13, 'atr_threshold': 3.0, 'pt_mult': 0.5, 'sl_mult': 1.0, 'td_mins': 120}. Best is trial 337 with value: 2.318948203404773.
[I 2026-03-12 01:34:38,424] Trial 981 finished with value: 0.0 and parameters: {'timeframe': 'M1', 'atr_period': 13, 'atr_threshold': 10.0, 'pt_mult': 0.5, 'sl_mult': 5.0, 'td_mins': 5}. Best is trial 337 with value: 2.318948203404773.
[I 2026-03-12 01:34:38,521] Trial 982 finished with value: 2.318948203404773 and parameters: {'timeframe': 'M1', 'atr_period': 13, 'atr_threshold': 2.0, 'pt_mult': 0.5, 'sl_mult': 5.0, 'td_mins': 5}. Best is trial 337 with value: 2.318948203404773.
[I 2026-03-12 01:34:38,574] Trial 983 finished with value: 0.0 and parameters: {'timeframe': 'M1', 'atr_period': 13, 'atr_threshold': 3.0, 'pt_mult': 2.5, 'sl_mult': 2.5, 'td_mins': 360}. Best is trial 337 with value: 2.318948203404773.
[I 2026-03-12 01:34:38,898] Trial 984 pruned. 
[I 2026-03-12 01:34:38,962] Trial 985 finished with value: 0.0 and parameters: {'timeframe': 'M1', 'atr_period': 13, 'atr_threshold': 15.0, 'pt_mult': 1.0, 'sl_mult': 2.5, 'td_mins': 720}. Best is trial 337 with value: 2.318948203404773.
[I 2026-03-12 01:34:39,029] Trial 986 pruned. 
[I 2026-03-12 01:34:39,147] Trial 987 pruned. 
[I 2026-03-12 01:34:39,229] Trial 988 pruned. 
[I 2026-03-12 01:34:39,307] Trial 989 pruned. 
[I 2026-03-12 01:34:39,359] Trial 990 finished with value: 0.0 and parameters: {'timeframe': 'M1', 'atr_period': 13, 'atr_threshold': 5.0, 'pt_mult': 0.5, 'sl_mult': 2.5, 'td_mins': 60}. Best is trial 337 with value: 2.318948203404773.
[I 2026-03-12 01:34:39,514] Trial 991 pruned. 
[I 2026-03-12 01:34:39,570] Trial 992 finished with value: 0.0 and parameters: {'timeframe': 'M1', 'atr_period': 13, 'atr_threshold': 15.0, 'pt_mult': 2.5, 'sl_mult': 0.5, 'td_mins': 120}. Best is trial 337 with value: 2.318948203404773.
[I 2026-03-12 01:34:39,622] Trial 993 finished with value: 0.0 and parameters: {'timeframe': 'M1', 'atr_period': 13, 'atr_threshold': 8.0, 'pt_mult': 5.0, 'sl_mult': 5.0, 'td_mins': 60}. Best is trial 337 with value: 2.318948203404773.
[I 2026-03-12 01:34:39,678] Trial 994 pruned. 
[I 2026-03-12 01:34:39,729] Trial 995 finished with value: 0.0 and parameters: {'timeframe': 'M1', 'atr_period': 13, 'atr_threshold': 3.0, 'pt_mult': 2.5, 'sl_mult': 1.0, 'td_mins': 30}. Best is trial 337 with value: 2.318948203404773.
[I 2026-03-12 01:34:39,822] Trial 996 finished with value: 2.318948203404773 and parameters: {'timeframe': 'M1', 'atr_period': 13, 'atr_threshold': 2.0, 'pt_mult': 0.5, 'sl_mult': 5.0, 'td_mins': 5}. Best is trial 337 with value: 2.318948203404773.
[I 2026-03-12 01:34:39,914] Trial 997 finished with value: 2.318948203404773 and parameters: {'timeframe': 'M1', 'atr_period': 13, 'atr_threshold': 2.0, 'pt_mult': 0.5, 'sl_mult': 5.0, 'td_mins': 5}. Best is trial 337 with value: 2.318948203404773.
[I 2026-03-12 01:34:40,045] Trial 998 pruned. 
[I 2026-03-12 01:34:40,103] Trial 999 pruned. 
2026-03-12 01:34:40,167 - INFO - === Starting Optuna Optimization for M3 [SHORT_ONLY] (Trials: 1000) ===
/home/hephaestus-zero/.local/lib/python3.11/site-packages/optuna/_experimental.py:32: ExperimentalWarning: Argument ``multivariate`` is an experimental feature. The interface can change in the future.
  warnings.warn(
[I 2026-03-12 01:34:40,167] A new study created in memory with name: no-name-03606d15-a4f1-4470-ab00-fce9bdb00c88
2026-03-12 01:34:40,170 - INFO -     [Cache Miss] Loading Signal Data for M3, ATR=13...
2026-03-12 01:35:16,533 - INFO -     [Cache Miss] Loading Signal Data for M3, ATR=13...
2026-03-12 01:35:52,552 - INFO -     [Cache Miss] Loading Signal Data for M3, ATR=13...
2026-03-12 01:36:29,053 - INFO -     [Cache Miss] Loading Signal Data for M3, ATR=13...
2026-03-12 01:37:05,137 - INFO -     [Cache Miss] Loading Signal Data for M3, ATR=13...
[I 2026-03-12 01:37:40,931] Trial 0 finished with value: 1.105429303807335 and parameters: {'timeframe': 'M3', 'atr_period': 13, 'atr_threshold': 3.0, 'pt_mult': 2.5, 'sl_mult': 5.0, 'td_mins': 30}. Best is trial 0 with value: 1.105429303807335.
[I 2026-03-12 01:37:41,505] Trial 1 finished with value: 0.22904375106240163 and parameters: {'timeframe': 'M3', 'atr_period': 13, 'atr_threshold': 1.0, 'pt_mult': 5.0, 'sl_mult': 2.5, 'td_mins': 30}. Best is trial 0 with value: 1.105429303807335.
[I 2026-03-12 01:37:42,519] Trial 2 finished with value: 0.9809392844005573 and parameters: {'timeframe': 'M3', 'atr_period': 13, 'atr_threshold': 1.0, 'pt_mult': 1.0, 'sl_mult': 1.0, 'td_mins': 120}. Best is trial 0 with value: 1.105429303807335.
[I 2026-03-12 01:37:42,695] Trial 3 finished with value: 0.28335975071347896 and parameters: {'timeframe': 'M3', 'atr_period': 13, 'atr_threshold': 3.0, 'pt_mult': 5.0, 'sl_mult': 1.0, 'td_mins': 60}. Best is trial 0 with value: 1.105429303807335.
[I 2026-03-12 01:37:42,740] Trial 4 finished with value: 0.0 and parameters: {'timeframe': 'M3', 'atr_period': 13, 'atr_threshold': 15.0, 'pt_mult': 1.0, 'sl_mult': 2.5, 'td_mins': 60}. Best is trial 0 with value: 1.105429303807335.
[I 2026-03-12 01:37:43,290] Trial 5 finished with value: 1.5593286804083646 and parameters: {'timeframe': 'M3', 'atr_period': 13, 'atr_threshold': 2.0, 'pt_mult': 1.0, 'sl_mult': 5.0, 'td_mins': 120}. Best is trial 5 with value: 1.5593286804083646.
[I 2026-03-12 01:37:46,497] Trial 6 finished with value: 0.8374030290025706 and parameters: {'timeframe': 'M3', 'atr_period': 13, 'atr_threshold': 0.5, 'pt_mult': 5.0, 'sl_mult': 5.0, 'td_mins': 180}. Best is trial 5 with value: 1.5593286804083646.
[I 2026-03-12 01:37:46,542] Trial 7 finished with value: 0.0 and parameters: {'timeframe': 'M3', 'atr_period': 13, 'atr_threshold': 8.0, 'pt_mult': 1.0, 'sl_mult': 1.0, 'td_mins': 120}. Best is trial 5 with value: 1.5593286804083646.
[I 2026-03-12 01:37:50,579] Trial 8 finished with value: 0.9898495445152072 and parameters: {'timeframe': 'M3', 'atr_period': 13, 'atr_threshold': 0.5, 'pt_mult': 1.0, 'sl_mult': 1.0, 'td_mins': 1080}. Best is trial 5 with value: 1.5593286804083646.
[I 2026-03-12 01:37:50,625] Trial 9 finished with value: 0.0 and parameters: {'timeframe': 'M3', 'atr_period': 13, 'atr_threshold': 15.0, 'pt_mult': 2.5, 'sl_mult': 2.5, 'td_mins': 15}. Best is trial 5 with value: 1.5593286804083646.
[I 2026-03-12 01:37:50,672] Trial 10 finished with value: 0.0 and parameters: {'timeframe': 'M3', 'atr_period': 13, 'atr_threshold': 10.0, 'pt_mult': 2.5, 'sl_mult': 5.0, 'td_mins': 5}. Best is trial 5 with value: 1.5593286804083646.
[I 2026-03-12 01:37:50,717] Trial 11 finished with value: 0.0 and parameters: {'timeframe': 'M3', 'atr_period': 13, 'atr_threshold': 15.0, 'pt_mult': 2.5, 'sl_mult': 5.0, 'td_mins': 1080}. Best is trial 5 with value: 1.5593286804083646.
[I 2026-03-12 01:37:51,358] Trial 12 finished with value: 0.6307146329034061 and parameters: {'timeframe': 'M3', 'atr_period': 13, 'atr_threshold': 0.5, 'pt_mult': 2.5, 'sl_mult': 0.5, 'td_mins': 30}. Best is trial 5 with value: 1.5593286804083646.
[I 2026-03-12 01:37:51,407] Trial 13 finished with value: 0.0 and parameters: {'timeframe': 'M3', 'atr_period': 13, 'atr_threshold': 8.0, 'pt_mult': 2.5, 'sl_mult': 0.5, 'td_mins': 180}. Best is trial 5 with value: 1.5593286804083646.
[I 2026-03-12 01:37:51,456] Trial 14 finished with value: 0.0 and parameters: {'timeframe': 'M3', 'atr_period': 13, 'atr_threshold': 15.0, 'pt_mult': 0.5, 'sl_mult': 1.0, 'td_mins': 15}. Best is trial 5 with value: 1.5593286804083646.
[I 2026-03-12 01:37:51,880] Trial 15 finished with value: 0.08476596666473876 and parameters: {'timeframe': 'M3', 'atr_period': 13, 'atr_threshold': 0.5, 'pt_mult': 5.0, 'sl_mult': 0.5, 'td_mins': 15}. Best is trial 5 with value: 1.5593286804083646.
[I 2026-03-12 01:37:53,098] Trial 16 finished with value: 0.7346399074167278 and parameters: {'timeframe': 'M3', 'atr_period': 13, 'atr_threshold': 2.0, 'pt_mult': 5.0, 'sl_mult': 1.0, 'td_mins': 360}. Best is trial 5 with value: 1.5593286804083646.
[I 2026-03-12 01:37:53,142] Trial 17 finished with value: 0.0 and parameters: {'timeframe': 'M3', 'atr_period': 13, 'atr_threshold': 5.0, 'pt_mult': 5.0, 'sl_mult': 1.0, 'td_mins': 180}. Best is trial 5 with value: 1.5593286804083646.
[I 2026-03-12 01:37:53,188] Trial 18 finished with value: 0.0 and parameters: {'timeframe': 'M3', 'atr_period': 13, 'atr_threshold': 10.0, 'pt_mult': 0.5, 'sl_mult': 1.0, 'td_mins': 30}. Best is trial 5 with value: 1.5593286804083646.
[I 2026-03-12 01:37:56,607] Trial 19 finished with value: 0.8767245034147824 and parameters: {'timeframe': 'M3', 'atr_period': 13, 'atr_threshold': 2.0, 'pt_mult': 5.0, 'sl_mult': 2.5, 'td_mins': 1080}. Best is trial 5 with value: 1.5593286804083646.
[I 2026-03-12 01:37:56,651] Trial 20 finished with value: 0.0 and parameters: {'timeframe': 'M3', 'atr_period': 13, 'atr_threshold': 8.0, 'pt_mult': 2.5, 'sl_mult': 2.5, 'td_mins': 5}. Best is trial 5 with value: 1.5593286804083646.
[I 2026-03-12 01:37:56,697] Trial 21 finished with value: 0.0 and parameters: {'timeframe': 'M3', 'atr_period': 13, 'atr_threshold': 8.0, 'pt_mult': 1.0, 'sl_mult': 2.5, 'td_mins': 120}. Best is trial 5 with value: 1.5593286804083646.
[I 2026-03-12 01:37:56,740] Trial 22 finished with value: 0.0 and parameters: {'timeframe': 'M3', 'atr_period': 13, 'atr_threshold': 15.0, 'pt_mult': 5.0, 'sl_mult': 5.0, 'td_mins': 120}. Best is trial 5 with value: 1.5593286804083646.
[I 2026-03-12 01:38:04,337] Trial 23 finished with value: 0.9235339551822808 and parameters: {'timeframe': 'M3', 'atr_period': 13, 'atr_threshold': 1.0, 'pt_mult': 5.0, 'sl_mult': 5.0, 'td_mins': 720}. Best is trial 5 with value: 1.5593286804083646.
[I 2026-03-12 01:38:17,459] Trial 24 finished with value: 0.9689824260291534 and parameters: {'timeframe': 'M3', 'atr_period': 13, 'atr_threshold': 0.5, 'pt_mult': 2.5, 'sl_mult': 5.0, 'td_mins': 1200}. Best is trial 5 with value: 1.5593286804083646.
[I 2026-03-12 01:38:17,505] Trial 25 finished with value: 0.0 and parameters: {'timeframe': 'M3', 'atr_period': 13, 'atr_threshold': 8.0, 'pt_mult': 2.5, 'sl_mult': 1.0, 'td_mins': 60}. Best is trial 5 with value: 1.5593286804083646.
[I 2026-03-12 01:38:17,573] Trial 26 pruned. 
[I 2026-03-12 01:38:17,618] Trial 27 finished with value: 0.0 and parameters: {'timeframe': 'M3', 'atr_period': 13, 'atr_threshold': 5.0, 'pt_mult': 2.5, 'sl_mult': 1.0, 'td_mins': 720}. Best is trial 5 with value: 1.5593286804083646.
[I 2026-03-12 01:38:17,663] Trial 28 finished with value: 0.0 and parameters: {'timeframe': 'M3', 'atr_period': 13, 'atr_threshold': 15.0, 'pt_mult': 0.5, 'sl_mult': 2.5, 'td_mins': 5}. Best is trial 5 with value: 1.5593286804083646.
[I 2026-03-12 01:38:17,744] Trial 29 pruned. 
