[I 2026-03-12 01:22:03,888] Trial 639 finished with value: 2.1354320678443623 and parameters: {'timeframe': 'mixed', 'atr_period': 13, 'atr_threshold': 3.0, 'pt_mult': 0.5, 'sl_mult': 5.0, 'td_mins': 60}. Best is trial 404 with value: 2.1354320678443623.
[I 2026-03-12 01:22:04,041] Trial 640 pruned. 
[I 2026-03-12 01:22:04,160] Trial 641 pruned. 
[I 2026-03-12 01:22:04,356] Trial 642 finished with value: 0.0 and parameters: {'timeframe': 'mixed', 'atr_period': 13, 'atr_threshold': 10.0, 'pt_mult': 0.5, 'sl_mult': 5.0, 'td_mins': 1200}. Best is trial 404 with value: 2.1354320678443623.
[I 2026-03-12 01:22:05,414] Trial 643 pruned. 
[I 2026-03-12 01:22:06,114] Trial 644 finished with value: 2.1354320678443623 and parameters: {'timeframe': 'mixed', 'atr_period': 13, 'atr_threshold': 3.0, 'pt_mult': 0.5, 'sl_mult': 5.0, 'td_mins': 60}. Best is trial 404 with value: 2.1354320678443623.
[I 2026-03-12 01:22:06,275] Trial 645 pruned. 
[I 2026-03-12 01:22:06,488] Trial 646 pruned. 
[I 2026-03-12 01:22:06,631] Trial 647 pruned. 
[I 2026-03-12 01:22:07,154] Trial 648 pruned. 
[I 2026-03-12 01:22:07,528] Trial 649 pruned. 
[I 2026-03-12 01:22:08,752] Trial 650 pruned. 
[I 2026-03-12 01:22:08,998] Trial 651 pruned. 
[I 2026-03-12 01:22:09,378] Trial 652 pruned. 
[I 2026-03-12 01:22:10,032] Trial 653 finished with value: 2.1354320678443623 and parameters: {'timeframe': 'mixed', 'atr_period': 13, 'atr_threshold': 3.0, 'pt_mult': 0.5, 'sl_mult': 5.0, 'td_mins': 60}. Best is trial 404 with value: 2.1354320678443623.
[I 2026-03-12 01:22:10,660] Trial 654 pruned. 
[I 2026-03-12 01:22:10,798] Trial 655 pruned. 
[I 2026-03-12 01:22:10,941] Trial 656 pruned. 
[I 2026-03-12 01:22:11,522] Trial 657 pruned. 
[I 2026-03-12 01:22:12,223] Trial 658 pruned. 
[I 2026-03-12 01:22:12,522] Trial 659 pruned. 
[I 2026-03-12 01:22:12,769] Trial 660 finished with value: 0.0 and parameters: {'timeframe': 'mixed', 'atr_period': 13, 'atr_threshold': 10.0, 'pt_mult': 1.0, 'sl_mult': 5.0, 'td_mins': 60}. Best is trial 404 with value: 2.1354320678443623.
[I 2026-03-12 01:22:13,046] Trial 661 pruned. 
[I 2026-03-12 01:22:13,161] Trial 662 pruned. 
[I 2026-03-12 01:22:13,319] Trial 663 pruned. 
[I 2026-03-12 01:22:13,628] Trial 664 finished with value: 1.851061453289293 and parameters: {'timeframe': 'mixed', 'atr_period': 13, 'atr_threshold': 5.0, 'pt_mult': 0.5, 'sl_mult': 5.0, 'td_mins': 60}. Best is trial 404 with value: 2.1354320678443623.
[I 2026-03-12 01:22:14,224] Trial 665 finished with value: 2.1354320678443623 and parameters: {'timeframe': 'mixed', 'atr_period': 13, 'atr_threshold': 3.0, 'pt_mult': 0.5, 'sl_mult': 5.0, 'td_mins': 60}. Best is trial 404 with value: 2.1354320678443623.
[I 2026-03-12 01:22:14,416] Trial 666 pruned. 
[I 2026-03-12 01:22:14,546] Trial 667 pruned. 
[I 2026-03-12 01:22:14,714] Trial 668 pruned. 
[I 2026-03-12 01:22:15,141] Trial 669 pruned. 
[I 2026-03-12 01:22:15,338] Trial 670 finished with value: 0.0 and parameters: {'timeframe': 'mixed', 'atr_period': 13, 'atr_threshold': 15.0, 'pt_mult': 5.0, 'sl_mult': 5.0, 'td_mins': 120}. Best is trial 404 with value: 2.1354320678443623.
[I 2026-03-12 01:22:15,838] Trial 671 finished with value: 1.9468260827108126 and parameters: {'timeframe': 'mixed', 'atr_period': 13, 'atr_threshold': 3.0, 'pt_mult': 0.5, 'sl_mult': 5.0, 'td_mins': 30}. Best is trial 404 with value: 2.1354320678443623.
[I 2026-03-12 01:22:16,430] Trial 672 finished with value: 2.1354320678443623 and parameters: {'timeframe': 'mixed', 'atr_period': 13, 'atr_threshold': 3.0, 'pt_mult': 0.5, 'sl_mult': 5.0, 'td_mins': 60}. Best is trial 404 with value: 2.1354320678443623.
[I 2026-03-12 01:22:17,068] Trial 673 finished with value: 2.1354320678443623 and parameters: {'timeframe': 'mixed', 'atr_period': 13, 'atr_threshold': 3.0, 'pt_mult': 0.5, 'sl_mult': 5.0, 'td_mins': 60}. Best is trial 404 with value: 2.1354320678443623.
[I 2026-03-12 01:22:17,770] Trial 674 finished with value: 2.1354320678443623 and parameters: {'timeframe': 'mixed', 'atr_period': 13, 'atr_threshold': 3.0, 'pt_mult': 0.5, 'sl_mult': 5.0, 'td_mins': 60}. Best is trial 404 with value: 2.1354320678443623.
[I 2026-03-12 01:22:17,967] Trial 675 pruned. 
[I 2026-03-12 01:22:18,170] Trial 676 pruned. 
[I 2026-03-12 01:22:19,012] Trial 677 pruned. 
[I 2026-03-12 01:22:19,194] Trial 678 finished with value: 0.0 and parameters: {'timeframe': 'mixed', 'atr_period': 13, 'atr_threshold': 10.0, 'pt_mult': 5.0, 'sl_mult': 0.5, 'td_mins': 5}. Best is trial 404 with value: 2.1354320678443623.
[I 2026-03-12 01:22:19,345] Trial 679 pruned. 
[I 2026-03-12 01:22:20,247] Trial 680 finished with value: 2.0147840062204914 and parameters: {'timeframe': 'mixed', 'atr_period': 13, 'atr_threshold': 3.0, 'pt_mult': 0.5, 'sl_mult': 5.0, 'td_mins': 120}. Best is trial 404 with value: 2.1354320678443623.
[I 2026-03-12 01:22:20,817] Trial 681 finished with value: 2.1354320678443623 and parameters: {'timeframe': 'mixed', 'atr_period': 13, 'atr_threshold': 3.0, 'pt_mult': 0.5, 'sl_mult': 5.0, 'td_mins': 60}. Best is trial 404 with value: 2.1354320678443623.
[I 2026-03-12 01:22:21,036] Trial 682 pruned. 
[I 2026-03-12 01:22:21,578] Trial 683 finished with value: 2.1354320678443623 and parameters: {'timeframe': 'mixed', 'atr_period': 13, 'atr_threshold': 3.0, 'pt_mult': 0.5, 'sl_mult': 5.0, 'td_mins': 60}. Best is trial 404 with value: 2.1354320678443623.
[I 2026-03-12 01:22:22,123] Trial 684 finished with value: 2.1354320678443623 and parameters: {'timeframe': 'mixed', 'atr_period': 13, 'atr_threshold': 3.0, 'pt_mult': 0.5, 'sl_mult': 5.0, 'td_mins': 60}. Best is trial 404 with value: 2.1354320678443623.
[I 2026-03-12 01:22:22,246] Trial 685 pruned. 
[I 2026-03-12 01:22:22,568] Trial 686 pruned. 
[I 2026-03-12 01:22:23,145] Trial 687 finished with value: 2.1354320678443623 and parameters: {'timeframe': 'mixed', 'atr_period': 13, 'atr_threshold': 3.0, 'pt_mult': 0.5, 'sl_mult': 5.0, 'td_mins': 60}. Best is trial 404 with value: 2.1354320678443623.
[I 2026-03-12 01:22:23,695] Trial 688 finished with value: 2.1354320678443623 and parameters: {'timeframe': 'mixed', 'atr_period': 13, 'atr_threshold': 3.0, 'pt_mult': 0.5, 'sl_mult': 5.0, 'td_mins': 60}. Best is trial 404 with value: 2.1354320678443623.
[I 2026-03-12 01:22:23,813] Trial 689 pruned. 
[I 2026-03-12 01:22:23,929] Trial 690 pruned. 
[I 2026-03-12 01:22:24,042] Trial 691 pruned. 
[I 2026-03-12 01:22:24,154] Trial 692 pruned. 
[I 2026-03-12 01:22:24,321] Trial 693 finished with value: 0.0 and parameters: {'timeframe': 'mixed', 'atr_period': 13, 'atr_threshold': 10.0, 'pt_mult': 5.0, 'sl_mult': 5.0, 'td_mins': 720}. Best is trial 404 with value: 2.1354320678443623.
[I 2026-03-12 01:22:24,871] Trial 694 finished with value: 2.1354320678443623 and parameters: {'timeframe': 'mixed', 'atr_period': 13, 'atr_threshold': 3.0, 'pt_mult': 0.5, 'sl_mult': 5.0, 'td_mins': 60}. Best is trial 404 with value: 2.1354320678443623.
[I 2026-03-12 01:22:25,949] Trial 695 pruned. 
[I 2026-03-12 01:22:26,236] Trial 696 pruned. 
[I 2026-03-12 01:22:26,427] Trial 697 finished with value: 0.0 and parameters: {'timeframe': 'mixed', 'atr_period': 13, 'atr_threshold': 15.0, 'pt_mult': 0.5, 'sl_mult': 5.0, 'td_mins': 30}. Best is trial 404 with value: 2.1354320678443623.
[I 2026-03-12 01:22:27,104] Trial 698 finished with value: 2.1354320678443623 and parameters: {'timeframe': 'mixed', 'atr_period': 13, 'atr_threshold': 3.0, 'pt_mult': 0.5, 'sl_mult': 5.0, 'td_mins': 60}. Best is trial 404 with value: 2.1354320678443623.
[I 2026-03-12 01:22:27,296] Trial 699 pruned. 
[I 2026-03-12 01:22:27,534] Trial 700 finished with value: 0.0 and parameters: {'timeframe': 'mixed', 'atr_period': 13, 'atr_threshold': 15.0, 'pt_mult': 1.0, 'sl_mult': 5.0, 'td_mins': 180}. Best is trial 404 with value: 2.1354320678443623.
[I 2026-03-12 01:22:27,825] Trial 701 pruned. 
[I 2026-03-12 01:22:28,504] Trial 702 finished with value: 2.1354320678443623 and parameters: {'timeframe': 'mixed', 'atr_period': 13, 'atr_threshold': 3.0, 'pt_mult': 0.5, 'sl_mult': 5.0, 'td_mins': 60}. Best is trial 404 with value: 2.1354320678443623.
[I 2026-03-12 01:22:29,071] Trial 703 finished with value: 2.1354320678443623 and parameters: {'timeframe': 'mixed', 'atr_period': 13, 'atr_threshold': 3.0, 'pt_mult': 0.5, 'sl_mult': 5.0, 'td_mins': 60}. Best is trial 404 with value: 2.1354320678443623.
[I 2026-03-12 01:22:29,637] Trial 704 finished with value: 2.1354320678443623 and parameters: {'timeframe': 'mixed', 'atr_period': 13, 'atr_threshold': 3.0, 'pt_mult': 0.5, 'sl_mult': 5.0, 'td_mins': 60}. Best is trial 404 with value: 2.1354320678443623.
[I 2026-03-12 01:22:30,187] Trial 705 finished with value: 2.1354320678443623 and parameters: {'timeframe': 'mixed', 'atr_period': 13, 'atr_threshold': 3.0, 'pt_mult': 0.5, 'sl_mult': 5.0, 'td_mins': 60}. Best is trial 404 with value: 2.1354320678443623.
[I 2026-03-12 01:22:30,354] Trial 706 finished with value: 0.0 and parameters: {'timeframe': 'mixed', 'atr_period': 13, 'atr_threshold': 10.0, 'pt_mult': 1.0, 'sl_mult': 0.5, 'td_mins': 30}. Best is trial 404 with value: 2.1354320678443623.
[I 2026-03-12 01:22:30,896] Trial 707 finished with value: 2.1354320678443623 and parameters: {'timeframe': 'mixed', 'atr_period': 13, 'atr_threshold': 3.0, 'pt_mult': 0.5, 'sl_mult': 5.0, 'td_mins': 60}. Best is trial 404 with value: 2.1354320678443623.
[I 2026-03-12 01:22:31,321] Trial 708 pruned. 
[I 2026-03-12 01:22:31,492] Trial 709 finished with value: 0.0 and parameters: {'timeframe': 'mixed', 'atr_period': 13, 'atr_threshold': 10.0, 'pt_mult': 0.5, 'sl_mult': 5.0, 'td_mins': 60}. Best is trial 404 with value: 2.1354320678443623.
[I 2026-03-12 01:22:32,047] Trial 710 finished with value: 2.1354320678443623 and parameters: {'timeframe': 'mixed', 'atr_period': 13, 'atr_threshold': 3.0, 'pt_mult': 0.5, 'sl_mult': 5.0, 'td_mins': 60}. Best is trial 404 with value: 2.1354320678443623.
[I 2026-03-12 01:22:32,601] Trial 711 finished with value: 2.1354320678443623 and parameters: {'timeframe': 'mixed', 'atr_period': 13, 'atr_threshold': 3.0, 'pt_mult': 0.5, 'sl_mult': 5.0, 'td_mins': 60}. Best is trial 404 with value: 2.1354320678443623.
[I 2026-03-12 01:22:33,175] Trial 712 finished with value: 2.1354320678443623 and parameters: {'timeframe': 'mixed', 'atr_period': 13, 'atr_threshold': 3.0, 'pt_mult': 0.5, 'sl_mult': 5.0, 'td_mins': 60}. Best is trial 404 with value: 2.1354320678443623.
[I 2026-03-12 01:22:33,712] Trial 713 finished with value: 2.1354320678443623 and parameters: {'timeframe': 'mixed', 'atr_period': 13, 'atr_threshold': 3.0, 'pt_mult': 0.5, 'sl_mult': 5.0, 'td_mins': 60}. Best is trial 404 with value: 2.1354320678443623.
[I 2026-03-12 01:22:33,861] Trial 714 pruned. 
[I 2026-03-12 01:22:34,005] Trial 715 pruned. 
[I 2026-03-12 01:22:34,543] Trial 716 pruned. 
[I 2026-03-12 01:22:35,098] Trial 717 finished with value: 2.1354320678443623 and parameters: {'timeframe': 'mixed', 'atr_period': 13, 'atr_threshold': 3.0, 'pt_mult': 0.5, 'sl_mult': 5.0, 'td_mins': 60}. Best is trial 404 with value: 2.1354320678443623.
[I 2026-03-12 01:22:35,658] Trial 718 finished with value: 2.1354320678443623 and parameters: {'timeframe': 'mixed', 'atr_period': 13, 'atr_threshold': 3.0, 'pt_mult': 0.5, 'sl_mult': 5.0, 'td_mins': 60}. Best is trial 404 with value: 2.1354320678443623.
[I 2026-03-12 01:22:35,792] Trial 719 pruned. 
[I 2026-03-12 01:22:36,350] Trial 720 finished with value: 2.1354320678443623 and parameters: {'timeframe': 'mixed', 'atr_period': 13, 'atr_threshold': 3.0, 'pt_mult': 0.5, 'sl_mult': 5.0, 'td_mins': 60}. Best is trial 404 with value: 2.1354320678443623.
[I 2026-03-12 01:22:37,421] Trial 721 pruned. 
[I 2026-03-12 01:22:37,566] Trial 722 pruned. 
[I 2026-03-12 01:22:37,723] Trial 723 pruned. 
[I 2026-03-12 01:22:38,304] Trial 724 finished with value: 2.1354320678443623 and parameters: {'timeframe': 'mixed', 'atr_period': 13, 'atr_threshold': 3.0, 'pt_mult': 0.5, 'sl_mult': 5.0, 'td_mins': 60}. Best is trial 404 with value: 2.1354320678443623.
[I 2026-03-12 01:22:38,450] Trial 725 pruned. 
[I 2026-03-12 01:22:38,563] Trial 726 pruned. 
[I 2026-03-12 01:22:38,734] Trial 727 finished with value: 0.0 and parameters: {'timeframe': 'mixed', 'atr_period': 13, 'atr_threshold': 15.0, 'pt_mult': 0.5, 'sl_mult': 5.0, 'td_mins': 60}. Best is trial 404 with value: 2.1354320678443623.
[I 2026-03-12 01:22:39,306] Trial 728 finished with value: 2.1354320678443623 and parameters: {'timeframe': 'mixed', 'atr_period': 13, 'atr_threshold': 3.0, 'pt_mult': 0.5, 'sl_mult': 5.0, 'td_mins': 60}. Best is trial 404 with value: 2.1354320678443623.
[I 2026-03-12 01:22:40,400] Trial 729 pruned. 
[I 2026-03-12 01:22:40,547] Trial 730 pruned. 
[I 2026-03-12 01:22:40,715] Trial 731 finished with value: 0.0 and parameters: {'timeframe': 'mixed', 'atr_period': 13, 'atr_threshold': 15.0, 'pt_mult': 1.0, 'sl_mult': 0.5, 'td_mins': 720}. Best is trial 404 with value: 2.1354320678443623.
[I 2026-03-12 01:22:41,163] Trial 732 pruned. 
[I 2026-03-12 01:22:42,079] Trial 733 pruned. 
[I 2026-03-12 01:22:42,825] Trial 734 pruned. 
[I 2026-03-12 01:22:42,958] Trial 735 pruned. 
[I 2026-03-12 01:22:43,458] Trial 736 pruned. 
[I 2026-03-12 01:22:43,597] Trial 737 pruned. 
[I 2026-03-12 01:22:44,138] Trial 738 finished with value: 2.1354320678443623 and parameters: {'timeframe': 'mixed', 'atr_period': 13, 'atr_threshold': 3.0, 'pt_mult': 0.5, 'sl_mult': 5.0, 'td_mins': 60}. Best is trial 404 with value: 2.1354320678443623.
[I 2026-03-12 01:22:44,282] Trial 739 pruned. 
[I 2026-03-12 01:22:44,450] Trial 740 finished with value: 0.0 and parameters: {'timeframe': 'mixed', 'atr_period': 13, 'atr_threshold': 15.0, 'pt_mult': 0.5, 'sl_mult': 5.0, 'td_mins': 180}. Best is trial 404 with value: 2.1354320678443623.
[I 2026-03-12 01:22:45,136] Trial 741 pruned. 
[I 2026-03-12 01:22:45,266] Trial 742 pruned. 
[I 2026-03-12 01:22:46,437] Trial 743 finished with value: 1.652490975861335 and parameters: {'timeframe': 'mixed', 'atr_period': 13, 'atr_threshold': 3.0, 'pt_mult': 1.0, 'sl_mult': 5.0, 'td_mins': 180}. Best is trial 404 with value: 2.1354320678443623.
[I 2026-03-12 01:22:46,588] Trial 744 pruned. 
[I 2026-03-12 01:22:50,217] Trial 745 pruned. 
[I 2026-03-12 01:22:50,459] Trial 746 finished with value: 1.851061453289293 and parameters: {'timeframe': 'mixed', 'atr_period': 13, 'atr_threshold': 5.0, 'pt_mult': 0.5, 'sl_mult': 5.0, 'td_mins': 60}. Best is trial 404 with value: 2.1354320678443623.
[I 2026-03-12 01:22:50,627] Trial 747 finished with value: 0.0 and parameters: {'timeframe': 'mixed', 'atr_period': 13, 'atr_threshold': 10.0, 'pt_mult': 0.5, 'sl_mult': 1.0, 'td_mins': 60}. Best is trial 404 with value: 2.1354320678443623.
[I 2026-03-12 01:22:50,768] Trial 748 pruned. 
[I 2026-03-12 01:22:51,341] Trial 749 finished with value: 2.1354320678443623 and parameters: {'timeframe': 'mixed', 'atr_period': 13, 'atr_threshold': 3.0, 'pt_mult': 0.5, 'sl_mult': 5.0, 'td_mins': 60}. Best is trial 404 with value: 2.1354320678443623.
[I 2026-03-12 01:22:51,572] Trial 750 pruned. 
[I 2026-03-12 01:22:51,744] Trial 751 finished with value: 0.0 and parameters: {'timeframe': 'mixed', 'atr_period': 13, 'atr_threshold': 15.0, 'pt_mult': 2.5, 'sl_mult': 2.5, 'td_mins': 360}. Best is trial 404 with value: 2.1354320678443623.
[I 2026-03-12 01:22:52,189] Trial 752 pruned. 
[I 2026-03-12 01:22:52,812] Trial 753 pruned. 
[I 2026-03-12 01:22:53,003] Trial 754 finished with value: 0.0 and parameters: {'timeframe': 'mixed', 'atr_period': 13, 'atr_threshold': 10.0, 'pt_mult': 2.5, 'sl_mult': 0.5, 'td_mins': 720}. Best is trial 404 with value: 2.1354320678443623.
[I 2026-03-12 01:22:53,110] Trial 755 pruned. 
[I 2026-03-12 01:22:53,362] Trial 756 pruned. 
[I 2026-03-12 01:22:53,531] Trial 757 finished with value: 0.0 and parameters: {'timeframe': 'mixed', 'atr_period': 13, 'atr_threshold': 15.0, 'pt_mult': 1.0, 'sl_mult': 1.0, 'td_mins': 360}. Best is trial 404 with value: 2.1354320678443623.
[I 2026-03-12 01:22:53,659] Trial 758 pruned. 
[I 2026-03-12 01:22:54,110] Trial 759 pruned. 
[I 2026-03-12 01:22:54,248] Trial 760 pruned. 
[I 2026-03-12 01:22:54,415] Trial 761 finished with value: 0.0 and parameters: {'timeframe': 'mixed', 'atr_period': 13, 'atr_threshold': 15.0, 'pt_mult': 0.5, 'sl_mult': 0.5, 'td_mins': 30}. Best is trial 404 with value: 2.1354320678443623.
[I 2026-03-12 01:22:54,966] Trial 762 finished with value: 2.1354320678443623 and parameters: {'timeframe': 'mixed', 'atr_period': 13, 'atr_threshold': 3.0, 'pt_mult': 0.5, 'sl_mult': 5.0, 'td_mins': 60}. Best is trial 404 with value: 2.1354320678443623.
[I 2026-03-12 01:22:55,133] Trial 763 finished with value: 0.0 and parameters: {'timeframe': 'mixed', 'atr_period': 13, 'atr_threshold': 15.0, 'pt_mult': 5.0, 'sl_mult': 0.5, 'td_mins': 1080}. Best is trial 404 with value: 2.1354320678443623.
[I 2026-03-12 01:22:55,351] Trial 764 pruned. 
[I 2026-03-12 01:22:55,506] Trial 765 pruned. 
[I 2026-03-12 01:22:56,890] Trial 766 pruned. 
[I 2026-03-12 01:22:57,064] Trial 767 finished with value: 0.0 and parameters: {'timeframe': 'mixed', 'atr_period': 13, 'atr_threshold': 15.0, 'pt_mult': 1.0, 'sl_mult': 5.0, 'td_mins': 1080}. Best is trial 404 with value: 2.1354320678443623.
[I 2026-03-12 01:22:57,281] Trial 768 pruned. 
[I 2026-03-12 01:22:57,690] Trial 769 finished with value: 1.9468260827108126 and parameters: {'timeframe': 'mixed', 'atr_period': 13, 'atr_threshold': 3.0, 'pt_mult': 0.5, 'sl_mult': 5.0, 'td_mins': 30}. Best is trial 404 with value: 2.1354320678443623.
[I 2026-03-12 01:23:00,129] Trial 770 pruned. 
[I 2026-03-12 01:23:00,275] Trial 771 pruned. 
[I 2026-03-12 01:23:00,608] Trial 772 pruned. 
[I 2026-03-12 01:23:00,779] Trial 773 finished with value: 0.0 and parameters: {'timeframe': 'mixed', 'atr_period': 13, 'atr_threshold': 15.0, 'pt_mult': 5.0, 'sl_mult': 2.5, 'td_mins': 30}. Best is trial 404 with value: 2.1354320678443623.
[I 2026-03-12 01:23:01,348] Trial 774 finished with value: 2.1354320678443623 and parameters: {'timeframe': 'mixed', 'atr_period': 13, 'atr_threshold': 3.0, 'pt_mult': 0.5, 'sl_mult': 5.0, 'td_mins': 60}. Best is trial 404 with value: 2.1354320678443623.
[I 2026-03-12 01:23:02,176] Trial 775 finished with value: 2.0147840062204914 and parameters: {'timeframe': 'mixed', 'atr_period': 13, 'atr_threshold': 3.0, 'pt_mult': 0.5, 'sl_mult': 5.0, 'td_mins': 120}. Best is trial 404 with value: 2.1354320678443623.
[I 2026-03-12 01:23:02,725] Trial 776 finished with value: 2.1354320678443623 and parameters: {'timeframe': 'mixed', 'atr_period': 13, 'atr_threshold': 3.0, 'pt_mult': 0.5, 'sl_mult': 5.0, 'td_mins': 60}. Best is trial 404 with value: 2.1354320678443623.
[I 2026-03-12 01:23:02,885] Trial 777 pruned. 
[I 2026-03-12 01:23:03,299] Trial 778 pruned. 
[I 2026-03-12 01:23:04,467] Trial 779 pruned. 
[I 2026-03-12 01:23:04,636] Trial 780 finished with value: 0.0 and parameters: {'timeframe': 'mixed', 'atr_period': 13, 'atr_threshold': 15.0, 'pt_mult': 2.5, 'sl_mult': 5.0, 'td_mins': 30}. Best is trial 404 with value: 2.1354320678443623.
[I 2026-03-12 01:23:05,168] Trial 781 finished with value: 2.1354320678443623 and parameters: {'timeframe': 'mixed', 'atr_period': 13, 'atr_threshold': 3.0, 'pt_mult': 0.5, 'sl_mult': 5.0, 'td_mins': 60}. Best is trial 404 with value: 2.1354320678443623.
[I 2026-03-12 01:23:05,718] Trial 782 finished with value: 2.1354320678443623 and parameters: {'timeframe': 'mixed', 'atr_period': 13, 'atr_threshold': 3.0, 'pt_mult': 0.5, 'sl_mult': 5.0, 'td_mins': 60}. Best is trial 404 with value: 2.1354320678443623.
[I 2026-03-12 01:23:06,059] Trial 783 pruned. 
[I 2026-03-12 01:23:06,166] Trial 784 pruned. 
[I 2026-03-12 01:23:06,714] Trial 785 finished with value: 2.1354320678443623 and parameters: {'timeframe': 'mixed', 'atr_period': 13, 'atr_threshold': 3.0, 'pt_mult': 0.5, 'sl_mult': 5.0, 'td_mins': 60}. Best is trial 404 with value: 2.1354320678443623.
[I 2026-03-12 01:23:06,830] Trial 786 pruned. 
[I 2026-03-12 01:23:07,274] Trial 787 pruned. 
[I 2026-03-12 01:23:07,851] Trial 788 finished with value: 2.1354320678443623 and parameters: {'timeframe': 'mixed', 'atr_period': 13, 'atr_threshold': 3.0, 'pt_mult': 0.5, 'sl_mult': 5.0, 'td_mins': 60}. Best is trial 404 with value: 2.1354320678443623.
[I 2026-03-12 01:23:07,970] Trial 789 pruned. 
[I 2026-03-12 01:23:08,505] Trial 790 finished with value: 2.1354320678443623 and parameters: {'timeframe': 'mixed', 'atr_period': 13, 'atr_threshold': 3.0, 'pt_mult': 0.5, 'sl_mult': 5.0, 'td_mins': 60}. Best is trial 404 with value: 2.1354320678443623.
[I 2026-03-12 01:23:08,669] Trial 791 finished with value: 0.0 and parameters: {'timeframe': 'mixed', 'atr_period': 13, 'atr_threshold': 10.0, 'pt_mult': 1.0, 'sl_mult': 1.0, 'td_mins': 120}. Best is trial 404 with value: 2.1354320678443623.
[I 2026-03-12 01:23:09,223] Trial 792 finished with value: 2.1354320678443623 and parameters: {'timeframe': 'mixed', 'atr_period': 13, 'atr_threshold': 3.0, 'pt_mult': 0.5, 'sl_mult': 5.0, 'td_mins': 60}. Best is trial 404 with value: 2.1354320678443623.
[I 2026-03-12 01:23:09,789] Trial 793 finished with value: 2.1354320678443623 and parameters: {'timeframe': 'mixed', 'atr_period': 13, 'atr_threshold': 3.0, 'pt_mult': 0.5, 'sl_mult': 5.0, 'td_mins': 60}. Best is trial 404 with value: 2.1354320678443623.
[I 2026-03-12 01:23:11,893] Trial 794 pruned. 
[I 2026-03-12 01:23:12,440] Trial 795 finished with value: 2.1354320678443623 and parameters: {'timeframe': 'mixed', 'atr_period': 13, 'atr_threshold': 3.0, 'pt_mult': 0.5, 'sl_mult': 5.0, 'td_mins': 60}. Best is trial 404 with value: 2.1354320678443623.
[I 2026-03-12 01:23:13,029] Trial 796 finished with value: 2.1354320678443623 and parameters: {'timeframe': 'mixed', 'atr_period': 13, 'atr_threshold': 3.0, 'pt_mult': 0.5, 'sl_mult': 5.0, 'td_mins': 60}. Best is trial 404 with value: 2.1354320678443623.
[I 2026-03-12 01:23:19,914] Trial 797 pruned. 
