[I 2026-03-12 00:40:28,500] Trial 98 finished with value: 0.0 and parameters: {'timeframe': 'M1', 'atr_period': 13, 'atr_threshold': 8.0, 'pt_mult': 0.5, 'sl_mult': 5.0, 'td_mins': 15}. Best is trial 32 with value: 1.7165018600651565.
[I 2026-03-12 00:40:28,611] Trial 99 pruned. 
[I 2026-03-12 00:40:29,421] Trial 100 pruned. 
[I 2026-03-12 00:40:29,603] Trial 101 finished with value: 1.1884118997438728 and parameters: {'timeframe': 'M1', 'atr_period': 13, 'atr_threshold': 2.0, 'pt_mult': 0.5, 'sl_mult': 5.0, 'td_mins': 30}. Best is trial 32 with value: 1.7165018600651565.
[I 2026-03-12 00:40:29,648] Trial 102 finished with value: 0.0 and parameters: {'timeframe': 'M1', 'atr_period': 13, 'atr_threshold': 15.0, 'pt_mult': 5.0, 'sl_mult': 0.5, 'td_mins': 720}. Best is trial 32 with value: 1.7165018600651565.
[I 2026-03-12 00:40:29,692] Trial 103 finished with value: 0.0 and parameters: {'timeframe': 'M1', 'atr_period': 13, 'atr_threshold': 5.0, 'pt_mult': 0.5, 'sl_mult': 2.5, 'td_mins': 720}. Best is trial 32 with value: 1.7165018600651565.
[I 2026-03-12 00:40:29,737] Trial 104 finished with value: 0.0 and parameters: {'timeframe': 'M1', 'atr_period': 13, 'atr_threshold': 15.0, 'pt_mult': 2.5, 'sl_mult': 1.0, 'td_mins': 5}. Best is trial 32 with value: 1.7165018600651565.
[I 2026-03-12 00:40:29,785] Trial 105 finished with value: 0.0 and parameters: {'timeframe': 'M1', 'atr_period': 13, 'atr_threshold': 15.0, 'pt_mult': 5.0, 'sl_mult': 0.5, 'td_mins': 1200}. Best is trial 32 with value: 1.7165018600651565.
[I 2026-03-12 00:40:41,183] Trial 106 finished with value: 1.0291509937916363 and parameters: {'timeframe': 'M1', 'atr_period': 13, 'atr_threshold': 1.0, 'pt_mult': 5.0, 'sl_mult': 5.0, 'td_mins': 1200}. Best is trial 32 with value: 1.7165018600651565.
[I 2026-03-12 00:40:41,233] Trial 107 finished with value: 0.0 and parameters: {'timeframe': 'M1', 'atr_period': 13, 'atr_threshold': 10.0, 'pt_mult': 1.0, 'sl_mult': 5.0, 'td_mins': 15}. Best is trial 32 with value: 1.7165018600651565.
[I 2026-03-12 00:40:41,284] Trial 108 finished with value: 0.0 and parameters: {'timeframe': 'M1', 'atr_period': 13, 'atr_threshold': 8.0, 'pt_mult': 0.5, 'sl_mult': 2.5, 'td_mins': 60}. Best is trial 32 with value: 1.7165018600651565.
[I 2026-03-12 00:40:41,336] Trial 109 finished with value: 0.0 and parameters: {'timeframe': 'M1', 'atr_period': 13, 'atr_threshold': 10.0, 'pt_mult': 1.0, 'sl_mult': 5.0, 'td_mins': 1200}. Best is trial 32 with value: 1.7165018600651565.
[I 2026-03-12 00:40:41,384] Trial 110 finished with value: 0.0 and parameters: {'timeframe': 'M1', 'atr_period': 13, 'atr_threshold': 10.0, 'pt_mult': 1.0, 'sl_mult': 2.5, 'td_mins': 1200}. Best is trial 32 with value: 1.7165018600651565.
[I 2026-03-12 00:40:41,766] Trial 111 pruned. 
[I 2026-03-12 00:40:41,966] Trial 112 pruned. 
[I 2026-03-12 00:40:42,015] Trial 113 finished with value: 0.0 and parameters: {'timeframe': 'M1', 'atr_period': 13, 'atr_threshold': 15.0, 'pt_mult': 0.5, 'sl_mult': 1.0, 'td_mins': 5}. Best is trial 32 with value: 1.7165018600651565.
[I 2026-03-12 00:40:42,067] Trial 114 finished with value: 0.0 and parameters: {'timeframe': 'M1', 'atr_period': 13, 'atr_threshold': 5.0, 'pt_mult': 0.5, 'sl_mult': 0.5, 'td_mins': 30}. Best is trial 32 with value: 1.7165018600651565.
[I 2026-03-12 00:40:42,855] Trial 115 finished with value: 1.04791331412257 and parameters: {'timeframe': 'M1', 'atr_period': 13, 'atr_threshold': 0.5, 'pt_mult': 1.0, 'sl_mult': 0.5, 'td_mins': 15}. Best is trial 32 with value: 1.7165018600651565.
[I 2026-03-12 00:40:42,902] Trial 116 finished with value: 0.0 and parameters: {'timeframe': 'M1', 'atr_period': 13, 'atr_threshold': 10.0, 'pt_mult': 5.0, 'sl_mult': 2.5, 'td_mins': 120}. Best is trial 32 with value: 1.7165018600651565.
[I 2026-03-12 00:40:42,960] Trial 117 finished with value: 0.0 and parameters: {'timeframe': 'M1', 'atr_period': 13, 'atr_threshold': 5.0, 'pt_mult': 0.5, 'sl_mult': 1.0, 'td_mins': 360}. Best is trial 32 with value: 1.7165018600651565.
[I 2026-03-12 00:40:43,019] Trial 118 finished with value: 0.0 and parameters: {'timeframe': 'M1', 'atr_period': 13, 'atr_threshold': 3.0, 'pt_mult': 1.0, 'sl_mult': 5.0, 'td_mins': 360}. Best is trial 32 with value: 1.7165018600651565.
[I 2026-03-12 00:40:43,069] Trial 119 finished with value: 0.0 and parameters: {'timeframe': 'M1', 'atr_period': 13, 'atr_threshold': 3.0, 'pt_mult': 2.5, 'sl_mult': 5.0, 'td_mins': 15}. Best is trial 32 with value: 1.7165018600651565.
[I 2026-03-12 00:40:43,118] Trial 120 finished with value: 0.0 and parameters: {'timeframe': 'M1', 'atr_period': 13, 'atr_threshold': 15.0, 'pt_mult': 1.0, 'sl_mult': 2.5, 'td_mins': 60}. Best is trial 32 with value: 1.7165018600651565.
[I 2026-03-12 00:40:43,193] Trial 121 pruned. 
[I 2026-03-12 00:40:43,236] Trial 122 finished with value: 0.0 and parameters: {'timeframe': 'M1', 'atr_period': 13, 'atr_threshold': 10.0, 'pt_mult': 2.5, 'sl_mult': 1.0, 'td_mins': 15}. Best is trial 32 with value: 1.7165018600651565.
[I 2026-03-12 00:40:43,280] Trial 123 finished with value: 0.0 and parameters: {'timeframe': 'M1', 'atr_period': 13, 'atr_threshold': 8.0, 'pt_mult': 1.0, 'sl_mult': 2.5, 'td_mins': 30}. Best is trial 32 with value: 1.7165018600651565.
[I 2026-03-12 00:40:45,262] Trial 124 finished with value: 1.0517578273177346 and parameters: {'timeframe': 'M1', 'atr_period': 13, 'atr_threshold': 1.0, 'pt_mult': 1.0, 'sl_mult': 0.5, 'td_mins': 720}. Best is trial 32 with value: 1.7165018600651565.
[I 2026-03-12 00:40:45,317] Trial 125 finished with value: 0.0 and parameters: {'timeframe': 'M1', 'atr_period': 13, 'atr_threshold': 3.0, 'pt_mult': 0.5, 'sl_mult': 5.0, 'td_mins': 720}. Best is trial 32 with value: 1.7165018600651565.
[I 2026-03-12 00:40:45,369] Trial 126 finished with value: 0.0 and parameters: {'timeframe': 'M1', 'atr_period': 13, 'atr_threshold': 8.0, 'pt_mult': 0.5, 'sl_mult': 2.5, 'td_mins': 120}. Best is trial 32 with value: 1.7165018600651565.
[I 2026-03-12 00:40:45,420] Trial 127 finished with value: 0.0 and parameters: {'timeframe': 'M1', 'atr_period': 13, 'atr_threshold': 3.0, 'pt_mult': 5.0, 'sl_mult': 1.0, 'td_mins': 5}. Best is trial 32 with value: 1.7165018600651565.
[I 2026-03-12 00:40:45,469] Trial 128 finished with value: 0.0 and parameters: {'timeframe': 'M1', 'atr_period': 13, 'atr_threshold': 8.0, 'pt_mult': 5.0, 'sl_mult': 0.5, 'td_mins': 5}. Best is trial 32 with value: 1.7165018600651565.
[I 2026-03-12 00:40:45,518] Trial 129 finished with value: 0.0 and parameters: {'timeframe': 'M1', 'atr_period': 13, 'atr_threshold': 10.0, 'pt_mult': 1.0, 'sl_mult': 1.0, 'td_mins': 5}. Best is trial 32 with value: 1.7165018600651565.
[I 2026-03-12 00:40:46,740] Trial 130 finished with value: 1.0297679564243358 and parameters: {'timeframe': 'M1', 'atr_period': 13, 'atr_threshold': 0.5, 'pt_mult': 2.5, 'sl_mult': 0.5, 'td_mins': 30}. Best is trial 32 with value: 1.7165018600651565.
[I 2026-03-12 00:40:46,849] Trial 131 pruned. 
[I 2026-03-12 00:40:46,895] Trial 132 finished with value: 0.0 and parameters: {'timeframe': 'M1', 'atr_period': 13, 'atr_threshold': 10.0, 'pt_mult': 5.0, 'sl_mult': 5.0, 'td_mins': 180}. Best is trial 32 with value: 1.7165018600651565.
[I 2026-03-12 00:40:46,939] Trial 133 finished with value: 0.0 and parameters: {'timeframe': 'M1', 'atr_period': 13, 'atr_threshold': 8.0, 'pt_mult': 5.0, 'sl_mult': 0.5, 'td_mins': 15}. Best is trial 32 with value: 1.7165018600651565.
[I 2026-03-12 00:40:46,982] Trial 134 finished with value: 0.0 and parameters: {'timeframe': 'M1', 'atr_period': 13, 'atr_threshold': 10.0, 'pt_mult': 2.5, 'sl_mult': 5.0, 'td_mins': 720}. Best is trial 32 with value: 1.7165018600651565.
[I 2026-03-12 00:40:47,025] Trial 135 finished with value: 0.0 and parameters: {'timeframe': 'M1', 'atr_period': 13, 'atr_threshold': 8.0, 'pt_mult': 0.5, 'sl_mult': 2.5, 'td_mins': 180}. Best is trial 32 with value: 1.7165018600651565.
[I 2026-03-12 00:40:47,084] Trial 136 finished with value: 0.0 and parameters: {'timeframe': 'M1', 'atr_period': 13, 'atr_threshold': 10.0, 'pt_mult': 2.5, 'sl_mult': 5.0, 'td_mins': 720}. Best is trial 32 with value: 1.7165018600651565.
[I 2026-03-12 00:40:48,746] Trial 137 finished with value: 1.0525336322863956 and parameters: {'timeframe': 'M1', 'atr_period': 13, 'atr_threshold': 0.5, 'pt_mult': 1.0, 'sl_mult': 0.5, 'td_mins': 120}. Best is trial 32 with value: 1.7165018600651565.
[I 2026-03-12 00:40:48,793] Trial 138 finished with value: 0.0 and parameters: {'timeframe': 'M1', 'atr_period': 13, 'atr_threshold': 3.0, 'pt_mult': 1.0, 'sl_mult': 5.0, 'td_mins': 15}. Best is trial 32 with value: 1.7165018600651565.
[I 2026-03-12 00:40:48,843] Trial 139 finished with value: 0.0 and parameters: {'timeframe': 'M1', 'atr_period': 13, 'atr_threshold': 3.0, 'pt_mult': 5.0, 'sl_mult': 0.5, 'td_mins': 1200}. Best is trial 32 with value: 1.7165018600651565.
[I 2026-03-12 00:40:48,887] Trial 140 finished with value: 0.0 and parameters: {'timeframe': 'M1', 'atr_period': 13, 'atr_threshold': 15.0, 'pt_mult': 2.5, 'sl_mult': 2.5, 'td_mins': 120}. Best is trial 32 with value: 1.7165018600651565.
[I 2026-03-12 00:40:48,932] Trial 141 finished with value: 0.0 and parameters: {'timeframe': 'M1', 'atr_period': 13, 'atr_threshold': 5.0, 'pt_mult': 1.0, 'sl_mult': 5.0, 'td_mins': 5}. Best is trial 32 with value: 1.7165018600651565.
[I 2026-03-12 00:40:48,977] Trial 142 finished with value: 0.0 and parameters: {'timeframe': 'M1', 'atr_period': 13, 'atr_threshold': 3.0, 'pt_mult': 2.5, 'sl_mult': 0.5, 'td_mins': 360}. Best is trial 32 with value: 1.7165018600651565.
[I 2026-03-12 00:40:56,558] Trial 143 finished with value: 0.986126784857631 and parameters: {'timeframe': 'M1', 'atr_period': 13, 'atr_threshold': 1.0, 'pt_mult': 1.0, 'sl_mult': 5.0, 'td_mins': 1200}. Best is trial 32 with value: 1.7165018600651565.
[I 2026-03-12 00:40:57,742] Trial 144 finished with value: 1.0520817105576767 and parameters: {'timeframe': 'M1', 'atr_period': 13, 'atr_threshold': 0.5, 'pt_mult': 1.0, 'sl_mult': 0.5, 'td_mins': 60}. Best is trial 32 with value: 1.7165018600651565.
[I 2026-03-12 00:40:57,797] Trial 145 finished with value: 0.0 and parameters: {'timeframe': 'M1', 'atr_period': 13, 'atr_threshold': 10.0, 'pt_mult': 5.0, 'sl_mult': 1.0, 'td_mins': 1080}. Best is trial 32 with value: 1.7165018600651565.
[I 2026-03-12 00:40:57,847] Trial 146 finished with value: 0.0 and parameters: {'timeframe': 'M1', 'atr_period': 13, 'atr_threshold': 3.0, 'pt_mult': 2.5, 'sl_mult': 2.5, 'td_mins': 120}. Best is trial 32 with value: 1.7165018600651565.
[I 2026-03-12 00:40:57,896] Trial 147 finished with value: 0.0 and parameters: {'timeframe': 'M1', 'atr_period': 13, 'atr_threshold': 8.0, 'pt_mult': 0.5, 'sl_mult': 0.5, 'td_mins': 1080}. Best is trial 32 with value: 1.7165018600651565.
[I 2026-03-12 00:41:02,016] Trial 148 pruned. 
[I 2026-03-12 00:41:04,356] Trial 149 finished with value: 1.0517578273177346 and parameters: {'timeframe': 'M1', 'atr_period': 13, 'atr_threshold': 1.0, 'pt_mult': 1.0, 'sl_mult': 0.5, 'td_mins': 1080}. Best is trial 32 with value: 1.7165018600651565.
[I 2026-03-12 00:41:04,401] Trial 150 finished with value: 0.0 and parameters: {'timeframe': 'M1', 'atr_period': 13, 'atr_threshold': 5.0, 'pt_mult': 2.5, 'sl_mult': 2.5, 'td_mins': 1200}. Best is trial 32 with value: 1.7165018600651565.
[I 2026-03-12 00:41:04,479] Trial 151 pruned. 
[I 2026-03-12 00:41:04,525] Trial 152 finished with value: 0.0 and parameters: {'timeframe': 'M1', 'atr_period': 13, 'atr_threshold': 10.0, 'pt_mult': 0.5, 'sl_mult': 0.5, 'td_mins': 30}. Best is trial 32 with value: 1.7165018600651565.
[I 2026-03-12 00:41:06,041] Trial 153 pruned. 
[I 2026-03-12 00:41:06,092] Trial 154 finished with value: 0.0 and parameters: {'timeframe': 'M1', 'atr_period': 13, 'atr_threshold': 10.0, 'pt_mult': 0.5, 'sl_mult': 1.0, 'td_mins': 1200}. Best is trial 32 with value: 1.7165018600651565.
[I 2026-03-12 00:41:06,138] Trial 155 finished with value: 0.0 and parameters: {'timeframe': 'M1', 'atr_period': 13, 'atr_threshold': 15.0, 'pt_mult': 5.0, 'sl_mult': 1.0, 'td_mins': 5}. Best is trial 32 with value: 1.7165018600651565.
[I 2026-03-12 00:41:06,224] Trial 156 finished with value: 1.7165018600651565 and parameters: {'timeframe': 'M1', 'atr_period': 13, 'atr_threshold': 2.0, 'pt_mult': 1.0, 'sl_mult': 5.0, 'td_mins': 5}. Best is trial 32 with value: 1.7165018600651565.
[I 2026-03-12 00:41:06,268] Trial 157 finished with value: 0.0 and parameters: {'timeframe': 'M1', 'atr_period': 13, 'atr_threshold': 3.0, 'pt_mult': 0.5, 'sl_mult': 0.5, 'td_mins': 1200}. Best is trial 32 with value: 1.7165018600651565.
[I 2026-03-12 00:41:06,311] Trial 158 finished with value: 0.0 and parameters: {'timeframe': 'M1', 'atr_period': 13, 'atr_threshold': 15.0, 'pt_mult': 1.0, 'sl_mult': 1.0, 'td_mins': 15}. Best is trial 32 with value: 1.7165018600651565.
[I 2026-03-12 00:41:06,354] Trial 159 finished with value: 0.0 and parameters: {'timeframe': 'M1', 'atr_period': 13, 'atr_threshold': 10.0, 'pt_mult': 1.0, 'sl_mult': 5.0, 'td_mins': 180}. Best is trial 32 with value: 1.7165018600651565.
[I 2026-03-12 00:41:06,398] Trial 160 finished with value: 0.0 and parameters: {'timeframe': 'M1', 'atr_period': 13, 'atr_threshold': 8.0, 'pt_mult': 5.0, 'sl_mult': 2.5, 'td_mins': 720}. Best is trial 32 with value: 1.7165018600651565.
[I 2026-03-12 00:41:12,534] Trial 161 finished with value: 1.0752288213217893 and parameters: {'timeframe': 'M1', 'atr_period': 13, 'atr_threshold': 0.5, 'pt_mult': 2.5, 'sl_mult': 0.5, 'td_mins': 720}. Best is trial 32 with value: 1.7165018600651565.
[I 2026-03-12 00:41:12,581] Trial 162 finished with value: 0.0 and parameters: {'timeframe': 'M1', 'atr_period': 13, 'atr_threshold': 3.0, 'pt_mult': 1.0, 'sl_mult': 2.5, 'td_mins': 30}. Best is trial 32 with value: 1.7165018600651565.
[I 2026-03-12 00:41:12,674] Trial 163 pruned. 
[I 2026-03-12 00:41:12,719] Trial 164 finished with value: 0.0 and parameters: {'timeframe': 'M1', 'atr_period': 13, 'atr_threshold': 8.0, 'pt_mult': 1.0, 'sl_mult': 5.0, 'td_mins': 15}. Best is trial 32 with value: 1.7165018600651565.
[I 2026-03-12 00:41:12,763] Trial 165 finished with value: 0.0 and parameters: {'timeframe': 'M1', 'atr_period': 13, 'atr_threshold': 8.0, 'pt_mult': 2.5, 'sl_mult': 0.5, 'td_mins': 5}. Best is trial 32 with value: 1.7165018600651565.
[I 2026-03-12 00:41:12,808] Trial 166 finished with value: 0.0 and parameters: {'timeframe': 'M1', 'atr_period': 13, 'atr_threshold': 10.0, 'pt_mult': 5.0, 'sl_mult': 5.0, 'td_mins': 15}. Best is trial 32 with value: 1.7165018600651565.
[I 2026-03-12 00:41:12,975] Trial 167 finished with value: 1.0401301669334961 and parameters: {'timeframe': 'M1', 'atr_period': 13, 'atr_threshold': 2.0, 'pt_mult': 1.0, 'sl_mult': 0.5, 'td_mins': 60}. Best is trial 32 with value: 1.7165018600651565.
[I 2026-03-12 00:41:13,019] Trial 168 finished with value: 0.0 and parameters: {'timeframe': 'M1', 'atr_period': 13, 'atr_threshold': 3.0, 'pt_mult': 1.0, 'sl_mult': 1.0, 'td_mins': 120}. Best is trial 32 with value: 1.7165018600651565.
[I 2026-03-12 00:41:13,347] Trial 169 pruned. 
[I 2026-03-12 00:41:13,806] Trial 170 finished with value: 0.9343482070422768 and parameters: {'timeframe': 'M1', 'atr_period': 13, 'atr_threshold': 2.0, 'pt_mult': 0.5, 'sl_mult': 5.0, 'td_mins': 180}. Best is trial 32 with value: 1.7165018600651565.
[I 2026-03-12 00:41:14,543] Trial 171 finished with value: 1.0707479869008742 and parameters: {'timeframe': 'M1', 'atr_period': 13, 'atr_threshold': 1.0, 'pt_mult': 2.5, 'sl_mult': 5.0, 'td_mins': 30}. Best is trial 32 with value: 1.7165018600651565.
[I 2026-03-12 00:41:17,376] Trial 172 pruned. 
[I 2026-03-12 00:41:17,683] Trial 173 finished with value: 1.094956881706024 and parameters: {'timeframe': 'M1', 'atr_period': 13, 'atr_threshold': 2.0, 'pt_mult': 2.5, 'sl_mult': 0.5, 'td_mins': 120}. Best is trial 32 with value: 1.7165018600651565.
[I 2026-03-12 00:41:17,727] Trial 174 finished with value: 0.0 and parameters: {'timeframe': 'M1', 'atr_period': 13, 'atr_threshold': 5.0, 'pt_mult': 1.0, 'sl_mult': 5.0, 'td_mins': 15}. Best is trial 32 with value: 1.7165018600651565.
[I 2026-03-12 00:41:26,101] Trial 175 finished with value: 1.0752288213217893 and parameters: {'timeframe': 'M1', 'atr_period': 13, 'atr_threshold': 0.5, 'pt_mult': 2.5, 'sl_mult': 0.5, 'td_mins': 1080}. Best is trial 32 with value: 1.7165018600651565.
[I 2026-03-12 00:41:26,150] Trial 176 finished with value: 0.0 and parameters: {'timeframe': 'M1', 'atr_period': 13, 'atr_threshold': 15.0, 'pt_mult': 2.5, 'sl_mult': 2.5, 'td_mins': 5}. Best is trial 32 with value: 1.7165018600651565.
[I 2026-03-12 00:41:26,201] Trial 177 finished with value: 0.0 and parameters: {'timeframe': 'M1', 'atr_period': 13, 'atr_threshold': 5.0, 'pt_mult': 2.5, 'sl_mult': 2.5, 'td_mins': 360}. Best is trial 32 with value: 1.7165018600651565.
[I 2026-03-12 00:41:27,648] Trial 178 pruned. 
[I 2026-03-12 00:41:27,738] Trial 179 pruned. 
[I 2026-03-12 00:41:27,784] Trial 180 finished with value: 0.0 and parameters: {'timeframe': 'M1', 'atr_period': 13, 'atr_threshold': 3.0, 'pt_mult': 2.5, 'sl_mult': 0.5, 'td_mins': 180}. Best is trial 32 with value: 1.7165018600651565.
[I 2026-03-12 00:41:27,886] Trial 181 pruned. 
[I 2026-03-12 00:41:27,931] Trial 182 finished with value: 0.0 and parameters: {'timeframe': 'M1', 'atr_period': 13, 'atr_threshold': 3.0, 'pt_mult': 0.5, 'sl_mult': 5.0, 'td_mins': 180}. Best is trial 32 with value: 1.7165018600651565.
[I 2026-03-12 00:41:27,975] Trial 183 finished with value: 0.0 and parameters: {'timeframe': 'M1', 'atr_period': 13, 'atr_threshold': 10.0, 'pt_mult': 1.0, 'sl_mult': 0.5, 'td_mins': 1200}. Best is trial 32 with value: 1.7165018600651565.
[I 2026-03-12 00:41:28,456] Trial 184 finished with value: 1.0229777042978287 and parameters: {'timeframe': 'M1', 'atr_period': 13, 'atr_threshold': 2.0, 'pt_mult': 2.5, 'sl_mult': 2.5, 'td_mins': 180}. Best is trial 32 with value: 1.7165018600651565.
[I 2026-03-12 00:41:28,502] Trial 185 finished with value: 0.0 and parameters: {'timeframe': 'M1', 'atr_period': 13, 'atr_threshold': 5.0, 'pt_mult': 1.0, 'sl_mult': 5.0, 'td_mins': 1080}. Best is trial 32 with value: 1.7165018600651565.
[I 2026-03-12 00:41:33,151] Trial 186 finished with value: 1.052586556808255 and parameters: {'timeframe': 'M1', 'atr_period': 13, 'atr_threshold': 0.5, 'pt_mult': 1.0, 'sl_mult': 0.5, 'td_mins': 1200}. Best is trial 32 with value: 1.7165018600651565.
[I 2026-03-12 00:41:33,200] Trial 187 finished with value: 0.0 and parameters: {'timeframe': 'M1', 'atr_period': 13, 'atr_threshold': 5.0, 'pt_mult': 0.5, 'sl_mult': 1.0, 'td_mins': 1200}. Best is trial 32 with value: 1.7165018600651565.
[I 2026-03-12 00:41:33,249] Trial 188 finished with value: 0.0 and parameters: {'timeframe': 'M1', 'atr_period': 13, 'atr_threshold': 8.0, 'pt_mult': 5.0, 'sl_mult': 0.5, 'td_mins': 5}. Best is trial 32 with value: 1.7165018600651565.
[I 2026-03-12 00:41:33,295] Trial 189 finished with value: 0.0 and parameters: {'timeframe': 'M1', 'atr_period': 13, 'atr_threshold': 15.0, 'pt_mult': 0.5, 'sl_mult': 1.0, 'td_mins': 180}. Best is trial 32 with value: 1.7165018600651565.
[I 2026-03-12 00:41:34,303] Trial 190 pruned. 
[I 2026-03-12 00:41:34,353] Trial 191 finished with value: 0.0 and parameters: {'timeframe': 'M1', 'atr_period': 13, 'atr_threshold': 8.0, 'pt_mult': 2.5, 'sl_mult': 5.0, 'td_mins': 120}. Best is trial 32 with value: 1.7165018600651565.
[I 2026-03-12 00:41:34,407] Trial 192 finished with value: 0.0 and parameters: {'timeframe': 'M1', 'atr_period': 13, 'atr_threshold': 10.0, 'pt_mult': 5.0, 'sl_mult': 1.0, 'td_mins': 180}. Best is trial 32 with value: 1.7165018600651565.
[I 2026-03-12 00:41:34,450] Trial 193 finished with value: 0.0 and parameters: {'timeframe': 'M1', 'atr_period': 13, 'atr_threshold': 3.0, 'pt_mult': 5.0, 'sl_mult': 5.0, 'td_mins': 720}. Best is trial 32 with value: 1.7165018600651565.
[I 2026-03-12 00:41:36,043] Trial 194 pruned. 
[I 2026-03-12 00:41:36,092] Trial 195 finished with value: 0.0 and parameters: {'timeframe': 'M1', 'atr_period': 13, 'atr_threshold': 10.0, 'pt_mult': 0.5, 'sl_mult': 5.0, 'td_mins': 120}. Best is trial 32 with value: 1.7165018600651565.
[I 2026-03-12 00:41:36,140] Trial 196 finished with value: 0.0 and parameters: {'timeframe': 'M1', 'atr_period': 13, 'atr_threshold': 10.0, 'pt_mult': 5.0, 'sl_mult': 5.0, 'td_mins': 15}. Best is trial 32 with value: 1.7165018600651565.
[I 2026-03-12 00:41:36,185] Trial 197 finished with value: 0.0 and parameters: {'timeframe': 'M1', 'atr_period': 13, 'atr_threshold': 3.0, 'pt_mult': 0.5, 'sl_mult': 0.5, 'td_mins': 5}. Best is trial 32 with value: 1.7165018600651565.
[I 2026-03-12 00:41:36,231] Trial 198 finished with value: 0.0 and parameters: {'timeframe': 'M1', 'atr_period': 13, 'atr_threshold': 15.0, 'pt_mult': 0.5, 'sl_mult': 5.0, 'td_mins': 120}. Best is trial 32 with value: 1.7165018600651565.
[I 2026-03-12 00:41:36,874] Trial 199 pruned. 
[I 2026-03-12 00:41:36,923] Trial 200 finished with value: 0.0 and parameters: {'timeframe': 'M1', 'atr_period': 13, 'atr_threshold': 3.0, 'pt_mult': 1.0, 'sl_mult': 2.5, 'td_mins': 1200}. Best is trial 32 with value: 1.7165018600651565.
[I 2026-03-12 00:41:36,968] Trial 201 finished with value: 0.0 and parameters: {'timeframe': 'M1', 'atr_period': 13, 'atr_threshold': 5.0, 'pt_mult': 0.5, 'sl_mult': 2.5, 'td_mins': 360}. Best is trial 32 with value: 1.7165018600651565.
[I 2026-03-12 00:41:37,010] Trial 202 finished with value: 0.0 and parameters: {'timeframe': 'M1', 'atr_period': 13, 'atr_threshold': 10.0, 'pt_mult': 1.0, 'sl_mult': 5.0, 'td_mins': 1080}. Best is trial 32 with value: 1.7165018600651565.
[I 2026-03-12 00:41:37,054] Trial 203 finished with value: 0.0 and parameters: {'timeframe': 'M1', 'atr_period': 13, 'atr_threshold': 3.0, 'pt_mult': 5.0, 'sl_mult': 0.5, 'td_mins': 120}. Best is trial 32 with value: 1.7165018600651565.
