[I 2026-03-12 01:33:13,050] Trial 390 finished with value: 2.318948203404773 and parameters: {'timeframe': 'M1', 'atr_period': 13, 'atr_threshold': 2.0, 'pt_mult': 0.5, 'sl_mult': 5.0, 'td_mins': 5}. Best is trial 337 with value: 2.318948203404773.
[I 2026-03-12 01:33:13,138] Trial 391 finished with value: 2.318948203404773 and parameters: {'timeframe': 'M1', 'atr_period': 13, 'atr_threshold': 2.0, 'pt_mult': 0.5, 'sl_mult': 5.0, 'td_mins': 5}. Best is trial 337 with value: 2.318948203404773.
[I 2026-03-12 01:33:13,232] Trial 392 finished with value: 2.318948203404773 and parameters: {'timeframe': 'M1', 'atr_period': 13, 'atr_threshold': 2.0, 'pt_mult': 0.5, 'sl_mult': 5.0, 'td_mins': 5}. Best is trial 337 with value: 2.318948203404773.
[I 2026-03-12 01:33:13,329] Trial 393 finished with value: 2.318948203404773 and parameters: {'timeframe': 'M1', 'atr_period': 13, 'atr_threshold': 2.0, 'pt_mult': 0.5, 'sl_mult': 5.0, 'td_mins': 5}. Best is trial 337 with value: 2.318948203404773.
[I 2026-03-12 01:33:13,418] Trial 394 finished with value: 2.318948203404773 and parameters: {'timeframe': 'M1', 'atr_period': 13, 'atr_threshold': 2.0, 'pt_mult': 0.5, 'sl_mult': 5.0, 'td_mins': 5}. Best is trial 337 with value: 2.318948203404773.
[I 2026-03-12 01:33:13,503] Trial 395 finished with value: 2.318948203404773 and parameters: {'timeframe': 'M1', 'atr_period': 13, 'atr_threshold': 2.0, 'pt_mult': 0.5, 'sl_mult': 5.0, 'td_mins': 5}. Best is trial 337 with value: 2.318948203404773.
[I 2026-03-12 01:33:13,592] Trial 396 finished with value: 2.318948203404773 and parameters: {'timeframe': 'M1', 'atr_period': 13, 'atr_threshold': 2.0, 'pt_mult': 0.5, 'sl_mult': 5.0, 'td_mins': 5}. Best is trial 337 with value: 2.318948203404773.
[I 2026-03-12 01:33:13,680] Trial 397 finished with value: 2.318948203404773 and parameters: {'timeframe': 'M1', 'atr_period': 13, 'atr_threshold': 2.0, 'pt_mult': 0.5, 'sl_mult': 5.0, 'td_mins': 5}. Best is trial 337 with value: 2.318948203404773.
[I 2026-03-12 01:33:13,767] Trial 398 finished with value: 2.318948203404773 and parameters: {'timeframe': 'M1', 'atr_period': 13, 'atr_threshold': 2.0, 'pt_mult': 0.5, 'sl_mult': 5.0, 'td_mins': 5}. Best is trial 337 with value: 2.318948203404773.
[I 2026-03-12 01:33:13,859] Trial 399 finished with value: 2.318948203404773 and parameters: {'timeframe': 'M1', 'atr_period': 13, 'atr_threshold': 2.0, 'pt_mult': 0.5, 'sl_mult': 5.0, 'td_mins': 5}. Best is trial 337 with value: 2.318948203404773.
[I 2026-03-12 01:33:13,945] Trial 400 finished with value: 2.318948203404773 and parameters: {'timeframe': 'M1', 'atr_period': 13, 'atr_threshold': 2.0, 'pt_mult': 0.5, 'sl_mult': 5.0, 'td_mins': 5}. Best is trial 337 with value: 2.318948203404773.
[I 2026-03-12 01:33:14,032] Trial 401 finished with value: 2.318948203404773 and parameters: {'timeframe': 'M1', 'atr_period': 13, 'atr_threshold': 2.0, 'pt_mult': 0.5, 'sl_mult': 5.0, 'td_mins': 5}. Best is trial 337 with value: 2.318948203404773.
[I 2026-03-12 01:33:14,080] Trial 402 finished with value: 0.0 and parameters: {'timeframe': 'M1', 'atr_period': 13, 'atr_threshold': 10.0, 'pt_mult': 0.5, 'sl_mult': 5.0, 'td_mins': 5}. Best is trial 337 with value: 2.318948203404773.
[I 2026-03-12 01:33:14,130] Trial 403 pruned. 
[I 2026-03-12 01:33:14,206] Trial 404 pruned. 
[I 2026-03-12 01:33:14,257] Trial 405 pruned. 
[I 2026-03-12 01:33:14,305] Trial 406 finished with value: 0.0 and parameters: {'timeframe': 'M1', 'atr_period': 13, 'atr_threshold': 5.0, 'pt_mult': 0.5, 'sl_mult': 5.0, 'td_mins': 5}. Best is trial 337 with value: 2.318948203404773.
[I 2026-03-12 01:33:14,357] Trial 407 pruned. 
[I 2026-03-12 01:33:14,405] Trial 408 finished with value: 0.0 and parameters: {'timeframe': 'M1', 'atr_period': 13, 'atr_threshold': 3.0, 'pt_mult': 0.5, 'sl_mult': 5.0, 'td_mins': 5}. Best is trial 337 with value: 2.318948203404773.
[I 2026-03-12 01:33:14,455] Trial 409 finished with value: 0.0 and parameters: {'timeframe': 'M1', 'atr_period': 13, 'atr_threshold': 8.0, 'pt_mult': 0.5, 'sl_mult': 5.0, 'td_mins': 5}. Best is trial 337 with value: 2.318948203404773.
[I 2026-03-12 01:33:14,606] Trial 410 pruned. 
[I 2026-03-12 01:33:14,698] Trial 411 finished with value: 2.318948203404773 and parameters: {'timeframe': 'M1', 'atr_period': 13, 'atr_threshold': 2.0, 'pt_mult': 0.5, 'sl_mult': 5.0, 'td_mins': 5}. Best is trial 337 with value: 2.318948203404773.
[I 2026-03-12 01:33:14,784] Trial 412 finished with value: 2.318948203404773 and parameters: {'timeframe': 'M1', 'atr_period': 13, 'atr_threshold': 2.0, 'pt_mult': 0.5, 'sl_mult': 5.0, 'td_mins': 5}. Best is trial 337 with value: 2.318948203404773.
[I 2026-03-12 01:33:14,837] Trial 413 pruned. 
[I 2026-03-12 01:33:14,890] Trial 414 pruned. 
[I 2026-03-12 01:33:14,979] Trial 415 finished with value: 2.318948203404773 and parameters: {'timeframe': 'M1', 'atr_period': 13, 'atr_threshold': 2.0, 'pt_mult': 0.5, 'sl_mult': 5.0, 'td_mins': 5}. Best is trial 337 with value: 2.318948203404773.
[I 2026-03-12 01:33:15,065] Trial 416 finished with value: 2.318948203404773 and parameters: {'timeframe': 'M1', 'atr_period': 13, 'atr_threshold': 2.0, 'pt_mult': 0.5, 'sl_mult': 5.0, 'td_mins': 5}. Best is trial 337 with value: 2.318948203404773.
[I 2026-03-12 01:33:15,157] Trial 417 finished with value: 2.318948203404773 and parameters: {'timeframe': 'M1', 'atr_period': 13, 'atr_threshold': 2.0, 'pt_mult': 0.5, 'sl_mult': 5.0, 'td_mins': 5}. Best is trial 337 with value: 2.318948203404773.
[I 2026-03-12 01:33:15,255] Trial 418 pruned. 
[I 2026-03-12 01:33:15,345] Trial 419 finished with value: 2.318948203404773 and parameters: {'timeframe': 'M1', 'atr_period': 13, 'atr_threshold': 2.0, 'pt_mult': 0.5, 'sl_mult': 5.0, 'td_mins': 5}. Best is trial 337 with value: 2.318948203404773.
[I 2026-03-12 01:33:15,433] Trial 420 finished with value: 2.318948203404773 and parameters: {'timeframe': 'M1', 'atr_period': 13, 'atr_threshold': 2.0, 'pt_mult': 0.5, 'sl_mult': 5.0, 'td_mins': 5}. Best is trial 337 with value: 2.318948203404773.
[I 2026-03-12 01:33:15,525] Trial 421 pruned. 
[I 2026-03-12 01:33:15,616] Trial 422 finished with value: 2.318948203404773 and parameters: {'timeframe': 'M1', 'atr_period': 13, 'atr_threshold': 2.0, 'pt_mult': 0.5, 'sl_mult': 5.0, 'td_mins': 5}. Best is trial 337 with value: 2.318948203404773.
[I 2026-03-12 01:33:15,703] Trial 423 finished with value: 2.318948203404773 and parameters: {'timeframe': 'M1', 'atr_period': 13, 'atr_threshold': 2.0, 'pt_mult': 0.5, 'sl_mult': 5.0, 'td_mins': 5}. Best is trial 337 with value: 2.318948203404773.
[I 2026-03-12 01:33:15,783] Trial 424 pruned. 
[I 2026-03-12 01:33:15,858] Trial 425 pruned. 
[I 2026-03-12 01:33:15,905] Trial 426 finished with value: 0.0 and parameters: {'timeframe': 'M1', 'atr_period': 13, 'atr_threshold': 8.0, 'pt_mult': 0.5, 'sl_mult': 1.0, 'td_mins': 5}. Best is trial 337 with value: 2.318948203404773.
[I 2026-03-12 01:33:15,952] Trial 427 finished with value: 0.0 and parameters: {'timeframe': 'M1', 'atr_period': 13, 'atr_threshold': 15.0, 'pt_mult': 0.5, 'sl_mult': 5.0, 'td_mins': 180}. Best is trial 337 with value: 2.318948203404773.
[I 2026-03-12 01:33:15,999] Trial 428 finished with value: 0.0 and parameters: {'timeframe': 'M1', 'atr_period': 13, 'atr_threshold': 5.0, 'pt_mult': 0.5, 'sl_mult': 2.5, 'td_mins': 5}. Best is trial 337 with value: 2.318948203404773.
[I 2026-03-12 01:33:16,071] Trial 429 pruned. 
[I 2026-03-12 01:33:16,122] Trial 430 finished with value: 0.0 and parameters: {'timeframe': 'M1', 'atr_period': 13, 'atr_threshold': 8.0, 'pt_mult': 0.5, 'sl_mult': 5.0, 'td_mins': 720}. Best is trial 337 with value: 2.318948203404773.
[I 2026-03-12 01:33:16,914] Trial 431 pruned. 
[I 2026-03-12 01:33:17,013] Trial 432 finished with value: 2.318948203404773 and parameters: {'timeframe': 'M1', 'atr_period': 13, 'atr_threshold': 2.0, 'pt_mult': 0.5, 'sl_mult': 5.0, 'td_mins': 5}. Best is trial 337 with value: 2.318948203404773.
[I 2026-03-12 01:33:17,061] Trial 433 finished with value: 0.0 and parameters: {'timeframe': 'M1', 'atr_period': 13, 'atr_threshold': 3.0, 'pt_mult': 0.5, 'sl_mult': 5.0, 'td_mins': 1080}. Best is trial 337 with value: 2.318948203404773.
[I 2026-03-12 01:33:17,150] Trial 434 finished with value: 2.318948203404773 and parameters: {'timeframe': 'M1', 'atr_period': 13, 'atr_threshold': 2.0, 'pt_mult': 0.5, 'sl_mult': 5.0, 'td_mins': 5}. Best is trial 337 with value: 2.318948203404773.
[I 2026-03-12 01:33:17,239] Trial 435 finished with value: 2.318948203404773 and parameters: {'timeframe': 'M1', 'atr_period': 13, 'atr_threshold': 2.0, 'pt_mult': 0.5, 'sl_mult': 5.0, 'td_mins': 5}. Best is trial 337 with value: 2.318948203404773.
[I 2026-03-12 01:33:17,293] Trial 436 finished with value: 0.0 and parameters: {'timeframe': 'M1', 'atr_period': 13, 'atr_threshold': 15.0, 'pt_mult': 0.5, 'sl_mult': 5.0, 'td_mins': 1200}. Best is trial 337 with value: 2.318948203404773.
[I 2026-03-12 01:33:17,404] Trial 437 finished with value: 2.318948203404773 and parameters: {'timeframe': 'M1', 'atr_period': 13, 'atr_threshold': 2.0, 'pt_mult': 0.5, 'sl_mult': 5.0, 'td_mins': 5}. Best is trial 337 with value: 2.318948203404773.
[I 2026-03-12 01:33:17,576] Trial 438 pruned. 
[I 2026-03-12 01:33:17,628] Trial 439 finished with value: 0.0 and parameters: {'timeframe': 'M1', 'atr_period': 13, 'atr_threshold': 10.0, 'pt_mult': 0.5, 'sl_mult': 5.0, 'td_mins': 60}. Best is trial 337 with value: 2.318948203404773.
[I 2026-03-12 01:33:17,723] Trial 440 pruned. 
[I 2026-03-12 01:33:17,813] Trial 441 finished with value: 2.318948203404773 and parameters: {'timeframe': 'M1', 'atr_period': 13, 'atr_threshold': 2.0, 'pt_mult': 0.5, 'sl_mult': 5.0, 'td_mins': 5}. Best is trial 337 with value: 2.318948203404773.
[I 2026-03-12 01:33:17,884] Trial 442 pruned. 
[I 2026-03-12 01:33:17,932] Trial 443 finished with value: 0.0 and parameters: {'timeframe': 'M1', 'atr_period': 13, 'atr_threshold': 3.0, 'pt_mult': 0.5, 'sl_mult': 5.0, 'td_mins': 1200}. Best is trial 337 with value: 2.318948203404773.
[I 2026-03-12 01:33:18,063] Trial 444 pruned. 
[I 2026-03-12 01:33:18,111] Trial 445 finished with value: 0.0 and parameters: {'timeframe': 'M1', 'atr_period': 13, 'atr_threshold': 5.0, 'pt_mult': 0.5, 'sl_mult': 0.5, 'td_mins': 1080}. Best is trial 337 with value: 2.318948203404773.
[I 2026-03-12 01:33:18,197] Trial 446 finished with value: 2.318948203404773 and parameters: {'timeframe': 'M1', 'atr_period': 13, 'atr_threshold': 2.0, 'pt_mult': 0.5, 'sl_mult': 5.0, 'td_mins': 5}. Best is trial 337 with value: 2.318948203404773.
[I 2026-03-12 01:33:18,260] Trial 447 pruned. 
[I 2026-03-12 01:33:18,537] Trial 448 pruned. 
[I 2026-03-12 01:33:18,698] Trial 449 pruned. 
[I 2026-03-12 01:33:18,747] Trial 450 finished with value: 0.0 and parameters: {'timeframe': 'M1', 'atr_period': 13, 'atr_threshold': 3.0, 'pt_mult': 2.5, 'sl_mult': 5.0, 'td_mins': 5}. Best is trial 337 with value: 2.318948203404773.
[I 2026-03-12 01:33:18,837] Trial 451 finished with value: 2.318948203404773 and parameters: {'timeframe': 'M1', 'atr_period': 13, 'atr_threshold': 2.0, 'pt_mult': 0.5, 'sl_mult': 5.0, 'td_mins': 5}. Best is trial 337 with value: 2.318948203404773.
[I 2026-03-12 01:33:18,932] Trial 452 finished with value: 2.318948203404773 and parameters: {'timeframe': 'M1', 'atr_period': 13, 'atr_threshold': 2.0, 'pt_mult': 0.5, 'sl_mult': 5.0, 'td_mins': 5}. Best is trial 337 with value: 2.318948203404773.
[I 2026-03-12 01:33:19,021] Trial 453 finished with value: 2.318948203404773 and parameters: {'timeframe': 'M1', 'atr_period': 13, 'atr_threshold': 2.0, 'pt_mult': 0.5, 'sl_mult': 5.0, 'td_mins': 5}. Best is trial 337 with value: 2.318948203404773.
[I 2026-03-12 01:33:19,109] Trial 454 finished with value: 2.318948203404773 and parameters: {'timeframe': 'M1', 'atr_period': 13, 'atr_threshold': 2.0, 'pt_mult': 0.5, 'sl_mult': 5.0, 'td_mins': 5}. Best is trial 337 with value: 2.318948203404773.
[I 2026-03-12 01:33:19,197] Trial 455 finished with value: 2.318948203404773 and parameters: {'timeframe': 'M1', 'atr_period': 13, 'atr_threshold': 2.0, 'pt_mult': 0.5, 'sl_mult': 5.0, 'td_mins': 5}. Best is trial 337 with value: 2.318948203404773.
[I 2026-03-12 01:33:19,248] Trial 456 finished with value: 0.0 and parameters: {'timeframe': 'M1', 'atr_period': 13, 'atr_threshold': 15.0, 'pt_mult': 0.5, 'sl_mult': 5.0, 'td_mins': 1080}. Best is trial 337 with value: 2.318948203404773.
[I 2026-03-12 01:33:19,298] Trial 457 finished with value: 0.0 and parameters: {'timeframe': 'M1', 'atr_period': 13, 'atr_threshold': 8.0, 'pt_mult': 5.0, 'sl_mult': 5.0, 'td_mins': 5}. Best is trial 337 with value: 2.318948203404773.
[I 2026-03-12 01:33:19,347] Trial 458 finished with value: 0.0 and parameters: {'timeframe': 'M1', 'atr_period': 13, 'atr_threshold': 10.0, 'pt_mult': 5.0, 'sl_mult': 5.0, 'td_mins': 5}. Best is trial 337 with value: 2.318948203404773.
[I 2026-03-12 01:33:19,490] Trial 459 pruned. 
[I 2026-03-12 01:33:19,540] Trial 460 finished with value: 0.0 and parameters: {'timeframe': 'M1', 'atr_period': 13, 'atr_threshold': 8.0, 'pt_mult': 0.5, 'sl_mult': 5.0, 'td_mins': 60}. Best is trial 337 with value: 2.318948203404773.
[I 2026-03-12 01:33:19,592] Trial 461 pruned. 
[I 2026-03-12 01:33:19,644] Trial 462 pruned. 
[I 2026-03-12 01:33:19,692] Trial 463 finished with value: 0.0 and parameters: {'timeframe': 'M1', 'atr_period': 13, 'atr_threshold': 5.0, 'pt_mult': 0.5, 'sl_mult': 5.0, 'td_mins': 720}. Best is trial 337 with value: 2.318948203404773.
[I 2026-03-12 01:33:19,755] Trial 464 pruned. 
[I 2026-03-12 01:33:19,911] Trial 465 pruned. 
[I 2026-03-12 01:33:20,002] Trial 466 finished with value: 2.318948203404773 and parameters: {'timeframe': 'M1', 'atr_period': 13, 'atr_threshold': 2.0, 'pt_mult': 0.5, 'sl_mult': 5.0, 'td_mins': 5}. Best is trial 337 with value: 2.318948203404773.
[I 2026-03-12 01:33:20,051] Trial 467 finished with value: 0.0 and parameters: {'timeframe': 'M1', 'atr_period': 13, 'atr_threshold': 5.0, 'pt_mult': 0.5, 'sl_mult': 1.0, 'td_mins': 5}. Best is trial 337 with value: 2.318948203404773.
[I 2026-03-12 01:33:20,150] Trial 468 pruned. 
[I 2026-03-12 01:33:20,203] Trial 469 pruned. 
[I 2026-03-12 01:33:20,545] Trial 470 pruned. 
[I 2026-03-12 01:33:20,626] Trial 471 pruned. 
[I 2026-03-12 01:33:20,676] Trial 472 finished with value: 0.0 and parameters: {'timeframe': 'M1', 'atr_period': 13, 'atr_threshold': 10.0, 'pt_mult': 0.5, 'sl_mult': 5.0, 'td_mins': 120}. Best is trial 337 with value: 2.318948203404773.
[I 2026-03-12 01:33:20,726] Trial 473 finished with value: 0.0 and parameters: {'timeframe': 'M1', 'atr_period': 13, 'atr_threshold': 3.0, 'pt_mult': 0.5, 'sl_mult': 5.0, 'td_mins': 30}. Best is trial 337 with value: 2.318948203404773.
[I 2026-03-12 01:33:20,806] Trial 474 pruned. 
[I 2026-03-12 01:33:20,854] Trial 475 finished with value: 0.0 and parameters: {'timeframe': 'M1', 'atr_period': 13, 'atr_threshold': 15.0, 'pt_mult': 0.5, 'sl_mult': 5.0, 'td_mins': 720}. Best is trial 337 with value: 2.318948203404773.
[I 2026-03-12 01:33:20,905] Trial 476 pruned. 
[I 2026-03-12 01:33:20,955] Trial 477 finished with value: 0.0 and parameters: {'timeframe': 'M1', 'atr_period': 13, 'atr_threshold': 5.0, 'pt_mult': 0.5, 'sl_mult': 5.0, 'td_mins': 120}. Best is trial 337 with value: 2.318948203404773.
[I 2026-03-12 01:33:23,569] Trial 478 pruned. 
[I 2026-03-12 01:33:23,624] Trial 479 finished with value: 0.0 and parameters: {'timeframe': 'M1', 'atr_period': 13, 'atr_threshold': 3.0, 'pt_mult': 0.5, 'sl_mult': 2.5, 'td_mins': 5}. Best is trial 337 with value: 2.318948203404773.
[I 2026-03-12 01:33:23,680] Trial 480 finished with value: 0.0 and parameters: {'timeframe': 'M1', 'atr_period': 13, 'atr_threshold': 5.0, 'pt_mult': 2.5, 'sl_mult': 5.0, 'td_mins': 5}. Best is trial 337 with value: 2.318948203404773.
[I 2026-03-12 01:33:23,758] Trial 481 pruned. 
[I 2026-03-12 01:33:23,844] Trial 482 pruned. 
[I 2026-03-12 01:33:23,891] Trial 483 finished with value: 0.0 and parameters: {'timeframe': 'M1', 'atr_period': 13, 'atr_threshold': 3.0, 'pt_mult': 0.5, 'sl_mult': 5.0, 'td_mins': 60}. Best is trial 337 with value: 2.318948203404773.
[I 2026-03-12 01:33:23,941] Trial 484 finished with value: 0.0 and parameters: {'timeframe': 'M1', 'atr_period': 13, 'atr_threshold': 15.0, 'pt_mult': 0.5, 'sl_mult': 1.0, 'td_mins': 5}. Best is trial 337 with value: 2.318948203404773.
[I 2026-03-12 01:33:24,031] Trial 485 finished with value: 2.318948203404773 and parameters: {'timeframe': 'M1', 'atr_period': 13, 'atr_threshold': 2.0, 'pt_mult': 0.5, 'sl_mult': 5.0, 'td_mins': 5}. Best is trial 337 with value: 2.318948203404773.
[I 2026-03-12 01:33:24,078] Trial 486 finished with value: 0.0 and parameters: {'timeframe': 'M1', 'atr_period': 13, 'atr_threshold': 10.0, 'pt_mult': 0.5, 'sl_mult': 2.5, 'td_mins': 5}. Best is trial 337 with value: 2.318948203404773.
[I 2026-03-12 01:33:24,128] Trial 487 finished with value: 0.0 and parameters: {'timeframe': 'M1', 'atr_period': 13, 'atr_threshold': 3.0, 'pt_mult': 0.5, 'sl_mult': 5.0, 'td_mins': 120}. Best is trial 337 with value: 2.318948203404773.
[I 2026-03-12 01:33:24,187] Trial 488 finished with value: 0.0 and parameters: {'timeframe': 'M1', 'atr_period': 13, 'atr_threshold': 8.0, 'pt_mult': 0.5, 'sl_mult': 5.0, 'td_mins': 120}. Best is trial 337 with value: 2.318948203404773.
[I 2026-03-12 01:33:24,306] Trial 489 finished with value: 2.318948203404773 and parameters: {'timeframe': 'M1', 'atr_period': 13, 'atr_threshold': 2.0, 'pt_mult': 0.5, 'sl_mult': 5.0, 'td_mins': 5}. Best is trial 337 with value: 2.318948203404773.
[I 2026-03-12 01:33:24,389] Trial 490 pruned. 
[I 2026-03-12 01:33:24,438] Trial 491 finished with value: 0.0 and parameters: {'timeframe': 'M1', 'atr_period': 13, 'atr_threshold': 15.0, 'pt_mult': 2.5, 'sl_mult': 5.0, 'td_mins': 5}. Best is trial 337 with value: 2.318948203404773.
[I 2026-03-12 01:33:24,529] Trial 492 finished with value: 2.318948203404773 and parameters: {'timeframe': 'M1', 'atr_period': 13, 'atr_threshold': 2.0, 'pt_mult': 0.5, 'sl_mult': 5.0, 'td_mins': 5}. Best is trial 337 with value: 2.318948203404773.
[I 2026-03-12 01:33:24,620] Trial 493 finished with value: 2.318948203404773 and parameters: {'timeframe': 'M1', 'atr_period': 13, 'atr_threshold': 2.0, 'pt_mult': 0.5, 'sl_mult': 5.0, 'td_mins': 5}. Best is trial 337 with value: 2.318948203404773.
[I 2026-03-12 01:33:24,709] Trial 494 finished with value: 2.318948203404773 and parameters: {'timeframe': 'M1', 'atr_period': 13, 'atr_threshold': 2.0, 'pt_mult': 0.5, 'sl_mult': 5.0, 'td_mins': 5}. Best is trial 337 with value: 2.318948203404773.
[I 2026-03-12 01:33:24,758] Trial 495 finished with value: 0.0 and parameters: {'timeframe': 'M1', 'atr_period': 13, 'atr_threshold': 10.0, 'pt_mult': 0.5, 'sl_mult': 5.0, 'td_mins': 5}. Best is trial 337 with value: 2.318948203404773.
[I 2026-03-12 01:33:24,810] Trial 496 pruned. 
[I 2026-03-12 01:33:24,857] Trial 497 finished with value: 0.0 and parameters: {'timeframe': 'M1', 'atr_period': 13, 'atr_threshold': 10.0, 'pt_mult': 0.5, 'sl_mult': 0.5, 'td_mins': 5}. Best is trial 337 with value: 2.318948203404773.
[I 2026-03-12 01:33:24,913] Trial 498 pruned. 
[I 2026-03-12 01:33:24,960] Trial 499 finished with value: 0.0 and parameters: {'timeframe': 'M1', 'atr_period': 13, 'atr_threshold': 10.0, 'pt_mult': 0.5, 'sl_mult': 5.0, 'td_mins': 180}. Best is trial 337 with value: 2.318948203404773.
[I 2026-03-12 01:33:25,021] Trial 500 pruned. 
[I 2026-03-12 01:33:25,077] Trial 501 pruned. 
[I 2026-03-12 01:33:25,136] Trial 502 pruned. 
[I 2026-03-12 01:33:25,185] Trial 503 finished with value: 0.0 and parameters: {'timeframe': 'M1', 'atr_period': 13, 'atr_threshold': 5.0, 'pt_mult': 0.5, 'sl_mult': 5.0, 'td_mins': 60}. Best is trial 337 with value: 2.318948203404773.
[I 2026-03-12 01:33:25,524] Trial 504 pruned. 
[I 2026-03-12 01:33:25,634] Trial 505 pruned. 
[I 2026-03-12 01:33:25,684] Trial 506 finished with value: 0.0 and parameters: {'timeframe': 'M1', 'atr_period': 13, 'atr_threshold': 8.0, 'pt_mult': 2.5, 'sl_mult': 5.0, 'td_mins': 5}. Best is trial 337 with value: 2.318948203404773.
[I 2026-03-12 01:33:25,733] Trial 507 finished with value: 0.0 and parameters: {'timeframe': 'M1', 'atr_period': 13, 'atr_threshold': 15.0, 'pt_mult': 0.5, 'sl_mult': 5.0, 'td_mins': 5}. Best is trial 337 with value: 2.318948203404773.
[I 2026-03-12 01:33:25,813] Trial 508 pruned. 
[I 2026-03-12 01:33:25,860] Trial 509 finished with value: 0.0 and parameters: {'timeframe': 'M1', 'atr_period': 13, 'atr_threshold': 5.0, 'pt_mult': 0.5, 'sl_mult': 0.5, 'td_mins': 5}. Best is trial 337 with value: 2.318948203404773.
[I 2026-03-12 01:33:25,908] Trial 510 finished with value: 0.0 and parameters: {'timeframe': 'M1', 'atr_period': 13, 'atr_threshold': 5.0, 'pt_mult': 5.0, 'sl_mult': 5.0, 'td_mins': 5}. Best is trial 337 with value: 2.318948203404773.
[I 2026-03-12 01:33:25,956] Trial 511 finished with value: 0.0 and parameters: {'timeframe': 'M1', 'atr_period': 13, 'atr_threshold': 3.0, 'pt_mult': 5.0, 'sl_mult': 5.0, 'td_mins': 5}. Best is trial 337 with value: 2.318948203404773.
[I 2026-03-12 01:33:26,150] Trial 512 pruned. 
[I 2026-03-12 01:33:26,198] Trial 513 finished with value: 0.0 and parameters: {'timeframe': 'M1', 'atr_period': 13, 'atr_threshold': 3.0, 'pt_mult': 0.5, 'sl_mult': 5.0, 'td_mins': 360}. Best is trial 337 with value: 2.318948203404773.
[I 2026-03-12 01:33:26,251] Trial 514 pruned. 
[I 2026-03-12 01:33:26,344] Trial 515 finished with value: 2.318948203404773 and parameters: {'timeframe': 'M1', 'atr_period': 13, 'atr_threshold': 2.0, 'pt_mult': 0.5, 'sl_mult': 5.0, 'td_mins': 5}. Best is trial 337 with value: 2.318948203404773.
[I 2026-03-12 01:33:26,391] Trial 516 finished with value: 0.0 and parameters: {'timeframe': 'M1', 'atr_period': 13, 'atr_threshold': 3.0, 'pt_mult': 0.5, 'sl_mult': 5.0, 'td_mins': 5}. Best is trial 337 with value: 2.318948203404773.
