[I 2026-03-12 01:24:34,257] Trial 963 finished with value: 2.1354320678443623 and parameters: {'timeframe': 'mixed', 'atr_period': 13, 'atr_threshold': 3.0, 'pt_mult': 0.5, 'sl_mult': 5.0, 'td_mins': 60}. Best is trial 404 with value: 2.1354320678443623.
[I 2026-03-12 01:24:34,831] Trial 964 finished with value: 2.1354320678443623 and parameters: {'timeframe': 'mixed', 'atr_period': 13, 'atr_threshold': 3.0, 'pt_mult': 0.5, 'sl_mult': 5.0, 'td_mins': 60}. Best is trial 404 with value: 2.1354320678443623.
[I 2026-03-12 01:24:34,998] Trial 965 finished with value: 0.0 and parameters: {'timeframe': 'mixed', 'atr_period': 13, 'atr_threshold': 15.0, 'pt_mult': 5.0, 'sl_mult': 2.5, 'td_mins': 60}. Best is trial 404 with value: 2.1354320678443623.
[I 2026-03-12 01:24:35,411] Trial 966 pruned. 
[I 2026-03-12 01:24:35,586] Trial 967 finished with value: 0.0 and parameters: {'timeframe': 'mixed', 'atr_period': 13, 'atr_threshold': 10.0, 'pt_mult': 5.0, 'sl_mult': 0.5, 'td_mins': 180}. Best is trial 404 with value: 2.1354320678443623.
[I 2026-03-12 01:24:35,745] Trial 968 pruned. 
[I 2026-03-12 01:24:35,927] Trial 969 pruned. 
[I 2026-03-12 01:24:36,470] Trial 970 finished with value: 2.1354320678443623 and parameters: {'timeframe': 'mixed', 'atr_period': 13, 'atr_threshold': 3.0, 'pt_mult': 0.5, 'sl_mult': 5.0, 'td_mins': 60}. Best is trial 404 with value: 2.1354320678443623.
[I 2026-03-12 01:24:37,022] Trial 971 finished with value: 2.1354320678443623 and parameters: {'timeframe': 'mixed', 'atr_period': 13, 'atr_threshold': 3.0, 'pt_mult': 0.5, 'sl_mult': 5.0, 'td_mins': 60}. Best is trial 404 with value: 2.1354320678443623.
[I 2026-03-12 01:24:37,190] Trial 972 finished with value: 0.0 and parameters: {'timeframe': 'mixed', 'atr_period': 13, 'atr_threshold': 15.0, 'pt_mult': 2.5, 'sl_mult': 2.5, 'td_mins': 180}. Best is trial 404 with value: 2.1354320678443623.
[I 2026-03-12 01:24:37,723] Trial 973 finished with value: 2.1354320678443623 and parameters: {'timeframe': 'mixed', 'atr_period': 13, 'atr_threshold': 3.0, 'pt_mult': 0.5, 'sl_mult': 5.0, 'td_mins': 60}. Best is trial 404 with value: 2.1354320678443623.
[I 2026-03-12 01:24:37,889] Trial 974 finished with value: 0.0 and parameters: {'timeframe': 'mixed', 'atr_period': 13, 'atr_threshold': 15.0, 'pt_mult': 0.5, 'sl_mult': 5.0, 'td_mins': 720}. Best is trial 404 with value: 2.1354320678443623.
[I 2026-03-12 01:24:38,054] Trial 975 finished with value: 0.0 and parameters: {'timeframe': 'mixed', 'atr_period': 13, 'atr_threshold': 10.0, 'pt_mult': 0.5, 'sl_mult': 0.5, 'td_mins': 30}. Best is trial 404 with value: 2.1354320678443623.
[I 2026-03-12 01:24:38,223] Trial 976 finished with value: 0.0 and parameters: {'timeframe': 'mixed', 'atr_period': 13, 'atr_threshold': 15.0, 'pt_mult': 0.5, 'sl_mult': 1.0, 'td_mins': 720}. Best is trial 404 with value: 2.1354320678443623.
[I 2026-03-12 01:24:38,768] Trial 977 finished with value: 2.1354320678443623 and parameters: {'timeframe': 'mixed', 'atr_period': 13, 'atr_threshold': 3.0, 'pt_mult': 0.5, 'sl_mult': 5.0, 'td_mins': 60}. Best is trial 404 with value: 2.1354320678443623.
[I 2026-03-12 01:24:40,134] Trial 978 pruned. 
[I 2026-03-12 01:24:40,470] Trial 979 pruned. 
[I 2026-03-12 01:24:41,356] Trial 980 finished with value: 2.0147840062204914 and parameters: {'timeframe': 'mixed', 'atr_period': 13, 'atr_threshold': 3.0, 'pt_mult': 0.5, 'sl_mult': 5.0, 'td_mins': 120}. Best is trial 404 with value: 2.1354320678443623.
[I 2026-03-12 01:24:41,894] Trial 981 finished with value: 2.1354320678443623 and parameters: {'timeframe': 'mixed', 'atr_period': 13, 'atr_threshold': 3.0, 'pt_mult': 0.5, 'sl_mult': 5.0, 'td_mins': 60}. Best is trial 404 with value: 2.1354320678443623.
[I 2026-03-12 01:24:42,014] Trial 982 pruned. 
[I 2026-03-12 01:24:44,099] Trial 983 pruned. 
[I 2026-03-12 01:24:44,670] Trial 984 finished with value: 2.1354320678443623 and parameters: {'timeframe': 'mixed', 'atr_period': 13, 'atr_threshold': 3.0, 'pt_mult': 0.5, 'sl_mult': 5.0, 'td_mins': 60}. Best is trial 404 with value: 2.1354320678443623.
[I 2026-03-12 01:24:44,818] Trial 985 pruned. 
[I 2026-03-12 01:24:45,381] Trial 986 finished with value: 2.1354320678443623 and parameters: {'timeframe': 'mixed', 'atr_period': 13, 'atr_threshold': 3.0, 'pt_mult': 0.5, 'sl_mult': 5.0, 'td_mins': 60}. Best is trial 404 with value: 2.1354320678443623.
[I 2026-03-12 01:24:45,931] Trial 987 finished with value: 2.1354320678443623 and parameters: {'timeframe': 'mixed', 'atr_period': 13, 'atr_threshold': 3.0, 'pt_mult': 0.5, 'sl_mult': 5.0, 'td_mins': 60}. Best is trial 404 with value: 2.1354320678443623.
[I 2026-03-12 01:24:46,520] Trial 988 finished with value: 2.1354320678443623 and parameters: {'timeframe': 'mixed', 'atr_period': 13, 'atr_threshold': 3.0, 'pt_mult': 0.5, 'sl_mult': 5.0, 'td_mins': 60}. Best is trial 404 with value: 2.1354320678443623.
[I 2026-03-12 01:24:46,687] Trial 989 finished with value: 0.0 and parameters: {'timeframe': 'mixed', 'atr_period': 13, 'atr_threshold': 10.0, 'pt_mult': 0.5, 'sl_mult': 5.0, 'td_mins': 60}. Best is trial 404 with value: 2.1354320678443623.
[I 2026-03-12 01:24:48,174] Trial 990 pruned. 
[I 2026-03-12 01:24:48,725] Trial 991 finished with value: 2.1354320678443623 and parameters: {'timeframe': 'mixed', 'atr_period': 13, 'atr_threshold': 3.0, 'pt_mult': 0.5, 'sl_mult': 5.0, 'td_mins': 60}. Best is trial 404 with value: 2.1354320678443623.
[I 2026-03-12 01:24:49,292] Trial 992 pruned. 
[I 2026-03-12 01:24:49,867] Trial 993 finished with value: 2.1354320678443623 and parameters: {'timeframe': 'mixed', 'atr_period': 13, 'atr_threshold': 3.0, 'pt_mult': 0.5, 'sl_mult': 5.0, 'td_mins': 60}. Best is trial 404 with value: 2.1354320678443623.
[I 2026-03-12 01:24:49,974] Trial 994 pruned. 
[I 2026-03-12 01:24:55,369] Trial 995 pruned. 
[I 2026-03-12 01:24:56,107] Trial 996 pruned. 
[I 2026-03-12 01:24:56,707] Trial 997 finished with value: 2.1354320678443623 and parameters: {'timeframe': 'mixed', 'atr_period': 13, 'atr_threshold': 3.0, 'pt_mult': 0.5, 'sl_mult': 5.0, 'td_mins': 60}. Best is trial 404 with value: 2.1354320678443623.
[I 2026-03-12 01:24:58,456] Trial 998 pruned. 
[I 2026-03-12 01:24:59,511] Trial 999 pruned. 
2026-03-12 01:24:59,620 - INFO - Top 100 results for each timeframe successfully saved to: /workspace/data/XAUUSD/stratum_7_models/1A_2B/optuna_top100_pure_atr_results.csv

timeframe  atr_period  atr_threshold  pt_mult  sl_mult  td_mins  Total_Bets    Wins  Losses  Timeouts  Avg_ATR  Avg_Payoff    Total_NP   Timeout_NP  Adjusted_PF
      M15          13            3.0      0.5      5.0      120     30336.0 21461.0   524.0    8351.0   4.2750         0.1 411314159.0 -100212000.0     2.454517
      M15          13            3.0      0.5      5.0       60     30336.0 18245.0   212.0   11879.0   4.2750         0.1 375504668.0 -142548000.0     2.399620
      M15          13            3.0      0.5      5.0      180     30336.0 23033.0   796.0    6507.0   4.2750         0.1 389644353.0  -78084000.0     2.292745
      M15          13            2.0      0.5      5.0      120     65391.0 46300.0  1146.0   17945.0   3.2958         0.1 638486032.0 -215340000.0     2.149660
      M15          13            2.0      0.5      5.0       60     65391.0 39408.0   453.0   25530.0   3.2958         0.1 555596319.0 -306360000.0     2.140971
      M15          13            0.5      0.5      5.0      120     96749.0 70741.0  2107.0   23901.0   2.7412         0.1 745146384.0 -286812000.0     2.027537
      M15          13            1.0      0.5      5.0      120     96749.0 70741.0  2107.0   23901.0   2.7412         0.1 745146384.0 -286812000.0     2.027537
      M15          13            2.0      0.5      5.0      180     65391.0 49694.0  1677.0   14020.0   3.2958         0.1 627834583.0 -168240000.0     2.020570
      M15          13            3.0      1.0      5.0      120     30336.0 14317.0   737.0   15282.0   4.2750         0.2 498059081.0 -183384000.0     1.890751
      M15          13            3.0      0.5      5.0      360     30336.0 25142.0  1365.0    3829.0   4.2750         0.1 295538136.0  -45948000.0     1.765410

==========================================================================================
🏆 mixed Top 10 Configurations 🏆
==========================================================================================
timeframe  atr_period  atr_threshold  pt_mult  sl_mult  td_mins  Total_Bets     Wins  Losses  Timeouts  Avg_ATR  Avg_Payoff     Total_NP   Timeout_NP  Adjusted_PF
    mixed          13            3.0      0.5      5.0       60     77350.0  53821.0  1540.0   21989.0   3.8843         0.1  849694419.0 -263868000.0     2.135432
    mixed          13            3.0      0.5      5.0      120     77350.0  60054.0  2549.0   14747.0   3.8843         0.1  819443060.0 -176964000.0     2.014784
    mixed          13            3.0      0.5      5.0       30     77350.0  45924.0   722.0   30704.0   3.8843         0.1  754832245.0 -368448000.0     1.946826
    mixed          13            3.0      0.5      5.0      180     77350.0  62885.0  3280.0   11185.0   3.8843         0.1  727852502.0 -134220000.0     1.901343
    mixed          13            5.0      0.5      5.0       60     10452.0   6880.0   169.0    3403.0   6.1135         0.1  199638257.0  -40836000.0     1.851061
    mixed          13            5.0      0.5      5.0       30     10452.0   5646.0    52.0    4754.0   6.1135         0.1  179141953.0  -57048000.0     1.815520
    mixed          13            2.0      0.5      5.0       60    224285.0 162514.0  6179.0   55592.0   2.7824         0.1 1482309849.0 -667104000.0     1.763842
    mixed          13            3.0      1.0      5.0      120     77350.0  45321.0  3935.0   28094.0   3.8843         0.2 1142686919.0 -337128000.0     1.715492
    mixed          13            2.0      0.5      5.0       30    224285.0 142871.0  3496.0   77918.0   2.7824         0.1 1330507088.0 -935016000.0     1.668500
    mixed          13            2.0      0.5      5.0      120    224285.0 178126.0  9497.0   36662.0   2.7824         0.1 1366363355.0 -439944000.0     1.661170

==========================================================================================
2026-03-12 01:25:02,225 - INFO - Discovering partitions...
2026-03-12 01:25:14,506 - INFO - === Starting Optuna Optimization for M1 [SHORT_ONLY] (Trials: 1000) ===
/home/hephaestus-zero/.local/lib/python3.11/site-packages/optuna/_experimental.py:32: ExperimentalWarning: Argument ``multivariate`` is an experimental feature. The interface can change in the future.
  warnings.warn(
[I 2026-03-12 01:25:14,507] A new study created in memory with name: no-name-b4567833-778e-4a60-8822-34991906ea3e
2026-03-12 01:25:14,508 - INFO -     [Cache Miss] Loading Raw Tick Data for Fold 20210801_20220526...
2026-03-12 01:25:42,989 - INFO -     [Cache Miss] Loading Signal Data for M1, ATR=13...
2026-03-12 01:26:21,397 - INFO -     [Cache Miss] Loading Raw Tick Data for Fold 20220526_20230321...
2026-03-12 01:26:50,273 - INFO -     [Cache Miss] Loading Signal Data for M1, ATR=13...
2026-03-12 01:27:27,260 - INFO -     [Cache Miss] Loading Raw Tick Data for Fold 20230321_20240115...
2026-03-12 01:27:56,189 - INFO -     [Cache Miss] Loading Signal Data for M1, ATR=13...
2026-03-12 01:28:33,039 - INFO -     [Cache Miss] Loading Raw Tick Data for Fold 20240115_20241107...
2026-03-12 01:29:02,696 - INFO -     [Cache Miss] Loading Signal Data for M1, ATR=13...
2026-03-12 01:29:40,520 - INFO -     [Cache Miss] Loading Raw Tick Data for Fold 20241107_20250904...
2026-03-12 01:30:11,244 - INFO -     [Cache Miss] Loading Signal Data for M1, ATR=13...
[I 2026-03-12 01:30:50,389] Trial 0 finished with value: 1.018976051459187 and parameters: {'timeframe': 'M1', 'atr_period': 13, 'atr_threshold': 1.0, 'pt_mult': 2.5, 'sl_mult': 1.0, 'td_mins': 120}. Best is trial 0 with value: 1.018976051459187.
[I 2026-03-12 01:30:50,438] Trial 1 finished with value: 0.0 and parameters: {'timeframe': 'M1', 'atr_period': 13, 'atr_threshold': 8.0, 'pt_mult': 1.0, 'sl_mult': 5.0, 'td_mins': 60}. Best is trial 0 with value: 1.018976051459187.
[I 2026-03-12 01:30:52,678] Trial 2 finished with value: 0.9611681400253277 and parameters: {'timeframe': 'M1', 'atr_period': 13, 'atr_threshold': 2.0, 'pt_mult': 2.5, 'sl_mult': 5.0, 'td_mins': 1200}. Best is trial 0 with value: 1.018976051459187.
[I 2026-03-12 01:30:53,626] Trial 3 finished with value: 0.9858323155228653 and parameters: {'timeframe': 'M1', 'atr_period': 13, 'atr_threshold': 1.0, 'pt_mult': 1.0, 'sl_mult': 2.5, 'td_mins': 60}. Best is trial 0 with value: 1.018976051459187.
[I 2026-03-12 01:30:54,068] Trial 4 finished with value: 0.7516379416449886 and parameters: {'timeframe': 'M1', 'atr_period': 13, 'atr_threshold': 1.0, 'pt_mult': 2.5, 'sl_mult': 2.5, 'td_mins': 15}. Best is trial 0 with value: 1.018976051459187.
[I 2026-03-12 01:30:54,122] Trial 5 finished with value: 0.0 and parameters: {'timeframe': 'M1', 'atr_period': 13, 'atr_threshold': 15.0, 'pt_mult': 5.0, 'sl_mult': 1.0, 'td_mins': 360}. Best is trial 0 with value: 1.018976051459187.
[I 2026-03-12 01:30:54,174] Trial 6 finished with value: 0.0 and parameters: {'timeframe': 'M1', 'atr_period': 13, 'atr_threshold': 8.0, 'pt_mult': 1.0, 'sl_mult': 1.0, 'td_mins': 120}. Best is trial 0 with value: 1.018976051459187.
[I 2026-03-12 01:31:18,731] Trial 7 finished with value: 0.968290540774546 and parameters: {'timeframe': 'M1', 'atr_period': 13, 'atr_threshold': 0.5, 'pt_mult': 5.0, 'sl_mult': 5.0, 'td_mins': 1200}. Best is trial 0 with value: 1.018976051459187.
[I 2026-03-12 01:31:19,393] Trial 8 finished with value: 1.0332978154761157 and parameters: {'timeframe': 'M1', 'atr_period': 13, 'atr_threshold': 2.0, 'pt_mult': 5.0, 'sl_mult': 5.0, 'td_mins': 180}. Best is trial 8 with value: 1.0332978154761157.
[I 2026-03-12 01:31:19,443] Trial 9 finished with value: 0.0 and parameters: {'timeframe': 'M1', 'atr_period': 13, 'atr_threshold': 15.0, 'pt_mult': 0.5, 'sl_mult': 1.0, 'td_mins': 720}. Best is trial 8 with value: 1.0332978154761157.
[I 2026-03-12 01:31:19,677] Trial 10 finished with value: 0.0635958705785433 and parameters: {'timeframe': 'M1', 'atr_period': 13, 'atr_threshold': 1.0, 'pt_mult': 5.0, 'sl_mult': 1.0, 'td_mins': 5}. Best is trial 8 with value: 1.0332978154761157.
[I 2026-03-12 01:31:19,722] Trial 11 finished with value: 0.0 and parameters: {'timeframe': 'M1', 'atr_period': 13, 'atr_threshold': 8.0, 'pt_mult': 5.0, 'sl_mult': 5.0, 'td_mins': 1200}. Best is trial 8 with value: 1.0332978154761157.
[I 2026-03-12 01:31:19,780] Trial 12 finished with value: 0.0 and parameters: {'timeframe': 'M1', 'atr_period': 13, 'atr_threshold': 15.0, 'pt_mult': 5.0, 'sl_mult': 1.0, 'td_mins': 120}. Best is trial 8 with value: 1.0332978154761157.
[I 2026-03-12 01:31:19,832] Trial 13 finished with value: 0.0 and parameters: {'timeframe': 'M1', 'atr_period': 13, 'atr_threshold': 8.0, 'pt_mult': 2.5, 'sl_mult': 0.5, 'td_mins': 15}. Best is trial 8 with value: 1.0332978154761157.
[I 2026-03-12 01:31:22,238] Trial 14 finished with value: 1.0437368260639504 and parameters: {'timeframe': 'M1', 'atr_period': 13, 'atr_threshold': 1.0, 'pt_mult': 1.0, 'sl_mult': 0.5, 'td_mins': 1200}. Best is trial 14 with value: 1.0437368260639504.
[I 2026-03-12 01:31:22,291] Trial 15 finished with value: 0.0 and parameters: {'timeframe': 'M1', 'atr_period': 13, 'atr_threshold': 5.0, 'pt_mult': 5.0, 'sl_mult': 0.5, 'td_mins': 5}. Best is trial 14 with value: 1.0437368260639504.
[I 2026-03-12 01:31:22,337] Trial 16 finished with value: 0.0 and parameters: {'timeframe': 'M1', 'atr_period': 13, 'atr_threshold': 10.0, 'pt_mult': 5.0, 'sl_mult': 0.5, 'td_mins': 60}. Best is trial 14 with value: 1.0437368260639504.
[I 2026-03-12 01:31:23,783] Trial 17 finished with value: 1.0048213984879573 and parameters: {'timeframe': 'M1', 'atr_period': 13, 'atr_threshold': 0.5, 'pt_mult': 0.5, 'sl_mult': 0.5, 'td_mins': 180}. Best is trial 14 with value: 1.0437368260639504.
[I 2026-03-12 01:31:23,831] Trial 18 finished with value: 0.0 and parameters: {'timeframe': 'M1', 'atr_period': 13, 'atr_threshold': 5.0, 'pt_mult': 5.0, 'sl_mult': 0.5, 'td_mins': 1200}. Best is trial 14 with value: 1.0437368260639504.
[I 2026-03-12 01:31:23,880] Trial 19 finished with value: 0.0 and parameters: {'timeframe': 'M1', 'atr_period': 13, 'atr_threshold': 15.0, 'pt_mult': 1.0, 'sl_mult': 5.0, 'td_mins': 360}. Best is trial 14 with value: 1.0437368260639504.
[I 2026-03-12 01:31:23,925] Trial 20 finished with value: 0.0 and parameters: {'timeframe': 'M1', 'atr_period': 13, 'atr_threshold': 5.0, 'pt_mult': 0.5, 'sl_mult': 1.0, 'td_mins': 120}. Best is trial 14 with value: 1.0437368260639504.
[I 2026-03-12 01:31:25,625] Trial 21 pruned. 
[I 2026-03-12 01:31:26,400] Trial 22 pruned. 
[I 2026-03-12 01:31:26,451] Trial 23 finished with value: 0.0 and parameters: {'timeframe': 'M1', 'atr_period': 13, 'atr_threshold': 8.0, 'pt_mult': 0.5, 'sl_mult': 5.0, 'td_mins': 30}. Best is trial 14 with value: 1.0437368260639504.
[I 2026-03-12 01:31:26,503] Trial 24 finished with value: 0.0 and parameters: {'timeframe': 'M1', 'atr_period': 13, 'atr_threshold': 8.0, 'pt_mult': 5.0, 'sl_mult': 2.5, 'td_mins': 1080}. Best is trial 14 with value: 1.0437368260639504.
[I 2026-03-12 01:31:26,547] Trial 25 finished with value: 0.0 and parameters: {'timeframe': 'M1', 'atr_period': 13, 'atr_threshold': 10.0, 'pt_mult': 0.5, 'sl_mult': 2.5, 'td_mins': 180}. Best is trial 14 with value: 1.0437368260639504.
[I 2026-03-12 01:31:26,591] Trial 26 finished with value: 0.0 and parameters: {'timeframe': 'M1', 'atr_period': 13, 'atr_threshold': 3.0, 'pt_mult': 0.5, 'sl_mult': 1.0, 'td_mins': 5}. Best is trial 14 with value: 1.0437368260639504.
[I 2026-03-12 01:31:28,297] Trial 27 pruned. 
[I 2026-03-12 01:31:28,347] Trial 28 finished with value: 0.0 and parameters: {'timeframe': 'M1', 'atr_period': 13, 'atr_threshold': 5.0, 'pt_mult': 2.5, 'sl_mult': 0.5, 'td_mins': 120}. Best is trial 14 with value: 1.0437368260639504.
[I 2026-03-12 01:31:28,433] Trial 29 pruned. 
[I 2026-03-12 01:31:28,478] Trial 30 finished with value: 0.0 and parameters: {'timeframe': 'M1', 'atr_period': 13, 'atr_threshold': 10.0, 'pt_mult': 1.0, 'sl_mult': 5.0, 'td_mins': 120}. Best is trial 14 with value: 1.0437368260639504.
[I 2026-03-12 01:31:28,523] Trial 31 finished with value: 0.0 and parameters: {'timeframe': 'M1', 'atr_period': 13, 'atr_threshold': 15.0, 'pt_mult': 0.5, 'sl_mult': 5.0, 'td_mins': 120}. Best is trial 14 with value: 1.0437368260639504.
[I 2026-03-12 01:31:28,566] Trial 32 finished with value: 0.0 and parameters: {'timeframe': 'M1', 'atr_period': 13, 'atr_threshold': 3.0, 'pt_mult': 0.5, 'sl_mult': 5.0, 'td_mins': 180}. Best is trial 14 with value: 1.0437368260639504.
[I 2026-03-12 01:31:28,609] Trial 33 finished with value: 0.0 and parameters: {'timeframe': 'M1', 'atr_period': 13, 'atr_threshold': 3.0, 'pt_mult': 2.5, 'sl_mult': 5.0, 'td_mins': 180}. Best is trial 14 with value: 1.0437368260639504.
[I 2026-03-12 01:31:28,653] Trial 34 finished with value: 0.0 and parameters: {'timeframe': 'M1', 'atr_period': 13, 'atr_threshold': 5.0, 'pt_mult': 2.5, 'sl_mult': 0.5, 'td_mins': 120}. Best is trial 14 with value: 1.0437368260639504.
[I 2026-03-12 01:31:28,713] Trial 35 pruned. 
[I 2026-03-12 01:31:28,759] Trial 36 finished with value: 0.0 and parameters: {'timeframe': 'M1', 'atr_period': 13, 'atr_threshold': 10.0, 'pt_mult': 0.5, 'sl_mult': 1.0, 'td_mins': 30}. Best is trial 14 with value: 1.0437368260639504.
[I 2026-03-12 01:31:29,044] Trial 37 pruned. 
[I 2026-03-12 01:31:29,096] Trial 38 finished with value: 0.0 and parameters: {'timeframe': 'M1', 'atr_period': 13, 'atr_threshold': 10.0, 'pt_mult': 2.5, 'sl_mult': 5.0, 'td_mins': 1200}. Best is trial 14 with value: 1.0437368260639504.
[I 2026-03-12 01:31:29,146] Trial 39 finished with value: 0.0 and parameters: {'timeframe': 'M1', 'atr_period': 13, 'atr_threshold': 10.0, 'pt_mult': 0.5, 'sl_mult': 0.5, 'td_mins': 120}. Best is trial 14 with value: 1.0437368260639504.
[I 2026-03-12 01:31:29,210] Trial 40 finished with value: 0.0 and parameters: {'timeframe': 'M1', 'atr_period': 13, 'atr_threshold': 5.0, 'pt_mult': 0.5, 'sl_mult': 5.0, 'td_mins': 180}. Best is trial 14 with value: 1.0437368260639504.
[I 2026-03-12 01:31:29,257] Trial 41 finished with value: 0.0 and parameters: {'timeframe': 'M1', 'atr_period': 13, 'atr_threshold': 15.0, 'pt_mult': 5.0, 'sl_mult': 2.5, 'td_mins': 5}. Best is trial 14 with value: 1.0437368260639504.
[I 2026-03-12 01:31:29,311] Trial 42 pruned. 
[I 2026-03-12 01:31:29,359] Trial 43 finished with value: 0.0 and parameters: {'timeframe': 'M1', 'atr_period': 13, 'atr_threshold': 10.0, 'pt_mult': 5.0, 'sl_mult': 2.5, 'td_mins': 360}. Best is trial 14 with value: 1.0437368260639504.
[I 2026-03-12 01:31:30,475] Trial 44 finished with value: 1.0940851700507497 and parameters: {'timeframe': 'M1', 'atr_period': 13, 'atr_threshold': 2.0, 'pt_mult': 2.5, 'sl_mult': 1.0, 'td_mins': 1080}. Best is trial 44 with value: 1.0940851700507497.
[I 2026-03-12 01:31:30,697] Trial 45 finished with value: 1.112569542667418 and parameters: {'timeframe': 'M1', 'atr_period': 13, 'atr_threshold': 2.0, 'pt_mult': 1.0, 'sl_mult': 0.5, 'td_mins': 120}. Best is trial 45 with value: 1.112569542667418.
[I 2026-03-12 01:31:32,141] Trial 46 finished with value: 1.2008711221707942 and parameters: {'timeframe': 'M1', 'atr_period': 13, 'atr_threshold': 2.0, 'pt_mult': 5.0, 'sl_mult': 0.5, 'td_mins': 1080}. Best is trial 46 with value: 1.2008711221707942.
[I 2026-03-12 01:31:32,283] Trial 47 pruned. 
[I 2026-03-12 01:31:32,337] Trial 48 finished with value: 0.0 and parameters: {'timeframe': 'M1', 'atr_period': 13, 'atr_threshold': 5.0, 'pt_mult': 1.0, 'sl_mult': 2.5, 'td_mins': 60}. Best is trial 46 with value: 1.2008711221707942.
