[I 2026-03-12 02:01:53,384] Trial 167 finished with value: 0.9533508975858455 and parameters: {'timeframe': 'M15', 'atr_period': 13, 'atr_threshold': 2.0, 'pt_mult': 1.0, 'sl_mult': 1.0, 'td_mins': 1200}. Best is trial 129 with value: 2.123964189095941.
[I 2026-03-12 02:01:53,639] Trial 168 pruned. 
[I 2026-03-12 02:01:54,930] Trial 169 finished with value: 1.4985832147843308 and parameters: {'timeframe': 'M15', 'atr_period': 13, 'atr_threshold': 1.0, 'pt_mult': 1.0, 'sl_mult': 5.0, 'td_mins': 360}. Best is trial 129 with value: 2.123964189095941.
[I 2026-03-12 02:01:55,018] Trial 170 finished with value: 0.0 and parameters: {'timeframe': 'M15', 'atr_period': 13, 'atr_threshold': 15.0, 'pt_mult': 2.5, 'sl_mult': 0.5, 'td_mins': 15}. Best is trial 129 with value: 2.123964189095941.
[I 2026-03-12 02:01:55,164] Trial 171 pruned. 
[I 2026-03-12 02:01:55,685] Trial 172 finished with value: 2.1722401515386682 and parameters: {'timeframe': 'M15', 'atr_period': 13, 'atr_threshold': 1.0, 'pt_mult': 0.5, 'sl_mult': 5.0, 'td_mins': 120}. Best is trial 172 with value: 2.1722401515386682.
[I 2026-03-12 02:01:55,729] Trial 173 finished with value: 0.0 and parameters: {'timeframe': 'M15', 'atr_period': 13, 'atr_threshold': 15.0, 'pt_mult': 5.0, 'sl_mult': 5.0, 'td_mins': 60}. Best is trial 172 with value: 2.1722401515386682.
[I 2026-03-12 02:02:00,499] Trial 174 finished with value: 1.0002037963282249 and parameters: {'timeframe': 'M15', 'atr_period': 13, 'atr_threshold': 1.0, 'pt_mult': 2.5, 'sl_mult': 5.0, 'td_mins': 1200}. Best is trial 172 with value: 2.1722401515386682.
[I 2026-03-12 02:02:00,544] Trial 175 pruned. 
[I 2026-03-12 02:02:01,246] Trial 176 finished with value: 1.9422282642786932 and parameters: {'timeframe': 'M15', 'atr_period': 13, 'atr_threshold': 0.5, 'pt_mult': 0.5, 'sl_mult': 5.0, 'td_mins': 180}. Best is trial 172 with value: 2.1722401515386682.
[I 2026-03-12 02:02:01,303] Trial 177 pruned. 
[I 2026-03-12 02:02:01,361] Trial 178 finished with value: 0.0 and parameters: {'timeframe': 'M15', 'atr_period': 13, 'atr_threshold': 10.0, 'pt_mult': 2.5, 'sl_mult': 5.0, 'td_mins': 60}. Best is trial 172 with value: 2.1722401515386682.
[I 2026-03-12 02:02:02,910] Trial 179 finished with value: 0.9527261407127396 and parameters: {'timeframe': 'M15', 'atr_period': 13, 'atr_threshold': 1.0, 'pt_mult': 1.0, 'sl_mult': 1.0, 'td_mins': 720}. Best is trial 172 with value: 2.1722401515386682.
[I 2026-03-12 02:02:02,999] Trial 180 pruned. 
[I 2026-03-12 02:02:03,056] Trial 181 pruned. 
[I 2026-03-12 02:02:03,106] Trial 182 finished with value: 0.0 and parameters: {'timeframe': 'M15', 'atr_period': 13, 'atr_threshold': 15.0, 'pt_mult': 0.5, 'sl_mult': 5.0, 'td_mins': 30}. Best is trial 172 with value: 2.1722401515386682.
[I 2026-03-12 02:02:03,246] Trial 183 pruned. 
[I 2026-03-12 02:02:03,297] Trial 184 pruned. 
[I 2026-03-12 02:02:03,346] Trial 185 pruned. 
[I 2026-03-12 02:02:03,396] Trial 186 pruned. 
[I 2026-03-12 02:02:03,480] Trial 187 pruned. 
[I 2026-03-12 02:02:04,574] Trial 188 finished with value: 1.012781623469841 and parameters: {'timeframe': 'M15', 'atr_period': 13, 'atr_threshold': 3.0, 'pt_mult': 1.0, 'sl_mult': 2.5, 'td_mins': 720}. Best is trial 172 with value: 2.1722401515386682.
[I 2026-03-12 02:02:04,648] Trial 189 pruned. 
[I 2026-03-12 02:02:06,863] Trial 190 finished with value: 0.948177191293707 and parameters: {'timeframe': 'M15', 'atr_period': 13, 'atr_threshold': 2.0, 'pt_mult': 0.5, 'sl_mult': 2.5, 'td_mins': 1200}. Best is trial 172 with value: 2.1722401515386682.
[I 2026-03-12 02:02:06,909] Trial 191 finished with value: 0.0 and parameters: {'timeframe': 'M15', 'atr_period': 13, 'atr_threshold': 15.0, 'pt_mult': 2.5, 'sl_mult': 2.5, 'td_mins': 5}. Best is trial 172 with value: 2.1722401515386682.
[I 2026-03-12 02:02:07,623] Trial 192 finished with value: 0.9681732628118418 and parameters: {'timeframe': 'M15', 'atr_period': 13, 'atr_threshold': 2.0, 'pt_mult': 0.5, 'sl_mult': 0.5, 'td_mins': 720}. Best is trial 172 with value: 2.1722401515386682.
[I 2026-03-12 02:02:07,848] Trial 193 finished with value: 1.2343783257453687 and parameters: {'timeframe': 'M15', 'atr_period': 13, 'atr_threshold': 1.0, 'pt_mult': 0.5, 'sl_mult': 2.5, 'td_mins': 30}. Best is trial 172 with value: 2.1722401515386682.
[I 2026-03-12 02:02:07,925] Trial 194 finished with value: 0.8957184639880325 and parameters: {'timeframe': 'M15', 'atr_period': 13, 'atr_threshold': 5.0, 'pt_mult': 1.0, 'sl_mult': 2.5, 'td_mins': 30}. Best is trial 172 with value: 2.1722401515386682.
[I 2026-03-12 02:02:08,107] Trial 195 pruned. 
[I 2026-03-12 02:02:10,915] Trial 196 finished with value: 0.9588716288548392 and parameters: {'timeframe': 'M15', 'atr_period': 13, 'atr_threshold': 1.0, 'pt_mult': 1.0, 'sl_mult': 2.5, 'td_mins': 1080}. Best is trial 172 with value: 2.1722401515386682.
[I 2026-03-12 02:02:11,272] Trial 197 finished with value: 1.176370154203029 and parameters: {'timeframe': 'M15', 'atr_period': 13, 'atr_threshold': 3.0, 'pt_mult': 1.0, 'sl_mult': 2.5, 'td_mins': 180}. Best is trial 172 with value: 2.1722401515386682.
[I 2026-03-12 02:02:11,752] Trial 198 finished with value: 1.2269916173379236 and parameters: {'timeframe': 'M15', 'atr_period': 13, 'atr_threshold': 1.0, 'pt_mult': 0.5, 'sl_mult': 2.5, 'td_mins': 120}. Best is trial 172 with value: 2.1722401515386682.
[I 2026-03-12 02:02:12,720] Trial 199 finished with value: 0.947154903915483 and parameters: {'timeframe': 'M15', 'atr_period': 13, 'atr_threshold': 2.0, 'pt_mult': 0.5, 'sl_mult': 1.0, 'td_mins': 720}. Best is trial 172 with value: 2.1722401515386682.
[I 2026-03-12 02:02:12,767] Trial 200 pruned. 
[I 2026-03-12 02:02:12,945] Trial 201 pruned. 
[I 2026-03-12 02:02:12,991] Trial 202 pruned. 
[I 2026-03-12 02:02:13,087] Trial 203 pruned. 
[I 2026-03-12 02:02:18,593] Trial 204 finished with value: 0.8987833835150292 and parameters: {'timeframe': 'M15', 'atr_period': 13, 'atr_threshold': 0.5, 'pt_mult': 5.0, 'sl_mult': 5.0, 'td_mins': 1200}. Best is trial 172 with value: 2.1722401515386682.
[I 2026-03-12 02:02:19,282] Trial 205 pruned. 
[I 2026-03-12 02:02:24,942] Trial 206 finished with value: 0.8987833835150292 and parameters: {'timeframe': 'M15', 'atr_period': 13, 'atr_threshold': 1.0, 'pt_mult': 5.0, 'sl_mult': 5.0, 'td_mins': 1200}. Best is trial 172 with value: 2.1722401515386682.
[I 2026-03-12 02:02:25,099] Trial 207 pruned. 
[I 2026-03-12 02:02:25,202] Trial 208 finished with value: 0.49534665734053596 and parameters: {'timeframe': 'M15', 'atr_period': 13, 'atr_threshold': 5.0, 'pt_mult': 2.5, 'sl_mult': 5.0, 'td_mins': 30}. Best is trial 172 with value: 2.1722401515386682.
[I 2026-03-12 02:02:25,337] Trial 209 pruned. 
[I 2026-03-12 02:02:26,386] Trial 210 finished with value: 0.9750151522322513 and parameters: {'timeframe': 'M15', 'atr_period': 13, 'atr_threshold': 1.0, 'pt_mult': 0.5, 'sl_mult': 0.5, 'td_mins': 720}. Best is trial 172 with value: 2.1722401515386682.
[I 2026-03-12 02:02:26,551] Trial 211 pruned. 
[I 2026-03-12 02:02:27,210] Trial 212 finished with value: 0.8336519597973083 and parameters: {'timeframe': 'M15', 'atr_period': 13, 'atr_threshold': 5.0, 'pt_mult': 2.5, 'sl_mult': 1.0, 'td_mins': 1080}. Best is trial 172 with value: 2.1722401515386682.
[I 2026-03-12 02:02:28,017] Trial 213 finished with value: 0.9092971795050809 and parameters: {'timeframe': 'M15', 'atr_period': 13, 'atr_threshold': 3.0, 'pt_mult': 0.5, 'sl_mult': 1.0, 'td_mins': 720}. Best is trial 172 with value: 2.1722401515386682.
[I 2026-03-12 02:02:28,668] Trial 214 finished with value: 1.0103993116271734 and parameters: {'timeframe': 'M15', 'atr_period': 13, 'atr_threshold': 5.0, 'pt_mult': 0.5, 'sl_mult': 5.0, 'td_mins': 1080}. Best is trial 172 with value: 2.1722401515386682.
[I 2026-03-12 02:02:32,329] Trial 215 finished with value: 0.9492250378938415 and parameters: {'timeframe': 'M15', 'atr_period': 13, 'atr_threshold': 2.0, 'pt_mult': 2.5, 'sl_mult': 2.5, 'td_mins': 1200}. Best is trial 172 with value: 2.1722401515386682.
[I 2026-03-12 02:02:32,373] Trial 216 finished with value: 0.0 and parameters: {'timeframe': 'M15', 'atr_period': 13, 'atr_threshold': 10.0, 'pt_mult': 5.0, 'sl_mult': 1.0, 'td_mins': 1200}. Best is trial 172 with value: 2.1722401515386682.
[I 2026-03-12 02:02:32,420] Trial 217 finished with value: 0.0 and parameters: {'timeframe': 'M15', 'atr_period': 13, 'atr_threshold': 15.0, 'pt_mult': 2.5, 'sl_mult': 1.0, 'td_mins': 30}. Best is trial 172 with value: 2.1722401515386682.
[I 2026-03-12 02:02:32,554] Trial 218 pruned. 
[I 2026-03-12 02:02:33,648] Trial 219 finished with value: 1.3130103854826434 and parameters: {'timeframe': 'M15', 'atr_period': 13, 'atr_threshold': 2.0, 'pt_mult': 2.5, 'sl_mult': 5.0, 'td_mins': 360}. Best is trial 172 with value: 2.1722401515386682.
[I 2026-03-12 02:02:33,745] Trial 220 pruned. 
[I 2026-03-12 02:02:33,897] Trial 221 finished with value: 0.9212010212887407 and parameters: {'timeframe': 'M15', 'atr_period': 13, 'atr_threshold': 5.0, 'pt_mult': 1.0, 'sl_mult': 2.5, 'td_mins': 180}. Best is trial 172 with value: 2.1722401515386682.
[I 2026-03-12 02:02:33,972] Trial 222 pruned. 
[I 2026-03-12 02:02:34,021] Trial 223 pruned. 
[I 2026-03-12 02:02:34,065] Trial 224 pruned. 
[I 2026-03-12 02:02:34,107] Trial 225 finished with value: 0.0 and parameters: {'timeframe': 'M15', 'atr_period': 13, 'atr_threshold': 15.0, 'pt_mult': 0.5, 'sl_mult': 2.5, 'td_mins': 720}. Best is trial 172 with value: 2.1722401515386682.
[I 2026-03-12 02:02:37,279] Trial 226 finished with value: 0.9443376667957688 and parameters: {'timeframe': 'M15', 'atr_period': 13, 'atr_threshold': 2.0, 'pt_mult': 2.5, 'sl_mult': 2.5, 'td_mins': 1080}. Best is trial 172 with value: 2.1722401515386682.
[I 2026-03-12 02:02:37,359] Trial 227 pruned. 
[I 2026-03-12 02:02:39,005] Trial 228 finished with value: 0.9716273569542473 and parameters: {'timeframe': 'M15', 'atr_period': 13, 'atr_threshold': 1.0, 'pt_mult': 1.0, 'sl_mult': 0.5, 'td_mins': 1200}. Best is trial 172 with value: 2.1722401515386682.
[I 2026-03-12 02:02:39,055] Trial 229 pruned. 
[I 2026-03-12 02:02:39,103] Trial 230 pruned. 
[I 2026-03-12 02:02:39,157] Trial 231 finished with value: 0.0 and parameters: {'timeframe': 'M15', 'atr_period': 13, 'atr_threshold': 15.0, 'pt_mult': 5.0, 'sl_mult': 5.0, 'td_mins': 1200}. Best is trial 172 with value: 2.1722401515386682.
[I 2026-03-12 02:02:39,654] Trial 232 finished with value: 0.8295752654243062 and parameters: {'timeframe': 'M15', 'atr_period': 13, 'atr_threshold': 5.0, 'pt_mult': 2.5, 'sl_mult': 0.5, 'td_mins': 1080}. Best is trial 172 with value: 2.1722401515386682.
[I 2026-03-12 02:02:39,745] Trial 233 pruned. 
[I 2026-03-12 02:02:39,796] Trial 234 finished with value: 0.0 and parameters: {'timeframe': 'M15', 'atr_period': 13, 'atr_threshold': 10.0, 'pt_mult': 2.5, 'sl_mult': 2.5, 'td_mins': 15}. Best is trial 172 with value: 2.1722401515386682.
[I 2026-03-12 02:02:40,224] Trial 235 pruned. 
[I 2026-03-12 02:02:40,271] Trial 236 finished with value: 0.0 and parameters: {'timeframe': 'M15', 'atr_period': 13, 'atr_threshold': 15.0, 'pt_mult': 0.5, 'sl_mult': 5.0, 'td_mins': 1200}. Best is trial 172 with value: 2.1722401515386682.
[I 2026-03-12 02:02:40,315] Trial 237 finished with value: 0.0 and parameters: {'timeframe': 'M15', 'atr_period': 13, 'atr_threshold': 15.0, 'pt_mult': 0.5, 'sl_mult': 5.0, 'td_mins': 180}. Best is trial 172 with value: 2.1722401515386682.
[I 2026-03-12 02:02:40,394] Trial 238 pruned. 
[I 2026-03-12 02:02:40,437] Trial 239 finished with value: 0.0 and parameters: {'timeframe': 'M15', 'atr_period': 13, 'atr_threshold': 10.0, 'pt_mult': 5.0, 'sl_mult': 2.5, 'td_mins': 360}. Best is trial 172 with value: 2.1722401515386682.
[I 2026-03-12 02:02:40,480] Trial 240 pruned. 
[I 2026-03-12 02:02:40,523] Trial 241 finished with value: 0.0 and parameters: {'timeframe': 'M15', 'atr_period': 13, 'atr_threshold': 10.0, 'pt_mult': 2.5, 'sl_mult': 2.5, 'td_mins': 30}. Best is trial 172 with value: 2.1722401515386682.
[I 2026-03-12 02:02:41,158] Trial 242 finished with value: 2.0428449374313256 and parameters: {'timeframe': 'M15', 'atr_period': 13, 'atr_threshold': 3.0, 'pt_mult': 0.5, 'sl_mult': 5.0, 'td_mins': 360}. Best is trial 172 with value: 2.1722401515386682.
[I 2026-03-12 02:02:41,689] Trial 243 pruned. 
[I 2026-03-12 02:02:41,734] Trial 244 finished with value: 0.0 and parameters: {'timeframe': 'M15', 'atr_period': 13, 'atr_threshold': 10.0, 'pt_mult': 5.0, 'sl_mult': 5.0, 'td_mins': 360}. Best is trial 172 with value: 2.1722401515386682.
[I 2026-03-12 02:02:43,471] Trial 245 finished with value: 0.9533508975858455 and parameters: {'timeframe': 'M15', 'atr_period': 13, 'atr_threshold': 2.0, 'pt_mult': 1.0, 'sl_mult': 1.0, 'td_mins': 1200}. Best is trial 172 with value: 2.1722401515386682.
[I 2026-03-12 02:02:43,520] Trial 246 pruned. 
[I 2026-03-12 02:02:43,568] Trial 247 finished with value: 0.0 and parameters: {'timeframe': 'M15', 'atr_period': 13, 'atr_threshold': 15.0, 'pt_mult': 1.0, 'sl_mult': 5.0, 'td_mins': 30}. Best is trial 172 with value: 2.1722401515386682.
[I 2026-03-12 02:02:43,613] Trial 248 finished with value: 0.0 and parameters: {'timeframe': 'M15', 'atr_period': 13, 'atr_threshold': 10.0, 'pt_mult': 0.5, 'sl_mult': 2.5, 'td_mins': 120}. Best is trial 172 with value: 2.1722401515386682.
[I 2026-03-12 02:02:43,656] Trial 249 pruned. 
[I 2026-03-12 02:02:43,867] Trial 250 finished with value: 0.6531326260370601 and parameters: {'timeframe': 'M15', 'atr_period': 13, 'atr_threshold': 5.0, 'pt_mult': 2.5, 'sl_mult': 0.5, 'td_mins': 360}. Best is trial 172 with value: 2.1722401515386682.
[I 2026-03-12 02:02:43,931] Trial 251 pruned. 
[I 2026-03-12 02:02:43,995] Trial 252 pruned. 
[I 2026-03-12 02:02:44,041] Trial 253 finished with value: 0.0 and parameters: {'timeframe': 'M15', 'atr_period': 13, 'atr_threshold': 10.0, 'pt_mult': 5.0, 'sl_mult': 0.5, 'td_mins': 180}. Best is trial 172 with value: 2.1722401515386682.
[I 2026-03-12 02:02:44,086] Trial 254 pruned. 
[I 2026-03-12 02:02:44,160] Trial 255 pruned. 
[I 2026-03-12 02:02:44,573] Trial 256 finished with value: 0.9641899660577191 and parameters: {'timeframe': 'M15', 'atr_period': 13, 'atr_threshold': 0.5, 'pt_mult': 0.5, 'sl_mult': 0.5, 'td_mins': 180}. Best is trial 172 with value: 2.1722401515386682.
[I 2026-03-12 02:02:47,185] Trial 257 finished with value: 0.9479728396418896 and parameters: {'timeframe': 'M15', 'atr_period': 13, 'atr_threshold': 0.5, 'pt_mult': 2.5, 'sl_mult': 0.5, 'td_mins': 1080}. Best is trial 172 with value: 2.1722401515386682.
[I 2026-03-12 02:02:49,539] Trial 258 finished with value: 0.9379520305366233 and parameters: {'timeframe': 'M15', 'atr_period': 13, 'atr_threshold': 2.0, 'pt_mult': 2.5, 'sl_mult': 1.0, 'td_mins': 1080}. Best is trial 172 with value: 2.1722401515386682.
[I 2026-03-12 02:02:49,585] Trial 259 pruned. 
[I 2026-03-12 02:02:50,361] Trial 260 finished with value: 0.9372824117018099 and parameters: {'timeframe': 'M15', 'atr_period': 13, 'atr_threshold': 2.0, 'pt_mult': 1.0, 'sl_mult': 1.0, 'td_mins': 360}. Best is trial 172 with value: 2.1722401515386682.
[I 2026-03-12 02:02:50,408] Trial 261 finished with value: 0.0 and parameters: {'timeframe': 'M15', 'atr_period': 13, 'atr_threshold': 10.0, 'pt_mult': 1.0, 'sl_mult': 0.5, 'td_mins': 180}. Best is trial 172 with value: 2.1722401515386682.
[I 2026-03-12 02:02:50,510] Trial 262 pruned. 
[I 2026-03-12 02:02:50,758] Trial 263 pruned. 
[I 2026-03-12 02:02:51,304] Trial 264 finished with value: 1.094341149914731 and parameters: {'timeframe': 'M15', 'atr_period': 13, 'atr_threshold': 3.0, 'pt_mult': 0.5, 'sl_mult': 2.5, 'td_mins': 360}. Best is trial 172 with value: 2.1722401515386682.
[I 2026-03-12 02:02:51,389] Trial 265 pruned. 
[I 2026-03-12 02:02:51,434] Trial 266 pruned. 
[I 2026-03-12 02:02:51,478] Trial 267 pruned. 
[I 2026-03-12 02:02:54,123] Trial 268 finished with value: 0.9486733711718985 and parameters: {'timeframe': 'M15', 'atr_period': 13, 'atr_threshold': 0.5, 'pt_mult': 2.5, 'sl_mult': 0.5, 'td_mins': 1200}. Best is trial 172 with value: 2.1722401515386682.
[I 2026-03-12 02:02:54,214] Trial 269 pruned. 
[I 2026-03-12 02:02:54,260] Trial 270 finished with value: 0.0 and parameters: {'timeframe': 'M15', 'atr_period': 13, 'atr_threshold': 10.0, 'pt_mult': 0.5, 'sl_mult': 5.0, 'td_mins': 5}. Best is trial 172 with value: 2.1722401515386682.
[I 2026-03-12 02:02:54,305] Trial 271 finished with value: 0.0 and parameters: {'timeframe': 'M15', 'atr_period': 13, 'atr_threshold': 10.0, 'pt_mult': 5.0, 'sl_mult': 2.5, 'td_mins': 120}. Best is trial 172 with value: 2.1722401515386682.
[I 2026-03-12 02:02:54,403] Trial 272 pruned. 
[I 2026-03-12 02:02:56,218] Trial 273 finished with value: 1.104853645389979 and parameters: {'timeframe': 'M15', 'atr_period': 13, 'atr_threshold': 3.0, 'pt_mult': 5.0, 'sl_mult': 5.0, 'td_mins': 720}. Best is trial 172 with value: 2.1722401515386682.
[I 2026-03-12 02:02:56,262] Trial 274 finished with value: 0.0 and parameters: {'timeframe': 'M15', 'atr_period': 13, 'atr_threshold': 10.0, 'pt_mult': 2.5, 'sl_mult': 5.0, 'td_mins': 360}. Best is trial 172 with value: 2.1722401515386682.
[I 2026-03-12 02:02:56,365] Trial 275 pruned. 
[I 2026-03-12 02:02:56,424] Trial 276 pruned. 
[I 2026-03-12 02:02:56,471] Trial 277 finished with value: 0.0 and parameters: {'timeframe': 'M15', 'atr_period': 13, 'atr_threshold': 15.0, 'pt_mult': 1.0, 'sl_mult': 5.0, 'td_mins': 30}. Best is trial 172 with value: 2.1722401515386682.
[I 2026-03-12 02:02:59,378] Trial 278 finished with value: 1.0097581041181356 and parameters: {'timeframe': 'M15', 'atr_period': 13, 'atr_threshold': 2.0, 'pt_mult': 0.5, 'sl_mult': 5.0, 'td_mins': 1080}. Best is trial 172 with value: 2.1722401515386682.
[I 2026-03-12 02:02:59,463] Trial 279 pruned. 
[I 2026-03-12 02:02:59,518] Trial 280 pruned. 
[I 2026-03-12 02:02:59,566] Trial 281 pruned. 
[I 2026-03-12 02:02:59,622] Trial 282 finished with value: 0.0 and parameters: {'timeframe': 'M15', 'atr_period': 13, 'atr_threshold': 15.0, 'pt_mult': 2.5, 'sl_mult': 5.0, 'td_mins': 1080}. Best is trial 172 with value: 2.1722401515386682.
[I 2026-03-12 02:02:59,938] Trial 283 pruned. 
[I 2026-03-12 02:03:01,075] Trial 284 finished with value: 0.9681732628118418 and parameters: {'timeframe': 'M15', 'atr_period': 13, 'atr_threshold': 2.0, 'pt_mult': 0.5, 'sl_mult': 0.5, 'td_mins': 1080}. Best is trial 172 with value: 2.1722401515386682.
[I 2026-03-12 02:03:01,122] Trial 285 finished with value: 0.0 and parameters: {'timeframe': 'M15', 'atr_period': 13, 'atr_threshold': 10.0, 'pt_mult': 0.5, 'sl_mult': 1.0, 'td_mins': 120}. Best is trial 172 with value: 2.1722401515386682.
[I 2026-03-12 02:03:01,174] Trial 286 pruned. 
[I 2026-03-12 02:03:01,255] Trial 287 pruned. 
[I 2026-03-12 02:03:01,375] Trial 288 pruned. 
[I 2026-03-12 02:03:01,892] Trial 289 finished with value: 1.2244199249931331 and parameters: {'timeframe': 'M15', 'atr_period': 13, 'atr_threshold': 2.0, 'pt_mult': 0.5, 'sl_mult': 2.5, 'td_mins': 180}. Best is trial 172 with value: 2.1722401515386682.
[I 2026-03-12 02:03:02,017] Trial 290 finished with value: 2.1951474620740763 and parameters: {'timeframe': 'M15', 'atr_period': 13, 'atr_threshold': 5.0, 'pt_mult': 1.0, 'sl_mult': 5.0, 'td_mins': 120}. Best is trial 290 with value: 2.1951474620740763.
[I 2026-03-12 02:03:02,117] Trial 291 pruned. 
[I 2026-03-12 02:03:02,328] Trial 292 pruned. 
[I 2026-03-12 02:03:02,377] Trial 293 pruned. 
[I 2026-03-12 02:03:02,442] Trial 294 finished with value: 0.0 and parameters: {'timeframe': 'M15', 'atr_period': 13, 'atr_threshold': 10.0, 'pt_mult': 1.0, 'sl_mult': 0.5, 'td_mins': 1200}. Best is trial 290 with value: 2.1951474620740763.
[I 2026-03-12 02:03:02,922] Trial 295 pruned. 
[I 2026-03-12 02:03:04,340] Trial 296 finished with value: 1.236984871273822 and parameters: {'timeframe': 'M15', 'atr_period': 13, 'atr_threshold': 0.5, 'pt_mult': 2.5, 'sl_mult': 5.0, 'td_mins': 360}. Best is trial 290 with value: 2.1951474620740763.
[I 2026-03-12 02:03:05,693] Trial 297 finished with value: 0.9503687330813368 and parameters: {'timeframe': 'M15', 'atr_period': 13, 'atr_threshold': 1.0, 'pt_mult': 0.5, 'sl_mult': 1.0, 'td_mins': 720}. Best is trial 290 with value: 2.1951474620740763.
[I 2026-03-12 02:03:05,889] Trial 298 pruned. 
[I 2026-03-12 02:03:05,983] Trial 299 pruned. 
[I 2026-03-12 02:03:06,470] Trial 300 finished with value: 1.08926017845721 and parameters: {'timeframe': 'M15', 'atr_period': 13, 'atr_threshold': 2.0, 'pt_mult': 2.5, 'sl_mult': 5.0, 'td_mins': 120}. Best is trial 290 with value: 2.1951474620740763.
[I 2026-03-12 02:03:06,944] Trial 301 finished with value: 1.08926017845721 and parameters: {'timeframe': 'M15', 'atr_period': 13, 'atr_threshold': 2.0, 'pt_mult': 2.5, 'sl_mult': 5.0, 'td_mins': 120}. Best is trial 290 with value: 2.1951474620740763.
[I 2026-03-12 02:03:07,397] Trial 302 finished with value: 1.08926017845721 and parameters: {'timeframe': 'M15', 'atr_period': 13, 'atr_threshold': 2.0, 'pt_mult': 2.5, 'sl_mult': 5.0, 'td_mins': 120}. Best is trial 290 with value: 2.1951474620740763.
[I 2026-03-12 02:03:08,119] Trial 303 finished with value: 1.977309488674108 and parameters: {'timeframe': 'M15', 'atr_period': 13, 'atr_threshold': 3.0, 'pt_mult': 1.0, 'sl_mult': 5.0, 'td_mins': 360}. Best is trial 290 with value: 2.1951474620740763.
[I 2026-03-12 02:03:08,866] Trial 304 finished with value: 1.977309488674108 and parameters: {'timeframe': 'M15', 'atr_period': 13, 'atr_threshold': 3.0, 'pt_mult': 1.0, 'sl_mult': 5.0, 'td_mins': 360}. Best is trial 290 with value: 2.1951474620740763.
[I 2026-03-12 02:03:09,584] Trial 305 finished with value: 1.977309488674108 and parameters: {'timeframe': 'M15', 'atr_period': 13, 'atr_threshold': 3.0, 'pt_mult': 1.0, 'sl_mult': 5.0, 'td_mins': 360}. Best is trial 290 with value: 2.1951474620740763.
