[I 2026-03-12 00:44:52,114] Trial 881 finished with value: 2.153336081466255 and parameters: {'timeframe': 'M1', 'atr_period': 13, 'atr_threshold': 2.0, 'pt_mult': 0.5, 'sl_mult': 5.0, 'td_mins': 5}. Best is trial 695 with value: 2.153336081466255.
[I 2026-03-12 00:44:52,167] Trial 882 finished with value: 0.0 and parameters: {'timeframe': 'M1', 'atr_period': 13, 'atr_threshold': 15.0, 'pt_mult': 0.5, 'sl_mult': 2.5, 'td_mins': 120}. Best is trial 695 with value: 2.153336081466255.
[I 2026-03-12 00:44:52,304] Trial 883 pruned. 
[I 2026-03-12 00:44:52,849] Trial 884 pruned. 
[I 2026-03-12 00:44:53,202] Trial 885 pruned. 
[I 2026-03-12 00:44:53,303] Trial 886 pruned. 
[I 2026-03-12 00:44:53,398] Trial 887 finished with value: 2.153336081466255 and parameters: {'timeframe': 'M1', 'atr_period': 13, 'atr_threshold': 2.0, 'pt_mult': 0.5, 'sl_mult': 5.0, 'td_mins': 5}. Best is trial 695 with value: 2.153336081466255.
[I 2026-03-12 00:44:53,463] Trial 888 pruned. 
[I 2026-03-12 00:44:53,589] Trial 889 pruned. 
[I 2026-03-12 00:44:53,663] Trial 890 pruned. 
[I 2026-03-12 00:44:53,758] Trial 891 finished with value: 2.153336081466255 and parameters: {'timeframe': 'M1', 'atr_period': 13, 'atr_threshold': 2.0, 'pt_mult': 0.5, 'sl_mult': 5.0, 'td_mins': 5}. Best is trial 695 with value: 2.153336081466255.
[I 2026-03-12 00:44:53,890] Trial 892 pruned. 
[I 2026-03-12 00:44:53,981] Trial 893 finished with value: 2.153336081466255 and parameters: {'timeframe': 'M1', 'atr_period': 13, 'atr_threshold': 2.0, 'pt_mult': 0.5, 'sl_mult': 5.0, 'td_mins': 5}. Best is trial 695 with value: 2.153336081466255.
[I 2026-03-12 00:44:54,038] Trial 894 pruned. 
[I 2026-03-12 00:44:54,108] Trial 895 pruned. 
[I 2026-03-12 00:44:54,161] Trial 896 finished with value: 0.0 and parameters: {'timeframe': 'M1', 'atr_period': 13, 'atr_threshold': 5.0, 'pt_mult': 0.5, 'sl_mult': 5.0, 'td_mins': 1200}. Best is trial 695 with value: 2.153336081466255.
[I 2026-03-12 00:44:54,212] Trial 897 finished with value: 0.0 and parameters: {'timeframe': 'M1', 'atr_period': 13, 'atr_threshold': 8.0, 'pt_mult': 0.5, 'sl_mult': 5.0, 'td_mins': 5}. Best is trial 695 with value: 2.153336081466255.
[I 2026-03-12 00:44:55,257] Trial 898 pruned. 
[I 2026-03-12 00:44:55,334] Trial 899 finished with value: 0.0 and parameters: {'timeframe': 'M1', 'atr_period': 13, 'atr_threshold': 10.0, 'pt_mult': 0.5, 'sl_mult': 2.5, 'td_mins': 30}. Best is trial 695 with value: 2.153336081466255.
[I 2026-03-12 00:44:55,403] Trial 900 finished with value: 0.0 and parameters: {'timeframe': 'M1', 'atr_period': 13, 'atr_threshold': 15.0, 'pt_mult': 0.5, 'sl_mult': 5.0, 'td_mins': 5}. Best is trial 695 with value: 2.153336081466255.
[I 2026-03-12 00:44:55,470] Trial 901 finished with value: 0.0 and parameters: {'timeframe': 'M1', 'atr_period': 13, 'atr_threshold': 10.0, 'pt_mult': 0.5, 'sl_mult': 5.0, 'td_mins': 5}. Best is trial 695 with value: 2.153336081466255.
[I 2026-03-12 00:44:55,538] Trial 902 finished with value: 0.0 and parameters: {'timeframe': 'M1', 'atr_period': 13, 'atr_threshold': 5.0, 'pt_mult': 0.5, 'sl_mult': 1.0, 'td_mins': 15}. Best is trial 695 with value: 2.153336081466255.
[I 2026-03-12 00:44:55,691] Trial 903 finished with value: 2.153336081466255 and parameters: {'timeframe': 'M1', 'atr_period': 13, 'atr_threshold': 2.0, 'pt_mult': 0.5, 'sl_mult': 5.0, 'td_mins': 5}. Best is trial 695 with value: 2.153336081466255.
[I 2026-03-12 00:44:55,751] Trial 904 finished with value: 0.0 and parameters: {'timeframe': 'M1', 'atr_period': 13, 'atr_threshold': 8.0, 'pt_mult': 5.0, 'sl_mult': 2.5, 'td_mins': 60}. Best is trial 695 with value: 2.153336081466255.
[I 2026-03-12 00:44:55,829] Trial 905 pruned. 
[I 2026-03-12 00:44:56,802] Trial 906 pruned. 
[I 2026-03-12 00:44:56,879] Trial 907 finished with value: 0.0 and parameters: {'timeframe': 'M1', 'atr_period': 13, 'atr_threshold': 3.0, 'pt_mult': 5.0, 'sl_mult': 0.5, 'td_mins': 360}. Best is trial 695 with value: 2.153336081466255.
[I 2026-03-12 00:44:56,995] Trial 908 pruned. 
[I 2026-03-12 00:44:57,135] Trial 909 pruned. 
[I 2026-03-12 00:44:57,212] Trial 910 finished with value: 0.0 and parameters: {'timeframe': 'M1', 'atr_period': 13, 'atr_threshold': 5.0, 'pt_mult': 0.5, 'sl_mult': 5.0, 'td_mins': 30}. Best is trial 695 with value: 2.153336081466255.
[I 2026-03-12 00:44:57,283] Trial 911 pruned. 
[I 2026-03-12 00:44:57,355] Trial 912 finished with value: 0.0 and parameters: {'timeframe': 'M1', 'atr_period': 13, 'atr_threshold': 15.0, 'pt_mult': 0.5, 'sl_mult': 2.5, 'td_mins': 1200}. Best is trial 695 with value: 2.153336081466255.
[I 2026-03-12 00:44:57,549] Trial 913 pruned. 
[I 2026-03-12 00:44:57,606] Trial 914 finished with value: 0.0 and parameters: {'timeframe': 'M1', 'atr_period': 13, 'atr_threshold': 5.0, 'pt_mult': 0.5, 'sl_mult': 5.0, 'td_mins': 5}. Best is trial 695 with value: 2.153336081466255.
[I 2026-03-12 00:44:57,663] Trial 915 finished with value: 0.0 and parameters: {'timeframe': 'M1', 'atr_period': 13, 'atr_threshold': 3.0, 'pt_mult': 0.5, 'sl_mult': 5.0, 'td_mins': 5}. Best is trial 695 with value: 2.153336081466255.
[I 2026-03-12 00:44:57,726] Trial 916 finished with value: 0.0 and parameters: {'timeframe': 'M1', 'atr_period': 13, 'atr_threshold': 15.0, 'pt_mult': 0.5, 'sl_mult': 2.5, 'td_mins': 5}. Best is trial 695 with value: 2.153336081466255.
[I 2026-03-12 00:44:57,834] Trial 917 finished with value: 2.153336081466255 and parameters: {'timeframe': 'M1', 'atr_period': 13, 'atr_threshold': 2.0, 'pt_mult': 0.5, 'sl_mult': 5.0, 'td_mins': 5}. Best is trial 695 with value: 2.153336081466255.
[I 2026-03-12 00:44:57,892] Trial 918 pruned. 
[I 2026-03-12 00:44:57,999] Trial 919 finished with value: 2.153336081466255 and parameters: {'timeframe': 'M1', 'atr_period': 13, 'atr_threshold': 2.0, 'pt_mult': 0.5, 'sl_mult': 5.0, 'td_mins': 5}. Best is trial 695 with value: 2.153336081466255.
[I 2026-03-12 00:44:58,108] Trial 920 finished with value: 2.153336081466255 and parameters: {'timeframe': 'M1', 'atr_period': 13, 'atr_threshold': 2.0, 'pt_mult': 0.5, 'sl_mult': 5.0, 'td_mins': 5}. Best is trial 695 with value: 2.153336081466255.
[I 2026-03-12 00:44:58,179] Trial 921 pruned. 
[I 2026-03-12 00:44:58,299] Trial 922 finished with value: 2.153336081466255 and parameters: {'timeframe': 'M1', 'atr_period': 13, 'atr_threshold': 2.0, 'pt_mult': 0.5, 'sl_mult': 5.0, 'td_mins': 5}. Best is trial 695 with value: 2.153336081466255.
[I 2026-03-12 00:44:58,600] Trial 923 pruned. 
[I 2026-03-12 00:44:58,691] Trial 924 pruned. 
[I 2026-03-12 00:44:58,751] Trial 925 finished with value: 0.0 and parameters: {'timeframe': 'M1', 'atr_period': 13, 'atr_threshold': 10.0, 'pt_mult': 0.5, 'sl_mult': 0.5, 'td_mins': 60}. Best is trial 695 with value: 2.153336081466255.
[I 2026-03-12 00:44:59,386] Trial 926 pruned. 
[I 2026-03-12 00:44:59,485] Trial 927 finished with value: 2.153336081466255 and parameters: {'timeframe': 'M1', 'atr_period': 13, 'atr_threshold': 2.0, 'pt_mult': 0.5, 'sl_mult': 5.0, 'td_mins': 5}. Best is trial 695 with value: 2.153336081466255.
[I 2026-03-12 00:45:00,003] Trial 928 pruned. 
[I 2026-03-12 00:45:00,061] Trial 929 finished with value: 0.0 and parameters: {'timeframe': 'M1', 'atr_period': 13, 'atr_threshold': 3.0, 'pt_mult': 0.5, 'sl_mult': 2.5, 'td_mins': 120}. Best is trial 695 with value: 2.153336081466255.
[I 2026-03-12 00:45:00,114] Trial 930 finished with value: 0.0 and parameters: {'timeframe': 'M1', 'atr_period': 13, 'atr_threshold': 5.0, 'pt_mult': 0.5, 'sl_mult': 0.5, 'td_mins': 1080}. Best is trial 695 with value: 2.153336081466255.
[I 2026-03-12 00:45:00,166] Trial 931 finished with value: 0.0 and parameters: {'timeframe': 'M1', 'atr_period': 13, 'atr_threshold': 10.0, 'pt_mult': 1.0, 'sl_mult': 2.5, 'td_mins': 720}. Best is trial 695 with value: 2.153336081466255.
[I 2026-03-12 00:45:00,281] Trial 932 finished with value: 2.153336081466255 and parameters: {'timeframe': 'M1', 'atr_period': 13, 'atr_threshold': 2.0, 'pt_mult': 0.5, 'sl_mult': 5.0, 'td_mins': 5}. Best is trial 695 with value: 2.153336081466255.
[I 2026-03-12 00:45:03,867] Trial 933 pruned. 
[I 2026-03-12 00:45:03,926] Trial 934 finished with value: 0.0 and parameters: {'timeframe': 'M1', 'atr_period': 13, 'atr_threshold': 5.0, 'pt_mult': 5.0, 'sl_mult': 0.5, 'td_mins': 60}. Best is trial 695 with value: 2.153336081466255.
[I 2026-03-12 00:45:03,977] Trial 935 finished with value: 0.0 and parameters: {'timeframe': 'M1', 'atr_period': 13, 'atr_threshold': 10.0, 'pt_mult': 0.5, 'sl_mult': 1.0, 'td_mins': 5}. Best is trial 695 with value: 2.153336081466255.
[I 2026-03-12 00:45:04,027] Trial 936 finished with value: 0.0 and parameters: {'timeframe': 'M1', 'atr_period': 13, 'atr_threshold': 10.0, 'pt_mult': 0.5, 'sl_mult': 0.5, 'td_mins': 5}. Best is trial 695 with value: 2.153336081466255.
[I 2026-03-12 00:45:04,122] Trial 937 finished with value: 2.153336081466255 and parameters: {'timeframe': 'M1', 'atr_period': 13, 'atr_threshold': 2.0, 'pt_mult': 0.5, 'sl_mult': 5.0, 'td_mins': 5}. Best is trial 695 with value: 2.153336081466255.
[I 2026-03-12 00:45:04,175] Trial 938 finished with value: 0.0 and parameters: {'timeframe': 'M1', 'atr_period': 13, 'atr_threshold': 3.0, 'pt_mult': 2.5, 'sl_mult': 0.5, 'td_mins': 1200}. Best is trial 695 with value: 2.153336081466255.
[I 2026-03-12 00:45:04,261] Trial 939 pruned. 
[I 2026-03-12 00:45:04,310] Trial 940 finished with value: 0.0 and parameters: {'timeframe': 'M1', 'atr_period': 13, 'atr_threshold': 10.0, 'pt_mult': 5.0, 'sl_mult': 0.5, 'td_mins': 120}. Best is trial 695 with value: 2.153336081466255.
[I 2026-03-12 00:45:04,363] Trial 941 finished with value: 0.0 and parameters: {'timeframe': 'M1', 'atr_period': 13, 'atr_threshold': 15.0, 'pt_mult': 5.0, 'sl_mult': 0.5, 'td_mins': 30}. Best is trial 695 with value: 2.153336081466255.
[I 2026-03-12 00:45:04,415] Trial 942 finished with value: 0.0 and parameters: {'timeframe': 'M1', 'atr_period': 13, 'atr_threshold': 5.0, 'pt_mult': 5.0, 'sl_mult': 2.5, 'td_mins': 5}. Best is trial 695 with value: 2.153336081466255.
[I 2026-03-12 00:45:04,505] Trial 943 finished with value: 2.153336081466255 and parameters: {'timeframe': 'M1', 'atr_period': 13, 'atr_threshold': 2.0, 'pt_mult': 0.5, 'sl_mult': 5.0, 'td_mins': 5}. Best is trial 695 with value: 2.153336081466255.
[I 2026-03-12 00:45:04,595] Trial 944 finished with value: 2.153336081466255 and parameters: {'timeframe': 'M1', 'atr_period': 13, 'atr_threshold': 2.0, 'pt_mult': 0.5, 'sl_mult': 5.0, 'td_mins': 5}. Best is trial 695 with value: 2.153336081466255.
[I 2026-03-12 00:45:04,690] Trial 945 finished with value: 2.153336081466255 and parameters: {'timeframe': 'M1', 'atr_period': 13, 'atr_threshold': 2.0, 'pt_mult': 0.5, 'sl_mult': 5.0, 'td_mins': 5}. Best is trial 695 with value: 2.153336081466255.
[I 2026-03-12 00:45:04,782] Trial 946 pruned. 
[I 2026-03-12 00:45:05,002] Trial 947 pruned. 
[I 2026-03-12 00:45:05,111] Trial 948 finished with value: 2.153336081466255 and parameters: {'timeframe': 'M1', 'atr_period': 13, 'atr_threshold': 2.0, 'pt_mult': 0.5, 'sl_mult': 5.0, 'td_mins': 5}. Best is trial 695 with value: 2.153336081466255.
[I 2026-03-12 00:45:05,249] Trial 949 finished with value: 2.153336081466255 and parameters: {'timeframe': 'M1', 'atr_period': 13, 'atr_threshold': 2.0, 'pt_mult': 0.5, 'sl_mult': 5.0, 'td_mins': 5}. Best is trial 695 with value: 2.153336081466255.
[I 2026-03-12 00:45:05,720] Trial 950 pruned. 
[I 2026-03-12 00:45:05,820] Trial 951 finished with value: 2.153336081466255 and parameters: {'timeframe': 'M1', 'atr_period': 13, 'atr_threshold': 2.0, 'pt_mult': 0.5, 'sl_mult': 5.0, 'td_mins': 5}. Best is trial 695 with value: 2.153336081466255.
[I 2026-03-12 00:45:05,916] Trial 952 finished with value: 2.153336081466255 and parameters: {'timeframe': 'M1', 'atr_period': 13, 'atr_threshold': 2.0, 'pt_mult': 0.5, 'sl_mult': 5.0, 'td_mins': 5}. Best is trial 695 with value: 2.153336081466255.
[I 2026-03-12 00:45:05,970] Trial 953 finished with value: 0.0 and parameters: {'timeframe': 'M1', 'atr_period': 13, 'atr_threshold': 3.0, 'pt_mult': 0.5, 'sl_mult': 2.5, 'td_mins': 60}. Best is trial 695 with value: 2.153336081466255.
[I 2026-03-12 00:45:06,022] Trial 954 finished with value: 0.0 and parameters: {'timeframe': 'M1', 'atr_period': 13, 'atr_threshold': 10.0, 'pt_mult': 0.5, 'sl_mult': 2.5, 'td_mins': 5}. Best is trial 695 with value: 2.153336081466255.
[I 2026-03-12 00:45:06,073] Trial 955 finished with value: 0.0 and parameters: {'timeframe': 'M1', 'atr_period': 13, 'atr_threshold': 10.0, 'pt_mult': 1.0, 'sl_mult': 2.5, 'td_mins': 360}. Best is trial 695 with value: 2.153336081466255.
[I 2026-03-12 00:45:06,141] Trial 956 pruned. 
[I 2026-03-12 00:45:06,293] Trial 957 pruned. 
[I 2026-03-12 00:45:06,388] Trial 958 finished with value: 2.153336081466255 and parameters: {'timeframe': 'M1', 'atr_period': 13, 'atr_threshold': 2.0, 'pt_mult': 0.5, 'sl_mult': 5.0, 'td_mins': 5}. Best is trial 695 with value: 2.153336081466255.
[I 2026-03-12 00:45:06,482] Trial 959 finished with value: 2.153336081466255 and parameters: {'timeframe': 'M1', 'atr_period': 13, 'atr_threshold': 2.0, 'pt_mult': 0.5, 'sl_mult': 5.0, 'td_mins': 5}. Best is trial 695 with value: 2.153336081466255.
[I 2026-03-12 00:45:06,575] Trial 960 finished with value: 2.153336081466255 and parameters: {'timeframe': 'M1', 'atr_period': 13, 'atr_threshold': 2.0, 'pt_mult': 0.5, 'sl_mult': 5.0, 'td_mins': 5}. Best is trial 695 with value: 2.153336081466255.
[I 2026-03-12 00:45:06,627] Trial 961 finished with value: 0.0 and parameters: {'timeframe': 'M1', 'atr_period': 13, 'atr_threshold': 10.0, 'pt_mult': 5.0, 'sl_mult': 2.5, 'td_mins': 1080}. Best is trial 695 with value: 2.153336081466255.
[I 2026-03-12 00:45:06,681] Trial 962 pruned. 
[I 2026-03-12 00:45:06,773] Trial 963 finished with value: 2.153336081466255 and parameters: {'timeframe': 'M1', 'atr_period': 13, 'atr_threshold': 2.0, 'pt_mult': 0.5, 'sl_mult': 5.0, 'td_mins': 5}. Best is trial 695 with value: 2.153336081466255.
[I 2026-03-12 00:45:06,868] Trial 964 finished with value: 2.153336081466255 and parameters: {'timeframe': 'M1', 'atr_period': 13, 'atr_threshold': 2.0, 'pt_mult': 0.5, 'sl_mult': 5.0, 'td_mins': 5}. Best is trial 695 with value: 2.153336081466255.
[I 2026-03-12 00:45:06,924] Trial 965 pruned. 
[I 2026-03-12 00:45:09,682] Trial 966 pruned. 
[I 2026-03-12 00:45:09,811] Trial 967 pruned. 
[I 2026-03-12 00:45:09,902] Trial 968 finished with value: 2.153336081466255 and parameters: {'timeframe': 'M1', 'atr_period': 13, 'atr_threshold': 2.0, 'pt_mult': 0.5, 'sl_mult': 5.0, 'td_mins': 5}. Best is trial 695 with value: 2.153336081466255.
[I 2026-03-12 00:45:09,997] Trial 969 finished with value: 2.153336081466255 and parameters: {'timeframe': 'M1', 'atr_period': 13, 'atr_threshold': 2.0, 'pt_mult': 0.5, 'sl_mult': 5.0, 'td_mins': 5}. Best is trial 695 with value: 2.153336081466255.
[I 2026-03-12 00:45:10,048] Trial 970 finished with value: 0.0 and parameters: {'timeframe': 'M1', 'atr_period': 13, 'atr_threshold': 3.0, 'pt_mult': 0.5, 'sl_mult': 2.5, 'td_mins': 180}. Best is trial 695 with value: 2.153336081466255.
[I 2026-03-12 00:45:10,120] Trial 971 pruned. 
[I 2026-03-12 00:45:10,235] Trial 972 pruned. 
[I 2026-03-12 00:45:10,292] Trial 973 finished with value: 0.0 and parameters: {'timeframe': 'M1', 'atr_period': 13, 'atr_threshold': 8.0, 'pt_mult': 1.0, 'sl_mult': 2.5, 'td_mins': 720}. Best is trial 695 with value: 2.153336081466255.
[I 2026-03-12 00:45:10,393] Trial 974 pruned. 
[I 2026-03-12 00:45:10,447] Trial 975 finished with value: 0.0 and parameters: {'timeframe': 'M1', 'atr_period': 13, 'atr_threshold': 8.0, 'pt_mult': 0.5, 'sl_mult': 5.0, 'td_mins': 30}. Best is trial 695 with value: 2.153336081466255.
[I 2026-03-12 00:45:10,502] Trial 976 finished with value: 0.0 and parameters: {'timeframe': 'M1', 'atr_period': 13, 'atr_threshold': 3.0, 'pt_mult': 5.0, 'sl_mult': 5.0, 'td_mins': 60}. Best is trial 695 with value: 2.153336081466255.
[I 2026-03-12 00:45:10,609] Trial 977 finished with value: 2.153336081466255 and parameters: {'timeframe': 'M1', 'atr_period': 13, 'atr_threshold': 2.0, 'pt_mult': 0.5, 'sl_mult': 5.0, 'td_mins': 5}. Best is trial 695 with value: 2.153336081466255.
[I 2026-03-12 00:45:10,701] Trial 978 finished with value: 2.153336081466255 and parameters: {'timeframe': 'M1', 'atr_period': 13, 'atr_threshold': 2.0, 'pt_mult': 0.5, 'sl_mult': 5.0, 'td_mins': 5}. Best is trial 695 with value: 2.153336081466255.
[I 2026-03-12 00:45:10,800] Trial 979 finished with value: 2.153336081466255 and parameters: {'timeframe': 'M1', 'atr_period': 13, 'atr_threshold': 2.0, 'pt_mult': 0.5, 'sl_mult': 5.0, 'td_mins': 5}. Best is trial 695 with value: 2.153336081466255.
[I 2026-03-12 00:45:10,879] Trial 980 pruned. 
[I 2026-03-12 00:45:10,929] Trial 981 finished with value: 0.0 and parameters: {'timeframe': 'M1', 'atr_period': 13, 'atr_threshold': 15.0, 'pt_mult': 0.5, 'sl_mult': 0.5, 'td_mins': 120}. Best is trial 695 with value: 2.153336081466255.
[I 2026-03-12 00:45:10,980] Trial 982 finished with value: 0.0 and parameters: {'timeframe': 'M1', 'atr_period': 13, 'atr_threshold': 3.0, 'pt_mult': 1.0, 'sl_mult': 2.5, 'td_mins': 5}. Best is trial 695 with value: 2.153336081466255.
[I 2026-03-12 00:45:11,210] Trial 983 pruned. 
[I 2026-03-12 00:45:11,352] Trial 984 pruned. 
[I 2026-03-12 00:45:11,448] Trial 985 finished with value: 2.153336081466255 and parameters: {'timeframe': 'M1', 'atr_period': 13, 'atr_threshold': 2.0, 'pt_mult': 0.5, 'sl_mult': 5.0, 'td_mins': 5}. Best is trial 695 with value: 2.153336081466255.
[I 2026-03-12 00:45:11,503] Trial 986 finished with value: 0.0 and parameters: {'timeframe': 'M1', 'atr_period': 13, 'atr_threshold': 8.0, 'pt_mult': 0.5, 'sl_mult': 5.0, 'td_mins': 5}. Best is trial 695 with value: 2.153336081466255.
[I 2026-03-12 00:45:11,641] Trial 987 pruned. 
[I 2026-03-12 00:45:11,736] Trial 988 finished with value: 2.153336081466255 and parameters: {'timeframe': 'M1', 'atr_period': 13, 'atr_threshold': 2.0, 'pt_mult': 0.5, 'sl_mult': 5.0, 'td_mins': 5}. Best is trial 695 with value: 2.153336081466255.
[I 2026-03-12 00:45:12,085] Trial 989 pruned. 
[I 2026-03-12 00:45:12,137] Trial 990 finished with value: 0.0 and parameters: {'timeframe': 'M1', 'atr_period': 13, 'atr_threshold': 10.0, 'pt_mult': 0.5, 'sl_mult': 5.0, 'td_mins': 5}. Best is trial 695 with value: 2.153336081466255.
[I 2026-03-12 00:45:13,122] Trial 991 pruned. 
[I 2026-03-12 00:45:14,672] Trial 992 pruned. 
[I 2026-03-12 00:45:14,728] Trial 993 finished with value: 0.0 and parameters: {'timeframe': 'M1', 'atr_period': 13, 'atr_threshold': 5.0, 'pt_mult': 0.5, 'sl_mult': 5.0, 'td_mins': 5}. Best is trial 695 with value: 2.153336081466255.
[I 2026-03-12 00:45:14,895] Trial 994 pruned. 
[I 2026-03-12 00:45:14,955] Trial 995 pruned. 
[I 2026-03-12 00:45:15,007] Trial 996 finished with value: 0.0 and parameters: {'timeframe': 'M1', 'atr_period': 13, 'atr_threshold': 15.0, 'pt_mult': 0.5, 'sl_mult': 5.0, 'td_mins': 5}. Best is trial 695 with value: 2.153336081466255.
[I 2026-03-12 00:45:15,061] Trial 997 pruned. 
[I 2026-03-12 00:45:15,112] Trial 998 finished with value: 0.0 and parameters: {'timeframe': 'M1', 'atr_period': 13, 'atr_threshold': 3.0, 'pt_mult': 2.5, 'sl_mult': 1.0, 'td_mins': 180}. Best is trial 695 with value: 2.153336081466255.
[I 2026-03-12 00:45:15,165] Trial 999 finished with value: 0.0 and parameters: {'timeframe': 'M1', 'atr_period': 13, 'atr_threshold': 5.0, 'pt_mult': 5.0, 'sl_mult': 5.0, 'td_mins': 5}. Best is trial 695 with value: 2.153336081466255.
2026-03-12 00:45:15,244 - INFO - === Starting Optuna Optimization for M3 (Trials: 1000) ===
/home/hephaestus-zero/.local/lib/python3.11/site-packages/optuna/_experimental.py:32: ExperimentalWarning: Argument ``multivariate`` is an experimental feature. The interface can change in the future.
  warnings.warn(
[I 2026-03-12 00:45:15,244] A new study created in memory with name: no-name-ac11f187-769e-4ccf-82fc-72bd51a87e7d
2026-03-12 00:45:15,248 - INFO -     [Cache Miss] Loading Signal Data for M3, ATR=13...
2026-03-12 00:45:51,000 - INFO -     [Cache Miss] Loading Signal Data for M3, ATR=13...
2026-03-12 00:46:26,612 - INFO -     [Cache Miss] Loading Signal Data for M3, ATR=13...
2026-03-12 00:47:02,499 - INFO -     [Cache Miss] Loading Signal Data for M3, ATR=13...
2026-03-12 00:47:37,983 - INFO -     [Cache Miss] Loading Signal Data for M3, ATR=13...
[I 2026-03-12 00:48:14,415] Trial 0 finished with value: 0.0 and parameters: {'timeframe': 'M3', 'atr_period': 13, 'atr_threshold': 15.0, 'pt_mult': 0.5, 'sl_mult': 1.0, 'td_mins': 60}. Best is trial 0 with value: 0.0.
[I 2026-03-12 00:48:14,458] Trial 1 finished with value: 0.0 and parameters: {'timeframe': 'M3', 'atr_period': 13, 'atr_threshold': 10.0, 'pt_mult': 0.5, 'sl_mult': 5.0, 'td_mins': 120}. Best is trial 0 with value: 0.0.
[I 2026-03-12 00:48:14,782] Trial 2 finished with value: 0.9689892831393584 and parameters: {'timeframe': 'M3', 'atr_period': 13, 'atr_threshold': 3.0, 'pt_mult': 0.5, 'sl_mult': 2.5, 'td_mins': 360}. Best is trial 2 with value: 0.9689892831393584.
[I 2026-03-12 00:48:17,984] Trial 3 finished with value: 0.788795192476984 and parameters: {'timeframe': 'M3', 'atr_period': 13, 'atr_threshold': 0.5, 'pt_mult': 5.0, 'sl_mult': 5.0, 'td_mins': 180}. Best is trial 2 with value: 0.9689892831393584.
[I 2026-03-12 00:48:19,430] Trial 4 finished with value: 1.0382226016359235 and parameters: {'timeframe': 'M3', 'atr_period': 13, 'atr_threshold': 1.0, 'pt_mult': 1.0, 'sl_mult': 0.5, 'td_mins': 360}. Best is trial 4 with value: 1.0382226016359235.
[I 2026-03-12 00:48:19,477] Trial 5 finished with value: 0.0 and parameters: {'timeframe': 'M3', 'atr_period': 13, 'atr_threshold': 8.0, 'pt_mult': 5.0, 'sl_mult': 2.5, 'td_mins': 1080}. Best is trial 4 with value: 1.0382226016359235.
