[I 2026-03-12 01:19:20,546] Trial 374 finished with value: 1.7154922913036164 and parameters: {'timeframe': 'mixed', 'atr_period': 13, 'atr_threshold': 3.0, 'pt_mult': 1.0, 'sl_mult': 5.0, 'td_mins': 120}. Best is trial 111 with value: 1.901343006707687.
[I 2026-03-12 01:19:20,729] Trial 375 pruned. 
[I 2026-03-12 01:19:21,828] Trial 376 finished with value: 1.901343006707687 and parameters: {'timeframe': 'mixed', 'atr_period': 13, 'atr_threshold': 3.0, 'pt_mult': 0.5, 'sl_mult': 5.0, 'td_mins': 180}. Best is trial 111 with value: 1.901343006707687.
[I 2026-03-12 01:19:22,980] Trial 377 finished with value: 1.901343006707687 and parameters: {'timeframe': 'mixed', 'atr_period': 13, 'atr_threshold': 3.0, 'pt_mult': 0.5, 'sl_mult': 5.0, 'td_mins': 180}. Best is trial 111 with value: 1.901343006707687.
[I 2026-03-12 01:19:24,092] Trial 378 finished with value: 1.901343006707687 and parameters: {'timeframe': 'mixed', 'atr_period': 13, 'atr_threshold': 3.0, 'pt_mult': 0.5, 'sl_mult': 5.0, 'td_mins': 180}. Best is trial 111 with value: 1.901343006707687.
[I 2026-03-12 01:19:25,151] Trial 379 finished with value: 1.901343006707687 and parameters: {'timeframe': 'mixed', 'atr_period': 13, 'atr_threshold': 3.0, 'pt_mult': 0.5, 'sl_mult': 5.0, 'td_mins': 180}. Best is trial 111 with value: 1.901343006707687.
[I 2026-03-12 01:19:28,471] Trial 380 pruned. 
[I 2026-03-12 01:19:29,526] Trial 381 finished with value: 1.901343006707687 and parameters: {'timeframe': 'mixed', 'atr_period': 13, 'atr_threshold': 3.0, 'pt_mult': 0.5, 'sl_mult': 5.0, 'td_mins': 180}. Best is trial 111 with value: 1.901343006707687.
[I 2026-03-12 01:19:30,631] Trial 382 finished with value: 1.901343006707687 and parameters: {'timeframe': 'mixed', 'atr_period': 13, 'atr_threshold': 3.0, 'pt_mult': 0.5, 'sl_mult': 5.0, 'td_mins': 180}. Best is trial 111 with value: 1.901343006707687.
[I 2026-03-12 01:19:31,657] Trial 383 finished with value: 1.901343006707687 and parameters: {'timeframe': 'mixed', 'atr_period': 13, 'atr_threshold': 3.0, 'pt_mult': 0.5, 'sl_mult': 5.0, 'td_mins': 180}. Best is trial 111 with value: 1.901343006707687.
[I 2026-03-12 01:19:32,726] Trial 384 finished with value: 1.901343006707687 and parameters: {'timeframe': 'mixed', 'atr_period': 13, 'atr_threshold': 3.0, 'pt_mult': 0.5, 'sl_mult': 5.0, 'td_mins': 180}. Best is trial 111 with value: 1.901343006707687.
[I 2026-03-12 01:19:33,808] Trial 385 finished with value: 1.901343006707687 and parameters: {'timeframe': 'mixed', 'atr_period': 13, 'atr_threshold': 3.0, 'pt_mult': 0.5, 'sl_mult': 5.0, 'td_mins': 180}. Best is trial 111 with value: 1.901343006707687.
[I 2026-03-12 01:19:34,835] Trial 386 finished with value: 1.901343006707687 and parameters: {'timeframe': 'mixed', 'atr_period': 13, 'atr_threshold': 3.0, 'pt_mult': 0.5, 'sl_mult': 5.0, 'td_mins': 180}. Best is trial 111 with value: 1.901343006707687.
[I 2026-03-12 01:19:35,919] Trial 387 finished with value: 1.901343006707687 and parameters: {'timeframe': 'mixed', 'atr_period': 13, 'atr_threshold': 3.0, 'pt_mult': 0.5, 'sl_mult': 5.0, 'td_mins': 180}. Best is trial 111 with value: 1.901343006707687.
[I 2026-03-12 01:19:37,044] Trial 388 finished with value: 1.901343006707687 and parameters: {'timeframe': 'mixed', 'atr_period': 13, 'atr_threshold': 3.0, 'pt_mult': 0.5, 'sl_mult': 5.0, 'td_mins': 180}. Best is trial 111 with value: 1.901343006707687.
[I 2026-03-12 01:19:38,162] Trial 389 finished with value: 1.901343006707687 and parameters: {'timeframe': 'mixed', 'atr_period': 13, 'atr_threshold': 3.0, 'pt_mult': 0.5, 'sl_mult': 5.0, 'td_mins': 180}. Best is trial 111 with value: 1.901343006707687.
[I 2026-03-12 01:19:39,203] Trial 390 finished with value: 1.901343006707687 and parameters: {'timeframe': 'mixed', 'atr_period': 13, 'atr_threshold': 3.0, 'pt_mult': 0.5, 'sl_mult': 5.0, 'td_mins': 180}. Best is trial 111 with value: 1.901343006707687.
[I 2026-03-12 01:19:40,278] Trial 391 finished with value: 1.901343006707687 and parameters: {'timeframe': 'mixed', 'atr_period': 13, 'atr_threshold': 3.0, 'pt_mult': 0.5, 'sl_mult': 5.0, 'td_mins': 180}. Best is trial 111 with value: 1.901343006707687.
[I 2026-03-12 01:19:41,308] Trial 392 finished with value: 1.901343006707687 and parameters: {'timeframe': 'mixed', 'atr_period': 13, 'atr_threshold': 3.0, 'pt_mult': 0.5, 'sl_mult': 5.0, 'td_mins': 180}. Best is trial 111 with value: 1.901343006707687.
[I 2026-03-12 01:19:42,422] Trial 393 finished with value: 1.901343006707687 and parameters: {'timeframe': 'mixed', 'atr_period': 13, 'atr_threshold': 3.0, 'pt_mult': 0.5, 'sl_mult': 5.0, 'td_mins': 180}. Best is trial 111 with value: 1.901343006707687.
[I 2026-03-12 01:19:43,587] Trial 394 finished with value: 1.901343006707687 and parameters: {'timeframe': 'mixed', 'atr_period': 13, 'atr_threshold': 3.0, 'pt_mult': 0.5, 'sl_mult': 5.0, 'td_mins': 180}. Best is trial 111 with value: 1.901343006707687.
[I 2026-03-12 01:19:44,616] Trial 395 finished with value: 1.901343006707687 and parameters: {'timeframe': 'mixed', 'atr_period': 13, 'atr_threshold': 3.0, 'pt_mult': 0.5, 'sl_mult': 5.0, 'td_mins': 180}. Best is trial 111 with value: 1.901343006707687.
[I 2026-03-12 01:19:45,764] Trial 396 finished with value: 1.901343006707687 and parameters: {'timeframe': 'mixed', 'atr_period': 13, 'atr_threshold': 3.0, 'pt_mult': 0.5, 'sl_mult': 5.0, 'td_mins': 180}. Best is trial 111 with value: 1.901343006707687.
[I 2026-03-12 01:19:46,800] Trial 397 finished with value: 1.901343006707687 and parameters: {'timeframe': 'mixed', 'atr_period': 13, 'atr_threshold': 3.0, 'pt_mult': 0.5, 'sl_mult': 5.0, 'td_mins': 180}. Best is trial 111 with value: 1.901343006707687.
[I 2026-03-12 01:19:47,934] Trial 398 finished with value: 1.901343006707687 and parameters: {'timeframe': 'mixed', 'atr_period': 13, 'atr_threshold': 3.0, 'pt_mult': 0.5, 'sl_mult': 5.0, 'td_mins': 180}. Best is trial 111 with value: 1.901343006707687.
[I 2026-03-12 01:19:49,148] Trial 399 finished with value: 1.901343006707687 and parameters: {'timeframe': 'mixed', 'atr_period': 13, 'atr_threshold': 3.0, 'pt_mult': 0.5, 'sl_mult': 5.0, 'td_mins': 180}. Best is trial 111 with value: 1.901343006707687.
[I 2026-03-12 01:19:50,266] Trial 400 finished with value: 1.901343006707687 and parameters: {'timeframe': 'mixed', 'atr_period': 13, 'atr_threshold': 3.0, 'pt_mult': 0.5, 'sl_mult': 5.0, 'td_mins': 180}. Best is trial 111 with value: 1.901343006707687.
[I 2026-03-12 01:19:51,388] Trial 401 finished with value: 1.901343006707687 and parameters: {'timeframe': 'mixed', 'atr_period': 13, 'atr_threshold': 3.0, 'pt_mult': 0.5, 'sl_mult': 5.0, 'td_mins': 180}. Best is trial 111 with value: 1.901343006707687.
[I 2026-03-12 01:19:52,587] Trial 402 finished with value: 1.901343006707687 and parameters: {'timeframe': 'mixed', 'atr_period': 13, 'atr_threshold': 3.0, 'pt_mult': 0.5, 'sl_mult': 5.0, 'td_mins': 180}. Best is trial 111 with value: 1.901343006707687.
[I 2026-03-12 01:19:52,794] Trial 403 pruned. 
[I 2026-03-12 01:19:53,347] Trial 404 finished with value: 2.1354320678443623 and parameters: {'timeframe': 'mixed', 'atr_period': 13, 'atr_threshold': 3.0, 'pt_mult': 0.5, 'sl_mult': 5.0, 'td_mins': 60}. Best is trial 404 with value: 2.1354320678443623.
[I 2026-03-12 01:19:53,893] Trial 405 finished with value: 2.1354320678443623 and parameters: {'timeframe': 'mixed', 'atr_period': 13, 'atr_threshold': 3.0, 'pt_mult': 0.5, 'sl_mult': 5.0, 'td_mins': 60}. Best is trial 404 with value: 2.1354320678443623.
[I 2026-03-12 01:19:54,450] Trial 406 finished with value: 2.1354320678443623 and parameters: {'timeframe': 'mixed', 'atr_period': 13, 'atr_threshold': 3.0, 'pt_mult': 0.5, 'sl_mult': 5.0, 'td_mins': 60}. Best is trial 404 with value: 2.1354320678443623.
[I 2026-03-12 01:19:55,008] Trial 407 finished with value: 2.1354320678443623 and parameters: {'timeframe': 'mixed', 'atr_period': 13, 'atr_threshold': 3.0, 'pt_mult': 0.5, 'sl_mult': 5.0, 'td_mins': 60}. Best is trial 404 with value: 2.1354320678443623.
[I 2026-03-12 01:19:55,561] Trial 408 finished with value: 2.1354320678443623 and parameters: {'timeframe': 'mixed', 'atr_period': 13, 'atr_threshold': 3.0, 'pt_mult': 0.5, 'sl_mult': 5.0, 'td_mins': 60}. Best is trial 404 with value: 2.1354320678443623.
[I 2026-03-12 01:19:56,138] Trial 409 finished with value: 2.1354320678443623 and parameters: {'timeframe': 'mixed', 'atr_period': 13, 'atr_threshold': 3.0, 'pt_mult': 0.5, 'sl_mult': 5.0, 'td_mins': 60}. Best is trial 404 with value: 2.1354320678443623.
[I 2026-03-12 01:19:56,685] Trial 410 finished with value: 2.1354320678443623 and parameters: {'timeframe': 'mixed', 'atr_period': 13, 'atr_threshold': 3.0, 'pt_mult': 0.5, 'sl_mult': 5.0, 'td_mins': 60}. Best is trial 404 with value: 2.1354320678443623.
[I 2026-03-12 01:19:57,222] Trial 411 finished with value: 2.1354320678443623 and parameters: {'timeframe': 'mixed', 'atr_period': 13, 'atr_threshold': 3.0, 'pt_mult': 0.5, 'sl_mult': 5.0, 'td_mins': 60}. Best is trial 404 with value: 2.1354320678443623.
[I 2026-03-12 01:19:57,799] Trial 412 finished with value: 2.1354320678443623 and parameters: {'timeframe': 'mixed', 'atr_period': 13, 'atr_threshold': 3.0, 'pt_mult': 0.5, 'sl_mult': 5.0, 'td_mins': 60}. Best is trial 404 with value: 2.1354320678443623.
[I 2026-03-12 01:19:58,352] Trial 413 finished with value: 2.1354320678443623 and parameters: {'timeframe': 'mixed', 'atr_period': 13, 'atr_threshold': 3.0, 'pt_mult': 0.5, 'sl_mult': 5.0, 'td_mins': 60}. Best is trial 404 with value: 2.1354320678443623.
[I 2026-03-12 01:19:58,932] Trial 414 finished with value: 2.1354320678443623 and parameters: {'timeframe': 'mixed', 'atr_period': 13, 'atr_threshold': 3.0, 'pt_mult': 0.5, 'sl_mult': 5.0, 'td_mins': 60}. Best is trial 404 with value: 2.1354320678443623.
[I 2026-03-12 01:19:59,546] Trial 415 finished with value: 2.1354320678443623 and parameters: {'timeframe': 'mixed', 'atr_period': 13, 'atr_threshold': 3.0, 'pt_mult': 0.5, 'sl_mult': 5.0, 'td_mins': 60}. Best is trial 404 with value: 2.1354320678443623.
[I 2026-03-12 01:20:00,126] Trial 416 finished with value: 2.1354320678443623 and parameters: {'timeframe': 'mixed', 'atr_period': 13, 'atr_threshold': 3.0, 'pt_mult': 0.5, 'sl_mult': 5.0, 'td_mins': 60}. Best is trial 404 with value: 2.1354320678443623.
[I 2026-03-12 01:20:00,793] Trial 417 finished with value: 2.1354320678443623 and parameters: {'timeframe': 'mixed', 'atr_period': 13, 'atr_threshold': 3.0, 'pt_mult': 0.5, 'sl_mult': 5.0, 'td_mins': 60}. Best is trial 404 with value: 2.1354320678443623.
[I 2026-03-12 01:20:01,413] Trial 418 finished with value: 2.1354320678443623 and parameters: {'timeframe': 'mixed', 'atr_period': 13, 'atr_threshold': 3.0, 'pt_mult': 0.5, 'sl_mult': 5.0, 'td_mins': 60}. Best is trial 404 with value: 2.1354320678443623.
[I 2026-03-12 01:20:01,960] Trial 419 finished with value: 2.1354320678443623 and parameters: {'timeframe': 'mixed', 'atr_period': 13, 'atr_threshold': 3.0, 'pt_mult': 0.5, 'sl_mult': 5.0, 'td_mins': 60}. Best is trial 404 with value: 2.1354320678443623.
[I 2026-03-12 01:20:02,513] Trial 420 finished with value: 2.1354320678443623 and parameters: {'timeframe': 'mixed', 'atr_period': 13, 'atr_threshold': 3.0, 'pt_mult': 0.5, 'sl_mult': 5.0, 'td_mins': 60}. Best is trial 404 with value: 2.1354320678443623.
[I 2026-03-12 01:20:03,089] Trial 421 finished with value: 2.1354320678443623 and parameters: {'timeframe': 'mixed', 'atr_period': 13, 'atr_threshold': 3.0, 'pt_mult': 0.5, 'sl_mult': 5.0, 'td_mins': 60}. Best is trial 404 with value: 2.1354320678443623.
[I 2026-03-12 01:20:03,639] Trial 422 finished with value: 2.1354320678443623 and parameters: {'timeframe': 'mixed', 'atr_period': 13, 'atr_threshold': 3.0, 'pt_mult': 0.5, 'sl_mult': 5.0, 'td_mins': 60}. Best is trial 404 with value: 2.1354320678443623.
[I 2026-03-12 01:20:04,204] Trial 423 finished with value: 2.1354320678443623 and parameters: {'timeframe': 'mixed', 'atr_period': 13, 'atr_threshold': 3.0, 'pt_mult': 0.5, 'sl_mult': 5.0, 'td_mins': 60}. Best is trial 404 with value: 2.1354320678443623.
[I 2026-03-12 01:20:04,757] Trial 424 finished with value: 2.1354320678443623 and parameters: {'timeframe': 'mixed', 'atr_period': 13, 'atr_threshold': 3.0, 'pt_mult': 0.5, 'sl_mult': 5.0, 'td_mins': 60}. Best is trial 404 with value: 2.1354320678443623.
[I 2026-03-12 01:20:05,301] Trial 425 finished with value: 2.1354320678443623 and parameters: {'timeframe': 'mixed', 'atr_period': 13, 'atr_threshold': 3.0, 'pt_mult': 0.5, 'sl_mult': 5.0, 'td_mins': 60}. Best is trial 404 with value: 2.1354320678443623.
[I 2026-03-12 01:20:05,839] Trial 426 finished with value: 2.1354320678443623 and parameters: {'timeframe': 'mixed', 'atr_period': 13, 'atr_threshold': 3.0, 'pt_mult': 0.5, 'sl_mult': 5.0, 'td_mins': 60}. Best is trial 404 with value: 2.1354320678443623.
[I 2026-03-12 01:20:06,390] Trial 427 finished with value: 2.1354320678443623 and parameters: {'timeframe': 'mixed', 'atr_period': 13, 'atr_threshold': 3.0, 'pt_mult': 0.5, 'sl_mult': 5.0, 'td_mins': 60}. Best is trial 404 with value: 2.1354320678443623.
[I 2026-03-12 01:20:06,931] Trial 428 finished with value: 2.1354320678443623 and parameters: {'timeframe': 'mixed', 'atr_period': 13, 'atr_threshold': 3.0, 'pt_mult': 0.5, 'sl_mult': 5.0, 'td_mins': 60}. Best is trial 404 with value: 2.1354320678443623.
[I 2026-03-12 01:20:07,492] Trial 429 finished with value: 2.1354320678443623 and parameters: {'timeframe': 'mixed', 'atr_period': 13, 'atr_threshold': 3.0, 'pt_mult': 0.5, 'sl_mult': 5.0, 'td_mins': 60}. Best is trial 404 with value: 2.1354320678443623.
[I 2026-03-12 01:20:07,677] Trial 430 finished with value: 0.0 and parameters: {'timeframe': 'mixed', 'atr_period': 13, 'atr_threshold': 15.0, 'pt_mult': 0.5, 'sl_mult': 5.0, 'td_mins': 60}. Best is trial 404 with value: 2.1354320678443623.
[I 2026-03-12 01:20:07,803] Trial 431 pruned. 
[I 2026-03-12 01:20:07,932] Trial 432 pruned. 
[I 2026-03-12 01:20:08,075] Trial 433 pruned. 
[I 2026-03-12 01:20:08,211] Trial 434 pruned. 
[I 2026-03-12 01:20:09,280] Trial 435 finished with value: 1.763842190550027 and parameters: {'timeframe': 'mixed', 'atr_period': 13, 'atr_threshold': 2.0, 'pt_mult': 0.5, 'sl_mult': 5.0, 'td_mins': 60}. Best is trial 404 with value: 2.1354320678443623.
[I 2026-03-12 01:20:10,182] Trial 436 pruned. 
[I 2026-03-12 01:20:10,796] Trial 437 finished with value: 2.1354320678443623 and parameters: {'timeframe': 'mixed', 'atr_period': 13, 'atr_threshold': 3.0, 'pt_mult': 0.5, 'sl_mult': 5.0, 'td_mins': 60}. Best is trial 404 with value: 2.1354320678443623.
[I 2026-03-12 01:20:11,353] Trial 438 finished with value: 1.3213631181775574 and parameters: {'timeframe': 'mixed', 'atr_period': 13, 'atr_threshold': 3.0, 'pt_mult': 0.5, 'sl_mult': 2.5, 'td_mins': 60}. Best is trial 404 with value: 2.1354320678443623.
[I 2026-03-12 01:20:11,508] Trial 439 pruned. 
[I 2026-03-12 01:20:11,633] Trial 440 pruned. 
[I 2026-03-12 01:20:11,889] Trial 441 finished with value: 1.851061453289293 and parameters: {'timeframe': 'mixed', 'atr_period': 13, 'atr_threshold': 5.0, 'pt_mult': 0.5, 'sl_mult': 5.0, 'td_mins': 60}. Best is trial 404 with value: 2.1354320678443623.
[I 2026-03-12 01:20:14,069] Trial 442 finished with value: 1.4160810995338415 and parameters: {'timeframe': 'mixed', 'atr_period': 13, 'atr_threshold': 1.0, 'pt_mult': 0.5, 'sl_mult': 5.0, 'td_mins': 60}. Best is trial 404 with value: 2.1354320678443623.
[I 2026-03-12 01:20:14,620] Trial 443 finished with value: 2.1354320678443623 and parameters: {'timeframe': 'mixed', 'atr_period': 13, 'atr_threshold': 3.0, 'pt_mult': 0.5, 'sl_mult': 5.0, 'td_mins': 60}. Best is trial 404 with value: 2.1354320678443623.
[I 2026-03-12 01:20:15,073] Trial 444 pruned. 
[I 2026-03-12 01:20:15,665] Trial 445 finished with value: 2.1354320678443623 and parameters: {'timeframe': 'mixed', 'atr_period': 13, 'atr_threshold': 3.0, 'pt_mult': 0.5, 'sl_mult': 5.0, 'td_mins': 60}. Best is trial 404 with value: 2.1354320678443623.
[I 2026-03-12 01:20:16,223] Trial 446 finished with value: 2.1354320678443623 and parameters: {'timeframe': 'mixed', 'atr_period': 13, 'atr_threshold': 3.0, 'pt_mult': 0.5, 'sl_mult': 5.0, 'td_mins': 60}. Best is trial 404 with value: 2.1354320678443623.
[I 2026-03-12 01:20:17,956] Trial 447 finished with value: 1.5267182676010331 and parameters: {'timeframe': 'mixed', 'atr_period': 13, 'atr_threshold': 3.0, 'pt_mult': 0.5, 'sl_mult': 5.0, 'td_mins': 360}. Best is trial 404 with value: 2.1354320678443623.
[I 2026-03-12 01:20:18,279] Trial 448 pruned. 
[I 2026-03-12 01:20:19,097] Trial 449 finished with value: 2.0147840062204914 and parameters: {'timeframe': 'mixed', 'atr_period': 13, 'atr_threshold': 3.0, 'pt_mult': 0.5, 'sl_mult': 5.0, 'td_mins': 120}. Best is trial 404 with value: 2.1354320678443623.
[I 2026-03-12 01:20:19,654] Trial 450 finished with value: 1.6158139878770883 and parameters: {'timeframe': 'mixed', 'atr_period': 13, 'atr_threshold': 3.0, 'pt_mult': 1.0, 'sl_mult': 5.0, 'td_mins': 60}. Best is trial 404 with value: 2.1354320678443623.
[I 2026-03-12 01:20:20,188] Trial 451 finished with value: 2.1354320678443623 and parameters: {'timeframe': 'mixed', 'atr_period': 13, 'atr_threshold': 3.0, 'pt_mult': 0.5, 'sl_mult': 5.0, 'td_mins': 60}. Best is trial 404 with value: 2.1354320678443623.
[I 2026-03-12 01:20:20,584] Trial 452 finished with value: 1.9468260827108126 and parameters: {'timeframe': 'mixed', 'atr_period': 13, 'atr_threshold': 3.0, 'pt_mult': 0.5, 'sl_mult': 5.0, 'td_mins': 30}. Best is trial 404 with value: 2.1354320678443623.
[I 2026-03-12 01:20:21,157] Trial 453 finished with value: 2.1354320678443623 and parameters: {'timeframe': 'mixed', 'atr_period': 13, 'atr_threshold': 3.0, 'pt_mult': 0.5, 'sl_mult': 5.0, 'td_mins': 60}. Best is trial 404 with value: 2.1354320678443623.
[I 2026-03-12 01:20:21,754] Trial 454 finished with value: 2.1354320678443623 and parameters: {'timeframe': 'mixed', 'atr_period': 13, 'atr_threshold': 3.0, 'pt_mult': 0.5, 'sl_mult': 5.0, 'td_mins': 60}. Best is trial 404 with value: 2.1354320678443623.
[I 2026-03-12 01:20:21,903] Trial 455 pruned. 
[I 2026-03-12 01:20:22,514] Trial 456 finished with value: 2.1354320678443623 and parameters: {'timeframe': 'mixed', 'atr_period': 13, 'atr_threshold': 3.0, 'pt_mult': 0.5, 'sl_mult': 5.0, 'td_mins': 60}. Best is trial 404 with value: 2.1354320678443623.
[I 2026-03-12 01:20:22,972] Trial 457 pruned. 
[I 2026-03-12 01:20:23,156] Trial 458 finished with value: 0.0 and parameters: {'timeframe': 'mixed', 'atr_period': 13, 'atr_threshold': 10.0, 'pt_mult': 0.5, 'sl_mult': 5.0, 'td_mins': 1080}. Best is trial 404 with value: 2.1354320678443623.
[I 2026-03-12 01:20:23,323] Trial 459 finished with value: 0.0 and parameters: {'timeframe': 'mixed', 'atr_period': 13, 'atr_threshold': 10.0, 'pt_mult': 0.5, 'sl_mult': 5.0, 'td_mins': 120}. Best is trial 404 with value: 2.1354320678443623.
[I 2026-03-12 01:20:23,635] Trial 460 finished with value: 1.4386754512980953 and parameters: {'timeframe': 'mixed', 'atr_period': 13, 'atr_threshold': 3.0, 'pt_mult': 0.5, 'sl_mult': 5.0, 'td_mins': 15}. Best is trial 404 with value: 2.1354320678443623.
[I 2026-03-12 01:20:29,200] Trial 461 pruned. 
[I 2026-03-12 01:20:29,776] Trial 462 finished with value: 2.1354320678443623 and parameters: {'timeframe': 'mixed', 'atr_period': 13, 'atr_threshold': 3.0, 'pt_mult': 0.5, 'sl_mult': 5.0, 'td_mins': 60}. Best is trial 404 with value: 2.1354320678443623.
[I 2026-03-12 01:20:30,650] Trial 463 pruned. 
[I 2026-03-12 01:20:31,052] Trial 464 pruned. 
[I 2026-03-12 01:20:31,200] Trial 465 pruned. 
[I 2026-03-12 01:20:31,348] Trial 466 pruned. 
[I 2026-03-12 01:20:31,514] Trial 467 finished with value: 0.0 and parameters: {'timeframe': 'mixed', 'atr_period': 13, 'atr_threshold': 15.0, 'pt_mult': 5.0, 'sl_mult': 5.0, 'td_mins': 60}. Best is trial 404 with value: 2.1354320678443623.
[I 2026-03-12 01:20:31,640] Trial 468 pruned. 
[I 2026-03-12 01:20:31,803] Trial 469 finished with value: 0.0 and parameters: {'timeframe': 'mixed', 'atr_period': 13, 'atr_threshold': 10.0, 'pt_mult': 0.5, 'sl_mult': 0.5, 'td_mins': 60}. Best is trial 404 with value: 2.1354320678443623.
[I 2026-03-12 01:20:35,337] Trial 470 finished with value: 1.3908442511512857 and parameters: {'timeframe': 'mixed', 'atr_period': 13, 'atr_threshold': 2.0, 'pt_mult': 0.5, 'sl_mult': 5.0, 'td_mins': 360}. Best is trial 404 with value: 2.1354320678443623.
[I 2026-03-12 01:20:35,865] Trial 471 finished with value: 2.1354320678443623 and parameters: {'timeframe': 'mixed', 'atr_period': 13, 'atr_threshold': 3.0, 'pt_mult': 0.5, 'sl_mult': 5.0, 'td_mins': 60}. Best is trial 404 with value: 2.1354320678443623.
[I 2026-03-12 01:20:36,074] Trial 472 pruned. 
[I 2026-03-12 01:20:36,242] Trial 473 finished with value: 0.0 and parameters: {'timeframe': 'mixed', 'atr_period': 13, 'atr_threshold': 10.0, 'pt_mult': 2.5, 'sl_mult': 5.0, 'td_mins': 60}. Best is trial 404 with value: 2.1354320678443623.
[I 2026-03-12 01:20:36,362] Trial 474 pruned. 
[I 2026-03-12 01:20:36,526] Trial 475 finished with value: 0.0 and parameters: {'timeframe': 'mixed', 'atr_period': 13, 'atr_threshold': 10.0, 'pt_mult': 5.0, 'sl_mult': 5.0, 'td_mins': 60}. Best is trial 404 with value: 2.1354320678443623.
[I 2026-03-12 01:20:37,069] Trial 476 finished with value: 2.1354320678443623 and parameters: {'timeframe': 'mixed', 'atr_period': 13, 'atr_threshold': 3.0, 'pt_mult': 0.5, 'sl_mult': 5.0, 'td_mins': 60}. Best is trial 404 with value: 2.1354320678443623.
[I 2026-03-12 01:20:37,235] Trial 477 finished with value: 0.0 and parameters: {'timeframe': 'mixed', 'atr_period': 13, 'atr_threshold': 15.0, 'pt_mult': 0.5, 'sl_mult': 5.0, 'td_mins': 1080}. Best is trial 404 with value: 2.1354320678443623.
