[I 2026-03-12 00:58:26,796] Trial 901 finished with value: 0.0 and parameters: {'timeframe': 'M5', 'atr_period': 13, 'atr_threshold': 15.0, 'pt_mult': 0.5, 'sl_mult': 0.5, 'td_mins': 120}. Best is trial 378 with value: 2.3870654100539324.
[I 2026-03-12 00:58:26,946] Trial 902 finished with value: 2.3870654100539324 and parameters: {'timeframe': 'M5', 'atr_period': 13, 'atr_threshold': 3.0, 'pt_mult': 0.5, 'sl_mult': 5.0, 'td_mins': 30}. Best is trial 378 with value: 2.3870654100539324.
[I 2026-03-12 00:58:27,087] Trial 903 finished with value: 2.3870654100539324 and parameters: {'timeframe': 'M5', 'atr_period': 13, 'atr_threshold': 3.0, 'pt_mult': 0.5, 'sl_mult': 5.0, 'td_mins': 30}. Best is trial 378 with value: 2.3870654100539324.
[I 2026-03-12 00:58:27,143] Trial 904 finished with value: 0.0 and parameters: {'timeframe': 'M5', 'atr_period': 13, 'atr_threshold': 15.0, 'pt_mult': 1.0, 'sl_mult': 1.0, 'td_mins': 720}. Best is trial 378 with value: 2.3870654100539324.
[I 2026-03-12 00:58:27,304] Trial 905 finished with value: 2.3870654100539324 and parameters: {'timeframe': 'M5', 'atr_period': 13, 'atr_threshold': 3.0, 'pt_mult': 0.5, 'sl_mult': 5.0, 'td_mins': 30}. Best is trial 378 with value: 2.3870654100539324.
[I 2026-03-12 00:58:27,367] Trial 906 finished with value: 0.0 and parameters: {'timeframe': 'M5', 'atr_period': 13, 'atr_threshold': 5.0, 'pt_mult': 0.5, 'sl_mult': 1.0, 'td_mins': 1200}. Best is trial 378 with value: 2.3870654100539324.
[I 2026-03-12 00:58:27,431] Trial 907 finished with value: 0.0 and parameters: {'timeframe': 'M5', 'atr_period': 13, 'atr_threshold': 10.0, 'pt_mult': 5.0, 'sl_mult': 1.0, 'td_mins': 5}. Best is trial 378 with value: 2.3870654100539324.
[I 2026-03-12 00:58:27,616] Trial 908 finished with value: 2.3870654100539324 and parameters: {'timeframe': 'M5', 'atr_period': 13, 'atr_threshold': 3.0, 'pt_mult': 0.5, 'sl_mult': 5.0, 'td_mins': 30}. Best is trial 378 with value: 2.3870654100539324.
[I 2026-03-12 00:58:27,693] Trial 909 pruned. 
[I 2026-03-12 00:58:27,761] Trial 910 finished with value: 0.0 and parameters: {'timeframe': 'M5', 'atr_period': 13, 'atr_threshold': 15.0, 'pt_mult': 5.0, 'sl_mult': 0.5, 'td_mins': 5}. Best is trial 378 with value: 2.3870654100539324.
[I 2026-03-12 00:58:27,833] Trial 911 finished with value: 0.0 and parameters: {'timeframe': 'M5', 'atr_period': 13, 'atr_threshold': 5.0, 'pt_mult': 2.5, 'sl_mult': 1.0, 'td_mins': 30}. Best is trial 378 with value: 2.3870654100539324.
[I 2026-03-12 00:58:27,910] Trial 912 pruned. 
[I 2026-03-12 00:58:28,055] Trial 913 finished with value: 2.3870654100539324 and parameters: {'timeframe': 'M5', 'atr_period': 13, 'atr_threshold': 3.0, 'pt_mult': 0.5, 'sl_mult': 5.0, 'td_mins': 30}. Best is trial 378 with value: 2.3870654100539324.
[I 2026-03-12 00:58:28,138] Trial 914 pruned. 
[I 2026-03-12 00:58:28,285] Trial 915 finished with value: 2.3870654100539324 and parameters: {'timeframe': 'M5', 'atr_period': 13, 'atr_threshold': 3.0, 'pt_mult': 0.5, 'sl_mult': 5.0, 'td_mins': 30}. Best is trial 378 with value: 2.3870654100539324.
[I 2026-03-12 00:58:28,431] Trial 916 finished with value: 2.3870654100539324 and parameters: {'timeframe': 'M5', 'atr_period': 13, 'atr_threshold': 3.0, 'pt_mult': 0.5, 'sl_mult': 5.0, 'td_mins': 30}. Best is trial 378 with value: 2.3870654100539324.
[I 2026-03-12 00:58:28,548] Trial 917 pruned. 
[I 2026-03-12 00:58:28,604] Trial 918 finished with value: 0.0 and parameters: {'timeframe': 'M5', 'atr_period': 13, 'atr_threshold': 10.0, 'pt_mult': 5.0, 'sl_mult': 2.5, 'td_mins': 120}. Best is trial 378 with value: 2.3870654100539324.
[I 2026-03-12 00:58:28,656] Trial 919 finished with value: 0.0 and parameters: {'timeframe': 'M5', 'atr_period': 13, 'atr_threshold': 8.0, 'pt_mult': 0.5, 'sl_mult': 1.0, 'td_mins': 720}. Best is trial 378 with value: 2.3870654100539324.
[I 2026-03-12 00:58:28,860] Trial 920 pruned. 
[I 2026-03-12 00:58:28,987] Trial 921 finished with value: 2.3870654100539324 and parameters: {'timeframe': 'M5', 'atr_period': 13, 'atr_threshold': 3.0, 'pt_mult': 0.5, 'sl_mult': 5.0, 'td_mins': 30}. Best is trial 378 with value: 2.3870654100539324.
[I 2026-03-12 00:58:29,110] Trial 922 finished with value: 2.3870654100539324 and parameters: {'timeframe': 'M5', 'atr_period': 13, 'atr_threshold': 3.0, 'pt_mult': 0.5, 'sl_mult': 5.0, 'td_mins': 30}. Best is trial 378 with value: 2.3870654100539324.
[I 2026-03-12 00:58:29,158] Trial 923 finished with value: 0.0 and parameters: {'timeframe': 'M5', 'atr_period': 13, 'atr_threshold': 5.0, 'pt_mult': 2.5, 'sl_mult': 5.0, 'td_mins': 15}. Best is trial 378 with value: 2.3870654100539324.
[I 2026-03-12 00:58:29,213] Trial 924 pruned. 
[I 2026-03-12 00:58:29,348] Trial 925 finished with value: 2.3870654100539324 and parameters: {'timeframe': 'M5', 'atr_period': 13, 'atr_threshold': 3.0, 'pt_mult': 0.5, 'sl_mult': 5.0, 'td_mins': 30}. Best is trial 378 with value: 2.3870654100539324.
[I 2026-03-12 00:58:29,468] Trial 926 finished with value: 2.3870654100539324 and parameters: {'timeframe': 'M5', 'atr_period': 13, 'atr_threshold': 3.0, 'pt_mult': 0.5, 'sl_mult': 5.0, 'td_mins': 30}. Best is trial 378 with value: 2.3870654100539324.
[I 2026-03-12 00:58:29,611] Trial 927 finished with value: 2.3870654100539324 and parameters: {'timeframe': 'M5', 'atr_period': 13, 'atr_threshold': 3.0, 'pt_mult': 0.5, 'sl_mult': 5.0, 'td_mins': 30}. Best is trial 378 with value: 2.3870654100539324.
[I 2026-03-12 00:58:29,675] Trial 928 pruned. 
[I 2026-03-12 00:58:29,727] Trial 929 finished with value: 0.0 and parameters: {'timeframe': 'M5', 'atr_period': 13, 'atr_threshold': 5.0, 'pt_mult': 0.5, 'sl_mult': 0.5, 'td_mins': 5}. Best is trial 378 with value: 2.3870654100539324.
[I 2026-03-12 00:58:29,776] Trial 930 finished with value: 0.0 and parameters: {'timeframe': 'M5', 'atr_period': 13, 'atr_threshold': 5.0, 'pt_mult': 5.0, 'sl_mult': 5.0, 'td_mins': 60}. Best is trial 378 with value: 2.3870654100539324.
[I 2026-03-12 00:58:29,899] Trial 931 finished with value: 2.3870654100539324 and parameters: {'timeframe': 'M5', 'atr_period': 13, 'atr_threshold': 3.0, 'pt_mult': 0.5, 'sl_mult': 5.0, 'td_mins': 30}. Best is trial 378 with value: 2.3870654100539324.
[I 2026-03-12 00:58:30,027] Trial 932 finished with value: 2.3870654100539324 and parameters: {'timeframe': 'M5', 'atr_period': 13, 'atr_threshold': 3.0, 'pt_mult': 0.5, 'sl_mult': 5.0, 'td_mins': 30}. Best is trial 378 with value: 2.3870654100539324.
[I 2026-03-12 00:58:30,153] Trial 933 finished with value: 2.3870654100539324 and parameters: {'timeframe': 'M5', 'atr_period': 13, 'atr_threshold': 3.0, 'pt_mult': 0.5, 'sl_mult': 5.0, 'td_mins': 30}. Best is trial 378 with value: 2.3870654100539324.
[I 2026-03-12 00:58:30,203] Trial 934 finished with value: 0.0 and parameters: {'timeframe': 'M5', 'atr_period': 13, 'atr_threshold': 5.0, 'pt_mult': 0.5, 'sl_mult': 0.5, 'td_mins': 1080}. Best is trial 378 with value: 2.3870654100539324.
[I 2026-03-12 00:58:30,573] Trial 935 pruned. 
[I 2026-03-12 00:58:30,644] Trial 936 pruned. 
[I 2026-03-12 00:58:30,692] Trial 937 finished with value: 0.0 and parameters: {'timeframe': 'M5', 'atr_period': 13, 'atr_threshold': 10.0, 'pt_mult': 0.5, 'sl_mult': 5.0, 'td_mins': 15}. Best is trial 378 with value: 2.3870654100539324.
[I 2026-03-12 00:58:30,741] Trial 938 finished with value: 0.0 and parameters: {'timeframe': 'M5', 'atr_period': 13, 'atr_threshold': 15.0, 'pt_mult': 0.5, 'sl_mult': 5.0, 'td_mins': 30}. Best is trial 378 with value: 2.3870654100539324.
[I 2026-03-12 00:58:30,865] Trial 939 finished with value: 2.3870654100539324 and parameters: {'timeframe': 'M5', 'atr_period': 13, 'atr_threshold': 3.0, 'pt_mult': 0.5, 'sl_mult': 5.0, 'td_mins': 30}. Best is trial 378 with value: 2.3870654100539324.
[I 2026-03-12 00:58:31,007] Trial 940 pruned. 
[I 2026-03-12 00:58:31,158] Trial 941 finished with value: 2.3870654100539324 and parameters: {'timeframe': 'M5', 'atr_period': 13, 'atr_threshold': 3.0, 'pt_mult': 0.5, 'sl_mult': 5.0, 'td_mins': 30}. Best is trial 378 with value: 2.3870654100539324.
[I 2026-03-12 00:58:31,211] Trial 942 finished with value: 0.0 and parameters: {'timeframe': 'M5', 'atr_period': 13, 'atr_threshold': 15.0, 'pt_mult': 2.5, 'sl_mult': 1.0, 'td_mins': 360}. Best is trial 378 with value: 2.3870654100539324.
[I 2026-03-12 00:58:31,375] Trial 943 finished with value: 2.3870654100539324 and parameters: {'timeframe': 'M5', 'atr_period': 13, 'atr_threshold': 3.0, 'pt_mult': 0.5, 'sl_mult': 5.0, 'td_mins': 30}. Best is trial 378 with value: 2.3870654100539324.
[I 2026-03-12 00:58:31,434] Trial 944 pruned. 
[I 2026-03-12 00:58:31,721] Trial 945 pruned. 
[I 2026-03-12 00:58:31,847] Trial 946 finished with value: 2.3870654100539324 and parameters: {'timeframe': 'M5', 'atr_period': 13, 'atr_threshold': 3.0, 'pt_mult': 0.5, 'sl_mult': 5.0, 'td_mins': 30}. Best is trial 378 with value: 2.3870654100539324.
[I 2026-03-12 00:58:31,898] Trial 947 finished with value: 0.0 and parameters: {'timeframe': 'M5', 'atr_period': 13, 'atr_threshold': 8.0, 'pt_mult': 0.5, 'sl_mult': 1.0, 'td_mins': 1200}. Best is trial 378 with value: 2.3870654100539324.
[I 2026-03-12 00:58:31,974] Trial 948 pruned. 
[I 2026-03-12 00:58:32,032] Trial 949 pruned. 
[I 2026-03-12 00:58:32,162] Trial 950 finished with value: 2.3870654100539324 and parameters: {'timeframe': 'M5', 'atr_period': 13, 'atr_threshold': 3.0, 'pt_mult': 0.5, 'sl_mult': 5.0, 'td_mins': 30}. Best is trial 378 with value: 2.3870654100539324.
[I 2026-03-12 00:58:32,283] Trial 951 finished with value: 2.3870654100539324 and parameters: {'timeframe': 'M5', 'atr_period': 13, 'atr_threshold': 3.0, 'pt_mult': 0.5, 'sl_mult': 5.0, 'td_mins': 30}. Best is trial 378 with value: 2.3870654100539324.
[I 2026-03-12 00:58:32,404] Trial 952 pruned. 
[I 2026-03-12 00:58:32,466] Trial 953 pruned. 
[I 2026-03-12 00:58:32,517] Trial 954 finished with value: 0.0 and parameters: {'timeframe': 'M5', 'atr_period': 13, 'atr_threshold': 10.0, 'pt_mult': 1.0, 'sl_mult': 5.0, 'td_mins': 1080}. Best is trial 378 with value: 2.3870654100539324.
[I 2026-03-12 00:58:32,566] Trial 955 finished with value: 0.0 and parameters: {'timeframe': 'M5', 'atr_period': 13, 'atr_threshold': 15.0, 'pt_mult': 0.5, 'sl_mult': 1.0, 'td_mins': 1080}. Best is trial 378 with value: 2.3870654100539324.
[I 2026-03-12 00:58:32,614] Trial 956 finished with value: 0.0 and parameters: {'timeframe': 'M5', 'atr_period': 13, 'atr_threshold': 8.0, 'pt_mult': 1.0, 'sl_mult': 5.0, 'td_mins': 720}. Best is trial 378 with value: 2.3870654100539324.
[I 2026-03-12 00:58:32,662] Trial 957 finished with value: 0.0 and parameters: {'timeframe': 'M5', 'atr_period': 13, 'atr_threshold': 8.0, 'pt_mult': 0.5, 'sl_mult': 1.0, 'td_mins': 5}. Best is trial 378 with value: 2.3870654100539324.
[I 2026-03-12 00:58:32,740] Trial 958 pruned. 
[I 2026-03-12 00:58:32,819] Trial 959 pruned. 
[I 2026-03-12 00:58:32,944] Trial 960 finished with value: 2.3870654100539324 and parameters: {'timeframe': 'M5', 'atr_period': 13, 'atr_threshold': 3.0, 'pt_mult': 0.5, 'sl_mult': 5.0, 'td_mins': 30}. Best is trial 378 with value: 2.3870654100539324.
[I 2026-03-12 00:58:33,001] Trial 961 pruned. 
[I 2026-03-12 00:58:33,059] Trial 962 pruned. 
[I 2026-03-12 00:58:33,112] Trial 963 finished with value: 0.0 and parameters: {'timeframe': 'M5', 'atr_period': 13, 'atr_threshold': 15.0, 'pt_mult': 0.5, 'sl_mult': 0.5, 'td_mins': 5}. Best is trial 378 with value: 2.3870654100539324.
[I 2026-03-12 00:58:33,162] Trial 964 finished with value: 0.0 and parameters: {'timeframe': 'M5', 'atr_period': 13, 'atr_threshold': 10.0, 'pt_mult': 1.0, 'sl_mult': 0.5, 'td_mins': 30}. Best is trial 378 with value: 2.3870654100539324.
[I 2026-03-12 00:58:33,752] Trial 965 pruned. 
[I 2026-03-12 00:58:33,828] Trial 966 pruned. 
[I 2026-03-12 00:58:34,016] Trial 967 pruned. 
[I 2026-03-12 00:58:34,076] Trial 968 pruned. 
[I 2026-03-12 00:58:34,128] Trial 969 finished with value: 0.0 and parameters: {'timeframe': 'M5', 'atr_period': 13, 'atr_threshold': 10.0, 'pt_mult': 0.5, 'sl_mult': 5.0, 'td_mins': 30}. Best is trial 378 with value: 2.3870654100539324.
[I 2026-03-12 00:58:34,270] Trial 970 pruned. 
[I 2026-03-12 00:58:34,399] Trial 971 pruned. 
[I 2026-03-12 00:58:34,451] Trial 972 finished with value: 0.0 and parameters: {'timeframe': 'M5', 'atr_period': 13, 'atr_threshold': 8.0, 'pt_mult': 2.5, 'sl_mult': 5.0, 'td_mins': 360}. Best is trial 378 with value: 2.3870654100539324.
[I 2026-03-12 00:58:34,504] Trial 973 finished with value: 0.0 and parameters: {'timeframe': 'M5', 'atr_period': 13, 'atr_threshold': 8.0, 'pt_mult': 0.5, 'sl_mult': 5.0, 'td_mins': 30}. Best is trial 378 with value: 2.3870654100539324.
[I 2026-03-12 00:58:34,625] Trial 974 finished with value: 2.3870654100539324 and parameters: {'timeframe': 'M5', 'atr_period': 13, 'atr_threshold': 3.0, 'pt_mult': 0.5, 'sl_mult': 5.0, 'td_mins': 30}. Best is trial 378 with value: 2.3870654100539324.
[I 2026-03-12 00:58:34,980] Trial 975 pruned. 
[I 2026-03-12 00:58:35,040] Trial 976 pruned. 
[I 2026-03-12 00:58:35,205] Trial 977 pruned. 
[I 2026-03-12 00:58:35,331] Trial 978 finished with value: 2.3870654100539324 and parameters: {'timeframe': 'M5', 'atr_period': 13, 'atr_threshold': 3.0, 'pt_mult': 0.5, 'sl_mult': 5.0, 'td_mins': 30}. Best is trial 378 with value: 2.3870654100539324.
[I 2026-03-12 00:58:35,455] Trial 979 finished with value: 2.3870654100539324 and parameters: {'timeframe': 'M5', 'atr_period': 13, 'atr_threshold': 3.0, 'pt_mult': 0.5, 'sl_mult': 5.0, 'td_mins': 30}. Best is trial 378 with value: 2.3870654100539324.
[I 2026-03-12 00:58:35,509] Trial 980 pruned. 
[I 2026-03-12 00:58:35,558] Trial 981 finished with value: 0.0 and parameters: {'timeframe': 'M5', 'atr_period': 13, 'atr_threshold': 10.0, 'pt_mult': 5.0, 'sl_mult': 5.0, 'td_mins': 60}. Best is trial 378 with value: 2.3870654100539324.
[I 2026-03-12 00:58:36,125] Trial 982 pruned. 
[I 2026-03-12 00:58:36,279] Trial 983 finished with value: 2.3870654100539324 and parameters: {'timeframe': 'M5', 'atr_period': 13, 'atr_threshold': 3.0, 'pt_mult': 0.5, 'sl_mult': 5.0, 'td_mins': 30}. Best is trial 378 with value: 2.3870654100539324.
[I 2026-03-12 00:58:36,641] Trial 984 pruned. 
[I 2026-03-12 00:58:36,768] Trial 985 finished with value: 2.3870654100539324 and parameters: {'timeframe': 'M5', 'atr_period': 13, 'atr_threshold': 3.0, 'pt_mult': 0.5, 'sl_mult': 5.0, 'td_mins': 30}. Best is trial 378 with value: 2.3870654100539324.
[I 2026-03-12 00:58:36,892] Trial 986 finished with value: 2.3870654100539324 and parameters: {'timeframe': 'M5', 'atr_period': 13, 'atr_threshold': 3.0, 'pt_mult': 0.5, 'sl_mult': 5.0, 'td_mins': 30}. Best is trial 378 with value: 2.3870654100539324.
[I 2026-03-12 00:58:37,019] Trial 987 finished with value: 2.3870654100539324 and parameters: {'timeframe': 'M5', 'atr_period': 13, 'atr_threshold': 3.0, 'pt_mult': 0.5, 'sl_mult': 5.0, 'td_mins': 30}. Best is trial 378 with value: 2.3870654100539324.
[I 2026-03-12 00:58:37,111] Trial 988 pruned. 
[I 2026-03-12 00:58:37,164] Trial 989 finished with value: 0.0 and parameters: {'timeframe': 'M5', 'atr_period': 13, 'atr_threshold': 15.0, 'pt_mult': 5.0, 'sl_mult': 0.5, 'td_mins': 30}. Best is trial 378 with value: 2.3870654100539324.
[I 2026-03-12 00:58:37,216] Trial 990 finished with value: 0.0 and parameters: {'timeframe': 'M5', 'atr_period': 13, 'atr_threshold': 5.0, 'pt_mult': 0.5, 'sl_mult': 5.0, 'td_mins': 30}. Best is trial 378 with value: 2.3870654100539324.
[I 2026-03-12 00:58:37,273] Trial 991 pruned. 
[I 2026-03-12 00:58:37,398] Trial 992 finished with value: 2.3870654100539324 and parameters: {'timeframe': 'M5', 'atr_period': 13, 'atr_threshold': 3.0, 'pt_mult': 0.5, 'sl_mult': 5.0, 'td_mins': 30}. Best is trial 378 with value: 2.3870654100539324.
[I 2026-03-12 00:58:37,523] Trial 993 finished with value: 2.3870654100539324 and parameters: {'timeframe': 'M5', 'atr_period': 13, 'atr_threshold': 3.0, 'pt_mult': 0.5, 'sl_mult': 5.0, 'td_mins': 30}. Best is trial 378 with value: 2.3870654100539324.
[I 2026-03-12 00:58:37,774] Trial 994 pruned. 
[I 2026-03-12 00:58:37,918] Trial 995 finished with value: 2.3870654100539324 and parameters: {'timeframe': 'M5', 'atr_period': 13, 'atr_threshold': 3.0, 'pt_mult': 0.5, 'sl_mult': 5.0, 'td_mins': 30}. Best is trial 378 with value: 2.3870654100539324.
[I 2026-03-12 00:58:37,966] Trial 996 finished with value: 0.0 and parameters: {'timeframe': 'M5', 'atr_period': 13, 'atr_threshold': 8.0, 'pt_mult': 0.5, 'sl_mult': 0.5, 'td_mins': 1200}. Best is trial 378 with value: 2.3870654100539324.
[I 2026-03-12 00:58:38,097] Trial 997 finished with value: 2.3870654100539324 and parameters: {'timeframe': 'M5', 'atr_period': 13, 'atr_threshold': 3.0, 'pt_mult': 0.5, 'sl_mult': 5.0, 'td_mins': 30}. Best is trial 378 with value: 2.3870654100539324.
[I 2026-03-12 00:58:38,375] Trial 998 pruned. 
[I 2026-03-12 00:58:38,452] Trial 999 pruned. 
2026-03-12 00:58:38,515 - INFO - === Starting Optuna Optimization for M8 (Trials: 1000) ===
/home/hephaestus-zero/.local/lib/python3.11/site-packages/optuna/_experimental.py:32: ExperimentalWarning: Argument ``multivariate`` is an experimental feature. The interface can change in the future.
  warnings.warn(
[I 2026-03-12 00:58:38,516] A new study created in memory with name: no-name-f709ae2b-ba27-4ad8-bcf4-d0490f30a04a
2026-03-12 00:58:38,519 - INFO -     [Cache Miss] Loading Signal Data for M8, ATR=13...
2026-03-12 00:59:15,156 - INFO -     [Cache Miss] Loading Signal Data for M8, ATR=13...
2026-03-12 00:59:51,467 - INFO -     [Cache Miss] Loading Signal Data for M8, ATR=13...
2026-03-12 01:00:28,166 - INFO -     [Cache Miss] Loading Signal Data for M8, ATR=13...
2026-03-12 01:01:04,334 - INFO -     [Cache Miss] Loading Signal Data for M8, ATR=13...
[I 2026-03-12 01:01:40,734] Trial 0 finished with value: 0.03938706733112854 and parameters: {'timeframe': 'M8', 'atr_period': 13, 'atr_threshold': 3.0, 'pt_mult': 5.0, 'sl_mult': 1.0, 'td_mins': 30}. Best is trial 0 with value: 0.03938706733112854.
[I 2026-03-12 01:01:43,100] Trial 1 finished with value: 0.7014508915655586 and parameters: {'timeframe': 'M8', 'atr_period': 13, 'atr_threshold': 2.0, 'pt_mult': 5.0, 'sl_mult': 1.0, 'td_mins': 720}. Best is trial 1 with value: 0.7014508915655586.
[I 2026-03-12 01:01:43,144] Trial 2 finished with value: 0.0 and parameters: {'timeframe': 'M8', 'atr_period': 13, 'atr_threshold': 15.0, 'pt_mult': 5.0, 'sl_mult': 1.0, 'td_mins': 720}. Best is trial 1 with value: 0.7014508915655586.
[I 2026-03-12 01:01:45,370] Trial 3 finished with value: 0.9955186917262561 and parameters: {'timeframe': 'M8', 'atr_period': 13, 'atr_threshold': 2.0, 'pt_mult': 2.5, 'sl_mult': 0.5, 'td_mins': 1200}. Best is trial 3 with value: 0.9955186917262561.
[I 2026-03-12 01:01:45,415] Trial 4 finished with value: 0.0 and parameters: {'timeframe': 'M8', 'atr_period': 13, 'atr_threshold': 10.0, 'pt_mult': 1.0, 'sl_mult': 1.0, 'td_mins': 1080}. Best is trial 3 with value: 0.9955186917262561.
[I 2026-03-12 01:01:45,822] Trial 5 finished with value: 0.9222660891445731 and parameters: {'timeframe': 'M8', 'atr_period': 13, 'atr_threshold': 1.0, 'pt_mult': 0.5, 'sl_mult': 1.0, 'td_mins': 60}. Best is trial 3 with value: 0.9955186917262561.
[I 2026-03-12 01:01:45,865] Trial 6 finished with value: 0.0 and parameters: {'timeframe': 'M8', 'atr_period': 13, 'atr_threshold': 10.0, 'pt_mult': 5.0, 'sl_mult': 2.5, 'td_mins': 720}. Best is trial 3 with value: 0.9955186917262561.
[I 2026-03-12 01:01:45,910] Trial 7 finished with value: 0.0 and parameters: {'timeframe': 'M8', 'atr_period': 13, 'atr_threshold': 10.0, 'pt_mult': 0.5, 'sl_mult': 0.5, 'td_mins': 360}. Best is trial 3 with value: 0.9955186917262561.
[I 2026-03-12 01:01:45,951] Trial 8 finished with value: 0.0 and parameters: {'timeframe': 'M8', 'atr_period': 13, 'atr_threshold': 10.0, 'pt_mult': 0.5, 'sl_mult': 1.0, 'td_mins': 5}. Best is trial 3 with value: 0.9955186917262561.
[I 2026-03-12 01:01:46,874] Trial 9 finished with value: 1.5207294803215412 and parameters: {'timeframe': 'M8', 'atr_period': 13, 'atr_threshold': 0.5, 'pt_mult': 0.5, 'sl_mult': 5.0, 'td_mins': 120}. Best is trial 9 with value: 1.5207294803215412.
[I 2026-03-12 01:01:47,040] Trial 10 finished with value: 0.21071787105874767 and parameters: {'timeframe': 'M8', 'atr_period': 13, 'atr_threshold': 2.0, 'pt_mult': 1.0, 'sl_mult': 2.5, 'td_mins': 5}. Best is trial 9 with value: 1.5207294803215412.
[I 2026-03-12 01:01:47,094] Trial 11 finished with value: 0.0 and parameters: {'timeframe': 'M8', 'atr_period': 13, 'atr_threshold': 10.0, 'pt_mult': 5.0, 'sl_mult': 0.5, 'td_mins': 120}. Best is trial 9 with value: 1.5207294803215412.
[I 2026-03-12 01:01:48,034] Trial 12 finished with value: 0.33722445302822146 and parameters: {'timeframe': 'M8', 'atr_period': 13, 'atr_threshold': 1.0, 'pt_mult': 5.0, 'sl_mult': 1.0, 'td_mins': 120}. Best is trial 9 with value: 1.5207294803215412.
[I 2026-03-12 01:01:48,081] Trial 13 finished with value: 0.0 and parameters: {'timeframe': 'M8', 'atr_period': 13, 'atr_threshold': 10.0, 'pt_mult': 5.0, 'sl_mult': 5.0, 'td_mins': 1200}. Best is trial 9 with value: 1.5207294803215412.
[I 2026-03-12 01:01:50,503] Trial 14 finished with value: 0.8010842231782529 and parameters: {'timeframe': 'M8', 'atr_period': 13, 'atr_threshold': 3.0, 'pt_mult': 5.0, 'sl_mult': 5.0, 'td_mins': 1080}. Best is trial 9 with value: 1.5207294803215412.
[I 2026-03-12 01:01:50,551] Trial 15 finished with value: 0.0 and parameters: {'timeframe': 'M8', 'atr_period': 13, 'atr_threshold': 15.0, 'pt_mult': 1.0, 'sl_mult': 5.0, 'td_mins': 720}. Best is trial 9 with value: 1.5207294803215412.
[I 2026-03-12 01:01:50,610] Trial 16 finished with value: 0.0 and parameters: {'timeframe': 'M8', 'atr_period': 13, 'atr_threshold': 5.0, 'pt_mult': 5.0, 'sl_mult': 2.5, 'td_mins': 5}. Best is trial 9 with value: 1.5207294803215412.
