[I 2026-03-12 02:05:03,285] Trial 841 pruned. 
[I 2026-03-12 02:05:03,567] Trial 842 finished with value: 2.627710256873383 and parameters: {'timeframe': 'M15', 'atr_period': 13, 'atr_threshold': 3.0, 'pt_mult': 0.5, 'sl_mult': 5.0, 'td_mins': 120}. Best is trial 393 with value: 2.627710256873383.
[I 2026-03-12 02:05:03,912] Trial 843 pruned. 
[I 2026-03-12 02:05:04,024] Trial 844 pruned. 
[I 2026-03-12 02:05:04,310] Trial 845 finished with value: 2.1318723590746487 and parameters: {'timeframe': 'M15', 'atr_period': 13, 'atr_threshold': 3.0, 'pt_mult': 1.0, 'sl_mult': 5.0, 'td_mins': 120}. Best is trial 393 with value: 2.627710256873383.
[I 2026-03-12 02:05:04,364] Trial 846 pruned. 
[I 2026-03-12 02:05:04,470] Trial 847 pruned. 
[I 2026-03-12 02:05:04,855] Trial 848 pruned. 
[I 2026-03-12 02:05:05,309] Trial 849 finished with value: 2.3274688702958795 and parameters: {'timeframe': 'M15', 'atr_period': 13, 'atr_threshold': 2.0, 'pt_mult': 0.5, 'sl_mult': 5.0, 'td_mins': 120}. Best is trial 393 with value: 2.627710256873383.
[I 2026-03-12 02:05:05,802] Trial 850 pruned. 
[I 2026-03-12 02:05:06,077] Trial 851 finished with value: 2.627710256873383 and parameters: {'timeframe': 'M15', 'atr_period': 13, 'atr_threshold': 3.0, 'pt_mult': 0.5, 'sl_mult': 5.0, 'td_mins': 120}. Best is trial 393 with value: 2.627710256873383.
[I 2026-03-12 02:05:06,355] Trial 852 finished with value: 2.627710256873383 and parameters: {'timeframe': 'M15', 'atr_period': 13, 'atr_threshold': 3.0, 'pt_mult': 0.5, 'sl_mult': 5.0, 'td_mins': 120}. Best is trial 393 with value: 2.627710256873383.
[I 2026-03-12 02:05:06,456] Trial 853 pruned. 
[I 2026-03-12 02:05:06,724] Trial 854 finished with value: 2.627710256873383 and parameters: {'timeframe': 'M15', 'atr_period': 13, 'atr_threshold': 3.0, 'pt_mult': 0.5, 'sl_mult': 5.0, 'td_mins': 120}. Best is trial 393 with value: 2.627710256873383.
[I 2026-03-12 02:05:07,003] Trial 855 finished with value: 2.627710256873383 and parameters: {'timeframe': 'M15', 'atr_period': 13, 'atr_threshold': 3.0, 'pt_mult': 0.5, 'sl_mult': 5.0, 'td_mins': 120}. Best is trial 393 with value: 2.627710256873383.
[I 2026-03-12 02:05:07,289] Trial 856 finished with value: 2.627710256873383 and parameters: {'timeframe': 'M15', 'atr_period': 13, 'atr_threshold': 3.0, 'pt_mult': 0.5, 'sl_mult': 5.0, 'td_mins': 120}. Best is trial 393 with value: 2.627710256873383.
[I 2026-03-12 02:05:07,343] Trial 857 finished with value: 0.0 and parameters: {'timeframe': 'M15', 'atr_period': 13, 'atr_threshold': 15.0, 'pt_mult': 0.5, 'sl_mult': 2.5, 'td_mins': 15}. Best is trial 393 with value: 2.627710256873383.
[I 2026-03-12 02:05:07,628] Trial 858 finished with value: 2.627710256873383 and parameters: {'timeframe': 'M15', 'atr_period': 13, 'atr_threshold': 3.0, 'pt_mult': 0.5, 'sl_mult': 5.0, 'td_mins': 120}. Best is trial 393 with value: 2.627710256873383.
[I 2026-03-12 02:05:07,682] Trial 859 finished with value: 0.0 and parameters: {'timeframe': 'M15', 'atr_period': 13, 'atr_threshold': 10.0, 'pt_mult': 0.5, 'sl_mult': 1.0, 'td_mins': 180}. Best is trial 393 with value: 2.627710256873383.
[I 2026-03-12 02:05:07,963] Trial 860 finished with value: 2.627710256873383 and parameters: {'timeframe': 'M15', 'atr_period': 13, 'atr_threshold': 3.0, 'pt_mult': 0.5, 'sl_mult': 5.0, 'td_mins': 120}. Best is trial 393 with value: 2.627710256873383.
[I 2026-03-12 02:05:08,241] Trial 861 finished with value: 2.627710256873383 and parameters: {'timeframe': 'M15', 'atr_period': 13, 'atr_threshold': 3.0, 'pt_mult': 0.5, 'sl_mult': 5.0, 'td_mins': 120}. Best is trial 393 with value: 2.627710256873383.
[I 2026-03-12 02:05:08,293] Trial 862 pruned. 
[I 2026-03-12 02:05:08,356] Trial 863 pruned. 
[I 2026-03-12 02:05:08,708] Trial 864 pruned. 
[I 2026-03-12 02:05:08,761] Trial 865 pruned. 
[I 2026-03-12 02:05:09,043] Trial 866 finished with value: 2.627710256873383 and parameters: {'timeframe': 'M15', 'atr_period': 13, 'atr_threshold': 3.0, 'pt_mult': 0.5, 'sl_mult': 5.0, 'td_mins': 120}. Best is trial 393 with value: 2.627710256873383.
[I 2026-03-12 02:05:09,115] Trial 867 pruned. 
[I 2026-03-12 02:05:09,311] Trial 868 pruned. 
[I 2026-03-12 02:05:09,504] Trial 869 pruned. 
[I 2026-03-12 02:05:09,609] Trial 870 pruned. 
[I 2026-03-12 02:05:09,678] Trial 871 pruned. 
[I 2026-03-12 02:05:09,754] Trial 872 pruned. 
[I 2026-03-12 02:05:09,821] Trial 873 pruned. 
[I 2026-03-12 02:05:10,049] Trial 874 pruned. 
[I 2026-03-12 02:05:10,112] Trial 875 finished with value: 0.0 and parameters: {'timeframe': 'M15', 'atr_period': 13, 'atr_threshold': 15.0, 'pt_mult': 0.5, 'sl_mult': 1.0, 'td_mins': 15}. Best is trial 393 with value: 2.627710256873383.
[I 2026-03-12 02:05:10,324] Trial 876 pruned. 
[I 2026-03-12 02:05:10,629] Trial 877 finished with value: 2.627710256873383 and parameters: {'timeframe': 'M15', 'atr_period': 13, 'atr_threshold': 3.0, 'pt_mult': 0.5, 'sl_mult': 5.0, 'td_mins': 120}. Best is trial 393 with value: 2.627710256873383.
[I 2026-03-12 02:05:10,690] Trial 878 pruned. 
[I 2026-03-12 02:05:10,999] Trial 879 finished with value: 2.627710256873383 and parameters: {'timeframe': 'M15', 'atr_period': 13, 'atr_threshold': 3.0, 'pt_mult': 0.5, 'sl_mult': 5.0, 'td_mins': 120}. Best is trial 393 with value: 2.627710256873383.
[I 2026-03-12 02:05:11,320] Trial 880 finished with value: 2.627710256873383 and parameters: {'timeframe': 'M15', 'atr_period': 13, 'atr_threshold': 3.0, 'pt_mult': 0.5, 'sl_mult': 5.0, 'td_mins': 120}. Best is trial 393 with value: 2.627710256873383.
[I 2026-03-12 02:05:11,625] Trial 881 finished with value: 2.627710256873383 and parameters: {'timeframe': 'M15', 'atr_period': 13, 'atr_threshold': 3.0, 'pt_mult': 0.5, 'sl_mult': 5.0, 'td_mins': 120}. Best is trial 393 with value: 2.627710256873383.
[I 2026-03-12 02:05:11,928] Trial 882 finished with value: 2.627710256873383 and parameters: {'timeframe': 'M15', 'atr_period': 13, 'atr_threshold': 3.0, 'pt_mult': 0.5, 'sl_mult': 5.0, 'td_mins': 120}. Best is trial 393 with value: 2.627710256873383.
[I 2026-03-12 02:05:12,129] Trial 883 pruned. 
[I 2026-03-12 02:05:12,425] Trial 884 finished with value: 2.627710256873383 and parameters: {'timeframe': 'M15', 'atr_period': 13, 'atr_threshold': 3.0, 'pt_mult': 0.5, 'sl_mult': 5.0, 'td_mins': 120}. Best is trial 393 with value: 2.627710256873383.
[I 2026-03-12 02:05:12,477] Trial 885 finished with value: 0.0 and parameters: {'timeframe': 'M15', 'atr_period': 13, 'atr_threshold': 10.0, 'pt_mult': 2.5, 'sl_mult': 1.0, 'td_mins': 30}. Best is trial 393 with value: 2.627710256873383.
[I 2026-03-12 02:05:12,758] Trial 886 finished with value: 2.627710256873383 and parameters: {'timeframe': 'M15', 'atr_period': 13, 'atr_threshold': 3.0, 'pt_mult': 0.5, 'sl_mult': 5.0, 'td_mins': 120}. Best is trial 393 with value: 2.627710256873383.
[I 2026-03-12 02:05:13,362] Trial 887 pruned. 
[I 2026-03-12 02:05:13,421] Trial 888 pruned. 
[I 2026-03-12 02:05:13,537] Trial 889 pruned. 
[I 2026-03-12 02:05:13,822] Trial 890 finished with value: 2.627710256873383 and parameters: {'timeframe': 'M15', 'atr_period': 13, 'atr_threshold': 3.0, 'pt_mult': 0.5, 'sl_mult': 5.0, 'td_mins': 120}. Best is trial 393 with value: 2.627710256873383.
[I 2026-03-12 02:05:13,874] Trial 891 finished with value: 0.0 and parameters: {'timeframe': 'M15', 'atr_period': 13, 'atr_threshold': 15.0, 'pt_mult': 5.0, 'sl_mult': 5.0, 'td_mins': 15}. Best is trial 393 with value: 2.627710256873383.
[I 2026-03-12 02:05:14,166] Trial 892 finished with value: 2.627710256873383 and parameters: {'timeframe': 'M15', 'atr_period': 13, 'atr_threshold': 3.0, 'pt_mult': 0.5, 'sl_mult': 5.0, 'td_mins': 120}. Best is trial 393 with value: 2.627710256873383.
[I 2026-03-12 02:05:14,450] Trial 893 finished with value: 2.627710256873383 and parameters: {'timeframe': 'M15', 'atr_period': 13, 'atr_threshold': 3.0, 'pt_mult': 0.5, 'sl_mult': 5.0, 'td_mins': 120}. Best is trial 393 with value: 2.627710256873383.
[I 2026-03-12 02:05:14,727] Trial 894 finished with value: 2.627710256873383 and parameters: {'timeframe': 'M15', 'atr_period': 13, 'atr_threshold': 3.0, 'pt_mult': 0.5, 'sl_mult': 5.0, 'td_mins': 120}. Best is trial 393 with value: 2.627710256873383.
[I 2026-03-12 02:05:14,824] Trial 895 pruned. 
[I 2026-03-12 02:05:15,128] Trial 896 finished with value: 2.627710256873383 and parameters: {'timeframe': 'M15', 'atr_period': 13, 'atr_threshold': 3.0, 'pt_mult': 0.5, 'sl_mult': 5.0, 'td_mins': 120}. Best is trial 393 with value: 2.627710256873383.
[I 2026-03-12 02:05:15,231] Trial 897 pruned. 
[I 2026-03-12 02:05:15,412] Trial 898 finished with value: 2.4190348657869114 and parameters: {'timeframe': 'M15', 'atr_period': 13, 'atr_threshold': 3.0, 'pt_mult': 0.5, 'sl_mult': 5.0, 'td_mins': 60}. Best is trial 393 with value: 2.627710256873383.
[I 2026-03-12 02:05:15,463] Trial 899 finished with value: 0.0 and parameters: {'timeframe': 'M15', 'atr_period': 13, 'atr_threshold': 10.0, 'pt_mult': 1.0, 'sl_mult': 0.5, 'td_mins': 60}. Best is trial 393 with value: 2.627710256873383.
[I 2026-03-12 02:05:15,516] Trial 900 finished with value: 0.0 and parameters: {'timeframe': 'M15', 'atr_period': 13, 'atr_threshold': 15.0, 'pt_mult': 0.5, 'sl_mult': 5.0, 'td_mins': 120}. Best is trial 393 with value: 2.627710256873383.
[I 2026-03-12 02:05:15,804] Trial 901 finished with value: 2.627710256873383 and parameters: {'timeframe': 'M15', 'atr_period': 13, 'atr_threshold': 3.0, 'pt_mult': 0.5, 'sl_mult': 5.0, 'td_mins': 120}. Best is trial 393 with value: 2.627710256873383.
[I 2026-03-12 02:05:15,857] Trial 902 pruned. 
[I 2026-03-12 02:05:15,935] Trial 903 pruned. 
[I 2026-03-12 02:05:15,985] Trial 904 finished with value: 0.0 and parameters: {'timeframe': 'M15', 'atr_period': 13, 'atr_threshold': 10.0, 'pt_mult': 5.0, 'sl_mult': 0.5, 'td_mins': 15}. Best is trial 393 with value: 2.627710256873383.
[I 2026-03-12 02:05:16,037] Trial 905 pruned. 
[I 2026-03-12 02:05:16,090] Trial 906 finished with value: 0.0 and parameters: {'timeframe': 'M15', 'atr_period': 13, 'atr_threshold': 10.0, 'pt_mult': 5.0, 'sl_mult': 1.0, 'td_mins': 120}. Best is trial 393 with value: 2.627710256873383.
[I 2026-03-12 02:05:16,156] Trial 907 pruned. 
[I 2026-03-12 02:05:16,236] Trial 908 pruned. 
[I 2026-03-12 02:05:16,423] Trial 909 pruned. 
[I 2026-03-12 02:05:16,473] Trial 910 finished with value: 0.0 and parameters: {'timeframe': 'M15', 'atr_period': 13, 'atr_threshold': 15.0, 'pt_mult': 5.0, 'sl_mult': 5.0, 'td_mins': 360}. Best is trial 393 with value: 2.627710256873383.
[I 2026-03-12 02:05:16,578] Trial 911 pruned. 
[I 2026-03-12 02:05:16,631] Trial 912 pruned. 
[I 2026-03-12 02:05:16,690] Trial 913 pruned. 
[I 2026-03-12 02:05:16,743] Trial 914 pruned. 
[I 2026-03-12 02:05:16,794] Trial 915 finished with value: 0.0 and parameters: {'timeframe': 'M15', 'atr_period': 13, 'atr_threshold': 15.0, 'pt_mult': 5.0, 'sl_mult': 2.5, 'td_mins': 30}. Best is trial 393 with value: 2.627710256873383.
[I 2026-03-12 02:05:17,080] Trial 916 pruned. 
[I 2026-03-12 02:05:17,208] Trial 917 pruned. 
[I 2026-03-12 02:05:17,282] Trial 918 pruned. 
[I 2026-03-12 02:05:17,335] Trial 919 finished with value: 0.0 and parameters: {'timeframe': 'M15', 'atr_period': 13, 'atr_threshold': 15.0, 'pt_mult': 5.0, 'sl_mult': 1.0, 'td_mins': 1200}. Best is trial 393 with value: 2.627710256873383.
[I 2026-03-12 02:05:17,386] Trial 920 pruned. 
[I 2026-03-12 02:05:17,665] Trial 921 finished with value: 2.627710256873383 and parameters: {'timeframe': 'M15', 'atr_period': 13, 'atr_threshold': 3.0, 'pt_mult': 0.5, 'sl_mult': 5.0, 'td_mins': 120}. Best is trial 393 with value: 2.627710256873383.
[I 2026-03-12 02:05:17,767] Trial 922 pruned. 
[I 2026-03-12 02:05:17,822] Trial 923 finished with value: 0.0 and parameters: {'timeframe': 'M15', 'atr_period': 13, 'atr_threshold': 15.0, 'pt_mult': 1.0, 'sl_mult': 0.5, 'td_mins': 180}. Best is trial 393 with value: 2.627710256873383.
[I 2026-03-12 02:05:17,912] Trial 924 pruned. 
[I 2026-03-12 02:05:17,969] Trial 925 pruned. 
[I 2026-03-12 02:05:18,020] Trial 926 finished with value: 0.0 and parameters: {'timeframe': 'M15', 'atr_period': 13, 'atr_threshold': 10.0, 'pt_mult': 5.0, 'sl_mult': 0.5, 'td_mins': 1200}. Best is trial 393 with value: 2.627710256873383.
[I 2026-03-12 02:05:18,104] Trial 927 pruned. 
[I 2026-03-12 02:05:18,155] Trial 928 finished with value: 0.0 and parameters: {'timeframe': 'M15', 'atr_period': 13, 'atr_threshold': 10.0, 'pt_mult': 0.5, 'sl_mult': 5.0, 'td_mins': 120}. Best is trial 393 with value: 2.627710256873383.
[I 2026-03-12 02:05:18,422] Trial 929 finished with value: 2.627710256873383 and parameters: {'timeframe': 'M15', 'atr_period': 13, 'atr_threshold': 3.0, 'pt_mult': 0.5, 'sl_mult': 5.0, 'td_mins': 120}. Best is trial 393 with value: 2.627710256873383.
[I 2026-03-12 02:05:18,475] Trial 930 pruned. 
[I 2026-03-12 02:05:18,529] Trial 931 pruned. 
[I 2026-03-12 02:05:18,781] Trial 932 pruned. 
[I 2026-03-12 02:05:19,055] Trial 933 finished with value: 2.627710256873383 and parameters: {'timeframe': 'M15', 'atr_period': 13, 'atr_threshold': 3.0, 'pt_mult': 0.5, 'sl_mult': 5.0, 'td_mins': 120}. Best is trial 393 with value: 2.627710256873383.
[I 2026-03-12 02:05:19,345] Trial 934 pruned. 
[I 2026-03-12 02:05:19,427] Trial 935 pruned. 
[I 2026-03-12 02:05:19,713] Trial 936 finished with value: 2.627710256873383 and parameters: {'timeframe': 'M15', 'atr_period': 13, 'atr_threshold': 3.0, 'pt_mult': 0.5, 'sl_mult': 5.0, 'td_mins': 120}. Best is trial 393 with value: 2.627710256873383.
[I 2026-03-12 02:05:19,833] Trial 937 pruned. 
[I 2026-03-12 02:05:20,040] Trial 938 pruned. 
[I 2026-03-12 02:05:20,429] Trial 939 finished with value: 2.4490491384580553 and parameters: {'timeframe': 'M15', 'atr_period': 13, 'atr_threshold': 3.0, 'pt_mult': 0.5, 'sl_mult': 5.0, 'td_mins': 180}. Best is trial 393 with value: 2.627710256873383.
[I 2026-03-12 02:05:20,777] Trial 940 pruned. 
[I 2026-03-12 02:05:20,831] Trial 941 pruned. 
[I 2026-03-12 02:05:20,885] Trial 942 finished with value: 0.0 and parameters: {'timeframe': 'M15', 'atr_period': 13, 'atr_threshold': 15.0, 'pt_mult': 0.5, 'sl_mult': 0.5, 'td_mins': 180}. Best is trial 393 with value: 2.627710256873383.
[I 2026-03-12 02:05:20,938] Trial 943 pruned. 
[I 2026-03-12 02:05:21,117] Trial 944 pruned. 
[I 2026-03-12 02:05:21,191] Trial 945 pruned. 
[I 2026-03-12 02:05:21,244] Trial 946 finished with value: 0.0 and parameters: {'timeframe': 'M15', 'atr_period': 13, 'atr_threshold': 10.0, 'pt_mult': 1.0, 'sl_mult': 0.5, 'td_mins': 360}. Best is trial 393 with value: 2.627710256873383.
[I 2026-03-12 02:05:21,676] Trial 947 finished with value: 2.3274688702958795 and parameters: {'timeframe': 'M15', 'atr_period': 13, 'atr_threshold': 2.0, 'pt_mult': 0.5, 'sl_mult': 5.0, 'td_mins': 120}. Best is trial 393 with value: 2.627710256873383.
[I 2026-03-12 02:05:21,758] Trial 948 pruned. 
[I 2026-03-12 02:05:22,039] Trial 949 finished with value: 2.627710256873383 and parameters: {'timeframe': 'M15', 'atr_period': 13, 'atr_threshold': 3.0, 'pt_mult': 0.5, 'sl_mult': 5.0, 'td_mins': 120}. Best is trial 393 with value: 2.627710256873383.
[I 2026-03-12 02:05:22,280] Trial 950 pruned. 
[I 2026-03-12 02:05:22,552] Trial 951 finished with value: 2.627710256873383 and parameters: {'timeframe': 'M15', 'atr_period': 13, 'atr_threshold': 3.0, 'pt_mult': 0.5, 'sl_mult': 5.0, 'td_mins': 120}. Best is trial 393 with value: 2.627710256873383.
[I 2026-03-12 02:05:22,835] Trial 952 finished with value: 2.627710256873383 and parameters: {'timeframe': 'M15', 'atr_period': 13, 'atr_threshold': 3.0, 'pt_mult': 0.5, 'sl_mult': 5.0, 'td_mins': 120}. Best is trial 393 with value: 2.627710256873383.
[I 2026-03-12 02:05:23,121] Trial 953 finished with value: 2.627710256873383 and parameters: {'timeframe': 'M15', 'atr_period': 13, 'atr_threshold': 3.0, 'pt_mult': 0.5, 'sl_mult': 5.0, 'td_mins': 120}. Best is trial 393 with value: 2.627710256873383.
[I 2026-03-12 02:05:23,175] Trial 954 finished with value: 0.0 and parameters: {'timeframe': 'M15', 'atr_period': 13, 'atr_threshold': 15.0, 'pt_mult': 2.5, 'sl_mult': 0.5, 'td_mins': 120}. Best is trial 393 with value: 2.627710256873383.
[I 2026-03-12 02:05:23,454] Trial 955 finished with value: 2.627710256873383 and parameters: {'timeframe': 'M15', 'atr_period': 13, 'atr_threshold': 3.0, 'pt_mult': 0.5, 'sl_mult': 5.0, 'td_mins': 120}. Best is trial 393 with value: 2.627710256873383.
[I 2026-03-12 02:05:23,662] Trial 956 pruned. 
[I 2026-03-12 02:05:23,945] Trial 957 finished with value: 2.627710256873383 and parameters: {'timeframe': 'M15', 'atr_period': 13, 'atr_threshold': 3.0, 'pt_mult': 0.5, 'sl_mult': 5.0, 'td_mins': 120}. Best is trial 393 with value: 2.627710256873383.
[I 2026-03-12 02:05:24,018] Trial 958 pruned. 
[I 2026-03-12 02:05:24,070] Trial 959 pruned. 
[I 2026-03-12 02:05:24,124] Trial 960 finished with value: 0.0 and parameters: {'timeframe': 'M15', 'atr_period': 13, 'atr_threshold': 15.0, 'pt_mult': 0.5, 'sl_mult': 1.0, 'td_mins': 30}. Best is trial 393 with value: 2.627710256873383.
[I 2026-03-12 02:05:24,400] Trial 961 finished with value: 2.627710256873383 and parameters: {'timeframe': 'M15', 'atr_period': 13, 'atr_threshold': 3.0, 'pt_mult': 0.5, 'sl_mult': 5.0, 'td_mins': 120}. Best is trial 393 with value: 2.627710256873383.
[I 2026-03-12 02:05:24,452] Trial 962 finished with value: 0.0 and parameters: {'timeframe': 'M15', 'atr_period': 13, 'atr_threshold': 10.0, 'pt_mult': 1.0, 'sl_mult': 1.0, 'td_mins': 1200}. Best is trial 393 with value: 2.627710256873383.
[I 2026-03-12 02:05:24,573] Trial 963 pruned. 
[I 2026-03-12 02:05:24,628] Trial 964 pruned. 
[I 2026-03-12 02:05:24,932] Trial 965 finished with value: 2.627710256873383 and parameters: {'timeframe': 'M15', 'atr_period': 13, 'atr_threshold': 3.0, 'pt_mult': 0.5, 'sl_mult': 5.0, 'td_mins': 120}. Best is trial 393 with value: 2.627710256873383.
[I 2026-03-12 02:05:25,744] Trial 966 pruned. 
[I 2026-03-12 02:05:25,798] Trial 967 finished with value: 0.0 and parameters: {'timeframe': 'M15', 'atr_period': 13, 'atr_threshold': 15.0, 'pt_mult': 5.0, 'sl_mult': 0.5, 'td_mins': 720}. Best is trial 393 with value: 2.627710256873383.
[I 2026-03-12 02:05:26,083] Trial 968 finished with value: 2.627710256873383 and parameters: {'timeframe': 'M15', 'atr_period': 13, 'atr_threshold': 3.0, 'pt_mult': 0.5, 'sl_mult': 5.0, 'td_mins': 120}. Best is trial 393 with value: 2.627710256873383.
[I 2026-03-12 02:05:26,286] Trial 969 pruned. 
[I 2026-03-12 02:05:26,891] Trial 970 pruned. 
[I 2026-03-12 02:05:26,956] Trial 971 pruned. 
[I 2026-03-12 02:05:27,235] Trial 972 finished with value: 2.627710256873383 and parameters: {'timeframe': 'M15', 'atr_period': 13, 'atr_threshold': 3.0, 'pt_mult': 0.5, 'sl_mult': 5.0, 'td_mins': 120}. Best is trial 393 with value: 2.627710256873383.
[I 2026-03-12 02:05:27,289] Trial 973 finished with value: 0.0 and parameters: {'timeframe': 'M15', 'atr_period': 13, 'atr_threshold': 15.0, 'pt_mult': 2.5, 'sl_mult': 5.0, 'td_mins': 360}. Best is trial 393 with value: 2.627710256873383.
[I 2026-03-12 02:05:27,376] Trial 974 pruned. 
[I 2026-03-12 02:05:27,520] Trial 975 pruned. 
[I 2026-03-12 02:05:27,815] Trial 976 finished with value: 2.627710256873383 and parameters: {'timeframe': 'M15', 'atr_period': 13, 'atr_threshold': 3.0, 'pt_mult': 0.5, 'sl_mult': 5.0, 'td_mins': 120}. Best is trial 393 with value: 2.627710256873383.
[I 2026-03-12 02:05:28,094] Trial 977 finished with value: 2.627710256873383 and parameters: {'timeframe': 'M15', 'atr_period': 13, 'atr_threshold': 3.0, 'pt_mult': 0.5, 'sl_mult': 5.0, 'td_mins': 120}. Best is trial 393 with value: 2.627710256873383.
[I 2026-03-12 02:05:28,179] Trial 978 pruned. 
[I 2026-03-12 02:05:28,244] Trial 979 pruned. 
[I 2026-03-12 02:05:28,519] Trial 980 finished with value: 2.627710256873383 and parameters: {'timeframe': 'M15', 'atr_period': 13, 'atr_threshold': 3.0, 'pt_mult': 0.5, 'sl_mult': 5.0, 'td_mins': 120}. Best is trial 393 with value: 2.627710256873383.
[I 2026-03-12 02:05:28,803] Trial 981 finished with value: 2.627710256873383 and parameters: {'timeframe': 'M15', 'atr_period': 13, 'atr_threshold': 3.0, 'pt_mult': 0.5, 'sl_mult': 5.0, 'td_mins': 120}. Best is trial 393 with value: 2.627710256873383.
[I 2026-03-12 02:05:29,079] Trial 982 finished with value: 2.627710256873383 and parameters: {'timeframe': 'M15', 'atr_period': 13, 'atr_threshold': 3.0, 'pt_mult': 0.5, 'sl_mult': 5.0, 'td_mins': 120}. Best is trial 393 with value: 2.627710256873383.
[I 2026-03-12 02:05:29,616] Trial 983 pruned. 
[I 2026-03-12 02:05:29,936] Trial 984 finished with value: 2.627710256873383 and parameters: {'timeframe': 'M15', 'atr_period': 13, 'atr_threshold': 3.0, 'pt_mult': 0.5, 'sl_mult': 5.0, 'td_mins': 120}. Best is trial 393 with value: 2.627710256873383.
[I 2026-03-12 02:05:30,085] Trial 985 pruned. 
[I 2026-03-12 02:05:30,140] Trial 986 finished with value: 0.0 and parameters: {'timeframe': 'M15', 'atr_period': 13, 'atr_threshold': 15.0, 'pt_mult': 2.5, 'sl_mult': 1.0, 'td_mins': 360}. Best is trial 393 with value: 2.627710256873383.
[I 2026-03-12 02:05:30,424] Trial 987 finished with value: 2.627710256873383 and parameters: {'timeframe': 'M15', 'atr_period': 13, 'atr_threshold': 3.0, 'pt_mult': 0.5, 'sl_mult': 5.0, 'td_mins': 120}. Best is trial 393 with value: 2.627710256873383.
[I 2026-03-12 02:05:30,701] Trial 988 finished with value: 2.627710256873383 and parameters: {'timeframe': 'M15', 'atr_period': 13, 'atr_threshold': 3.0, 'pt_mult': 0.5, 'sl_mult': 5.0, 'td_mins': 120}. Best is trial 393 with value: 2.627710256873383.
[I 2026-03-12 02:05:30,976] Trial 989 finished with value: 2.627710256873383 and parameters: {'timeframe': 'M15', 'atr_period': 13, 'atr_threshold': 3.0, 'pt_mult': 0.5, 'sl_mult': 5.0, 'td_mins': 120}. Best is trial 393 with value: 2.627710256873383.
