[I 2026-03-12 00:44:33,263] Trial 751 pruned. 
[I 2026-03-12 00:44:33,352] Trial 752 finished with value: 2.153336081466255 and parameters: {'timeframe': 'M1', 'atr_period': 13, 'atr_threshold': 2.0, 'pt_mult': 0.5, 'sl_mult': 5.0, 'td_mins': 5}. Best is trial 695 with value: 2.153336081466255.
[I 2026-03-12 00:44:33,442] Trial 753 finished with value: 2.153336081466255 and parameters: {'timeframe': 'M1', 'atr_period': 13, 'atr_threshold': 2.0, 'pt_mult': 0.5, 'sl_mult': 5.0, 'td_mins': 5}. Best is trial 695 with value: 2.153336081466255.
[I 2026-03-12 00:44:33,526] Trial 754 pruned. 
[I 2026-03-12 00:44:33,670] Trial 755 pruned. 
[I 2026-03-12 00:44:33,745] Trial 756 pruned. 
[I 2026-03-12 00:44:33,900] Trial 757 pruned. 
[I 2026-03-12 00:44:33,956] Trial 758 pruned. 
[I 2026-03-12 00:44:34,041] Trial 759 pruned. 
[I 2026-03-12 00:44:34,091] Trial 760 finished with value: 0.0 and parameters: {'timeframe': 'M1', 'atr_period': 13, 'atr_threshold': 10.0, 'pt_mult': 0.5, 'sl_mult': 5.0, 'td_mins': 60}. Best is trial 695 with value: 2.153336081466255.
[I 2026-03-12 00:44:34,181] Trial 761 finished with value: 2.153336081466255 and parameters: {'timeframe': 'M1', 'atr_period': 13, 'atr_threshold': 2.0, 'pt_mult': 0.5, 'sl_mult': 5.0, 'td_mins': 5}. Best is trial 695 with value: 2.153336081466255.
[I 2026-03-12 00:44:34,272] Trial 762 finished with value: 2.153336081466255 and parameters: {'timeframe': 'M1', 'atr_period': 13, 'atr_threshold': 2.0, 'pt_mult': 0.5, 'sl_mult': 5.0, 'td_mins': 5}. Best is trial 695 with value: 2.153336081466255.
[I 2026-03-12 00:44:34,430] Trial 763 pruned. 
[I 2026-03-12 00:44:34,483] Trial 764 finished with value: 0.0 and parameters: {'timeframe': 'M1', 'atr_period': 13, 'atr_threshold': 15.0, 'pt_mult': 2.5, 'sl_mult': 5.0, 'td_mins': 5}. Best is trial 695 with value: 2.153336081466255.
[I 2026-03-12 00:44:35,552] Trial 765 pruned. 
[I 2026-03-12 00:44:35,660] Trial 766 finished with value: 2.153336081466255 and parameters: {'timeframe': 'M1', 'atr_period': 13, 'atr_threshold': 2.0, 'pt_mult': 0.5, 'sl_mult': 5.0, 'td_mins': 5}. Best is trial 695 with value: 2.153336081466255.
[I 2026-03-12 00:44:35,714] Trial 767 finished with value: 0.0 and parameters: {'timeframe': 'M1', 'atr_period': 13, 'atr_threshold': 5.0, 'pt_mult': 0.5, 'sl_mult': 2.5, 'td_mins': 5}. Best is trial 695 with value: 2.153336081466255.
[I 2026-03-12 00:44:35,767] Trial 768 finished with value: 0.0 and parameters: {'timeframe': 'M1', 'atr_period': 13, 'atr_threshold': 10.0, 'pt_mult': 2.5, 'sl_mult': 5.0, 'td_mins': 5}. Best is trial 695 with value: 2.153336081466255.
[I 2026-03-12 00:44:35,848] Trial 769 pruned. 
[I 2026-03-12 00:44:38,455] Trial 770 pruned. 
[I 2026-03-12 00:44:38,575] Trial 771 finished with value: 2.153336081466255 and parameters: {'timeframe': 'M1', 'atr_period': 13, 'atr_threshold': 2.0, 'pt_mult': 0.5, 'sl_mult': 5.0, 'td_mins': 5}. Best is trial 695 with value: 2.153336081466255.
[I 2026-03-12 00:44:38,661] Trial 772 pruned. 
[I 2026-03-12 00:44:38,737] Trial 773 pruned. 
[I 2026-03-12 00:44:39,687] Trial 774 pruned. 
[I 2026-03-12 00:44:39,737] Trial 775 finished with value: 0.0 and parameters: {'timeframe': 'M1', 'atr_period': 13, 'atr_threshold': 10.0, 'pt_mult': 0.5, 'sl_mult': 5.0, 'td_mins': 360}. Best is trial 695 with value: 2.153336081466255.
[I 2026-03-12 00:44:39,829] Trial 776 finished with value: 2.153336081466255 and parameters: {'timeframe': 'M1', 'atr_period': 13, 'atr_threshold': 2.0, 'pt_mult': 0.5, 'sl_mult': 5.0, 'td_mins': 5}. Best is trial 695 with value: 2.153336081466255.
[I 2026-03-12 00:44:39,920] Trial 777 finished with value: 2.153336081466255 and parameters: {'timeframe': 'M1', 'atr_period': 13, 'atr_threshold': 2.0, 'pt_mult': 0.5, 'sl_mult': 5.0, 'td_mins': 5}. Best is trial 695 with value: 2.153336081466255.
[I 2026-03-12 00:44:40,010] Trial 778 finished with value: 2.153336081466255 and parameters: {'timeframe': 'M1', 'atr_period': 13, 'atr_threshold': 2.0, 'pt_mult': 0.5, 'sl_mult': 5.0, 'td_mins': 5}. Best is trial 695 with value: 2.153336081466255.
[I 2026-03-12 00:44:40,058] Trial 779 finished with value: 0.0 and parameters: {'timeframe': 'M1', 'atr_period': 13, 'atr_threshold': 15.0, 'pt_mult': 0.5, 'sl_mult': 0.5, 'td_mins': 5}. Best is trial 695 with value: 2.153336081466255.
[I 2026-03-12 00:44:40,122] Trial 780 pruned. 
[I 2026-03-12 00:44:40,187] Trial 781 pruned. 
[I 2026-03-12 00:44:41,093] Trial 782 pruned. 
[I 2026-03-12 00:44:41,151] Trial 783 finished with value: 0.0 and parameters: {'timeframe': 'M1', 'atr_period': 13, 'atr_threshold': 8.0, 'pt_mult': 0.5, 'sl_mult': 2.5, 'td_mins': 5}. Best is trial 695 with value: 2.153336081466255.
[I 2026-03-12 00:44:41,245] Trial 784 finished with value: 2.153336081466255 and parameters: {'timeframe': 'M1', 'atr_period': 13, 'atr_threshold': 2.0, 'pt_mult': 0.5, 'sl_mult': 5.0, 'td_mins': 5}. Best is trial 695 with value: 2.153336081466255.
[I 2026-03-12 00:44:41,335] Trial 785 finished with value: 2.153336081466255 and parameters: {'timeframe': 'M1', 'atr_period': 13, 'atr_threshold': 2.0, 'pt_mult': 0.5, 'sl_mult': 5.0, 'td_mins': 5}. Best is trial 695 with value: 2.153336081466255.
[I 2026-03-12 00:44:41,425] Trial 786 finished with value: 2.153336081466255 and parameters: {'timeframe': 'M1', 'atr_period': 13, 'atr_threshold': 2.0, 'pt_mult': 0.5, 'sl_mult': 5.0, 'td_mins': 5}. Best is trial 695 with value: 2.153336081466255.
[I 2026-03-12 00:44:41,478] Trial 787 pruned. 
[I 2026-03-12 00:44:41,571] Trial 788 finished with value: 2.153336081466255 and parameters: {'timeframe': 'M1', 'atr_period': 13, 'atr_threshold': 2.0, 'pt_mult': 0.5, 'sl_mult': 5.0, 'td_mins': 5}. Best is trial 695 with value: 2.153336081466255.
[I 2026-03-12 00:44:41,664] Trial 789 finished with value: 2.153336081466255 and parameters: {'timeframe': 'M1', 'atr_period': 13, 'atr_threshold': 2.0, 'pt_mult': 0.5, 'sl_mult': 5.0, 'td_mins': 5}. Best is trial 695 with value: 2.153336081466255.
[I 2026-03-12 00:44:41,714] Trial 790 finished with value: 0.0 and parameters: {'timeframe': 'M1', 'atr_period': 13, 'atr_threshold': 3.0, 'pt_mult': 2.5, 'sl_mult': 5.0, 'td_mins': 5}. Best is trial 695 with value: 2.153336081466255.
[I 2026-03-12 00:44:41,818] Trial 791 pruned. 
[I 2026-03-12 00:44:41,907] Trial 792 finished with value: 2.153336081466255 and parameters: {'timeframe': 'M1', 'atr_period': 13, 'atr_threshold': 2.0, 'pt_mult': 0.5, 'sl_mult': 5.0, 'td_mins': 5}. Best is trial 695 with value: 2.153336081466255.
[I 2026-03-12 00:44:42,049] Trial 793 pruned. 
[I 2026-03-12 00:44:42,129] Trial 794 pruned. 
[I 2026-03-12 00:44:42,190] Trial 795 pruned. 
[I 2026-03-12 00:44:42,283] Trial 796 pruned. 
[I 2026-03-12 00:44:42,333] Trial 797 finished with value: 0.0 and parameters: {'timeframe': 'M1', 'atr_period': 13, 'atr_threshold': 3.0, 'pt_mult': 0.5, 'sl_mult': 5.0, 'td_mins': 1200}. Best is trial 695 with value: 2.153336081466255.
[I 2026-03-12 00:44:42,381] Trial 798 finished with value: 0.0 and parameters: {'timeframe': 'M1', 'atr_period': 13, 'atr_threshold': 3.0, 'pt_mult': 5.0, 'sl_mult': 5.0, 'td_mins': 5}. Best is trial 695 with value: 2.153336081466255.
[I 2026-03-12 00:44:42,446] Trial 799 pruned. 
[I 2026-03-12 00:44:42,548] Trial 800 pruned. 
[I 2026-03-12 00:44:42,707] Trial 801 pruned. 
[I 2026-03-12 00:44:42,759] Trial 802 finished with value: 0.0 and parameters: {'timeframe': 'M1', 'atr_period': 13, 'atr_threshold': 3.0, 'pt_mult': 0.5, 'sl_mult': 5.0, 'td_mins': 360}. Best is trial 695 with value: 2.153336081466255.
[I 2026-03-12 00:44:42,850] Trial 803 finished with value: 2.153336081466255 and parameters: {'timeframe': 'M1', 'atr_period': 13, 'atr_threshold': 2.0, 'pt_mult': 0.5, 'sl_mult': 5.0, 'td_mins': 5}. Best is trial 695 with value: 2.153336081466255.
[I 2026-03-12 00:44:42,942] Trial 804 finished with value: 2.153336081466255 and parameters: {'timeframe': 'M1', 'atr_period': 13, 'atr_threshold': 2.0, 'pt_mult': 0.5, 'sl_mult': 5.0, 'td_mins': 5}. Best is trial 695 with value: 2.153336081466255.
[I 2026-03-12 00:44:43,032] Trial 805 finished with value: 2.153336081466255 and parameters: {'timeframe': 'M1', 'atr_period': 13, 'atr_threshold': 2.0, 'pt_mult': 0.5, 'sl_mult': 5.0, 'td_mins': 5}. Best is trial 695 with value: 2.153336081466255.
[I 2026-03-12 00:44:43,121] Trial 806 finished with value: 2.153336081466255 and parameters: {'timeframe': 'M1', 'atr_period': 13, 'atr_threshold': 2.0, 'pt_mult': 0.5, 'sl_mult': 5.0, 'td_mins': 5}. Best is trial 695 with value: 2.153336081466255.
[I 2026-03-12 00:44:43,173] Trial 807 finished with value: 0.0 and parameters: {'timeframe': 'M1', 'atr_period': 13, 'atr_threshold': 5.0, 'pt_mult': 0.5, 'sl_mult': 5.0, 'td_mins': 1080}. Best is trial 695 with value: 2.153336081466255.
[I 2026-03-12 00:44:43,255] Trial 808 pruned. 
[I 2026-03-12 00:44:43,380] Trial 809 pruned. 
[I 2026-03-12 00:44:43,469] Trial 810 finished with value: 2.153336081466255 and parameters: {'timeframe': 'M1', 'atr_period': 13, 'atr_threshold': 2.0, 'pt_mult': 0.5, 'sl_mult': 5.0, 'td_mins': 5}. Best is trial 695 with value: 2.153336081466255.
[I 2026-03-12 00:44:44,282] Trial 811 pruned. 
[I 2026-03-12 00:44:44,336] Trial 812 pruned. 
[I 2026-03-12 00:44:44,396] Trial 813 pruned. 
[I 2026-03-12 00:44:44,445] Trial 814 finished with value: 0.0 and parameters: {'timeframe': 'M1', 'atr_period': 13, 'atr_threshold': 5.0, 'pt_mult': 0.5, 'sl_mult': 5.0, 'td_mins': 5}. Best is trial 695 with value: 2.153336081466255.
[I 2026-03-12 00:44:44,495] Trial 815 finished with value: 0.0 and parameters: {'timeframe': 'M1', 'atr_period': 13, 'atr_threshold': 15.0, 'pt_mult': 0.5, 'sl_mult': 5.0, 'td_mins': 5}. Best is trial 695 with value: 2.153336081466255.
[I 2026-03-12 00:44:44,543] Trial 816 finished with value: 0.0 and parameters: {'timeframe': 'M1', 'atr_period': 13, 'atr_threshold': 5.0, 'pt_mult': 0.5, 'sl_mult': 5.0, 'td_mins': 60}. Best is trial 695 with value: 2.153336081466255.
[I 2026-03-12 00:44:44,592] Trial 817 finished with value: 0.0 and parameters: {'timeframe': 'M1', 'atr_period': 13, 'atr_threshold': 10.0, 'pt_mult': 0.5, 'sl_mult': 5.0, 'td_mins': 5}. Best is trial 695 with value: 2.153336081466255.
[I 2026-03-12 00:44:44,954] Trial 818 pruned. 
[I 2026-03-12 00:44:45,007] Trial 819 finished with value: 0.0 and parameters: {'timeframe': 'M1', 'atr_period': 13, 'atr_threshold': 8.0, 'pt_mult': 0.5, 'sl_mult': 5.0, 'td_mins': 5}. Best is trial 695 with value: 2.153336081466255.
[I 2026-03-12 00:44:45,165] Trial 820 pruned. 
[I 2026-03-12 00:44:45,239] Trial 821 pruned. 
[I 2026-03-12 00:44:45,294] Trial 822 finished with value: 0.0 and parameters: {'timeframe': 'M1', 'atr_period': 13, 'atr_threshold': 15.0, 'pt_mult': 0.5, 'sl_mult': 5.0, 'td_mins': 30}. Best is trial 695 with value: 2.153336081466255.
[I 2026-03-12 00:44:45,413] Trial 823 finished with value: 2.153336081466255 and parameters: {'timeframe': 'M1', 'atr_period': 13, 'atr_threshold': 2.0, 'pt_mult': 0.5, 'sl_mult': 5.0, 'td_mins': 5}. Best is trial 695 with value: 2.153336081466255.
[I 2026-03-12 00:44:45,467] Trial 824 finished with value: 0.0 and parameters: {'timeframe': 'M1', 'atr_period': 13, 'atr_threshold': 5.0, 'pt_mult': 0.5, 'sl_mult': 5.0, 'td_mins': 180}. Best is trial 695 with value: 2.153336081466255.
[I 2026-03-12 00:44:45,530] Trial 825 pruned. 
[I 2026-03-12 00:44:45,628] Trial 826 finished with value: 2.153336081466255 and parameters: {'timeframe': 'M1', 'atr_period': 13, 'atr_threshold': 2.0, 'pt_mult': 0.5, 'sl_mult': 5.0, 'td_mins': 5}. Best is trial 695 with value: 2.153336081466255.
[I 2026-03-12 00:44:45,682] Trial 827 finished with value: 0.0 and parameters: {'timeframe': 'M1', 'atr_period': 13, 'atr_threshold': 3.0, 'pt_mult': 0.5, 'sl_mult': 5.0, 'td_mins': 5}. Best is trial 695 with value: 2.153336081466255.
[I 2026-03-12 00:44:45,773] Trial 828 finished with value: 2.153336081466255 and parameters: {'timeframe': 'M1', 'atr_period': 13, 'atr_threshold': 2.0, 'pt_mult': 0.5, 'sl_mult': 5.0, 'td_mins': 5}. Best is trial 695 with value: 2.153336081466255.
[I 2026-03-12 00:44:45,862] Trial 829 finished with value: 2.153336081466255 and parameters: {'timeframe': 'M1', 'atr_period': 13, 'atr_threshold': 2.0, 'pt_mult': 0.5, 'sl_mult': 5.0, 'td_mins': 5}. Best is trial 695 with value: 2.153336081466255.
[I 2026-03-12 00:44:45,957] Trial 830 finished with value: 2.153336081466255 and parameters: {'timeframe': 'M1', 'atr_period': 13, 'atr_threshold': 2.0, 'pt_mult': 0.5, 'sl_mult': 5.0, 'td_mins': 5}. Best is trial 695 with value: 2.153336081466255.
[I 2026-03-12 00:44:46,010] Trial 831 finished with value: 0.0 and parameters: {'timeframe': 'M1', 'atr_period': 13, 'atr_threshold': 8.0, 'pt_mult': 0.5, 'sl_mult': 5.0, 'td_mins': 360}. Best is trial 695 with value: 2.153336081466255.
[I 2026-03-12 00:44:46,059] Trial 832 finished with value: 0.0 and parameters: {'timeframe': 'M1', 'atr_period': 13, 'atr_threshold': 15.0, 'pt_mult': 0.5, 'sl_mult': 5.0, 'td_mins': 1080}. Best is trial 695 with value: 2.153336081466255.
[I 2026-03-12 00:44:46,136] Trial 833 pruned. 
[I 2026-03-12 00:44:46,234] Trial 834 finished with value: 2.153336081466255 and parameters: {'timeframe': 'M1', 'atr_period': 13, 'atr_threshold': 2.0, 'pt_mult': 0.5, 'sl_mult': 5.0, 'td_mins': 5}. Best is trial 695 with value: 2.153336081466255.
[I 2026-03-12 00:44:46,328] Trial 835 pruned. 
[I 2026-03-12 00:44:46,421] Trial 836 finished with value: 2.153336081466255 and parameters: {'timeframe': 'M1', 'atr_period': 13, 'atr_threshold': 2.0, 'pt_mult': 0.5, 'sl_mult': 5.0, 'td_mins': 5}. Best is trial 695 with value: 2.153336081466255.
[I 2026-03-12 00:44:46,472] Trial 837 finished with value: 0.0 and parameters: {'timeframe': 'M1', 'atr_period': 13, 'atr_threshold': 5.0, 'pt_mult': 0.5, 'sl_mult': 5.0, 'td_mins': 120}. Best is trial 695 with value: 2.153336081466255.
[I 2026-03-12 00:44:46,546] Trial 838 pruned. 
[I 2026-03-12 00:44:48,664] Trial 839 pruned. 
[I 2026-03-12 00:44:48,728] Trial 840 pruned. 
[I 2026-03-12 00:44:48,782] Trial 841 finished with value: 0.0 and parameters: {'timeframe': 'M1', 'atr_period': 13, 'atr_threshold': 8.0, 'pt_mult': 0.5, 'sl_mult': 5.0, 'td_mins': 720}. Best is trial 695 with value: 2.153336081466255.
[I 2026-03-12 00:44:48,832] Trial 842 finished with value: 0.0 and parameters: {'timeframe': 'M1', 'atr_period': 13, 'atr_threshold': 10.0, 'pt_mult': 0.5, 'sl_mult': 5.0, 'td_mins': 1080}. Best is trial 695 with value: 2.153336081466255.
[I 2026-03-12 00:44:48,921] Trial 843 finished with value: 2.153336081466255 and parameters: {'timeframe': 'M1', 'atr_period': 13, 'atr_threshold': 2.0, 'pt_mult': 0.5, 'sl_mult': 5.0, 'td_mins': 5}. Best is trial 695 with value: 2.153336081466255.
[I 2026-03-12 00:44:48,978] Trial 844 pruned. 
[I 2026-03-12 00:44:49,064] Trial 845 pruned. 
[I 2026-03-12 00:44:49,153] Trial 846 finished with value: 2.153336081466255 and parameters: {'timeframe': 'M1', 'atr_period': 13, 'atr_threshold': 2.0, 'pt_mult': 0.5, 'sl_mult': 5.0, 'td_mins': 5}. Best is trial 695 with value: 2.153336081466255.
[I 2026-03-12 00:44:49,242] Trial 847 finished with value: 2.153336081466255 and parameters: {'timeframe': 'M1', 'atr_period': 13, 'atr_threshold': 2.0, 'pt_mult': 0.5, 'sl_mult': 5.0, 'td_mins': 5}. Best is trial 695 with value: 2.153336081466255.
[I 2026-03-12 00:44:49,292] Trial 848 finished with value: 0.0 and parameters: {'timeframe': 'M1', 'atr_period': 13, 'atr_threshold': 15.0, 'pt_mult': 5.0, 'sl_mult': 5.0, 'td_mins': 5}. Best is trial 695 with value: 2.153336081466255.
[I 2026-03-12 00:44:49,455] Trial 849 pruned. 
[I 2026-03-12 00:44:49,505] Trial 850 finished with value: 0.0 and parameters: {'timeframe': 'M1', 'atr_period': 13, 'atr_threshold': 8.0, 'pt_mult': 2.5, 'sl_mult': 5.0, 'td_mins': 5}. Best is trial 695 with value: 2.153336081466255.
[I 2026-03-12 00:44:49,568] Trial 851 pruned. 
[I 2026-03-12 00:44:49,662] Trial 852 finished with value: 2.153336081466255 and parameters: {'timeframe': 'M1', 'atr_period': 13, 'atr_threshold': 2.0, 'pt_mult': 0.5, 'sl_mult': 5.0, 'td_mins': 5}. Best is trial 695 with value: 2.153336081466255.
[I 2026-03-12 00:44:49,753] Trial 853 finished with value: 2.153336081466255 and parameters: {'timeframe': 'M1', 'atr_period': 13, 'atr_threshold': 2.0, 'pt_mult': 0.5, 'sl_mult': 5.0, 'td_mins': 5}. Best is trial 695 with value: 2.153336081466255.
[I 2026-03-12 00:44:49,803] Trial 854 finished with value: 0.0 and parameters: {'timeframe': 'M1', 'atr_period': 13, 'atr_threshold': 8.0, 'pt_mult': 0.5, 'sl_mult': 5.0, 'td_mins': 60}. Best is trial 695 with value: 2.153336081466255.
[I 2026-03-12 00:44:49,893] Trial 855 finished with value: 2.153336081466255 and parameters: {'timeframe': 'M1', 'atr_period': 13, 'atr_threshold': 2.0, 'pt_mult': 0.5, 'sl_mult': 5.0, 'td_mins': 5}. Best is trial 695 with value: 2.153336081466255.
[I 2026-03-12 00:44:49,984] Trial 856 finished with value: 2.153336081466255 and parameters: {'timeframe': 'M1', 'atr_period': 13, 'atr_threshold': 2.0, 'pt_mult': 0.5, 'sl_mult': 5.0, 'td_mins': 5}. Best is trial 695 with value: 2.153336081466255.
[I 2026-03-12 00:44:50,073] Trial 857 finished with value: 2.153336081466255 and parameters: {'timeframe': 'M1', 'atr_period': 13, 'atr_threshold': 2.0, 'pt_mult': 0.5, 'sl_mult': 5.0, 'td_mins': 5}. Best is trial 695 with value: 2.153336081466255.
[I 2026-03-12 00:44:50,480] Trial 858 pruned. 
[I 2026-03-12 00:44:50,538] Trial 859 finished with value: 0.0 and parameters: {'timeframe': 'M1', 'atr_period': 13, 'atr_threshold': 15.0, 'pt_mult': 0.5, 'sl_mult': 5.0, 'td_mins': 1200}. Best is trial 695 with value: 2.153336081466255.
[I 2026-03-12 00:44:50,591] Trial 860 finished with value: 0.0 and parameters: {'timeframe': 'M1', 'atr_period': 13, 'atr_threshold': 8.0, 'pt_mult': 2.5, 'sl_mult': 1.0, 'td_mins': 1200}. Best is trial 695 with value: 2.153336081466255.
[I 2026-03-12 00:44:50,705] Trial 861 finished with value: 2.153336081466255 and parameters: {'timeframe': 'M1', 'atr_period': 13, 'atr_threshold': 2.0, 'pt_mult': 0.5, 'sl_mult': 5.0, 'td_mins': 5}. Best is trial 695 with value: 2.153336081466255.
[I 2026-03-12 00:44:50,755] Trial 862 finished with value: 0.0 and parameters: {'timeframe': 'M1', 'atr_period': 13, 'atr_threshold': 5.0, 'pt_mult': 0.5, 'sl_mult': 1.0, 'td_mins': 5}. Best is trial 695 with value: 2.153336081466255.
[I 2026-03-12 00:44:50,843] Trial 863 finished with value: 2.153336081466255 and parameters: {'timeframe': 'M1', 'atr_period': 13, 'atr_threshold': 2.0, 'pt_mult': 0.5, 'sl_mult': 5.0, 'td_mins': 5}. Best is trial 695 with value: 2.153336081466255.
[I 2026-03-12 00:44:50,891] Trial 864 finished with value: 0.0 and parameters: {'timeframe': 'M1', 'atr_period': 13, 'atr_threshold': 3.0, 'pt_mult': 0.5, 'sl_mult': 5.0, 'td_mins': 30}. Best is trial 695 with value: 2.153336081466255.
[I 2026-03-12 00:44:50,945] Trial 865 pruned. 
[I 2026-03-12 00:44:50,993] Trial 866 finished with value: 0.0 and parameters: {'timeframe': 'M1', 'atr_period': 13, 'atr_threshold': 8.0, 'pt_mult': 0.5, 'sl_mult': 5.0, 'td_mins': 120}. Best is trial 695 with value: 2.153336081466255.
[I 2026-03-12 00:44:51,050] Trial 867 pruned. 
[I 2026-03-12 00:44:51,100] Trial 868 finished with value: 0.0 and parameters: {'timeframe': 'M1', 'atr_period': 13, 'atr_threshold': 8.0, 'pt_mult': 0.5, 'sl_mult': 0.5, 'td_mins': 5}. Best is trial 695 with value: 2.153336081466255.
[I 2026-03-12 00:44:51,158] Trial 869 pruned. 
[I 2026-03-12 00:44:51,248] Trial 870 finished with value: 2.153336081466255 and parameters: {'timeframe': 'M1', 'atr_period': 13, 'atr_threshold': 2.0, 'pt_mult': 0.5, 'sl_mult': 5.0, 'td_mins': 5}. Best is trial 695 with value: 2.153336081466255.
[I 2026-03-12 00:44:51,342] Trial 871 finished with value: 2.153336081466255 and parameters: {'timeframe': 'M1', 'atr_period': 13, 'atr_threshold': 2.0, 'pt_mult': 0.5, 'sl_mult': 5.0, 'td_mins': 5}. Best is trial 695 with value: 2.153336081466255.
[I 2026-03-12 00:44:51,433] Trial 872 finished with value: 2.153336081466255 and parameters: {'timeframe': 'M1', 'atr_period': 13, 'atr_threshold': 2.0, 'pt_mult': 0.5, 'sl_mult': 5.0, 'td_mins': 5}. Best is trial 695 with value: 2.153336081466255.
[I 2026-03-12 00:44:51,491] Trial 873 finished with value: 0.0 and parameters: {'timeframe': 'M1', 'atr_period': 13, 'atr_threshold': 10.0, 'pt_mult': 2.5, 'sl_mult': 5.0, 'td_mins': 1200}. Best is trial 695 with value: 2.153336081466255.
[I 2026-03-12 00:44:51,585] Trial 874 finished with value: 2.153336081466255 and parameters: {'timeframe': 'M1', 'atr_period': 13, 'atr_threshold': 2.0, 'pt_mult': 0.5, 'sl_mult': 5.0, 'td_mins': 5}. Best is trial 695 with value: 2.153336081466255.
[I 2026-03-12 00:44:51,674] Trial 875 finished with value: 2.153336081466255 and parameters: {'timeframe': 'M1', 'atr_period': 13, 'atr_threshold': 2.0, 'pt_mult': 0.5, 'sl_mult': 5.0, 'td_mins': 5}. Best is trial 695 with value: 2.153336081466255.
[I 2026-03-12 00:44:51,726] Trial 876 finished with value: 0.0 and parameters: {'timeframe': 'M1', 'atr_period': 13, 'atr_threshold': 15.0, 'pt_mult': 2.5, 'sl_mult': 5.0, 'td_mins': 180}. Best is trial 695 with value: 2.153336081466255.
[I 2026-03-12 00:44:51,778] Trial 877 finished with value: 0.0 and parameters: {'timeframe': 'M1', 'atr_period': 13, 'atr_threshold': 15.0, 'pt_mult': 0.5, 'sl_mult': 5.0, 'td_mins': 180}. Best is trial 695 with value: 2.153336081466255.
[I 2026-03-12 00:44:51,851] Trial 878 pruned. 
[I 2026-03-12 00:44:51,925] Trial 879 finished with value: 0.0 and parameters: {'timeframe': 'M1', 'atr_period': 13, 'atr_threshold': 5.0, 'pt_mult': 1.0, 'sl_mult': 0.5, 'td_mins': 5}. Best is trial 695 with value: 2.153336081466255.
[I 2026-03-12 00:44:52,022] Trial 880 pruned. 
