[I 2026-03-12 01:04:40,723] Trial 819 finished with value: 2.2537359686354455 and parameters: {'timeframe': 'M8', 'atr_period': 13, 'atr_threshold': 3.0, 'pt_mult': 0.5, 'sl_mult': 5.0, 'td_mins': 60}. Best is trial 57 with value: 2.2537359686354455.
[I 2026-03-12 01:04:40,869] Trial 820 pruned. 
[I 2026-03-12 01:04:41,088] Trial 821 finished with value: 2.2537359686354455 and parameters: {'timeframe': 'M8', 'atr_period': 13, 'atr_threshold': 3.0, 'pt_mult': 0.5, 'sl_mult': 5.0, 'td_mins': 60}. Best is trial 57 with value: 2.2537359686354455.
[I 2026-03-12 01:04:41,315] Trial 822 finished with value: 2.2537359686354455 and parameters: {'timeframe': 'M8', 'atr_period': 13, 'atr_threshold': 3.0, 'pt_mult': 0.5, 'sl_mult': 5.0, 'td_mins': 60}. Best is trial 57 with value: 2.2537359686354455.
[I 2026-03-12 01:04:41,539] Trial 823 finished with value: 2.2537359686354455 and parameters: {'timeframe': 'M8', 'atr_period': 13, 'atr_threshold': 3.0, 'pt_mult': 0.5, 'sl_mult': 5.0, 'td_mins': 60}. Best is trial 57 with value: 2.2537359686354455.
[I 2026-03-12 01:04:41,763] Trial 824 finished with value: 2.2537359686354455 and parameters: {'timeframe': 'M8', 'atr_period': 13, 'atr_threshold': 3.0, 'pt_mult': 0.5, 'sl_mult': 5.0, 'td_mins': 60}. Best is trial 57 with value: 2.2537359686354455.
[I 2026-03-12 01:04:42,567] Trial 825 pruned. 
[I 2026-03-12 01:04:42,770] Trial 826 finished with value: 2.2537359686354455 and parameters: {'timeframe': 'M8', 'atr_period': 13, 'atr_threshold': 3.0, 'pt_mult': 0.5, 'sl_mult': 5.0, 'td_mins': 60}. Best is trial 57 with value: 2.2537359686354455.
[I 2026-03-12 01:04:43,444] Trial 827 pruned. 
[I 2026-03-12 01:04:43,498] Trial 828 finished with value: 0.0 and parameters: {'timeframe': 'M8', 'atr_period': 13, 'atr_threshold': 8.0, 'pt_mult': 5.0, 'sl_mult': 1.0, 'td_mins': 60}. Best is trial 57 with value: 2.2537359686354455.
[I 2026-03-12 01:04:43,701] Trial 829 finished with value: 2.2537359686354455 and parameters: {'timeframe': 'M8', 'atr_period': 13, 'atr_threshold': 3.0, 'pt_mult': 0.5, 'sl_mult': 5.0, 'td_mins': 60}. Best is trial 57 with value: 2.2537359686354455.
[I 2026-03-12 01:04:44,012] Trial 830 pruned. 
[I 2026-03-12 01:04:44,314] Trial 831 pruned. 
[I 2026-03-12 01:04:44,496] Trial 832 finished with value: 2.2537359686354455 and parameters: {'timeframe': 'M8', 'atr_period': 13, 'atr_threshold': 3.0, 'pt_mult': 0.5, 'sl_mult': 5.0, 'td_mins': 60}. Best is trial 57 with value: 2.2537359686354455.
[I 2026-03-12 01:04:44,684] Trial 833 finished with value: 2.2537359686354455 and parameters: {'timeframe': 'M8', 'atr_period': 13, 'atr_threshold': 3.0, 'pt_mult': 0.5, 'sl_mult': 5.0, 'td_mins': 60}. Best is trial 57 with value: 2.2537359686354455.
[I 2026-03-12 01:04:45,619] Trial 834 pruned. 
[I 2026-03-12 01:04:46,469] Trial 835 pruned. 
[I 2026-03-12 01:04:46,636] Trial 836 pruned. 
[I 2026-03-12 01:04:46,822] Trial 837 finished with value: 2.2537359686354455 and parameters: {'timeframe': 'M8', 'atr_period': 13, 'atr_threshold': 3.0, 'pt_mult': 0.5, 'sl_mult': 5.0, 'td_mins': 60}. Best is trial 57 with value: 2.2537359686354455.
[I 2026-03-12 01:04:47,031] Trial 838 finished with value: 2.2537359686354455 and parameters: {'timeframe': 'M8', 'atr_period': 13, 'atr_threshold': 3.0, 'pt_mult': 0.5, 'sl_mult': 5.0, 'td_mins': 60}. Best is trial 57 with value: 2.2537359686354455.
[I 2026-03-12 01:04:47,194] Trial 839 pruned. 
[I 2026-03-12 01:04:47,402] Trial 840 finished with value: 2.2537359686354455 and parameters: {'timeframe': 'M8', 'atr_period': 13, 'atr_threshold': 3.0, 'pt_mult': 0.5, 'sl_mult': 5.0, 'td_mins': 60}. Best is trial 57 with value: 2.2537359686354455.
[I 2026-03-12 01:04:47,451] Trial 841 finished with value: 0.0 and parameters: {'timeframe': 'M8', 'atr_period': 13, 'atr_threshold': 8.0, 'pt_mult': 5.0, 'sl_mult': 1.0, 'td_mins': 5}. Best is trial 57 with value: 2.2537359686354455.
[I 2026-03-12 01:04:47,504] Trial 842 finished with value: 0.0 and parameters: {'timeframe': 'M8', 'atr_period': 13, 'atr_threshold': 10.0, 'pt_mult': 5.0, 'sl_mult': 1.0, 'td_mins': 15}. Best is trial 57 with value: 2.2537359686354455.
[I 2026-03-12 01:04:47,896] Trial 843 pruned. 
[I 2026-03-12 01:04:47,946] Trial 844 finished with value: 0.0 and parameters: {'timeframe': 'M8', 'atr_period': 13, 'atr_threshold': 8.0, 'pt_mult': 5.0, 'sl_mult': 5.0, 'td_mins': 720}. Best is trial 57 with value: 2.2537359686354455.
[I 2026-03-12 01:04:48,305] Trial 845 pruned. 
[I 2026-03-12 01:04:48,504] Trial 846 finished with value: 2.2537359686354455 and parameters: {'timeframe': 'M8', 'atr_period': 13, 'atr_threshold': 3.0, 'pt_mult': 0.5, 'sl_mult': 5.0, 'td_mins': 60}. Best is trial 57 with value: 2.2537359686354455.
[I 2026-03-12 01:04:48,629] Trial 847 pruned. 
[I 2026-03-12 01:04:48,684] Trial 848 finished with value: 0.0 and parameters: {'timeframe': 'M8', 'atr_period': 13, 'atr_threshold': 10.0, 'pt_mult': 2.5, 'sl_mult': 5.0, 'td_mins': 1080}. Best is trial 57 with value: 2.2537359686354455.
[I 2026-03-12 01:04:48,761] Trial 849 pruned. 
[I 2026-03-12 01:04:48,818] Trial 850 finished with value: 0.0 and parameters: {'timeframe': 'M8', 'atr_period': 13, 'atr_threshold': 10.0, 'pt_mult': 0.5, 'sl_mult': 1.0, 'td_mins': 1080}. Best is trial 57 with value: 2.2537359686354455.
[I 2026-03-12 01:04:49,919] Trial 851 pruned. 
[I 2026-03-12 01:04:49,983] Trial 852 pruned. 
[I 2026-03-12 01:04:50,063] Trial 853 pruned. 
[I 2026-03-12 01:04:50,115] Trial 854 finished with value: 0.0 and parameters: {'timeframe': 'M8', 'atr_period': 13, 'atr_threshold': 15.0, 'pt_mult': 5.0, 'sl_mult': 2.5, 'td_mins': 120}. Best is trial 57 with value: 2.2537359686354455.
[I 2026-03-12 01:04:50,220] Trial 855 pruned. 
[I 2026-03-12 01:04:50,284] Trial 856 pruned. 
[I 2026-03-12 01:04:50,349] Trial 857 pruned. 
[I 2026-03-12 01:04:50,399] Trial 858 finished with value: 0.0 and parameters: {'timeframe': 'M8', 'atr_period': 13, 'atr_threshold': 10.0, 'pt_mult': 2.5, 'sl_mult': 5.0, 'td_mins': 120}. Best is trial 57 with value: 2.2537359686354455.
[I 2026-03-12 01:04:50,463] Trial 859 pruned. 
[I 2026-03-12 01:04:50,517] Trial 860 finished with value: 0.0 and parameters: {'timeframe': 'M8', 'atr_period': 13, 'atr_threshold': 10.0, 'pt_mult': 0.5, 'sl_mult': 5.0, 'td_mins': 60}. Best is trial 57 with value: 2.2537359686354455.
[I 2026-03-12 01:04:50,773] Trial 861 pruned. 
[I 2026-03-12 01:04:50,973] Trial 862 finished with value: 2.2537359686354455 and parameters: {'timeframe': 'M8', 'atr_period': 13, 'atr_threshold': 3.0, 'pt_mult': 0.5, 'sl_mult': 5.0, 'td_mins': 60}. Best is trial 57 with value: 2.2537359686354455.
[I 2026-03-12 01:04:51,025] Trial 863 pruned. 
[I 2026-03-12 01:04:51,098] Trial 864 finished with value: 0.0 and parameters: {'timeframe': 'M8', 'atr_period': 13, 'atr_threshold': 8.0, 'pt_mult': 0.5, 'sl_mult': 5.0, 'td_mins': 60}. Best is trial 57 with value: 2.2537359686354455.
[I 2026-03-12 01:04:51,178] Trial 865 finished with value: 0.0 and parameters: {'timeframe': 'M8', 'atr_period': 13, 'atr_threshold': 15.0, 'pt_mult': 2.5, 'sl_mult': 1.0, 'td_mins': 360}. Best is trial 57 with value: 2.2537359686354455.
[I 2026-03-12 01:04:51,375] Trial 866 finished with value: 2.2537359686354455 and parameters: {'timeframe': 'M8', 'atr_period': 13, 'atr_threshold': 3.0, 'pt_mult': 0.5, 'sl_mult': 5.0, 'td_mins': 60}. Best is trial 57 with value: 2.2537359686354455.
[I 2026-03-12 01:04:51,427] Trial 867 pruned. 
[I 2026-03-12 01:04:51,489] Trial 868 finished with value: 0.0 and parameters: {'timeframe': 'M8', 'atr_period': 13, 'atr_threshold': 10.0, 'pt_mult': 5.0, 'sl_mult': 1.0, 'td_mins': 1080}. Best is trial 57 with value: 2.2537359686354455.
[I 2026-03-12 01:04:51,550] Trial 869 pruned. 
[I 2026-03-12 01:04:51,758] Trial 870 finished with value: 2.2537359686354455 and parameters: {'timeframe': 'M8', 'atr_period': 13, 'atr_threshold': 3.0, 'pt_mult': 0.5, 'sl_mult': 5.0, 'td_mins': 60}. Best is trial 57 with value: 2.2537359686354455.
[I 2026-03-12 01:04:51,936] Trial 871 pruned. 
[I 2026-03-12 01:04:52,151] Trial 872 pruned. 
[I 2026-03-12 01:04:52,282] Trial 873 pruned. 
[I 2026-03-12 01:04:52,475] Trial 874 finished with value: 2.2537359686354455 and parameters: {'timeframe': 'M8', 'atr_period': 13, 'atr_threshold': 3.0, 'pt_mult': 0.5, 'sl_mult': 5.0, 'td_mins': 60}. Best is trial 57 with value: 2.2537359686354455.
[I 2026-03-12 01:04:52,526] Trial 875 pruned. 
[I 2026-03-12 01:04:52,589] Trial 876 pruned. 
[I 2026-03-12 01:04:52,782] Trial 877 finished with value: 2.2537359686354455 and parameters: {'timeframe': 'M8', 'atr_period': 13, 'atr_threshold': 3.0, 'pt_mult': 0.5, 'sl_mult': 5.0, 'td_mins': 60}. Best is trial 57 with value: 2.2537359686354455.
[I 2026-03-12 01:04:52,835] Trial 878 pruned. 
[I 2026-03-12 01:04:52,961] Trial 879 pruned. 
[I 2026-03-12 01:04:54,352] Trial 880 pruned. 
[I 2026-03-12 01:04:54,586] Trial 881 pruned. 
[I 2026-03-12 01:04:54,650] Trial 882 pruned. 
[I 2026-03-12 01:04:55,130] Trial 883 pruned. 
[I 2026-03-12 01:04:55,319] Trial 884 finished with value: 2.2537359686354455 and parameters: {'timeframe': 'M8', 'atr_period': 13, 'atr_threshold': 3.0, 'pt_mult': 0.5, 'sl_mult': 5.0, 'td_mins': 60}. Best is trial 57 with value: 2.2537359686354455.
[I 2026-03-12 01:04:55,502] Trial 885 finished with value: 2.2537359686354455 and parameters: {'timeframe': 'M8', 'atr_period': 13, 'atr_threshold': 3.0, 'pt_mult': 0.5, 'sl_mult': 5.0, 'td_mins': 60}. Best is trial 57 with value: 2.2537359686354455.
[I 2026-03-12 01:04:55,570] Trial 886 pruned. 
[I 2026-03-12 01:04:55,757] Trial 887 finished with value: 2.2537359686354455 and parameters: {'timeframe': 'M8', 'atr_period': 13, 'atr_threshold': 3.0, 'pt_mult': 0.5, 'sl_mult': 5.0, 'td_mins': 60}. Best is trial 57 with value: 2.2537359686354455.
[I 2026-03-12 01:04:55,860] Trial 888 pruned. 
[I 2026-03-12 01:04:56,053] Trial 889 finished with value: 2.2537359686354455 and parameters: {'timeframe': 'M8', 'atr_period': 13, 'atr_threshold': 3.0, 'pt_mult': 0.5, 'sl_mult': 5.0, 'td_mins': 60}. Best is trial 57 with value: 2.2537359686354455.
[I 2026-03-12 01:04:56,181] Trial 890 pruned. 
[I 2026-03-12 01:04:56,234] Trial 891 finished with value: 0.0 and parameters: {'timeframe': 'M8', 'atr_period': 13, 'atr_threshold': 15.0, 'pt_mult': 0.5, 'sl_mult': 5.0, 'td_mins': 60}. Best is trial 57 with value: 2.2537359686354455.
[I 2026-03-12 01:04:56,288] Trial 892 finished with value: 0.0 and parameters: {'timeframe': 'M8', 'atr_period': 13, 'atr_threshold': 8.0, 'pt_mult': 5.0, 'sl_mult': 2.5, 'td_mins': 360}. Best is trial 57 with value: 2.2537359686354455.
[I 2026-03-12 01:04:56,345] Trial 893 pruned. 
[I 2026-03-12 01:04:56,445] Trial 894 pruned. 
[I 2026-03-12 01:04:56,638] Trial 895 finished with value: 2.2537359686354455 and parameters: {'timeframe': 'M8', 'atr_period': 13, 'atr_threshold': 3.0, 'pt_mult': 0.5, 'sl_mult': 5.0, 'td_mins': 60}. Best is trial 57 with value: 2.2537359686354455.
[I 2026-03-12 01:04:56,872] Trial 896 pruned. 
[I 2026-03-12 01:04:56,928] Trial 897 finished with value: 0.0 and parameters: {'timeframe': 'M8', 'atr_period': 13, 'atr_threshold': 8.0, 'pt_mult': 1.0, 'sl_mult': 5.0, 'td_mins': 180}. Best is trial 57 with value: 2.2537359686354455.
[I 2026-03-12 01:04:57,035] Trial 898 finished with value: 1.4188342665491664 and parameters: {'timeframe': 'M8', 'atr_period': 13, 'atr_threshold': 5.0, 'pt_mult': 0.5, 'sl_mult': 5.0, 'td_mins': 60}. Best is trial 57 with value: 2.2537359686354455.
[I 2026-03-12 01:04:57,261] Trial 899 finished with value: 2.2537359686354455 and parameters: {'timeframe': 'M8', 'atr_period': 13, 'atr_threshold': 3.0, 'pt_mult': 0.5, 'sl_mult': 5.0, 'td_mins': 60}. Best is trial 57 with value: 2.2537359686354455.
[I 2026-03-12 01:04:57,455] Trial 900 finished with value: 2.2537359686354455 and parameters: {'timeframe': 'M8', 'atr_period': 13, 'atr_threshold': 3.0, 'pt_mult': 0.5, 'sl_mult': 5.0, 'td_mins': 60}. Best is trial 57 with value: 2.2537359686354455.
[I 2026-03-12 01:04:57,646] Trial 901 pruned. 
[I 2026-03-12 01:04:58,085] Trial 902 pruned. 
[I 2026-03-12 01:04:58,284] Trial 903 finished with value: 2.2537359686354455 and parameters: {'timeframe': 'M8', 'atr_period': 13, 'atr_threshold': 3.0, 'pt_mult': 0.5, 'sl_mult': 5.0, 'td_mins': 60}. Best is trial 57 with value: 2.2537359686354455.
[I 2026-03-12 01:04:58,432] Trial 904 pruned. 
[I 2026-03-12 01:04:58,481] Trial 905 finished with value: 0.0 and parameters: {'timeframe': 'M8', 'atr_period': 13, 'atr_threshold': 8.0, 'pt_mult': 0.5, 'sl_mult': 0.5, 'td_mins': 1080}. Best is trial 57 with value: 2.2537359686354455.
[I 2026-03-12 01:05:00,663] Trial 906 pruned. 
[I 2026-03-12 01:05:00,852] Trial 907 pruned. 
[I 2026-03-12 01:05:00,965] Trial 908 pruned. 
[I 2026-03-12 01:05:01,154] Trial 909 finished with value: 2.2537359686354455 and parameters: {'timeframe': 'M8', 'atr_period': 13, 'atr_threshold': 3.0, 'pt_mult': 0.5, 'sl_mult': 5.0, 'td_mins': 60}. Best is trial 57 with value: 2.2537359686354455.
[I 2026-03-12 01:05:01,211] Trial 910 pruned. 
[I 2026-03-12 01:05:01,435] Trial 911 finished with value: 2.2537359686354455 and parameters: {'timeframe': 'M8', 'atr_period': 13, 'atr_threshold': 3.0, 'pt_mult': 0.5, 'sl_mult': 5.0, 'td_mins': 60}. Best is trial 57 with value: 2.2537359686354455.
[I 2026-03-12 01:05:01,641] Trial 912 finished with value: 2.2537359686354455 and parameters: {'timeframe': 'M8', 'atr_period': 13, 'atr_threshold': 3.0, 'pt_mult': 0.5, 'sl_mult': 5.0, 'td_mins': 60}. Best is trial 57 with value: 2.2537359686354455.
[I 2026-03-12 01:05:01,832] Trial 913 finished with value: 2.2537359686354455 and parameters: {'timeframe': 'M8', 'atr_period': 13, 'atr_threshold': 3.0, 'pt_mult': 0.5, 'sl_mult': 5.0, 'td_mins': 60}. Best is trial 57 with value: 2.2537359686354455.
[I 2026-03-12 01:05:02,055] Trial 914 finished with value: 2.2537359686354455 and parameters: {'timeframe': 'M8', 'atr_period': 13, 'atr_threshold': 3.0, 'pt_mult': 0.5, 'sl_mult': 5.0, 'td_mins': 60}. Best is trial 57 with value: 2.2537359686354455.
[I 2026-03-12 01:05:02,198] Trial 915 pruned. 
[I 2026-03-12 01:05:02,406] Trial 916 finished with value: 2.2537359686354455 and parameters: {'timeframe': 'M8', 'atr_period': 13, 'atr_threshold': 3.0, 'pt_mult': 0.5, 'sl_mult': 5.0, 'td_mins': 60}. Best is trial 57 with value: 2.2537359686354455.
[I 2026-03-12 01:05:02,462] Trial 917 finished with value: 0.0 and parameters: {'timeframe': 'M8', 'atr_period': 13, 'atr_threshold': 15.0, 'pt_mult': 2.5, 'sl_mult': 5.0, 'td_mins': 15}. Best is trial 57 with value: 2.2537359686354455.
[I 2026-03-12 01:05:02,514] Trial 918 finished with value: 0.0 and parameters: {'timeframe': 'M8', 'atr_period': 13, 'atr_threshold': 8.0, 'pt_mult': 2.5, 'sl_mult': 5.0, 'td_mins': 720}. Best is trial 57 with value: 2.2537359686354455.
[I 2026-03-12 01:05:02,788] Trial 919 pruned. 
[I 2026-03-12 01:05:02,914] Trial 920 pruned. 
[I 2026-03-12 01:05:02,969] Trial 921 finished with value: 0.0 and parameters: {'timeframe': 'M8', 'atr_period': 13, 'atr_threshold': 10.0, 'pt_mult': 0.5, 'sl_mult': 5.0, 'td_mins': 60}. Best is trial 57 with value: 2.2537359686354455.
[I 2026-03-12 01:05:03,182] Trial 922 finished with value: 2.2537359686354455 and parameters: {'timeframe': 'M8', 'atr_period': 13, 'atr_threshold': 3.0, 'pt_mult': 0.5, 'sl_mult': 5.0, 'td_mins': 60}. Best is trial 57 with value: 2.2537359686354455.
[I 2026-03-12 01:05:03,323] Trial 923 pruned. 
[I 2026-03-12 01:05:03,375] Trial 924 finished with value: 0.0 and parameters: {'timeframe': 'M8', 'atr_period': 13, 'atr_threshold': 10.0, 'pt_mult': 1.0, 'sl_mult': 0.5, 'td_mins': 720}. Best is trial 57 with value: 2.2537359686354455.
[I 2026-03-12 01:05:04,287] Trial 925 pruned. 
[I 2026-03-12 01:05:04,506] Trial 926 finished with value: 2.2537359686354455 and parameters: {'timeframe': 'M8', 'atr_period': 13, 'atr_threshold': 3.0, 'pt_mult': 0.5, 'sl_mult': 5.0, 'td_mins': 60}. Best is trial 57 with value: 2.2537359686354455.
[I 2026-03-12 01:05:04,720] Trial 927 finished with value: 2.2537359686354455 and parameters: {'timeframe': 'M8', 'atr_period': 13, 'atr_threshold': 3.0, 'pt_mult': 0.5, 'sl_mult': 5.0, 'td_mins': 60}. Best is trial 57 with value: 2.2537359686354455.
[I 2026-03-12 01:05:04,775] Trial 928 finished with value: 0.0 and parameters: {'timeframe': 'M8', 'atr_period': 13, 'atr_threshold': 10.0, 'pt_mult': 5.0, 'sl_mult': 2.5, 'td_mins': 15}. Best is trial 57 with value: 2.2537359686354455.
[I 2026-03-12 01:05:04,831] Trial 929 finished with value: 0.0 and parameters: {'timeframe': 'M8', 'atr_period': 13, 'atr_threshold': 10.0, 'pt_mult': 2.5, 'sl_mult': 5.0, 'td_mins': 15}. Best is trial 57 with value: 2.2537359686354455.
[I 2026-03-12 01:05:04,933] Trial 930 pruned. 
[I 2026-03-12 01:05:06,423] Trial 931 pruned. 
[I 2026-03-12 01:05:06,481] Trial 932 pruned. 
[I 2026-03-12 01:05:06,562] Trial 933 pruned. 
[I 2026-03-12 01:05:06,963] Trial 934 pruned. 
[I 2026-03-12 01:05:07,374] Trial 935 pruned. 
[I 2026-03-12 01:05:07,430] Trial 936 pruned. 
[I 2026-03-12 01:05:07,488] Trial 937 pruned. 
[I 2026-03-12 01:05:07,673] Trial 938 finished with value: 2.2537359686354455 and parameters: {'timeframe': 'M8', 'atr_period': 13, 'atr_threshold': 3.0, 'pt_mult': 0.5, 'sl_mult': 5.0, 'td_mins': 60}. Best is trial 57 with value: 2.2537359686354455.
[I 2026-03-12 01:05:07,843] Trial 939 pruned. 
[I 2026-03-12 01:05:08,025] Trial 940 finished with value: 2.2537359686354455 and parameters: {'timeframe': 'M8', 'atr_period': 13, 'atr_threshold': 3.0, 'pt_mult': 0.5, 'sl_mult': 5.0, 'td_mins': 60}. Best is trial 57 with value: 2.2537359686354455.
[I 2026-03-12 01:05:08,076] Trial 941 finished with value: 0.0 and parameters: {'timeframe': 'M8', 'atr_period': 13, 'atr_threshold': 8.0, 'pt_mult': 0.5, 'sl_mult': 1.0, 'td_mins': 30}. Best is trial 57 with value: 2.2537359686354455.
[I 2026-03-12 01:05:08,141] Trial 942 pruned. 
[I 2026-03-12 01:05:08,201] Trial 943 pruned. 
[I 2026-03-12 01:05:08,390] Trial 944 finished with value: 2.2537359686354455 and parameters: {'timeframe': 'M8', 'atr_period': 13, 'atr_threshold': 3.0, 'pt_mult': 0.5, 'sl_mult': 5.0, 'td_mins': 60}. Best is trial 57 with value: 2.2537359686354455.
[I 2026-03-12 01:05:08,571] Trial 945 finished with value: 2.2537359686354455 and parameters: {'timeframe': 'M8', 'atr_period': 13, 'atr_threshold': 3.0, 'pt_mult': 0.5, 'sl_mult': 5.0, 'td_mins': 60}. Best is trial 57 with value: 2.2537359686354455.
[I 2026-03-12 01:05:08,619] Trial 946 finished with value: 0.0 and parameters: {'timeframe': 'M8', 'atr_period': 13, 'atr_threshold': 8.0, 'pt_mult': 0.5, 'sl_mult': 0.5, 'td_mins': 15}. Best is trial 57 with value: 2.2537359686354455.
[I 2026-03-12 01:05:08,672] Trial 947 finished with value: 0.0 and parameters: {'timeframe': 'M8', 'atr_period': 13, 'atr_threshold': 8.0, 'pt_mult': 1.0, 'sl_mult': 5.0, 'td_mins': 1080}. Best is trial 57 with value: 2.2537359686354455.
[I 2026-03-12 01:05:08,763] Trial 948 pruned. 
[I 2026-03-12 01:05:08,863] Trial 949 pruned. 
[I 2026-03-12 01:05:08,914] Trial 950 finished with value: 0.0 and parameters: {'timeframe': 'M8', 'atr_period': 13, 'atr_threshold': 10.0, 'pt_mult': 1.0, 'sl_mult': 5.0, 'td_mins': 360}. Best is trial 57 with value: 2.2537359686354455.
[I 2026-03-12 01:05:08,990] Trial 951 pruned. 
[I 2026-03-12 01:05:09,172] Trial 952 finished with value: 2.2537359686354455 and parameters: {'timeframe': 'M8', 'atr_period': 13, 'atr_threshold': 3.0, 'pt_mult': 0.5, 'sl_mult': 5.0, 'td_mins': 60}. Best is trial 57 with value: 2.2537359686354455.
[I 2026-03-12 01:05:09,238] Trial 953 pruned. 
[I 2026-03-12 01:05:09,426] Trial 954 finished with value: 2.2537359686354455 and parameters: {'timeframe': 'M8', 'atr_period': 13, 'atr_threshold': 3.0, 'pt_mult': 0.5, 'sl_mult': 5.0, 'td_mins': 60}. Best is trial 57 with value: 2.2537359686354455.
[I 2026-03-12 01:05:11,199] Trial 955 pruned. 
[I 2026-03-12 01:05:11,260] Trial 956 pruned. 
[I 2026-03-12 01:05:11,312] Trial 957 pruned. 
[I 2026-03-12 01:05:11,363] Trial 958 finished with value: 0.0 and parameters: {'timeframe': 'M8', 'atr_period': 13, 'atr_threshold': 8.0, 'pt_mult': 0.5, 'sl_mult': 5.0, 'td_mins': 60}. Best is trial 57 with value: 2.2537359686354455.
[I 2026-03-12 01:05:11,448] Trial 959 pruned. 
[I 2026-03-12 01:05:11,584] Trial 960 pruned. 
[I 2026-03-12 01:05:11,648] Trial 961 pruned. 
[I 2026-03-12 01:05:11,698] Trial 962 finished with value: 0.0 and parameters: {'timeframe': 'M8', 'atr_period': 13, 'atr_threshold': 8.0, 'pt_mult': 0.5, 'sl_mult': 5.0, 'td_mins': 15}. Best is trial 57 with value: 2.2537359686354455.
[I 2026-03-12 01:05:11,807] Trial 963 pruned. 
[I 2026-03-12 01:05:11,866] Trial 964 finished with value: 0.0 and parameters: {'timeframe': 'M8', 'atr_period': 13, 'atr_threshold': 8.0, 'pt_mult': 0.5, 'sl_mult': 2.5, 'td_mins': 180}. Best is trial 57 with value: 2.2537359686354455.
[I 2026-03-12 01:05:12,077] Trial 965 finished with value: 2.2537359686354455 and parameters: {'timeframe': 'M8', 'atr_period': 13, 'atr_threshold': 3.0, 'pt_mult': 0.5, 'sl_mult': 5.0, 'td_mins': 60}. Best is trial 57 with value: 2.2537359686354455.
[I 2026-03-12 01:05:12,145] Trial 966 pruned. 
[I 2026-03-12 01:05:12,231] Trial 967 pruned. 
[I 2026-03-12 01:05:12,282] Trial 968 finished with value: 0.0 and parameters: {'timeframe': 'M8', 'atr_period': 13, 'atr_threshold': 8.0, 'pt_mult': 2.5, 'sl_mult': 2.5, 'td_mins': 5}. Best is trial 57 with value: 2.2537359686354455.
[I 2026-03-12 01:05:12,340] Trial 969 pruned. 
[I 2026-03-12 01:05:12,532] Trial 970 finished with value: 2.2537359686354455 and parameters: {'timeframe': 'M8', 'atr_period': 13, 'atr_threshold': 3.0, 'pt_mult': 0.5, 'sl_mult': 5.0, 'td_mins': 60}. Best is trial 57 with value: 2.2537359686354455.
