[I 2026-03-12 02:03:10,402] Trial 306 finished with value: 1.977309488674108 and parameters: {'timeframe': 'M15', 'atr_period': 13, 'atr_threshold': 3.0, 'pt_mult': 1.0, 'sl_mult': 5.0, 'td_mins': 360}. Best is trial 290 with value: 2.1951474620740763.
[I 2026-03-12 02:03:11,052] Trial 307 finished with value: 1.977309488674108 and parameters: {'timeframe': 'M15', 'atr_period': 13, 'atr_threshold': 3.0, 'pt_mult': 1.0, 'sl_mult': 5.0, 'td_mins': 360}. Best is trial 290 with value: 2.1951474620740763.
[I 2026-03-12 02:03:11,753] Trial 308 finished with value: 1.977309488674108 and parameters: {'timeframe': 'M15', 'atr_period': 13, 'atr_threshold': 3.0, 'pt_mult': 1.0, 'sl_mult': 5.0, 'td_mins': 360}. Best is trial 290 with value: 2.1951474620740763.
[I 2026-03-12 02:03:12,412] Trial 309 finished with value: 1.977309488674108 and parameters: {'timeframe': 'M15', 'atr_period': 13, 'atr_threshold': 3.0, 'pt_mult': 1.0, 'sl_mult': 5.0, 'td_mins': 360}. Best is trial 290 with value: 2.1951474620740763.
[I 2026-03-12 02:03:13,065] Trial 310 finished with value: 1.977309488674108 and parameters: {'timeframe': 'M15', 'atr_period': 13, 'atr_threshold': 3.0, 'pt_mult': 1.0, 'sl_mult': 5.0, 'td_mins': 360}. Best is trial 290 with value: 2.1951474620740763.
[I 2026-03-12 02:03:13,710] Trial 311 finished with value: 1.977309488674108 and parameters: {'timeframe': 'M15', 'atr_period': 13, 'atr_threshold': 3.0, 'pt_mult': 1.0, 'sl_mult': 5.0, 'td_mins': 360}. Best is trial 290 with value: 2.1951474620740763.
[I 2026-03-12 02:03:14,349] Trial 312 finished with value: 1.977309488674108 and parameters: {'timeframe': 'M15', 'atr_period': 13, 'atr_threshold': 3.0, 'pt_mult': 1.0, 'sl_mult': 5.0, 'td_mins': 360}. Best is trial 290 with value: 2.1951474620740763.
[I 2026-03-12 02:03:15,027] Trial 313 finished with value: 1.977309488674108 and parameters: {'timeframe': 'M15', 'atr_period': 13, 'atr_threshold': 3.0, 'pt_mult': 1.0, 'sl_mult': 5.0, 'td_mins': 360}. Best is trial 290 with value: 2.1951474620740763.
[I 2026-03-12 02:03:15,708] Trial 314 finished with value: 1.977309488674108 and parameters: {'timeframe': 'M15', 'atr_period': 13, 'atr_threshold': 3.0, 'pt_mult': 1.0, 'sl_mult': 5.0, 'td_mins': 360}. Best is trial 290 with value: 2.1951474620740763.
[I 2026-03-12 02:03:16,356] Trial 315 finished with value: 1.977309488674108 and parameters: {'timeframe': 'M15', 'atr_period': 13, 'atr_threshold': 3.0, 'pt_mult': 1.0, 'sl_mult': 5.0, 'td_mins': 360}. Best is trial 290 with value: 2.1951474620740763.
[I 2026-03-12 02:03:17,005] Trial 316 finished with value: 1.977309488674108 and parameters: {'timeframe': 'M15', 'atr_period': 13, 'atr_threshold': 3.0, 'pt_mult': 1.0, 'sl_mult': 5.0, 'td_mins': 360}. Best is trial 290 with value: 2.1951474620740763.
[I 2026-03-12 02:03:17,632] Trial 317 finished with value: 1.977309488674108 and parameters: {'timeframe': 'M15', 'atr_period': 13, 'atr_threshold': 3.0, 'pt_mult': 1.0, 'sl_mult': 5.0, 'td_mins': 360}. Best is trial 290 with value: 2.1951474620740763.
[I 2026-03-12 02:03:18,280] Trial 318 finished with value: 1.977309488674108 and parameters: {'timeframe': 'M15', 'atr_period': 13, 'atr_threshold': 3.0, 'pt_mult': 1.0, 'sl_mult': 5.0, 'td_mins': 360}. Best is trial 290 with value: 2.1951474620740763.
[I 2026-03-12 02:03:18,939] Trial 319 finished with value: 1.977309488674108 and parameters: {'timeframe': 'M15', 'atr_period': 13, 'atr_threshold': 3.0, 'pt_mult': 1.0, 'sl_mult': 5.0, 'td_mins': 360}. Best is trial 290 with value: 2.1951474620740763.
[I 2026-03-12 02:03:19,587] Trial 320 finished with value: 1.977309488674108 and parameters: {'timeframe': 'M15', 'atr_period': 13, 'atr_threshold': 3.0, 'pt_mult': 1.0, 'sl_mult': 5.0, 'td_mins': 360}. Best is trial 290 with value: 2.1951474620740763.
[I 2026-03-12 02:03:20,297] Trial 321 finished with value: 1.977309488674108 and parameters: {'timeframe': 'M15', 'atr_period': 13, 'atr_threshold': 3.0, 'pt_mult': 1.0, 'sl_mult': 5.0, 'td_mins': 360}. Best is trial 290 with value: 2.1951474620740763.
[I 2026-03-12 02:03:20,973] Trial 322 finished with value: 1.977309488674108 and parameters: {'timeframe': 'M15', 'atr_period': 13, 'atr_threshold': 3.0, 'pt_mult': 1.0, 'sl_mult': 5.0, 'td_mins': 360}. Best is trial 290 with value: 2.1951474620740763.
[I 2026-03-12 02:03:21,098] Trial 323 finished with value: 2.1951474620740763 and parameters: {'timeframe': 'M15', 'atr_period': 13, 'atr_threshold': 5.0, 'pt_mult': 1.0, 'sl_mult': 5.0, 'td_mins': 120}. Best is trial 290 with value: 2.1951474620740763.
[I 2026-03-12 02:03:21,228] Trial 324 finished with value: 2.1951474620740763 and parameters: {'timeframe': 'M15', 'atr_period': 13, 'atr_threshold': 5.0, 'pt_mult': 1.0, 'sl_mult': 5.0, 'td_mins': 120}. Best is trial 290 with value: 2.1951474620740763.
[I 2026-03-12 02:03:21,843] Trial 325 finished with value: 2.0428449374313256 and parameters: {'timeframe': 'M15', 'atr_period': 13, 'atr_threshold': 3.0, 'pt_mult': 0.5, 'sl_mult': 5.0, 'td_mins': 360}. Best is trial 290 with value: 2.1951474620740763.
[I 2026-03-12 02:03:21,968] Trial 326 finished with value: 2.1951474620740763 and parameters: {'timeframe': 'M15', 'atr_period': 13, 'atr_threshold': 5.0, 'pt_mult': 1.0, 'sl_mult': 5.0, 'td_mins': 120}. Best is trial 290 with value: 2.1951474620740763.
[I 2026-03-12 02:03:22,092] Trial 327 finished with value: 2.1951474620740763 and parameters: {'timeframe': 'M15', 'atr_period': 13, 'atr_threshold': 5.0, 'pt_mult': 1.0, 'sl_mult': 5.0, 'td_mins': 120}. Best is trial 290 with value: 2.1951474620740763.
[I 2026-03-12 02:03:22,219] Trial 328 finished with value: 1.0472806093705356 and parameters: {'timeframe': 'M15', 'atr_period': 13, 'atr_threshold': 3.0, 'pt_mult': 0.5, 'sl_mult': 5.0, 'td_mins': 15}. Best is trial 290 with value: 2.1951474620740763.
[I 2026-03-12 02:03:22,340] Trial 329 finished with value: 2.1951474620740763 and parameters: {'timeframe': 'M15', 'atr_period': 13, 'atr_threshold': 5.0, 'pt_mult': 1.0, 'sl_mult': 5.0, 'td_mins': 120}. Best is trial 290 with value: 2.1951474620740763.
[I 2026-03-12 02:03:22,467] Trial 330 finished with value: 2.1951474620740763 and parameters: {'timeframe': 'M15', 'atr_period': 13, 'atr_threshold': 5.0, 'pt_mult': 1.0, 'sl_mult': 5.0, 'td_mins': 120}. Best is trial 290 with value: 2.1951474620740763.
[I 2026-03-12 02:03:22,588] Trial 331 finished with value: 2.1951474620740763 and parameters: {'timeframe': 'M15', 'atr_period': 13, 'atr_threshold': 5.0, 'pt_mult': 1.0, 'sl_mult': 5.0, 'td_mins': 120}. Best is trial 290 with value: 2.1951474620740763.
[I 2026-03-12 02:03:22,711] Trial 332 finished with value: 2.1951474620740763 and parameters: {'timeframe': 'M15', 'atr_period': 13, 'atr_threshold': 5.0, 'pt_mult': 1.0, 'sl_mult': 5.0, 'td_mins': 120}. Best is trial 290 with value: 2.1951474620740763.
[I 2026-03-12 02:03:22,840] Trial 333 finished with value: 2.1951474620740763 and parameters: {'timeframe': 'M15', 'atr_period': 13, 'atr_threshold': 5.0, 'pt_mult': 1.0, 'sl_mult': 5.0, 'td_mins': 120}. Best is trial 290 with value: 2.1951474620740763.
[I 2026-03-12 02:03:22,962] Trial 334 finished with value: 2.1951474620740763 and parameters: {'timeframe': 'M15', 'atr_period': 13, 'atr_threshold': 5.0, 'pt_mult': 1.0, 'sl_mult': 5.0, 'td_mins': 120}. Best is trial 290 with value: 2.1951474620740763.
[I 2026-03-12 02:03:23,097] Trial 335 finished with value: 2.1951474620740763 and parameters: {'timeframe': 'M15', 'atr_period': 13, 'atr_threshold': 5.0, 'pt_mult': 1.0, 'sl_mult': 5.0, 'td_mins': 120}. Best is trial 290 with value: 2.1951474620740763.
[I 2026-03-12 02:03:23,227] Trial 336 finished with value: 2.1951474620740763 and parameters: {'timeframe': 'M15', 'atr_period': 13, 'atr_threshold': 5.0, 'pt_mult': 1.0, 'sl_mult': 5.0, 'td_mins': 120}. Best is trial 290 with value: 2.1951474620740763.
[I 2026-03-12 02:03:23,352] Trial 337 finished with value: 2.1951474620740763 and parameters: {'timeframe': 'M15', 'atr_period': 13, 'atr_threshold': 5.0, 'pt_mult': 1.0, 'sl_mult': 5.0, 'td_mins': 120}. Best is trial 290 with value: 2.1951474620740763.
[I 2026-03-12 02:03:23,478] Trial 338 finished with value: 2.1951474620740763 and parameters: {'timeframe': 'M15', 'atr_period': 13, 'atr_threshold': 5.0, 'pt_mult': 1.0, 'sl_mult': 5.0, 'td_mins': 120}. Best is trial 290 with value: 2.1951474620740763.
[I 2026-03-12 02:03:23,607] Trial 339 finished with value: 2.1951474620740763 and parameters: {'timeframe': 'M15', 'atr_period': 13, 'atr_threshold': 5.0, 'pt_mult': 1.0, 'sl_mult': 5.0, 'td_mins': 120}. Best is trial 290 with value: 2.1951474620740763.
[I 2026-03-12 02:03:23,727] Trial 340 finished with value: 2.1951474620740763 and parameters: {'timeframe': 'M15', 'atr_period': 13, 'atr_threshold': 5.0, 'pt_mult': 1.0, 'sl_mult': 5.0, 'td_mins': 120}. Best is trial 290 with value: 2.1951474620740763.
[I 2026-03-12 02:03:23,858] Trial 341 finished with value: 2.1951474620740763 and parameters: {'timeframe': 'M15', 'atr_period': 13, 'atr_threshold': 5.0, 'pt_mult': 1.0, 'sl_mult': 5.0, 'td_mins': 120}. Best is trial 290 with value: 2.1951474620740763.
[I 2026-03-12 02:03:23,980] Trial 342 finished with value: 2.1951474620740763 and parameters: {'timeframe': 'M15', 'atr_period': 13, 'atr_threshold': 5.0, 'pt_mult': 1.0, 'sl_mult': 5.0, 'td_mins': 120}. Best is trial 290 with value: 2.1951474620740763.
[I 2026-03-12 02:03:24,103] Trial 343 finished with value: 2.1951474620740763 and parameters: {'timeframe': 'M15', 'atr_period': 13, 'atr_threshold': 5.0, 'pt_mult': 1.0, 'sl_mult': 5.0, 'td_mins': 120}. Best is trial 290 with value: 2.1951474620740763.
[I 2026-03-12 02:03:24,228] Trial 344 finished with value: 2.1951474620740763 and parameters: {'timeframe': 'M15', 'atr_period': 13, 'atr_threshold': 5.0, 'pt_mult': 1.0, 'sl_mult': 5.0, 'td_mins': 120}. Best is trial 290 with value: 2.1951474620740763.
[I 2026-03-12 02:03:24,353] Trial 345 finished with value: 2.1951474620740763 and parameters: {'timeframe': 'M15', 'atr_period': 13, 'atr_threshold': 5.0, 'pt_mult': 1.0, 'sl_mult': 5.0, 'td_mins': 120}. Best is trial 290 with value: 2.1951474620740763.
[I 2026-03-12 02:03:24,479] Trial 346 finished with value: 2.1951474620740763 and parameters: {'timeframe': 'M15', 'atr_period': 13, 'atr_threshold': 5.0, 'pt_mult': 1.0, 'sl_mult': 5.0, 'td_mins': 120}. Best is trial 290 with value: 2.1951474620740763.
[I 2026-03-12 02:03:24,614] Trial 347 finished with value: 2.1951474620740763 and parameters: {'timeframe': 'M15', 'atr_period': 13, 'atr_threshold': 5.0, 'pt_mult': 1.0, 'sl_mult': 5.0, 'td_mins': 120}. Best is trial 290 with value: 2.1951474620740763.
[I 2026-03-12 02:03:24,751] Trial 348 finished with value: 2.1951474620740763 and parameters: {'timeframe': 'M15', 'atr_period': 13, 'atr_threshold': 5.0, 'pt_mult': 1.0, 'sl_mult': 5.0, 'td_mins': 120}. Best is trial 290 with value: 2.1951474620740763.
[I 2026-03-12 02:03:24,892] Trial 349 finished with value: 2.1951474620740763 and parameters: {'timeframe': 'M15', 'atr_period': 13, 'atr_threshold': 5.0, 'pt_mult': 1.0, 'sl_mult': 5.0, 'td_mins': 120}. Best is trial 290 with value: 2.1951474620740763.
[I 2026-03-12 02:03:25,000] Trial 350 finished with value: 1.8354021917709218 and parameters: {'timeframe': 'M15', 'atr_period': 13, 'atr_threshold': 5.0, 'pt_mult': 1.0, 'sl_mult': 5.0, 'td_mins': 60}. Best is trial 290 with value: 2.1951474620740763.
[I 2026-03-12 02:03:25,142] Trial 351 finished with value: 1.0046644872140926 and parameters: {'timeframe': 'M15', 'atr_period': 13, 'atr_threshold': 5.0, 'pt_mult': 1.0, 'sl_mult': 2.5, 'td_mins': 120}. Best is trial 290 with value: 2.1951474620740763.
[I 2026-03-12 02:03:25,188] Trial 352 finished with value: 0.0 and parameters: {'timeframe': 'M15', 'atr_period': 13, 'atr_threshold': 10.0, 'pt_mult': 1.0, 'sl_mult': 5.0, 'td_mins': 120}. Best is trial 290 with value: 2.1951474620740763.
[I 2026-03-12 02:03:25,239] Trial 353 pruned. 
[I 2026-03-12 02:03:25,371] Trial 354 finished with value: 2.3262803933627714 and parameters: {'timeframe': 'M15', 'atr_period': 13, 'atr_threshold': 5.0, 'pt_mult': 0.5, 'sl_mult': 5.0, 'td_mins': 120}. Best is trial 354 with value: 2.3262803933627714.
[I 2026-03-12 02:03:25,421] Trial 355 pruned. 
[I 2026-03-12 02:03:25,542] Trial 356 finished with value: 2.3262803933627714 and parameters: {'timeframe': 'M15', 'atr_period': 13, 'atr_threshold': 5.0, 'pt_mult': 0.5, 'sl_mult': 5.0, 'td_mins': 120}. Best is trial 354 with value: 2.3262803933627714.
[I 2026-03-12 02:03:25,588] Trial 357 pruned. 
[I 2026-03-12 02:03:25,706] Trial 358 finished with value: 2.3262803933627714 and parameters: {'timeframe': 'M15', 'atr_period': 13, 'atr_threshold': 5.0, 'pt_mult': 0.5, 'sl_mult': 5.0, 'td_mins': 120}. Best is trial 354 with value: 2.3262803933627714.
[I 2026-03-12 02:03:25,838] Trial 359 finished with value: 0.9033170051889314 and parameters: {'timeframe': 'M15', 'atr_period': 13, 'atr_threshold': 5.0, 'pt_mult': 5.0, 'sl_mult': 5.0, 'td_mins': 120}. Best is trial 354 with value: 2.3262803933627714.
[I 2026-03-12 02:03:25,960] Trial 360 finished with value: 2.3262803933627714 and parameters: {'timeframe': 'M15', 'atr_period': 13, 'atr_threshold': 5.0, 'pt_mult': 0.5, 'sl_mult': 5.0, 'td_mins': 120}. Best is trial 354 with value: 2.3262803933627714.
[I 2026-03-12 02:03:26,088] Trial 361 finished with value: 2.3262803933627714 and parameters: {'timeframe': 'M15', 'atr_period': 13, 'atr_threshold': 5.0, 'pt_mult': 0.5, 'sl_mult': 5.0, 'td_mins': 120}. Best is trial 354 with value: 2.3262803933627714.
[I 2026-03-12 02:03:26,213] Trial 362 finished with value: 2.3262803933627714 and parameters: {'timeframe': 'M15', 'atr_period': 13, 'atr_threshold': 5.0, 'pt_mult': 0.5, 'sl_mult': 5.0, 'td_mins': 120}. Best is trial 354 with value: 2.3262803933627714.
[I 2026-03-12 02:03:26,334] Trial 363 finished with value: 2.3262803933627714 and parameters: {'timeframe': 'M15', 'atr_period': 13, 'atr_threshold': 5.0, 'pt_mult': 0.5, 'sl_mult': 5.0, 'td_mins': 120}. Best is trial 354 with value: 2.3262803933627714.
[I 2026-03-12 02:03:26,463] Trial 364 finished with value: 2.3262803933627714 and parameters: {'timeframe': 'M15', 'atr_period': 13, 'atr_threshold': 5.0, 'pt_mult': 0.5, 'sl_mult': 5.0, 'td_mins': 120}. Best is trial 354 with value: 2.3262803933627714.
[I 2026-03-12 02:03:26,587] Trial 365 finished with value: 2.3262803933627714 and parameters: {'timeframe': 'M15', 'atr_period': 13, 'atr_threshold': 5.0, 'pt_mult': 0.5, 'sl_mult': 5.0, 'td_mins': 120}. Best is trial 354 with value: 2.3262803933627714.
[I 2026-03-12 02:03:26,711] Trial 366 finished with value: 2.3262803933627714 and parameters: {'timeframe': 'M15', 'atr_period': 13, 'atr_threshold': 5.0, 'pt_mult': 0.5, 'sl_mult': 5.0, 'td_mins': 120}. Best is trial 354 with value: 2.3262803933627714.
[I 2026-03-12 02:03:26,834] Trial 367 finished with value: 2.3262803933627714 and parameters: {'timeframe': 'M15', 'atr_period': 13, 'atr_threshold': 5.0, 'pt_mult': 0.5, 'sl_mult': 5.0, 'td_mins': 120}. Best is trial 354 with value: 2.3262803933627714.
[I 2026-03-12 02:03:26,953] Trial 368 finished with value: 2.3262803933627714 and parameters: {'timeframe': 'M15', 'atr_period': 13, 'atr_threshold': 5.0, 'pt_mult': 0.5, 'sl_mult': 5.0, 'td_mins': 120}. Best is trial 354 with value: 2.3262803933627714.
[I 2026-03-12 02:03:27,073] Trial 369 finished with value: 2.3262803933627714 and parameters: {'timeframe': 'M15', 'atr_period': 13, 'atr_threshold': 5.0, 'pt_mult': 0.5, 'sl_mult': 5.0, 'td_mins': 120}. Best is trial 354 with value: 2.3262803933627714.
[I 2026-03-12 02:03:27,195] Trial 370 finished with value: 2.3262803933627714 and parameters: {'timeframe': 'M15', 'atr_period': 13, 'atr_threshold': 5.0, 'pt_mult': 0.5, 'sl_mult': 5.0, 'td_mins': 120}. Best is trial 354 with value: 2.3262803933627714.
[I 2026-03-12 02:03:27,330] Trial 371 finished with value: 2.3262803933627714 and parameters: {'timeframe': 'M15', 'atr_period': 13, 'atr_threshold': 5.0, 'pt_mult': 0.5, 'sl_mult': 5.0, 'td_mins': 120}. Best is trial 354 with value: 2.3262803933627714.
[I 2026-03-12 02:03:27,459] Trial 372 finished with value: 2.3262803933627714 and parameters: {'timeframe': 'M15', 'atr_period': 13, 'atr_threshold': 5.0, 'pt_mult': 0.5, 'sl_mult': 5.0, 'td_mins': 120}. Best is trial 354 with value: 2.3262803933627714.
[I 2026-03-12 02:03:27,580] Trial 373 finished with value: 2.3262803933627714 and parameters: {'timeframe': 'M15', 'atr_period': 13, 'atr_threshold': 5.0, 'pt_mult': 0.5, 'sl_mult': 5.0, 'td_mins': 120}. Best is trial 354 with value: 2.3262803933627714.
[I 2026-03-12 02:03:27,702] Trial 374 finished with value: 2.3262803933627714 and parameters: {'timeframe': 'M15', 'atr_period': 13, 'atr_threshold': 5.0, 'pt_mult': 0.5, 'sl_mult': 5.0, 'td_mins': 120}. Best is trial 354 with value: 2.3262803933627714.
[I 2026-03-12 02:03:27,824] Trial 375 finished with value: 2.3262803933627714 and parameters: {'timeframe': 'M15', 'atr_period': 13, 'atr_threshold': 5.0, 'pt_mult': 0.5, 'sl_mult': 5.0, 'td_mins': 120}. Best is trial 354 with value: 2.3262803933627714.
[I 2026-03-12 02:03:27,943] Trial 376 finished with value: 2.3262803933627714 and parameters: {'timeframe': 'M15', 'atr_period': 13, 'atr_threshold': 5.0, 'pt_mult': 0.5, 'sl_mult': 5.0, 'td_mins': 120}. Best is trial 354 with value: 2.3262803933627714.
[I 2026-03-12 02:03:28,069] Trial 377 finished with value: 2.3262803933627714 and parameters: {'timeframe': 'M15', 'atr_period': 13, 'atr_threshold': 5.0, 'pt_mult': 0.5, 'sl_mult': 5.0, 'td_mins': 120}. Best is trial 354 with value: 2.3262803933627714.
[I 2026-03-12 02:03:28,192] Trial 378 finished with value: 2.3262803933627714 and parameters: {'timeframe': 'M15', 'atr_period': 13, 'atr_threshold': 5.0, 'pt_mult': 0.5, 'sl_mult': 5.0, 'td_mins': 120}. Best is trial 354 with value: 2.3262803933627714.
[I 2026-03-12 02:03:28,311] Trial 379 finished with value: 2.3262803933627714 and parameters: {'timeframe': 'M15', 'atr_period': 13, 'atr_threshold': 5.0, 'pt_mult': 0.5, 'sl_mult': 5.0, 'td_mins': 120}. Best is trial 354 with value: 2.3262803933627714.
[I 2026-03-12 02:03:28,437] Trial 380 finished with value: 2.3262803933627714 and parameters: {'timeframe': 'M15', 'atr_period': 13, 'atr_threshold': 5.0, 'pt_mult': 0.5, 'sl_mult': 5.0, 'td_mins': 120}. Best is trial 354 with value: 2.3262803933627714.
[I 2026-03-12 02:03:28,569] Trial 381 finished with value: 2.3262803933627714 and parameters: {'timeframe': 'M15', 'atr_period': 13, 'atr_threshold': 5.0, 'pt_mult': 0.5, 'sl_mult': 5.0, 'td_mins': 120}. Best is trial 354 with value: 2.3262803933627714.
[I 2026-03-12 02:03:28,687] Trial 382 finished with value: 2.3262803933627714 and parameters: {'timeframe': 'M15', 'atr_period': 13, 'atr_threshold': 5.0, 'pt_mult': 0.5, 'sl_mult': 5.0, 'td_mins': 120}. Best is trial 354 with value: 2.3262803933627714.
[I 2026-03-12 02:03:29,142] Trial 383 finished with value: 1.1129016683831863 and parameters: {'timeframe': 'M15', 'atr_period': 13, 'atr_threshold': 5.0, 'pt_mult': 0.5, 'sl_mult': 5.0, 'td_mins': 720}. Best is trial 354 with value: 2.3262803933627714.
[I 2026-03-12 02:03:29,676] Trial 384 finished with value: 2.1722401515386682 and parameters: {'timeframe': 'M15', 'atr_period': 13, 'atr_threshold': 0.5, 'pt_mult': 0.5, 'sl_mult': 5.0, 'td_mins': 120}. Best is trial 354 with value: 2.3262803933627714.
[I 2026-03-12 02:03:29,767] Trial 385 finished with value: 1.9296701851147837 and parameters: {'timeframe': 'M15', 'atr_period': 13, 'atr_threshold': 5.0, 'pt_mult': 0.5, 'sl_mult': 5.0, 'td_mins': 30}. Best is trial 354 with value: 2.3262803933627714.
[I 2026-03-12 02:03:29,826] Trial 386 pruned. 
[I 2026-03-12 02:03:29,883] Trial 387 pruned. 
[I 2026-03-12 02:03:30,015] Trial 388 finished with value: 1.050259621606156 and parameters: {'timeframe': 'M15', 'atr_period': 13, 'atr_threshold': 5.0, 'pt_mult': 0.5, 'sl_mult': 2.5, 'td_mins': 120}. Best is trial 354 with value: 2.3262803933627714.
[I 2026-03-12 02:03:30,065] Trial 389 finished with value: 0.0 and parameters: {'timeframe': 'M15', 'atr_period': 13, 'atr_threshold': 15.0, 'pt_mult': 0.5, 'sl_mult': 5.0, 'td_mins': 120}. Best is trial 354 with value: 2.3262803933627714.
[I 2026-03-12 02:03:30,141] Trial 390 finished with value: 1.1930413280080239 and parameters: {'timeframe': 'M15', 'atr_period': 13, 'atr_threshold': 5.0, 'pt_mult': 0.5, 'sl_mult': 5.0, 'td_mins': 15}. Best is trial 354 with value: 2.3262803933627714.
[I 2026-03-12 02:03:30,188] Trial 391 pruned. 
[I 2026-03-12 02:03:30,893] Trial 392 finished with value: 0.9935237481900074 and parameters: {'timeframe': 'M15', 'atr_period': 13, 'atr_threshold': 5.0, 'pt_mult': 0.5, 'sl_mult': 5.0, 'td_mins': 1200}. Best is trial 354 with value: 2.3262803933627714.
[I 2026-03-12 02:03:31,169] Trial 393 finished with value: 2.627710256873383 and parameters: {'timeframe': 'M15', 'atr_period': 13, 'atr_threshold': 3.0, 'pt_mult': 0.5, 'sl_mult': 5.0, 'td_mins': 120}. Best is trial 393 with value: 2.627710256873383.
[I 2026-03-12 02:03:31,222] Trial 394 finished with value: 0.0 and parameters: {'timeframe': 'M15', 'atr_period': 13, 'atr_threshold': 10.0, 'pt_mult': 0.5, 'sl_mult': 5.0, 'td_mins': 120}. Best is trial 393 with value: 2.627710256873383.
[I 2026-03-12 02:03:31,500] Trial 395 finished with value: 2.627710256873383 and parameters: {'timeframe': 'M15', 'atr_period': 13, 'atr_threshold': 3.0, 'pt_mult': 0.5, 'sl_mult': 5.0, 'td_mins': 120}. Best is trial 393 with value: 2.627710256873383.
[I 2026-03-12 02:03:31,778] Trial 396 finished with value: 2.627710256873383 and parameters: {'timeframe': 'M15', 'atr_period': 13, 'atr_threshold': 3.0, 'pt_mult': 0.5, 'sl_mult': 5.0, 'td_mins': 120}. Best is trial 393 with value: 2.627710256873383.
