[I 2026-03-12 01:54:10,615] Trial 155 pruned. 
[I 2026-03-12 01:54:10,700] Trial 156 pruned. 
[I 2026-03-12 01:54:10,748] Trial 157 finished with value: 0.0 and parameters: {'timeframe': 'M8', 'atr_period': 13, 'atr_threshold': 8.0, 'pt_mult': 0.5, 'sl_mult': 5.0, 'td_mins': 180}. Best is trial 132 with value: 2.8319342647562786.
[I 2026-03-12 01:54:10,965] Trial 158 pruned. 
[I 2026-03-12 01:54:11,022] Trial 159 pruned. 
[I 2026-03-12 01:54:11,133] Trial 160 pruned. 
[I 2026-03-12 01:54:11,180] Trial 161 finished with value: 0.0 and parameters: {'timeframe': 'M8', 'atr_period': 13, 'atr_threshold': 8.0, 'pt_mult': 1.0, 'sl_mult': 0.5, 'td_mins': 15}. Best is trial 132 with value: 2.8319342647562786.
[I 2026-03-12 01:54:11,239] Trial 162 pruned. 
[I 2026-03-12 01:54:11,289] Trial 163 finished with value: 0.0 and parameters: {'timeframe': 'M8', 'atr_period': 13, 'atr_threshold': 15.0, 'pt_mult': 2.5, 'sl_mult': 2.5, 'td_mins': 360}. Best is trial 132 with value: 2.8319342647562786.
[I 2026-03-12 01:54:14,774] Trial 164 finished with value: 0.9517396696694196 and parameters: {'timeframe': 'M8', 'atr_period': 13, 'atr_threshold': 2.0, 'pt_mult': 2.5, 'sl_mult': 2.5, 'td_mins': 1080}. Best is trial 132 with value: 2.8319342647562786.
[I 2026-03-12 01:54:15,360] Trial 165 pruned. 
[I 2026-03-12 01:54:15,469] Trial 166 pruned. 
[I 2026-03-12 01:54:15,667] Trial 167 finished with value: 1.4967331369168109 and parameters: {'timeframe': 'M8', 'atr_period': 13, 'atr_threshold': 5.0, 'pt_mult': 0.5, 'sl_mult': 5.0, 'td_mins': 360}. Best is trial 132 with value: 2.8319342647562786.
[I 2026-03-12 01:54:15,715] Trial 168 finished with value: 0.0 and parameters: {'timeframe': 'M8', 'atr_period': 13, 'atr_threshold': 10.0, 'pt_mult': 2.5, 'sl_mult': 0.5, 'td_mins': 720}. Best is trial 132 with value: 2.8319342647562786.
[I 2026-03-12 01:54:15,776] Trial 169 pruned. 
[I 2026-03-12 01:54:17,112] Trial 170 finished with value: 0.9016535124234215 and parameters: {'timeframe': 'M8', 'atr_period': 13, 'atr_threshold': 3.0, 'pt_mult': 1.0, 'sl_mult': 2.5, 'td_mins': 1200}. Best is trial 132 with value: 2.8319342647562786.
[I 2026-03-12 01:54:17,186] Trial 171 pruned. 
[I 2026-03-12 01:54:17,357] Trial 172 pruned. 
[I 2026-03-12 01:54:18,485] Trial 173 finished with value: 1.3992711857010782 and parameters: {'timeframe': 'M8', 'atr_period': 13, 'atr_threshold': 1.0, 'pt_mult': 1.0, 'sl_mult': 5.0, 'td_mins': 180}. Best is trial 132 with value: 2.8319342647562786.
[I 2026-03-12 01:54:19,657] Trial 174 finished with value: 0.9956088506440122 and parameters: {'timeframe': 'M8', 'atr_period': 13, 'atr_threshold': 3.0, 'pt_mult': 2.5, 'sl_mult': 2.5, 'td_mins': 720}. Best is trial 132 with value: 2.8319342647562786.
[I 2026-03-12 01:54:19,701] Trial 175 finished with value: 0.0 and parameters: {'timeframe': 'M8', 'atr_period': 13, 'atr_threshold': 8.0, 'pt_mult': 5.0, 'sl_mult': 5.0, 'td_mins': 60}. Best is trial 132 with value: 2.8319342647562786.
[I 2026-03-12 01:54:19,796] Trial 176 pruned. 
[I 2026-03-12 01:54:19,839] Trial 177 finished with value: 0.0 and parameters: {'timeframe': 'M8', 'atr_period': 13, 'atr_threshold': 8.0, 'pt_mult': 1.0, 'sl_mult': 2.5, 'td_mins': 180}. Best is trial 132 with value: 2.8319342647562786.
[I 2026-03-12 01:54:19,935] Trial 178 pruned. 
[I 2026-03-12 01:54:20,460] Trial 179 pruned. 
[I 2026-03-12 01:54:20,605] Trial 180 pruned. 
[I 2026-03-12 01:54:20,653] Trial 181 finished with value: 0.0 and parameters: {'timeframe': 'M8', 'atr_period': 13, 'atr_threshold': 10.0, 'pt_mult': 2.5, 'sl_mult': 5.0, 'td_mins': 5}. Best is trial 132 with value: 2.8319342647562786.
[I 2026-03-12 01:54:20,720] Trial 182 pruned. 
[I 2026-03-12 01:54:21,156] Trial 183 finished with value: 1.3055235395145481 and parameters: {'timeframe': 'M8', 'atr_period': 13, 'atr_threshold': 5.0, 'pt_mult': 0.5, 'sl_mult': 5.0, 'td_mins': 1080}. Best is trial 132 with value: 2.8319342647562786.
[I 2026-03-12 01:54:21,216] Trial 184 pruned. 
[I 2026-03-12 01:54:21,261] Trial 185 finished with value: 0.0 and parameters: {'timeframe': 'M8', 'atr_period': 13, 'atr_threshold': 10.0, 'pt_mult': 1.0, 'sl_mult': 5.0, 'td_mins': 15}. Best is trial 132 with value: 2.8319342647562786.
[I 2026-03-12 01:54:21,628] Trial 186 finished with value: 1.833199362657993 and parameters: {'timeframe': 'M8', 'atr_period': 13, 'atr_threshold': 5.0, 'pt_mult': 1.0, 'sl_mult': 5.0, 'td_mins': 720}. Best is trial 132 with value: 2.8319342647562786.
[I 2026-03-12 01:54:21,674] Trial 187 finished with value: 0.0 and parameters: {'timeframe': 'M8', 'atr_period': 13, 'atr_threshold': 8.0, 'pt_mult': 0.5, 'sl_mult': 5.0, 'td_mins': 720}. Best is trial 132 with value: 2.8319342647562786.
[I 2026-03-12 01:54:21,718] Trial 188 finished with value: 0.0 and parameters: {'timeframe': 'M8', 'atr_period': 13, 'atr_threshold': 15.0, 'pt_mult': 1.0, 'sl_mult': 0.5, 'td_mins': 5}. Best is trial 132 with value: 2.8319342647562786.
[I 2026-03-12 01:54:21,834] Trial 189 finished with value: 1.3520063852315152 and parameters: {'timeframe': 'M8', 'atr_period': 13, 'atr_threshold': 5.0, 'pt_mult': 5.0, 'sl_mult': 5.0, 'td_mins': 120}. Best is trial 132 with value: 2.8319342647562786.
[I 2026-03-12 01:54:21,934] Trial 190 pruned. 
[I 2026-03-12 01:54:29,018] Trial 191 finished with value: 0.9849558563593623 and parameters: {'timeframe': 'M8', 'atr_period': 13, 'atr_threshold': 0.5, 'pt_mult': 2.5, 'sl_mult': 5.0, 'td_mins': 1080}. Best is trial 132 with value: 2.8319342647562786.
[I 2026-03-12 01:54:29,063] Trial 192 finished with value: 0.0 and parameters: {'timeframe': 'M8', 'atr_period': 13, 'atr_threshold': 15.0, 'pt_mult': 0.5, 'sl_mult': 5.0, 'td_mins': 1080}. Best is trial 132 with value: 2.8319342647562786.
[I 2026-03-12 01:54:29,391] Trial 193 pruned. 
[I 2026-03-12 01:54:29,518] Trial 194 finished with value: 2.85002292450261 and parameters: {'timeframe': 'M8', 'atr_period': 13, 'atr_threshold': 5.0, 'pt_mult': 0.5, 'sl_mult': 5.0, 'td_mins': 180}. Best is trial 194 with value: 2.85002292450261.
[I 2026-03-12 01:54:30,509] Trial 195 finished with value: 1.0528366746199842 and parameters: {'timeframe': 'M8', 'atr_period': 13, 'atr_threshold': 1.0, 'pt_mult': 0.5, 'sl_mult': 2.5, 'td_mins': 180}. Best is trial 194 with value: 2.85002292450261.
[I 2026-03-12 01:54:30,628] Trial 196 pruned. 
[I 2026-03-12 01:54:30,674] Trial 197 finished with value: 0.0 and parameters: {'timeframe': 'M8', 'atr_period': 13, 'atr_threshold': 8.0, 'pt_mult': 5.0, 'sl_mult': 0.5, 'td_mins': 1200}. Best is trial 194 with value: 2.85002292450261.
[I 2026-03-12 01:54:30,718] Trial 198 finished with value: 0.0 and parameters: {'timeframe': 'M8', 'atr_period': 13, 'atr_threshold': 10.0, 'pt_mult': 0.5, 'sl_mult': 0.5, 'td_mins': 360}. Best is trial 194 with value: 2.85002292450261.
[I 2026-03-12 01:54:30,759] Trial 199 finished with value: 0.0 and parameters: {'timeframe': 'M8', 'atr_period': 13, 'atr_threshold': 15.0, 'pt_mult': 5.0, 'sl_mult': 5.0, 'td_mins': 30}. Best is trial 194 with value: 2.85002292450261.
[I 2026-03-12 01:54:30,802] Trial 200 finished with value: 0.0 and parameters: {'timeframe': 'M8', 'atr_period': 13, 'atr_threshold': 15.0, 'pt_mult': 5.0, 'sl_mult': 1.0, 'td_mins': 1080}. Best is trial 194 with value: 2.85002292450261.
[I 2026-03-12 01:54:30,844] Trial 201 finished with value: 0.0 and parameters: {'timeframe': 'M8', 'atr_period': 13, 'atr_threshold': 15.0, 'pt_mult': 0.5, 'sl_mult': 2.5, 'td_mins': 180}. Best is trial 194 with value: 2.85002292450261.
[I 2026-03-12 01:54:30,887] Trial 202 finished with value: 0.0 and parameters: {'timeframe': 'M8', 'atr_period': 13, 'atr_threshold': 15.0, 'pt_mult': 0.5, 'sl_mult': 1.0, 'td_mins': 1080}. Best is trial 194 with value: 2.85002292450261.
[I 2026-03-12 01:54:30,936] Trial 203 pruned. 
[I 2026-03-12 01:54:31,862] Trial 204 finished with value: 1.0528366746199842 and parameters: {'timeframe': 'M8', 'atr_period': 13, 'atr_threshold': 1.0, 'pt_mult': 0.5, 'sl_mult': 2.5, 'td_mins': 180}. Best is trial 194 with value: 2.85002292450261.
[I 2026-03-12 01:54:31,908] Trial 205 finished with value: 0.0 and parameters: {'timeframe': 'M8', 'atr_period': 13, 'atr_threshold': 10.0, 'pt_mult': 0.5, 'sl_mult': 0.5, 'td_mins': 60}. Best is trial 194 with value: 2.85002292450261.
[I 2026-03-12 01:54:31,956] Trial 206 finished with value: 0.0 and parameters: {'timeframe': 'M8', 'atr_period': 13, 'atr_threshold': 10.0, 'pt_mult': 5.0, 'sl_mult': 1.0, 'td_mins': 15}. Best is trial 194 with value: 2.85002292450261.
[I 2026-03-12 01:54:32,037] Trial 207 finished with value: 2.9979644789811193 and parameters: {'timeframe': 'M8', 'atr_period': 13, 'atr_threshold': 5.0, 'pt_mult': 0.5, 'sl_mult': 5.0, 'td_mins': 60}. Best is trial 207 with value: 2.9979644789811193.
[I 2026-03-12 01:54:32,081] Trial 208 finished with value: 0.0 and parameters: {'timeframe': 'M8', 'atr_period': 13, 'atr_threshold': 10.0, 'pt_mult': 2.5, 'sl_mult': 1.0, 'td_mins': 1200}. Best is trial 207 with value: 2.9979644789811193.
[I 2026-03-12 01:54:32,202] Trial 209 pruned. 
[I 2026-03-12 01:54:35,218] Trial 210 finished with value: 0.9537591441784109 and parameters: {'timeframe': 'M8', 'atr_period': 13, 'atr_threshold': 1.0, 'pt_mult': 0.5, 'sl_mult': 2.5, 'td_mins': 1080}. Best is trial 207 with value: 2.9979644789811193.
[I 2026-03-12 01:54:35,273] Trial 211 pruned. 
[I 2026-03-12 01:54:35,978] Trial 212 finished with value: 1.3344680243033293 and parameters: {'timeframe': 'M8', 'atr_period': 13, 'atr_threshold': 5.0, 'pt_mult': 5.0, 'sl_mult': 5.0, 'td_mins': 1200}. Best is trial 207 with value: 2.9979644789811193.
[I 2026-03-12 01:54:36,024] Trial 213 finished with value: 0.0 and parameters: {'timeframe': 'M8', 'atr_period': 13, 'atr_threshold': 10.0, 'pt_mult': 5.0, 'sl_mult': 0.5, 'td_mins': 5}. Best is trial 207 with value: 2.9979644789811193.
[I 2026-03-12 01:54:36,071] Trial 214 finished with value: 0.0 and parameters: {'timeframe': 'M8', 'atr_period': 13, 'atr_threshold': 15.0, 'pt_mult': 1.0, 'sl_mult': 1.0, 'td_mins': 30}. Best is trial 207 with value: 2.9979644789811193.
[I 2026-03-12 01:54:36,696] Trial 215 pruned. 
[I 2026-03-12 01:54:36,803] Trial 216 pruned. 
[I 2026-03-12 01:54:36,933] Trial 217 pruned. 
[I 2026-03-12 01:54:36,982] Trial 218 finished with value: 0.0 and parameters: {'timeframe': 'M8', 'atr_period': 13, 'atr_threshold': 8.0, 'pt_mult': 0.5, 'sl_mult': 0.5, 'td_mins': 120}. Best is trial 207 with value: 2.9979644789811193.
[I 2026-03-12 01:54:37,024] Trial 219 finished with value: 0.0 and parameters: {'timeframe': 'M8', 'atr_period': 13, 'atr_threshold': 10.0, 'pt_mult': 0.5, 'sl_mult': 0.5, 'td_mins': 1200}. Best is trial 207 with value: 2.9979644789811193.
[I 2026-03-12 01:54:37,067] Trial 220 finished with value: 0.0 and parameters: {'timeframe': 'M8', 'atr_period': 13, 'atr_threshold': 15.0, 'pt_mult': 5.0, 'sl_mult': 5.0, 'td_mins': 1200}. Best is trial 207 with value: 2.9979644789811193.
[I 2026-03-12 01:54:37,111] Trial 221 finished with value: 0.0 and parameters: {'timeframe': 'M8', 'atr_period': 13, 'atr_threshold': 15.0, 'pt_mult': 5.0, 'sl_mult': 5.0, 'td_mins': 30}. Best is trial 207 with value: 2.9979644789811193.
[I 2026-03-12 01:54:37,694] Trial 222 finished with value: 1.1283355299584064 and parameters: {'timeframe': 'M8', 'atr_period': 13, 'atr_threshold': 2.0, 'pt_mult': 0.5, 'sl_mult': 2.5, 'td_mins': 180}. Best is trial 207 with value: 2.9979644789811193.
[I 2026-03-12 01:54:37,928] Trial 223 pruned. 
[I 2026-03-12 01:54:38,453] Trial 224 finished with value: 1.79014172415797 and parameters: {'timeframe': 'M8', 'atr_period': 13, 'atr_threshold': 2.0, 'pt_mult': 1.0, 'sl_mult': 5.0, 'td_mins': 120}. Best is trial 207 with value: 2.9979644789811193.
[I 2026-03-12 01:54:38,503] Trial 225 finished with value: 0.0 and parameters: {'timeframe': 'M8', 'atr_period': 13, 'atr_threshold': 15.0, 'pt_mult': 2.5, 'sl_mult': 5.0, 'td_mins': 1200}. Best is trial 207 with value: 2.9979644789811193.
[I 2026-03-12 01:54:38,608] Trial 226 pruned. 
[I 2026-03-12 01:54:38,656] Trial 227 pruned. 
[I 2026-03-12 01:54:38,702] Trial 228 finished with value: 0.0 and parameters: {'timeframe': 'M8', 'atr_period': 13, 'atr_threshold': 15.0, 'pt_mult': 1.0, 'sl_mult': 2.5, 'td_mins': 60}. Best is trial 207 with value: 2.9979644789811193.
[I 2026-03-12 01:54:38,868] Trial 229 finished with value: 1.5633084437276523 and parameters: {'timeframe': 'M8', 'atr_period': 13, 'atr_threshold': 3.0, 'pt_mult': 0.5, 'sl_mult': 2.5, 'td_mins': 60}. Best is trial 207 with value: 2.9979644789811193.
[I 2026-03-12 01:54:38,913] Trial 230 finished with value: 0.0 and parameters: {'timeframe': 'M8', 'atr_period': 13, 'atr_threshold': 10.0, 'pt_mult': 0.5, 'sl_mult': 1.0, 'td_mins': 1200}. Best is trial 207 with value: 2.9979644789811193.
[I 2026-03-12 01:54:39,674] Trial 231 finished with value: 1.102878765761467 and parameters: {'timeframe': 'M8', 'atr_period': 13, 'atr_threshold': 3.0, 'pt_mult': 5.0, 'sl_mult': 5.0, 'td_mins': 360}. Best is trial 207 with value: 2.9979644789811193.
[I 2026-03-12 01:54:39,724] Trial 232 finished with value: 0.0 and parameters: {'timeframe': 'M8', 'atr_period': 13, 'atr_threshold': 15.0, 'pt_mult': 0.5, 'sl_mult': 5.0, 'td_mins': 360}. Best is trial 207 with value: 2.9979644789811193.
[I 2026-03-12 01:54:39,775] Trial 233 finished with value: 0.0 and parameters: {'timeframe': 'M8', 'atr_period': 13, 'atr_threshold': 8.0, 'pt_mult': 0.5, 'sl_mult': 0.5, 'td_mins': 360}. Best is trial 207 with value: 2.9979644789811193.
[I 2026-03-12 01:54:39,818] Trial 234 finished with value: 0.0 and parameters: {'timeframe': 'M8', 'atr_period': 13, 'atr_threshold': 10.0, 'pt_mult': 2.5, 'sl_mult': 1.0, 'td_mins': 120}. Best is trial 207 with value: 2.9979644789811193.
[I 2026-03-12 01:54:39,910] Trial 235 pruned. 
[I 2026-03-12 01:54:39,957] Trial 236 finished with value: 0.0 and parameters: {'timeframe': 'M8', 'atr_period': 13, 'atr_threshold': 15.0, 'pt_mult': 0.5, 'sl_mult': 0.5, 'td_mins': 15}. Best is trial 207 with value: 2.9979644789811193.
[I 2026-03-12 01:54:40,182] Trial 237 finished with value: 1.4021648526953971 and parameters: {'timeframe': 'M8', 'atr_period': 13, 'atr_threshold': 2.0, 'pt_mult': 1.0, 'sl_mult': 5.0, 'td_mins': 30}. Best is trial 207 with value: 2.9979644789811193.
[I 2026-03-12 01:54:40,232] Trial 238 finished with value: 0.0 and parameters: {'timeframe': 'M8', 'atr_period': 13, 'atr_threshold': 10.0, 'pt_mult': 5.0, 'sl_mult': 2.5, 'td_mins': 60}. Best is trial 207 with value: 2.9979644789811193.
[I 2026-03-12 01:54:40,286] Trial 239 finished with value: 0.0 and parameters: {'timeframe': 'M8', 'atr_period': 13, 'atr_threshold': 10.0, 'pt_mult': 2.5, 'sl_mult': 5.0, 'td_mins': 720}. Best is trial 207 with value: 2.9979644789811193.
[I 2026-03-12 01:54:42,142] Trial 240 finished with value: 1.0584888243623154 and parameters: {'timeframe': 'M8', 'atr_period': 13, 'atr_threshold': 3.0, 'pt_mult': 2.5, 'sl_mult': 2.5, 'td_mins': 1200}. Best is trial 207 with value: 2.9979644789811193.
[I 2026-03-12 01:54:42,184] Trial 241 finished with value: 0.0 and parameters: {'timeframe': 'M8', 'atr_period': 13, 'atr_threshold': 10.0, 'pt_mult': 1.0, 'sl_mult': 0.5, 'td_mins': 5}. Best is trial 207 with value: 2.9979644789811193.
[I 2026-03-12 01:54:42,231] Trial 242 finished with value: 0.0 and parameters: {'timeframe': 'M8', 'atr_period': 13, 'atr_threshold': 10.0, 'pt_mult': 0.5, 'sl_mult': 0.5, 'td_mins': 5}. Best is trial 207 with value: 2.9979644789811193.
[I 2026-03-12 01:54:43,394] Trial 243 finished with value: 1.4099479242204933 and parameters: {'timeframe': 'M8', 'atr_period': 13, 'atr_threshold': 0.5, 'pt_mult': 0.5, 'sl_mult': 5.0, 'td_mins': 180}. Best is trial 207 with value: 2.9979644789811193.
[I 2026-03-12 01:54:43,657] Trial 244 pruned. 
[I 2026-03-12 01:54:43,709] Trial 245 finished with value: 0.0 and parameters: {'timeframe': 'M8', 'atr_period': 13, 'atr_threshold': 15.0, 'pt_mult': 1.0, 'sl_mult': 5.0, 'td_mins': 120}. Best is trial 207 with value: 2.9979644789811193.
[I 2026-03-12 01:54:43,764] Trial 246 finished with value: 0.0 and parameters: {'timeframe': 'M8', 'atr_period': 13, 'atr_threshold': 15.0, 'pt_mult': 5.0, 'sl_mult': 1.0, 'td_mins': 180}. Best is trial 207 with value: 2.9979644789811193.
[I 2026-03-12 01:54:43,849] Trial 247 pruned. 
[I 2026-03-12 01:54:45,776] Trial 248 finished with value: 0.9658548158287685 and parameters: {'timeframe': 'M8', 'atr_period': 13, 'atr_threshold': 2.0, 'pt_mult': 1.0, 'sl_mult': 2.5, 'td_mins': 720}. Best is trial 207 with value: 2.9979644789811193.
[I 2026-03-12 01:54:50,229] Trial 249 pruned. 
[I 2026-03-12 01:54:50,279] Trial 250 finished with value: 0.0 and parameters: {'timeframe': 'M8', 'atr_period': 13, 'atr_threshold': 10.0, 'pt_mult': 1.0, 'sl_mult': 2.5, 'td_mins': 720}. Best is trial 207 with value: 2.9979644789811193.
[I 2026-03-12 01:54:50,329] Trial 251 finished with value: 0.0 and parameters: {'timeframe': 'M8', 'atr_period': 13, 'atr_threshold': 8.0, 'pt_mult': 0.5, 'sl_mult': 0.5, 'td_mins': 720}. Best is trial 207 with value: 2.9979644789811193.
[I 2026-03-12 01:54:50,486] Trial 252 pruned. 
[I 2026-03-12 01:54:50,532] Trial 253 finished with value: 0.0 and parameters: {'timeframe': 'M8', 'atr_period': 13, 'atr_threshold': 8.0, 'pt_mult': 0.5, 'sl_mult': 5.0, 'td_mins': 60}. Best is trial 207 with value: 2.9979644789811193.
[I 2026-03-12 01:54:50,586] Trial 254 pruned. 
[I 2026-03-12 01:54:50,631] Trial 255 finished with value: 0.0 and parameters: {'timeframe': 'M8', 'atr_period': 13, 'atr_threshold': 8.0, 'pt_mult': 1.0, 'sl_mult': 0.5, 'td_mins': 120}. Best is trial 207 with value: 2.9979644789811193.
[I 2026-03-12 01:54:56,391] Trial 256 finished with value: 0.9657185215301434 and parameters: {'timeframe': 'M8', 'atr_period': 13, 'atr_threshold': 0.5, 'pt_mult': 1.0, 'sl_mult': 5.0, 'td_mins': 1200}. Best is trial 207 with value: 2.9979644789811193.
[I 2026-03-12 01:54:57,079] Trial 257 finished with value: 1.3344680243033293 and parameters: {'timeframe': 'M8', 'atr_period': 13, 'atr_threshold': 5.0, 'pt_mult': 5.0, 'sl_mult': 5.0, 'td_mins': 1200}. Best is trial 207 with value: 2.9979644789811193.
[I 2026-03-12 01:54:58,248] Trial 258 pruned. 
[I 2026-03-12 01:54:58,302] Trial 259 pruned. 
[I 2026-03-12 01:55:03,835] Trial 260 finished with value: 0.938707894060658 and parameters: {'timeframe': 'M8', 'atr_period': 13, 'atr_threshold': 2.0, 'pt_mult': 5.0, 'sl_mult': 5.0, 'td_mins': 1200}. Best is trial 207 with value: 2.9979644789811193.
[I 2026-03-12 01:55:03,881] Trial 261 finished with value: 0.0 and parameters: {'timeframe': 'M8', 'atr_period': 13, 'atr_threshold': 8.0, 'pt_mult': 1.0, 'sl_mult': 0.5, 'td_mins': 15}. Best is trial 207 with value: 2.9979644789811193.
[I 2026-03-12 01:55:03,930] Trial 262 finished with value: 0.0 and parameters: {'timeframe': 'M8', 'atr_period': 13, 'atr_threshold': 8.0, 'pt_mult': 5.0, 'sl_mult': 5.0, 'td_mins': 1080}. Best is trial 207 with value: 2.9979644789811193.
[I 2026-03-12 01:55:10,482] Trial 263 finished with value: 0.9849558563593623 and parameters: {'timeframe': 'M8', 'atr_period': 13, 'atr_threshold': 0.5, 'pt_mult': 2.5, 'sl_mult': 5.0, 'td_mins': 1080}. Best is trial 207 with value: 2.9979644789811193.
[I 2026-03-12 01:55:10,534] Trial 264 pruned. 
[I 2026-03-12 01:55:10,584] Trial 265 finished with value: 0.0 and parameters: {'timeframe': 'M8', 'atr_period': 13, 'atr_threshold': 8.0, 'pt_mult': 5.0, 'sl_mult': 5.0, 'td_mins': 360}. Best is trial 207 with value: 2.9979644789811193.
[I 2026-03-12 01:55:10,733] Trial 266 finished with value: 1.1455757525932313 and parameters: {'timeframe': 'M8', 'atr_period': 13, 'atr_threshold': 2.0, 'pt_mult': 0.5, 'sl_mult': 2.5, 'td_mins': 15}. Best is trial 207 with value: 2.9979644789811193.
[I 2026-03-12 01:55:10,779] Trial 267 finished with value: 0.0 and parameters: {'timeframe': 'M8', 'atr_period': 13, 'atr_threshold': 15.0, 'pt_mult': 2.5, 'sl_mult': 2.5, 'td_mins': 720}. Best is trial 207 with value: 2.9979644789811193.
[I 2026-03-12 01:55:10,824] Trial 268 finished with value: 0.0 and parameters: {'timeframe': 'M8', 'atr_period': 13, 'atr_threshold': 10.0, 'pt_mult': 2.5, 'sl_mult': 2.5, 'td_mins': 360}. Best is trial 207 with value: 2.9979644789811193.
[I 2026-03-12 01:55:10,871] Trial 269 finished with value: 0.0 and parameters: {'timeframe': 'M8', 'atr_period': 13, 'atr_threshold': 15.0, 'pt_mult': 2.5, 'sl_mult': 2.5, 'td_mins': 360}. Best is trial 207 with value: 2.9979644789811193.
[I 2026-03-12 01:55:10,915] Trial 270 finished with value: 0.0 and parameters: {'timeframe': 'M8', 'atr_period': 13, 'atr_threshold': 10.0, 'pt_mult': 1.0, 'sl_mult': 5.0, 'td_mins': 30}. Best is trial 207 with value: 2.9979644789811193.
[I 2026-03-12 01:55:11,654] Trial 271 pruned. 
[I 2026-03-12 01:55:13,435] Trial 272 finished with value: 0.9933770372366684 and parameters: {'timeframe': 'M8', 'atr_period': 13, 'atr_threshold': 1.0, 'pt_mult': 1.0, 'sl_mult': 2.5, 'td_mins': 360}. Best is trial 207 with value: 2.9979644789811193.
[I 2026-03-12 01:55:13,491] Trial 273 finished with value: 0.0 and parameters: {'timeframe': 'M8', 'atr_period': 13, 'atr_threshold': 8.0, 'pt_mult': 5.0, 'sl_mult': 2.5, 'td_mins': 120}. Best is trial 207 with value: 2.9979644789811193.
[I 2026-03-12 01:55:13,555] Trial 274 pruned. 
[I 2026-03-12 01:55:13,664] Trial 275 pruned. 
[I 2026-03-12 01:55:13,713] Trial 276 finished with value: 0.0 and parameters: {'timeframe': 'M8', 'atr_period': 13, 'atr_threshold': 8.0, 'pt_mult': 2.5, 'sl_mult': 1.0, 'td_mins': 1080}. Best is trial 207 with value: 2.9979644789811193.
[I 2026-03-12 01:55:13,766] Trial 277 finished with value: 0.0 and parameters: {'timeframe': 'M8', 'atr_period': 13, 'atr_threshold': 8.0, 'pt_mult': 1.0, 'sl_mult': 2.5, 'td_mins': 5}. Best is trial 207 with value: 2.9979644789811193.
[I 2026-03-12 01:55:14,968] Trial 278 pruned. 
