2026-03-12 00:33:47,635 - INFO - Discovering partitions...
2026-03-12 00:34:00,650 - INFO - === Starting Optuna Optimization for M1 (Trials: 1000) ===
/home/hephaestus-zero/.local/lib/python3.11/site-packages/optuna/_experimental.py:32: ExperimentalWarning: Argument ``multivariate`` is an experimental feature. The interface can change in the future.
  warnings.warn(
[I 2026-03-12 00:34:00,651] A new study created in memory with name: no-name-9c4b35fd-1946-4088-a531-3e47fec2a08d
2026-03-12 00:34:00,653 - INFO -     [Cache Miss] Loading Raw Tick Data for Fold 20210801_20220526...
2026-03-12 00:34:30,032 - INFO -     [Cache Miss] Loading Signal Data for M1, ATR=13...
2026-03-12 00:35:06,403 - INFO -     [Cache Miss] Loading Raw Tick Data for Fold 20220526_20230321...
2026-03-12 00:35:34,967 - INFO -     [Cache Miss] Loading Signal Data for M1, ATR=13...
2026-03-12 00:36:11,472 - INFO -     [Cache Miss] Loading Raw Tick Data for Fold 20230321_20240115...
2026-03-12 00:36:40,054 - INFO -     [Cache Miss] Loading Signal Data for M1, ATR=13...
2026-03-12 00:37:16,348 - INFO -     [Cache Miss] Loading Raw Tick Data for Fold 20240115_20241107...
2026-03-12 00:37:45,352 - INFO -     [Cache Miss] Loading Signal Data for M1, ATR=13...
2026-03-12 00:38:22,071 - INFO -     [Cache Miss] Loading Raw Tick Data for Fold 20241107_20250904...
2026-03-12 00:38:51,715 - INFO -     [Cache Miss] Loading Signal Data for M1, ATR=13...
[I 2026-03-12 00:39:30,075] Trial 0 finished with value: 0.0 and parameters: {'timeframe': 'M1', 'atr_period': 13, 'atr_threshold': 10.0, 'pt_mult': 0.5, 'sl_mult': 5.0, 'td_mins': 15}. Best is trial 0 with value: 0.0.
[I 2026-03-12 00:39:30,108] Trial 1 finished with value: 0.0 and parameters: {'timeframe': 'M1', 'atr_period': 13, 'atr_threshold': 5.0, 'pt_mult': 1.0, 'sl_mult': 5.0, 'td_mins': 1200}. Best is trial 0 with value: 0.0.
[I 2026-03-12 00:39:30,137] Trial 2 finished with value: 0.0 and parameters: {'timeframe': 'M1', 'atr_period': 13, 'atr_threshold': 8.0, 'pt_mult': 0.5, 'sl_mult': 5.0, 'td_mins': 15}. Best is trial 0 with value: 0.0.
[I 2026-03-12 00:39:33,048] Trial 3 finished with value: 0.9424077309131531 and parameters: {'timeframe': 'M1', 'atr_period': 13, 'atr_threshold': 1.0, 'pt_mult': 2.5, 'sl_mult': 2.5, 'td_mins': 60}. Best is trial 3 with value: 0.9424077309131531.
[I 2026-03-12 00:39:35,087] Trial 4 finished with value: 0.9318383513897535 and parameters: {'timeframe': 'M1', 'atr_period': 13, 'atr_threshold': 1.0, 'pt_mult': 0.5, 'sl_mult': 2.5, 'td_mins': 360}. Best is trial 3 with value: 0.9424077309131531.
[I 2026-03-12 00:39:35,221] Trial 5 finished with value: 0.28200903831953833 and parameters: {'timeframe': 'M1', 'atr_period': 13, 'atr_threshold': 2.0, 'pt_mult': 5.0, 'sl_mult': 1.0, 'td_mins': 15}. Best is trial 3 with value: 0.9424077309131531.
[I 2026-03-12 00:39:37,822] Trial 6 finished with value: 0.7398504120491369 and parameters: {'timeframe': 'M1', 'atr_period': 13, 'atr_threshold': 0.5, 'pt_mult': 5.0, 'sl_mult': 2.5, 'td_mins': 60}. Best is trial 3 with value: 0.9424077309131531.
[I 2026-03-12 00:39:38,048] Trial 7 finished with value: 1.095484792912652 and parameters: {'timeframe': 'M1', 'atr_period': 13, 'atr_threshold': 1.0, 'pt_mult': 0.5, 'sl_mult': 2.5, 'td_mins': 5}. Best is trial 7 with value: 1.095484792912652.
[I 2026-03-12 00:39:38,090] Trial 8 finished with value: 0.0 and parameters: {'timeframe': 'M1', 'atr_period': 13, 'atr_threshold': 10.0, 'pt_mult': 1.0, 'sl_mult': 5.0, 'td_mins': 1200}. Best is trial 7 with value: 1.095484792912652.
[I 2026-03-12 00:39:38,133] Trial 9 finished with value: 0.0 and parameters: {'timeframe': 'M1', 'atr_period': 13, 'atr_threshold': 10.0, 'pt_mult': 0.5, 'sl_mult': 2.5, 'td_mins': 720}. Best is trial 7 with value: 1.095484792912652.
[I 2026-03-12 00:39:38,849] Trial 10 finished with value: 0.958445290988671 and parameters: {'timeframe': 'M1', 'atr_period': 13, 'atr_threshold': 2.0, 'pt_mult': 1.0, 'sl_mult': 5.0, 'td_mins': 360}. Best is trial 7 with value: 1.095484792912652.
[I 2026-03-12 00:39:53,725] Trial 11 finished with value: 1.0425837919319956 and parameters: {'timeframe': 'M1', 'atr_period': 13, 'atr_threshold': 0.5, 'pt_mult': 5.0, 'sl_mult': 1.0, 'td_mins': 1200}. Best is trial 7 with value: 1.095484792912652.
[I 2026-03-12 00:39:53,769] Trial 12 finished with value: 0.0 and parameters: {'timeframe': 'M1', 'atr_period': 13, 'atr_threshold': 10.0, 'pt_mult': 0.5, 'sl_mult': 2.5, 'td_mins': 360}. Best is trial 7 with value: 1.095484792912652.
[I 2026-03-12 00:39:53,817] Trial 13 finished with value: 0.0 and parameters: {'timeframe': 'M1', 'atr_period': 13, 'atr_threshold': 8.0, 'pt_mult': 1.0, 'sl_mult': 5.0, 'td_mins': 1200}. Best is trial 7 with value: 1.095484792912652.
[I 2026-03-12 00:39:54,094] Trial 14 finished with value: 1.0674388283470675 and parameters: {'timeframe': 'M1', 'atr_period': 13, 'atr_threshold': 2.0, 'pt_mult': 1.0, 'sl_mult': 5.0, 'td_mins': 60}. Best is trial 7 with value: 1.095484792912652.
[I 2026-03-12 00:39:54,138] Trial 15 finished with value: 0.0 and parameters: {'timeframe': 'M1', 'atr_period': 13, 'atr_threshold': 8.0, 'pt_mult': 0.5, 'sl_mult': 5.0, 'td_mins': 360}. Best is trial 7 with value: 1.095484792912652.
[I 2026-03-12 00:39:58,558] Trial 16 finished with value: 0.9476484812521544 and parameters: {'timeframe': 'M1', 'atr_period': 13, 'atr_threshold': 0.5, 'pt_mult': 0.5, 'sl_mult': 1.0, 'td_mins': 1080}. Best is trial 7 with value: 1.095484792912652.
[I 2026-03-12 00:39:58,604] Trial 17 finished with value: 0.0 and parameters: {'timeframe': 'M1', 'atr_period': 13, 'atr_threshold': 8.0, 'pt_mult': 2.5, 'sl_mult': 1.0, 'td_mins': 360}. Best is trial 7 with value: 1.095484792912652.
[I 2026-03-12 00:39:58,652] Trial 18 finished with value: 0.0 and parameters: {'timeframe': 'M1', 'atr_period': 13, 'atr_threshold': 15.0, 'pt_mult': 2.5, 'sl_mult': 5.0, 'td_mins': 1200}. Best is trial 7 with value: 1.095484792912652.
[I 2026-03-12 00:39:58,698] Trial 19 finished with value: 0.0 and parameters: {'timeframe': 'M1', 'atr_period': 13, 'atr_threshold': 5.0, 'pt_mult': 5.0, 'sl_mult': 0.5, 'td_mins': 1200}. Best is trial 7 with value: 1.095484792912652.
[I 2026-03-12 00:39:58,742] Trial 20 finished with value: 0.0 and parameters: {'timeframe': 'M1', 'atr_period': 13, 'atr_threshold': 3.0, 'pt_mult': 0.5, 'sl_mult': 0.5, 'td_mins': 120}. Best is trial 7 with value: 1.095484792912652.
[I 2026-03-12 00:39:58,922] Trial 21 finished with value: 1.1884118997438728 and parameters: {'timeframe': 'M1', 'atr_period': 13, 'atr_threshold': 2.0, 'pt_mult': 0.5, 'sl_mult': 5.0, 'td_mins': 30}. Best is trial 21 with value: 1.1884118997438728.
[I 2026-03-12 00:39:58,971] Trial 22 finished with value: 0.0 and parameters: {'timeframe': 'M1', 'atr_period': 13, 'atr_threshold': 5.0, 'pt_mult': 2.5, 'sl_mult': 1.0, 'td_mins': 120}. Best is trial 21 with value: 1.1884118997438728.
[I 2026-03-12 00:39:59,018] Trial 23 finished with value: 0.0 and parameters: {'timeframe': 'M1', 'atr_period': 13, 'atr_threshold': 5.0, 'pt_mult': 1.0, 'sl_mult': 2.5, 'td_mins': 15}. Best is trial 21 with value: 1.1884118997438728.
[I 2026-03-12 00:39:59,061] Trial 24 finished with value: 0.0 and parameters: {'timeframe': 'M1', 'atr_period': 13, 'atr_threshold': 3.0, 'pt_mult': 5.0, 'sl_mult': 1.0, 'td_mins': 120}. Best is trial 21 with value: 1.1884118997438728.
[I 2026-03-12 00:40:00,151] Trial 25 finished with value: 0.983889970457162 and parameters: {'timeframe': 'M1', 'atr_period': 13, 'atr_threshold': 2.0, 'pt_mult': 5.0, 'sl_mult': 5.0, 'td_mins': 360}. Best is trial 21 with value: 1.1884118997438728.
[I 2026-03-12 00:40:00,205] Trial 26 finished with value: 0.0 and parameters: {'timeframe': 'M1', 'atr_period': 13, 'atr_threshold': 15.0, 'pt_mult': 2.5, 'sl_mult': 0.5, 'td_mins': 30}. Best is trial 21 with value: 1.1884118997438728.
[I 2026-03-12 00:40:00,255] Trial 27 finished with value: 0.0 and parameters: {'timeframe': 'M1', 'atr_period': 13, 'atr_threshold': 8.0, 'pt_mult': 1.0, 'sl_mult': 0.5, 'td_mins': 1080}. Best is trial 21 with value: 1.1884118997438728.
[I 2026-03-12 00:40:00,300] Trial 28 finished with value: 0.0 and parameters: {'timeframe': 'M1', 'atr_period': 13, 'atr_threshold': 15.0, 'pt_mult': 1.0, 'sl_mult': 1.0, 'td_mins': 720}. Best is trial 21 with value: 1.1884118997438728.
[I 2026-03-12 00:40:00,343] Trial 29 finished with value: 0.0 and parameters: {'timeframe': 'M1', 'atr_period': 13, 'atr_threshold': 3.0, 'pt_mult': 0.5, 'sl_mult': 1.0, 'td_mins': 30}. Best is trial 21 with value: 1.1884118997438728.
[I 2026-03-12 00:40:00,386] Trial 30 finished with value: 0.0 and parameters: {'timeframe': 'M1', 'atr_period': 13, 'atr_threshold': 5.0, 'pt_mult': 1.0, 'sl_mult': 5.0, 'td_mins': 120}. Best is trial 21 with value: 1.1884118997438728.
[I 2026-03-12 00:40:00,428] Trial 31 finished with value: 0.0 and parameters: {'timeframe': 'M1', 'atr_period': 13, 'atr_threshold': 5.0, 'pt_mult': 0.5, 'sl_mult': 1.0, 'td_mins': 5}. Best is trial 21 with value: 1.1884118997438728.
[I 2026-03-12 00:40:00,514] Trial 32 finished with value: 1.7165018600651565 and parameters: {'timeframe': 'M1', 'atr_period': 13, 'atr_threshold': 2.0, 'pt_mult': 1.0, 'sl_mult': 5.0, 'td_mins': 5}. Best is trial 32 with value: 1.7165018600651565.
[I 2026-03-12 00:40:03,113] Trial 33 pruned. 
[I 2026-03-12 00:40:03,170] Trial 34 pruned. 
[I 2026-03-12 00:40:03,222] Trial 35 finished with value: 0.0 and parameters: {'timeframe': 'M1', 'atr_period': 13, 'atr_threshold': 5.0, 'pt_mult': 1.0, 'sl_mult': 0.5, 'td_mins': 30}. Best is trial 32 with value: 1.7165018600651565.
[I 2026-03-12 00:40:03,518] Trial 36 pruned. 
[I 2026-03-12 00:40:03,562] Trial 37 finished with value: 0.0 and parameters: {'timeframe': 'M1', 'atr_period': 13, 'atr_threshold': 8.0, 'pt_mult': 0.5, 'sl_mult': 2.5, 'td_mins': 360}. Best is trial 32 with value: 1.7165018600651565.
[I 2026-03-12 00:40:03,608] Trial 38 finished with value: 0.0 and parameters: {'timeframe': 'M1', 'atr_period': 13, 'atr_threshold': 15.0, 'pt_mult': 5.0, 'sl_mult': 1.0, 'td_mins': 30}. Best is trial 32 with value: 1.7165018600651565.
[I 2026-03-12 00:40:03,653] Trial 39 finished with value: 0.0 and parameters: {'timeframe': 'M1', 'atr_period': 13, 'atr_threshold': 3.0, 'pt_mult': 2.5, 'sl_mult': 5.0, 'td_mins': 15}. Best is trial 32 with value: 1.7165018600651565.
[I 2026-03-12 00:40:03,698] Trial 40 finished with value: 0.0 and parameters: {'timeframe': 'M1', 'atr_period': 13, 'atr_threshold': 8.0, 'pt_mult': 0.5, 'sl_mult': 2.5, 'td_mins': 15}. Best is trial 32 with value: 1.7165018600651565.
[I 2026-03-12 00:40:03,740] Trial 41 finished with value: 0.0 and parameters: {'timeframe': 'M1', 'atr_period': 13, 'atr_threshold': 10.0, 'pt_mult': 2.5, 'sl_mult': 0.5, 'td_mins': 180}. Best is trial 32 with value: 1.7165018600651565.
[I 2026-03-12 00:40:05,671] Trial 42 pruned. 
[I 2026-03-12 00:40:05,718] Trial 43 finished with value: 0.0 and parameters: {'timeframe': 'M1', 'atr_period': 13, 'atr_threshold': 10.0, 'pt_mult': 1.0, 'sl_mult': 5.0, 'td_mins': 30}. Best is trial 32 with value: 1.7165018600651565.
[I 2026-03-12 00:40:10,610] Trial 44 finished with value: 1.0798020402100426 and parameters: {'timeframe': 'M1', 'atr_period': 13, 'atr_threshold': 1.0, 'pt_mult': 5.0, 'sl_mult': 0.5, 'td_mins': 720}. Best is trial 32 with value: 1.7165018600651565.
[I 2026-03-12 00:40:10,659] Trial 45 finished with value: 0.0 and parameters: {'timeframe': 'M1', 'atr_period': 13, 'atr_threshold': 5.0, 'pt_mult': 2.5, 'sl_mult': 5.0, 'td_mins': 1200}. Best is trial 32 with value: 1.7165018600651565.
[I 2026-03-12 00:40:10,710] Trial 46 finished with value: 0.0 and parameters: {'timeframe': 'M1', 'atr_period': 13, 'atr_threshold': 15.0, 'pt_mult': 5.0, 'sl_mult': 1.0, 'td_mins': 60}. Best is trial 32 with value: 1.7165018600651565.
[I 2026-03-12 00:40:10,784] Trial 47 pruned. 
[I 2026-03-12 00:40:10,829] Trial 48 finished with value: 0.0 and parameters: {'timeframe': 'M1', 'atr_period': 13, 'atr_threshold': 8.0, 'pt_mult': 1.0, 'sl_mult': 5.0, 'td_mins': 720}. Best is trial 32 with value: 1.7165018600651565.
[I 2026-03-12 00:40:10,871] Trial 49 finished with value: 0.0 and parameters: {'timeframe': 'M1', 'atr_period': 13, 'atr_threshold': 15.0, 'pt_mult': 1.0, 'sl_mult': 1.0, 'td_mins': 720}. Best is trial 32 with value: 1.7165018600651565.
[I 2026-03-12 00:40:10,914] Trial 50 finished with value: 0.0 and parameters: {'timeframe': 'M1', 'atr_period': 13, 'atr_threshold': 15.0, 'pt_mult': 2.5, 'sl_mult': 5.0, 'td_mins': 30}. Best is trial 32 with value: 1.7165018600651565.
[I 2026-03-12 00:40:10,956] Trial 51 finished with value: 0.0 and parameters: {'timeframe': 'M1', 'atr_period': 13, 'atr_threshold': 15.0, 'pt_mult': 5.0, 'sl_mult': 0.5, 'td_mins': 360}. Best is trial 32 with value: 1.7165018600651565.
[I 2026-03-12 00:40:10,998] Trial 52 finished with value: 0.0 and parameters: {'timeframe': 'M1', 'atr_period': 13, 'atr_threshold': 3.0, 'pt_mult': 5.0, 'sl_mult': 5.0, 'td_mins': 30}. Best is trial 32 with value: 1.7165018600651565.
[I 2026-03-12 00:40:11,040] Trial 53 finished with value: 0.0 and parameters: {'timeframe': 'M1', 'atr_period': 13, 'atr_threshold': 5.0, 'pt_mult': 5.0, 'sl_mult': 1.0, 'td_mins': 360}. Best is trial 32 with value: 1.7165018600651565.
[I 2026-03-12 00:40:11,082] Trial 54 finished with value: 0.0 and parameters: {'timeframe': 'M1', 'atr_period': 13, 'atr_threshold': 10.0, 'pt_mult': 2.5, 'sl_mult': 5.0, 'td_mins': 15}. Best is trial 32 with value: 1.7165018600651565.
[I 2026-03-12 00:40:12,308] Trial 55 pruned. 
[I 2026-03-12 00:40:12,354] Trial 56 finished with value: 0.0 and parameters: {'timeframe': 'M1', 'atr_period': 13, 'atr_threshold': 5.0, 'pt_mult': 5.0, 'sl_mult': 5.0, 'td_mins': 30}. Best is trial 32 with value: 1.7165018600651565.
[I 2026-03-12 00:40:12,402] Trial 57 finished with value: 0.0 and parameters: {'timeframe': 'M1', 'atr_period': 13, 'atr_threshold': 3.0, 'pt_mult': 1.0, 'sl_mult': 2.5, 'td_mins': 30}. Best is trial 32 with value: 1.7165018600651565.
[I 2026-03-12 00:40:12,446] Trial 58 finished with value: 0.0 and parameters: {'timeframe': 'M1', 'atr_period': 13, 'atr_threshold': 15.0, 'pt_mult': 2.5, 'sl_mult': 1.0, 'td_mins': 5}. Best is trial 32 with value: 1.7165018600651565.
[I 2026-03-12 00:40:13,483] Trial 59 finished with value: 0.946089635732213 and parameters: {'timeframe': 'M1', 'atr_period': 13, 'atr_threshold': 2.0, 'pt_mult': 1.0, 'sl_mult': 5.0, 'td_mins': 720}. Best is trial 32 with value: 1.7165018600651565.
[I 2026-03-12 00:40:13,530] Trial 60 finished with value: 0.0 and parameters: {'timeframe': 'M1', 'atr_period': 13, 'atr_threshold': 8.0, 'pt_mult': 1.0, 'sl_mult': 2.5, 'td_mins': 180}. Best is trial 32 with value: 1.7165018600651565.
[I 2026-03-12 00:40:13,575] Trial 61 finished with value: 0.0 and parameters: {'timeframe': 'M1', 'atr_period': 13, 'atr_threshold': 15.0, 'pt_mult': 0.5, 'sl_mult': 0.5, 'td_mins': 30}. Best is trial 32 with value: 1.7165018600651565.
[I 2026-03-12 00:40:13,620] Trial 62 finished with value: 0.0 and parameters: {'timeframe': 'M1', 'atr_period': 13, 'atr_threshold': 15.0, 'pt_mult': 1.0, 'sl_mult': 0.5, 'td_mins': 360}. Best is trial 32 with value: 1.7165018600651565.
[I 2026-03-12 00:40:13,725] Trial 63 finished with value: 1.0343187330390606 and parameters: {'timeframe': 'M1', 'atr_period': 13, 'atr_threshold': 2.0, 'pt_mult': 1.0, 'sl_mult': 0.5, 'td_mins': 15}. Best is trial 32 with value: 1.7165018600651565.
[I 2026-03-12 00:40:13,769] Trial 64 finished with value: 0.0 and parameters: {'timeframe': 'M1', 'atr_period': 13, 'atr_threshold': 15.0, 'pt_mult': 2.5, 'sl_mult': 1.0, 'td_mins': 360}. Best is trial 32 with value: 1.7165018600651565.
[I 2026-03-12 00:40:13,812] Trial 65 finished with value: 0.0 and parameters: {'timeframe': 'M1', 'atr_period': 13, 'atr_threshold': 8.0, 'pt_mult': 2.5, 'sl_mult': 0.5, 'td_mins': 360}. Best is trial 32 with value: 1.7165018600651565.
[I 2026-03-12 00:40:14,194] Trial 66 pruned. 
[I 2026-03-12 00:40:14,242] Trial 67 finished with value: 0.0 and parameters: {'timeframe': 'M1', 'atr_period': 13, 'atr_threshold': 3.0, 'pt_mult': 2.5, 'sl_mult': 5.0, 'td_mins': 120}. Best is trial 32 with value: 1.7165018600651565.
[I 2026-03-12 00:40:18,550] Trial 68 finished with value: 1.0752288213217893 and parameters: {'timeframe': 'M1', 'atr_period': 13, 'atr_threshold': 0.5, 'pt_mult': 2.5, 'sl_mult': 0.5, 'td_mins': 360}. Best is trial 32 with value: 1.7165018600651565.
[I 2026-03-12 00:40:18,596] Trial 69 finished with value: 0.0 and parameters: {'timeframe': 'M1', 'atr_period': 13, 'atr_threshold': 15.0, 'pt_mult': 1.0, 'sl_mult': 2.5, 'td_mins': 1200}. Best is trial 32 with value: 1.7165018600651565.
[I 2026-03-12 00:40:18,644] Trial 70 finished with value: 0.0 and parameters: {'timeframe': 'M1', 'atr_period': 13, 'atr_threshold': 10.0, 'pt_mult': 5.0, 'sl_mult': 5.0, 'td_mins': 15}. Best is trial 32 with value: 1.7165018600651565.
[I 2026-03-12 00:40:18,688] Trial 71 finished with value: 0.0 and parameters: {'timeframe': 'M1', 'atr_period': 13, 'atr_threshold': 3.0, 'pt_mult': 1.0, 'sl_mult': 1.0, 'td_mins': 1200}. Best is trial 32 with value: 1.7165018600651565.
[I 2026-03-12 00:40:18,734] Trial 72 finished with value: 0.0 and parameters: {'timeframe': 'M1', 'atr_period': 13, 'atr_threshold': 8.0, 'pt_mult': 5.0, 'sl_mult': 0.5, 'td_mins': 120}. Best is trial 32 with value: 1.7165018600651565.
[I 2026-03-12 00:40:18,778] Trial 73 finished with value: 0.0 and parameters: {'timeframe': 'M1', 'atr_period': 13, 'atr_threshold': 10.0, 'pt_mult': 0.5, 'sl_mult': 5.0, 'td_mins': 15}. Best is trial 32 with value: 1.7165018600651565.
[I 2026-03-12 00:40:18,822] Trial 74 finished with value: 0.0 and parameters: {'timeframe': 'M1', 'atr_period': 13, 'atr_threshold': 15.0, 'pt_mult': 0.5, 'sl_mult': 0.5, 'td_mins': 1200}. Best is trial 32 with value: 1.7165018600651565.
[I 2026-03-12 00:40:18,865] Trial 75 finished with value: 0.0 and parameters: {'timeframe': 'M1', 'atr_period': 13, 'atr_threshold': 15.0, 'pt_mult': 1.0, 'sl_mult': 5.0, 'td_mins': 30}. Best is trial 32 with value: 1.7165018600651565.
[I 2026-03-12 00:40:19,454] Trial 76 pruned. 
[I 2026-03-12 00:40:19,501] Trial 77 finished with value: 0.0 and parameters: {'timeframe': 'M1', 'atr_period': 13, 'atr_threshold': 10.0, 'pt_mult': 1.0, 'sl_mult': 0.5, 'td_mins': 60}. Best is trial 32 with value: 1.7165018600651565.
[I 2026-03-12 00:40:19,840] Trial 78 pruned. 
[I 2026-03-12 00:40:19,891] Trial 79 finished with value: 0.0 and parameters: {'timeframe': 'M1', 'atr_period': 13, 'atr_threshold': 8.0, 'pt_mult': 5.0, 'sl_mult': 5.0, 'td_mins': 1200}. Best is trial 32 with value: 1.7165018600651565.
[I 2026-03-12 00:40:19,942] Trial 80 finished with value: 0.0 and parameters: {'timeframe': 'M1', 'atr_period': 13, 'atr_threshold': 5.0, 'pt_mult': 1.0, 'sl_mult': 2.5, 'td_mins': 15}. Best is trial 32 with value: 1.7165018600651565.
[I 2026-03-12 00:40:20,022] Trial 81 pruned. 
[I 2026-03-12 00:40:20,069] Trial 82 finished with value: 0.0 and parameters: {'timeframe': 'M1', 'atr_period': 13, 'atr_threshold': 3.0, 'pt_mult': 0.5, 'sl_mult': 5.0, 'td_mins': 60}. Best is trial 32 with value: 1.7165018600651565.
[I 2026-03-12 00:40:20,116] Trial 83 finished with value: 0.0 and parameters: {'timeframe': 'M1', 'atr_period': 13, 'atr_threshold': 10.0, 'pt_mult': 0.5, 'sl_mult': 1.0, 'td_mins': 15}. Best is trial 32 with value: 1.7165018600651565.
[I 2026-03-12 00:40:20,201] Trial 84 pruned. 
[I 2026-03-12 00:40:20,423] Trial 85 pruned. 
[I 2026-03-12 00:40:20,674] Trial 86 finished with value: 0.9901313346051774 and parameters: {'timeframe': 'M1', 'atr_period': 13, 'atr_threshold': 2.0, 'pt_mult': 2.5, 'sl_mult': 1.0, 'td_mins': 60}. Best is trial 32 with value: 1.7165018600651565.
[I 2026-03-12 00:40:20,717] Trial 87 finished with value: 0.0 and parameters: {'timeframe': 'M1', 'atr_period': 13, 'atr_threshold': 3.0, 'pt_mult': 0.5, 'sl_mult': 5.0, 'td_mins': 120}. Best is trial 32 with value: 1.7165018600651565.
[I 2026-03-12 00:40:21,299] Trial 88 pruned. 
[I 2026-03-12 00:40:23,751] Trial 89 finished with value: 1.0736071542692716 and parameters: {'timeframe': 'M1', 'atr_period': 13, 'atr_threshold': 0.5, 'pt_mult': 2.5, 'sl_mult': 0.5, 'td_mins': 120}. Best is trial 32 with value: 1.7165018600651565.
[I 2026-03-12 00:40:23,799] Trial 90 finished with value: 0.0 and parameters: {'timeframe': 'M1', 'atr_period': 13, 'atr_threshold': 3.0, 'pt_mult': 5.0, 'sl_mult': 2.5, 'td_mins': 1200}. Best is trial 32 with value: 1.7165018600651565.
[I 2026-03-12 00:40:24,988] Trial 91 pruned. 
[I 2026-03-12 00:40:25,046] Trial 92 finished with value: 0.0 and parameters: {'timeframe': 'M1', 'atr_period': 13, 'atr_threshold': 3.0, 'pt_mult': 2.5, 'sl_mult': 0.5, 'td_mins': 30}. Best is trial 32 with value: 1.7165018600651565.
[I 2026-03-12 00:40:25,102] Trial 93 finished with value: 0.0 and parameters: {'timeframe': 'M1', 'atr_period': 13, 'atr_threshold': 8.0, 'pt_mult': 1.0, 'sl_mult': 1.0, 'td_mins': 360}. Best is trial 32 with value: 1.7165018600651565.
[I 2026-03-12 00:40:25,153] Trial 94 finished with value: 0.0 and parameters: {'timeframe': 'M1', 'atr_period': 13, 'atr_threshold': 8.0, 'pt_mult': 1.0, 'sl_mult': 1.0, 'td_mins': 120}. Best is trial 32 with value: 1.7165018600651565.
[I 2026-03-12 00:40:25,934] Trial 95 finished with value: 0.958445290988671 and parameters: {'timeframe': 'M1', 'atr_period': 13, 'atr_threshold': 2.0, 'pt_mult': 1.0, 'sl_mult': 5.0, 'td_mins': 360}. Best is trial 32 with value: 1.7165018600651565.
[I 2026-03-12 00:40:28,367] Trial 96 finished with value: 1.0517578273177346 and parameters: {'timeframe': 'M1', 'atr_period': 13, 'atr_threshold': 1.0, 'pt_mult': 1.0, 'sl_mult': 0.5, 'td_mins': 1080}. Best is trial 32 with value: 1.7165018600651565.
[I 2026-03-12 00:40:28,455] Trial 97 pruned. 
