[I 2026-03-12 00:55:58,677] Trial 106 finished with value: 0.0 and parameters: {'timeframe': 'M5', 'atr_period': 13, 'atr_threshold': 10.0, 'pt_mult': 2.5, 'sl_mult': 1.0, 'td_mins': 15}. Best is trial 42 with value: 1.641470502456864.
[I 2026-03-12 00:55:58,735] Trial 107 pruned. 
[I 2026-03-12 00:55:58,782] Trial 108 finished with value: 0.0 and parameters: {'timeframe': 'M5', 'atr_period': 13, 'atr_threshold': 10.0, 'pt_mult': 1.0, 'sl_mult': 1.0, 'td_mins': 720}. Best is trial 42 with value: 1.641470502456864.
[I 2026-03-12 00:55:59,790] Trial 109 finished with value: 1.0373923190533014 and parameters: {'timeframe': 'M5', 'atr_period': 13, 'atr_threshold': 3.0, 'pt_mult': 0.5, 'sl_mult': 5.0, 'td_mins': 720}. Best is trial 42 with value: 1.641470502456864.
[I 2026-03-12 00:56:00,013] Trial 110 pruned. 
[I 2026-03-12 00:56:00,062] Trial 111 finished with value: 0.0 and parameters: {'timeframe': 'M5', 'atr_period': 13, 'atr_threshold': 10.0, 'pt_mult': 1.0, 'sl_mult': 2.5, 'td_mins': 120}. Best is trial 42 with value: 1.641470502456864.
[I 2026-03-12 00:56:00,106] Trial 112 finished with value: 0.0 and parameters: {'timeframe': 'M5', 'atr_period': 13, 'atr_threshold': 15.0, 'pt_mult': 0.5, 'sl_mult': 2.5, 'td_mins': 360}. Best is trial 42 with value: 1.641470502456864.
[I 2026-03-12 00:56:00,450] Trial 113 finished with value: 1.783955378354149 and parameters: {'timeframe': 'M5', 'atr_period': 13, 'atr_threshold': 3.0, 'pt_mult': 0.5, 'sl_mult': 5.0, 'td_mins': 180}. Best is trial 113 with value: 1.783955378354149.
[I 2026-03-12 00:56:00,494] Trial 114 finished with value: 0.0 and parameters: {'timeframe': 'M5', 'atr_period': 13, 'atr_threshold': 5.0, 'pt_mult': 5.0, 'sl_mult': 0.5, 'td_mins': 360}. Best is trial 113 with value: 1.783955378354149.
[I 2026-03-12 00:56:00,537] Trial 115 finished with value: 0.0 and parameters: {'timeframe': 'M5', 'atr_period': 13, 'atr_threshold': 10.0, 'pt_mult': 2.5, 'sl_mult': 2.5, 'td_mins': 30}. Best is trial 113 with value: 1.783955378354149.
[I 2026-03-12 00:56:00,586] Trial 116 pruned. 
[I 2026-03-12 00:56:00,676] Trial 117 pruned. 
[I 2026-03-12 00:56:00,718] Trial 118 finished with value: 0.0 and parameters: {'timeframe': 'M5', 'atr_period': 13, 'atr_threshold': 5.0, 'pt_mult': 2.5, 'sl_mult': 5.0, 'td_mins': 120}. Best is trial 113 with value: 1.783955378354149.
[I 2026-03-12 00:56:01,104] Trial 119 pruned. 
[I 2026-03-12 00:56:01,155] Trial 120 finished with value: 0.0 and parameters: {'timeframe': 'M5', 'atr_period': 13, 'atr_threshold': 10.0, 'pt_mult': 1.0, 'sl_mult': 2.5, 'td_mins': 30}. Best is trial 113 with value: 1.783955378354149.
[I 2026-03-12 00:56:01,251] Trial 121 pruned. 
[I 2026-03-12 00:56:01,298] Trial 122 finished with value: 0.0 and parameters: {'timeframe': 'M5', 'atr_period': 13, 'atr_threshold': 8.0, 'pt_mult': 1.0, 'sl_mult': 2.5, 'td_mins': 5}. Best is trial 113 with value: 1.783955378354149.
[I 2026-03-12 00:56:01,547] Trial 123 pruned. 
[I 2026-03-12 00:56:01,946] Trial 124 pruned. 
[I 2026-03-12 00:56:01,993] Trial 125 finished with value: 0.0 and parameters: {'timeframe': 'M5', 'atr_period': 13, 'atr_threshold': 5.0, 'pt_mult': 2.5, 'sl_mult': 0.5, 'td_mins': 15}. Best is trial 113 with value: 1.783955378354149.
[I 2026-03-12 00:56:02,042] Trial 126 finished with value: 0.0 and parameters: {'timeframe': 'M5', 'atr_period': 13, 'atr_threshold': 5.0, 'pt_mult': 1.0, 'sl_mult': 5.0, 'td_mins': 180}. Best is trial 113 with value: 1.783955378354149.
[I 2026-03-12 00:56:02,086] Trial 127 finished with value: 0.0 and parameters: {'timeframe': 'M5', 'atr_period': 13, 'atr_threshold': 15.0, 'pt_mult': 1.0, 'sl_mult': 5.0, 'td_mins': 120}. Best is trial 113 with value: 1.783955378354149.
[I 2026-03-12 00:56:02,283] Trial 128 pruned. 
[I 2026-03-12 00:56:02,407] Trial 129 pruned. 
[I 2026-03-12 00:56:02,453] Trial 130 finished with value: 0.0 and parameters: {'timeframe': 'M5', 'atr_period': 13, 'atr_threshold': 5.0, 'pt_mult': 0.5, 'sl_mult': 0.5, 'td_mins': 720}. Best is trial 113 with value: 1.783955378354149.
[I 2026-03-12 00:56:02,747] Trial 131 pruned. 
[I 2026-03-12 00:56:02,956] Trial 132 pruned. 
[I 2026-03-12 00:56:03,000] Trial 133 finished with value: 0.0 and parameters: {'timeframe': 'M5', 'atr_period': 13, 'atr_threshold': 10.0, 'pt_mult': 5.0, 'sl_mult': 2.5, 'td_mins': 5}. Best is trial 113 with value: 1.783955378354149.
[I 2026-03-12 00:56:03,082] Trial 134 pruned. 
[I 2026-03-12 00:56:03,128] Trial 135 finished with value: 0.0 and parameters: {'timeframe': 'M5', 'atr_period': 13, 'atr_threshold': 8.0, 'pt_mult': 5.0, 'sl_mult': 1.0, 'td_mins': 15}. Best is trial 113 with value: 1.783955378354149.
[I 2026-03-12 00:56:03,171] Trial 136 finished with value: 0.0 and parameters: {'timeframe': 'M5', 'atr_period': 13, 'atr_threshold': 15.0, 'pt_mult': 0.5, 'sl_mult': 2.5, 'td_mins': 1200}. Best is trial 113 with value: 1.783955378354149.
[I 2026-03-12 00:56:03,213] Trial 137 finished with value: 0.0 and parameters: {'timeframe': 'M5', 'atr_period': 13, 'atr_threshold': 5.0, 'pt_mult': 5.0, 'sl_mult': 2.5, 'td_mins': 180}. Best is trial 113 with value: 1.783955378354149.
[I 2026-03-12 00:56:03,292] Trial 138 finished with value: 0.9836404307258061 and parameters: {'timeframe': 'M5', 'atr_period': 13, 'atr_threshold': 3.0, 'pt_mult': 0.5, 'sl_mult': 5.0, 'td_mins': 5}. Best is trial 113 with value: 1.783955378354149.
[I 2026-03-12 00:56:03,933] Trial 139 pruned. 
[I 2026-03-12 00:56:04,227] Trial 140 pruned. 
[I 2026-03-12 00:56:04,337] Trial 141 pruned. 
[I 2026-03-12 00:56:04,382] Trial 142 finished with value: 0.0 and parameters: {'timeframe': 'M5', 'atr_period': 13, 'atr_threshold': 8.0, 'pt_mult': 5.0, 'sl_mult': 0.5, 'td_mins': 360}. Best is trial 113 with value: 1.783955378354149.
[I 2026-03-12 00:56:04,426] Trial 143 finished with value: 0.0 and parameters: {'timeframe': 'M5', 'atr_period': 13, 'atr_threshold': 15.0, 'pt_mult': 2.5, 'sl_mult': 5.0, 'td_mins': 15}. Best is trial 113 with value: 1.783955378354149.
[I 2026-03-12 00:56:04,925] Trial 144 finished with value: 1.1035408439825674 and parameters: {'timeframe': 'M5', 'atr_period': 13, 'atr_threshold': 2.0, 'pt_mult': 1.0, 'sl_mult': 2.5, 'td_mins': 120}. Best is trial 113 with value: 1.783955378354149.
[I 2026-03-12 00:56:04,969] Trial 145 finished with value: 0.0 and parameters: {'timeframe': 'M5', 'atr_period': 13, 'atr_threshold': 5.0, 'pt_mult': 5.0, 'sl_mult': 5.0, 'td_mins': 720}. Best is trial 113 with value: 1.783955378354149.
[I 2026-03-12 00:56:05,183] Trial 146 pruned. 
[I 2026-03-12 00:56:05,345] Trial 147 pruned. 
[I 2026-03-12 00:56:07,910] Trial 148 pruned. 
[I 2026-03-12 00:56:07,980] Trial 149 pruned. 
[I 2026-03-12 00:56:08,139] Trial 150 finished with value: 1.2390766125498034 and parameters: {'timeframe': 'M5', 'atr_period': 13, 'atr_threshold': 3.0, 'pt_mult': 0.5, 'sl_mult': 2.5, 'td_mins': 60}. Best is trial 113 with value: 1.783955378354149.
[I 2026-03-12 00:56:08,184] Trial 151 finished with value: 0.0 and parameters: {'timeframe': 'M5', 'atr_period': 13, 'atr_threshold': 10.0, 'pt_mult': 2.5, 'sl_mult': 5.0, 'td_mins': 1200}. Best is trial 113 with value: 1.783955378354149.
[I 2026-03-12 00:56:08,229] Trial 152 finished with value: 0.0 and parameters: {'timeframe': 'M5', 'atr_period': 13, 'atr_threshold': 5.0, 'pt_mult': 2.5, 'sl_mult': 1.0, 'td_mins': 360}. Best is trial 113 with value: 1.783955378354149.
[I 2026-03-12 00:56:08,272] Trial 153 finished with value: 0.0 and parameters: {'timeframe': 'M5', 'atr_period': 13, 'atr_threshold': 10.0, 'pt_mult': 5.0, 'sl_mult': 0.5, 'td_mins': 120}. Best is trial 113 with value: 1.783955378354149.
[I 2026-03-12 00:56:10,808] Trial 154 finished with value: 1.15094959414123 and parameters: {'timeframe': 'M5', 'atr_period': 13, 'atr_threshold': 2.0, 'pt_mult': 2.5, 'sl_mult': 5.0, 'td_mins': 720}. Best is trial 113 with value: 1.783955378354149.
[I 2026-03-12 00:56:10,852] Trial 155 finished with value: 0.0 and parameters: {'timeframe': 'M5', 'atr_period': 13, 'atr_threshold': 8.0, 'pt_mult': 5.0, 'sl_mult': 5.0, 'td_mins': 1080}. Best is trial 113 with value: 1.783955378354149.
[I 2026-03-12 00:56:10,901] Trial 156 finished with value: 0.0 and parameters: {'timeframe': 'M5', 'atr_period': 13, 'atr_threshold': 5.0, 'pt_mult': 5.0, 'sl_mult': 1.0, 'td_mins': 1200}. Best is trial 113 with value: 1.783955378354149.
[I 2026-03-12 00:56:10,978] Trial 157 pruned. 
[I 2026-03-12 00:56:11,025] Trial 158 finished with value: 0.0 and parameters: {'timeframe': 'M5', 'atr_period': 13, 'atr_threshold': 5.0, 'pt_mult': 5.0, 'sl_mult': 0.5, 'td_mins': 1080}. Best is trial 113 with value: 1.783955378354149.
[I 2026-03-12 00:56:11,073] Trial 159 finished with value: 0.0 and parameters: {'timeframe': 'M5', 'atr_period': 13, 'atr_threshold': 8.0, 'pt_mult': 0.5, 'sl_mult': 5.0, 'td_mins': 180}. Best is trial 113 with value: 1.783955378354149.
[I 2026-03-12 00:56:11,118] Trial 160 finished with value: 0.0 and parameters: {'timeframe': 'M5', 'atr_period': 13, 'atr_threshold': 10.0, 'pt_mult': 5.0, 'sl_mult': 5.0, 'td_mins': 5}. Best is trial 113 with value: 1.783955378354149.
[I 2026-03-12 00:56:11,386] Trial 161 pruned. 
[I 2026-03-12 00:56:11,450] Trial 162 pruned. 
[I 2026-03-12 00:56:11,495] Trial 163 finished with value: 0.0 and parameters: {'timeframe': 'M5', 'atr_period': 13, 'atr_threshold': 10.0, 'pt_mult': 1.0, 'sl_mult': 1.0, 'td_mins': 360}. Best is trial 113 with value: 1.783955378354149.
[I 2026-03-12 00:56:11,537] Trial 164 finished with value: 0.0 and parameters: {'timeframe': 'M5', 'atr_period': 13, 'atr_threshold': 5.0, 'pt_mult': 2.5, 'sl_mult': 1.0, 'td_mins': 720}. Best is trial 113 with value: 1.783955378354149.
[I 2026-03-12 00:56:12,589] Trial 165 pruned. 
[I 2026-03-12 00:56:14,010] Trial 166 pruned. 
[I 2026-03-12 00:56:14,055] Trial 167 finished with value: 0.0 and parameters: {'timeframe': 'M5', 'atr_period': 13, 'atr_threshold': 5.0, 'pt_mult': 2.5, 'sl_mult': 1.0, 'td_mins': 1080}. Best is trial 113 with value: 1.783955378354149.
[I 2026-03-12 00:56:15,017] Trial 168 finished with value: 1.0193713221095544 and parameters: {'timeframe': 'M5', 'atr_period': 13, 'atr_threshold': 3.0, 'pt_mult': 2.5, 'sl_mult': 2.5, 'td_mins': 720}. Best is trial 113 with value: 1.783955378354149.
[I 2026-03-12 00:56:15,702] Trial 169 pruned. 
[I 2026-03-12 00:56:15,756] Trial 170 finished with value: 0.0 and parameters: {'timeframe': 'M5', 'atr_period': 13, 'atr_threshold': 8.0, 'pt_mult': 0.5, 'sl_mult': 2.5, 'td_mins': 15}. Best is trial 113 with value: 1.783955378354149.
[I 2026-03-12 00:56:17,358] Trial 171 pruned. 
[I 2026-03-12 00:56:17,407] Trial 172 finished with value: 0.0 and parameters: {'timeframe': 'M5', 'atr_period': 13, 'atr_threshold': 8.0, 'pt_mult': 2.5, 'sl_mult': 5.0, 'td_mins': 5}. Best is trial 113 with value: 1.783955378354149.
[I 2026-03-12 00:56:17,602] Trial 173 pruned. 
[I 2026-03-12 00:56:17,649] Trial 174 finished with value: 0.0 and parameters: {'timeframe': 'M5', 'atr_period': 13, 'atr_threshold': 10.0, 'pt_mult': 2.5, 'sl_mult': 5.0, 'td_mins': 60}. Best is trial 113 with value: 1.783955378354149.
[I 2026-03-12 00:56:17,693] Trial 175 finished with value: 0.0 and parameters: {'timeframe': 'M5', 'atr_period': 13, 'atr_threshold': 15.0, 'pt_mult': 1.0, 'sl_mult': 1.0, 'td_mins': 15}. Best is trial 113 with value: 1.783955378354149.
[I 2026-03-12 00:56:17,737] Trial 176 finished with value: 0.0 and parameters: {'timeframe': 'M5', 'atr_period': 13, 'atr_threshold': 5.0, 'pt_mult': 5.0, 'sl_mult': 0.5, 'td_mins': 180}. Best is trial 113 with value: 1.783955378354149.
[I 2026-03-12 00:56:18,954] Trial 177 finished with value: 1.307219479864015 and parameters: {'timeframe': 'M5', 'atr_period': 13, 'atr_threshold': 2.0, 'pt_mult': 1.0, 'sl_mult': 5.0, 'td_mins': 360}. Best is trial 113 with value: 1.783955378354149.
[I 2026-03-12 00:56:19,203] Trial 178 finished with value: 1.0811325222704808 and parameters: {'timeframe': 'M5', 'atr_period': 13, 'atr_threshold': 3.0, 'pt_mult': 1.0, 'sl_mult': 1.0, 'td_mins': 180}. Best is trial 113 with value: 1.783955378354149.
[I 2026-03-12 00:56:19,346] Trial 179 pruned. 
[I 2026-03-12 00:56:21,961] Trial 180 pruned. 
[I 2026-03-12 00:56:22,080] Trial 181 finished with value: 1.2553471441195652 and parameters: {'timeframe': 'M5', 'atr_period': 13, 'atr_threshold': 3.0, 'pt_mult': 1.0, 'sl_mult': 5.0, 'td_mins': 15}. Best is trial 113 with value: 1.783955378354149.
[I 2026-03-12 00:56:23,705] Trial 182 pruned. 
[I 2026-03-12 00:56:23,991] Trial 183 finished with value: 1.055479354420579 and parameters: {'timeframe': 'M5', 'atr_period': 13, 'atr_threshold': 3.0, 'pt_mult': 1.0, 'sl_mult': 0.5, 'td_mins': 360}. Best is trial 113 with value: 1.783955378354149.
[I 2026-03-12 00:56:24,034] Trial 184 finished with value: 0.0 and parameters: {'timeframe': 'M5', 'atr_period': 13, 'atr_threshold': 15.0, 'pt_mult': 5.0, 'sl_mult': 5.0, 'td_mins': 15}. Best is trial 113 with value: 1.783955378354149.
[I 2026-03-12 00:56:24,098] Trial 185 pruned. 
[I 2026-03-12 00:56:24,212] Trial 186 pruned. 
[I 2026-03-12 00:56:24,256] Trial 187 finished with value: 0.0 and parameters: {'timeframe': 'M5', 'atr_period': 13, 'atr_threshold': 8.0, 'pt_mult': 0.5, 'sl_mult': 1.0, 'td_mins': 60}. Best is trial 113 with value: 1.783955378354149.
[I 2026-03-12 00:56:24,299] Trial 188 finished with value: 0.0 and parameters: {'timeframe': 'M5', 'atr_period': 13, 'atr_threshold': 15.0, 'pt_mult': 0.5, 'sl_mult': 0.5, 'td_mins': 60}. Best is trial 113 with value: 1.783955378354149.
[I 2026-03-12 00:56:24,341] Trial 189 finished with value: 0.0 and parameters: {'timeframe': 'M5', 'atr_period': 13, 'atr_threshold': 15.0, 'pt_mult': 1.0, 'sl_mult': 5.0, 'td_mins': 5}. Best is trial 113 with value: 1.783955378354149.
[I 2026-03-12 00:56:24,448] Trial 190 pruned. 
[I 2026-03-12 00:56:24,492] Trial 191 finished with value: 0.0 and parameters: {'timeframe': 'M5', 'atr_period': 13, 'atr_threshold': 8.0, 'pt_mult': 5.0, 'sl_mult': 1.0, 'td_mins': 30}. Best is trial 113 with value: 1.783955378354149.
[I 2026-03-12 00:56:24,555] Trial 192 pruned. 
[I 2026-03-12 00:56:24,598] Trial 193 finished with value: 0.0 and parameters: {'timeframe': 'M5', 'atr_period': 13, 'atr_threshold': 15.0, 'pt_mult': 1.0, 'sl_mult': 0.5, 'td_mins': 60}. Best is trial 113 with value: 1.783955378354149.
[I 2026-03-12 00:56:24,642] Trial 194 finished with value: 0.0 and parameters: {'timeframe': 'M5', 'atr_period': 13, 'atr_threshold': 15.0, 'pt_mult': 0.5, 'sl_mult': 5.0, 'td_mins': 360}. Best is trial 113 with value: 1.783955378354149.
[I 2026-03-12 00:56:24,725] Trial 195 pruned. 
[I 2026-03-12 00:56:24,834] Trial 196 pruned. 
[I 2026-03-12 00:56:25,135] Trial 197 pruned. 
[I 2026-03-12 00:56:25,178] Trial 198 finished with value: 0.0 and parameters: {'timeframe': 'M5', 'atr_period': 13, 'atr_threshold': 5.0, 'pt_mult': 1.0, 'sl_mult': 0.5, 'td_mins': 15}. Best is trial 113 with value: 1.783955378354149.
[I 2026-03-12 00:56:25,971] Trial 199 pruned. 
[I 2026-03-12 00:56:26,782] Trial 200 pruned. 
[I 2026-03-12 00:56:26,828] Trial 201 finished with value: 0.0 and parameters: {'timeframe': 'M5', 'atr_period': 13, 'atr_threshold': 5.0, 'pt_mult': 1.0, 'sl_mult': 2.5, 'td_mins': 360}. Best is trial 113 with value: 1.783955378354149.
[I 2026-03-12 00:56:26,876] Trial 202 finished with value: 0.0 and parameters: {'timeframe': 'M5', 'atr_period': 13, 'atr_threshold': 8.0, 'pt_mult': 1.0, 'sl_mult': 2.5, 'td_mins': 1080}. Best is trial 113 with value: 1.783955378354149.
[I 2026-03-12 00:56:26,920] Trial 203 finished with value: 0.0 and parameters: {'timeframe': 'M5', 'atr_period': 13, 'atr_threshold': 10.0, 'pt_mult': 5.0, 'sl_mult': 5.0, 'td_mins': 120}. Best is trial 113 with value: 1.783955378354149.
[I 2026-03-12 00:56:27,020] Trial 204 pruned. 
[I 2026-03-12 00:56:27,120] Trial 205 pruned. 
[I 2026-03-12 00:56:27,167] Trial 206 finished with value: 0.0 and parameters: {'timeframe': 'M5', 'atr_period': 13, 'atr_threshold': 10.0, 'pt_mult': 2.5, 'sl_mult': 5.0, 'td_mins': 15}. Best is trial 113 with value: 1.783955378354149.
[I 2026-03-12 00:56:27,265] Trial 207 pruned. 
[I 2026-03-12 00:56:27,310] Trial 208 finished with value: 0.0 and parameters: {'timeframe': 'M5', 'atr_period': 13, 'atr_threshold': 10.0, 'pt_mult': 5.0, 'sl_mult': 1.0, 'td_mins': 1080}. Best is trial 113 with value: 1.783955378354149.
[I 2026-03-12 00:56:27,718] Trial 209 pruned. 
[I 2026-03-12 00:56:27,760] Trial 210 finished with value: 0.0 and parameters: {'timeframe': 'M5', 'atr_period': 13, 'atr_threshold': 8.0, 'pt_mult': 2.5, 'sl_mult': 2.5, 'td_mins': 30}. Best is trial 113 with value: 1.783955378354149.
[I 2026-03-12 00:56:28,431] Trial 211 pruned. 
[I 2026-03-12 00:56:28,478] Trial 212 finished with value: 0.0 and parameters: {'timeframe': 'M5', 'atr_period': 13, 'atr_threshold': 15.0, 'pt_mult': 0.5, 'sl_mult': 2.5, 'td_mins': 60}. Best is trial 113 with value: 1.783955378354149.
[I 2026-03-12 00:56:28,527] Trial 213 finished with value: 0.0 and parameters: {'timeframe': 'M5', 'atr_period': 13, 'atr_threshold': 5.0, 'pt_mult': 1.0, 'sl_mult': 5.0, 'td_mins': 15}. Best is trial 113 with value: 1.783955378354149.
[I 2026-03-12 00:56:28,569] Trial 214 finished with value: 0.0 and parameters: {'timeframe': 'M5', 'atr_period': 13, 'atr_threshold': 5.0, 'pt_mult': 1.0, 'sl_mult': 1.0, 'td_mins': 5}. Best is trial 113 with value: 1.783955378354149.
[I 2026-03-12 00:56:30,380] Trial 215 pruned. 
[I 2026-03-12 00:56:30,491] Trial 216 pruned. 
[I 2026-03-12 00:56:30,535] Trial 217 finished with value: 0.0 and parameters: {'timeframe': 'M5', 'atr_period': 13, 'atr_threshold': 8.0, 'pt_mult': 2.5, 'sl_mult': 1.0, 'td_mins': 1200}. Best is trial 113 with value: 1.783955378354149.
[I 2026-03-12 00:56:30,578] Trial 218 finished with value: 0.0 and parameters: {'timeframe': 'M5', 'atr_period': 13, 'atr_threshold': 8.0, 'pt_mult': 2.5, 'sl_mult': 5.0, 'td_mins': 5}. Best is trial 113 with value: 1.783955378354149.
[I 2026-03-12 00:56:30,621] Trial 219 finished with value: 0.0 and parameters: {'timeframe': 'M5', 'atr_period': 13, 'atr_threshold': 10.0, 'pt_mult': 5.0, 'sl_mult': 1.0, 'td_mins': 180}. Best is trial 113 with value: 1.783955378354149.
[I 2026-03-12 00:56:30,795] Trial 220 pruned. 
[I 2026-03-12 00:56:31,292] Trial 221 pruned. 
[I 2026-03-12 00:56:31,341] Trial 222 finished with value: 0.0 and parameters: {'timeframe': 'M5', 'atr_period': 13, 'atr_threshold': 10.0, 'pt_mult': 1.0, 'sl_mult': 5.0, 'td_mins': 180}. Best is trial 113 with value: 1.783955378354149.
[I 2026-03-12 00:56:31,610] Trial 223 finished with value: 1.7694115243064128 and parameters: {'timeframe': 'M5', 'atr_period': 13, 'atr_threshold': 3.0, 'pt_mult': 0.5, 'sl_mult': 5.0, 'td_mins': 120}. Best is trial 113 with value: 1.783955378354149.
[I 2026-03-12 00:56:32,851] Trial 224 pruned. 
[I 2026-03-12 00:56:33,130] Trial 225 pruned. 
[I 2026-03-12 00:56:33,484] Trial 226 pruned. 
[I 2026-03-12 00:56:33,606] Trial 227 pruned. 
[I 2026-03-12 00:56:33,652] Trial 228 finished with value: 0.0 and parameters: {'timeframe': 'M5', 'atr_period': 13, 'atr_threshold': 15.0, 'pt_mult': 5.0, 'sl_mult': 2.5, 'td_mins': 30}. Best is trial 113 with value: 1.783955378354149.
[I 2026-03-12 00:56:33,695] Trial 229 finished with value: 0.0 and parameters: {'timeframe': 'M5', 'atr_period': 13, 'atr_threshold': 5.0, 'pt_mult': 5.0, 'sl_mult': 0.5, 'td_mins': 1080}. Best is trial 113 with value: 1.783955378354149.
[I 2026-03-12 00:56:36,242] Trial 230 finished with value: 1.1693038798602762 and parameters: {'timeframe': 'M5', 'atr_period': 13, 'atr_threshold': 1.0, 'pt_mult': 1.0, 'sl_mult': 5.0, 'td_mins': 360}. Best is trial 113 with value: 1.783955378354149.
[I 2026-03-12 00:56:36,291] Trial 231 finished with value: 0.0 and parameters: {'timeframe': 'M5', 'atr_period': 13, 'atr_threshold': 8.0, 'pt_mult': 0.5, 'sl_mult': 2.5, 'td_mins': 5}. Best is trial 113 with value: 1.783955378354149.
[I 2026-03-12 00:56:36,337] Trial 232 finished with value: 0.0 and parameters: {'timeframe': 'M5', 'atr_period': 13, 'atr_threshold': 10.0, 'pt_mult': 2.5, 'sl_mult': 0.5, 'td_mins': 120}. Best is trial 113 with value: 1.783955378354149.
[I 2026-03-12 00:56:36,648] Trial 233 pruned. 
[I 2026-03-12 00:56:36,692] Trial 234 finished with value: 0.0 and parameters: {'timeframe': 'M5', 'atr_period': 13, 'atr_threshold': 10.0, 'pt_mult': 1.0, 'sl_mult': 0.5, 'td_mins': 1200}. Best is trial 113 with value: 1.783955378354149.
[I 2026-03-12 00:56:37,767] Trial 235 finished with value: 1.3836490848479914 and parameters: {'timeframe': 'M5', 'atr_period': 13, 'atr_threshold': 1.0, 'pt_mult': 0.5, 'sl_mult': 5.0, 'td_mins': 120}. Best is trial 113 with value: 1.783955378354149.
[I 2026-03-12 00:56:37,812] Trial 236 finished with value: 0.0 and parameters: {'timeframe': 'M5', 'atr_period': 13, 'atr_threshold': 8.0, 'pt_mult': 2.5, 'sl_mult': 0.5, 'td_mins': 1200}. Best is trial 113 with value: 1.783955378354149.
[I 2026-03-12 00:56:37,858] Trial 237 finished with value: 0.0 and parameters: {'timeframe': 'M5', 'atr_period': 13, 'atr_threshold': 15.0, 'pt_mult': 1.0, 'sl_mult': 2.5, 'td_mins': 60}. Best is trial 113 with value: 1.783955378354149.
[I 2026-03-12 00:56:38,205] Trial 238 pruned. 
[I 2026-03-12 00:56:38,249] Trial 239 finished with value: 0.0 and parameters: {'timeframe': 'M5', 'atr_period': 13, 'atr_threshold': 10.0, 'pt_mult': 1.0, 'sl_mult': 0.5, 'td_mins': 60}. Best is trial 113 with value: 1.783955378354149.
[I 2026-03-12 00:56:38,296] Trial 240 finished with value: 0.0 and parameters: {'timeframe': 'M5', 'atr_period': 13, 'atr_threshold': 15.0, 'pt_mult': 0.5, 'sl_mult': 0.5, 'td_mins': 720}. Best is trial 113 with value: 1.783955378354149.
[I 2026-03-12 00:56:38,545] Trial 241 pruned. 
[I 2026-03-12 00:56:38,646] Trial 242 pruned. 
