[I 2026-03-12 00:43:02,907] Trial 312 finished with value: 1.094956881706024 and parameters: {'timeframe': 'M1', 'atr_period': 13, 'atr_threshold': 2.0, 'pt_mult': 2.5, 'sl_mult': 0.5, 'td_mins': 120}. Best is trial 32 with value: 1.7165018600651565.
[I 2026-03-12 00:43:03,256] Trial 313 finished with value: 1.094956881706024 and parameters: {'timeframe': 'M1', 'atr_period': 13, 'atr_threshold': 2.0, 'pt_mult': 2.5, 'sl_mult': 0.5, 'td_mins': 120}. Best is trial 32 with value: 1.7165018600651565.
[I 2026-03-12 00:43:03,615] Trial 314 finished with value: 1.094956881706024 and parameters: {'timeframe': 'M1', 'atr_period': 13, 'atr_threshold': 2.0, 'pt_mult': 2.5, 'sl_mult': 0.5, 'td_mins': 120}. Best is trial 32 with value: 1.7165018600651565.
[I 2026-03-12 00:43:03,939] Trial 315 finished with value: 1.094956881706024 and parameters: {'timeframe': 'M1', 'atr_period': 13, 'atr_threshold': 2.0, 'pt_mult': 2.5, 'sl_mult': 0.5, 'td_mins': 120}. Best is trial 32 with value: 1.7165018600651565.
[I 2026-03-12 00:43:04,247] Trial 316 finished with value: 1.094956881706024 and parameters: {'timeframe': 'M1', 'atr_period': 13, 'atr_threshold': 2.0, 'pt_mult': 2.5, 'sl_mult': 0.5, 'td_mins': 120}. Best is trial 32 with value: 1.7165018600651565.
[I 2026-03-12 00:43:04,596] Trial 317 finished with value: 1.094956881706024 and parameters: {'timeframe': 'M1', 'atr_period': 13, 'atr_threshold': 2.0, 'pt_mult': 2.5, 'sl_mult': 0.5, 'td_mins': 120}. Best is trial 32 with value: 1.7165018600651565.
[I 2026-03-12 00:43:04,942] Trial 318 finished with value: 1.094956881706024 and parameters: {'timeframe': 'M1', 'atr_period': 13, 'atr_threshold': 2.0, 'pt_mult': 2.5, 'sl_mult': 0.5, 'td_mins': 120}. Best is trial 32 with value: 1.7165018600651565.
[I 2026-03-12 00:43:05,256] Trial 319 finished with value: 1.094956881706024 and parameters: {'timeframe': 'M1', 'atr_period': 13, 'atr_threshold': 2.0, 'pt_mult': 2.5, 'sl_mult': 0.5, 'td_mins': 120}. Best is trial 32 with value: 1.7165018600651565.
[I 2026-03-12 00:43:05,587] Trial 320 finished with value: 1.094956881706024 and parameters: {'timeframe': 'M1', 'atr_period': 13, 'atr_threshold': 2.0, 'pt_mult': 2.5, 'sl_mult': 0.5, 'td_mins': 120}. Best is trial 32 with value: 1.7165018600651565.
[I 2026-03-12 00:43:05,687] Trial 321 finished with value: 1.7165018600651565 and parameters: {'timeframe': 'M1', 'atr_period': 13, 'atr_threshold': 2.0, 'pt_mult': 1.0, 'sl_mult': 5.0, 'td_mins': 5}. Best is trial 32 with value: 1.7165018600651565.
[I 2026-03-12 00:43:05,873] Trial 322 finished with value: 1.1884118997438728 and parameters: {'timeframe': 'M1', 'atr_period': 13, 'atr_threshold': 2.0, 'pt_mult': 0.5, 'sl_mult': 5.0, 'td_mins': 30}. Best is trial 32 with value: 1.7165018600651565.
[I 2026-03-12 00:43:06,052] Trial 323 finished with value: 1.1884118997438728 and parameters: {'timeframe': 'M1', 'atr_period': 13, 'atr_threshold': 2.0, 'pt_mult': 0.5, 'sl_mult': 5.0, 'td_mins': 30}. Best is trial 32 with value: 1.7165018600651565.
[I 2026-03-12 00:43:06,230] Trial 324 finished with value: 1.1884118997438728 and parameters: {'timeframe': 'M1', 'atr_period': 13, 'atr_threshold': 2.0, 'pt_mult': 0.5, 'sl_mult': 5.0, 'td_mins': 30}. Best is trial 32 with value: 1.7165018600651565.
[I 2026-03-12 00:43:06,411] Trial 325 finished with value: 1.1884118997438728 and parameters: {'timeframe': 'M1', 'atr_period': 13, 'atr_threshold': 2.0, 'pt_mult': 0.5, 'sl_mult': 5.0, 'td_mins': 30}. Best is trial 32 with value: 1.7165018600651565.
[I 2026-03-12 00:43:06,596] Trial 326 finished with value: 1.1884118997438728 and parameters: {'timeframe': 'M1', 'atr_period': 13, 'atr_threshold': 2.0, 'pt_mult': 0.5, 'sl_mult': 5.0, 'td_mins': 30}. Best is trial 32 with value: 1.7165018600651565.
[I 2026-03-12 00:43:06,824] Trial 327 finished with value: 1.1884118997438728 and parameters: {'timeframe': 'M1', 'atr_period': 13, 'atr_threshold': 2.0, 'pt_mult': 0.5, 'sl_mult': 5.0, 'td_mins': 30}. Best is trial 32 with value: 1.7165018600651565.
[I 2026-03-12 00:43:07,005] Trial 328 finished with value: 1.1884118997438728 and parameters: {'timeframe': 'M1', 'atr_period': 13, 'atr_threshold': 2.0, 'pt_mult': 0.5, 'sl_mult': 5.0, 'td_mins': 30}. Best is trial 32 with value: 1.7165018600651565.
[I 2026-03-12 00:43:07,183] Trial 329 finished with value: 1.1884118997438728 and parameters: {'timeframe': 'M1', 'atr_period': 13, 'atr_threshold': 2.0, 'pt_mult': 0.5, 'sl_mult': 5.0, 'td_mins': 30}. Best is trial 32 with value: 1.7165018600651565.
[I 2026-03-12 00:43:07,378] Trial 330 finished with value: 1.1884118997438728 and parameters: {'timeframe': 'M1', 'atr_period': 13, 'atr_threshold': 2.0, 'pt_mult': 0.5, 'sl_mult': 5.0, 'td_mins': 30}. Best is trial 32 with value: 1.7165018600651565.
[I 2026-03-12 00:43:07,562] Trial 331 finished with value: 1.1884118997438728 and parameters: {'timeframe': 'M1', 'atr_period': 13, 'atr_threshold': 2.0, 'pt_mult': 0.5, 'sl_mult': 5.0, 'td_mins': 30}. Best is trial 32 with value: 1.7165018600651565.
[I 2026-03-12 00:43:07,744] Trial 332 finished with value: 1.1884118997438728 and parameters: {'timeframe': 'M1', 'atr_period': 13, 'atr_threshold': 2.0, 'pt_mult': 0.5, 'sl_mult': 5.0, 'td_mins': 30}. Best is trial 32 with value: 1.7165018600651565.
[I 2026-03-12 00:43:07,927] Trial 333 finished with value: 1.1884118997438728 and parameters: {'timeframe': 'M1', 'atr_period': 13, 'atr_threshold': 2.0, 'pt_mult': 0.5, 'sl_mult': 5.0, 'td_mins': 30}. Best is trial 32 with value: 1.7165018600651565.
[I 2026-03-12 00:43:08,109] Trial 334 finished with value: 1.1884118997438728 and parameters: {'timeframe': 'M1', 'atr_period': 13, 'atr_threshold': 2.0, 'pt_mult': 0.5, 'sl_mult': 5.0, 'td_mins': 30}. Best is trial 32 with value: 1.7165018600651565.
[I 2026-03-12 00:43:08,289] Trial 335 finished with value: 1.1884118997438728 and parameters: {'timeframe': 'M1', 'atr_period': 13, 'atr_threshold': 2.0, 'pt_mult': 0.5, 'sl_mult': 5.0, 'td_mins': 30}. Best is trial 32 with value: 1.7165018600651565.
[I 2026-03-12 00:43:08,471] Trial 336 finished with value: 1.1884118997438728 and parameters: {'timeframe': 'M1', 'atr_period': 13, 'atr_threshold': 2.0, 'pt_mult': 0.5, 'sl_mult': 5.0, 'td_mins': 30}. Best is trial 32 with value: 1.7165018600651565.
[I 2026-03-12 00:43:08,655] Trial 337 finished with value: 1.1884118997438728 and parameters: {'timeframe': 'M1', 'atr_period': 13, 'atr_threshold': 2.0, 'pt_mult': 0.5, 'sl_mult': 5.0, 'td_mins': 30}. Best is trial 32 with value: 1.7165018600651565.
[I 2026-03-12 00:43:08,837] Trial 338 finished with value: 1.1884118997438728 and parameters: {'timeframe': 'M1', 'atr_period': 13, 'atr_threshold': 2.0, 'pt_mult': 0.5, 'sl_mult': 5.0, 'td_mins': 30}. Best is trial 32 with value: 1.7165018600651565.
[I 2026-03-12 00:43:09,017] Trial 339 finished with value: 1.1884118997438728 and parameters: {'timeframe': 'M1', 'atr_period': 13, 'atr_threshold': 2.0, 'pt_mult': 0.5, 'sl_mult': 5.0, 'td_mins': 30}. Best is trial 32 with value: 1.7165018600651565.
[I 2026-03-12 00:43:09,207] Trial 340 finished with value: 1.1884118997438728 and parameters: {'timeframe': 'M1', 'atr_period': 13, 'atr_threshold': 2.0, 'pt_mult': 0.5, 'sl_mult': 5.0, 'td_mins': 30}. Best is trial 32 with value: 1.7165018600651565.
[I 2026-03-12 00:43:09,296] Trial 341 finished with value: 1.7165018600651565 and parameters: {'timeframe': 'M1', 'atr_period': 13, 'atr_threshold': 2.0, 'pt_mult': 1.0, 'sl_mult': 5.0, 'td_mins': 5}. Best is trial 32 with value: 1.7165018600651565.
[I 2026-03-12 00:43:09,390] Trial 342 finished with value: 1.7165018600651565 and parameters: {'timeframe': 'M1', 'atr_period': 13, 'atr_threshold': 2.0, 'pt_mult': 1.0, 'sl_mult': 5.0, 'td_mins': 5}. Best is trial 32 with value: 1.7165018600651565.
[I 2026-03-12 00:43:09,480] Trial 343 finished with value: 1.7165018600651565 and parameters: {'timeframe': 'M1', 'atr_period': 13, 'atr_threshold': 2.0, 'pt_mult': 1.0, 'sl_mult': 5.0, 'td_mins': 5}. Best is trial 32 with value: 1.7165018600651565.
[I 2026-03-12 00:43:09,572] Trial 344 finished with value: 1.7165018600651565 and parameters: {'timeframe': 'M1', 'atr_period': 13, 'atr_threshold': 2.0, 'pt_mult': 1.0, 'sl_mult': 5.0, 'td_mins': 5}. Best is trial 32 with value: 1.7165018600651565.
[I 2026-03-12 00:43:09,663] Trial 345 finished with value: 1.7165018600651565 and parameters: {'timeframe': 'M1', 'atr_period': 13, 'atr_threshold': 2.0, 'pt_mult': 1.0, 'sl_mult': 5.0, 'td_mins': 5}. Best is trial 32 with value: 1.7165018600651565.
[I 2026-03-12 00:43:09,753] Trial 346 finished with value: 1.7165018600651565 and parameters: {'timeframe': 'M1', 'atr_period': 13, 'atr_threshold': 2.0, 'pt_mult': 1.0, 'sl_mult': 5.0, 'td_mins': 5}. Best is trial 32 with value: 1.7165018600651565.
[I 2026-03-12 00:43:09,838] Trial 347 finished with value: 1.7165018600651565 and parameters: {'timeframe': 'M1', 'atr_period': 13, 'atr_threshold': 2.0, 'pt_mult': 1.0, 'sl_mult': 5.0, 'td_mins': 5}. Best is trial 32 with value: 1.7165018600651565.
[I 2026-03-12 00:43:09,927] Trial 348 finished with value: 1.7165018600651565 and parameters: {'timeframe': 'M1', 'atr_period': 13, 'atr_threshold': 2.0, 'pt_mult': 1.0, 'sl_mult': 5.0, 'td_mins': 5}. Best is trial 32 with value: 1.7165018600651565.
[I 2026-03-12 00:43:10,016] Trial 349 finished with value: 1.7165018600651565 and parameters: {'timeframe': 'M1', 'atr_period': 13, 'atr_threshold': 2.0, 'pt_mult': 1.0, 'sl_mult': 5.0, 'td_mins': 5}. Best is trial 32 with value: 1.7165018600651565.
[I 2026-03-12 00:43:10,103] Trial 350 finished with value: 1.7165018600651565 and parameters: {'timeframe': 'M1', 'atr_period': 13, 'atr_threshold': 2.0, 'pt_mult': 1.0, 'sl_mult': 5.0, 'td_mins': 5}. Best is trial 32 with value: 1.7165018600651565.
[I 2026-03-12 00:43:10,208] Trial 351 finished with value: 1.7165018600651565 and parameters: {'timeframe': 'M1', 'atr_period': 13, 'atr_threshold': 2.0, 'pt_mult': 1.0, 'sl_mult': 5.0, 'td_mins': 5}. Best is trial 32 with value: 1.7165018600651565.
[I 2026-03-12 00:43:10,319] Trial 352 finished with value: 1.7165018600651565 and parameters: {'timeframe': 'M1', 'atr_period': 13, 'atr_threshold': 2.0, 'pt_mult': 1.0, 'sl_mult': 5.0, 'td_mins': 5}. Best is trial 32 with value: 1.7165018600651565.
[I 2026-03-12 00:43:10,421] Trial 353 finished with value: 1.7165018600651565 and parameters: {'timeframe': 'M1', 'atr_period': 13, 'atr_threshold': 2.0, 'pt_mult': 1.0, 'sl_mult': 5.0, 'td_mins': 5}. Best is trial 32 with value: 1.7165018600651565.
[I 2026-03-12 00:43:10,531] Trial 354 finished with value: 1.7165018600651565 and parameters: {'timeframe': 'M1', 'atr_period': 13, 'atr_threshold': 2.0, 'pt_mult': 1.0, 'sl_mult': 5.0, 'td_mins': 5}. Best is trial 32 with value: 1.7165018600651565.
[I 2026-03-12 00:43:10,622] Trial 355 finished with value: 1.7165018600651565 and parameters: {'timeframe': 'M1', 'atr_period': 13, 'atr_threshold': 2.0, 'pt_mult': 1.0, 'sl_mult': 5.0, 'td_mins': 5}. Best is trial 32 with value: 1.7165018600651565.
[I 2026-03-12 00:43:10,715] Trial 356 finished with value: 1.7165018600651565 and parameters: {'timeframe': 'M1', 'atr_period': 13, 'atr_threshold': 2.0, 'pt_mult': 1.0, 'sl_mult': 5.0, 'td_mins': 5}. Best is trial 32 with value: 1.7165018600651565.
[I 2026-03-12 00:43:10,801] Trial 357 finished with value: 1.7165018600651565 and parameters: {'timeframe': 'M1', 'atr_period': 13, 'atr_threshold': 2.0, 'pt_mult': 1.0, 'sl_mult': 5.0, 'td_mins': 5}. Best is trial 32 with value: 1.7165018600651565.
[I 2026-03-12 00:43:10,888] Trial 358 finished with value: 1.7165018600651565 and parameters: {'timeframe': 'M1', 'atr_period': 13, 'atr_threshold': 2.0, 'pt_mult': 1.0, 'sl_mult': 5.0, 'td_mins': 5}. Best is trial 32 with value: 1.7165018600651565.
[I 2026-03-12 00:43:10,974] Trial 359 finished with value: 1.7165018600651565 and parameters: {'timeframe': 'M1', 'atr_period': 13, 'atr_threshold': 2.0, 'pt_mult': 1.0, 'sl_mult': 5.0, 'td_mins': 5}. Best is trial 32 with value: 1.7165018600651565.
[I 2026-03-12 00:43:11,062] Trial 360 finished with value: 1.7165018600651565 and parameters: {'timeframe': 'M1', 'atr_period': 13, 'atr_threshold': 2.0, 'pt_mult': 1.0, 'sl_mult': 5.0, 'td_mins': 5}. Best is trial 32 with value: 1.7165018600651565.
[I 2026-03-12 00:43:11,151] Trial 361 finished with value: 1.7165018600651565 and parameters: {'timeframe': 'M1', 'atr_period': 13, 'atr_threshold': 2.0, 'pt_mult': 1.0, 'sl_mult': 5.0, 'td_mins': 5}. Best is trial 32 with value: 1.7165018600651565.
[I 2026-03-12 00:43:11,242] Trial 362 finished with value: 1.7165018600651565 and parameters: {'timeframe': 'M1', 'atr_period': 13, 'atr_threshold': 2.0, 'pt_mult': 1.0, 'sl_mult': 5.0, 'td_mins': 5}. Best is trial 32 with value: 1.7165018600651565.
[I 2026-03-12 00:43:11,330] Trial 363 finished with value: 1.7165018600651565 and parameters: {'timeframe': 'M1', 'atr_period': 13, 'atr_threshold': 2.0, 'pt_mult': 1.0, 'sl_mult': 5.0, 'td_mins': 5}. Best is trial 32 with value: 1.7165018600651565.
[I 2026-03-12 00:43:12,944] Trial 364 finished with value: 0.9507615277386618 and parameters: {'timeframe': 'M1', 'atr_period': 13, 'atr_threshold': 2.0, 'pt_mult': 1.0, 'sl_mult': 5.0, 'td_mins': 1200}. Best is trial 32 with value: 1.7165018600651565.
[I 2026-03-12 00:43:12,997] Trial 365 pruned. 
[I 2026-03-12 00:43:13,047] Trial 366 finished with value: 0.0 and parameters: {'timeframe': 'M1', 'atr_period': 13, 'atr_threshold': 8.0, 'pt_mult': 1.0, 'sl_mult': 5.0, 'td_mins': 5}. Best is trial 32 with value: 1.7165018600651565.
[I 2026-03-12 00:43:13,098] Trial 367 pruned. 
[I 2026-03-12 00:43:13,149] Trial 368 pruned. 
[I 2026-03-12 00:43:13,201] Trial 369 pruned. 
[I 2026-03-12 00:43:13,606] Trial 370 finished with value: 1.0159756537053202 and parameters: {'timeframe': 'M1', 'atr_period': 13, 'atr_threshold': 2.0, 'pt_mult': 1.0, 'sl_mult': 5.0, 'td_mins': 120}. Best is trial 32 with value: 1.7165018600651565.
[I 2026-03-12 00:43:15,046] Trial 371 finished with value: 0.9507615277386618 and parameters: {'timeframe': 'M1', 'atr_period': 13, 'atr_threshold': 2.0, 'pt_mult': 1.0, 'sl_mult': 5.0, 'td_mins': 1080}. Best is trial 32 with value: 1.7165018600651565.
[I 2026-03-12 00:43:15,099] Trial 372 pruned. 
[I 2026-03-12 00:43:15,154] Trial 373 finished with value: 0.0 and parameters: {'timeframe': 'M1', 'atr_period': 13, 'atr_threshold': 3.0, 'pt_mult': 1.0, 'sl_mult': 5.0, 'td_mins': 5}. Best is trial 32 with value: 1.7165018600651565.
[I 2026-03-12 00:43:15,316] Trial 374 finished with value: 1.778026240865349 and parameters: {'timeframe': 'M1', 'atr_period': 13, 'atr_threshold': 2.0, 'pt_mult': 1.0, 'sl_mult': 5.0, 'td_mins': 15}. Best is trial 374 with value: 1.778026240865349.
[I 2026-03-12 00:43:15,479] Trial 375 finished with value: 1.778026240865349 and parameters: {'timeframe': 'M1', 'atr_period': 13, 'atr_threshold': 2.0, 'pt_mult': 1.0, 'sl_mult': 5.0, 'td_mins': 15}. Best is trial 374 with value: 1.778026240865349.
[I 2026-03-12 00:43:15,643] Trial 376 finished with value: 1.778026240865349 and parameters: {'timeframe': 'M1', 'atr_period': 13, 'atr_threshold': 2.0, 'pt_mult': 1.0, 'sl_mult': 5.0, 'td_mins': 15}. Best is trial 374 with value: 1.778026240865349.
[I 2026-03-12 00:43:15,776] Trial 377 finished with value: 1.778026240865349 and parameters: {'timeframe': 'M1', 'atr_period': 13, 'atr_threshold': 2.0, 'pt_mult': 1.0, 'sl_mult': 5.0, 'td_mins': 15}. Best is trial 374 with value: 1.778026240865349.
[I 2026-03-12 00:43:15,912] Trial 378 finished with value: 1.778026240865349 and parameters: {'timeframe': 'M1', 'atr_period': 13, 'atr_threshold': 2.0, 'pt_mult': 1.0, 'sl_mult': 5.0, 'td_mins': 15}. Best is trial 374 with value: 1.778026240865349.
[I 2026-03-12 00:43:16,090] Trial 379 finished with value: 1.778026240865349 and parameters: {'timeframe': 'M1', 'atr_period': 13, 'atr_threshold': 2.0, 'pt_mult': 1.0, 'sl_mult': 5.0, 'td_mins': 15}. Best is trial 374 with value: 1.778026240865349.
[I 2026-03-12 00:43:16,220] Trial 380 finished with value: 1.778026240865349 and parameters: {'timeframe': 'M1', 'atr_period': 13, 'atr_threshold': 2.0, 'pt_mult': 1.0, 'sl_mult': 5.0, 'td_mins': 15}. Best is trial 374 with value: 1.778026240865349.
[I 2026-03-12 00:43:16,351] Trial 381 finished with value: 1.778026240865349 and parameters: {'timeframe': 'M1', 'atr_period': 13, 'atr_threshold': 2.0, 'pt_mult': 1.0, 'sl_mult': 5.0, 'td_mins': 15}. Best is trial 374 with value: 1.778026240865349.
[I 2026-03-12 00:43:16,482] Trial 382 finished with value: 1.778026240865349 and parameters: {'timeframe': 'M1', 'atr_period': 13, 'atr_threshold': 2.0, 'pt_mult': 1.0, 'sl_mult': 5.0, 'td_mins': 15}. Best is trial 374 with value: 1.778026240865349.
[I 2026-03-12 00:43:16,613] Trial 383 finished with value: 1.778026240865349 and parameters: {'timeframe': 'M1', 'atr_period': 13, 'atr_threshold': 2.0, 'pt_mult': 1.0, 'sl_mult': 5.0, 'td_mins': 15}. Best is trial 374 with value: 1.778026240865349.
[I 2026-03-12 00:43:16,748] Trial 384 finished with value: 1.778026240865349 and parameters: {'timeframe': 'M1', 'atr_period': 13, 'atr_threshold': 2.0, 'pt_mult': 1.0, 'sl_mult': 5.0, 'td_mins': 15}. Best is trial 374 with value: 1.778026240865349.
[I 2026-03-12 00:43:16,892] Trial 385 finished with value: 1.778026240865349 and parameters: {'timeframe': 'M1', 'atr_period': 13, 'atr_threshold': 2.0, 'pt_mult': 1.0, 'sl_mult': 5.0, 'td_mins': 15}. Best is trial 374 with value: 1.778026240865349.
[I 2026-03-12 00:43:17,028] Trial 386 finished with value: 1.778026240865349 and parameters: {'timeframe': 'M1', 'atr_period': 13, 'atr_threshold': 2.0, 'pt_mult': 1.0, 'sl_mult': 5.0, 'td_mins': 15}. Best is trial 374 with value: 1.778026240865349.
[I 2026-03-12 00:43:17,159] Trial 387 finished with value: 1.778026240865349 and parameters: {'timeframe': 'M1', 'atr_period': 13, 'atr_threshold': 2.0, 'pt_mult': 1.0, 'sl_mult': 5.0, 'td_mins': 15}. Best is trial 374 with value: 1.778026240865349.
[I 2026-03-12 00:43:17,294] Trial 388 finished with value: 1.778026240865349 and parameters: {'timeframe': 'M1', 'atr_period': 13, 'atr_threshold': 2.0, 'pt_mult': 1.0, 'sl_mult': 5.0, 'td_mins': 15}. Best is trial 374 with value: 1.778026240865349.
[I 2026-03-12 00:43:17,425] Trial 389 finished with value: 1.778026240865349 and parameters: {'timeframe': 'M1', 'atr_period': 13, 'atr_threshold': 2.0, 'pt_mult': 1.0, 'sl_mult': 5.0, 'td_mins': 15}. Best is trial 374 with value: 1.778026240865349.
[I 2026-03-12 00:43:17,555] Trial 390 finished with value: 1.778026240865349 and parameters: {'timeframe': 'M1', 'atr_period': 13, 'atr_threshold': 2.0, 'pt_mult': 1.0, 'sl_mult': 5.0, 'td_mins': 15}. Best is trial 374 with value: 1.778026240865349.
[I 2026-03-12 00:43:17,694] Trial 391 finished with value: 1.778026240865349 and parameters: {'timeframe': 'M1', 'atr_period': 13, 'atr_threshold': 2.0, 'pt_mult': 1.0, 'sl_mult': 5.0, 'td_mins': 15}. Best is trial 374 with value: 1.778026240865349.
[I 2026-03-12 00:43:17,827] Trial 392 finished with value: 1.778026240865349 and parameters: {'timeframe': 'M1', 'atr_period': 13, 'atr_threshold': 2.0, 'pt_mult': 1.0, 'sl_mult': 5.0, 'td_mins': 15}. Best is trial 374 with value: 1.778026240865349.
[I 2026-03-12 00:43:17,957] Trial 393 finished with value: 1.778026240865349 and parameters: {'timeframe': 'M1', 'atr_period': 13, 'atr_threshold': 2.0, 'pt_mult': 1.0, 'sl_mult': 5.0, 'td_mins': 15}. Best is trial 374 with value: 1.778026240865349.
[I 2026-03-12 00:43:18,091] Trial 394 finished with value: 1.778026240865349 and parameters: {'timeframe': 'M1', 'atr_period': 13, 'atr_threshold': 2.0, 'pt_mult': 1.0, 'sl_mult': 5.0, 'td_mins': 15}. Best is trial 374 with value: 1.778026240865349.
[I 2026-03-12 00:43:18,220] Trial 395 finished with value: 1.778026240865349 and parameters: {'timeframe': 'M1', 'atr_period': 13, 'atr_threshold': 2.0, 'pt_mult': 1.0, 'sl_mult': 5.0, 'td_mins': 15}. Best is trial 374 with value: 1.778026240865349.
[I 2026-03-12 00:43:18,355] Trial 396 finished with value: 1.778026240865349 and parameters: {'timeframe': 'M1', 'atr_period': 13, 'atr_threshold': 2.0, 'pt_mult': 1.0, 'sl_mult': 5.0, 'td_mins': 15}. Best is trial 374 with value: 1.778026240865349.
[I 2026-03-12 00:43:18,487] Trial 397 finished with value: 1.778026240865349 and parameters: {'timeframe': 'M1', 'atr_period': 13, 'atr_threshold': 2.0, 'pt_mult': 1.0, 'sl_mult': 5.0, 'td_mins': 15}. Best is trial 374 with value: 1.778026240865349.
[I 2026-03-12 00:43:18,621] Trial 398 finished with value: 1.778026240865349 and parameters: {'timeframe': 'M1', 'atr_period': 13, 'atr_threshold': 2.0, 'pt_mult': 1.0, 'sl_mult': 5.0, 'td_mins': 15}. Best is trial 374 with value: 1.778026240865349.
[I 2026-03-12 00:43:18,753] Trial 399 finished with value: 1.778026240865349 and parameters: {'timeframe': 'M1', 'atr_period': 13, 'atr_threshold': 2.0, 'pt_mult': 1.0, 'sl_mult': 5.0, 'td_mins': 15}. Best is trial 374 with value: 1.778026240865349.
[I 2026-03-12 00:43:18,890] Trial 400 finished with value: 1.1825108596082887 and parameters: {'timeframe': 'M1', 'atr_period': 13, 'atr_threshold': 2.0, 'pt_mult': 2.5, 'sl_mult': 5.0, 'td_mins': 15}. Best is trial 374 with value: 1.778026240865349.
[I 2026-03-12 00:43:19,129] Trial 401 pruned. 
[I 2026-03-12 00:43:19,265] Trial 402 finished with value: 1.778026240865349 and parameters: {'timeframe': 'M1', 'atr_period': 13, 'atr_threshold': 2.0, 'pt_mult': 1.0, 'sl_mult': 5.0, 'td_mins': 15}. Best is trial 374 with value: 1.778026240865349.
[I 2026-03-12 00:43:19,318] Trial 403 pruned. 
[I 2026-03-12 00:43:19,375] Trial 404 pruned. 
[I 2026-03-12 00:43:19,508] Trial 405 finished with value: 1.7544910219295822 and parameters: {'timeframe': 'M1', 'atr_period': 13, 'atr_threshold': 2.0, 'pt_mult': 0.5, 'sl_mult': 5.0, 'td_mins': 15}. Best is trial 374 with value: 1.778026240865349.
