[I 2026-03-12 00:50:47,311] Trial 572 finished with value: 0.0 and parameters: {'timeframe': 'M3', 'atr_period': 13, 'atr_threshold': 15.0, 'pt_mult': 0.5, 'sl_mult': 5.0, 'td_mins': 360}. Best is trial 226 with value: 2.6610758639085312.
[I 2026-03-12 00:50:47,435] Trial 573 pruned. 
[I 2026-03-12 00:50:47,590] Trial 574 pruned. 
[I 2026-03-12 00:50:47,640] Trial 575 pruned. 
[I 2026-03-12 00:50:47,761] Trial 576 pruned. 
[I 2026-03-12 00:50:47,859] Trial 577 pruned. 
[I 2026-03-12 00:50:47,978] Trial 578 finished with value: 2.6610758639085312 and parameters: {'timeframe': 'M3', 'atr_period': 13, 'atr_threshold': 3.0, 'pt_mult': 0.5, 'sl_mult': 5.0, 'td_mins': 30}. Best is trial 226 with value: 2.6610758639085312.
[I 2026-03-12 00:50:48,580] Trial 579 pruned. 
[I 2026-03-12 00:50:48,631] Trial 580 finished with value: 0.0 and parameters: {'timeframe': 'M3', 'atr_period': 13, 'atr_threshold': 8.0, 'pt_mult': 0.5, 'sl_mult': 5.0, 'td_mins': 180}. Best is trial 226 with value: 2.6610758639085312.
[I 2026-03-12 00:50:48,700] Trial 581 pruned. 
[I 2026-03-12 00:50:48,940] Trial 582 pruned. 
[I 2026-03-12 00:50:48,987] Trial 583 finished with value: 0.0 and parameters: {'timeframe': 'M3', 'atr_period': 13, 'atr_threshold': 10.0, 'pt_mult': 1.0, 'sl_mult': 2.5, 'td_mins': 30}. Best is trial 226 with value: 2.6610758639085312.
[I 2026-03-12 00:50:49,037] Trial 584 finished with value: 0.0 and parameters: {'timeframe': 'M3', 'atr_period': 13, 'atr_threshold': 15.0, 'pt_mult': 1.0, 'sl_mult': 5.0, 'td_mins': 30}. Best is trial 226 with value: 2.6610758639085312.
[I 2026-03-12 00:50:49,210] Trial 585 finished with value: 2.4718369634519943 and parameters: {'timeframe': 'M3', 'atr_period': 13, 'atr_threshold': 3.0, 'pt_mult': 0.5, 'sl_mult': 5.0, 'td_mins': 60}. Best is trial 226 with value: 2.6610758639085312.
[I 2026-03-12 00:50:49,320] Trial 586 pruned. 
[I 2026-03-12 00:50:49,599] Trial 587 finished with value: 1.6877263821705335 and parameters: {'timeframe': 'M3', 'atr_period': 13, 'atr_threshold': 3.0, 'pt_mult': 2.5, 'sl_mult': 5.0, 'td_mins': 120}. Best is trial 226 with value: 2.6610758639085312.
[I 2026-03-12 00:50:49,663] Trial 588 pruned. 
[I 2026-03-12 00:50:49,718] Trial 589 pruned. 
[I 2026-03-12 00:50:49,772] Trial 590 pruned. 
[I 2026-03-12 00:50:49,838] Trial 591 pruned. 
[I 2026-03-12 00:50:49,925] Trial 592 pruned. 
[I 2026-03-12 00:50:49,983] Trial 593 pruned. 
[I 2026-03-12 00:50:50,032] Trial 594 pruned. 
[I 2026-03-12 00:50:50,110] Trial 595 pruned. 
[I 2026-03-12 00:50:50,235] Trial 596 pruned. 
[I 2026-03-12 00:50:50,285] Trial 597 finished with value: 0.0 and parameters: {'timeframe': 'M3', 'atr_period': 13, 'atr_threshold': 15.0, 'pt_mult': 5.0, 'sl_mult': 5.0, 'td_mins': 30}. Best is trial 226 with value: 2.6610758639085312.
[I 2026-03-12 00:50:50,338] Trial 598 finished with value: 0.0 and parameters: {'timeframe': 'M3', 'atr_period': 13, 'atr_threshold': 5.0, 'pt_mult': 1.0, 'sl_mult': 5.0, 'td_mins': 30}. Best is trial 226 with value: 2.6610758639085312.
[I 2026-03-12 00:50:50,463] Trial 599 pruned. 
[I 2026-03-12 00:50:50,519] Trial 600 finished with value: 0.0 and parameters: {'timeframe': 'M3', 'atr_period': 13, 'atr_threshold': 5.0, 'pt_mult': 0.5, 'sl_mult': 5.0, 'td_mins': 30}. Best is trial 226 with value: 2.6610758639085312.
[I 2026-03-12 00:50:50,666] Trial 601 pruned. 
[I 2026-03-12 00:50:50,812] Trial 602 finished with value: 2.6610758639085312 and parameters: {'timeframe': 'M3', 'atr_period': 13, 'atr_threshold': 3.0, 'pt_mult': 0.5, 'sl_mult': 5.0, 'td_mins': 30}. Best is trial 226 with value: 2.6610758639085312.
[I 2026-03-12 00:50:51,135] Trial 603 finished with value: 1.6986001089155351 and parameters: {'timeframe': 'M3', 'atr_period': 13, 'atr_threshold': 3.0, 'pt_mult': 0.5, 'sl_mult': 5.0, 'td_mins': 180}. Best is trial 226 with value: 2.6610758639085312.
[I 2026-03-12 00:50:51,260] Trial 604 finished with value: 2.6610758639085312 and parameters: {'timeframe': 'M3', 'atr_period': 13, 'atr_threshold': 3.0, 'pt_mult': 0.5, 'sl_mult': 5.0, 'td_mins': 30}. Best is trial 226 with value: 2.6610758639085312.
[I 2026-03-12 00:50:51,329] Trial 605 pruned. 
[I 2026-03-12 00:50:51,396] Trial 606 pruned. 
[I 2026-03-12 00:50:51,521] Trial 607 finished with value: 2.6610758639085312 and parameters: {'timeframe': 'M3', 'atr_period': 13, 'atr_threshold': 3.0, 'pt_mult': 0.5, 'sl_mult': 5.0, 'td_mins': 30}. Best is trial 226 with value: 2.6610758639085312.
[I 2026-03-12 00:50:51,587] Trial 608 pruned. 
[I 2026-03-12 00:50:51,708] Trial 609 finished with value: 2.6610758639085312 and parameters: {'timeframe': 'M3', 'atr_period': 13, 'atr_threshold': 3.0, 'pt_mult': 0.5, 'sl_mult': 5.0, 'td_mins': 30}. Best is trial 226 with value: 2.6610758639085312.
[I 2026-03-12 00:50:51,826] Trial 610 finished with value: 2.6610758639085312 and parameters: {'timeframe': 'M3', 'atr_period': 13, 'atr_threshold': 3.0, 'pt_mult': 0.5, 'sl_mult': 5.0, 'td_mins': 30}. Best is trial 226 with value: 2.6610758639085312.
[I 2026-03-12 00:50:52,203] Trial 611 pruned. 
[I 2026-03-12 00:50:52,254] Trial 612 finished with value: 0.0 and parameters: {'timeframe': 'M3', 'atr_period': 13, 'atr_threshold': 8.0, 'pt_mult': 5.0, 'sl_mult': 0.5, 'td_mins': 5}. Best is trial 226 with value: 2.6610758639085312.
[I 2026-03-12 00:50:52,306] Trial 613 finished with value: 0.0 and parameters: {'timeframe': 'M3', 'atr_period': 13, 'atr_threshold': 8.0, 'pt_mult': 0.5, 'sl_mult': 5.0, 'td_mins': 5}. Best is trial 226 with value: 2.6610758639085312.
[I 2026-03-12 00:50:52,423] Trial 614 finished with value: 2.6610758639085312 and parameters: {'timeframe': 'M3', 'atr_period': 13, 'atr_threshold': 3.0, 'pt_mult': 0.5, 'sl_mult': 5.0, 'td_mins': 30}. Best is trial 226 with value: 2.6610758639085312.
[I 2026-03-12 00:50:52,539] Trial 615 finished with value: 2.6610758639085312 and parameters: {'timeframe': 'M3', 'atr_period': 13, 'atr_threshold': 3.0, 'pt_mult': 0.5, 'sl_mult': 5.0, 'td_mins': 30}. Best is trial 226 with value: 2.6610758639085312.
[I 2026-03-12 00:50:52,600] Trial 616 pruned. 
[I 2026-03-12 00:50:52,648] Trial 617 finished with value: 0.0 and parameters: {'timeframe': 'M3', 'atr_period': 13, 'atr_threshold': 8.0, 'pt_mult': 0.5, 'sl_mult': 5.0, 'td_mins': 30}. Best is trial 226 with value: 2.6610758639085312.
[I 2026-03-12 00:50:52,701] Trial 618 pruned. 
[I 2026-03-12 00:50:52,759] Trial 619 pruned. 
[I 2026-03-12 00:50:52,882] Trial 620 finished with value: 2.6610758639085312 and parameters: {'timeframe': 'M3', 'atr_period': 13, 'atr_threshold': 3.0, 'pt_mult': 0.5, 'sl_mult': 5.0, 'td_mins': 30}. Best is trial 226 with value: 2.6610758639085312.
[I 2026-03-12 00:50:53,000] Trial 621 finished with value: 2.6610758639085312 and parameters: {'timeframe': 'M3', 'atr_period': 13, 'atr_threshold': 3.0, 'pt_mult': 0.5, 'sl_mult': 5.0, 'td_mins': 30}. Best is trial 226 with value: 2.6610758639085312.
[I 2026-03-12 00:50:53,118] Trial 622 finished with value: 2.6610758639085312 and parameters: {'timeframe': 'M3', 'atr_period': 13, 'atr_threshold': 3.0, 'pt_mult': 0.5, 'sl_mult': 5.0, 'td_mins': 30}. Best is trial 226 with value: 2.6610758639085312.
[I 2026-03-12 00:50:53,912] Trial 623 pruned. 
[I 2026-03-12 00:50:53,973] Trial 624 finished with value: 0.0 and parameters: {'timeframe': 'M3', 'atr_period': 13, 'atr_threshold': 5.0, 'pt_mult': 2.5, 'sl_mult': 1.0, 'td_mins': 1080}. Best is trial 226 with value: 2.6610758639085312.
[I 2026-03-12 00:50:54,031] Trial 625 finished with value: 0.0 and parameters: {'timeframe': 'M3', 'atr_period': 13, 'atr_threshold': 15.0, 'pt_mult': 0.5, 'sl_mult': 5.0, 'td_mins': 30}. Best is trial 226 with value: 2.6610758639085312.
[I 2026-03-12 00:50:54,160] Trial 626 finished with value: 2.6610758639085312 and parameters: {'timeframe': 'M3', 'atr_period': 13, 'atr_threshold': 3.0, 'pt_mult': 0.5, 'sl_mult': 5.0, 'td_mins': 30}. Best is trial 226 with value: 2.6610758639085312.
[I 2026-03-12 00:50:54,442] Trial 627 pruned. 
[I 2026-03-12 00:50:54,591] Trial 628 finished with value: 2.6610758639085312 and parameters: {'timeframe': 'M3', 'atr_period': 13, 'atr_threshold': 3.0, 'pt_mult': 0.5, 'sl_mult': 5.0, 'td_mins': 30}. Best is trial 226 with value: 2.6610758639085312.
[I 2026-03-12 00:50:54,728] Trial 629 finished with value: 2.6610758639085312 and parameters: {'timeframe': 'M3', 'atr_period': 13, 'atr_threshold': 3.0, 'pt_mult': 0.5, 'sl_mult': 5.0, 'td_mins': 30}. Best is trial 226 with value: 2.6610758639085312.
[I 2026-03-12 00:50:56,534] Trial 630 pruned. 
[I 2026-03-12 00:50:56,673] Trial 631 finished with value: 2.6610758639085312 and parameters: {'timeframe': 'M3', 'atr_period': 13, 'atr_threshold': 3.0, 'pt_mult': 0.5, 'sl_mult': 5.0, 'td_mins': 30}. Best is trial 226 with value: 2.6610758639085312.
[I 2026-03-12 00:50:56,790] Trial 632 finished with value: 2.6610758639085312 and parameters: {'timeframe': 'M3', 'atr_period': 13, 'atr_threshold': 3.0, 'pt_mult': 0.5, 'sl_mult': 5.0, 'td_mins': 30}. Best is trial 226 with value: 2.6610758639085312.
[I 2026-03-12 00:50:56,933] Trial 633 finished with value: 2.6610758639085312 and parameters: {'timeframe': 'M3', 'atr_period': 13, 'atr_threshold': 3.0, 'pt_mult': 0.5, 'sl_mult': 5.0, 'td_mins': 30}. Best is trial 226 with value: 2.6610758639085312.
[I 2026-03-12 00:50:57,051] Trial 634 finished with value: 2.6610758639085312 and parameters: {'timeframe': 'M3', 'atr_period': 13, 'atr_threshold': 3.0, 'pt_mult': 0.5, 'sl_mult': 5.0, 'td_mins': 30}. Best is trial 226 with value: 2.6610758639085312.
[I 2026-03-12 00:50:57,741] Trial 635 pruned. 
[I 2026-03-12 00:50:57,792] Trial 636 finished with value: 0.0 and parameters: {'timeframe': 'M3', 'atr_period': 13, 'atr_threshold': 10.0, 'pt_mult': 2.5, 'sl_mult': 1.0, 'td_mins': 60}. Best is trial 226 with value: 2.6610758639085312.
[I 2026-03-12 00:50:57,927] Trial 637 finished with value: 2.6610758639085312 and parameters: {'timeframe': 'M3', 'atr_period': 13, 'atr_threshold': 3.0, 'pt_mult': 0.5, 'sl_mult': 5.0, 'td_mins': 30}. Best is trial 226 with value: 2.6610758639085312.
[I 2026-03-12 00:50:58,020] Trial 638 pruned. 
[I 2026-03-12 00:50:58,093] Trial 639 pruned. 
[I 2026-03-12 00:50:58,210] Trial 640 finished with value: 2.6610758639085312 and parameters: {'timeframe': 'M3', 'atr_period': 13, 'atr_threshold': 3.0, 'pt_mult': 0.5, 'sl_mult': 5.0, 'td_mins': 30}. Best is trial 226 with value: 2.6610758639085312.
[I 2026-03-12 00:50:58,317] Trial 641 pruned. 
[I 2026-03-12 00:50:58,369] Trial 642 finished with value: 0.0 and parameters: {'timeframe': 'M3', 'atr_period': 13, 'atr_threshold': 10.0, 'pt_mult': 0.5, 'sl_mult': 5.0, 'td_mins': 30}. Best is trial 226 with value: 2.6610758639085312.
[I 2026-03-12 00:50:58,473] Trial 643 pruned. 
[I 2026-03-12 00:50:58,589] Trial 644 finished with value: 2.56808242042213 and parameters: {'timeframe': 'M3', 'atr_period': 13, 'atr_threshold': 3.0, 'pt_mult': 0.5, 'sl_mult': 5.0, 'td_mins': 15}. Best is trial 226 with value: 2.6610758639085312.
[I 2026-03-12 00:50:58,680] Trial 645 pruned. 
[I 2026-03-12 00:50:58,732] Trial 646 finished with value: 0.0 and parameters: {'timeframe': 'M3', 'atr_period': 13, 'atr_threshold': 15.0, 'pt_mult': 2.5, 'sl_mult': 2.5, 'td_mins': 360}. Best is trial 226 with value: 2.6610758639085312.
[I 2026-03-12 00:50:58,801] Trial 647 pruned. 
[I 2026-03-12 00:50:58,935] Trial 648 finished with value: 2.6610758639085312 and parameters: {'timeframe': 'M3', 'atr_period': 13, 'atr_threshold': 3.0, 'pt_mult': 0.5, 'sl_mult': 5.0, 'td_mins': 30}. Best is trial 226 with value: 2.6610758639085312.
[I 2026-03-12 00:50:59,066] Trial 649 finished with value: 2.6610758639085312 and parameters: {'timeframe': 'M3', 'atr_period': 13, 'atr_threshold': 3.0, 'pt_mult': 0.5, 'sl_mult': 5.0, 'td_mins': 30}. Best is trial 226 with value: 2.6610758639085312.
[I 2026-03-12 00:50:59,191] Trial 650 finished with value: 2.6610758639085312 and parameters: {'timeframe': 'M3', 'atr_period': 13, 'atr_threshold': 3.0, 'pt_mult': 0.5, 'sl_mult': 5.0, 'td_mins': 30}. Best is trial 226 with value: 2.6610758639085312.
[I 2026-03-12 00:50:59,261] Trial 651 pruned. 
[I 2026-03-12 00:50:59,315] Trial 652 finished with value: 0.0 and parameters: {'timeframe': 'M3', 'atr_period': 13, 'atr_threshold': 15.0, 'pt_mult': 2.5, 'sl_mult': 5.0, 'td_mins': 360}. Best is trial 226 with value: 2.6610758639085312.
[I 2026-03-12 00:51:00,666] Trial 653 pruned. 
[I 2026-03-12 00:51:00,897] Trial 654 finished with value: 2.6610758639085312 and parameters: {'timeframe': 'M3', 'atr_period': 13, 'atr_threshold': 3.0, 'pt_mult': 0.5, 'sl_mult': 5.0, 'td_mins': 30}. Best is trial 226 with value: 2.6610758639085312.
[I 2026-03-12 00:51:01,010] Trial 655 pruned. 
[I 2026-03-12 00:51:01,273] Trial 656 finished with value: 2.268830132624994 and parameters: {'timeframe': 'M3', 'atr_period': 13, 'atr_threshold': 2.0, 'pt_mult': 0.5, 'sl_mult': 5.0, 'td_mins': 30}. Best is trial 226 with value: 2.6610758639085312.
[I 2026-03-12 00:51:01,415] Trial 657 finished with value: 2.6610758639085312 and parameters: {'timeframe': 'M3', 'atr_period': 13, 'atr_threshold': 3.0, 'pt_mult': 0.5, 'sl_mult': 5.0, 'td_mins': 30}. Best is trial 226 with value: 2.6610758639085312.
[I 2026-03-12 00:51:01,590] Trial 658 pruned. 
[I 2026-03-12 00:51:01,646] Trial 659 finished with value: 0.0 and parameters: {'timeframe': 'M3', 'atr_period': 13, 'atr_threshold': 10.0, 'pt_mult': 0.5, 'sl_mult': 5.0, 'td_mins': 120}. Best is trial 226 with value: 2.6610758639085312.
[I 2026-03-12 00:51:03,790] Trial 660 pruned. 
[I 2026-03-12 00:51:03,845] Trial 661 pruned. 
[I 2026-03-12 00:51:03,907] Trial 662 pruned. 
[I 2026-03-12 00:51:03,972] Trial 663 pruned. 
[I 2026-03-12 00:51:04,097] Trial 664 finished with value: 2.6610758639085312 and parameters: {'timeframe': 'M3', 'atr_period': 13, 'atr_threshold': 3.0, 'pt_mult': 0.5, 'sl_mult': 5.0, 'td_mins': 30}. Best is trial 226 with value: 2.6610758639085312.
[I 2026-03-12 00:51:04,348] Trial 665 pruned. 
[I 2026-03-12 00:51:04,397] Trial 666 finished with value: 0.0 and parameters: {'timeframe': 'M3', 'atr_period': 13, 'atr_threshold': 10.0, 'pt_mult': 2.5, 'sl_mult': 5.0, 'td_mins': 180}. Best is trial 226 with value: 2.6610758639085312.
[I 2026-03-12 00:51:05,772] Trial 667 pruned. 
[I 2026-03-12 00:51:05,830] Trial 668 finished with value: 0.0 and parameters: {'timeframe': 'M3', 'atr_period': 13, 'atr_threshold': 5.0, 'pt_mult': 5.0, 'sl_mult': 5.0, 'td_mins': 1080}. Best is trial 226 with value: 2.6610758639085312.
[I 2026-03-12 00:51:05,927] Trial 669 pruned. 
[I 2026-03-12 00:51:05,980] Trial 670 finished with value: 0.0 and parameters: {'timeframe': 'M3', 'atr_period': 13, 'atr_threshold': 5.0, 'pt_mult': 0.5, 'sl_mult': 1.0, 'td_mins': 5}. Best is trial 226 with value: 2.6610758639085312.
[I 2026-03-12 00:51:06,031] Trial 671 finished with value: 0.0 and parameters: {'timeframe': 'M3', 'atr_period': 13, 'atr_threshold': 10.0, 'pt_mult': 1.0, 'sl_mult': 1.0, 'td_mins': 30}. Best is trial 226 with value: 2.6610758639085312.
[I 2026-03-12 00:51:06,195] Trial 672 finished with value: 2.4718369634519943 and parameters: {'timeframe': 'M3', 'atr_period': 13, 'atr_threshold': 3.0, 'pt_mult': 0.5, 'sl_mult': 5.0, 'td_mins': 60}. Best is trial 226 with value: 2.6610758639085312.
[I 2026-03-12 00:51:06,250] Trial 673 pruned. 
[I 2026-03-12 00:51:06,303] Trial 674 pruned. 
[I 2026-03-12 00:51:06,422] Trial 675 finished with value: 2.6610758639085312 and parameters: {'timeframe': 'M3', 'atr_period': 13, 'atr_threshold': 3.0, 'pt_mult': 0.5, 'sl_mult': 5.0, 'td_mins': 30}. Best is trial 226 with value: 2.6610758639085312.
[I 2026-03-12 00:51:06,477] Trial 676 finished with value: 0.0 and parameters: {'timeframe': 'M3', 'atr_period': 13, 'atr_threshold': 5.0, 'pt_mult': 0.5, 'sl_mult': 5.0, 'td_mins': 30}. Best is trial 226 with value: 2.6610758639085312.
[I 2026-03-12 00:51:06,524] Trial 677 finished with value: 0.0 and parameters: {'timeframe': 'M3', 'atr_period': 13, 'atr_threshold': 5.0, 'pt_mult': 0.5, 'sl_mult': 5.0, 'td_mins': 720}. Best is trial 226 with value: 2.6610758639085312.
[I 2026-03-12 00:51:06,581] Trial 678 pruned. 
[I 2026-03-12 00:51:06,636] Trial 679 pruned. 
[I 2026-03-12 00:51:06,731] Trial 680 pruned. 
[I 2026-03-12 00:51:06,781] Trial 681 finished with value: 0.0 and parameters: {'timeframe': 'M3', 'atr_period': 13, 'atr_threshold': 8.0, 'pt_mult': 1.0, 'sl_mult': 1.0, 'td_mins': 1200}. Best is trial 226 with value: 2.6610758639085312.
[I 2026-03-12 00:51:06,829] Trial 682 finished with value: 0.0 and parameters: {'timeframe': 'M3', 'atr_period': 13, 'atr_threshold': 8.0, 'pt_mult': 5.0, 'sl_mult': 1.0, 'td_mins': 720}. Best is trial 226 with value: 2.6610758639085312.
[I 2026-03-12 00:51:06,946] Trial 683 finished with value: 2.6610758639085312 and parameters: {'timeframe': 'M3', 'atr_period': 13, 'atr_threshold': 3.0, 'pt_mult': 0.5, 'sl_mult': 5.0, 'td_mins': 30}. Best is trial 226 with value: 2.6610758639085312.
[I 2026-03-12 00:51:07,302] Trial 684 pruned. 
[I 2026-03-12 00:51:07,595] Trial 685 finished with value: 1.6986001089155351 and parameters: {'timeframe': 'M3', 'atr_period': 13, 'atr_threshold': 3.0, 'pt_mult': 0.5, 'sl_mult': 5.0, 'td_mins': 180}. Best is trial 226 with value: 2.6610758639085312.
[I 2026-03-12 00:51:07,734] Trial 686 finished with value: 2.6610758639085312 and parameters: {'timeframe': 'M3', 'atr_period': 13, 'atr_threshold': 3.0, 'pt_mult': 0.5, 'sl_mult': 5.0, 'td_mins': 30}. Best is trial 226 with value: 2.6610758639085312.
[I 2026-03-12 00:51:07,785] Trial 687 pruned. 
[I 2026-03-12 00:51:07,853] Trial 688 pruned. 
[I 2026-03-12 00:51:07,972] Trial 689 finished with value: 2.6610758639085312 and parameters: {'timeframe': 'M3', 'atr_period': 13, 'atr_threshold': 3.0, 'pt_mult': 0.5, 'sl_mult': 5.0, 'td_mins': 30}. Best is trial 226 with value: 2.6610758639085312.
[I 2026-03-12 00:51:08,030] Trial 690 pruned. 
[I 2026-03-12 00:51:08,079] Trial 691 finished with value: 0.0 and parameters: {'timeframe': 'M3', 'atr_period': 13, 'atr_threshold': 15.0, 'pt_mult': 1.0, 'sl_mult': 0.5, 'td_mins': 1080}. Best is trial 226 with value: 2.6610758639085312.
[I 2026-03-12 00:51:08,221] Trial 692 finished with value: 2.6610758639085312 and parameters: {'timeframe': 'M3', 'atr_period': 13, 'atr_threshold': 3.0, 'pt_mult': 0.5, 'sl_mult': 5.0, 'td_mins': 30}. Best is trial 226 with value: 2.6610758639085312.
[I 2026-03-12 00:51:11,113] Trial 693 pruned. 
[I 2026-03-12 00:51:11,279] Trial 694 finished with value: 2.6610758639085312 and parameters: {'timeframe': 'M3', 'atr_period': 13, 'atr_threshold': 3.0, 'pt_mult': 0.5, 'sl_mult': 5.0, 'td_mins': 30}. Best is trial 226 with value: 2.6610758639085312.
[I 2026-03-12 00:51:11,333] Trial 695 finished with value: 0.0 and parameters: {'timeframe': 'M3', 'atr_period': 13, 'atr_threshold': 8.0, 'pt_mult': 0.5, 'sl_mult': 1.0, 'td_mins': 720}. Best is trial 226 with value: 2.6610758639085312.
[I 2026-03-12 00:51:11,391] Trial 696 finished with value: 0.0 and parameters: {'timeframe': 'M3', 'atr_period': 13, 'atr_threshold': 15.0, 'pt_mult': 5.0, 'sl_mult': 5.0, 'td_mins': 120}. Best is trial 226 with value: 2.6610758639085312.
[I 2026-03-12 00:51:11,528] Trial 697 finished with value: 2.6610758639085312 and parameters: {'timeframe': 'M3', 'atr_period': 13, 'atr_threshold': 3.0, 'pt_mult': 0.5, 'sl_mult': 5.0, 'td_mins': 30}. Best is trial 226 with value: 2.6610758639085312.
[I 2026-03-12 00:51:11,650] Trial 698 finished with value: 2.6610758639085312 and parameters: {'timeframe': 'M3', 'atr_period': 13, 'atr_threshold': 3.0, 'pt_mult': 0.5, 'sl_mult': 5.0, 'td_mins': 30}. Best is trial 226 with value: 2.6610758639085312.
[I 2026-03-12 00:51:11,772] Trial 699 finished with value: 2.6610758639085312 and parameters: {'timeframe': 'M3', 'atr_period': 13, 'atr_threshold': 3.0, 'pt_mult': 0.5, 'sl_mult': 5.0, 'td_mins': 30}. Best is trial 226 with value: 2.6610758639085312.
[I 2026-03-12 00:51:11,819] Trial 700 finished with value: 0.0 and parameters: {'timeframe': 'M3', 'atr_period': 13, 'atr_threshold': 15.0, 'pt_mult': 0.5, 'sl_mult': 5.0, 'td_mins': 30}. Best is trial 226 with value: 2.6610758639085312.
[I 2026-03-12 00:51:12,032] Trial 701 pruned. 
[I 2026-03-12 00:51:12,146] Trial 702 finished with value: 2.6610758639085312 and parameters: {'timeframe': 'M3', 'atr_period': 13, 'atr_threshold': 3.0, 'pt_mult': 0.5, 'sl_mult': 5.0, 'td_mins': 30}. Best is trial 226 with value: 2.6610758639085312.
[I 2026-03-12 00:51:12,197] Trial 703 finished with value: 0.0 and parameters: {'timeframe': 'M3', 'atr_period': 13, 'atr_threshold': 8.0, 'pt_mult': 5.0, 'sl_mult': 5.0, 'td_mins': 120}. Best is trial 226 with value: 2.6610758639085312.
[I 2026-03-12 00:51:12,253] Trial 704 finished with value: 0.0 and parameters: {'timeframe': 'M3', 'atr_period': 13, 'atr_threshold': 8.0, 'pt_mult': 0.5, 'sl_mult': 5.0, 'td_mins': 30}. Best is trial 226 with value: 2.6610758639085312.
[I 2026-03-12 00:51:12,711] Trial 705 pruned. 
[I 2026-03-12 00:51:12,835] Trial 706 finished with value: 2.6610758639085312 and parameters: {'timeframe': 'M3', 'atr_period': 13, 'atr_threshold': 3.0, 'pt_mult': 0.5, 'sl_mult': 5.0, 'td_mins': 30}. Best is trial 226 with value: 2.6610758639085312.
[I 2026-03-12 00:51:12,952] Trial 707 finished with value: 2.6610758639085312 and parameters: {'timeframe': 'M3', 'atr_period': 13, 'atr_threshold': 3.0, 'pt_mult': 0.5, 'sl_mult': 5.0, 'td_mins': 30}. Best is trial 226 with value: 2.6610758639085312.
[I 2026-03-12 00:51:13,011] Trial 708 pruned. 
[I 2026-03-12 00:51:13,068] Trial 709 pruned. 
[I 2026-03-12 00:51:13,190] Trial 710 finished with value: 2.6610758639085312 and parameters: {'timeframe': 'M3', 'atr_period': 13, 'atr_threshold': 3.0, 'pt_mult': 0.5, 'sl_mult': 5.0, 'td_mins': 30}. Best is trial 226 with value: 2.6610758639085312.
