[I 2026-03-12 01:47:38,261] Trial 317 finished with value: 1.879311938277294 and parameters: {'timeframe': 'M5', 'atr_period': 13, 'atr_threshold': 3.0, 'pt_mult': 0.5, 'sl_mult': 5.0, 'td_mins': 360}. Best is trial 17 with value: 2.3323020644376053.
[I 2026-03-12 01:47:38,798] Trial 318 finished with value: 1.879311938277294 and parameters: {'timeframe': 'M5', 'atr_period': 13, 'atr_threshold': 3.0, 'pt_mult': 0.5, 'sl_mult': 5.0, 'td_mins': 360}. Best is trial 17 with value: 2.3323020644376053.
[I 2026-03-12 01:47:39,339] Trial 319 finished with value: 1.879311938277294 and parameters: {'timeframe': 'M5', 'atr_period': 13, 'atr_threshold': 3.0, 'pt_mult': 0.5, 'sl_mult': 5.0, 'td_mins': 360}. Best is trial 17 with value: 2.3323020644376053.
[I 2026-03-12 01:47:39,884] Trial 320 finished with value: 1.879311938277294 and parameters: {'timeframe': 'M5', 'atr_period': 13, 'atr_threshold': 3.0, 'pt_mult': 0.5, 'sl_mult': 5.0, 'td_mins': 360}. Best is trial 17 with value: 2.3323020644376053.
[I 2026-03-12 01:47:40,439] Trial 321 finished with value: 1.879311938277294 and parameters: {'timeframe': 'M5', 'atr_period': 13, 'atr_threshold': 3.0, 'pt_mult': 0.5, 'sl_mult': 5.0, 'td_mins': 360}. Best is trial 17 with value: 2.3323020644376053.
[I 2026-03-12 01:47:40,966] Trial 322 finished with value: 1.879311938277294 and parameters: {'timeframe': 'M5', 'atr_period': 13, 'atr_threshold': 3.0, 'pt_mult': 0.5, 'sl_mult': 5.0, 'td_mins': 360}. Best is trial 17 with value: 2.3323020644376053.
[I 2026-03-12 01:47:41,502] Trial 323 finished with value: 1.879311938277294 and parameters: {'timeframe': 'M5', 'atr_period': 13, 'atr_threshold': 3.0, 'pt_mult': 0.5, 'sl_mult': 5.0, 'td_mins': 360}. Best is trial 17 with value: 2.3323020644376053.
[I 2026-03-12 01:47:42,035] Trial 324 finished with value: 1.879311938277294 and parameters: {'timeframe': 'M5', 'atr_period': 13, 'atr_threshold': 3.0, 'pt_mult': 0.5, 'sl_mult': 5.0, 'td_mins': 360}. Best is trial 17 with value: 2.3323020644376053.
[I 2026-03-12 01:47:42,550] Trial 325 finished with value: 1.879311938277294 and parameters: {'timeframe': 'M5', 'atr_period': 13, 'atr_threshold': 3.0, 'pt_mult': 0.5, 'sl_mult': 5.0, 'td_mins': 360}. Best is trial 17 with value: 2.3323020644376053.
[I 2026-03-12 01:47:43,069] Trial 326 finished with value: 1.879311938277294 and parameters: {'timeframe': 'M5', 'atr_period': 13, 'atr_threshold': 3.0, 'pt_mult': 0.5, 'sl_mult': 5.0, 'td_mins': 360}. Best is trial 17 with value: 2.3323020644376053.
[I 2026-03-12 01:47:43,575] Trial 327 finished with value: 1.879311938277294 and parameters: {'timeframe': 'M5', 'atr_period': 13, 'atr_threshold': 3.0, 'pt_mult': 0.5, 'sl_mult': 5.0, 'td_mins': 360}. Best is trial 17 with value: 2.3323020644376053.
[I 2026-03-12 01:47:43,969] Trial 328 finished with value: 1.8893132556849117 and parameters: {'timeframe': 'M5', 'atr_period': 13, 'atr_threshold': 1.0, 'pt_mult': 0.5, 'sl_mult': 5.0, 'td_mins': 30}. Best is trial 17 with value: 2.3323020644376053.
[I 2026-03-12 01:47:44,360] Trial 329 finished with value: 1.8893132556849117 and parameters: {'timeframe': 'M5', 'atr_period': 13, 'atr_threshold': 1.0, 'pt_mult': 0.5, 'sl_mult': 5.0, 'td_mins': 30}. Best is trial 17 with value: 2.3323020644376053.
[I 2026-03-12 01:47:44,754] Trial 330 finished with value: 1.8893132556849117 and parameters: {'timeframe': 'M5', 'atr_period': 13, 'atr_threshold': 1.0, 'pt_mult': 0.5, 'sl_mult': 5.0, 'td_mins': 30}. Best is trial 17 with value: 2.3323020644376053.
[I 2026-03-12 01:47:45,176] Trial 331 finished with value: 1.8893132556849117 and parameters: {'timeframe': 'M5', 'atr_period': 13, 'atr_threshold': 1.0, 'pt_mult': 0.5, 'sl_mult': 5.0, 'td_mins': 30}. Best is trial 17 with value: 2.3323020644376053.
[I 2026-03-12 01:47:45,611] Trial 332 finished with value: 1.8893132556849117 and parameters: {'timeframe': 'M5', 'atr_period': 13, 'atr_threshold': 1.0, 'pt_mult': 0.5, 'sl_mult': 5.0, 'td_mins': 30}. Best is trial 17 with value: 2.3323020644376053.
[I 2026-03-12 01:47:46,015] Trial 333 finished with value: 1.8893132556849117 and parameters: {'timeframe': 'M5', 'atr_period': 13, 'atr_threshold': 1.0, 'pt_mult': 0.5, 'sl_mult': 5.0, 'td_mins': 30}. Best is trial 17 with value: 2.3323020644376053.
[I 2026-03-12 01:47:46,404] Trial 334 finished with value: 1.8893132556849117 and parameters: {'timeframe': 'M5', 'atr_period': 13, 'atr_threshold': 1.0, 'pt_mult': 0.5, 'sl_mult': 5.0, 'td_mins': 30}. Best is trial 17 with value: 2.3323020644376053.
[I 2026-03-12 01:47:46,769] Trial 335 finished with value: 1.8893132556849117 and parameters: {'timeframe': 'M5', 'atr_period': 13, 'atr_threshold': 1.0, 'pt_mult': 0.5, 'sl_mult': 5.0, 'td_mins': 30}. Best is trial 17 with value: 2.3323020644376053.
[I 2026-03-12 01:47:47,136] Trial 336 finished with value: 1.8893132556849117 and parameters: {'timeframe': 'M5', 'atr_period': 13, 'atr_threshold': 1.0, 'pt_mult': 0.5, 'sl_mult': 5.0, 'td_mins': 30}. Best is trial 17 with value: 2.3323020644376053.
[I 2026-03-12 01:47:47,522] Trial 337 finished with value: 1.8893132556849117 and parameters: {'timeframe': 'M5', 'atr_period': 13, 'atr_threshold': 1.0, 'pt_mult': 0.5, 'sl_mult': 5.0, 'td_mins': 30}. Best is trial 17 with value: 2.3323020644376053.
[I 2026-03-12 01:47:47,898] Trial 338 finished with value: 1.8893132556849117 and parameters: {'timeframe': 'M5', 'atr_period': 13, 'atr_threshold': 1.0, 'pt_mult': 0.5, 'sl_mult': 5.0, 'td_mins': 30}. Best is trial 17 with value: 2.3323020644376053.
[I 2026-03-12 01:47:48,273] Trial 339 finished with value: 1.8893132556849117 and parameters: {'timeframe': 'M5', 'atr_period': 13, 'atr_threshold': 1.0, 'pt_mult': 0.5, 'sl_mult': 5.0, 'td_mins': 30}. Best is trial 17 with value: 2.3323020644376053.
[I 2026-03-12 01:47:48,649] Trial 340 finished with value: 1.8893132556849117 and parameters: {'timeframe': 'M5', 'atr_period': 13, 'atr_threshold': 1.0, 'pt_mult': 0.5, 'sl_mult': 5.0, 'td_mins': 30}. Best is trial 17 with value: 2.3323020644376053.
[I 2026-03-12 01:47:49,025] Trial 341 finished with value: 1.8893132556849117 and parameters: {'timeframe': 'M5', 'atr_period': 13, 'atr_threshold': 1.0, 'pt_mult': 0.5, 'sl_mult': 5.0, 'td_mins': 30}. Best is trial 17 with value: 2.3323020644376053.
[I 2026-03-12 01:47:49,397] Trial 342 finished with value: 1.8893132556849117 and parameters: {'timeframe': 'M5', 'atr_period': 13, 'atr_threshold': 1.0, 'pt_mult': 0.5, 'sl_mult': 5.0, 'td_mins': 30}. Best is trial 17 with value: 2.3323020644376053.
[I 2026-03-12 01:47:49,783] Trial 343 finished with value: 1.8893132556849117 and parameters: {'timeframe': 'M5', 'atr_period': 13, 'atr_threshold': 1.0, 'pt_mult': 0.5, 'sl_mult': 5.0, 'td_mins': 30}. Best is trial 17 with value: 2.3323020644376053.
[I 2026-03-12 01:47:50,184] Trial 344 finished with value: 1.8893132556849117 and parameters: {'timeframe': 'M5', 'atr_period': 13, 'atr_threshold': 1.0, 'pt_mult': 0.5, 'sl_mult': 5.0, 'td_mins': 30}. Best is trial 17 with value: 2.3323020644376053.
[I 2026-03-12 01:47:50,558] Trial 345 finished with value: 1.8893132556849117 and parameters: {'timeframe': 'M5', 'atr_period': 13, 'atr_threshold': 1.0, 'pt_mult': 0.5, 'sl_mult': 5.0, 'td_mins': 30}. Best is trial 17 with value: 2.3323020644376053.
[I 2026-03-12 01:47:50,932] Trial 346 finished with value: 1.8893132556849117 and parameters: {'timeframe': 'M5', 'atr_period': 13, 'atr_threshold': 1.0, 'pt_mult': 0.5, 'sl_mult': 5.0, 'td_mins': 30}. Best is trial 17 with value: 2.3323020644376053.
[I 2026-03-12 01:47:51,318] Trial 347 finished with value: 1.8893132556849117 and parameters: {'timeframe': 'M5', 'atr_period': 13, 'atr_threshold': 1.0, 'pt_mult': 0.5, 'sl_mult': 5.0, 'td_mins': 30}. Best is trial 17 with value: 2.3323020644376053.
[I 2026-03-12 01:47:51,663] Trial 348 finished with value: 2.3323020644376053 and parameters: {'timeframe': 'M5', 'atr_period': 13, 'atr_threshold': 3.0, 'pt_mult': 1.0, 'sl_mult': 5.0, 'td_mins': 180}. Best is trial 17 with value: 2.3323020644376053.
[I 2026-03-12 01:47:52,012] Trial 349 finished with value: 2.3323020644376053 and parameters: {'timeframe': 'M5', 'atr_period': 13, 'atr_threshold': 3.0, 'pt_mult': 1.0, 'sl_mult': 5.0, 'td_mins': 180}. Best is trial 17 with value: 2.3323020644376053.
[I 2026-03-12 01:47:52,362] Trial 350 finished with value: 2.3323020644376053 and parameters: {'timeframe': 'M5', 'atr_period': 13, 'atr_threshold': 3.0, 'pt_mult': 1.0, 'sl_mult': 5.0, 'td_mins': 180}. Best is trial 17 with value: 2.3323020644376053.
[I 2026-03-12 01:47:52,712] Trial 351 finished with value: 2.3323020644376053 and parameters: {'timeframe': 'M5', 'atr_period': 13, 'atr_threshold': 3.0, 'pt_mult': 1.0, 'sl_mult': 5.0, 'td_mins': 180}. Best is trial 17 with value: 2.3323020644376053.
[I 2026-03-12 01:47:53,060] Trial 352 finished with value: 2.3323020644376053 and parameters: {'timeframe': 'M5', 'atr_period': 13, 'atr_threshold': 3.0, 'pt_mult': 1.0, 'sl_mult': 5.0, 'td_mins': 180}. Best is trial 17 with value: 2.3323020644376053.
[I 2026-03-12 01:47:53,411] Trial 353 finished with value: 2.3323020644376053 and parameters: {'timeframe': 'M5', 'atr_period': 13, 'atr_threshold': 3.0, 'pt_mult': 1.0, 'sl_mult': 5.0, 'td_mins': 180}. Best is trial 17 with value: 2.3323020644376053.
[I 2026-03-12 01:47:53,763] Trial 354 finished with value: 2.3323020644376053 and parameters: {'timeframe': 'M5', 'atr_period': 13, 'atr_threshold': 3.0, 'pt_mult': 1.0, 'sl_mult': 5.0, 'td_mins': 180}. Best is trial 17 with value: 2.3323020644376053.
[I 2026-03-12 01:47:54,116] Trial 355 finished with value: 2.3323020644376053 and parameters: {'timeframe': 'M5', 'atr_period': 13, 'atr_threshold': 3.0, 'pt_mult': 1.0, 'sl_mult': 5.0, 'td_mins': 180}. Best is trial 17 with value: 2.3323020644376053.
[I 2026-03-12 01:47:54,471] Trial 356 finished with value: 2.3323020644376053 and parameters: {'timeframe': 'M5', 'atr_period': 13, 'atr_threshold': 3.0, 'pt_mult': 1.0, 'sl_mult': 5.0, 'td_mins': 180}. Best is trial 17 with value: 2.3323020644376053.
[I 2026-03-12 01:47:54,845] Trial 357 finished with value: 2.3323020644376053 and parameters: {'timeframe': 'M5', 'atr_period': 13, 'atr_threshold': 3.0, 'pt_mult': 1.0, 'sl_mult': 5.0, 'td_mins': 180}. Best is trial 17 with value: 2.3323020644376053.
[I 2026-03-12 01:47:55,219] Trial 358 finished with value: 2.3323020644376053 and parameters: {'timeframe': 'M5', 'atr_period': 13, 'atr_threshold': 3.0, 'pt_mult': 1.0, 'sl_mult': 5.0, 'td_mins': 180}. Best is trial 17 with value: 2.3323020644376053.
[I 2026-03-12 01:47:55,576] Trial 359 finished with value: 2.3323020644376053 and parameters: {'timeframe': 'M5', 'atr_period': 13, 'atr_threshold': 3.0, 'pt_mult': 1.0, 'sl_mult': 5.0, 'td_mins': 180}. Best is trial 17 with value: 2.3323020644376053.
[I 2026-03-12 01:47:55,931] Trial 360 finished with value: 2.3323020644376053 and parameters: {'timeframe': 'M5', 'atr_period': 13, 'atr_threshold': 3.0, 'pt_mult': 1.0, 'sl_mult': 5.0, 'td_mins': 180}. Best is trial 17 with value: 2.3323020644376053.
[I 2026-03-12 01:47:56,286] Trial 361 finished with value: 2.3323020644376053 and parameters: {'timeframe': 'M5', 'atr_period': 13, 'atr_threshold': 3.0, 'pt_mult': 1.0, 'sl_mult': 5.0, 'td_mins': 180}. Best is trial 17 with value: 2.3323020644376053.
[I 2026-03-12 01:47:56,640] Trial 362 finished with value: 2.3323020644376053 and parameters: {'timeframe': 'M5', 'atr_period': 13, 'atr_threshold': 3.0, 'pt_mult': 1.0, 'sl_mult': 5.0, 'td_mins': 180}. Best is trial 17 with value: 2.3323020644376053.
[I 2026-03-12 01:47:56,992] Trial 363 finished with value: 2.3323020644376053 and parameters: {'timeframe': 'M5', 'atr_period': 13, 'atr_threshold': 3.0, 'pt_mult': 1.0, 'sl_mult': 5.0, 'td_mins': 180}. Best is trial 17 with value: 2.3323020644376053.
[I 2026-03-12 01:47:57,345] Trial 364 finished with value: 2.3323020644376053 and parameters: {'timeframe': 'M5', 'atr_period': 13, 'atr_threshold': 3.0, 'pt_mult': 1.0, 'sl_mult': 5.0, 'td_mins': 180}. Best is trial 17 with value: 2.3323020644376053.
[I 2026-03-12 01:47:57,683] Trial 365 finished with value: 2.3323020644376053 and parameters: {'timeframe': 'M5', 'atr_period': 13, 'atr_threshold': 3.0, 'pt_mult': 1.0, 'sl_mult': 5.0, 'td_mins': 180}. Best is trial 17 with value: 2.3323020644376053.
[I 2026-03-12 01:47:58,033] Trial 366 finished with value: 2.3323020644376053 and parameters: {'timeframe': 'M5', 'atr_period': 13, 'atr_threshold': 3.0, 'pt_mult': 1.0, 'sl_mult': 5.0, 'td_mins': 180}. Best is trial 17 with value: 2.3323020644376053.
[I 2026-03-12 01:47:58,399] Trial 367 finished with value: 2.3323020644376053 and parameters: {'timeframe': 'M5', 'atr_period': 13, 'atr_threshold': 3.0, 'pt_mult': 1.0, 'sl_mult': 5.0, 'td_mins': 180}. Best is trial 17 with value: 2.3323020644376053.
[I 2026-03-12 01:47:58,775] Trial 368 finished with value: 2.3323020644376053 and parameters: {'timeframe': 'M5', 'atr_period': 13, 'atr_threshold': 3.0, 'pt_mult': 1.0, 'sl_mult': 5.0, 'td_mins': 180}. Best is trial 17 with value: 2.3323020644376053.
[I 2026-03-12 01:47:59,135] Trial 369 finished with value: 2.3323020644376053 and parameters: {'timeframe': 'M5', 'atr_period': 13, 'atr_threshold': 3.0, 'pt_mult': 1.0, 'sl_mult': 5.0, 'td_mins': 180}. Best is trial 17 with value: 2.3323020644376053.
[I 2026-03-12 01:47:59,498] Trial 370 finished with value: 2.3323020644376053 and parameters: {'timeframe': 'M5', 'atr_period': 13, 'atr_threshold': 3.0, 'pt_mult': 1.0, 'sl_mult': 5.0, 'td_mins': 180}. Best is trial 17 with value: 2.3323020644376053.
[I 2026-03-12 01:47:59,872] Trial 371 finished with value: 2.3323020644376053 and parameters: {'timeframe': 'M5', 'atr_period': 13, 'atr_threshold': 3.0, 'pt_mult': 1.0, 'sl_mult': 5.0, 'td_mins': 180}. Best is trial 17 with value: 2.3323020644376053.
[I 2026-03-12 01:48:00,041] Trial 372 pruned. 
[I 2026-03-12 01:48:00,421] Trial 373 finished with value: 1.8875852629580734 and parameters: {'timeframe': 'M5', 'atr_period': 13, 'atr_threshold': 3.0, 'pt_mult': 2.5, 'sl_mult': 5.0, 'td_mins': 180}. Best is trial 17 with value: 2.3323020644376053.
[I 2026-03-12 01:48:00,545] Trial 374 finished with value: 2.0994080110947877 and parameters: {'timeframe': 'M5', 'atr_period': 13, 'atr_threshold': 3.0, 'pt_mult': 1.0, 'sl_mult': 5.0, 'td_mins': 30}. Best is trial 17 with value: 2.3323020644376053.
[I 2026-03-12 01:48:00,620] Trial 375 pruned. 
[I 2026-03-12 01:48:00,755] Trial 376 pruned. 
[I 2026-03-12 01:48:00,927] Trial 377 finished with value: 2.3951380426385716 and parameters: {'timeframe': 'M5', 'atr_period': 13, 'atr_threshold': 3.0, 'pt_mult': 1.0, 'sl_mult': 5.0, 'td_mins': 60}. Best is trial 377 with value: 2.3951380426385716.
[I 2026-03-12 01:48:00,976] Trial 378 finished with value: 0.0 and parameters: {'timeframe': 'M5', 'atr_period': 13, 'atr_threshold': 5.0, 'pt_mult': 1.0, 'sl_mult': 5.0, 'td_mins': 180}. Best is trial 377 with value: 2.3951380426385716.
[I 2026-03-12 01:48:01,151] Trial 379 finished with value: 2.3951380426385716 and parameters: {'timeframe': 'M5', 'atr_period': 13, 'atr_threshold': 3.0, 'pt_mult': 1.0, 'sl_mult': 5.0, 'td_mins': 60}. Best is trial 377 with value: 2.3951380426385716.
[I 2026-03-12 01:48:01,335] Trial 380 finished with value: 2.3951380426385716 and parameters: {'timeframe': 'M5', 'atr_period': 13, 'atr_threshold': 3.0, 'pt_mult': 1.0, 'sl_mult': 5.0, 'td_mins': 60}. Best is trial 377 with value: 2.3951380426385716.
[I 2026-03-12 01:48:01,515] Trial 381 finished with value: 2.3951380426385716 and parameters: {'timeframe': 'M5', 'atr_period': 13, 'atr_threshold': 3.0, 'pt_mult': 1.0, 'sl_mult': 5.0, 'td_mins': 60}. Best is trial 377 with value: 2.3951380426385716.
[I 2026-03-12 01:48:01,684] Trial 382 finished with value: 2.3951380426385716 and parameters: {'timeframe': 'M5', 'atr_period': 13, 'atr_threshold': 3.0, 'pt_mult': 1.0, 'sl_mult': 5.0, 'td_mins': 60}. Best is trial 377 with value: 2.3951380426385716.
[I 2026-03-12 01:48:01,849] Trial 383 finished with value: 2.3951380426385716 and parameters: {'timeframe': 'M5', 'atr_period': 13, 'atr_threshold': 3.0, 'pt_mult': 1.0, 'sl_mult': 5.0, 'td_mins': 60}. Best is trial 377 with value: 2.3951380426385716.
[I 2026-03-12 01:48:02,027] Trial 384 finished with value: 2.3951380426385716 and parameters: {'timeframe': 'M5', 'atr_period': 13, 'atr_threshold': 3.0, 'pt_mult': 1.0, 'sl_mult': 5.0, 'td_mins': 60}. Best is trial 377 with value: 2.3951380426385716.
[I 2026-03-12 01:48:02,198] Trial 385 finished with value: 2.3951380426385716 and parameters: {'timeframe': 'M5', 'atr_period': 13, 'atr_threshold': 3.0, 'pt_mult': 1.0, 'sl_mult': 5.0, 'td_mins': 60}. Best is trial 377 with value: 2.3951380426385716.
[I 2026-03-12 01:48:02,374] Trial 386 finished with value: 2.3951380426385716 and parameters: {'timeframe': 'M5', 'atr_period': 13, 'atr_threshold': 3.0, 'pt_mult': 1.0, 'sl_mult': 5.0, 'td_mins': 60}. Best is trial 377 with value: 2.3951380426385716.
[I 2026-03-12 01:48:02,547] Trial 387 finished with value: 2.3951380426385716 and parameters: {'timeframe': 'M5', 'atr_period': 13, 'atr_threshold': 3.0, 'pt_mult': 1.0, 'sl_mult': 5.0, 'td_mins': 60}. Best is trial 377 with value: 2.3951380426385716.
[I 2026-03-12 01:48:02,717] Trial 388 finished with value: 2.3951380426385716 and parameters: {'timeframe': 'M5', 'atr_period': 13, 'atr_threshold': 3.0, 'pt_mult': 1.0, 'sl_mult': 5.0, 'td_mins': 60}. Best is trial 377 with value: 2.3951380426385716.
[I 2026-03-12 01:48:02,892] Trial 389 finished with value: 2.3951380426385716 and parameters: {'timeframe': 'M5', 'atr_period': 13, 'atr_threshold': 3.0, 'pt_mult': 1.0, 'sl_mult': 5.0, 'td_mins': 60}. Best is trial 377 with value: 2.3951380426385716.
[I 2026-03-12 01:48:03,068] Trial 390 finished with value: 2.3951380426385716 and parameters: {'timeframe': 'M5', 'atr_period': 13, 'atr_threshold': 3.0, 'pt_mult': 1.0, 'sl_mult': 5.0, 'td_mins': 60}. Best is trial 377 with value: 2.3951380426385716.
[I 2026-03-12 01:48:03,242] Trial 391 finished with value: 2.3951380426385716 and parameters: {'timeframe': 'M5', 'atr_period': 13, 'atr_threshold': 3.0, 'pt_mult': 1.0, 'sl_mult': 5.0, 'td_mins': 60}. Best is trial 377 with value: 2.3951380426385716.
[I 2026-03-12 01:48:03,418] Trial 392 finished with value: 2.3951380426385716 and parameters: {'timeframe': 'M5', 'atr_period': 13, 'atr_threshold': 3.0, 'pt_mult': 1.0, 'sl_mult': 5.0, 'td_mins': 60}. Best is trial 377 with value: 2.3951380426385716.
[I 2026-03-12 01:48:03,590] Trial 393 finished with value: 2.3951380426385716 and parameters: {'timeframe': 'M5', 'atr_period': 13, 'atr_threshold': 3.0, 'pt_mult': 1.0, 'sl_mult': 5.0, 'td_mins': 60}. Best is trial 377 with value: 2.3951380426385716.
[I 2026-03-12 01:48:03,771] Trial 394 finished with value: 2.3951380426385716 and parameters: {'timeframe': 'M5', 'atr_period': 13, 'atr_threshold': 3.0, 'pt_mult': 1.0, 'sl_mult': 5.0, 'td_mins': 60}. Best is trial 377 with value: 2.3951380426385716.
[I 2026-03-12 01:48:03,952] Trial 395 finished with value: 2.3951380426385716 and parameters: {'timeframe': 'M5', 'atr_period': 13, 'atr_threshold': 3.0, 'pt_mult': 1.0, 'sl_mult': 5.0, 'td_mins': 60}. Best is trial 377 with value: 2.3951380426385716.
[I 2026-03-12 01:48:04,125] Trial 396 finished with value: 2.3951380426385716 and parameters: {'timeframe': 'M5', 'atr_period': 13, 'atr_threshold': 3.0, 'pt_mult': 1.0, 'sl_mult': 5.0, 'td_mins': 60}. Best is trial 377 with value: 2.3951380426385716.
[I 2026-03-12 01:48:04,300] Trial 397 finished with value: 2.3951380426385716 and parameters: {'timeframe': 'M5', 'atr_period': 13, 'atr_threshold': 3.0, 'pt_mult': 1.0, 'sl_mult': 5.0, 'td_mins': 60}. Best is trial 377 with value: 2.3951380426385716.
[I 2026-03-12 01:48:04,475] Trial 398 finished with value: 2.3951380426385716 and parameters: {'timeframe': 'M5', 'atr_period': 13, 'atr_threshold': 3.0, 'pt_mult': 1.0, 'sl_mult': 5.0, 'td_mins': 60}. Best is trial 377 with value: 2.3951380426385716.
[I 2026-03-12 01:48:04,669] Trial 399 finished with value: 2.3951380426385716 and parameters: {'timeframe': 'M5', 'atr_period': 13, 'atr_threshold': 3.0, 'pt_mult': 1.0, 'sl_mult': 5.0, 'td_mins': 60}. Best is trial 377 with value: 2.3951380426385716.
[I 2026-03-12 01:48:04,881] Trial 400 finished with value: 2.3951380426385716 and parameters: {'timeframe': 'M5', 'atr_period': 13, 'atr_threshold': 3.0, 'pt_mult': 1.0, 'sl_mult': 5.0, 'td_mins': 60}. Best is trial 377 with value: 2.3951380426385716.
[I 2026-03-12 01:48:05,069] Trial 401 finished with value: 2.3951380426385716 and parameters: {'timeframe': 'M5', 'atr_period': 13, 'atr_threshold': 3.0, 'pt_mult': 1.0, 'sl_mult': 5.0, 'td_mins': 60}. Best is trial 377 with value: 2.3951380426385716.
[I 2026-03-12 01:48:05,239] Trial 402 finished with value: 2.3951380426385716 and parameters: {'timeframe': 'M5', 'atr_period': 13, 'atr_threshold': 3.0, 'pt_mult': 1.0, 'sl_mult': 5.0, 'td_mins': 60}. Best is trial 377 with value: 2.3951380426385716.
[I 2026-03-12 01:48:05,413] Trial 403 finished with value: 2.3951380426385716 and parameters: {'timeframe': 'M5', 'atr_period': 13, 'atr_threshold': 3.0, 'pt_mult': 1.0, 'sl_mult': 5.0, 'td_mins': 60}. Best is trial 377 with value: 2.3951380426385716.
[I 2026-03-12 01:48:05,459] Trial 404 finished with value: 0.0 and parameters: {'timeframe': 'M5', 'atr_period': 13, 'atr_threshold': 10.0, 'pt_mult': 1.0, 'sl_mult': 5.0, 'td_mins': 60}. Best is trial 377 with value: 2.3951380426385716.
[I 2026-03-12 01:48:05,793] Trial 405 finished with value: 2.089008491715452 and parameters: {'timeframe': 'M5', 'atr_period': 13, 'atr_threshold': 2.0, 'pt_mult': 1.0, 'sl_mult': 5.0, 'td_mins': 60}. Best is trial 377 with value: 2.3951380426385716.
[I 2026-03-12 01:48:05,854] Trial 406 pruned. 
[I 2026-03-12 01:48:05,919] Trial 407 pruned. 
[I 2026-03-12 01:48:05,975] Trial 408 pruned. 
