[I 2026-03-12 01:10:33,341] Trial 387 finished with value: 2.454517025102679 and parameters: {'timeframe': 'M15', 'atr_period': 13, 'atr_threshold': 3.0, 'pt_mult': 0.5, 'sl_mult': 5.0, 'td_mins': 120}. Best is trial 82 with value: 2.454517025102679.
[I 2026-03-12 01:10:33,636] Trial 388 finished with value: 2.454517025102679 and parameters: {'timeframe': 'M15', 'atr_period': 13, 'atr_threshold': 3.0, 'pt_mult': 0.5, 'sl_mult': 5.0, 'td_mins': 120}. Best is trial 82 with value: 2.454517025102679.
[I 2026-03-12 01:10:33,918] Trial 389 finished with value: 2.454517025102679 and parameters: {'timeframe': 'M15', 'atr_period': 13, 'atr_threshold': 3.0, 'pt_mult': 0.5, 'sl_mult': 5.0, 'td_mins': 120}. Best is trial 82 with value: 2.454517025102679.
[I 2026-03-12 01:10:34,186] Trial 390 finished with value: 2.454517025102679 and parameters: {'timeframe': 'M15', 'atr_period': 13, 'atr_threshold': 3.0, 'pt_mult': 0.5, 'sl_mult': 5.0, 'td_mins': 120}. Best is trial 82 with value: 2.454517025102679.
[I 2026-03-12 01:10:34,488] Trial 391 finished with value: 2.454517025102679 and parameters: {'timeframe': 'M15', 'atr_period': 13, 'atr_threshold': 3.0, 'pt_mult': 0.5, 'sl_mult': 5.0, 'td_mins': 120}. Best is trial 82 with value: 2.454517025102679.
[I 2026-03-12 01:10:34,535] Trial 392 finished with value: 0.0 and parameters: {'timeframe': 'M15', 'atr_period': 13, 'atr_threshold': 15.0, 'pt_mult': 0.5, 'sl_mult': 5.0, 'td_mins': 120}. Best is trial 82 with value: 2.454517025102679.
[I 2026-03-12 01:10:34,659] Trial 393 pruned. 
[I 2026-03-12 01:10:34,913] Trial 394 pruned. 
[I 2026-03-12 01:10:35,446] Trial 395 finished with value: 2.0275373500982505 and parameters: {'timeframe': 'M15', 'atr_period': 13, 'atr_threshold': 1.0, 'pt_mult': 0.5, 'sl_mult': 5.0, 'td_mins': 120}. Best is trial 82 with value: 2.454517025102679.
[I 2026-03-12 01:10:35,742] Trial 396 finished with value: 2.454517025102679 and parameters: {'timeframe': 'M15', 'atr_period': 13, 'atr_threshold': 3.0, 'pt_mult': 0.5, 'sl_mult': 5.0, 'td_mins': 120}. Best is trial 82 with value: 2.454517025102679.
[I 2026-03-12 01:10:36,297] Trial 397 finished with value: 2.0275373500982505 and parameters: {'timeframe': 'M15', 'atr_period': 13, 'atr_threshold': 0.5, 'pt_mult': 0.5, 'sl_mult': 5.0, 'td_mins': 120}. Best is trial 82 with value: 2.454517025102679.
[I 2026-03-12 01:10:36,376] Trial 398 pruned. 
[I 2026-03-12 01:10:36,451] Trial 399 pruned. 
[I 2026-03-12 01:10:36,756] Trial 400 finished with value: 2.454517025102679 and parameters: {'timeframe': 'M15', 'atr_period': 13, 'atr_threshold': 3.0, 'pt_mult': 0.5, 'sl_mult': 5.0, 'td_mins': 120}. Best is trial 82 with value: 2.454517025102679.
[I 2026-03-12 01:10:37,124] Trial 401 finished with value: 2.292744804194478 and parameters: {'timeframe': 'M15', 'atr_period': 13, 'atr_threshold': 3.0, 'pt_mult': 0.5, 'sl_mult': 5.0, 'td_mins': 180}. Best is trial 82 with value: 2.454517025102679.
[I 2026-03-12 01:10:37,198] Trial 402 pruned. 
[I 2026-03-12 01:10:37,251] Trial 403 pruned. 
[I 2026-03-12 01:10:37,300] Trial 404 pruned. 
[I 2026-03-12 01:10:37,579] Trial 405 finished with value: 2.454517025102679 and parameters: {'timeframe': 'M15', 'atr_period': 13, 'atr_threshold': 3.0, 'pt_mult': 0.5, 'sl_mult': 5.0, 'td_mins': 120}. Best is trial 82 with value: 2.454517025102679.
[I 2026-03-12 01:10:37,753] Trial 406 pruned. 
[I 2026-03-12 01:10:38,172] Trial 407 finished with value: 2.1496600872205787 and parameters: {'timeframe': 'M15', 'atr_period': 13, 'atr_threshold': 2.0, 'pt_mult': 0.5, 'sl_mult': 5.0, 'td_mins': 120}. Best is trial 82 with value: 2.454517025102679.
[I 2026-03-12 01:10:38,235] Trial 408 pruned. 
[I 2026-03-12 01:10:38,509] Trial 409 finished with value: 2.454517025102679 and parameters: {'timeframe': 'M15', 'atr_period': 13, 'atr_threshold': 3.0, 'pt_mult': 0.5, 'sl_mult': 5.0, 'td_mins': 120}. Best is trial 82 with value: 2.454517025102679.
[I 2026-03-12 01:10:38,825] Trial 410 finished with value: 2.454517025102679 and parameters: {'timeframe': 'M15', 'atr_period': 13, 'atr_threshold': 3.0, 'pt_mult': 0.5, 'sl_mult': 5.0, 'td_mins': 120}. Best is trial 82 with value: 2.454517025102679.
[I 2026-03-12 01:10:38,903] Trial 411 pruned. 
[I 2026-03-12 01:10:39,174] Trial 412 finished with value: 2.454517025102679 and parameters: {'timeframe': 'M15', 'atr_period': 13, 'atr_threshold': 3.0, 'pt_mult': 0.5, 'sl_mult': 5.0, 'td_mins': 120}. Best is trial 82 with value: 2.454517025102679.
[I 2026-03-12 01:10:39,461] Trial 413 pruned. 
[I 2026-03-12 01:10:39,772] Trial 414 pruned. 
[I 2026-03-12 01:10:39,820] Trial 415 pruned. 
[I 2026-03-12 01:10:39,949] Trial 416 pruned. 
[I 2026-03-12 01:10:40,027] Trial 417 pruned. 
[I 2026-03-12 01:10:40,073] Trial 418 finished with value: 0.0 and parameters: {'timeframe': 'M15', 'atr_period': 13, 'atr_threshold': 10.0, 'pt_mult': 0.5, 'sl_mult': 5.0, 'td_mins': 180}. Best is trial 82 with value: 2.454517025102679.
[I 2026-03-12 01:10:40,124] Trial 419 pruned. 
[I 2026-03-12 01:10:40,398] Trial 420 finished with value: 2.454517025102679 and parameters: {'timeframe': 'M15', 'atr_period': 13, 'atr_threshold': 3.0, 'pt_mult': 0.5, 'sl_mult': 5.0, 'td_mins': 120}. Best is trial 82 with value: 2.454517025102679.
[I 2026-03-12 01:10:40,467] Trial 421 pruned. 
[I 2026-03-12 01:10:40,560] Trial 422 pruned. 
[I 2026-03-12 01:10:40,706] Trial 423 pruned. 
[I 2026-03-12 01:10:41,007] Trial 424 finished with value: 2.454517025102679 and parameters: {'timeframe': 'M15', 'atr_period': 13, 'atr_threshold': 3.0, 'pt_mult': 0.5, 'sl_mult': 5.0, 'td_mins': 120}. Best is trial 82 with value: 2.454517025102679.
[I 2026-03-12 01:10:41,060] Trial 425 pruned. 
[I 2026-03-12 01:10:41,118] Trial 426 finished with value: 0.0 and parameters: {'timeframe': 'M15', 'atr_period': 13, 'atr_threshold': 10.0, 'pt_mult': 0.5, 'sl_mult': 2.5, 'td_mins': 120}. Best is trial 82 with value: 2.454517025102679.
[I 2026-03-12 01:10:41,546] Trial 427 pruned. 
[I 2026-03-12 01:10:41,833] Trial 428 finished with value: 2.454517025102679 and parameters: {'timeframe': 'M15', 'atr_period': 13, 'atr_threshold': 3.0, 'pt_mult': 0.5, 'sl_mult': 5.0, 'td_mins': 120}. Best is trial 82 with value: 2.454517025102679.
[I 2026-03-12 01:10:42,114] Trial 429 finished with value: 2.454517025102679 and parameters: {'timeframe': 'M15', 'atr_period': 13, 'atr_threshold': 3.0, 'pt_mult': 0.5, 'sl_mult': 5.0, 'td_mins': 120}. Best is trial 82 with value: 2.454517025102679.
[I 2026-03-12 01:10:42,220] Trial 430 pruned. 
[I 2026-03-12 01:10:42,506] Trial 431 finished with value: 2.454517025102679 and parameters: {'timeframe': 'M15', 'atr_period': 13, 'atr_threshold': 3.0, 'pt_mult': 0.5, 'sl_mult': 5.0, 'td_mins': 120}. Best is trial 82 with value: 2.454517025102679.
[I 2026-03-12 01:10:42,791] Trial 432 finished with value: 2.454517025102679 and parameters: {'timeframe': 'M15', 'atr_period': 13, 'atr_threshold': 3.0, 'pt_mult': 0.5, 'sl_mult': 5.0, 'td_mins': 120}. Best is trial 82 with value: 2.454517025102679.
[I 2026-03-12 01:10:42,877] Trial 433 pruned. 
[I 2026-03-12 01:10:42,956] Trial 434 pruned. 
[I 2026-03-12 01:10:43,154] Trial 435 pruned. 
[I 2026-03-12 01:10:43,201] Trial 436 finished with value: 0.0 and parameters: {'timeframe': 'M15', 'atr_period': 13, 'atr_threshold': 10.0, 'pt_mult': 2.5, 'sl_mult': 5.0, 'td_mins': 120}. Best is trial 82 with value: 2.454517025102679.
[I 2026-03-12 01:10:43,263] Trial 437 pruned. 
[I 2026-03-12 01:10:43,315] Trial 438 pruned. 
[I 2026-03-12 01:10:44,289] Trial 439 pruned. 
[I 2026-03-12 01:10:44,335] Trial 440 finished with value: 0.0 and parameters: {'timeframe': 'M15', 'atr_period': 13, 'atr_threshold': 15.0, 'pt_mult': 5.0, 'sl_mult': 5.0, 'td_mins': 120}. Best is trial 82 with value: 2.454517025102679.
[I 2026-03-12 01:10:44,540] Trial 441 pruned. 
[I 2026-03-12 01:10:44,586] Trial 442 finished with value: 0.0 and parameters: {'timeframe': 'M15', 'atr_period': 13, 'atr_threshold': 10.0, 'pt_mult': 0.5, 'sl_mult': 5.0, 'td_mins': 120}. Best is trial 82 with value: 2.454517025102679.
[I 2026-03-12 01:10:44,863] Trial 443 finished with value: 2.454517025102679 and parameters: {'timeframe': 'M15', 'atr_period': 13, 'atr_threshold': 3.0, 'pt_mult': 0.5, 'sl_mult': 5.0, 'td_mins': 120}. Best is trial 82 with value: 2.454517025102679.
[I 2026-03-12 01:10:44,912] Trial 444 pruned. 
[I 2026-03-12 01:10:45,197] Trial 445 finished with value: 2.454517025102679 and parameters: {'timeframe': 'M15', 'atr_period': 13, 'atr_threshold': 3.0, 'pt_mult': 0.5, 'sl_mult': 5.0, 'td_mins': 120}. Best is trial 82 with value: 2.454517025102679.
[I 2026-03-12 01:10:45,342] Trial 446 pruned. 
[I 2026-03-12 01:10:45,420] Trial 447 pruned. 
[I 2026-03-12 01:10:45,706] Trial 448 finished with value: 2.454517025102679 and parameters: {'timeframe': 'M15', 'atr_period': 13, 'atr_threshold': 3.0, 'pt_mult': 0.5, 'sl_mult': 5.0, 'td_mins': 120}. Best is trial 82 with value: 2.454517025102679.
[I 2026-03-12 01:10:45,849] Trial 449 pruned. 
[I 2026-03-12 01:10:45,903] Trial 450 finished with value: 0.0 and parameters: {'timeframe': 'M15', 'atr_period': 13, 'atr_threshold': 15.0, 'pt_mult': 0.5, 'sl_mult': 5.0, 'td_mins': 720}. Best is trial 82 with value: 2.454517025102679.
[I 2026-03-12 01:10:45,953] Trial 451 pruned. 
[I 2026-03-12 01:10:46,259] Trial 452 finished with value: 2.454517025102679 and parameters: {'timeframe': 'M15', 'atr_period': 13, 'atr_threshold': 3.0, 'pt_mult': 0.5, 'sl_mult': 5.0, 'td_mins': 120}. Best is trial 82 with value: 2.454517025102679.
[I 2026-03-12 01:10:46,307] Trial 453 finished with value: 0.0 and parameters: {'timeframe': 'M15', 'atr_period': 13, 'atr_threshold': 10.0, 'pt_mult': 0.5, 'sl_mult': 5.0, 'td_mins': 1080}. Best is trial 82 with value: 2.454517025102679.
[I 2026-03-12 01:10:46,391] Trial 454 pruned. 
[I 2026-03-12 01:10:46,557] Trial 455 pruned. 
[I 2026-03-12 01:10:46,615] Trial 456 pruned. 
[I 2026-03-12 01:10:46,676] Trial 457 pruned. 
[I 2026-03-12 01:10:46,757] Trial 458 pruned. 
[I 2026-03-12 01:10:46,941] Trial 459 pruned. 
[I 2026-03-12 01:10:47,236] Trial 460 pruned. 
[I 2026-03-12 01:10:47,301] Trial 461 pruned. 
[I 2026-03-12 01:10:47,355] Trial 462 pruned. 
[I 2026-03-12 01:10:47,530] Trial 463 pruned. 
[I 2026-03-12 01:10:47,614] Trial 464 pruned. 
[I 2026-03-12 01:10:47,912] Trial 465 finished with value: 2.454517025102679 and parameters: {'timeframe': 'M15', 'atr_period': 13, 'atr_threshold': 3.0, 'pt_mult': 0.5, 'sl_mult': 5.0, 'td_mins': 120}. Best is trial 82 with value: 2.454517025102679.
[I 2026-03-12 01:10:48,015] Trial 466 pruned. 
[I 2026-03-12 01:10:48,347] Trial 467 finished with value: 2.454517025102679 and parameters: {'timeframe': 'M15', 'atr_period': 13, 'atr_threshold': 3.0, 'pt_mult': 0.5, 'sl_mult': 5.0, 'td_mins': 120}. Best is trial 82 with value: 2.454517025102679.
[I 2026-03-12 01:10:48,396] Trial 468 finished with value: 0.0 and parameters: {'timeframe': 'M15', 'atr_period': 13, 'atr_threshold': 15.0, 'pt_mult': 2.5, 'sl_mult': 5.0, 'td_mins': 120}. Best is trial 82 with value: 2.454517025102679.
[I 2026-03-12 01:10:48,664] Trial 469 finished with value: 2.454517025102679 and parameters: {'timeframe': 'M15', 'atr_period': 13, 'atr_threshold': 3.0, 'pt_mult': 0.5, 'sl_mult': 5.0, 'td_mins': 120}. Best is trial 82 with value: 2.454517025102679.
[I 2026-03-12 01:10:48,742] Trial 470 pruned. 
[I 2026-03-12 01:10:48,796] Trial 471 pruned. 
[I 2026-03-12 01:10:48,958] Trial 472 pruned. 
[I 2026-03-12 01:10:49,207] Trial 473 pruned. 
[I 2026-03-12 01:10:49,299] Trial 474 pruned. 
[I 2026-03-12 01:10:49,347] Trial 475 finished with value: 0.0 and parameters: {'timeframe': 'M15', 'atr_period': 13, 'atr_threshold': 15.0, 'pt_mult': 0.5, 'sl_mult': 2.5, 'td_mins': 120}. Best is trial 82 with value: 2.454517025102679.
[I 2026-03-12 01:10:49,394] Trial 476 finished with value: 0.0 and parameters: {'timeframe': 'M15', 'atr_period': 13, 'atr_threshold': 15.0, 'pt_mult': 0.5, 'sl_mult': 5.0, 'td_mins': 5}. Best is trial 82 with value: 2.454517025102679.
[I 2026-03-12 01:10:49,677] Trial 477 finished with value: 2.454517025102679 and parameters: {'timeframe': 'M15', 'atr_period': 13, 'atr_threshold': 3.0, 'pt_mult': 0.5, 'sl_mult': 5.0, 'td_mins': 120}. Best is trial 82 with value: 2.454517025102679.
[I 2026-03-12 01:10:49,946] Trial 478 finished with value: 2.454517025102679 and parameters: {'timeframe': 'M15', 'atr_period': 13, 'atr_threshold': 3.0, 'pt_mult': 0.5, 'sl_mult': 5.0, 'td_mins': 120}. Best is trial 82 with value: 2.454517025102679.
[I 2026-03-12 01:10:50,218] Trial 479 finished with value: 2.454517025102679 and parameters: {'timeframe': 'M15', 'atr_period': 13, 'atr_threshold': 3.0, 'pt_mult': 0.5, 'sl_mult': 5.0, 'td_mins': 120}. Best is trial 82 with value: 2.454517025102679.
[I 2026-03-12 01:10:50,418] Trial 480 pruned. 
[I 2026-03-12 01:10:50,706] Trial 481 finished with value: 2.454517025102679 and parameters: {'timeframe': 'M15', 'atr_period': 13, 'atr_threshold': 3.0, 'pt_mult': 0.5, 'sl_mult': 5.0, 'td_mins': 120}. Best is trial 82 with value: 2.454517025102679.
[I 2026-03-12 01:10:50,762] Trial 482 pruned. 
[I 2026-03-12 01:10:50,843] Trial 483 pruned. 
[I 2026-03-12 01:10:50,894] Trial 484 finished with value: 0.0 and parameters: {'timeframe': 'M15', 'atr_period': 13, 'atr_threshold': 15.0, 'pt_mult': 0.5, 'sl_mult': 5.0, 'td_mins': 180}. Best is trial 82 with value: 2.454517025102679.
[I 2026-03-12 01:10:50,945] Trial 485 pruned. 
[I 2026-03-12 01:10:51,066] Trial 486 pruned. 
[I 2026-03-12 01:10:51,369] Trial 487 finished with value: 2.454517025102679 and parameters: {'timeframe': 'M15', 'atr_period': 13, 'atr_threshold': 3.0, 'pt_mult': 0.5, 'sl_mult': 5.0, 'td_mins': 120}. Best is trial 82 with value: 2.454517025102679.
[I 2026-03-12 01:10:51,656] Trial 488 finished with value: 2.454517025102679 and parameters: {'timeframe': 'M15', 'atr_period': 13, 'atr_threshold': 3.0, 'pt_mult': 0.5, 'sl_mult': 5.0, 'td_mins': 120}. Best is trial 82 with value: 2.454517025102679.
[I 2026-03-12 01:10:51,934] Trial 489 finished with value: 2.454517025102679 and parameters: {'timeframe': 'M15', 'atr_period': 13, 'atr_threshold': 3.0, 'pt_mult': 0.5, 'sl_mult': 5.0, 'td_mins': 120}. Best is trial 82 with value: 2.454517025102679.
[I 2026-03-12 01:10:51,981] Trial 490 finished with value: 0.0 and parameters: {'timeframe': 'M15', 'atr_period': 13, 'atr_threshold': 15.0, 'pt_mult': 0.5, 'sl_mult': 1.0, 'td_mins': 120}. Best is trial 82 with value: 2.454517025102679.
[I 2026-03-12 01:10:52,031] Trial 491 finished with value: 0.0 and parameters: {'timeframe': 'M15', 'atr_period': 13, 'atr_threshold': 15.0, 'pt_mult': 0.5, 'sl_mult': 5.0, 'td_mins': 15}. Best is trial 82 with value: 2.454517025102679.
[I 2026-03-12 01:10:52,077] Trial 492 finished with value: 0.0 and parameters: {'timeframe': 'M15', 'atr_period': 13, 'atr_threshold': 10.0, 'pt_mult': 5.0, 'sl_mult': 5.0, 'td_mins': 120}. Best is trial 82 with value: 2.454517025102679.
[I 2026-03-12 01:10:52,204] Trial 493 pruned. 
[I 2026-03-12 01:10:52,292] Trial 494 pruned. 
[I 2026-03-12 01:10:52,340] Trial 495 finished with value: 0.0 and parameters: {'timeframe': 'M15', 'atr_period': 13, 'atr_threshold': 15.0, 'pt_mult': 0.5, 'sl_mult': 5.0, 'td_mins': 120}. Best is trial 82 with value: 2.454517025102679.
[I 2026-03-12 01:10:52,413] Trial 496 pruned. 
[I 2026-03-12 01:10:52,467] Trial 497 pruned. 
[I 2026-03-12 01:10:52,556] Trial 498 pruned. 
[I 2026-03-12 01:10:53,054] Trial 499 pruned. 
[I 2026-03-12 01:10:53,269] Trial 500 pruned. 
[I 2026-03-12 01:10:53,340] Trial 501 pruned. 
[I 2026-03-12 01:10:53,396] Trial 502 pruned. 
[I 2026-03-12 01:10:53,456] Trial 503 pruned. 
[I 2026-03-12 01:10:53,526] Trial 504 pruned. 
[I 2026-03-12 01:10:53,582] Trial 505 finished with value: 0.0 and parameters: {'timeframe': 'M15', 'atr_period': 13, 'atr_threshold': 10.0, 'pt_mult': 0.5, 'sl_mult': 5.0, 'td_mins': 360}. Best is trial 82 with value: 2.454517025102679.
[I 2026-03-12 01:10:54,287] Trial 506 pruned. 
[I 2026-03-12 01:10:54,406] Trial 507 pruned. 
[I 2026-03-12 01:10:54,538] Trial 508 pruned. 
[I 2026-03-12 01:10:55,139] Trial 509 pruned. 
[I 2026-03-12 01:10:55,495] Trial 510 finished with value: 2.454517025102679 and parameters: {'timeframe': 'M15', 'atr_period': 13, 'atr_threshold': 3.0, 'pt_mult': 0.5, 'sl_mult': 5.0, 'td_mins': 120}. Best is trial 82 with value: 2.454517025102679.
[I 2026-03-12 01:10:55,957] Trial 511 finished with value: 2.292744804194478 and parameters: {'timeframe': 'M15', 'atr_period': 13, 'atr_threshold': 3.0, 'pt_mult': 0.5, 'sl_mult': 5.0, 'td_mins': 180}. Best is trial 82 with value: 2.454517025102679.
[I 2026-03-12 01:10:56,115] Trial 512 pruned. 
[I 2026-03-12 01:10:56,176] Trial 513 finished with value: 0.0 and parameters: {'timeframe': 'M15', 'atr_period': 13, 'atr_threshold': 10.0, 'pt_mult': 0.5, 'sl_mult': 5.0, 'td_mins': 5}. Best is trial 82 with value: 2.454517025102679.
[I 2026-03-12 01:10:56,473] Trial 514 pruned. 
[I 2026-03-12 01:10:56,564] Trial 515 pruned. 
[I 2026-03-12 01:10:56,623] Trial 516 pruned. 
[I 2026-03-12 01:10:56,712] Trial 517 pruned. 
[I 2026-03-12 01:10:57,254] Trial 518 finished with value: 2.1496600872205787 and parameters: {'timeframe': 'M15', 'atr_period': 13, 'atr_threshold': 2.0, 'pt_mult': 0.5, 'sl_mult': 5.0, 'td_mins': 120}. Best is trial 82 with value: 2.454517025102679.
[I 2026-03-12 01:10:58,069] Trial 519 pruned. 
[I 2026-03-12 01:10:58,420] Trial 520 finished with value: 2.454517025102679 and parameters: {'timeframe': 'M15', 'atr_period': 13, 'atr_threshold': 3.0, 'pt_mult': 0.5, 'sl_mult': 5.0, 'td_mins': 120}. Best is trial 82 with value: 2.454517025102679.
[I 2026-03-12 01:10:58,981] Trial 521 pruned. 
[I 2026-03-12 01:10:59,313] Trial 522 finished with value: 2.454517025102679 and parameters: {'timeframe': 'M15', 'atr_period': 13, 'atr_threshold': 3.0, 'pt_mult': 0.5, 'sl_mult': 5.0, 'td_mins': 120}. Best is trial 82 with value: 2.454517025102679.
[I 2026-03-12 01:10:59,493] Trial 523 pruned. 
[I 2026-03-12 01:10:59,574] Trial 524 pruned. 
[I 2026-03-12 01:10:59,922] Trial 525 pruned. 
[I 2026-03-12 01:10:59,988] Trial 526 pruned. 
[I 2026-03-12 01:11:00,055] Trial 527 pruned. 
[I 2026-03-12 01:11:00,141] Trial 528 pruned. 
[I 2026-03-12 01:11:00,420] Trial 529 pruned. 
[I 2026-03-12 01:11:00,705] Trial 530 finished with value: 2.454517025102679 and parameters: {'timeframe': 'M15', 'atr_period': 13, 'atr_threshold': 3.0, 'pt_mult': 0.5, 'sl_mult': 5.0, 'td_mins': 120}. Best is trial 82 with value: 2.454517025102679.
[I 2026-03-12 01:11:00,781] Trial 531 pruned. 
[I 2026-03-12 01:11:01,094] Trial 532 finished with value: 2.454517025102679 and parameters: {'timeframe': 'M15', 'atr_period': 13, 'atr_threshold': 3.0, 'pt_mult': 0.5, 'sl_mult': 5.0, 'td_mins': 120}. Best is trial 82 with value: 2.454517025102679.
[I 2026-03-12 01:11:01,267] Trial 533 pruned. 
[I 2026-03-12 01:11:01,552] Trial 534 finished with value: 2.454517025102679 and parameters: {'timeframe': 'M15', 'atr_period': 13, 'atr_threshold': 3.0, 'pt_mult': 0.5, 'sl_mult': 5.0, 'td_mins': 120}. Best is trial 82 with value: 2.454517025102679.
[I 2026-03-12 01:11:01,639] Trial 535 pruned. 
[I 2026-03-12 01:11:01,687] Trial 536 finished with value: 0.0 and parameters: {'timeframe': 'M15', 'atr_period': 13, 'atr_threshold': 10.0, 'pt_mult': 0.5, 'sl_mult': 5.0, 'td_mins': 15}. Best is trial 82 with value: 2.454517025102679.
[I 2026-03-12 01:11:01,976] Trial 537 finished with value: 2.454517025102679 and parameters: {'timeframe': 'M15', 'atr_period': 13, 'atr_threshold': 3.0, 'pt_mult': 0.5, 'sl_mult': 5.0, 'td_mins': 120}. Best is trial 82 with value: 2.454517025102679.
[I 2026-03-12 01:11:02,279] Trial 538 finished with value: 2.454517025102679 and parameters: {'timeframe': 'M15', 'atr_period': 13, 'atr_threshold': 3.0, 'pt_mult': 0.5, 'sl_mult': 5.0, 'td_mins': 120}. Best is trial 82 with value: 2.454517025102679.
[I 2026-03-12 01:11:02,572] Trial 539 finished with value: 2.454517025102679 and parameters: {'timeframe': 'M15', 'atr_period': 13, 'atr_threshold': 3.0, 'pt_mult': 0.5, 'sl_mult': 5.0, 'td_mins': 120}. Best is trial 82 with value: 2.454517025102679.
[I 2026-03-12 01:11:02,860] Trial 540 finished with value: 2.454517025102679 and parameters: {'timeframe': 'M15', 'atr_period': 13, 'atr_threshold': 3.0, 'pt_mult': 0.5, 'sl_mult': 5.0, 'td_mins': 120}. Best is trial 82 with value: 2.454517025102679.
[I 2026-03-12 01:11:03,164] Trial 541 finished with value: 2.454517025102679 and parameters: {'timeframe': 'M15', 'atr_period': 13, 'atr_threshold': 3.0, 'pt_mult': 0.5, 'sl_mult': 5.0, 'td_mins': 120}. Best is trial 82 with value: 2.454517025102679.
[I 2026-03-12 01:11:03,214] Trial 542 finished with value: 0.0 and parameters: {'timeframe': 'M15', 'atr_period': 13, 'atr_threshold': 10.0, 'pt_mult': 0.5, 'sl_mult': 5.0, 'td_mins': 120}. Best is trial 82 with value: 2.454517025102679.
[I 2026-03-12 01:11:03,503] Trial 543 finished with value: 2.454517025102679 and parameters: {'timeframe': 'M15', 'atr_period': 13, 'atr_threshold': 3.0, 'pt_mult': 0.5, 'sl_mult': 5.0, 'td_mins': 120}. Best is trial 82 with value: 2.454517025102679.
[I 2026-03-12 01:11:03,787] Trial 544 finished with value: 2.454517025102679 and parameters: {'timeframe': 'M15', 'atr_period': 13, 'atr_threshold': 3.0, 'pt_mult': 0.5, 'sl_mult': 5.0, 'td_mins': 120}. Best is trial 82 with value: 2.454517025102679.
[I 2026-03-12 01:11:03,837] Trial 545 finished with value: 0.0 and parameters: {'timeframe': 'M15', 'atr_period': 13, 'atr_threshold': 15.0, 'pt_mult': 1.0, 'sl_mult': 5.0, 'td_mins': 120}. Best is trial 82 with value: 2.454517025102679.
[I 2026-03-12 01:11:03,906] Trial 546 pruned. 
[I 2026-03-12 01:11:03,989] Trial 547 pruned. 
[I 2026-03-12 01:11:04,042] Trial 548 pruned. 
