[I 2026-03-12 00:44:16,557] Trial 636 finished with value: 1.1138927247265178 and parameters: {'timeframe': 'M1', 'atr_period': 13, 'atr_threshold': 2.0, 'pt_mult': 2.5, 'sl_mult': 5.0, 'td_mins': 120}. Best is trial 374 with value: 1.778026240865349.
[I 2026-03-12 00:44:16,667] Trial 637 pruned. 
[I 2026-03-12 00:44:16,723] Trial 638 finished with value: 0.0 and parameters: {'timeframe': 'M1', 'atr_period': 13, 'atr_threshold': 5.0, 'pt_mult': 1.0, 'sl_mult': 1.0, 'td_mins': 1080}. Best is trial 374 with value: 1.778026240865349.
[I 2026-03-12 00:44:16,781] Trial 639 finished with value: 0.0 and parameters: {'timeframe': 'M1', 'atr_period': 13, 'atr_threshold': 10.0, 'pt_mult': 5.0, 'sl_mult': 2.5, 'td_mins': 15}. Best is trial 374 with value: 1.778026240865349.
[I 2026-03-12 00:44:16,942] Trial 640 finished with value: 1.778026240865349 and parameters: {'timeframe': 'M1', 'atr_period': 13, 'atr_threshold': 2.0, 'pt_mult': 1.0, 'sl_mult': 5.0, 'td_mins': 15}. Best is trial 374 with value: 1.778026240865349.
[I 2026-03-12 00:44:16,999] Trial 641 finished with value: 0.0 and parameters: {'timeframe': 'M1', 'atr_period': 13, 'atr_threshold': 3.0, 'pt_mult': 2.5, 'sl_mult': 5.0, 'td_mins': 60}. Best is trial 374 with value: 1.778026240865349.
[I 2026-03-12 00:44:17,159] Trial 642 finished with value: 1.778026240865349 and parameters: {'timeframe': 'M1', 'atr_period': 13, 'atr_threshold': 2.0, 'pt_mult': 1.0, 'sl_mult': 5.0, 'td_mins': 15}. Best is trial 374 with value: 1.778026240865349.
[I 2026-03-12 00:44:17,319] Trial 643 finished with value: 1.778026240865349 and parameters: {'timeframe': 'M1', 'atr_period': 13, 'atr_threshold': 2.0, 'pt_mult': 1.0, 'sl_mult': 5.0, 'td_mins': 15}. Best is trial 374 with value: 1.778026240865349.
[I 2026-03-12 00:44:17,476] Trial 644 finished with value: 1.778026240865349 and parameters: {'timeframe': 'M1', 'atr_period': 13, 'atr_threshold': 2.0, 'pt_mult': 1.0, 'sl_mult': 5.0, 'td_mins': 15}. Best is trial 374 with value: 1.778026240865349.
[I 2026-03-12 00:44:17,892] Trial 645 pruned. 
[I 2026-03-12 00:44:18,067] Trial 646 pruned. 
[I 2026-03-12 00:44:18,116] Trial 647 finished with value: 0.0 and parameters: {'timeframe': 'M1', 'atr_period': 13, 'atr_threshold': 5.0, 'pt_mult': 1.0, 'sl_mult': 5.0, 'td_mins': 15}. Best is trial 374 with value: 1.778026240865349.
[I 2026-03-12 00:44:18,292] Trial 648 finished with value: 1.778026240865349 and parameters: {'timeframe': 'M1', 'atr_period': 13, 'atr_threshold': 2.0, 'pt_mult': 1.0, 'sl_mult': 5.0, 'td_mins': 15}. Best is trial 374 with value: 1.778026240865349.
[I 2026-03-12 00:44:18,437] Trial 649 finished with value: 1.778026240865349 and parameters: {'timeframe': 'M1', 'atr_period': 13, 'atr_threshold': 2.0, 'pt_mult': 1.0, 'sl_mult': 5.0, 'td_mins': 15}. Best is trial 374 with value: 1.778026240865349.
[I 2026-03-12 00:44:18,572] Trial 650 finished with value: 1.778026240865349 and parameters: {'timeframe': 'M1', 'atr_period': 13, 'atr_threshold': 2.0, 'pt_mult': 1.0, 'sl_mult': 5.0, 'td_mins': 15}. Best is trial 374 with value: 1.778026240865349.
[I 2026-03-12 00:44:18,710] Trial 651 finished with value: 1.778026240865349 and parameters: {'timeframe': 'M1', 'atr_period': 13, 'atr_threshold': 2.0, 'pt_mult': 1.0, 'sl_mult': 5.0, 'td_mins': 15}. Best is trial 374 with value: 1.778026240865349.
[I 2026-03-12 00:44:18,756] Trial 652 finished with value: 0.0 and parameters: {'timeframe': 'M1', 'atr_period': 13, 'atr_threshold': 8.0, 'pt_mult': 5.0, 'sl_mult': 1.0, 'td_mins': 180}. Best is trial 374 with value: 1.778026240865349.
[I 2026-03-12 00:44:18,805] Trial 653 finished with value: 0.0 and parameters: {'timeframe': 'M1', 'atr_period': 13, 'atr_threshold': 3.0, 'pt_mult': 0.5, 'sl_mult': 1.0, 'td_mins': 15}. Best is trial 374 with value: 1.778026240865349.
[I 2026-03-12 00:44:18,854] Trial 654 finished with value: 0.0 and parameters: {'timeframe': 'M1', 'atr_period': 13, 'atr_threshold': 3.0, 'pt_mult': 1.0, 'sl_mult': 5.0, 'td_mins': 720}. Best is trial 374 with value: 1.778026240865349.
[I 2026-03-12 00:44:18,988] Trial 655 finished with value: 1.778026240865349 and parameters: {'timeframe': 'M1', 'atr_period': 13, 'atr_threshold': 2.0, 'pt_mult': 1.0, 'sl_mult': 5.0, 'td_mins': 15}. Best is trial 374 with value: 1.778026240865349.
[I 2026-03-12 00:44:19,044] Trial 656 pruned. 
[I 2026-03-12 00:44:19,094] Trial 657 finished with value: 0.0 and parameters: {'timeframe': 'M1', 'atr_period': 13, 'atr_threshold': 15.0, 'pt_mult': 5.0, 'sl_mult': 5.0, 'td_mins': 1200}. Best is trial 374 with value: 1.778026240865349.
[I 2026-03-12 00:44:19,144] Trial 658 finished with value: 0.0 and parameters: {'timeframe': 'M1', 'atr_period': 13, 'atr_threshold': 8.0, 'pt_mult': 5.0, 'sl_mult': 5.0, 'td_mins': 120}. Best is trial 374 with value: 1.778026240865349.
[I 2026-03-12 00:44:21,068] Trial 659 pruned. 
[I 2026-03-12 00:44:21,146] Trial 660 pruned. 
[I 2026-03-12 00:44:21,195] Trial 661 finished with value: 0.0 and parameters: {'timeframe': 'M1', 'atr_period': 13, 'atr_threshold': 3.0, 'pt_mult': 1.0, 'sl_mult': 1.0, 'td_mins': 30}. Best is trial 374 with value: 1.778026240865349.
[I 2026-03-12 00:44:21,243] Trial 662 finished with value: 0.0 and parameters: {'timeframe': 'M1', 'atr_period': 13, 'atr_threshold': 15.0, 'pt_mult': 1.0, 'sl_mult': 5.0, 'td_mins': 5}. Best is trial 374 with value: 1.778026240865349.
[I 2026-03-12 00:44:21,303] Trial 663 pruned. 
[I 2026-03-12 00:44:21,439] Trial 664 finished with value: 1.778026240865349 and parameters: {'timeframe': 'M1', 'atr_period': 13, 'atr_threshold': 2.0, 'pt_mult': 1.0, 'sl_mult': 5.0, 'td_mins': 15}. Best is trial 374 with value: 1.778026240865349.
[I 2026-03-12 00:44:21,574] Trial 665 finished with value: 1.778026240865349 and parameters: {'timeframe': 'M1', 'atr_period': 13, 'atr_threshold': 2.0, 'pt_mult': 1.0, 'sl_mult': 5.0, 'td_mins': 15}. Best is trial 374 with value: 1.778026240865349.
[I 2026-03-12 00:44:21,714] Trial 666 finished with value: 1.778026240865349 and parameters: {'timeframe': 'M1', 'atr_period': 13, 'atr_threshold': 2.0, 'pt_mult': 1.0, 'sl_mult': 5.0, 'td_mins': 15}. Best is trial 374 with value: 1.778026240865349.
[I 2026-03-12 00:44:24,045] Trial 667 finished with value: 1.0327297056560405 and parameters: {'timeframe': 'M1', 'atr_period': 13, 'atr_threshold': 2.0, 'pt_mult': 5.0, 'sl_mult': 5.0, 'td_mins': 1080}. Best is trial 374 with value: 1.778026240865349.
[I 2026-03-12 00:44:24,186] Trial 668 finished with value: 1.778026240865349 and parameters: {'timeframe': 'M1', 'atr_period': 13, 'atr_threshold': 2.0, 'pt_mult': 1.0, 'sl_mult': 5.0, 'td_mins': 15}. Best is trial 374 with value: 1.778026240865349.
[I 2026-03-12 00:44:24,967] Trial 669 pruned. 
[I 2026-03-12 00:44:25,105] Trial 670 finished with value: 1.778026240865349 and parameters: {'timeframe': 'M1', 'atr_period': 13, 'atr_threshold': 2.0, 'pt_mult': 1.0, 'sl_mult': 5.0, 'td_mins': 15}. Best is trial 374 with value: 1.778026240865349.
[I 2026-03-12 00:44:25,225] Trial 671 pruned. 
[I 2026-03-12 00:44:25,277] Trial 672 finished with value: 0.0 and parameters: {'timeframe': 'M1', 'atr_period': 13, 'atr_threshold': 15.0, 'pt_mult': 2.5, 'sl_mult': 1.0, 'td_mins': 15}. Best is trial 374 with value: 1.778026240865349.
[I 2026-03-12 00:44:25,344] Trial 673 pruned. 
[I 2026-03-12 00:44:25,505] Trial 674 finished with value: 1.778026240865349 and parameters: {'timeframe': 'M1', 'atr_period': 13, 'atr_threshold': 2.0, 'pt_mult': 1.0, 'sl_mult': 5.0, 'td_mins': 15}. Best is trial 374 with value: 1.778026240865349.
[I 2026-03-12 00:44:25,619] Trial 675 pruned. 
[I 2026-03-12 00:44:26,622] Trial 676 pruned. 
[I 2026-03-12 00:44:26,684] Trial 677 pruned. 
[I 2026-03-12 00:44:26,747] Trial 678 pruned. 
[I 2026-03-12 00:44:26,807] Trial 679 pruned. 
[I 2026-03-12 00:44:26,857] Trial 680 finished with value: 0.0 and parameters: {'timeframe': 'M1', 'atr_period': 13, 'atr_threshold': 5.0, 'pt_mult': 5.0, 'sl_mult': 2.5, 'td_mins': 1200}. Best is trial 374 with value: 1.778026240865349.
[I 2026-03-12 00:44:26,904] Trial 681 finished with value: 0.0 and parameters: {'timeframe': 'M1', 'atr_period': 13, 'atr_threshold': 15.0, 'pt_mult': 0.5, 'sl_mult': 5.0, 'td_mins': 15}. Best is trial 374 with value: 1.778026240865349.
[I 2026-03-12 00:44:27,224] Trial 682 pruned. 
[I 2026-03-12 00:44:27,272] Trial 683 finished with value: 0.0 and parameters: {'timeframe': 'M1', 'atr_period': 13, 'atr_threshold': 3.0, 'pt_mult': 0.5, 'sl_mult': 2.5, 'td_mins': 30}. Best is trial 374 with value: 1.778026240865349.
[I 2026-03-12 00:44:27,405] Trial 684 pruned. 
[I 2026-03-12 00:44:27,461] Trial 685 pruned. 
[I 2026-03-12 00:44:27,512] Trial 686 finished with value: 0.0 and parameters: {'timeframe': 'M1', 'atr_period': 13, 'atr_threshold': 15.0, 'pt_mult': 5.0, 'sl_mult': 2.5, 'td_mins': 360}. Best is trial 374 with value: 1.778026240865349.
[I 2026-03-12 00:44:27,561] Trial 687 finished with value: 0.0 and parameters: {'timeframe': 'M1', 'atr_period': 13, 'atr_threshold': 15.0, 'pt_mult': 1.0, 'sl_mult': 5.0, 'td_mins': 15}. Best is trial 374 with value: 1.778026240865349.
[I 2026-03-12 00:44:27,805] Trial 688 pruned. 
[I 2026-03-12 00:44:28,194] Trial 689 pruned. 
[I 2026-03-12 00:44:28,252] Trial 690 pruned. 
[I 2026-03-12 00:44:28,305] Trial 691 finished with value: 0.0 and parameters: {'timeframe': 'M1', 'atr_period': 13, 'atr_threshold': 3.0, 'pt_mult': 2.5, 'sl_mult': 0.5, 'td_mins': 720}. Best is trial 374 with value: 1.778026240865349.
[I 2026-03-12 00:44:28,359] Trial 692 finished with value: 0.0 and parameters: {'timeframe': 'M1', 'atr_period': 13, 'atr_threshold': 5.0, 'pt_mult': 0.5, 'sl_mult': 5.0, 'td_mins': 360}. Best is trial 374 with value: 1.778026240865349.
[I 2026-03-12 00:44:28,410] Trial 693 finished with value: 0.0 and parameters: {'timeframe': 'M1', 'atr_period': 13, 'atr_threshold': 8.0, 'pt_mult': 0.5, 'sl_mult': 0.5, 'td_mins': 360}. Best is trial 374 with value: 1.778026240865349.
[I 2026-03-12 00:44:28,533] Trial 694 pruned. 
[I 2026-03-12 00:44:28,620] Trial 695 finished with value: 2.153336081466255 and parameters: {'timeframe': 'M1', 'atr_period': 13, 'atr_threshold': 2.0, 'pt_mult': 0.5, 'sl_mult': 5.0, 'td_mins': 5}. Best is trial 695 with value: 2.153336081466255.
[I 2026-03-12 00:44:28,718] Trial 696 finished with value: 2.153336081466255 and parameters: {'timeframe': 'M1', 'atr_period': 13, 'atr_threshold': 2.0, 'pt_mult': 0.5, 'sl_mult': 5.0, 'td_mins': 5}. Best is trial 695 with value: 2.153336081466255.
[I 2026-03-12 00:44:28,808] Trial 697 finished with value: 2.153336081466255 and parameters: {'timeframe': 'M1', 'atr_period': 13, 'atr_threshold': 2.0, 'pt_mult': 0.5, 'sl_mult': 5.0, 'td_mins': 5}. Best is trial 695 with value: 2.153336081466255.
[I 2026-03-12 00:44:28,897] Trial 698 finished with value: 2.153336081466255 and parameters: {'timeframe': 'M1', 'atr_period': 13, 'atr_threshold': 2.0, 'pt_mult': 0.5, 'sl_mult': 5.0, 'td_mins': 5}. Best is trial 695 with value: 2.153336081466255.
[I 2026-03-12 00:44:28,988] Trial 699 finished with value: 2.153336081466255 and parameters: {'timeframe': 'M1', 'atr_period': 13, 'atr_threshold': 2.0, 'pt_mult': 0.5, 'sl_mult': 5.0, 'td_mins': 5}. Best is trial 695 with value: 2.153336081466255.
[I 2026-03-12 00:44:29,079] Trial 700 finished with value: 2.153336081466255 and parameters: {'timeframe': 'M1', 'atr_period': 13, 'atr_threshold': 2.0, 'pt_mult': 0.5, 'sl_mult': 5.0, 'td_mins': 5}. Best is trial 695 with value: 2.153336081466255.
[I 2026-03-12 00:44:29,168] Trial 701 finished with value: 2.153336081466255 and parameters: {'timeframe': 'M1', 'atr_period': 13, 'atr_threshold': 2.0, 'pt_mult': 0.5, 'sl_mult': 5.0, 'td_mins': 5}. Best is trial 695 with value: 2.153336081466255.
[I 2026-03-12 00:44:29,258] Trial 702 finished with value: 2.153336081466255 and parameters: {'timeframe': 'M1', 'atr_period': 13, 'atr_threshold': 2.0, 'pt_mult': 0.5, 'sl_mult': 5.0, 'td_mins': 5}. Best is trial 695 with value: 2.153336081466255.
[I 2026-03-12 00:44:29,406] Trial 703 finished with value: 2.153336081466255 and parameters: {'timeframe': 'M1', 'atr_period': 13, 'atr_threshold': 2.0, 'pt_mult': 0.5, 'sl_mult': 5.0, 'td_mins': 5}. Best is trial 695 with value: 2.153336081466255.
[I 2026-03-12 00:44:29,494] Trial 704 finished with value: 2.153336081466255 and parameters: {'timeframe': 'M1', 'atr_period': 13, 'atr_threshold': 2.0, 'pt_mult': 0.5, 'sl_mult': 5.0, 'td_mins': 5}. Best is trial 695 with value: 2.153336081466255.
[I 2026-03-12 00:44:29,587] Trial 705 finished with value: 2.153336081466255 and parameters: {'timeframe': 'M1', 'atr_period': 13, 'atr_threshold': 2.0, 'pt_mult': 0.5, 'sl_mult': 5.0, 'td_mins': 5}. Best is trial 695 with value: 2.153336081466255.
[I 2026-03-12 00:44:29,683] Trial 706 finished with value: 2.153336081466255 and parameters: {'timeframe': 'M1', 'atr_period': 13, 'atr_threshold': 2.0, 'pt_mult': 0.5, 'sl_mult': 5.0, 'td_mins': 5}. Best is trial 695 with value: 2.153336081466255.
[I 2026-03-12 00:44:29,772] Trial 707 finished with value: 2.153336081466255 and parameters: {'timeframe': 'M1', 'atr_period': 13, 'atr_threshold': 2.0, 'pt_mult': 0.5, 'sl_mult': 5.0, 'td_mins': 5}. Best is trial 695 with value: 2.153336081466255.
[I 2026-03-12 00:44:29,862] Trial 708 finished with value: 2.153336081466255 and parameters: {'timeframe': 'M1', 'atr_period': 13, 'atr_threshold': 2.0, 'pt_mult': 0.5, 'sl_mult': 5.0, 'td_mins': 5}. Best is trial 695 with value: 2.153336081466255.
[I 2026-03-12 00:44:29,951] Trial 709 finished with value: 2.153336081466255 and parameters: {'timeframe': 'M1', 'atr_period': 13, 'atr_threshold': 2.0, 'pt_mult': 0.5, 'sl_mult': 5.0, 'td_mins': 5}. Best is trial 695 with value: 2.153336081466255.
[I 2026-03-12 00:44:30,039] Trial 710 finished with value: 2.153336081466255 and parameters: {'timeframe': 'M1', 'atr_period': 13, 'atr_threshold': 2.0, 'pt_mult': 0.5, 'sl_mult': 5.0, 'td_mins': 5}. Best is trial 695 with value: 2.153336081466255.
[I 2026-03-12 00:44:30,129] Trial 711 finished with value: 2.153336081466255 and parameters: {'timeframe': 'M1', 'atr_period': 13, 'atr_threshold': 2.0, 'pt_mult': 0.5, 'sl_mult': 5.0, 'td_mins': 5}. Best is trial 695 with value: 2.153336081466255.
[I 2026-03-12 00:44:30,241] Trial 712 finished with value: 2.153336081466255 and parameters: {'timeframe': 'M1', 'atr_period': 13, 'atr_threshold': 2.0, 'pt_mult': 0.5, 'sl_mult': 5.0, 'td_mins': 5}. Best is trial 695 with value: 2.153336081466255.
[I 2026-03-12 00:44:30,352] Trial 713 finished with value: 2.153336081466255 and parameters: {'timeframe': 'M1', 'atr_period': 13, 'atr_threshold': 2.0, 'pt_mult': 0.5, 'sl_mult': 5.0, 'td_mins': 5}. Best is trial 695 with value: 2.153336081466255.
[I 2026-03-12 00:44:30,468] Trial 714 finished with value: 2.153336081466255 and parameters: {'timeframe': 'M1', 'atr_period': 13, 'atr_threshold': 2.0, 'pt_mult': 0.5, 'sl_mult': 5.0, 'td_mins': 5}. Best is trial 695 with value: 2.153336081466255.
[I 2026-03-12 00:44:30,588] Trial 715 finished with value: 2.153336081466255 and parameters: {'timeframe': 'M1', 'atr_period': 13, 'atr_threshold': 2.0, 'pt_mult': 0.5, 'sl_mult': 5.0, 'td_mins': 5}. Best is trial 695 with value: 2.153336081466255.
[I 2026-03-12 00:44:30,679] Trial 716 finished with value: 2.153336081466255 and parameters: {'timeframe': 'M1', 'atr_period': 13, 'atr_threshold': 2.0, 'pt_mult': 0.5, 'sl_mult': 5.0, 'td_mins': 5}. Best is trial 695 with value: 2.153336081466255.
[I 2026-03-12 00:44:30,790] Trial 717 finished with value: 2.153336081466255 and parameters: {'timeframe': 'M1', 'atr_period': 13, 'atr_threshold': 2.0, 'pt_mult': 0.5, 'sl_mult': 5.0, 'td_mins': 5}. Best is trial 695 with value: 2.153336081466255.
[I 2026-03-12 00:44:30,881] Trial 718 finished with value: 2.153336081466255 and parameters: {'timeframe': 'M1', 'atr_period': 13, 'atr_threshold': 2.0, 'pt_mult': 0.5, 'sl_mult': 5.0, 'td_mins': 5}. Best is trial 695 with value: 2.153336081466255.
[I 2026-03-12 00:44:30,974] Trial 719 finished with value: 2.153336081466255 and parameters: {'timeframe': 'M1', 'atr_period': 13, 'atr_threshold': 2.0, 'pt_mult': 0.5, 'sl_mult': 5.0, 'td_mins': 5}. Best is trial 695 with value: 2.153336081466255.
[I 2026-03-12 00:44:31,066] Trial 720 finished with value: 2.153336081466255 and parameters: {'timeframe': 'M1', 'atr_period': 13, 'atr_threshold': 2.0, 'pt_mult': 0.5, 'sl_mult': 5.0, 'td_mins': 5}. Best is trial 695 with value: 2.153336081466255.
[I 2026-03-12 00:44:31,119] Trial 721 pruned. 
[I 2026-03-12 00:44:31,168] Trial 722 finished with value: 0.0 and parameters: {'timeframe': 'M1', 'atr_period': 13, 'atr_threshold': 5.0, 'pt_mult': 0.5, 'sl_mult': 5.0, 'td_mins': 5}. Best is trial 695 with value: 2.153336081466255.
[I 2026-03-12 00:44:31,217] Trial 723 finished with value: 0.0 and parameters: {'timeframe': 'M1', 'atr_period': 13, 'atr_threshold': 8.0, 'pt_mult': 0.5, 'sl_mult': 5.0, 'td_mins': 5}. Best is trial 695 with value: 2.153336081466255.
[I 2026-03-12 00:44:31,266] Trial 724 finished with value: 0.0 and parameters: {'timeframe': 'M1', 'atr_period': 13, 'atr_threshold': 10.0, 'pt_mult': 0.5, 'sl_mult': 5.0, 'td_mins': 5}. Best is trial 695 with value: 2.153336081466255.
[I 2026-03-12 00:44:31,314] Trial 725 finished with value: 0.0 and parameters: {'timeframe': 'M1', 'atr_period': 13, 'atr_threshold': 15.0, 'pt_mult': 0.5, 'sl_mult': 5.0, 'td_mins': 5}. Best is trial 695 with value: 2.153336081466255.
[I 2026-03-12 00:44:31,364] Trial 726 pruned. 
[I 2026-03-12 00:44:31,520] Trial 727 pruned. 
[I 2026-03-12 00:44:31,575] Trial 728 finished with value: 0.0 and parameters: {'timeframe': 'M1', 'atr_period': 13, 'atr_threshold': 3.0, 'pt_mult': 0.5, 'sl_mult': 5.0, 'td_mins': 5}. Best is trial 695 with value: 2.153336081466255.
[I 2026-03-12 00:44:31,670] Trial 729 finished with value: 2.153336081466255 and parameters: {'timeframe': 'M1', 'atr_period': 13, 'atr_threshold': 2.0, 'pt_mult': 0.5, 'sl_mult': 5.0, 'td_mins': 5}. Best is trial 695 with value: 2.153336081466255.
[I 2026-03-12 00:44:31,720] Trial 730 pruned. 
[I 2026-03-12 00:44:31,799] Trial 731 pruned. 
[I 2026-03-12 00:44:31,894] Trial 732 finished with value: 2.153336081466255 and parameters: {'timeframe': 'M1', 'atr_period': 13, 'atr_threshold': 2.0, 'pt_mult': 0.5, 'sl_mult': 5.0, 'td_mins': 5}. Best is trial 695 with value: 2.153336081466255.
[I 2026-03-12 00:44:31,983] Trial 733 finished with value: 2.153336081466255 and parameters: {'timeframe': 'M1', 'atr_period': 13, 'atr_threshold': 2.0, 'pt_mult': 0.5, 'sl_mult': 5.0, 'td_mins': 5}. Best is trial 695 with value: 2.153336081466255.
[I 2026-03-12 00:44:32,074] Trial 734 finished with value: 2.153336081466255 and parameters: {'timeframe': 'M1', 'atr_period': 13, 'atr_threshold': 2.0, 'pt_mult': 0.5, 'sl_mult': 5.0, 'td_mins': 5}. Best is trial 695 with value: 2.153336081466255.
[I 2026-03-12 00:44:32,125] Trial 735 finished with value: 0.0 and parameters: {'timeframe': 'M1', 'atr_period': 13, 'atr_threshold': 8.0, 'pt_mult': 0.5, 'sl_mult': 5.0, 'td_mins': 1080}. Best is trial 695 with value: 2.153336081466255.
[I 2026-03-12 00:44:32,196] Trial 736 pruned. 
[I 2026-03-12 00:44:32,244] Trial 737 finished with value: 0.0 and parameters: {'timeframe': 'M1', 'atr_period': 13, 'atr_threshold': 8.0, 'pt_mult': 5.0, 'sl_mult': 5.0, 'td_mins': 5}. Best is trial 695 with value: 2.153336081466255.
[I 2026-03-12 00:44:32,333] Trial 738 finished with value: 2.153336081466255 and parameters: {'timeframe': 'M1', 'atr_period': 13, 'atr_threshold': 2.0, 'pt_mult': 0.5, 'sl_mult': 5.0, 'td_mins': 5}. Best is trial 695 with value: 2.153336081466255.
[I 2026-03-12 00:44:32,380] Trial 739 finished with value: 0.0 and parameters: {'timeframe': 'M1', 'atr_period': 13, 'atr_threshold': 10.0, 'pt_mult': 5.0, 'sl_mult': 5.0, 'td_mins': 5}. Best is trial 695 with value: 2.153336081466255.
[I 2026-03-12 00:44:32,531] Trial 740 pruned. 
[I 2026-03-12 00:44:32,607] Trial 741 pruned. 
[I 2026-03-12 00:44:32,702] Trial 742 finished with value: 2.153336081466255 and parameters: {'timeframe': 'M1', 'atr_period': 13, 'atr_threshold': 2.0, 'pt_mult': 0.5, 'sl_mult': 5.0, 'td_mins': 5}. Best is trial 695 with value: 2.153336081466255.
[I 2026-03-12 00:44:32,751] Trial 743 finished with value: 0.0 and parameters: {'timeframe': 'M1', 'atr_period': 13, 'atr_threshold': 5.0, 'pt_mult': 2.5, 'sl_mult': 5.0, 'td_mins': 5}. Best is trial 695 with value: 2.153336081466255.
[I 2026-03-12 00:44:32,802] Trial 744 finished with value: 0.0 and parameters: {'timeframe': 'M1', 'atr_period': 13, 'atr_threshold': 15.0, 'pt_mult': 0.5, 'sl_mult': 5.0, 'td_mins': 360}. Best is trial 695 with value: 2.153336081466255.
[I 2026-03-12 00:44:32,852] Trial 745 finished with value: 0.0 and parameters: {'timeframe': 'M1', 'atr_period': 13, 'atr_threshold': 10.0, 'pt_mult': 0.5, 'sl_mult': 5.0, 'td_mins': 720}. Best is trial 695 with value: 2.153336081466255.
[I 2026-03-12 00:44:32,943] Trial 746 finished with value: 2.153336081466255 and parameters: {'timeframe': 'M1', 'atr_period': 13, 'atr_threshold': 2.0, 'pt_mult': 0.5, 'sl_mult': 5.0, 'td_mins': 5}. Best is trial 695 with value: 2.153336081466255.
[I 2026-03-12 00:44:32,993] Trial 747 finished with value: 0.0 and parameters: {'timeframe': 'M1', 'atr_period': 13, 'atr_threshold': 3.0, 'pt_mult': 0.5, 'sl_mult': 5.0, 'td_mins': 1080}. Best is trial 695 with value: 2.153336081466255.
[I 2026-03-12 00:44:33,042] Trial 748 finished with value: 0.0 and parameters: {'timeframe': 'M1', 'atr_period': 13, 'atr_threshold': 8.0, 'pt_mult': 0.5, 'sl_mult': 1.0, 'td_mins': 5}. Best is trial 695 with value: 2.153336081466255.
[I 2026-03-12 00:44:33,150] Trial 749 pruned. 
[I 2026-03-12 00:44:33,199] Trial 750 finished with value: 0.0 and parameters: {'timeframe': 'M1', 'atr_period': 13, 'atr_threshold': 3.0, 'pt_mult': 0.5, 'sl_mult': 1.0, 'td_mins': 5}. Best is trial 695 with value: 2.153336081466255.
