[I 2026-03-12 00:43:46,531] Trial 522 finished with value: 1.778026240865349 and parameters: {'timeframe': 'M1', 'atr_period': 13, 'atr_threshold': 2.0, 'pt_mult': 1.0, 'sl_mult': 5.0, 'td_mins': 15}. Best is trial 374 with value: 1.778026240865349.
[I 2026-03-12 00:43:46,661] Trial 523 finished with value: 1.778026240865349 and parameters: {'timeframe': 'M1', 'atr_period': 13, 'atr_threshold': 2.0, 'pt_mult': 1.0, 'sl_mult': 5.0, 'td_mins': 15}. Best is trial 374 with value: 1.778026240865349.
[I 2026-03-12 00:43:47,732] Trial 524 finished with value: 0.946089635732213 and parameters: {'timeframe': 'M1', 'atr_period': 13, 'atr_threshold': 2.0, 'pt_mult': 1.0, 'sl_mult': 5.0, 'td_mins': 720}. Best is trial 374 with value: 1.778026240865349.
[I 2026-03-12 00:43:47,871] Trial 525 finished with value: 1.7544910219295822 and parameters: {'timeframe': 'M1', 'atr_period': 13, 'atr_threshold': 2.0, 'pt_mult': 0.5, 'sl_mult': 5.0, 'td_mins': 15}. Best is trial 374 with value: 1.778026240865349.
[I 2026-03-12 00:43:48,011] Trial 526 finished with value: 1.778026240865349 and parameters: {'timeframe': 'M1', 'atr_period': 13, 'atr_threshold': 2.0, 'pt_mult': 1.0, 'sl_mult': 5.0, 'td_mins': 15}. Best is trial 374 with value: 1.778026240865349.
[I 2026-03-12 00:43:48,150] Trial 527 finished with value: 1.778026240865349 and parameters: {'timeframe': 'M1', 'atr_period': 13, 'atr_threshold': 2.0, 'pt_mult': 1.0, 'sl_mult': 5.0, 'td_mins': 15}. Best is trial 374 with value: 1.778026240865349.
[I 2026-03-12 00:43:48,282] Trial 528 finished with value: 1.778026240865349 and parameters: {'timeframe': 'M1', 'atr_period': 13, 'atr_threshold': 2.0, 'pt_mult': 1.0, 'sl_mult': 5.0, 'td_mins': 15}. Best is trial 374 with value: 1.778026240865349.
[I 2026-03-12 00:43:48,374] Trial 529 pruned. 
[I 2026-03-12 00:43:48,423] Trial 530 finished with value: 0.0 and parameters: {'timeframe': 'M1', 'atr_period': 13, 'atr_threshold': 5.0, 'pt_mult': 0.5, 'sl_mult': 5.0, 'td_mins': 15}. Best is trial 374 with value: 1.778026240865349.
[I 2026-03-12 00:43:48,919] Trial 531 finished with value: 0.9944714046348431 and parameters: {'timeframe': 'M1', 'atr_period': 13, 'atr_threshold': 2.0, 'pt_mult': 5.0, 'sl_mult': 5.0, 'td_mins': 120}. Best is trial 374 with value: 1.778026240865349.
[I 2026-03-12 00:43:48,971] Trial 532 finished with value: 0.0 and parameters: {'timeframe': 'M1', 'atr_period': 13, 'atr_threshold': 10.0, 'pt_mult': 1.0, 'sl_mult': 5.0, 'td_mins': 15}. Best is trial 374 with value: 1.778026240865349.
[I 2026-03-12 00:43:49,113] Trial 533 finished with value: 1.778026240865349 and parameters: {'timeframe': 'M1', 'atr_period': 13, 'atr_threshold': 2.0, 'pt_mult': 1.0, 'sl_mult': 5.0, 'td_mins': 15}. Best is trial 374 with value: 1.778026240865349.
[I 2026-03-12 00:43:49,162] Trial 534 finished with value: 0.0 and parameters: {'timeframe': 'M1', 'atr_period': 13, 'atr_threshold': 15.0, 'pt_mult': 5.0, 'sl_mult': 5.0, 'td_mins': 15}. Best is trial 374 with value: 1.778026240865349.
[I 2026-03-12 00:43:49,210] Trial 535 finished with value: 0.0 and parameters: {'timeframe': 'M1', 'atr_period': 13, 'atr_threshold': 5.0, 'pt_mult': 1.0, 'sl_mult': 5.0, 'td_mins': 1200}. Best is trial 374 with value: 1.778026240865349.
[I 2026-03-12 00:43:49,257] Trial 536 finished with value: 0.0 and parameters: {'timeframe': 'M1', 'atr_period': 13, 'atr_threshold': 3.0, 'pt_mult': 1.0, 'sl_mult': 5.0, 'td_mins': 1080}. Best is trial 374 with value: 1.778026240865349.
[I 2026-03-12 00:43:49,304] Trial 537 finished with value: 0.0 and parameters: {'timeframe': 'M1', 'atr_period': 13, 'atr_threshold': 15.0, 'pt_mult': 1.0, 'sl_mult': 2.5, 'td_mins': 15}. Best is trial 374 with value: 1.778026240865349.
[I 2026-03-12 00:43:49,673] Trial 538 pruned. 
[I 2026-03-12 00:43:50,388] Trial 539 finished with value: 0.958445290988671 and parameters: {'timeframe': 'M1', 'atr_period': 13, 'atr_threshold': 2.0, 'pt_mult': 1.0, 'sl_mult': 5.0, 'td_mins': 360}. Best is trial 374 with value: 1.778026240865349.
[I 2026-03-12 00:43:50,557] Trial 540 finished with value: 1.778026240865349 and parameters: {'timeframe': 'M1', 'atr_period': 13, 'atr_threshold': 2.0, 'pt_mult': 1.0, 'sl_mult': 5.0, 'td_mins': 15}. Best is trial 374 with value: 1.778026240865349.
[I 2026-03-12 00:43:50,609] Trial 541 finished with value: 0.0 and parameters: {'timeframe': 'M1', 'atr_period': 13, 'atr_threshold': 8.0, 'pt_mult': 1.0, 'sl_mult': 5.0, 'td_mins': 15}. Best is trial 374 with value: 1.778026240865349.
[I 2026-03-12 00:43:50,769] Trial 542 finished with value: 1.778026240865349 and parameters: {'timeframe': 'M1', 'atr_period': 13, 'atr_threshold': 2.0, 'pt_mult': 1.0, 'sl_mult': 5.0, 'td_mins': 15}. Best is trial 374 with value: 1.778026240865349.
[I 2026-03-12 00:43:50,904] Trial 543 finished with value: 1.778026240865349 and parameters: {'timeframe': 'M1', 'atr_period': 13, 'atr_threshold': 2.0, 'pt_mult': 1.0, 'sl_mult': 5.0, 'td_mins': 15}. Best is trial 374 with value: 1.778026240865349.
[I 2026-03-12 00:43:51,786] Trial 544 pruned. 
[I 2026-03-12 00:43:51,929] Trial 545 finished with value: 1.778026240865349 and parameters: {'timeframe': 'M1', 'atr_period': 13, 'atr_threshold': 2.0, 'pt_mult': 1.0, 'sl_mult': 5.0, 'td_mins': 15}. Best is trial 374 with value: 1.778026240865349.
[I 2026-03-12 00:43:51,978] Trial 546 finished with value: 0.0 and parameters: {'timeframe': 'M1', 'atr_period': 13, 'atr_threshold': 8.0, 'pt_mult': 1.0, 'sl_mult': 5.0, 'td_mins': 360}. Best is trial 374 with value: 1.778026240865349.
[I 2026-03-12 00:43:52,307] Trial 547 pruned. 
[I 2026-03-12 00:43:53,297] Trial 548 pruned. 
[I 2026-03-12 00:43:53,355] Trial 549 finished with value: 0.0 and parameters: {'timeframe': 'M1', 'atr_period': 13, 'atr_threshold': 5.0, 'pt_mult': 1.0, 'sl_mult': 5.0, 'td_mins': 60}. Best is trial 374 with value: 1.778026240865349.
[I 2026-03-12 00:43:53,415] Trial 550 finished with value: 0.0 and parameters: {'timeframe': 'M1', 'atr_period': 13, 'atr_threshold': 5.0, 'pt_mult': 1.0, 'sl_mult': 5.0, 'td_mins': 15}. Best is trial 374 with value: 1.778026240865349.
[I 2026-03-12 00:43:53,468] Trial 551 finished with value: 0.0 and parameters: {'timeframe': 'M1', 'atr_period': 13, 'atr_threshold': 15.0, 'pt_mult': 1.0, 'sl_mult': 5.0, 'td_mins': 1080}. Best is trial 374 with value: 1.778026240865349.
[I 2026-03-12 00:43:53,627] Trial 552 finished with value: 1.778026240865349 and parameters: {'timeframe': 'M1', 'atr_period': 13, 'atr_threshold': 2.0, 'pt_mult': 1.0, 'sl_mult': 5.0, 'td_mins': 15}. Best is trial 374 with value: 1.778026240865349.
[I 2026-03-12 00:43:53,706] Trial 553 pruned. 
[I 2026-03-12 00:43:53,861] Trial 554 finished with value: 1.778026240865349 and parameters: {'timeframe': 'M1', 'atr_period': 13, 'atr_threshold': 2.0, 'pt_mult': 1.0, 'sl_mult': 5.0, 'td_mins': 15}. Best is trial 374 with value: 1.778026240865349.
[I 2026-03-12 00:43:54,016] Trial 555 finished with value: 1.778026240865349 and parameters: {'timeframe': 'M1', 'atr_period': 13, 'atr_threshold': 2.0, 'pt_mult': 1.0, 'sl_mult': 5.0, 'td_mins': 15}. Best is trial 374 with value: 1.778026240865349.
[I 2026-03-12 00:43:54,174] Trial 556 finished with value: 1.778026240865349 and parameters: {'timeframe': 'M1', 'atr_period': 13, 'atr_threshold': 2.0, 'pt_mult': 1.0, 'sl_mult': 5.0, 'td_mins': 15}. Best is trial 374 with value: 1.778026240865349.
[I 2026-03-12 00:43:54,250] Trial 557 pruned. 
[I 2026-03-12 00:43:54,307] Trial 558 finished with value: 0.0 and parameters: {'timeframe': 'M1', 'atr_period': 13, 'atr_threshold': 5.0, 'pt_mult': 1.0, 'sl_mult': 2.5, 'td_mins': 180}. Best is trial 374 with value: 1.778026240865349.
[I 2026-03-12 00:43:54,465] Trial 559 finished with value: 1.778026240865349 and parameters: {'timeframe': 'M1', 'atr_period': 13, 'atr_threshold': 2.0, 'pt_mult': 1.0, 'sl_mult': 5.0, 'td_mins': 15}. Best is trial 374 with value: 1.778026240865349.
[I 2026-03-12 00:43:54,633] Trial 560 finished with value: 1.778026240865349 and parameters: {'timeframe': 'M1', 'atr_period': 13, 'atr_threshold': 2.0, 'pt_mult': 1.0, 'sl_mult': 5.0, 'td_mins': 15}. Best is trial 374 with value: 1.778026240865349.
[I 2026-03-12 00:43:54,786] Trial 561 finished with value: 1.778026240865349 and parameters: {'timeframe': 'M1', 'atr_period': 13, 'atr_threshold': 2.0, 'pt_mult': 1.0, 'sl_mult': 5.0, 'td_mins': 15}. Best is trial 374 with value: 1.778026240865349.
[I 2026-03-12 00:43:54,834] Trial 562 finished with value: 0.0 and parameters: {'timeframe': 'M1', 'atr_period': 13, 'atr_threshold': 15.0, 'pt_mult': 1.0, 'sl_mult': 5.0, 'td_mins': 720}. Best is trial 374 with value: 1.778026240865349.
[I 2026-03-12 00:43:54,970] Trial 563 finished with value: 1.778026240865349 and parameters: {'timeframe': 'M1', 'atr_period': 13, 'atr_threshold': 2.0, 'pt_mult': 1.0, 'sl_mult': 5.0, 'td_mins': 15}. Best is trial 374 with value: 1.778026240865349.
[I 2026-03-12 00:43:55,214] Trial 564 pruned. 
[I 2026-03-12 00:43:55,430] Trial 565 finished with value: 1.2633955128037777 and parameters: {'timeframe': 'M1', 'atr_period': 13, 'atr_threshold': 2.0, 'pt_mult': 1.0, 'sl_mult': 5.0, 'td_mins': 30}. Best is trial 374 with value: 1.778026240865349.
[I 2026-03-12 00:43:55,514] Trial 566 pruned. 
[I 2026-03-12 00:43:55,673] Trial 567 finished with value: 1.778026240865349 and parameters: {'timeframe': 'M1', 'atr_period': 13, 'atr_threshold': 2.0, 'pt_mult': 1.0, 'sl_mult': 5.0, 'td_mins': 15}. Best is trial 374 with value: 1.778026240865349.
[I 2026-03-12 00:43:55,816] Trial 568 finished with value: 1.778026240865349 and parameters: {'timeframe': 'M1', 'atr_period': 13, 'atr_threshold': 2.0, 'pt_mult': 1.0, 'sl_mult': 5.0, 'td_mins': 15}. Best is trial 374 with value: 1.778026240865349.
[I 2026-03-12 00:43:55,906] Trial 569 pruned. 
[I 2026-03-12 00:43:56,049] Trial 570 finished with value: 1.778026240865349 and parameters: {'timeframe': 'M1', 'atr_period': 13, 'atr_threshold': 2.0, 'pt_mult': 1.0, 'sl_mult': 5.0, 'td_mins': 15}. Best is trial 374 with value: 1.778026240865349.
[I 2026-03-12 00:43:56,098] Trial 571 finished with value: 0.0 and parameters: {'timeframe': 'M1', 'atr_period': 13, 'atr_threshold': 15.0, 'pt_mult': 2.5, 'sl_mult': 5.0, 'td_mins': 15}. Best is trial 374 with value: 1.778026240865349.
[I 2026-03-12 00:43:56,202] Trial 572 pruned. 
[I 2026-03-12 00:43:56,339] Trial 573 finished with value: 1.778026240865349 and parameters: {'timeframe': 'M1', 'atr_period': 13, 'atr_threshold': 2.0, 'pt_mult': 1.0, 'sl_mult': 5.0, 'td_mins': 15}. Best is trial 374 with value: 1.778026240865349.
[I 2026-03-12 00:43:57,625] Trial 574 finished with value: 1.0586567652293908 and parameters: {'timeframe': 'M1', 'atr_period': 13, 'atr_threshold': 2.0, 'pt_mult': 2.5, 'sl_mult': 5.0, 'td_mins': 720}. Best is trial 374 with value: 1.778026240865349.
[I 2026-03-12 00:43:57,863] Trial 575 pruned. 
[I 2026-03-12 00:43:58,008] Trial 576 finished with value: 1.1825108596082887 and parameters: {'timeframe': 'M1', 'atr_period': 13, 'atr_threshold': 2.0, 'pt_mult': 2.5, 'sl_mult': 5.0, 'td_mins': 15}. Best is trial 374 with value: 1.778026240865349.
[I 2026-03-12 00:43:58,054] Trial 577 finished with value: 0.0 and parameters: {'timeframe': 'M1', 'atr_period': 13, 'atr_threshold': 8.0, 'pt_mult': 1.0, 'sl_mult': 2.5, 'td_mins': 15}. Best is trial 374 with value: 1.778026240865349.
[I 2026-03-12 00:43:58,110] Trial 578 pruned. 
[I 2026-03-12 00:43:58,754] Trial 579 finished with value: 1.0184889809259696 and parameters: {'timeframe': 'M1', 'atr_period': 13, 'atr_threshold': 2.0, 'pt_mult': 5.0, 'sl_mult': 5.0, 'td_mins': 180}. Best is trial 374 with value: 1.778026240865349.
[I 2026-03-12 00:43:59,001] Trial 580 pruned. 
[I 2026-03-12 00:43:59,058] Trial 581 pruned. 
[I 2026-03-12 00:44:00,390] Trial 582 finished with value: 1.027146247752522 and parameters: {'timeframe': 'M1', 'atr_period': 13, 'atr_threshold': 2.0, 'pt_mult': 2.5, 'sl_mult': 2.5, 'td_mins': 1080}. Best is trial 374 with value: 1.778026240865349.
[I 2026-03-12 00:44:00,621] Trial 583 finished with value: 1.135994645496098 and parameters: {'timeframe': 'M1', 'atr_period': 13, 'atr_threshold': 2.0, 'pt_mult': 2.5, 'sl_mult': 5.0, 'td_mins': 30}. Best is trial 374 with value: 1.778026240865349.
[I 2026-03-12 00:44:02,480] Trial 584 finished with value: 1.048363051591292 and parameters: {'timeframe': 'M1', 'atr_period': 13, 'atr_threshold': 2.0, 'pt_mult': 2.5, 'sl_mult': 5.0, 'td_mins': 1200}. Best is trial 374 with value: 1.778026240865349.
[I 2026-03-12 00:44:04,035] Trial 585 finished with value: 0.9507615277386618 and parameters: {'timeframe': 'M1', 'atr_period': 13, 'atr_threshold': 2.0, 'pt_mult': 1.0, 'sl_mult': 5.0, 'td_mins': 1200}. Best is trial 374 with value: 1.778026240865349.
[I 2026-03-12 00:44:04,082] Trial 586 finished with value: 0.0 and parameters: {'timeframe': 'M1', 'atr_period': 13, 'atr_threshold': 5.0, 'pt_mult': 2.5, 'sl_mult': 0.5, 'td_mins': 1200}. Best is trial 374 with value: 1.778026240865349.
[I 2026-03-12 00:44:04,220] Trial 587 finished with value: 1.778026240865349 and parameters: {'timeframe': 'M1', 'atr_period': 13, 'atr_threshold': 2.0, 'pt_mult': 1.0, 'sl_mult': 5.0, 'td_mins': 15}. Best is trial 374 with value: 1.778026240865349.
[I 2026-03-12 00:44:04,268] Trial 588 finished with value: 0.0 and parameters: {'timeframe': 'M1', 'atr_period': 13, 'atr_threshold': 15.0, 'pt_mult': 5.0, 'sl_mult': 2.5, 'td_mins': 180}. Best is trial 374 with value: 1.778026240865349.
[I 2026-03-12 00:44:04,317] Trial 589 finished with value: 0.0 and parameters: {'timeframe': 'M1', 'atr_period': 13, 'atr_threshold': 15.0, 'pt_mult': 1.0, 'sl_mult': 5.0, 'td_mins': 15}. Best is trial 374 with value: 1.778026240865349.
[I 2026-03-12 00:44:04,364] Trial 590 finished with value: 0.0 and parameters: {'timeframe': 'M1', 'atr_period': 13, 'atr_threshold': 10.0, 'pt_mult': 1.0, 'sl_mult': 5.0, 'td_mins': 5}. Best is trial 374 with value: 1.778026240865349.
[I 2026-03-12 00:44:04,417] Trial 591 pruned. 
[I 2026-03-12 00:44:04,495] Trial 592 pruned. 
[I 2026-03-12 00:44:04,573] Trial 593 pruned. 
[I 2026-03-12 00:44:04,803] Trial 594 pruned. 
[I 2026-03-12 00:44:04,902] Trial 595 pruned. 
[I 2026-03-12 00:44:05,338] Trial 596 finished with value: 1.5345820563546146 and parameters: {'timeframe': 'M1', 'atr_period': 13, 'atr_threshold': 1.0, 'pt_mult': 1.0, 'sl_mult': 5.0, 'td_mins': 15}. Best is trial 374 with value: 1.778026240865349.
[I 2026-03-12 00:44:06,802] Trial 597 finished with value: 0.9507615277386618 and parameters: {'timeframe': 'M1', 'atr_period': 13, 'atr_threshold': 2.0, 'pt_mult': 1.0, 'sl_mult': 5.0, 'td_mins': 1080}. Best is trial 374 with value: 1.778026240865349.
[I 2026-03-12 00:44:06,938] Trial 598 finished with value: 1.7544910219295822 and parameters: {'timeframe': 'M1', 'atr_period': 13, 'atr_threshold': 2.0, 'pt_mult': 0.5, 'sl_mult': 5.0, 'td_mins': 15}. Best is trial 374 with value: 1.778026240865349.
[I 2026-03-12 00:44:07,083] Trial 599 finished with value: 1.778026240865349 and parameters: {'timeframe': 'M1', 'atr_period': 13, 'atr_threshold': 2.0, 'pt_mult': 1.0, 'sl_mult': 5.0, 'td_mins': 15}. Best is trial 374 with value: 1.778026240865349.
[I 2026-03-12 00:44:07,579] Trial 600 finished with value: 0.9806061701878208 and parameters: {'timeframe': 'M1', 'atr_period': 13, 'atr_threshold': 2.0, 'pt_mult': 1.0, 'sl_mult': 5.0, 'td_mins': 180}. Best is trial 374 with value: 1.778026240865349.
[I 2026-03-12 00:44:07,713] Trial 601 finished with value: 1.778026240865349 and parameters: {'timeframe': 'M1', 'atr_period': 13, 'atr_threshold': 2.0, 'pt_mult': 1.0, 'sl_mult': 5.0, 'td_mins': 15}. Best is trial 374 with value: 1.778026240865349.
[I 2026-03-12 00:44:07,766] Trial 602 finished with value: 0.0 and parameters: {'timeframe': 'M1', 'atr_period': 13, 'atr_threshold': 3.0, 'pt_mult': 1.0, 'sl_mult': 5.0, 'td_mins': 120}. Best is trial 374 with value: 1.778026240865349.
[I 2026-03-12 00:44:08,051] Trial 603 finished with value: 1.0674388283470675 and parameters: {'timeframe': 'M1', 'atr_period': 13, 'atr_threshold': 2.0, 'pt_mult': 1.0, 'sl_mult': 5.0, 'td_mins': 60}. Best is trial 374 with value: 1.778026240865349.
[I 2026-03-12 00:44:08,098] Trial 604 finished with value: 0.0 and parameters: {'timeframe': 'M1', 'atr_period': 13, 'atr_threshold': 3.0, 'pt_mult': 1.0, 'sl_mult': 5.0, 'td_mins': 15}. Best is trial 374 with value: 1.778026240865349.
[I 2026-03-12 00:44:08,149] Trial 605 finished with value: 0.0 and parameters: {'timeframe': 'M1', 'atr_period': 13, 'atr_threshold': 5.0, 'pt_mult': 5.0, 'sl_mult': 5.0, 'td_mins': 720}. Best is trial 374 with value: 1.778026240865349.
[I 2026-03-12 00:44:08,212] Trial 606 pruned. 
[I 2026-03-12 00:44:11,461] Trial 607 pruned. 
[I 2026-03-12 00:44:11,912] Trial 608 finished with value: 1.0159756537053202 and parameters: {'timeframe': 'M1', 'atr_period': 13, 'atr_threshold': 2.0, 'pt_mult': 1.0, 'sl_mult': 5.0, 'td_mins': 120}. Best is trial 374 with value: 1.778026240865349.
[I 2026-03-12 00:44:12,080] Trial 609 finished with value: 1.778026240865349 and parameters: {'timeframe': 'M1', 'atr_period': 13, 'atr_threshold': 2.0, 'pt_mult': 1.0, 'sl_mult': 5.0, 'td_mins': 15}. Best is trial 374 with value: 1.778026240865349.
[I 2026-03-12 00:44:12,241] Trial 610 finished with value: 1.778026240865349 and parameters: {'timeframe': 'M1', 'atr_period': 13, 'atr_threshold': 2.0, 'pt_mult': 1.0, 'sl_mult': 5.0, 'td_mins': 15}. Best is trial 374 with value: 1.778026240865349.
[I 2026-03-12 00:44:12,322] Trial 611 pruned. 
[I 2026-03-12 00:44:12,440] Trial 612 pruned. 
[I 2026-03-12 00:44:12,604] Trial 613 finished with value: 1.778026240865349 and parameters: {'timeframe': 'M1', 'atr_period': 13, 'atr_threshold': 2.0, 'pt_mult': 1.0, 'sl_mult': 5.0, 'td_mins': 15}. Best is trial 374 with value: 1.778026240865349.
[I 2026-03-12 00:44:12,666] Trial 614 finished with value: 0.0 and parameters: {'timeframe': 'M1', 'atr_period': 13, 'atr_threshold': 10.0, 'pt_mult': 5.0, 'sl_mult': 0.5, 'td_mins': 360}. Best is trial 374 with value: 1.778026240865349.
[I 2026-03-12 00:44:12,720] Trial 615 finished with value: 0.0 and parameters: {'timeframe': 'M1', 'atr_period': 13, 'atr_threshold': 5.0, 'pt_mult': 5.0, 'sl_mult': 5.0, 'td_mins': 15}. Best is trial 374 with value: 1.778026240865349.
[I 2026-03-12 00:44:12,881] Trial 616 finished with value: 1.778026240865349 and parameters: {'timeframe': 'M1', 'atr_period': 13, 'atr_threshold': 2.0, 'pt_mult': 1.0, 'sl_mult': 5.0, 'td_mins': 15}. Best is trial 374 with value: 1.778026240865349.
[I 2026-03-12 00:44:13,199] Trial 617 pruned. 
[I 2026-03-12 00:44:13,246] Trial 618 finished with value: 0.0 and parameters: {'timeframe': 'M1', 'atr_period': 13, 'atr_threshold': 15.0, 'pt_mult': 2.5, 'sl_mult': 0.5, 'td_mins': 1080}. Best is trial 374 with value: 1.778026240865349.
[I 2026-03-12 00:44:13,322] Trial 619 pruned. 
[I 2026-03-12 00:44:13,380] Trial 620 pruned. 
[I 2026-03-12 00:44:13,436] Trial 621 pruned. 
[I 2026-03-12 00:44:13,618] Trial 622 finished with value: 1.778026240865349 and parameters: {'timeframe': 'M1', 'atr_period': 13, 'atr_threshold': 2.0, 'pt_mult': 1.0, 'sl_mult': 5.0, 'td_mins': 15}. Best is trial 374 with value: 1.778026240865349.
[I 2026-03-12 00:44:13,665] Trial 623 finished with value: 0.0 and parameters: {'timeframe': 'M1', 'atr_period': 13, 'atr_threshold': 10.0, 'pt_mult': 1.0, 'sl_mult': 1.0, 'td_mins': 15}. Best is trial 374 with value: 1.778026240865349.
[I 2026-03-12 00:44:13,717] Trial 624 finished with value: 0.0 and parameters: {'timeframe': 'M1', 'atr_period': 13, 'atr_threshold': 15.0, 'pt_mult': 5.0, 'sl_mult': 1.0, 'td_mins': 120}. Best is trial 374 with value: 1.778026240865349.
[I 2026-03-12 00:44:13,860] Trial 625 finished with value: 1.778026240865349 and parameters: {'timeframe': 'M1', 'atr_period': 13, 'atr_threshold': 2.0, 'pt_mult': 1.0, 'sl_mult': 5.0, 'td_mins': 15}. Best is trial 374 with value: 1.778026240865349.
[I 2026-03-12 00:44:13,912] Trial 626 finished with value: 0.0 and parameters: {'timeframe': 'M1', 'atr_period': 13, 'atr_threshold': 10.0, 'pt_mult': 2.5, 'sl_mult': 0.5, 'td_mins': 30}. Best is trial 374 with value: 1.778026240865349.
[I 2026-03-12 00:44:14,134] Trial 627 pruned. 
[I 2026-03-12 00:44:14,187] Trial 628 finished with value: 0.0 and parameters: {'timeframe': 'M1', 'atr_period': 13, 'atr_threshold': 10.0, 'pt_mult': 1.0, 'sl_mult': 5.0, 'td_mins': 15}. Best is trial 374 with value: 1.778026240865349.
[I 2026-03-12 00:44:14,300] Trial 629 pruned. 
[I 2026-03-12 00:44:14,470] Trial 630 finished with value: 1.778026240865349 and parameters: {'timeframe': 'M1', 'atr_period': 13, 'atr_threshold': 2.0, 'pt_mult': 1.0, 'sl_mult': 5.0, 'td_mins': 15}. Best is trial 374 with value: 1.778026240865349.
[I 2026-03-12 00:44:14,592] Trial 631 pruned. 
[I 2026-03-12 00:44:14,641] Trial 632 finished with value: 0.0 and parameters: {'timeframe': 'M1', 'atr_period': 13, 'atr_threshold': 5.0, 'pt_mult': 2.5, 'sl_mult': 5.0, 'td_mins': 1080}. Best is trial 374 with value: 1.778026240865349.
[I 2026-03-12 00:44:14,777] Trial 633 finished with value: 1.778026240865349 and parameters: {'timeframe': 'M1', 'atr_period': 13, 'atr_threshold': 2.0, 'pt_mult': 1.0, 'sl_mult': 5.0, 'td_mins': 15}. Best is trial 374 with value: 1.778026240865349.
[I 2026-03-12 00:44:15,975] Trial 634 finished with value: 0.983889970457162 and parameters: {'timeframe': 'M1', 'atr_period': 13, 'atr_threshold': 2.0, 'pt_mult': 5.0, 'sl_mult': 5.0, 'td_mins': 360}. Best is trial 374 with value: 1.778026240865349.
[I 2026-03-12 00:44:16,029] Trial 635 finished with value: 0.0 and parameters: {'timeframe': 'M1', 'atr_period': 13, 'atr_threshold': 8.0, 'pt_mult': 1.0, 'sl_mult': 5.0, 'td_mins': 15}. Best is trial 374 with value: 1.778026240865349.
