[I 2026-03-12 01:48:06,023] Trial 409 finished with value: 0.0 and parameters: {'timeframe': 'M5', 'atr_period': 13, 'atr_threshold': 15.0, 'pt_mult': 1.0, 'sl_mult': 5.0, 'td_mins': 60}. Best is trial 377 with value: 2.3951380426385716.
[I 2026-03-12 01:48:06,072] Trial 410 finished with value: 0.0 and parameters: {'timeframe': 'M5', 'atr_period': 13, 'atr_threshold': 5.0, 'pt_mult': 1.0, 'sl_mult': 5.0, 'td_mins': 60}. Best is trial 377 with value: 2.3951380426385716.
[I 2026-03-12 01:48:06,243] Trial 411 finished with value: 2.3951380426385716 and parameters: {'timeframe': 'M5', 'atr_period': 13, 'atr_threshold': 3.0, 'pt_mult': 1.0, 'sl_mult': 5.0, 'td_mins': 60}. Best is trial 377 with value: 2.3951380426385716.
[I 2026-03-12 01:48:06,302] Trial 412 pruned. 
[I 2026-03-12 01:48:06,481] Trial 413 finished with value: 2.3951380426385716 and parameters: {'timeframe': 'M5', 'atr_period': 13, 'atr_threshold': 3.0, 'pt_mult': 1.0, 'sl_mult': 5.0, 'td_mins': 60}. Best is trial 377 with value: 2.3951380426385716.
[I 2026-03-12 01:48:06,542] Trial 414 pruned. 
[I 2026-03-12 01:48:06,801] Trial 415 finished with value: 2.428310938085524 and parameters: {'timeframe': 'M5', 'atr_period': 13, 'atr_threshold': 3.0, 'pt_mult': 1.0, 'sl_mult': 5.0, 'td_mins': 120}. Best is trial 415 with value: 2.428310938085524.
[I 2026-03-12 01:48:06,849] Trial 416 finished with value: 0.0 and parameters: {'timeframe': 'M5', 'atr_period': 13, 'atr_threshold': 8.0, 'pt_mult': 1.0, 'sl_mult': 5.0, 'td_mins': 60}. Best is trial 415 with value: 2.428310938085524.
[I 2026-03-12 01:48:07,107] Trial 417 finished with value: 2.428310938085524 and parameters: {'timeframe': 'M5', 'atr_period': 13, 'atr_threshold': 3.0, 'pt_mult': 1.0, 'sl_mult': 5.0, 'td_mins': 120}. Best is trial 415 with value: 2.428310938085524.
[I 2026-03-12 01:48:07,371] Trial 418 finished with value: 2.428310938085524 and parameters: {'timeframe': 'M5', 'atr_period': 13, 'atr_threshold': 3.0, 'pt_mult': 1.0, 'sl_mult': 5.0, 'td_mins': 120}. Best is trial 415 with value: 2.428310938085524.
[I 2026-03-12 01:48:07,635] Trial 419 finished with value: 2.428310938085524 and parameters: {'timeframe': 'M5', 'atr_period': 13, 'atr_threshold': 3.0, 'pt_mult': 1.0, 'sl_mult': 5.0, 'td_mins': 120}. Best is trial 415 with value: 2.428310938085524.
[I 2026-03-12 01:48:08,070] Trial 420 pruned. 
[I 2026-03-12 01:48:08,339] Trial 421 finished with value: 2.428310938085524 and parameters: {'timeframe': 'M5', 'atr_period': 13, 'atr_threshold': 3.0, 'pt_mult': 1.0, 'sl_mult': 5.0, 'td_mins': 120}. Best is trial 415 with value: 2.428310938085524.
[I 2026-03-12 01:48:08,613] Trial 422 finished with value: 2.428310938085524 and parameters: {'timeframe': 'M5', 'atr_period': 13, 'atr_threshold': 3.0, 'pt_mult': 1.0, 'sl_mult': 5.0, 'td_mins': 120}. Best is trial 415 with value: 2.428310938085524.
[I 2026-03-12 01:48:08,756] Trial 423 pruned. 
[I 2026-03-12 01:48:09,026] Trial 424 finished with value: 2.428310938085524 and parameters: {'timeframe': 'M5', 'atr_period': 13, 'atr_threshold': 3.0, 'pt_mult': 1.0, 'sl_mult': 5.0, 'td_mins': 120}. Best is trial 415 with value: 2.428310938085524.
[I 2026-03-12 01:48:09,297] Trial 425 finished with value: 2.428310938085524 and parameters: {'timeframe': 'M5', 'atr_period': 13, 'atr_threshold': 3.0, 'pt_mult': 1.0, 'sl_mult': 5.0, 'td_mins': 120}. Best is trial 415 with value: 2.428310938085524.
[I 2026-03-12 01:48:09,568] Trial 426 finished with value: 2.428310938085524 and parameters: {'timeframe': 'M5', 'atr_period': 13, 'atr_threshold': 3.0, 'pt_mult': 1.0, 'sl_mult': 5.0, 'td_mins': 120}. Best is trial 415 with value: 2.428310938085524.
[I 2026-03-12 01:48:09,856] Trial 427 finished with value: 2.428310938085524 and parameters: {'timeframe': 'M5', 'atr_period': 13, 'atr_threshold': 3.0, 'pt_mult': 1.0, 'sl_mult': 5.0, 'td_mins': 120}. Best is trial 415 with value: 2.428310938085524.
[I 2026-03-12 01:48:10,144] Trial 428 finished with value: 2.428310938085524 and parameters: {'timeframe': 'M5', 'atr_period': 13, 'atr_threshold': 3.0, 'pt_mult': 1.0, 'sl_mult': 5.0, 'td_mins': 120}. Best is trial 415 with value: 2.428310938085524.
[I 2026-03-12 01:48:10,407] Trial 429 finished with value: 2.428310938085524 and parameters: {'timeframe': 'M5', 'atr_period': 13, 'atr_threshold': 3.0, 'pt_mult': 1.0, 'sl_mult': 5.0, 'td_mins': 120}. Best is trial 415 with value: 2.428310938085524.
[I 2026-03-12 01:48:10,684] Trial 430 finished with value: 2.428310938085524 and parameters: {'timeframe': 'M5', 'atr_period': 13, 'atr_threshold': 3.0, 'pt_mult': 1.0, 'sl_mult': 5.0, 'td_mins': 120}. Best is trial 415 with value: 2.428310938085524.
[I 2026-03-12 01:48:10,957] Trial 431 finished with value: 2.428310938085524 and parameters: {'timeframe': 'M5', 'atr_period': 13, 'atr_threshold': 3.0, 'pt_mult': 1.0, 'sl_mult': 5.0, 'td_mins': 120}. Best is trial 415 with value: 2.428310938085524.
[I 2026-03-12 01:48:11,236] Trial 432 finished with value: 2.428310938085524 and parameters: {'timeframe': 'M5', 'atr_period': 13, 'atr_threshold': 3.0, 'pt_mult': 1.0, 'sl_mult': 5.0, 'td_mins': 120}. Best is trial 415 with value: 2.428310938085524.
[I 2026-03-12 01:48:11,495] Trial 433 finished with value: 2.428310938085524 and parameters: {'timeframe': 'M5', 'atr_period': 13, 'atr_threshold': 3.0, 'pt_mult': 1.0, 'sl_mult': 5.0, 'td_mins': 120}. Best is trial 415 with value: 2.428310938085524.
[I 2026-03-12 01:48:11,763] Trial 434 finished with value: 2.428310938085524 and parameters: {'timeframe': 'M5', 'atr_period': 13, 'atr_threshold': 3.0, 'pt_mult': 1.0, 'sl_mult': 5.0, 'td_mins': 120}. Best is trial 415 with value: 2.428310938085524.
[I 2026-03-12 01:48:12,034] Trial 435 finished with value: 2.428310938085524 and parameters: {'timeframe': 'M5', 'atr_period': 13, 'atr_threshold': 3.0, 'pt_mult': 1.0, 'sl_mult': 5.0, 'td_mins': 120}. Best is trial 415 with value: 2.428310938085524.
[I 2026-03-12 01:48:12,299] Trial 436 finished with value: 2.428310938085524 and parameters: {'timeframe': 'M5', 'atr_period': 13, 'atr_threshold': 3.0, 'pt_mult': 1.0, 'sl_mult': 5.0, 'td_mins': 120}. Best is trial 415 with value: 2.428310938085524.
[I 2026-03-12 01:48:12,560] Trial 437 finished with value: 2.428310938085524 and parameters: {'timeframe': 'M5', 'atr_period': 13, 'atr_threshold': 3.0, 'pt_mult': 1.0, 'sl_mult': 5.0, 'td_mins': 120}. Best is trial 415 with value: 2.428310938085524.
[I 2026-03-12 01:48:12,821] Trial 438 finished with value: 2.428310938085524 and parameters: {'timeframe': 'M5', 'atr_period': 13, 'atr_threshold': 3.0, 'pt_mult': 1.0, 'sl_mult': 5.0, 'td_mins': 120}. Best is trial 415 with value: 2.428310938085524.
[I 2026-03-12 01:48:13,093] Trial 439 finished with value: 2.428310938085524 and parameters: {'timeframe': 'M5', 'atr_period': 13, 'atr_threshold': 3.0, 'pt_mult': 1.0, 'sl_mult': 5.0, 'td_mins': 120}. Best is trial 415 with value: 2.428310938085524.
[I 2026-03-12 01:48:13,384] Trial 440 finished with value: 2.428310938085524 and parameters: {'timeframe': 'M5', 'atr_period': 13, 'atr_threshold': 3.0, 'pt_mult': 1.0, 'sl_mult': 5.0, 'td_mins': 120}. Best is trial 415 with value: 2.428310938085524.
[I 2026-03-12 01:48:13,645] Trial 441 finished with value: 2.428310938085524 and parameters: {'timeframe': 'M5', 'atr_period': 13, 'atr_threshold': 3.0, 'pt_mult': 1.0, 'sl_mult': 5.0, 'td_mins': 120}. Best is trial 415 with value: 2.428310938085524.
[I 2026-03-12 01:48:13,920] Trial 442 finished with value: 2.428310938085524 and parameters: {'timeframe': 'M5', 'atr_period': 13, 'atr_threshold': 3.0, 'pt_mult': 1.0, 'sl_mult': 5.0, 'td_mins': 120}. Best is trial 415 with value: 2.428310938085524.
[I 2026-03-12 01:48:14,201] Trial 443 finished with value: 2.428310938085524 and parameters: {'timeframe': 'M5', 'atr_period': 13, 'atr_threshold': 3.0, 'pt_mult': 1.0, 'sl_mult': 5.0, 'td_mins': 120}. Best is trial 415 with value: 2.428310938085524.
[I 2026-03-12 01:48:14,253] Trial 444 finished with value: 0.0 and parameters: {'timeframe': 'M5', 'atr_period': 13, 'atr_threshold': 10.0, 'pt_mult': 1.0, 'sl_mult': 5.0, 'td_mins': 120}. Best is trial 415 with value: 2.428310938085524.
[I 2026-03-12 01:48:14,304] Trial 445 finished with value: 0.0 and parameters: {'timeframe': 'M5', 'atr_period': 13, 'atr_threshold': 5.0, 'pt_mult': 1.0, 'sl_mult': 5.0, 'td_mins': 120}. Best is trial 415 with value: 2.428310938085524.
[I 2026-03-12 01:48:14,375] Trial 446 pruned. 
[I 2026-03-12 01:48:14,665] Trial 447 finished with value: 2.428310938085524 and parameters: {'timeframe': 'M5', 'atr_period': 13, 'atr_threshold': 3.0, 'pt_mult': 1.0, 'sl_mult': 5.0, 'td_mins': 120}. Best is trial 415 with value: 2.428310938085524.
[I 2026-03-12 01:48:14,734] Trial 448 pruned. 
[I 2026-03-12 01:48:14,786] Trial 449 finished with value: 0.0 and parameters: {'timeframe': 'M5', 'atr_period': 13, 'atr_threshold': 8.0, 'pt_mult': 1.0, 'sl_mult': 5.0, 'td_mins': 120}. Best is trial 415 with value: 2.428310938085524.
[I 2026-03-12 01:48:15,072] Trial 450 finished with value: 2.428310938085524 and parameters: {'timeframe': 'M5', 'atr_period': 13, 'atr_threshold': 3.0, 'pt_mult': 1.0, 'sl_mult': 5.0, 'td_mins': 120}. Best is trial 415 with value: 2.428310938085524.
[I 2026-03-12 01:48:15,340] Trial 451 finished with value: 2.428310938085524 and parameters: {'timeframe': 'M5', 'atr_period': 13, 'atr_threshold': 3.0, 'pt_mult': 1.0, 'sl_mult': 5.0, 'td_mins': 120}. Best is trial 415 with value: 2.428310938085524.
[I 2026-03-12 01:48:15,613] Trial 452 finished with value: 2.428310938085524 and parameters: {'timeframe': 'M5', 'atr_period': 13, 'atr_threshold': 3.0, 'pt_mult': 1.0, 'sl_mult': 5.0, 'td_mins': 120}. Best is trial 415 with value: 2.428310938085524.
[I 2026-03-12 01:48:15,872] Trial 453 finished with value: 2.7631983640697526 and parameters: {'timeframe': 'M5', 'atr_period': 13, 'atr_threshold': 3.0, 'pt_mult': 0.5, 'sl_mult': 5.0, 'td_mins': 120}. Best is trial 453 with value: 2.7631983640697526.
[I 2026-03-12 01:48:16,124] Trial 454 finished with value: 2.7631983640697526 and parameters: {'timeframe': 'M5', 'atr_period': 13, 'atr_threshold': 3.0, 'pt_mult': 0.5, 'sl_mult': 5.0, 'td_mins': 120}. Best is trial 453 with value: 2.7631983640697526.
[I 2026-03-12 01:48:16,391] Trial 455 finished with value: 2.7631983640697526 and parameters: {'timeframe': 'M5', 'atr_period': 13, 'atr_threshold': 3.0, 'pt_mult': 0.5, 'sl_mult': 5.0, 'td_mins': 120}. Best is trial 453 with value: 2.7631983640697526.
[I 2026-03-12 01:48:16,705] Trial 456 pruned. 
[I 2026-03-12 01:48:16,845] Trial 457 pruned. 
[I 2026-03-12 01:48:17,102] Trial 458 finished with value: 2.7631983640697526 and parameters: {'timeframe': 'M5', 'atr_period': 13, 'atr_threshold': 3.0, 'pt_mult': 0.5, 'sl_mult': 5.0, 'td_mins': 120}. Best is trial 453 with value: 2.7631983640697526.
[I 2026-03-12 01:48:17,379] Trial 459 finished with value: 2.7631983640697526 and parameters: {'timeframe': 'M5', 'atr_period': 13, 'atr_threshold': 3.0, 'pt_mult': 0.5, 'sl_mult': 5.0, 'td_mins': 120}. Best is trial 453 with value: 2.7631983640697526.
[I 2026-03-12 01:48:17,632] Trial 460 finished with value: 2.7631983640697526 and parameters: {'timeframe': 'M5', 'atr_period': 13, 'atr_threshold': 3.0, 'pt_mult': 0.5, 'sl_mult': 5.0, 'td_mins': 120}. Best is trial 453 with value: 2.7631983640697526.
[I 2026-03-12 01:48:17,895] Trial 461 finished with value: 2.7631983640697526 and parameters: {'timeframe': 'M5', 'atr_period': 13, 'atr_threshold': 3.0, 'pt_mult': 0.5, 'sl_mult': 5.0, 'td_mins': 120}. Best is trial 453 with value: 2.7631983640697526.
[I 2026-03-12 01:48:18,149] Trial 462 finished with value: 2.7631983640697526 and parameters: {'timeframe': 'M5', 'atr_period': 13, 'atr_threshold': 3.0, 'pt_mult': 0.5, 'sl_mult': 5.0, 'td_mins': 120}. Best is trial 453 with value: 2.7631983640697526.
[I 2026-03-12 01:48:18,410] Trial 463 finished with value: 2.7631983640697526 and parameters: {'timeframe': 'M5', 'atr_period': 13, 'atr_threshold': 3.0, 'pt_mult': 0.5, 'sl_mult': 5.0, 'td_mins': 120}. Best is trial 453 with value: 2.7631983640697526.
[I 2026-03-12 01:48:18,670] Trial 464 finished with value: 2.7631983640697526 and parameters: {'timeframe': 'M5', 'atr_period': 13, 'atr_threshold': 3.0, 'pt_mult': 0.5, 'sl_mult': 5.0, 'td_mins': 120}. Best is trial 453 with value: 2.7631983640697526.
[I 2026-03-12 01:48:18,930] Trial 465 finished with value: 2.7631983640697526 and parameters: {'timeframe': 'M5', 'atr_period': 13, 'atr_threshold': 3.0, 'pt_mult': 0.5, 'sl_mult': 5.0, 'td_mins': 120}. Best is trial 453 with value: 2.7631983640697526.
[I 2026-03-12 01:48:19,176] Trial 466 finished with value: 2.7631983640697526 and parameters: {'timeframe': 'M5', 'atr_period': 13, 'atr_threshold': 3.0, 'pt_mult': 0.5, 'sl_mult': 5.0, 'td_mins': 120}. Best is trial 453 with value: 2.7631983640697526.
[I 2026-03-12 01:48:19,444] Trial 467 finished with value: 2.7631983640697526 and parameters: {'timeframe': 'M5', 'atr_period': 13, 'atr_threshold': 3.0, 'pt_mult': 0.5, 'sl_mult': 5.0, 'td_mins': 120}. Best is trial 453 with value: 2.7631983640697526.
[I 2026-03-12 01:48:19,726] Trial 468 finished with value: 2.7631983640697526 and parameters: {'timeframe': 'M5', 'atr_period': 13, 'atr_threshold': 3.0, 'pt_mult': 0.5, 'sl_mult': 5.0, 'td_mins': 120}. Best is trial 453 with value: 2.7631983640697526.
[I 2026-03-12 01:48:20,002] Trial 469 finished with value: 2.7631983640697526 and parameters: {'timeframe': 'M5', 'atr_period': 13, 'atr_threshold': 3.0, 'pt_mult': 0.5, 'sl_mult': 5.0, 'td_mins': 120}. Best is trial 453 with value: 2.7631983640697526.
[I 2026-03-12 01:48:20,280] Trial 470 finished with value: 2.7631983640697526 and parameters: {'timeframe': 'M5', 'atr_period': 13, 'atr_threshold': 3.0, 'pt_mult': 0.5, 'sl_mult': 5.0, 'td_mins': 120}. Best is trial 453 with value: 2.7631983640697526.
[I 2026-03-12 01:48:20,540] Trial 471 finished with value: 2.7631983640697526 and parameters: {'timeframe': 'M5', 'atr_period': 13, 'atr_threshold': 3.0, 'pt_mult': 0.5, 'sl_mult': 5.0, 'td_mins': 120}. Best is trial 453 with value: 2.7631983640697526.
[I 2026-03-12 01:48:20,806] Trial 472 finished with value: 2.7631983640697526 and parameters: {'timeframe': 'M5', 'atr_period': 13, 'atr_threshold': 3.0, 'pt_mult': 0.5, 'sl_mult': 5.0, 'td_mins': 120}. Best is trial 453 with value: 2.7631983640697526.
[I 2026-03-12 01:48:21,062] Trial 473 finished with value: 2.7631983640697526 and parameters: {'timeframe': 'M5', 'atr_period': 13, 'atr_threshold': 3.0, 'pt_mult': 0.5, 'sl_mult': 5.0, 'td_mins': 120}. Best is trial 453 with value: 2.7631983640697526.
[I 2026-03-12 01:48:21,324] Trial 474 finished with value: 2.7631983640697526 and parameters: {'timeframe': 'M5', 'atr_period': 13, 'atr_threshold': 3.0, 'pt_mult': 0.5, 'sl_mult': 5.0, 'td_mins': 120}. Best is trial 453 with value: 2.7631983640697526.
[I 2026-03-12 01:48:21,579] Trial 475 finished with value: 2.7631983640697526 and parameters: {'timeframe': 'M5', 'atr_period': 13, 'atr_threshold': 3.0, 'pt_mult': 0.5, 'sl_mult': 5.0, 'td_mins': 120}. Best is trial 453 with value: 2.7631983640697526.
[I 2026-03-12 01:48:21,844] Trial 476 finished with value: 2.7631983640697526 and parameters: {'timeframe': 'M5', 'atr_period': 13, 'atr_threshold': 3.0, 'pt_mult': 0.5, 'sl_mult': 5.0, 'td_mins': 120}. Best is trial 453 with value: 2.7631983640697526.
[I 2026-03-12 01:48:22,097] Trial 477 finished with value: 2.7631983640697526 and parameters: {'timeframe': 'M5', 'atr_period': 13, 'atr_threshold': 3.0, 'pt_mult': 0.5, 'sl_mult': 5.0, 'td_mins': 120}. Best is trial 453 with value: 2.7631983640697526.
[I 2026-03-12 01:48:22,353] Trial 478 finished with value: 2.7631983640697526 and parameters: {'timeframe': 'M5', 'atr_period': 13, 'atr_threshold': 3.0, 'pt_mult': 0.5, 'sl_mult': 5.0, 'td_mins': 120}. Best is trial 453 with value: 2.7631983640697526.
[I 2026-03-12 01:48:22,612] Trial 479 finished with value: 2.7631983640697526 and parameters: {'timeframe': 'M5', 'atr_period': 13, 'atr_threshold': 3.0, 'pt_mult': 0.5, 'sl_mult': 5.0, 'td_mins': 120}. Best is trial 453 with value: 2.7631983640697526.
[I 2026-03-12 01:48:22,876] Trial 480 finished with value: 2.7631983640697526 and parameters: {'timeframe': 'M5', 'atr_period': 13, 'atr_threshold': 3.0, 'pt_mult': 0.5, 'sl_mult': 5.0, 'td_mins': 120}. Best is trial 453 with value: 2.7631983640697526.
[I 2026-03-12 01:48:23,006] Trial 481 pruned. 
[I 2026-03-12 01:48:23,056] Trial 482 finished with value: 0.0 and parameters: {'timeframe': 'M5', 'atr_period': 13, 'atr_threshold': 15.0, 'pt_mult': 0.5, 'sl_mult': 5.0, 'td_mins': 120}. Best is trial 453 with value: 2.7631983640697526.
[I 2026-03-12 01:48:23,104] Trial 483 finished with value: 0.0 and parameters: {'timeframe': 'M5', 'atr_period': 13, 'atr_threshold': 10.0, 'pt_mult': 0.5, 'sl_mult': 5.0, 'td_mins': 120}. Best is trial 453 with value: 2.7631983640697526.
[I 2026-03-12 01:48:23,161] Trial 484 pruned. 
[I 2026-03-12 01:48:23,213] Trial 485 pruned. 
[I 2026-03-12 01:48:23,262] Trial 486 finished with value: 0.0 and parameters: {'timeframe': 'M5', 'atr_period': 13, 'atr_threshold': 5.0, 'pt_mult': 0.5, 'sl_mult': 5.0, 'td_mins': 120}. Best is trial 453 with value: 2.7631983640697526.
[I 2026-03-12 01:48:23,690] Trial 487 pruned. 
[I 2026-03-12 01:48:23,746] Trial 488 pruned. 
[I 2026-03-12 01:48:23,799] Trial 489 finished with value: 0.0 and parameters: {'timeframe': 'M5', 'atr_period': 13, 'atr_threshold': 8.0, 'pt_mult': 0.5, 'sl_mult': 5.0, 'td_mins': 120}. Best is trial 453 with value: 2.7631983640697526.
[I 2026-03-12 01:48:24,052] Trial 490 finished with value: 2.7631983640697526 and parameters: {'timeframe': 'M5', 'atr_period': 13, 'atr_threshold': 3.0, 'pt_mult': 0.5, 'sl_mult': 5.0, 'td_mins': 120}. Best is trial 453 with value: 2.7631983640697526.
[I 2026-03-12 01:48:24,116] Trial 491 pruned. 
[I 2026-03-12 01:48:24,385] Trial 492 finished with value: 2.7631983640697526 and parameters: {'timeframe': 'M5', 'atr_period': 13, 'atr_threshold': 3.0, 'pt_mult': 0.5, 'sl_mult': 5.0, 'td_mins': 120}. Best is trial 453 with value: 2.7631983640697526.
[I 2026-03-12 01:48:24,528] Trial 493 pruned. 
[I 2026-03-12 01:48:24,615] Trial 494 pruned. 
[I 2026-03-12 01:48:24,727] Trial 495 pruned. 
[I 2026-03-12 01:48:25,046] Trial 496 pruned. 
[I 2026-03-12 01:48:25,170] Trial 497 finished with value: 2.764226017929662 and parameters: {'timeframe': 'M5', 'atr_period': 13, 'atr_threshold': 3.0, 'pt_mult': 0.5, 'sl_mult': 5.0, 'td_mins': 30}. Best is trial 497 with value: 2.764226017929662.
[I 2026-03-12 01:48:25,428] Trial 498 finished with value: 2.7631983640697526 and parameters: {'timeframe': 'M5', 'atr_period': 13, 'atr_threshold': 3.0, 'pt_mult': 0.5, 'sl_mult': 5.0, 'td_mins': 120}. Best is trial 497 with value: 2.764226017929662.
[I 2026-03-12 01:48:25,692] Trial 499 finished with value: 2.7631983640697526 and parameters: {'timeframe': 'M5', 'atr_period': 13, 'atr_threshold': 3.0, 'pt_mult': 0.5, 'sl_mult': 5.0, 'td_mins': 120}. Best is trial 497 with value: 2.764226017929662.
[I 2026-03-12 01:48:25,815] Trial 500 finished with value: 2.764226017929662 and parameters: {'timeframe': 'M5', 'atr_period': 13, 'atr_threshold': 3.0, 'pt_mult': 0.5, 'sl_mult': 5.0, 'td_mins': 30}. Best is trial 497 with value: 2.764226017929662.
[I 2026-03-12 01:48:25,939] Trial 501 finished with value: 2.764226017929662 and parameters: {'timeframe': 'M5', 'atr_period': 13, 'atr_threshold': 3.0, 'pt_mult': 0.5, 'sl_mult': 5.0, 'td_mins': 30}. Best is trial 497 with value: 2.764226017929662.
[I 2026-03-12 01:48:26,061] Trial 502 finished with value: 2.764226017929662 and parameters: {'timeframe': 'M5', 'atr_period': 13, 'atr_threshold': 3.0, 'pt_mult': 0.5, 'sl_mult': 5.0, 'td_mins': 30}. Best is trial 497 with value: 2.764226017929662.
[I 2026-03-12 01:48:26,178] Trial 503 finished with value: 2.764226017929662 and parameters: {'timeframe': 'M5', 'atr_period': 13, 'atr_threshold': 3.0, 'pt_mult': 0.5, 'sl_mult': 5.0, 'td_mins': 30}. Best is trial 497 with value: 2.764226017929662.
[I 2026-03-12 01:48:26,309] Trial 504 finished with value: 2.764226017929662 and parameters: {'timeframe': 'M5', 'atr_period': 13, 'atr_threshold': 3.0, 'pt_mult': 0.5, 'sl_mult': 5.0, 'td_mins': 30}. Best is trial 497 with value: 2.764226017929662.
[I 2026-03-12 01:48:26,429] Trial 505 finished with value: 2.764226017929662 and parameters: {'timeframe': 'M5', 'atr_period': 13, 'atr_threshold': 3.0, 'pt_mult': 0.5, 'sl_mult': 5.0, 'td_mins': 30}. Best is trial 497 with value: 2.764226017929662.
[I 2026-03-12 01:48:26,552] Trial 506 finished with value: 2.764226017929662 and parameters: {'timeframe': 'M5', 'atr_period': 13, 'atr_threshold': 3.0, 'pt_mult': 0.5, 'sl_mult': 5.0, 'td_mins': 30}. Best is trial 497 with value: 2.764226017929662.
[I 2026-03-12 01:48:26,670] Trial 507 finished with value: 2.764226017929662 and parameters: {'timeframe': 'M5', 'atr_period': 13, 'atr_threshold': 3.0, 'pt_mult': 0.5, 'sl_mult': 5.0, 'td_mins': 30}. Best is trial 497 with value: 2.764226017929662.
[I 2026-03-12 01:48:26,791] Trial 508 finished with value: 2.764226017929662 and parameters: {'timeframe': 'M5', 'atr_period': 13, 'atr_threshold': 3.0, 'pt_mult': 0.5, 'sl_mult': 5.0, 'td_mins': 30}. Best is trial 497 with value: 2.764226017929662.
[I 2026-03-12 01:48:26,912] Trial 509 finished with value: 2.764226017929662 and parameters: {'timeframe': 'M5', 'atr_period': 13, 'atr_threshold': 3.0, 'pt_mult': 0.5, 'sl_mult': 5.0, 'td_mins': 30}. Best is trial 497 with value: 2.764226017929662.
[I 2026-03-12 01:48:27,036] Trial 510 finished with value: 2.764226017929662 and parameters: {'timeframe': 'M5', 'atr_period': 13, 'atr_threshold': 3.0, 'pt_mult': 0.5, 'sl_mult': 5.0, 'td_mins': 30}. Best is trial 497 with value: 2.764226017929662.
[I 2026-03-12 01:48:27,091] Trial 511 pruned. 
