[I 2026-03-12 01:33:27,855] Trial 517 pruned. 
[I 2026-03-12 01:33:28,002] Trial 518 pruned. 
[I 2026-03-12 01:33:28,113] Trial 519 pruned. 
[I 2026-03-12 01:33:28,201] Trial 520 pruned. 
[I 2026-03-12 01:33:28,357] Trial 521 pruned. 
[I 2026-03-12 01:33:28,407] Trial 522 finished with value: 0.0 and parameters: {'timeframe': 'M1', 'atr_period': 13, 'atr_threshold': 3.0, 'pt_mult': 0.5, 'sl_mult': 0.5, 'td_mins': 5}. Best is trial 337 with value: 2.318948203404773.
[I 2026-03-12 01:33:28,468] Trial 523 pruned. 
[I 2026-03-12 01:33:28,520] Trial 524 finished with value: 0.0 and parameters: {'timeframe': 'M1', 'atr_period': 13, 'atr_threshold': 5.0, 'pt_mult': 1.0, 'sl_mult': 1.0, 'td_mins': 30}. Best is trial 337 with value: 2.318948203404773.
[I 2026-03-12 01:33:28,580] Trial 525 pruned. 
[I 2026-03-12 01:33:28,667] Trial 526 finished with value: 2.318948203404773 and parameters: {'timeframe': 'M1', 'atr_period': 13, 'atr_threshold': 2.0, 'pt_mult': 0.5, 'sl_mult': 5.0, 'td_mins': 5}. Best is trial 337 with value: 2.318948203404773.
[I 2026-03-12 01:33:28,732] Trial 527 pruned. 
[I 2026-03-12 01:33:28,805] Trial 528 pruned. 
[I 2026-03-12 01:33:28,875] Trial 529 pruned. 
[I 2026-03-12 01:33:28,954] Trial 530 pruned. 
[I 2026-03-12 01:33:29,002] Trial 531 finished with value: 0.0 and parameters: {'timeframe': 'M1', 'atr_period': 13, 'atr_threshold': 10.0, 'pt_mult': 0.5, 'sl_mult': 5.0, 'td_mins': 720}. Best is trial 337 with value: 2.318948203404773.
[I 2026-03-12 01:33:29,052] Trial 532 finished with value: 0.0 and parameters: {'timeframe': 'M1', 'atr_period': 13, 'atr_threshold': 5.0, 'pt_mult': 0.5, 'sl_mult': 5.0, 'td_mins': 5}. Best is trial 337 with value: 2.318948203404773.
[I 2026-03-12 01:33:29,100] Trial 533 finished with value: 0.0 and parameters: {'timeframe': 'M1', 'atr_period': 13, 'atr_threshold': 8.0, 'pt_mult': 0.5, 'sl_mult': 5.0, 'td_mins': 5}. Best is trial 337 with value: 2.318948203404773.
[I 2026-03-12 01:33:29,628] Trial 534 pruned. 
[I 2026-03-12 01:33:29,741] Trial 535 finished with value: 2.318948203404773 and parameters: {'timeframe': 'M1', 'atr_period': 13, 'atr_threshold': 2.0, 'pt_mult': 0.5, 'sl_mult': 5.0, 'td_mins': 5}. Best is trial 337 with value: 2.318948203404773.
[I 2026-03-12 01:33:29,843] Trial 536 finished with value: 2.318948203404773 and parameters: {'timeframe': 'M1', 'atr_period': 13, 'atr_threshold': 2.0, 'pt_mult': 0.5, 'sl_mult': 5.0, 'td_mins': 5}. Best is trial 337 with value: 2.318948203404773.
[I 2026-03-12 01:33:29,900] Trial 537 finished with value: 0.0 and parameters: {'timeframe': 'M1', 'atr_period': 13, 'atr_threshold': 8.0, 'pt_mult': 0.5, 'sl_mult': 5.0, 'td_mins': 180}. Best is trial 337 with value: 2.318948203404773.
[I 2026-03-12 01:33:30,005] Trial 538 pruned. 
[I 2026-03-12 01:33:30,072] Trial 539 pruned. 
[I 2026-03-12 01:33:30,185] Trial 540 finished with value: 2.318948203404773 and parameters: {'timeframe': 'M1', 'atr_period': 13, 'atr_threshold': 2.0, 'pt_mult': 0.5, 'sl_mult': 5.0, 'td_mins': 5}. Best is trial 337 with value: 2.318948203404773.
[I 2026-03-12 01:33:30,243] Trial 541 finished with value: 0.0 and parameters: {'timeframe': 'M1', 'atr_period': 13, 'atr_threshold': 5.0, 'pt_mult': 0.5, 'sl_mult': 5.0, 'td_mins': 1080}. Best is trial 337 with value: 2.318948203404773.
[I 2026-03-12 01:33:30,359] Trial 542 finished with value: 2.318948203404773 and parameters: {'timeframe': 'M1', 'atr_period': 13, 'atr_threshold': 2.0, 'pt_mult': 0.5, 'sl_mult': 5.0, 'td_mins': 5}. Best is trial 337 with value: 2.318948203404773.
[I 2026-03-12 01:33:30,438] Trial 543 pruned. 
[I 2026-03-12 01:33:30,529] Trial 544 pruned. 
[I 2026-03-12 01:33:30,635] Trial 545 finished with value: 2.318948203404773 and parameters: {'timeframe': 'M1', 'atr_period': 13, 'atr_threshold': 2.0, 'pt_mult': 0.5, 'sl_mult': 5.0, 'td_mins': 5}. Best is trial 337 with value: 2.318948203404773.
[I 2026-03-12 01:33:30,695] Trial 546 finished with value: 0.0 and parameters: {'timeframe': 'M1', 'atr_period': 13, 'atr_threshold': 15.0, 'pt_mult': 0.5, 'sl_mult': 0.5, 'td_mins': 30}. Best is trial 337 with value: 2.318948203404773.
[I 2026-03-12 01:33:30,747] Trial 547 finished with value: 0.0 and parameters: {'timeframe': 'M1', 'atr_period': 13, 'atr_threshold': 10.0, 'pt_mult': 1.0, 'sl_mult': 5.0, 'td_mins': 5}. Best is trial 337 with value: 2.318948203404773.
[I 2026-03-12 01:33:30,807] Trial 548 pruned. 
[I 2026-03-12 01:33:30,922] Trial 549 pruned. 
[I 2026-03-12 01:33:31,021] Trial 550 finished with value: 2.318948203404773 and parameters: {'timeframe': 'M1', 'atr_period': 13, 'atr_threshold': 2.0, 'pt_mult': 0.5, 'sl_mult': 5.0, 'td_mins': 5}. Best is trial 337 with value: 2.318948203404773.
[I 2026-03-12 01:33:31,093] Trial 551 pruned. 
[I 2026-03-12 01:33:31,209] Trial 552 finished with value: 2.318948203404773 and parameters: {'timeframe': 'M1', 'atr_period': 13, 'atr_threshold': 2.0, 'pt_mult': 0.5, 'sl_mult': 5.0, 'td_mins': 5}. Best is trial 337 with value: 2.318948203404773.
[I 2026-03-12 01:33:31,325] Trial 553 finished with value: 2.318948203404773 and parameters: {'timeframe': 'M1', 'atr_period': 13, 'atr_threshold': 2.0, 'pt_mult': 0.5, 'sl_mult': 5.0, 'td_mins': 5}. Best is trial 337 with value: 2.318948203404773.
[I 2026-03-12 01:33:31,404] Trial 554 pruned. 
[I 2026-03-12 01:33:31,510] Trial 555 finished with value: 2.318948203404773 and parameters: {'timeframe': 'M1', 'atr_period': 13, 'atr_threshold': 2.0, 'pt_mult': 0.5, 'sl_mult': 5.0, 'td_mins': 5}. Best is trial 337 with value: 2.318948203404773.
[I 2026-03-12 01:33:31,595] Trial 556 pruned. 
[I 2026-03-12 01:33:31,765] Trial 557 pruned. 
[I 2026-03-12 01:33:31,820] Trial 558 finished with value: 0.0 and parameters: {'timeframe': 'M1', 'atr_period': 13, 'atr_threshold': 8.0, 'pt_mult': 0.5, 'sl_mult': 5.0, 'td_mins': 1080}. Best is trial 337 with value: 2.318948203404773.
[I 2026-03-12 01:33:31,946] Trial 559 finished with value: 2.318948203404773 and parameters: {'timeframe': 'M1', 'atr_period': 13, 'atr_threshold': 2.0, 'pt_mult': 0.5, 'sl_mult': 5.0, 'td_mins': 5}. Best is trial 337 with value: 2.318948203404773.
[I 2026-03-12 01:33:32,049] Trial 560 pruned. 
[I 2026-03-12 01:33:32,167] Trial 561 finished with value: 2.318948203404773 and parameters: {'timeframe': 'M1', 'atr_period': 13, 'atr_threshold': 2.0, 'pt_mult': 0.5, 'sl_mult': 5.0, 'td_mins': 5}. Best is trial 337 with value: 2.318948203404773.
[I 2026-03-12 01:33:32,248] Trial 562 pruned. 
[I 2026-03-12 01:33:32,312] Trial 563 finished with value: 0.0 and parameters: {'timeframe': 'M1', 'atr_period': 13, 'atr_threshold': 15.0, 'pt_mult': 1.0, 'sl_mult': 5.0, 'td_mins': 5}. Best is trial 337 with value: 2.318948203404773.
[I 2026-03-12 01:33:32,404] Trial 564 pruned. 
[I 2026-03-12 01:33:32,471] Trial 565 pruned. 
[I 2026-03-12 01:33:32,524] Trial 566 finished with value: 0.0 and parameters: {'timeframe': 'M1', 'atr_period': 13, 'atr_threshold': 3.0, 'pt_mult': 0.5, 'sl_mult': 5.0, 'td_mins': 720}. Best is trial 337 with value: 2.318948203404773.
[I 2026-03-12 01:33:32,629] Trial 567 finished with value: 2.318948203404773 and parameters: {'timeframe': 'M1', 'atr_period': 13, 'atr_threshold': 2.0, 'pt_mult': 0.5, 'sl_mult': 5.0, 'td_mins': 5}. Best is trial 337 with value: 2.318948203404773.
[I 2026-03-12 01:33:32,720] Trial 568 finished with value: 2.318948203404773 and parameters: {'timeframe': 'M1', 'atr_period': 13, 'atr_threshold': 2.0, 'pt_mult': 0.5, 'sl_mult': 5.0, 'td_mins': 5}. Best is trial 337 with value: 2.318948203404773.
[I 2026-03-12 01:33:32,797] Trial 569 pruned. 
[I 2026-03-12 01:33:32,883] Trial 570 finished with value: 2.318948203404773 and parameters: {'timeframe': 'M1', 'atr_period': 13, 'atr_threshold': 2.0, 'pt_mult': 0.5, 'sl_mult': 5.0, 'td_mins': 5}. Best is trial 337 with value: 2.318948203404773.
[I 2026-03-12 01:33:32,931] Trial 571 finished with value: 0.0 and parameters: {'timeframe': 'M1', 'atr_period': 13, 'atr_threshold': 8.0, 'pt_mult': 0.5, 'sl_mult': 5.0, 'td_mins': 1200}. Best is trial 337 with value: 2.318948203404773.
[I 2026-03-12 01:33:33,017] Trial 572 finished with value: 2.318948203404773 and parameters: {'timeframe': 'M1', 'atr_period': 13, 'atr_threshold': 2.0, 'pt_mult': 0.5, 'sl_mult': 5.0, 'td_mins': 5}. Best is trial 337 with value: 2.318948203404773.
[I 2026-03-12 01:33:33,066] Trial 573 finished with value: 0.0 and parameters: {'timeframe': 'M1', 'atr_period': 13, 'atr_threshold': 3.0, 'pt_mult': 1.0, 'sl_mult': 5.0, 'td_mins': 5}. Best is trial 337 with value: 2.318948203404773.
[I 2026-03-12 01:33:33,116] Trial 574 finished with value: 0.0 and parameters: {'timeframe': 'M1', 'atr_period': 13, 'atr_threshold': 10.0, 'pt_mult': 2.5, 'sl_mult': 5.0, 'td_mins': 5}. Best is trial 337 with value: 2.318948203404773.
[I 2026-03-12 01:33:33,211] Trial 575 finished with value: 2.318948203404773 and parameters: {'timeframe': 'M1', 'atr_period': 13, 'atr_threshold': 2.0, 'pt_mult': 0.5, 'sl_mult': 5.0, 'td_mins': 5}. Best is trial 337 with value: 2.318948203404773.
[I 2026-03-12 01:33:33,291] Trial 576 pruned. 
[I 2026-03-12 01:33:33,403] Trial 577 finished with value: 2.318948203404773 and parameters: {'timeframe': 'M1', 'atr_period': 13, 'atr_threshold': 2.0, 'pt_mult': 0.5, 'sl_mult': 5.0, 'td_mins': 5}. Best is trial 337 with value: 2.318948203404773.
[I 2026-03-12 01:33:33,515] Trial 578 finished with value: 2.318948203404773 and parameters: {'timeframe': 'M1', 'atr_period': 13, 'atr_threshold': 2.0, 'pt_mult': 0.5, 'sl_mult': 5.0, 'td_mins': 5}. Best is trial 337 with value: 2.318948203404773.
[I 2026-03-12 01:33:33,617] Trial 579 pruned. 
[I 2026-03-12 01:33:33,745] Trial 580 finished with value: 2.318948203404773 and parameters: {'timeframe': 'M1', 'atr_period': 13, 'atr_threshold': 2.0, 'pt_mult': 0.5, 'sl_mult': 5.0, 'td_mins': 5}. Best is trial 337 with value: 2.318948203404773.
[I 2026-03-12 01:33:33,800] Trial 581 finished with value: 0.0 and parameters: {'timeframe': 'M1', 'atr_period': 13, 'atr_threshold': 5.0, 'pt_mult': 0.5, 'sl_mult': 5.0, 'td_mins': 30}. Best is trial 337 with value: 2.318948203404773.
[I 2026-03-12 01:33:33,848] Trial 582 finished with value: 0.0 and parameters: {'timeframe': 'M1', 'atr_period': 13, 'atr_threshold': 15.0, 'pt_mult': 0.5, 'sl_mult': 5.0, 'td_mins': 5}. Best is trial 337 with value: 2.318948203404773.
[I 2026-03-12 01:33:33,936] Trial 583 finished with value: 2.318948203404773 and parameters: {'timeframe': 'M1', 'atr_period': 13, 'atr_threshold': 2.0, 'pt_mult': 0.5, 'sl_mult': 5.0, 'td_mins': 5}. Best is trial 337 with value: 2.318948203404773.
[I 2026-03-12 01:33:34,426] Trial 584 pruned. 
[I 2026-03-12 01:33:34,520] Trial 585 finished with value: 2.318948203404773 and parameters: {'timeframe': 'M1', 'atr_period': 13, 'atr_threshold': 2.0, 'pt_mult': 0.5, 'sl_mult': 5.0, 'td_mins': 5}. Best is trial 337 with value: 2.318948203404773.
[I 2026-03-12 01:33:34,614] Trial 586 finished with value: 2.318948203404773 and parameters: {'timeframe': 'M1', 'atr_period': 13, 'atr_threshold': 2.0, 'pt_mult': 0.5, 'sl_mult': 5.0, 'td_mins': 5}. Best is trial 337 with value: 2.318948203404773.
[I 2026-03-12 01:33:34,749] Trial 587 pruned. 
[I 2026-03-12 01:33:34,799] Trial 588 finished with value: 0.0 and parameters: {'timeframe': 'M1', 'atr_period': 13, 'atr_threshold': 15.0, 'pt_mult': 2.5, 'sl_mult': 2.5, 'td_mins': 60}. Best is trial 337 with value: 2.318948203404773.
[I 2026-03-12 01:33:34,848] Trial 589 finished with value: 0.0 and parameters: {'timeframe': 'M1', 'atr_period': 13, 'atr_threshold': 10.0, 'pt_mult': 2.5, 'sl_mult': 2.5, 'td_mins': 120}. Best is trial 337 with value: 2.318948203404773.
[I 2026-03-12 01:33:34,943] Trial 590 pruned. 
[I 2026-03-12 01:33:35,001] Trial 591 pruned. 
[I 2026-03-12 01:33:35,051] Trial 592 finished with value: 0.0 and parameters: {'timeframe': 'M1', 'atr_period': 13, 'atr_threshold': 10.0, 'pt_mult': 0.5, 'sl_mult': 5.0, 'td_mins': 1200}. Best is trial 337 with value: 2.318948203404773.
[I 2026-03-12 01:33:35,140] Trial 593 finished with value: 2.318948203404773 and parameters: {'timeframe': 'M1', 'atr_period': 13, 'atr_threshold': 2.0, 'pt_mult': 0.5, 'sl_mult': 5.0, 'td_mins': 5}. Best is trial 337 with value: 2.318948203404773.
[I 2026-03-12 01:33:35,231] Trial 594 pruned. 
[I 2026-03-12 01:33:35,285] Trial 595 finished with value: 0.0 and parameters: {'timeframe': 'M1', 'atr_period': 13, 'atr_threshold': 10.0, 'pt_mult': 0.5, 'sl_mult': 5.0, 'td_mins': 5}. Best is trial 337 with value: 2.318948203404773.
[I 2026-03-12 01:33:35,339] Trial 596 pruned. 
[I 2026-03-12 01:33:35,434] Trial 597 finished with value: 2.318948203404773 and parameters: {'timeframe': 'M1', 'atr_period': 13, 'atr_threshold': 2.0, 'pt_mult': 0.5, 'sl_mult': 5.0, 'td_mins': 5}. Best is trial 337 with value: 2.318948203404773.
[I 2026-03-12 01:33:35,483] Trial 598 finished with value: 0.0 and parameters: {'timeframe': 'M1', 'atr_period': 13, 'atr_threshold': 15.0, 'pt_mult': 0.5, 'sl_mult': 5.0, 'td_mins': 30}. Best is trial 337 with value: 2.318948203404773.
[I 2026-03-12 01:33:35,545] Trial 599 pruned. 
[I 2026-03-12 01:33:35,638] Trial 600 finished with value: 2.318948203404773 and parameters: {'timeframe': 'M1', 'atr_period': 13, 'atr_threshold': 2.0, 'pt_mult': 0.5, 'sl_mult': 5.0, 'td_mins': 5}. Best is trial 337 with value: 2.318948203404773.
[I 2026-03-12 01:33:35,686] Trial 601 finished with value: 0.0 and parameters: {'timeframe': 'M1', 'atr_period': 13, 'atr_threshold': 8.0, 'pt_mult': 1.0, 'sl_mult': 5.0, 'td_mins': 5}. Best is trial 337 with value: 2.318948203404773.
[I 2026-03-12 01:33:35,752] Trial 602 pruned. 
[I 2026-03-12 01:33:35,804] Trial 603 finished with value: 0.0 and parameters: {'timeframe': 'M1', 'atr_period': 13, 'atr_threshold': 3.0, 'pt_mult': 0.5, 'sl_mult': 5.0, 'td_mins': 5}. Best is trial 337 with value: 2.318948203404773.
[I 2026-03-12 01:33:35,853] Trial 604 finished with value: 0.0 and parameters: {'timeframe': 'M1', 'atr_period': 13, 'atr_threshold': 5.0, 'pt_mult': 0.5, 'sl_mult': 5.0, 'td_mins': 1200}. Best is trial 337 with value: 2.318948203404773.
[I 2026-03-12 01:33:35,982] Trial 605 pruned. 
[I 2026-03-12 01:33:36,094] Trial 606 pruned. 
[I 2026-03-12 01:33:36,185] Trial 607 pruned. 
[I 2026-03-12 01:33:36,266] Trial 608 pruned. 
[I 2026-03-12 01:33:36,335] Trial 609 pruned. 
[I 2026-03-12 01:33:36,387] Trial 610 pruned. 
[I 2026-03-12 01:33:36,465] Trial 611 pruned. 
[I 2026-03-12 01:33:36,535] Trial 612 pruned. 
[I 2026-03-12 01:33:36,611] Trial 613 pruned. 
[I 2026-03-12 01:33:36,727] Trial 614 pruned. 
[I 2026-03-12 01:33:36,778] Trial 615 finished with value: 0.0 and parameters: {'timeframe': 'M1', 'atr_period': 13, 'atr_threshold': 5.0, 'pt_mult': 0.5, 'sl_mult': 5.0, 'td_mins': 5}. Best is trial 337 with value: 2.318948203404773.
[I 2026-03-12 01:33:36,866] Trial 616 finished with value: 2.318948203404773 and parameters: {'timeframe': 'M1', 'atr_period': 13, 'atr_threshold': 2.0, 'pt_mult': 0.5, 'sl_mult': 5.0, 'td_mins': 5}. Best is trial 337 with value: 2.318948203404773.
[I 2026-03-12 01:33:36,915] Trial 617 finished with value: 0.0 and parameters: {'timeframe': 'M1', 'atr_period': 13, 'atr_threshold': 3.0, 'pt_mult': 5.0, 'sl_mult': 5.0, 'td_mins': 720}. Best is trial 337 with value: 2.318948203404773.
[I 2026-03-12 01:33:36,963] Trial 618 finished with value: 0.0 and parameters: {'timeframe': 'M1', 'atr_period': 13, 'atr_threshold': 3.0, 'pt_mult': 5.0, 'sl_mult': 2.5, 'td_mins': 180}. Best is trial 337 with value: 2.318948203404773.
[I 2026-03-12 01:33:37,011] Trial 619 finished with value: 0.0 and parameters: {'timeframe': 'M1', 'atr_period': 13, 'atr_threshold': 5.0, 'pt_mult': 5.0, 'sl_mult': 0.5, 'td_mins': 720}. Best is trial 337 with value: 2.318948203404773.
[I 2026-03-12 01:33:37,161] Trial 620 pruned. 
[I 2026-03-12 01:33:37,287] Trial 621 pruned. 
[I 2026-03-12 01:33:37,348] Trial 622 finished with value: 0.0 and parameters: {'timeframe': 'M1', 'atr_period': 13, 'atr_threshold': 8.0, 'pt_mult': 0.5, 'sl_mult': 5.0, 'td_mins': 5}. Best is trial 337 with value: 2.318948203404773.
[I 2026-03-12 01:33:37,406] Trial 623 finished with value: 0.0 and parameters: {'timeframe': 'M1', 'atr_period': 13, 'atr_threshold': 10.0, 'pt_mult': 5.0, 'sl_mult': 0.5, 'td_mins': 15}. Best is trial 337 with value: 2.318948203404773.
[I 2026-03-12 01:33:38,243] Trial 624 pruned. 
[I 2026-03-12 01:33:38,332] Trial 625 finished with value: 2.318948203404773 and parameters: {'timeframe': 'M1', 'atr_period': 13, 'atr_threshold': 2.0, 'pt_mult': 0.5, 'sl_mult': 5.0, 'td_mins': 5}. Best is trial 337 with value: 2.318948203404773.
[I 2026-03-12 01:33:38,421] Trial 626 finished with value: 2.318948203404773 and parameters: {'timeframe': 'M1', 'atr_period': 13, 'atr_threshold': 2.0, 'pt_mult': 0.5, 'sl_mult': 5.0, 'td_mins': 5}. Best is trial 337 with value: 2.318948203404773.
[I 2026-03-12 01:33:38,472] Trial 627 finished with value: 0.0 and parameters: {'timeframe': 'M1', 'atr_period': 13, 'atr_threshold': 3.0, 'pt_mult': 2.5, 'sl_mult': 1.0, 'td_mins': 5}. Best is trial 337 with value: 2.318948203404773.
[I 2026-03-12 01:33:38,559] Trial 628 finished with value: 2.318948203404773 and parameters: {'timeframe': 'M1', 'atr_period': 13, 'atr_threshold': 2.0, 'pt_mult': 0.5, 'sl_mult': 5.0, 'td_mins': 5}. Best is trial 337 with value: 2.318948203404773.
[I 2026-03-12 01:33:38,612] Trial 629 pruned. 
[I 2026-03-12 01:33:38,817] Trial 630 pruned. 
[I 2026-03-12 01:33:38,871] Trial 631 pruned. 
[I 2026-03-12 01:33:38,943] Trial 632 finished with value: 0.0 and parameters: {'timeframe': 'M1', 'atr_period': 13, 'atr_threshold': 10.0, 'pt_mult': 0.5, 'sl_mult': 5.0, 'td_mins': 360}. Best is trial 337 with value: 2.318948203404773.
[I 2026-03-12 01:33:39,016] Trial 633 pruned. 
[I 2026-03-12 01:33:39,064] Trial 634 finished with value: 0.0 and parameters: {'timeframe': 'M1', 'atr_period': 13, 'atr_threshold': 8.0, 'pt_mult': 1.0, 'sl_mult': 1.0, 'td_mins': 60}. Best is trial 337 with value: 2.318948203404773.
[I 2026-03-12 01:33:39,157] Trial 635 finished with value: 2.318948203404773 and parameters: {'timeframe': 'M1', 'atr_period': 13, 'atr_threshold': 2.0, 'pt_mult': 0.5, 'sl_mult': 5.0, 'td_mins': 5}. Best is trial 337 with value: 2.318948203404773.
[I 2026-03-12 01:33:39,208] Trial 636 finished with value: 0.0 and parameters: {'timeframe': 'M1', 'atr_period': 13, 'atr_threshold': 5.0, 'pt_mult': 2.5, 'sl_mult': 5.0, 'td_mins': 15}. Best is trial 337 with value: 2.318948203404773.
[I 2026-03-12 01:33:39,309] Trial 637 pruned. 
[I 2026-03-12 01:33:39,395] Trial 638 finished with value: 2.318948203404773 and parameters: {'timeframe': 'M1', 'atr_period': 13, 'atr_threshold': 2.0, 'pt_mult': 0.5, 'sl_mult': 5.0, 'td_mins': 5}. Best is trial 337 with value: 2.318948203404773.
[I 2026-03-12 01:33:39,449] Trial 639 finished with value: 0.0 and parameters: {'timeframe': 'M1', 'atr_period': 13, 'atr_threshold': 8.0, 'pt_mult': 0.5, 'sl_mult': 0.5, 'td_mins': 5}. Best is trial 337 with value: 2.318948203404773.
[I 2026-03-12 01:33:42,613] Trial 640 pruned. 
[I 2026-03-12 01:33:44,240] Trial 641 pruned. 
[I 2026-03-12 01:33:44,334] Trial 642 finished with value: 2.318948203404773 and parameters: {'timeframe': 'M1', 'atr_period': 13, 'atr_threshold': 2.0, 'pt_mult': 0.5, 'sl_mult': 5.0, 'td_mins': 5}. Best is trial 337 with value: 2.318948203404773.
[I 2026-03-12 01:33:44,385] Trial 643 finished with value: 0.0 and parameters: {'timeframe': 'M1', 'atr_period': 13, 'atr_threshold': 5.0, 'pt_mult': 1.0, 'sl_mult': 1.0, 'td_mins': 180}. Best is trial 337 with value: 2.318948203404773.
[I 2026-03-12 01:33:46,824] Trial 644 pruned. 
[I 2026-03-12 01:33:46,916] Trial 645 finished with value: 2.318948203404773 and parameters: {'timeframe': 'M1', 'atr_period': 13, 'atr_threshold': 2.0, 'pt_mult': 0.5, 'sl_mult': 5.0, 'td_mins': 5}. Best is trial 337 with value: 2.318948203404773.
[I 2026-03-12 01:33:47,492] Trial 646 pruned. 
[I 2026-03-12 01:33:47,608] Trial 647 finished with value: 2.318948203404773 and parameters: {'timeframe': 'M1', 'atr_period': 13, 'atr_threshold': 2.0, 'pt_mult': 0.5, 'sl_mult': 5.0, 'td_mins': 5}. Best is trial 337 with value: 2.318948203404773.
[I 2026-03-12 01:33:48,447] Trial 648 pruned. 
[I 2026-03-12 01:33:48,539] Trial 649 finished with value: 2.318948203404773 and parameters: {'timeframe': 'M1', 'atr_period': 13, 'atr_threshold': 2.0, 'pt_mult': 0.5, 'sl_mult': 5.0, 'td_mins': 5}. Best is trial 337 with value: 2.318948203404773.
[I 2026-03-12 01:33:48,629] Trial 650 finished with value: 2.318948203404773 and parameters: {'timeframe': 'M1', 'atr_period': 13, 'atr_threshold': 2.0, 'pt_mult': 0.5, 'sl_mult': 5.0, 'td_mins': 5}. Best is trial 337 with value: 2.318948203404773.
[I 2026-03-12 01:33:48,682] Trial 651 finished with value: 0.0 and parameters: {'timeframe': 'M1', 'atr_period': 13, 'atr_threshold': 8.0, 'pt_mult': 5.0, 'sl_mult': 2.5, 'td_mins': 5}. Best is trial 337 with value: 2.318948203404773.
[I 2026-03-12 01:33:48,772] Trial 652 finished with value: 2.318948203404773 and parameters: {'timeframe': 'M1', 'atr_period': 13, 'atr_threshold': 2.0, 'pt_mult': 0.5, 'sl_mult': 5.0, 'td_mins': 5}. Best is trial 337 with value: 2.318948203404773.
[I 2026-03-12 01:33:48,822] Trial 653 finished with value: 0.0 and parameters: {'timeframe': 'M1', 'atr_period': 13, 'atr_threshold': 8.0, 'pt_mult': 0.5, 'sl_mult': 2.5, 'td_mins': 720}. Best is trial 337 with value: 2.318948203404773.
[I 2026-03-12 01:33:48,914] Trial 654 finished with value: 2.318948203404773 and parameters: {'timeframe': 'M1', 'atr_period': 13, 'atr_threshold': 2.0, 'pt_mult': 0.5, 'sl_mult': 5.0, 'td_mins': 5}. Best is trial 337 with value: 2.318948203404773.
