[I 2026-03-12 00:57:19,915] Trial 473 finished with value: 2.3870654100539324 and parameters: {'timeframe': 'M5', 'atr_period': 13, 'atr_threshold': 3.0, 'pt_mult': 0.5, 'sl_mult': 5.0, 'td_mins': 30}. Best is trial 378 with value: 2.3870654100539324.
[I 2026-03-12 00:57:19,993] Trial 474 pruned. 
[I 2026-03-12 00:57:20,066] Trial 475 pruned. 
[I 2026-03-12 00:57:20,112] Trial 476 finished with value: 0.0 and parameters: {'timeframe': 'M5', 'atr_period': 13, 'atr_threshold': 15.0, 'pt_mult': 0.5, 'sl_mult': 5.0, 'td_mins': 5}. Best is trial 378 with value: 2.3870654100539324.
[I 2026-03-12 00:57:20,234] Trial 477 finished with value: 2.3870654100539324 and parameters: {'timeframe': 'M5', 'atr_period': 13, 'atr_threshold': 3.0, 'pt_mult': 0.5, 'sl_mult': 5.0, 'td_mins': 30}. Best is trial 378 with value: 2.3870654100539324.
[I 2026-03-12 00:57:20,280] Trial 478 finished with value: 0.0 and parameters: {'timeframe': 'M5', 'atr_period': 13, 'atr_threshold': 15.0, 'pt_mult': 0.5, 'sl_mult': 5.0, 'td_mins': 1080}. Best is trial 378 with value: 2.3870654100539324.
[I 2026-03-12 00:57:20,398] Trial 479 finished with value: 2.3870654100539324 and parameters: {'timeframe': 'M5', 'atr_period': 13, 'atr_threshold': 3.0, 'pt_mult': 0.5, 'sl_mult': 5.0, 'td_mins': 30}. Best is trial 378 with value: 2.3870654100539324.
[I 2026-03-12 00:57:20,447] Trial 480 finished with value: 0.0 and parameters: {'timeframe': 'M5', 'atr_period': 13, 'atr_threshold': 15.0, 'pt_mult': 0.5, 'sl_mult': 5.0, 'td_mins': 15}. Best is trial 378 with value: 2.3870654100539324.
[I 2026-03-12 00:57:20,498] Trial 481 pruned. 
[I 2026-03-12 00:57:20,621] Trial 482 finished with value: 2.3870654100539324 and parameters: {'timeframe': 'M5', 'atr_period': 13, 'atr_threshold': 3.0, 'pt_mult': 0.5, 'sl_mult': 5.0, 'td_mins': 30}. Best is trial 378 with value: 2.3870654100539324.
[I 2026-03-12 00:57:20,669] Trial 483 finished with value: 0.0 and parameters: {'timeframe': 'M5', 'atr_period': 13, 'atr_threshold': 5.0, 'pt_mult': 0.5, 'sl_mult': 1.0, 'td_mins': 30}. Best is trial 378 with value: 2.3870654100539324.
[I 2026-03-12 00:57:20,722] Trial 484 pruned. 
[I 2026-03-12 00:57:20,844] Trial 485 finished with value: 2.3870654100539324 and parameters: {'timeframe': 'M5', 'atr_period': 13, 'atr_threshold': 3.0, 'pt_mult': 0.5, 'sl_mult': 5.0, 'td_mins': 30}. Best is trial 378 with value: 2.3870654100539324.
[I 2026-03-12 00:57:20,969] Trial 486 finished with value: 2.3870654100539324 and parameters: {'timeframe': 'M5', 'atr_period': 13, 'atr_threshold': 3.0, 'pt_mult': 0.5, 'sl_mult': 5.0, 'td_mins': 30}. Best is trial 378 with value: 2.3870654100539324.
[I 2026-03-12 00:57:21,027] Trial 487 finished with value: 0.0 and parameters: {'timeframe': 'M5', 'atr_period': 13, 'atr_threshold': 15.0, 'pt_mult': 2.5, 'sl_mult': 5.0, 'td_mins': 30}. Best is trial 378 with value: 2.3870654100539324.
[I 2026-03-12 00:57:21,166] Trial 488 pruned. 
[I 2026-03-12 00:57:21,231] Trial 489 pruned. 
[I 2026-03-12 00:57:21,321] Trial 490 pruned. 
[I 2026-03-12 00:57:21,605] Trial 491 pruned. 
[I 2026-03-12 00:57:21,732] Trial 492 pruned. 
[I 2026-03-12 00:57:21,866] Trial 493 pruned. 
[I 2026-03-12 00:57:21,960] Trial 494 pruned. 
[I 2026-03-12 00:57:22,139] Trial 495 pruned. 
[I 2026-03-12 00:57:22,189] Trial 496 finished with value: 0.0 and parameters: {'timeframe': 'M5', 'atr_period': 13, 'atr_threshold': 8.0, 'pt_mult': 1.0, 'sl_mult': 5.0, 'td_mins': 30}. Best is trial 378 with value: 2.3870654100539324.
[I 2026-03-12 00:57:22,309] Trial 497 finished with value: 2.3870654100539324 and parameters: {'timeframe': 'M5', 'atr_period': 13, 'atr_threshold': 3.0, 'pt_mult': 0.5, 'sl_mult': 5.0, 'td_mins': 30}. Best is trial 378 with value: 2.3870654100539324.
[I 2026-03-12 00:57:24,402] Trial 498 pruned. 
[I 2026-03-12 00:57:24,545] Trial 499 pruned. 
[I 2026-03-12 00:57:24,613] Trial 500 pruned. 
[I 2026-03-12 00:57:24,680] Trial 501 pruned. 
[I 2026-03-12 00:57:24,733] Trial 502 finished with value: 0.0 and parameters: {'timeframe': 'M5', 'atr_period': 13, 'atr_threshold': 5.0, 'pt_mult': 0.5, 'sl_mult': 5.0, 'td_mins': 15}. Best is trial 378 with value: 2.3870654100539324.
[I 2026-03-12 00:57:24,785] Trial 503 finished with value: 0.0 and parameters: {'timeframe': 'M5', 'atr_period': 13, 'atr_threshold': 8.0, 'pt_mult': 0.5, 'sl_mult': 2.5, 'td_mins': 30}. Best is trial 378 with value: 2.3870654100539324.
[I 2026-03-12 00:57:24,941] Trial 504 pruned. 
[I 2026-03-12 00:57:24,994] Trial 505 finished with value: 0.0 and parameters: {'timeframe': 'M5', 'atr_period': 13, 'atr_threshold': 8.0, 'pt_mult': 0.5, 'sl_mult': 5.0, 'td_mins': 15}. Best is trial 378 with value: 2.3870654100539324.
[I 2026-03-12 00:57:25,047] Trial 506 finished with value: 0.0 and parameters: {'timeframe': 'M5', 'atr_period': 13, 'atr_threshold': 8.0, 'pt_mult': 0.5, 'sl_mult': 5.0, 'td_mins': 5}. Best is trial 378 with value: 2.3870654100539324.
[I 2026-03-12 00:57:25,100] Trial 507 finished with value: 0.0 and parameters: {'timeframe': 'M5', 'atr_period': 13, 'atr_threshold': 15.0, 'pt_mult': 0.5, 'sl_mult': 5.0, 'td_mins': 30}. Best is trial 378 with value: 2.3870654100539324.
[I 2026-03-12 00:57:25,153] Trial 508 finished with value: 0.0 and parameters: {'timeframe': 'M5', 'atr_period': 13, 'atr_threshold': 10.0, 'pt_mult': 0.5, 'sl_mult': 5.0, 'td_mins': 1080}. Best is trial 378 with value: 2.3870654100539324.
[I 2026-03-12 00:57:25,229] Trial 509 pruned. 
[I 2026-03-12 00:57:25,281] Trial 510 finished with value: 0.0 and parameters: {'timeframe': 'M5', 'atr_period': 13, 'atr_threshold': 15.0, 'pt_mult': 5.0, 'sl_mult': 5.0, 'td_mins': 30}. Best is trial 378 with value: 2.3870654100539324.
[I 2026-03-12 00:57:25,518] Trial 511 pruned. 
[I 2026-03-12 00:57:25,572] Trial 512 finished with value: 0.0 and parameters: {'timeframe': 'M5', 'atr_period': 13, 'atr_threshold': 5.0, 'pt_mult': 0.5, 'sl_mult': 5.0, 'td_mins': 720}. Best is trial 378 with value: 2.3870654100539324.
[I 2026-03-12 00:57:25,628] Trial 513 finished with value: 0.0 and parameters: {'timeframe': 'M5', 'atr_period': 13, 'atr_threshold': 8.0, 'pt_mult': 0.5, 'sl_mult': 0.5, 'td_mins': 30}. Best is trial 378 with value: 2.3870654100539324.
[I 2026-03-12 00:57:25,688] Trial 514 pruned. 
[I 2026-03-12 00:57:25,753] Trial 515 pruned. 
[I 2026-03-12 00:57:25,806] Trial 516 finished with value: 0.0 and parameters: {'timeframe': 'M5', 'atr_period': 13, 'atr_threshold': 8.0, 'pt_mult': 0.5, 'sl_mult': 5.0, 'td_mins': 1200}. Best is trial 378 with value: 2.3870654100539324.
[I 2026-03-12 00:57:25,892] Trial 517 pruned. 
[I 2026-03-12 00:57:25,949] Trial 518 finished with value: 0.0 and parameters: {'timeframe': 'M5', 'atr_period': 13, 'atr_threshold': 10.0, 'pt_mult': 0.5, 'sl_mult': 5.0, 'td_mins': 30}. Best is trial 378 with value: 2.3870654100539324.
[I 2026-03-12 00:57:26,039] Trial 519 pruned. 
[I 2026-03-12 00:57:26,194] Trial 520 finished with value: 2.3870654100539324 and parameters: {'timeframe': 'M5', 'atr_period': 13, 'atr_threshold': 3.0, 'pt_mult': 0.5, 'sl_mult': 5.0, 'td_mins': 30}. Best is trial 378 with value: 2.3870654100539324.
[I 2026-03-12 00:57:26,247] Trial 521 finished with value: 0.0 and parameters: {'timeframe': 'M5', 'atr_period': 13, 'atr_threshold': 8.0, 'pt_mult': 0.5, 'sl_mult': 5.0, 'td_mins': 30}. Best is trial 378 with value: 2.3870654100539324.
[I 2026-03-12 00:57:26,365] Trial 522 pruned. 
[I 2026-03-12 00:57:26,420] Trial 523 pruned. 
[I 2026-03-12 00:57:26,468] Trial 524 finished with value: 0.0 and parameters: {'timeframe': 'M5', 'atr_period': 13, 'atr_threshold': 5.0, 'pt_mult': 0.5, 'sl_mult': 5.0, 'td_mins': 30}. Best is trial 378 with value: 2.3870654100539324.
[I 2026-03-12 00:57:26,587] Trial 525 finished with value: 2.3870654100539324 and parameters: {'timeframe': 'M5', 'atr_period': 13, 'atr_threshold': 3.0, 'pt_mult': 0.5, 'sl_mult': 5.0, 'td_mins': 30}. Best is trial 378 with value: 2.3870654100539324.
[I 2026-03-12 00:57:26,712] Trial 526 finished with value: 2.3870654100539324 and parameters: {'timeframe': 'M5', 'atr_period': 13, 'atr_threshold': 3.0, 'pt_mult': 0.5, 'sl_mult': 5.0, 'td_mins': 30}. Best is trial 378 with value: 2.3870654100539324.
[I 2026-03-12 00:57:26,866] Trial 527 pruned. 
[I 2026-03-12 00:57:26,914] Trial 528 finished with value: 0.0 and parameters: {'timeframe': 'M5', 'atr_period': 13, 'atr_threshold': 5.0, 'pt_mult': 5.0, 'sl_mult': 5.0, 'td_mins': 30}. Best is trial 378 with value: 2.3870654100539324.
[I 2026-03-12 00:57:27,042] Trial 529 finished with value: 2.3870654100539324 and parameters: {'timeframe': 'M5', 'atr_period': 13, 'atr_threshold': 3.0, 'pt_mult': 0.5, 'sl_mult': 5.0, 'td_mins': 30}. Best is trial 378 with value: 2.3870654100539324.
[I 2026-03-12 00:57:27,094] Trial 530 pruned. 
[I 2026-03-12 00:57:27,181] Trial 531 pruned. 
[I 2026-03-12 00:57:27,227] Trial 532 finished with value: 0.0 and parameters: {'timeframe': 'M5', 'atr_period': 13, 'atr_threshold': 5.0, 'pt_mult': 1.0, 'sl_mult': 5.0, 'td_mins': 30}. Best is trial 378 with value: 2.3870654100539324.
[I 2026-03-12 00:57:28,618] Trial 533 pruned. 
[I 2026-03-12 00:57:28,795] Trial 534 pruned. 
[I 2026-03-12 00:57:28,924] Trial 535 finished with value: 2.3870654100539324 and parameters: {'timeframe': 'M5', 'atr_period': 13, 'atr_threshold': 3.0, 'pt_mult': 0.5, 'sl_mult': 5.0, 'td_mins': 30}. Best is trial 378 with value: 2.3870654100539324.
[I 2026-03-12 00:57:29,016] Trial 536 finished with value: 2.1309226830196697 and parameters: {'timeframe': 'M5', 'atr_period': 13, 'atr_threshold': 3.0, 'pt_mult': 0.5, 'sl_mult': 5.0, 'td_mins': 15}. Best is trial 378 with value: 2.3870654100539324.
[I 2026-03-12 00:57:29,143] Trial 537 pruned. 
[I 2026-03-12 00:57:29,191] Trial 538 finished with value: 0.0 and parameters: {'timeframe': 'M5', 'atr_period': 13, 'atr_threshold': 10.0, 'pt_mult': 1.0, 'sl_mult': 5.0, 'td_mins': 30}. Best is trial 378 with value: 2.3870654100539324.
[I 2026-03-12 00:57:29,359] Trial 539 pruned. 
[I 2026-03-12 00:57:29,416] Trial 540 pruned. 
[I 2026-03-12 00:57:29,469] Trial 541 pruned. 
[I 2026-03-12 00:57:29,596] Trial 542 finished with value: 2.3870654100539324 and parameters: {'timeframe': 'M5', 'atr_period': 13, 'atr_threshold': 3.0, 'pt_mult': 0.5, 'sl_mult': 5.0, 'td_mins': 30}. Best is trial 378 with value: 2.3870654100539324.
[I 2026-03-12 00:57:29,719] Trial 543 finished with value: 2.3870654100539324 and parameters: {'timeframe': 'M5', 'atr_period': 13, 'atr_threshold': 3.0, 'pt_mult': 0.5, 'sl_mult': 5.0, 'td_mins': 30}. Best is trial 378 with value: 2.3870654100539324.
[I 2026-03-12 00:57:29,841] Trial 544 finished with value: 2.3870654100539324 and parameters: {'timeframe': 'M5', 'atr_period': 13, 'atr_threshold': 3.0, 'pt_mult': 0.5, 'sl_mult': 5.0, 'td_mins': 30}. Best is trial 378 with value: 2.3870654100539324.
[I 2026-03-12 00:57:29,964] Trial 545 finished with value: 2.3870654100539324 and parameters: {'timeframe': 'M5', 'atr_period': 13, 'atr_threshold': 3.0, 'pt_mult': 0.5, 'sl_mult': 5.0, 'td_mins': 30}. Best is trial 378 with value: 2.3870654100539324.
[I 2026-03-12 00:57:30,049] Trial 546 pruned. 
[I 2026-03-12 00:57:30,106] Trial 547 pruned. 
[I 2026-03-12 00:57:30,209] Trial 548 pruned. 
[I 2026-03-12 00:57:30,316] Trial 549 pruned. 
[I 2026-03-12 00:57:30,437] Trial 550 finished with value: 2.3870654100539324 and parameters: {'timeframe': 'M5', 'atr_period': 13, 'atr_threshold': 3.0, 'pt_mult': 0.5, 'sl_mult': 5.0, 'td_mins': 30}. Best is trial 378 with value: 2.3870654100539324.
[I 2026-03-12 00:57:30,557] Trial 551 finished with value: 2.3870654100539324 and parameters: {'timeframe': 'M5', 'atr_period': 13, 'atr_threshold': 3.0, 'pt_mult': 0.5, 'sl_mult': 5.0, 'td_mins': 30}. Best is trial 378 with value: 2.3870654100539324.
[I 2026-03-12 00:57:30,724] Trial 552 pruned. 
[I 2026-03-12 00:57:30,845] Trial 553 finished with value: 2.3870654100539324 and parameters: {'timeframe': 'M5', 'atr_period': 13, 'atr_threshold': 3.0, 'pt_mult': 0.5, 'sl_mult': 5.0, 'td_mins': 30}. Best is trial 378 with value: 2.3870654100539324.
[I 2026-03-12 00:57:30,893] Trial 554 finished with value: 0.0 and parameters: {'timeframe': 'M5', 'atr_period': 13, 'atr_threshold': 8.0, 'pt_mult': 5.0, 'sl_mult': 5.0, 'td_mins': 30}. Best is trial 378 with value: 2.3870654100539324.
[I 2026-03-12 00:57:31,034] Trial 555 finished with value: 2.3870654100539324 and parameters: {'timeframe': 'M5', 'atr_period': 13, 'atr_threshold': 3.0, 'pt_mult': 0.5, 'sl_mult': 5.0, 'td_mins': 30}. Best is trial 378 with value: 2.3870654100539324.
[I 2026-03-12 00:57:31,087] Trial 556 finished with value: 0.0 and parameters: {'timeframe': 'M5', 'atr_period': 13, 'atr_threshold': 5.0, 'pt_mult': 0.5, 'sl_mult': 5.0, 'td_mins': 1080}. Best is trial 378 with value: 2.3870654100539324.
[I 2026-03-12 00:57:31,173] Trial 557 pruned. 
[I 2026-03-12 00:57:31,225] Trial 558 finished with value: 0.0 and parameters: {'timeframe': 'M5', 'atr_period': 13, 'atr_threshold': 8.0, 'pt_mult': 0.5, 'sl_mult': 5.0, 'td_mins': 360}. Best is trial 378 with value: 2.3870654100539324.
[I 2026-03-12 00:57:31,292] Trial 559 pruned. 
[I 2026-03-12 00:57:31,344] Trial 560 finished with value: 0.0 and parameters: {'timeframe': 'M5', 'atr_period': 13, 'atr_threshold': 5.0, 'pt_mult': 0.5, 'sl_mult': 5.0, 'td_mins': 1200}. Best is trial 378 with value: 2.3870654100539324.
[I 2026-03-12 00:57:31,401] Trial 561 pruned. 
[I 2026-03-12 00:57:31,522] Trial 562 finished with value: 2.3870654100539324 and parameters: {'timeframe': 'M5', 'atr_period': 13, 'atr_threshold': 3.0, 'pt_mult': 0.5, 'sl_mult': 5.0, 'td_mins': 30}. Best is trial 378 with value: 2.3870654100539324.
[I 2026-03-12 00:57:31,644] Trial 563 finished with value: 2.3870654100539324 and parameters: {'timeframe': 'M5', 'atr_period': 13, 'atr_threshold': 3.0, 'pt_mult': 0.5, 'sl_mult': 5.0, 'td_mins': 30}. Best is trial 378 with value: 2.3870654100539324.
[I 2026-03-12 00:57:31,690] Trial 564 finished with value: 0.0 and parameters: {'timeframe': 'M5', 'atr_period': 13, 'atr_threshold': 15.0, 'pt_mult': 1.0, 'sl_mult': 5.0, 'td_mins': 30}. Best is trial 378 with value: 2.3870654100539324.
[I 2026-03-12 00:57:31,813] Trial 565 finished with value: 2.3870654100539324 and parameters: {'timeframe': 'M5', 'atr_period': 13, 'atr_threshold': 3.0, 'pt_mult': 0.5, 'sl_mult': 5.0, 'td_mins': 30}. Best is trial 378 with value: 2.3870654100539324.
[I 2026-03-12 00:57:31,944] Trial 566 finished with value: 2.3870654100539324 and parameters: {'timeframe': 'M5', 'atr_period': 13, 'atr_threshold': 3.0, 'pt_mult': 0.5, 'sl_mult': 5.0, 'td_mins': 30}. Best is trial 378 with value: 2.3870654100539324.
[I 2026-03-12 00:57:32,009] Trial 567 pruned. 
[I 2026-03-12 00:57:32,133] Trial 568 finished with value: 2.3870654100539324 and parameters: {'timeframe': 'M5', 'atr_period': 13, 'atr_threshold': 3.0, 'pt_mult': 0.5, 'sl_mult': 5.0, 'td_mins': 30}. Best is trial 378 with value: 2.3870654100539324.
[I 2026-03-12 00:57:32,202] Trial 569 pruned. 
[I 2026-03-12 00:57:32,250] Trial 570 finished with value: 0.0 and parameters: {'timeframe': 'M5', 'atr_period': 13, 'atr_threshold': 10.0, 'pt_mult': 0.5, 'sl_mult': 2.5, 'td_mins': 1200}. Best is trial 378 with value: 2.3870654100539324.
[I 2026-03-12 00:57:32,376] Trial 571 finished with value: 2.3870654100539324 and parameters: {'timeframe': 'M5', 'atr_period': 13, 'atr_threshold': 3.0, 'pt_mult': 0.5, 'sl_mult': 5.0, 'td_mins': 30}. Best is trial 378 with value: 2.3870654100539324.
[I 2026-03-12 00:57:32,495] Trial 572 finished with value: 2.3870654100539324 and parameters: {'timeframe': 'M5', 'atr_period': 13, 'atr_threshold': 3.0, 'pt_mult': 0.5, 'sl_mult': 5.0, 'td_mins': 30}. Best is trial 378 with value: 2.3870654100539324.
[I 2026-03-12 00:57:32,615] Trial 573 finished with value: 2.3870654100539324 and parameters: {'timeframe': 'M5', 'atr_period': 13, 'atr_threshold': 3.0, 'pt_mult': 0.5, 'sl_mult': 5.0, 'td_mins': 30}. Best is trial 378 with value: 2.3870654100539324.
[I 2026-03-12 00:57:32,736] Trial 574 finished with value: 2.3870654100539324 and parameters: {'timeframe': 'M5', 'atr_period': 13, 'atr_threshold': 3.0, 'pt_mult': 0.5, 'sl_mult': 5.0, 'td_mins': 30}. Best is trial 378 with value: 2.3870654100539324.
[I 2026-03-12 00:57:32,784] Trial 575 finished with value: 0.0 and parameters: {'timeframe': 'M5', 'atr_period': 13, 'atr_threshold': 10.0, 'pt_mult': 0.5, 'sl_mult': 5.0, 'td_mins': 1200}. Best is trial 378 with value: 2.3870654100539324.
[I 2026-03-12 00:57:32,853] Trial 576 pruned. 
[I 2026-03-12 00:57:33,047] Trial 577 pruned. 
[I 2026-03-12 00:57:33,096] Trial 578 finished with value: 0.0 and parameters: {'timeframe': 'M5', 'atr_period': 13, 'atr_threshold': 5.0, 'pt_mult': 0.5, 'sl_mult': 5.0, 'td_mins': 120}. Best is trial 378 with value: 2.3870654100539324.
[I 2026-03-12 00:57:33,217] Trial 579 finished with value: 2.3870654100539324 and parameters: {'timeframe': 'M5', 'atr_period': 13, 'atr_threshold': 3.0, 'pt_mult': 0.5, 'sl_mult': 5.0, 'td_mins': 30}. Best is trial 378 with value: 2.3870654100539324.
[I 2026-03-12 00:57:33,267] Trial 580 finished with value: 0.0 and parameters: {'timeframe': 'M5', 'atr_period': 13, 'atr_threshold': 10.0, 'pt_mult': 0.5, 'sl_mult': 2.5, 'td_mins': 30}. Best is trial 378 with value: 2.3870654100539324.
[I 2026-03-12 00:57:33,314] Trial 581 finished with value: 0.0 and parameters: {'timeframe': 'M5', 'atr_period': 13, 'atr_threshold': 10.0, 'pt_mult': 0.5, 'sl_mult': 5.0, 'td_mins': 360}. Best is trial 378 with value: 2.3870654100539324.
[I 2026-03-12 00:57:33,435] Trial 582 finished with value: 2.3870654100539324 and parameters: {'timeframe': 'M5', 'atr_period': 13, 'atr_threshold': 3.0, 'pt_mult': 0.5, 'sl_mult': 5.0, 'td_mins': 30}. Best is trial 378 with value: 2.3870654100539324.
[I 2026-03-12 00:57:33,496] Trial 583 pruned. 
[I 2026-03-12 00:57:33,543] Trial 584 finished with value: 0.0 and parameters: {'timeframe': 'M5', 'atr_period': 13, 'atr_threshold': 15.0, 'pt_mult': 0.5, 'sl_mult': 5.0, 'td_mins': 120}. Best is trial 378 with value: 2.3870654100539324.
[I 2026-03-12 00:57:33,590] Trial 585 finished with value: 0.0 and parameters: {'timeframe': 'M5', 'atr_period': 13, 'atr_threshold': 10.0, 'pt_mult': 0.5, 'sl_mult': 5.0, 'td_mins': 720}. Best is trial 378 with value: 2.3870654100539324.
[I 2026-03-12 00:57:33,718] Trial 586 pruned. 
[I 2026-03-12 00:57:33,767] Trial 587 finished with value: 0.0 and parameters: {'timeframe': 'M5', 'atr_period': 13, 'atr_threshold': 15.0, 'pt_mult': 0.5, 'sl_mult': 5.0, 'td_mins': 30}. Best is trial 378 with value: 2.3870654100539324.
[I 2026-03-12 00:57:33,819] Trial 588 pruned. 
[I 2026-03-12 00:57:35,729] Trial 589 pruned. 
[I 2026-03-12 00:57:35,854] Trial 590 finished with value: 2.3870654100539324 and parameters: {'timeframe': 'M5', 'atr_period': 13, 'atr_threshold': 3.0, 'pt_mult': 0.5, 'sl_mult': 5.0, 'td_mins': 30}. Best is trial 378 with value: 2.3870654100539324.
[I 2026-03-12 00:57:35,931] Trial 591 pruned. 
[I 2026-03-12 00:57:35,998] Trial 592 pruned. 
[I 2026-03-12 00:57:36,726] Trial 593 pruned. 
[I 2026-03-12 00:57:37,190] Trial 594 pruned. 
[I 2026-03-12 00:57:37,701] Trial 595 pruned. 
[I 2026-03-12 00:57:37,759] Trial 596 pruned. 
[I 2026-03-12 00:57:37,887] Trial 597 finished with value: 2.3870654100539324 and parameters: {'timeframe': 'M5', 'atr_period': 13, 'atr_threshold': 3.0, 'pt_mult': 0.5, 'sl_mult': 5.0, 'td_mins': 30}. Best is trial 378 with value: 2.3870654100539324.
[I 2026-03-12 00:57:37,934] Trial 598 finished with value: 0.0 and parameters: {'timeframe': 'M5', 'atr_period': 13, 'atr_threshold': 15.0, 'pt_mult': 2.5, 'sl_mult': 1.0, 'td_mins': 30}. Best is trial 378 with value: 2.3870654100539324.
[I 2026-03-12 00:57:38,215] Trial 599 pruned. 
[I 2026-03-12 00:57:38,292] Trial 600 pruned. 
[I 2026-03-12 00:57:38,344] Trial 601 pruned. 
[I 2026-03-12 00:57:38,391] Trial 602 finished with value: 0.0 and parameters: {'timeframe': 'M5', 'atr_period': 13, 'atr_threshold': 15.0, 'pt_mult': 0.5, 'sl_mult': 5.0, 'td_mins': 180}. Best is trial 378 with value: 2.3870654100539324.
[I 2026-03-12 00:57:38,769] Trial 603 pruned. 
[I 2026-03-12 00:57:38,817] Trial 604 finished with value: 0.0 and parameters: {'timeframe': 'M5', 'atr_period': 13, 'atr_threshold': 10.0, 'pt_mult': 0.5, 'sl_mult': 5.0, 'td_mins': 30}. Best is trial 378 with value: 2.3870654100539324.
[I 2026-03-12 00:57:38,998] Trial 605 pruned. 
[I 2026-03-12 00:57:39,119] Trial 606 finished with value: 2.3870654100539324 and parameters: {'timeframe': 'M5', 'atr_period': 13, 'atr_threshold': 3.0, 'pt_mult': 0.5, 'sl_mult': 5.0, 'td_mins': 30}. Best is trial 378 with value: 2.3870654100539324.
[I 2026-03-12 00:57:39,263] Trial 607 pruned. 
[I 2026-03-12 00:57:39,309] Trial 608 finished with value: 0.0 and parameters: {'timeframe': 'M5', 'atr_period': 13, 'atr_threshold': 15.0, 'pt_mult': 1.0, 'sl_mult': 0.5, 'td_mins': 720}. Best is trial 378 with value: 2.3870654100539324.
[I 2026-03-12 00:57:39,358] Trial 609 finished with value: 0.0 and parameters: {'timeframe': 'M5', 'atr_period': 13, 'atr_threshold': 5.0, 'pt_mult': 2.5, 'sl_mult': 1.0, 'td_mins': 180}. Best is trial 378 with value: 2.3870654100539324.
[I 2026-03-12 00:57:39,414] Trial 610 pruned. 
[I 2026-03-12 00:57:39,487] Trial 611 pruned. 
[I 2026-03-12 00:57:39,626] Trial 612 pruned. 
[I 2026-03-12 00:57:39,688] Trial 613 pruned. 
[I 2026-03-12 00:57:39,759] Trial 614 pruned. 
[I 2026-03-12 00:57:39,823] Trial 615 pruned. 
[I 2026-03-12 00:57:39,944] Trial 616 finished with value: 2.3870654100539324 and parameters: {'timeframe': 'M5', 'atr_period': 13, 'atr_threshold': 3.0, 'pt_mult': 0.5, 'sl_mult': 5.0, 'td_mins': 30}. Best is trial 378 with value: 2.3870654100539324.
[I 2026-03-12 00:57:40,032] Trial 617 pruned. 
