[I 2026-03-12 02:04:03,283] Trial 548 finished with value: 2.627710256873383 and parameters: {'timeframe': 'M15', 'atr_period': 13, 'atr_threshold': 3.0, 'pt_mult': 0.5, 'sl_mult': 5.0, 'td_mins': 120}. Best is trial 393 with value: 2.627710256873383.
[I 2026-03-12 02:04:03,556] Trial 549 finished with value: 2.627710256873383 and parameters: {'timeframe': 'M15', 'atr_period': 13, 'atr_threshold': 3.0, 'pt_mult': 0.5, 'sl_mult': 5.0, 'td_mins': 120}. Best is trial 393 with value: 2.627710256873383.
[I 2026-03-12 02:04:03,843] Trial 550 finished with value: 2.1318723590746487 and parameters: {'timeframe': 'M15', 'atr_period': 13, 'atr_threshold': 3.0, 'pt_mult': 1.0, 'sl_mult': 5.0, 'td_mins': 120}. Best is trial 393 with value: 2.627710256873383.
[I 2026-03-12 02:04:04,014] Trial 551 pruned. 
[I 2026-03-12 02:04:04,064] Trial 552 finished with value: 0.0 and parameters: {'timeframe': 'M15', 'atr_period': 13, 'atr_threshold': 15.0, 'pt_mult': 0.5, 'sl_mult': 5.0, 'td_mins': 1080}. Best is trial 393 with value: 2.627710256873383.
[I 2026-03-12 02:04:04,113] Trial 553 finished with value: 0.0 and parameters: {'timeframe': 'M15', 'atr_period': 13, 'atr_threshold': 10.0, 'pt_mult': 0.5, 'sl_mult': 0.5, 'td_mins': 120}. Best is trial 393 with value: 2.627710256873383.
[I 2026-03-12 02:04:04,222] Trial 554 pruned. 
[I 2026-03-12 02:04:04,443] Trial 555 pruned. 
[I 2026-03-12 02:04:04,511] Trial 556 pruned. 
[I 2026-03-12 02:04:04,805] Trial 557 finished with value: 2.627710256873383 and parameters: {'timeframe': 'M15', 'atr_period': 13, 'atr_threshold': 3.0, 'pt_mult': 0.5, 'sl_mult': 5.0, 'td_mins': 120}. Best is trial 393 with value: 2.627710256873383.
[I 2026-03-12 02:04:05,095] Trial 558 finished with value: 2.627710256873383 and parameters: {'timeframe': 'M15', 'atr_period': 13, 'atr_threshold': 3.0, 'pt_mult': 0.5, 'sl_mult': 5.0, 'td_mins': 120}. Best is trial 393 with value: 2.627710256873383.
[I 2026-03-12 02:04:05,147] Trial 559 pruned. 
[I 2026-03-12 02:04:05,236] Trial 560 pruned. 
[I 2026-03-12 02:04:05,302] Trial 561 pruned. 
[I 2026-03-12 02:04:05,575] Trial 562 finished with value: 2.627710256873383 and parameters: {'timeframe': 'M15', 'atr_period': 13, 'atr_threshold': 3.0, 'pt_mult': 0.5, 'sl_mult': 5.0, 'td_mins': 120}. Best is trial 393 with value: 2.627710256873383.
[I 2026-03-12 02:04:05,952] Trial 563 finished with value: 2.144064556486753 and parameters: {'timeframe': 'M15', 'atr_period': 13, 'atr_threshold': 3.0, 'pt_mult': 1.0, 'sl_mult': 5.0, 'td_mins': 180}. Best is trial 393 with value: 2.627710256873383.
[I 2026-03-12 02:04:06,113] Trial 564 pruned. 
[I 2026-03-12 02:04:06,526] Trial 565 finished with value: 2.3274688702958795 and parameters: {'timeframe': 'M15', 'atr_period': 13, 'atr_threshold': 2.0, 'pt_mult': 0.5, 'sl_mult': 5.0, 'td_mins': 120}. Best is trial 393 with value: 2.627710256873383.
[I 2026-03-12 02:04:06,598] Trial 566 pruned. 
[I 2026-03-12 02:04:06,710] Trial 567 pruned. 
[I 2026-03-12 02:04:07,001] Trial 568 finished with value: 2.627710256873383 and parameters: {'timeframe': 'M15', 'atr_period': 13, 'atr_threshold': 3.0, 'pt_mult': 0.5, 'sl_mult': 5.0, 'td_mins': 120}. Best is trial 393 with value: 2.627710256873383.
[I 2026-03-12 02:04:07,062] Trial 569 pruned. 
[I 2026-03-12 02:04:07,132] Trial 570 pruned. 
[I 2026-03-12 02:04:07,445] Trial 571 finished with value: 2.627710256873383 and parameters: {'timeframe': 'M15', 'atr_period': 13, 'atr_threshold': 3.0, 'pt_mult': 0.5, 'sl_mult': 5.0, 'td_mins': 120}. Best is trial 393 with value: 2.627710256873383.
[I 2026-03-12 02:04:07,744] Trial 572 finished with value: 2.627710256873383 and parameters: {'timeframe': 'M15', 'atr_period': 13, 'atr_threshold': 3.0, 'pt_mult': 0.5, 'sl_mult': 5.0, 'td_mins': 120}. Best is trial 393 with value: 2.627710256873383.
[I 2026-03-12 02:04:07,818] Trial 573 pruned. 
[I 2026-03-12 02:04:07,971] Trial 574 pruned. 
[I 2026-03-12 02:04:08,265] Trial 575 finished with value: 2.627710256873383 and parameters: {'timeframe': 'M15', 'atr_period': 13, 'atr_threshold': 3.0, 'pt_mult': 0.5, 'sl_mult': 5.0, 'td_mins': 120}. Best is trial 393 with value: 2.627710256873383.
[I 2026-03-12 02:04:09,356] Trial 576 pruned. 
[I 2026-03-12 02:04:09,413] Trial 577 finished with value: 0.0 and parameters: {'timeframe': 'M15', 'atr_period': 13, 'atr_threshold': 15.0, 'pt_mult': 0.5, 'sl_mult': 5.0, 'td_mins': 720}. Best is trial 393 with value: 2.627710256873383.
[I 2026-03-12 02:04:09,555] Trial 578 pruned. 
[I 2026-03-12 02:04:09,861] Trial 579 finished with value: 2.627710256873383 and parameters: {'timeframe': 'M15', 'atr_period': 13, 'atr_threshold': 3.0, 'pt_mult': 0.5, 'sl_mult': 5.0, 'td_mins': 120}. Best is trial 393 with value: 2.627710256873383.
[I 2026-03-12 02:04:10,160] Trial 580 finished with value: 2.627710256873383 and parameters: {'timeframe': 'M15', 'atr_period': 13, 'atr_threshold': 3.0, 'pt_mult': 0.5, 'sl_mult': 5.0, 'td_mins': 120}. Best is trial 393 with value: 2.627710256873383.
[I 2026-03-12 02:04:10,438] Trial 581 finished with value: 2.627710256873383 and parameters: {'timeframe': 'M15', 'atr_period': 13, 'atr_threshold': 3.0, 'pt_mult': 0.5, 'sl_mult': 5.0, 'td_mins': 120}. Best is trial 393 with value: 2.627710256873383.
[I 2026-03-12 02:04:10,572] Trial 582 pruned. 
[I 2026-03-12 02:04:10,848] Trial 583 finished with value: 2.627710256873383 and parameters: {'timeframe': 'M15', 'atr_period': 13, 'atr_threshold': 3.0, 'pt_mult': 0.5, 'sl_mult': 5.0, 'td_mins': 120}. Best is trial 393 with value: 2.627710256873383.
[I 2026-03-12 02:04:11,471] Trial 584 finished with value: 2.0428449374313256 and parameters: {'timeframe': 'M15', 'atr_period': 13, 'atr_threshold': 3.0, 'pt_mult': 0.5, 'sl_mult': 5.0, 'td_mins': 360}. Best is trial 393 with value: 2.627710256873383.
[I 2026-03-12 02:04:11,520] Trial 585 pruned. 
[I 2026-03-12 02:04:11,603] Trial 586 pruned. 
[I 2026-03-12 02:04:11,651] Trial 587 finished with value: 0.0 and parameters: {'timeframe': 'M15', 'atr_period': 13, 'atr_threshold': 10.0, 'pt_mult': 0.5, 'sl_mult': 5.0, 'td_mins': 1080}. Best is trial 393 with value: 2.627710256873383.
[I 2026-03-12 02:04:11,847] Trial 588 pruned. 
[I 2026-03-12 02:04:11,895] Trial 589 finished with value: 0.0 and parameters: {'timeframe': 'M15', 'atr_period': 13, 'atr_threshold': 10.0, 'pt_mult': 0.5, 'sl_mult': 5.0, 'td_mins': 60}. Best is trial 393 with value: 2.627710256873383.
[I 2026-03-12 02:04:12,310] Trial 590 pruned. 
[I 2026-03-12 02:04:12,506] Trial 591 pruned. 
[I 2026-03-12 02:04:12,900] Trial 592 pruned. 
[I 2026-03-12 02:04:12,951] Trial 593 pruned. 
[I 2026-03-12 02:04:13,156] Trial 594 pruned. 
[I 2026-03-12 02:04:13,204] Trial 595 finished with value: 0.0 and parameters: {'timeframe': 'M15', 'atr_period': 13, 'atr_threshold': 15.0, 'pt_mult': 5.0, 'sl_mult': 5.0, 'td_mins': 120}. Best is trial 393 with value: 2.627710256873383.
[I 2026-03-12 02:04:13,257] Trial 596 finished with value: 0.0 and parameters: {'timeframe': 'M15', 'atr_period': 13, 'atr_threshold': 15.0, 'pt_mult': 0.5, 'sl_mult': 5.0, 'td_mins': 5}. Best is trial 393 with value: 2.627710256873383.
[I 2026-03-12 02:04:13,535] Trial 597 finished with value: 2.627710256873383 and parameters: {'timeframe': 'M15', 'atr_period': 13, 'atr_threshold': 3.0, 'pt_mult': 0.5, 'sl_mult': 5.0, 'td_mins': 120}. Best is trial 393 with value: 2.627710256873383.
[I 2026-03-12 02:04:13,807] Trial 598 finished with value: 2.627710256873383 and parameters: {'timeframe': 'M15', 'atr_period': 13, 'atr_threshold': 3.0, 'pt_mult': 0.5, 'sl_mult': 5.0, 'td_mins': 120}. Best is trial 393 with value: 2.627710256873383.
[I 2026-03-12 02:04:14,084] Trial 599 finished with value: 2.627710256873383 and parameters: {'timeframe': 'M15', 'atr_period': 13, 'atr_threshold': 3.0, 'pt_mult': 0.5, 'sl_mult': 5.0, 'td_mins': 120}. Best is trial 393 with value: 2.627710256873383.
[I 2026-03-12 02:04:14,348] Trial 600 finished with value: 2.627710256873383 and parameters: {'timeframe': 'M15', 'atr_period': 13, 'atr_threshold': 3.0, 'pt_mult': 0.5, 'sl_mult': 5.0, 'td_mins': 120}. Best is trial 393 with value: 2.627710256873383.
[I 2026-03-12 02:04:14,395] Trial 601 finished with value: 0.0 and parameters: {'timeframe': 'M15', 'atr_period': 13, 'atr_threshold': 10.0, 'pt_mult': 0.5, 'sl_mult': 5.0, 'td_mins': 30}. Best is trial 393 with value: 2.627710256873383.
[I 2026-03-12 02:04:14,673] Trial 602 finished with value: 2.627710256873383 and parameters: {'timeframe': 'M15', 'atr_period': 13, 'atr_threshold': 3.0, 'pt_mult': 0.5, 'sl_mult': 5.0, 'td_mins': 120}. Best is trial 393 with value: 2.627710256873383.
[I 2026-03-12 02:04:14,986] Trial 603 finished with value: 2.627710256873383 and parameters: {'timeframe': 'M15', 'atr_period': 13, 'atr_threshold': 3.0, 'pt_mult': 0.5, 'sl_mult': 5.0, 'td_mins': 120}. Best is trial 393 with value: 2.627710256873383.
[I 2026-03-12 02:04:15,301] Trial 604 finished with value: 2.627710256873383 and parameters: {'timeframe': 'M15', 'atr_period': 13, 'atr_threshold': 3.0, 'pt_mult': 0.5, 'sl_mult': 5.0, 'td_mins': 120}. Best is trial 393 with value: 2.627710256873383.
[I 2026-03-12 02:04:15,352] Trial 605 finished with value: 0.0 and parameters: {'timeframe': 'M15', 'atr_period': 13, 'atr_threshold': 15.0, 'pt_mult': 5.0, 'sl_mult': 0.5, 'td_mins': 360}. Best is trial 393 with value: 2.627710256873383.
[I 2026-03-12 02:04:15,402] Trial 606 finished with value: 0.0 and parameters: {'timeframe': 'M15', 'atr_period': 13, 'atr_threshold': 10.0, 'pt_mult': 2.5, 'sl_mult': 1.0, 'td_mins': 1200}. Best is trial 393 with value: 2.627710256873383.
[I 2026-03-12 02:04:15,560] Trial 607 pruned. 
[I 2026-03-12 02:04:15,826] Trial 608 finished with value: 2.627710256873383 and parameters: {'timeframe': 'M15', 'atr_period': 13, 'atr_threshold': 3.0, 'pt_mult': 0.5, 'sl_mult': 5.0, 'td_mins': 120}. Best is trial 393 with value: 2.627710256873383.
[I 2026-03-12 02:04:15,874] Trial 609 pruned. 
[I 2026-03-12 02:04:16,146] Trial 610 finished with value: 2.627710256873383 and parameters: {'timeframe': 'M15', 'atr_period': 13, 'atr_threshold': 3.0, 'pt_mult': 0.5, 'sl_mult': 5.0, 'td_mins': 120}. Best is trial 393 with value: 2.627710256873383.
[I 2026-03-12 02:04:16,420] Trial 611 finished with value: 2.627710256873383 and parameters: {'timeframe': 'M15', 'atr_period': 13, 'atr_threshold': 3.0, 'pt_mult': 0.5, 'sl_mult': 5.0, 'td_mins': 120}. Best is trial 393 with value: 2.627710256873383.
[I 2026-03-12 02:04:16,503] Trial 612 pruned. 
[I 2026-03-12 02:04:16,567] Trial 613 pruned. 
[I 2026-03-12 02:04:17,122] Trial 614 finished with value: 2.1593543017305707 and parameters: {'timeframe': 'M15', 'atr_period': 13, 'atr_threshold': 2.0, 'pt_mult': 0.5, 'sl_mult': 5.0, 'td_mins': 180}. Best is trial 393 with value: 2.627710256873383.
[I 2026-03-12 02:04:17,399] Trial 615 finished with value: 2.627710256873383 and parameters: {'timeframe': 'M15', 'atr_period': 13, 'atr_threshold': 3.0, 'pt_mult': 0.5, 'sl_mult': 5.0, 'td_mins': 120}. Best is trial 393 with value: 2.627710256873383.
[I 2026-03-12 02:04:17,590] Trial 616 pruned. 
[I 2026-03-12 02:04:17,667] Trial 617 pruned. 
[I 2026-03-12 02:04:17,855] Trial 618 finished with value: 2.4190348657869114 and parameters: {'timeframe': 'M15', 'atr_period': 13, 'atr_threshold': 3.0, 'pt_mult': 0.5, 'sl_mult': 5.0, 'td_mins': 60}. Best is trial 393 with value: 2.627710256873383.
[I 2026-03-12 02:04:17,927] Trial 619 pruned. 
[I 2026-03-12 02:04:17,977] Trial 620 finished with value: 0.0 and parameters: {'timeframe': 'M15', 'atr_period': 13, 'atr_threshold': 15.0, 'pt_mult': 0.5, 'sl_mult': 5.0, 'td_mins': 120}. Best is trial 393 with value: 2.627710256873383.
[I 2026-03-12 02:04:18,044] Trial 621 pruned. 
[I 2026-03-12 02:04:18,091] Trial 622 finished with value: 0.0 and parameters: {'timeframe': 'M15', 'atr_period': 13, 'atr_threshold': 10.0, 'pt_mult': 0.5, 'sl_mult': 1.0, 'td_mins': 15}. Best is trial 393 with value: 2.627710256873383.
[I 2026-03-12 02:04:18,284] Trial 623 pruned. 
[I 2026-03-12 02:04:18,368] Trial 624 pruned. 
[I 2026-03-12 02:04:18,650] Trial 625 finished with value: 2.627710256873383 and parameters: {'timeframe': 'M15', 'atr_period': 13, 'atr_threshold': 3.0, 'pt_mult': 0.5, 'sl_mult': 5.0, 'td_mins': 120}. Best is trial 393 with value: 2.627710256873383.
[I 2026-03-12 02:04:18,916] Trial 626 pruned. 
[I 2026-03-12 02:04:18,963] Trial 627 finished with value: 0.0 and parameters: {'timeframe': 'M15', 'atr_period': 13, 'atr_threshold': 15.0, 'pt_mult': 1.0, 'sl_mult': 5.0, 'td_mins': 120}. Best is trial 393 with value: 2.627710256873383.
[I 2026-03-12 02:04:19,021] Trial 628 pruned. 
[I 2026-03-12 02:04:19,113] Trial 629 pruned. 
[I 2026-03-12 02:04:19,186] Trial 630 pruned. 
[I 2026-03-12 02:04:19,369] Trial 631 pruned. 
[I 2026-03-12 02:04:19,427] Trial 632 pruned. 
[I 2026-03-12 02:04:19,706] Trial 633 finished with value: 2.627710256873383 and parameters: {'timeframe': 'M15', 'atr_period': 13, 'atr_threshold': 3.0, 'pt_mult': 0.5, 'sl_mult': 5.0, 'td_mins': 120}. Best is trial 393 with value: 2.627710256873383.
[I 2026-03-12 02:04:19,980] Trial 634 pruned. 
[I 2026-03-12 02:04:20,035] Trial 635 pruned. 
[I 2026-03-12 02:04:20,339] Trial 636 pruned. 
[I 2026-03-12 02:04:20,389] Trial 637 finished with value: 0.0 and parameters: {'timeframe': 'M15', 'atr_period': 13, 'atr_threshold': 10.0, 'pt_mult': 0.5, 'sl_mult': 5.0, 'td_mins': 1200}. Best is trial 393 with value: 2.627710256873383.
[I 2026-03-12 02:04:20,521] Trial 638 pruned. 
[I 2026-03-12 02:04:20,704] Trial 639 pruned. 
[I 2026-03-12 02:04:20,752] Trial 640 finished with value: 0.0 and parameters: {'timeframe': 'M15', 'atr_period': 13, 'atr_threshold': 10.0, 'pt_mult': 0.5, 'sl_mult': 5.0, 'td_mins': 120}. Best is trial 393 with value: 2.627710256873383.
[I 2026-03-12 02:04:20,816] Trial 641 pruned. 
[I 2026-03-12 02:04:20,881] Trial 642 pruned. 
[I 2026-03-12 02:04:21,251] Trial 643 finished with value: 2.4490491384580553 and parameters: {'timeframe': 'M15', 'atr_period': 13, 'atr_threshold': 3.0, 'pt_mult': 0.5, 'sl_mult': 5.0, 'td_mins': 180}. Best is trial 393 with value: 2.627710256873383.
[I 2026-03-12 02:04:21,604] Trial 644 pruned. 
[I 2026-03-12 02:04:21,654] Trial 645 finished with value: 0.0 and parameters: {'timeframe': 'M15', 'atr_period': 13, 'atr_threshold': 15.0, 'pt_mult': 5.0, 'sl_mult': 2.5, 'td_mins': 5}. Best is trial 393 with value: 2.627710256873383.
[I 2026-03-12 02:04:21,945] Trial 646 finished with value: 2.1318723590746487 and parameters: {'timeframe': 'M15', 'atr_period': 13, 'atr_threshold': 3.0, 'pt_mult': 1.0, 'sl_mult': 5.0, 'td_mins': 120}. Best is trial 393 with value: 2.627710256873383.
[I 2026-03-12 02:04:21,995] Trial 647 pruned. 
[I 2026-03-12 02:04:22,123] Trial 648 pruned. 
[I 2026-03-12 02:04:22,513] Trial 649 pruned. 
[I 2026-03-12 02:04:22,563] Trial 650 finished with value: 0.0 and parameters: {'timeframe': 'M15', 'atr_period': 13, 'atr_threshold': 10.0, 'pt_mult': 1.0, 'sl_mult': 5.0, 'td_mins': 720}. Best is trial 393 with value: 2.627710256873383.
[I 2026-03-12 02:04:22,835] Trial 651 finished with value: 2.627710256873383 and parameters: {'timeframe': 'M15', 'atr_period': 13, 'atr_threshold': 3.0, 'pt_mult': 0.5, 'sl_mult': 5.0, 'td_mins': 120}. Best is trial 393 with value: 2.627710256873383.
[I 2026-03-12 02:04:23,003] Trial 652 pruned. 
[I 2026-03-12 02:04:23,403] Trial 653 finished with value: 2.3274688702958795 and parameters: {'timeframe': 'M15', 'atr_period': 13, 'atr_threshold': 2.0, 'pt_mult': 0.5, 'sl_mult': 5.0, 'td_mins': 120}. Best is trial 393 with value: 2.627710256873383.
[I 2026-03-12 02:04:23,690] Trial 654 finished with value: 2.627710256873383 and parameters: {'timeframe': 'M15', 'atr_period': 13, 'atr_threshold': 3.0, 'pt_mult': 0.5, 'sl_mult': 5.0, 'td_mins': 120}. Best is trial 393 with value: 2.627710256873383.
[I 2026-03-12 02:04:23,965] Trial 655 finished with value: 2.627710256873383 and parameters: {'timeframe': 'M15', 'atr_period': 13, 'atr_threshold': 3.0, 'pt_mult': 0.5, 'sl_mult': 5.0, 'td_mins': 120}. Best is trial 393 with value: 2.627710256873383.
[I 2026-03-12 02:04:24,233] Trial 656 finished with value: 2.627710256873383 and parameters: {'timeframe': 'M15', 'atr_period': 13, 'atr_threshold': 3.0, 'pt_mult': 0.5, 'sl_mult': 5.0, 'td_mins': 120}. Best is trial 393 with value: 2.627710256873383.
[I 2026-03-12 02:04:24,515] Trial 657 finished with value: 2.627710256873383 and parameters: {'timeframe': 'M15', 'atr_period': 13, 'atr_threshold': 3.0, 'pt_mult': 0.5, 'sl_mult': 5.0, 'td_mins': 120}. Best is trial 393 with value: 2.627710256873383.
[I 2026-03-12 02:04:24,566] Trial 658 finished with value: 0.0 and parameters: {'timeframe': 'M15', 'atr_period': 13, 'atr_threshold': 10.0, 'pt_mult': 0.5, 'sl_mult': 5.0, 'td_mins': 15}. Best is trial 393 with value: 2.627710256873383.
[I 2026-03-12 02:04:24,855] Trial 659 finished with value: 2.627710256873383 and parameters: {'timeframe': 'M15', 'atr_period': 13, 'atr_threshold': 3.0, 'pt_mult': 0.5, 'sl_mult': 5.0, 'td_mins': 120}. Best is trial 393 with value: 2.627710256873383.
[I 2026-03-12 02:04:25,174] Trial 660 finished with value: 2.627710256873383 and parameters: {'timeframe': 'M15', 'atr_period': 13, 'atr_threshold': 3.0, 'pt_mult': 0.5, 'sl_mult': 5.0, 'td_mins': 120}. Best is trial 393 with value: 2.627710256873383.
[I 2026-03-12 02:04:25,506] Trial 661 finished with value: 2.627710256873383 and parameters: {'timeframe': 'M15', 'atr_period': 13, 'atr_threshold': 3.0, 'pt_mult': 0.5, 'sl_mult': 5.0, 'td_mins': 120}. Best is trial 393 with value: 2.627710256873383.
[I 2026-03-12 02:04:25,559] Trial 662 finished with value: 0.0 and parameters: {'timeframe': 'M15', 'atr_period': 13, 'atr_threshold': 10.0, 'pt_mult': 2.5, 'sl_mult': 1.0, 'td_mins': 120}. Best is trial 393 with value: 2.627710256873383.
[I 2026-03-12 02:04:25,852] Trial 663 finished with value: 2.627710256873383 and parameters: {'timeframe': 'M15', 'atr_period': 13, 'atr_threshold': 3.0, 'pt_mult': 0.5, 'sl_mult': 5.0, 'td_mins': 120}. Best is trial 393 with value: 2.627710256873383.
[I 2026-03-12 02:04:25,908] Trial 664 pruned. 
[I 2026-03-12 02:04:26,596] Trial 665 finished with value: 2.0428449374313256 and parameters: {'timeframe': 'M15', 'atr_period': 13, 'atr_threshold': 3.0, 'pt_mult': 0.5, 'sl_mult': 5.0, 'td_mins': 360}. Best is trial 393 with value: 2.627710256873383.
[I 2026-03-12 02:04:26,736] Trial 666 pruned. 
[I 2026-03-12 02:04:26,881] Trial 667 pruned. 
[I 2026-03-12 02:04:26,933] Trial 668 pruned. 
[I 2026-03-12 02:04:27,226] Trial 669 finished with value: 2.627710256873383 and parameters: {'timeframe': 'M15', 'atr_period': 13, 'atr_threshold': 3.0, 'pt_mult': 0.5, 'sl_mult': 5.0, 'td_mins': 120}. Best is trial 393 with value: 2.627710256873383.
[I 2026-03-12 02:04:27,516] Trial 670 finished with value: 2.627710256873383 and parameters: {'timeframe': 'M15', 'atr_period': 13, 'atr_threshold': 3.0, 'pt_mult': 0.5, 'sl_mult': 5.0, 'td_mins': 120}. Best is trial 393 with value: 2.627710256873383.
[I 2026-03-12 02:04:27,574] Trial 671 pruned. 
[I 2026-03-12 02:04:27,625] Trial 672 finished with value: 0.0 and parameters: {'timeframe': 'M15', 'atr_period': 13, 'atr_threshold': 15.0, 'pt_mult': 1.0, 'sl_mult': 0.5, 'td_mins': 720}. Best is trial 393 with value: 2.627710256873383.
[I 2026-03-12 02:04:27,810] Trial 673 pruned. 
[I 2026-03-12 02:04:28,087] Trial 674 finished with value: 2.627710256873383 and parameters: {'timeframe': 'M15', 'atr_period': 13, 'atr_threshold': 3.0, 'pt_mult': 0.5, 'sl_mult': 5.0, 'td_mins': 120}. Best is trial 393 with value: 2.627710256873383.
[I 2026-03-12 02:04:28,366] Trial 675 finished with value: 2.627710256873383 and parameters: {'timeframe': 'M15', 'atr_period': 13, 'atr_threshold': 3.0, 'pt_mult': 0.5, 'sl_mult': 5.0, 'td_mins': 120}. Best is trial 393 with value: 2.627710256873383.
[I 2026-03-12 02:04:28,553] Trial 676 pruned. 
[I 2026-03-12 02:04:28,602] Trial 677 pruned. 
[I 2026-03-12 02:04:28,894] Trial 678 finished with value: 2.627710256873383 and parameters: {'timeframe': 'M15', 'atr_period': 13, 'atr_threshold': 3.0, 'pt_mult': 0.5, 'sl_mult': 5.0, 'td_mins': 120}. Best is trial 393 with value: 2.627710256873383.
[I 2026-03-12 02:04:28,960] Trial 679 pruned. 
[I 2026-03-12 02:04:29,012] Trial 680 pruned. 
[I 2026-03-12 02:04:29,060] Trial 681 finished with value: 0.0 and parameters: {'timeframe': 'M15', 'atr_period': 13, 'atr_threshold': 10.0, 'pt_mult': 1.0, 'sl_mult': 1.0, 'td_mins': 180}. Best is trial 393 with value: 2.627710256873383.
[I 2026-03-12 02:04:29,344] Trial 682 finished with value: 2.627710256873383 and parameters: {'timeframe': 'M15', 'atr_period': 13, 'atr_threshold': 3.0, 'pt_mult': 0.5, 'sl_mult': 5.0, 'td_mins': 120}. Best is trial 393 with value: 2.627710256873383.
[I 2026-03-12 02:04:29,627] Trial 683 finished with value: 2.627710256873383 and parameters: {'timeframe': 'M15', 'atr_period': 13, 'atr_threshold': 3.0, 'pt_mult': 0.5, 'sl_mult': 5.0, 'td_mins': 120}. Best is trial 393 with value: 2.627710256873383.
[I 2026-03-12 02:04:29,969] Trial 684 finished with value: 2.627710256873383 and parameters: {'timeframe': 'M15', 'atr_period': 13, 'atr_threshold': 3.0, 'pt_mult': 0.5, 'sl_mult': 5.0, 'td_mins': 120}. Best is trial 393 with value: 2.627710256873383.
[I 2026-03-12 02:04:30,073] Trial 685 finished with value: 0.0 and parameters: {'timeframe': 'M15', 'atr_period': 13, 'atr_threshold': 15.0, 'pt_mult': 1.0, 'sl_mult': 1.0, 'td_mins': 5}. Best is trial 393 with value: 2.627710256873383.
[I 2026-03-12 02:04:30,399] Trial 686 pruned. 
[I 2026-03-12 02:04:30,453] Trial 687 finished with value: 0.0 and parameters: {'timeframe': 'M15', 'atr_period': 13, 'atr_threshold': 15.0, 'pt_mult': 5.0, 'sl_mult': 1.0, 'td_mins': 60}. Best is trial 393 with value: 2.627710256873383.
[I 2026-03-12 02:04:30,515] Trial 688 pruned. 
