[I 2026-03-12 01:31:32,393] Trial 49 finished with value: 0.0 and parameters: {'timeframe': 'M1', 'atr_period': 13, 'atr_threshold': 3.0, 'pt_mult': 1.0, 'sl_mult': 5.0, 'td_mins': 60}. Best is trial 46 with value: 1.2008711221707942.
[I 2026-03-12 01:31:32,446] Trial 50 finished with value: 0.0 and parameters: {'timeframe': 'M1', 'atr_period': 13, 'atr_threshold': 10.0, 'pt_mult': 0.5, 'sl_mult': 2.5, 'td_mins': 60}. Best is trial 46 with value: 1.2008711221707942.
[I 2026-03-12 01:31:32,501] Trial 51 finished with value: 0.0 and parameters: {'timeframe': 'M1', 'atr_period': 13, 'atr_threshold': 3.0, 'pt_mult': 2.5, 'sl_mult': 0.5, 'td_mins': 120}. Best is trial 46 with value: 1.2008711221707942.
[I 2026-03-12 01:31:32,555] Trial 52 finished with value: 0.0 and parameters: {'timeframe': 'M1', 'atr_period': 13, 'atr_threshold': 8.0, 'pt_mult': 2.5, 'sl_mult': 1.0, 'td_mins': 720}. Best is trial 46 with value: 1.2008711221707942.
[I 2026-03-12 01:31:32,679] Trial 53 pruned. 
[I 2026-03-12 01:31:32,739] Trial 54 pruned. 
[I 2026-03-12 01:31:33,073] Trial 55 finished with value: 1.2507858824305815 and parameters: {'timeframe': 'M1', 'atr_period': 13, 'atr_threshold': 2.0, 'pt_mult': 2.5, 'sl_mult': 5.0, 'td_mins': 60}. Best is trial 55 with value: 1.2507858824305815.
[I 2026-03-12 01:31:35,470] Trial 56 finished with value: 1.0437368260639504 and parameters: {'timeframe': 'M1', 'atr_period': 13, 'atr_threshold': 1.0, 'pt_mult': 1.0, 'sl_mult': 0.5, 'td_mins': 1080}. Best is trial 55 with value: 1.2507858824305815.
[I 2026-03-12 01:31:35,583] Trial 57 pruned. 
[I 2026-03-12 01:31:35,635] Trial 58 finished with value: 0.0 and parameters: {'timeframe': 'M1', 'atr_period': 13, 'atr_threshold': 3.0, 'pt_mult': 2.5, 'sl_mult': 0.5, 'td_mins': 30}. Best is trial 55 with value: 1.2507858824305815.
[I 2026-03-12 01:31:35,684] Trial 59 finished with value: 0.0 and parameters: {'timeframe': 'M1', 'atr_period': 13, 'atr_threshold': 8.0, 'pt_mult': 2.5, 'sl_mult': 1.0, 'td_mins': 60}. Best is trial 55 with value: 1.2507858824305815.
[I 2026-03-12 01:31:40,955] Trial 60 finished with value: 1.0250854256775348 and parameters: {'timeframe': 'M1', 'atr_period': 13, 'atr_threshold': 0.5, 'pt_mult': 2.5, 'sl_mult': 1.0, 'td_mins': 360}. Best is trial 55 with value: 1.2507858824305815.
[I 2026-03-12 01:31:42,207] Trial 61 finished with value: 1.0708200958480418 and parameters: {'timeframe': 'M1', 'atr_period': 13, 'atr_threshold': 1.0, 'pt_mult': 2.5, 'sl_mult': 0.5, 'td_mins': 120}. Best is trial 55 with value: 1.2507858824305815.
[I 2026-03-12 01:31:42,584] Trial 62 pruned. 
[I 2026-03-12 01:31:42,632] Trial 63 finished with value: 0.0 and parameters: {'timeframe': 'M1', 'atr_period': 13, 'atr_threshold': 3.0, 'pt_mult': 5.0, 'sl_mult': 0.5, 'td_mins': 120}. Best is trial 55 with value: 1.2507858824305815.
[I 2026-03-12 01:31:42,689] Trial 64 finished with value: 0.0 and parameters: {'timeframe': 'M1', 'atr_period': 13, 'atr_threshold': 10.0, 'pt_mult': 1.0, 'sl_mult': 5.0, 'td_mins': 720}. Best is trial 55 with value: 1.2507858824305815.
[I 2026-03-12 01:31:42,735] Trial 65 finished with value: 0.0 and parameters: {'timeframe': 'M1', 'atr_period': 13, 'atr_threshold': 8.0, 'pt_mult': 5.0, 'sl_mult': 0.5, 'td_mins': 120}. Best is trial 55 with value: 1.2507858824305815.
[I 2026-03-12 01:31:42,987] Trial 66 pruned. 
[I 2026-03-12 01:31:43,034] Trial 67 finished with value: 0.0 and parameters: {'timeframe': 'M1', 'atr_period': 13, 'atr_threshold': 10.0, 'pt_mult': 0.5, 'sl_mult': 0.5, 'td_mins': 720}. Best is trial 55 with value: 1.2507858824305815.
[I 2026-03-12 01:31:43,884] Trial 68 finished with value: 1.0644897855684885 and parameters: {'timeframe': 'M1', 'atr_period': 13, 'atr_threshold': 1.0, 'pt_mult': 2.5, 'sl_mult': 0.5, 'td_mins': 60}. Best is trial 55 with value: 1.2507858824305815.
[I 2026-03-12 01:31:43,932] Trial 69 finished with value: 0.0 and parameters: {'timeframe': 'M1', 'atr_period': 13, 'atr_threshold': 10.0, 'pt_mult': 0.5, 'sl_mult': 5.0, 'td_mins': 30}. Best is trial 55 with value: 1.2507858824305815.
[I 2026-03-12 01:31:43,983] Trial 70 finished with value: 0.0 and parameters: {'timeframe': 'M1', 'atr_period': 13, 'atr_threshold': 3.0, 'pt_mult': 1.0, 'sl_mult': 5.0, 'td_mins': 180}. Best is trial 55 with value: 1.2507858824305815.
[I 2026-03-12 01:31:44,052] Trial 71 pruned. 
[I 2026-03-12 01:31:44,098] Trial 72 finished with value: 0.0 and parameters: {'timeframe': 'M1', 'atr_period': 13, 'atr_threshold': 10.0, 'pt_mult': 2.5, 'sl_mult': 1.0, 'td_mins': 1200}. Best is trial 55 with value: 1.2507858824305815.
[I 2026-03-12 01:31:44,149] Trial 73 pruned. 
[I 2026-03-12 01:31:44,924] Trial 74 pruned. 
[I 2026-03-12 01:31:44,988] Trial 75 finished with value: 0.0 and parameters: {'timeframe': 'M1', 'atr_period': 13, 'atr_threshold': 8.0, 'pt_mult': 5.0, 'sl_mult': 1.0, 'td_mins': 60}. Best is trial 55 with value: 1.2507858824305815.
[I 2026-03-12 01:31:47,417] Trial 76 pruned. 
[I 2026-03-12 01:31:47,494] Trial 77 pruned. 
[I 2026-03-12 01:31:47,547] Trial 78 finished with value: 0.0 and parameters: {'timeframe': 'M1', 'atr_period': 13, 'atr_threshold': 3.0, 'pt_mult': 1.0, 'sl_mult': 5.0, 'td_mins': 60}. Best is trial 55 with value: 1.2507858824305815.
[I 2026-03-12 01:31:47,599] Trial 79 finished with value: 0.0 and parameters: {'timeframe': 'M1', 'atr_period': 13, 'atr_threshold': 10.0, 'pt_mult': 5.0, 'sl_mult': 1.0, 'td_mins': 30}. Best is trial 55 with value: 1.2507858824305815.
[I 2026-03-12 01:31:47,654] Trial 80 finished with value: 0.0 and parameters: {'timeframe': 'M1', 'atr_period': 13, 'atr_threshold': 3.0, 'pt_mult': 0.5, 'sl_mult': 1.0, 'td_mins': 60}. Best is trial 55 with value: 1.2507858824305815.
[I 2026-03-12 01:31:47,706] Trial 81 finished with value: 0.0 and parameters: {'timeframe': 'M1', 'atr_period': 13, 'atr_threshold': 15.0, 'pt_mult': 5.0, 'sl_mult': 2.5, 'td_mins': 30}. Best is trial 55 with value: 1.2507858824305815.
[I 2026-03-12 01:31:47,758] Trial 82 finished with value: 0.0 and parameters: {'timeframe': 'M1', 'atr_period': 13, 'atr_threshold': 3.0, 'pt_mult': 2.5, 'sl_mult': 5.0, 'td_mins': 180}. Best is trial 55 with value: 1.2507858824305815.
[I 2026-03-12 01:31:48,731] Trial 83 pruned. 
[I 2026-03-12 01:31:48,793] Trial 84 finished with value: 0.0 and parameters: {'timeframe': 'M1', 'atr_period': 13, 'atr_threshold': 15.0, 'pt_mult': 5.0, 'sl_mult': 0.5, 'td_mins': 120}. Best is trial 55 with value: 1.2507858824305815.
[I 2026-03-12 01:31:49,576] Trial 85 finished with value: 1.1784910659943975 and parameters: {'timeframe': 'M1', 'atr_period': 13, 'atr_threshold': 2.0, 'pt_mult': 2.5, 'sl_mult': 0.5, 'td_mins': 720}. Best is trial 55 with value: 1.2507858824305815.
[I 2026-03-12 01:31:49,633] Trial 86 finished with value: 0.0 and parameters: {'timeframe': 'M1', 'atr_period': 13, 'atr_threshold': 15.0, 'pt_mult': 0.5, 'sl_mult': 5.0, 'td_mins': 360}. Best is trial 55 with value: 1.2507858824305815.
[I 2026-03-12 01:31:49,694] Trial 87 finished with value: 0.0 and parameters: {'timeframe': 'M1', 'atr_period': 13, 'atr_threshold': 5.0, 'pt_mult': 0.5, 'sl_mult': 0.5, 'td_mins': 360}. Best is trial 55 with value: 1.2507858824305815.
[I 2026-03-12 01:31:49,753] Trial 88 finished with value: 0.0 and parameters: {'timeframe': 'M1', 'atr_period': 13, 'atr_threshold': 5.0, 'pt_mult': 1.0, 'sl_mult': 5.0, 'td_mins': 30}. Best is trial 55 with value: 1.2507858824305815.
[I 2026-03-12 01:31:49,816] Trial 89 finished with value: 0.0 and parameters: {'timeframe': 'M1', 'atr_period': 13, 'atr_threshold': 8.0, 'pt_mult': 2.5, 'sl_mult': 1.0, 'td_mins': 360}. Best is trial 55 with value: 1.2507858824305815.
[I 2026-03-12 01:31:52,785] Trial 90 pruned. 
[I 2026-03-12 01:31:52,843] Trial 91 finished with value: 0.0 and parameters: {'timeframe': 'M1', 'atr_period': 13, 'atr_threshold': 5.0, 'pt_mult': 1.0, 'sl_mult': 5.0, 'td_mins': 1080}. Best is trial 55 with value: 1.2507858824305815.
[I 2026-03-12 01:31:52,947] Trial 92 pruned. 
[I 2026-03-12 01:31:53,871] Trial 93 pruned. 
[I 2026-03-12 01:31:53,926] Trial 94 finished with value: 0.0 and parameters: {'timeframe': 'M1', 'atr_period': 13, 'atr_threshold': 3.0, 'pt_mult': 0.5, 'sl_mult': 1.0, 'td_mins': 1080}. Best is trial 55 with value: 1.2507858824305815.
[I 2026-03-12 01:31:53,981] Trial 95 finished with value: 0.0 and parameters: {'timeframe': 'M1', 'atr_period': 13, 'atr_threshold': 8.0, 'pt_mult': 2.5, 'sl_mult': 2.5, 'td_mins': 360}. Best is trial 55 with value: 1.2507858824305815.
[I 2026-03-12 01:31:54,120] Trial 96 finished with value: 1.9675745537951908 and parameters: {'timeframe': 'M1', 'atr_period': 13, 'atr_threshold': 2.0, 'pt_mult': 0.5, 'sl_mult': 5.0, 'td_mins': 15}. Best is trial 96 with value: 1.9675745537951908.
[I 2026-03-12 01:31:54,437] Trial 97 pruned. 
[I 2026-03-12 01:31:54,497] Trial 98 finished with value: 0.0 and parameters: {'timeframe': 'M1', 'atr_period': 13, 'atr_threshold': 5.0, 'pt_mult': 2.5, 'sl_mult': 5.0, 'td_mins': 1080}. Best is trial 96 with value: 1.9675745537951908.
[I 2026-03-12 01:31:54,674] Trial 99 finished with value: 1.1106220225576493 and parameters: {'timeframe': 'M1', 'atr_period': 13, 'atr_threshold': 2.0, 'pt_mult': 1.0, 'sl_mult': 0.5, 'td_mins': 30}. Best is trial 96 with value: 1.9675745537951908.
[I 2026-03-12 01:31:54,726] Trial 100 finished with value: 0.0 and parameters: {'timeframe': 'M1', 'atr_period': 13, 'atr_threshold': 15.0, 'pt_mult': 1.0, 'sl_mult': 1.0, 'td_mins': 5}. Best is trial 96 with value: 1.9675745537951908.
[I 2026-03-12 01:31:54,785] Trial 101 finished with value: 0.0 and parameters: {'timeframe': 'M1', 'atr_period': 13, 'atr_threshold': 3.0, 'pt_mult': 5.0, 'sl_mult': 0.5, 'td_mins': 30}. Best is trial 96 with value: 1.9675745537951908.
[I 2026-03-12 01:31:54,843] Trial 102 finished with value: 0.0 and parameters: {'timeframe': 'M1', 'atr_period': 13, 'atr_threshold': 3.0, 'pt_mult': 0.5, 'sl_mult': 2.5, 'td_mins': 120}. Best is trial 96 with value: 1.9675745537951908.
[I 2026-03-12 01:31:54,898] Trial 103 finished with value: 0.0 and parameters: {'timeframe': 'M1', 'atr_period': 13, 'atr_threshold': 5.0, 'pt_mult': 5.0, 'sl_mult': 5.0, 'td_mins': 30}. Best is trial 96 with value: 1.9675745537951908.
[I 2026-03-12 01:31:55,934] Trial 104 pruned. 
[I 2026-03-12 01:31:55,985] Trial 105 finished with value: 0.0 and parameters: {'timeframe': 'M1', 'atr_period': 13, 'atr_threshold': 3.0, 'pt_mult': 0.5, 'sl_mult': 2.5, 'td_mins': 15}. Best is trial 96 with value: 1.9675745537951908.
[I 2026-03-12 01:31:56,042] Trial 106 finished with value: 0.0 and parameters: {'timeframe': 'M1', 'atr_period': 13, 'atr_threshold': 15.0, 'pt_mult': 5.0, 'sl_mult': 2.5, 'td_mins': 1080}. Best is trial 96 with value: 1.9675745537951908.
[I 2026-03-12 01:31:56,095] Trial 107 finished with value: 0.0 and parameters: {'timeframe': 'M1', 'atr_period': 13, 'atr_threshold': 3.0, 'pt_mult': 5.0, 'sl_mult': 0.5, 'td_mins': 180}. Best is trial 96 with value: 1.9675745537951908.
[I 2026-03-12 01:31:56,144] Trial 108 finished with value: 0.0 and parameters: {'timeframe': 'M1', 'atr_period': 13, 'atr_threshold': 15.0, 'pt_mult': 0.5, 'sl_mult': 0.5, 'td_mins': 5}. Best is trial 96 with value: 1.9675745537951908.
[I 2026-03-12 01:31:56,195] Trial 109 finished with value: 0.0 and parameters: {'timeframe': 'M1', 'atr_period': 13, 'atr_threshold': 5.0, 'pt_mult': 5.0, 'sl_mult': 0.5, 'td_mins': 1200}. Best is trial 96 with value: 1.9675745537951908.
[I 2026-03-12 01:31:56,245] Trial 110 finished with value: 0.0 and parameters: {'timeframe': 'M1', 'atr_period': 13, 'atr_threshold': 5.0, 'pt_mult': 0.5, 'sl_mult': 1.0, 'td_mins': 360}. Best is trial 96 with value: 1.9675745537951908.
[I 2026-03-12 01:31:56,294] Trial 111 finished with value: 0.0 and parameters: {'timeframe': 'M1', 'atr_period': 13, 'atr_threshold': 8.0, 'pt_mult': 2.5, 'sl_mult': 1.0, 'td_mins': 180}. Best is trial 96 with value: 1.9675745537951908.
[I 2026-03-12 01:31:57,966] Trial 112 finished with value: 1.2008711221707942 and parameters: {'timeframe': 'M1', 'atr_period': 13, 'atr_threshold': 2.0, 'pt_mult': 5.0, 'sl_mult': 0.5, 'td_mins': 1200}. Best is trial 96 with value: 1.9675745537951908.
[I 2026-03-12 01:31:58,031] Trial 113 pruned. 
[I 2026-03-12 01:31:58,081] Trial 114 finished with value: 0.0 and parameters: {'timeframe': 'M1', 'atr_period': 13, 'atr_threshold': 8.0, 'pt_mult': 5.0, 'sl_mult': 1.0, 'td_mins': 1080}. Best is trial 96 with value: 1.9675745537951908.
[I 2026-03-12 01:31:58,132] Trial 115 finished with value: 0.0 and parameters: {'timeframe': 'M1', 'atr_period': 13, 'atr_threshold': 5.0, 'pt_mult': 5.0, 'sl_mult': 2.5, 'td_mins': 720}. Best is trial 96 with value: 1.9675745537951908.
[I 2026-03-12 01:31:58,183] Trial 116 finished with value: 0.0 and parameters: {'timeframe': 'M1', 'atr_period': 13, 'atr_threshold': 8.0, 'pt_mult': 1.0, 'sl_mult': 2.5, 'td_mins': 15}. Best is trial 96 with value: 1.9675745537951908.
[I 2026-03-12 01:31:58,242] Trial 117 finished with value: 0.0 and parameters: {'timeframe': 'M1', 'atr_period': 13, 'atr_threshold': 8.0, 'pt_mult': 1.0, 'sl_mult': 5.0, 'td_mins': 360}. Best is trial 96 with value: 1.9675745537951908.
[I 2026-03-12 01:31:58,296] Trial 118 finished with value: 0.0 and parameters: {'timeframe': 'M1', 'atr_period': 13, 'atr_threshold': 15.0, 'pt_mult': 1.0, 'sl_mult': 5.0, 'td_mins': 720}. Best is trial 96 with value: 1.9675745537951908.
[I 2026-03-12 01:31:58,380] Trial 119 finished with value: 0.0 and parameters: {'timeframe': 'M1', 'atr_period': 13, 'atr_threshold': 8.0, 'pt_mult': 5.0, 'sl_mult': 5.0, 'td_mins': 1200}. Best is trial 96 with value: 1.9675745537951908.
[I 2026-03-12 01:31:58,439] Trial 120 finished with value: 0.0 and parameters: {'timeframe': 'M1', 'atr_period': 13, 'atr_threshold': 3.0, 'pt_mult': 1.0, 'sl_mult': 5.0, 'td_mins': 180}. Best is trial 96 with value: 1.9675745537951908.
[I 2026-03-12 01:31:58,490] Trial 121 finished with value: 0.0 and parameters: {'timeframe': 'M1', 'atr_period': 13, 'atr_threshold': 10.0, 'pt_mult': 1.0, 'sl_mult': 5.0, 'td_mins': 30}. Best is trial 96 with value: 1.9675745537951908.
[I 2026-03-12 01:31:58,539] Trial 122 finished with value: 0.0 and parameters: {'timeframe': 'M1', 'atr_period': 13, 'atr_threshold': 8.0, 'pt_mult': 5.0, 'sl_mult': 2.5, 'td_mins': 1080}. Best is trial 96 with value: 1.9675745537951908.
[I 2026-03-12 01:31:58,588] Trial 123 finished with value: 0.0 and parameters: {'timeframe': 'M1', 'atr_period': 13, 'atr_threshold': 3.0, 'pt_mult': 1.0, 'sl_mult': 5.0, 'td_mins': 60}. Best is trial 96 with value: 1.9675745537951908.
[I 2026-03-12 01:32:01,933] Trial 124 pruned. 
[I 2026-03-12 01:32:02,006] Trial 125 finished with value: 0.0 and parameters: {'timeframe': 'M1', 'atr_period': 13, 'atr_threshold': 5.0, 'pt_mult': 2.5, 'sl_mult': 0.5, 'td_mins': 120}. Best is trial 96 with value: 1.9675745537951908.
[I 2026-03-12 01:32:02,083] Trial 126 pruned. 
[I 2026-03-12 01:32:02,137] Trial 127 finished with value: 0.0 and parameters: {'timeframe': 'M1', 'atr_period': 13, 'atr_threshold': 15.0, 'pt_mult': 2.5, 'sl_mult': 2.5, 'td_mins': 180}. Best is trial 96 with value: 1.9675745537951908.
[I 2026-03-12 01:32:02,189] Trial 128 finished with value: 0.0 and parameters: {'timeframe': 'M1', 'atr_period': 13, 'atr_threshold': 15.0, 'pt_mult': 2.5, 'sl_mult': 5.0, 'td_mins': 120}. Best is trial 96 with value: 1.9675745537951908.
[I 2026-03-12 01:32:05,102] Trial 129 finished with value: 1.076542505786332 and parameters: {'timeframe': 'M1', 'atr_period': 13, 'atr_threshold': 0.5, 'pt_mult': 2.5, 'sl_mult': 0.5, 'td_mins': 120}. Best is trial 96 with value: 1.9675745537951908.
[I 2026-03-12 01:32:05,181] Trial 130 finished with value: 0.0 and parameters: {'timeframe': 'M1', 'atr_period': 13, 'atr_threshold': 3.0, 'pt_mult': 5.0, 'sl_mult': 1.0, 'td_mins': 360}. Best is trial 96 with value: 1.9675745537951908.
[I 2026-03-12 01:32:05,249] Trial 131 finished with value: 0.0 and parameters: {'timeframe': 'M1', 'atr_period': 13, 'atr_threshold': 5.0, 'pt_mult': 2.5, 'sl_mult': 1.0, 'td_mins': 15}. Best is trial 96 with value: 1.9675745537951908.
[I 2026-03-12 01:32:05,461] Trial 132 pruned. 
[I 2026-03-12 01:32:05,512] Trial 133 finished with value: 0.0 and parameters: {'timeframe': 'M1', 'atr_period': 13, 'atr_threshold': 15.0, 'pt_mult': 2.5, 'sl_mult': 5.0, 'td_mins': 360}. Best is trial 96 with value: 1.9675745537951908.
[I 2026-03-12 01:32:05,568] Trial 134 finished with value: 0.0 and parameters: {'timeframe': 'M1', 'atr_period': 13, 'atr_threshold': 5.0, 'pt_mult': 1.0, 'sl_mult': 2.5, 'td_mins': 60}. Best is trial 96 with value: 1.9675745537951908.
[I 2026-03-12 01:32:05,622] Trial 135 finished with value: 0.0 and parameters: {'timeframe': 'M1', 'atr_period': 13, 'atr_threshold': 15.0, 'pt_mult': 5.0, 'sl_mult': 0.5, 'td_mins': 720}. Best is trial 96 with value: 1.9675745537951908.
[I 2026-03-12 01:32:05,671] Trial 136 finished with value: 0.0 and parameters: {'timeframe': 'M1', 'atr_period': 13, 'atr_threshold': 3.0, 'pt_mult': 5.0, 'sl_mult': 0.5, 'td_mins': 1080}. Best is trial 96 with value: 1.9675745537951908.
[I 2026-03-12 01:32:07,018] Trial 137 pruned. 
[I 2026-03-12 01:32:07,074] Trial 138 finished with value: 0.0 and parameters: {'timeframe': 'M1', 'atr_period': 13, 'atr_threshold': 3.0, 'pt_mult': 1.0, 'sl_mult': 1.0, 'td_mins': 180}. Best is trial 96 with value: 1.9675745537951908.
[I 2026-03-12 01:32:07,244] Trial 139 pruned. 
[I 2026-03-12 01:32:07,297] Trial 140 finished with value: 0.0 and parameters: {'timeframe': 'M1', 'atr_period': 13, 'atr_threshold': 8.0, 'pt_mult': 5.0, 'sl_mult': 1.0, 'td_mins': 1200}. Best is trial 96 with value: 1.9675745537951908.
[I 2026-03-12 01:32:07,346] Trial 141 finished with value: 0.0 and parameters: {'timeframe': 'M1', 'atr_period': 13, 'atr_threshold': 15.0, 'pt_mult': 5.0, 'sl_mult': 1.0, 'td_mins': 720}. Best is trial 96 with value: 1.9675745537951908.
[I 2026-03-12 01:32:07,396] Trial 142 finished with value: 0.0 and parameters: {'timeframe': 'M1', 'atr_period': 13, 'atr_threshold': 5.0, 'pt_mult': 5.0, 'sl_mult': 1.0, 'td_mins': 5}. Best is trial 96 with value: 1.9675745537951908.
[I 2026-03-12 01:32:07,444] Trial 143 finished with value: 0.0 and parameters: {'timeframe': 'M1', 'atr_period': 13, 'atr_threshold': 3.0, 'pt_mult': 1.0, 'sl_mult': 5.0, 'td_mins': 30}. Best is trial 96 with value: 1.9675745537951908.
[I 2026-03-12 01:32:07,492] Trial 144 finished with value: 0.0 and parameters: {'timeframe': 'M1', 'atr_period': 13, 'atr_threshold': 3.0, 'pt_mult': 1.0, 'sl_mult': 1.0, 'td_mins': 5}. Best is trial 96 with value: 1.9675745537951908.
[I 2026-03-12 01:32:07,540] Trial 145 finished with value: 0.0 and parameters: {'timeframe': 'M1', 'atr_period': 13, 'atr_threshold': 15.0, 'pt_mult': 0.5, 'sl_mult': 0.5, 'td_mins': 720}. Best is trial 96 with value: 1.9675745537951908.
[I 2026-03-12 01:32:07,743] Trial 146 finished with value: 1.9675745537951908 and parameters: {'timeframe': 'M1', 'atr_period': 13, 'atr_threshold': 2.0, 'pt_mult': 0.5, 'sl_mult': 5.0, 'td_mins': 15}. Best is trial 96 with value: 1.9675745537951908.
[I 2026-03-12 01:32:07,828] Trial 147 pruned. 
[I 2026-03-12 01:32:08,806] Trial 148 pruned. 
[I 2026-03-12 01:32:08,862] Trial 149 finished with value: 0.0 and parameters: {'timeframe': 'M1', 'atr_period': 13, 'atr_threshold': 3.0, 'pt_mult': 0.5, 'sl_mult': 2.5, 'td_mins': 120}. Best is trial 96 with value: 1.9675745537951908.
[I 2026-03-12 01:32:08,919] Trial 150 finished with value: 0.0 and parameters: {'timeframe': 'M1', 'atr_period': 13, 'atr_threshold': 8.0, 'pt_mult': 1.0, 'sl_mult': 0.5, 'td_mins': 120}. Best is trial 96 with value: 1.9675745537951908.
[I 2026-03-12 01:32:08,969] Trial 151 finished with value: 0.0 and parameters: {'timeframe': 'M1', 'atr_period': 13, 'atr_threshold': 8.0, 'pt_mult': 0.5, 'sl_mult': 1.0, 'td_mins': 15}. Best is trial 96 with value: 1.9675745537951908.
[I 2026-03-12 01:32:09,065] Trial 152 pruned. 
[I 2026-03-12 01:32:09,471] Trial 153 pruned. 
[I 2026-03-12 01:32:09,682] Trial 154 pruned. 
[I 2026-03-12 01:32:10,199] Trial 155 pruned. 
[I 2026-03-12 01:32:10,272] Trial 156 finished with value: 0.0 and parameters: {'timeframe': 'M1', 'atr_period': 13, 'atr_threshold': 15.0, 'pt_mult': 5.0, 'sl_mult': 0.5, 'td_mins': 180}. Best is trial 96 with value: 1.9675745537951908.
[I 2026-03-12 01:32:10,339] Trial 157 finished with value: 0.0 and parameters: {'timeframe': 'M1', 'atr_period': 13, 'atr_threshold': 8.0, 'pt_mult': 2.5, 'sl_mult': 0.5, 'td_mins': 60}. Best is trial 96 with value: 1.9675745537951908.
[I 2026-03-12 01:32:10,398] Trial 158 finished with value: 0.0 and parameters: {'timeframe': 'M1', 'atr_period': 13, 'atr_threshold': 8.0, 'pt_mult': 0.5, 'sl_mult': 5.0, 'td_mins': 15}. Best is trial 96 with value: 1.9675745537951908.
[I 2026-03-12 01:32:11,057] Trial 159 pruned. 
[I 2026-03-12 01:32:11,110] Trial 160 finished with value: 0.0 and parameters: {'timeframe': 'M1', 'atr_period': 13, 'atr_threshold': 8.0, 'pt_mult': 2.5, 'sl_mult': 2.5, 'td_mins': 1080}. Best is trial 96 with value: 1.9675745537951908.
[I 2026-03-12 01:32:11,167] Trial 161 finished with value: 0.0 and parameters: {'timeframe': 'M1', 'atr_period': 13, 'atr_threshold': 15.0, 'pt_mult': 0.5, 'sl_mult': 2.5, 'td_mins': 360}. Best is trial 96 with value: 1.9675745537951908.
[I 2026-03-12 01:32:11,223] Trial 162 finished with value: 0.0 and parameters: {'timeframe': 'M1', 'atr_period': 13, 'atr_threshold': 3.0, 'pt_mult': 1.0, 'sl_mult': 5.0, 'td_mins': 1080}. Best is trial 96 with value: 1.9675745537951908.
[I 2026-03-12 01:32:11,279] Trial 163 finished with value: 0.0 and parameters: {'timeframe': 'M1', 'atr_period': 13, 'atr_threshold': 3.0, 'pt_mult': 2.5, 'sl_mult': 0.5, 'td_mins': 720}. Best is trial 96 with value: 1.9675745537951908.
[I 2026-03-12 01:32:11,844] Trial 164 pruned. 
