[I 2026-03-12 01:48:27,210] Trial 512 finished with value: 2.764226017929662 and parameters: {'timeframe': 'M5', 'atr_period': 13, 'atr_threshold': 3.0, 'pt_mult': 0.5, 'sl_mult': 5.0, 'td_mins': 30}. Best is trial 497 with value: 2.764226017929662.
[I 2026-03-12 01:48:27,331] Trial 513 finished with value: 2.764226017929662 and parameters: {'timeframe': 'M5', 'atr_period': 13, 'atr_threshold': 3.0, 'pt_mult': 0.5, 'sl_mult': 5.0, 'td_mins': 30}. Best is trial 497 with value: 2.764226017929662.
[I 2026-03-12 01:48:27,452] Trial 514 finished with value: 2.764226017929662 and parameters: {'timeframe': 'M5', 'atr_period': 13, 'atr_threshold': 3.0, 'pt_mult': 0.5, 'sl_mult': 5.0, 'td_mins': 30}. Best is trial 497 with value: 2.764226017929662.
[I 2026-03-12 01:48:27,570] Trial 515 finished with value: 2.764226017929662 and parameters: {'timeframe': 'M5', 'atr_period': 13, 'atr_threshold': 3.0, 'pt_mult': 0.5, 'sl_mult': 5.0, 'td_mins': 30}. Best is trial 497 with value: 2.764226017929662.
[I 2026-03-12 01:48:27,692] Trial 516 finished with value: 2.764226017929662 and parameters: {'timeframe': 'M5', 'atr_period': 13, 'atr_threshold': 3.0, 'pt_mult': 0.5, 'sl_mult': 5.0, 'td_mins': 30}. Best is trial 497 with value: 2.764226017929662.
[I 2026-03-12 01:48:27,814] Trial 517 finished with value: 2.764226017929662 and parameters: {'timeframe': 'M5', 'atr_period': 13, 'atr_threshold': 3.0, 'pt_mult': 0.5, 'sl_mult': 5.0, 'td_mins': 30}. Best is trial 497 with value: 2.764226017929662.
[I 2026-03-12 01:48:27,931] Trial 518 finished with value: 2.764226017929662 and parameters: {'timeframe': 'M5', 'atr_period': 13, 'atr_threshold': 3.0, 'pt_mult': 0.5, 'sl_mult': 5.0, 'td_mins': 30}. Best is trial 497 with value: 2.764226017929662.
[I 2026-03-12 01:48:28,055] Trial 519 finished with value: 2.764226017929662 and parameters: {'timeframe': 'M5', 'atr_period': 13, 'atr_threshold': 3.0, 'pt_mult': 0.5, 'sl_mult': 5.0, 'td_mins': 30}. Best is trial 497 with value: 2.764226017929662.
[I 2026-03-12 01:48:28,176] Trial 520 finished with value: 2.764226017929662 and parameters: {'timeframe': 'M5', 'atr_period': 13, 'atr_threshold': 3.0, 'pt_mult': 0.5, 'sl_mult': 5.0, 'td_mins': 30}. Best is trial 497 with value: 2.764226017929662.
[I 2026-03-12 01:48:28,308] Trial 521 finished with value: 2.764226017929662 and parameters: {'timeframe': 'M5', 'atr_period': 13, 'atr_threshold': 3.0, 'pt_mult': 0.5, 'sl_mult': 5.0, 'td_mins': 30}. Best is trial 497 with value: 2.764226017929662.
[I 2026-03-12 01:48:28,450] Trial 522 finished with value: 2.764226017929662 and parameters: {'timeframe': 'M5', 'atr_period': 13, 'atr_threshold': 3.0, 'pt_mult': 0.5, 'sl_mult': 5.0, 'td_mins': 30}. Best is trial 497 with value: 2.764226017929662.
[I 2026-03-12 01:48:28,593] Trial 523 finished with value: 2.764226017929662 and parameters: {'timeframe': 'M5', 'atr_period': 13, 'atr_threshold': 3.0, 'pt_mult': 0.5, 'sl_mult': 5.0, 'td_mins': 30}. Best is trial 497 with value: 2.764226017929662.
[I 2026-03-12 01:48:28,735] Trial 524 finished with value: 2.764226017929662 and parameters: {'timeframe': 'M5', 'atr_period': 13, 'atr_threshold': 3.0, 'pt_mult': 0.5, 'sl_mult': 5.0, 'td_mins': 30}. Best is trial 497 with value: 2.764226017929662.
[I 2026-03-12 01:48:28,877] Trial 525 finished with value: 2.764226017929662 and parameters: {'timeframe': 'M5', 'atr_period': 13, 'atr_threshold': 3.0, 'pt_mult': 0.5, 'sl_mult': 5.0, 'td_mins': 30}. Best is trial 497 with value: 2.764226017929662.
[I 2026-03-12 01:48:28,932] Trial 526 finished with value: 0.0 and parameters: {'timeframe': 'M5', 'atr_period': 13, 'atr_threshold': 10.0, 'pt_mult': 0.5, 'sl_mult': 5.0, 'td_mins': 30}. Best is trial 497 with value: 2.764226017929662.
[I 2026-03-12 01:48:29,035] Trial 527 pruned. 
[I 2026-03-12 01:48:29,131] Trial 528 pruned. 
[I 2026-03-12 01:48:29,203] Trial 529 pruned. 
[I 2026-03-12 01:48:29,264] Trial 530 finished with value: 0.0 and parameters: {'timeframe': 'M5', 'atr_period': 13, 'atr_threshold': 15.0, 'pt_mult': 0.5, 'sl_mult': 5.0, 'td_mins': 30}. Best is trial 497 with value: 2.764226017929662.
[I 2026-03-12 01:48:29,409] Trial 531 finished with value: 2.764226017929662 and parameters: {'timeframe': 'M5', 'atr_period': 13, 'atr_threshold': 3.0, 'pt_mult': 0.5, 'sl_mult': 5.0, 'td_mins': 30}. Best is trial 497 with value: 2.764226017929662.
[I 2026-03-12 01:48:29,468] Trial 532 finished with value: 0.0 and parameters: {'timeframe': 'M5', 'atr_period': 13, 'atr_threshold': 8.0, 'pt_mult': 0.5, 'sl_mult': 5.0, 'td_mins': 30}. Best is trial 497 with value: 2.764226017929662.
[I 2026-03-12 01:48:29,540] Trial 533 pruned. 
[I 2026-03-12 01:48:29,599] Trial 534 finished with value: 0.0 and parameters: {'timeframe': 'M5', 'atr_period': 13, 'atr_threshold': 5.0, 'pt_mult': 0.5, 'sl_mult': 5.0, 'td_mins': 30}. Best is trial 497 with value: 2.764226017929662.
[I 2026-03-12 01:48:29,761] Trial 535 finished with value: 2.764226017929662 and parameters: {'timeframe': 'M5', 'atr_period': 13, 'atr_threshold': 3.0, 'pt_mult': 0.5, 'sl_mult': 5.0, 'td_mins': 30}. Best is trial 497 with value: 2.764226017929662.
[I 2026-03-12 01:48:29,915] Trial 536 finished with value: 2.764226017929662 and parameters: {'timeframe': 'M5', 'atr_period': 13, 'atr_threshold': 3.0, 'pt_mult': 0.5, 'sl_mult': 5.0, 'td_mins': 30}. Best is trial 497 with value: 2.764226017929662.
[I 2026-03-12 01:48:30,119] Trial 537 finished with value: 2.8555764149575955 and parameters: {'timeframe': 'M5', 'atr_period': 13, 'atr_threshold': 3.0, 'pt_mult': 0.5, 'sl_mult': 5.0, 'td_mins': 60}. Best is trial 537 with value: 2.8555764149575955.
[I 2026-03-12 01:48:30,317] Trial 538 finished with value: 2.8555764149575955 and parameters: {'timeframe': 'M5', 'atr_period': 13, 'atr_threshold': 3.0, 'pt_mult': 0.5, 'sl_mult': 5.0, 'td_mins': 60}. Best is trial 537 with value: 2.8555764149575955.
[I 2026-03-12 01:48:30,508] Trial 539 finished with value: 2.8555764149575955 and parameters: {'timeframe': 'M5', 'atr_period': 13, 'atr_threshold': 3.0, 'pt_mult': 0.5, 'sl_mult': 5.0, 'td_mins': 60}. Best is trial 537 with value: 2.8555764149575955.
[I 2026-03-12 01:48:30,703] Trial 540 finished with value: 2.8555764149575955 and parameters: {'timeframe': 'M5', 'atr_period': 13, 'atr_threshold': 3.0, 'pt_mult': 0.5, 'sl_mult': 5.0, 'td_mins': 60}. Best is trial 537 with value: 2.8555764149575955.
[I 2026-03-12 01:48:30,897] Trial 541 finished with value: 2.8555764149575955 and parameters: {'timeframe': 'M5', 'atr_period': 13, 'atr_threshold': 3.0, 'pt_mult': 0.5, 'sl_mult': 5.0, 'td_mins': 60}. Best is trial 537 with value: 2.8555764149575955.
[I 2026-03-12 01:48:31,064] Trial 542 finished with value: 2.8555764149575955 and parameters: {'timeframe': 'M5', 'atr_period': 13, 'atr_threshold': 3.0, 'pt_mult': 0.5, 'sl_mult': 5.0, 'td_mins': 60}. Best is trial 537 with value: 2.8555764149575955.
[I 2026-03-12 01:48:31,232] Trial 543 finished with value: 2.8555764149575955 and parameters: {'timeframe': 'M5', 'atr_period': 13, 'atr_threshold': 3.0, 'pt_mult': 0.5, 'sl_mult': 5.0, 'td_mins': 60}. Best is trial 537 with value: 2.8555764149575955.
[I 2026-03-12 01:48:31,398] Trial 544 finished with value: 2.8555764149575955 and parameters: {'timeframe': 'M5', 'atr_period': 13, 'atr_threshold': 3.0, 'pt_mult': 0.5, 'sl_mult': 5.0, 'td_mins': 60}. Best is trial 537 with value: 2.8555764149575955.
[I 2026-03-12 01:48:31,566] Trial 545 finished with value: 2.8555764149575955 and parameters: {'timeframe': 'M5', 'atr_period': 13, 'atr_threshold': 3.0, 'pt_mult': 0.5, 'sl_mult': 5.0, 'td_mins': 60}. Best is trial 537 with value: 2.8555764149575955.
[I 2026-03-12 01:48:31,739] Trial 546 finished with value: 2.8555764149575955 and parameters: {'timeframe': 'M5', 'atr_period': 13, 'atr_threshold': 3.0, 'pt_mult': 0.5, 'sl_mult': 5.0, 'td_mins': 60}. Best is trial 537 with value: 2.8555764149575955.
[I 2026-03-12 01:48:31,909] Trial 547 finished with value: 2.8555764149575955 and parameters: {'timeframe': 'M5', 'atr_period': 13, 'atr_threshold': 3.0, 'pt_mult': 0.5, 'sl_mult': 5.0, 'td_mins': 60}. Best is trial 537 with value: 2.8555764149575955.
[I 2026-03-12 01:48:31,971] Trial 548 pruned. 
[I 2026-03-12 01:48:32,149] Trial 549 finished with value: 2.8555764149575955 and parameters: {'timeframe': 'M5', 'atr_period': 13, 'atr_threshold': 3.0, 'pt_mult': 0.5, 'sl_mult': 5.0, 'td_mins': 60}. Best is trial 537 with value: 2.8555764149575955.
[I 2026-03-12 01:48:32,325] Trial 550 finished with value: 2.8555764149575955 and parameters: {'timeframe': 'M5', 'atr_period': 13, 'atr_threshold': 3.0, 'pt_mult': 0.5, 'sl_mult': 5.0, 'td_mins': 60}. Best is trial 537 with value: 2.8555764149575955.
[I 2026-03-12 01:48:32,493] Trial 551 finished with value: 2.8555764149575955 and parameters: {'timeframe': 'M5', 'atr_period': 13, 'atr_threshold': 3.0, 'pt_mult': 0.5, 'sl_mult': 5.0, 'td_mins': 60}. Best is trial 537 with value: 2.8555764149575955.
[I 2026-03-12 01:48:32,660] Trial 552 finished with value: 2.8555764149575955 and parameters: {'timeframe': 'M5', 'atr_period': 13, 'atr_threshold': 3.0, 'pt_mult': 0.5, 'sl_mult': 5.0, 'td_mins': 60}. Best is trial 537 with value: 2.8555764149575955.
[I 2026-03-12 01:48:32,829] Trial 553 finished with value: 2.8555764149575955 and parameters: {'timeframe': 'M5', 'atr_period': 13, 'atr_threshold': 3.0, 'pt_mult': 0.5, 'sl_mult': 5.0, 'td_mins': 60}. Best is trial 537 with value: 2.8555764149575955.
[I 2026-03-12 01:48:33,005] Trial 554 finished with value: 2.8555764149575955 and parameters: {'timeframe': 'M5', 'atr_period': 13, 'atr_threshold': 3.0, 'pt_mult': 0.5, 'sl_mult': 5.0, 'td_mins': 60}. Best is trial 537 with value: 2.8555764149575955.
[I 2026-03-12 01:48:33,170] Trial 555 finished with value: 2.8555764149575955 and parameters: {'timeframe': 'M5', 'atr_period': 13, 'atr_threshold': 3.0, 'pt_mult': 0.5, 'sl_mult': 5.0, 'td_mins': 60}. Best is trial 537 with value: 2.8555764149575955.
[I 2026-03-12 01:48:33,339] Trial 556 finished with value: 2.8555764149575955 and parameters: {'timeframe': 'M5', 'atr_period': 13, 'atr_threshold': 3.0, 'pt_mult': 0.5, 'sl_mult': 5.0, 'td_mins': 60}. Best is trial 537 with value: 2.8555764149575955.
[I 2026-03-12 01:48:33,507] Trial 557 finished with value: 2.8555764149575955 and parameters: {'timeframe': 'M5', 'atr_period': 13, 'atr_threshold': 3.0, 'pt_mult': 0.5, 'sl_mult': 5.0, 'td_mins': 60}. Best is trial 537 with value: 2.8555764149575955.
[I 2026-03-12 01:48:33,677] Trial 558 finished with value: 2.8555764149575955 and parameters: {'timeframe': 'M5', 'atr_period': 13, 'atr_threshold': 3.0, 'pt_mult': 0.5, 'sl_mult': 5.0, 'td_mins': 60}. Best is trial 537 with value: 2.8555764149575955.
[I 2026-03-12 01:48:33,843] Trial 559 finished with value: 2.8555764149575955 and parameters: {'timeframe': 'M5', 'atr_period': 13, 'atr_threshold': 3.0, 'pt_mult': 0.5, 'sl_mult': 5.0, 'td_mins': 60}. Best is trial 537 with value: 2.8555764149575955.
[I 2026-03-12 01:48:34,024] Trial 560 finished with value: 2.8555764149575955 and parameters: {'timeframe': 'M5', 'atr_period': 13, 'atr_threshold': 3.0, 'pt_mult': 0.5, 'sl_mult': 5.0, 'td_mins': 60}. Best is trial 537 with value: 2.8555764149575955.
[I 2026-03-12 01:48:34,190] Trial 561 finished with value: 2.8555764149575955 and parameters: {'timeframe': 'M5', 'atr_period': 13, 'atr_threshold': 3.0, 'pt_mult': 0.5, 'sl_mult': 5.0, 'td_mins': 60}. Best is trial 537 with value: 2.8555764149575955.
[I 2026-03-12 01:48:34,365] Trial 562 finished with value: 2.8555764149575955 and parameters: {'timeframe': 'M5', 'atr_period': 13, 'atr_threshold': 3.0, 'pt_mult': 0.5, 'sl_mult': 5.0, 'td_mins': 60}. Best is trial 537 with value: 2.8555764149575955.
[I 2026-03-12 01:48:34,536] Trial 563 finished with value: 2.8555764149575955 and parameters: {'timeframe': 'M5', 'atr_period': 13, 'atr_threshold': 3.0, 'pt_mult': 0.5, 'sl_mult': 5.0, 'td_mins': 60}. Best is trial 537 with value: 2.8555764149575955.
[I 2026-03-12 01:48:34,827] Trial 564 pruned. 
[I 2026-03-12 01:48:34,881] Trial 565 finished with value: 0.0 and parameters: {'timeframe': 'M5', 'atr_period': 13, 'atr_threshold': 10.0, 'pt_mult': 0.5, 'sl_mult': 5.0, 'td_mins': 60}. Best is trial 537 with value: 2.8555764149575955.
[I 2026-03-12 01:48:34,954] Trial 566 pruned. 
[I 2026-03-12 01:48:35,019] Trial 567 pruned. 
[I 2026-03-12 01:48:35,066] Trial 568 finished with value: 0.0 and parameters: {'timeframe': 'M5', 'atr_period': 13, 'atr_threshold': 5.0, 'pt_mult': 0.5, 'sl_mult': 5.0, 'td_mins': 60}. Best is trial 537 with value: 2.8555764149575955.
[I 2026-03-12 01:48:35,391] Trial 569 finished with value: 2.406101417633213 and parameters: {'timeframe': 'M5', 'atr_period': 13, 'atr_threshold': 2.0, 'pt_mult': 0.5, 'sl_mult': 5.0, 'td_mins': 60}. Best is trial 537 with value: 2.8555764149575955.
[I 2026-03-12 01:48:35,443] Trial 570 finished with value: 0.0 and parameters: {'timeframe': 'M5', 'atr_period': 13, 'atr_threshold': 15.0, 'pt_mult': 0.5, 'sl_mult': 5.0, 'td_mins': 60}. Best is trial 537 with value: 2.8555764149575955.
[I 2026-03-12 01:48:35,622] Trial 571 finished with value: 2.8555764149575955 and parameters: {'timeframe': 'M5', 'atr_period': 13, 'atr_threshold': 3.0, 'pt_mult': 0.5, 'sl_mult': 5.0, 'td_mins': 60}. Best is trial 537 with value: 2.8555764149575955.
[I 2026-03-12 01:48:35,796] Trial 572 finished with value: 2.8555764149575955 and parameters: {'timeframe': 'M5', 'atr_period': 13, 'atr_threshold': 3.0, 'pt_mult': 0.5, 'sl_mult': 5.0, 'td_mins': 60}. Best is trial 537 with value: 2.8555764149575955.
[I 2026-03-12 01:48:35,978] Trial 573 finished with value: 2.8555764149575955 and parameters: {'timeframe': 'M5', 'atr_period': 13, 'atr_threshold': 3.0, 'pt_mult': 0.5, 'sl_mult': 5.0, 'td_mins': 60}. Best is trial 537 with value: 2.8555764149575955.
[I 2026-03-12 01:48:36,148] Trial 574 finished with value: 2.8555764149575955 and parameters: {'timeframe': 'M5', 'atr_period': 13, 'atr_threshold': 3.0, 'pt_mult': 0.5, 'sl_mult': 5.0, 'td_mins': 60}. Best is trial 537 with value: 2.8555764149575955.
[I 2026-03-12 01:48:36,315] Trial 575 finished with value: 2.8555764149575955 and parameters: {'timeframe': 'M5', 'atr_period': 13, 'atr_threshold': 3.0, 'pt_mult': 0.5, 'sl_mult': 5.0, 'td_mins': 60}. Best is trial 537 with value: 2.8555764149575955.
[I 2026-03-12 01:48:36,486] Trial 576 finished with value: 2.8555764149575955 and parameters: {'timeframe': 'M5', 'atr_period': 13, 'atr_threshold': 3.0, 'pt_mult': 0.5, 'sl_mult': 5.0, 'td_mins': 60}. Best is trial 537 with value: 2.8555764149575955.
[I 2026-03-12 01:48:36,620] Trial 577 pruned. 
[I 2026-03-12 01:48:36,697] Trial 578 pruned. 
[I 2026-03-12 01:48:36,989] Trial 579 pruned. 
[I 2026-03-12 01:48:37,041] Trial 580 finished with value: 0.0 and parameters: {'timeframe': 'M5', 'atr_period': 13, 'atr_threshold': 15.0, 'pt_mult': 0.5, 'sl_mult': 5.0, 'td_mins': 5}. Best is trial 537 with value: 2.8555764149575955.
[I 2026-03-12 01:48:37,213] Trial 581 finished with value: 2.8555764149575955 and parameters: {'timeframe': 'M5', 'atr_period': 13, 'atr_threshold': 3.0, 'pt_mult': 0.5, 'sl_mult': 5.0, 'td_mins': 60}. Best is trial 537 with value: 2.8555764149575955.
[I 2026-03-12 01:48:37,262] Trial 582 finished with value: 0.0 and parameters: {'timeframe': 'M5', 'atr_period': 13, 'atr_threshold': 5.0, 'pt_mult': 0.5, 'sl_mult': 1.0, 'td_mins': 60}. Best is trial 537 with value: 2.8555764149575955.
[I 2026-03-12 01:48:37,446] Trial 583 pruned. 
[I 2026-03-12 01:48:37,536] Trial 584 pruned. 
[I 2026-03-12 01:48:37,751] Trial 585 pruned. 
[I 2026-03-12 01:48:37,811] Trial 586 pruned. 
[I 2026-03-12 01:48:37,985] Trial 587 finished with value: 2.8555764149575955 and parameters: {'timeframe': 'M5', 'atr_period': 13, 'atr_threshold': 3.0, 'pt_mult': 0.5, 'sl_mult': 5.0, 'td_mins': 60}. Best is trial 537 with value: 2.8555764149575955.
[I 2026-03-12 01:48:38,159] Trial 588 finished with value: 2.8555764149575955 and parameters: {'timeframe': 'M5', 'atr_period': 13, 'atr_threshold': 3.0, 'pt_mult': 0.5, 'sl_mult': 5.0, 'td_mins': 60}. Best is trial 537 with value: 2.8555764149575955.
[I 2026-03-12 01:48:38,349] Trial 589 pruned. 
[I 2026-03-12 01:48:38,397] Trial 590 finished with value: 0.0 and parameters: {'timeframe': 'M5', 'atr_period': 13, 'atr_threshold': 8.0, 'pt_mult': 2.5, 'sl_mult': 5.0, 'td_mins': 60}. Best is trial 537 with value: 2.8555764149575955.
[I 2026-03-12 01:48:38,551] Trial 591 pruned. 
[I 2026-03-12 01:48:38,598] Trial 592 finished with value: 0.0 and parameters: {'timeframe': 'M5', 'atr_period': 13, 'atr_threshold': 10.0, 'pt_mult': 0.5, 'sl_mult': 1.0, 'td_mins': 60}. Best is trial 537 with value: 2.8555764149575955.
[I 2026-03-12 01:48:38,653] Trial 593 pruned. 
[I 2026-03-12 01:48:38,950] Trial 594 pruned. 
[I 2026-03-12 01:48:39,147] Trial 595 finished with value: 2.8555764149575955 and parameters: {'timeframe': 'M5', 'atr_period': 13, 'atr_threshold': 3.0, 'pt_mult': 0.5, 'sl_mult': 5.0, 'td_mins': 60}. Best is trial 537 with value: 2.8555764149575955.
[I 2026-03-12 01:48:39,235] Trial 596 pruned. 
[I 2026-03-12 01:48:39,285] Trial 597 finished with value: 0.0 and parameters: {'timeframe': 'M5', 'atr_period': 13, 'atr_threshold': 10.0, 'pt_mult': 2.5, 'sl_mult': 5.0, 'td_mins': 60}. Best is trial 537 with value: 2.8555764149575955.
[I 2026-03-12 01:48:39,341] Trial 598 pruned. 
[I 2026-03-12 01:48:39,949] Trial 599 pruned. 
[I 2026-03-12 01:48:40,156] Trial 600 finished with value: 2.8555764149575955 and parameters: {'timeframe': 'M5', 'atr_period': 13, 'atr_threshold': 3.0, 'pt_mult': 0.5, 'sl_mult': 5.0, 'td_mins': 60}. Best is trial 537 with value: 2.8555764149575955.
[I 2026-03-12 01:48:40,330] Trial 601 finished with value: 2.8555764149575955 and parameters: {'timeframe': 'M5', 'atr_period': 13, 'atr_threshold': 3.0, 'pt_mult': 0.5, 'sl_mult': 5.0, 'td_mins': 60}. Best is trial 537 with value: 2.8555764149575955.
[I 2026-03-12 01:48:40,380] Trial 602 finished with value: 0.0 and parameters: {'timeframe': 'M5', 'atr_period': 13, 'atr_threshold': 8.0, 'pt_mult': 0.5, 'sl_mult': 5.0, 'td_mins': 60}. Best is trial 537 with value: 2.8555764149575955.
[I 2026-03-12 01:48:40,550] Trial 603 finished with value: 2.8555764149575955 and parameters: {'timeframe': 'M5', 'atr_period': 13, 'atr_threshold': 3.0, 'pt_mult': 0.5, 'sl_mult': 5.0, 'td_mins': 60}. Best is trial 537 with value: 2.8555764149575955.
[I 2026-03-12 01:48:40,720] Trial 604 finished with value: 2.8555764149575955 and parameters: {'timeframe': 'M5', 'atr_period': 13, 'atr_threshold': 3.0, 'pt_mult': 0.5, 'sl_mult': 5.0, 'td_mins': 60}. Best is trial 537 with value: 2.8555764149575955.
[I 2026-03-12 01:48:40,937] Trial 605 pruned. 
[I 2026-03-12 01:48:41,103] Trial 606 finished with value: 2.8555764149575955 and parameters: {'timeframe': 'M5', 'atr_period': 13, 'atr_threshold': 3.0, 'pt_mult': 0.5, 'sl_mult': 5.0, 'td_mins': 60}. Best is trial 537 with value: 2.8555764149575955.
[I 2026-03-12 01:48:41,162] Trial 607 pruned. 
[I 2026-03-12 01:48:41,219] Trial 608 pruned. 
[I 2026-03-12 01:48:41,270] Trial 609 finished with value: 0.0 and parameters: {'timeframe': 'M5', 'atr_period': 13, 'atr_threshold': 10.0, 'pt_mult': 0.5, 'sl_mult': 5.0, 'td_mins': 180}. Best is trial 537 with value: 2.8555764149575955.
[I 2026-03-12 01:48:41,440] Trial 610 finished with value: 2.8555764149575955 and parameters: {'timeframe': 'M5', 'atr_period': 13, 'atr_threshold': 3.0, 'pt_mult': 0.5, 'sl_mult': 5.0, 'td_mins': 60}. Best is trial 537 with value: 2.8555764149575955.
[I 2026-03-12 01:48:41,501] Trial 611 pruned. 
[I 2026-03-12 01:48:41,550] Trial 612 finished with value: 0.0 and parameters: {'timeframe': 'M5', 'atr_period': 13, 'atr_threshold': 15.0, 'pt_mult': 0.5, 'sl_mult': 5.0, 'td_mins': 1080}. Best is trial 537 with value: 2.8555764149575955.
[I 2026-03-12 01:48:41,731] Trial 613 finished with value: 2.8555764149575955 and parameters: {'timeframe': 'M5', 'atr_period': 13, 'atr_threshold': 3.0, 'pt_mult': 0.5, 'sl_mult': 5.0, 'td_mins': 60}. Best is trial 537 with value: 2.8555764149575955.
[I 2026-03-12 01:48:41,780] Trial 614 finished with value: 0.0 and parameters: {'timeframe': 'M5', 'atr_period': 13, 'atr_threshold': 10.0, 'pt_mult': 0.5, 'sl_mult': 5.0, 'td_mins': 15}. Best is trial 537 with value: 2.8555764149575955.
[I 2026-03-12 01:48:41,907] Trial 615 pruned. 
[I 2026-03-12 01:48:41,957] Trial 616 finished with value: 0.0 and parameters: {'timeframe': 'M5', 'atr_period': 13, 'atr_threshold': 15.0, 'pt_mult': 0.5, 'sl_mult': 0.5, 'td_mins': 60}. Best is trial 537 with value: 2.8555764149575955.
[I 2026-03-12 01:48:42,129] Trial 617 finished with value: 2.8555764149575955 and parameters: {'timeframe': 'M5', 'atr_period': 13, 'atr_threshold': 3.0, 'pt_mult': 0.5, 'sl_mult': 5.0, 'td_mins': 60}. Best is trial 537 with value: 2.8555764149575955.
[I 2026-03-12 01:48:42,307] Trial 618 finished with value: 2.8555764149575955 and parameters: {'timeframe': 'M5', 'atr_period': 13, 'atr_threshold': 3.0, 'pt_mult': 0.5, 'sl_mult': 5.0, 'td_mins': 60}. Best is trial 537 with value: 2.8555764149575955.
[I 2026-03-12 01:48:42,503] Trial 619 pruned. 
[I 2026-03-12 01:48:42,552] Trial 620 finished with value: 0.0 and parameters: {'timeframe': 'M5', 'atr_period': 13, 'atr_threshold': 15.0, 'pt_mult': 0.5, 'sl_mult': 5.0, 'td_mins': 180}. Best is trial 537 with value: 2.8555764149575955.
[I 2026-03-12 01:48:42,681] Trial 621 pruned. 
[I 2026-03-12 01:48:42,851] Trial 622 finished with value: 2.8555764149575955 and parameters: {'timeframe': 'M5', 'atr_period': 13, 'atr_threshold': 3.0, 'pt_mult': 0.5, 'sl_mult': 5.0, 'td_mins': 60}. Best is trial 537 with value: 2.8555764149575955.
[I 2026-03-12 01:48:43,029] Trial 623 finished with value: 2.8555764149575955 and parameters: {'timeframe': 'M5', 'atr_period': 13, 'atr_threshold': 3.0, 'pt_mult': 0.5, 'sl_mult': 5.0, 'td_mins': 60}. Best is trial 537 with value: 2.8555764149575955.
