[I 2026-03-12 01:09:45,442] Trial 299 pruned. 
[I 2026-03-12 01:09:47,454] Trial 300 finished with value: 1.271278600530214 and parameters: {'timeframe': 'M15', 'atr_period': 13, 'atr_threshold': 2.0, 'pt_mult': 1.0, 'sl_mult': 5.0, 'td_mins': 720}. Best is trial 82 with value: 2.454517025102679.
[I 2026-03-12 01:09:49,464] Trial 301 finished with value: 1.271278600530214 and parameters: {'timeframe': 'M15', 'atr_period': 13, 'atr_threshold': 2.0, 'pt_mult': 1.0, 'sl_mult': 5.0, 'td_mins': 720}. Best is trial 82 with value: 2.454517025102679.
[I 2026-03-12 01:09:51,565] Trial 302 finished with value: 1.271278600530214 and parameters: {'timeframe': 'M15', 'atr_period': 13, 'atr_threshold': 2.0, 'pt_mult': 1.0, 'sl_mult': 5.0, 'td_mins': 720}. Best is trial 82 with value: 2.454517025102679.
[I 2026-03-12 01:09:53,688] Trial 303 finished with value: 1.271278600530214 and parameters: {'timeframe': 'M15', 'atr_period': 13, 'atr_threshold': 2.0, 'pt_mult': 1.0, 'sl_mult': 5.0, 'td_mins': 720}. Best is trial 82 with value: 2.454517025102679.
[I 2026-03-12 01:09:56,004] Trial 304 finished with value: 1.271278600530214 and parameters: {'timeframe': 'M15', 'atr_period': 13, 'atr_threshold': 2.0, 'pt_mult': 1.0, 'sl_mult': 5.0, 'td_mins': 720}. Best is trial 82 with value: 2.454517025102679.
[I 2026-03-12 01:09:58,322] Trial 305 finished with value: 1.271278600530214 and parameters: {'timeframe': 'M15', 'atr_period': 13, 'atr_threshold': 2.0, 'pt_mult': 1.0, 'sl_mult': 5.0, 'td_mins': 720}. Best is trial 82 with value: 2.454517025102679.
[I 2026-03-12 01:10:00,591] Trial 306 finished with value: 1.271278600530214 and parameters: {'timeframe': 'M15', 'atr_period': 13, 'atr_threshold': 2.0, 'pt_mult': 1.0, 'sl_mult': 5.0, 'td_mins': 720}. Best is trial 82 with value: 2.454517025102679.
[I 2026-03-12 01:10:02,909] Trial 307 finished with value: 1.271278600530214 and parameters: {'timeframe': 'M15', 'atr_period': 13, 'atr_threshold': 2.0, 'pt_mult': 1.0, 'sl_mult': 5.0, 'td_mins': 720}. Best is trial 82 with value: 2.454517025102679.
[I 2026-03-12 01:10:05,192] Trial 308 finished with value: 1.271278600530214 and parameters: {'timeframe': 'M15', 'atr_period': 13, 'atr_threshold': 2.0, 'pt_mult': 1.0, 'sl_mult': 5.0, 'td_mins': 720}. Best is trial 82 with value: 2.454517025102679.
[I 2026-03-12 01:10:07,805] Trial 309 finished with value: 1.271278600530214 and parameters: {'timeframe': 'M15', 'atr_period': 13, 'atr_threshold': 2.0, 'pt_mult': 1.0, 'sl_mult': 5.0, 'td_mins': 720}. Best is trial 82 with value: 2.454517025102679.
[I 2026-03-12 01:10:09,805] Trial 310 finished with value: 1.271278600530214 and parameters: {'timeframe': 'M15', 'atr_period': 13, 'atr_threshold': 2.0, 'pt_mult': 1.0, 'sl_mult': 5.0, 'td_mins': 720}. Best is trial 82 with value: 2.454517025102679.
[I 2026-03-12 01:10:11,896] Trial 311 finished with value: 1.271278600530214 and parameters: {'timeframe': 'M15', 'atr_period': 13, 'atr_threshold': 2.0, 'pt_mult': 1.0, 'sl_mult': 5.0, 'td_mins': 720}. Best is trial 82 with value: 2.454517025102679.
[I 2026-03-12 01:10:13,885] Trial 312 finished with value: 1.271278600530214 and parameters: {'timeframe': 'M15', 'atr_period': 13, 'atr_threshold': 2.0, 'pt_mult': 1.0, 'sl_mult': 5.0, 'td_mins': 720}. Best is trial 82 with value: 2.454517025102679.
[I 2026-03-12 01:10:15,899] Trial 313 finished with value: 1.271278600530214 and parameters: {'timeframe': 'M15', 'atr_period': 13, 'atr_threshold': 2.0, 'pt_mult': 1.0, 'sl_mult': 5.0, 'td_mins': 720}. Best is trial 82 with value: 2.454517025102679.
[I 2026-03-12 01:10:16,188] Trial 314 finished with value: 2.1409708515998753 and parameters: {'timeframe': 'M15', 'atr_period': 13, 'atr_threshold': 2.0, 'pt_mult': 0.5, 'sl_mult': 5.0, 'td_mins': 60}. Best is trial 82 with value: 2.454517025102679.
[I 2026-03-12 01:10:16,390] Trial 315 finished with value: 1.6267700121182007 and parameters: {'timeframe': 'M15', 'atr_period': 13, 'atr_threshold': 2.0, 'pt_mult': 0.5, 'sl_mult': 5.0, 'td_mins': 30}. Best is trial 82 with value: 2.454517025102679.
[I 2026-03-12 01:10:16,645] Trial 316 finished with value: 2.1409708515998753 and parameters: {'timeframe': 'M15', 'atr_period': 13, 'atr_threshold': 2.0, 'pt_mult': 0.5, 'sl_mult': 5.0, 'td_mins': 60}. Best is trial 82 with value: 2.454517025102679.
[I 2026-03-12 01:10:16,908] Trial 317 finished with value: 2.1409708515998753 and parameters: {'timeframe': 'M15', 'atr_period': 13, 'atr_threshold': 2.0, 'pt_mult': 0.5, 'sl_mult': 5.0, 'td_mins': 60}. Best is trial 82 with value: 2.454517025102679.
[I 2026-03-12 01:10:17,183] Trial 318 finished with value: 2.1409708515998753 and parameters: {'timeframe': 'M15', 'atr_period': 13, 'atr_threshold': 2.0, 'pt_mult': 0.5, 'sl_mult': 5.0, 'td_mins': 60}. Best is trial 82 with value: 2.454517025102679.
[I 2026-03-12 01:10:17,377] Trial 319 finished with value: 1.6267700121182007 and parameters: {'timeframe': 'M15', 'atr_period': 13, 'atr_threshold': 2.0, 'pt_mult': 0.5, 'sl_mult': 5.0, 'td_mins': 30}. Best is trial 82 with value: 2.454517025102679.
[I 2026-03-12 01:10:17,562] Trial 320 finished with value: 1.6267700121182007 and parameters: {'timeframe': 'M15', 'atr_period': 13, 'atr_threshold': 2.0, 'pt_mult': 0.5, 'sl_mult': 5.0, 'td_mins': 30}. Best is trial 82 with value: 2.454517025102679.
[I 2026-03-12 01:10:17,744] Trial 321 finished with value: 1.6267700121182007 and parameters: {'timeframe': 'M15', 'atr_period': 13, 'atr_threshold': 2.0, 'pt_mult': 0.5, 'sl_mult': 5.0, 'td_mins': 30}. Best is trial 82 with value: 2.454517025102679.
[I 2026-03-12 01:10:17,927] Trial 322 finished with value: 1.6267700121182007 and parameters: {'timeframe': 'M15', 'atr_period': 13, 'atr_threshold': 2.0, 'pt_mult': 0.5, 'sl_mult': 5.0, 'td_mins': 30}. Best is trial 82 with value: 2.454517025102679.
[I 2026-03-12 01:10:18,121] Trial 323 finished with value: 1.6267700121182007 and parameters: {'timeframe': 'M15', 'atr_period': 13, 'atr_threshold': 2.0, 'pt_mult': 0.5, 'sl_mult': 5.0, 'td_mins': 30}. Best is trial 82 with value: 2.454517025102679.
[I 2026-03-12 01:10:18,314] Trial 324 finished with value: 1.6267700121182007 and parameters: {'timeframe': 'M15', 'atr_period': 13, 'atr_threshold': 2.0, 'pt_mult': 0.5, 'sl_mult': 5.0, 'td_mins': 30}. Best is trial 82 with value: 2.454517025102679.
[I 2026-03-12 01:10:18,503] Trial 325 finished with value: 1.6267700121182007 and parameters: {'timeframe': 'M15', 'atr_period': 13, 'atr_threshold': 2.0, 'pt_mult': 0.5, 'sl_mult': 5.0, 'td_mins': 30}. Best is trial 82 with value: 2.454517025102679.
[I 2026-03-12 01:10:18,688] Trial 326 finished with value: 1.6267700121182007 and parameters: {'timeframe': 'M15', 'atr_period': 13, 'atr_threshold': 2.0, 'pt_mult': 0.5, 'sl_mult': 5.0, 'td_mins': 30}. Best is trial 82 with value: 2.454517025102679.
[I 2026-03-12 01:10:18,878] Trial 327 finished with value: 1.6267700121182007 and parameters: {'timeframe': 'M15', 'atr_period': 13, 'atr_threshold': 2.0, 'pt_mult': 0.5, 'sl_mult': 5.0, 'td_mins': 30}. Best is trial 82 with value: 2.454517025102679.
[I 2026-03-12 01:10:19,067] Trial 328 finished with value: 1.6267700121182007 and parameters: {'timeframe': 'M15', 'atr_period': 13, 'atr_threshold': 2.0, 'pt_mult': 0.5, 'sl_mult': 5.0, 'td_mins': 30}. Best is trial 82 with value: 2.454517025102679.
[I 2026-03-12 01:10:19,278] Trial 329 finished with value: 1.6267700121182007 and parameters: {'timeframe': 'M15', 'atr_period': 13, 'atr_threshold': 2.0, 'pt_mult': 0.5, 'sl_mult': 5.0, 'td_mins': 30}. Best is trial 82 with value: 2.454517025102679.
[I 2026-03-12 01:10:19,467] Trial 330 finished with value: 1.6267700121182007 and parameters: {'timeframe': 'M15', 'atr_period': 13, 'atr_threshold': 2.0, 'pt_mult': 0.5, 'sl_mult': 5.0, 'td_mins': 30}. Best is trial 82 with value: 2.454517025102679.
[I 2026-03-12 01:10:19,652] Trial 331 finished with value: 1.6267700121182007 and parameters: {'timeframe': 'M15', 'atr_period': 13, 'atr_threshold': 2.0, 'pt_mult': 0.5, 'sl_mult': 5.0, 'td_mins': 30}. Best is trial 82 with value: 2.454517025102679.
[I 2026-03-12 01:10:19,837] Trial 332 finished with value: 1.6267700121182007 and parameters: {'timeframe': 'M15', 'atr_period': 13, 'atr_threshold': 2.0, 'pt_mult': 0.5, 'sl_mult': 5.0, 'td_mins': 30}. Best is trial 82 with value: 2.454517025102679.
[I 2026-03-12 01:10:20,029] Trial 333 finished with value: 1.6267700121182007 and parameters: {'timeframe': 'M15', 'atr_period': 13, 'atr_threshold': 2.0, 'pt_mult': 0.5, 'sl_mult': 5.0, 'td_mins': 30}. Best is trial 82 with value: 2.454517025102679.
[I 2026-03-12 01:10:20,295] Trial 334 finished with value: 2.1409708515998753 and parameters: {'timeframe': 'M15', 'atr_period': 13, 'atr_threshold': 2.0, 'pt_mult': 0.5, 'sl_mult': 5.0, 'td_mins': 60}. Best is trial 82 with value: 2.454517025102679.
[I 2026-03-12 01:10:20,553] Trial 335 finished with value: 2.1409708515998753 and parameters: {'timeframe': 'M15', 'atr_period': 13, 'atr_threshold': 2.0, 'pt_mult': 0.5, 'sl_mult': 5.0, 'td_mins': 60}. Best is trial 82 with value: 2.454517025102679.
[I 2026-03-12 01:10:20,818] Trial 336 finished with value: 2.1409708515998753 and parameters: {'timeframe': 'M15', 'atr_period': 13, 'atr_threshold': 2.0, 'pt_mult': 0.5, 'sl_mult': 5.0, 'td_mins': 60}. Best is trial 82 with value: 2.454517025102679.
[I 2026-03-12 01:10:21,107] Trial 337 finished with value: 2.1409708515998753 and parameters: {'timeframe': 'M15', 'atr_period': 13, 'atr_threshold': 2.0, 'pt_mult': 0.5, 'sl_mult': 5.0, 'td_mins': 60}. Best is trial 82 with value: 2.454517025102679.
[I 2026-03-12 01:10:21,388] Trial 338 finished with value: 2.1409708515998753 and parameters: {'timeframe': 'M15', 'atr_period': 13, 'atr_threshold': 2.0, 'pt_mult': 0.5, 'sl_mult': 5.0, 'td_mins': 60}. Best is trial 82 with value: 2.454517025102679.
[I 2026-03-12 01:10:21,640] Trial 339 finished with value: 2.1409708515998753 and parameters: {'timeframe': 'M15', 'atr_period': 13, 'atr_threshold': 2.0, 'pt_mult': 0.5, 'sl_mult': 5.0, 'td_mins': 60}. Best is trial 82 with value: 2.454517025102679.
[I 2026-03-12 01:10:21,906] Trial 340 finished with value: 2.1409708515998753 and parameters: {'timeframe': 'M15', 'atr_period': 13, 'atr_threshold': 2.0, 'pt_mult': 0.5, 'sl_mult': 5.0, 'td_mins': 60}. Best is trial 82 with value: 2.454517025102679.
[I 2026-03-12 01:10:22,175] Trial 341 finished with value: 2.1409708515998753 and parameters: {'timeframe': 'M15', 'atr_period': 13, 'atr_threshold': 2.0, 'pt_mult': 0.5, 'sl_mult': 5.0, 'td_mins': 60}. Best is trial 82 with value: 2.454517025102679.
[I 2026-03-12 01:10:22,353] Trial 342 finished with value: 2.3996200894903077 and parameters: {'timeframe': 'M15', 'atr_period': 13, 'atr_threshold': 3.0, 'pt_mult': 0.5, 'sl_mult': 5.0, 'td_mins': 60}. Best is trial 82 with value: 2.454517025102679.
[I 2026-03-12 01:10:22,534] Trial 343 finished with value: 2.3996200894903077 and parameters: {'timeframe': 'M15', 'atr_period': 13, 'atr_threshold': 3.0, 'pt_mult': 0.5, 'sl_mult': 5.0, 'td_mins': 60}. Best is trial 82 with value: 2.454517025102679.
[I 2026-03-12 01:10:22,715] Trial 344 finished with value: 2.3996200894903077 and parameters: {'timeframe': 'M15', 'atr_period': 13, 'atr_threshold': 3.0, 'pt_mult': 0.5, 'sl_mult': 5.0, 'td_mins': 60}. Best is trial 82 with value: 2.454517025102679.
[I 2026-03-12 01:10:22,898] Trial 345 finished with value: 2.3996200894903077 and parameters: {'timeframe': 'M15', 'atr_period': 13, 'atr_threshold': 3.0, 'pt_mult': 0.5, 'sl_mult': 5.0, 'td_mins': 60}. Best is trial 82 with value: 2.454517025102679.
[I 2026-03-12 01:10:23,084] Trial 346 finished with value: 2.3996200894903077 and parameters: {'timeframe': 'M15', 'atr_period': 13, 'atr_threshold': 3.0, 'pt_mult': 0.5, 'sl_mult': 5.0, 'td_mins': 60}. Best is trial 82 with value: 2.454517025102679.
[I 2026-03-12 01:10:23,279] Trial 347 finished with value: 2.3996200894903077 and parameters: {'timeframe': 'M15', 'atr_period': 13, 'atr_threshold': 3.0, 'pt_mult': 0.5, 'sl_mult': 5.0, 'td_mins': 60}. Best is trial 82 with value: 2.454517025102679.
[I 2026-03-12 01:10:23,456] Trial 348 finished with value: 2.3996200894903077 and parameters: {'timeframe': 'M15', 'atr_period': 13, 'atr_threshold': 3.0, 'pt_mult': 0.5, 'sl_mult': 5.0, 'td_mins': 60}. Best is trial 82 with value: 2.454517025102679.
[I 2026-03-12 01:10:23,642] Trial 349 finished with value: 2.3996200894903077 and parameters: {'timeframe': 'M15', 'atr_period': 13, 'atr_threshold': 3.0, 'pt_mult': 0.5, 'sl_mult': 5.0, 'td_mins': 60}. Best is trial 82 with value: 2.454517025102679.
[I 2026-03-12 01:10:23,823] Trial 350 finished with value: 2.3996200894903077 and parameters: {'timeframe': 'M15', 'atr_period': 13, 'atr_threshold': 3.0, 'pt_mult': 0.5, 'sl_mult': 5.0, 'td_mins': 60}. Best is trial 82 with value: 2.454517025102679.
[I 2026-03-12 01:10:24,007] Trial 351 finished with value: 2.3996200894903077 and parameters: {'timeframe': 'M15', 'atr_period': 13, 'atr_threshold': 3.0, 'pt_mult': 0.5, 'sl_mult': 5.0, 'td_mins': 60}. Best is trial 82 with value: 2.454517025102679.
[I 2026-03-12 01:10:24,252] Trial 352 finished with value: 2.3996200894903077 and parameters: {'timeframe': 'M15', 'atr_period': 13, 'atr_threshold': 3.0, 'pt_mult': 0.5, 'sl_mult': 5.0, 'td_mins': 60}. Best is trial 82 with value: 2.454517025102679.
[I 2026-03-12 01:10:24,430] Trial 353 finished with value: 2.3996200894903077 and parameters: {'timeframe': 'M15', 'atr_period': 13, 'atr_threshold': 3.0, 'pt_mult': 0.5, 'sl_mult': 5.0, 'td_mins': 60}. Best is trial 82 with value: 2.454517025102679.
[I 2026-03-12 01:10:24,672] Trial 354 finished with value: 2.3996200894903077 and parameters: {'timeframe': 'M15', 'atr_period': 13, 'atr_threshold': 3.0, 'pt_mult': 0.5, 'sl_mult': 5.0, 'td_mins': 60}. Best is trial 82 with value: 2.454517025102679.
[I 2026-03-12 01:10:24,864] Trial 355 finished with value: 2.3996200894903077 and parameters: {'timeframe': 'M15', 'atr_period': 13, 'atr_threshold': 3.0, 'pt_mult': 0.5, 'sl_mult': 5.0, 'td_mins': 60}. Best is trial 82 with value: 2.454517025102679.
[I 2026-03-12 01:10:25,048] Trial 356 finished with value: 2.3996200894903077 and parameters: {'timeframe': 'M15', 'atr_period': 13, 'atr_threshold': 3.0, 'pt_mult': 0.5, 'sl_mult': 5.0, 'td_mins': 60}. Best is trial 82 with value: 2.454517025102679.
[I 2026-03-12 01:10:25,238] Trial 357 finished with value: 2.3996200894903077 and parameters: {'timeframe': 'M15', 'atr_period': 13, 'atr_threshold': 3.0, 'pt_mult': 0.5, 'sl_mult': 5.0, 'td_mins': 60}. Best is trial 82 with value: 2.454517025102679.
[I 2026-03-12 01:10:25,439] Trial 358 finished with value: 2.3996200894903077 and parameters: {'timeframe': 'M15', 'atr_period': 13, 'atr_threshold': 3.0, 'pt_mult': 0.5, 'sl_mult': 5.0, 'td_mins': 60}. Best is trial 82 with value: 2.454517025102679.
[I 2026-03-12 01:10:25,620] Trial 359 finished with value: 2.3996200894903077 and parameters: {'timeframe': 'M15', 'atr_period': 13, 'atr_threshold': 3.0, 'pt_mult': 0.5, 'sl_mult': 5.0, 'td_mins': 60}. Best is trial 82 with value: 2.454517025102679.
[I 2026-03-12 01:10:25,805] Trial 360 finished with value: 2.3996200894903077 and parameters: {'timeframe': 'M15', 'atr_period': 13, 'atr_threshold': 3.0, 'pt_mult': 0.5, 'sl_mult': 5.0, 'td_mins': 60}. Best is trial 82 with value: 2.454517025102679.
[I 2026-03-12 01:10:26,015] Trial 361 finished with value: 2.3996200894903077 and parameters: {'timeframe': 'M15', 'atr_period': 13, 'atr_threshold': 3.0, 'pt_mult': 0.5, 'sl_mult': 5.0, 'td_mins': 60}. Best is trial 82 with value: 2.454517025102679.
[I 2026-03-12 01:10:26,215] Trial 362 finished with value: 2.3996200894903077 and parameters: {'timeframe': 'M15', 'atr_period': 13, 'atr_threshold': 3.0, 'pt_mult': 0.5, 'sl_mult': 5.0, 'td_mins': 60}. Best is trial 82 with value: 2.454517025102679.
[I 2026-03-12 01:10:26,407] Trial 363 finished with value: 2.3996200894903077 and parameters: {'timeframe': 'M15', 'atr_period': 13, 'atr_threshold': 3.0, 'pt_mult': 0.5, 'sl_mult': 5.0, 'td_mins': 60}. Best is trial 82 with value: 2.454517025102679.
[I 2026-03-12 01:10:26,586] Trial 364 finished with value: 2.3996200894903077 and parameters: {'timeframe': 'M15', 'atr_period': 13, 'atr_threshold': 3.0, 'pt_mult': 0.5, 'sl_mult': 5.0, 'td_mins': 60}. Best is trial 82 with value: 2.454517025102679.
[I 2026-03-12 01:10:26,765] Trial 365 finished with value: 2.3996200894903077 and parameters: {'timeframe': 'M15', 'atr_period': 13, 'atr_threshold': 3.0, 'pt_mult': 0.5, 'sl_mult': 5.0, 'td_mins': 60}. Best is trial 82 with value: 2.454517025102679.
[I 2026-03-12 01:10:27,380] Trial 366 finished with value: 1.7654101140021843 and parameters: {'timeframe': 'M15', 'atr_period': 13, 'atr_threshold': 3.0, 'pt_mult': 0.5, 'sl_mult': 5.0, 'td_mins': 360}. Best is trial 82 with value: 2.454517025102679.
[I 2026-03-12 01:10:27,657] Trial 367 finished with value: 2.454517025102679 and parameters: {'timeframe': 'M15', 'atr_period': 13, 'atr_threshold': 3.0, 'pt_mult': 0.5, 'sl_mult': 5.0, 'td_mins': 120}. Best is trial 82 with value: 2.454517025102679.
[I 2026-03-12 01:10:27,929] Trial 368 finished with value: 2.454517025102679 and parameters: {'timeframe': 'M15', 'atr_period': 13, 'atr_threshold': 3.0, 'pt_mult': 0.5, 'sl_mult': 5.0, 'td_mins': 120}. Best is trial 82 with value: 2.454517025102679.
[I 2026-03-12 01:10:28,211] Trial 369 finished with value: 2.454517025102679 and parameters: {'timeframe': 'M15', 'atr_period': 13, 'atr_threshold': 3.0, 'pt_mult': 0.5, 'sl_mult': 5.0, 'td_mins': 120}. Best is trial 82 with value: 2.454517025102679.
[I 2026-03-12 01:10:28,504] Trial 370 finished with value: 2.454517025102679 and parameters: {'timeframe': 'M15', 'atr_period': 13, 'atr_threshold': 3.0, 'pt_mult': 0.5, 'sl_mult': 5.0, 'td_mins': 120}. Best is trial 82 with value: 2.454517025102679.
[I 2026-03-12 01:10:28,790] Trial 371 finished with value: 2.454517025102679 and parameters: {'timeframe': 'M15', 'atr_period': 13, 'atr_threshold': 3.0, 'pt_mult': 0.5, 'sl_mult': 5.0, 'td_mins': 120}. Best is trial 82 with value: 2.454517025102679.
[I 2026-03-12 01:10:29,071] Trial 372 finished with value: 2.454517025102679 and parameters: {'timeframe': 'M15', 'atr_period': 13, 'atr_threshold': 3.0, 'pt_mult': 0.5, 'sl_mult': 5.0, 'td_mins': 120}. Best is trial 82 with value: 2.454517025102679.
[I 2026-03-12 01:10:29,351] Trial 373 finished with value: 2.454517025102679 and parameters: {'timeframe': 'M15', 'atr_period': 13, 'atr_threshold': 3.0, 'pt_mult': 0.5, 'sl_mult': 5.0, 'td_mins': 120}. Best is trial 82 with value: 2.454517025102679.
[I 2026-03-12 01:10:29,630] Trial 374 finished with value: 2.454517025102679 and parameters: {'timeframe': 'M15', 'atr_period': 13, 'atr_threshold': 3.0, 'pt_mult': 0.5, 'sl_mult': 5.0, 'td_mins': 120}. Best is trial 82 with value: 2.454517025102679.
[I 2026-03-12 01:10:29,916] Trial 375 finished with value: 2.454517025102679 and parameters: {'timeframe': 'M15', 'atr_period': 13, 'atr_threshold': 3.0, 'pt_mult': 0.5, 'sl_mult': 5.0, 'td_mins': 120}. Best is trial 82 with value: 2.454517025102679.
[I 2026-03-12 01:10:30,202] Trial 376 finished with value: 2.454517025102679 and parameters: {'timeframe': 'M15', 'atr_period': 13, 'atr_threshold': 3.0, 'pt_mult': 0.5, 'sl_mult': 5.0, 'td_mins': 120}. Best is trial 82 with value: 2.454517025102679.
[I 2026-03-12 01:10:30,480] Trial 377 finished with value: 2.454517025102679 and parameters: {'timeframe': 'M15', 'atr_period': 13, 'atr_threshold': 3.0, 'pt_mult': 0.5, 'sl_mult': 5.0, 'td_mins': 120}. Best is trial 82 with value: 2.454517025102679.
[I 2026-03-12 01:10:30,765] Trial 378 finished with value: 2.454517025102679 and parameters: {'timeframe': 'M15', 'atr_period': 13, 'atr_threshold': 3.0, 'pt_mult': 0.5, 'sl_mult': 5.0, 'td_mins': 120}. Best is trial 82 with value: 2.454517025102679.
[I 2026-03-12 01:10:31,079] Trial 379 finished with value: 2.454517025102679 and parameters: {'timeframe': 'M15', 'atr_period': 13, 'atr_threshold': 3.0, 'pt_mult': 0.5, 'sl_mult': 5.0, 'td_mins': 120}. Best is trial 82 with value: 2.454517025102679.
[I 2026-03-12 01:10:31,381] Trial 380 finished with value: 2.454517025102679 and parameters: {'timeframe': 'M15', 'atr_period': 13, 'atr_threshold': 3.0, 'pt_mult': 0.5, 'sl_mult': 5.0, 'td_mins': 120}. Best is trial 82 with value: 2.454517025102679.
[I 2026-03-12 01:10:31,672] Trial 381 finished with value: 2.454517025102679 and parameters: {'timeframe': 'M15', 'atr_period': 13, 'atr_threshold': 3.0, 'pt_mult': 0.5, 'sl_mult': 5.0, 'td_mins': 120}. Best is trial 82 with value: 2.454517025102679.
[I 2026-03-12 01:10:31,953] Trial 382 finished with value: 2.454517025102679 and parameters: {'timeframe': 'M15', 'atr_period': 13, 'atr_threshold': 3.0, 'pt_mult': 0.5, 'sl_mult': 5.0, 'td_mins': 120}. Best is trial 82 with value: 2.454517025102679.
[I 2026-03-12 01:10:32,236] Trial 383 finished with value: 2.454517025102679 and parameters: {'timeframe': 'M15', 'atr_period': 13, 'atr_threshold': 3.0, 'pt_mult': 0.5, 'sl_mult': 5.0, 'td_mins': 120}. Best is trial 82 with value: 2.454517025102679.
[I 2026-03-12 01:10:32,512] Trial 384 finished with value: 2.454517025102679 and parameters: {'timeframe': 'M15', 'atr_period': 13, 'atr_threshold': 3.0, 'pt_mult': 0.5, 'sl_mult': 5.0, 'td_mins': 120}. Best is trial 82 with value: 2.454517025102679.
[I 2026-03-12 01:10:32,787] Trial 385 finished with value: 2.454517025102679 and parameters: {'timeframe': 'M15', 'atr_period': 13, 'atr_threshold': 3.0, 'pt_mult': 0.5, 'sl_mult': 5.0, 'td_mins': 120}. Best is trial 82 with value: 2.454517025102679.
[I 2026-03-12 01:10:33,061] Trial 386 finished with value: 2.454517025102679 and parameters: {'timeframe': 'M15', 'atr_period': 13, 'atr_threshold': 3.0, 'pt_mult': 0.5, 'sl_mult': 5.0, 'td_mins': 120}. Best is trial 82 with value: 2.454517025102679.
