[I 2026-03-12 01:48:43,202] Trial 624 finished with value: 2.8555764149575955 and parameters: {'timeframe': 'M5', 'atr_period': 13, 'atr_threshold': 3.0, 'pt_mult': 0.5, 'sl_mult': 5.0, 'td_mins': 60}. Best is trial 537 with value: 2.8555764149575955.
[I 2026-03-12 01:48:43,270] Trial 625 pruned. 
[I 2026-03-12 01:48:43,446] Trial 626 finished with value: 2.8555764149575955 and parameters: {'timeframe': 'M5', 'atr_period': 13, 'atr_threshold': 3.0, 'pt_mult': 0.5, 'sl_mult': 5.0, 'td_mins': 60}. Best is trial 537 with value: 2.8555764149575955.
[I 2026-03-12 01:48:43,619] Trial 627 finished with value: 2.8555764149575955 and parameters: {'timeframe': 'M5', 'atr_period': 13, 'atr_threshold': 3.0, 'pt_mult': 0.5, 'sl_mult': 5.0, 'td_mins': 60}. Best is trial 537 with value: 2.8555764149575955.
[I 2026-03-12 01:48:43,787] Trial 628 finished with value: 2.8555764149575955 and parameters: {'timeframe': 'M5', 'atr_period': 13, 'atr_threshold': 3.0, 'pt_mult': 0.5, 'sl_mult': 5.0, 'td_mins': 60}. Best is trial 537 with value: 2.8555764149575955.
[I 2026-03-12 01:48:43,839] Trial 629 finished with value: 0.0 and parameters: {'timeframe': 'M5', 'atr_period': 13, 'atr_threshold': 5.0, 'pt_mult': 0.5, 'sl_mult': 0.5, 'td_mins': 60}. Best is trial 537 with value: 2.8555764149575955.
[I 2026-03-12 01:48:43,906] Trial 630 pruned. 
[I 2026-03-12 01:48:43,960] Trial 631 pruned. 
[I 2026-03-12 01:48:44,009] Trial 632 finished with value: 0.0 and parameters: {'timeframe': 'M5', 'atr_period': 13, 'atr_threshold': 15.0, 'pt_mult': 0.5, 'sl_mult': 1.0, 'td_mins': 60}. Best is trial 537 with value: 2.8555764149575955.
[I 2026-03-12 01:48:44,072] Trial 633 pruned. 
[I 2026-03-12 01:48:44,245] Trial 634 finished with value: 2.8555764149575955 and parameters: {'timeframe': 'M5', 'atr_period': 13, 'atr_threshold': 3.0, 'pt_mult': 0.5, 'sl_mult': 5.0, 'td_mins': 60}. Best is trial 537 with value: 2.8555764149575955.
[I 2026-03-12 01:48:44,362] Trial 635 pruned. 
[I 2026-03-12 01:48:44,414] Trial 636 pruned. 
[I 2026-03-12 01:48:44,464] Trial 637 finished with value: 0.0 and parameters: {'timeframe': 'M5', 'atr_period': 13, 'atr_threshold': 8.0, 'pt_mult': 0.5, 'sl_mult': 2.5, 'td_mins': 60}. Best is trial 537 with value: 2.8555764149575955.
[I 2026-03-12 01:48:44,516] Trial 638 finished with value: 0.0 and parameters: {'timeframe': 'M5', 'atr_period': 13, 'atr_threshold': 5.0, 'pt_mult': 0.5, 'sl_mult': 5.0, 'td_mins': 1200}. Best is trial 537 with value: 2.8555764149575955.
[I 2026-03-12 01:48:44,589] Trial 639 pruned. 
[I 2026-03-12 01:48:44,649] Trial 640 pruned. 
[I 2026-03-12 01:48:44,702] Trial 641 finished with value: 0.0 and parameters: {'timeframe': 'M5', 'atr_period': 13, 'atr_threshold': 8.0, 'pt_mult': 5.0, 'sl_mult': 5.0, 'td_mins': 60}. Best is trial 537 with value: 2.8555764149575955.
[I 2026-03-12 01:48:44,756] Trial 642 finished with value: 0.0 and parameters: {'timeframe': 'M5', 'atr_period': 13, 'atr_threshold': 10.0, 'pt_mult': 0.5, 'sl_mult': 2.5, 'td_mins': 60}. Best is trial 537 with value: 2.8555764149575955.
[I 2026-03-12 01:48:44,942] Trial 643 finished with value: 2.8555764149575955 and parameters: {'timeframe': 'M5', 'atr_period': 13, 'atr_threshold': 3.0, 'pt_mult': 0.5, 'sl_mult': 5.0, 'td_mins': 60}. Best is trial 537 with value: 2.8555764149575955.
[I 2026-03-12 01:48:44,993] Trial 644 finished with value: 0.0 and parameters: {'timeframe': 'M5', 'atr_period': 13, 'atr_threshold': 8.0, 'pt_mult': 0.5, 'sl_mult': 5.0, 'td_mins': 15}. Best is trial 537 with value: 2.8555764149575955.
[I 2026-03-12 01:48:46,230] Trial 645 pruned. 
[I 2026-03-12 01:48:46,284] Trial 646 finished with value: 0.0 and parameters: {'timeframe': 'M5', 'atr_period': 13, 'atr_threshold': 10.0, 'pt_mult': 0.5, 'sl_mult': 5.0, 'td_mins': 60}. Best is trial 537 with value: 2.8555764149575955.
[I 2026-03-12 01:48:46,375] Trial 647 pruned. 
[I 2026-03-12 01:48:46,429] Trial 648 pruned. 
[I 2026-03-12 01:48:46,698] Trial 649 pruned. 
[I 2026-03-12 01:48:46,748] Trial 650 finished with value: 0.0 and parameters: {'timeframe': 'M5', 'atr_period': 13, 'atr_threshold': 15.0, 'pt_mult': 2.5, 'sl_mult': 5.0, 'td_mins': 60}. Best is trial 537 with value: 2.8555764149575955.
[I 2026-03-12 01:48:47,158] Trial 651 pruned. 
[I 2026-03-12 01:48:47,239] Trial 652 pruned. 
[I 2026-03-12 01:48:47,371] Trial 653 pruned. 
[I 2026-03-12 01:48:47,428] Trial 654 pruned. 
[I 2026-03-12 01:48:47,482] Trial 655 pruned. 
[I 2026-03-12 01:48:47,533] Trial 656 finished with value: 0.0 and parameters: {'timeframe': 'M5', 'atr_period': 13, 'atr_threshold': 8.0, 'pt_mult': 0.5, 'sl_mult': 5.0, 'td_mins': 1080}. Best is trial 537 with value: 2.8555764149575955.
[I 2026-03-12 01:48:49,473] Trial 657 pruned. 
[I 2026-03-12 01:48:49,680] Trial 658 pruned. 
[I 2026-03-12 01:48:49,792] Trial 659 pruned. 
[I 2026-03-12 01:48:49,915] Trial 660 pruned. 
[I 2026-03-12 01:48:51,306] Trial 661 pruned. 
[I 2026-03-12 01:48:51,382] Trial 662 pruned. 
[I 2026-03-12 01:48:51,545] Trial 663 pruned. 
[I 2026-03-12 01:48:51,607] Trial 664 pruned. 
[I 2026-03-12 01:48:51,658] Trial 665 finished with value: 0.0 and parameters: {'timeframe': 'M5', 'atr_period': 13, 'atr_threshold': 15.0, 'pt_mult': 0.5, 'sl_mult': 5.0, 'td_mins': 1200}. Best is trial 537 with value: 2.8555764149575955.
[I 2026-03-12 01:48:51,721] Trial 666 pruned. 
[I 2026-03-12 01:48:51,779] Trial 667 pruned. 
[I 2026-03-12 01:48:51,848] Trial 668 pruned. 
[I 2026-03-12 01:48:52,000] Trial 669 pruned. 
[I 2026-03-12 01:48:52,050] Trial 670 finished with value: 0.0 and parameters: {'timeframe': 'M5', 'atr_period': 13, 'atr_threshold': 5.0, 'pt_mult': 0.5, 'sl_mult': 5.0, 'td_mins': 60}. Best is trial 537 with value: 2.8555764149575955.
[I 2026-03-12 01:48:52,098] Trial 671 finished with value: 0.0 and parameters: {'timeframe': 'M5', 'atr_period': 13, 'atr_threshold': 8.0, 'pt_mult': 0.5, 'sl_mult': 5.0, 'td_mins': 5}. Best is trial 537 with value: 2.8555764149575955.
[I 2026-03-12 01:48:52,465] Trial 672 pruned. 
[I 2026-03-12 01:48:52,518] Trial 673 finished with value: 0.0 and parameters: {'timeframe': 'M5', 'atr_period': 13, 'atr_threshold': 15.0, 'pt_mult': 0.5, 'sl_mult': 5.0, 'td_mins': 60}. Best is trial 537 with value: 2.8555764149575955.
[I 2026-03-12 01:48:52,829] Trial 674 finished with value: 2.406101417633213 and parameters: {'timeframe': 'M5', 'atr_period': 13, 'atr_threshold': 2.0, 'pt_mult': 0.5, 'sl_mult': 5.0, 'td_mins': 60}. Best is trial 537 with value: 2.8555764149575955.
[I 2026-03-12 01:48:52,878] Trial 675 finished with value: 0.0 and parameters: {'timeframe': 'M5', 'atr_period': 13, 'atr_threshold': 15.0, 'pt_mult': 0.5, 'sl_mult': 5.0, 'td_mins': 720}. Best is trial 537 with value: 2.8555764149575955.
[I 2026-03-12 01:48:52,928] Trial 676 finished with value: 0.0 and parameters: {'timeframe': 'M5', 'atr_period': 13, 'atr_threshold': 5.0, 'pt_mult': 2.5, 'sl_mult': 5.0, 'td_mins': 60}. Best is trial 537 with value: 2.8555764149575955.
[I 2026-03-12 01:48:53,018] Trial 677 pruned. 
[I 2026-03-12 01:48:53,196] Trial 678 finished with value: 2.8555764149575955 and parameters: {'timeframe': 'M5', 'atr_period': 13, 'atr_threshold': 3.0, 'pt_mult': 0.5, 'sl_mult': 5.0, 'td_mins': 60}. Best is trial 537 with value: 2.8555764149575955.
[I 2026-03-12 01:48:53,367] Trial 679 finished with value: 2.8555764149575955 and parameters: {'timeframe': 'M5', 'atr_period': 13, 'atr_threshold': 3.0, 'pt_mult': 0.5, 'sl_mult': 5.0, 'td_mins': 60}. Best is trial 537 with value: 2.8555764149575955.
[I 2026-03-12 01:48:53,420] Trial 680 pruned. 
[I 2026-03-12 01:48:53,477] Trial 681 pruned. 
[I 2026-03-12 01:48:53,583] Trial 682 pruned. 
[I 2026-03-12 01:48:53,768] Trial 683 finished with value: 2.8555764149575955 and parameters: {'timeframe': 'M5', 'atr_period': 13, 'atr_threshold': 3.0, 'pt_mult': 0.5, 'sl_mult': 5.0, 'td_mins': 60}. Best is trial 537 with value: 2.8555764149575955.
[I 2026-03-12 01:48:53,823] Trial 684 finished with value: 0.0 and parameters: {'timeframe': 'M5', 'atr_period': 13, 'atr_threshold': 10.0, 'pt_mult': 0.5, 'sl_mult': 5.0, 'td_mins': 1080}. Best is trial 537 with value: 2.8555764149575955.
[I 2026-03-12 01:48:53,972] Trial 685 pruned. 
[I 2026-03-12 01:48:54,029] Trial 686 finished with value: 0.0 and parameters: {'timeframe': 'M5', 'atr_period': 13, 'atr_threshold': 5.0, 'pt_mult': 0.5, 'sl_mult': 5.0, 'td_mins': 360}. Best is trial 537 with value: 2.8555764149575955.
[I 2026-03-12 01:48:54,305] Trial 687 pruned. 
[I 2026-03-12 01:48:54,506] Trial 688 finished with value: 2.8555764149575955 and parameters: {'timeframe': 'M5', 'atr_period': 13, 'atr_threshold': 3.0, 'pt_mult': 0.5, 'sl_mult': 5.0, 'td_mins': 60}. Best is trial 537 with value: 2.8555764149575955.
[I 2026-03-12 01:48:54,705] Trial 689 pruned. 
[I 2026-03-12 01:48:54,765] Trial 690 finished with value: 0.0 and parameters: {'timeframe': 'M5', 'atr_period': 13, 'atr_threshold': 15.0, 'pt_mult': 0.5, 'sl_mult': 5.0, 'td_mins': 15}. Best is trial 537 with value: 2.8555764149575955.
[I 2026-03-12 01:48:54,857] Trial 691 pruned. 
[I 2026-03-12 01:48:55,908] Trial 692 pruned. 
[I 2026-03-12 01:48:56,029] Trial 693 pruned. 
[I 2026-03-12 01:48:56,233] Trial 694 finished with value: 2.8555764149575955 and parameters: {'timeframe': 'M5', 'atr_period': 13, 'atr_threshold': 3.0, 'pt_mult': 0.5, 'sl_mult': 5.0, 'td_mins': 60}. Best is trial 537 with value: 2.8555764149575955.
[I 2026-03-12 01:48:56,441] Trial 695 finished with value: 2.8555764149575955 and parameters: {'timeframe': 'M5', 'atr_period': 13, 'atr_threshold': 3.0, 'pt_mult': 0.5, 'sl_mult': 5.0, 'td_mins': 60}. Best is trial 537 with value: 2.8555764149575955.
[I 2026-03-12 01:48:57,275] Trial 696 pruned. 
[I 2026-03-12 01:48:57,457] Trial 697 finished with value: 2.8555764149575955 and parameters: {'timeframe': 'M5', 'atr_period': 13, 'atr_threshold': 3.0, 'pt_mult': 0.5, 'sl_mult': 5.0, 'td_mins': 60}. Best is trial 537 with value: 2.8555764149575955.
[I 2026-03-12 01:48:57,506] Trial 698 finished with value: 0.0 and parameters: {'timeframe': 'M5', 'atr_period': 13, 'atr_threshold': 10.0, 'pt_mult': 1.0, 'sl_mult': 1.0, 'td_mins': 360}. Best is trial 537 with value: 2.8555764149575955.
[I 2026-03-12 01:48:57,615] Trial 699 pruned. 
[I 2026-03-12 01:48:57,824] Trial 700 finished with value: 2.8555764149575955 and parameters: {'timeframe': 'M5', 'atr_period': 13, 'atr_threshold': 3.0, 'pt_mult': 0.5, 'sl_mult': 5.0, 'td_mins': 60}. Best is trial 537 with value: 2.8555764149575955.
[I 2026-03-12 01:48:58,077] Trial 701 pruned. 
[I 2026-03-12 01:48:58,264] Trial 702 finished with value: 2.8555764149575955 and parameters: {'timeframe': 'M5', 'atr_period': 13, 'atr_threshold': 3.0, 'pt_mult': 0.5, 'sl_mult': 5.0, 'td_mins': 60}. Best is trial 537 with value: 2.8555764149575955.
[I 2026-03-12 01:48:58,312] Trial 703 finished with value: 0.0 and parameters: {'timeframe': 'M5', 'atr_period': 13, 'atr_threshold': 5.0, 'pt_mult': 1.0, 'sl_mult': 1.0, 'td_mins': 30}. Best is trial 537 with value: 2.8555764149575955.
[I 2026-03-12 01:48:58,362] Trial 704 finished with value: 0.0 and parameters: {'timeframe': 'M5', 'atr_period': 13, 'atr_threshold': 10.0, 'pt_mult': 0.5, 'sl_mult': 5.0, 'td_mins': 360}. Best is trial 537 with value: 2.8555764149575955.
[I 2026-03-12 01:48:58,535] Trial 705 finished with value: 2.8555764149575955 and parameters: {'timeframe': 'M5', 'atr_period': 13, 'atr_threshold': 3.0, 'pt_mult': 0.5, 'sl_mult': 5.0, 'td_mins': 60}. Best is trial 537 with value: 2.8555764149575955.
[I 2026-03-12 01:48:58,713] Trial 706 finished with value: 2.8555764149575955 and parameters: {'timeframe': 'M5', 'atr_period': 13, 'atr_threshold': 3.0, 'pt_mult': 0.5, 'sl_mult': 5.0, 'td_mins': 60}. Best is trial 537 with value: 2.8555764149575955.
[I 2026-03-12 01:48:58,769] Trial 707 finished with value: 0.0 and parameters: {'timeframe': 'M5', 'atr_period': 13, 'atr_threshold': 10.0, 'pt_mult': 0.5, 'sl_mult': 0.5, 'td_mins': 60}. Best is trial 537 with value: 2.8555764149575955.
[I 2026-03-12 01:48:58,943] Trial 708 finished with value: 2.8555764149575955 and parameters: {'timeframe': 'M5', 'atr_period': 13, 'atr_threshold': 3.0, 'pt_mult': 0.5, 'sl_mult': 5.0, 'td_mins': 60}. Best is trial 537 with value: 2.8555764149575955.
[I 2026-03-12 01:48:58,993] Trial 709 finished with value: 0.0 and parameters: {'timeframe': 'M5', 'atr_period': 13, 'atr_threshold': 15.0, 'pt_mult': 2.5, 'sl_mult': 2.5, 'td_mins': 360}. Best is trial 537 with value: 2.8555764149575955.
[I 2026-03-12 01:48:59,169] Trial 710 finished with value: 2.8555764149575955 and parameters: {'timeframe': 'M5', 'atr_period': 13, 'atr_threshold': 3.0, 'pt_mult': 0.5, 'sl_mult': 5.0, 'td_mins': 60}. Best is trial 537 with value: 2.8555764149575955.
[I 2026-03-12 01:48:59,218] Trial 711 finished with value: 0.0 and parameters: {'timeframe': 'M5', 'atr_period': 13, 'atr_threshold': 8.0, 'pt_mult': 0.5, 'sl_mult': 1.0, 'td_mins': 60}. Best is trial 537 with value: 2.8555764149575955.
[I 2026-03-12 01:48:59,338] Trial 712 pruned. 
[I 2026-03-12 01:48:59,421] Trial 713 pruned. 
[I 2026-03-12 01:48:59,863] Trial 714 pruned. 
[I 2026-03-12 01:49:00,066] Trial 715 finished with value: 2.8555764149575955 and parameters: {'timeframe': 'M5', 'atr_period': 13, 'atr_threshold': 3.0, 'pt_mult': 0.5, 'sl_mult': 5.0, 'td_mins': 60}. Best is trial 537 with value: 2.8555764149575955.
[I 2026-03-12 01:49:00,120] Trial 716 finished with value: 0.0 and parameters: {'timeframe': 'M5', 'atr_period': 13, 'atr_threshold': 10.0, 'pt_mult': 5.0, 'sl_mult': 5.0, 'td_mins': 60}. Best is trial 537 with value: 2.8555764149575955.
[I 2026-03-12 01:49:00,173] Trial 717 finished with value: 0.0 and parameters: {'timeframe': 'M5', 'atr_period': 13, 'atr_threshold': 8.0, 'pt_mult': 0.5, 'sl_mult': 5.0, 'td_mins': 60}. Best is trial 537 with value: 2.8555764149575955.
[I 2026-03-12 01:49:00,344] Trial 718 finished with value: 2.8555764149575955 and parameters: {'timeframe': 'M5', 'atr_period': 13, 'atr_threshold': 3.0, 'pt_mult': 0.5, 'sl_mult': 5.0, 'td_mins': 60}. Best is trial 537 with value: 2.8555764149575955.
[I 2026-03-12 01:49:00,520] Trial 719 finished with value: 2.8555764149575955 and parameters: {'timeframe': 'M5', 'atr_period': 13, 'atr_threshold': 3.0, 'pt_mult': 0.5, 'sl_mult': 5.0, 'td_mins': 60}. Best is trial 537 with value: 2.8555764149575955.
[I 2026-03-12 01:49:00,694] Trial 720 finished with value: 2.8555764149575955 and parameters: {'timeframe': 'M5', 'atr_period': 13, 'atr_threshold': 3.0, 'pt_mult': 0.5, 'sl_mult': 5.0, 'td_mins': 60}. Best is trial 537 with value: 2.8555764149575955.
[I 2026-03-12 01:49:00,876] Trial 721 finished with value: 2.8555764149575955 and parameters: {'timeframe': 'M5', 'atr_period': 13, 'atr_threshold': 3.0, 'pt_mult': 0.5, 'sl_mult': 5.0, 'td_mins': 60}. Best is trial 537 with value: 2.8555764149575955.
[I 2026-03-12 01:49:00,924] Trial 722 finished with value: 0.0 and parameters: {'timeframe': 'M5', 'atr_period': 13, 'atr_threshold': 8.0, 'pt_mult': 2.5, 'sl_mult': 5.0, 'td_mins': 360}. Best is trial 537 with value: 2.8555764149575955.
[I 2026-03-12 01:49:00,977] Trial 723 finished with value: 0.0 and parameters: {'timeframe': 'M5', 'atr_period': 13, 'atr_threshold': 5.0, 'pt_mult': 5.0, 'sl_mult': 1.0, 'td_mins': 1080}. Best is trial 537 with value: 2.8555764149575955.
[I 2026-03-12 01:49:01,145] Trial 724 finished with value: 2.8555764149575955 and parameters: {'timeframe': 'M5', 'atr_period': 13, 'atr_threshold': 3.0, 'pt_mult': 0.5, 'sl_mult': 5.0, 'td_mins': 60}. Best is trial 537 with value: 2.8555764149575955.
[I 2026-03-12 01:49:01,316] Trial 725 pruned. 
[I 2026-03-12 01:49:01,381] Trial 726 pruned. 
[I 2026-03-12 01:49:01,433] Trial 727 finished with value: 0.0 and parameters: {'timeframe': 'M5', 'atr_period': 13, 'atr_threshold': 5.0, 'pt_mult': 0.5, 'sl_mult': 5.0, 'td_mins': 180}. Best is trial 537 with value: 2.8555764149575955.
[I 2026-03-12 01:49:01,639] Trial 728 pruned. 
[I 2026-03-12 01:49:01,688] Trial 729 finished with value: 0.0 and parameters: {'timeframe': 'M5', 'atr_period': 13, 'atr_threshold': 8.0, 'pt_mult': 5.0, 'sl_mult': 0.5, 'td_mins': 15}. Best is trial 537 with value: 2.8555764149575955.
[I 2026-03-12 01:49:01,741] Trial 730 finished with value: 0.0 and parameters: {'timeframe': 'M5', 'atr_period': 13, 'atr_threshold': 8.0, 'pt_mult': 0.5, 'sl_mult': 5.0, 'td_mins': 360}. Best is trial 537 with value: 2.8555764149575955.
[I 2026-03-12 01:49:01,924] Trial 731 pruned. 
[I 2026-03-12 01:49:02,101] Trial 732 finished with value: 2.8555764149575955 and parameters: {'timeframe': 'M5', 'atr_period': 13, 'atr_threshold': 3.0, 'pt_mult': 0.5, 'sl_mult': 5.0, 'td_mins': 60}. Best is trial 537 with value: 2.8555764149575955.
[I 2026-03-12 01:49:02,179] Trial 733 pruned. 
[I 2026-03-12 01:49:02,244] Trial 734 pruned. 
[I 2026-03-12 01:49:02,527] Trial 735 pruned. 
[I 2026-03-12 01:49:02,595] Trial 736 pruned. 
[I 2026-03-12 01:49:02,768] Trial 737 finished with value: 2.8555764149575955 and parameters: {'timeframe': 'M5', 'atr_period': 13, 'atr_threshold': 3.0, 'pt_mult': 0.5, 'sl_mult': 5.0, 'td_mins': 60}. Best is trial 537 with value: 2.8555764149575955.
[I 2026-03-12 01:49:02,944] Trial 738 finished with value: 2.8555764149575955 and parameters: {'timeframe': 'M5', 'atr_period': 13, 'atr_threshold': 3.0, 'pt_mult': 0.5, 'sl_mult': 5.0, 'td_mins': 60}. Best is trial 537 with value: 2.8555764149575955.
[I 2026-03-12 01:49:03,121] Trial 739 finished with value: 2.8555764149575955 and parameters: {'timeframe': 'M5', 'atr_period': 13, 'atr_threshold': 3.0, 'pt_mult': 0.5, 'sl_mult': 5.0, 'td_mins': 60}. Best is trial 537 with value: 2.8555764149575955.
[I 2026-03-12 01:49:03,288] Trial 740 finished with value: 2.8555764149575955 and parameters: {'timeframe': 'M5', 'atr_period': 13, 'atr_threshold': 3.0, 'pt_mult': 0.5, 'sl_mult': 5.0, 'td_mins': 60}. Best is trial 537 with value: 2.8555764149575955.
[I 2026-03-12 01:49:03,357] Trial 741 pruned. 
[I 2026-03-12 01:49:03,421] Trial 742 pruned. 
[I 2026-03-12 01:49:03,470] Trial 743 finished with value: 0.0 and parameters: {'timeframe': 'M5', 'atr_period': 13, 'atr_threshold': 10.0, 'pt_mult': 0.5, 'sl_mult': 5.0, 'td_mins': 1200}. Best is trial 537 with value: 2.8555764149575955.
[I 2026-03-12 01:49:03,599] Trial 744 pruned. 
[I 2026-03-12 01:49:03,774] Trial 745 finished with value: 2.8555764149575955 and parameters: {'timeframe': 'M5', 'atr_period': 13, 'atr_threshold': 3.0, 'pt_mult': 0.5, 'sl_mult': 5.0, 'td_mins': 60}. Best is trial 537 with value: 2.8555764149575955.
[I 2026-03-12 01:49:03,826] Trial 746 pruned. 
[I 2026-03-12 01:49:03,892] Trial 747 pruned. 
[I 2026-03-12 01:49:04,161] Trial 748 pruned. 
[I 2026-03-12 01:49:04,336] Trial 749 finished with value: 2.8555764149575955 and parameters: {'timeframe': 'M5', 'atr_period': 13, 'atr_threshold': 3.0, 'pt_mult': 0.5, 'sl_mult': 5.0, 'td_mins': 60}. Best is trial 537 with value: 2.8555764149575955.
[I 2026-03-12 01:49:04,445] Trial 750 pruned. 
[I 2026-03-12 01:49:04,594] Trial 751 pruned. 
[I 2026-03-12 01:49:04,668] Trial 752 pruned. 
[I 2026-03-12 01:49:04,725] Trial 753 finished with value: 0.0 and parameters: {'timeframe': 'M5', 'atr_period': 13, 'atr_threshold': 10.0, 'pt_mult': 0.5, 'sl_mult': 5.0, 'td_mins': 60}. Best is trial 537 with value: 2.8555764149575955.
[I 2026-03-12 01:49:04,779] Trial 754 finished with value: 0.0 and parameters: {'timeframe': 'M5', 'atr_period': 13, 'atr_threshold': 8.0, 'pt_mult': 2.5, 'sl_mult': 0.5, 'td_mins': 1200}. Best is trial 537 with value: 2.8555764149575955.
[I 2026-03-12 01:49:04,854] Trial 755 pruned. 
[I 2026-03-12 01:49:04,923] Trial 756 pruned. 
[I 2026-03-12 01:49:05,049] Trial 757 pruned. 
[I 2026-03-12 01:49:05,100] Trial 758 finished with value: 0.0 and parameters: {'timeframe': 'M5', 'atr_period': 13, 'atr_threshold': 8.0, 'pt_mult': 1.0, 'sl_mult': 0.5, 'td_mins': 1080}. Best is trial 537 with value: 2.8555764149575955.
[I 2026-03-12 01:49:05,152] Trial 759 finished with value: 0.0 and parameters: {'timeframe': 'M5', 'atr_period': 13, 'atr_threshold': 5.0, 'pt_mult': 0.5, 'sl_mult': 2.5, 'td_mins': 60}. Best is trial 537 with value: 2.8555764149575955.
[I 2026-03-12 01:49:05,563] Trial 760 pruned. 
[I 2026-03-12 01:49:05,616] Trial 761 finished with value: 0.0 and parameters: {'timeframe': 'M5', 'atr_period': 13, 'atr_threshold': 15.0, 'pt_mult': 0.5, 'sl_mult': 5.0, 'td_mins': 360}. Best is trial 537 with value: 2.8555764149575955.
[I 2026-03-12 01:49:05,668] Trial 762 finished with value: 0.0 and parameters: {'timeframe': 'M5', 'atr_period': 13, 'atr_threshold': 5.0, 'pt_mult': 0.5, 'sl_mult': 5.0, 'td_mins': 60}. Best is trial 537 with value: 2.8555764149575955.
[I 2026-03-12 01:49:05,808] Trial 763 pruned. 
[I 2026-03-12 01:49:06,130] Trial 764 finished with value: 2.406101417633213 and parameters: {'timeframe': 'M5', 'atr_period': 13, 'atr_threshold': 2.0, 'pt_mult': 0.5, 'sl_mult': 5.0, 'td_mins': 60}. Best is trial 537 with value: 2.8555764149575955.
[I 2026-03-12 01:49:07,855] Trial 765 pruned. 
[I 2026-03-12 01:49:07,907] Trial 766 finished with value: 0.0 and parameters: {'timeframe': 'M5', 'atr_period': 13, 'atr_threshold': 15.0, 'pt_mult': 2.5, 'sl_mult': 0.5, 'td_mins': 180}. Best is trial 537 with value: 2.8555764149575955.
[I 2026-03-12 01:49:08,054] Trial 767 pruned. 
[I 2026-03-12 01:49:08,103] Trial 768 finished with value: 0.0 and parameters: {'timeframe': 'M5', 'atr_period': 13, 'atr_threshold': 10.0, 'pt_mult': 1.0, 'sl_mult': 1.0, 'td_mins': 15}. Best is trial 537 with value: 2.8555764149575955.
[I 2026-03-12 01:49:08,273] Trial 769 finished with value: 2.8555764149575955 and parameters: {'timeframe': 'M5', 'atr_period': 13, 'atr_threshold': 3.0, 'pt_mult': 0.5, 'sl_mult': 5.0, 'td_mins': 60}. Best is trial 537 with value: 2.8555764149575955.
