[I 2026-03-12 00:56:39,104] Trial 243 finished with value: 1.2925297399334947 and parameters: {'timeframe': 'M5', 'atr_period': 13, 'atr_threshold': 0.5, 'pt_mult': 1.0, 'sl_mult': 5.0, 'td_mins': 30}. Best is trial 113 with value: 1.783955378354149.
[I 2026-03-12 00:56:39,205] Trial 244 pruned. 
[I 2026-03-12 00:56:39,253] Trial 245 finished with value: 0.0 and parameters: {'timeframe': 'M5', 'atr_period': 13, 'atr_threshold': 15.0, 'pt_mult': 2.5, 'sl_mult': 1.0, 'td_mins': 1080}. Best is trial 113 with value: 1.783955378354149.
[I 2026-03-12 00:56:39,822] Trial 246 pruned. 
[I 2026-03-12 00:56:40,558] Trial 247 pruned. 
[I 2026-03-12 00:56:40,610] Trial 248 finished with value: 0.0 and parameters: {'timeframe': 'M5', 'atr_period': 13, 'atr_threshold': 8.0, 'pt_mult': 1.0, 'sl_mult': 5.0, 'td_mins': 15}. Best is trial 113 with value: 1.783955378354149.
[I 2026-03-12 00:56:40,807] Trial 249 pruned. 
[I 2026-03-12 00:56:40,850] Trial 250 finished with value: 0.0 and parameters: {'timeframe': 'M5', 'atr_period': 13, 'atr_threshold': 8.0, 'pt_mult': 5.0, 'sl_mult': 0.5, 'td_mins': 1200}. Best is trial 113 with value: 1.783955378354149.
[I 2026-03-12 00:56:40,900] Trial 251 finished with value: 0.0 and parameters: {'timeframe': 'M5', 'atr_period': 13, 'atr_threshold': 8.0, 'pt_mult': 1.0, 'sl_mult': 0.5, 'td_mins': 60}. Best is trial 113 with value: 1.783955378354149.
[I 2026-03-12 00:56:41,019] Trial 252 pruned. 
[I 2026-03-12 00:56:41,067] Trial 253 finished with value: 0.0 and parameters: {'timeframe': 'M5', 'atr_period': 13, 'atr_threshold': 5.0, 'pt_mult': 0.5, 'sl_mult': 1.0, 'td_mins': 120}. Best is trial 113 with value: 1.783955378354149.
[I 2026-03-12 00:56:41,113] Trial 254 finished with value: 0.0 and parameters: {'timeframe': 'M5', 'atr_period': 13, 'atr_threshold': 15.0, 'pt_mult': 5.0, 'sl_mult': 5.0, 'td_mins': 60}. Best is trial 113 with value: 1.783955378354149.
[I 2026-03-12 00:56:41,747] Trial 255 pruned. 
[I 2026-03-12 00:56:41,806] Trial 256 pruned. 
[I 2026-03-12 00:56:41,849] Trial 257 finished with value: 0.0 and parameters: {'timeframe': 'M5', 'atr_period': 13, 'atr_threshold': 15.0, 'pt_mult': 1.0, 'sl_mult': 2.5, 'td_mins': 180}. Best is trial 113 with value: 1.783955378354149.
[I 2026-03-12 00:56:41,891] Trial 258 finished with value: 0.0 and parameters: {'timeframe': 'M5', 'atr_period': 13, 'atr_threshold': 10.0, 'pt_mult': 0.5, 'sl_mult': 2.5, 'td_mins': 15}. Best is trial 113 with value: 1.783955378354149.
[I 2026-03-12 00:56:41,943] Trial 259 pruned. 
[I 2026-03-12 00:56:41,987] Trial 260 finished with value: 0.0 and parameters: {'timeframe': 'M5', 'atr_period': 13, 'atr_threshold': 8.0, 'pt_mult': 0.5, 'sl_mult': 5.0, 'td_mins': 180}. Best is trial 113 with value: 1.783955378354149.
[I 2026-03-12 00:56:42,993] Trial 261 finished with value: 1.1616765401297746 and parameters: {'timeframe': 'M5', 'atr_period': 13, 'atr_threshold': 3.0, 'pt_mult': 2.5, 'sl_mult': 0.5, 'td_mins': 1200}. Best is trial 113 with value: 1.783955378354149.
[I 2026-03-12 00:56:43,771] Trial 262 pruned. 
[I 2026-03-12 00:56:44,437] Trial 263 pruned. 
[I 2026-03-12 00:56:44,495] Trial 264 pruned. 
[I 2026-03-12 00:56:44,541] Trial 265 finished with value: 0.0 and parameters: {'timeframe': 'M5', 'atr_period': 13, 'atr_threshold': 10.0, 'pt_mult': 5.0, 'sl_mult': 5.0, 'td_mins': 30}. Best is trial 113 with value: 1.783955378354149.
[I 2026-03-12 00:56:45,210] Trial 266 pruned. 
[I 2026-03-12 00:56:45,883] Trial 267 pruned. 
[I 2026-03-12 00:56:45,960] Trial 268 pruned. 
[I 2026-03-12 00:56:46,012] Trial 269 finished with value: 0.0 and parameters: {'timeframe': 'M5', 'atr_period': 13, 'atr_threshold': 5.0, 'pt_mult': 0.5, 'sl_mult': 0.5, 'td_mins': 15}. Best is trial 113 with value: 1.783955378354149.
[I 2026-03-12 00:56:46,137] Trial 270 pruned. 
[I 2026-03-12 00:56:47,153] Trial 271 pruned. 
[I 2026-03-12 00:56:47,200] Trial 272 finished with value: 0.0 and parameters: {'timeframe': 'M5', 'atr_period': 13, 'atr_threshold': 15.0, 'pt_mult': 5.0, 'sl_mult': 0.5, 'td_mins': 120}. Best is trial 113 with value: 1.783955378354149.
[I 2026-03-12 00:56:47,247] Trial 273 finished with value: 0.0 and parameters: {'timeframe': 'M5', 'atr_period': 13, 'atr_threshold': 8.0, 'pt_mult': 2.5, 'sl_mult': 0.5, 'td_mins': 5}. Best is trial 113 with value: 1.783955378354149.
[I 2026-03-12 00:56:47,291] Trial 274 finished with value: 0.0 and parameters: {'timeframe': 'M5', 'atr_period': 13, 'atr_threshold': 10.0, 'pt_mult': 1.0, 'sl_mult': 5.0, 'td_mins': 180}. Best is trial 113 with value: 1.783955378354149.
[I 2026-03-12 00:56:47,389] Trial 275 pruned. 
[I 2026-03-12 00:56:47,435] Trial 276 finished with value: 0.0 and parameters: {'timeframe': 'M5', 'atr_period': 13, 'atr_threshold': 5.0, 'pt_mult': 1.0, 'sl_mult': 1.0, 'td_mins': 1080}. Best is trial 113 with value: 1.783955378354149.
[I 2026-03-12 00:56:47,480] Trial 277 finished with value: 0.0 and parameters: {'timeframe': 'M5', 'atr_period': 13, 'atr_threshold': 15.0, 'pt_mult': 0.5, 'sl_mult': 1.0, 'td_mins': 30}. Best is trial 113 with value: 1.783955378354149.
[I 2026-03-12 00:56:47,523] Trial 278 finished with value: 0.0 and parameters: {'timeframe': 'M5', 'atr_period': 13, 'atr_threshold': 10.0, 'pt_mult': 5.0, 'sl_mult': 2.5, 'td_mins': 60}. Best is trial 113 with value: 1.783955378354149.
[I 2026-03-12 00:56:48,143] Trial 279 pruned. 
[I 2026-03-12 00:56:48,190] Trial 280 finished with value: 0.0 and parameters: {'timeframe': 'M5', 'atr_period': 13, 'atr_threshold': 10.0, 'pt_mult': 2.5, 'sl_mult': 2.5, 'td_mins': 1080}. Best is trial 113 with value: 1.783955378354149.
[I 2026-03-12 00:56:48,318] Trial 281 pruned. 
[I 2026-03-12 00:56:48,366] Trial 282 finished with value: 0.0 and parameters: {'timeframe': 'M5', 'atr_period': 13, 'atr_threshold': 5.0, 'pt_mult': 0.5, 'sl_mult': 2.5, 'td_mins': 180}. Best is trial 113 with value: 1.783955378354149.
[I 2026-03-12 00:56:49,549] Trial 283 finished with value: 1.307219479864015 and parameters: {'timeframe': 'M5', 'atr_period': 13, 'atr_threshold': 2.0, 'pt_mult': 1.0, 'sl_mult': 5.0, 'td_mins': 360}. Best is trial 113 with value: 1.783955378354149.
[I 2026-03-12 00:56:49,594] Trial 284 finished with value: 0.0 and parameters: {'timeframe': 'M5', 'atr_period': 13, 'atr_threshold': 15.0, 'pt_mult': 2.5, 'sl_mult': 0.5, 'td_mins': 1080}. Best is trial 113 with value: 1.783955378354149.
[I 2026-03-12 00:56:49,728] Trial 285 pruned. 
[I 2026-03-12 00:56:49,773] Trial 286 finished with value: 0.0 and parameters: {'timeframe': 'M5', 'atr_period': 13, 'atr_threshold': 8.0, 'pt_mult': 2.5, 'sl_mult': 1.0, 'td_mins': 15}. Best is trial 113 with value: 1.783955378354149.
[I 2026-03-12 00:56:50,381] Trial 287 pruned. 
[I 2026-03-12 00:56:50,600] Trial 288 pruned. 
[I 2026-03-12 00:56:50,672] Trial 289 pruned. 
[I 2026-03-12 00:56:50,718] Trial 290 finished with value: 0.0 and parameters: {'timeframe': 'M5', 'atr_period': 13, 'atr_threshold': 15.0, 'pt_mult': 0.5, 'sl_mult': 5.0, 'td_mins': 30}. Best is trial 113 with value: 1.783955378354149.
[I 2026-03-12 00:56:50,764] Trial 291 finished with value: 0.0 and parameters: {'timeframe': 'M5', 'atr_period': 13, 'atr_threshold': 15.0, 'pt_mult': 2.5, 'sl_mult': 0.5, 'td_mins': 360}. Best is trial 113 with value: 1.783955378354149.
[I 2026-03-12 00:56:50,808] Trial 292 finished with value: 0.0 and parameters: {'timeframe': 'M5', 'atr_period': 13, 'atr_threshold': 8.0, 'pt_mult': 1.0, 'sl_mult': 5.0, 'td_mins': 1080}. Best is trial 113 with value: 1.783955378354149.
[I 2026-03-12 00:56:50,850] Trial 293 finished with value: 0.0 and parameters: {'timeframe': 'M5', 'atr_period': 13, 'atr_threshold': 5.0, 'pt_mult': 1.0, 'sl_mult': 2.5, 'td_mins': 1200}. Best is trial 113 with value: 1.783955378354149.
[I 2026-03-12 00:56:50,895] Trial 294 finished with value: 0.0 and parameters: {'timeframe': 'M5', 'atr_period': 13, 'atr_threshold': 10.0, 'pt_mult': 0.5, 'sl_mult': 1.0, 'td_mins': 15}. Best is trial 113 with value: 1.783955378354149.
[I 2026-03-12 00:56:50,943] Trial 295 finished with value: 0.0 and parameters: {'timeframe': 'M5', 'atr_period': 13, 'atr_threshold': 10.0, 'pt_mult': 1.0, 'sl_mult': 5.0, 'td_mins': 1200}. Best is trial 113 with value: 1.783955378354149.
[I 2026-03-12 00:56:51,180] Trial 296 pruned. 
[I 2026-03-12 00:56:51,229] Trial 297 finished with value: 0.0 and parameters: {'timeframe': 'M5', 'atr_period': 13, 'atr_threshold': 8.0, 'pt_mult': 2.5, 'sl_mult': 0.5, 'td_mins': 60}. Best is trial 113 with value: 1.783955378354149.
[I 2026-03-12 00:56:51,281] Trial 298 finished with value: 0.0 and parameters: {'timeframe': 'M5', 'atr_period': 13, 'atr_threshold': 15.0, 'pt_mult': 0.5, 'sl_mult': 2.5, 'td_mins': 30}. Best is trial 113 with value: 1.783955378354149.
[I 2026-03-12 00:56:51,335] Trial 299 finished with value: 0.0 and parameters: {'timeframe': 'M5', 'atr_period': 13, 'atr_threshold': 5.0, 'pt_mult': 0.5, 'sl_mult': 5.0, 'td_mins': 180}. Best is trial 113 with value: 1.783955378354149.
[I 2026-03-12 00:56:51,990] Trial 300 pruned. 
[I 2026-03-12 00:56:52,244] Trial 301 finished with value: 1.0811325222704808 and parameters: {'timeframe': 'M5', 'atr_period': 13, 'atr_threshold': 3.0, 'pt_mult': 1.0, 'sl_mult': 1.0, 'td_mins': 180}. Best is trial 113 with value: 1.783955378354149.
[I 2026-03-12 00:56:52,500] Trial 302 finished with value: 1.0811325222704808 and parameters: {'timeframe': 'M5', 'atr_period': 13, 'atr_threshold': 3.0, 'pt_mult': 1.0, 'sl_mult': 1.0, 'td_mins': 180}. Best is trial 113 with value: 1.783955378354149.
[I 2026-03-12 00:56:52,747] Trial 303 finished with value: 1.0811325222704808 and parameters: {'timeframe': 'M5', 'atr_period': 13, 'atr_threshold': 3.0, 'pt_mult': 1.0, 'sl_mult': 1.0, 'td_mins': 180}. Best is trial 113 with value: 1.783955378354149.
[I 2026-03-12 00:56:53,143] Trial 304 finished with value: 1.0662424837261235 and parameters: {'timeframe': 'M5', 'atr_period': 13, 'atr_threshold': 3.0, 'pt_mult': 0.5, 'sl_mult': 2.5, 'td_mins': 360}. Best is trial 113 with value: 1.783955378354149.
[I 2026-03-12 00:56:53,387] Trial 305 finished with value: 1.0811325222704808 and parameters: {'timeframe': 'M5', 'atr_period': 13, 'atr_threshold': 3.0, 'pt_mult': 1.0, 'sl_mult': 1.0, 'td_mins': 180}. Best is trial 113 with value: 1.783955378354149.
[I 2026-03-12 00:56:53,632] Trial 306 finished with value: 1.0811325222704808 and parameters: {'timeframe': 'M5', 'atr_period': 13, 'atr_threshold': 3.0, 'pt_mult': 1.0, 'sl_mult': 1.0, 'td_mins': 180}. Best is trial 113 with value: 1.783955378354149.
[I 2026-03-12 00:56:53,876] Trial 307 finished with value: 1.0811325222704808 and parameters: {'timeframe': 'M5', 'atr_period': 13, 'atr_threshold': 3.0, 'pt_mult': 1.0, 'sl_mult': 1.0, 'td_mins': 180}. Best is trial 113 with value: 1.783955378354149.
[I 2026-03-12 00:56:54,059] Trial 308 pruned. 
[I 2026-03-12 00:56:55,244] Trial 309 finished with value: 1.307219479864015 and parameters: {'timeframe': 'M5', 'atr_period': 13, 'atr_threshold': 2.0, 'pt_mult': 1.0, 'sl_mult': 5.0, 'td_mins': 360}. Best is trial 113 with value: 1.783955378354149.
[I 2026-03-12 00:56:55,541] Trial 310 finished with value: 1.7694115243064128 and parameters: {'timeframe': 'M5', 'atr_period': 13, 'atr_threshold': 3.0, 'pt_mult': 0.5, 'sl_mult': 5.0, 'td_mins': 120}. Best is trial 113 with value: 1.783955378354149.
[I 2026-03-12 00:56:55,810] Trial 311 finished with value: 1.7694115243064128 and parameters: {'timeframe': 'M5', 'atr_period': 13, 'atr_threshold': 3.0, 'pt_mult': 0.5, 'sl_mult': 5.0, 'td_mins': 120}. Best is trial 113 with value: 1.783955378354149.
[I 2026-03-12 00:56:56,082] Trial 312 finished with value: 1.7694115243064128 and parameters: {'timeframe': 'M5', 'atr_period': 13, 'atr_threshold': 3.0, 'pt_mult': 0.5, 'sl_mult': 5.0, 'td_mins': 120}. Best is trial 113 with value: 1.783955378354149.
[I 2026-03-12 00:56:56,381] Trial 313 finished with value: 1.7694115243064128 and parameters: {'timeframe': 'M5', 'atr_period': 13, 'atr_threshold': 3.0, 'pt_mult': 0.5, 'sl_mult': 5.0, 'td_mins': 120}. Best is trial 113 with value: 1.783955378354149.
[I 2026-03-12 00:56:56,658] Trial 314 finished with value: 1.7694115243064128 and parameters: {'timeframe': 'M5', 'atr_period': 13, 'atr_threshold': 3.0, 'pt_mult': 0.5, 'sl_mult': 5.0, 'td_mins': 120}. Best is trial 113 with value: 1.783955378354149.
[I 2026-03-12 00:56:56,919] Trial 315 finished with value: 1.7694115243064128 and parameters: {'timeframe': 'M5', 'atr_period': 13, 'atr_threshold': 3.0, 'pt_mult': 0.5, 'sl_mult': 5.0, 'td_mins': 120}. Best is trial 113 with value: 1.783955378354149.
[I 2026-03-12 00:56:57,172] Trial 316 finished with value: 1.7694115243064128 and parameters: {'timeframe': 'M5', 'atr_period': 13, 'atr_threshold': 3.0, 'pt_mult': 0.5, 'sl_mult': 5.0, 'td_mins': 120}. Best is trial 113 with value: 1.783955378354149.
[I 2026-03-12 00:56:57,435] Trial 317 finished with value: 1.7694115243064128 and parameters: {'timeframe': 'M5', 'atr_period': 13, 'atr_threshold': 3.0, 'pt_mult': 0.5, 'sl_mult': 5.0, 'td_mins': 120}. Best is trial 113 with value: 1.783955378354149.
[I 2026-03-12 00:56:57,691] Trial 318 finished with value: 1.7694115243064128 and parameters: {'timeframe': 'M5', 'atr_period': 13, 'atr_threshold': 3.0, 'pt_mult': 0.5, 'sl_mult': 5.0, 'td_mins': 120}. Best is trial 113 with value: 1.783955378354149.
[I 2026-03-12 00:56:57,946] Trial 319 finished with value: 1.7694115243064128 and parameters: {'timeframe': 'M5', 'atr_period': 13, 'atr_threshold': 3.0, 'pt_mult': 0.5, 'sl_mult': 5.0, 'td_mins': 120}. Best is trial 113 with value: 1.783955378354149.
[I 2026-03-12 00:56:58,193] Trial 320 finished with value: 1.7694115243064128 and parameters: {'timeframe': 'M5', 'atr_period': 13, 'atr_threshold': 3.0, 'pt_mult': 0.5, 'sl_mult': 5.0, 'td_mins': 120}. Best is trial 113 with value: 1.783955378354149.
[I 2026-03-12 00:56:58,520] Trial 321 finished with value: 1.7694115243064128 and parameters: {'timeframe': 'M5', 'atr_period': 13, 'atr_threshold': 3.0, 'pt_mult': 0.5, 'sl_mult': 5.0, 'td_mins': 120}. Best is trial 113 with value: 1.783955378354149.
[I 2026-03-12 00:56:58,781] Trial 322 finished with value: 1.7694115243064128 and parameters: {'timeframe': 'M5', 'atr_period': 13, 'atr_threshold': 3.0, 'pt_mult': 0.5, 'sl_mult': 5.0, 'td_mins': 120}. Best is trial 113 with value: 1.783955378354149.
[I 2026-03-12 00:56:59,049] Trial 323 finished with value: 1.7694115243064128 and parameters: {'timeframe': 'M5', 'atr_period': 13, 'atr_threshold': 3.0, 'pt_mult': 0.5, 'sl_mult': 5.0, 'td_mins': 120}. Best is trial 113 with value: 1.783955378354149.
[I 2026-03-12 00:56:59,317] Trial 324 finished with value: 1.7694115243064128 and parameters: {'timeframe': 'M5', 'atr_period': 13, 'atr_threshold': 3.0, 'pt_mult': 0.5, 'sl_mult': 5.0, 'td_mins': 120}. Best is trial 113 with value: 1.783955378354149.
[I 2026-03-12 00:56:59,583] Trial 325 finished with value: 1.7694115243064128 and parameters: {'timeframe': 'M5', 'atr_period': 13, 'atr_threshold': 3.0, 'pt_mult': 0.5, 'sl_mult': 5.0, 'td_mins': 120}. Best is trial 113 with value: 1.783955378354149.
[I 2026-03-12 00:56:59,837] Trial 326 finished with value: 1.7694115243064128 and parameters: {'timeframe': 'M5', 'atr_period': 13, 'atr_threshold': 3.0, 'pt_mult': 0.5, 'sl_mult': 5.0, 'td_mins': 120}. Best is trial 113 with value: 1.783955378354149.
[I 2026-03-12 00:57:00,098] Trial 327 finished with value: 1.7694115243064128 and parameters: {'timeframe': 'M5', 'atr_period': 13, 'atr_threshold': 3.0, 'pt_mult': 0.5, 'sl_mult': 5.0, 'td_mins': 120}. Best is trial 113 with value: 1.783955378354149.
[I 2026-03-12 00:57:00,360] Trial 328 finished with value: 1.7694115243064128 and parameters: {'timeframe': 'M5', 'atr_period': 13, 'atr_threshold': 3.0, 'pt_mult': 0.5, 'sl_mult': 5.0, 'td_mins': 120}. Best is trial 113 with value: 1.783955378354149.
[I 2026-03-12 00:57:00,613] Trial 329 finished with value: 1.7694115243064128 and parameters: {'timeframe': 'M5', 'atr_period': 13, 'atr_threshold': 3.0, 'pt_mult': 0.5, 'sl_mult': 5.0, 'td_mins': 120}. Best is trial 113 with value: 1.783955378354149.
[I 2026-03-12 00:57:00,864] Trial 330 finished with value: 1.7694115243064128 and parameters: {'timeframe': 'M5', 'atr_period': 13, 'atr_threshold': 3.0, 'pt_mult': 0.5, 'sl_mult': 5.0, 'td_mins': 120}. Best is trial 113 with value: 1.783955378354149.
[I 2026-03-12 00:57:01,163] Trial 331 finished with value: 1.7694115243064128 and parameters: {'timeframe': 'M5', 'atr_period': 13, 'atr_threshold': 3.0, 'pt_mult': 0.5, 'sl_mult': 5.0, 'td_mins': 120}. Best is trial 113 with value: 1.783955378354149.
[I 2026-03-12 00:57:01,442] Trial 332 finished with value: 1.7694115243064128 and parameters: {'timeframe': 'M5', 'atr_period': 13, 'atr_threshold': 3.0, 'pt_mult': 0.5, 'sl_mult': 5.0, 'td_mins': 120}. Best is trial 113 with value: 1.783955378354149.
[I 2026-03-12 00:57:01,703] Trial 333 finished with value: 1.7694115243064128 and parameters: {'timeframe': 'M5', 'atr_period': 13, 'atr_threshold': 3.0, 'pt_mult': 0.5, 'sl_mult': 5.0, 'td_mins': 120}. Best is trial 113 with value: 1.783955378354149.
[I 2026-03-12 00:57:01,840] Trial 334 pruned. 
[I 2026-03-12 00:57:01,900] Trial 335 pruned. 
[I 2026-03-12 00:57:02,154] Trial 336 finished with value: 1.705484745246379 and parameters: {'timeframe': 'M5', 'atr_period': 13, 'atr_threshold': 3.0, 'pt_mult': 1.0, 'sl_mult': 5.0, 'td_mins': 120}. Best is trial 113 with value: 1.783955378354149.
[I 2026-03-12 00:57:02,324] Trial 337 finished with value: 2.1460025462423253 and parameters: {'timeframe': 'M5', 'atr_period': 13, 'atr_threshold': 3.0, 'pt_mult': 0.5, 'sl_mult': 5.0, 'td_mins': 60}. Best is trial 337 with value: 2.1460025462423253.
[I 2026-03-12 00:57:02,507] Trial 338 finished with value: 2.1460025462423253 and parameters: {'timeframe': 'M5', 'atr_period': 13, 'atr_threshold': 3.0, 'pt_mult': 0.5, 'sl_mult': 5.0, 'td_mins': 60}. Best is trial 337 with value: 2.1460025462423253.
[I 2026-03-12 00:57:02,685] Trial 339 finished with value: 2.1460025462423253 and parameters: {'timeframe': 'M5', 'atr_period': 13, 'atr_threshold': 3.0, 'pt_mult': 0.5, 'sl_mult': 5.0, 'td_mins': 60}. Best is trial 337 with value: 2.1460025462423253.
[I 2026-03-12 00:57:02,854] Trial 340 finished with value: 2.1460025462423253 and parameters: {'timeframe': 'M5', 'atr_period': 13, 'atr_threshold': 3.0, 'pt_mult': 0.5, 'sl_mult': 5.0, 'td_mins': 60}. Best is trial 337 with value: 2.1460025462423253.
[I 2026-03-12 00:57:03,024] Trial 341 finished with value: 2.1460025462423253 and parameters: {'timeframe': 'M5', 'atr_period': 13, 'atr_threshold': 3.0, 'pt_mult': 0.5, 'sl_mult': 5.0, 'td_mins': 60}. Best is trial 337 with value: 2.1460025462423253.
[I 2026-03-12 00:57:03,192] Trial 342 finished with value: 2.1460025462423253 and parameters: {'timeframe': 'M5', 'atr_period': 13, 'atr_threshold': 3.0, 'pt_mult': 0.5, 'sl_mult': 5.0, 'td_mins': 60}. Best is trial 337 with value: 2.1460025462423253.
[I 2026-03-12 00:57:03,360] Trial 343 finished with value: 2.1460025462423253 and parameters: {'timeframe': 'M5', 'atr_period': 13, 'atr_threshold': 3.0, 'pt_mult': 0.5, 'sl_mult': 5.0, 'td_mins': 60}. Best is trial 337 with value: 2.1460025462423253.
[I 2026-03-12 00:57:03,526] Trial 344 finished with value: 2.1460025462423253 and parameters: {'timeframe': 'M5', 'atr_period': 13, 'atr_threshold': 3.0, 'pt_mult': 0.5, 'sl_mult': 5.0, 'td_mins': 60}. Best is trial 337 with value: 2.1460025462423253.
[I 2026-03-12 00:57:03,699] Trial 345 finished with value: 2.1460025462423253 and parameters: {'timeframe': 'M5', 'atr_period': 13, 'atr_threshold': 3.0, 'pt_mult': 0.5, 'sl_mult': 5.0, 'td_mins': 60}. Best is trial 337 with value: 2.1460025462423253.
[I 2026-03-12 00:57:03,877] Trial 346 finished with value: 2.1460025462423253 and parameters: {'timeframe': 'M5', 'atr_period': 13, 'atr_threshold': 3.0, 'pt_mult': 0.5, 'sl_mult': 5.0, 'td_mins': 60}. Best is trial 337 with value: 2.1460025462423253.
[I 2026-03-12 00:57:04,050] Trial 347 finished with value: 2.1460025462423253 and parameters: {'timeframe': 'M5', 'atr_period': 13, 'atr_threshold': 3.0, 'pt_mult': 0.5, 'sl_mult': 5.0, 'td_mins': 60}. Best is trial 337 with value: 2.1460025462423253.
[I 2026-03-12 00:57:04,223] Trial 348 finished with value: 2.1460025462423253 and parameters: {'timeframe': 'M5', 'atr_period': 13, 'atr_threshold': 3.0, 'pt_mult': 0.5, 'sl_mult': 5.0, 'td_mins': 60}. Best is trial 337 with value: 2.1460025462423253.
[I 2026-03-12 00:57:04,408] Trial 349 finished with value: 2.1460025462423253 and parameters: {'timeframe': 'M5', 'atr_period': 13, 'atr_threshold': 3.0, 'pt_mult': 0.5, 'sl_mult': 5.0, 'td_mins': 60}. Best is trial 337 with value: 2.1460025462423253.
[I 2026-03-12 00:57:04,583] Trial 350 finished with value: 2.1460025462423253 and parameters: {'timeframe': 'M5', 'atr_period': 13, 'atr_threshold': 3.0, 'pt_mult': 0.5, 'sl_mult': 5.0, 'td_mins': 60}. Best is trial 337 with value: 2.1460025462423253.
[I 2026-03-12 00:57:04,755] Trial 351 finished with value: 2.1460025462423253 and parameters: {'timeframe': 'M5', 'atr_period': 13, 'atr_threshold': 3.0, 'pt_mult': 0.5, 'sl_mult': 5.0, 'td_mins': 60}. Best is trial 337 with value: 2.1460025462423253.
[I 2026-03-12 00:57:04,922] Trial 352 finished with value: 2.1460025462423253 and parameters: {'timeframe': 'M5', 'atr_period': 13, 'atr_threshold': 3.0, 'pt_mult': 0.5, 'sl_mult': 5.0, 'td_mins': 60}. Best is trial 337 with value: 2.1460025462423253.
[I 2026-03-12 00:57:05,090] Trial 353 finished with value: 2.1460025462423253 and parameters: {'timeframe': 'M5', 'atr_period': 13, 'atr_threshold': 3.0, 'pt_mult': 0.5, 'sl_mult': 5.0, 'td_mins': 60}. Best is trial 337 with value: 2.1460025462423253.
