[I 2026-03-12 00:49:32,104] Trial 229 finished with value: 0.0 and parameters: {'timeframe': 'M3', 'atr_period': 13, 'atr_threshold': 15.0, 'pt_mult': 0.5, 'sl_mult': 0.5, 'td_mins': 30}. Best is trial 226 with value: 2.6610758639085312.
[I 2026-03-12 00:49:34,322] Trial 230 finished with value: 1.0590972749519765 and parameters: {'timeframe': 'M3', 'atr_period': 13, 'atr_threshold': 2.0, 'pt_mult': 1.0, 'sl_mult': 2.5, 'td_mins': 1200}. Best is trial 226 with value: 2.6610758639085312.
[I 2026-03-12 00:49:34,366] Trial 231 finished with value: 0.0 and parameters: {'timeframe': 'M3', 'atr_period': 13, 'atr_threshold': 10.0, 'pt_mult': 1.0, 'sl_mult': 0.5, 'td_mins': 15}. Best is trial 226 with value: 2.6610758639085312.
[I 2026-03-12 00:49:34,410] Trial 232 finished with value: 0.0 and parameters: {'timeframe': 'M3', 'atr_period': 13, 'atr_threshold': 5.0, 'pt_mult': 0.5, 'sl_mult': 5.0, 'td_mins': 5}. Best is trial 226 with value: 2.6610758639085312.
[I 2026-03-12 00:49:34,453] Trial 233 finished with value: 0.0 and parameters: {'timeframe': 'M3', 'atr_period': 13, 'atr_threshold': 5.0, 'pt_mult': 5.0, 'sl_mult': 5.0, 'td_mins': 360}. Best is trial 226 with value: 2.6610758639085312.
[I 2026-03-12 00:49:35,325] Trial 234 pruned. 
[I 2026-03-12 00:49:35,376] Trial 235 finished with value: 0.0 and parameters: {'timeframe': 'M3', 'atr_period': 13, 'atr_threshold': 5.0, 'pt_mult': 1.0, 'sl_mult': 1.0, 'td_mins': 180}. Best is trial 226 with value: 2.6610758639085312.
[I 2026-03-12 00:49:35,984] Trial 236 finished with value: 1.5373882315308038 and parameters: {'timeframe': 'M3', 'atr_period': 13, 'atr_threshold': 2.0, 'pt_mult': 1.0, 'sl_mult': 5.0, 'td_mins': 120}. Best is trial 226 with value: 2.6610758639085312.
[I 2026-03-12 00:49:36,035] Trial 237 finished with value: 0.0 and parameters: {'timeframe': 'M3', 'atr_period': 13, 'atr_threshold': 5.0, 'pt_mult': 2.5, 'sl_mult': 1.0, 'td_mins': 30}. Best is trial 226 with value: 2.6610758639085312.
[I 2026-03-12 00:49:36,090] Trial 238 finished with value: 0.0 and parameters: {'timeframe': 'M3', 'atr_period': 13, 'atr_threshold': 10.0, 'pt_mult': 2.5, 'sl_mult': 1.0, 'td_mins': 720}. Best is trial 226 with value: 2.6610758639085312.
[I 2026-03-12 00:49:36,135] Trial 239 finished with value: 0.0 and parameters: {'timeframe': 'M3', 'atr_period': 13, 'atr_threshold': 10.0, 'pt_mult': 2.5, 'sl_mult': 0.5, 'td_mins': 120}. Best is trial 226 with value: 2.6610758639085312.
[I 2026-03-12 00:49:36,180] Trial 240 finished with value: 0.0 and parameters: {'timeframe': 'M3', 'atr_period': 13, 'atr_threshold': 5.0, 'pt_mult': 1.0, 'sl_mult': 1.0, 'td_mins': 1080}. Best is trial 226 with value: 2.6610758639085312.
[I 2026-03-12 00:49:36,223] Trial 241 finished with value: 0.0 and parameters: {'timeframe': 'M3', 'atr_period': 13, 'atr_threshold': 8.0, 'pt_mult': 2.5, 'sl_mult': 0.5, 'td_mins': 720}. Best is trial 226 with value: 2.6610758639085312.
[I 2026-03-12 00:49:37,152] Trial 242 finished with value: 1.0743702660348753 and parameters: {'timeframe': 'M3', 'atr_period': 13, 'atr_threshold': 2.0, 'pt_mult': 1.0, 'sl_mult': 2.5, 'td_mins': 360}. Best is trial 226 with value: 2.6610758639085312.
[I 2026-03-12 00:49:37,280] Trial 243 pruned. 
[I 2026-03-12 00:49:37,324] Trial 244 finished with value: 0.0 and parameters: {'timeframe': 'M3', 'atr_period': 13, 'atr_threshold': 8.0, 'pt_mult': 0.5, 'sl_mult': 1.0, 'td_mins': 180}. Best is trial 226 with value: 2.6610758639085312.
[I 2026-03-12 00:49:37,368] Trial 245 finished with value: 0.0 and parameters: {'timeframe': 'M3', 'atr_period': 13, 'atr_threshold': 5.0, 'pt_mult': 2.5, 'sl_mult': 5.0, 'td_mins': 5}. Best is trial 226 with value: 2.6610758639085312.
[I 2026-03-12 00:49:37,415] Trial 246 finished with value: 0.0 and parameters: {'timeframe': 'M3', 'atr_period': 13, 'atr_threshold': 8.0, 'pt_mult': 5.0, 'sl_mult': 5.0, 'td_mins': 5}. Best is trial 226 with value: 2.6610758639085312.
[I 2026-03-12 00:49:37,563] Trial 247 pruned. 
[I 2026-03-12 00:49:37,650] Trial 248 finished with value: 2.56808242042213 and parameters: {'timeframe': 'M3', 'atr_period': 13, 'atr_threshold': 3.0, 'pt_mult': 0.5, 'sl_mult': 5.0, 'td_mins': 15}. Best is trial 226 with value: 2.6610758639085312.
[I 2026-03-12 00:49:37,697] Trial 249 finished with value: 0.0 and parameters: {'timeframe': 'M3', 'atr_period': 13, 'atr_threshold': 8.0, 'pt_mult': 2.5, 'sl_mult': 1.0, 'td_mins': 60}. Best is trial 226 with value: 2.6610758639085312.
[I 2026-03-12 00:49:37,743] Trial 250 finished with value: 0.0 and parameters: {'timeframe': 'M3', 'atr_period': 13, 'atr_threshold': 8.0, 'pt_mult': 0.5, 'sl_mult': 0.5, 'td_mins': 5}. Best is trial 226 with value: 2.6610758639085312.
[I 2026-03-12 00:49:37,785] Trial 251 finished with value: 0.0 and parameters: {'timeframe': 'M3', 'atr_period': 13, 'atr_threshold': 8.0, 'pt_mult': 1.0, 'sl_mult': 5.0, 'td_mins': 720}. Best is trial 226 with value: 2.6610758639085312.
[I 2026-03-12 00:49:38,395] Trial 252 finished with value: 1.185416547709049 and parameters: {'timeframe': 'M3', 'atr_period': 13, 'atr_threshold': 3.0, 'pt_mult': 2.5, 'sl_mult': 1.0, 'td_mins': 720}. Best is trial 226 with value: 2.6610758639085312.
[I 2026-03-12 00:49:38,505] Trial 253 pruned. 
[I 2026-03-12 00:49:38,626] Trial 254 finished with value: 1.0044326838996027 and parameters: {'timeframe': 'M3', 'atr_period': 13, 'atr_threshold': 3.0, 'pt_mult': 0.5, 'sl_mult': 0.5, 'td_mins': 60}. Best is trial 226 with value: 2.6610758639085312.
[I 2026-03-12 00:49:38,670] Trial 255 finished with value: 0.0 and parameters: {'timeframe': 'M3', 'atr_period': 13, 'atr_threshold': 5.0, 'pt_mult': 1.0, 'sl_mult': 2.5, 'td_mins': 5}. Best is trial 226 with value: 2.6610758639085312.
[I 2026-03-12 00:49:38,780] Trial 256 finished with value: 1.1646562310515098 and parameters: {'timeframe': 'M3', 'atr_period': 13, 'atr_threshold': 3.0, 'pt_mult': 1.0, 'sl_mult': 2.5, 'td_mins': 30}. Best is trial 226 with value: 2.6610758639085312.
[I 2026-03-12 00:49:38,827] Trial 257 finished with value: 0.0 and parameters: {'timeframe': 'M3', 'atr_period': 13, 'atr_threshold': 10.0, 'pt_mult': 1.0, 'sl_mult': 5.0, 'td_mins': 15}. Best is trial 226 with value: 2.6610758639085312.
[I 2026-03-12 00:49:38,872] Trial 258 finished with value: 0.0 and parameters: {'timeframe': 'M3', 'atr_period': 13, 'atr_threshold': 10.0, 'pt_mult': 1.0, 'sl_mult': 5.0, 'td_mins': 30}. Best is trial 226 with value: 2.6610758639085312.
[I 2026-03-12 00:49:38,916] Trial 259 finished with value: 0.0 and parameters: {'timeframe': 'M3', 'atr_period': 13, 'atr_threshold': 8.0, 'pt_mult': 2.5, 'sl_mult': 5.0, 'td_mins': 180}. Best is trial 226 with value: 2.6610758639085312.
[I 2026-03-12 00:49:38,959] Trial 260 finished with value: 0.0 and parameters: {'timeframe': 'M3', 'atr_period': 13, 'atr_threshold': 10.0, 'pt_mult': 5.0, 'sl_mult': 5.0, 'td_mins': 720}. Best is trial 226 with value: 2.6610758639085312.
[I 2026-03-12 00:49:39,002] Trial 261 finished with value: 0.0 and parameters: {'timeframe': 'M3', 'atr_period': 13, 'atr_threshold': 10.0, 'pt_mult': 1.0, 'sl_mult': 5.0, 'td_mins': 60}. Best is trial 226 with value: 2.6610758639085312.
[I 2026-03-12 00:49:40,181] Trial 262 finished with value: 1.0772653179037008 and parameters: {'timeframe': 'M3', 'atr_period': 13, 'atr_threshold': 3.0, 'pt_mult': 0.5, 'sl_mult': 5.0, 'td_mins': 1200}. Best is trial 226 with value: 2.6610758639085312.
[I 2026-03-12 00:49:40,230] Trial 263 finished with value: 0.0 and parameters: {'timeframe': 'M3', 'atr_period': 13, 'atr_threshold': 15.0, 'pt_mult': 2.5, 'sl_mult': 1.0, 'td_mins': 15}. Best is trial 226 with value: 2.6610758639085312.
[I 2026-03-12 00:49:40,277] Trial 264 finished with value: 0.0 and parameters: {'timeframe': 'M3', 'atr_period': 13, 'atr_threshold': 10.0, 'pt_mult': 0.5, 'sl_mult': 0.5, 'td_mins': 15}. Best is trial 226 with value: 2.6610758639085312.
[I 2026-03-12 00:49:40,322] Trial 265 finished with value: 0.0 and parameters: {'timeframe': 'M3', 'atr_period': 13, 'atr_threshold': 15.0, 'pt_mult': 0.5, 'sl_mult': 0.5, 'td_mins': 1200}. Best is trial 226 with value: 2.6610758639085312.
[I 2026-03-12 00:49:41,704] Trial 266 pruned. 
[I 2026-03-12 00:49:41,768] Trial 267 pruned. 
[I 2026-03-12 00:49:43,111] Trial 268 pruned. 
[I 2026-03-12 00:49:44,593] Trial 269 pruned. 
[I 2026-03-12 00:49:44,641] Trial 270 finished with value: 0.0 and parameters: {'timeframe': 'M3', 'atr_period': 13, 'atr_threshold': 15.0, 'pt_mult': 5.0, 'sl_mult': 2.5, 'td_mins': 30}. Best is trial 226 with value: 2.6610758639085312.
[I 2026-03-12 00:49:45,160] Trial 271 pruned. 
[I 2026-03-12 00:49:45,207] Trial 272 finished with value: 0.0 and parameters: {'timeframe': 'M3', 'atr_period': 13, 'atr_threshold': 15.0, 'pt_mult': 1.0, 'sl_mult': 1.0, 'td_mins': 5}. Best is trial 226 with value: 2.6610758639085312.
[I 2026-03-12 00:49:45,303] Trial 273 finished with value: 1.0014049349586969 and parameters: {'timeframe': 'M3', 'atr_period': 13, 'atr_threshold': 3.0, 'pt_mult': 0.5, 'sl_mult': 1.0, 'td_mins': 30}. Best is trial 226 with value: 2.6610758639085312.
[I 2026-03-12 00:49:45,348] Trial 274 finished with value: 0.0 and parameters: {'timeframe': 'M3', 'atr_period': 13, 'atr_threshold': 15.0, 'pt_mult': 5.0, 'sl_mult': 5.0, 'td_mins': 60}. Best is trial 226 with value: 2.6610758639085312.
[I 2026-03-12 00:49:45,393] Trial 275 finished with value: 0.0 and parameters: {'timeframe': 'M3', 'atr_period': 13, 'atr_threshold': 5.0, 'pt_mult': 1.0, 'sl_mult': 1.0, 'td_mins': 720}. Best is trial 226 with value: 2.6610758639085312.
[I 2026-03-12 00:49:45,438] Trial 276 finished with value: 0.0 and parameters: {'timeframe': 'M3', 'atr_period': 13, 'atr_threshold': 5.0, 'pt_mult': 5.0, 'sl_mult': 1.0, 'td_mins': 15}. Best is trial 226 with value: 2.6610758639085312.
[I 2026-03-12 00:49:45,556] Trial 277 pruned. 
[I 2026-03-12 00:49:45,604] Trial 278 finished with value: 0.0 and parameters: {'timeframe': 'M3', 'atr_period': 13, 'atr_threshold': 15.0, 'pt_mult': 5.0, 'sl_mult': 0.5, 'td_mins': 360}. Best is trial 226 with value: 2.6610758639085312.
[I 2026-03-12 00:49:45,652] Trial 279 finished with value: 0.0 and parameters: {'timeframe': 'M3', 'atr_period': 13, 'atr_threshold': 15.0, 'pt_mult': 1.0, 'sl_mult': 0.5, 'td_mins': 30}. Best is trial 226 with value: 2.6610758639085312.
[I 2026-03-12 00:49:45,804] Trial 280 pruned. 
[I 2026-03-12 00:49:45,853] Trial 281 finished with value: 0.0 and parameters: {'timeframe': 'M3', 'atr_period': 13, 'atr_threshold': 5.0, 'pt_mult': 1.0, 'sl_mult': 5.0, 'td_mins': 120}. Best is trial 226 with value: 2.6610758639085312.
[I 2026-03-12 00:49:46,112] Trial 282 pruned. 
[I 2026-03-12 00:49:47,016] Trial 283 pruned. 
[I 2026-03-12 00:49:47,069] Trial 284 finished with value: 0.0 and parameters: {'timeframe': 'M3', 'atr_period': 13, 'atr_threshold': 5.0, 'pt_mult': 0.5, 'sl_mult': 2.5, 'td_mins': 180}. Best is trial 226 with value: 2.6610758639085312.
[I 2026-03-12 00:49:47,205] Trial 285 pruned. 
[I 2026-03-12 00:49:47,270] Trial 286 finished with value: 0.0 and parameters: {'timeframe': 'M3', 'atr_period': 13, 'atr_threshold': 15.0, 'pt_mult': 0.5, 'sl_mult': 5.0, 'td_mins': 1200}. Best is trial 226 with value: 2.6610758639085312.
[I 2026-03-12 00:49:47,484] Trial 287 pruned. 
[I 2026-03-12 00:49:47,533] Trial 288 finished with value: 0.0 and parameters: {'timeframe': 'M3', 'atr_period': 13, 'atr_threshold': 10.0, 'pt_mult': 1.0, 'sl_mult': 1.0, 'td_mins': 720}. Best is trial 226 with value: 2.6610758639085312.
[I 2026-03-12 00:49:47,781] Trial 289 pruned. 
[I 2026-03-12 00:49:47,828] Trial 290 finished with value: 0.0 and parameters: {'timeframe': 'M3', 'atr_period': 13, 'atr_threshold': 15.0, 'pt_mult': 5.0, 'sl_mult': 1.0, 'td_mins': 1200}. Best is trial 226 with value: 2.6610758639085312.
[I 2026-03-12 00:49:47,874] Trial 291 finished with value: 0.0 and parameters: {'timeframe': 'M3', 'atr_period': 13, 'atr_threshold': 15.0, 'pt_mult': 1.0, 'sl_mult': 5.0, 'td_mins': 1080}. Best is trial 226 with value: 2.6610758639085312.
[I 2026-03-12 00:49:47,921] Trial 292 finished with value: 0.0 and parameters: {'timeframe': 'M3', 'atr_period': 13, 'atr_threshold': 15.0, 'pt_mult': 0.5, 'sl_mult': 2.5, 'td_mins': 60}. Best is trial 226 with value: 2.6610758639085312.
[I 2026-03-12 00:49:48,299] Trial 293 finished with value: 0.9323392421188746 and parameters: {'timeframe': 'M3', 'atr_period': 13, 'atr_threshold': 3.0, 'pt_mult': 5.0, 'sl_mult': 5.0, 'td_mins': 180}. Best is trial 226 with value: 2.6610758639085312.
[I 2026-03-12 00:49:48,654] Trial 294 pruned. 
[I 2026-03-12 00:49:48,702] Trial 295 finished with value: 0.0 and parameters: {'timeframe': 'M3', 'atr_period': 13, 'atr_threshold': 5.0, 'pt_mult': 5.0, 'sl_mult': 5.0, 'td_mins': 180}. Best is trial 226 with value: 2.6610758639085312.
[I 2026-03-12 00:49:48,746] Trial 296 finished with value: 0.0 and parameters: {'timeframe': 'M3', 'atr_period': 13, 'atr_threshold': 15.0, 'pt_mult': 5.0, 'sl_mult': 0.5, 'td_mins': 120}. Best is trial 226 with value: 2.6610758639085312.
[I 2026-03-12 00:49:48,789] Trial 297 finished with value: 0.0 and parameters: {'timeframe': 'M3', 'atr_period': 13, 'atr_threshold': 15.0, 'pt_mult': 5.0, 'sl_mult': 2.5, 'td_mins': 30}. Best is trial 226 with value: 2.6610758639085312.
[I 2026-03-12 00:49:48,834] Trial 298 finished with value: 0.0 and parameters: {'timeframe': 'M3', 'atr_period': 13, 'atr_threshold': 15.0, 'pt_mult': 0.5, 'sl_mult': 2.5, 'td_mins': 15}. Best is trial 226 with value: 2.6610758639085312.
[I 2026-03-12 00:49:48,880] Trial 299 finished with value: 0.0 and parameters: {'timeframe': 'M3', 'atr_period': 13, 'atr_threshold': 8.0, 'pt_mult': 1.0, 'sl_mult': 1.0, 'td_mins': 60}. Best is trial 226 with value: 2.6610758639085312.
[I 2026-03-12 00:49:50,816] Trial 300 finished with value: 1.1051004807795013 and parameters: {'timeframe': 'M3', 'atr_period': 13, 'atr_threshold': 2.0, 'pt_mult': 2.5, 'sl_mult': 0.5, 'td_mins': 1200}. Best is trial 226 with value: 2.6610758639085312.
[I 2026-03-12 00:49:51,082] Trial 301 finished with value: 1.7907020647597356 and parameters: {'timeframe': 'M3', 'atr_period': 13, 'atr_threshold': 3.0, 'pt_mult': 0.5, 'sl_mult': 5.0, 'td_mins': 120}. Best is trial 226 with value: 2.6610758639085312.
[I 2026-03-12 00:49:51,468] Trial 302 finished with value: 1.1815368930178622 and parameters: {'timeframe': 'M3', 'atr_period': 13, 'atr_threshold': 2.0, 'pt_mult': 2.5, 'sl_mult': 5.0, 'td_mins': 60}. Best is trial 226 with value: 2.6610758639085312.
[I 2026-03-12 00:49:53,372] Trial 303 finished with value: 1.1051004807795013 and parameters: {'timeframe': 'M3', 'atr_period': 13, 'atr_threshold': 2.0, 'pt_mult': 2.5, 'sl_mult': 0.5, 'td_mins': 1200}. Best is trial 226 with value: 2.6610758639085312.
[I 2026-03-12 00:49:53,741] Trial 304 finished with value: 1.1815368930178622 and parameters: {'timeframe': 'M3', 'atr_period': 13, 'atr_threshold': 2.0, 'pt_mult': 2.5, 'sl_mult': 5.0, 'td_mins': 60}. Best is trial 226 with value: 2.6610758639085312.
[I 2026-03-12 00:49:55,656] Trial 305 finished with value: 1.1051004807795013 and parameters: {'timeframe': 'M3', 'atr_period': 13, 'atr_threshold': 2.0, 'pt_mult': 2.5, 'sl_mult': 0.5, 'td_mins': 1200}. Best is trial 226 with value: 2.6610758639085312.
[I 2026-03-12 00:49:57,581] Trial 306 finished with value: 1.1051004807795013 and parameters: {'timeframe': 'M3', 'atr_period': 13, 'atr_threshold': 2.0, 'pt_mult': 2.5, 'sl_mult': 0.5, 'td_mins': 1200}. Best is trial 226 with value: 2.6610758639085312.
[I 2026-03-12 00:49:59,481] Trial 307 finished with value: 1.1051004807795013 and parameters: {'timeframe': 'M3', 'atr_period': 13, 'atr_threshold': 2.0, 'pt_mult': 2.5, 'sl_mult': 0.5, 'td_mins': 1200}. Best is trial 226 with value: 2.6610758639085312.
[I 2026-03-12 00:49:59,853] Trial 308 finished with value: 1.1815368930178622 and parameters: {'timeframe': 'M3', 'atr_period': 13, 'atr_threshold': 2.0, 'pt_mult': 2.5, 'sl_mult': 5.0, 'td_mins': 60}. Best is trial 226 with value: 2.6610758639085312.
[I 2026-03-12 00:50:00,235] Trial 309 finished with value: 1.1815368930178622 and parameters: {'timeframe': 'M3', 'atr_period': 13, 'atr_threshold': 2.0, 'pt_mult': 2.5, 'sl_mult': 5.0, 'td_mins': 60}. Best is trial 226 with value: 2.6610758639085312.
[I 2026-03-12 00:50:00,630] Trial 310 finished with value: 1.1815368930178622 and parameters: {'timeframe': 'M3', 'atr_period': 13, 'atr_threshold': 2.0, 'pt_mult': 2.5, 'sl_mult': 5.0, 'td_mins': 60}. Best is trial 226 with value: 2.6610758639085312.
[I 2026-03-12 00:50:01,074] Trial 311 finished with value: 1.1815368930178622 and parameters: {'timeframe': 'M3', 'atr_period': 13, 'atr_threshold': 2.0, 'pt_mult': 2.5, 'sl_mult': 5.0, 'td_mins': 60}. Best is trial 226 with value: 2.6610758639085312.
[I 2026-03-12 00:50:01,465] Trial 312 finished with value: 1.1815368930178622 and parameters: {'timeframe': 'M3', 'atr_period': 13, 'atr_threshold': 2.0, 'pt_mult': 2.5, 'sl_mult': 5.0, 'td_mins': 60}. Best is trial 226 with value: 2.6610758639085312.
[I 2026-03-12 00:50:01,854] Trial 313 finished with value: 1.1815368930178622 and parameters: {'timeframe': 'M3', 'atr_period': 13, 'atr_threshold': 2.0, 'pt_mult': 2.5, 'sl_mult': 5.0, 'td_mins': 60}. Best is trial 226 with value: 2.6610758639085312.
[I 2026-03-12 00:50:02,245] Trial 314 finished with value: 1.1815368930178622 and parameters: {'timeframe': 'M3', 'atr_period': 13, 'atr_threshold': 2.0, 'pt_mult': 2.5, 'sl_mult': 5.0, 'td_mins': 60}. Best is trial 226 with value: 2.6610758639085312.
[I 2026-03-12 00:50:02,670] Trial 315 finished with value: 1.1815368930178622 and parameters: {'timeframe': 'M3', 'atr_period': 13, 'atr_threshold': 2.0, 'pt_mult': 2.5, 'sl_mult': 5.0, 'td_mins': 60}. Best is trial 226 with value: 2.6610758639085312.
[I 2026-03-12 00:50:03,061] Trial 316 finished with value: 1.1815368930178622 and parameters: {'timeframe': 'M3', 'atr_period': 13, 'atr_threshold': 2.0, 'pt_mult': 2.5, 'sl_mult': 5.0, 'td_mins': 60}. Best is trial 226 with value: 2.6610758639085312.
[I 2026-03-12 00:50:03,368] Trial 317 finished with value: 1.7907020647597356 and parameters: {'timeframe': 'M3', 'atr_period': 13, 'atr_threshold': 3.0, 'pt_mult': 0.5, 'sl_mult': 5.0, 'td_mins': 120}. Best is trial 226 with value: 2.6610758639085312.
[I 2026-03-12 00:50:03,652] Trial 318 finished with value: 1.7907020647597356 and parameters: {'timeframe': 'M3', 'atr_period': 13, 'atr_threshold': 3.0, 'pt_mult': 0.5, 'sl_mult': 5.0, 'td_mins': 120}. Best is trial 226 with value: 2.6610758639085312.
[I 2026-03-12 00:50:03,995] Trial 319 finished with value: 1.7907020647597356 and parameters: {'timeframe': 'M3', 'atr_period': 13, 'atr_threshold': 3.0, 'pt_mult': 0.5, 'sl_mult': 5.0, 'td_mins': 120}. Best is trial 226 with value: 2.6610758639085312.
[I 2026-03-12 00:50:04,230] Trial 320 finished with value: 1.7907020647597356 and parameters: {'timeframe': 'M3', 'atr_period': 13, 'atr_threshold': 3.0, 'pt_mult': 0.5, 'sl_mult': 5.0, 'td_mins': 120}. Best is trial 226 with value: 2.6610758639085312.
[I 2026-03-12 00:50:04,478] Trial 321 finished with value: 1.7907020647597356 and parameters: {'timeframe': 'M3', 'atr_period': 13, 'atr_threshold': 3.0, 'pt_mult': 0.5, 'sl_mult': 5.0, 'td_mins': 120}. Best is trial 226 with value: 2.6610758639085312.
[I 2026-03-12 00:50:04,724] Trial 322 finished with value: 1.7907020647597356 and parameters: {'timeframe': 'M3', 'atr_period': 13, 'atr_threshold': 3.0, 'pt_mult': 0.5, 'sl_mult': 5.0, 'td_mins': 120}. Best is trial 226 with value: 2.6610758639085312.
[I 2026-03-12 00:50:04,954] Trial 323 finished with value: 1.7907020647597356 and parameters: {'timeframe': 'M3', 'atr_period': 13, 'atr_threshold': 3.0, 'pt_mult': 0.5, 'sl_mult': 5.0, 'td_mins': 120}. Best is trial 226 with value: 2.6610758639085312.
[I 2026-03-12 00:50:05,246] Trial 324 finished with value: 1.7907020647597356 and parameters: {'timeframe': 'M3', 'atr_period': 13, 'atr_threshold': 3.0, 'pt_mult': 0.5, 'sl_mult': 5.0, 'td_mins': 120}. Best is trial 226 with value: 2.6610758639085312.
[I 2026-03-12 00:50:05,474] Trial 325 finished with value: 1.7907020647597356 and parameters: {'timeframe': 'M3', 'atr_period': 13, 'atr_threshold': 3.0, 'pt_mult': 0.5, 'sl_mult': 5.0, 'td_mins': 120}. Best is trial 226 with value: 2.6610758639085312.
[I 2026-03-12 00:50:05,733] Trial 326 finished with value: 1.7907020647597356 and parameters: {'timeframe': 'M3', 'atr_period': 13, 'atr_threshold': 3.0, 'pt_mult': 0.5, 'sl_mult': 5.0, 'td_mins': 120}. Best is trial 226 with value: 2.6610758639085312.
[I 2026-03-12 00:50:06,002] Trial 327 finished with value: 1.7907020647597356 and parameters: {'timeframe': 'M3', 'atr_period': 13, 'atr_threshold': 3.0, 'pt_mult': 0.5, 'sl_mult': 5.0, 'td_mins': 120}. Best is trial 226 with value: 2.6610758639085312.
[I 2026-03-12 00:50:06,278] Trial 328 finished with value: 1.7907020647597356 and parameters: {'timeframe': 'M3', 'atr_period': 13, 'atr_threshold': 3.0, 'pt_mult': 0.5, 'sl_mult': 5.0, 'td_mins': 120}. Best is trial 226 with value: 2.6610758639085312.
[I 2026-03-12 00:50:06,549] Trial 329 finished with value: 1.7907020647597356 and parameters: {'timeframe': 'M3', 'atr_period': 13, 'atr_threshold': 3.0, 'pt_mult': 0.5, 'sl_mult': 5.0, 'td_mins': 120}. Best is trial 226 with value: 2.6610758639085312.
[I 2026-03-12 00:50:06,818] Trial 330 finished with value: 1.7907020647597356 and parameters: {'timeframe': 'M3', 'atr_period': 13, 'atr_threshold': 3.0, 'pt_mult': 0.5, 'sl_mult': 5.0, 'td_mins': 120}. Best is trial 226 with value: 2.6610758639085312.
[I 2026-03-12 00:50:07,076] Trial 331 finished with value: 1.7907020647597356 and parameters: {'timeframe': 'M3', 'atr_period': 13, 'atr_threshold': 3.0, 'pt_mult': 0.5, 'sl_mult': 5.0, 'td_mins': 120}. Best is trial 226 with value: 2.6610758639085312.
