[I 2026-03-12 01:17:48,654] Trial 273 pruned. 
[I 2026-03-12 01:17:48,816] Trial 274 pruned. 
[I 2026-03-12 01:17:48,984] Trial 275 finished with value: 0.0 and parameters: {'timeframe': 'mixed', 'atr_period': 13, 'atr_threshold': 15.0, 'pt_mult': 0.5, 'sl_mult': 2.5, 'td_mins': 15}. Best is trial 111 with value: 1.901343006707687.
[I 2026-03-12 01:17:49,411] Trial 276 pruned. 
[I 2026-03-12 01:17:51,613] Trial 277 finished with value: 1.2986994976853166 and parameters: {'timeframe': 'mixed', 'atr_period': 13, 'atr_threshold': 1.0, 'pt_mult': 1.0, 'sl_mult': 5.0, 'td_mins': 60}. Best is trial 111 with value: 1.901343006707687.
[I 2026-03-12 01:17:51,896] Trial 278 pruned. 
[I 2026-03-12 01:17:52,065] Trial 279 finished with value: 0.0 and parameters: {'timeframe': 'mixed', 'atr_period': 13, 'atr_threshold': 15.0, 'pt_mult': 0.5, 'sl_mult': 0.5, 'td_mins': 360}. Best is trial 111 with value: 1.901343006707687.
[I 2026-03-12 01:17:52,181] Trial 280 pruned. 
[I 2026-03-12 01:17:52,291] Trial 281 pruned. 
[I 2026-03-12 01:17:52,470] Trial 282 finished with value: 0.0 and parameters: {'timeframe': 'mixed', 'atr_period': 13, 'atr_threshold': 10.0, 'pt_mult': 0.5, 'sl_mult': 0.5, 'td_mins': 180}. Best is trial 111 with value: 1.901343006707687.
[I 2026-03-12 01:17:54,052] Trial 283 pruned. 
[I 2026-03-12 01:17:58,992] Trial 284 pruned. 
[I 2026-03-12 01:17:59,114] Trial 285 pruned. 
[I 2026-03-12 01:17:59,255] Trial 286 pruned. 
[I 2026-03-12 01:18:01,349] Trial 287 pruned. 
[I 2026-03-12 01:18:01,867] Trial 288 pruned. 
[I 2026-03-12 01:18:04,244] Trial 289 pruned. 
[I 2026-03-12 01:18:04,362] Trial 290 pruned. 
[I 2026-03-12 01:18:04,607] Trial 291 finished with value: 1.326701338781918 and parameters: {'timeframe': 'mixed', 'atr_period': 13, 'atr_threshold': 5.0, 'pt_mult': 1.0, 'sl_mult': 5.0, 'td_mins': 60}. Best is trial 111 with value: 1.901343006707687.
[I 2026-03-12 01:18:04,769] Trial 292 finished with value: 0.0 and parameters: {'timeframe': 'mixed', 'atr_period': 13, 'atr_threshold': 15.0, 'pt_mult': 2.5, 'sl_mult': 1.0, 'td_mins': 120}. Best is trial 111 with value: 1.901343006707687.
[I 2026-03-12 01:18:04,970] Trial 293 finished with value: 1.3881073172410645 and parameters: {'timeframe': 'mixed', 'atr_period': 13, 'atr_threshold': 5.0, 'pt_mult': 0.5, 'sl_mult': 5.0, 'td_mins': 15}. Best is trial 111 with value: 1.901343006707687.
[I 2026-03-12 01:18:05,141] Trial 294 finished with value: 0.0 and parameters: {'timeframe': 'mixed', 'atr_period': 13, 'atr_threshold': 10.0, 'pt_mult': 5.0, 'sl_mult': 1.0, 'td_mins': 1200}. Best is trial 111 with value: 1.901343006707687.
[I 2026-03-12 01:18:05,438] Trial 295 pruned. 
[I 2026-03-12 01:18:06,439] Trial 296 pruned. 
[I 2026-03-12 01:18:06,545] Trial 297 pruned. 
[I 2026-03-12 01:18:06,951] Trial 298 pruned. 
[I 2026-03-12 01:18:07,118] Trial 299 finished with value: 0.0 and parameters: {'timeframe': 'mixed', 'atr_period': 13, 'atr_threshold': 10.0, 'pt_mult': 5.0, 'sl_mult': 1.0, 'td_mins': 1080}. Best is trial 111 with value: 1.901343006707687.
[I 2026-03-12 01:18:07,882] Trial 300 finished with value: 1.2509770181810493 and parameters: {'timeframe': 'mixed', 'atr_period': 13, 'atr_threshold': 3.0, 'pt_mult': 0.5, 'sl_mult': 2.5, 'td_mins': 120}. Best is trial 111 with value: 1.901343006707687.
[I 2026-03-12 01:18:08,533] Trial 301 finished with value: 1.161882455721618 and parameters: {'timeframe': 'mixed', 'atr_period': 13, 'atr_threshold': 2.0, 'pt_mult': 0.5, 'sl_mult': 2.5, 'td_mins': 30}. Best is trial 111 with value: 1.901343006707687.
[I 2026-03-12 01:18:09,504] Trial 302 finished with value: 1.1716594167659165 and parameters: {'timeframe': 'mixed', 'atr_period': 13, 'atr_threshold': 2.0, 'pt_mult': 0.5, 'sl_mult': 2.5, 'td_mins': 60}. Best is trial 111 with value: 1.901343006707687.
[I 2026-03-12 01:18:10,197] Trial 303 finished with value: 1.161882455721618 and parameters: {'timeframe': 'mixed', 'atr_period': 13, 'atr_threshold': 2.0, 'pt_mult': 0.5, 'sl_mult': 2.5, 'td_mins': 30}. Best is trial 111 with value: 1.901343006707687.
[I 2026-03-12 01:18:11,072] Trial 304 finished with value: 1.2509770181810493 and parameters: {'timeframe': 'mixed', 'atr_period': 13, 'atr_threshold': 3.0, 'pt_mult': 0.5, 'sl_mult': 2.5, 'td_mins': 120}. Best is trial 111 with value: 1.901343006707687.
[I 2026-03-12 01:18:11,870] Trial 305 finished with value: 1.2509770181810493 and parameters: {'timeframe': 'mixed', 'atr_period': 13, 'atr_threshold': 3.0, 'pt_mult': 0.5, 'sl_mult': 2.5, 'td_mins': 120}. Best is trial 111 with value: 1.901343006707687.
[I 2026-03-12 01:18:12,594] Trial 306 finished with value: 1.161882455721618 and parameters: {'timeframe': 'mixed', 'atr_period': 13, 'atr_threshold': 2.0, 'pt_mult': 0.5, 'sl_mult': 2.5, 'td_mins': 30}. Best is trial 111 with value: 1.901343006707687.
[I 2026-03-12 01:18:13,375] Trial 307 finished with value: 1.2509770181810493 and parameters: {'timeframe': 'mixed', 'atr_period': 13, 'atr_threshold': 3.0, 'pt_mult': 0.5, 'sl_mult': 2.5, 'td_mins': 120}. Best is trial 111 with value: 1.901343006707687.
[I 2026-03-12 01:18:14,181] Trial 308 finished with value: 1.2509770181810493 and parameters: {'timeframe': 'mixed', 'atr_period': 13, 'atr_threshold': 3.0, 'pt_mult': 0.5, 'sl_mult': 2.5, 'td_mins': 120}. Best is trial 111 with value: 1.901343006707687.
[I 2026-03-12 01:18:14,994] Trial 309 finished with value: 1.2509770181810493 and parameters: {'timeframe': 'mixed', 'atr_period': 13, 'atr_threshold': 3.0, 'pt_mult': 0.5, 'sl_mult': 2.5, 'td_mins': 120}. Best is trial 111 with value: 1.901343006707687.
[I 2026-03-12 01:18:15,766] Trial 310 finished with value: 1.2509770181810493 and parameters: {'timeframe': 'mixed', 'atr_period': 13, 'atr_threshold': 3.0, 'pt_mult': 0.5, 'sl_mult': 2.5, 'td_mins': 120}. Best is trial 111 with value: 1.901343006707687.
[I 2026-03-12 01:18:16,551] Trial 311 finished with value: 1.2509770181810493 and parameters: {'timeframe': 'mixed', 'atr_period': 13, 'atr_threshold': 3.0, 'pt_mult': 0.5, 'sl_mult': 2.5, 'td_mins': 120}. Best is trial 111 with value: 1.901343006707687.
[I 2026-03-12 01:18:17,335] Trial 312 finished with value: 1.2509770181810493 and parameters: {'timeframe': 'mixed', 'atr_period': 13, 'atr_threshold': 3.0, 'pt_mult': 0.5, 'sl_mult': 2.5, 'td_mins': 120}. Best is trial 111 with value: 1.901343006707687.
[I 2026-03-12 01:18:18,171] Trial 313 finished with value: 1.2509770181810493 and parameters: {'timeframe': 'mixed', 'atr_period': 13, 'atr_threshold': 3.0, 'pt_mult': 0.5, 'sl_mult': 2.5, 'td_mins': 120}. Best is trial 111 with value: 1.901343006707687.
[I 2026-03-12 01:18:18,902] Trial 314 finished with value: 1.2509770181810493 and parameters: {'timeframe': 'mixed', 'atr_period': 13, 'atr_threshold': 3.0, 'pt_mult': 0.5, 'sl_mult': 2.5, 'td_mins': 120}. Best is trial 111 with value: 1.901343006707687.
[I 2026-03-12 01:18:19,623] Trial 315 finished with value: 1.2509770181810493 and parameters: {'timeframe': 'mixed', 'atr_period': 13, 'atr_threshold': 3.0, 'pt_mult': 0.5, 'sl_mult': 2.5, 'td_mins': 120}. Best is trial 111 with value: 1.901343006707687.
[I 2026-03-12 01:18:20,363] Trial 316 finished with value: 1.2509770181810493 and parameters: {'timeframe': 'mixed', 'atr_period': 13, 'atr_threshold': 3.0, 'pt_mult': 0.5, 'sl_mult': 2.5, 'td_mins': 120}. Best is trial 111 with value: 1.901343006707687.
[I 2026-03-12 01:18:21,081] Trial 317 finished with value: 1.2509770181810493 and parameters: {'timeframe': 'mixed', 'atr_period': 13, 'atr_threshold': 3.0, 'pt_mult': 0.5, 'sl_mult': 2.5, 'td_mins': 120}. Best is trial 111 with value: 1.901343006707687.
[I 2026-03-12 01:18:21,278] Trial 318 finished with value: 1.3881073172410645 and parameters: {'timeframe': 'mixed', 'atr_period': 13, 'atr_threshold': 5.0, 'pt_mult': 0.5, 'sl_mult': 5.0, 'td_mins': 15}. Best is trial 111 with value: 1.901343006707687.
[I 2026-03-12 01:18:23,511] Trial 319 finished with value: 1.2986994976853166 and parameters: {'timeframe': 'mixed', 'atr_period': 13, 'atr_threshold': 1.0, 'pt_mult': 1.0, 'sl_mult': 5.0, 'td_mins': 60}. Best is trial 111 with value: 1.901343006707687.
[I 2026-03-12 01:18:25,723] Trial 320 finished with value: 1.2986994976853166 and parameters: {'timeframe': 'mixed', 'atr_period': 13, 'atr_threshold': 1.0, 'pt_mult': 1.0, 'sl_mult': 5.0, 'td_mins': 60}. Best is trial 111 with value: 1.901343006707687.
[I 2026-03-12 01:18:27,956] Trial 321 finished with value: 1.2986994976853166 and parameters: {'timeframe': 'mixed', 'atr_period': 13, 'atr_threshold': 1.0, 'pt_mult': 1.0, 'sl_mult': 5.0, 'td_mins': 60}. Best is trial 111 with value: 1.901343006707687.
[I 2026-03-12 01:18:29,777] Trial 322 finished with value: 1.256423319090118 and parameters: {'timeframe': 'mixed', 'atr_period': 13, 'atr_threshold': 0.5, 'pt_mult': 0.5, 'sl_mult': 5.0, 'td_mins': 30}. Best is trial 111 with value: 1.901343006707687.
[I 2026-03-12 01:18:32,087] Trial 323 finished with value: 1.2986994976853166 and parameters: {'timeframe': 'mixed', 'atr_period': 13, 'atr_threshold': 1.0, 'pt_mult': 1.0, 'sl_mult': 5.0, 'td_mins': 60}. Best is trial 111 with value: 1.901343006707687.
[I 2026-03-12 01:18:34,403] Trial 324 finished with value: 1.2986994976853166 and parameters: {'timeframe': 'mixed', 'atr_period': 13, 'atr_threshold': 1.0, 'pt_mult': 1.0, 'sl_mult': 5.0, 'td_mins': 60}. Best is trial 111 with value: 1.901343006707687.
[I 2026-03-12 01:18:36,639] Trial 325 finished with value: 1.2986994976853166 and parameters: {'timeframe': 'mixed', 'atr_period': 13, 'atr_threshold': 1.0, 'pt_mult': 1.0, 'sl_mult': 5.0, 'td_mins': 60}. Best is trial 111 with value: 1.901343006707687.
[I 2026-03-12 01:18:38,883] Trial 326 finished with value: 1.2986994976853166 and parameters: {'timeframe': 'mixed', 'atr_period': 13, 'atr_threshold': 1.0, 'pt_mult': 1.0, 'sl_mult': 5.0, 'td_mins': 60}. Best is trial 111 with value: 1.901343006707687.
[I 2026-03-12 01:18:41,147] Trial 327 finished with value: 1.2986994976853166 and parameters: {'timeframe': 'mixed', 'atr_period': 13, 'atr_threshold': 1.0, 'pt_mult': 1.0, 'sl_mult': 5.0, 'td_mins': 60}. Best is trial 111 with value: 1.901343006707687.
[I 2026-03-12 01:18:43,404] Trial 328 finished with value: 1.2986994976853166 and parameters: {'timeframe': 'mixed', 'atr_period': 13, 'atr_threshold': 1.0, 'pt_mult': 1.0, 'sl_mult': 5.0, 'td_mins': 60}. Best is trial 111 with value: 1.901343006707687.
[I 2026-03-12 01:18:45,595] Trial 329 finished with value: 1.2986994976853166 and parameters: {'timeframe': 'mixed', 'atr_period': 13, 'atr_threshold': 1.0, 'pt_mult': 1.0, 'sl_mult': 5.0, 'td_mins': 60}. Best is trial 111 with value: 1.901343006707687.
[I 2026-03-12 01:18:47,847] Trial 330 finished with value: 1.2986994976853166 and parameters: {'timeframe': 'mixed', 'atr_period': 13, 'atr_threshold': 1.0, 'pt_mult': 1.0, 'sl_mult': 5.0, 'td_mins': 60}. Best is trial 111 with value: 1.901343006707687.
[I 2026-03-12 01:18:50,084] Trial 331 finished with value: 1.2986994976853166 and parameters: {'timeframe': 'mixed', 'atr_period': 13, 'atr_threshold': 1.0, 'pt_mult': 1.0, 'sl_mult': 5.0, 'td_mins': 60}. Best is trial 111 with value: 1.901343006707687.
[I 2026-03-12 01:18:52,340] Trial 332 finished with value: 1.2986994976853166 and parameters: {'timeframe': 'mixed', 'atr_period': 13, 'atr_threshold': 1.0, 'pt_mult': 1.0, 'sl_mult': 5.0, 'td_mins': 60}. Best is trial 111 with value: 1.901343006707687.
[I 2026-03-12 01:18:54,629] Trial 333 finished with value: 1.2986994976853166 and parameters: {'timeframe': 'mixed', 'atr_period': 13, 'atr_threshold': 1.0, 'pt_mult': 1.0, 'sl_mult': 5.0, 'td_mins': 60}. Best is trial 111 with value: 1.901343006707687.
[I 2026-03-12 01:18:56,818] Trial 334 finished with value: 1.2986994976853166 and parameters: {'timeframe': 'mixed', 'atr_period': 13, 'atr_threshold': 1.0, 'pt_mult': 1.0, 'sl_mult': 5.0, 'td_mins': 60}. Best is trial 111 with value: 1.901343006707687.
[I 2026-03-12 01:18:57,015] Trial 335 finished with value: 1.3881073172410645 and parameters: {'timeframe': 'mixed', 'atr_period': 13, 'atr_threshold': 5.0, 'pt_mult': 0.5, 'sl_mult': 5.0, 'td_mins': 15}. Best is trial 111 with value: 1.901343006707687.
[I 2026-03-12 01:18:57,210] Trial 336 finished with value: 1.3881073172410645 and parameters: {'timeframe': 'mixed', 'atr_period': 13, 'atr_threshold': 5.0, 'pt_mult': 0.5, 'sl_mult': 5.0, 'td_mins': 15}. Best is trial 111 with value: 1.901343006707687.
[I 2026-03-12 01:18:57,428] Trial 337 finished with value: 1.3881073172410645 and parameters: {'timeframe': 'mixed', 'atr_period': 13, 'atr_threshold': 5.0, 'pt_mult': 0.5, 'sl_mult': 5.0, 'td_mins': 15}. Best is trial 111 with value: 1.901343006707687.
[I 2026-03-12 01:18:57,646] Trial 338 finished with value: 1.3881073172410645 and parameters: {'timeframe': 'mixed', 'atr_period': 13, 'atr_threshold': 5.0, 'pt_mult': 0.5, 'sl_mult': 5.0, 'td_mins': 15}. Best is trial 111 with value: 1.901343006707687.
[I 2026-03-12 01:18:57,843] Trial 339 finished with value: 1.3881073172410645 and parameters: {'timeframe': 'mixed', 'atr_period': 13, 'atr_threshold': 5.0, 'pt_mult': 0.5, 'sl_mult': 5.0, 'td_mins': 15}. Best is trial 111 with value: 1.901343006707687.
[I 2026-03-12 01:18:58,038] Trial 340 finished with value: 1.3881073172410645 and parameters: {'timeframe': 'mixed', 'atr_period': 13, 'atr_threshold': 5.0, 'pt_mult': 0.5, 'sl_mult': 5.0, 'td_mins': 15}. Best is trial 111 with value: 1.901343006707687.
[I 2026-03-12 01:18:58,232] Trial 341 finished with value: 1.3881073172410645 and parameters: {'timeframe': 'mixed', 'atr_period': 13, 'atr_threshold': 5.0, 'pt_mult': 0.5, 'sl_mult': 5.0, 'td_mins': 15}. Best is trial 111 with value: 1.901343006707687.
[I 2026-03-12 01:18:58,429] Trial 342 finished with value: 1.3881073172410645 and parameters: {'timeframe': 'mixed', 'atr_period': 13, 'atr_threshold': 5.0, 'pt_mult': 0.5, 'sl_mult': 5.0, 'td_mins': 15}. Best is trial 111 with value: 1.901343006707687.
[I 2026-03-12 01:18:58,623] Trial 343 finished with value: 1.3881073172410645 and parameters: {'timeframe': 'mixed', 'atr_period': 13, 'atr_threshold': 5.0, 'pt_mult': 0.5, 'sl_mult': 5.0, 'td_mins': 15}. Best is trial 111 with value: 1.901343006707687.
[I 2026-03-12 01:18:58,822] Trial 344 finished with value: 1.3881073172410645 and parameters: {'timeframe': 'mixed', 'atr_period': 13, 'atr_threshold': 5.0, 'pt_mult': 0.5, 'sl_mult': 5.0, 'td_mins': 15}. Best is trial 111 with value: 1.901343006707687.
[I 2026-03-12 01:18:59,015] Trial 345 finished with value: 1.3881073172410645 and parameters: {'timeframe': 'mixed', 'atr_period': 13, 'atr_threshold': 5.0, 'pt_mult': 0.5, 'sl_mult': 5.0, 'td_mins': 15}. Best is trial 111 with value: 1.901343006707687.
[I 2026-03-12 01:18:59,214] Trial 346 finished with value: 1.3881073172410645 and parameters: {'timeframe': 'mixed', 'atr_period': 13, 'atr_threshold': 5.0, 'pt_mult': 0.5, 'sl_mult': 5.0, 'td_mins': 15}. Best is trial 111 with value: 1.901343006707687.
[I 2026-03-12 01:18:59,409] Trial 347 finished with value: 1.3881073172410645 and parameters: {'timeframe': 'mixed', 'atr_period': 13, 'atr_threshold': 5.0, 'pt_mult': 0.5, 'sl_mult': 5.0, 'td_mins': 15}. Best is trial 111 with value: 1.901343006707687.
[I 2026-03-12 01:18:59,603] Trial 348 finished with value: 1.3881073172410645 and parameters: {'timeframe': 'mixed', 'atr_period': 13, 'atr_threshold': 5.0, 'pt_mult': 0.5, 'sl_mult': 5.0, 'td_mins': 15}. Best is trial 111 with value: 1.901343006707687.
[I 2026-03-12 01:18:59,804] Trial 349 finished with value: 1.3881073172410645 and parameters: {'timeframe': 'mixed', 'atr_period': 13, 'atr_threshold': 5.0, 'pt_mult': 0.5, 'sl_mult': 5.0, 'td_mins': 15}. Best is trial 111 with value: 1.901343006707687.
[I 2026-03-12 01:19:00,002] Trial 350 finished with value: 1.3881073172410645 and parameters: {'timeframe': 'mixed', 'atr_period': 13, 'atr_threshold': 5.0, 'pt_mult': 0.5, 'sl_mult': 5.0, 'td_mins': 15}. Best is trial 111 with value: 1.901343006707687.
[I 2026-03-12 01:19:00,216] Trial 351 finished with value: 1.3881073172410645 and parameters: {'timeframe': 'mixed', 'atr_period': 13, 'atr_threshold': 5.0, 'pt_mult': 0.5, 'sl_mult': 5.0, 'td_mins': 15}. Best is trial 111 with value: 1.901343006707687.
[I 2026-03-12 01:19:01,059] Trial 352 finished with value: 1.7154922913036164 and parameters: {'timeframe': 'mixed', 'atr_period': 13, 'atr_threshold': 3.0, 'pt_mult': 1.0, 'sl_mult': 5.0, 'td_mins': 120}. Best is trial 111 with value: 1.901343006707687.
[I 2026-03-12 01:19:01,928] Trial 353 finished with value: 1.7154922913036164 and parameters: {'timeframe': 'mixed', 'atr_period': 13, 'atr_threshold': 3.0, 'pt_mult': 1.0, 'sl_mult': 5.0, 'td_mins': 120}. Best is trial 111 with value: 1.901343006707687.
[I 2026-03-12 01:19:02,134] Trial 354 finished with value: 1.815519643729255 and parameters: {'timeframe': 'mixed', 'atr_period': 13, 'atr_threshold': 5.0, 'pt_mult': 0.5, 'sl_mult': 5.0, 'td_mins': 30}. Best is trial 111 with value: 1.901343006707687.
[I 2026-03-12 01:19:02,360] Trial 355 finished with value: 1.815519643729255 and parameters: {'timeframe': 'mixed', 'atr_period': 13, 'atr_threshold': 5.0, 'pt_mult': 0.5, 'sl_mult': 5.0, 'td_mins': 30}. Best is trial 111 with value: 1.901343006707687.
[I 2026-03-12 01:19:03,231] Trial 356 finished with value: 1.7154922913036164 and parameters: {'timeframe': 'mixed', 'atr_period': 13, 'atr_threshold': 3.0, 'pt_mult': 1.0, 'sl_mult': 5.0, 'td_mins': 120}. Best is trial 111 with value: 1.901343006707687.
[I 2026-03-12 01:19:05,523] Trial 357 finished with value: 1.4736445410959171 and parameters: {'timeframe': 'mixed', 'atr_period': 13, 'atr_threshold': 2.0, 'pt_mult': 1.0, 'sl_mult': 5.0, 'td_mins': 180}. Best is trial 111 with value: 1.901343006707687.
[I 2026-03-12 01:19:06,396] Trial 358 finished with value: 1.7154922913036164 and parameters: {'timeframe': 'mixed', 'atr_period': 13, 'atr_threshold': 3.0, 'pt_mult': 1.0, 'sl_mult': 5.0, 'td_mins': 120}. Best is trial 111 with value: 1.901343006707687.
[I 2026-03-12 01:19:07,320] Trial 359 finished with value: 1.7154922913036164 and parameters: {'timeframe': 'mixed', 'atr_period': 13, 'atr_threshold': 3.0, 'pt_mult': 1.0, 'sl_mult': 5.0, 'td_mins': 120}. Best is trial 111 with value: 1.901343006707687.
[I 2026-03-12 01:19:08,266] Trial 360 finished with value: 1.7154922913036164 and parameters: {'timeframe': 'mixed', 'atr_period': 13, 'atr_threshold': 3.0, 'pt_mult': 1.0, 'sl_mult': 5.0, 'td_mins': 120}. Best is trial 111 with value: 1.901343006707687.
[I 2026-03-12 01:19:09,135] Trial 361 finished with value: 1.7154922913036164 and parameters: {'timeframe': 'mixed', 'atr_period': 13, 'atr_threshold': 3.0, 'pt_mult': 1.0, 'sl_mult': 5.0, 'td_mins': 120}. Best is trial 111 with value: 1.901343006707687.
[I 2026-03-12 01:19:09,967] Trial 362 finished with value: 1.7154922913036164 and parameters: {'timeframe': 'mixed', 'atr_period': 13, 'atr_threshold': 3.0, 'pt_mult': 1.0, 'sl_mult': 5.0, 'td_mins': 120}. Best is trial 111 with value: 1.901343006707687.
[I 2026-03-12 01:19:10,828] Trial 363 finished with value: 1.7154922913036164 and parameters: {'timeframe': 'mixed', 'atr_period': 13, 'atr_threshold': 3.0, 'pt_mult': 1.0, 'sl_mult': 5.0, 'td_mins': 120}. Best is trial 111 with value: 1.901343006707687.
[I 2026-03-12 01:19:11,671] Trial 364 finished with value: 1.7154922913036164 and parameters: {'timeframe': 'mixed', 'atr_period': 13, 'atr_threshold': 3.0, 'pt_mult': 1.0, 'sl_mult': 5.0, 'td_mins': 120}. Best is trial 111 with value: 1.901343006707687.
[I 2026-03-12 01:19:12,549] Trial 365 finished with value: 1.7154922913036164 and parameters: {'timeframe': 'mixed', 'atr_period': 13, 'atr_threshold': 3.0, 'pt_mult': 1.0, 'sl_mult': 5.0, 'td_mins': 120}. Best is trial 111 with value: 1.901343006707687.
[I 2026-03-12 01:19:13,412] Trial 366 finished with value: 1.7154922913036164 and parameters: {'timeframe': 'mixed', 'atr_period': 13, 'atr_threshold': 3.0, 'pt_mult': 1.0, 'sl_mult': 5.0, 'td_mins': 120}. Best is trial 111 with value: 1.901343006707687.
[I 2026-03-12 01:19:14,267] Trial 367 finished with value: 1.7154922913036164 and parameters: {'timeframe': 'mixed', 'atr_period': 13, 'atr_threshold': 3.0, 'pt_mult': 1.0, 'sl_mult': 5.0, 'td_mins': 120}. Best is trial 111 with value: 1.901343006707687.
[I 2026-03-12 01:19:15,142] Trial 368 finished with value: 1.7154922913036164 and parameters: {'timeframe': 'mixed', 'atr_period': 13, 'atr_threshold': 3.0, 'pt_mult': 1.0, 'sl_mult': 5.0, 'td_mins': 120}. Best is trial 111 with value: 1.901343006707687.
[I 2026-03-12 01:19:16,009] Trial 369 finished with value: 1.7154922913036164 and parameters: {'timeframe': 'mixed', 'atr_period': 13, 'atr_threshold': 3.0, 'pt_mult': 1.0, 'sl_mult': 5.0, 'td_mins': 120}. Best is trial 111 with value: 1.901343006707687.
[I 2026-03-12 01:19:16,874] Trial 370 finished with value: 1.7154922913036164 and parameters: {'timeframe': 'mixed', 'atr_period': 13, 'atr_threshold': 3.0, 'pt_mult': 1.0, 'sl_mult': 5.0, 'td_mins': 120}. Best is trial 111 with value: 1.901343006707687.
[I 2026-03-12 01:19:17,804] Trial 371 finished with value: 1.7154922913036164 and parameters: {'timeframe': 'mixed', 'atr_period': 13, 'atr_threshold': 3.0, 'pt_mult': 1.0, 'sl_mult': 5.0, 'td_mins': 120}. Best is trial 111 with value: 1.901343006707687.
[I 2026-03-12 01:19:18,725] Trial 372 finished with value: 1.7154922913036164 and parameters: {'timeframe': 'mixed', 'atr_period': 13, 'atr_threshold': 3.0, 'pt_mult': 1.0, 'sl_mult': 5.0, 'td_mins': 120}. Best is trial 111 with value: 1.901343006707687.
[I 2026-03-12 01:19:19,642] Trial 373 finished with value: 1.7154922913036164 and parameters: {'timeframe': 'mixed', 'atr_period': 13, 'atr_threshold': 3.0, 'pt_mult': 1.0, 'sl_mult': 5.0, 'td_mins': 120}. Best is trial 111 with value: 1.901343006707687.
