[I 2026-03-12 00:51:48,270] Trial 858 pruned. 
[I 2026-03-12 00:51:48,395] Trial 859 finished with value: 2.6610758639085312 and parameters: {'timeframe': 'M3', 'atr_period': 13, 'atr_threshold': 3.0, 'pt_mult': 0.5, 'sl_mult': 5.0, 'td_mins': 30}. Best is trial 226 with value: 2.6610758639085312.
[I 2026-03-12 00:51:48,452] Trial 860 pruned. 
[I 2026-03-12 00:51:48,512] Trial 861 pruned. 
[I 2026-03-12 00:51:48,665] Trial 862 pruned. 
[I 2026-03-12 00:51:48,722] Trial 863 pruned. 
[I 2026-03-12 00:51:48,906] Trial 864 pruned. 
[I 2026-03-12 00:51:49,027] Trial 865 finished with value: 2.6610758639085312 and parameters: {'timeframe': 'M3', 'atr_period': 13, 'atr_threshold': 3.0, 'pt_mult': 0.5, 'sl_mult': 5.0, 'td_mins': 30}. Best is trial 226 with value: 2.6610758639085312.
[I 2026-03-12 00:51:49,168] Trial 866 pruned. 
[I 2026-03-12 00:51:49,221] Trial 867 pruned. 
[I 2026-03-12 00:51:49,344] Trial 868 finished with value: 2.6610758639085312 and parameters: {'timeframe': 'M3', 'atr_period': 13, 'atr_threshold': 3.0, 'pt_mult': 0.5, 'sl_mult': 5.0, 'td_mins': 30}. Best is trial 226 with value: 2.6610758639085312.
[I 2026-03-12 00:51:49,592] Trial 869 pruned. 
[I 2026-03-12 00:51:49,678] Trial 870 pruned. 
[I 2026-03-12 00:51:49,784] Trial 871 pruned. 
[I 2026-03-12 00:51:49,841] Trial 872 pruned. 
[I 2026-03-12 00:51:49,975] Trial 873 pruned. 
[I 2026-03-12 00:51:50,142] Trial 874 finished with value: 2.6610758639085312 and parameters: {'timeframe': 'M3', 'atr_period': 13, 'atr_threshold': 3.0, 'pt_mult': 0.5, 'sl_mult': 5.0, 'td_mins': 30}. Best is trial 226 with value: 2.6610758639085312.
[I 2026-03-12 00:51:50,237] Trial 875 pruned. 
[I 2026-03-12 00:51:50,362] Trial 876 finished with value: 2.6610758639085312 and parameters: {'timeframe': 'M3', 'atr_period': 13, 'atr_threshold': 3.0, 'pt_mult': 0.5, 'sl_mult': 5.0, 'td_mins': 30}. Best is trial 226 with value: 2.6610758639085312.
[I 2026-03-12 00:51:50,467] Trial 877 pruned. 
[I 2026-03-12 00:51:51,233] Trial 878 pruned. 
[I 2026-03-12 00:51:51,292] Trial 879 pruned. 
[I 2026-03-12 00:51:51,349] Trial 880 finished with value: 0.0 and parameters: {'timeframe': 'M3', 'atr_period': 13, 'atr_threshold': 10.0, 'pt_mult': 5.0, 'sl_mult': 2.5, 'td_mins': 1200}. Best is trial 226 with value: 2.6610758639085312.
[I 2026-03-12 00:51:51,434] Trial 881 pruned. 
[I 2026-03-12 00:51:51,488] Trial 882 pruned. 
[I 2026-03-12 00:51:51,654] Trial 883 finished with value: 2.4718369634519943 and parameters: {'timeframe': 'M3', 'atr_period': 13, 'atr_threshold': 3.0, 'pt_mult': 0.5, 'sl_mult': 5.0, 'td_mins': 60}. Best is trial 226 with value: 2.6610758639085312.
[I 2026-03-12 00:51:51,900] Trial 884 pruned. 
[I 2026-03-12 00:51:52,016] Trial 885 finished with value: 2.6610758639085312 and parameters: {'timeframe': 'M3', 'atr_period': 13, 'atr_threshold': 3.0, 'pt_mult': 0.5, 'sl_mult': 5.0, 'td_mins': 30}. Best is trial 226 with value: 2.6610758639085312.
[I 2026-03-12 00:51:52,079] Trial 886 pruned. 
[I 2026-03-12 00:51:52,130] Trial 887 finished with value: 0.0 and parameters: {'timeframe': 'M3', 'atr_period': 13, 'atr_threshold': 15.0, 'pt_mult': 1.0, 'sl_mult': 5.0, 'td_mins': 60}. Best is trial 226 with value: 2.6610758639085312.
[I 2026-03-12 00:51:52,198] Trial 888 pruned. 
[I 2026-03-12 00:51:52,320] Trial 889 finished with value: 2.6610758639085312 and parameters: {'timeframe': 'M3', 'atr_period': 13, 'atr_threshold': 3.0, 'pt_mult': 0.5, 'sl_mult': 5.0, 'td_mins': 30}. Best is trial 226 with value: 2.6610758639085312.
[I 2026-03-12 00:51:52,455] Trial 890 finished with value: 2.6610758639085312 and parameters: {'timeframe': 'M3', 'atr_period': 13, 'atr_threshold': 3.0, 'pt_mult': 0.5, 'sl_mult': 5.0, 'td_mins': 30}. Best is trial 226 with value: 2.6610758639085312.
[I 2026-03-12 00:51:52,516] Trial 891 finished with value: 0.0 and parameters: {'timeframe': 'M3', 'atr_period': 13, 'atr_threshold': 5.0, 'pt_mult': 1.0, 'sl_mult': 2.5, 'td_mins': 360}. Best is trial 226 with value: 2.6610758639085312.
[I 2026-03-12 00:51:52,585] Trial 892 pruned. 
[I 2026-03-12 00:51:52,638] Trial 893 finished with value: 0.0 and parameters: {'timeframe': 'M3', 'atr_period': 13, 'atr_threshold': 5.0, 'pt_mult': 0.5, 'sl_mult': 5.0, 'td_mins': 30}. Best is trial 226 with value: 2.6610758639085312.
[I 2026-03-12 00:51:52,688] Trial 894 finished with value: 0.0 and parameters: {'timeframe': 'M3', 'atr_period': 13, 'atr_threshold': 8.0, 'pt_mult': 0.5, 'sl_mult': 5.0, 'td_mins': 1200}. Best is trial 226 with value: 2.6610758639085312.
[I 2026-03-12 00:51:52,738] Trial 895 finished with value: 0.0 and parameters: {'timeframe': 'M3', 'atr_period': 13, 'atr_threshold': 15.0, 'pt_mult': 2.5, 'sl_mult': 2.5, 'td_mins': 720}. Best is trial 226 with value: 2.6610758639085312.
[I 2026-03-12 00:51:52,918] Trial 896 finished with value: 2.6610758639085312 and parameters: {'timeframe': 'M3', 'atr_period': 13, 'atr_threshold': 3.0, 'pt_mult': 0.5, 'sl_mult': 5.0, 'td_mins': 30}. Best is trial 226 with value: 2.6610758639085312.
[I 2026-03-12 00:51:53,037] Trial 897 finished with value: 2.6610758639085312 and parameters: {'timeframe': 'M3', 'atr_period': 13, 'atr_threshold': 3.0, 'pt_mult': 0.5, 'sl_mult': 5.0, 'td_mins': 30}. Best is trial 226 with value: 2.6610758639085312.
[I 2026-03-12 00:51:53,153] Trial 898 finished with value: 2.6610758639085312 and parameters: {'timeframe': 'M3', 'atr_period': 13, 'atr_threshold': 3.0, 'pt_mult': 0.5, 'sl_mult': 5.0, 'td_mins': 30}. Best is trial 226 with value: 2.6610758639085312.
[I 2026-03-12 00:51:53,369] Trial 899 pruned. 
[I 2026-03-12 00:51:53,492] Trial 900 finished with value: 2.6610758639085312 and parameters: {'timeframe': 'M3', 'atr_period': 13, 'atr_threshold': 3.0, 'pt_mult': 0.5, 'sl_mult': 5.0, 'td_mins': 30}. Best is trial 226 with value: 2.6610758639085312.
[I 2026-03-12 00:51:53,541] Trial 901 finished with value: 0.0 and parameters: {'timeframe': 'M3', 'atr_period': 13, 'atr_threshold': 10.0, 'pt_mult': 0.5, 'sl_mult': 0.5, 'td_mins': 5}. Best is trial 226 with value: 2.6610758639085312.
[I 2026-03-12 00:51:53,667] Trial 902 finished with value: 2.6610758639085312 and parameters: {'timeframe': 'M3', 'atr_period': 13, 'atr_threshold': 3.0, 'pt_mult': 0.5, 'sl_mult': 5.0, 'td_mins': 30}. Best is trial 226 with value: 2.6610758639085312.
[I 2026-03-12 00:51:53,719] Trial 903 finished with value: 0.0 and parameters: {'timeframe': 'M3', 'atr_period': 13, 'atr_threshold': 5.0, 'pt_mult': 5.0, 'sl_mult': 0.5, 'td_mins': 30}. Best is trial 226 with value: 2.6610758639085312.
[I 2026-03-12 00:51:53,769] Trial 904 finished with value: 0.0 and parameters: {'timeframe': 'M3', 'atr_period': 13, 'atr_threshold': 10.0, 'pt_mult': 0.5, 'sl_mult': 0.5, 'td_mins': 720}. Best is trial 226 with value: 2.6610758639085312.
[I 2026-03-12 00:51:53,820] Trial 905 finished with value: 0.0 and parameters: {'timeframe': 'M3', 'atr_period': 13, 'atr_threshold': 10.0, 'pt_mult': 2.5, 'sl_mult': 0.5, 'td_mins': 720}. Best is trial 226 with value: 2.6610758639085312.
[I 2026-03-12 00:51:53,877] Trial 906 finished with value: 0.0 and parameters: {'timeframe': 'M3', 'atr_period': 13, 'atr_threshold': 8.0, 'pt_mult': 0.5, 'sl_mult': 5.0, 'td_mins': 30}. Best is trial 226 with value: 2.6610758639085312.
[I 2026-03-12 00:51:53,928] Trial 907 finished with value: 0.0 and parameters: {'timeframe': 'M3', 'atr_period': 13, 'atr_threshold': 15.0, 'pt_mult': 0.5, 'sl_mult': 5.0, 'td_mins': 30}. Best is trial 226 with value: 2.6610758639085312.
[I 2026-03-12 00:51:54,054] Trial 908 finished with value: 2.6610758639085312 and parameters: {'timeframe': 'M3', 'atr_period': 13, 'atr_threshold': 3.0, 'pt_mult': 0.5, 'sl_mult': 5.0, 'td_mins': 30}. Best is trial 226 with value: 2.6610758639085312.
[I 2026-03-12 00:51:54,106] Trial 909 pruned. 
[I 2026-03-12 00:51:54,173] Trial 910 pruned. 
[I 2026-03-12 00:51:54,302] Trial 911 finished with value: 2.6610758639085312 and parameters: {'timeframe': 'M3', 'atr_period': 13, 'atr_threshold': 3.0, 'pt_mult': 0.5, 'sl_mult': 5.0, 'td_mins': 30}. Best is trial 226 with value: 2.6610758639085312.
[I 2026-03-12 00:51:54,426] Trial 912 finished with value: 2.6610758639085312 and parameters: {'timeframe': 'M3', 'atr_period': 13, 'atr_threshold': 3.0, 'pt_mult': 0.5, 'sl_mult': 5.0, 'td_mins': 30}. Best is trial 226 with value: 2.6610758639085312.
[I 2026-03-12 00:51:54,552] Trial 913 finished with value: 2.6610758639085312 and parameters: {'timeframe': 'M3', 'atr_period': 13, 'atr_threshold': 3.0, 'pt_mult': 0.5, 'sl_mult': 5.0, 'td_mins': 30}. Best is trial 226 with value: 2.6610758639085312.
[I 2026-03-12 00:51:54,678] Trial 914 finished with value: 2.6610758639085312 and parameters: {'timeframe': 'M3', 'atr_period': 13, 'atr_threshold': 3.0, 'pt_mult': 0.5, 'sl_mult': 5.0, 'td_mins': 30}. Best is trial 226 with value: 2.6610758639085312.
[I 2026-03-12 00:51:54,732] Trial 915 finished with value: 0.0 and parameters: {'timeframe': 'M3', 'atr_period': 13, 'atr_threshold': 8.0, 'pt_mult': 1.0, 'sl_mult': 0.5, 'td_mins': 1080}. Best is trial 226 with value: 2.6610758639085312.
[I 2026-03-12 00:51:54,862] Trial 916 finished with value: 2.6610758639085312 and parameters: {'timeframe': 'M3', 'atr_period': 13, 'atr_threshold': 3.0, 'pt_mult': 0.5, 'sl_mult': 5.0, 'td_mins': 30}. Best is trial 226 with value: 2.6610758639085312.
[I 2026-03-12 00:51:54,913] Trial 917 finished with value: 0.0 and parameters: {'timeframe': 'M3', 'atr_period': 13, 'atr_threshold': 5.0, 'pt_mult': 2.5, 'sl_mult': 5.0, 'td_mins': 1200}. Best is trial 226 with value: 2.6610758639085312.
[I 2026-03-12 00:51:55,070] Trial 918 pruned. 
[I 2026-03-12 00:51:55,798] Trial 919 pruned. 
[I 2026-03-12 00:51:55,960] Trial 920 finished with value: 2.6610758639085312 and parameters: {'timeframe': 'M3', 'atr_period': 13, 'atr_threshold': 3.0, 'pt_mult': 0.5, 'sl_mult': 5.0, 'td_mins': 30}. Best is trial 226 with value: 2.6610758639085312.
[I 2026-03-12 00:51:56,032] Trial 921 pruned. 
[I 2026-03-12 00:51:56,096] Trial 922 finished with value: 0.0 and parameters: {'timeframe': 'M3', 'atr_period': 13, 'atr_threshold': 10.0, 'pt_mult': 0.5, 'sl_mult': 5.0, 'td_mins': 360}. Best is trial 226 with value: 2.6610758639085312.
[I 2026-03-12 00:51:56,234] Trial 923 finished with value: 2.6610758639085312 and parameters: {'timeframe': 'M3', 'atr_period': 13, 'atr_threshold': 3.0, 'pt_mult': 0.5, 'sl_mult': 5.0, 'td_mins': 30}. Best is trial 226 with value: 2.6610758639085312.
[I 2026-03-12 00:51:56,284] Trial 924 finished with value: 0.0 and parameters: {'timeframe': 'M3', 'atr_period': 13, 'atr_threshold': 10.0, 'pt_mult': 0.5, 'sl_mult': 5.0, 'td_mins': 30}. Best is trial 226 with value: 2.6610758639085312.
[I 2026-03-12 00:51:56,333] Trial 925 finished with value: 0.0 and parameters: {'timeframe': 'M3', 'atr_period': 13, 'atr_threshold': 15.0, 'pt_mult': 1.0, 'sl_mult': 1.0, 'td_mins': 720}. Best is trial 226 with value: 2.6610758639085312.
[I 2026-03-12 00:51:56,452] Trial 926 finished with value: 2.6610758639085312 and parameters: {'timeframe': 'M3', 'atr_period': 13, 'atr_threshold': 3.0, 'pt_mult': 0.5, 'sl_mult': 5.0, 'td_mins': 30}. Best is trial 226 with value: 2.6610758639085312.
[I 2026-03-12 00:51:56,554] Trial 927 pruned. 
[I 2026-03-12 00:51:56,674] Trial 928 finished with value: 2.6610758639085312 and parameters: {'timeframe': 'M3', 'atr_period': 13, 'atr_threshold': 3.0, 'pt_mult': 0.5, 'sl_mult': 5.0, 'td_mins': 30}. Best is trial 226 with value: 2.6610758639085312.
[I 2026-03-12 00:51:56,730] Trial 929 pruned. 
[I 2026-03-12 00:51:56,867] Trial 930 finished with value: 2.6610758639085312 and parameters: {'timeframe': 'M3', 'atr_period': 13, 'atr_threshold': 3.0, 'pt_mult': 0.5, 'sl_mult': 5.0, 'td_mins': 30}. Best is trial 226 with value: 2.6610758639085312.
[I 2026-03-12 00:51:56,986] Trial 931 finished with value: 2.6610758639085312 and parameters: {'timeframe': 'M3', 'atr_period': 13, 'atr_threshold': 3.0, 'pt_mult': 0.5, 'sl_mult': 5.0, 'td_mins': 30}. Best is trial 226 with value: 2.6610758639085312.
[I 2026-03-12 00:51:57,035] Trial 932 finished with value: 0.0 and parameters: {'timeframe': 'M3', 'atr_period': 13, 'atr_threshold': 5.0, 'pt_mult': 0.5, 'sl_mult': 0.5, 'td_mins': 60}. Best is trial 226 with value: 2.6610758639085312.
[I 2026-03-12 00:51:57,364] Trial 933 pruned. 
[I 2026-03-12 00:51:57,446] Trial 934 finished with value: 0.0 and parameters: {'timeframe': 'M3', 'atr_period': 13, 'atr_threshold': 8.0, 'pt_mult': 0.5, 'sl_mult': 2.5, 'td_mins': 30}. Best is trial 226 with value: 2.6610758639085312.
[I 2026-03-12 00:51:57,555] Trial 935 finished with value: 2.56808242042213 and parameters: {'timeframe': 'M3', 'atr_period': 13, 'atr_threshold': 3.0, 'pt_mult': 0.5, 'sl_mult': 5.0, 'td_mins': 15}. Best is trial 226 with value: 2.6610758639085312.
[I 2026-03-12 00:51:57,606] Trial 936 finished with value: 0.0 and parameters: {'timeframe': 'M3', 'atr_period': 13, 'atr_threshold': 15.0, 'pt_mult': 2.5, 'sl_mult': 5.0, 'td_mins': 120}. Best is trial 226 with value: 2.6610758639085312.
[I 2026-03-12 00:51:57,661] Trial 937 finished with value: 0.0 and parameters: {'timeframe': 'M3', 'atr_period': 13, 'atr_threshold': 8.0, 'pt_mult': 2.5, 'sl_mult': 5.0, 'td_mins': 1200}. Best is trial 226 with value: 2.6610758639085312.
[I 2026-03-12 00:51:57,766] Trial 938 pruned. 
[I 2026-03-12 00:51:57,890] Trial 939 finished with value: 2.6610758639085312 and parameters: {'timeframe': 'M3', 'atr_period': 13, 'atr_threshold': 3.0, 'pt_mult': 0.5, 'sl_mult': 5.0, 'td_mins': 30}. Best is trial 226 with value: 2.6610758639085312.
[I 2026-03-12 00:51:57,941] Trial 940 finished with value: 0.0 and parameters: {'timeframe': 'M3', 'atr_period': 13, 'atr_threshold': 8.0, 'pt_mult': 1.0, 'sl_mult': 0.5, 'td_mins': 360}. Best is trial 226 with value: 2.6610758639085312.
[I 2026-03-12 00:51:58,063] Trial 941 finished with value: 2.6610758639085312 and parameters: {'timeframe': 'M3', 'atr_period': 13, 'atr_threshold': 3.0, 'pt_mult': 0.5, 'sl_mult': 5.0, 'td_mins': 30}. Best is trial 226 with value: 2.6610758639085312.
[I 2026-03-12 00:51:58,121] Trial 942 pruned. 
[I 2026-03-12 00:51:58,193] Trial 943 pruned. 
[I 2026-03-12 00:51:58,250] Trial 944 pruned. 
[I 2026-03-12 00:51:58,370] Trial 945 finished with value: 2.6610758639085312 and parameters: {'timeframe': 'M3', 'atr_period': 13, 'atr_threshold': 3.0, 'pt_mult': 0.5, 'sl_mult': 5.0, 'td_mins': 30}. Best is trial 226 with value: 2.6610758639085312.
[I 2026-03-12 00:51:58,608] Trial 946 pruned. 
[I 2026-03-12 00:51:58,761] Trial 947 pruned. 
[I 2026-03-12 00:51:58,883] Trial 948 finished with value: 2.6610758639085312 and parameters: {'timeframe': 'M3', 'atr_period': 13, 'atr_threshold': 3.0, 'pt_mult': 0.5, 'sl_mult': 5.0, 'td_mins': 30}. Best is trial 226 with value: 2.6610758639085312.
[I 2026-03-12 00:51:58,932] Trial 949 finished with value: 0.0 and parameters: {'timeframe': 'M3', 'atr_period': 13, 'atr_threshold': 15.0, 'pt_mult': 0.5, 'sl_mult': 1.0, 'td_mins': 5}. Best is trial 226 with value: 2.6610758639085312.
[I 2026-03-12 00:51:58,988] Trial 950 pruned. 
[I 2026-03-12 00:51:59,043] Trial 951 pruned. 
[I 2026-03-12 00:51:59,093] Trial 952 finished with value: 0.0 and parameters: {'timeframe': 'M3', 'atr_period': 13, 'atr_threshold': 5.0, 'pt_mult': 2.5, 'sl_mult': 2.5, 'td_mins': 180}. Best is trial 226 with value: 2.6610758639085312.
[I 2026-03-12 00:51:59,319] Trial 953 pruned. 
[I 2026-03-12 00:51:59,573] Trial 954 pruned. 
[I 2026-03-12 00:51:59,675] Trial 955 pruned. 
[I 2026-03-12 00:51:59,768] Trial 956 pruned. 
[I 2026-03-12 00:52:00,071] Trial 957 pruned. 
[I 2026-03-12 00:52:01,835] Trial 958 pruned. 
[I 2026-03-12 00:52:01,969] Trial 959 finished with value: 2.6610758639085312 and parameters: {'timeframe': 'M3', 'atr_period': 13, 'atr_threshold': 3.0, 'pt_mult': 0.5, 'sl_mult': 5.0, 'td_mins': 30}. Best is trial 226 with value: 2.6610758639085312.
[I 2026-03-12 00:52:03,916] Trial 960 pruned. 
[I 2026-03-12 00:52:03,967] Trial 961 finished with value: 0.0 and parameters: {'timeframe': 'M3', 'atr_period': 13, 'atr_threshold': 5.0, 'pt_mult': 0.5, 'sl_mult': 5.0, 'td_mins': 30}. Best is trial 226 with value: 2.6610758639085312.
[I 2026-03-12 00:52:04,072] Trial 962 pruned. 
[I 2026-03-12 00:52:04,165] Trial 963 pruned. 
[I 2026-03-12 00:52:04,231] Trial 964 pruned. 
[I 2026-03-12 00:52:04,352] Trial 965 finished with value: 2.6610758639085312 and parameters: {'timeframe': 'M3', 'atr_period': 13, 'atr_threshold': 3.0, 'pt_mult': 0.5, 'sl_mult': 5.0, 'td_mins': 30}. Best is trial 226 with value: 2.6610758639085312.
[I 2026-03-12 00:52:04,403] Trial 966 finished with value: 0.0 and parameters: {'timeframe': 'M3', 'atr_period': 13, 'atr_threshold': 10.0, 'pt_mult': 5.0, 'sl_mult': 5.0, 'td_mins': 180}. Best is trial 226 with value: 2.6610758639085312.
[I 2026-03-12 00:52:04,575] Trial 967 finished with value: 2.4718369634519943 and parameters: {'timeframe': 'M3', 'atr_period': 13, 'atr_threshold': 3.0, 'pt_mult': 0.5, 'sl_mult': 5.0, 'td_mins': 60}. Best is trial 226 with value: 2.6610758639085312.
[I 2026-03-12 00:52:04,623] Trial 968 finished with value: 0.0 and parameters: {'timeframe': 'M3', 'atr_period': 13, 'atr_threshold': 15.0, 'pt_mult': 0.5, 'sl_mult': 1.0, 'td_mins': 720}. Best is trial 226 with value: 2.6610758639085312.
[I 2026-03-12 00:52:04,723] Trial 969 pruned. 
[I 2026-03-12 00:52:04,773] Trial 970 finished with value: 0.0 and parameters: {'timeframe': 'M3', 'atr_period': 13, 'atr_threshold': 8.0, 'pt_mult': 1.0, 'sl_mult': 0.5, 'td_mins': 1200}. Best is trial 226 with value: 2.6610758639085312.
[I 2026-03-12 00:52:04,846] Trial 971 pruned. 
[I 2026-03-12 00:52:04,896] Trial 972 finished with value: 0.0 and parameters: {'timeframe': 'M3', 'atr_period': 13, 'atr_threshold': 10.0, 'pt_mult': 5.0, 'sl_mult': 2.5, 'td_mins': 30}. Best is trial 226 with value: 2.6610758639085312.
[I 2026-03-12 00:52:04,950] Trial 973 pruned. 
[I 2026-03-12 00:52:05,071] Trial 974 finished with value: 2.6610758639085312 and parameters: {'timeframe': 'M3', 'atr_period': 13, 'atr_threshold': 3.0, 'pt_mult': 0.5, 'sl_mult': 5.0, 'td_mins': 30}. Best is trial 226 with value: 2.6610758639085312.
[I 2026-03-12 00:52:05,484] Trial 975 pruned. 
[I 2026-03-12 00:52:05,545] Trial 976 finished with value: 0.0 and parameters: {'timeframe': 'M3', 'atr_period': 13, 'atr_threshold': 10.0, 'pt_mult': 5.0, 'sl_mult': 5.0, 'td_mins': 1080}. Best is trial 226 with value: 2.6610758639085312.
[I 2026-03-12 00:52:05,637] Trial 977 pruned. 
[I 2026-03-12 00:52:05,777] Trial 978 finished with value: 2.6610758639085312 and parameters: {'timeframe': 'M3', 'atr_period': 13, 'atr_threshold': 3.0, 'pt_mult': 0.5, 'sl_mult': 5.0, 'td_mins': 30}. Best is trial 226 with value: 2.6610758639085312.
[I 2026-03-12 00:52:05,857] Trial 979 pruned. 
[I 2026-03-12 00:52:05,916] Trial 980 finished with value: 0.0 and parameters: {'timeframe': 'M3', 'atr_period': 13, 'atr_threshold': 15.0, 'pt_mult': 1.0, 'sl_mult': 2.5, 'td_mins': 720}. Best is trial 226 with value: 2.6610758639085312.
[I 2026-03-12 00:52:06,045] Trial 981 finished with value: 2.6610758639085312 and parameters: {'timeframe': 'M3', 'atr_period': 13, 'atr_threshold': 3.0, 'pt_mult': 0.5, 'sl_mult': 5.0, 'td_mins': 30}. Best is trial 226 with value: 2.6610758639085312.
[I 2026-03-12 00:52:06,095] Trial 982 finished with value: 0.0 and parameters: {'timeframe': 'M3', 'atr_period': 13, 'atr_threshold': 15.0, 'pt_mult': 0.5, 'sl_mult': 1.0, 'td_mins': 1080}. Best is trial 226 with value: 2.6610758639085312.
[I 2026-03-12 00:52:06,922] Trial 983 pruned. 
[I 2026-03-12 00:52:07,074] Trial 984 finished with value: 2.6610758639085312 and parameters: {'timeframe': 'M3', 'atr_period': 13, 'atr_threshold': 3.0, 'pt_mult': 0.5, 'sl_mult': 5.0, 'td_mins': 30}. Best is trial 226 with value: 2.6610758639085312.
[I 2026-03-12 00:52:07,126] Trial 985 finished with value: 0.0 and parameters: {'timeframe': 'M3', 'atr_period': 13, 'atr_threshold': 15.0, 'pt_mult': 1.0, 'sl_mult': 2.5, 'td_mins': 1080}. Best is trial 226 with value: 2.6610758639085312.
[I 2026-03-12 00:52:07,179] Trial 986 finished with value: 0.0 and parameters: {'timeframe': 'M3', 'atr_period': 13, 'atr_threshold': 8.0, 'pt_mult': 1.0, 'sl_mult': 5.0, 'td_mins': 120}. Best is trial 226 with value: 2.6610758639085312.
[I 2026-03-12 00:52:07,299] Trial 987 finished with value: 2.6610758639085312 and parameters: {'timeframe': 'M3', 'atr_period': 13, 'atr_threshold': 3.0, 'pt_mult': 0.5, 'sl_mult': 5.0, 'td_mins': 30}. Best is trial 226 with value: 2.6610758639085312.
[I 2026-03-12 00:52:07,353] Trial 988 finished with value: 0.0 and parameters: {'timeframe': 'M3', 'atr_period': 13, 'atr_threshold': 8.0, 'pt_mult': 5.0, 'sl_mult': 1.0, 'td_mins': 30}. Best is trial 226 with value: 2.6610758639085312.
[I 2026-03-12 00:52:07,481] Trial 989 finished with value: 2.6610758639085312 and parameters: {'timeframe': 'M3', 'atr_period': 13, 'atr_threshold': 3.0, 'pt_mult': 0.5, 'sl_mult': 5.0, 'td_mins': 30}. Best is trial 226 with value: 2.6610758639085312.
[I 2026-03-12 00:52:07,532] Trial 990 finished with value: 0.0 and parameters: {'timeframe': 'M3', 'atr_period': 13, 'atr_threshold': 8.0, 'pt_mult': 0.5, 'sl_mult': 5.0, 'td_mins': 30}. Best is trial 226 with value: 2.6610758639085312.
[I 2026-03-12 00:52:07,654] Trial 991 finished with value: 2.6610758639085312 and parameters: {'timeframe': 'M3', 'atr_period': 13, 'atr_threshold': 3.0, 'pt_mult': 0.5, 'sl_mult': 5.0, 'td_mins': 30}. Best is trial 226 with value: 2.6610758639085312.
[I 2026-03-12 00:52:07,706] Trial 992 finished with value: 0.0 and parameters: {'timeframe': 'M3', 'atr_period': 13, 'atr_threshold': 15.0, 'pt_mult': 2.5, 'sl_mult': 2.5, 'td_mins': 60}. Best is trial 226 with value: 2.6610758639085312.
