[I 2026-03-12 01:32:59,178] Trial 293 finished with value: 0.0 and parameters: {'timeframe': 'M1', 'atr_period': 13, 'atr_threshold': 15.0, 'pt_mult': 1.0, 'sl_mult': 5.0, 'td_mins': 1080}. Best is trial 96 with value: 1.9675745537951908.
[I 2026-03-12 01:32:59,221] Trial 294 finished with value: 0.0 and parameters: {'timeframe': 'M1', 'atr_period': 13, 'atr_threshold': 10.0, 'pt_mult': 5.0, 'sl_mult': 1.0, 'td_mins': 720}. Best is trial 96 with value: 1.9675745537951908.
[I 2026-03-12 01:32:59,268] Trial 295 finished with value: 0.0 and parameters: {'timeframe': 'M1', 'atr_period': 13, 'atr_threshold': 15.0, 'pt_mult': 1.0, 'sl_mult': 0.5, 'td_mins': 1200}. Best is trial 96 with value: 1.9675745537951908.
[I 2026-03-12 01:32:59,314] Trial 296 finished with value: 0.0 and parameters: {'timeframe': 'M1', 'atr_period': 13, 'atr_threshold': 8.0, 'pt_mult': 5.0, 'sl_mult': 5.0, 'td_mins': 30}. Best is trial 96 with value: 1.9675745537951908.
[I 2026-03-12 01:32:59,360] Trial 297 finished with value: 0.0 and parameters: {'timeframe': 'M1', 'atr_period': 13, 'atr_threshold': 3.0, 'pt_mult': 1.0, 'sl_mult': 0.5, 'td_mins': 1080}. Best is trial 96 with value: 1.9675745537951908.
[I 2026-03-12 01:32:59,405] Trial 298 finished with value: 0.0 and parameters: {'timeframe': 'M1', 'atr_period': 13, 'atr_threshold': 3.0, 'pt_mult': 2.5, 'sl_mult': 0.5, 'td_mins': 180}. Best is trial 96 with value: 1.9675745537951908.
[I 2026-03-12 01:32:59,449] Trial 299 finished with value: 0.0 and parameters: {'timeframe': 'M1', 'atr_period': 13, 'atr_threshold': 10.0, 'pt_mult': 2.5, 'sl_mult': 5.0, 'td_mins': 180}. Best is trial 96 with value: 1.9675745537951908.
[I 2026-03-12 01:32:59,837] Trial 300 finished with value: 1.112569542667418 and parameters: {'timeframe': 'M1', 'atr_period': 13, 'atr_threshold': 2.0, 'pt_mult': 1.0, 'sl_mult': 0.5, 'td_mins': 720}. Best is trial 96 with value: 1.9675745537951908.
[I 2026-03-12 01:33:00,304] Trial 301 finished with value: 1.112569542667418 and parameters: {'timeframe': 'M1', 'atr_period': 13, 'atr_threshold': 2.0, 'pt_mult': 1.0, 'sl_mult': 0.5, 'td_mins': 720}. Best is trial 96 with value: 1.9675745537951908.
[I 2026-03-12 01:33:00,741] Trial 302 finished with value: 1.112569542667418 and parameters: {'timeframe': 'M1', 'atr_period': 13, 'atr_threshold': 2.0, 'pt_mult': 1.0, 'sl_mult': 0.5, 'td_mins': 720}. Best is trial 96 with value: 1.9675745537951908.
[I 2026-03-12 01:33:00,964] Trial 303 finished with value: 1.112569542667418 and parameters: {'timeframe': 'M1', 'atr_period': 13, 'atr_threshold': 2.0, 'pt_mult': 1.0, 'sl_mult': 0.5, 'td_mins': 120}. Best is trial 96 with value: 1.9675745537951908.
[I 2026-03-12 01:33:01,404] Trial 304 finished with value: 1.112569542667418 and parameters: {'timeframe': 'M1', 'atr_period': 13, 'atr_threshold': 2.0, 'pt_mult': 1.0, 'sl_mult': 0.5, 'td_mins': 720}. Best is trial 96 with value: 1.9675745537951908.
[I 2026-03-12 01:33:01,847] Trial 305 finished with value: 1.112569542667418 and parameters: {'timeframe': 'M1', 'atr_period': 13, 'atr_threshold': 2.0, 'pt_mult': 1.0, 'sl_mult': 0.5, 'td_mins': 720}. Best is trial 96 with value: 1.9675745537951908.
[I 2026-03-12 01:33:02,289] Trial 306 finished with value: 1.112569542667418 and parameters: {'timeframe': 'M1', 'atr_period': 13, 'atr_threshold': 2.0, 'pt_mult': 1.0, 'sl_mult': 0.5, 'td_mins': 720}. Best is trial 96 with value: 1.9675745537951908.
[I 2026-03-12 01:33:02,761] Trial 307 finished with value: 1.112569542667418 and parameters: {'timeframe': 'M1', 'atr_period': 13, 'atr_threshold': 2.0, 'pt_mult': 1.0, 'sl_mult': 0.5, 'td_mins': 720}. Best is trial 96 with value: 1.9675745537951908.
[I 2026-03-12 01:33:03,227] Trial 308 finished with value: 1.112569542667418 and parameters: {'timeframe': 'M1', 'atr_period': 13, 'atr_threshold': 2.0, 'pt_mult': 1.0, 'sl_mult': 0.5, 'td_mins': 720}. Best is trial 96 with value: 1.9675745537951908.
[I 2026-03-12 01:33:03,669] Trial 309 finished with value: 1.112569542667418 and parameters: {'timeframe': 'M1', 'atr_period': 13, 'atr_threshold': 2.0, 'pt_mult': 1.0, 'sl_mult': 0.5, 'td_mins': 720}. Best is trial 96 with value: 1.9675745537951908.
[I 2026-03-12 01:33:04,056] Trial 310 finished with value: 1.112569542667418 and parameters: {'timeframe': 'M1', 'atr_period': 13, 'atr_threshold': 2.0, 'pt_mult': 1.0, 'sl_mult': 0.5, 'td_mins': 720}. Best is trial 96 with value: 1.9675745537951908.
[I 2026-03-12 01:33:04,492] Trial 311 finished with value: 1.112569542667418 and parameters: {'timeframe': 'M1', 'atr_period': 13, 'atr_threshold': 2.0, 'pt_mult': 1.0, 'sl_mult': 0.5, 'td_mins': 720}. Best is trial 96 with value: 1.9675745537951908.
[I 2026-03-12 01:33:04,937] Trial 312 finished with value: 1.112569542667418 and parameters: {'timeframe': 'M1', 'atr_period': 13, 'atr_threshold': 2.0, 'pt_mult': 1.0, 'sl_mult': 0.5, 'td_mins': 720}. Best is trial 96 with value: 1.9675745537951908.
[I 2026-03-12 01:33:05,144] Trial 313 finished with value: 1.112569542667418 and parameters: {'timeframe': 'M1', 'atr_period': 13, 'atr_threshold': 2.0, 'pt_mult': 1.0, 'sl_mult': 0.5, 'td_mins': 120}. Best is trial 96 with value: 1.9675745537951908.
[I 2026-03-12 01:33:05,232] Trial 314 finished with value: 1.8029492832408522 and parameters: {'timeframe': 'M1', 'atr_period': 13, 'atr_threshold': 2.0, 'pt_mult': 1.0, 'sl_mult': 5.0, 'td_mins': 5}. Best is trial 96 with value: 1.9675745537951908.
[I 2026-03-12 01:33:05,328] Trial 315 finished with value: 1.8029492832408522 and parameters: {'timeframe': 'M1', 'atr_period': 13, 'atr_threshold': 2.0, 'pt_mult': 1.0, 'sl_mult': 5.0, 'td_mins': 5}. Best is trial 96 with value: 1.9675745537951908.
[I 2026-03-12 01:33:05,419] Trial 316 finished with value: 1.8029492832408522 and parameters: {'timeframe': 'M1', 'atr_period': 13, 'atr_threshold': 2.0, 'pt_mult': 1.0, 'sl_mult': 5.0, 'td_mins': 5}. Best is trial 96 with value: 1.9675745537951908.
[I 2026-03-12 01:33:05,507] Trial 317 finished with value: 1.8029492832408522 and parameters: {'timeframe': 'M1', 'atr_period': 13, 'atr_threshold': 2.0, 'pt_mult': 1.0, 'sl_mult': 5.0, 'td_mins': 5}. Best is trial 96 with value: 1.9675745537951908.
[I 2026-03-12 01:33:05,598] Trial 318 finished with value: 1.8029492832408522 and parameters: {'timeframe': 'M1', 'atr_period': 13, 'atr_threshold': 2.0, 'pt_mult': 1.0, 'sl_mult': 5.0, 'td_mins': 5}. Best is trial 96 with value: 1.9675745537951908.
[I 2026-03-12 01:33:05,686] Trial 319 finished with value: 1.8029492832408522 and parameters: {'timeframe': 'M1', 'atr_period': 13, 'atr_threshold': 2.0, 'pt_mult': 1.0, 'sl_mult': 5.0, 'td_mins': 5}. Best is trial 96 with value: 1.9675745537951908.
[I 2026-03-12 01:33:05,771] Trial 320 finished with value: 1.8029492832408522 and parameters: {'timeframe': 'M1', 'atr_period': 13, 'atr_threshold': 2.0, 'pt_mult': 1.0, 'sl_mult': 5.0, 'td_mins': 5}. Best is trial 96 with value: 1.9675745537951908.
[I 2026-03-12 01:33:05,859] Trial 321 finished with value: 1.8029492832408522 and parameters: {'timeframe': 'M1', 'atr_period': 13, 'atr_threshold': 2.0, 'pt_mult': 1.0, 'sl_mult': 5.0, 'td_mins': 5}. Best is trial 96 with value: 1.9675745537951908.
[I 2026-03-12 01:33:05,948] Trial 322 finished with value: 1.8029492832408522 and parameters: {'timeframe': 'M1', 'atr_period': 13, 'atr_threshold': 2.0, 'pt_mult': 1.0, 'sl_mult': 5.0, 'td_mins': 5}. Best is trial 96 with value: 1.9675745537951908.
[I 2026-03-12 01:33:06,038] Trial 323 finished with value: 1.8029492832408522 and parameters: {'timeframe': 'M1', 'atr_period': 13, 'atr_threshold': 2.0, 'pt_mult': 1.0, 'sl_mult': 5.0, 'td_mins': 5}. Best is trial 96 with value: 1.9675745537951908.
[I 2026-03-12 01:33:06,125] Trial 324 finished with value: 1.8029492832408522 and parameters: {'timeframe': 'M1', 'atr_period': 13, 'atr_threshold': 2.0, 'pt_mult': 1.0, 'sl_mult': 5.0, 'td_mins': 5}. Best is trial 96 with value: 1.9675745537951908.
[I 2026-03-12 01:33:06,214] Trial 325 finished with value: 1.8029492832408522 and parameters: {'timeframe': 'M1', 'atr_period': 13, 'atr_threshold': 2.0, 'pt_mult': 1.0, 'sl_mult': 5.0, 'td_mins': 5}. Best is trial 96 with value: 1.9675745537951908.
[I 2026-03-12 01:33:06,305] Trial 326 finished with value: 1.8029492832408522 and parameters: {'timeframe': 'M1', 'atr_period': 13, 'atr_threshold': 2.0, 'pt_mult': 1.0, 'sl_mult': 5.0, 'td_mins': 5}. Best is trial 96 with value: 1.9675745537951908.
[I 2026-03-12 01:33:06,399] Trial 327 finished with value: 1.8029492832408522 and parameters: {'timeframe': 'M1', 'atr_period': 13, 'atr_threshold': 2.0, 'pt_mult': 1.0, 'sl_mult': 5.0, 'td_mins': 5}. Best is trial 96 with value: 1.9675745537951908.
[I 2026-03-12 01:33:06,495] Trial 328 finished with value: 1.8029492832408522 and parameters: {'timeframe': 'M1', 'atr_period': 13, 'atr_threshold': 2.0, 'pt_mult': 1.0, 'sl_mult': 5.0, 'td_mins': 5}. Best is trial 96 with value: 1.9675745537951908.
[I 2026-03-12 01:33:06,585] Trial 329 finished with value: 1.8029492832408522 and parameters: {'timeframe': 'M1', 'atr_period': 13, 'atr_threshold': 2.0, 'pt_mult': 1.0, 'sl_mult': 5.0, 'td_mins': 5}. Best is trial 96 with value: 1.9675745537951908.
[I 2026-03-12 01:33:06,674] Trial 330 finished with value: 1.8029492832408522 and parameters: {'timeframe': 'M1', 'atr_period': 13, 'atr_threshold': 2.0, 'pt_mult': 1.0, 'sl_mult': 5.0, 'td_mins': 5}. Best is trial 96 with value: 1.9675745537951908.
[I 2026-03-12 01:33:06,764] Trial 331 finished with value: 1.8029492832408522 and parameters: {'timeframe': 'M1', 'atr_period': 13, 'atr_threshold': 2.0, 'pt_mult': 1.0, 'sl_mult': 5.0, 'td_mins': 5}. Best is trial 96 with value: 1.9675745537951908.
[I 2026-03-12 01:33:06,850] Trial 332 finished with value: 1.8029492832408522 and parameters: {'timeframe': 'M1', 'atr_period': 13, 'atr_threshold': 2.0, 'pt_mult': 1.0, 'sl_mult': 5.0, 'td_mins': 5}. Best is trial 96 with value: 1.9675745537951908.
[I 2026-03-12 01:33:06,941] Trial 333 finished with value: 1.8029492832408522 and parameters: {'timeframe': 'M1', 'atr_period': 13, 'atr_threshold': 2.0, 'pt_mult': 1.0, 'sl_mult': 5.0, 'td_mins': 5}. Best is trial 96 with value: 1.9675745537951908.
[I 2026-03-12 01:33:07,035] Trial 334 finished with value: 1.8029492832408522 and parameters: {'timeframe': 'M1', 'atr_period': 13, 'atr_threshold': 2.0, 'pt_mult': 1.0, 'sl_mult': 5.0, 'td_mins': 5}. Best is trial 96 with value: 1.9675745537951908.
[I 2026-03-12 01:33:07,122] Trial 335 finished with value: 1.8029492832408522 and parameters: {'timeframe': 'M1', 'atr_period': 13, 'atr_threshold': 2.0, 'pt_mult': 1.0, 'sl_mult': 5.0, 'td_mins': 5}. Best is trial 96 with value: 1.9675745537951908.
[I 2026-03-12 01:33:07,213] Trial 336 finished with value: 1.8029492832408522 and parameters: {'timeframe': 'M1', 'atr_period': 13, 'atr_threshold': 2.0, 'pt_mult': 1.0, 'sl_mult': 5.0, 'td_mins': 5}. Best is trial 96 with value: 1.9675745537951908.
[I 2026-03-12 01:33:07,316] Trial 337 finished with value: 2.318948203404773 and parameters: {'timeframe': 'M1', 'atr_period': 13, 'atr_threshold': 2.0, 'pt_mult': 0.5, 'sl_mult': 5.0, 'td_mins': 5}. Best is trial 337 with value: 2.318948203404773.
[I 2026-03-12 01:33:07,467] Trial 338 finished with value: 1.9675745537951908 and parameters: {'timeframe': 'M1', 'atr_period': 13, 'atr_threshold': 2.0, 'pt_mult': 0.5, 'sl_mult': 5.0, 'td_mins': 15}. Best is trial 337 with value: 2.318948203404773.
[I 2026-03-12 01:33:07,618] Trial 339 finished with value: 1.9675745537951908 and parameters: {'timeframe': 'M1', 'atr_period': 13, 'atr_threshold': 2.0, 'pt_mult': 0.5, 'sl_mult': 5.0, 'td_mins': 15}. Best is trial 337 with value: 2.318948203404773.
[I 2026-03-12 01:33:07,769] Trial 340 finished with value: 1.9675745537951908 and parameters: {'timeframe': 'M1', 'atr_period': 13, 'atr_threshold': 2.0, 'pt_mult': 0.5, 'sl_mult': 5.0, 'td_mins': 15}. Best is trial 337 with value: 2.318948203404773.
[I 2026-03-12 01:33:07,898] Trial 341 finished with value: 1.9675745537951908 and parameters: {'timeframe': 'M1', 'atr_period': 13, 'atr_threshold': 2.0, 'pt_mult': 0.5, 'sl_mult': 5.0, 'td_mins': 15}. Best is trial 337 with value: 2.318948203404773.
[I 2026-03-12 01:33:08,021] Trial 342 finished with value: 1.9675745537951908 and parameters: {'timeframe': 'M1', 'atr_period': 13, 'atr_threshold': 2.0, 'pt_mult': 0.5, 'sl_mult': 5.0, 'td_mins': 15}. Best is trial 337 with value: 2.318948203404773.
[I 2026-03-12 01:33:08,152] Trial 343 finished with value: 1.9675745537951908 and parameters: {'timeframe': 'M1', 'atr_period': 13, 'atr_threshold': 2.0, 'pt_mult': 0.5, 'sl_mult': 5.0, 'td_mins': 15}. Best is trial 337 with value: 2.318948203404773.
[I 2026-03-12 01:33:08,280] Trial 344 finished with value: 1.9675745537951908 and parameters: {'timeframe': 'M1', 'atr_period': 13, 'atr_threshold': 2.0, 'pt_mult': 0.5, 'sl_mult': 5.0, 'td_mins': 15}. Best is trial 337 with value: 2.318948203404773.
[I 2026-03-12 01:33:08,407] Trial 345 finished with value: 1.9675745537951908 and parameters: {'timeframe': 'M1', 'atr_period': 13, 'atr_threshold': 2.0, 'pt_mult': 0.5, 'sl_mult': 5.0, 'td_mins': 15}. Best is trial 337 with value: 2.318948203404773.
[I 2026-03-12 01:33:08,544] Trial 346 finished with value: 1.9675745537951908 and parameters: {'timeframe': 'M1', 'atr_period': 13, 'atr_threshold': 2.0, 'pt_mult': 0.5, 'sl_mult': 5.0, 'td_mins': 15}. Best is trial 337 with value: 2.318948203404773.
[I 2026-03-12 01:33:08,671] Trial 347 finished with value: 1.9675745537951908 and parameters: {'timeframe': 'M1', 'atr_period': 13, 'atr_threshold': 2.0, 'pt_mult': 0.5, 'sl_mult': 5.0, 'td_mins': 15}. Best is trial 337 with value: 2.318948203404773.
[I 2026-03-12 01:33:08,805] Trial 348 finished with value: 1.9675745537951908 and parameters: {'timeframe': 'M1', 'atr_period': 13, 'atr_threshold': 2.0, 'pt_mult': 0.5, 'sl_mult': 5.0, 'td_mins': 15}. Best is trial 337 with value: 2.318948203404773.
[I 2026-03-12 01:33:08,931] Trial 349 finished with value: 1.9675745537951908 and parameters: {'timeframe': 'M1', 'atr_period': 13, 'atr_threshold': 2.0, 'pt_mult': 0.5, 'sl_mult': 5.0, 'td_mins': 15}. Best is trial 337 with value: 2.318948203404773.
[I 2026-03-12 01:33:09,057] Trial 350 finished with value: 1.9675745537951908 and parameters: {'timeframe': 'M1', 'atr_period': 13, 'atr_threshold': 2.0, 'pt_mult': 0.5, 'sl_mult': 5.0, 'td_mins': 15}. Best is trial 337 with value: 2.318948203404773.
[I 2026-03-12 01:33:09,185] Trial 351 finished with value: 1.9675745537951908 and parameters: {'timeframe': 'M1', 'atr_period': 13, 'atr_threshold': 2.0, 'pt_mult': 0.5, 'sl_mult': 5.0, 'td_mins': 15}. Best is trial 337 with value: 2.318948203404773.
[I 2026-03-12 01:33:09,317] Trial 352 finished with value: 1.9675745537951908 and parameters: {'timeframe': 'M1', 'atr_period': 13, 'atr_threshold': 2.0, 'pt_mult': 0.5, 'sl_mult': 5.0, 'td_mins': 15}. Best is trial 337 with value: 2.318948203404773.
[I 2026-03-12 01:33:09,445] Trial 353 finished with value: 1.9675745537951908 and parameters: {'timeframe': 'M1', 'atr_period': 13, 'atr_threshold': 2.0, 'pt_mult': 0.5, 'sl_mult': 5.0, 'td_mins': 15}. Best is trial 337 with value: 2.318948203404773.
[I 2026-03-12 01:33:09,575] Trial 354 finished with value: 1.9675745537951908 and parameters: {'timeframe': 'M1', 'atr_period': 13, 'atr_threshold': 2.0, 'pt_mult': 0.5, 'sl_mult': 5.0, 'td_mins': 15}. Best is trial 337 with value: 2.318948203404773.
[I 2026-03-12 01:33:09,702] Trial 355 finished with value: 1.9675745537951908 and parameters: {'timeframe': 'M1', 'atr_period': 13, 'atr_threshold': 2.0, 'pt_mult': 0.5, 'sl_mult': 5.0, 'td_mins': 15}. Best is trial 337 with value: 2.318948203404773.
[I 2026-03-12 01:33:09,831] Trial 356 finished with value: 1.9675745537951908 and parameters: {'timeframe': 'M1', 'atr_period': 13, 'atr_threshold': 2.0, 'pt_mult': 0.5, 'sl_mult': 5.0, 'td_mins': 15}. Best is trial 337 with value: 2.318948203404773.
[I 2026-03-12 01:33:09,959] Trial 357 finished with value: 1.9675745537951908 and parameters: {'timeframe': 'M1', 'atr_period': 13, 'atr_threshold': 2.0, 'pt_mult': 0.5, 'sl_mult': 5.0, 'td_mins': 15}. Best is trial 337 with value: 2.318948203404773.
[I 2026-03-12 01:33:10,087] Trial 358 finished with value: 1.9675745537951908 and parameters: {'timeframe': 'M1', 'atr_period': 13, 'atr_threshold': 2.0, 'pt_mult': 0.5, 'sl_mult': 5.0, 'td_mins': 15}. Best is trial 337 with value: 2.318948203404773.
[I 2026-03-12 01:33:10,216] Trial 359 finished with value: 1.9675745537951908 and parameters: {'timeframe': 'M1', 'atr_period': 13, 'atr_threshold': 2.0, 'pt_mult': 0.5, 'sl_mult': 5.0, 'td_mins': 15}. Best is trial 337 with value: 2.318948203404773.
[I 2026-03-12 01:33:10,347] Trial 360 finished with value: 1.9675745537951908 and parameters: {'timeframe': 'M1', 'atr_period': 13, 'atr_threshold': 2.0, 'pt_mult': 0.5, 'sl_mult': 5.0, 'td_mins': 15}. Best is trial 337 with value: 2.318948203404773.
[I 2026-03-12 01:33:10,456] Trial 361 pruned. 
[I 2026-03-12 01:33:10,528] Trial 362 pruned. 
[I 2026-03-12 01:33:10,594] Trial 363 pruned. 
[I 2026-03-12 01:33:10,651] Trial 364 pruned. 
[I 2026-03-12 01:33:10,706] Trial 365 pruned. 
[I 2026-03-12 01:33:10,943] Trial 366 pruned. 
[I 2026-03-12 01:33:11,023] Trial 367 pruned. 
[I 2026-03-12 01:33:11,086] Trial 368 pruned. 
[I 2026-03-12 01:33:11,137] Trial 369 finished with value: 0.0 and parameters: {'timeframe': 'M1', 'atr_period': 13, 'atr_threshold': 15.0, 'pt_mult': 0.5, 'sl_mult': 5.0, 'td_mins': 15}. Best is trial 337 with value: 2.318948203404773.
[I 2026-03-12 01:33:11,258] Trial 370 pruned. 
[I 2026-03-12 01:33:11,312] Trial 371 pruned. 
[I 2026-03-12 01:33:11,360] Trial 372 finished with value: 0.0 and parameters: {'timeframe': 'M1', 'atr_period': 13, 'atr_threshold': 10.0, 'pt_mult': 0.5, 'sl_mult': 5.0, 'td_mins': 15}. Best is trial 337 with value: 2.318948203404773.
[I 2026-03-12 01:33:11,409] Trial 373 finished with value: 0.0 and parameters: {'timeframe': 'M1', 'atr_period': 13, 'atr_threshold': 3.0, 'pt_mult': 0.5, 'sl_mult': 5.0, 'td_mins': 15}. Best is trial 337 with value: 2.318948203404773.
[I 2026-03-12 01:33:11,476] Trial 374 pruned. 
[I 2026-03-12 01:33:11,602] Trial 375 finished with value: 1.9675745537951908 and parameters: {'timeframe': 'M1', 'atr_period': 13, 'atr_threshold': 2.0, 'pt_mult': 0.5, 'sl_mult': 5.0, 'td_mins': 15}. Best is trial 337 with value: 2.318948203404773.
[I 2026-03-12 01:33:11,690] Trial 376 finished with value: 2.318948203404773 and parameters: {'timeframe': 'M1', 'atr_period': 13, 'atr_threshold': 2.0, 'pt_mult': 0.5, 'sl_mult': 5.0, 'td_mins': 5}. Best is trial 337 with value: 2.318948203404773.
[I 2026-03-12 01:33:11,782] Trial 377 finished with value: 2.318948203404773 and parameters: {'timeframe': 'M1', 'atr_period': 13, 'atr_threshold': 2.0, 'pt_mult': 0.5, 'sl_mult': 5.0, 'td_mins': 5}. Best is trial 337 with value: 2.318948203404773.
[I 2026-03-12 01:33:11,872] Trial 378 finished with value: 2.318948203404773 and parameters: {'timeframe': 'M1', 'atr_period': 13, 'atr_threshold': 2.0, 'pt_mult': 0.5, 'sl_mult': 5.0, 'td_mins': 5}. Best is trial 337 with value: 2.318948203404773.
[I 2026-03-12 01:33:12,000] Trial 379 finished with value: 1.9675745537951908 and parameters: {'timeframe': 'M1', 'atr_period': 13, 'atr_threshold': 2.0, 'pt_mult': 0.5, 'sl_mult': 5.0, 'td_mins': 15}. Best is trial 337 with value: 2.318948203404773.
[I 2026-03-12 01:33:12,087] Trial 380 finished with value: 2.318948203404773 and parameters: {'timeframe': 'M1', 'atr_period': 13, 'atr_threshold': 2.0, 'pt_mult': 0.5, 'sl_mult': 5.0, 'td_mins': 5}. Best is trial 337 with value: 2.318948203404773.
[I 2026-03-12 01:33:12,175] Trial 381 finished with value: 2.318948203404773 and parameters: {'timeframe': 'M1', 'atr_period': 13, 'atr_threshold': 2.0, 'pt_mult': 0.5, 'sl_mult': 5.0, 'td_mins': 5}. Best is trial 337 with value: 2.318948203404773.
[I 2026-03-12 01:33:12,274] Trial 382 finished with value: 2.318948203404773 and parameters: {'timeframe': 'M1', 'atr_period': 13, 'atr_threshold': 2.0, 'pt_mult': 0.5, 'sl_mult': 5.0, 'td_mins': 5}. Best is trial 337 with value: 2.318948203404773.
[I 2026-03-12 01:33:12,381] Trial 383 finished with value: 2.318948203404773 and parameters: {'timeframe': 'M1', 'atr_period': 13, 'atr_threshold': 2.0, 'pt_mult': 0.5, 'sl_mult': 5.0, 'td_mins': 5}. Best is trial 337 with value: 2.318948203404773.
[I 2026-03-12 01:33:12,483] Trial 384 finished with value: 2.318948203404773 and parameters: {'timeframe': 'M1', 'atr_period': 13, 'atr_threshold': 2.0, 'pt_mult': 0.5, 'sl_mult': 5.0, 'td_mins': 5}. Best is trial 337 with value: 2.318948203404773.
[I 2026-03-12 01:33:12,586] Trial 385 finished with value: 2.318948203404773 and parameters: {'timeframe': 'M1', 'atr_period': 13, 'atr_threshold': 2.0, 'pt_mult': 0.5, 'sl_mult': 5.0, 'td_mins': 5}. Best is trial 337 with value: 2.318948203404773.
[I 2026-03-12 01:33:12,696] Trial 386 finished with value: 2.318948203404773 and parameters: {'timeframe': 'M1', 'atr_period': 13, 'atr_threshold': 2.0, 'pt_mult': 0.5, 'sl_mult': 5.0, 'td_mins': 5}. Best is trial 337 with value: 2.318948203404773.
[I 2026-03-12 01:33:12,784] Trial 387 finished with value: 2.318948203404773 and parameters: {'timeframe': 'M1', 'atr_period': 13, 'atr_threshold': 2.0, 'pt_mult': 0.5, 'sl_mult': 5.0, 'td_mins': 5}. Best is trial 337 with value: 2.318948203404773.
[I 2026-03-12 01:33:12,873] Trial 388 finished with value: 2.318948203404773 and parameters: {'timeframe': 'M1', 'atr_period': 13, 'atr_threshold': 2.0, 'pt_mult': 0.5, 'sl_mult': 5.0, 'td_mins': 5}. Best is trial 337 with value: 2.318948203404773.
[I 2026-03-12 01:33:12,963] Trial 389 finished with value: 2.318948203404773 and parameters: {'timeframe': 'M1', 'atr_period': 13, 'atr_threshold': 2.0, 'pt_mult': 0.5, 'sl_mult': 5.0, 'td_mins': 5}. Best is trial 337 with value: 2.318948203404773.
