[I 2026-03-12 02:08:11,999] Trial 66 finished with value: 1.8602282650499926 and parameters: {'timeframe': 'mixed', 'atr_period': 13, 'atr_threshold': 5.0, 'pt_mult': 1.0, 'sl_mult': 5.0, 'td_mins': 30}. Best is trial 50 with value: 43.32685925026577.
[I 2026-03-12 02:08:12,208] Trial 67 pruned. 
[I 2026-03-12 02:08:12,375] Trial 68 finished with value: 0.0 and parameters: {'timeframe': 'mixed', 'atr_period': 13, 'atr_threshold': 10.0, 'pt_mult': 5.0, 'sl_mult': 5.0, 'td_mins': 60}. Best is trial 50 with value: 43.32685925026577.
[I 2026-03-12 02:08:12,698] Trial 69 pruned. 
[I 2026-03-12 02:08:12,896] Trial 70 pruned. 
[I 2026-03-12 02:08:13,272] Trial 71 finished with value: 2.406823683574585 and parameters: {'timeframe': 'mixed', 'atr_period': 13, 'atr_threshold': 5.0, 'pt_mult': 5.0, 'sl_mult': 5.0, 'td_mins': 180}. Best is trial 50 with value: 43.32685925026577.
[I 2026-03-12 02:08:13,940] Trial 72 finished with value: 1.5227156504289359 and parameters: {'timeframe': 'mixed', 'atr_period': 13, 'atr_threshold': 5.0, 'pt_mult': 0.5, 'sl_mult': 2.5, 'td_mins': 720}. Best is trial 50 with value: 43.32685925026577.
[I 2026-03-12 02:08:14,511] Trial 73 pruned. 
[I 2026-03-12 02:08:15,618] Trial 74 finished with value: 1.9646741865906328 and parameters: {'timeframe': 'mixed', 'atr_period': 13, 'atr_threshold': 2.0, 'pt_mult': 0.5, 'sl_mult': 5.0, 'td_mins': 60}. Best is trial 50 with value: 43.32685925026577.
[I 2026-03-12 02:08:15,795] Trial 75 finished with value: 0.0 and parameters: {'timeframe': 'mixed', 'atr_period': 13, 'atr_threshold': 10.0, 'pt_mult': 2.5, 'sl_mult': 2.5, 'td_mins': 30}. Best is trial 50 with value: 43.32685925026577.
[I 2026-03-12 02:08:28,401] Trial 76 finished with value: 0.985271197866864 and parameters: {'timeframe': 'mixed', 'atr_period': 13, 'atr_threshold': 1.0, 'pt_mult': 2.5, 'sl_mult': 0.5, 'td_mins': 1200}. Best is trial 50 with value: 43.32685925026577.
[I 2026-03-12 02:08:28,795] Trial 77 pruned. 
[I 2026-03-12 02:08:30,269] Trial 78 pruned. 
[I 2026-03-12 02:08:30,437] Trial 79 finished with value: 0.0 and parameters: {'timeframe': 'mixed', 'atr_period': 13, 'atr_threshold': 15.0, 'pt_mult': 0.5, 'sl_mult': 2.5, 'td_mins': 30}. Best is trial 50 with value: 43.32685925026577.
[I 2026-03-12 02:08:30,807] Trial 80 pruned. 
[I 2026-03-12 02:08:30,980] Trial 81 finished with value: 0.0 and parameters: {'timeframe': 'mixed', 'atr_period': 13, 'atr_threshold': 15.0, 'pt_mult': 1.0, 'sl_mult': 0.5, 'td_mins': 15}. Best is trial 50 with value: 43.32685925026577.
[I 2026-03-12 02:08:31,149] Trial 82 finished with value: 0.0 and parameters: {'timeframe': 'mixed', 'atr_period': 13, 'atr_threshold': 15.0, 'pt_mult': 5.0, 'sl_mult': 2.5, 'td_mins': 120}. Best is trial 50 with value: 43.32685925026577.
[I 2026-03-12 02:08:33,316] Trial 83 pruned. 
[I 2026-03-12 02:08:33,486] Trial 84 finished with value: 0.0 and parameters: {'timeframe': 'mixed', 'atr_period': 13, 'atr_threshold': 10.0, 'pt_mult': 5.0, 'sl_mult': 0.5, 'td_mins': 180}. Best is trial 50 with value: 43.32685925026577.
[I 2026-03-12 02:08:34,505] Trial 85 pruned. 
[I 2026-03-12 02:08:34,893] Trial 86 pruned. 
[I 2026-03-12 02:08:35,004] Trial 87 pruned. 
[I 2026-03-12 02:08:35,916] Trial 88 pruned. 
[I 2026-03-12 02:08:36,084] Trial 89 finished with value: 0.0 and parameters: {'timeframe': 'mixed', 'atr_period': 13, 'atr_threshold': 15.0, 'pt_mult': 5.0, 'sl_mult': 5.0, 'td_mins': 720}. Best is trial 50 with value: 43.32685925026577.
[I 2026-03-12 02:08:36,385] Trial 90 finished with value: 5.027591010621808 and parameters: {'timeframe': 'mixed', 'atr_period': 13, 'atr_threshold': 5.0, 'pt_mult': 0.5, 'sl_mult': 5.0, 'td_mins': 120}. Best is trial 50 with value: 43.32685925026577.
[I 2026-03-12 02:08:36,791] Trial 91 pruned. 
[I 2026-03-12 02:08:36,961] Trial 92 finished with value: 0.0 and parameters: {'timeframe': 'mixed', 'atr_period': 13, 'atr_threshold': 15.0, 'pt_mult': 5.0, 'sl_mult': 0.5, 'td_mins': 1200}. Best is trial 50 with value: 43.32685925026577.
[I 2026-03-12 02:08:37,125] Trial 93 finished with value: 0.0 and parameters: {'timeframe': 'mixed', 'atr_period': 13, 'atr_threshold': 10.0, 'pt_mult': 0.5, 'sl_mult': 2.5, 'td_mins': 60}. Best is trial 50 with value: 43.32685925026577.
[I 2026-03-12 02:08:37,337] Trial 94 pruned. 
[I 2026-03-12 02:08:37,506] Trial 95 finished with value: 0.0 and parameters: {'timeframe': 'mixed', 'atr_period': 13, 'atr_threshold': 10.0, 'pt_mult': 5.0, 'sl_mult': 5.0, 'td_mins': 180}. Best is trial 50 with value: 43.32685925026577.
[I 2026-03-12 02:08:37,671] Trial 96 finished with value: 0.0 and parameters: {'timeframe': 'mixed', 'atr_period': 13, 'atr_threshold': 10.0, 'pt_mult': 2.5, 'sl_mult': 1.0, 'td_mins': 360}. Best is trial 50 with value: 43.32685925026577.
[I 2026-03-12 02:08:37,811] Trial 97 pruned. 
[I 2026-03-12 02:08:37,995] Trial 98 pruned. 
[I 2026-03-12 02:08:50,200] Trial 99 finished with value: 1.0494265532275988 and parameters: {'timeframe': 'mixed', 'atr_period': 13, 'atr_threshold': 1.0, 'pt_mult': 1.0, 'sl_mult': 5.0, 'td_mins': 720}. Best is trial 50 with value: 43.32685925026577.
[I 2026-03-12 02:08:50,736] Trial 100 pruned. 
[I 2026-03-12 02:08:52,372] Trial 101 finished with value: 3.1181653989779536 and parameters: {'timeframe': 'mixed', 'atr_period': 13, 'atr_threshold': 5.0, 'pt_mult': 5.0, 'sl_mult': 2.5, 'td_mins': 1200}. Best is trial 50 with value: 43.32685925026577.
[I 2026-03-12 02:08:54,329] Trial 102 pruned. 
[I 2026-03-12 02:08:54,433] Trial 103 pruned. 
[I 2026-03-12 02:08:54,578] Trial 104 pruned. 
[I 2026-03-12 02:08:54,963] Trial 105 pruned. 
[I 2026-03-12 02:08:55,119] Trial 106 pruned. 
[I 2026-03-12 02:08:55,472] Trial 107 pruned. 
[I 2026-03-12 02:08:55,623] Trial 108 pruned. 
[I 2026-03-12 02:08:55,783] Trial 109 pruned. 
[I 2026-03-12 02:08:59,431] Trial 110 pruned. 
[I 2026-03-12 02:08:59,601] Trial 111 finished with value: 0.0 and parameters: {'timeframe': 'mixed', 'atr_period': 13, 'atr_threshold': 15.0, 'pt_mult': 1.0, 'sl_mult': 0.5, 'td_mins': 1080}. Best is trial 50 with value: 43.32685925026577.
[I 2026-03-12 02:08:59,745] Trial 112 pruned. 
[I 2026-03-12 02:09:00,051] Trial 113 pruned. 
[I 2026-03-12 02:09:04,099] Trial 114 finished with value: 1.4333314634868186 and parameters: {'timeframe': 'mixed', 'atr_period': 13, 'atr_threshold': 3.0, 'pt_mult': 2.5, 'sl_mult': 5.0, 'td_mins': 720}. Best is trial 50 with value: 43.32685925026577.
[I 2026-03-12 02:09:04,266] Trial 115 finished with value: 0.0 and parameters: {'timeframe': 'mixed', 'atr_period': 13, 'atr_threshold': 10.0, 'pt_mult': 0.5, 'sl_mult': 0.5, 'td_mins': 15}. Best is trial 50 with value: 43.32685925026577.
[I 2026-03-12 02:09:04,410] Trial 116 pruned. 
[I 2026-03-12 02:09:04,898] Trial 117 pruned. 
[I 2026-03-12 02:09:05,064] Trial 118 finished with value: 0.0 and parameters: {'timeframe': 'mixed', 'atr_period': 13, 'atr_threshold': 15.0, 'pt_mult': 2.5, 'sl_mult': 5.0, 'td_mins': 120}. Best is trial 50 with value: 43.32685925026577.
[I 2026-03-12 02:09:05,229] Trial 119 finished with value: 0.0 and parameters: {'timeframe': 'mixed', 'atr_period': 13, 'atr_threshold': 10.0, 'pt_mult': 0.5, 'sl_mult': 2.5, 'td_mins': 360}. Best is trial 50 with value: 43.32685925026577.
[I 2026-03-12 02:09:05,355] Trial 120 pruned. 
[I 2026-03-12 02:09:05,580] Trial 121 pruned. 
[I 2026-03-12 02:09:05,726] Trial 122 pruned. 
[I 2026-03-12 02:09:08,601] Trial 123 pruned. 
[I 2026-03-12 02:09:16,171] Trial 124 pruned. 
[I 2026-03-12 02:09:17,363] Trial 125 pruned. 
[I 2026-03-12 02:09:17,543] Trial 126 finished with value: 0.0 and parameters: {'timeframe': 'mixed', 'atr_period': 13, 'atr_threshold': 15.0, 'pt_mult': 5.0, 'sl_mult': 0.5, 'td_mins': 120}. Best is trial 50 with value: 43.32685925026577.
[I 2026-03-12 02:09:17,662] Trial 127 pruned. 
[I 2026-03-12 02:09:23,418] Trial 128 pruned. 
[I 2026-03-12 02:09:23,593] Trial 129 pruned. 
[I 2026-03-12 02:09:24,177] Trial 130 pruned. 
[I 2026-03-12 02:09:25,682] Trial 131 pruned. 
[I 2026-03-12 02:09:27,467] Trial 132 pruned. 
[I 2026-03-12 02:09:27,644] Trial 133 finished with value: 0.0 and parameters: {'timeframe': 'mixed', 'atr_period': 13, 'atr_threshold': 15.0, 'pt_mult': 5.0, 'sl_mult': 0.5, 'td_mins': 1080}. Best is trial 50 with value: 43.32685925026577.
[I 2026-03-12 02:09:28,432] Trial 134 pruned. 
[I 2026-03-12 02:09:28,605] Trial 135 finished with value: 0.0 and parameters: {'timeframe': 'mixed', 'atr_period': 13, 'atr_threshold': 15.0, 'pt_mult': 2.5, 'sl_mult': 5.0, 'td_mins': 1080}. Best is trial 50 with value: 43.32685925026577.
[I 2026-03-12 02:09:29,647] Trial 136 pruned. 
[I 2026-03-12 02:09:29,811] Trial 137 pruned. 
[I 2026-03-12 02:09:29,994] Trial 138 finished with value: 0.0 and parameters: {'timeframe': 'mixed', 'atr_period': 13, 'atr_threshold': 10.0, 'pt_mult': 1.0, 'sl_mult': 0.5, 'td_mins': 360}. Best is trial 50 with value: 43.32685925026577.
[I 2026-03-12 02:09:34,122] Trial 139 pruned. 
[I 2026-03-12 02:09:34,820] Trial 140 pruned. 
[I 2026-03-12 02:09:36,194] Trial 141 finished with value: 1.2752532441055646 and parameters: {'timeframe': 'mixed', 'atr_period': 13, 'atr_threshold': 1.0, 'pt_mult': 1.0, 'sl_mult': 5.0, 'td_mins': 30}. Best is trial 50 with value: 43.32685925026577.
[I 2026-03-12 02:09:37,000] Trial 142 pruned. 
[I 2026-03-12 02:09:37,279] Trial 143 pruned. 
[I 2026-03-12 02:09:37,469] Trial 144 finished with value: 0.0 and parameters: {'timeframe': 'mixed', 'atr_period': 13, 'atr_threshold': 15.0, 'pt_mult': 5.0, 'sl_mult': 2.5, 'td_mins': 5}. Best is trial 50 with value: 43.32685925026577.
[I 2026-03-12 02:09:37,639] Trial 145 finished with value: 0.0 and parameters: {'timeframe': 'mixed', 'atr_period': 13, 'atr_threshold': 10.0, 'pt_mult': 1.0, 'sl_mult': 5.0, 'td_mins': 5}. Best is trial 50 with value: 43.32685925026577.
[I 2026-03-12 02:09:38,655] Trial 146 pruned. 
[I 2026-03-12 02:09:38,761] Trial 147 pruned. 
[I 2026-03-12 02:09:38,871] Trial 148 pruned. 
[I 2026-03-12 02:09:40,044] Trial 149 pruned. 
[I 2026-03-12 02:09:40,382] Trial 150 pruned. 
[I 2026-03-12 02:09:40,528] Trial 151 pruned. 
[I 2026-03-12 02:09:44,814] Trial 152 pruned. 
[I 2026-03-12 02:09:45,371] Trial 153 finished with value: 1.8985786117381782 and parameters: {'timeframe': 'mixed', 'atr_period': 13, 'atr_threshold': 3.0, 'pt_mult': 1.0, 'sl_mult': 5.0, 'td_mins': 60}. Best is trial 50 with value: 43.32685925026577.
[I 2026-03-12 02:09:47,594] Trial 154 finished with value: 1.365337375672344 and parameters: {'timeframe': 'mixed', 'atr_period': 13, 'atr_threshold': 1.0, 'pt_mult': 1.0, 'sl_mult': 5.0, 'td_mins': 60}. Best is trial 50 with value: 43.32685925026577.
[I 2026-03-12 02:09:47,733] Trial 155 pruned. 
[I 2026-03-12 02:09:48,371] Trial 156 pruned. 
[I 2026-03-12 02:09:48,965] Trial 157 pruned. 
[I 2026-03-12 02:09:49,136] Trial 158 finished with value: 0.0 and parameters: {'timeframe': 'mixed', 'atr_period': 13, 'atr_threshold': 15.0, 'pt_mult': 2.5, 'sl_mult': 5.0, 'td_mins': 180}. Best is trial 50 with value: 43.32685925026577.
[I 2026-03-12 02:09:49,302] Trial 159 finished with value: 0.0 and parameters: {'timeframe': 'mixed', 'atr_period': 13, 'atr_threshold': 15.0, 'pt_mult': 2.5, 'sl_mult': 5.0, 'td_mins': 5}. Best is trial 50 with value: 43.32685925026577.
[I 2026-03-12 02:09:50,483] Trial 160 finished with value: 17.016304956723822 and parameters: {'timeframe': 'mixed', 'atr_period': 13, 'atr_threshold': 5.0, 'pt_mult': 1.0, 'sl_mult': 5.0, 'td_mins': 1080}. Best is trial 50 with value: 43.32685925026577.
[I 2026-03-12 02:09:50,774] Trial 161 finished with value: 3.7555546595771974 and parameters: {'timeframe': 'mixed', 'atr_period': 13, 'atr_threshold': 5.0, 'pt_mult': 1.0, 'sl_mult': 5.0, 'td_mins': 120}. Best is trial 50 with value: 43.32685925026577.
[I 2026-03-12 02:09:51,092] Trial 162 finished with value: 7.272017553876298 and parameters: {'timeframe': 'mixed', 'atr_period': 13, 'atr_threshold': 5.0, 'pt_mult': 0.5, 'sl_mult': 2.5, 'td_mins': 180}. Best is trial 50 with value: 43.32685925026577.
[I 2026-03-12 02:09:51,302] Trial 163 finished with value: 0.0 and parameters: {'timeframe': 'mixed', 'atr_period': 13, 'atr_threshold': 10.0, 'pt_mult': 1.0, 'sl_mult': 0.5, 'td_mins': 180}. Best is trial 50 with value: 43.32685925026577.
[I 2026-03-12 02:09:51,736] Trial 164 pruned. 
[I 2026-03-12 02:09:53,446] Trial 165 finished with value: 1.7497011426398763 and parameters: {'timeframe': 'mixed', 'atr_period': 13, 'atr_threshold': 3.0, 'pt_mult': 0.5, 'sl_mult': 5.0, 'td_mins': 360}. Best is trial 50 with value: 43.32685925026577.
[I 2026-03-12 02:09:53,744] Trial 166 pruned. 
[I 2026-03-12 02:09:53,917] Trial 167 finished with value: 0.0 and parameters: {'timeframe': 'mixed', 'atr_period': 13, 'atr_threshold': 15.0, 'pt_mult': 1.0, 'sl_mult': 1.0, 'td_mins': 1200}. Best is trial 50 with value: 43.32685925026577.
[I 2026-03-12 02:09:54,081] Trial 168 finished with value: 0.0 and parameters: {'timeframe': 'mixed', 'atr_period': 13, 'atr_threshold': 10.0, 'pt_mult': 5.0, 'sl_mult': 2.5, 'td_mins': 1200}. Best is trial 50 with value: 43.32685925026577.
[I 2026-03-12 02:09:54,234] Trial 169 pruned. 
[I 2026-03-12 02:09:54,380] Trial 170 pruned. 
[I 2026-03-12 02:09:54,548] Trial 171 finished with value: 0.0 and parameters: {'timeframe': 'mixed', 'atr_period': 13, 'atr_threshold': 10.0, 'pt_mult': 1.0, 'sl_mult': 5.0, 'td_mins': 180}. Best is trial 50 with value: 43.32685925026577.
[I 2026-03-12 02:09:54,690] Trial 172 pruned. 
[I 2026-03-12 02:09:54,985] Trial 173 pruned. 
[I 2026-03-12 02:09:55,141] Trial 174 pruned. 
[I 2026-03-12 02:09:55,428] Trial 175 pruned. 
[I 2026-03-12 02:09:55,581] Trial 176 pruned. 
[I 2026-03-12 02:09:55,684] Trial 177 pruned. 
[I 2026-03-12 02:09:55,803] Trial 178 pruned. 
[I 2026-03-12 02:09:55,948] Trial 179 pruned. 
[I 2026-03-12 02:09:56,107] Trial 180 pruned. 
[I 2026-03-12 02:09:56,210] Trial 181 pruned. 
[I 2026-03-12 02:09:56,607] Trial 182 pruned. 
[I 2026-03-12 02:09:56,778] Trial 183 finished with value: 0.0 and parameters: {'timeframe': 'mixed', 'atr_period': 13, 'atr_threshold': 15.0, 'pt_mult': 0.5, 'sl_mult': 5.0, 'td_mins': 720}. Best is trial 50 with value: 43.32685925026577.
[I 2026-03-12 02:09:59,001] Trial 184 pruned. 
[I 2026-03-12 02:09:59,173] Trial 185 finished with value: 0.0 and parameters: {'timeframe': 'mixed', 'atr_period': 13, 'atr_threshold': 15.0, 'pt_mult': 5.0, 'sl_mult': 5.0, 'td_mins': 5}. Best is trial 50 with value: 43.32685925026577.
[I 2026-03-12 02:10:00,569] Trial 186 pruned. 
[I 2026-03-12 02:10:00,674] Trial 187 pruned. 
[I 2026-03-12 02:10:00,839] Trial 188 finished with value: 0.0 and parameters: {'timeframe': 'mixed', 'atr_period': 13, 'atr_threshold': 15.0, 'pt_mult': 2.5, 'sl_mult': 0.5, 'td_mins': 30}. Best is trial 50 with value: 43.32685925026577.
[I 2026-03-12 02:10:00,976] Trial 189 pruned. 
[I 2026-03-12 02:10:01,188] Trial 190 finished with value: 2.7543976726628343 and parameters: {'timeframe': 'mixed', 'atr_period': 13, 'atr_threshold': 5.0, 'pt_mult': 0.5, 'sl_mult': 5.0, 'td_mins': 30}. Best is trial 50 with value: 43.32685925026577.
[I 2026-03-12 02:10:01,353] Trial 191 finished with value: 0.0 and parameters: {'timeframe': 'mixed', 'atr_period': 13, 'atr_threshold': 15.0, 'pt_mult': 1.0, 'sl_mult': 2.5, 'td_mins': 1080}. Best is trial 50 with value: 43.32685925026577.
[I 2026-03-12 02:10:03,177] Trial 192 finished with value: 30.408273324481236 and parameters: {'timeframe': 'mixed', 'atr_period': 13, 'atr_threshold': 5.0, 'pt_mult': 5.0, 'sl_mult': 5.0, 'td_mins': 1200}. Best is trial 50 with value: 43.32685925026577.
[I 2026-03-12 02:10:03,280] Trial 193 pruned. 
[I 2026-03-12 02:10:03,445] Trial 194 finished with value: 0.0 and parameters: {'timeframe': 'mixed', 'atr_period': 13, 'atr_threshold': 15.0, 'pt_mult': 2.5, 'sl_mult': 0.5, 'td_mins': 1200}. Best is trial 50 with value: 43.32685925026577.
[I 2026-03-12 02:10:04,134] Trial 195 finished with value: 1.417836267646774 and parameters: {'timeframe': 'mixed', 'atr_period': 13, 'atr_threshold': 5.0, 'pt_mult': 2.5, 'sl_mult': 0.5, 'td_mins': 720}. Best is trial 50 with value: 43.32685925026577.
[I 2026-03-12 02:10:04,235] Trial 196 pruned. 
[I 2026-03-12 02:10:04,617] Trial 197 finished with value: 1.4592473834046804 and parameters: {'timeframe': 'mixed', 'atr_period': 13, 'atr_threshold': 3.0, 'pt_mult': 1.0, 'sl_mult': 5.0, 'td_mins': 30}. Best is trial 50 with value: 43.32685925026577.
[I 2026-03-12 02:10:04,782] Trial 198 finished with value: 0.0 and parameters: {'timeframe': 'mixed', 'atr_period': 13, 'atr_threshold': 10.0, 'pt_mult': 0.5, 'sl_mult': 1.0, 'td_mins': 1080}. Best is trial 50 with value: 43.32685925026577.
[I 2026-03-12 02:10:04,890] Trial 199 pruned. 
[I 2026-03-12 02:10:05,058] Trial 200 finished with value: 0.0 and parameters: {'timeframe': 'mixed', 'atr_period': 13, 'atr_threshold': 15.0, 'pt_mult': 5.0, 'sl_mult': 0.5, 'td_mins': 720}. Best is trial 50 with value: 43.32685925026577.
[I 2026-03-12 02:10:05,200] Trial 201 pruned. 
[I 2026-03-12 02:10:05,367] Trial 202 finished with value: 0.0 and parameters: {'timeframe': 'mixed', 'atr_period': 13, 'atr_threshold': 15.0, 'pt_mult': 1.0, 'sl_mult': 2.5, 'td_mins': 15}. Best is trial 50 with value: 43.32685925026577.
[I 2026-03-12 02:10:08,160] Trial 203 pruned. 
[I 2026-03-12 02:10:08,280] Trial 204 pruned. 
[I 2026-03-12 02:10:08,429] Trial 205 pruned. 
[I 2026-03-12 02:10:09,204] Trial 206 pruned. 
[I 2026-03-12 02:10:14,624] Trial 207 pruned. 
[I 2026-03-12 02:10:15,297] Trial 208 pruned. 
[I 2026-03-12 02:10:15,427] Trial 209 pruned. 
[I 2026-03-12 02:10:18,700] Trial 210 pruned. 
[I 2026-03-12 02:10:19,082] Trial 211 pruned. 
[I 2026-03-12 02:10:19,249] Trial 212 finished with value: 0.0 and parameters: {'timeframe': 'mixed', 'atr_period': 13, 'atr_threshold': 10.0, 'pt_mult': 1.0, 'sl_mult': 5.0, 'td_mins': 180}. Best is trial 50 with value: 43.32685925026577.
[I 2026-03-12 02:10:21,988] Trial 213 pruned. 
[I 2026-03-12 02:10:22,136] Trial 214 pruned. 
[I 2026-03-12 02:10:22,516] Trial 215 pruned. 
[I 2026-03-12 02:10:22,693] Trial 216 finished with value: 0.0 and parameters: {'timeframe': 'mixed', 'atr_period': 13, 'atr_threshold': 10.0, 'pt_mult': 1.0, 'sl_mult': 2.5, 'td_mins': 60}. Best is trial 50 with value: 43.32685925026577.
[I 2026-03-12 02:10:23,197] Trial 217 finished with value: 1.4092407585521092 and parameters: {'timeframe': 'mixed', 'atr_period': 13, 'atr_threshold': 3.0, 'pt_mult': 0.5, 'sl_mult': 2.5, 'td_mins': 60}. Best is trial 50 with value: 43.32685925026577.
[I 2026-03-12 02:10:23,437] Trial 218 pruned. 
[I 2026-03-12 02:10:23,604] Trial 219 finished with value: 0.0 and parameters: {'timeframe': 'mixed', 'atr_period': 13, 'atr_threshold': 10.0, 'pt_mult': 1.0, 'sl_mult': 2.5, 'td_mins': 180}. Best is trial 50 with value: 43.32685925026577.
[I 2026-03-12 02:10:24,109] Trial 220 pruned. 
[I 2026-03-12 02:10:24,262] Trial 221 pruned. 
[I 2026-03-12 02:10:24,367] Trial 222 pruned. 
[I 2026-03-12 02:10:28,599] Trial 223 pruned. 
[I 2026-03-12 02:10:31,640] Trial 224 pruned. 
[I 2026-03-12 02:10:31,788] Trial 225 pruned. 
[I 2026-03-12 02:10:31,924] Trial 226 pruned. 
[I 2026-03-12 02:10:32,126] Trial 227 pruned. 
[I 2026-03-12 02:10:32,310] Trial 228 finished with value: 0.0 and parameters: {'timeframe': 'mixed', 'atr_period': 13, 'atr_threshold': 15.0, 'pt_mult': 0.5, 'sl_mult': 1.0, 'td_mins': 360}. Best is trial 50 with value: 43.32685925026577.
[I 2026-03-12 02:10:32,461] Trial 229 pruned. 
[I 2026-03-12 02:10:33,579] Trial 230 pruned. 
[I 2026-03-12 02:10:33,773] Trial 231 finished with value: 0.0 and parameters: {'timeframe': 'mixed', 'atr_period': 13, 'atr_threshold': 10.0, 'pt_mult': 2.5, 'sl_mult': 5.0, 'td_mins': 15}. Best is trial 50 with value: 43.32685925026577.
[I 2026-03-12 02:10:33,938] Trial 232 finished with value: 0.0 and parameters: {'timeframe': 'mixed', 'atr_period': 13, 'atr_threshold': 10.0, 'pt_mult': 0.5, 'sl_mult': 0.5, 'td_mins': 180}. Best is trial 50 with value: 43.32685925026577.
[I 2026-03-12 02:10:34,108] Trial 233 finished with value: 0.0 and parameters: {'timeframe': 'mixed', 'atr_period': 13, 'atr_threshold': 15.0, 'pt_mult': 1.0, 'sl_mult': 0.5, 'td_mins': 5}. Best is trial 50 with value: 43.32685925026577.
[I 2026-03-12 02:10:34,755] Trial 234 pruned. 
[I 2026-03-12 02:10:37,954] Trial 235 pruned. 
[I 2026-03-12 02:10:38,382] Trial 236 pruned. 
[I 2026-03-12 02:10:38,572] Trial 237 finished with value: 0.0 and parameters: {'timeframe': 'mixed', 'atr_period': 13, 'atr_threshold': 15.0, 'pt_mult': 5.0, 'sl_mult': 5.0, 'td_mins': 120}. Best is trial 50 with value: 43.32685925026577.
[I 2026-03-12 02:10:38,725] Trial 238 pruned. 
[I 2026-03-12 02:10:38,903] Trial 239 finished with value: 0.0 and parameters: {'timeframe': 'mixed', 'atr_period': 13, 'atr_threshold': 10.0, 'pt_mult': 5.0, 'sl_mult': 1.0, 'td_mins': 360}. Best is trial 50 with value: 43.32685925026577.
[I 2026-03-12 02:10:39,081] Trial 240 pruned. 
[I 2026-03-12 02:10:40,547] Trial 241 pruned. 
[I 2026-03-12 02:10:40,696] Trial 242 pruned. 
[I 2026-03-12 02:10:40,841] Trial 243 pruned. 
[I 2026-03-12 02:10:41,008] Trial 244 finished with value: 0.0 and parameters: {'timeframe': 'mixed', 'atr_period': 13, 'atr_threshold': 10.0, 'pt_mult': 2.5, 'sl_mult': 2.5, 'td_mins': 1200}. Best is trial 50 with value: 43.32685925026577.
[I 2026-03-12 02:10:43,468] Trial 245 pruned. 
[I 2026-03-12 02:10:43,615] Trial 246 pruned. 
[I 2026-03-12 02:10:44,122] Trial 247 pruned. 
[I 2026-03-12 02:10:45,696] Trial 248 finished with value: 3.1113812867113615 and parameters: {'timeframe': 'mixed', 'atr_period': 13, 'atr_threshold': 5.0, 'pt_mult': 5.0, 'sl_mult': 2.5, 'td_mins': 1080}. Best is trial 50 with value: 43.32685925026577.
[I 2026-03-12 02:10:45,846] Trial 249 pruned. 
[I 2026-03-12 02:10:46,520] Trial 250 pruned. 
[I 2026-03-12 02:10:46,900] Trial 251 pruned. 
