[I 2026-03-12 02:05:31,261] Trial 990 finished with value: 2.627710256873383 and parameters: {'timeframe': 'M15', 'atr_period': 13, 'atr_threshold': 3.0, 'pt_mult': 0.5, 'sl_mult': 5.0, 'td_mins': 120}. Best is trial 393 with value: 2.627710256873383.
[I 2026-03-12 02:05:31,326] Trial 991 pruned. 
[I 2026-03-12 02:05:31,409] Trial 992 pruned. 
[I 2026-03-12 02:05:31,462] Trial 993 finished with value: 0.0 and parameters: {'timeframe': 'M15', 'atr_period': 13, 'atr_threshold': 10.0, 'pt_mult': 2.5, 'sl_mult': 0.5, 'td_mins': 120}. Best is trial 393 with value: 2.627710256873383.
[I 2026-03-12 02:05:31,743] Trial 994 finished with value: 2.627710256873383 and parameters: {'timeframe': 'M15', 'atr_period': 13, 'atr_threshold': 3.0, 'pt_mult': 0.5, 'sl_mult': 5.0, 'td_mins': 120}. Best is trial 393 with value: 2.627710256873383.
[I 2026-03-12 02:05:31,939] Trial 995 pruned. 
[I 2026-03-12 02:05:32,013] Trial 996 pruned. 
[I 2026-03-12 02:05:32,075] Trial 997 pruned. 
[I 2026-03-12 02:05:32,126] Trial 998 finished with value: 0.0 and parameters: {'timeframe': 'M15', 'atr_period': 13, 'atr_threshold': 15.0, 'pt_mult': 0.5, 'sl_mult': 5.0, 'td_mins': 120}. Best is trial 393 with value: 2.627710256873383.
[I 2026-03-12 02:05:32,395] Trial 999 finished with value: 2.627710256873383 and parameters: {'timeframe': 'M15', 'atr_period': 13, 'atr_threshold': 3.0, 'pt_mult': 0.5, 'sl_mult': 5.0, 'td_mins': 120}. Best is trial 393 with value: 2.627710256873383.

==========================================================================================
🏆 M1 Top 10 Configurations [SHORT ONLY] 🏆
==========================================================================================
timeframe  atr_period  atr_threshold  pt_mult  sl_mult  td_mins  Total_Bets     Wins  Losses  Timeouts  Avg_ATR  Avg_Payoff     Total_NP   Timeout_NP  Adjusted_PF
       M1          13            2.0      0.5      5.0        5     30134.0  21007.0   174.0    8953.0   2.2746         0.1  221030901.0 -107436000.0     2.318948
       M1          13            2.0      0.5      5.0       15     30134.0  24515.0  1020.0    4599.0   2.2746         0.1  188000229.0  -55188000.0     1.967575
       M1          13            2.0      1.0      5.0        5     30134.0  14035.0   215.0   15884.0   2.2746         0.2  252145065.0 -190608000.0     1.802949
       M1          13            1.0      1.0      5.0       15    238327.0 155905.0  9755.0   72667.0   1.4413         0.2 1446505765.0 -872004000.0     1.698136
       M1          13            1.0      0.5      5.0       30    238327.0 205503.0 13837.0   18987.0   1.4413         0.1  501948417.0 -227844000.0     1.285731
       M1          13            2.0      2.5      5.0       60     30134.0  16468.0  6690.0    6976.0   2.2746         0.5  177219331.0  -83712000.0     1.250786
       M1          13            2.0      5.0      0.5     1080     30134.0   2910.0 27213.0      11.0   2.2746        10.0   31197772.0    -132000.0     1.200871
       M1          13            2.0      5.0      0.5     1200     30134.0   2910.0 27213.0      11.0   2.2746        10.0   31197772.0    -132000.0     1.200871
       M1          13            2.0      2.5      0.5      720     30134.0   5297.0 24837.0       0.0   2.2746         5.0   27624497.0          0.0     1.178491
       M1          13            2.0      2.5      0.5      120     30134.0   5284.0 24828.0      22.0   2.2746         5.0   26450899.0    -264000.0     1.166760

==========================================================================================
🏆 M3 Top 10 Configurations [SHORT ONLY] 🏆
==========================================================================================
timeframe  atr_period  atr_threshold  pt_mult  sl_mult  td_mins  Total_Bets     Wins  Losses  Timeouts  Avg_ATR  Avg_Payoff     Total_NP   Timeout_NP  Adjusted_PF
       M3          13            3.0      0.5      5.0       30     15584.0  11546.0   216.0    3822.0   3.5680         0.1  205639307.0  -45864000.0     2.710569
       M3          13            3.0      0.5      5.0       15     15584.0  10296.0    74.0    5214.0   3.5680         0.1  193921262.0  -62568000.0     2.613255
       M3          13            2.0      0.5      5.0       30     58411.0  43705.0   783.0   13923.0   2.7034         0.1  558378385.0 -167076000.0     2.561288
       M3          13            2.0      0.5      5.0       15     58411.0  38637.0   246.0   19528.0   2.7034         0.1  497938636.0 -234336000.0     2.393487
       M3          13            3.0      1.0      5.0       30     15584.0   8298.0   312.0    6974.0   3.5680         0.2  278718481.0  -83688000.0     2.387929
       M3          13            2.0      1.0      5.0       30     58411.0  31581.0  1087.0   25743.0   2.7034         0.2  747271506.0 -308916000.0     2.233159
       M3          13            2.0      0.5      5.0       60     58411.0  47273.0  1769.0    9369.0   2.7034         0.1  488870940.0 -112428000.0     2.124793
       M3          13            3.0      1.0      5.0      120     15584.0  11146.0  1240.0    3198.0   3.5680         0.2  225191685.0  -38376000.0     1.996254
       M3          13            3.0      0.5      5.0      120     15584.0  13238.0   783.0    1563.0   3.5680         0.1  124166986.0  -18756000.0     1.990479
       M3          13            1.0      0.5      5.0       30    235514.0 179785.0  4575.0   51154.0   1.7140         0.1 1139716913.0 -613848000.0     1.883712

==========================================================================================
🏆 M5 Top 10 Configurations [SHORT ONLY] 🏆
==========================================================================================
timeframe  atr_period  atr_threshold  pt_mult  sl_mult  td_mins  Total_Bets    Wins  Losses  Timeouts  Avg_ATR  Avg_Payoff    Total_NP   Timeout_NP  Adjusted_PF
       M5          13            3.0      0.5      5.0       60     20812.0 15570.0   346.0    4896.0   3.8332         0.1 292056986.0  -58752000.0     2.855576
       M5          13            3.0      0.5      5.0       30     20812.0 13835.0   144.0    6833.0   3.8332         0.1 276892412.0  -81996000.0     2.764226
       M5          13            3.0      0.5      5.0      120     20812.0 16788.0   693.0    3331.0   3.8332         0.1 246816536.0  -39972000.0     2.763198
       M5          13            3.0      1.0      5.0      120     20812.0 13264.0  1041.0    6507.0   3.8332         0.2 392750978.0  -78084000.0     2.428311
       M5          13            2.0      0.5      5.0       60     66076.0 49743.0  1149.0   15184.0   2.8553         0.1 640552899.0 -182208000.0     2.406101
       M5          13            3.0      1.0      5.0       60     20812.0 11181.0   501.0    9130.0   3.8332         0.2 395300342.0 -109560000.0     2.395138
       M5          13            3.0      1.0      5.0      180     20812.0 14083.0  1546.0    5183.0   3.8332         0.2 311478778.0  -62196000.0     2.332302
       M5          13            3.0      1.0      5.0       30     20812.0  8669.0   195.0   11948.0   3.8332         0.2 303521379.0 -143376000.0     2.099408
       M5          13            2.0      1.0      5.0       60     66076.0 36308.0  1678.0   28090.0   2.8553         0.2 863327038.0 -337080000.0     2.089008
       M5          13            3.0      2.5      5.0      360     20812.0  9502.0  3897.0    7413.0   3.8332         0.5 149661851.0  -88956000.0     1.987875

==========================================================================================
🏆 M8 Top 10 Configurations [SHORT ONLY] 🏆
==========================================================================================
timeframe  atr_period  atr_threshold  pt_mult  sl_mult  td_mins  Total_Bets    Wins  Losses  Timeouts  Avg_ATR  Avg_Payoff    Total_NP   Timeout_NP  Adjusted_PF
       M8          13            5.0      0.5      5.0      120      4314.0  3279.0    80.0     955.0   5.6988         0.1  94548186.0  -11460000.0     3.484125
       M8          13            5.0      0.5      5.0       60      4314.0  2992.0    38.0    1284.0   5.6988         0.1  96308905.0  -15408000.0     2.997964
       M8          13            5.0      0.5      5.0      180      4314.0  3383.0   146.0     785.0   5.6988         0.1  73154716.0   -9420000.0     2.850023
       M8          13            3.0      0.5      5.0       60     25684.0 17362.0   231.0    8091.0   4.0197         0.1 357584375.0  -97092000.0     2.831934
       M8          13            5.0      1.0      5.0      120      4314.0  2511.0   105.0    1698.0   5.6988         0.2 149798340.0  -20376000.0     2.798517
       M8          13            5.0      1.0      5.0      180      4314.0  2679.0   200.0    1435.0   5.6988         0.2 127035276.0  -17220000.0     2.529777
       M8          13            3.0      0.5      5.0      120     25684.0 19109.0   518.0    6057.0   4.0197         0.1 347600523.0  -72684000.0     2.512368
       M8          13            5.0      0.5      5.0       30      4314.0  2602.0    10.0    1702.0   5.6988         0.1  86704915.0  -20424000.0     2.489604
       M8          13            5.0      1.0      5.0       60      4314.0  2046.0    47.0    2221.0   5.6988         0.2 128463041.0  -26652000.0     2.411000
       M8          13            2.0      0.5      5.0       60     69919.0 47656.0   839.0   21424.0   3.0101         0.1 639121594.0 -257088000.0     2.252845

==========================================================================================
🏆 M15 Top 10 Configurations [SHORT ONLY] 🏆2026-03-12 02:05:32,454 - INFO - === Starting Optuna Optimization for mixed [SHORT_ONLY] (Trials: 1000) ===
/home/hephaestus-zero/.local/lib/python3.11/site-packages/optuna/_experimental.py:32: ExperimentalWarning: Argument ``multivariate`` is an experimental feature. The interface can change in the future.
  warnings.warn(
[I 2026-03-12 02:05:32,454] A new study created in memory with name: no-name-4ade1ec6-316d-4e72-95b9-17525191b246
[I 2026-03-12 02:05:37,226] Trial 0 finished with value: 0.6396734610193519 and parameters: {'timeframe': 'mixed', 'atr_period': 13, 'atr_threshold': 1.0, 'pt_mult': 5.0, 'sl_mult': 1.0, 'td_mins': 180}. Best is trial 0 with value: 0.6396734610193519.
[I 2026-03-12 02:05:37,384] Trial 1 finished with value: 0.0 and parameters: {'timeframe': 'mixed', 'atr_period': 13, 'atr_threshold': 15.0, 'pt_mult': 5.0, 'sl_mult': 2.5, 'td_mins': 60}. Best is trial 0 with value: 0.6396734610193519.
[I 2026-03-12 02:05:37,542] Trial 2 finished with value: 0.0 and parameters: {'timeframe': 'mixed', 'atr_period': 13, 'atr_threshold': 10.0, 'pt_mult': 1.0, 'sl_mult': 2.5, 'td_mins': 1080}. Best is trial 0 with value: 0.6396734610193519.
[I 2026-03-12 02:05:40,182] Trial 3 finished with value: 0.9714104507667904 and parameters: {'timeframe': 'mixed', 'atr_period': 13, 'atr_threshold': 0.5, 'pt_mult': 1.0, 'sl_mult': 2.5, 'td_mins': 60}. Best is trial 3 with value: 0.9714104507667904.
[I 2026-03-12 02:05:40,344] Trial 4 finished with value: 0.0 and parameters: {'timeframe': 'mixed', 'atr_period': 13, 'atr_threshold': 10.0, 'pt_mult': 5.0, 'sl_mult': 0.5, 'td_mins': 360}. Best is trial 3 with value: 0.9714104507667904.
[I 2026-03-12 02:05:42,571] Trial 5 finished with value: 0.37882523781510447 and parameters: {'timeframe': 'mixed', 'atr_period': 13, 'atr_threshold': 1.0, 'pt_mult': 5.0, 'sl_mult': 1.0, 'td_mins': 60}. Best is trial 3 with value: 0.9714104507667904.
[I 2026-03-12 02:05:48,555] Trial 6 finished with value: 1.165302256320248 and parameters: {'timeframe': 'mixed', 'atr_period': 13, 'atr_threshold': 3.0, 'pt_mult': 2.5, 'sl_mult': 5.0, 'td_mins': 1080}. Best is trial 6 with value: 1.165302256320248.
[I 2026-03-12 02:05:48,724] Trial 7 finished with value: 0.0 and parameters: {'timeframe': 'mixed', 'atr_period': 13, 'atr_threshold': 10.0, 'pt_mult': 5.0, 'sl_mult': 0.5, 'td_mins': 5}. Best is trial 6 with value: 1.165302256320248.
[I 2026-03-12 02:05:50,047] Trial 8 finished with value: 0.19964355691294972 and parameters: {'timeframe': 'mixed', 'atr_period': 13, 'atr_threshold': 0.5, 'pt_mult': 5.0, 'sl_mult': 5.0, 'td_mins': 15}. Best is trial 6 with value: 1.165302256320248.
[I 2026-03-12 02:05:50,385] Trial 9 finished with value: 8.726119862620362 and parameters: {'timeframe': 'mixed', 'atr_period': 13, 'atr_threshold': 5.0, 'pt_mult': 0.5, 'sl_mult': 5.0, 'td_mins': 180}. Best is trial 9 with value: 8.726119862620362.
[I 2026-03-12 02:06:07,500] Trial 10 finished with value: 0.9555617613429803 and parameters: {'timeframe': 'mixed', 'atr_period': 13, 'atr_threshold': 1.0, 'pt_mult': 2.5, 'sl_mult': 2.5, 'td_mins': 1200}. Best is trial 9 with value: 8.726119862620362.
[I 2026-03-12 02:06:08,896] Trial 11 finished with value: 0.22619290221199675 and parameters: {'timeframe': 'mixed', 'atr_period': 13, 'atr_threshold': 1.0, 'pt_mult': 5.0, 'sl_mult': 1.0, 'td_mins': 30}. Best is trial 9 with value: 8.726119862620362.
[I 2026-03-12 02:06:09,066] Trial 12 finished with value: 0.0 and parameters: {'timeframe': 'mixed', 'atr_period': 13, 'atr_threshold': 15.0, 'pt_mult': 5.0, 'sl_mult': 2.5, 'td_mins': 60}. Best is trial 9 with value: 8.726119862620362.
[I 2026-03-12 02:06:09,402] Trial 13 finished with value: 0.012347524868424293 and parameters: {'timeframe': 'mixed', 'atr_period': 13, 'atr_threshold': 2.0, 'pt_mult': 5.0, 'sl_mult': 0.5, 'td_mins': 5}. Best is trial 9 with value: 8.726119862620362.
[I 2026-03-12 02:06:28,569] Trial 14 finished with value: 0.9078155575850536 and parameters: {'timeframe': 'mixed', 'atr_period': 13, 'atr_threshold': 1.0, 'pt_mult': 5.0, 'sl_mult': 1.0, 'td_mins': 1080}. Best is trial 9 with value: 8.726119862620362.
[I 2026-03-12 02:06:30,384] Trial 15 finished with value: 0.9142411486876109 and parameters: {'timeframe': 'mixed', 'atr_period': 13, 'atr_threshold': 3.0, 'pt_mult': 1.0, 'sl_mult': 1.0, 'td_mins': 720}. Best is trial 9 with value: 8.726119862620362.
[I 2026-03-12 02:06:30,547] Trial 16 finished with value: 0.0 and parameters: {'timeframe': 'mixed', 'atr_period': 13, 'atr_threshold': 15.0, 'pt_mult': 1.0, 'sl_mult': 2.5, 'td_mins': 180}. Best is trial 9 with value: 8.726119862620362.
[I 2026-03-12 02:06:30,735] Trial 17 finished with value: 1.4624691872380655 and parameters: {'timeframe': 'mixed', 'atr_period': 13, 'atr_threshold': 5.0, 'pt_mult': 0.5, 'sl_mult': 2.5, 'td_mins': 15}. Best is trial 9 with value: 8.726119862620362.
[I 2026-03-12 02:06:34,614] Trial 18 finished with value: 0.585527086996916 and parameters: {'timeframe': 'mixed', 'atr_period': 13, 'atr_threshold': 1.0, 'pt_mult': 5.0, 'sl_mult': 2.5, 'td_mins': 120}. Best is trial 9 with value: 8.726119862620362.
[I 2026-03-12 02:06:45,148] Trial 19 finished with value: 0.8709385473306706 and parameters: {'timeframe': 'mixed', 'atr_period': 13, 'atr_threshold': 2.0, 'pt_mult': 5.0, 'sl_mult': 1.0, 'td_mins': 1200}. Best is trial 9 with value: 8.726119862620362.
[I 2026-03-12 02:06:46,688] Trial 20 finished with value: 0.9782500762725821 and parameters: {'timeframe': 'mixed', 'atr_period': 13, 'atr_threshold': 2.0, 'pt_mult': 0.5, 'sl_mult': 0.5, 'td_mins': 360}. Best is trial 9 with value: 8.726119862620362.
[I 2026-03-12 02:06:47,897] Trial 21 pruned. 
[I 2026-03-12 02:06:48,834] Trial 22 finished with value: 0.9213438466835765 and parameters: {'timeframe': 'mixed', 'atr_period': 13, 'atr_threshold': 3.0, 'pt_mult': 0.5, 'sl_mult': 1.0, 'td_mins': 360}. Best is trial 9 with value: 8.726119862620362.
[I 2026-03-12 02:07:04,834] Trial 23 finished with value: 0.9122341458288432 and parameters: {'timeframe': 'mixed', 'atr_period': 13, 'atr_threshold': 0.5, 'pt_mult': 5.0, 'sl_mult': 1.0, 'td_mins': 720}. Best is trial 9 with value: 8.726119862620362.
[I 2026-03-12 02:07:06,934] Trial 24 finished with value: 1.4937372838742842 and parameters: {'timeframe': 'mixed', 'atr_period': 13, 'atr_threshold': 1.0, 'pt_mult': 0.5, 'sl_mult': 5.0, 'td_mins': 60}. Best is trial 9 with value: 8.726119862620362.
[I 2026-03-12 02:07:08,772] Trial 25 pruned. 
[I 2026-03-12 02:07:08,986] Trial 26 pruned. 
[I 2026-03-12 02:07:09,105] Trial 27 pruned. 
[I 2026-03-12 02:07:10,031] Trial 28 pruned. 
[I 2026-03-12 02:07:10,198] Trial 29 finished with value: 0.0 and parameters: {'timeframe': 'mixed', 'atr_period': 13, 'atr_threshold': 10.0, 'pt_mult': 2.5, 'sl_mult': 2.5, 'td_mins': 1080}. Best is trial 9 with value: 8.726119862620362.
[I 2026-03-12 02:07:10,492] Trial 30 finished with value: 1.7427218499248205 and parameters: {'timeframe': 'mixed', 'atr_period': 13, 'atr_threshold': 5.0, 'pt_mult': 2.5, 'sl_mult': 2.5, 'td_mins': 120}. Best is trial 9 with value: 8.726119862620362.
[I 2026-03-12 02:07:10,660] Trial 31 finished with value: 0.0 and parameters: {'timeframe': 'mixed', 'atr_period': 13, 'atr_threshold': 10.0, 'pt_mult': 1.0, 'sl_mult': 0.5, 'td_mins': 15}. Best is trial 9 with value: 8.726119862620362.
[I 2026-03-12 02:07:15,396] Trial 32 finished with value: 1.230752996054535 and parameters: {'timeframe': 'mixed', 'atr_period': 13, 'atr_threshold': 1.0, 'pt_mult': 1.0, 'sl_mult': 5.0, 'td_mins': 180}. Best is trial 9 with value: 8.726119862620362.
[I 2026-03-12 02:07:15,497] Trial 33 pruned. 
[I 2026-03-12 02:07:15,661] Trial 34 finished with value: 0.0 and parameters: {'timeframe': 'mixed', 'atr_period': 13, 'atr_threshold': 10.0, 'pt_mult': 2.5, 'sl_mult': 5.0, 'td_mins': 180}. Best is trial 9 with value: 8.726119862620362.
[I 2026-03-12 02:07:19,687] Trial 35 finished with value: 1.4334387647732698 and parameters: {'timeframe': 'mixed', 'atr_period': 13, 'atr_threshold': 2.0, 'pt_mult': 1.0, 'sl_mult': 5.0, 'td_mins': 360}. Best is trial 9 with value: 8.726119862620362.
[I 2026-03-12 02:07:19,830] Trial 36 pruned. 
[I 2026-03-12 02:07:20,759] Trial 37 finished with value: 1.1791892972244356 and parameters: {'timeframe': 'mixed', 'atr_period': 13, 'atr_threshold': 3.0, 'pt_mult': 0.5, 'sl_mult': 2.5, 'td_mins': 180}. Best is trial 9 with value: 8.726119862620362.
[I 2026-03-12 02:07:23,434] Trial 38 finished with value: 0.9793603014152954 and parameters: {'timeframe': 'mixed', 'atr_period': 13, 'atr_threshold': 2.0, 'pt_mult': 1.0, 'sl_mult': 0.5, 'td_mins': 720}. Best is trial 9 with value: 8.726119862620362.
[I 2026-03-12 02:07:23,547] Trial 39 pruned. 
[I 2026-03-12 02:07:28,332] Trial 40 finished with value: 1.230752996054535 and parameters: {'timeframe': 'mixed', 'atr_period': 13, 'atr_threshold': 1.0, 'pt_mult': 1.0, 'sl_mult': 5.0, 'td_mins': 180}. Best is trial 9 with value: 8.726119862620362.
[I 2026-03-12 02:07:28,568] Trial 41 pruned. 
[I 2026-03-12 02:07:28,714] Trial 42 pruned. 
[I 2026-03-12 02:07:28,851] Trial 43 pruned. 
[I 2026-03-12 02:07:29,942] Trial 44 finished with value: 1.9061713667683584 and parameters: {'timeframe': 'mixed', 'atr_period': 13, 'atr_threshold': 3.0, 'pt_mult': 1.0, 'sl_mult': 5.0, 'td_mins': 180}. Best is trial 9 with value: 8.726119862620362.
[I 2026-03-12 02:07:30,106] Trial 45 finished with value: 0.0 and parameters: {'timeframe': 'mixed', 'atr_period': 13, 'atr_threshold': 15.0, 'pt_mult': 2.5, 'sl_mult': 5.0, 'td_mins': 1200}. Best is trial 9 with value: 8.726119862620362.
[I 2026-03-12 02:07:30,207] Trial 46 pruned. 
[I 2026-03-12 02:07:30,636] Trial 47 pruned. 
[I 2026-03-12 02:07:30,835] Trial 48 pruned. 
[I 2026-03-12 02:07:31,610] Trial 49 pruned. 
[I 2026-03-12 02:07:32,679] Trial 50 finished with value: 43.32685925026577 and parameters: {'timeframe': 'mixed', 'atr_period': 13, 'atr_threshold': 5.0, 'pt_mult': 0.5, 'sl_mult': 5.0, 'td_mins': 1080}. Best is trial 50 with value: 43.32685925026577.
[I 2026-03-12 02:07:59,208] Trial 51 finished with value: 0.9706193463447714 and parameters: {'timeframe': 'mixed', 'atr_period': 13, 'atr_threshold': 0.5, 'pt_mult': 2.5, 'sl_mult': 5.0, 'td_mins': 1080}. Best is trial 50 with value: 43.32685925026577.
[I 2026-03-12 02:07:59,920] Trial 52 pruned. 
[I 2026-03-12 02:08:03,415] Trial 53 finished with value: 0.9904979641617354 and parameters: {'timeframe': 'mixed', 'atr_period': 13, 'atr_threshold': 1.0, 'pt_mult': 0.5, 'sl_mult': 0.5, 'td_mins': 720}. Best is trial 50 with value: 43.32685925026577.
[I 2026-03-12 02:08:03,550] Trial 54 pruned. 
[I 2026-03-12 02:08:03,713] Trial 55 finished with value: 0.0 and parameters: {'timeframe': 'mixed', 'atr_period': 13, 'atr_threshold': 10.0, 'pt_mult': 1.0, 'sl_mult': 5.0, 'td_mins': 15}. Best is trial 50 with value: 43.32685925026577.
[I 2026-03-12 02:08:03,808] Trial 56 pruned. 
[I 2026-03-12 02:08:08,535] Trial 57 finished with value: 1.003841187440091 and parameters: {'timeframe': 'mixed', 'atr_period': 13, 'atr_threshold': 1.0, 'pt_mult': 1.0, 'sl_mult': 0.5, 'td_mins': 720}. Best is trial 50 with value: 43.32685925026577.
[I 2026-03-12 02:08:08,954] Trial 58 pruned. 
[I 2026-03-12 02:08:09,180] Trial 59 pruned. 
[I 2026-03-12 02:08:09,325] Trial 60 pruned. 
[I 2026-03-12 02:08:09,493] Trial 61 finished with value: 0.0 and parameters: {'timeframe': 'mixed', 'atr_period': 13, 'atr_threshold': 15.0, 'pt_mult': 2.5, 'sl_mult': 5.0, 'td_mins': 120}. Best is trial 50 with value: 43.32685925026577.
[I 2026-03-12 02:08:09,656] Trial 62 finished with value: 0.0 and parameters: {'timeframe': 'mixed', 'atr_period': 13, 'atr_threshold': 10.0, 'pt_mult': 0.5, 'sl_mult': 2.5, 'td_mins': 720}. Best is trial 50 with value: 43.32685925026577.
[I 2026-03-12 02:08:11,089] Trial 63 pruned. 
[I 2026-03-12 02:08:11,234] Trial 64 pruned. 
[I 2026-03-12 02:08:11,788] Trial 65 finished with value: 19.652491309745592 and parameters: {'timeframe': 'mixed', 'atr_period': 13, 'atr_threshold': 5.0, 'pt_mult': 2.5, 'sl_mult': 5.0, 'td_mins': 360}. Best is trial 50 with value: 43.32685925026577.
