[I 2026-03-12 01:42:18,183] Trial 932 finished with value: 2.710569080288531 and parameters: {'timeframe': 'M3', 'atr_period': 13, 'atr_threshold': 3.0, 'pt_mult': 0.5, 'sl_mult': 5.0, 'td_mins': 30}. Best is trial 367 with value: 2.710569080288531.
[I 2026-03-12 01:42:18,239] Trial 933 finished with value: 0.0 and parameters: {'timeframe': 'M3', 'atr_period': 13, 'atr_threshold': 5.0, 'pt_mult': 1.0, 'sl_mult': 2.5, 'td_mins': 30}. Best is trial 367 with value: 2.710569080288531.
[I 2026-03-12 01:42:18,295] Trial 934 pruned. 
[I 2026-03-12 01:42:18,412] Trial 935 finished with value: 2.710569080288531 and parameters: {'timeframe': 'M3', 'atr_period': 13, 'atr_threshold': 3.0, 'pt_mult': 0.5, 'sl_mult': 5.0, 'td_mins': 30}. Best is trial 367 with value: 2.710569080288531.
[I 2026-03-12 01:42:18,462] Trial 936 finished with value: 0.0 and parameters: {'timeframe': 'M3', 'atr_period': 13, 'atr_threshold': 5.0, 'pt_mult': 0.5, 'sl_mult': 2.5, 'td_mins': 5}. Best is trial 367 with value: 2.710569080288531.
[I 2026-03-12 01:42:18,636] Trial 937 pruned. 
[I 2026-03-12 01:42:18,756] Trial 938 finished with value: 2.710569080288531 and parameters: {'timeframe': 'M3', 'atr_period': 13, 'atr_threshold': 3.0, 'pt_mult': 0.5, 'sl_mult': 5.0, 'td_mins': 30}. Best is trial 367 with value: 2.710569080288531.
[I 2026-03-12 01:42:18,877] Trial 939 finished with value: 2.710569080288531 and parameters: {'timeframe': 'M3', 'atr_period': 13, 'atr_threshold': 3.0, 'pt_mult': 0.5, 'sl_mult': 5.0, 'td_mins': 30}. Best is trial 367 with value: 2.710569080288531.
[I 2026-03-12 01:42:18,940] Trial 940 pruned. 
[I 2026-03-12 01:42:19,360] Trial 941 pruned. 
[I 2026-03-12 01:42:19,485] Trial 942 finished with value: 2.710569080288531 and parameters: {'timeframe': 'M3', 'atr_period': 13, 'atr_threshold': 3.0, 'pt_mult': 0.5, 'sl_mult': 5.0, 'td_mins': 30}. Best is trial 367 with value: 2.710569080288531.
[I 2026-03-12 01:42:19,606] Trial 943 finished with value: 2.710569080288531 and parameters: {'timeframe': 'M3', 'atr_period': 13, 'atr_threshold': 3.0, 'pt_mult': 0.5, 'sl_mult': 5.0, 'td_mins': 30}. Best is trial 367 with value: 2.710569080288531.
[I 2026-03-12 01:42:20,164] Trial 944 pruned. 
[I 2026-03-12 01:42:20,310] Trial 945 finished with value: 2.710569080288531 and parameters: {'timeframe': 'M3', 'atr_period': 13, 'atr_threshold': 3.0, 'pt_mult': 0.5, 'sl_mult': 5.0, 'td_mins': 30}. Best is trial 367 with value: 2.710569080288531.
[I 2026-03-12 01:42:20,366] Trial 946 finished with value: 0.0 and parameters: {'timeframe': 'M3', 'atr_period': 13, 'atr_threshold': 5.0, 'pt_mult': 2.5, 'sl_mult': 5.0, 'td_mins': 5}. Best is trial 367 with value: 2.710569080288531.
[I 2026-03-12 01:42:20,446] Trial 947 pruned. 
[I 2026-03-12 01:42:20,497] Trial 948 finished with value: 0.0 and parameters: {'timeframe': 'M3', 'atr_period': 13, 'atr_threshold': 5.0, 'pt_mult': 0.5, 'sl_mult': 1.0, 'td_mins': 1200}. Best is trial 367 with value: 2.710569080288531.
[I 2026-03-12 01:42:20,547] Trial 949 finished with value: 0.0 and parameters: {'timeframe': 'M3', 'atr_period': 13, 'atr_threshold': 15.0, 'pt_mult': 0.5, 'sl_mult': 5.0, 'td_mins': 1200}. Best is trial 367 with value: 2.710569080288531.
[I 2026-03-12 01:42:20,599] Trial 950 finished with value: 0.0 and parameters: {'timeframe': 'M3', 'atr_period': 13, 'atr_threshold': 10.0, 'pt_mult': 0.5, 'sl_mult': 5.0, 'td_mins': 120}. Best is trial 367 with value: 2.710569080288531.
[I 2026-03-12 01:42:20,651] Trial 951 finished with value: 0.0 and parameters: {'timeframe': 'M3', 'atr_period': 13, 'atr_threshold': 8.0, 'pt_mult': 0.5, 'sl_mult': 5.0, 'td_mins': 30}. Best is trial 367 with value: 2.710569080288531.
[I 2026-03-12 01:42:20,771] Trial 952 finished with value: 2.710569080288531 and parameters: {'timeframe': 'M3', 'atr_period': 13, 'atr_threshold': 3.0, 'pt_mult': 0.5, 'sl_mult': 5.0, 'td_mins': 30}. Best is trial 367 with value: 2.710569080288531.
[I 2026-03-12 01:42:20,823] Trial 953 finished with value: 0.0 and parameters: {'timeframe': 'M3', 'atr_period': 13, 'atr_threshold': 5.0, 'pt_mult': 1.0, 'sl_mult': 0.5, 'td_mins': 5}. Best is trial 367 with value: 2.710569080288531.
[I 2026-03-12 01:42:20,942] Trial 954 finished with value: 2.710569080288531 and parameters: {'timeframe': 'M3', 'atr_period': 13, 'atr_threshold': 3.0, 'pt_mult': 0.5, 'sl_mult': 5.0, 'td_mins': 30}. Best is trial 367 with value: 2.710569080288531.
[I 2026-03-12 01:42:21,005] Trial 955 pruned. 
[I 2026-03-12 01:42:21,058] Trial 956 finished with value: 0.0 and parameters: {'timeframe': 'M3', 'atr_period': 13, 'atr_threshold': 15.0, 'pt_mult': 0.5, 'sl_mult': 2.5, 'td_mins': 15}. Best is trial 367 with value: 2.710569080288531.
[I 2026-03-12 01:42:21,122] Trial 957 pruned. 
[I 2026-03-12 01:42:21,272] Trial 958 finished with value: 2.710569080288531 and parameters: {'timeframe': 'M3', 'atr_period': 13, 'atr_threshold': 3.0, 'pt_mult': 0.5, 'sl_mult': 5.0, 'td_mins': 30}. Best is trial 367 with value: 2.710569080288531.
[I 2026-03-12 01:42:21,671] Trial 959 pruned. 
[I 2026-03-12 01:42:21,792] Trial 960 finished with value: 2.710569080288531 and parameters: {'timeframe': 'M3', 'atr_period': 13, 'atr_threshold': 3.0, 'pt_mult': 0.5, 'sl_mult': 5.0, 'td_mins': 30}. Best is trial 367 with value: 2.710569080288531.
[I 2026-03-12 01:42:21,911] Trial 961 finished with value: 2.710569080288531 and parameters: {'timeframe': 'M3', 'atr_period': 13, 'atr_threshold': 3.0, 'pt_mult': 0.5, 'sl_mult': 5.0, 'td_mins': 30}. Best is trial 367 with value: 2.710569080288531.
[I 2026-03-12 01:42:21,963] Trial 962 finished with value: 0.0 and parameters: {'timeframe': 'M3', 'atr_period': 13, 'atr_threshold': 8.0, 'pt_mult': 1.0, 'sl_mult': 0.5, 'td_mins': 30}. Best is trial 367 with value: 2.710569080288531.
[I 2026-03-12 01:42:22,236] Trial 963 pruned. 
[I 2026-03-12 01:42:22,357] Trial 964 finished with value: 2.710569080288531 and parameters: {'timeframe': 'M3', 'atr_period': 13, 'atr_threshold': 3.0, 'pt_mult': 0.5, 'sl_mult': 5.0, 'td_mins': 30}. Best is trial 367 with value: 2.710569080288531.
[I 2026-03-12 01:42:22,410] Trial 965 finished with value: 0.0 and parameters: {'timeframe': 'M3', 'atr_period': 13, 'atr_threshold': 5.0, 'pt_mult': 0.5, 'sl_mult': 5.0, 'td_mins': 30}. Best is trial 367 with value: 2.710569080288531.
[I 2026-03-12 01:42:22,462] Trial 966 finished with value: 0.0 and parameters: {'timeframe': 'M3', 'atr_period': 13, 'atr_threshold': 10.0, 'pt_mult': 5.0, 'sl_mult': 1.0, 'td_mins': 180}. Best is trial 367 with value: 2.710569080288531.
[I 2026-03-12 01:42:22,524] Trial 967 finished with value: 0.0 and parameters: {'timeframe': 'M3', 'atr_period': 13, 'atr_threshold': 8.0, 'pt_mult': 2.5, 'sl_mult': 5.0, 'td_mins': 15}. Best is trial 367 with value: 2.710569080288531.
[I 2026-03-12 01:42:22,644] Trial 968 finished with value: 2.710569080288531 and parameters: {'timeframe': 'M3', 'atr_period': 13, 'atr_threshold': 3.0, 'pt_mult': 0.5, 'sl_mult': 5.0, 'td_mins': 30}. Best is trial 367 with value: 2.710569080288531.
[I 2026-03-12 01:42:22,765] Trial 969 finished with value: 2.710569080288531 and parameters: {'timeframe': 'M3', 'atr_period': 13, 'atr_threshold': 3.0, 'pt_mult': 0.5, 'sl_mult': 5.0, 'td_mins': 30}. Best is trial 367 with value: 2.710569080288531.
[I 2026-03-12 01:42:22,932] Trial 970 pruned. 
[I 2026-03-12 01:42:22,990] Trial 971 pruned. 
[I 2026-03-12 01:42:23,041] Trial 972 finished with value: 0.0 and parameters: {'timeframe': 'M3', 'atr_period': 13, 'atr_threshold': 5.0, 'pt_mult': 1.0, 'sl_mult': 1.0, 'td_mins': 720}. Best is trial 367 with value: 2.710569080288531.
[I 2026-03-12 01:42:23,491] Trial 973 pruned. 
[I 2026-03-12 01:42:23,549] Trial 974 finished with value: 0.0 and parameters: {'timeframe': 'M3', 'atr_period': 13, 'atr_threshold': 10.0, 'pt_mult': 5.0, 'sl_mult': 2.5, 'td_mins': 60}. Best is trial 367 with value: 2.710569080288531.
[I 2026-03-12 01:42:23,604] Trial 975 finished with value: 0.0 and parameters: {'timeframe': 'M3', 'atr_period': 13, 'atr_threshold': 15.0, 'pt_mult': 0.5, 'sl_mult': 2.5, 'td_mins': 360}. Best is trial 367 with value: 2.710569080288531.
[I 2026-03-12 01:42:23,922] Trial 976 pruned. 
[I 2026-03-12 01:42:24,621] Trial 977 pruned. 
[I 2026-03-12 01:42:24,678] Trial 978 finished with value: 0.0 and parameters: {'timeframe': 'M3', 'atr_period': 13, 'atr_threshold': 10.0, 'pt_mult': 1.0, 'sl_mult': 0.5, 'td_mins': 1200}. Best is trial 367 with value: 2.710569080288531.
[I 2026-03-12 01:42:24,736] Trial 979 pruned. 
[I 2026-03-12 01:42:24,832] Trial 980 pruned. 
[I 2026-03-12 01:42:24,887] Trial 981 finished with value: 0.0 and parameters: {'timeframe': 'M3', 'atr_period': 13, 'atr_threshold': 5.0, 'pt_mult': 2.5, 'sl_mult': 0.5, 'td_mins': 30}. Best is trial 367 with value: 2.710569080288531.
[I 2026-03-12 01:42:24,942] Trial 982 finished with value: 0.0 and parameters: {'timeframe': 'M3', 'atr_period': 13, 'atr_threshold': 8.0, 'pt_mult': 5.0, 'sl_mult': 0.5, 'td_mins': 360}. Best is trial 367 with value: 2.710569080288531.
[I 2026-03-12 01:42:25,008] Trial 983 pruned. 
[I 2026-03-12 01:42:25,355] Trial 984 pruned. 
[I 2026-03-12 01:42:25,405] Trial 985 finished with value: 0.0 and parameters: {'timeframe': 'M3', 'atr_period': 13, 'atr_threshold': 8.0, 'pt_mult': 1.0, 'sl_mult': 2.5, 'td_mins': 1200}. Best is trial 367 with value: 2.710569080288531.
[I 2026-03-12 01:42:25,526] Trial 986 finished with value: 2.710569080288531 and parameters: {'timeframe': 'M3', 'atr_period': 13, 'atr_threshold': 3.0, 'pt_mult': 0.5, 'sl_mult': 5.0, 'td_mins': 30}. Best is trial 367 with value: 2.710569080288531.
[I 2026-03-12 01:42:25,580] Trial 987 pruned. 
[I 2026-03-12 01:42:25,636] Trial 988 pruned. 
[I 2026-03-12 01:42:25,694] Trial 989 pruned. 
[I 2026-03-12 01:42:25,744] Trial 990 finished with value: 0.0 and parameters: {'timeframe': 'M3', 'atr_period': 13, 'atr_threshold': 15.0, 'pt_mult': 1.0, 'sl_mult': 0.5, 'td_mins': 180}. Best is trial 367 with value: 2.710569080288531.
[I 2026-03-12 01:42:25,796] Trial 991 finished with value: 0.0 and parameters: {'timeframe': 'M3', 'atr_period': 13, 'atr_threshold': 8.0, 'pt_mult': 0.5, 'sl_mult': 2.5, 'td_mins': 1200}. Best is trial 367 with value: 2.710569080288531.
[I 2026-03-12 01:42:25,846] Trial 992 finished with value: 0.0 and parameters: {'timeframe': 'M3', 'atr_period': 13, 'atr_threshold': 10.0, 'pt_mult': 2.5, 'sl_mult': 2.5, 'td_mins': 5}. Best is trial 367 with value: 2.710569080288531.
[I 2026-03-12 01:42:25,897] Trial 993 finished with value: 0.0 and parameters: {'timeframe': 'M3', 'atr_period': 13, 'atr_threshold': 15.0, 'pt_mult': 1.0, 'sl_mult': 2.5, 'td_mins': 1080}. Best is trial 367 with value: 2.710569080288531.
[I 2026-03-12 01:42:25,968] Trial 994 pruned. 
[I 2026-03-12 01:42:26,019] Trial 995 finished with value: 0.0 and parameters: {'timeframe': 'M3', 'atr_period': 13, 'atr_threshold': 5.0, 'pt_mult': 1.0, 'sl_mult': 1.0, 'td_mins': 60}. Best is trial 367 with value: 2.710569080288531.
[I 2026-03-12 01:42:26,849] Trial 996 pruned. 
[I 2026-03-12 01:42:26,930] Trial 997 pruned. 
[I 2026-03-12 01:42:27,005] Trial 998 pruned. 
[I 2026-03-12 01:42:27,173] Trial 999 pruned. 
2026-03-12 01:42:27,241 - INFO - === Starting Optuna Optimization for M5 [SHORT_ONLY] (Trials: 1000) ===
/home/hephaestus-zero/.local/lib/python3.11/site-packages/optuna/_experimental.py:32: ExperimentalWarning: Argument ``multivariate`` is an experimental feature. The interface can change in the future.
  warnings.warn(
[I 2026-03-12 01:42:27,242] A new study created in memory with name: no-name-4737cbdc-3bd7-44aa-8230-ac4c600ea81a
2026-03-12 01:42:27,245 - INFO -     [Cache Miss] Loading Signal Data for M5, ATR=13...
2026-03-12 01:43:04,291 - INFO -     [Cache Miss] Loading Signal Data for M5, ATR=13...
2026-03-12 01:43:43,457 - INFO -     [Cache Miss] Loading Signal Data for M5, ATR=13...
2026-03-12 01:44:19,791 - INFO -     [Cache Miss] Loading Signal Data for M5, ATR=13...
2026-03-12 01:44:56,203 - INFO -     [Cache Miss] Loading Signal Data for M5, ATR=13...
[I 2026-03-12 01:45:32,600] Trial 0 finished with value: 0.0 and parameters: {'timeframe': 'M5', 'atr_period': 13, 'atr_threshold': 15.0, 'pt_mult': 5.0, 'sl_mult': 2.5, 'td_mins': 1200}. Best is trial 0 with value: 0.0.
[I 2026-03-12 01:45:32,645] Trial 1 finished with value: 0.0 and parameters: {'timeframe': 'M5', 'atr_period': 13, 'atr_threshold': 15.0, 'pt_mult': 0.5, 'sl_mult': 1.0, 'td_mins': 360}. Best is trial 0 with value: 0.0.
[I 2026-03-12 01:45:32,691] Trial 2 finished with value: 0.0 and parameters: {'timeframe': 'M5', 'atr_period': 13, 'atr_threshold': 10.0, 'pt_mult': 1.0, 'sl_mult': 1.0, 'td_mins': 60}. Best is trial 0 with value: 0.0.
[I 2026-03-12 01:45:32,733] Trial 3 finished with value: 0.0 and parameters: {'timeframe': 'M5', 'atr_period': 13, 'atr_threshold': 15.0, 'pt_mult': 5.0, 'sl_mult': 2.5, 'td_mins': 30}. Best is trial 0 with value: 0.0.
[I 2026-03-12 01:45:33,781] Trial 4 finished with value: 0.855890386340505 and parameters: {'timeframe': 'M5', 'atr_period': 13, 'atr_threshold': 2.0, 'pt_mult': 2.5, 'sl_mult': 1.0, 'td_mins': 360}. Best is trial 4 with value: 0.855890386340505.
[I 2026-03-12 01:45:33,864] Trial 5 finished with value: 0.5888188995416697 and parameters: {'timeframe': 'M5', 'atr_period': 13, 'atr_threshold': 3.0, 'pt_mult': 0.5, 'sl_mult': 0.5, 'td_mins': 5}. Best is trial 4 with value: 0.855890386340505.
[I 2026-03-12 01:45:33,913] Trial 6 finished with value: 0.0 and parameters: {'timeframe': 'M5', 'atr_period': 13, 'atr_threshold': 8.0, 'pt_mult': 5.0, 'sl_mult': 1.0, 'td_mins': 30}. Best is trial 4 with value: 0.855890386340505.
[I 2026-03-12 01:45:33,960] Trial 7 finished with value: 0.0 and parameters: {'timeframe': 'M5', 'atr_period': 13, 'atr_threshold': 5.0, 'pt_mult': 1.0, 'sl_mult': 0.5, 'td_mins': 1200}. Best is trial 4 with value: 0.855890386340505.
[I 2026-03-12 01:45:34,007] Trial 8 finished with value: 0.0 and parameters: {'timeframe': 'M5', 'atr_period': 13, 'atr_threshold': 8.0, 'pt_mult': 5.0, 'sl_mult': 1.0, 'td_mins': 1200}. Best is trial 4 with value: 0.855890386340505.
[I 2026-03-12 01:45:34,727] Trial 9 finished with value: 0.5091895902228535 and parameters: {'timeframe': 'M5', 'atr_period': 13, 'atr_threshold': 2.0, 'pt_mult': 5.0, 'sl_mult': 1.0, 'td_mins': 180}. Best is trial 4 with value: 0.855890386340505.
[I 2026-03-12 01:45:35,173] Trial 10 finished with value: 0.9833830361243404 and parameters: {'timeframe': 'M5', 'atr_period': 13, 'atr_threshold': 2.0, 'pt_mult': 0.5, 'sl_mult': 0.5, 'td_mins': 360}. Best is trial 10 with value: 0.9833830361243404.
[I 2026-03-12 01:45:37,258] Trial 11 finished with value: 1.0124927069816247 and parameters: {'timeframe': 'M5', 'atr_period': 13, 'atr_threshold': 0.5, 'pt_mult': 1.0, 'sl_mult': 0.5, 'td_mins': 720}. Best is trial 11 with value: 1.0124927069816247.
[I 2026-03-12 01:45:37,304] Trial 12 finished with value: 0.0 and parameters: {'timeframe': 'M5', 'atr_period': 13, 'atr_threshold': 5.0, 'pt_mult': 2.5, 'sl_mult': 5.0, 'td_mins': 360}. Best is trial 11 with value: 1.0124927069816247.
[I 2026-03-12 01:45:38,700] Trial 13 finished with value: 1.0549017339470086 and parameters: {'timeframe': 'M5', 'atr_period': 13, 'atr_threshold': 3.0, 'pt_mult': 5.0, 'sl_mult': 0.5, 'td_mins': 1200}. Best is trial 13 with value: 1.0549017339470086.
[I 2026-03-12 01:45:38,749] Trial 14 finished with value: 0.0 and parameters: {'timeframe': 'M5', 'atr_period': 13, 'atr_threshold': 8.0, 'pt_mult': 1.0, 'sl_mult': 5.0, 'td_mins': 720}. Best is trial 13 with value: 1.0549017339470086.
[I 2026-03-12 01:45:38,797] Trial 15 finished with value: 0.0 and parameters: {'timeframe': 'M5', 'atr_period': 13, 'atr_threshold': 5.0, 'pt_mult': 0.5, 'sl_mult': 5.0, 'td_mins': 1080}. Best is trial 13 with value: 1.0549017339470086.
[I 2026-03-12 01:45:38,845] Trial 16 finished with value: 0.0 and parameters: {'timeframe': 'M5', 'atr_period': 13, 'atr_threshold': 10.0, 'pt_mult': 5.0, 'sl_mult': 5.0, 'td_mins': 120}. Best is trial 13 with value: 1.0549017339470086.
[I 2026-03-12 01:45:39,222] Trial 17 finished with value: 2.3323020644376053 and parameters: {'timeframe': 'M5', 'atr_period': 13, 'atr_threshold': 3.0, 'pt_mult': 1.0, 'sl_mult': 5.0, 'td_mins': 180}. Best is trial 17 with value: 2.3323020644376053.
[I 2026-03-12 01:45:39,267] Trial 18 finished with value: 0.0 and parameters: {'timeframe': 'M5', 'atr_period': 13, 'atr_threshold': 15.0, 'pt_mult': 0.5, 'sl_mult': 1.0, 'td_mins': 15}. Best is trial 17 with value: 2.3323020644376053.
[I 2026-03-12 01:45:42,060] Trial 19 finished with value: 1.0818623839985604 and parameters: {'timeframe': 'M5', 'atr_period': 13, 'atr_threshold': 1.0, 'pt_mult': 2.5, 'sl_mult': 5.0, 'td_mins': 360}. Best is trial 17 with value: 2.3323020644376053.
[I 2026-03-12 01:45:42,104] Trial 20 finished with value: 0.0 and parameters: {'timeframe': 'M5', 'atr_period': 13, 'atr_threshold': 5.0, 'pt_mult': 5.0, 'sl_mult': 2.5, 'td_mins': 120}. Best is trial 17 with value: 2.3323020644376053.
[I 2026-03-12 01:45:42,152] Trial 21 finished with value: 0.0 and parameters: {'timeframe': 'M5', 'atr_period': 13, 'atr_threshold': 5.0, 'pt_mult': 5.0, 'sl_mult': 0.5, 'td_mins': 15}. Best is trial 17 with value: 2.3323020644376053.
[I 2026-03-12 01:45:43,214] Trial 22 finished with value: 1.4801915020004013 and parameters: {'timeframe': 'M5', 'atr_period': 13, 'atr_threshold': 1.0, 'pt_mult': 1.0, 'sl_mult': 5.0, 'td_mins': 120}. Best is trial 17 with value: 2.3323020644376053.
[I 2026-03-12 01:45:44,323] Trial 23 pruned. 
[I 2026-03-12 01:45:44,366] Trial 24 finished with value: 0.0 and parameters: {'timeframe': 'M5', 'atr_period': 13, 'atr_threshold': 15.0, 'pt_mult': 5.0, 'sl_mult': 5.0, 'td_mins': 30}. Best is trial 17 with value: 2.3323020644376053.
[I 2026-03-12 01:45:44,488] Trial 25 pruned. 
[I 2026-03-12 01:45:44,534] Trial 26 finished with value: 0.0 and parameters: {'timeframe': 'M5', 'atr_period': 13, 'atr_threshold': 10.0, 'pt_mult': 0.5, 'sl_mult': 2.5, 'td_mins': 120}. Best is trial 17 with value: 2.3323020644376053.
[I 2026-03-12 01:45:44,731] Trial 27 pruned. 
[I 2026-03-12 01:45:44,778] Trial 28 finished with value: 0.0 and parameters: {'timeframe': 'M5', 'atr_period': 13, 'atr_threshold': 15.0, 'pt_mult': 2.5, 'sl_mult': 1.0, 'td_mins': 1200}. Best is trial 17 with value: 2.3323020644376053.
[I 2026-03-12 01:45:44,820] Trial 29 finished with value: 0.0 and parameters: {'timeframe': 'M5', 'atr_period': 13, 'atr_threshold': 15.0, 'pt_mult': 1.0, 'sl_mult': 0.5, 'td_mins': 1200}. Best is trial 17 with value: 2.3323020644376053.
[I 2026-03-12 01:45:44,864] Trial 30 finished with value: 0.0 and parameters: {'timeframe': 'M5', 'atr_period': 13, 'atr_threshold': 8.0, 'pt_mult': 5.0, 'sl_mult': 5.0, 'td_mins': 1200}. Best is trial 17 with value: 2.3323020644376053.
[I 2026-03-12 01:45:45,592] Trial 31 pruned. 
[I 2026-03-12 01:45:51,871] Trial 32 finished with value: 1.0105750778779243 and parameters: {'timeframe': 'M5', 'atr_period': 13, 'atr_threshold': 0.5, 'pt_mult': 2.5, 'sl_mult': 5.0, 'td_mins': 720}. Best is trial 17 with value: 2.3323020644376053.
[I 2026-03-12 01:45:52,362] Trial 33 pruned. 
[I 2026-03-12 01:45:52,408] Trial 34 finished with value: 0.0 and parameters: {'timeframe': 'M5', 'atr_period': 13, 'atr_threshold': 8.0, 'pt_mult': 2.5, 'sl_mult': 2.5, 'td_mins': 1080}. Best is trial 17 with value: 2.3323020644376053.
[I 2026-03-12 01:45:52,451] Trial 35 finished with value: 0.0 and parameters: {'timeframe': 'M5', 'atr_period': 13, 'atr_threshold': 8.0, 'pt_mult': 0.5, 'sl_mult': 5.0, 'td_mins': 180}. Best is trial 17 with value: 2.3323020644376053.
[I 2026-03-12 01:45:52,497] Trial 36 finished with value: 0.0 and parameters: {'timeframe': 'M5', 'atr_period': 13, 'atr_threshold': 5.0, 'pt_mult': 2.5, 'sl_mult': 2.5, 'td_mins': 5}. Best is trial 17 with value: 2.3323020644376053.
[I 2026-03-12 01:45:52,540] Trial 37 finished with value: 0.0 and parameters: {'timeframe': 'M5', 'atr_period': 13, 'atr_threshold': 10.0, 'pt_mult': 1.0, 'sl_mult': 1.0, 'td_mins': 5}. Best is trial 17 with value: 2.3323020644376053.
[I 2026-03-12 01:45:52,642] Trial 38 pruned. 
[I 2026-03-12 01:45:52,690] Trial 39 finished with value: 0.0 and parameters: {'timeframe': 'M5', 'atr_period': 13, 'atr_threshold': 15.0, 'pt_mult': 1.0, 'sl_mult': 2.5, 'td_mins': 5}. Best is trial 17 with value: 2.3323020644376053.
[I 2026-03-12 01:45:52,734] Trial 40 finished with value: 0.0 and parameters: {'timeframe': 'M5', 'atr_period': 13, 'atr_threshold': 8.0, 'pt_mult': 2.5, 'sl_mult': 5.0, 'td_mins': 5}. Best is trial 17 with value: 2.3323020644376053.
[I 2026-03-12 01:45:52,777] Trial 41 finished with value: 0.0 and parameters: {'timeframe': 'M5', 'atr_period': 13, 'atr_threshold': 5.0, 'pt_mult': 0.5, 'sl_mult': 0.5, 'td_mins': 30}. Best is trial 17 with value: 2.3323020644376053.
[I 2026-03-12 01:45:52,821] Trial 42 finished with value: 0.0 and parameters: {'timeframe': 'M5', 'atr_period': 13, 'atr_threshold': 8.0, 'pt_mult': 5.0, 'sl_mult': 5.0, 'td_mins': 30}. Best is trial 17 with value: 2.3323020644376053.
[I 2026-03-12 01:45:52,864] Trial 43 finished with value: 0.0 and parameters: {'timeframe': 'M5', 'atr_period': 13, 'atr_threshold': 15.0, 'pt_mult': 5.0, 'sl_mult': 5.0, 'td_mins': 1080}. Best is trial 17 with value: 2.3323020644376053.
[I 2026-03-12 01:45:52,908] Trial 44 finished with value: 0.0 and parameters: {'timeframe': 'M5', 'atr_period': 13, 'atr_threshold': 8.0, 'pt_mult': 2.5, 'sl_mult': 1.0, 'td_mins': 720}. Best is trial 17 with value: 2.3323020644376053.
[I 2026-03-12 01:45:52,966] Trial 45 pruned. 
[I 2026-03-12 01:45:53,009] Trial 46 finished with value: 0.0 and parameters: {'timeframe': 'M5', 'atr_period': 13, 'atr_threshold': 8.0, 'pt_mult': 5.0, 'sl_mult': 2.5, 'td_mins': 720}. Best is trial 17 with value: 2.3323020644376053.
