[I 2026-03-12 00:43:19,557] Trial 406 finished with value: 0.0 and parameters: {'timeframe': 'M1', 'atr_period': 13, 'atr_threshold': 15.0, 'pt_mult': 1.0, 'sl_mult': 5.0, 'td_mins': 15}. Best is trial 374 with value: 1.778026240865349.
[I 2026-03-12 00:43:19,988] Trial 407 finished with value: 1.5345820563546146 and parameters: {'timeframe': 'M1', 'atr_period': 13, 'atr_threshold': 1.0, 'pt_mult': 1.0, 'sl_mult': 5.0, 'td_mins': 15}. Best is trial 374 with value: 1.778026240865349.
[I 2026-03-12 00:43:20,048] Trial 408 pruned. 
[I 2026-03-12 00:43:20,190] Trial 409 finished with value: 1.778026240865349 and parameters: {'timeframe': 'M1', 'atr_period': 13, 'atr_threshold': 2.0, 'pt_mult': 1.0, 'sl_mult': 5.0, 'td_mins': 15}. Best is trial 374 with value: 1.778026240865349.
[I 2026-03-12 00:43:20,342] Trial 410 finished with value: 1.778026240865349 and parameters: {'timeframe': 'M1', 'atr_period': 13, 'atr_threshold': 2.0, 'pt_mult': 1.0, 'sl_mult': 5.0, 'td_mins': 15}. Best is trial 374 with value: 1.778026240865349.
[I 2026-03-12 00:43:20,495] Trial 411 finished with value: 1.778026240865349 and parameters: {'timeframe': 'M1', 'atr_period': 13, 'atr_threshold': 2.0, 'pt_mult': 1.0, 'sl_mult': 5.0, 'td_mins': 15}. Best is trial 374 with value: 1.778026240865349.
[I 2026-03-12 00:43:20,647] Trial 412 finished with value: 1.778026240865349 and parameters: {'timeframe': 'M1', 'atr_period': 13, 'atr_threshold': 2.0, 'pt_mult': 1.0, 'sl_mult': 5.0, 'td_mins': 15}. Best is trial 374 with value: 1.778026240865349.
[I 2026-03-12 00:43:21,145] Trial 413 finished with value: 0.9806061701878208 and parameters: {'timeframe': 'M1', 'atr_period': 13, 'atr_threshold': 2.0, 'pt_mult': 1.0, 'sl_mult': 5.0, 'td_mins': 180}. Best is trial 374 with value: 1.778026240865349.
[I 2026-03-12 00:43:21,194] Trial 414 finished with value: 0.0 and parameters: {'timeframe': 'M1', 'atr_period': 13, 'atr_threshold': 10.0, 'pt_mult': 1.0, 'sl_mult': 2.5, 'td_mins': 15}. Best is trial 374 with value: 1.778026240865349.
[I 2026-03-12 00:43:21,243] Trial 415 finished with value: 0.0 and parameters: {'timeframe': 'M1', 'atr_period': 13, 'atr_threshold': 5.0, 'pt_mult': 1.0, 'sl_mult': 1.0, 'td_mins': 15}. Best is trial 374 with value: 1.778026240865349.
[I 2026-03-12 00:43:21,377] Trial 416 finished with value: 1.778026240865349 and parameters: {'timeframe': 'M1', 'atr_period': 13, 'atr_threshold': 2.0, 'pt_mult': 1.0, 'sl_mult': 5.0, 'td_mins': 15}. Best is trial 374 with value: 1.778026240865349.
[I 2026-03-12 00:43:22,449] Trial 417 finished with value: 0.946089635732213 and parameters: {'timeframe': 'M1', 'atr_period': 13, 'atr_threshold': 2.0, 'pt_mult': 1.0, 'sl_mult': 5.0, 'td_mins': 720}. Best is trial 374 with value: 1.778026240865349.
[I 2026-03-12 00:43:22,504] Trial 418 pruned. 
[I 2026-03-12 00:43:22,591] Trial 419 pruned. 
[I 2026-03-12 00:43:22,862] Trial 420 finished with value: 1.0674388283470675 and parameters: {'timeframe': 'M1', 'atr_period': 13, 'atr_threshold': 2.0, 'pt_mult': 1.0, 'sl_mult': 5.0, 'td_mins': 60}. Best is trial 374 with value: 1.778026240865349.
[I 2026-03-12 00:43:22,994] Trial 421 finished with value: 1.778026240865349 and parameters: {'timeframe': 'M1', 'atr_period': 13, 'atr_threshold': 2.0, 'pt_mult': 1.0, 'sl_mult': 5.0, 'td_mins': 15}. Best is trial 374 with value: 1.778026240865349.
[I 2026-03-12 00:43:23,039] Trial 422 finished with value: 0.0 and parameters: {'timeframe': 'M1', 'atr_period': 13, 'atr_threshold': 8.0, 'pt_mult': 1.0, 'sl_mult': 5.0, 'td_mins': 60}. Best is trial 374 with value: 1.778026240865349.
[I 2026-03-12 00:43:23,173] Trial 423 finished with value: 1.778026240865349 and parameters: {'timeframe': 'M1', 'atr_period': 13, 'atr_threshold': 2.0, 'pt_mult': 1.0, 'sl_mult': 5.0, 'td_mins': 15}. Best is trial 374 with value: 1.778026240865349.
[I 2026-03-12 00:43:23,309] Trial 424 finished with value: 1.778026240865349 and parameters: {'timeframe': 'M1', 'atr_period': 13, 'atr_threshold': 2.0, 'pt_mult': 1.0, 'sl_mult': 5.0, 'td_mins': 15}. Best is trial 374 with value: 1.778026240865349.
[I 2026-03-12 00:43:23,358] Trial 425 finished with value: 0.0 and parameters: {'timeframe': 'M1', 'atr_period': 13, 'atr_threshold': 10.0, 'pt_mult': 1.0, 'sl_mult': 5.0, 'td_mins': 15}. Best is trial 374 with value: 1.778026240865349.
[I 2026-03-12 00:43:23,631] Trial 426 pruned. 
[I 2026-03-12 00:43:23,767] Trial 427 finished with value: 1.778026240865349 and parameters: {'timeframe': 'M1', 'atr_period': 13, 'atr_threshold': 2.0, 'pt_mult': 1.0, 'sl_mult': 5.0, 'td_mins': 15}. Best is trial 374 with value: 1.778026240865349.
[I 2026-03-12 00:43:23,813] Trial 428 finished with value: 0.0 and parameters: {'timeframe': 'M1', 'atr_period': 13, 'atr_threshold': 8.0, 'pt_mult': 5.0, 'sl_mult': 5.0, 'td_mins': 15}. Best is trial 374 with value: 1.778026240865349.
[I 2026-03-12 00:43:23,966] Trial 429 finished with value: 1.778026240865349 and parameters: {'timeframe': 'M1', 'atr_period': 13, 'atr_threshold': 2.0, 'pt_mult': 1.0, 'sl_mult': 5.0, 'td_mins': 15}. Best is trial 374 with value: 1.778026240865349.
[I 2026-03-12 00:43:24,074] Trial 430 pruned. 
[I 2026-03-12 00:43:24,124] Trial 431 finished with value: 0.0 and parameters: {'timeframe': 'M1', 'atr_period': 13, 'atr_threshold': 3.0, 'pt_mult': 1.0, 'sl_mult': 5.0, 'td_mins': 60}. Best is trial 374 with value: 1.778026240865349.
[I 2026-03-12 00:43:24,188] Trial 432 pruned. 
[I 2026-03-12 00:43:24,325] Trial 433 finished with value: 1.778026240865349 and parameters: {'timeframe': 'M1', 'atr_period': 13, 'atr_threshold': 2.0, 'pt_mult': 1.0, 'sl_mult': 5.0, 'td_mins': 15}. Best is trial 374 with value: 1.778026240865349.
[I 2026-03-12 00:43:24,382] Trial 434 pruned. 
[I 2026-03-12 00:43:24,448] Trial 435 pruned. 
[I 2026-03-12 00:43:24,496] Trial 436 finished with value: 0.0 and parameters: {'timeframe': 'M1', 'atr_period': 13, 'atr_threshold': 5.0, 'pt_mult': 1.0, 'sl_mult': 5.0, 'td_mins': 180}. Best is trial 374 with value: 1.778026240865349.
[I 2026-03-12 00:43:25,199] Trial 437 finished with value: 0.958445290988671 and parameters: {'timeframe': 'M1', 'atr_period': 13, 'atr_threshold': 2.0, 'pt_mult': 1.0, 'sl_mult': 5.0, 'td_mins': 360}. Best is trial 374 with value: 1.778026240865349.
[I 2026-03-12 00:43:25,791] Trial 438 pruned. 
[I 2026-03-12 00:43:25,846] Trial 439 finished with value: 0.0 and parameters: {'timeframe': 'M1', 'atr_period': 13, 'atr_threshold': 3.0, 'pt_mult': 1.0, 'sl_mult': 0.5, 'td_mins': 15}. Best is trial 374 with value: 1.778026240865349.
[I 2026-03-12 00:43:26,547] Trial 440 pruned. 
[I 2026-03-12 00:43:26,596] Trial 441 finished with value: 0.0 and parameters: {'timeframe': 'M1', 'atr_period': 13, 'atr_threshold': 8.0, 'pt_mult': 1.0, 'sl_mult': 5.0, 'td_mins': 15}. Best is trial 374 with value: 1.778026240865349.
[I 2026-03-12 00:43:26,662] Trial 442 pruned. 
[I 2026-03-12 00:43:26,967] Trial 443 finished with value: 1.0912469659038482 and parameters: {'timeframe': 'M1', 'atr_period': 13, 'atr_threshold': 2.0, 'pt_mult': 2.5, 'sl_mult': 5.0, 'td_mins': 60}. Best is trial 374 with value: 1.778026240865349.
[I 2026-03-12 00:43:27,024] Trial 444 pruned. 
[I 2026-03-12 00:43:27,082] Trial 445 pruned. 
[I 2026-03-12 00:43:27,131] Trial 446 finished with value: 0.0 and parameters: {'timeframe': 'M1', 'atr_period': 13, 'atr_threshold': 8.0, 'pt_mult': 1.0, 'sl_mult': 5.0, 'td_mins': 120}. Best is trial 374 with value: 1.778026240865349.
[I 2026-03-12 00:43:28,783] Trial 447 pruned. 
[I 2026-03-12 00:43:28,928] Trial 448 finished with value: 1.778026240865349 and parameters: {'timeframe': 'M1', 'atr_period': 13, 'atr_threshold': 2.0, 'pt_mult': 1.0, 'sl_mult': 5.0, 'td_mins': 15}. Best is trial 374 with value: 1.778026240865349.
[I 2026-03-12 00:43:28,976] Trial 449 finished with value: 0.0 and parameters: {'timeframe': 'M1', 'atr_period': 13, 'atr_threshold': 3.0, 'pt_mult': 1.0, 'sl_mult': 5.0, 'td_mins': 1200}. Best is trial 374 with value: 1.778026240865349.
[I 2026-03-12 00:43:29,111] Trial 450 finished with value: 1.778026240865349 and parameters: {'timeframe': 'M1', 'atr_period': 13, 'atr_threshold': 2.0, 'pt_mult': 1.0, 'sl_mult': 5.0, 'td_mins': 15}. Best is trial 374 with value: 1.778026240865349.
[I 2026-03-12 00:43:29,247] Trial 451 finished with value: 1.778026240865349 and parameters: {'timeframe': 'M1', 'atr_period': 13, 'atr_threshold': 2.0, 'pt_mult': 1.0, 'sl_mult': 5.0, 'td_mins': 15}. Best is trial 374 with value: 1.778026240865349.
[I 2026-03-12 00:43:29,608] Trial 452 pruned. 
[I 2026-03-12 00:43:29,657] Trial 453 finished with value: 0.0 and parameters: {'timeframe': 'M1', 'atr_period': 13, 'atr_threshold': 15.0, 'pt_mult': 1.0, 'sl_mult': 5.0, 'td_mins': 60}. Best is trial 374 with value: 1.778026240865349.
[I 2026-03-12 00:43:29,798] Trial 454 finished with value: 1.778026240865349 and parameters: {'timeframe': 'M1', 'atr_period': 13, 'atr_threshold': 2.0, 'pt_mult': 1.0, 'sl_mult': 5.0, 'td_mins': 15}. Best is trial 374 with value: 1.778026240865349.
[I 2026-03-12 00:43:30,115] Trial 455 finished with value: 0.7923873372821554 and parameters: {'timeframe': 'M1', 'atr_period': 13, 'atr_threshold': 2.0, 'pt_mult': 5.0, 'sl_mult': 5.0, 'td_mins': 60}. Best is trial 374 with value: 1.778026240865349.
[I 2026-03-12 00:43:30,172] Trial 456 finished with value: 0.0 and parameters: {'timeframe': 'M1', 'atr_period': 13, 'atr_threshold': 3.0, 'pt_mult': 1.0, 'sl_mult': 2.5, 'td_mins': 15}. Best is trial 374 with value: 1.778026240865349.
[I 2026-03-12 00:43:30,226] Trial 457 finished with value: 0.0 and parameters: {'timeframe': 'M1', 'atr_period': 13, 'atr_threshold': 5.0, 'pt_mult': 1.0, 'sl_mult': 5.0, 'td_mins': 15}. Best is trial 374 with value: 1.778026240865349.
[I 2026-03-12 00:43:30,321] Trial 458 pruned. 
[I 2026-03-12 00:43:30,480] Trial 459 finished with value: 1.778026240865349 and parameters: {'timeframe': 'M1', 'atr_period': 13, 'atr_threshold': 2.0, 'pt_mult': 1.0, 'sl_mult': 5.0, 'td_mins': 15}. Best is trial 374 with value: 1.778026240865349.
[I 2026-03-12 00:43:30,532] Trial 460 finished with value: 0.0 and parameters: {'timeframe': 'M1', 'atr_period': 13, 'atr_threshold': 5.0, 'pt_mult': 1.0, 'sl_mult': 0.5, 'td_mins': 15}. Best is trial 374 with value: 1.778026240865349.
[I 2026-03-12 00:43:30,592] Trial 461 finished with value: 0.0 and parameters: {'timeframe': 'M1', 'atr_period': 13, 'atr_threshold': 8.0, 'pt_mult': 2.5, 'sl_mult': 5.0, 'td_mins': 15}. Best is trial 374 with value: 1.778026240865349.
[I 2026-03-12 00:43:33,137] Trial 462 finished with value: 1.0273118418727338 and parameters: {'timeframe': 'M1', 'atr_period': 13, 'atr_threshold': 2.0, 'pt_mult': 5.0, 'sl_mult': 5.0, 'td_mins': 1200}. Best is trial 374 with value: 1.778026240865349.
[I 2026-03-12 00:43:33,186] Trial 463 finished with value: 0.0 and parameters: {'timeframe': 'M1', 'atr_period': 13, 'atr_threshold': 5.0, 'pt_mult': 1.0, 'sl_mult': 5.0, 'td_mins': 720}. Best is trial 374 with value: 1.778026240865349.
[I 2026-03-12 00:43:33,256] Trial 464 pruned. 
[I 2026-03-12 00:43:33,311] Trial 465 pruned. 
[I 2026-03-12 00:43:34,513] Trial 466 pruned. 
[I 2026-03-12 00:43:35,474] Trial 467 finished with value: 1.0658200273938971 and parameters: {'timeframe': 'M1', 'atr_period': 13, 'atr_threshold': 2.0, 'pt_mult': 2.5, 'sl_mult': 5.0, 'td_mins': 360}. Best is trial 374 with value: 1.778026240865349.
[I 2026-03-12 00:43:35,660] Trial 468 finished with value: 1.778026240865349 and parameters: {'timeframe': 'M1', 'atr_period': 13, 'atr_threshold': 2.0, 'pt_mult': 1.0, 'sl_mult': 5.0, 'td_mins': 15}. Best is trial 374 with value: 1.778026240865349.
[I 2026-03-12 00:43:35,731] Trial 469 pruned. 
[I 2026-03-12 00:43:35,781] Trial 470 finished with value: 0.0 and parameters: {'timeframe': 'M1', 'atr_period': 13, 'atr_threshold': 8.0, 'pt_mult': 1.0, 'sl_mult': 5.0, 'td_mins': 30}. Best is trial 374 with value: 1.778026240865349.
[I 2026-03-12 00:43:35,833] Trial 471 finished with value: 0.0 and parameters: {'timeframe': 'M1', 'atr_period': 13, 'atr_threshold': 10.0, 'pt_mult': 1.0, 'sl_mult': 5.0, 'td_mins': 720}. Best is trial 374 with value: 1.778026240865349.
[I 2026-03-12 00:43:35,994] Trial 472 finished with value: 1.778026240865349 and parameters: {'timeframe': 'M1', 'atr_period': 13, 'atr_threshold': 2.0, 'pt_mult': 1.0, 'sl_mult': 5.0, 'td_mins': 15}. Best is trial 374 with value: 1.778026240865349.
[I 2026-03-12 00:43:36,072] Trial 473 pruned. 
[I 2026-03-12 00:43:36,236] Trial 474 finished with value: 1.778026240865349 and parameters: {'timeframe': 'M1', 'atr_period': 13, 'atr_threshold': 2.0, 'pt_mult': 1.0, 'sl_mult': 5.0, 'td_mins': 15}. Best is trial 374 with value: 1.778026240865349.
[I 2026-03-12 00:43:36,468] Trial 475 finished with value: 1.2633955128037777 and parameters: {'timeframe': 'M1', 'atr_period': 13, 'atr_threshold': 2.0, 'pt_mult': 1.0, 'sl_mult': 5.0, 'td_mins': 30}. Best is trial 374 with value: 1.778026240865349.
[I 2026-03-12 00:43:36,626] Trial 476 finished with value: 1.778026240865349 and parameters: {'timeframe': 'M1', 'atr_period': 13, 'atr_threshold': 2.0, 'pt_mult': 1.0, 'sl_mult': 5.0, 'td_mins': 15}. Best is trial 374 with value: 1.778026240865349.
[I 2026-03-12 00:43:36,869] Trial 477 pruned. 
[I 2026-03-12 00:43:37,433] Trial 478 finished with value: 1.0832799201180852 and parameters: {'timeframe': 'M1', 'atr_period': 13, 'atr_threshold': 2.0, 'pt_mult': 2.5, 'sl_mult': 5.0, 'td_mins': 180}. Best is trial 374 with value: 1.778026240865349.
[I 2026-03-12 00:43:37,569] Trial 479 finished with value: 1.778026240865349 and parameters: {'timeframe': 'M1', 'atr_period': 13, 'atr_threshold': 2.0, 'pt_mult': 1.0, 'sl_mult': 5.0, 'td_mins': 15}. Best is trial 374 with value: 1.778026240865349.
[I 2026-03-12 00:43:37,719] Trial 480 finished with value: 1.778026240865349 and parameters: {'timeframe': 'M1', 'atr_period': 13, 'atr_threshold': 2.0, 'pt_mult': 1.0, 'sl_mult': 5.0, 'td_mins': 15}. Best is trial 374 with value: 1.778026240865349.
[I 2026-03-12 00:43:37,780] Trial 481 finished with value: 0.0 and parameters: {'timeframe': 'M1', 'atr_period': 13, 'atr_threshold': 10.0, 'pt_mult': 1.0, 'sl_mult': 5.0, 'td_mins': 60}. Best is trial 374 with value: 1.778026240865349.
[I 2026-03-12 00:43:37,838] Trial 482 finished with value: 0.0 and parameters: {'timeframe': 'M1', 'atr_period': 13, 'atr_threshold': 15.0, 'pt_mult': 1.0, 'sl_mult': 0.5, 'td_mins': 15}. Best is trial 374 with value: 1.778026240865349.
[I 2026-03-12 00:43:37,994] Trial 483 finished with value: 1.778026240865349 and parameters: {'timeframe': 'M1', 'atr_period': 13, 'atr_threshold': 2.0, 'pt_mult': 1.0, 'sl_mult': 5.0, 'td_mins': 15}. Best is trial 374 with value: 1.778026240865349.
[I 2026-03-12 00:43:38,156] Trial 484 finished with value: 1.778026240865349 and parameters: {'timeframe': 'M1', 'atr_period': 13, 'atr_threshold': 2.0, 'pt_mult': 1.0, 'sl_mult': 5.0, 'td_mins': 15}. Best is trial 374 with value: 1.778026240865349.
[I 2026-03-12 00:43:38,211] Trial 485 pruned. 
[I 2026-03-12 00:43:38,267] Trial 486 finished with value: 0.0 and parameters: {'timeframe': 'M1', 'atr_period': 13, 'atr_threshold': 8.0, 'pt_mult': 1.0, 'sl_mult': 0.5, 'td_mins': 15}. Best is trial 374 with value: 1.778026240865349.
[I 2026-03-12 00:43:38,404] Trial 487 finished with value: 1.778026240865349 and parameters: {'timeframe': 'M1', 'atr_period': 13, 'atr_threshold': 2.0, 'pt_mult': 1.0, 'sl_mult': 5.0, 'td_mins': 15}. Best is trial 374 with value: 1.778026240865349.
[I 2026-03-12 00:43:38,451] Trial 488 finished with value: 0.0 and parameters: {'timeframe': 'M1', 'atr_period': 13, 'atr_threshold': 8.0, 'pt_mult': 1.0, 'sl_mult': 1.0, 'td_mins': 15}. Best is trial 374 with value: 1.778026240865349.
[I 2026-03-12 00:43:38,509] Trial 489 finished with value: 0.0 and parameters: {'timeframe': 'M1', 'atr_period': 13, 'atr_threshold': 3.0, 'pt_mult': 1.0, 'sl_mult': 5.0, 'td_mins': 180}. Best is trial 374 with value: 1.778026240865349.
[I 2026-03-12 00:43:38,659] Trial 490 finished with value: 1.1825108596082887 and parameters: {'timeframe': 'M1', 'atr_period': 13, 'atr_threshold': 2.0, 'pt_mult': 2.5, 'sl_mult': 5.0, 'td_mins': 15}. Best is trial 374 with value: 1.778026240865349.
[I 2026-03-12 00:43:38,716] Trial 491 pruned. 
[I 2026-03-12 00:43:38,774] Trial 492 pruned. 
[I 2026-03-12 00:43:38,915] Trial 493 finished with value: 1.778026240865349 and parameters: {'timeframe': 'M1', 'atr_period': 13, 'atr_threshold': 2.0, 'pt_mult': 1.0, 'sl_mult': 5.0, 'td_mins': 15}. Best is trial 374 with value: 1.778026240865349.
[I 2026-03-12 00:43:38,964] Trial 494 finished with value: 0.0 and parameters: {'timeframe': 'M1', 'atr_period': 13, 'atr_threshold': 8.0, 'pt_mult': 1.0, 'sl_mult': 5.0, 'td_mins': 1080}. Best is trial 374 with value: 1.778026240865349.
[I 2026-03-12 00:43:39,012] Trial 495 finished with value: 0.0 and parameters: {'timeframe': 'M1', 'atr_period': 13, 'atr_threshold': 15.0, 'pt_mult': 1.0, 'sl_mult': 5.0, 'td_mins': 1200}. Best is trial 374 with value: 1.778026240865349.
[I 2026-03-12 00:43:39,058] Trial 496 finished with value: 0.0 and parameters: {'timeframe': 'M1', 'atr_period': 13, 'atr_threshold': 5.0, 'pt_mult': 1.0, 'sl_mult': 5.0, 'td_mins': 360}. Best is trial 374 with value: 1.778026240865349.
[I 2026-03-12 00:43:39,104] Trial 497 finished with value: 0.0 and parameters: {'timeframe': 'M1', 'atr_period': 13, 'atr_threshold': 10.0, 'pt_mult': 1.0, 'sl_mult': 0.5, 'td_mins': 15}. Best is trial 374 with value: 1.778026240865349.
[I 2026-03-12 00:43:39,655] Trial 498 pruned. 
[I 2026-03-12 00:43:39,934] Trial 499 pruned. 
[I 2026-03-12 00:43:39,995] Trial 500 finished with value: 0.0 and parameters: {'timeframe': 'M1', 'atr_period': 13, 'atr_threshold': 15.0, 'pt_mult': 1.0, 'sl_mult': 5.0, 'td_mins': 15}. Best is trial 374 with value: 1.778026240865349.
[I 2026-03-12 00:43:41,849] Trial 501 finished with value: 0.9507615277386618 and parameters: {'timeframe': 'M1', 'atr_period': 13, 'atr_threshold': 2.0, 'pt_mult': 1.0, 'sl_mult': 5.0, 'td_mins': 1200}. Best is trial 374 with value: 1.778026240865349.
[I 2026-03-12 00:43:41,903] Trial 502 finished with value: 0.0 and parameters: {'timeframe': 'M1', 'atr_period': 13, 'atr_threshold': 8.0, 'pt_mult': 1.0, 'sl_mult': 5.0, 'td_mins': 180}. Best is trial 374 with value: 1.778026240865349.
[I 2026-03-12 00:43:42,047] Trial 503 pruned. 
[I 2026-03-12 00:43:42,112] Trial 504 pruned. 
[I 2026-03-12 00:43:42,165] Trial 505 finished with value: 0.0 and parameters: {'timeframe': 'M1', 'atr_period': 13, 'atr_threshold': 3.0, 'pt_mult': 1.0, 'sl_mult': 1.0, 'td_mins': 15}. Best is trial 374 with value: 1.778026240865349.
[I 2026-03-12 00:43:42,232] Trial 506 pruned. 
[I 2026-03-12 00:43:42,397] Trial 507 finished with value: 1.778026240865349 and parameters: {'timeframe': 'M1', 'atr_period': 13, 'atr_threshold': 2.0, 'pt_mult': 1.0, 'sl_mult': 5.0, 'td_mins': 15}. Best is trial 374 with value: 1.778026240865349.
[I 2026-03-12 00:43:42,473] Trial 508 pruned. 
[I 2026-03-12 00:43:42,940] Trial 509 finished with value: 1.5345820563546146 and parameters: {'timeframe': 'M1', 'atr_period': 13, 'atr_threshold': 1.0, 'pt_mult': 1.0, 'sl_mult': 5.0, 'td_mins': 15}. Best is trial 374 with value: 1.778026240865349.
[I 2026-03-12 00:43:43,074] Trial 510 finished with value: 1.778026240865349 and parameters: {'timeframe': 'M1', 'atr_period': 13, 'atr_threshold': 2.0, 'pt_mult': 1.0, 'sl_mult': 5.0, 'td_mins': 15}. Best is trial 374 with value: 1.778026240865349.
[I 2026-03-12 00:43:43,121] Trial 511 finished with value: 0.0 and parameters: {'timeframe': 'M1', 'atr_period': 13, 'atr_threshold': 3.0, 'pt_mult': 0.5, 'sl_mult': 5.0, 'td_mins': 15}. Best is trial 374 with value: 1.778026240865349.
[I 2026-03-12 00:43:44,701] Trial 512 finished with value: 0.9507615277386618 and parameters: {'timeframe': 'M1', 'atr_period': 13, 'atr_threshold': 2.0, 'pt_mult': 1.0, 'sl_mult': 5.0, 'td_mins': 1080}. Best is trial 374 with value: 1.778026240865349.
[I 2026-03-12 00:43:44,750] Trial 513 finished with value: 0.0 and parameters: {'timeframe': 'M1', 'atr_period': 13, 'atr_threshold': 15.0, 'pt_mult': 1.0, 'sl_mult': 5.0, 'td_mins': 120}. Best is trial 374 with value: 1.778026240865349.
[I 2026-03-12 00:43:45,170] Trial 514 finished with value: 1.0159756537053202 and parameters: {'timeframe': 'M1', 'atr_period': 13, 'atr_threshold': 2.0, 'pt_mult': 1.0, 'sl_mult': 5.0, 'td_mins': 120}. Best is trial 374 with value: 1.778026240865349.
[I 2026-03-12 00:43:45,690] Trial 515 finished with value: 0.9806061701878208 and parameters: {'timeframe': 'M1', 'atr_period': 13, 'atr_threshold': 2.0, 'pt_mult': 1.0, 'sl_mult': 5.0, 'td_mins': 180}. Best is trial 374 with value: 1.778026240865349.
[I 2026-03-12 00:43:45,975] Trial 516 finished with value: 1.0674388283470675 and parameters: {'timeframe': 'M1', 'atr_period': 13, 'atr_threshold': 2.0, 'pt_mult': 1.0, 'sl_mult': 5.0, 'td_mins': 60}. Best is trial 374 with value: 1.778026240865349.
[I 2026-03-12 00:43:46,108] Trial 517 finished with value: 1.778026240865349 and parameters: {'timeframe': 'M1', 'atr_period': 13, 'atr_threshold': 2.0, 'pt_mult': 1.0, 'sl_mult': 5.0, 'td_mins': 15}. Best is trial 374 with value: 1.778026240865349.
[I 2026-03-12 00:43:46,242] Trial 518 finished with value: 1.778026240865349 and parameters: {'timeframe': 'M1', 'atr_period': 13, 'atr_threshold': 2.0, 'pt_mult': 1.0, 'sl_mult': 5.0, 'td_mins': 15}. Best is trial 374 with value: 1.778026240865349.
[I 2026-03-12 00:43:46,290] Trial 519 finished with value: 0.0 and parameters: {'timeframe': 'M1', 'atr_period': 13, 'atr_threshold': 3.0, 'pt_mult': 1.0, 'sl_mult': 5.0, 'td_mins': 15}. Best is trial 374 with value: 1.778026240865349.
[I 2026-03-12 00:43:46,343] Trial 520 pruned. 
[I 2026-03-12 00:43:46,398] Trial 521 pruned. 
