[I 2026-03-12 01:45:53,054] Trial 47 finished with value: 0.0 and parameters: {'timeframe': 'M5', 'atr_period': 13, 'atr_threshold': 5.0, 'pt_mult': 5.0, 'sl_mult': 2.5, 'td_mins': 15}. Best is trial 17 with value: 2.3323020644376053.
[I 2026-03-12 01:45:53,108] Trial 48 finished with value: 0.0 and parameters: {'timeframe': 'M5', 'atr_period': 13, 'atr_threshold': 15.0, 'pt_mult': 1.0, 'sl_mult': 5.0, 'td_mins': 30}. Best is trial 17 with value: 2.3323020644376053.
[I 2026-03-12 01:45:53,169] Trial 49 finished with value: 0.0 and parameters: {'timeframe': 'M5', 'atr_period': 13, 'atr_threshold': 15.0, 'pt_mult': 5.0, 'sl_mult': 5.0, 'td_mins': 1200}. Best is trial 17 with value: 2.3323020644376053.
[I 2026-03-12 01:45:53,220] Trial 50 pruned. 
[I 2026-03-12 01:45:53,265] Trial 51 finished with value: 0.0 and parameters: {'timeframe': 'M5', 'atr_period': 13, 'atr_threshold': 10.0, 'pt_mult': 0.5, 'sl_mult': 5.0, 'td_mins': 720}. Best is trial 17 with value: 2.3323020644376053.
[I 2026-03-12 01:45:53,411] Trial 52 pruned. 
[I 2026-03-12 01:45:53,478] Trial 53 finished with value: 0.0 and parameters: {'timeframe': 'M5', 'atr_period': 13, 'atr_threshold': 8.0, 'pt_mult': 2.5, 'sl_mult': 1.0, 'td_mins': 1080}. Best is trial 17 with value: 2.3323020644376053.
[I 2026-03-12 01:45:53,602] Trial 54 pruned. 
[I 2026-03-12 01:45:54,564] Trial 55 pruned. 
[I 2026-03-12 01:45:54,609] Trial 56 finished with value: 0.0 and parameters: {'timeframe': 'M5', 'atr_period': 13, 'atr_threshold': 8.0, 'pt_mult': 1.0, 'sl_mult': 1.0, 'td_mins': 120}. Best is trial 17 with value: 2.3323020644376053.
[I 2026-03-12 01:45:54,657] Trial 57 finished with value: 0.0 and parameters: {'timeframe': 'M5', 'atr_period': 13, 'atr_threshold': 5.0, 'pt_mult': 1.0, 'sl_mult': 2.5, 'td_mins': 360}. Best is trial 17 with value: 2.3323020644376053.
[I 2026-03-12 01:45:54,811] Trial 58 pruned. 
[I 2026-03-12 01:45:54,871] Trial 59 pruned. 
[I 2026-03-12 01:45:54,946] Trial 60 pruned. 
[I 2026-03-12 01:45:54,992] Trial 61 finished with value: 0.0 and parameters: {'timeframe': 'M5', 'atr_period': 13, 'atr_threshold': 10.0, 'pt_mult': 5.0, 'sl_mult': 1.0, 'td_mins': 1080}. Best is trial 17 with value: 2.3323020644376053.
[I 2026-03-12 01:45:55,038] Trial 62 pruned. 
[I 2026-03-12 01:45:55,082] Trial 63 finished with value: 0.0 and parameters: {'timeframe': 'M5', 'atr_period': 13, 'atr_threshold': 15.0, 'pt_mult': 5.0, 'sl_mult': 0.5, 'td_mins': 360}. Best is trial 17 with value: 2.3323020644376053.
[I 2026-03-12 01:45:55,125] Trial 64 finished with value: 0.0 and parameters: {'timeframe': 'M5', 'atr_period': 13, 'atr_threshold': 5.0, 'pt_mult': 0.5, 'sl_mult': 2.5, 'td_mins': 30}. Best is trial 17 with value: 2.3323020644376053.
[I 2026-03-12 01:45:55,214] Trial 65 pruned. 
[I 2026-03-12 01:45:55,285] Trial 66 pruned. 
[I 2026-03-12 01:45:55,406] Trial 67 pruned. 
[I 2026-03-12 01:45:55,450] Trial 68 finished with value: 0.0 and parameters: {'timeframe': 'M5', 'atr_period': 13, 'atr_threshold': 15.0, 'pt_mult': 0.5, 'sl_mult': 2.5, 'td_mins': 1080}. Best is trial 17 with value: 2.3323020644376053.
[I 2026-03-12 01:46:03,486] Trial 69 finished with value: 0.9853924021419506 and parameters: {'timeframe': 'M5', 'atr_period': 13, 'atr_threshold': 1.0, 'pt_mult': 2.5, 'sl_mult': 5.0, 'td_mins': 1200}. Best is trial 17 with value: 2.3323020644376053.
[I 2026-03-12 01:46:03,532] Trial 70 finished with value: 0.0 and parameters: {'timeframe': 'M5', 'atr_period': 13, 'atr_threshold': 10.0, 'pt_mult': 0.5, 'sl_mult': 2.5, 'td_mins': 15}. Best is trial 17 with value: 2.3323020644376053.
[I 2026-03-12 01:46:03,583] Trial 71 finished with value: 0.0 and parameters: {'timeframe': 'M5', 'atr_period': 13, 'atr_threshold': 8.0, 'pt_mult': 5.0, 'sl_mult': 2.5, 'td_mins': 720}. Best is trial 17 with value: 2.3323020644376053.
[I 2026-03-12 01:46:03,629] Trial 72 finished with value: 0.0 and parameters: {'timeframe': 'M5', 'atr_period': 13, 'atr_threshold': 5.0, 'pt_mult': 1.0, 'sl_mult': 2.5, 'td_mins': 1200}. Best is trial 17 with value: 2.3323020644376053.
[I 2026-03-12 01:46:03,676] Trial 73 finished with value: 0.0 and parameters: {'timeframe': 'M5', 'atr_period': 13, 'atr_threshold': 15.0, 'pt_mult': 2.5, 'sl_mult': 2.5, 'td_mins': 30}. Best is trial 17 with value: 2.3323020644376053.
[I 2026-03-12 01:46:03,719] Trial 74 finished with value: 0.0 and parameters: {'timeframe': 'M5', 'atr_period': 13, 'atr_threshold': 8.0, 'pt_mult': 5.0, 'sl_mult': 0.5, 'td_mins': 60}. Best is trial 17 with value: 2.3323020644376053.
[I 2026-03-12 01:46:03,786] Trial 75 pruned. 
[I 2026-03-12 01:46:03,899] Trial 76 pruned. 
[I 2026-03-12 01:46:03,945] Trial 77 finished with value: 0.0 and parameters: {'timeframe': 'M5', 'atr_period': 13, 'atr_threshold': 10.0, 'pt_mult': 1.0, 'sl_mult': 5.0, 'td_mins': 5}. Best is trial 17 with value: 2.3323020644376053.
[I 2026-03-12 01:46:03,989] Trial 78 finished with value: 0.0 and parameters: {'timeframe': 'M5', 'atr_period': 13, 'atr_threshold': 5.0, 'pt_mult': 0.5, 'sl_mult': 0.5, 'td_mins': 120}. Best is trial 17 with value: 2.3323020644376053.
[I 2026-03-12 01:46:04,032] Trial 79 finished with value: 0.0 and parameters: {'timeframe': 'M5', 'atr_period': 13, 'atr_threshold': 5.0, 'pt_mult': 0.5, 'sl_mult': 0.5, 'td_mins': 180}. Best is trial 17 with value: 2.3323020644376053.
[I 2026-03-12 01:46:04,192] Trial 80 pruned. 
[I 2026-03-12 01:46:04,237] Trial 81 finished with value: 0.0 and parameters: {'timeframe': 'M5', 'atr_period': 13, 'atr_threshold': 5.0, 'pt_mult': 5.0, 'sl_mult': 1.0, 'td_mins': 360}. Best is trial 17 with value: 2.3323020644376053.
[I 2026-03-12 01:46:04,325] Trial 82 pruned. 
[I 2026-03-12 01:46:04,417] Trial 83 finished with value: 1.412058409497967 and parameters: {'timeframe': 'M5', 'atr_period': 13, 'atr_threshold': 3.0, 'pt_mult': 1.0, 'sl_mult': 5.0, 'td_mins': 15}. Best is trial 17 with value: 2.3323020644376053.
[I 2026-03-12 01:46:04,461] Trial 84 finished with value: 0.0 and parameters: {'timeframe': 'M5', 'atr_period': 13, 'atr_threshold': 10.0, 'pt_mult': 5.0, 'sl_mult': 0.5, 'td_mins': 30}. Best is trial 17 with value: 2.3323020644376053.
[I 2026-03-12 01:46:04,507] Trial 85 finished with value: 0.0 and parameters: {'timeframe': 'M5', 'atr_period': 13, 'atr_threshold': 5.0, 'pt_mult': 0.5, 'sl_mult': 5.0, 'td_mins': 5}. Best is trial 17 with value: 2.3323020644376053.
[I 2026-03-12 01:46:04,714] Trial 86 pruned. 
[I 2026-03-12 01:46:04,764] Trial 87 finished with value: 0.0 and parameters: {'timeframe': 'M5', 'atr_period': 13, 'atr_threshold': 15.0, 'pt_mult': 2.5, 'sl_mult': 1.0, 'td_mins': 1200}. Best is trial 17 with value: 2.3323020644376053.
[I 2026-03-12 01:46:04,811] Trial 88 finished with value: 0.0 and parameters: {'timeframe': 'M5', 'atr_period': 13, 'atr_threshold': 5.0, 'pt_mult': 0.5, 'sl_mult': 5.0, 'td_mins': 720}. Best is trial 17 with value: 2.3323020644376053.
[I 2026-03-12 01:46:04,859] Trial 89 finished with value: 0.0 and parameters: {'timeframe': 'M5', 'atr_period': 13, 'atr_threshold': 10.0, 'pt_mult': 0.5, 'sl_mult': 0.5, 'td_mins': 1080}. Best is trial 17 with value: 2.3323020644376053.
[I 2026-03-12 01:46:04,907] Trial 90 finished with value: 0.0 and parameters: {'timeframe': 'M5', 'atr_period': 13, 'atr_threshold': 15.0, 'pt_mult': 2.5, 'sl_mult': 2.5, 'td_mins': 1200}. Best is trial 17 with value: 2.3323020644376053.
[I 2026-03-12 01:46:04,951] Trial 91 finished with value: 0.0 and parameters: {'timeframe': 'M5', 'atr_period': 13, 'atr_threshold': 5.0, 'pt_mult': 0.5, 'sl_mult': 5.0, 'td_mins': 1080}. Best is trial 17 with value: 2.3323020644376053.
[I 2026-03-12 01:46:05,060] Trial 92 pruned. 
[I 2026-03-12 01:46:05,414] Trial 93 finished with value: 2.3323020644376053 and parameters: {'timeframe': 'M5', 'atr_period': 13, 'atr_threshold': 3.0, 'pt_mult': 1.0, 'sl_mult': 5.0, 'td_mins': 180}. Best is trial 17 with value: 2.3323020644376053.
[I 2026-03-12 01:46:05,463] Trial 94 finished with value: 0.0 and parameters: {'timeframe': 'M5', 'atr_period': 13, 'atr_threshold': 15.0, 'pt_mult': 0.5, 'sl_mult': 1.0, 'td_mins': 5}. Best is trial 17 with value: 2.3323020644376053.
[I 2026-03-12 01:46:05,511] Trial 95 finished with value: 0.0 and parameters: {'timeframe': 'M5', 'atr_period': 13, 'atr_threshold': 5.0, 'pt_mult': 5.0, 'sl_mult': 5.0, 'td_mins': 30}. Best is trial 17 with value: 2.3323020644376053.
[I 2026-03-12 01:46:05,639] Trial 96 pruned. 
[I 2026-03-12 01:46:05,689] Trial 97 finished with value: 0.0 and parameters: {'timeframe': 'M5', 'atr_period': 13, 'atr_threshold': 5.0, 'pt_mult': 5.0, 'sl_mult': 5.0, 'td_mins': 60}. Best is trial 17 with value: 2.3323020644376053.
[I 2026-03-12 01:46:05,802] Trial 98 pruned. 
[I 2026-03-12 01:46:05,846] Trial 99 finished with value: 0.0 and parameters: {'timeframe': 'M5', 'atr_period': 13, 'atr_threshold': 5.0, 'pt_mult': 5.0, 'sl_mult': 1.0, 'td_mins': 180}. Best is trial 17 with value: 2.3323020644376053.
[I 2026-03-12 01:46:05,887] Trial 100 finished with value: 0.0 and parameters: {'timeframe': 'M5', 'atr_period': 13, 'atr_threshold': 10.0, 'pt_mult': 2.5, 'sl_mult': 1.0, 'td_mins': 60}. Best is trial 17 with value: 2.3323020644376053.
[I 2026-03-12 01:46:06,018] Trial 101 pruned. 
[I 2026-03-12 01:46:07,157] Trial 102 finished with value: 1.16050052360944 and parameters: {'timeframe': 'M5', 'atr_period': 13, 'atr_threshold': 1.0, 'pt_mult': 2.5, 'sl_mult': 5.0, 'td_mins': 120}. Best is trial 17 with value: 2.3323020644376053.
[I 2026-03-12 01:46:07,454] Trial 103 pruned. 
[I 2026-03-12 01:46:07,498] Trial 104 finished with value: 0.0 and parameters: {'timeframe': 'M5', 'atr_period': 13, 'atr_threshold': 15.0, 'pt_mult': 5.0, 'sl_mult': 1.0, 'td_mins': 720}. Best is trial 17 with value: 2.3323020644376053.
[I 2026-03-12 01:46:07,567] Trial 105 pruned. 
[I 2026-03-12 01:46:07,752] Trial 106 pruned. 
[I 2026-03-12 01:46:07,799] Trial 107 finished with value: 0.0 and parameters: {'timeframe': 'M5', 'atr_period': 13, 'atr_threshold': 8.0, 'pt_mult': 1.0, 'sl_mult': 2.5, 'td_mins': 30}. Best is trial 17 with value: 2.3323020644376053.
[I 2026-03-12 01:46:07,845] Trial 108 finished with value: 0.0 and parameters: {'timeframe': 'M5', 'atr_period': 13, 'atr_threshold': 15.0, 'pt_mult': 1.0, 'sl_mult': 5.0, 'td_mins': 180}. Best is trial 17 with value: 2.3323020644376053.
[I 2026-03-12 01:46:07,907] Trial 109 pruned. 
[I 2026-03-12 01:46:08,028] Trial 110 finished with value: 1.277775014401294 and parameters: {'timeframe': 'M5', 'atr_period': 13, 'atr_threshold': 3.0, 'pt_mult': 1.0, 'sl_mult': 2.5, 'td_mins': 30}. Best is trial 17 with value: 2.3323020644376053.
[I 2026-03-12 01:46:08,070] Trial 111 finished with value: 0.0 and parameters: {'timeframe': 'M5', 'atr_period': 13, 'atr_threshold': 15.0, 'pt_mult': 5.0, 'sl_mult': 1.0, 'td_mins': 720}. Best is trial 17 with value: 2.3323020644376053.
[I 2026-03-12 01:46:08,114] Trial 112 finished with value: 0.0 and parameters: {'timeframe': 'M5', 'atr_period': 13, 'atr_threshold': 15.0, 'pt_mult': 1.0, 'sl_mult': 0.5, 'td_mins': 30}. Best is trial 17 with value: 2.3323020644376053.
[I 2026-03-12 01:46:09,982] Trial 113 pruned. 
[I 2026-03-12 01:46:10,542] Trial 114 finished with value: 1.879311938277294 and parameters: {'timeframe': 'M5', 'atr_period': 13, 'atr_threshold': 3.0, 'pt_mult': 0.5, 'sl_mult': 5.0, 'td_mins': 360}. Best is trial 17 with value: 2.3323020644376053.
[I 2026-03-12 01:46:10,587] Trial 115 finished with value: 0.0 and parameters: {'timeframe': 'M5', 'atr_period': 13, 'atr_threshold': 5.0, 'pt_mult': 0.5, 'sl_mult': 0.5, 'td_mins': 15}. Best is trial 17 with value: 2.3323020644376053.
[I 2026-03-12 01:46:13,441] Trial 116 finished with value: 1.1033836935983499 and parameters: {'timeframe': 'M5', 'atr_period': 13, 'atr_threshold': 0.5, 'pt_mult': 0.5, 'sl_mult': 5.0, 'td_mins': 360}. Best is trial 17 with value: 2.3323020644376053.
[I 2026-03-12 01:46:13,487] Trial 117 finished with value: 0.0 and parameters: {'timeframe': 'M5', 'atr_period': 13, 'atr_threshold': 8.0, 'pt_mult': 5.0, 'sl_mult': 5.0, 'td_mins': 5}. Best is trial 17 with value: 2.3323020644376053.
[I 2026-03-12 01:46:13,534] Trial 118 finished with value: 0.0 and parameters: {'timeframe': 'M5', 'atr_period': 13, 'atr_threshold': 8.0, 'pt_mult': 2.5, 'sl_mult': 1.0, 'td_mins': 1080}. Best is trial 17 with value: 2.3323020644376053.
[I 2026-03-12 01:46:13,721] Trial 119 pruned. 
[I 2026-03-12 01:46:13,778] Trial 120 pruned. 
[I 2026-03-12 01:46:13,847] Trial 121 pruned. 
[I 2026-03-12 01:46:13,901] Trial 122 pruned. 
[I 2026-03-12 01:46:13,945] Trial 123 finished with value: 0.0 and parameters: {'timeframe': 'M5', 'atr_period': 13, 'atr_threshold': 15.0, 'pt_mult': 2.5, 'sl_mult': 5.0, 'td_mins': 1200}. Best is trial 17 with value: 2.3323020644376053.
[I 2026-03-12 01:46:13,991] Trial 124 finished with value: 0.0 and parameters: {'timeframe': 'M5', 'atr_period': 13, 'atr_threshold': 10.0, 'pt_mult': 2.5, 'sl_mult': 0.5, 'td_mins': 120}. Best is trial 17 with value: 2.3323020644376053.
[I 2026-03-12 01:46:14,279] Trial 125 finished with value: 1.0097837866981336 and parameters: {'timeframe': 'M5', 'atr_period': 13, 'atr_threshold': 3.0, 'pt_mult': 5.0, 'sl_mult': 5.0, 'td_mins': 120}. Best is trial 17 with value: 2.3323020644376053.
[I 2026-03-12 01:46:14,337] Trial 126 pruned. 
[I 2026-03-12 01:46:14,430] Trial 127 pruned. 
[I 2026-03-12 01:46:15,076] Trial 128 finished with value: 1.8283701818560025 and parameters: {'timeframe': 'M5', 'atr_period': 13, 'atr_threshold': 1.0, 'pt_mult': 0.5, 'sl_mult': 5.0, 'td_mins': 60}. Best is trial 17 with value: 2.3323020644376053.
[I 2026-03-12 01:46:15,128] Trial 129 finished with value: 0.0 and parameters: {'timeframe': 'M5', 'atr_period': 13, 'atr_threshold': 8.0, 'pt_mult': 0.5, 'sl_mult': 1.0, 'td_mins': 360}. Best is trial 17 with value: 2.3323020644376053.
[I 2026-03-12 01:46:15,182] Trial 130 finished with value: 0.0 and parameters: {'timeframe': 'M5', 'atr_period': 13, 'atr_threshold': 8.0, 'pt_mult': 2.5, 'sl_mult': 2.5, 'td_mins': 1200}. Best is trial 17 with value: 2.3323020644376053.
[I 2026-03-12 01:46:15,229] Trial 131 finished with value: 0.0 and parameters: {'timeframe': 'M5', 'atr_period': 13, 'atr_threshold': 8.0, 'pt_mult': 0.5, 'sl_mult': 0.5, 'td_mins': 1080}. Best is trial 17 with value: 2.3323020644376053.
[I 2026-03-12 01:46:15,275] Trial 132 finished with value: 0.0 and parameters: {'timeframe': 'M5', 'atr_period': 13, 'atr_threshold': 15.0, 'pt_mult': 0.5, 'sl_mult': 1.0, 'td_mins': 15}. Best is trial 17 with value: 2.3323020644376053.
[I 2026-03-12 01:46:15,318] Trial 133 finished with value: 0.0 and parameters: {'timeframe': 'M5', 'atr_period': 13, 'atr_threshold': 15.0, 'pt_mult': 0.5, 'sl_mult': 0.5, 'td_mins': 5}. Best is trial 17 with value: 2.3323020644376053.
[I 2026-03-12 01:46:15,783] Trial 134 pruned. 
[I 2026-03-12 01:46:15,830] Trial 135 finished with value: 0.0 and parameters: {'timeframe': 'M5', 'atr_period': 13, 'atr_threshold': 5.0, 'pt_mult': 5.0, 'sl_mult': 2.5, 'td_mins': 15}. Best is trial 17 with value: 2.3323020644376053.
[I 2026-03-12 01:46:15,877] Trial 136 finished with value: 0.0 and parameters: {'timeframe': 'M5', 'atr_period': 13, 'atr_threshold': 15.0, 'pt_mult': 1.0, 'sl_mult': 2.5, 'td_mins': 180}. Best is trial 17 with value: 2.3323020644376053.
[I 2026-03-12 01:46:15,920] Trial 137 finished with value: 0.0 and parameters: {'timeframe': 'M5', 'atr_period': 13, 'atr_threshold': 8.0, 'pt_mult': 5.0, 'sl_mult': 5.0, 'td_mins': 120}. Best is trial 17 with value: 2.3323020644376053.
[I 2026-03-12 01:46:15,965] Trial 138 finished with value: 0.0 and parameters: {'timeframe': 'M5', 'atr_period': 13, 'atr_threshold': 5.0, 'pt_mult': 5.0, 'sl_mult': 2.5, 'td_mins': 360}. Best is trial 17 with value: 2.3323020644376053.
[I 2026-03-12 01:46:16,010] Trial 139 finished with value: 0.0 and parameters: {'timeframe': 'M5', 'atr_period': 13, 'atr_threshold': 15.0, 'pt_mult': 2.5, 'sl_mult': 1.0, 'td_mins': 15}. Best is trial 17 with value: 2.3323020644376053.
[I 2026-03-12 01:46:16,056] Trial 140 finished with value: 0.0 and parameters: {'timeframe': 'M5', 'atr_period': 13, 'atr_threshold': 8.0, 'pt_mult': 0.5, 'sl_mult': 0.5, 'td_mins': 30}. Best is trial 17 with value: 2.3323020644376053.
[I 2026-03-12 01:46:16,116] Trial 141 pruned. 
[I 2026-03-12 01:46:16,189] Trial 142 pruned. 
[I 2026-03-12 01:46:16,309] Trial 143 pruned. 
[I 2026-03-12 01:46:16,357] Trial 144 finished with value: 0.0 and parameters: {'timeframe': 'M5', 'atr_period': 13, 'atr_threshold': 15.0, 'pt_mult': 0.5, 'sl_mult': 0.5, 'td_mins': 15}. Best is trial 17 with value: 2.3323020644376053.
[I 2026-03-12 01:46:16,400] Trial 145 finished with value: 0.0 and parameters: {'timeframe': 'M5', 'atr_period': 13, 'atr_threshold': 15.0, 'pt_mult': 1.0, 'sl_mult': 5.0, 'td_mins': 180}. Best is trial 17 with value: 2.3323020644376053.
[I 2026-03-12 01:46:17,483] Trial 146 pruned. 
[I 2026-03-12 01:46:17,529] Trial 147 finished with value: 0.0 and parameters: {'timeframe': 'M5', 'atr_period': 13, 'atr_threshold': 8.0, 'pt_mult': 0.5, 'sl_mult': 5.0, 'td_mins': 720}. Best is trial 17 with value: 2.3323020644376053.
[I 2026-03-12 01:46:17,576] Trial 148 finished with value: 0.0 and parameters: {'timeframe': 'M5', 'atr_period': 13, 'atr_threshold': 15.0, 'pt_mult': 5.0, 'sl_mult': 1.0, 'td_mins': 120}. Best is trial 17 with value: 2.3323020644376053.
[I 2026-03-12 01:46:17,625] Trial 149 pruned. 
[I 2026-03-12 01:46:17,669] Trial 150 finished with value: 0.0 and parameters: {'timeframe': 'M5', 'atr_period': 13, 'atr_threshold': 8.0, 'pt_mult': 2.5, 'sl_mult': 1.0, 'td_mins': 360}. Best is trial 17 with value: 2.3323020644376053.
[I 2026-03-12 01:46:17,713] Trial 151 finished with value: 0.0 and parameters: {'timeframe': 'M5', 'atr_period': 13, 'atr_threshold': 10.0, 'pt_mult': 2.5, 'sl_mult': 0.5, 'td_mins': 5}. Best is trial 17 with value: 2.3323020644376053.
[I 2026-03-12 01:46:17,757] Trial 152 finished with value: 0.0 and parameters: {'timeframe': 'M5', 'atr_period': 13, 'atr_threshold': 15.0, 'pt_mult': 5.0, 'sl_mult': 5.0, 'td_mins': 60}. Best is trial 17 with value: 2.3323020644376053.
[I 2026-03-12 01:46:17,799] Trial 153 finished with value: 0.0 and parameters: {'timeframe': 'M5', 'atr_period': 13, 'atr_threshold': 10.0, 'pt_mult': 2.5, 'sl_mult': 5.0, 'td_mins': 360}. Best is trial 17 with value: 2.3323020644376053.
[I 2026-03-12 01:46:17,842] Trial 154 finished with value: 0.0 and parameters: {'timeframe': 'M5', 'atr_period': 13, 'atr_threshold': 5.0, 'pt_mult': 2.5, 'sl_mult': 2.5, 'td_mins': 30}. Best is trial 17 with value: 2.3323020644376053.
[I 2026-03-12 01:46:18,129] Trial 155 pruned. 
[I 2026-03-12 01:46:18,224] Trial 156 pruned. 
[I 2026-03-12 01:46:18,274] Trial 157 pruned. 
[I 2026-03-12 01:46:18,318] Trial 158 finished with value: 0.0 and parameters: {'timeframe': 'M5', 'atr_period': 13, 'atr_threshold': 10.0, 'pt_mult': 5.0, 'sl_mult': 0.5, 'td_mins': 60}. Best is trial 17 with value: 2.3323020644376053.
[I 2026-03-12 01:46:18,362] Trial 159 finished with value: 0.0 and parameters: {'timeframe': 'M5', 'atr_period': 13, 'atr_threshold': 5.0, 'pt_mult': 2.5, 'sl_mult': 5.0, 'td_mins': 180}. Best is trial 17 with value: 2.3323020644376053.
[I 2026-03-12 01:46:18,548] Trial 160 pruned. 
[I 2026-03-12 01:46:18,598] Trial 161 pruned. 
[I 2026-03-12 01:46:18,662] Trial 162 pruned. 
[I 2026-03-12 01:46:18,712] Trial 163 finished with value: 0.0 and parameters: {'timeframe': 'M5', 'atr_period': 13, 'atr_threshold': 10.0, 'pt_mult': 2.5, 'sl_mult': 1.0, 'td_mins': 30}. Best is trial 17 with value: 2.3323020644376053.
[I 2026-03-12 01:46:19,077] Trial 164 finished with value: 1.8893132556849117 and parameters: {'timeframe': 'M5', 'atr_period': 13, 'atr_threshold': 1.0, 'pt_mult': 0.5, 'sl_mult': 5.0, 'td_mins': 30}. Best is trial 17 with value: 2.3323020644376053.
[I 2026-03-12 01:46:19,159] Trial 165 pruned. 
[I 2026-03-12 01:46:19,206] Trial 166 finished with value: 0.0 and parameters: {'timeframe': 'M5', 'atr_period': 13, 'atr_threshold': 8.0, 'pt_mult': 5.0, 'sl_mult': 0.5, 'td_mins': 5}. Best is trial 17 with value: 2.3323020644376053.
[I 2026-03-12 01:46:19,252] Trial 167 finished with value: 0.0 and parameters: {'timeframe': 'M5', 'atr_period': 13, 'atr_threshold': 15.0, 'pt_mult': 0.5, 'sl_mult': 1.0, 'td_mins': 720}. Best is trial 17 with value: 2.3323020644376053.
[I 2026-03-12 01:46:19,297] Trial 168 finished with value: 0.0 and parameters: {'timeframe': 'M5', 'atr_period': 13, 'atr_threshold': 10.0, 'pt_mult': 5.0, 'sl_mult': 2.5, 'td_mins': 720}. Best is trial 17 with value: 2.3323020644376053.
[I 2026-03-12 01:46:19,384] Trial 169 pruned. 
[I 2026-03-12 01:46:19,428] Trial 170 finished with value: 0.0 and parameters: {'timeframe': 'M5', 'atr_period': 13, 'atr_threshold': 5.0, 'pt_mult': 5.0, 'sl_mult': 5.0, 'td_mins': 30}. Best is trial 17 with value: 2.3323020644376053.
[I 2026-03-12 01:46:19,473] Trial 171 finished with value: 0.0 and parameters: {'timeframe': 'M5', 'atr_period': 13, 'atr_threshold': 5.0, 'pt_mult': 1.0, 'sl_mult': 1.0, 'td_mins': 60}. Best is trial 17 with value: 2.3323020644376053.
[I 2026-03-12 01:46:19,521] Trial 172 finished with value: 0.0 and parameters: {'timeframe': 'M5', 'atr_period': 13, 'atr_threshold': 5.0, 'pt_mult': 5.0, 'sl_mult': 5.0, 'td_mins': 1200}. Best is trial 17 with value: 2.3323020644376053.
[I 2026-03-12 01:46:19,663] Trial 173 pruned. 
[I 2026-03-12 01:46:19,713] Trial 174 finished with value: 0.0 and parameters: {'timeframe': 'M5', 'atr_period': 13, 'atr_threshold': 5.0, 'pt_mult': 0.5, 'sl_mult': 0.5, 'td_mins': 360}. Best is trial 17 with value: 2.3323020644376053.
[I 2026-03-12 01:46:19,827] Trial 175 pruned. 
[I 2026-03-12 01:46:19,876] Trial 176 finished with value: 0.0 and parameters: {'timeframe': 'M5', 'atr_period': 13, 'atr_threshold': 10.0, 'pt_mult': 1.0, 'sl_mult': 0.5, 'td_mins': 1200}. Best is trial 17 with value: 2.3323020644376053.
