[I 2026-03-12 01:11:04,352] Trial 549 finished with value: 2.454517025102679 and parameters: {'timeframe': 'M15', 'atr_period': 13, 'atr_threshold': 3.0, 'pt_mult': 0.5, 'sl_mult': 5.0, 'td_mins': 120}. Best is trial 82 with value: 2.454517025102679.
[I 2026-03-12 01:11:04,647] Trial 550 finished with value: 2.454517025102679 and parameters: {'timeframe': 'M15', 'atr_period': 13, 'atr_threshold': 3.0, 'pt_mult': 0.5, 'sl_mult': 5.0, 'td_mins': 120}. Best is trial 82 with value: 2.454517025102679.
[I 2026-03-12 01:11:04,930] Trial 551 finished with value: 2.454517025102679 and parameters: {'timeframe': 'M15', 'atr_period': 13, 'atr_threshold': 3.0, 'pt_mult': 0.5, 'sl_mult': 5.0, 'td_mins': 120}. Best is trial 82 with value: 2.454517025102679.
[I 2026-03-12 01:11:04,980] Trial 552 finished with value: 0.0 and parameters: {'timeframe': 'M15', 'atr_period': 13, 'atr_threshold': 15.0, 'pt_mult': 0.5, 'sl_mult': 5.0, 'td_mins': 30}. Best is trial 82 with value: 2.454517025102679.
[I 2026-03-12 01:11:05,296] Trial 553 finished with value: 2.454517025102679 and parameters: {'timeframe': 'M15', 'atr_period': 13, 'atr_threshold': 3.0, 'pt_mult': 0.5, 'sl_mult': 5.0, 'td_mins': 120}. Best is trial 82 with value: 2.454517025102679.
[I 2026-03-12 01:11:05,380] Trial 554 pruned. 
[I 2026-03-12 01:11:05,443] Trial 555 pruned. 
[I 2026-03-12 01:11:05,491] Trial 556 finished with value: 0.0 and parameters: {'timeframe': 'M15', 'atr_period': 13, 'atr_threshold': 15.0, 'pt_mult': 0.5, 'sl_mult': 5.0, 'td_mins': 360}. Best is trial 82 with value: 2.454517025102679.
[I 2026-03-12 01:11:05,540] Trial 557 pruned. 
[I 2026-03-12 01:11:05,816] Trial 558 finished with value: 2.454517025102679 and parameters: {'timeframe': 'M15', 'atr_period': 13, 'atr_threshold': 3.0, 'pt_mult': 0.5, 'sl_mult': 5.0, 'td_mins': 120}. Best is trial 82 with value: 2.454517025102679.
[I 2026-03-12 01:11:05,869] Trial 559 finished with value: 0.0 and parameters: {'timeframe': 'M15', 'atr_period': 13, 'atr_threshold': 10.0, 'pt_mult': 0.5, 'sl_mult': 0.5, 'td_mins': 120}. Best is trial 82 with value: 2.454517025102679.
[I 2026-03-12 01:11:06,191] Trial 560 finished with value: 2.454517025102679 and parameters: {'timeframe': 'M15', 'atr_period': 13, 'atr_threshold': 3.0, 'pt_mult': 0.5, 'sl_mult': 5.0, 'td_mins': 120}. Best is trial 82 with value: 2.454517025102679.
[I 2026-03-12 01:11:06,491] Trial 561 finished with value: 2.454517025102679 and parameters: {'timeframe': 'M15', 'atr_period': 13, 'atr_threshold': 3.0, 'pt_mult': 0.5, 'sl_mult': 5.0, 'td_mins': 120}. Best is trial 82 with value: 2.454517025102679.
[I 2026-03-12 01:11:06,804] Trial 562 finished with value: 2.454517025102679 and parameters: {'timeframe': 'M15', 'atr_period': 13, 'atr_threshold': 3.0, 'pt_mult': 0.5, 'sl_mult': 5.0, 'td_mins': 120}. Best is trial 82 with value: 2.454517025102679.
[I 2026-03-12 01:11:06,855] Trial 563 pruned. 
[I 2026-03-12 01:11:07,118] Trial 564 pruned. 
[I 2026-03-12 01:11:07,195] Trial 565 pruned. 
[I 2026-03-12 01:11:07,337] Trial 566 pruned. 
[I 2026-03-12 01:11:07,610] Trial 567 finished with value: 2.454517025102679 and parameters: {'timeframe': 'M15', 'atr_period': 13, 'atr_threshold': 3.0, 'pt_mult': 0.5, 'sl_mult': 5.0, 'td_mins': 120}. Best is trial 82 with value: 2.454517025102679.
[I 2026-03-12 01:11:07,748] Trial 568 pruned. 
[I 2026-03-12 01:11:07,951] Trial 569 pruned. 
[I 2026-03-12 01:11:08,001] Trial 570 pruned. 
[I 2026-03-12 01:11:08,080] Trial 571 pruned. 
[I 2026-03-12 01:11:08,364] Trial 572 finished with value: 2.454517025102679 and parameters: {'timeframe': 'M15', 'atr_period': 13, 'atr_threshold': 3.0, 'pt_mult': 0.5, 'sl_mult': 5.0, 'td_mins': 120}. Best is trial 82 with value: 2.454517025102679.
[I 2026-03-12 01:11:08,445] Trial 573 pruned. 
[I 2026-03-12 01:11:08,501] Trial 574 pruned. 
[I 2026-03-12 01:11:08,788] Trial 575 finished with value: 2.454517025102679 and parameters: {'timeframe': 'M15', 'atr_period': 13, 'atr_threshold': 3.0, 'pt_mult': 0.5, 'sl_mult': 5.0, 'td_mins': 120}. Best is trial 82 with value: 2.454517025102679.
[I 2026-03-12 01:11:09,056] Trial 576 pruned. 
[I 2026-03-12 01:11:09,330] Trial 577 finished with value: 2.454517025102679 and parameters: {'timeframe': 'M15', 'atr_period': 13, 'atr_threshold': 3.0, 'pt_mult': 0.5, 'sl_mult': 5.0, 'td_mins': 120}. Best is trial 82 with value: 2.454517025102679.
[I 2026-03-12 01:11:09,451] Trial 578 pruned. 
[I 2026-03-12 01:11:09,756] Trial 579 finished with value: 2.454517025102679 and parameters: {'timeframe': 'M15', 'atr_period': 13, 'atr_threshold': 3.0, 'pt_mult': 0.5, 'sl_mult': 5.0, 'td_mins': 120}. Best is trial 82 with value: 2.454517025102679.
[I 2026-03-12 01:11:09,877] Trial 580 pruned. 
[I 2026-03-12 01:11:09,927] Trial 581 finished with value: 0.0 and parameters: {'timeframe': 'M15', 'atr_period': 13, 'atr_threshold': 15.0, 'pt_mult': 0.5, 'sl_mult': 5.0, 'td_mins': 120}. Best is trial 82 with value: 2.454517025102679.
[I 2026-03-12 01:11:10,198] Trial 582 pruned. 
[I 2026-03-12 01:11:10,280] Trial 583 pruned. 
[I 2026-03-12 01:11:10,381] Trial 584 pruned. 
[I 2026-03-12 01:11:11,105] Trial 585 pruned. 
[I 2026-03-12 01:11:11,233] Trial 586 pruned. 
[I 2026-03-12 01:11:11,377] Trial 587 pruned. 
[I 2026-03-12 01:11:12,224] Trial 588 pruned. 
[I 2026-03-12 01:11:12,301] Trial 589 pruned. 
[I 2026-03-12 01:11:12,517] Trial 590 pruned. 
[I 2026-03-12 01:11:12,572] Trial 591 pruned. 
[I 2026-03-12 01:11:12,632] Trial 592 pruned. 
[I 2026-03-12 01:11:12,681] Trial 593 finished with value: 0.0 and parameters: {'timeframe': 'M15', 'atr_period': 13, 'atr_threshold': 10.0, 'pt_mult': 5.0, 'sl_mult': 5.0, 'td_mins': 60}. Best is trial 82 with value: 2.454517025102679.
[I 2026-03-12 01:11:12,880] Trial 594 pruned. 
[I 2026-03-12 01:11:12,930] Trial 595 finished with value: 0.0 and parameters: {'timeframe': 'M15', 'atr_period': 13, 'atr_threshold': 15.0, 'pt_mult': 0.5, 'sl_mult': 5.0, 'td_mins': 1200}. Best is trial 82 with value: 2.454517025102679.
[I 2026-03-12 01:11:13,003] Trial 596 pruned. 
[I 2026-03-12 01:11:13,291] Trial 597 finished with value: 2.454517025102679 and parameters: {'timeframe': 'M15', 'atr_period': 13, 'atr_threshold': 3.0, 'pt_mult': 0.5, 'sl_mult': 5.0, 'td_mins': 120}. Best is trial 82 with value: 2.454517025102679.
[I 2026-03-12 01:11:13,588] Trial 598 finished with value: 2.454517025102679 and parameters: {'timeframe': 'M15', 'atr_period': 13, 'atr_threshold': 3.0, 'pt_mult': 0.5, 'sl_mult': 5.0, 'td_mins': 120}. Best is trial 82 with value: 2.454517025102679.
[I 2026-03-12 01:11:13,705] Trial 599 pruned. 
[I 2026-03-12 01:11:13,757] Trial 600 finished with value: 0.0 and parameters: {'timeframe': 'M15', 'atr_period': 13, 'atr_threshold': 10.0, 'pt_mult': 1.0, 'sl_mult': 2.5, 'td_mins': 5}. Best is trial 82 with value: 2.454517025102679.
[I 2026-03-12 01:11:13,836] Trial 601 pruned. 
[I 2026-03-12 01:11:13,883] Trial 602 pruned. 
[I 2026-03-12 01:11:13,952] Trial 603 pruned. 
[I 2026-03-12 01:11:14,243] Trial 604 finished with value: 2.454517025102679 and parameters: {'timeframe': 'M15', 'atr_period': 13, 'atr_threshold': 3.0, 'pt_mult': 0.5, 'sl_mult': 5.0, 'td_mins': 120}. Best is trial 82 with value: 2.454517025102679.
[I 2026-03-12 01:11:14,434] Trial 605 pruned. 
[I 2026-03-12 01:11:14,825] Trial 606 finished with value: 2.292744804194478 and parameters: {'timeframe': 'M15', 'atr_period': 13, 'atr_threshold': 3.0, 'pt_mult': 0.5, 'sl_mult': 5.0, 'td_mins': 180}. Best is trial 82 with value: 2.454517025102679.
[I 2026-03-12 01:11:14,875] Trial 607 pruned. 
[I 2026-03-12 01:11:15,195] Trial 608 finished with value: 2.454517025102679 and parameters: {'timeframe': 'M15', 'atr_period': 13, 'atr_threshold': 3.0, 'pt_mult': 0.5, 'sl_mult': 5.0, 'td_mins': 120}. Best is trial 82 with value: 2.454517025102679.
[I 2026-03-12 01:11:15,477] Trial 609 pruned. 
[I 2026-03-12 01:11:15,530] Trial 610 pruned. 
[I 2026-03-12 01:11:15,675] Trial 611 pruned. 
[I 2026-03-12 01:11:16,356] Trial 612 pruned. 
[I 2026-03-12 01:11:16,472] Trial 613 pruned. 
[I 2026-03-12 01:11:16,544] Trial 614 pruned. 
[I 2026-03-12 01:11:17,375] Trial 615 pruned. 
[I 2026-03-12 01:11:17,665] Trial 616 finished with value: 2.454517025102679 and parameters: {'timeframe': 'M15', 'atr_period': 13, 'atr_threshold': 3.0, 'pt_mult': 0.5, 'sl_mult': 5.0, 'td_mins': 120}. Best is trial 82 with value: 2.454517025102679.
[I 2026-03-12 01:11:17,713] Trial 617 finished with value: 0.0 and parameters: {'timeframe': 'M15', 'atr_period': 13, 'atr_threshold': 10.0, 'pt_mult': 2.5, 'sl_mult': 1.0, 'td_mins': 60}. Best is trial 82 with value: 2.454517025102679.
[I 2026-03-12 01:11:17,812] Trial 618 pruned. 
[I 2026-03-12 01:11:17,872] Trial 619 pruned. 
[I 2026-03-12 01:11:18,150] Trial 620 finished with value: 2.454517025102679 and parameters: {'timeframe': 'M15', 'atr_period': 13, 'atr_threshold': 3.0, 'pt_mult': 0.5, 'sl_mult': 5.0, 'td_mins': 120}. Best is trial 82 with value: 2.454517025102679.
[I 2026-03-12 01:11:18,236] Trial 621 pruned. 
[I 2026-03-12 01:11:18,533] Trial 622 finished with value: 2.454517025102679 and parameters: {'timeframe': 'M15', 'atr_period': 13, 'atr_threshold': 3.0, 'pt_mult': 0.5, 'sl_mult': 5.0, 'td_mins': 120}. Best is trial 82 with value: 2.454517025102679.
[I 2026-03-12 01:11:18,822] Trial 623 finished with value: 2.454517025102679 and parameters: {'timeframe': 'M15', 'atr_period': 13, 'atr_threshold': 3.0, 'pt_mult': 0.5, 'sl_mult': 5.0, 'td_mins': 120}. Best is trial 82 with value: 2.454517025102679.
[I 2026-03-12 01:11:18,889] Trial 624 pruned. 
[I 2026-03-12 01:11:18,976] Trial 625 pruned. 
[I 2026-03-12 01:11:19,341] Trial 626 pruned. 
[I 2026-03-12 01:11:19,394] Trial 627 pruned. 
[I 2026-03-12 01:11:19,610] Trial 628 pruned. 
[I 2026-03-12 01:11:19,706] Trial 629 pruned. 
[I 2026-03-12 01:11:20,003] Trial 630 finished with value: 2.454517025102679 and parameters: {'timeframe': 'M15', 'atr_period': 13, 'atr_threshold': 3.0, 'pt_mult': 0.5, 'sl_mult': 5.0, 'td_mins': 120}. Best is trial 82 with value: 2.454517025102679.
[I 2026-03-12 01:11:20,207] Trial 631 pruned. 
[I 2026-03-12 01:11:20,890] Trial 632 pruned. 
[I 2026-03-12 01:11:20,946] Trial 633 finished with value: 0.0 and parameters: {'timeframe': 'M15', 'atr_period': 13, 'atr_threshold': 10.0, 'pt_mult': 0.5, 'sl_mult': 5.0, 'td_mins': 720}. Best is trial 82 with value: 2.454517025102679.
[I 2026-03-12 01:11:21,006] Trial 634 pruned. 
[I 2026-03-12 01:11:21,319] Trial 635 finished with value: 2.454517025102679 and parameters: {'timeframe': 'M15', 'atr_period': 13, 'atr_threshold': 3.0, 'pt_mult': 0.5, 'sl_mult': 5.0, 'td_mins': 120}. Best is trial 82 with value: 2.454517025102679.
[I 2026-03-12 01:11:21,611] Trial 636 finished with value: 2.454517025102679 and parameters: {'timeframe': 'M15', 'atr_period': 13, 'atr_threshold': 3.0, 'pt_mult': 0.5, 'sl_mult': 5.0, 'td_mins': 120}. Best is trial 82 with value: 2.454517025102679.
[I 2026-03-12 01:11:22,252] Trial 637 pruned. 
[I 2026-03-12 01:11:22,577] Trial 638 finished with value: 2.454517025102679 and parameters: {'timeframe': 'M15', 'atr_period': 13, 'atr_threshold': 3.0, 'pt_mult': 0.5, 'sl_mult': 5.0, 'td_mins': 120}. Best is trial 82 with value: 2.454517025102679.
[I 2026-03-12 01:11:22,630] Trial 639 finished with value: 0.0 and parameters: {'timeframe': 'M15', 'atr_period': 13, 'atr_threshold': 10.0, 'pt_mult': 0.5, 'sl_mult': 5.0, 'td_mins': 120}. Best is trial 82 with value: 2.454517025102679.
[I 2026-03-12 01:11:22,685] Trial 640 pruned. 
[I 2026-03-12 01:11:22,959] Trial 641 finished with value: 2.454517025102679 and parameters: {'timeframe': 'M15', 'atr_period': 13, 'atr_threshold': 3.0, 'pt_mult': 0.5, 'sl_mult': 5.0, 'td_mins': 120}. Best is trial 82 with value: 2.454517025102679.
[I 2026-03-12 01:11:23,248] Trial 642 finished with value: 2.454517025102679 and parameters: {'timeframe': 'M15', 'atr_period': 13, 'atr_threshold': 3.0, 'pt_mult': 0.5, 'sl_mult': 5.0, 'td_mins': 120}. Best is trial 82 with value: 2.454517025102679.
[I 2026-03-12 01:11:23,726] Trial 643 pruned. 
[I 2026-03-12 01:11:24,080] Trial 644 finished with value: 2.454517025102679 and parameters: {'timeframe': 'M15', 'atr_period': 13, 'atr_threshold': 3.0, 'pt_mult': 0.5, 'sl_mult': 5.0, 'td_mins': 120}. Best is trial 82 with value: 2.454517025102679.
[I 2026-03-12 01:11:24,404] Trial 645 finished with value: 2.454517025102679 and parameters: {'timeframe': 'M15', 'atr_period': 13, 'atr_threshold': 3.0, 'pt_mult': 0.5, 'sl_mult': 5.0, 'td_mins': 120}. Best is trial 82 with value: 2.454517025102679.
[I 2026-03-12 01:11:24,499] Trial 646 pruned. 
[I 2026-03-12 01:11:24,617] Trial 647 pruned. 
[I 2026-03-12 01:11:24,675] Trial 648 finished with value: 0.0 and parameters: {'timeframe': 'M15', 'atr_period': 13, 'atr_threshold': 15.0, 'pt_mult': 0.5, 'sl_mult': 5.0, 'td_mins': 60}. Best is trial 82 with value: 2.454517025102679.
[I 2026-03-12 01:11:24,738] Trial 649 pruned. 
[I 2026-03-12 01:11:24,798] Trial 650 finished with value: 0.0 and parameters: {'timeframe': 'M15', 'atr_period': 13, 'atr_threshold': 10.0, 'pt_mult': 0.5, 'sl_mult': 1.0, 'td_mins': 360}. Best is trial 82 with value: 2.454517025102679.
[I 2026-03-12 01:11:25,118] Trial 651 finished with value: 2.454517025102679 and parameters: {'timeframe': 'M15', 'atr_period': 13, 'atr_threshold': 3.0, 'pt_mult': 0.5, 'sl_mult': 5.0, 'td_mins': 120}. Best is trial 82 with value: 2.454517025102679.
[I 2026-03-12 01:11:25,171] Trial 652 finished with value: 0.0 and parameters: {'timeframe': 'M15', 'atr_period': 13, 'atr_threshold': 10.0, 'pt_mult': 0.5, 'sl_mult': 5.0, 'td_mins': 1200}. Best is trial 82 with value: 2.454517025102679.
[I 2026-03-12 01:11:25,694] Trial 653 pruned. 
[I 2026-03-12 01:11:25,746] Trial 654 finished with value: 0.0 and parameters: {'timeframe': 'M15', 'atr_period': 13, 'atr_threshold': 15.0, 'pt_mult': 0.5, 'sl_mult': 0.5, 'td_mins': 120}. Best is trial 82 with value: 2.454517025102679.
[I 2026-03-12 01:11:25,859] Trial 655 pruned. 
[I 2026-03-12 01:11:25,914] Trial 656 finished with value: 0.0 and parameters: {'timeframe': 'M15', 'atr_period': 13, 'atr_threshold': 15.0, 'pt_mult': 2.5, 'sl_mult': 0.5, 'td_mins': 360}. Best is trial 82 with value: 2.454517025102679.
[I 2026-03-12 01:11:25,967] Trial 657 finished with value: 0.0 and parameters: {'timeframe': 'M15', 'atr_period': 13, 'atr_threshold': 10.0, 'pt_mult': 0.5, 'sl_mult': 1.0, 'td_mins': 1200}. Best is trial 82 with value: 2.454517025102679.
[I 2026-03-12 01:11:26,024] Trial 658 pruned. 
[I 2026-03-12 01:11:26,083] Trial 659 pruned. 
[I 2026-03-12 01:11:26,149] Trial 660 finished with value: 0.0 and parameters: {'timeframe': 'M15', 'atr_period': 13, 'atr_threshold': 10.0, 'pt_mult': 0.5, 'sl_mult': 2.5, 'td_mins': 180}. Best is trial 82 with value: 2.454517025102679.
[I 2026-03-12 01:11:26,211] Trial 661 pruned. 
[I 2026-03-12 01:11:26,536] Trial 662 finished with value: 2.454517025102679 and parameters: {'timeframe': 'M15', 'atr_period': 13, 'atr_threshold': 3.0, 'pt_mult': 0.5, 'sl_mult': 5.0, 'td_mins': 120}. Best is trial 82 with value: 2.454517025102679.
[I 2026-03-12 01:11:26,829] Trial 663 finished with value: 2.454517025102679 and parameters: {'timeframe': 'M15', 'atr_period': 13, 'atr_threshold': 3.0, 'pt_mult': 0.5, 'sl_mult': 5.0, 'td_mins': 120}. Best is trial 82 with value: 2.454517025102679.
[I 2026-03-12 01:11:27,121] Trial 664 finished with value: 2.454517025102679 and parameters: {'timeframe': 'M15', 'atr_period': 13, 'atr_threshold': 3.0, 'pt_mult': 0.5, 'sl_mult': 5.0, 'td_mins': 120}. Best is trial 82 with value: 2.454517025102679.
[I 2026-03-12 01:11:27,171] Trial 665 pruned. 
[I 2026-03-12 01:11:27,413] Trial 666 pruned. 
[I 2026-03-12 01:11:27,732] Trial 667 finished with value: 2.454517025102679 and parameters: {'timeframe': 'M15', 'atr_period': 13, 'atr_threshold': 3.0, 'pt_mult': 0.5, 'sl_mult': 5.0, 'td_mins': 120}. Best is trial 82 with value: 2.454517025102679.
[I 2026-03-12 01:11:27,815] Trial 668 pruned. 
[I 2026-03-12 01:11:28,144] Trial 669 finished with value: 2.454517025102679 and parameters: {'timeframe': 'M15', 'atr_period': 13, 'atr_threshold': 3.0, 'pt_mult': 0.5, 'sl_mult': 5.0, 'td_mins': 120}. Best is trial 82 with value: 2.454517025102679.
[I 2026-03-12 01:11:28,200] Trial 670 finished with value: 0.0 and parameters: {'timeframe': 'M15', 'atr_period': 13, 'atr_threshold': 15.0, 'pt_mult': 5.0, 'sl_mult': 5.0, 'td_mins': 30}. Best is trial 82 with value: 2.454517025102679.
[I 2026-03-12 01:11:28,480] Trial 671 pruned. 
[I 2026-03-12 01:11:28,764] Trial 672 finished with value: 2.454517025102679 and parameters: {'timeframe': 'M15', 'atr_period': 13, 'atr_threshold': 3.0, 'pt_mult': 0.5, 'sl_mult': 5.0, 'td_mins': 120}. Best is trial 82 with value: 2.454517025102679.
[I 2026-03-12 01:11:28,899] Trial 673 pruned. 
[I 2026-03-12 01:11:28,955] Trial 674 pruned. 
[I 2026-03-12 01:11:29,007] Trial 675 pruned. 
[I 2026-03-12 01:11:29,954] Trial 676 pruned. 
[I 2026-03-12 01:11:30,397] Trial 677 pruned. 
[I 2026-03-12 01:11:30,446] Trial 678 finished with value: 0.0 and parameters: {'timeframe': 'M15', 'atr_period': 13, 'atr_threshold': 10.0, 'pt_mult': 0.5, 'sl_mult': 5.0, 'td_mins': 30}. Best is trial 82 with value: 2.454517025102679.
[I 2026-03-12 01:11:30,731] Trial 679 finished with value: 2.454517025102679 and parameters: {'timeframe': 'M15', 'atr_period': 13, 'atr_threshold': 3.0, 'pt_mult': 0.5, 'sl_mult': 5.0, 'td_mins': 120}. Best is trial 82 with value: 2.454517025102679.
[I 2026-03-12 01:11:31,031] Trial 680 finished with value: 2.454517025102679 and parameters: {'timeframe': 'M15', 'atr_period': 13, 'atr_threshold': 3.0, 'pt_mult': 0.5, 'sl_mult': 5.0, 'td_mins': 120}. Best is trial 82 with value: 2.454517025102679.
[I 2026-03-12 01:11:31,085] Trial 681 finished with value: 0.0 and parameters: {'timeframe': 'M15', 'atr_period': 13, 'atr_threshold': 15.0, 'pt_mult': 0.5, 'sl_mult': 5.0, 'td_mins': 120}. Best is trial 82 with value: 2.454517025102679.
[I 2026-03-12 01:11:31,247] Trial 682 pruned. 
[I 2026-03-12 01:11:31,307] Trial 683 pruned. 
[I 2026-03-12 01:11:31,443] Trial 684 pruned. 
[I 2026-03-12 01:11:31,517] Trial 685 pruned. 
[I 2026-03-12 01:11:31,700] Trial 686 pruned. 
[I 2026-03-12 01:11:31,749] Trial 687 finished with value: 0.0 and parameters: {'timeframe': 'M15', 'atr_period': 13, 'atr_threshold': 15.0, 'pt_mult': 2.5, 'sl_mult': 2.5, 'td_mins': 30}. Best is trial 82 with value: 2.454517025102679.
[I 2026-03-12 01:11:31,878] Trial 688 pruned. 
[I 2026-03-12 01:11:31,943] Trial 689 pruned. 
[I 2026-03-12 01:11:32,027] Trial 690 pruned. 
[I 2026-03-12 01:11:32,097] Trial 691 pruned. 
[I 2026-03-12 01:11:32,957] Trial 692 pruned. 
[I 2026-03-12 01:11:33,008] Trial 693 finished with value: 0.0 and parameters: {'timeframe': 'M15', 'atr_period': 13, 'atr_threshold': 15.0, 'pt_mult': 2.5, 'sl_mult': 5.0, 'td_mins': 1200}. Best is trial 82 with value: 2.454517025102679.
[I 2026-03-12 01:11:33,230] Trial 694 pruned. 
[I 2026-03-12 01:11:33,290] Trial 695 pruned. 
[I 2026-03-12 01:11:33,589] Trial 696 finished with value: 2.454517025102679 and parameters: {'timeframe': 'M15', 'atr_period': 13, 'atr_threshold': 3.0, 'pt_mult': 0.5, 'sl_mult': 5.0, 'td_mins': 120}. Best is trial 82 with value: 2.454517025102679.
[I 2026-03-12 01:11:34,026] Trial 697 pruned. 
[I 2026-03-12 01:11:34,221] Trial 698 pruned. 
[I 2026-03-12 01:11:34,420] Trial 699 pruned. 
[I 2026-03-12 01:11:34,477] Trial 700 pruned. 
[I 2026-03-12 01:11:34,537] Trial 701 pruned. 
[I 2026-03-12 01:11:35,006] Trial 702 pruned. 
[I 2026-03-12 01:11:35,124] Trial 703 pruned. 
[I 2026-03-12 01:11:35,317] Trial 704 pruned. 
[I 2026-03-12 01:11:35,603] Trial 705 finished with value: 2.454517025102679 and parameters: {'timeframe': 'M15', 'atr_period': 13, 'atr_threshold': 3.0, 'pt_mult': 0.5, 'sl_mult': 5.0, 'td_mins': 120}. Best is trial 82 with value: 2.454517025102679.
[I 2026-03-12 01:11:35,659] Trial 706 pruned. 
[I 2026-03-12 01:11:35,964] Trial 707 finished with value: 2.454517025102679 and parameters: {'timeframe': 'M15', 'atr_period': 13, 'atr_threshold': 3.0, 'pt_mult': 0.5, 'sl_mult': 5.0, 'td_mins': 120}. Best is trial 82 with value: 2.454517025102679.
[I 2026-03-12 01:11:36,031] Trial 708 pruned. 
[I 2026-03-12 01:11:36,085] Trial 709 finished with value: 0.0 and parameters: {'timeframe': 'M15', 'atr_period': 13, 'atr_threshold': 15.0, 'pt_mult': 2.5, 'sl_mult': 5.0, 'td_mins': 5}. Best is trial 82 with value: 2.454517025102679.
[I 2026-03-12 01:11:36,173] Trial 710 pruned. 
[I 2026-03-12 01:11:36,257] Trial 711 pruned. 
[I 2026-03-12 01:11:36,597] Trial 712 pruned. 
[I 2026-03-12 01:11:36,653] Trial 713 pruned. 
[I 2026-03-12 01:11:36,719] Trial 714 pruned. 
[I 2026-03-12 01:11:36,770] Trial 715 pruned. 
[I 2026-03-12 01:11:37,049] Trial 716 finished with value: 2.454517025102679 and parameters: {'timeframe': 'M15', 'atr_period': 13, 'atr_threshold': 3.0, 'pt_mult': 0.5, 'sl_mult': 5.0, 'td_mins': 120}. Best is trial 82 with value: 2.454517025102679.
[I 2026-03-12 01:11:37,104] Trial 717 pruned. 
[I 2026-03-12 01:11:37,251] Trial 718 pruned. 
[I 2026-03-12 01:11:37,300] Trial 719 pruned. 
[I 2026-03-12 01:11:37,352] Trial 720 pruned. 
[I 2026-03-12 01:11:37,420] Trial 721 pruned. 
[I 2026-03-12 01:11:37,480] Trial 722 pruned. 
[I 2026-03-12 01:11:38,157] Trial 723 pruned. 
[I 2026-03-12 01:11:38,215] Trial 724 pruned. 
[I 2026-03-12 01:11:38,481] Trial 725 pruned. 
[I 2026-03-12 01:11:38,879] Trial 726 pruned. 
[I 2026-03-12 01:11:39,157] Trial 727 finished with value: 2.454517025102679 and parameters: {'timeframe': 'M15', 'atr_period': 13, 'atr_threshold': 3.0, 'pt_mult': 0.5, 'sl_mult': 5.0, 'td_mins': 120}. Best is trial 82 with value: 2.454517025102679.
