[I 2026-03-12 00:57:58,361] Trial 757 finished with value: 0.0 and parameters: {'timeframe': 'M5', 'atr_period': 13, 'atr_threshold': 8.0, 'pt_mult': 5.0, 'sl_mult': 5.0, 'td_mins': 5}. Best is trial 378 with value: 2.3870654100539324.
[I 2026-03-12 00:57:58,481] Trial 758 pruned. 
[I 2026-03-12 00:57:58,689] Trial 759 pruned. 
[I 2026-03-12 00:57:58,816] Trial 760 finished with value: 2.3870654100539324 and parameters: {'timeframe': 'M5', 'atr_period': 13, 'atr_threshold': 3.0, 'pt_mult': 0.5, 'sl_mult': 5.0, 'td_mins': 30}. Best is trial 378 with value: 2.3870654100539324.
[I 2026-03-12 00:57:58,951] Trial 761 finished with value: 2.3870654100539324 and parameters: {'timeframe': 'M5', 'atr_period': 13, 'atr_threshold': 3.0, 'pt_mult': 0.5, 'sl_mult': 5.0, 'td_mins': 30}. Best is trial 378 with value: 2.3870654100539324.
[I 2026-03-12 00:57:59,075] Trial 762 finished with value: 2.3870654100539324 and parameters: {'timeframe': 'M5', 'atr_period': 13, 'atr_threshold': 3.0, 'pt_mult': 0.5, 'sl_mult': 5.0, 'td_mins': 30}. Best is trial 378 with value: 2.3870654100539324.
[I 2026-03-12 00:57:59,196] Trial 763 finished with value: 2.3870654100539324 and parameters: {'timeframe': 'M5', 'atr_period': 13, 'atr_threshold': 3.0, 'pt_mult': 0.5, 'sl_mult': 5.0, 'td_mins': 30}. Best is trial 378 with value: 2.3870654100539324.
[I 2026-03-12 00:57:59,320] Trial 764 finished with value: 2.3870654100539324 and parameters: {'timeframe': 'M5', 'atr_period': 13, 'atr_threshold': 3.0, 'pt_mult': 0.5, 'sl_mult': 5.0, 'td_mins': 30}. Best is trial 378 with value: 2.3870654100539324.
[I 2026-03-12 00:57:59,379] Trial 765 pruned. 
[I 2026-03-12 00:58:01,471] Trial 766 pruned. 
[I 2026-03-12 00:58:01,540] Trial 767 pruned. 
[I 2026-03-12 00:58:01,589] Trial 768 finished with value: 0.0 and parameters: {'timeframe': 'M5', 'atr_period': 13, 'atr_threshold': 15.0, 'pt_mult': 0.5, 'sl_mult': 5.0, 'td_mins': 30}. Best is trial 378 with value: 2.3870654100539324.
[I 2026-03-12 00:58:01,710] Trial 769 finished with value: 2.3870654100539324 and parameters: {'timeframe': 'M5', 'atr_period': 13, 'atr_threshold': 3.0, 'pt_mult': 0.5, 'sl_mult': 5.0, 'td_mins': 30}. Best is trial 378 with value: 2.3870654100539324.
[I 2026-03-12 00:58:02,678] Trial 770 pruned. 
[I 2026-03-12 00:58:02,811] Trial 771 pruned. 
[I 2026-03-12 00:58:02,939] Trial 772 finished with value: 2.3870654100539324 and parameters: {'timeframe': 'M5', 'atr_period': 13, 'atr_threshold': 3.0, 'pt_mult': 0.5, 'sl_mult': 5.0, 'td_mins': 30}. Best is trial 378 with value: 2.3870654100539324.
[I 2026-03-12 00:58:02,996] Trial 773 pruned. 
[I 2026-03-12 00:58:03,121] Trial 774 finished with value: 2.3870654100539324 and parameters: {'timeframe': 'M5', 'atr_period': 13, 'atr_threshold': 3.0, 'pt_mult': 0.5, 'sl_mult': 5.0, 'td_mins': 30}. Best is trial 378 with value: 2.3870654100539324.
[I 2026-03-12 00:58:03,181] Trial 775 pruned. 
[I 2026-03-12 00:58:03,228] Trial 776 finished with value: 0.0 and parameters: {'timeframe': 'M5', 'atr_period': 13, 'atr_threshold': 15.0, 'pt_mult': 0.5, 'sl_mult': 1.0, 'td_mins': 720}. Best is trial 378 with value: 2.3870654100539324.
[I 2026-03-12 00:58:03,351] Trial 777 finished with value: 2.3870654100539324 and parameters: {'timeframe': 'M5', 'atr_period': 13, 'atr_threshold': 3.0, 'pt_mult': 0.5, 'sl_mult': 5.0, 'td_mins': 30}. Best is trial 378 with value: 2.3870654100539324.
[I 2026-03-12 00:58:03,479] Trial 778 finished with value: 2.3870654100539324 and parameters: {'timeframe': 'M5', 'atr_period': 13, 'atr_threshold': 3.0, 'pt_mult': 0.5, 'sl_mult': 5.0, 'td_mins': 30}. Best is trial 378 with value: 2.3870654100539324.
[I 2026-03-12 00:58:03,624] Trial 779 pruned. 
[I 2026-03-12 00:58:03,678] Trial 780 pruned. 
[I 2026-03-12 00:58:03,736] Trial 781 pruned. 
[I 2026-03-12 00:58:03,796] Trial 782 pruned. 
[I 2026-03-12 00:58:03,921] Trial 783 finished with value: 2.3870654100539324 and parameters: {'timeframe': 'M5', 'atr_period': 13, 'atr_threshold': 3.0, 'pt_mult': 0.5, 'sl_mult': 5.0, 'td_mins': 30}. Best is trial 378 with value: 2.3870654100539324.
[I 2026-03-12 00:58:04,333] Trial 784 pruned. 
[I 2026-03-12 00:58:04,383] Trial 785 finished with value: 0.0 and parameters: {'timeframe': 'M5', 'atr_period': 13, 'atr_threshold': 10.0, 'pt_mult': 5.0, 'sl_mult': 1.0, 'td_mins': 720}. Best is trial 378 with value: 2.3870654100539324.
[I 2026-03-12 00:58:04,531] Trial 786 pruned. 
[I 2026-03-12 00:58:04,713] Trial 787 pruned. 
[I 2026-03-12 00:58:04,762] Trial 788 finished with value: 0.0 and parameters: {'timeframe': 'M5', 'atr_period': 13, 'atr_threshold': 5.0, 'pt_mult': 5.0, 'sl_mult': 1.0, 'td_mins': 1080}. Best is trial 378 with value: 2.3870654100539324.
[I 2026-03-12 00:58:04,810] Trial 789 finished with value: 0.0 and parameters: {'timeframe': 'M5', 'atr_period': 13, 'atr_threshold': 8.0, 'pt_mult': 0.5, 'sl_mult': 5.0, 'td_mins': 30}. Best is trial 378 with value: 2.3870654100539324.
[I 2026-03-12 00:58:05,240] Trial 790 pruned. 
[I 2026-03-12 00:58:05,341] Trial 791 pruned. 
[I 2026-03-12 00:58:05,392] Trial 792 finished with value: 0.0 and parameters: {'timeframe': 'M5', 'atr_period': 13, 'atr_threshold': 8.0, 'pt_mult': 1.0, 'sl_mult': 0.5, 'td_mins': 180}. Best is trial 378 with value: 2.3870654100539324.
[I 2026-03-12 00:58:05,467] Trial 793 pruned. 
[I 2026-03-12 00:58:05,596] Trial 794 pruned. 
[I 2026-03-12 00:58:05,646] Trial 795 finished with value: 0.0 and parameters: {'timeframe': 'M5', 'atr_period': 13, 'atr_threshold': 10.0, 'pt_mult': 0.5, 'sl_mult': 1.0, 'td_mins': 720}. Best is trial 378 with value: 2.3870654100539324.
[I 2026-03-12 00:58:05,766] Trial 796 pruned. 
[I 2026-03-12 00:58:05,862] Trial 797 pruned. 
[I 2026-03-12 00:58:05,914] Trial 798 finished with value: 0.0 and parameters: {'timeframe': 'M5', 'atr_period': 13, 'atr_threshold': 10.0, 'pt_mult': 0.5, 'sl_mult': 5.0, 'td_mins': 30}. Best is trial 378 with value: 2.3870654100539324.
[I 2026-03-12 00:58:07,265] Trial 799 pruned. 
[I 2026-03-12 00:58:07,345] Trial 800 pruned. 
[I 2026-03-12 00:58:07,460] Trial 801 pruned. 
[I 2026-03-12 00:58:07,509] Trial 802 finished with value: 0.0 and parameters: {'timeframe': 'M5', 'atr_period': 13, 'atr_threshold': 5.0, 'pt_mult': 0.5, 'sl_mult': 5.0, 'td_mins': 30}. Best is trial 378 with value: 2.3870654100539324.
[I 2026-03-12 00:58:07,635] Trial 803 finished with value: 2.3870654100539324 and parameters: {'timeframe': 'M5', 'atr_period': 13, 'atr_threshold': 3.0, 'pt_mult': 0.5, 'sl_mult': 5.0, 'td_mins': 30}. Best is trial 378 with value: 2.3870654100539324.
[I 2026-03-12 00:58:07,690] Trial 804 pruned. 
[I 2026-03-12 00:58:07,740] Trial 805 finished with value: 0.0 and parameters: {'timeframe': 'M5', 'atr_period': 13, 'atr_threshold': 8.0, 'pt_mult': 2.5, 'sl_mult': 0.5, 'td_mins': 720}. Best is trial 378 with value: 2.3870654100539324.
[I 2026-03-12 00:58:07,791] Trial 806 finished with value: 0.0 and parameters: {'timeframe': 'M5', 'atr_period': 13, 'atr_threshold': 15.0, 'pt_mult': 2.5, 'sl_mult': 5.0, 'td_mins': 5}. Best is trial 378 with value: 2.3870654100539324.
[I 2026-03-12 00:58:07,972] Trial 807 pruned. 
[I 2026-03-12 00:58:08,093] Trial 808 finished with value: 2.3870654100539324 and parameters: {'timeframe': 'M5', 'atr_period': 13, 'atr_threshold': 3.0, 'pt_mult': 0.5, 'sl_mult': 5.0, 'td_mins': 30}. Best is trial 378 with value: 2.3870654100539324.
[I 2026-03-12 00:58:08,214] Trial 809 finished with value: 2.3870654100539324 and parameters: {'timeframe': 'M5', 'atr_period': 13, 'atr_threshold': 3.0, 'pt_mult': 0.5, 'sl_mult': 5.0, 'td_mins': 30}. Best is trial 378 with value: 2.3870654100539324.
[I 2026-03-12 00:58:08,337] Trial 810 finished with value: 2.3870654100539324 and parameters: {'timeframe': 'M5', 'atr_period': 13, 'atr_threshold': 3.0, 'pt_mult': 0.5, 'sl_mult': 5.0, 'td_mins': 30}. Best is trial 378 with value: 2.3870654100539324.
[I 2026-03-12 00:58:08,386] Trial 811 finished with value: 0.0 and parameters: {'timeframe': 'M5', 'atr_period': 13, 'atr_threshold': 8.0, 'pt_mult': 2.5, 'sl_mult': 5.0, 'td_mins': 15}. Best is trial 378 with value: 2.3870654100539324.
[I 2026-03-12 00:58:08,436] Trial 812 finished with value: 0.0 and parameters: {'timeframe': 'M5', 'atr_period': 13, 'atr_threshold': 5.0, 'pt_mult': 1.0, 'sl_mult': 2.5, 'td_mins': 60}. Best is trial 378 with value: 2.3870654100539324.
[I 2026-03-12 00:58:08,524] Trial 813 pruned. 
[I 2026-03-12 00:58:09,104] Trial 814 pruned. 
[I 2026-03-12 00:58:09,234] Trial 815 finished with value: 2.3870654100539324 and parameters: {'timeframe': 'M5', 'atr_period': 13, 'atr_threshold': 3.0, 'pt_mult': 0.5, 'sl_mult': 5.0, 'td_mins': 30}. Best is trial 378 with value: 2.3870654100539324.
[I 2026-03-12 00:58:09,366] Trial 816 pruned. 
[I 2026-03-12 00:58:09,489] Trial 817 finished with value: 2.3870654100539324 and parameters: {'timeframe': 'M5', 'atr_period': 13, 'atr_threshold': 3.0, 'pt_mult': 0.5, 'sl_mult': 5.0, 'td_mins': 30}. Best is trial 378 with value: 2.3870654100539324.
[I 2026-03-12 00:58:09,538] Trial 818 finished with value: 0.0 and parameters: {'timeframe': 'M5', 'atr_period': 13, 'atr_threshold': 15.0, 'pt_mult': 1.0, 'sl_mult': 5.0, 'td_mins': 60}. Best is trial 378 with value: 2.3870654100539324.
[I 2026-03-12 00:58:09,589] Trial 819 finished with value: 0.0 and parameters: {'timeframe': 'M5', 'atr_period': 13, 'atr_threshold': 8.0, 'pt_mult': 5.0, 'sl_mult': 5.0, 'td_mins': 360}. Best is trial 378 with value: 2.3870654100539324.
[I 2026-03-12 00:58:09,645] Trial 820 pruned. 
[I 2026-03-12 00:58:10,721] Trial 821 pruned. 
[I 2026-03-12 00:58:10,850] Trial 822 finished with value: 2.3870654100539324 and parameters: {'timeframe': 'M5', 'atr_period': 13, 'atr_threshold': 3.0, 'pt_mult': 0.5, 'sl_mult': 5.0, 'td_mins': 30}. Best is trial 378 with value: 2.3870654100539324.
[I 2026-03-12 00:58:11,053] Trial 823 pruned. 
[I 2026-03-12 00:58:11,458] Trial 824 pruned. 
[I 2026-03-12 00:58:11,526] Trial 825 pruned. 
[I 2026-03-12 00:58:11,578] Trial 826 finished with value: 0.0 and parameters: {'timeframe': 'M5', 'atr_period': 13, 'atr_threshold': 10.0, 'pt_mult': 0.5, 'sl_mult': 0.5, 'td_mins': 720}. Best is trial 378 with value: 2.3870654100539324.
[I 2026-03-12 00:58:11,703] Trial 827 finished with value: 2.3870654100539324 and parameters: {'timeframe': 'M5', 'atr_period': 13, 'atr_threshold': 3.0, 'pt_mult': 0.5, 'sl_mult': 5.0, 'td_mins': 30}. Best is trial 378 with value: 2.3870654100539324.
[I 2026-03-12 00:58:11,830] Trial 828 finished with value: 2.3870654100539324 and parameters: {'timeframe': 'M5', 'atr_period': 13, 'atr_threshold': 3.0, 'pt_mult': 0.5, 'sl_mult': 5.0, 'td_mins': 30}. Best is trial 378 with value: 2.3870654100539324.
[I 2026-03-12 00:58:12,009] Trial 829 pruned. 
[I 2026-03-12 00:58:12,429] Trial 830 pruned. 
[I 2026-03-12 00:58:12,557] Trial 831 finished with value: 2.3870654100539324 and parameters: {'timeframe': 'M5', 'atr_period': 13, 'atr_threshold': 3.0, 'pt_mult': 0.5, 'sl_mult': 5.0, 'td_mins': 30}. Best is trial 378 with value: 2.3870654100539324.
[I 2026-03-12 00:58:12,680] Trial 832 finished with value: 2.3870654100539324 and parameters: {'timeframe': 'M5', 'atr_period': 13, 'atr_threshold': 3.0, 'pt_mult': 0.5, 'sl_mult': 5.0, 'td_mins': 30}. Best is trial 378 with value: 2.3870654100539324.
[I 2026-03-12 00:58:12,780] Trial 833 pruned. 
[I 2026-03-12 00:58:12,904] Trial 834 finished with value: 2.3870654100539324 and parameters: {'timeframe': 'M5', 'atr_period': 13, 'atr_threshold': 3.0, 'pt_mult': 0.5, 'sl_mult': 5.0, 'td_mins': 30}. Best is trial 378 with value: 2.3870654100539324.
[I 2026-03-12 00:58:13,038] Trial 835 pruned. 
[I 2026-03-12 00:58:13,100] Trial 836 pruned. 
[I 2026-03-12 00:58:13,230] Trial 837 finished with value: 2.3870654100539324 and parameters: {'timeframe': 'M5', 'atr_period': 13, 'atr_threshold': 3.0, 'pt_mult': 0.5, 'sl_mult': 5.0, 'td_mins': 30}. Best is trial 378 with value: 2.3870654100539324.
[I 2026-03-12 00:58:13,296] Trial 838 pruned. 
[I 2026-03-12 00:58:14,044] Trial 839 pruned. 
[I 2026-03-12 00:58:14,177] Trial 840 pruned. 
[I 2026-03-12 00:58:16,314] Trial 841 pruned. 
[I 2026-03-12 00:58:16,373] Trial 842 finished with value: 0.0 and parameters: {'timeframe': 'M5', 'atr_period': 13, 'atr_threshold': 15.0, 'pt_mult': 2.5, 'sl_mult': 1.0, 'td_mins': 5}. Best is trial 378 with value: 2.3870654100539324.
[I 2026-03-12 00:58:16,510] Trial 843 pruned. 
[I 2026-03-12 00:58:16,632] Trial 844 finished with value: 2.3870654100539324 and parameters: {'timeframe': 'M5', 'atr_period': 13, 'atr_threshold': 3.0, 'pt_mult': 0.5, 'sl_mult': 5.0, 'td_mins': 30}. Best is trial 378 with value: 2.3870654100539324.
[I 2026-03-12 00:58:16,758] Trial 845 finished with value: 2.3870654100539324 and parameters: {'timeframe': 'M5', 'atr_period': 13, 'atr_threshold': 3.0, 'pt_mult': 0.5, 'sl_mult': 5.0, 'td_mins': 30}. Best is trial 378 with value: 2.3870654100539324.
[I 2026-03-12 00:58:16,882] Trial 846 finished with value: 2.3870654100539324 and parameters: {'timeframe': 'M5', 'atr_period': 13, 'atr_threshold': 3.0, 'pt_mult': 0.5, 'sl_mult': 5.0, 'td_mins': 30}. Best is trial 378 with value: 2.3870654100539324.
[I 2026-03-12 00:58:16,979] Trial 847 pruned. 
[I 2026-03-12 00:58:17,067] Trial 848 pruned. 
[I 2026-03-12 00:58:17,456] Trial 849 pruned. 
[I 2026-03-12 00:58:17,581] Trial 850 finished with value: 2.3870654100539324 and parameters: {'timeframe': 'M5', 'atr_period': 13, 'atr_threshold': 3.0, 'pt_mult': 0.5, 'sl_mult': 5.0, 'td_mins': 30}. Best is trial 378 with value: 2.3870654100539324.
[I 2026-03-12 00:58:18,762] Trial 851 pruned. 
[I 2026-03-12 00:58:18,891] Trial 852 finished with value: 2.3870654100539324 and parameters: {'timeframe': 'M5', 'atr_period': 13, 'atr_threshold': 3.0, 'pt_mult': 0.5, 'sl_mult': 5.0, 'td_mins': 30}. Best is trial 378 with value: 2.3870654100539324.
[I 2026-03-12 00:58:18,944] Trial 853 finished with value: 0.0 and parameters: {'timeframe': 'M5', 'atr_period': 13, 'atr_threshold': 8.0, 'pt_mult': 2.5, 'sl_mult': 2.5, 'td_mins': 1200}. Best is trial 378 with value: 2.3870654100539324.
[I 2026-03-12 00:58:18,997] Trial 854 finished with value: 0.0 and parameters: {'timeframe': 'M5', 'atr_period': 13, 'atr_threshold': 15.0, 'pt_mult': 1.0, 'sl_mult': 1.0, 'td_mins': 30}. Best is trial 378 with value: 2.3870654100539324.
[I 2026-03-12 00:58:19,046] Trial 855 finished with value: 0.0 and parameters: {'timeframe': 'M5', 'atr_period': 13, 'atr_threshold': 5.0, 'pt_mult': 0.5, 'sl_mult': 5.0, 'td_mins': 5}. Best is trial 378 with value: 2.3870654100539324.
[I 2026-03-12 00:58:19,095] Trial 856 finished with value: 0.0 and parameters: {'timeframe': 'M5', 'atr_period': 13, 'atr_threshold': 15.0, 'pt_mult': 5.0, 'sl_mult': 1.0, 'td_mins': 180}. Best is trial 378 with value: 2.3870654100539324.
[I 2026-03-12 00:58:19,221] Trial 857 finished with value: 2.3870654100539324 and parameters: {'timeframe': 'M5', 'atr_period': 13, 'atr_threshold': 3.0, 'pt_mult': 0.5, 'sl_mult': 5.0, 'td_mins': 30}. Best is trial 378 with value: 2.3870654100539324.
[I 2026-03-12 00:58:19,339] Trial 858 pruned. 
[I 2026-03-12 00:58:19,466] Trial 859 pruned. 
[I 2026-03-12 00:58:19,518] Trial 860 pruned. 
[I 2026-03-12 00:58:22,239] Trial 861 pruned. 
[I 2026-03-12 00:58:22,401] Trial 862 finished with value: 2.3870654100539324 and parameters: {'timeframe': 'M5', 'atr_period': 13, 'atr_threshold': 3.0, 'pt_mult': 0.5, 'sl_mult': 5.0, 'td_mins': 30}. Best is trial 378 with value: 2.3870654100539324.
[I 2026-03-12 00:58:22,558] Trial 863 finished with value: 2.3870654100539324 and parameters: {'timeframe': 'M5', 'atr_period': 13, 'atr_threshold': 3.0, 'pt_mult': 0.5, 'sl_mult': 5.0, 'td_mins': 30}. Best is trial 378 with value: 2.3870654100539324.
[I 2026-03-12 00:58:22,624] Trial 864 pruned. 
[I 2026-03-12 00:58:22,773] Trial 865 pruned. 
[I 2026-03-12 00:58:22,920] Trial 866 finished with value: 2.3870654100539324 and parameters: {'timeframe': 'M5', 'atr_period': 13, 'atr_threshold': 3.0, 'pt_mult': 0.5, 'sl_mult': 5.0, 'td_mins': 30}. Best is trial 378 with value: 2.3870654100539324.
[I 2026-03-12 00:58:22,980] Trial 867 finished with value: 0.0 and parameters: {'timeframe': 'M5', 'atr_period': 13, 'atr_threshold': 15.0, 'pt_mult': 0.5, 'sl_mult': 5.0, 'td_mins': 30}. Best is trial 378 with value: 2.3870654100539324.
[I 2026-03-12 00:58:23,172] Trial 868 pruned. 
[I 2026-03-12 00:58:23,246] Trial 869 pruned. 
[I 2026-03-12 00:58:23,326] Trial 870 pruned. 
[I 2026-03-12 00:58:23,474] Trial 871 finished with value: 2.3870654100539324 and parameters: {'timeframe': 'M5', 'atr_period': 13, 'atr_threshold': 3.0, 'pt_mult': 0.5, 'sl_mult': 5.0, 'td_mins': 30}. Best is trial 378 with value: 2.3870654100539324.
[I 2026-03-12 00:58:23,640] Trial 872 finished with value: 2.3870654100539324 and parameters: {'timeframe': 'M5', 'atr_period': 13, 'atr_threshold': 3.0, 'pt_mult': 0.5, 'sl_mult': 5.0, 'td_mins': 30}. Best is trial 378 with value: 2.3870654100539324.
[I 2026-03-12 00:58:23,706] Trial 873 finished with value: 0.0 and parameters: {'timeframe': 'M5', 'atr_period': 13, 'atr_threshold': 8.0, 'pt_mult': 0.5, 'sl_mult': 1.0, 'td_mins': 15}. Best is trial 378 with value: 2.3870654100539324.
[I 2026-03-12 00:58:23,786] Trial 874 pruned. 
[I 2026-03-12 00:58:23,846] Trial 875 finished with value: 0.0 and parameters: {'timeframe': 'M5', 'atr_period': 13, 'atr_threshold': 10.0, 'pt_mult': 0.5, 'sl_mult': 0.5, 'td_mins': 1080}. Best is trial 378 with value: 2.3870654100539324.
[I 2026-03-12 00:58:23,927] Trial 876 pruned. 
[I 2026-03-12 00:58:24,101] Trial 877 finished with value: 2.3870654100539324 and parameters: {'timeframe': 'M5', 'atr_period': 13, 'atr_threshold': 3.0, 'pt_mult': 0.5, 'sl_mult': 5.0, 'td_mins': 30}. Best is trial 378 with value: 2.3870654100539324.
[I 2026-03-12 00:58:24,366] Trial 878 pruned. 
[I 2026-03-12 00:58:24,467] Trial 879 pruned. 
[I 2026-03-12 00:58:24,526] Trial 880 finished with value: 0.0 and parameters: {'timeframe': 'M5', 'atr_period': 13, 'atr_threshold': 8.0, 'pt_mult': 0.5, 'sl_mult': 2.5, 'td_mins': 720}. Best is trial 378 with value: 2.3870654100539324.
[I 2026-03-12 00:58:24,622] Trial 881 pruned. 
[I 2026-03-12 00:58:24,681] Trial 882 finished with value: 0.0 and parameters: {'timeframe': 'M5', 'atr_period': 13, 'atr_threshold': 10.0, 'pt_mult': 0.5, 'sl_mult': 5.0, 'td_mins': 30}. Best is trial 378 with value: 2.3870654100539324.
[I 2026-03-12 00:58:24,838] Trial 883 finished with value: 2.3870654100539324 and parameters: {'timeframe': 'M5', 'atr_period': 13, 'atr_threshold': 3.0, 'pt_mult': 0.5, 'sl_mult': 5.0, 'td_mins': 30}. Best is trial 378 with value: 2.3870654100539324.
[I 2026-03-12 00:58:24,996] Trial 884 finished with value: 2.3870654100539324 and parameters: {'timeframe': 'M5', 'atr_period': 13, 'atr_threshold': 3.0, 'pt_mult': 0.5, 'sl_mult': 5.0, 'td_mins': 30}. Best is trial 378 with value: 2.3870654100539324.
[I 2026-03-12 00:58:25,160] Trial 885 pruned. 
[I 2026-03-12 00:58:25,212] Trial 886 finished with value: 0.0 and parameters: {'timeframe': 'M5', 'atr_period': 13, 'atr_threshold': 8.0, 'pt_mult': 0.5, 'sl_mult': 5.0, 'td_mins': 30}. Best is trial 378 with value: 2.3870654100539324.
[I 2026-03-12 00:58:25,269] Trial 887 finished with value: 0.0 and parameters: {'timeframe': 'M5', 'atr_period': 13, 'atr_threshold': 10.0, 'pt_mult': 0.5, 'sl_mult': 2.5, 'td_mins': 1080}. Best is trial 378 with value: 2.3870654100539324.
[I 2026-03-12 00:58:25,346] Trial 888 pruned. 
[I 2026-03-12 00:58:25,412] Trial 889 pruned. 
[I 2026-03-12 00:58:25,560] Trial 890 pruned. 
[I 2026-03-12 00:58:25,619] Trial 891 finished with value: 0.0 and parameters: {'timeframe': 'M5', 'atr_period': 13, 'atr_threshold': 10.0, 'pt_mult': 1.0, 'sl_mult': 1.0, 'td_mins': 15}. Best is trial 378 with value: 2.3870654100539324.
[I 2026-03-12 00:58:25,775] Trial 892 finished with value: 2.3870654100539324 and parameters: {'timeframe': 'M5', 'atr_period': 13, 'atr_threshold': 3.0, 'pt_mult': 0.5, 'sl_mult': 5.0, 'td_mins': 30}. Best is trial 378 with value: 2.3870654100539324.
[I 2026-03-12 00:58:25,840] Trial 893 finished with value: 0.0 and parameters: {'timeframe': 'M5', 'atr_period': 13, 'atr_threshold': 5.0, 'pt_mult': 0.5, 'sl_mult': 5.0, 'td_mins': 30}. Best is trial 378 with value: 2.3870654100539324.
[I 2026-03-12 00:58:25,902] Trial 894 finished with value: 0.0 and parameters: {'timeframe': 'M5', 'atr_period': 13, 'atr_threshold': 5.0, 'pt_mult': 1.0, 'sl_mult': 1.0, 'td_mins': 30}. Best is trial 378 with value: 2.3870654100539324.
[I 2026-03-12 00:58:25,986] Trial 895 finished with value: 0.0 and parameters: {'timeframe': 'M5', 'atr_period': 13, 'atr_threshold': 5.0, 'pt_mult': 2.5, 'sl_mult': 2.5, 'td_mins': 1200}. Best is trial 378 with value: 2.3870654100539324.
[I 2026-03-12 00:58:26,123] Trial 896 pruned. 
[I 2026-03-12 00:58:26,338] Trial 897 finished with value: 2.3870654100539324 and parameters: {'timeframe': 'M5', 'atr_period': 13, 'atr_threshold': 3.0, 'pt_mult': 0.5, 'sl_mult': 5.0, 'td_mins': 30}. Best is trial 378 with value: 2.3870654100539324.
[I 2026-03-12 00:58:26,530] Trial 898 finished with value: 2.3870654100539324 and parameters: {'timeframe': 'M5', 'atr_period': 13, 'atr_threshold': 3.0, 'pt_mult': 0.5, 'sl_mult': 5.0, 'td_mins': 30}. Best is trial 378 with value: 2.3870654100539324.
[I 2026-03-12 00:58:26,588] Trial 899 finished with value: 0.0 and parameters: {'timeframe': 'M5', 'atr_period': 13, 'atr_threshold': 10.0, 'pt_mult': 0.5, 'sl_mult': 1.0, 'td_mins': 360}. Best is trial 378 with value: 2.3870654100539324.
[I 2026-03-12 00:58:26,741] Trial 900 finished with value: 2.3870654100539324 and parameters: {'timeframe': 'M5', 'atr_period': 13, 'atr_threshold': 3.0, 'pt_mult': 0.5, 'sl_mult': 5.0, 'td_mins': 30}. Best is trial 378 with value: 2.3870654100539324.
