[I 2026-03-12 01:14:55,973] Trial 85 finished with value: 0.0 and parameters: {'timeframe': 'mixed', 'atr_period': 13, 'atr_threshold': 15.0, 'pt_mult': 5.0, 'sl_mult': 0.5, 'td_mins': 5}. Best is trial 28 with value: 1.4736445410959171.
[I 2026-03-12 01:14:56,431] Trial 86 finished with value: 0.7200417552988915 and parameters: {'timeframe': 'mixed', 'atr_period': 13, 'atr_threshold': 5.0, 'pt_mult': 0.5, 'sl_mult': 0.5, 'td_mins': 1080}. Best is trial 28 with value: 1.4736445410959171.
[I 2026-03-12 01:14:57,192] Trial 87 pruned. 
[I 2026-03-12 01:14:57,353] Trial 88 finished with value: 0.0 and parameters: {'timeframe': 'mixed', 'atr_period': 13, 'atr_threshold': 10.0, 'pt_mult': 2.5, 'sl_mult': 1.0, 'td_mins': 1200}. Best is trial 28 with value: 1.4736445410959171.
[I 2026-03-12 01:14:57,491] Trial 89 pruned. 
[I 2026-03-12 01:14:58,005] Trial 90 pruned. 
[I 2026-03-12 01:14:58,174] Trial 91 finished with value: 0.0 and parameters: {'timeframe': 'mixed', 'atr_period': 13, 'atr_threshold': 10.0, 'pt_mult': 0.5, 'sl_mult': 0.5, 'td_mins': 5}. Best is trial 28 with value: 1.4736445410959171.
[I 2026-03-12 01:14:58,342] Trial 92 finished with value: 0.0 and parameters: {'timeframe': 'mixed', 'atr_period': 13, 'atr_threshold': 15.0, 'pt_mult': 2.5, 'sl_mult': 0.5, 'td_mins': 180}. Best is trial 28 with value: 1.4736445410959171.
[I 2026-03-12 01:14:58,969] Trial 93 pruned. 
[I 2026-03-12 01:14:59,132] Trial 94 finished with value: 0.0 and parameters: {'timeframe': 'mixed', 'atr_period': 13, 'atr_threshold': 15.0, 'pt_mult': 5.0, 'sl_mult': 1.0, 'td_mins': 5}. Best is trial 28 with value: 1.4736445410959171.
[I 2026-03-12 01:15:01,328] Trial 95 pruned. 
[I 2026-03-12 01:15:01,606] Trial 96 finished with value: 0.7028061481983068 and parameters: {'timeframe': 'mixed', 'atr_period': 13, 'atr_threshold': 5.0, 'pt_mult': 1.0, 'sl_mult': 0.5, 'td_mins': 180}. Best is trial 28 with value: 1.4736445410959171.
[I 2026-03-12 01:15:01,758] Trial 97 pruned. 
[I 2026-03-12 01:15:01,970] Trial 98 pruned. 
[I 2026-03-12 01:15:02,277] Trial 99 finished with value: 0.7305244101000201 and parameters: {'timeframe': 'mixed', 'atr_period': 13, 'atr_threshold': 5.0, 'pt_mult': 0.5, 'sl_mult': 2.5, 'td_mins': 180}. Best is trial 28 with value: 1.4736445410959171.
[I 2026-03-12 01:15:02,497] Trial 100 pruned. 
[I 2026-03-12 01:15:05,998] Trial 101 pruned. 
[I 2026-03-12 01:15:06,162] Trial 102 finished with value: 0.0 and parameters: {'timeframe': 'mixed', 'atr_period': 13, 'atr_threshold': 15.0, 'pt_mult': 0.5, 'sl_mult': 1.0, 'td_mins': 1080}. Best is trial 28 with value: 1.4736445410959171.
[I 2026-03-12 01:15:06,471] Trial 103 pruned. 
[I 2026-03-12 01:15:06,634] Trial 104 pruned. 
[I 2026-03-12 01:15:06,908] Trial 105 pruned. 
[I 2026-03-12 01:15:08,887] Trial 106 finished with value: 1.256423319090118 and parameters: {'timeframe': 'mixed', 'atr_period': 13, 'atr_threshold': 0.5, 'pt_mult': 0.5, 'sl_mult': 5.0, 'td_mins': 30}. Best is trial 28 with value: 1.4736445410959171.
[I 2026-03-12 01:15:09,046] Trial 107 finished with value: 0.0 and parameters: {'timeframe': 'mixed', 'atr_period': 13, 'atr_threshold': 10.0, 'pt_mult': 0.5, 'sl_mult': 5.0, 'td_mins': 15}. Best is trial 28 with value: 1.4736445410959171.
[I 2026-03-12 01:15:09,206] Trial 108 finished with value: 0.0 and parameters: {'timeframe': 'mixed', 'atr_period': 13, 'atr_threshold': 15.0, 'pt_mult': 5.0, 'sl_mult': 1.0, 'td_mins': 120}. Best is trial 28 with value: 1.4736445410959171.
[I 2026-03-12 01:15:09,367] Trial 109 finished with value: 0.0 and parameters: {'timeframe': 'mixed', 'atr_period': 13, 'atr_threshold': 15.0, 'pt_mult': 1.0, 'sl_mult': 1.0, 'td_mins': 120}. Best is trial 28 with value: 1.4736445410959171.
[I 2026-03-12 01:15:12,104] Trial 110 pruned. 
[I 2026-03-12 01:15:13,138] Trial 111 finished with value: 1.901343006707687 and parameters: {'timeframe': 'mixed', 'atr_period': 13, 'atr_threshold': 3.0, 'pt_mult': 0.5, 'sl_mult': 5.0, 'td_mins': 180}. Best is trial 111 with value: 1.901343006707687.
[I 2026-03-12 01:15:13,289] Trial 112 pruned. 
[I 2026-03-12 01:15:18,289] Trial 113 pruned. 
[I 2026-03-12 01:15:21,957] Trial 114 pruned. 
[I 2026-03-12 01:15:22,059] Trial 115 pruned. 
[I 2026-03-12 01:15:22,254] Trial 116 pruned. 
[I 2026-03-12 01:15:22,354] Trial 117 pruned. 
[I 2026-03-12 01:15:22,491] Trial 118 pruned. 
[I 2026-03-12 01:15:23,488] Trial 119 finished with value: 1.0631543534169539 and parameters: {'timeframe': 'mixed', 'atr_period': 13, 'atr_threshold': 3.0, 'pt_mult': 0.5, 'sl_mult': 1.0, 'td_mins': 360}. Best is trial 111 with value: 1.901343006707687.
[I 2026-03-12 01:15:23,661] Trial 120 pruned. 
[I 2026-03-12 01:15:27,965] Trial 121 pruned. 
[I 2026-03-12 01:15:28,079] Trial 122 pruned. 
[I 2026-03-12 01:15:31,284] Trial 123 pruned. 
[I 2026-03-12 01:15:31,699] Trial 124 pruned. 
[I 2026-03-12 01:15:31,863] Trial 125 finished with value: 0.0 and parameters: {'timeframe': 'mixed', 'atr_period': 13, 'atr_threshold': 10.0, 'pt_mult': 1.0, 'sl_mult': 5.0, 'td_mins': 5}. Best is trial 111 with value: 1.901343006707687.
[I 2026-03-12 01:15:32,019] Trial 126 finished with value: 0.0 and parameters: {'timeframe': 'mixed', 'atr_period': 13, 'atr_threshold': 15.0, 'pt_mult': 1.0, 'sl_mult': 1.0, 'td_mins': 180}. Best is trial 111 with value: 1.901343006707687.
[I 2026-03-12 01:15:32,322] Trial 127 finished with value: 0.7305244101000201 and parameters: {'timeframe': 'mixed', 'atr_period': 13, 'atr_threshold': 5.0, 'pt_mult': 0.5, 'sl_mult': 2.5, 'td_mins': 180}. Best is trial 111 with value: 1.901343006707687.
[I 2026-03-12 01:15:32,464] Trial 128 pruned. 
[I 2026-03-12 01:15:33,541] Trial 129 pruned. 
[I 2026-03-12 01:15:33,715] Trial 130 finished with value: 0.0 and parameters: {'timeframe': 'mixed', 'atr_period': 13, 'atr_threshold': 10.0, 'pt_mult': 2.5, 'sl_mult': 2.5, 'td_mins': 360}. Best is trial 111 with value: 1.901343006707687.
[I 2026-03-12 01:15:34,132] Trial 131 pruned. 
[I 2026-03-12 01:15:34,245] Trial 132 pruned. 
[I 2026-03-12 01:15:34,408] Trial 133 finished with value: 0.0 and parameters: {'timeframe': 'mixed', 'atr_period': 13, 'atr_threshold': 10.0, 'pt_mult': 0.5, 'sl_mult': 2.5, 'td_mins': 720}. Best is trial 111 with value: 1.901343006707687.
[I 2026-03-12 01:15:35,004] Trial 134 pruned. 
[I 2026-03-12 01:15:35,121] Trial 135 pruned. 
[I 2026-03-12 01:15:35,265] Trial 136 pruned. 
[I 2026-03-12 01:15:37,093] Trial 137 finished with value: 1.0647388237803603 and parameters: {'timeframe': 'mixed', 'atr_period': 13, 'atr_threshold': 3.0, 'pt_mult': 0.5, 'sl_mult': 1.0, 'td_mins': 1080}. Best is trial 111 with value: 1.901343006707687.
[I 2026-03-12 01:15:37,291] Trial 138 pruned. 
[I 2026-03-12 01:15:37,396] Trial 139 pruned. 
[I 2026-03-12 01:15:37,559] Trial 140 finished with value: 0.0 and parameters: {'timeframe': 'mixed', 'atr_period': 13, 'atr_threshold': 15.0, 'pt_mult': 1.0, 'sl_mult': 0.5, 'td_mins': 30}. Best is trial 111 with value: 1.901343006707687.
[I 2026-03-12 01:15:37,756] Trial 141 pruned. 
[I 2026-03-12 01:15:37,899] Trial 142 pruned. 
[I 2026-03-12 01:15:41,311] Trial 143 finished with value: 1.0248170594569836 and parameters: {'timeframe': 'mixed', 'atr_period': 13, 'atr_threshold': 1.0, 'pt_mult': 1.0, 'sl_mult': 0.5, 'td_mins': 360}. Best is trial 111 with value: 1.901343006707687.
[I 2026-03-12 01:15:41,922] Trial 144 pruned. 
[I 2026-03-12 01:15:42,221] Trial 145 pruned. 
[I 2026-03-12 01:15:42,522] Trial 146 pruned. 
[I 2026-03-12 01:15:44,981] Trial 147 finished with value: 1.0638374062307108 and parameters: {'timeframe': 'mixed', 'atr_period': 13, 'atr_threshold': 3.0, 'pt_mult': 1.0, 'sl_mult': 1.0, 'td_mins': 1080}. Best is trial 111 with value: 1.901343006707687.
[I 2026-03-12 01:15:47,541] Trial 148 pruned. 
[I 2026-03-12 01:15:47,702] Trial 149 finished with value: 0.0 and parameters: {'timeframe': 'mixed', 'atr_period': 13, 'atr_threshold': 10.0, 'pt_mult': 1.0, 'sl_mult': 2.5, 'td_mins': 60}. Best is trial 111 with value: 1.901343006707687.
[I 2026-03-12 01:15:49,347] Trial 150 pruned. 
[I 2026-03-12 01:15:49,460] Trial 151 pruned. 
[I 2026-03-12 01:15:49,620] Trial 152 finished with value: 0.0 and parameters: {'timeframe': 'mixed', 'atr_period': 13, 'atr_threshold': 15.0, 'pt_mult': 5.0, 'sl_mult': 1.0, 'td_mins': 60}. Best is trial 111 with value: 1.901343006707687.
[I 2026-03-12 01:15:49,727] Trial 153 pruned. 
[I 2026-03-12 01:15:50,737] Trial 154 finished with value: 1.1716594167659165 and parameters: {'timeframe': 'mixed', 'atr_period': 13, 'atr_threshold': 2.0, 'pt_mult': 0.5, 'sl_mult': 2.5, 'td_mins': 60}. Best is trial 111 with value: 1.901343006707687.
[I 2026-03-12 01:15:50,894] Trial 155 finished with value: 0.0 and parameters: {'timeframe': 'mixed', 'atr_period': 13, 'atr_threshold': 10.0, 'pt_mult': 2.5, 'sl_mult': 2.5, 'td_mins': 720}. Best is trial 111 with value: 1.901343006707687.
[I 2026-03-12 01:15:52,823] Trial 156 finished with value: 1.112658063878332 and parameters: {'timeframe': 'mixed', 'atr_period': 13, 'atr_threshold': 2.0, 'pt_mult': 0.5, 'sl_mult': 2.5, 'td_mins': 180}. Best is trial 111 with value: 1.901343006707687.
[I 2026-03-12 01:15:53,019] Trial 157 finished with value: 1.3881073172410645 and parameters: {'timeframe': 'mixed', 'atr_period': 13, 'atr_threshold': 5.0, 'pt_mult': 0.5, 'sl_mult': 5.0, 'td_mins': 15}. Best is trial 111 with value: 1.901343006707687.
[I 2026-03-12 01:15:58,481] Trial 158 finished with value: 1.0055535730766068 and parameters: {'timeframe': 'mixed', 'atr_period': 13, 'atr_threshold': 3.0, 'pt_mult': 0.5, 'sl_mult': 5.0, 'td_mins': 1200}. Best is trial 111 with value: 1.901343006707687.
[I 2026-03-12 01:16:00,034] Trial 159 finished with value: 1.0647388237803603 and parameters: {'timeframe': 'mixed', 'atr_period': 13, 'atr_threshold': 3.0, 'pt_mult': 0.5, 'sl_mult': 1.0, 'td_mins': 720}. Best is trial 111 with value: 1.901343006707687.
[I 2026-03-12 01:16:00,200] Trial 160 finished with value: 0.0 and parameters: {'timeframe': 'mixed', 'atr_period': 13, 'atr_threshold': 15.0, 'pt_mult': 5.0, 'sl_mult': 0.5, 'td_mins': 5}. Best is trial 111 with value: 1.901343006707687.
[I 2026-03-12 01:16:01,185] Trial 161 pruned. 
[I 2026-03-12 01:16:01,351] Trial 162 finished with value: 0.0 and parameters: {'timeframe': 'mixed', 'atr_period': 13, 'atr_threshold': 10.0, 'pt_mult': 5.0, 'sl_mult': 5.0, 'td_mins': 15}. Best is trial 111 with value: 1.901343006707687.
[I 2026-03-12 01:16:05,222] Trial 163 pruned. 
[I 2026-03-12 01:16:05,830] Trial 164 pruned. 
[I 2026-03-12 01:16:11,901] Trial 165 pruned. 
[I 2026-03-12 01:16:12,555] Trial 166 pruned. 
[I 2026-03-12 01:16:12,698] Trial 167 pruned. 
[I 2026-03-12 01:16:12,831] Trial 168 pruned. 
[I 2026-03-12 01:16:12,930] Trial 169 pruned. 
[I 2026-03-12 01:16:13,094] Trial 170 finished with value: 0.0 and parameters: {'timeframe': 'mixed', 'atr_period': 13, 'atr_threshold': 10.0, 'pt_mult': 0.5, 'sl_mult': 5.0, 'td_mins': 15}. Best is trial 111 with value: 1.901343006707687.
[I 2026-03-12 01:16:13,224] Trial 171 pruned. 
[I 2026-03-12 01:16:13,396] Trial 172 finished with value: 0.0 and parameters: {'timeframe': 'mixed', 'atr_period': 13, 'atr_threshold': 15.0, 'pt_mult': 2.5, 'sl_mult': 5.0, 'td_mins': 360}. Best is trial 111 with value: 1.901343006707687.
[I 2026-03-12 01:16:13,538] Trial 173 pruned. 
[I 2026-03-12 01:16:14,354] Trial 174 pruned. 
[I 2026-03-12 01:16:14,613] Trial 175 pruned. 
[I 2026-03-12 01:16:17,490] Trial 176 finished with value: 1.0743993022967973 and parameters: {'timeframe': 'mixed', 'atr_period': 13, 'atr_threshold': 2.0, 'pt_mult': 0.5, 'sl_mult': 2.5, 'td_mins': 360}. Best is trial 111 with value: 1.901343006707687.
[I 2026-03-12 01:16:17,589] Trial 177 pruned. 
[I 2026-03-12 01:16:17,731] Trial 178 pruned. 
[I 2026-03-12 01:16:17,894] Trial 179 finished with value: 0.0 and parameters: {'timeframe': 'mixed', 'atr_period': 13, 'atr_threshold': 15.0, 'pt_mult': 0.5, 'sl_mult': 1.0, 'td_mins': 120}. Best is trial 111 with value: 1.901343006707687.
[I 2026-03-12 01:16:18,118] Trial 180 pruned. 
[I 2026-03-12 01:16:18,601] Trial 181 pruned. 
[I 2026-03-12 01:16:19,747] Trial 182 pruned. 
[I 2026-03-12 01:16:19,917] Trial 183 pruned. 
[I 2026-03-12 01:16:20,046] Trial 184 pruned. 
[I 2026-03-12 01:16:20,624] Trial 185 pruned. 
[I 2026-03-12 01:16:20,980] Trial 186 finished with value: 0.9391618722607584 and parameters: {'timeframe': 'mixed', 'atr_period': 13, 'atr_threshold': 5.0, 'pt_mult': 1.0, 'sl_mult': 5.0, 'td_mins': 180}. Best is trial 111 with value: 1.901343006707687.
[I 2026-03-12 01:16:21,121] Trial 187 pruned. 
[I 2026-03-12 01:16:21,332] Trial 188 finished with value: 1.815519643729255 and parameters: {'timeframe': 'mixed', 'atr_period': 13, 'atr_threshold': 5.0, 'pt_mult': 0.5, 'sl_mult': 5.0, 'td_mins': 30}. Best is trial 111 with value: 1.901343006707687.
[I 2026-03-12 01:16:21,491] Trial 189 finished with value: 0.0 and parameters: {'timeframe': 'mixed', 'atr_period': 13, 'atr_threshold': 15.0, 'pt_mult': 0.5, 'sl_mult': 2.5, 'td_mins': 1200}. Best is trial 111 with value: 1.901343006707687.
[I 2026-03-12 01:16:21,631] Trial 190 pruned. 
[I 2026-03-12 01:16:21,770] Trial 191 pruned. 
[I 2026-03-12 01:16:21,873] Trial 192 pruned. 
[I 2026-03-12 01:16:21,980] Trial 193 pruned. 
[I 2026-03-12 01:16:23,586] Trial 194 pruned. 
[I 2026-03-12 01:16:23,756] Trial 195 pruned. 
[I 2026-03-12 01:16:25,407] Trial 196 pruned. 
[I 2026-03-12 01:16:25,523] Trial 197 pruned. 
[I 2026-03-12 01:16:26,159] Trial 198 pruned. 
[I 2026-03-12 01:16:26,494] Trial 199 pruned. 
[I 2026-03-12 01:16:28,108] Trial 200 pruned. 
[I 2026-03-12 01:16:32,495] Trial 201 pruned. 
[I 2026-03-12 01:16:38,629] Trial 202 finished with value: 1.1814175601729562 and parameters: {'timeframe': 'mixed', 'atr_period': 13, 'atr_threshold': 2.0, 'pt_mult': 0.5, 'sl_mult': 5.0, 'td_mins': 720}. Best is trial 111 with value: 1.901343006707687.
[I 2026-03-12 01:16:40,263] Trial 203 pruned. 
[I 2026-03-12 01:16:40,557] Trial 204 pruned. 
[I 2026-03-12 01:16:40,777] Trial 205 pruned. 
[I 2026-03-12 01:16:42,897] Trial 206 finished with value: 1.0647388237803603 and parameters: {'timeframe': 'mixed', 'atr_period': 13, 'atr_threshold': 3.0, 'pt_mult': 0.5, 'sl_mult': 1.0, 'td_mins': 1200}. Best is trial 111 with value: 1.901343006707687.
[I 2026-03-12 01:16:43,065] Trial 207 finished with value: 0.0 and parameters: {'timeframe': 'mixed', 'atr_period': 13, 'atr_threshold': 15.0, 'pt_mult': 2.5, 'sl_mult': 2.5, 'td_mins': 30}. Best is trial 111 with value: 1.901343006707687.
[I 2026-03-12 01:16:43,194] Trial 208 pruned. 
[I 2026-03-12 01:16:43,304] Trial 209 pruned. 
[I 2026-03-12 01:16:43,810] Trial 210 pruned. 
[I 2026-03-12 01:16:49,265] Trial 211 pruned. 
[I 2026-03-12 01:16:49,410] Trial 212 pruned. 
[I 2026-03-12 01:16:49,571] Trial 213 finished with value: 0.0 and parameters: {'timeframe': 'mixed', 'atr_period': 13, 'atr_threshold': 10.0, 'pt_mult': 2.5, 'sl_mult': 2.5, 'td_mins': 5}. Best is trial 111 with value: 1.901343006707687.
[I 2026-03-12 01:16:49,669] Trial 214 pruned. 
[I 2026-03-12 01:16:49,832] Trial 215 finished with value: 0.0 and parameters: {'timeframe': 'mixed', 'atr_period': 13, 'atr_threshold': 10.0, 'pt_mult': 5.0, 'sl_mult': 1.0, 'td_mins': 60}. Best is trial 111 with value: 1.901343006707687.
[I 2026-03-12 01:16:49,971] Trial 216 pruned. 
[I 2026-03-12 01:16:50,115] Trial 217 pruned. 
[I 2026-03-12 01:16:50,213] Trial 218 pruned. 
[I 2026-03-12 01:16:50,357] Trial 219 pruned. 
[I 2026-03-12 01:16:50,786] Trial 220 pruned. 
[I 2026-03-12 01:16:51,769] Trial 221 pruned. 
[I 2026-03-12 01:16:52,386] Trial 222 pruned. 
[I 2026-03-12 01:16:52,787] Trial 223 pruned. 
[I 2026-03-12 01:16:52,936] Trial 224 pruned. 
[I 2026-03-12 01:16:58,327] Trial 225 pruned. 
[I 2026-03-12 01:16:58,532] Trial 226 pruned. 
[I 2026-03-12 01:16:58,696] Trial 227 finished with value: 0.0 and parameters: {'timeframe': 'mixed', 'atr_period': 13, 'atr_threshold': 15.0, 'pt_mult': 0.5, 'sl_mult': 5.0, 'td_mins': 5}. Best is trial 111 with value: 1.901343006707687.
[I 2026-03-12 01:16:58,860] Trial 228 finished with value: 0.0 and parameters: {'timeframe': 'mixed', 'atr_period': 13, 'atr_threshold': 15.0, 'pt_mult': 1.0, 'sl_mult': 2.5, 'td_mins': 5}. Best is trial 111 with value: 1.901343006707687.
[I 2026-03-12 01:16:58,978] Trial 229 pruned. 
[I 2026-03-12 01:17:04,185] Trial 230 finished with value: 1.0055535730766068 and parameters: {'timeframe': 'mixed', 'atr_period': 13, 'atr_threshold': 3.0, 'pt_mult': 0.5, 'sl_mult': 5.0, 'td_mins': 1200}. Best is trial 111 with value: 1.901343006707687.
[I 2026-03-12 01:17:04,485] Trial 231 finished with value: 1.1169437167356642 and parameters: {'timeframe': 'mixed', 'atr_period': 13, 'atr_threshold': 3.0, 'pt_mult': 0.5, 'sl_mult': 2.5, 'td_mins': 15}. Best is trial 111 with value: 1.901343006707687.
[I 2026-03-12 01:17:08,369] Trial 232 pruned. 
[I 2026-03-12 01:17:14,812] Trial 233 pruned. 
[I 2026-03-12 01:17:16,880] Trial 234 pruned. 
[I 2026-03-12 01:17:16,992] Trial 235 pruned. 
[I 2026-03-12 01:17:17,093] Trial 236 pruned. 
[I 2026-03-12 01:17:20,530] Trial 237 pruned. 
[I 2026-03-12 01:17:20,674] Trial 238 pruned. 
[I 2026-03-12 01:17:20,838] Trial 239 finished with value: 0.0 and parameters: {'timeframe': 'mixed', 'atr_period': 13, 'atr_threshold': 15.0, 'pt_mult': 0.5, 'sl_mult': 1.0, 'td_mins': 180}. Best is trial 111 with value: 1.901343006707687.
[I 2026-03-12 01:17:21,049] Trial 240 finished with value: 0.0 and parameters: {'timeframe': 'mixed', 'atr_period': 13, 'atr_threshold': 15.0, 'pt_mult': 2.5, 'sl_mult': 5.0, 'td_mins': 120}. Best is trial 111 with value: 1.901343006707687.
[I 2026-03-12 01:17:21,216] Trial 241 finished with value: 0.0 and parameters: {'timeframe': 'mixed', 'atr_period': 13, 'atr_threshold': 15.0, 'pt_mult': 1.0, 'sl_mult': 5.0, 'td_mins': 30}. Best is trial 111 with value: 1.901343006707687.
[I 2026-03-12 01:17:21,387] Trial 242 finished with value: 0.0 and parameters: {'timeframe': 'mixed', 'atr_period': 13, 'atr_threshold': 10.0, 'pt_mult': 0.5, 'sl_mult': 5.0, 'td_mins': 60}. Best is trial 111 with value: 1.901343006707687.
[I 2026-03-12 01:17:21,492] Trial 243 pruned. 
[I 2026-03-12 01:17:21,727] Trial 244 pruned. 
[I 2026-03-12 01:17:22,039] Trial 245 pruned. 
[I 2026-03-12 01:17:22,155] Trial 246 pruned. 
[I 2026-03-12 01:17:23,376] Trial 247 pruned. 
[I 2026-03-12 01:17:23,532] Trial 248 pruned. 
[I 2026-03-12 01:17:24,388] Trial 249 finished with value: 1.7154922913036164 and parameters: {'timeframe': 'mixed', 'atr_period': 13, 'atr_threshold': 3.0, 'pt_mult': 1.0, 'sl_mult': 5.0, 'td_mins': 120}. Best is trial 111 with value: 1.901343006707687.
[I 2026-03-12 01:17:25,795] Trial 250 pruned. 
[I 2026-03-12 01:17:36,236] Trial 251 finished with value: 1.0832596839995405 and parameters: {'timeframe': 'mixed', 'atr_period': 13, 'atr_threshold': 0.5, 'pt_mult': 1.0, 'sl_mult': 5.0, 'td_mins': 360}. Best is trial 111 with value: 1.901343006707687.
[I 2026-03-12 01:17:36,397] Trial 252 finished with value: 0.0 and parameters: {'timeframe': 'mixed', 'atr_period': 13, 'atr_threshold': 10.0, 'pt_mult': 5.0, 'sl_mult': 1.0, 'td_mins': 30}. Best is trial 111 with value: 1.901343006707687.
[I 2026-03-12 01:17:36,601] Trial 253 finished with value: 1.815519643729255 and parameters: {'timeframe': 'mixed', 'atr_period': 13, 'atr_threshold': 5.0, 'pt_mult': 0.5, 'sl_mult': 5.0, 'td_mins': 30}. Best is trial 111 with value: 1.901343006707687.
[I 2026-03-12 01:17:38,348] Trial 254 pruned. 
[I 2026-03-12 01:17:38,527] Trial 255 finished with value: 0.0 and parameters: {'timeframe': 'mixed', 'atr_period': 13, 'atr_threshold': 15.0, 'pt_mult': 0.5, 'sl_mult': 2.5, 'td_mins': 15}. Best is trial 111 with value: 1.901343006707687.
[I 2026-03-12 01:17:38,674] Trial 256 pruned. 
[I 2026-03-12 01:17:43,855] Trial 257 finished with value: 1.1365514145487687 and parameters: {'timeframe': 'mixed', 'atr_period': 13, 'atr_threshold': 0.5, 'pt_mult': 1.0, 'sl_mult': 5.0, 'td_mins': 120}. Best is trial 111 with value: 1.901343006707687.
[I 2026-03-12 01:17:43,998] Trial 258 pruned. 
[I 2026-03-12 01:17:44,161] Trial 259 finished with value: 0.0 and parameters: {'timeframe': 'mixed', 'atr_period': 13, 'atr_threshold': 10.0, 'pt_mult': 5.0, 'sl_mult': 2.5, 'td_mins': 1080}. Best is trial 111 with value: 1.901343006707687.
[I 2026-03-12 01:17:44,315] Trial 260 pruned. 
[I 2026-03-12 01:17:44,728] Trial 261 pruned. 
[I 2026-03-12 01:17:44,874] Trial 262 pruned. 
[I 2026-03-12 01:17:45,036] Trial 263 finished with value: 0.0 and parameters: {'timeframe': 'mixed', 'atr_period': 13, 'atr_threshold': 15.0, 'pt_mult': 2.5, 'sl_mult': 0.5, 'td_mins': 120}. Best is trial 111 with value: 1.901343006707687.
[I 2026-03-12 01:17:47,028] Trial 264 pruned. 
[I 2026-03-12 01:17:47,202] Trial 265 finished with value: 0.0 and parameters: {'timeframe': 'mixed', 'atr_period': 13, 'atr_threshold': 15.0, 'pt_mult': 1.0, 'sl_mult': 2.5, 'td_mins': 60}. Best is trial 111 with value: 1.901343006707687.
[I 2026-03-12 01:17:47,372] Trial 266 finished with value: 0.0 and parameters: {'timeframe': 'mixed', 'atr_period': 13, 'atr_threshold': 10.0, 'pt_mult': 5.0, 'sl_mult': 2.5, 'td_mins': 1080}. Best is trial 111 with value: 1.901343006707687.
[I 2026-03-12 01:17:47,563] Trial 267 pruned. 
[I 2026-03-12 01:17:47,696] Trial 268 pruned. 
[I 2026-03-12 01:17:47,867] Trial 269 finished with value: 0.0 and parameters: {'timeframe': 'mixed', 'atr_period': 13, 'atr_threshold': 10.0, 'pt_mult': 1.0, 'sl_mult': 5.0, 'td_mins': 180}. Best is trial 111 with value: 1.901343006707687.
[I 2026-03-12 01:17:48,017] Trial 270 pruned. 
[I 2026-03-12 01:17:48,116] Trial 271 pruned. 
[I 2026-03-12 01:17:48,281] Trial 272 finished with value: 0.0 and parameters: {'timeframe': 'mixed', 'atr_period': 13, 'atr_threshold': 15.0, 'pt_mult': 2.5, 'sl_mult': 1.0, 'td_mins': 360}. Best is trial 111 with value: 1.901343006707687.
