[I 2026-03-12 00:51:13,319] Trial 711 finished with value: 2.6610758639085312 and parameters: {'timeframe': 'M3', 'atr_period': 13, 'atr_threshold': 3.0, 'pt_mult': 0.5, 'sl_mult': 5.0, 'td_mins': 30}. Best is trial 226 with value: 2.6610758639085312.
[I 2026-03-12 00:51:13,436] Trial 712 finished with value: 2.6610758639085312 and parameters: {'timeframe': 'M3', 'atr_period': 13, 'atr_threshold': 3.0, 'pt_mult': 0.5, 'sl_mult': 5.0, 'td_mins': 30}. Best is trial 226 with value: 2.6610758639085312.
[I 2026-03-12 00:51:13,508] Trial 713 pruned. 
[I 2026-03-12 00:51:13,628] Trial 714 finished with value: 2.6610758639085312 and parameters: {'timeframe': 'M3', 'atr_period': 13, 'atr_threshold': 3.0, 'pt_mult': 0.5, 'sl_mult': 5.0, 'td_mins': 30}. Best is trial 226 with value: 2.6610758639085312.
[I 2026-03-12 00:51:13,689] Trial 715 pruned. 
[I 2026-03-12 00:51:14,057] Trial 716 pruned. 
[I 2026-03-12 00:51:14,105] Trial 717 finished with value: 0.0 and parameters: {'timeframe': 'M3', 'atr_period': 13, 'atr_threshold': 10.0, 'pt_mult': 0.5, 'sl_mult': 1.0, 'td_mins': 1200}. Best is trial 226 with value: 2.6610758639085312.
[I 2026-03-12 00:51:14,226] Trial 718 finished with value: 2.6610758639085312 and parameters: {'timeframe': 'M3', 'atr_period': 13, 'atr_threshold': 3.0, 'pt_mult': 0.5, 'sl_mult': 5.0, 'td_mins': 30}. Best is trial 226 with value: 2.6610758639085312.
[I 2026-03-12 00:51:14,352] Trial 719 finished with value: 2.6610758639085312 and parameters: {'timeframe': 'M3', 'atr_period': 13, 'atr_threshold': 3.0, 'pt_mult': 0.5, 'sl_mult': 5.0, 'td_mins': 30}. Best is trial 226 with value: 2.6610758639085312.
[I 2026-03-12 00:51:14,403] Trial 720 finished with value: 0.0 and parameters: {'timeframe': 'M3', 'atr_period': 13, 'atr_threshold': 8.0, 'pt_mult': 2.5, 'sl_mult': 5.0, 'td_mins': 30}. Best is trial 226 with value: 2.6610758639085312.
[I 2026-03-12 00:51:14,453] Trial 721 finished with value: 0.0 and parameters: {'timeframe': 'M3', 'atr_period': 13, 'atr_threshold': 8.0, 'pt_mult': 2.5, 'sl_mult': 2.5, 'td_mins': 5}. Best is trial 226 with value: 2.6610758639085312.
[I 2026-03-12 00:51:14,503] Trial 722 finished with value: 0.0 and parameters: {'timeframe': 'M3', 'atr_period': 13, 'atr_threshold': 10.0, 'pt_mult': 0.5, 'sl_mult': 5.0, 'td_mins': 30}. Best is trial 226 with value: 2.6610758639085312.
[I 2026-03-12 00:51:14,726] Trial 723 pruned. 
[I 2026-03-12 00:51:14,776] Trial 724 finished with value: 0.0 and parameters: {'timeframe': 'M3', 'atr_period': 13, 'atr_threshold': 8.0, 'pt_mult': 2.5, 'sl_mult': 0.5, 'td_mins': 60}. Best is trial 226 with value: 2.6610758639085312.
[I 2026-03-12 00:51:14,826] Trial 725 finished with value: 0.0 and parameters: {'timeframe': 'M3', 'atr_period': 13, 'atr_threshold': 5.0, 'pt_mult': 0.5, 'sl_mult': 0.5, 'td_mins': 15}. Best is trial 226 with value: 2.6610758639085312.
[I 2026-03-12 00:51:14,944] Trial 726 finished with value: 2.6610758639085312 and parameters: {'timeframe': 'M3', 'atr_period': 13, 'atr_threshold': 3.0, 'pt_mult': 0.5, 'sl_mult': 5.0, 'td_mins': 30}. Best is trial 226 with value: 2.6610758639085312.
[I 2026-03-12 00:51:15,633] Trial 727 pruned. 
[I 2026-03-12 00:51:15,889] Trial 728 pruned. 
[I 2026-03-12 00:51:15,958] Trial 729 pruned. 
[I 2026-03-12 00:51:16,176] Trial 730 pruned. 
[I 2026-03-12 00:51:16,236] Trial 731 pruned. 
[I 2026-03-12 00:51:16,601] Trial 732 pruned. 
[I 2026-03-12 00:51:16,835] Trial 733 pruned. 
[I 2026-03-12 00:51:16,895] Trial 734 pruned. 
[I 2026-03-12 00:51:16,992] Trial 735 finished with value: 2.56808242042213 and parameters: {'timeframe': 'M3', 'atr_period': 13, 'atr_threshold': 3.0, 'pt_mult': 0.5, 'sl_mult': 5.0, 'td_mins': 15}. Best is trial 226 with value: 2.6610758639085312.
[I 2026-03-12 00:51:17,041] Trial 736 finished with value: 0.0 and parameters: {'timeframe': 'M3', 'atr_period': 13, 'atr_threshold': 8.0, 'pt_mult': 2.5, 'sl_mult': 5.0, 'td_mins': 360}. Best is trial 226 with value: 2.6610758639085312.
[I 2026-03-12 00:51:17,237] Trial 737 pruned. 
[I 2026-03-12 00:51:17,414] Trial 738 finished with value: 2.6610758639085312 and parameters: {'timeframe': 'M3', 'atr_period': 13, 'atr_threshold': 3.0, 'pt_mult': 0.5, 'sl_mult': 5.0, 'td_mins': 30}. Best is trial 226 with value: 2.6610758639085312.
[I 2026-03-12 00:51:17,531] Trial 739 finished with value: 2.6610758639085312 and parameters: {'timeframe': 'M3', 'atr_period': 13, 'atr_threshold': 3.0, 'pt_mult': 0.5, 'sl_mult': 5.0, 'td_mins': 30}. Best is trial 226 with value: 2.6610758639085312.
[I 2026-03-12 00:51:17,629] Trial 740 pruned. 
[I 2026-03-12 00:51:17,748] Trial 741 finished with value: 2.6610758639085312 and parameters: {'timeframe': 'M3', 'atr_period': 13, 'atr_threshold': 3.0, 'pt_mult': 0.5, 'sl_mult': 5.0, 'td_mins': 30}. Best is trial 226 with value: 2.6610758639085312.
[I 2026-03-12 00:51:17,866] Trial 742 finished with value: 2.6610758639085312 and parameters: {'timeframe': 'M3', 'atr_period': 13, 'atr_threshold': 3.0, 'pt_mult': 0.5, 'sl_mult': 5.0, 'td_mins': 30}. Best is trial 226 with value: 2.6610758639085312.
[I 2026-03-12 00:51:17,916] Trial 743 finished with value: 0.0 and parameters: {'timeframe': 'M3', 'atr_period': 13, 'atr_threshold': 5.0, 'pt_mult': 0.5, 'sl_mult': 2.5, 'td_mins': 720}. Best is trial 226 with value: 2.6610758639085312.
[I 2026-03-12 00:51:18,013] Trial 744 pruned. 
[I 2026-03-12 00:51:18,088] Trial 745 pruned. 
[I 2026-03-12 00:51:18,162] Trial 746 pruned. 
[I 2026-03-12 00:51:18,210] Trial 747 finished with value: 0.0 and parameters: {'timeframe': 'M3', 'atr_period': 13, 'atr_threshold': 8.0, 'pt_mult': 1.0, 'sl_mult': 2.5, 'td_mins': 1200}. Best is trial 226 with value: 2.6610758639085312.
[I 2026-03-12 00:51:18,258] Trial 748 finished with value: 0.0 and parameters: {'timeframe': 'M3', 'atr_period': 13, 'atr_threshold': 5.0, 'pt_mult': 5.0, 'sl_mult': 1.0, 'td_mins': 5}. Best is trial 226 with value: 2.6610758639085312.
[I 2026-03-12 00:51:18,375] Trial 749 finished with value: 2.6610758639085312 and parameters: {'timeframe': 'M3', 'atr_period': 13, 'atr_threshold': 3.0, 'pt_mult': 0.5, 'sl_mult': 5.0, 'td_mins': 30}. Best is trial 226 with value: 2.6610758639085312.
[I 2026-03-12 00:51:18,496] Trial 750 finished with value: 2.6610758639085312 and parameters: {'timeframe': 'M3', 'atr_period': 13, 'atr_threshold': 3.0, 'pt_mult': 0.5, 'sl_mult': 5.0, 'td_mins': 30}. Best is trial 226 with value: 2.6610758639085312.
[I 2026-03-12 00:51:21,956] Trial 751 pruned. 
[I 2026-03-12 00:51:22,040] Trial 752 pruned. 
[I 2026-03-12 00:51:22,097] Trial 753 pruned. 
[I 2026-03-12 00:51:22,851] Trial 754 pruned. 
[I 2026-03-12 00:51:22,901] Trial 755 finished with value: 0.0 and parameters: {'timeframe': 'M3', 'atr_period': 13, 'atr_threshold': 10.0, 'pt_mult': 0.5, 'sl_mult': 2.5, 'td_mins': 120}. Best is trial 226 with value: 2.6610758639085312.
[I 2026-03-12 00:51:22,955] Trial 756 finished with value: 0.0 and parameters: {'timeframe': 'M3', 'atr_period': 13, 'atr_threshold': 15.0, 'pt_mult': 5.0, 'sl_mult': 1.0, 'td_mins': 1080}. Best is trial 226 with value: 2.6610758639085312.
[I 2026-03-12 00:51:23,012] Trial 757 pruned. 
[I 2026-03-12 00:51:23,164] Trial 758 pruned. 
[I 2026-03-12 00:51:24,513] Trial 759 pruned. 
[I 2026-03-12 00:51:24,753] Trial 760 pruned. 
[I 2026-03-12 00:51:24,897] Trial 761 finished with value: 2.6610758639085312 and parameters: {'timeframe': 'M3', 'atr_period': 13, 'atr_threshold': 3.0, 'pt_mult': 0.5, 'sl_mult': 5.0, 'td_mins': 30}. Best is trial 226 with value: 2.6610758639085312.
[I 2026-03-12 00:51:24,969] Trial 762 pruned. 
[I 2026-03-12 00:51:25,024] Trial 763 finished with value: 0.0 and parameters: {'timeframe': 'M3', 'atr_period': 13, 'atr_threshold': 10.0, 'pt_mult': 5.0, 'sl_mult': 0.5, 'td_mins': 360}. Best is trial 226 with value: 2.6610758639085312.
[I 2026-03-12 00:51:25,075] Trial 764 finished with value: 0.0 and parameters: {'timeframe': 'M3', 'atr_period': 13, 'atr_threshold': 10.0, 'pt_mult': 2.5, 'sl_mult': 1.0, 'td_mins': 1200}. Best is trial 226 with value: 2.6610758639085312.
[I 2026-03-12 00:51:25,152] Trial 765 pruned. 
[I 2026-03-12 00:51:25,216] Trial 766 pruned. 
[I 2026-03-12 00:51:25,398] Trial 767 finished with value: 2.4718369634519943 and parameters: {'timeframe': 'M3', 'atr_period': 13, 'atr_threshold': 3.0, 'pt_mult': 0.5, 'sl_mult': 5.0, 'td_mins': 60}. Best is trial 226 with value: 2.6610758639085312.
[I 2026-03-12 00:51:25,637] Trial 768 pruned. 
[I 2026-03-12 00:51:25,691] Trial 769 finished with value: 0.0 and parameters: {'timeframe': 'M3', 'atr_period': 13, 'atr_threshold': 10.0, 'pt_mult': 1.0, 'sl_mult': 5.0, 'td_mins': 360}. Best is trial 226 with value: 2.6610758639085312.
[I 2026-03-12 00:51:25,753] Trial 770 pruned. 
[I 2026-03-12 00:51:26,388] Trial 771 pruned. 
[I 2026-03-12 00:51:26,495] Trial 772 pruned. 
[I 2026-03-12 00:51:26,750] Trial 773 pruned. 
[I 2026-03-12 00:51:26,836] Trial 774 pruned. 
[I 2026-03-12 00:51:26,972] Trial 775 finished with value: 2.6610758639085312 and parameters: {'timeframe': 'M3', 'atr_period': 13, 'atr_threshold': 3.0, 'pt_mult': 0.5, 'sl_mult': 5.0, 'td_mins': 30}. Best is trial 226 with value: 2.6610758639085312.
[I 2026-03-12 00:51:27,023] Trial 776 finished with value: 0.0 and parameters: {'timeframe': 'M3', 'atr_period': 13, 'atr_threshold': 10.0, 'pt_mult': 2.5, 'sl_mult': 5.0, 'td_mins': 360}. Best is trial 226 with value: 2.6610758639085312.
[I 2026-03-12 00:51:27,081] Trial 777 finished with value: 0.0 and parameters: {'timeframe': 'M3', 'atr_period': 13, 'atr_threshold': 5.0, 'pt_mult': 2.5, 'sl_mult': 0.5, 'td_mins': 180}. Best is trial 226 with value: 2.6610758639085312.
[I 2026-03-12 00:51:27,207] Trial 778 finished with value: 2.6610758639085312 and parameters: {'timeframe': 'M3', 'atr_period': 13, 'atr_threshold': 3.0, 'pt_mult': 0.5, 'sl_mult': 5.0, 'td_mins': 30}. Best is trial 226 with value: 2.6610758639085312.
[I 2026-03-12 00:51:27,388] Trial 779 pruned. 
[I 2026-03-12 00:51:27,446] Trial 780 pruned. 
[I 2026-03-12 00:51:27,497] Trial 781 finished with value: 0.0 and parameters: {'timeframe': 'M3', 'atr_period': 13, 'atr_threshold': 5.0, 'pt_mult': 0.5, 'sl_mult': 5.0, 'td_mins': 30}. Best is trial 226 with value: 2.6610758639085312.
[I 2026-03-12 00:51:27,550] Trial 782 pruned. 
[I 2026-03-12 00:51:27,605] Trial 783 pruned. 
[I 2026-03-12 00:51:27,698] Trial 784 pruned. 
[I 2026-03-12 00:51:27,772] Trial 785 pruned. 
[I 2026-03-12 00:51:27,821] Trial 786 finished with value: 0.0 and parameters: {'timeframe': 'M3', 'atr_period': 13, 'atr_threshold': 15.0, 'pt_mult': 1.0, 'sl_mult': 0.5, 'td_mins': 15}. Best is trial 226 with value: 2.6610758639085312.
[I 2026-03-12 00:51:29,016] Trial 787 pruned. 
[I 2026-03-12 00:51:29,151] Trial 788 finished with value: 2.6610758639085312 and parameters: {'timeframe': 'M3', 'atr_period': 13, 'atr_threshold': 3.0, 'pt_mult': 0.5, 'sl_mult': 5.0, 'td_mins': 30}. Best is trial 226 with value: 2.6610758639085312.
[I 2026-03-12 00:51:29,206] Trial 789 finished with value: 0.0 and parameters: {'timeframe': 'M3', 'atr_period': 13, 'atr_threshold': 8.0, 'pt_mult': 0.5, 'sl_mult': 2.5, 'td_mins': 360}. Best is trial 226 with value: 2.6610758639085312.
[I 2026-03-12 00:51:32,098] Trial 790 pruned. 
[I 2026-03-12 00:51:32,222] Trial 791 finished with value: 2.6610758639085312 and parameters: {'timeframe': 'M3', 'atr_period': 13, 'atr_threshold': 3.0, 'pt_mult': 0.5, 'sl_mult': 5.0, 'td_mins': 30}. Best is trial 226 with value: 2.6610758639085312.
[I 2026-03-12 00:51:34,824] Trial 792 pruned. 
[I 2026-03-12 00:51:34,887] Trial 793 pruned. 
[I 2026-03-12 00:51:35,011] Trial 794 pruned. 
[I 2026-03-12 00:51:35,618] Trial 795 pruned. 
[I 2026-03-12 00:51:35,674] Trial 796 finished with value: 0.0 and parameters: {'timeframe': 'M3', 'atr_period': 13, 'atr_threshold': 15.0, 'pt_mult': 5.0, 'sl_mult': 5.0, 'td_mins': 15}. Best is trial 226 with value: 2.6610758639085312.
[I 2026-03-12 00:51:36,098] Trial 797 pruned. 
[I 2026-03-12 00:51:36,215] Trial 798 finished with value: 2.6610758639085312 and parameters: {'timeframe': 'M3', 'atr_period': 13, 'atr_threshold': 3.0, 'pt_mult': 0.5, 'sl_mult': 5.0, 'td_mins': 30}. Best is trial 226 with value: 2.6610758639085312.
[I 2026-03-12 00:51:36,337] Trial 799 finished with value: 2.6610758639085312 and parameters: {'timeframe': 'M3', 'atr_period': 13, 'atr_threshold': 3.0, 'pt_mult': 0.5, 'sl_mult': 5.0, 'td_mins': 30}. Best is trial 226 with value: 2.6610758639085312.
[I 2026-03-12 00:51:36,403] Trial 800 pruned. 
[I 2026-03-12 00:51:36,551] Trial 801 pruned. 
[I 2026-03-12 00:51:36,603] Trial 802 finished with value: 0.0 and parameters: {'timeframe': 'M3', 'atr_period': 13, 'atr_threshold': 5.0, 'pt_mult': 5.0, 'sl_mult': 0.5, 'td_mins': 360}. Best is trial 226 with value: 2.6610758639085312.
[I 2026-03-12 00:51:36,665] Trial 803 pruned. 
[I 2026-03-12 00:51:36,717] Trial 804 finished with value: 0.0 and parameters: {'timeframe': 'M3', 'atr_period': 13, 'atr_threshold': 15.0, 'pt_mult': 0.5, 'sl_mult': 5.0, 'td_mins': 180}. Best is trial 226 with value: 2.6610758639085312.
[I 2026-03-12 00:51:36,834] Trial 805 finished with value: 2.6610758639085312 and parameters: {'timeframe': 'M3', 'atr_period': 13, 'atr_threshold': 3.0, 'pt_mult': 0.5, 'sl_mult': 5.0, 'td_mins': 30}. Best is trial 226 with value: 2.6610758639085312.
[I 2026-03-12 00:51:36,950] Trial 806 finished with value: 2.6610758639085312 and parameters: {'timeframe': 'M3', 'atr_period': 13, 'atr_threshold': 3.0, 'pt_mult': 0.5, 'sl_mult': 5.0, 'td_mins': 30}. Best is trial 226 with value: 2.6610758639085312.
[I 2026-03-12 00:51:36,999] Trial 807 finished with value: 0.0 and parameters: {'timeframe': 'M3', 'atr_period': 13, 'atr_threshold': 8.0, 'pt_mult': 0.5, 'sl_mult': 5.0, 'td_mins': 30}. Best is trial 226 with value: 2.6610758639085312.
[I 2026-03-12 00:51:37,046] Trial 808 finished with value: 0.0 and parameters: {'timeframe': 'M3', 'atr_period': 13, 'atr_threshold': 8.0, 'pt_mult': 5.0, 'sl_mult': 5.0, 'td_mins': 180}. Best is trial 226 with value: 2.6610758639085312.
[I 2026-03-12 00:51:37,096] Trial 809 finished with value: 0.0 and parameters: {'timeframe': 'M3', 'atr_period': 13, 'atr_threshold': 10.0, 'pt_mult': 5.0, 'sl_mult': 1.0, 'td_mins': 120}. Best is trial 226 with value: 2.6610758639085312.
[I 2026-03-12 00:51:37,252] Trial 810 pruned. 
[I 2026-03-12 00:51:37,440] Trial 811 finished with value: 2.6610758639085312 and parameters: {'timeframe': 'M3', 'atr_period': 13, 'atr_threshold': 3.0, 'pt_mult': 0.5, 'sl_mult': 5.0, 'td_mins': 30}. Best is trial 226 with value: 2.6610758639085312.
[I 2026-03-12 00:51:37,593] Trial 812 pruned. 
[I 2026-03-12 00:51:37,768] Trial 813 finished with value: 2.6610758639085312 and parameters: {'timeframe': 'M3', 'atr_period': 13, 'atr_threshold': 3.0, 'pt_mult': 0.5, 'sl_mult': 5.0, 'td_mins': 30}. Best is trial 226 with value: 2.6610758639085312.
[I 2026-03-12 00:51:38,143] Trial 814 pruned. 
[I 2026-03-12 00:51:39,075] Trial 815 pruned. 
[I 2026-03-12 00:51:39,128] Trial 816 finished with value: 0.0 and parameters: {'timeframe': 'M3', 'atr_period': 13, 'atr_threshold': 5.0, 'pt_mult': 2.5, 'sl_mult': 2.5, 'td_mins': 60}. Best is trial 226 with value: 2.6610758639085312.
[I 2026-03-12 00:51:39,537] Trial 817 pruned. 
[I 2026-03-12 00:51:39,795] Trial 818 pruned. 
[I 2026-03-12 00:51:39,846] Trial 819 finished with value: 0.0 and parameters: {'timeframe': 'M3', 'atr_period': 13, 'atr_threshold': 15.0, 'pt_mult': 0.5, 'sl_mult': 5.0, 'td_mins': 30}. Best is trial 226 with value: 2.6610758639085312.
[I 2026-03-12 00:51:39,974] Trial 820 finished with value: 2.6610758639085312 and parameters: {'timeframe': 'M3', 'atr_period': 13, 'atr_threshold': 3.0, 'pt_mult': 0.5, 'sl_mult': 5.0, 'td_mins': 30}. Best is trial 226 with value: 2.6610758639085312.
[I 2026-03-12 00:51:40,092] Trial 821 finished with value: 2.6610758639085312 and parameters: {'timeframe': 'M3', 'atr_period': 13, 'atr_threshold': 3.0, 'pt_mult': 0.5, 'sl_mult': 5.0, 'td_mins': 30}. Best is trial 226 with value: 2.6610758639085312.
[I 2026-03-12 00:51:40,142] Trial 822 finished with value: 0.0 and parameters: {'timeframe': 'M3', 'atr_period': 13, 'atr_threshold': 10.0, 'pt_mult': 2.5, 'sl_mult': 1.0, 'td_mins': 15}. Best is trial 226 with value: 2.6610758639085312.
[I 2026-03-12 00:51:40,484] Trial 823 pruned. 
[I 2026-03-12 00:51:40,626] Trial 824 finished with value: 2.6610758639085312 and parameters: {'timeframe': 'M3', 'atr_period': 13, 'atr_threshold': 3.0, 'pt_mult': 0.5, 'sl_mult': 5.0, 'td_mins': 30}. Best is trial 226 with value: 2.6610758639085312.
[I 2026-03-12 00:51:40,679] Trial 825 finished with value: 0.0 and parameters: {'timeframe': 'M3', 'atr_period': 13, 'atr_threshold': 15.0, 'pt_mult': 5.0, 'sl_mult': 1.0, 'td_mins': 60}. Best is trial 226 with value: 2.6610758639085312.
[I 2026-03-12 00:51:42,602] Trial 826 pruned. 
[I 2026-03-12 00:51:42,661] Trial 827 pruned. 
[I 2026-03-12 00:51:42,780] Trial 828 finished with value: 2.6610758639085312 and parameters: {'timeframe': 'M3', 'atr_period': 13, 'atr_threshold': 3.0, 'pt_mult': 0.5, 'sl_mult': 5.0, 'td_mins': 30}. Best is trial 226 with value: 2.6610758639085312.
[I 2026-03-12 00:51:42,898] Trial 829 finished with value: 2.6610758639085312 and parameters: {'timeframe': 'M3', 'atr_period': 13, 'atr_threshold': 3.0, 'pt_mult': 0.5, 'sl_mult': 5.0, 'td_mins': 30}. Best is trial 226 with value: 2.6610758639085312.
[I 2026-03-12 00:51:43,019] Trial 830 finished with value: 2.6610758639085312 and parameters: {'timeframe': 'M3', 'atr_period': 13, 'atr_threshold': 3.0, 'pt_mult': 0.5, 'sl_mult': 5.0, 'td_mins': 30}. Best is trial 226 with value: 2.6610758639085312.
[I 2026-03-12 00:51:43,456] Trial 831 pruned. 
[I 2026-03-12 00:51:43,581] Trial 832 finished with value: 2.6610758639085312 and parameters: {'timeframe': 'M3', 'atr_period': 13, 'atr_threshold': 3.0, 'pt_mult': 0.5, 'sl_mult': 5.0, 'td_mins': 30}. Best is trial 226 with value: 2.6610758639085312.
[I 2026-03-12 00:51:43,700] Trial 833 finished with value: 2.6610758639085312 and parameters: {'timeframe': 'M3', 'atr_period': 13, 'atr_threshold': 3.0, 'pt_mult': 0.5, 'sl_mult': 5.0, 'td_mins': 30}. Best is trial 226 with value: 2.6610758639085312.
[I 2026-03-12 00:51:44,511] Trial 834 pruned. 
[I 2026-03-12 00:51:44,637] Trial 835 finished with value: 2.6610758639085312 and parameters: {'timeframe': 'M3', 'atr_period': 13, 'atr_threshold': 3.0, 'pt_mult': 0.5, 'sl_mult': 5.0, 'td_mins': 30}. Best is trial 226 with value: 2.6610758639085312.
[I 2026-03-12 00:51:44,760] Trial 836 finished with value: 2.6610758639085312 and parameters: {'timeframe': 'M3', 'atr_period': 13, 'atr_threshold': 3.0, 'pt_mult': 0.5, 'sl_mult': 5.0, 'td_mins': 30}. Best is trial 226 with value: 2.6610758639085312.
[I 2026-03-12 00:51:44,808] Trial 837 finished with value: 0.0 and parameters: {'timeframe': 'M3', 'atr_period': 13, 'atr_threshold': 10.0, 'pt_mult': 1.0, 'sl_mult': 5.0, 'td_mins': 5}. Best is trial 226 with value: 2.6610758639085312.
[I 2026-03-12 00:51:44,908] Trial 838 finished with value: 2.56808242042213 and parameters: {'timeframe': 'M3', 'atr_period': 13, 'atr_threshold': 3.0, 'pt_mult': 0.5, 'sl_mult': 5.0, 'td_mins': 15}. Best is trial 226 with value: 2.6610758639085312.
[I 2026-03-12 00:51:44,974] Trial 839 pruned. 
[I 2026-03-12 00:51:45,075] Trial 840 pruned. 
[I 2026-03-12 00:51:45,191] Trial 841 finished with value: 2.6610758639085312 and parameters: {'timeframe': 'M3', 'atr_period': 13, 'atr_threshold': 3.0, 'pt_mult': 0.5, 'sl_mult': 5.0, 'td_mins': 30}. Best is trial 226 with value: 2.6610758639085312.
[I 2026-03-12 00:51:45,311] Trial 842 finished with value: 2.6610758639085312 and parameters: {'timeframe': 'M3', 'atr_period': 13, 'atr_threshold': 3.0, 'pt_mult': 0.5, 'sl_mult': 5.0, 'td_mins': 30}. Best is trial 226 with value: 2.6610758639085312.
[I 2026-03-12 00:51:45,433] Trial 843 finished with value: 2.6610758639085312 and parameters: {'timeframe': 'M3', 'atr_period': 13, 'atr_threshold': 3.0, 'pt_mult': 0.5, 'sl_mult': 5.0, 'td_mins': 30}. Best is trial 226 with value: 2.6610758639085312.
[I 2026-03-12 00:51:45,536] Trial 844 pruned. 
[I 2026-03-12 00:51:45,593] Trial 845 finished with value: 0.0 and parameters: {'timeframe': 'M3', 'atr_period': 13, 'atr_threshold': 5.0, 'pt_mult': 2.5, 'sl_mult': 0.5, 'td_mins': 15}. Best is trial 226 with value: 2.6610758639085312.
[I 2026-03-12 00:51:46,356] Trial 846 pruned. 
[I 2026-03-12 00:51:46,752] Trial 847 pruned. 
[I 2026-03-12 00:51:46,804] Trial 848 finished with value: 0.0 and parameters: {'timeframe': 'M3', 'atr_period': 13, 'atr_threshold': 8.0, 'pt_mult': 0.5, 'sl_mult': 2.5, 'td_mins': 15}. Best is trial 226 with value: 2.6610758639085312.
[I 2026-03-12 00:51:46,856] Trial 849 finished with value: 0.0 and parameters: {'timeframe': 'M3', 'atr_period': 13, 'atr_threshold': 15.0, 'pt_mult': 0.5, 'sl_mult': 0.5, 'td_mins': 5}. Best is trial 226 with value: 2.6610758639085312.
[I 2026-03-12 00:51:46,911] Trial 850 finished with value: 0.0 and parameters: {'timeframe': 'M3', 'atr_period': 13, 'atr_threshold': 10.0, 'pt_mult': 0.5, 'sl_mult': 5.0, 'td_mins': 30}. Best is trial 226 with value: 2.6610758639085312.
[I 2026-03-12 00:51:46,982] Trial 851 pruned. 
[I 2026-03-12 00:51:47,032] Trial 852 finished with value: 0.0 and parameters: {'timeframe': 'M3', 'atr_period': 13, 'atr_threshold': 8.0, 'pt_mult': 1.0, 'sl_mult': 0.5, 'td_mins': 15}. Best is trial 226 with value: 2.6610758639085312.
[I 2026-03-12 00:51:47,086] Trial 853 pruned. 
[I 2026-03-12 00:51:47,147] Trial 854 pruned. 
[I 2026-03-12 00:51:47,221] Trial 855 pruned. 
[I 2026-03-12 00:51:47,272] Trial 856 finished with value: 0.0 and parameters: {'timeframe': 'M3', 'atr_period': 13, 'atr_threshold': 15.0, 'pt_mult': 0.5, 'sl_mult': 2.5, 'td_mins': 1200}. Best is trial 226 with value: 2.6610758639085312.
[I 2026-03-12 00:51:48,176] Trial 857 pruned. 
