[I 2026-03-12 00:57:40,080] Trial 618 finished with value: 0.0 and parameters: {'timeframe': 'M5', 'atr_period': 13, 'atr_threshold': 8.0, 'pt_mult': 0.5, 'sl_mult': 5.0, 'td_mins': 30}. Best is trial 378 with value: 2.3870654100539324.
[I 2026-03-12 00:57:40,200] Trial 619 finished with value: 2.3870654100539324 and parameters: {'timeframe': 'M5', 'atr_period': 13, 'atr_threshold': 3.0, 'pt_mult': 0.5, 'sl_mult': 5.0, 'td_mins': 30}. Best is trial 378 with value: 2.3870654100539324.
[I 2026-03-12 00:57:40,325] Trial 620 pruned. 
[I 2026-03-12 00:57:40,420] Trial 621 finished with value: 2.1309226830196697 and parameters: {'timeframe': 'M5', 'atr_period': 13, 'atr_threshold': 3.0, 'pt_mult': 0.5, 'sl_mult': 5.0, 'td_mins': 15}. Best is trial 378 with value: 2.3870654100539324.
[I 2026-03-12 00:57:40,520] Trial 622 pruned. 
[I 2026-03-12 00:57:40,569] Trial 623 finished with value: 0.0 and parameters: {'timeframe': 'M5', 'atr_period': 13, 'atr_threshold': 5.0, 'pt_mult': 0.5, 'sl_mult': 5.0, 'td_mins': 30}. Best is trial 378 with value: 2.3870654100539324.
[I 2026-03-12 00:57:40,655] Trial 624 pruned. 
[I 2026-03-12 00:57:40,783] Trial 625 finished with value: 2.3870654100539324 and parameters: {'timeframe': 'M5', 'atr_period': 13, 'atr_threshold': 3.0, 'pt_mult': 0.5, 'sl_mult': 5.0, 'td_mins': 30}. Best is trial 378 with value: 2.3870654100539324.
[I 2026-03-12 00:57:40,886] Trial 626 pruned. 
[I 2026-03-12 00:57:41,036] Trial 627 finished with value: 2.3870654100539324 and parameters: {'timeframe': 'M5', 'atr_period': 13, 'atr_threshold': 3.0, 'pt_mult': 0.5, 'sl_mult': 5.0, 'td_mins': 30}. Best is trial 378 with value: 2.3870654100539324.
[I 2026-03-12 00:57:41,183] Trial 628 finished with value: 2.3870654100539324 and parameters: {'timeframe': 'M5', 'atr_period': 13, 'atr_threshold': 3.0, 'pt_mult': 0.5, 'sl_mult': 5.0, 'td_mins': 30}. Best is trial 378 with value: 2.3870654100539324.
[I 2026-03-12 00:57:42,658] Trial 629 pruned. 
[I 2026-03-12 00:57:43,275] Trial 630 pruned. 
[I 2026-03-12 00:57:43,398] Trial 631 finished with value: 2.3870654100539324 and parameters: {'timeframe': 'M5', 'atr_period': 13, 'atr_threshold': 3.0, 'pt_mult': 0.5, 'sl_mult': 5.0, 'td_mins': 30}. Best is trial 378 with value: 2.3870654100539324.
[I 2026-03-12 00:57:43,524] Trial 632 finished with value: 2.3870654100539324 and parameters: {'timeframe': 'M5', 'atr_period': 13, 'atr_threshold': 3.0, 'pt_mult': 0.5, 'sl_mult': 5.0, 'td_mins': 30}. Best is trial 378 with value: 2.3870654100539324.
[I 2026-03-12 00:57:43,571] Trial 633 finished with value: 0.0 and parameters: {'timeframe': 'M5', 'atr_period': 13, 'atr_threshold': 8.0, 'pt_mult': 0.5, 'sl_mult': 5.0, 'td_mins': 720}. Best is trial 378 with value: 2.3870654100539324.
[I 2026-03-12 00:57:43,624] Trial 634 pruned. 
[I 2026-03-12 00:57:43,674] Trial 635 finished with value: 0.0 and parameters: {'timeframe': 'M5', 'atr_period': 13, 'atr_threshold': 5.0, 'pt_mult': 5.0, 'sl_mult': 2.5, 'td_mins': 120}. Best is trial 378 with value: 2.3870654100539324.
[I 2026-03-12 00:57:43,753] Trial 636 pruned. 
[I 2026-03-12 00:57:43,900] Trial 637 finished with value: 2.3870654100539324 and parameters: {'timeframe': 'M5', 'atr_period': 13, 'atr_threshold': 3.0, 'pt_mult': 0.5, 'sl_mult': 5.0, 'td_mins': 30}. Best is trial 378 with value: 2.3870654100539324.
[I 2026-03-12 00:57:43,975] Trial 638 pruned. 
[I 2026-03-12 00:57:44,081] Trial 639 pruned. 
[I 2026-03-12 00:57:44,130] Trial 640 finished with value: 0.0 and parameters: {'timeframe': 'M5', 'atr_period': 13, 'atr_threshold': 8.0, 'pt_mult': 0.5, 'sl_mult': 0.5, 'td_mins': 1080}. Best is trial 378 with value: 2.3870654100539324.
[I 2026-03-12 00:57:44,179] Trial 641 finished with value: 0.0 and parameters: {'timeframe': 'M5', 'atr_period': 13, 'atr_threshold': 10.0, 'pt_mult': 0.5, 'sl_mult': 5.0, 'td_mins': 5}. Best is trial 378 with value: 2.3870654100539324.
[I 2026-03-12 00:57:44,621] Trial 642 pruned. 
[I 2026-03-12 00:57:44,748] Trial 643 finished with value: 2.3870654100539324 and parameters: {'timeframe': 'M5', 'atr_period': 13, 'atr_threshold': 3.0, 'pt_mult': 0.5, 'sl_mult': 5.0, 'td_mins': 30}. Best is trial 378 with value: 2.3870654100539324.
[I 2026-03-12 00:57:44,868] Trial 644 finished with value: 2.3870654100539324 and parameters: {'timeframe': 'M5', 'atr_period': 13, 'atr_threshold': 3.0, 'pt_mult': 0.5, 'sl_mult': 5.0, 'td_mins': 30}. Best is trial 378 with value: 2.3870654100539324.
[I 2026-03-12 00:57:44,938] Trial 645 pruned. 
[I 2026-03-12 00:57:45,062] Trial 646 finished with value: 2.3870654100539324 and parameters: {'timeframe': 'M5', 'atr_period': 13, 'atr_threshold': 3.0, 'pt_mult': 0.5, 'sl_mult': 5.0, 'td_mins': 30}. Best is trial 378 with value: 2.3870654100539324.
[I 2026-03-12 00:57:45,193] Trial 647 pruned. 
[I 2026-03-12 00:57:45,325] Trial 648 finished with value: 2.3870654100539324 and parameters: {'timeframe': 'M5', 'atr_period': 13, 'atr_threshold': 3.0, 'pt_mult': 0.5, 'sl_mult': 5.0, 'td_mins': 30}. Best is trial 378 with value: 2.3870654100539324.
[I 2026-03-12 00:57:45,381] Trial 649 pruned. 
[I 2026-03-12 00:57:45,937] Trial 650 pruned. 
[I 2026-03-12 00:57:46,100] Trial 651 finished with value: 2.3870654100539324 and parameters: {'timeframe': 'M5', 'atr_period': 13, 'atr_threshold': 3.0, 'pt_mult': 0.5, 'sl_mult': 5.0, 'td_mins': 30}. Best is trial 378 with value: 2.3870654100539324.
[I 2026-03-12 00:57:46,279] Trial 652 pruned. 
[I 2026-03-12 00:57:46,431] Trial 653 finished with value: 2.3870654100539324 and parameters: {'timeframe': 'M5', 'atr_period': 13, 'atr_threshold': 3.0, 'pt_mult': 0.5, 'sl_mult': 5.0, 'td_mins': 30}. Best is trial 378 with value: 2.3870654100539324.
[I 2026-03-12 00:57:46,560] Trial 654 finished with value: 2.3870654100539324 and parameters: {'timeframe': 'M5', 'atr_period': 13, 'atr_threshold': 3.0, 'pt_mult': 0.5, 'sl_mult': 5.0, 'td_mins': 30}. Best is trial 378 with value: 2.3870654100539324.
[I 2026-03-12 00:57:46,682] Trial 655 finished with value: 2.3870654100539324 and parameters: {'timeframe': 'M5', 'atr_period': 13, 'atr_threshold': 3.0, 'pt_mult': 0.5, 'sl_mult': 5.0, 'td_mins': 30}. Best is trial 378 with value: 2.3870654100539324.
[I 2026-03-12 00:57:46,740] Trial 656 pruned. 
[I 2026-03-12 00:57:46,790] Trial 657 finished with value: 0.0 and parameters: {'timeframe': 'M5', 'atr_period': 13, 'atr_threshold': 8.0, 'pt_mult': 1.0, 'sl_mult': 1.0, 'td_mins': 360}. Best is trial 378 with value: 2.3870654100539324.
[I 2026-03-12 00:57:46,901] Trial 658 pruned. 
[I 2026-03-12 00:57:46,949] Trial 659 finished with value: 0.0 and parameters: {'timeframe': 'M5', 'atr_period': 13, 'atr_threshold': 5.0, 'pt_mult': 0.5, 'sl_mult': 1.0, 'td_mins': 360}. Best is trial 378 with value: 2.3870654100539324.
[I 2026-03-12 00:57:47,065] Trial 660 finished with value: 2.3870654100539324 and parameters: {'timeframe': 'M5', 'atr_period': 13, 'atr_threshold': 3.0, 'pt_mult': 0.5, 'sl_mult': 5.0, 'td_mins': 30}. Best is trial 378 with value: 2.3870654100539324.
[I 2026-03-12 00:57:47,160] Trial 661 pruned. 
[I 2026-03-12 00:57:47,280] Trial 662 finished with value: 2.3870654100539324 and parameters: {'timeframe': 'M5', 'atr_period': 13, 'atr_threshold': 3.0, 'pt_mult': 0.5, 'sl_mult': 5.0, 'td_mins': 30}. Best is trial 378 with value: 2.3870654100539324.
[I 2026-03-12 00:57:47,397] Trial 663 finished with value: 2.3870654100539324 and parameters: {'timeframe': 'M5', 'atr_period': 13, 'atr_threshold': 3.0, 'pt_mult': 0.5, 'sl_mult': 5.0, 'td_mins': 30}. Best is trial 378 with value: 2.3870654100539324.
[I 2026-03-12 00:57:47,522] Trial 664 finished with value: 2.3870654100539324 and parameters: {'timeframe': 'M5', 'atr_period': 13, 'atr_threshold': 3.0, 'pt_mult': 0.5, 'sl_mult': 5.0, 'td_mins': 30}. Best is trial 378 with value: 2.3870654100539324.
[I 2026-03-12 00:57:47,570] Trial 665 finished with value: 0.0 and parameters: {'timeframe': 'M5', 'atr_period': 13, 'atr_threshold': 10.0, 'pt_mult': 1.0, 'sl_mult': 0.5, 'td_mins': 1080}. Best is trial 378 with value: 2.3870654100539324.
[I 2026-03-12 00:57:47,618] Trial 666 finished with value: 0.0 and parameters: {'timeframe': 'M5', 'atr_period': 13, 'atr_threshold': 8.0, 'pt_mult': 1.0, 'sl_mult': 1.0, 'td_mins': 60}. Best is trial 378 with value: 2.3870654100539324.
[I 2026-03-12 00:57:47,722] Trial 667 pruned. 
[I 2026-03-12 00:57:47,839] Trial 668 pruned. 
[I 2026-03-12 00:57:47,964] Trial 669 finished with value: 2.3870654100539324 and parameters: {'timeframe': 'M5', 'atr_period': 13, 'atr_threshold': 3.0, 'pt_mult': 0.5, 'sl_mult': 5.0, 'td_mins': 30}. Best is trial 378 with value: 2.3870654100539324.
[I 2026-03-12 00:57:48,448] Trial 670 pruned. 
[I 2026-03-12 00:57:48,536] Trial 671 pruned. 
[I 2026-03-12 00:57:48,660] Trial 672 finished with value: 2.3870654100539324 and parameters: {'timeframe': 'M5', 'atr_period': 13, 'atr_threshold': 3.0, 'pt_mult': 0.5, 'sl_mult': 5.0, 'td_mins': 30}. Best is trial 378 with value: 2.3870654100539324.
[I 2026-03-12 00:57:48,709] Trial 673 finished with value: 0.0 and parameters: {'timeframe': 'M5', 'atr_period': 13, 'atr_threshold': 10.0, 'pt_mult': 0.5, 'sl_mult': 1.0, 'td_mins': 30}. Best is trial 378 with value: 2.3870654100539324.
[I 2026-03-12 00:57:48,831] Trial 674 finished with value: 2.3870654100539324 and parameters: {'timeframe': 'M5', 'atr_period': 13, 'atr_threshold': 3.0, 'pt_mult': 0.5, 'sl_mult': 5.0, 'td_mins': 30}. Best is trial 378 with value: 2.3870654100539324.
[I 2026-03-12 00:57:48,958] Trial 675 pruned. 
[I 2026-03-12 00:57:49,067] Trial 676 pruned. 
[I 2026-03-12 00:57:49,123] Trial 677 pruned. 
[I 2026-03-12 00:57:49,172] Trial 678 finished with value: 0.0 and parameters: {'timeframe': 'M5', 'atr_period': 13, 'atr_threshold': 15.0, 'pt_mult': 0.5, 'sl_mult': 5.0, 'td_mins': 30}. Best is trial 378 with value: 2.3870654100539324.
[I 2026-03-12 00:57:49,222] Trial 679 finished with value: 0.0 and parameters: {'timeframe': 'M5', 'atr_period': 13, 'atr_threshold': 5.0, 'pt_mult': 0.5, 'sl_mult': 5.0, 'td_mins': 360}. Best is trial 378 with value: 2.3870654100539324.
[I 2026-03-12 00:57:49,347] Trial 680 finished with value: 2.3870654100539324 and parameters: {'timeframe': 'M5', 'atr_period': 13, 'atr_threshold': 3.0, 'pt_mult': 0.5, 'sl_mult': 5.0, 'td_mins': 30}. Best is trial 378 with value: 2.3870654100539324.
[I 2026-03-12 00:57:49,393] Trial 681 finished with value: 0.0 and parameters: {'timeframe': 'M5', 'atr_period': 13, 'atr_threshold': 5.0, 'pt_mult': 1.0, 'sl_mult': 0.5, 'td_mins': 30}. Best is trial 378 with value: 2.3870654100539324.
[I 2026-03-12 00:57:49,458] Trial 682 pruned. 
[I 2026-03-12 00:57:49,513] Trial 683 pruned. 
[I 2026-03-12 00:57:49,562] Trial 684 finished with value: 0.0 and parameters: {'timeframe': 'M5', 'atr_period': 13, 'atr_threshold': 10.0, 'pt_mult': 0.5, 'sl_mult': 5.0, 'td_mins': 120}. Best is trial 378 with value: 2.3870654100539324.
[I 2026-03-12 00:57:49,609] Trial 685 finished with value: 0.0 and parameters: {'timeframe': 'M5', 'atr_period': 13, 'atr_threshold': 8.0, 'pt_mult': 5.0, 'sl_mult': 5.0, 'td_mins': 60}. Best is trial 378 with value: 2.3870654100539324.
[I 2026-03-12 00:57:49,750] Trial 686 pruned. 
[I 2026-03-12 00:57:49,801] Trial 687 finished with value: 0.0 and parameters: {'timeframe': 'M5', 'atr_period': 13, 'atr_threshold': 10.0, 'pt_mult': 1.0, 'sl_mult': 5.0, 'td_mins': 60}. Best is trial 378 with value: 2.3870654100539324.
[I 2026-03-12 00:57:49,924] Trial 688 finished with value: 2.3870654100539324 and parameters: {'timeframe': 'M5', 'atr_period': 13, 'atr_threshold': 3.0, 'pt_mult': 0.5, 'sl_mult': 5.0, 'td_mins': 30}. Best is trial 378 with value: 2.3870654100539324.
[I 2026-03-12 00:57:49,972] Trial 689 finished with value: 0.0 and parameters: {'timeframe': 'M5', 'atr_period': 13, 'atr_threshold': 15.0, 'pt_mult': 1.0, 'sl_mult': 2.5, 'td_mins': 1080}. Best is trial 378 with value: 2.3870654100539324.
[I 2026-03-12 00:57:50,020] Trial 690 finished with value: 0.0 and parameters: {'timeframe': 'M5', 'atr_period': 13, 'atr_threshold': 15.0, 'pt_mult': 2.5, 'sl_mult': 2.5, 'td_mins': 5}. Best is trial 378 with value: 2.3870654100539324.
[I 2026-03-12 00:57:50,592] Trial 691 pruned. 
[I 2026-03-12 00:57:50,646] Trial 692 pruned. 
[I 2026-03-12 00:57:50,727] Trial 693 pruned. 
[I 2026-03-12 00:57:51,311] Trial 694 pruned. 
[I 2026-03-12 00:57:51,383] Trial 695 pruned. 
[I 2026-03-12 00:57:51,438] Trial 696 finished with value: 0.0 and parameters: {'timeframe': 'M5', 'atr_period': 13, 'atr_threshold': 10.0, 'pt_mult': 0.5, 'sl_mult': 5.0, 'td_mins': 180}. Best is trial 378 with value: 2.3870654100539324.
[I 2026-03-12 00:57:51,485] Trial 697 finished with value: 0.0 and parameters: {'timeframe': 'M5', 'atr_period': 13, 'atr_threshold': 10.0, 'pt_mult': 2.5, 'sl_mult': 5.0, 'td_mins': 30}. Best is trial 378 with value: 2.3870654100539324.
[I 2026-03-12 00:57:51,673] Trial 698 pruned. 
[I 2026-03-12 00:57:51,730] Trial 699 pruned. 
[I 2026-03-12 00:57:51,781] Trial 700 finished with value: 0.0 and parameters: {'timeframe': 'M5', 'atr_period': 13, 'atr_threshold': 8.0, 'pt_mult': 1.0, 'sl_mult': 1.0, 'td_mins': 1200}. Best is trial 378 with value: 2.3870654100539324.
[I 2026-03-12 00:57:51,843] Trial 701 pruned. 
[I 2026-03-12 00:57:51,968] Trial 702 finished with value: 2.3870654100539324 and parameters: {'timeframe': 'M5', 'atr_period': 13, 'atr_threshold': 3.0, 'pt_mult': 0.5, 'sl_mult': 5.0, 'td_mins': 30}. Best is trial 378 with value: 2.3870654100539324.
[I 2026-03-12 00:57:52,016] Trial 703 finished with value: 0.0 and parameters: {'timeframe': 'M5', 'atr_period': 13, 'atr_threshold': 15.0, 'pt_mult': 2.5, 'sl_mult': 2.5, 'td_mins': 15}. Best is trial 378 with value: 2.3870654100539324.
[I 2026-03-12 00:57:52,072] Trial 704 pruned. 
[I 2026-03-12 00:57:52,145] Trial 705 pruned. 
[I 2026-03-12 00:57:52,195] Trial 706 finished with value: 0.0 and parameters: {'timeframe': 'M5', 'atr_period': 13, 'atr_threshold': 5.0, 'pt_mult': 0.5, 'sl_mult': 5.0, 'td_mins': 30}. Best is trial 378 with value: 2.3870654100539324.
[I 2026-03-12 00:57:52,242] Trial 707 finished with value: 0.0 and parameters: {'timeframe': 'M5', 'atr_period': 13, 'atr_threshold': 8.0, 'pt_mult': 0.5, 'sl_mult': 5.0, 'td_mins': 30}. Best is trial 378 with value: 2.3870654100539324.
[I 2026-03-12 00:57:52,397] Trial 708 pruned. 
[I 2026-03-12 00:57:52,528] Trial 709 finished with value: 2.3870654100539324 and parameters: {'timeframe': 'M5', 'atr_period': 13, 'atr_threshold': 3.0, 'pt_mult': 0.5, 'sl_mult': 5.0, 'td_mins': 30}. Best is trial 378 with value: 2.3870654100539324.
[I 2026-03-12 00:57:52,576] Trial 710 finished with value: 0.0 and parameters: {'timeframe': 'M5', 'atr_period': 13, 'atr_threshold': 10.0, 'pt_mult': 0.5, 'sl_mult': 5.0, 'td_mins': 30}. Best is trial 378 with value: 2.3870654100539324.
[I 2026-03-12 00:57:52,697] Trial 711 finished with value: 2.3870654100539324 and parameters: {'timeframe': 'M5', 'atr_period': 13, 'atr_threshold': 3.0, 'pt_mult': 0.5, 'sl_mult': 5.0, 'td_mins': 30}. Best is trial 378 with value: 2.3870654100539324.
[I 2026-03-12 00:57:52,819] Trial 712 pruned. 
[I 2026-03-12 00:57:52,867] Trial 713 finished with value: 0.0 and parameters: {'timeframe': 'M5', 'atr_period': 13, 'atr_threshold': 15.0, 'pt_mult': 1.0, 'sl_mult': 0.5, 'td_mins': 30}. Best is trial 378 with value: 2.3870654100539324.
[I 2026-03-12 00:57:52,919] Trial 714 pruned. 
[I 2026-03-12 00:57:53,045] Trial 715 finished with value: 2.3870654100539324 and parameters: {'timeframe': 'M5', 'atr_period': 13, 'atr_threshold': 3.0, 'pt_mult': 0.5, 'sl_mult': 5.0, 'td_mins': 30}. Best is trial 378 with value: 2.3870654100539324.
[I 2026-03-12 00:57:53,097] Trial 716 pruned. 
[I 2026-03-12 00:57:53,192] Trial 717 pruned. 
[I 2026-03-12 00:57:53,315] Trial 718 finished with value: 2.3870654100539324 and parameters: {'timeframe': 'M5', 'atr_period': 13, 'atr_threshold': 3.0, 'pt_mult': 0.5, 'sl_mult': 5.0, 'td_mins': 30}. Best is trial 378 with value: 2.3870654100539324.
[I 2026-03-12 00:57:53,436] Trial 719 finished with value: 2.3870654100539324 and parameters: {'timeframe': 'M5', 'atr_period': 13, 'atr_threshold': 3.0, 'pt_mult': 0.5, 'sl_mult': 5.0, 'td_mins': 30}. Best is trial 378 with value: 2.3870654100539324.
[I 2026-03-12 00:57:53,497] Trial 720 pruned. 
[I 2026-03-12 00:57:53,552] Trial 721 pruned. 
[I 2026-03-12 00:57:53,601] Trial 722 finished with value: 0.0 and parameters: {'timeframe': 'M5', 'atr_period': 13, 'atr_threshold': 5.0, 'pt_mult': 5.0, 'sl_mult': 5.0, 'td_mins': 5}. Best is trial 378 with value: 2.3870654100539324.
[I 2026-03-12 00:57:53,648] Trial 723 finished with value: 0.0 and parameters: {'timeframe': 'M5', 'atr_period': 13, 'atr_threshold': 15.0, 'pt_mult': 5.0, 'sl_mult': 1.0, 'td_mins': 1200}. Best is trial 378 with value: 2.3870654100539324.
[I 2026-03-12 00:57:53,732] Trial 724 pruned. 
[I 2026-03-12 00:57:53,849] Trial 725 pruned. 
[I 2026-03-12 00:57:53,976] Trial 726 finished with value: 2.3870654100539324 and parameters: {'timeframe': 'M5', 'atr_period': 13, 'atr_threshold': 3.0, 'pt_mult': 0.5, 'sl_mult': 5.0, 'td_mins': 30}. Best is trial 378 with value: 2.3870654100539324.
[I 2026-03-12 00:57:54,149] Trial 727 pruned. 
[I 2026-03-12 00:57:54,232] Trial 728 pruned. 
[I 2026-03-12 00:57:54,363] Trial 729 finished with value: 2.3870654100539324 and parameters: {'timeframe': 'M5', 'atr_period': 13, 'atr_threshold': 3.0, 'pt_mult': 0.5, 'sl_mult': 5.0, 'td_mins': 30}. Best is trial 378 with value: 2.3870654100539324.
[I 2026-03-12 00:57:54,417] Trial 730 pruned. 
[I 2026-03-12 00:57:54,484] Trial 731 pruned. 
[I 2026-03-12 00:57:54,567] Trial 732 pruned. 
[I 2026-03-12 00:57:54,614] Trial 733 finished with value: 0.0 and parameters: {'timeframe': 'M5', 'atr_period': 13, 'atr_threshold': 15.0, 'pt_mult': 5.0, 'sl_mult': 1.0, 'td_mins': 60}. Best is trial 378 with value: 2.3870654100539324.
[I 2026-03-12 00:57:54,740] Trial 734 finished with value: 2.3870654100539324 and parameters: {'timeframe': 'M5', 'atr_period': 13, 'atr_threshold': 3.0, 'pt_mult': 0.5, 'sl_mult': 5.0, 'td_mins': 30}. Best is trial 378 with value: 2.3870654100539324.
[I 2026-03-12 00:57:55,731] Trial 735 pruned. 
[I 2026-03-12 00:57:55,784] Trial 736 finished with value: 0.0 and parameters: {'timeframe': 'M5', 'atr_period': 13, 'atr_threshold': 5.0, 'pt_mult': 1.0, 'sl_mult': 5.0, 'td_mins': 1080}. Best is trial 378 with value: 2.3870654100539324.
[I 2026-03-12 00:57:55,904] Trial 737 pruned. 
[I 2026-03-12 00:57:56,108] Trial 738 pruned. 
[I 2026-03-12 00:57:56,165] Trial 739 finished with value: 0.0 and parameters: {'timeframe': 'M5', 'atr_period': 13, 'atr_threshold': 15.0, 'pt_mult': 1.0, 'sl_mult': 1.0, 'td_mins': 1080}. Best is trial 378 with value: 2.3870654100539324.
[I 2026-03-12 00:57:56,319] Trial 740 finished with value: 2.3870654100539324 and parameters: {'timeframe': 'M5', 'atr_period': 13, 'atr_threshold': 3.0, 'pt_mult': 0.5, 'sl_mult': 5.0, 'td_mins': 30}. Best is trial 378 with value: 2.3870654100539324.
[I 2026-03-12 00:57:56,371] Trial 741 finished with value: 0.0 and parameters: {'timeframe': 'M5', 'atr_period': 13, 'atr_threshold': 8.0, 'pt_mult': 0.5, 'sl_mult': 5.0, 'td_mins': 120}. Best is trial 378 with value: 2.3870654100539324.
[I 2026-03-12 00:57:56,494] Trial 742 pruned. 
[I 2026-03-12 00:57:56,621] Trial 743 finished with value: 2.3870654100539324 and parameters: {'timeframe': 'M5', 'atr_period': 13, 'atr_threshold': 3.0, 'pt_mult': 0.5, 'sl_mult': 5.0, 'td_mins': 30}. Best is trial 378 with value: 2.3870654100539324.
[I 2026-03-12 00:57:56,697] Trial 744 pruned. 
[I 2026-03-12 00:57:56,745] Trial 745 finished with value: 0.0 and parameters: {'timeframe': 'M5', 'atr_period': 13, 'atr_threshold': 15.0, 'pt_mult': 5.0, 'sl_mult': 0.5, 'td_mins': 15}. Best is trial 378 with value: 2.3870654100539324.
[I 2026-03-12 00:57:56,873] Trial 746 finished with value: 2.3870654100539324 and parameters: {'timeframe': 'M5', 'atr_period': 13, 'atr_threshold': 3.0, 'pt_mult': 0.5, 'sl_mult': 5.0, 'td_mins': 30}. Best is trial 378 with value: 2.3870654100539324.
[I 2026-03-12 00:57:56,994] Trial 747 finished with value: 2.3870654100539324 and parameters: {'timeframe': 'M5', 'atr_period': 13, 'atr_threshold': 3.0, 'pt_mult': 0.5, 'sl_mult': 5.0, 'td_mins': 30}. Best is trial 378 with value: 2.3870654100539324.
[I 2026-03-12 00:57:57,116] Trial 748 pruned. 
[I 2026-03-12 00:57:57,247] Trial 749 finished with value: 2.3870654100539324 and parameters: {'timeframe': 'M5', 'atr_period': 13, 'atr_threshold': 3.0, 'pt_mult': 0.5, 'sl_mult': 5.0, 'td_mins': 30}. Best is trial 378 with value: 2.3870654100539324.
[I 2026-03-12 00:57:57,322] Trial 750 pruned. 
[I 2026-03-12 00:57:57,385] Trial 751 pruned. 
[I 2026-03-12 00:57:57,511] Trial 752 finished with value: 2.3870654100539324 and parameters: {'timeframe': 'M5', 'atr_period': 13, 'atr_threshold': 3.0, 'pt_mult': 0.5, 'sl_mult': 5.0, 'td_mins': 30}. Best is trial 378 with value: 2.3870654100539324.
[I 2026-03-12 00:57:57,631] Trial 753 finished with value: 2.3870654100539324 and parameters: {'timeframe': 'M5', 'atr_period': 13, 'atr_threshold': 3.0, 'pt_mult': 0.5, 'sl_mult': 5.0, 'td_mins': 30}. Best is trial 378 with value: 2.3870654100539324.
[I 2026-03-12 00:57:57,763] Trial 754 finished with value: 2.3870654100539324 and parameters: {'timeframe': 'M5', 'atr_period': 13, 'atr_threshold': 3.0, 'pt_mult': 0.5, 'sl_mult': 5.0, 'td_mins': 30}. Best is trial 378 with value: 2.3870654100539324.
[I 2026-03-12 00:57:57,815] Trial 755 finished with value: 0.0 and parameters: {'timeframe': 'M5', 'atr_period': 13, 'atr_threshold': 8.0, 'pt_mult': 5.0, 'sl_mult': 1.0, 'td_mins': 1080}. Best is trial 378 with value: 2.3870654100539324.
[I 2026-03-12 00:57:58,303] Trial 756 pruned. 
