[I 2026-03-12 01:40:48,365] Trial 382 finished with value: 2.710569080288531 and parameters: {'timeframe': 'M3', 'atr_period': 13, 'atr_threshold': 3.0, 'pt_mult': 0.5, 'sl_mult': 5.0, 'td_mins': 30}. Best is trial 367 with value: 2.710569080288531.
[I 2026-03-12 01:40:48,476] Trial 383 finished with value: 2.710569080288531 and parameters: {'timeframe': 'M3', 'atr_period': 13, 'atr_threshold': 3.0, 'pt_mult': 0.5, 'sl_mult': 5.0, 'td_mins': 30}. Best is trial 367 with value: 2.710569080288531.
[I 2026-03-12 01:40:48,593] Trial 384 finished with value: 2.710569080288531 and parameters: {'timeframe': 'M3', 'atr_period': 13, 'atr_threshold': 3.0, 'pt_mult': 0.5, 'sl_mult': 5.0, 'td_mins': 30}. Best is trial 367 with value: 2.710569080288531.
[I 2026-03-12 01:40:48,706] Trial 385 finished with value: 2.710569080288531 and parameters: {'timeframe': 'M3', 'atr_period': 13, 'atr_threshold': 3.0, 'pt_mult': 0.5, 'sl_mult': 5.0, 'td_mins': 30}. Best is trial 367 with value: 2.710569080288531.
[I 2026-03-12 01:40:48,838] Trial 386 finished with value: 2.710569080288531 and parameters: {'timeframe': 'M3', 'atr_period': 13, 'atr_threshold': 3.0, 'pt_mult': 0.5, 'sl_mult': 5.0, 'td_mins': 30}. Best is trial 367 with value: 2.710569080288531.
[I 2026-03-12 01:40:48,951] Trial 387 finished with value: 2.710569080288531 and parameters: {'timeframe': 'M3', 'atr_period': 13, 'atr_threshold': 3.0, 'pt_mult': 0.5, 'sl_mult': 5.0, 'td_mins': 30}. Best is trial 367 with value: 2.710569080288531.
[I 2026-03-12 01:40:49,065] Trial 388 finished with value: 2.710569080288531 and parameters: {'timeframe': 'M3', 'atr_period': 13, 'atr_threshold': 3.0, 'pt_mult': 0.5, 'sl_mult': 5.0, 'td_mins': 30}. Best is trial 367 with value: 2.710569080288531.
[I 2026-03-12 01:40:49,179] Trial 389 finished with value: 2.710569080288531 and parameters: {'timeframe': 'M3', 'atr_period': 13, 'atr_threshold': 3.0, 'pt_mult': 0.5, 'sl_mult': 5.0, 'td_mins': 30}. Best is trial 367 with value: 2.710569080288531.
[I 2026-03-12 01:40:49,293] Trial 390 finished with value: 2.710569080288531 and parameters: {'timeframe': 'M3', 'atr_period': 13, 'atr_threshold': 3.0, 'pt_mult': 0.5, 'sl_mult': 5.0, 'td_mins': 30}. Best is trial 367 with value: 2.710569080288531.
[I 2026-03-12 01:40:49,404] Trial 391 finished with value: 2.710569080288531 and parameters: {'timeframe': 'M3', 'atr_period': 13, 'atr_threshold': 3.0, 'pt_mult': 0.5, 'sl_mult': 5.0, 'td_mins': 30}. Best is trial 367 with value: 2.710569080288531.
[I 2026-03-12 01:40:49,522] Trial 392 finished with value: 2.710569080288531 and parameters: {'timeframe': 'M3', 'atr_period': 13, 'atr_threshold': 3.0, 'pt_mult': 0.5, 'sl_mult': 5.0, 'td_mins': 30}. Best is trial 367 with value: 2.710569080288531.
[I 2026-03-12 01:40:49,635] Trial 393 finished with value: 2.710569080288531 and parameters: {'timeframe': 'M3', 'atr_period': 13, 'atr_threshold': 3.0, 'pt_mult': 0.5, 'sl_mult': 5.0, 'td_mins': 30}. Best is trial 367 with value: 2.710569080288531.
[I 2026-03-12 01:40:49,697] Trial 394 pruned. 
[I 2026-03-12 01:40:49,753] Trial 395 pruned. 
[I 2026-03-12 01:40:49,823] Trial 396 pruned. 
[I 2026-03-12 01:40:49,966] Trial 397 finished with value: 2.387929099905751 and parameters: {'timeframe': 'M3', 'atr_period': 13, 'atr_threshold': 3.0, 'pt_mult': 1.0, 'sl_mult': 5.0, 'td_mins': 30}. Best is trial 367 with value: 2.710569080288531.
[I 2026-03-12 01:40:50,033] Trial 398 pruned. 
[I 2026-03-12 01:40:50,089] Trial 399 pruned. 
[I 2026-03-12 01:40:50,206] Trial 400 finished with value: 2.613255170260378 and parameters: {'timeframe': 'M3', 'atr_period': 13, 'atr_threshold': 3.0, 'pt_mult': 0.5, 'sl_mult': 5.0, 'td_mins': 15}. Best is trial 367 with value: 2.710569080288531.
[I 2026-03-12 01:40:50,294] Trial 401 pruned. 
[I 2026-03-12 01:40:50,417] Trial 402 finished with value: 2.710569080288531 and parameters: {'timeframe': 'M3', 'atr_period': 13, 'atr_threshold': 3.0, 'pt_mult': 0.5, 'sl_mult': 5.0, 'td_mins': 30}. Best is trial 367 with value: 2.710569080288531.
[I 2026-03-12 01:40:50,469] Trial 403 pruned. 
[I 2026-03-12 01:40:50,565] Trial 404 pruned. 
[I 2026-03-12 01:40:50,801] Trial 405 pruned. 
[I 2026-03-12 01:40:50,902] Trial 406 pruned. 
[I 2026-03-12 01:40:50,960] Trial 407 pruned. 
[I 2026-03-12 01:40:51,078] Trial 408 finished with value: 2.710569080288531 and parameters: {'timeframe': 'M3', 'atr_period': 13, 'atr_threshold': 3.0, 'pt_mult': 0.5, 'sl_mult': 5.0, 'td_mins': 30}. Best is trial 367 with value: 2.710569080288531.
[I 2026-03-12 01:40:51,192] Trial 409 finished with value: 2.710569080288531 and parameters: {'timeframe': 'M3', 'atr_period': 13, 'atr_threshold': 3.0, 'pt_mult': 0.5, 'sl_mult': 5.0, 'td_mins': 30}. Best is trial 367 with value: 2.710569080288531.
[I 2026-03-12 01:40:51,245] Trial 410 finished with value: 0.0 and parameters: {'timeframe': 'M3', 'atr_period': 13, 'atr_threshold': 15.0, 'pt_mult': 0.5, 'sl_mult': 5.0, 'td_mins': 30}. Best is trial 367 with value: 2.710569080288531.
[I 2026-03-12 01:40:51,485] Trial 411 finished with value: 2.561287763012388 and parameters: {'timeframe': 'M3', 'atr_period': 13, 'atr_threshold': 2.0, 'pt_mult': 0.5, 'sl_mult': 5.0, 'td_mins': 30}. Best is trial 367 with value: 2.710569080288531.
[I 2026-03-12 01:40:51,604] Trial 412 finished with value: 2.710569080288531 and parameters: {'timeframe': 'M3', 'atr_period': 13, 'atr_threshold': 3.0, 'pt_mult': 0.5, 'sl_mult': 5.0, 'td_mins': 30}. Best is trial 367 with value: 2.710569080288531.
[I 2026-03-12 01:40:51,720] Trial 413 finished with value: 2.710569080288531 and parameters: {'timeframe': 'M3', 'atr_period': 13, 'atr_threshold': 3.0, 'pt_mult': 0.5, 'sl_mult': 5.0, 'td_mins': 30}. Best is trial 367 with value: 2.710569080288531.
[I 2026-03-12 01:40:51,769] Trial 414 finished with value: 0.0 and parameters: {'timeframe': 'M3', 'atr_period': 13, 'atr_threshold': 10.0, 'pt_mult': 0.5, 'sl_mult': 5.0, 'td_mins': 30}. Best is trial 367 with value: 2.710569080288531.
[I 2026-03-12 01:40:51,886] Trial 415 finished with value: 2.710569080288531 and parameters: {'timeframe': 'M3', 'atr_period': 13, 'atr_threshold': 3.0, 'pt_mult': 0.5, 'sl_mult': 5.0, 'td_mins': 30}. Best is trial 367 with value: 2.710569080288531.
[I 2026-03-12 01:40:52,002] Trial 416 finished with value: 2.710569080288531 and parameters: {'timeframe': 'M3', 'atr_period': 13, 'atr_threshold': 3.0, 'pt_mult': 0.5, 'sl_mult': 5.0, 'td_mins': 30}. Best is trial 367 with value: 2.710569080288531.
[I 2026-03-12 01:40:52,051] Trial 417 finished with value: 0.0 and parameters: {'timeframe': 'M3', 'atr_period': 13, 'atr_threshold': 5.0, 'pt_mult': 0.5, 'sl_mult': 5.0, 'td_mins': 15}. Best is trial 367 with value: 2.710569080288531.
[I 2026-03-12 01:40:52,104] Trial 418 pruned. 
[I 2026-03-12 01:40:52,280] Trial 419 pruned. 
[I 2026-03-12 01:40:52,328] Trial 420 finished with value: 0.0 and parameters: {'timeframe': 'M3', 'atr_period': 13, 'atr_threshold': 8.0, 'pt_mult': 0.5, 'sl_mult': 1.0, 'td_mins': 30}. Best is trial 367 with value: 2.710569080288531.
[I 2026-03-12 01:40:52,383] Trial 421 pruned. 
[I 2026-03-12 01:40:52,434] Trial 422 pruned. 
[I 2026-03-12 01:40:53,090] Trial 423 pruned. 
[I 2026-03-12 01:40:53,142] Trial 424 finished with value: 0.0 and parameters: {'timeframe': 'M3', 'atr_period': 13, 'atr_threshold': 15.0, 'pt_mult': 0.5, 'sl_mult': 5.0, 'td_mins': 180}. Best is trial 367 with value: 2.710569080288531.
[I 2026-03-12 01:40:53,198] Trial 425 pruned. 
[I 2026-03-12 01:40:53,312] Trial 426 finished with value: 2.710569080288531 and parameters: {'timeframe': 'M3', 'atr_period': 13, 'atr_threshold': 3.0, 'pt_mult': 0.5, 'sl_mult': 5.0, 'td_mins': 30}. Best is trial 367 with value: 2.710569080288531.
[I 2026-03-12 01:40:53,390] Trial 427 pruned. 
[I 2026-03-12 01:40:53,440] Trial 428 finished with value: 0.0 and parameters: {'timeframe': 'M3', 'atr_period': 13, 'atr_threshold': 8.0, 'pt_mult': 0.5, 'sl_mult': 5.0, 'td_mins': 360}. Best is trial 367 with value: 2.710569080288531.
[I 2026-03-12 01:40:53,664] Trial 429 pruned. 
[I 2026-03-12 01:40:53,733] Trial 430 pruned. 
[I 2026-03-12 01:40:53,868] Trial 431 finished with value: 2.710569080288531 and parameters: {'timeframe': 'M3', 'atr_period': 13, 'atr_threshold': 3.0, 'pt_mult': 0.5, 'sl_mult': 5.0, 'td_mins': 30}. Best is trial 367 with value: 2.710569080288531.
[I 2026-03-12 01:40:53,986] Trial 432 finished with value: 2.710569080288531 and parameters: {'timeframe': 'M3', 'atr_period': 13, 'atr_threshold': 3.0, 'pt_mult': 0.5, 'sl_mult': 5.0, 'td_mins': 30}. Best is trial 367 with value: 2.710569080288531.
[I 2026-03-12 01:40:54,035] Trial 433 finished with value: 0.0 and parameters: {'timeframe': 'M3', 'atr_period': 13, 'atr_threshold': 5.0, 'pt_mult': 0.5, 'sl_mult': 5.0, 'td_mins': 1200}. Best is trial 367 with value: 2.710569080288531.
[I 2026-03-12 01:40:54,171] Trial 434 finished with value: 2.710569080288531 and parameters: {'timeframe': 'M3', 'atr_period': 13, 'atr_threshold': 3.0, 'pt_mult': 0.5, 'sl_mult': 5.0, 'td_mins': 30}. Best is trial 367 with value: 2.710569080288531.
[I 2026-03-12 01:40:54,218] Trial 435 finished with value: 0.0 and parameters: {'timeframe': 'M3', 'atr_period': 13, 'atr_threshold': 15.0, 'pt_mult': 5.0, 'sl_mult': 5.0, 'td_mins': 30}. Best is trial 367 with value: 2.710569080288531.
[I 2026-03-12 01:40:54,263] Trial 436 finished with value: 0.0 and parameters: {'timeframe': 'M3', 'atr_period': 13, 'atr_threshold': 5.0, 'pt_mult': 0.5, 'sl_mult': 0.5, 'td_mins': 30}. Best is trial 367 with value: 2.710569080288531.
[I 2026-03-12 01:40:54,347] Trial 437 pruned. 
[I 2026-03-12 01:40:54,408] Trial 438 pruned. 
[I 2026-03-12 01:40:54,463] Trial 439 finished with value: 0.0 and parameters: {'timeframe': 'M3', 'atr_period': 13, 'atr_threshold': 5.0, 'pt_mult': 2.5, 'sl_mult': 5.0, 'td_mins': 30}. Best is trial 367 with value: 2.710569080288531.
[I 2026-03-12 01:40:54,587] Trial 440 finished with value: 2.710569080288531 and parameters: {'timeframe': 'M3', 'atr_period': 13, 'atr_threshold': 3.0, 'pt_mult': 0.5, 'sl_mult': 5.0, 'td_mins': 30}. Best is trial 367 with value: 2.710569080288531.
[I 2026-03-12 01:40:54,651] Trial 441 pruned. 
[I 2026-03-12 01:40:54,714] Trial 442 pruned. 
[I 2026-03-12 01:40:54,780] Trial 443 pruned. 
[I 2026-03-12 01:40:54,928] Trial 444 finished with value: 2.710569080288531 and parameters: {'timeframe': 'M3', 'atr_period': 13, 'atr_threshold': 3.0, 'pt_mult': 0.5, 'sl_mult': 5.0, 'td_mins': 30}. Best is trial 367 with value: 2.710569080288531.
[I 2026-03-12 01:40:55,006] Trial 445 pruned. 
[I 2026-03-12 01:40:56,324] Trial 446 pruned. 
[I 2026-03-12 01:40:56,381] Trial 447 finished with value: 0.0 and parameters: {'timeframe': 'M3', 'atr_period': 13, 'atr_threshold': 5.0, 'pt_mult': 0.5, 'sl_mult': 5.0, 'td_mins': 720}. Best is trial 367 with value: 2.710569080288531.
[I 2026-03-12 01:40:56,433] Trial 448 finished with value: 0.0 and parameters: {'timeframe': 'M3', 'atr_period': 13, 'atr_threshold': 15.0, 'pt_mult': 1.0, 'sl_mult': 5.0, 'td_mins': 30}. Best is trial 367 with value: 2.710569080288531.
[I 2026-03-12 01:40:56,618] Trial 449 pruned. 
[I 2026-03-12 01:40:56,673] Trial 450 finished with value: 0.0 and parameters: {'timeframe': 'M3', 'atr_period': 13, 'atr_threshold': 8.0, 'pt_mult': 2.5, 'sl_mult': 5.0, 'td_mins': 30}. Best is trial 367 with value: 2.710569080288531.
[I 2026-03-12 01:40:56,806] Trial 451 pruned. 
[I 2026-03-12 01:40:56,855] Trial 452 finished with value: 0.0 and parameters: {'timeframe': 'M3', 'atr_period': 13, 'atr_threshold': 15.0, 'pt_mult': 0.5, 'sl_mult': 2.5, 'td_mins': 30}. Best is trial 367 with value: 2.710569080288531.
[I 2026-03-12 01:40:56,906] Trial 453 finished with value: 0.0 and parameters: {'timeframe': 'M3', 'atr_period': 13, 'atr_threshold': 10.0, 'pt_mult': 0.5, 'sl_mult': 0.5, 'td_mins': 30}. Best is trial 367 with value: 2.710569080288531.
[I 2026-03-12 01:40:57,049] Trial 454 finished with value: 2.710569080288531 and parameters: {'timeframe': 'M3', 'atr_period': 13, 'atr_threshold': 3.0, 'pt_mult': 0.5, 'sl_mult': 5.0, 'td_mins': 30}. Best is trial 367 with value: 2.710569080288531.
[I 2026-03-12 01:40:57,097] Trial 455 finished with value: 0.0 and parameters: {'timeframe': 'M3', 'atr_period': 13, 'atr_threshold': 10.0, 'pt_mult': 0.5, 'sl_mult': 5.0, 'td_mins': 180}. Best is trial 367 with value: 2.710569080288531.
[I 2026-03-12 01:40:57,234] Trial 456 finished with value: 2.710569080288531 and parameters: {'timeframe': 'M3', 'atr_period': 13, 'atr_threshold': 3.0, 'pt_mult': 0.5, 'sl_mult': 5.0, 'td_mins': 30}. Best is trial 367 with value: 2.710569080288531.
[I 2026-03-12 01:40:57,320] Trial 457 pruned. 
[I 2026-03-12 01:40:57,376] Trial 458 pruned. 
[I 2026-03-12 01:40:57,423] Trial 459 finished with value: 0.0 and parameters: {'timeframe': 'M3', 'atr_period': 13, 'atr_threshold': 8.0, 'pt_mult': 0.5, 'sl_mult': 5.0, 'td_mins': 120}. Best is trial 367 with value: 2.710569080288531.
[I 2026-03-12 01:40:57,476] Trial 460 pruned. 
[I 2026-03-12 01:40:57,776] Trial 461 pruned. 
[I 2026-03-12 01:40:57,836] Trial 462 pruned. 
[I 2026-03-12 01:40:57,898] Trial 463 pruned. 
[I 2026-03-12 01:40:57,969] Trial 464 pruned. 
[I 2026-03-12 01:40:58,024] Trial 465 pruned. 
[I 2026-03-12 01:40:58,144] Trial 466 finished with value: 2.710569080288531 and parameters: {'timeframe': 'M3', 'atr_period': 13, 'atr_threshold': 3.0, 'pt_mult': 0.5, 'sl_mult': 5.0, 'td_mins': 30}. Best is trial 367 with value: 2.710569080288531.
[I 2026-03-12 01:40:58,193] Trial 467 finished with value: 0.0 and parameters: {'timeframe': 'M3', 'atr_period': 13, 'atr_threshold': 8.0, 'pt_mult': 0.5, 'sl_mult': 5.0, 'td_mins': 30}. Best is trial 367 with value: 2.710569080288531.
[I 2026-03-12 01:40:58,243] Trial 468 finished with value: 0.0 and parameters: {'timeframe': 'M3', 'atr_period': 13, 'atr_threshold': 10.0, 'pt_mult': 0.5, 'sl_mult': 2.5, 'td_mins': 30}. Best is trial 367 with value: 2.710569080288531.
[I 2026-03-12 01:40:58,302] Trial 469 pruned. 
[I 2026-03-12 01:40:58,349] Trial 470 finished with value: 0.0 and parameters: {'timeframe': 'M3', 'atr_period': 13, 'atr_threshold': 8.0, 'pt_mult': 0.5, 'sl_mult': 0.5, 'td_mins': 30}. Best is trial 367 with value: 2.710569080288531.
[I 2026-03-12 01:40:58,461] Trial 471 finished with value: 2.710569080288531 and parameters: {'timeframe': 'M3', 'atr_period': 13, 'atr_threshold': 3.0, 'pt_mult': 0.5, 'sl_mult': 5.0, 'td_mins': 30}. Best is trial 367 with value: 2.710569080288531.
[I 2026-03-12 01:40:58,578] Trial 472 finished with value: 2.710569080288531 and parameters: {'timeframe': 'M3', 'atr_period': 13, 'atr_threshold': 3.0, 'pt_mult': 0.5, 'sl_mult': 5.0, 'td_mins': 30}. Best is trial 367 with value: 2.710569080288531.
[I 2026-03-12 01:40:58,696] Trial 473 finished with value: 2.710569080288531 and parameters: {'timeframe': 'M3', 'atr_period': 13, 'atr_threshold': 3.0, 'pt_mult': 0.5, 'sl_mult': 5.0, 'td_mins': 30}. Best is trial 367 with value: 2.710569080288531.
[I 2026-03-12 01:40:58,811] Trial 474 finished with value: 2.710569080288531 and parameters: {'timeframe': 'M3', 'atr_period': 13, 'atr_threshold': 3.0, 'pt_mult': 0.5, 'sl_mult': 5.0, 'td_mins': 30}. Best is trial 367 with value: 2.710569080288531.
[I 2026-03-12 01:40:58,925] Trial 475 finished with value: 2.710569080288531 and parameters: {'timeframe': 'M3', 'atr_period': 13, 'atr_threshold': 3.0, 'pt_mult': 0.5, 'sl_mult': 5.0, 'td_mins': 30}. Best is trial 367 with value: 2.710569080288531.
[I 2026-03-12 01:40:59,041] Trial 476 finished with value: 2.710569080288531 and parameters: {'timeframe': 'M3', 'atr_period': 13, 'atr_threshold': 3.0, 'pt_mult': 0.5, 'sl_mult': 5.0, 'td_mins': 30}. Best is trial 367 with value: 2.710569080288531.
[I 2026-03-12 01:40:59,123] Trial 477 pruned. 
[I 2026-03-12 01:40:59,172] Trial 478 finished with value: 0.0 and parameters: {'timeframe': 'M3', 'atr_period': 13, 'atr_threshold': 5.0, 'pt_mult': 0.5, 'sl_mult': 2.5, 'td_mins': 30}. Best is trial 367 with value: 2.710569080288531.
[I 2026-03-12 01:40:59,221] Trial 479 finished with value: 0.0 and parameters: {'timeframe': 'M3', 'atr_period': 13, 'atr_threshold': 8.0, 'pt_mult': 0.5, 'sl_mult': 5.0, 'td_mins': 15}. Best is trial 367 with value: 2.710569080288531.
[I 2026-03-12 01:40:59,338] Trial 480 finished with value: 2.710569080288531 and parameters: {'timeframe': 'M3', 'atr_period': 13, 'atr_threshold': 3.0, 'pt_mult': 0.5, 'sl_mult': 5.0, 'td_mins': 30}. Best is trial 367 with value: 2.710569080288531.
[I 2026-03-12 01:40:59,386] Trial 481 finished with value: 0.0 and parameters: {'timeframe': 'M3', 'atr_period': 13, 'atr_threshold': 5.0, 'pt_mult': 0.5, 'sl_mult': 5.0, 'td_mins': 30}. Best is trial 367 with value: 2.710569080288531.
[I 2026-03-12 01:40:59,503] Trial 482 finished with value: 2.710569080288531 and parameters: {'timeframe': 'M3', 'atr_period': 13, 'atr_threshold': 3.0, 'pt_mult': 0.5, 'sl_mult': 5.0, 'td_mins': 30}. Best is trial 367 with value: 2.710569080288531.
[I 2026-03-12 01:40:59,554] Trial 483 finished with value: 0.0 and parameters: {'timeframe': 'M3', 'atr_period': 13, 'atr_threshold': 15.0, 'pt_mult': 0.5, 'sl_mult': 0.5, 'td_mins': 30}. Best is trial 367 with value: 2.710569080288531.
[I 2026-03-12 01:40:59,677] Trial 484 finished with value: 2.710569080288531 and parameters: {'timeframe': 'M3', 'atr_period': 13, 'atr_threshold': 3.0, 'pt_mult': 0.5, 'sl_mult': 5.0, 'td_mins': 30}. Best is trial 367 with value: 2.710569080288531.
[I 2026-03-12 01:40:59,725] Trial 485 finished with value: 0.0 and parameters: {'timeframe': 'M3', 'atr_period': 13, 'atr_threshold': 15.0, 'pt_mult': 0.5, 'sl_mult': 5.0, 'td_mins': 15}. Best is trial 367 with value: 2.710569080288531.
[I 2026-03-12 01:40:59,872] Trial 486 finished with value: 2.710569080288531 and parameters: {'timeframe': 'M3', 'atr_period': 13, 'atr_threshold': 3.0, 'pt_mult': 0.5, 'sl_mult': 5.0, 'td_mins': 30}. Best is trial 367 with value: 2.710569080288531.
[I 2026-03-12 01:40:59,947] Trial 487 pruned. 
[I 2026-03-12 01:41:00,037] Trial 488 pruned. 
[I 2026-03-12 01:41:00,106] Trial 489 pruned. 
[I 2026-03-12 01:41:00,164] Trial 490 pruned. 
[I 2026-03-12 01:41:00,231] Trial 491 pruned. 
[I 2026-03-12 01:41:00,305] Trial 492 pruned. 
[I 2026-03-12 01:41:00,368] Trial 493 pruned. 
[I 2026-03-12 01:41:00,488] Trial 494 finished with value: 2.387929099905751 and parameters: {'timeframe': 'M3', 'atr_period': 13, 'atr_threshold': 3.0, 'pt_mult': 1.0, 'sl_mult': 5.0, 'td_mins': 30}. Best is trial 367 with value: 2.710569080288531.
[I 2026-03-12 01:41:00,555] Trial 495 pruned. 
[I 2026-03-12 01:41:00,605] Trial 496 finished with value: 0.0 and parameters: {'timeframe': 'M3', 'atr_period': 13, 'atr_threshold': 10.0, 'pt_mult': 0.5, 'sl_mult': 5.0, 'td_mins': 15}. Best is trial 367 with value: 2.710569080288531.
[I 2026-03-12 01:41:00,654] Trial 497 finished with value: 0.0 and parameters: {'timeframe': 'M3', 'atr_period': 13, 'atr_threshold': 5.0, 'pt_mult': 0.5, 'sl_mult': 5.0, 'td_mins': 120}. Best is trial 367 with value: 2.710569080288531.
[I 2026-03-12 01:41:00,744] Trial 498 finished with value: 2.613255170260378 and parameters: {'timeframe': 'M3', 'atr_period': 13, 'atr_threshold': 3.0, 'pt_mult': 0.5, 'sl_mult': 5.0, 'td_mins': 15}. Best is trial 367 with value: 2.710569080288531.
[I 2026-03-12 01:41:00,793] Trial 499 finished with value: 0.0 and parameters: {'timeframe': 'M3', 'atr_period': 13, 'atr_threshold': 5.0, 'pt_mult': 0.5, 'sl_mult': 5.0, 'td_mins': 1080}. Best is trial 367 with value: 2.710569080288531.
[I 2026-03-12 01:41:00,903] Trial 500 pruned. 
[I 2026-03-12 01:41:00,960] Trial 501 pruned. 
[I 2026-03-12 01:41:01,025] Trial 502 pruned. 
[I 2026-03-12 01:41:01,121] Trial 503 pruned. 
[I 2026-03-12 01:41:01,185] Trial 504 pruned. 
[I 2026-03-12 01:41:01,239] Trial 505 pruned. 
[I 2026-03-12 01:41:01,289] Trial 506 finished with value: 0.0 and parameters: {'timeframe': 'M3', 'atr_period': 13, 'atr_threshold': 5.0, 'pt_mult': 0.5, 'sl_mult': 5.0, 'td_mins': 360}. Best is trial 367 with value: 2.710569080288531.
[I 2026-03-12 01:41:01,336] Trial 507 finished with value: 0.0 and parameters: {'timeframe': 'M3', 'atr_period': 13, 'atr_threshold': 15.0, 'pt_mult': 0.5, 'sl_mult': 5.0, 'td_mins': 120}. Best is trial 367 with value: 2.710569080288531.
[I 2026-03-12 01:41:01,392] Trial 508 pruned. 
[I 2026-03-12 01:41:01,507] Trial 509 finished with value: 2.710569080288531 and parameters: {'timeframe': 'M3', 'atr_period': 13, 'atr_threshold': 3.0, 'pt_mult': 0.5, 'sl_mult': 5.0, 'td_mins': 30}. Best is trial 367 with value: 2.710569080288531.
[I 2026-03-12 01:41:01,555] Trial 510 finished with value: 0.0 and parameters: {'timeframe': 'M3', 'atr_period': 13, 'atr_threshold': 10.0, 'pt_mult': 0.5, 'sl_mult': 5.0, 'td_mins': 360}. Best is trial 367 with value: 2.710569080288531.
[I 2026-03-12 01:41:01,615] Trial 511 pruned. 
[I 2026-03-12 01:41:01,696] Trial 512 pruned. 
[I 2026-03-12 01:41:01,800] Trial 513 pruned. 
[I 2026-03-12 01:41:02,026] Trial 514 finished with value: 2.561287763012388 and parameters: {'timeframe': 'M3', 'atr_period': 13, 'atr_threshold': 2.0, 'pt_mult': 0.5, 'sl_mult': 5.0, 'td_mins': 30}. Best is trial 367 with value: 2.710569080288531.
[I 2026-03-12 01:41:02,134] Trial 515 pruned. 
[I 2026-03-12 01:41:02,195] Trial 516 pruned. 
[I 2026-03-12 01:41:02,378] Trial 517 pruned. 
[I 2026-03-12 01:41:02,476] Trial 518 pruned. 
[I 2026-03-12 01:41:02,605] Trial 519 finished with value: 2.710569080288531 and parameters: {'timeframe': 'M3', 'atr_period': 13, 'atr_threshold': 3.0, 'pt_mult': 0.5, 'sl_mult': 5.0, 'td_mins': 30}. Best is trial 367 with value: 2.710569080288531.
[I 2026-03-12 01:41:02,654] Trial 520 finished with value: 0.0 and parameters: {'timeframe': 'M3', 'atr_period': 13, 'atr_threshold': 15.0, 'pt_mult': 0.5, 'sl_mult': 5.0, 'td_mins': 30}. Best is trial 367 with value: 2.710569080288531.
