[I 2026-03-12 00:48:21,580] Trial 6 finished with value: 1.1051004807795013 and parameters: {'timeframe': 'M3', 'atr_period': 13, 'atr_threshold': 2.0, 'pt_mult': 2.5, 'sl_mult': 0.5, 'td_mins': 1200}. Best is trial 6 with value: 1.1051004807795013.
[I 2026-03-12 00:48:21,913] Trial 7 finished with value: 0.9150546460711743 and parameters: {'timeframe': 'M3', 'atr_period': 13, 'atr_threshold': 1.0, 'pt_mult': 1.0, 'sl_mult': 2.5, 'td_mins': 15}. Best is trial 6 with value: 1.1051004807795013.
[I 2026-03-12 00:48:22,047] Trial 8 finished with value: 0.6259569629010497 and parameters: {'timeframe': 'M3', 'atr_period': 13, 'atr_threshold': 3.0, 'pt_mult': 2.5, 'sl_mult': 2.5, 'td_mins': 30}. Best is trial 6 with value: 1.1051004807795013.
[I 2026-03-12 00:48:22,096] Trial 9 finished with value: 0.0 and parameters: {'timeframe': 'M3', 'atr_period': 13, 'atr_threshold': 5.0, 'pt_mult': 1.0, 'sl_mult': 5.0, 'td_mins': 720}. Best is trial 6 with value: 1.1051004807795013.
[I 2026-03-12 00:48:22,190] Trial 10 finished with value: 0.7433335334327722 and parameters: {'timeframe': 'M3', 'atr_period': 13, 'atr_threshold': 3.0, 'pt_mult': 1.0, 'sl_mult': 0.5, 'td_mins': 15}. Best is trial 6 with value: 1.1051004807795013.
[I 2026-03-12 00:48:22,241] Trial 11 finished with value: 0.0 and parameters: {'timeframe': 'M3', 'atr_period': 13, 'atr_threshold': 15.0, 'pt_mult': 2.5, 'sl_mult': 2.5, 'td_mins': 180}. Best is trial 6 with value: 1.1051004807795013.
[I 2026-03-12 00:48:22,299] Trial 12 finished with value: 0.0 and parameters: {'timeframe': 'M3', 'atr_period': 13, 'atr_threshold': 10.0, 'pt_mult': 5.0, 'sl_mult': 5.0, 'td_mins': 5}. Best is trial 6 with value: 1.1051004807795013.
[I 2026-03-12 00:48:22,396] Trial 13 finished with value: 0.5783892126712059 and parameters: {'timeframe': 'M3', 'atr_period': 13, 'atr_threshold': 3.0, 'pt_mult': 2.5, 'sl_mult': 5.0, 'td_mins': 15}. Best is trial 6 with value: 1.1051004807795013.
[I 2026-03-12 00:48:22,441] Trial 14 finished with value: 0.0 and parameters: {'timeframe': 'M3', 'atr_period': 13, 'atr_threshold': 5.0, 'pt_mult': 0.5, 'sl_mult': 2.5, 'td_mins': 5}. Best is trial 6 with value: 1.1051004807795013.
[I 2026-03-12 00:48:22,508] Trial 15 finished with value: 0.021184972615990023 and parameters: {'timeframe': 'M3', 'atr_period': 13, 'atr_threshold': 3.0, 'pt_mult': 5.0, 'sl_mult': 5.0, 'td_mins': 5}. Best is trial 6 with value: 1.1051004807795013.
[I 2026-03-12 00:48:22,551] Trial 16 finished with value: 0.0 and parameters: {'timeframe': 'M3', 'atr_period': 13, 'atr_threshold': 15.0, 'pt_mult': 1.0, 'sl_mult': 2.5, 'td_mins': 1200}. Best is trial 6 with value: 1.1051004807795013.
[I 2026-03-12 00:48:22,593] Trial 17 finished with value: 0.0 and parameters: {'timeframe': 'M3', 'atr_period': 13, 'atr_threshold': 5.0, 'pt_mult': 0.5, 'sl_mult': 5.0, 'td_mins': 720}. Best is trial 6 with value: 1.1051004807795013.
[I 2026-03-12 00:48:25,899] Trial 18 finished with value: 1.0121277127219164 and parameters: {'timeframe': 'M3', 'atr_period': 13, 'atr_threshold': 1.0, 'pt_mult': 1.0, 'sl_mult': 1.0, 'td_mins': 1200}. Best is trial 6 with value: 1.1051004807795013.
[I 2026-03-12 00:48:25,942] Trial 19 finished with value: 0.0 and parameters: {'timeframe': 'M3', 'atr_period': 13, 'atr_threshold': 10.0, 'pt_mult': 5.0, 'sl_mult': 0.5, 'td_mins': 5}. Best is trial 6 with value: 1.1051004807795013.
[I 2026-03-12 00:48:27,741] Trial 20 finished with value: 0.9731425755059704 and parameters: {'timeframe': 'M3', 'atr_period': 13, 'atr_threshold': 2.0, 'pt_mult': 5.0, 'sl_mult': 0.5, 'td_mins': 720}. Best is trial 6 with value: 1.1051004807795013.
[I 2026-03-12 00:48:34,471] Trial 21 finished with value: 1.032851166476019 and parameters: {'timeframe': 'M3', 'atr_period': 13, 'atr_threshold': 1.0, 'pt_mult': 5.0, 'sl_mult': 0.5, 'td_mins': 1200}. Best is trial 6 with value: 1.1051004807795013.
[I 2026-03-12 00:48:36,342] Trial 22 finished with value: 1.1122230515893905 and parameters: {'timeframe': 'M3', 'atr_period': 13, 'atr_threshold': 2.0, 'pt_mult': 0.5, 'sl_mult': 5.0, 'td_mins': 720}. Best is trial 22 with value: 1.1122230515893905.
[I 2026-03-12 00:48:36,386] Trial 23 finished with value: 0.0 and parameters: {'timeframe': 'M3', 'atr_period': 13, 'atr_threshold': 10.0, 'pt_mult': 1.0, 'sl_mult': 0.5, 'td_mins': 360}. Best is trial 22 with value: 1.1122230515893905.
[I 2026-03-12 00:48:36,431] Trial 24 finished with value: 0.0 and parameters: {'timeframe': 'M3', 'atr_period': 13, 'atr_threshold': 5.0, 'pt_mult': 5.0, 'sl_mult': 2.5, 'td_mins': 60}. Best is trial 22 with value: 1.1122230515893905.
[I 2026-03-12 00:48:36,582] Trial 25 finished with value: 1.058565696204774 and parameters: {'timeframe': 'M3', 'atr_period': 13, 'atr_threshold': 3.0, 'pt_mult': 1.0, 'sl_mult': 2.5, 'td_mins': 60}. Best is trial 22 with value: 1.1122230515893905.
[I 2026-03-12 00:48:37,888] Trial 26 finished with value: 1.0403571477945603 and parameters: {'timeframe': 'M3', 'atr_period': 13, 'atr_threshold': 3.0, 'pt_mult': 2.5, 'sl_mult': 5.0, 'td_mins': 1080}. Best is trial 22 with value: 1.1122230515893905.
[I 2026-03-12 00:48:37,932] Trial 27 finished with value: 0.0 and parameters: {'timeframe': 'M3', 'atr_period': 13, 'atr_threshold': 15.0, 'pt_mult': 1.0, 'sl_mult': 5.0, 'td_mins': 1080}. Best is trial 22 with value: 1.1122230515893905.
[I 2026-03-12 00:48:38,018] Trial 28 pruned. 
[I 2026-03-12 00:48:38,151] Trial 29 finished with value: 1.9600482462895854 and parameters: {'timeframe': 'M3', 'atr_period': 13, 'atr_threshold': 3.0, 'pt_mult': 1.0, 'sl_mult': 5.0, 'td_mins': 30}. Best is trial 29 with value: 1.9600482462895854.
[I 2026-03-12 00:48:39,505] Trial 30 finished with value: 1.003756526500557 and parameters: {'timeframe': 'M3', 'atr_period': 13, 'atr_threshold': 0.5, 'pt_mult': 0.5, 'sl_mult': 0.5, 'td_mins': 360}. Best is trial 29 with value: 1.9600482462895854.
[I 2026-03-12 00:48:39,550] Trial 31 finished with value: 0.0 and parameters: {'timeframe': 'M3', 'atr_period': 13, 'atr_threshold': 5.0, 'pt_mult': 1.0, 'sl_mult': 0.5, 'td_mins': 1080}. Best is trial 29 with value: 1.9600482462895854.
[I 2026-03-12 00:48:39,599] Trial 32 finished with value: 0.0 and parameters: {'timeframe': 'M3', 'atr_period': 13, 'atr_threshold': 5.0, 'pt_mult': 0.5, 'sl_mult': 2.5, 'td_mins': 60}. Best is trial 29 with value: 1.9600482462895854.
[I 2026-03-12 00:48:39,642] Trial 33 pruned. 
[I 2026-03-12 00:48:39,788] Trial 34 finished with value: 1.0876079724625662 and parameters: {'timeframe': 'M3', 'atr_period': 13, 'atr_threshold': 2.0, 'pt_mult': 1.0, 'sl_mult': 2.5, 'td_mins': 15}. Best is trial 29 with value: 1.9600482462895854.
[I 2026-03-12 00:48:39,831] Trial 35 finished with value: 0.0 and parameters: {'timeframe': 'M3', 'atr_period': 13, 'atr_threshold': 15.0, 'pt_mult': 1.0, 'sl_mult': 1.0, 'td_mins': 5}. Best is trial 29 with value: 1.9600482462895854.
[I 2026-03-12 00:48:39,873] Trial 36 finished with value: 0.0 and parameters: {'timeframe': 'M3', 'atr_period': 13, 'atr_threshold': 5.0, 'pt_mult': 1.0, 'sl_mult': 0.5, 'td_mins': 1200}. Best is trial 29 with value: 1.9600482462895854.
[I 2026-03-12 00:48:39,917] Trial 37 finished with value: 0.0 and parameters: {'timeframe': 'M3', 'atr_period': 13, 'atr_threshold': 5.0, 'pt_mult': 0.5, 'sl_mult': 0.5, 'td_mins': 120}. Best is trial 29 with value: 1.9600482462895854.
[I 2026-03-12 00:48:40,041] Trial 38 pruned. 
[I 2026-03-12 00:48:40,952] Trial 39 finished with value: 1.1882671083033565 and parameters: {'timeframe': 'M3', 'atr_period': 13, 'atr_threshold': 3.0, 'pt_mult': 2.5, 'sl_mult': 1.0, 'td_mins': 1200}. Best is trial 29 with value: 1.9600482462895854.
[I 2026-03-12 00:48:41,361] Trial 40 pruned. 
[I 2026-03-12 00:48:41,407] Trial 41 finished with value: 0.0 and parameters: {'timeframe': 'M3', 'atr_period': 13, 'atr_threshold': 10.0, 'pt_mult': 5.0, 'sl_mult': 0.5, 'td_mins': 30}. Best is trial 29 with value: 1.9600482462895854.
[I 2026-03-12 00:48:44,587] Trial 42 finished with value: 1.0389764900330625 and parameters: {'timeframe': 'M3', 'atr_period': 13, 'atr_threshold': 0.5, 'pt_mult': 1.0, 'sl_mult': 0.5, 'td_mins': 1080}. Best is trial 29 with value: 1.9600482462895854.
[I 2026-03-12 00:48:44,630] Trial 43 finished with value: 0.0 and parameters: {'timeframe': 'M3', 'atr_period': 13, 'atr_threshold': 5.0, 'pt_mult': 0.5, 'sl_mult': 2.5, 'td_mins': 180}. Best is trial 29 with value: 1.9600482462895854.
[I 2026-03-12 00:48:44,724] Trial 44 pruned. 
[I 2026-03-12 00:48:45,097] Trial 45 finished with value: 0.9323392421188746 and parameters: {'timeframe': 'M3', 'atr_period': 13, 'atr_threshold': 3.0, 'pt_mult': 5.0, 'sl_mult': 5.0, 'td_mins': 180}. Best is trial 29 with value: 1.9600482462895854.
[I 2026-03-12 00:48:45,142] Trial 46 finished with value: 0.0 and parameters: {'timeframe': 'M3', 'atr_period': 13, 'atr_threshold': 15.0, 'pt_mult': 2.5, 'sl_mult': 0.5, 'td_mins': 1080}. Best is trial 29 with value: 1.9600482462895854.
[I 2026-03-12 00:48:45,185] Trial 47 finished with value: 0.0 and parameters: {'timeframe': 'M3', 'atr_period': 13, 'atr_threshold': 8.0, 'pt_mult': 2.5, 'sl_mult': 1.0, 'td_mins': 120}. Best is trial 29 with value: 1.9600482462895854.
[I 2026-03-12 00:48:45,228] Trial 48 finished with value: 0.0 and parameters: {'timeframe': 'M3', 'atr_period': 13, 'atr_threshold': 10.0, 'pt_mult': 1.0, 'sl_mult': 2.5, 'td_mins': 180}. Best is trial 29 with value: 1.9600482462895854.
[I 2026-03-12 00:48:46,124] Trial 49 finished with value: 0.9763340802830596 and parameters: {'timeframe': 'M3', 'atr_period': 13, 'atr_threshold': 3.0, 'pt_mult': 5.0, 'sl_mult': 1.0, 'td_mins': 720}. Best is trial 29 with value: 1.9600482462895854.
[I 2026-03-12 00:48:46,169] Trial 50 finished with value: 0.0 and parameters: {'timeframe': 'M3', 'atr_period': 13, 'atr_threshold': 10.0, 'pt_mult': 1.0, 'sl_mult': 2.5, 'td_mins': 720}. Best is trial 29 with value: 1.9600482462895854.
[I 2026-03-12 00:48:46,215] Trial 51 finished with value: 0.0 and parameters: {'timeframe': 'M3', 'atr_period': 13, 'atr_threshold': 5.0, 'pt_mult': 2.5, 'sl_mult': 2.5, 'td_mins': 5}. Best is trial 29 with value: 1.9600482462895854.
[I 2026-03-12 00:48:46,258] Trial 52 finished with value: 0.0 and parameters: {'timeframe': 'M3', 'atr_period': 13, 'atr_threshold': 15.0, 'pt_mult': 1.0, 'sl_mult': 5.0, 'td_mins': 1080}. Best is trial 29 with value: 1.9600482462895854.
[I 2026-03-12 00:48:46,300] Trial 53 finished with value: 0.0 and parameters: {'timeframe': 'M3', 'atr_period': 13, 'atr_threshold': 8.0, 'pt_mult': 1.0, 'sl_mult': 5.0, 'td_mins': 60}. Best is trial 29 with value: 1.9600482462895854.
[I 2026-03-12 00:48:46,343] Trial 54 finished with value: 0.0 and parameters: {'timeframe': 'M3', 'atr_period': 13, 'atr_threshold': 5.0, 'pt_mult': 0.5, 'sl_mult': 1.0, 'td_mins': 360}. Best is trial 29 with value: 1.9600482462895854.
[I 2026-03-12 00:48:46,388] Trial 55 finished with value: 0.0 and parameters: {'timeframe': 'M3', 'atr_period': 13, 'atr_threshold': 5.0, 'pt_mult': 5.0, 'sl_mult': 2.5, 'td_mins': 180}. Best is trial 29 with value: 1.9600482462895854.
[I 2026-03-12 00:48:47,054] Trial 56 pruned. 
[I 2026-03-12 00:48:47,290] Trial 57 finished with value: 1.7907020647597356 and parameters: {'timeframe': 'M3', 'atr_period': 13, 'atr_threshold': 3.0, 'pt_mult': 0.5, 'sl_mult': 5.0, 'td_mins': 120}. Best is trial 29 with value: 1.9600482462895854.
[I 2026-03-12 00:48:47,336] Trial 58 finished with value: 0.0 and parameters: {'timeframe': 'M3', 'atr_period': 13, 'atr_threshold': 15.0, 'pt_mult': 0.5, 'sl_mult': 5.0, 'td_mins': 180}. Best is trial 29 with value: 1.9600482462895854.
[I 2026-03-12 00:48:47,389] Trial 59 finished with value: 0.0 and parameters: {'timeframe': 'M3', 'atr_period': 13, 'atr_threshold': 15.0, 'pt_mult': 1.0, 'sl_mult': 5.0, 'td_mins': 1080}. Best is trial 29 with value: 1.9600482462895854.
[I 2026-03-12 00:48:47,433] Trial 60 finished with value: 0.0 and parameters: {'timeframe': 'M3', 'atr_period': 13, 'atr_threshold': 8.0, 'pt_mult': 2.5, 'sl_mult': 5.0, 'td_mins': 30}. Best is trial 29 with value: 1.9600482462895854.
[I 2026-03-12 00:48:47,485] Trial 61 pruned. 
[I 2026-03-12 00:48:47,528] Trial 62 finished with value: 0.0 and parameters: {'timeframe': 'M3', 'atr_period': 13, 'atr_threshold': 5.0, 'pt_mult': 0.5, 'sl_mult': 2.5, 'td_mins': 360}. Best is trial 29 with value: 1.9600482462895854.
[I 2026-03-12 00:48:47,572] Trial 63 finished with value: 0.0 and parameters: {'timeframe': 'M3', 'atr_period': 13, 'atr_threshold': 10.0, 'pt_mult': 1.0, 'sl_mult': 1.0, 'td_mins': 360}. Best is trial 29 with value: 1.9600482462895854.
[I 2026-03-12 00:48:47,614] Trial 64 finished with value: 0.0 and parameters: {'timeframe': 'M3', 'atr_period': 13, 'atr_threshold': 8.0, 'pt_mult': 2.5, 'sl_mult': 0.5, 'td_mins': 120}. Best is trial 29 with value: 1.9600482462895854.
[I 2026-03-12 00:48:49,329] Trial 65 finished with value: 0.9845277071353955 and parameters: {'timeframe': 'M3', 'atr_period': 13, 'atr_threshold': 3.0, 'pt_mult': 5.0, 'sl_mult': 2.5, 'td_mins': 1200}. Best is trial 29 with value: 1.9600482462895854.
[I 2026-03-12 00:48:49,381] Trial 66 finished with value: 0.0 and parameters: {'timeframe': 'M3', 'atr_period': 13, 'atr_threshold': 5.0, 'pt_mult': 5.0, 'sl_mult': 2.5, 'td_mins': 360}. Best is trial 29 with value: 1.9600482462895854.
[I 2026-03-12 00:48:50,224] Trial 67 finished with value: 0.9890885532525514 and parameters: {'timeframe': 'M3', 'atr_period': 13, 'atr_threshold': 2.0, 'pt_mult': 0.5, 'sl_mult': 1.0, 'td_mins': 720}. Best is trial 29 with value: 1.9600482462895854.
[I 2026-03-12 00:48:50,271] Trial 68 finished with value: 0.0 and parameters: {'timeframe': 'M3', 'atr_period': 13, 'atr_threshold': 8.0, 'pt_mult': 5.0, 'sl_mult': 0.5, 'td_mins': 15}. Best is trial 29 with value: 1.9600482462895854.
[I 2026-03-12 00:48:50,878] Trial 69 pruned. 
[I 2026-03-12 00:48:50,939] Trial 70 finished with value: 0.0 and parameters: {'timeframe': 'M3', 'atr_period': 13, 'atr_threshold': 8.0, 'pt_mult': 5.0, 'sl_mult': 2.5, 'td_mins': 1080}. Best is trial 29 with value: 1.9600482462895854.
[I 2026-03-12 00:48:51,008] Trial 71 finished with value: 0.0 and parameters: {'timeframe': 'M3', 'atr_period': 13, 'atr_threshold': 10.0, 'pt_mult': 2.5, 'sl_mult': 5.0, 'td_mins': 15}. Best is trial 29 with value: 1.9600482462895854.
[I 2026-03-12 00:48:52,075] Trial 72 pruned. 
[I 2026-03-12 00:48:52,123] Trial 73 finished with value: 0.0 and parameters: {'timeframe': 'M3', 'atr_period': 13, 'atr_threshold': 5.0, 'pt_mult': 1.0, 'sl_mult': 2.5, 'td_mins': 60}. Best is trial 29 with value: 1.9600482462895854.
[I 2026-03-12 00:48:52,172] Trial 74 pruned. 
[I 2026-03-12 00:48:52,218] Trial 75 finished with value: 0.0 and parameters: {'timeframe': 'M3', 'atr_period': 13, 'atr_threshold': 15.0, 'pt_mult': 2.5, 'sl_mult': 2.5, 'td_mins': 15}. Best is trial 29 with value: 1.9600482462895854.
[I 2026-03-12 00:48:52,265] Trial 76 finished with value: 0.0 and parameters: {'timeframe': 'M3', 'atr_period': 13, 'atr_threshold': 8.0, 'pt_mult': 5.0, 'sl_mult': 2.5, 'td_mins': 15}. Best is trial 29 with value: 1.9600482462895854.
[I 2026-03-12 00:48:52,310] Trial 77 finished with value: 0.0 and parameters: {'timeframe': 'M3', 'atr_period': 13, 'atr_threshold': 8.0, 'pt_mult': 2.5, 'sl_mult': 2.5, 'td_mins': 1080}. Best is trial 29 with value: 1.9600482462895854.
[I 2026-03-12 00:48:52,361] Trial 78 finished with value: 0.0 and parameters: {'timeframe': 'M3', 'atr_period': 13, 'atr_threshold': 10.0, 'pt_mult': 1.0, 'sl_mult': 1.0, 'td_mins': 360}. Best is trial 29 with value: 1.9600482462895854.
[I 2026-03-12 00:48:52,409] Trial 79 finished with value: 0.0 and parameters: {'timeframe': 'M3', 'atr_period': 13, 'atr_threshold': 8.0, 'pt_mult': 2.5, 'sl_mult': 2.5, 'td_mins': 1080}. Best is trial 29 with value: 1.9600482462895854.
[I 2026-03-12 00:48:52,566] Trial 80 pruned. 
[I 2026-03-12 00:48:52,611] Trial 81 finished with value: 0.0 and parameters: {'timeframe': 'M3', 'atr_period': 13, 'atr_threshold': 8.0, 'pt_mult': 0.5, 'sl_mult': 1.0, 'td_mins': 120}. Best is trial 29 with value: 1.9600482462895854.
[I 2026-03-12 00:48:54,018] Trial 82 pruned. 
[I 2026-03-12 00:48:54,063] Trial 83 finished with value: 0.0 and parameters: {'timeframe': 'M3', 'atr_period': 13, 'atr_threshold': 8.0, 'pt_mult': 5.0, 'sl_mult': 2.5, 'td_mins': 180}. Best is trial 29 with value: 1.9600482462895854.
[I 2026-03-12 00:48:54,107] Trial 84 finished with value: 0.0 and parameters: {'timeframe': 'M3', 'atr_period': 13, 'atr_threshold': 8.0, 'pt_mult': 1.0, 'sl_mult': 5.0, 'td_mins': 360}. Best is trial 29 with value: 1.9600482462895854.
[I 2026-03-12 00:48:54,719] Trial 85 finished with value: 1.2678679084232083 and parameters: {'timeframe': 'M3', 'atr_period': 13, 'atr_threshold': 2.0, 'pt_mult': 2.5, 'sl_mult': 5.0, 'td_mins': 120}. Best is trial 29 with value: 1.9600482462895854.
[I 2026-03-12 00:48:54,769] Trial 86 finished with value: 0.0 and parameters: {'timeframe': 'M3', 'atr_period': 13, 'atr_threshold': 15.0, 'pt_mult': 2.5, 'sl_mult': 5.0, 'td_mins': 1200}. Best is trial 29 with value: 1.9600482462895854.
[I 2026-03-12 00:48:54,820] Trial 87 finished with value: 0.0 and parameters: {'timeframe': 'M3', 'atr_period': 13, 'atr_threshold': 15.0, 'pt_mult': 1.0, 'sl_mult': 2.5, 'td_mins': 120}. Best is trial 29 with value: 1.9600482462895854.
[I 2026-03-12 00:48:54,862] Trial 88 finished with value: 0.0 and parameters: {'timeframe': 'M3', 'atr_period': 13, 'atr_threshold': 8.0, 'pt_mult': 2.5, 'sl_mult': 5.0, 'td_mins': 1080}. Best is trial 29 with value: 1.9600482462895854.
[I 2026-03-12 00:48:54,907] Trial 89 finished with value: 0.0 and parameters: {'timeframe': 'M3', 'atr_period': 13, 'atr_threshold': 8.0, 'pt_mult': 0.5, 'sl_mult': 5.0, 'td_mins': 1200}. Best is trial 29 with value: 1.9600482462895854.
[I 2026-03-12 00:48:54,949] Trial 90 finished with value: 0.0 and parameters: {'timeframe': 'M3', 'atr_period': 13, 'atr_threshold': 10.0, 'pt_mult': 5.0, 'sl_mult': 5.0, 'td_mins': 60}. Best is trial 29 with value: 1.9600482462895854.
[I 2026-03-12 00:48:54,992] Trial 91 finished with value: 0.0 and parameters: {'timeframe': 'M3', 'atr_period': 13, 'atr_threshold': 15.0, 'pt_mult': 2.5, 'sl_mult': 0.5, 'td_mins': 120}. Best is trial 29 with value: 1.9600482462895854.
[I 2026-03-12 00:48:55,199] Trial 92 pruned. 
[I 2026-03-12 00:48:55,250] Trial 93 pruned. 
[I 2026-03-12 00:48:56,467] Trial 94 finished with value: 1.1947242054201375 and parameters: {'timeframe': 'M3', 'atr_period': 13, 'atr_threshold': 3.0, 'pt_mult': 5.0, 'sl_mult': 0.5, 'td_mins': 1200}. Best is trial 29 with value: 1.9600482462895854.
[I 2026-03-12 00:48:56,510] Trial 95 finished with value: 0.0 and parameters: {'timeframe': 'M3', 'atr_period': 13, 'atr_threshold': 8.0, 'pt_mult': 2.5, 'sl_mult': 0.5, 'td_mins': 180}. Best is trial 29 with value: 1.9600482462895854.
[I 2026-03-12 00:48:56,557] Trial 96 finished with value: 0.0 and parameters: {'timeframe': 'M3', 'atr_period': 13, 'atr_threshold': 15.0, 'pt_mult': 2.5, 'sl_mult': 1.0, 'td_mins': 1200}. Best is trial 29 with value: 1.9600482462895854.
[I 2026-03-12 00:48:56,754] Trial 97 pruned. 
[I 2026-03-12 00:48:56,796] Trial 98 finished with value: 0.0 and parameters: {'timeframe': 'M3', 'atr_period': 13, 'atr_threshold': 10.0, 'pt_mult': 5.0, 'sl_mult': 2.5, 'td_mins': 720}. Best is trial 29 with value: 1.9600482462895854.
[I 2026-03-12 00:48:56,846] Trial 99 finished with value: 0.0 and parameters: {'timeframe': 'M3', 'atr_period': 13, 'atr_threshold': 5.0, 'pt_mult': 0.5, 'sl_mult': 0.5, 'td_mins': 1200}. Best is trial 29 with value: 1.9600482462895854.
[I 2026-03-12 00:48:56,894] Trial 100 finished with value: 0.0 and parameters: {'timeframe': 'M3', 'atr_period': 13, 'atr_threshold': 10.0, 'pt_mult': 1.0, 'sl_mult': 2.5, 'td_mins': 15}. Best is trial 29 with value: 1.9600482462895854.
[I 2026-03-12 00:48:57,204] Trial 101 finished with value: 1.7030497438519188 and parameters: {'timeframe': 'M3', 'atr_period': 13, 'atr_threshold': 1.0, 'pt_mult': 0.5, 'sl_mult': 5.0, 'td_mins': 15}. Best is trial 29 with value: 1.9600482462895854.
[I 2026-03-12 00:48:57,328] Trial 102 finished with value: 0.9894428694155846 and parameters: {'timeframe': 'M3', 'atr_period': 13, 'atr_threshold': 3.0, 'pt_mult': 0.5, 'sl_mult': 0.5, 'td_mins': 120}. Best is trial 29 with value: 1.9600482462895854.
[I 2026-03-12 00:48:57,371] Trial 103 finished with value: 0.0 and parameters: {'timeframe': 'M3', 'atr_period': 13, 'atr_threshold': 8.0, 'pt_mult': 0.5, 'sl_mult': 5.0, 'td_mins': 30}. Best is trial 29 with value: 1.9600482462895854.
[I 2026-03-12 00:48:57,718] Trial 104 finished with value: 1.652669785016838 and parameters: {'timeframe': 'M3', 'atr_period': 13, 'atr_threshold': 3.0, 'pt_mult': 2.5, 'sl_mult': 5.0, 'td_mins': 180}. Best is trial 29 with value: 1.9600482462895854.
[I 2026-03-12 00:48:57,764] Trial 105 finished with value: 0.0 and parameters: {'timeframe': 'M3', 'atr_period': 13, 'atr_threshold': 5.0, 'pt_mult': 1.0, 'sl_mult': 1.0, 'td_mins': 15}. Best is trial 29 with value: 1.9600482462895854.
[I 2026-03-12 00:48:57,810] Trial 106 finished with value: 0.0 and parameters: {'timeframe': 'M3', 'atr_period': 13, 'atr_threshold': 8.0, 'pt_mult': 0.5, 'sl_mult': 2.5, 'td_mins': 30}. Best is trial 29 with value: 1.9600482462895854.
[I 2026-03-12 00:48:58,480] Trial 107 pruned. 
[I 2026-03-12 00:48:58,527] Trial 108 finished with value: 0.0 and parameters: {'timeframe': 'M3', 'atr_period': 13, 'atr_threshold': 15.0, 'pt_mult': 2.5, 'sl_mult': 0.5, 'td_mins': 15}. Best is trial 29 with value: 1.9600482462895854.
[I 2026-03-12 00:48:58,574] Trial 109 finished with value: 0.0 and parameters: {'timeframe': 'M3', 'atr_period': 13, 'atr_threshold': 8.0, 'pt_mult': 1.0, 'sl_mult': 5.0, 'td_mins': 1200}. Best is trial 29 with value: 1.9600482462895854.
