[I 2026-03-12 02:17:11,794] Trial 657 pruned. 
[I 2026-03-12 02:17:11,947] Trial 658 pruned. 
[I 2026-03-12 02:17:12,167] Trial 659 finished with value: 0.0 and parameters: {'timeframe': 'mixed', 'atr_period': 13, 'atr_threshold': 15.0, 'pt_mult': 0.5, 'sl_mult': 5.0, 'td_mins': 1200}. Best is trial 50 with value: 43.32685925026577.
[I 2026-03-12 02:17:12,285] Trial 660 pruned. 
[I 2026-03-12 02:17:13,912] Trial 661 pruned. 
[I 2026-03-12 02:17:14,072] Trial 662 pruned. 
[I 2026-03-12 02:17:14,273] Trial 663 finished with value: 0.0 and parameters: {'timeframe': 'mixed', 'atr_period': 13, 'atr_threshold': 15.0, 'pt_mult': 0.5, 'sl_mult': 5.0, 'td_mins': 1080}. Best is trial 50 with value: 43.32685925026577.
[I 2026-03-12 02:17:14,430] Trial 664 pruned. 
[I 2026-03-12 02:17:14,732] Trial 665 pruned. 
[I 2026-03-12 02:17:14,856] Trial 666 pruned. 
[I 2026-03-12 02:17:16,664] Trial 667 pruned. 
[I 2026-03-12 02:17:17,952] Trial 668 finished with value: 43.32685925026577 and parameters: {'timeframe': 'mixed', 'atr_period': 13, 'atr_threshold': 5.0, 'pt_mult': 0.5, 'sl_mult': 5.0, 'td_mins': 1080}. Best is trial 50 with value: 43.32685925026577.
[I 2026-03-12 02:17:19,822] Trial 669 pruned. 
[I 2026-03-12 02:17:19,957] Trial 670 pruned. 
[I 2026-03-12 02:17:20,161] Trial 671 pruned. 
[I 2026-03-12 02:17:21,555] Trial 672 finished with value: 43.32685925026577 and parameters: {'timeframe': 'mixed', 'atr_period': 13, 'atr_threshold': 5.0, 'pt_mult': 0.5, 'sl_mult': 5.0, 'td_mins': 1080}. Best is trial 50 with value: 43.32685925026577.
[I 2026-03-12 02:17:21,740] Trial 673 pruned. 
[I 2026-03-12 02:17:21,915] Trial 674 pruned. 
[I 2026-03-12 02:17:22,097] Trial 675 pruned. 
[I 2026-03-12 02:17:23,477] Trial 676 finished with value: 43.32685925026577 and parameters: {'timeframe': 'mixed', 'atr_period': 13, 'atr_threshold': 5.0, 'pt_mult': 0.5, 'sl_mult': 5.0, 'td_mins': 1080}. Best is trial 50 with value: 43.32685925026577.
[I 2026-03-12 02:17:23,599] Trial 677 pruned. 
[I 2026-03-12 02:17:24,778] Trial 678 finished with value: 43.32685925026577 and parameters: {'timeframe': 'mixed', 'atr_period': 13, 'atr_threshold': 5.0, 'pt_mult': 0.5, 'sl_mult': 5.0, 'td_mins': 1080}. Best is trial 50 with value: 43.32685925026577.
[I 2026-03-12 02:17:25,312] Trial 679 pruned. 
[I 2026-03-12 02:17:26,498] Trial 680 finished with value: 43.32685925026577 and parameters: {'timeframe': 'mixed', 'atr_period': 13, 'atr_threshold': 5.0, 'pt_mult': 0.5, 'sl_mult': 5.0, 'td_mins': 1080}. Best is trial 50 with value: 43.32685925026577.
[I 2026-03-12 02:17:35,216] Trial 681 pruned. 
[I 2026-03-12 02:17:39,445] Trial 682 pruned. 
[I 2026-03-12 02:17:39,619] Trial 683 finished with value: 0.0 and parameters: {'timeframe': 'mixed', 'atr_period': 13, 'atr_threshold': 15.0, 'pt_mult': 0.5, 'sl_mult': 0.5, 'td_mins': 30}. Best is trial 50 with value: 43.32685925026577.
[I 2026-03-12 02:17:39,889] Trial 684 pruned. 
[I 2026-03-12 02:17:40,030] Trial 685 pruned. 
[I 2026-03-12 02:17:41,293] Trial 686 finished with value: 43.32685925026577 and parameters: {'timeframe': 'mixed', 'atr_period': 13, 'atr_threshold': 5.0, 'pt_mult': 0.5, 'sl_mult': 5.0, 'td_mins': 1080}. Best is trial 50 with value: 43.32685925026577.
[I 2026-03-12 02:17:41,898] Trial 687 pruned. 
[I 2026-03-12 02:17:42,117] Trial 688 pruned. 
[I 2026-03-12 02:17:43,322] Trial 689 finished with value: 43.32685925026577 and parameters: {'timeframe': 'mixed', 'atr_period': 13, 'atr_threshold': 5.0, 'pt_mult': 0.5, 'sl_mult': 5.0, 'td_mins': 1080}. Best is trial 50 with value: 43.32685925026577.
[I 2026-03-12 02:17:44,531] Trial 690 finished with value: 43.32685925026577 and parameters: {'timeframe': 'mixed', 'atr_period': 13, 'atr_threshold': 5.0, 'pt_mult': 0.5, 'sl_mult': 5.0, 'td_mins': 1080}. Best is trial 50 with value: 43.32685925026577.
[I 2026-03-12 02:17:44,787] Trial 691 pruned. 
[I 2026-03-12 02:17:44,940] Trial 692 pruned. 
[I 2026-03-12 02:17:45,117] Trial 693 pruned. 
[I 2026-03-12 02:17:46,502] Trial 694 finished with value: 43.32685925026577 and parameters: {'timeframe': 'mixed', 'atr_period': 13, 'atr_threshold': 5.0, 'pt_mult': 0.5, 'sl_mult': 5.0, 'td_mins': 1080}. Best is trial 50 with value: 43.32685925026577.
[I 2026-03-12 02:17:47,761] Trial 695 finished with value: 43.32685925026577 and parameters: {'timeframe': 'mixed', 'atr_period': 13, 'atr_threshold': 5.0, 'pt_mult': 0.5, 'sl_mult': 5.0, 'td_mins': 1080}. Best is trial 50 with value: 43.32685925026577.
[I 2026-03-12 02:17:50,637] Trial 696 pruned. 
[I 2026-03-12 02:17:52,097] Trial 697 finished with value: 43.32685925026577 and parameters: {'timeframe': 'mixed', 'atr_period': 13, 'atr_threshold': 5.0, 'pt_mult': 0.5, 'sl_mult': 5.0, 'td_mins': 1080}. Best is trial 50 with value: 43.32685925026577.
[I 2026-03-12 02:17:52,277] Trial 698 pruned. 
[I 2026-03-12 02:17:53,563] Trial 699 finished with value: 43.32685925026577 and parameters: {'timeframe': 'mixed', 'atr_period': 13, 'atr_threshold': 5.0, 'pt_mult': 0.5, 'sl_mult': 5.0, 'td_mins': 1080}. Best is trial 50 with value: 43.32685925026577.
[I 2026-03-12 02:17:54,766] Trial 700 finished with value: 43.32685925026577 and parameters: {'timeframe': 'mixed', 'atr_period': 13, 'atr_threshold': 5.0, 'pt_mult': 0.5, 'sl_mult': 5.0, 'td_mins': 1080}. Best is trial 50 with value: 43.32685925026577.
[I 2026-03-12 02:17:54,879] Trial 701 pruned. 
[I 2026-03-12 02:17:55,398] Trial 702 pruned. 
[I 2026-03-12 02:17:56,000] Trial 703 pruned. 
[I 2026-03-12 02:17:56,163] Trial 704 pruned. 
[I 2026-03-12 02:17:56,347] Trial 705 finished with value: 0.0 and parameters: {'timeframe': 'mixed', 'atr_period': 13, 'atr_threshold': 15.0, 'pt_mult': 1.0, 'sl_mult': 2.5, 'td_mins': 120}. Best is trial 50 with value: 43.32685925026577.
[I 2026-03-12 02:17:57,647] Trial 706 finished with value: 43.32685925026577 and parameters: {'timeframe': 'mixed', 'atr_period': 13, 'atr_threshold': 5.0, 'pt_mult': 0.5, 'sl_mult': 5.0, 'td_mins': 1080}. Best is trial 50 with value: 43.32685925026577.
[I 2026-03-12 02:17:57,829] Trial 707 finished with value: 0.0 and parameters: {'timeframe': 'mixed', 'atr_period': 13, 'atr_threshold': 15.0, 'pt_mult': 0.5, 'sl_mult': 5.0, 'td_mins': 180}. Best is trial 50 with value: 43.32685925026577.
[I 2026-03-12 02:17:59,063] Trial 708 finished with value: 43.32685925026577 and parameters: {'timeframe': 'mixed', 'atr_period': 13, 'atr_threshold': 5.0, 'pt_mult': 0.5, 'sl_mult': 5.0, 'td_mins': 1080}. Best is trial 50 with value: 43.32685925026577.
[I 2026-03-12 02:18:03,162] Trial 709 pruned. 
[I 2026-03-12 02:18:05,162] Trial 710 pruned. 
[I 2026-03-12 02:18:06,453] Trial 711 finished with value: 43.32685925026577 and parameters: {'timeframe': 'mixed', 'atr_period': 13, 'atr_threshold': 5.0, 'pt_mult': 0.5, 'sl_mult': 5.0, 'td_mins': 1080}. Best is trial 50 with value: 43.32685925026577.
[I 2026-03-12 02:18:07,748] Trial 712 finished with value: 43.32685925026577 and parameters: {'timeframe': 'mixed', 'atr_period': 13, 'atr_threshold': 5.0, 'pt_mult': 0.5, 'sl_mult': 5.0, 'td_mins': 1080}. Best is trial 50 with value: 43.32685925026577.
[I 2026-03-12 02:18:07,926] Trial 713 finished with value: 0.0 and parameters: {'timeframe': 'mixed', 'atr_period': 13, 'atr_threshold': 10.0, 'pt_mult': 0.5, 'sl_mult': 5.0, 'td_mins': 180}. Best is trial 50 with value: 43.32685925026577.
[I 2026-03-12 02:18:08,100] Trial 714 finished with value: 0.0 and parameters: {'timeframe': 'mixed', 'atr_period': 13, 'atr_threshold': 10.0, 'pt_mult': 2.5, 'sl_mult': 0.5, 'td_mins': 180}. Best is trial 50 with value: 43.32685925026577.
[I 2026-03-12 02:18:08,232] Trial 715 pruned. 
[I 2026-03-12 02:18:09,487] Trial 716 finished with value: 43.32685925026577 and parameters: {'timeframe': 'mixed', 'atr_period': 13, 'atr_threshold': 5.0, 'pt_mult': 0.5, 'sl_mult': 5.0, 'td_mins': 1080}. Best is trial 50 with value: 43.32685925026577.
[I 2026-03-12 02:18:10,729] Trial 717 finished with value: 43.32685925026577 and parameters: {'timeframe': 'mixed', 'atr_period': 13, 'atr_threshold': 5.0, 'pt_mult': 0.5, 'sl_mult': 5.0, 'td_mins': 1080}. Best is trial 50 with value: 43.32685925026577.
[I 2026-03-12 02:18:10,881] Trial 718 pruned. 
[I 2026-03-12 02:18:12,166] Trial 719 finished with value: 43.32685925026577 and parameters: {'timeframe': 'mixed', 'atr_period': 13, 'atr_threshold': 5.0, 'pt_mult': 0.5, 'sl_mult': 5.0, 'td_mins': 1080}. Best is trial 50 with value: 43.32685925026577.
[I 2026-03-12 02:18:13,801] Trial 720 pruned. 
[I 2026-03-12 02:18:15,797] Trial 721 pruned. 
[I 2026-03-12 02:18:15,978] Trial 722 pruned. 
[I 2026-03-12 02:18:16,146] Trial 723 finished with value: 0.0 and parameters: {'timeframe': 'mixed', 'atr_period': 13, 'atr_threshold': 10.0, 'pt_mult': 5.0, 'sl_mult': 5.0, 'td_mins': 15}. Best is trial 50 with value: 43.32685925026577.
[I 2026-03-12 02:18:17,314] Trial 724 finished with value: 43.32685925026577 and parameters: {'timeframe': 'mixed', 'atr_period': 13, 'atr_threshold': 5.0, 'pt_mult': 0.5, 'sl_mult': 5.0, 'td_mins': 1080}. Best is trial 50 with value: 43.32685925026577.
[I 2026-03-12 02:18:17,810] Trial 725 pruned. 
[I 2026-03-12 02:18:18,902] Trial 726 finished with value: 43.32685925026577 and parameters: {'timeframe': 'mixed', 'atr_period': 13, 'atr_threshold': 5.0, 'pt_mult': 0.5, 'sl_mult': 5.0, 'td_mins': 1080}. Best is trial 50 with value: 43.32685925026577.
[I 2026-03-12 02:18:19,992] Trial 727 finished with value: 43.32685925026577 and parameters: {'timeframe': 'mixed', 'atr_period': 13, 'atr_threshold': 5.0, 'pt_mult': 0.5, 'sl_mult': 5.0, 'td_mins': 1080}. Best is trial 50 with value: 43.32685925026577.
[I 2026-03-12 02:18:20,166] Trial 728 pruned. 
[I 2026-03-12 02:18:21,262] Trial 729 finished with value: 43.32685925026577 and parameters: {'timeframe': 'mixed', 'atr_period': 13, 'atr_threshold': 5.0, 'pt_mult': 0.5, 'sl_mult': 5.0, 'td_mins': 1080}. Best is trial 50 with value: 43.32685925026577.
[I 2026-03-12 02:18:21,423] Trial 730 pruned. 
[I 2026-03-12 02:18:26,385] Trial 731 pruned. 
[I 2026-03-12 02:18:26,513] Trial 732 pruned. 
[I 2026-03-12 02:18:26,669] Trial 733 pruned. 
[I 2026-03-12 02:18:26,790] Trial 734 pruned. 
[I 2026-03-12 02:18:27,880] Trial 735 finished with value: 43.32685925026577 and parameters: {'timeframe': 'mixed', 'atr_period': 13, 'atr_threshold': 5.0, 'pt_mult': 0.5, 'sl_mult': 5.0, 'td_mins': 1080}. Best is trial 50 with value: 43.32685925026577.
[I 2026-03-12 02:18:28,089] Trial 736 pruned. 
[I 2026-03-12 02:18:28,238] Trial 737 pruned. 
[I 2026-03-12 02:18:28,353] Trial 738 pruned. 
[I 2026-03-12 02:18:28,908] Trial 739 pruned. 
[I 2026-03-12 02:18:34,149] Trial 740 pruned. 
[I 2026-03-12 02:18:35,328] Trial 741 finished with value: 43.32685925026577 and parameters: {'timeframe': 'mixed', 'atr_period': 13, 'atr_threshold': 5.0, 'pt_mult': 0.5, 'sl_mult': 5.0, 'td_mins': 1080}. Best is trial 50 with value: 43.32685925026577.
[I 2026-03-12 02:18:35,501] Trial 742 finished with value: 0.0 and parameters: {'timeframe': 'mixed', 'atr_period': 13, 'atr_threshold': 10.0, 'pt_mult': 0.5, 'sl_mult': 5.0, 'td_mins': 1080}. Best is trial 50 with value: 43.32685925026577.
[I 2026-03-12 02:18:36,665] Trial 743 finished with value: 43.32685925026577 and parameters: {'timeframe': 'mixed', 'atr_period': 13, 'atr_threshold': 5.0, 'pt_mult': 0.5, 'sl_mult': 5.0, 'td_mins': 1080}. Best is trial 50 with value: 43.32685925026577.
[I 2026-03-12 02:18:36,845] Trial 744 finished with value: 0.0 and parameters: {'timeframe': 'mixed', 'atr_period': 13, 'atr_threshold': 10.0, 'pt_mult': 1.0, 'sl_mult': 5.0, 'td_mins': 720}. Best is trial 50 with value: 43.32685925026577.
[I 2026-03-12 02:18:41,519] Trial 745 pruned. 
[I 2026-03-12 02:18:41,694] Trial 746 pruned. 
[I 2026-03-12 02:18:42,889] Trial 747 finished with value: 43.313027464575086 and parameters: {'timeframe': 'mixed', 'atr_period': 13, 'atr_threshold': 5.0, 'pt_mult': 0.5, 'sl_mult': 5.0, 'td_mins': 1200}. Best is trial 50 with value: 43.32685925026577.
[I 2026-03-12 02:18:43,045] Trial 748 pruned. 
[I 2026-03-12 02:18:43,197] Trial 749 pruned. 
[I 2026-03-12 02:18:43,311] Trial 750 pruned. 
[I 2026-03-12 02:18:43,482] Trial 751 finished with value: 0.0 and parameters: {'timeframe': 'mixed', 'atr_period': 13, 'atr_threshold': 15.0, 'pt_mult': 0.5, 'sl_mult': 5.0, 'td_mins': 1080}. Best is trial 50 with value: 43.32685925026577.
[I 2026-03-12 02:18:53,259] Trial 752 pruned. 
[I 2026-03-12 02:18:55,352] Trial 753 pruned. 
[I 2026-03-12 02:18:58,708] Trial 754 pruned. 
[I 2026-03-12 02:18:58,818] Trial 755 pruned. 
[I 2026-03-12 02:18:59,962] Trial 756 finished with value: 43.32685925026577 and parameters: {'timeframe': 'mixed', 'atr_period': 13, 'atr_threshold': 5.0, 'pt_mult': 0.5, 'sl_mult': 5.0, 'td_mins': 1080}. Best is trial 50 with value: 43.32685925026577.
[I 2026-03-12 02:19:00,119] Trial 757 pruned. 
[I 2026-03-12 02:19:01,093] Trial 758 pruned. 
[I 2026-03-12 02:19:01,264] Trial 759 finished with value: 0.0 and parameters: {'timeframe': 'mixed', 'atr_period': 13, 'atr_threshold': 15.0, 'pt_mult': 0.5, 'sl_mult': 5.0, 'td_mins': 30}. Best is trial 50 with value: 43.32685925026577.
[I 2026-03-12 02:19:01,939] Trial 760 pruned. 
[I 2026-03-12 02:19:02,108] Trial 761 finished with value: 0.0 and parameters: {'timeframe': 'mixed', 'atr_period': 13, 'atr_threshold': 15.0, 'pt_mult': 1.0, 'sl_mult': 5.0, 'td_mins': 720}. Best is trial 50 with value: 43.32685925026577.
[I 2026-03-12 02:19:02,257] Trial 762 pruned. 
[I 2026-03-12 02:19:05,316] Trial 763 pruned. 
[I 2026-03-12 02:19:05,984] Trial 764 pruned. 
[I 2026-03-12 02:19:06,120] Trial 765 pruned. 
[I 2026-03-12 02:19:06,292] Trial 766 finished with value: 0.0 and parameters: {'timeframe': 'mixed', 'atr_period': 13, 'atr_threshold': 15.0, 'pt_mult': 0.5, 'sl_mult': 1.0, 'td_mins': 5}. Best is trial 50 with value: 43.32685925026577.
[I 2026-03-12 02:19:07,356] Trial 767 finished with value: 43.32685925026577 and parameters: {'timeframe': 'mixed', 'atr_period': 13, 'atr_threshold': 5.0, 'pt_mult': 0.5, 'sl_mult': 5.0, 'td_mins': 1080}. Best is trial 50 with value: 43.32685925026577.
[I 2026-03-12 02:19:07,913] Trial 768 pruned. 
[I 2026-03-12 02:19:08,062] Trial 769 pruned. 
[I 2026-03-12 02:19:08,245] Trial 770 pruned. 
[I 2026-03-12 02:19:08,406] Trial 771 pruned. 
[I 2026-03-12 02:19:08,513] Trial 772 pruned. 
