[I 2026-03-12 01:33:49,002] Trial 655 finished with value: 2.318948203404773 and parameters: {'timeframe': 'M1', 'atr_period': 13, 'atr_threshold': 2.0, 'pt_mult': 0.5, 'sl_mult': 5.0, 'td_mins': 5}. Best is trial 337 with value: 2.318948203404773.
[I 2026-03-12 01:33:49,119] Trial 656 pruned. 
[I 2026-03-12 01:33:49,207] Trial 657 finished with value: 2.318948203404773 and parameters: {'timeframe': 'M1', 'atr_period': 13, 'atr_threshold': 2.0, 'pt_mult': 0.5, 'sl_mult': 5.0, 'td_mins': 5}. Best is trial 337 with value: 2.318948203404773.
[I 2026-03-12 01:33:49,298] Trial 658 finished with value: 2.318948203404773 and parameters: {'timeframe': 'M1', 'atr_period': 13, 'atr_threshold': 2.0, 'pt_mult': 0.5, 'sl_mult': 5.0, 'td_mins': 5}. Best is trial 337 with value: 2.318948203404773.
[I 2026-03-12 01:33:49,368] Trial 659 pruned. 
[I 2026-03-12 01:33:49,417] Trial 660 finished with value: 0.0 and parameters: {'timeframe': 'M1', 'atr_period': 13, 'atr_threshold': 8.0, 'pt_mult': 0.5, 'sl_mult': 0.5, 'td_mins': 15}. Best is trial 337 with value: 2.318948203404773.
[I 2026-03-12 01:33:49,503] Trial 661 finished with value: 2.318948203404773 and parameters: {'timeframe': 'M1', 'atr_period': 13, 'atr_threshold': 2.0, 'pt_mult': 0.5, 'sl_mult': 5.0, 'td_mins': 5}. Best is trial 337 with value: 2.318948203404773.
[I 2026-03-12 01:33:50,270] Trial 662 pruned. 
[I 2026-03-12 01:33:50,362] Trial 663 finished with value: 2.318948203404773 and parameters: {'timeframe': 'M1', 'atr_period': 13, 'atr_threshold': 2.0, 'pt_mult': 0.5, 'sl_mult': 5.0, 'td_mins': 5}. Best is trial 337 with value: 2.318948203404773.
[I 2026-03-12 01:33:50,411] Trial 664 finished with value: 0.0 and parameters: {'timeframe': 'M1', 'atr_period': 13, 'atr_threshold': 10.0, 'pt_mult': 2.5, 'sl_mult': 5.0, 'td_mins': 60}. Best is trial 337 with value: 2.318948203404773.
[I 2026-03-12 01:33:50,460] Trial 665 finished with value: 0.0 and parameters: {'timeframe': 'M1', 'atr_period': 13, 'atr_threshold': 15.0, 'pt_mult': 0.5, 'sl_mult': 0.5, 'td_mins': 360}. Best is trial 337 with value: 2.318948203404773.
[I 2026-03-12 01:33:50,551] Trial 666 finished with value: 2.318948203404773 and parameters: {'timeframe': 'M1', 'atr_period': 13, 'atr_threshold': 2.0, 'pt_mult': 0.5, 'sl_mult': 5.0, 'td_mins': 5}. Best is trial 337 with value: 2.318948203404773.
[I 2026-03-12 01:33:50,601] Trial 667 finished with value: 0.0 and parameters: {'timeframe': 'M1', 'atr_period': 13, 'atr_threshold': 15.0, 'pt_mult': 5.0, 'sl_mult': 5.0, 'td_mins': 15}. Best is trial 337 with value: 2.318948203404773.
[I 2026-03-12 01:33:50,692] Trial 668 pruned. 
[I 2026-03-12 01:33:50,766] Trial 669 pruned. 
[I 2026-03-12 01:33:50,817] Trial 670 finished with value: 0.0 and parameters: {'timeframe': 'M1', 'atr_period': 13, 'atr_threshold': 15.0, 'pt_mult': 0.5, 'sl_mult': 5.0, 'td_mins': 5}. Best is trial 337 with value: 2.318948203404773.
[I 2026-03-12 01:33:50,866] Trial 671 finished with value: 0.0 and parameters: {'timeframe': 'M1', 'atr_period': 13, 'atr_threshold': 10.0, 'pt_mult': 0.5, 'sl_mult': 1.0, 'td_mins': 5}. Best is trial 337 with value: 2.318948203404773.
[I 2026-03-12 01:33:50,952] Trial 672 finished with value: 2.318948203404773 and parameters: {'timeframe': 'M1', 'atr_period': 13, 'atr_threshold': 2.0, 'pt_mult': 0.5, 'sl_mult': 5.0, 'td_mins': 5}. Best is trial 337 with value: 2.318948203404773.
[I 2026-03-12 01:33:51,048] Trial 673 finished with value: 2.318948203404773 and parameters: {'timeframe': 'M1', 'atr_period': 13, 'atr_threshold': 2.0, 'pt_mult': 0.5, 'sl_mult': 5.0, 'td_mins': 5}. Best is trial 337 with value: 2.318948203404773.
[I 2026-03-12 01:33:51,144] Trial 674 finished with value: 2.318948203404773 and parameters: {'timeframe': 'M1', 'atr_period': 13, 'atr_threshold': 2.0, 'pt_mult': 0.5, 'sl_mult': 5.0, 'td_mins': 5}. Best is trial 337 with value: 2.318948203404773.
[I 2026-03-12 01:33:51,196] Trial 675 finished with value: 0.0 and parameters: {'timeframe': 'M1', 'atr_period': 13, 'atr_threshold': 5.0, 'pt_mult': 1.0, 'sl_mult': 0.5, 'td_mins': 30}. Best is trial 337 with value: 2.318948203404773.
[I 2026-03-12 01:33:51,245] Trial 676 finished with value: 0.0 and parameters: {'timeframe': 'M1', 'atr_period': 13, 'atr_threshold': 10.0, 'pt_mult': 1.0, 'sl_mult': 0.5, 'td_mins': 1080}. Best is trial 337 with value: 2.318948203404773.
[I 2026-03-12 01:33:55,016] Trial 677 pruned. 
[I 2026-03-12 01:33:55,124] Trial 678 finished with value: 2.318948203404773 and parameters: {'timeframe': 'M1', 'atr_period': 13, 'atr_threshold': 2.0, 'pt_mult': 0.5, 'sl_mult': 5.0, 'td_mins': 5}. Best is trial 337 with value: 2.318948203404773.
[I 2026-03-12 01:33:55,230] Trial 679 finished with value: 2.318948203404773 and parameters: {'timeframe': 'M1', 'atr_period': 13, 'atr_threshold': 2.0, 'pt_mult': 0.5, 'sl_mult': 5.0, 'td_mins': 5}. Best is trial 337 with value: 2.318948203404773.
[I 2026-03-12 01:33:55,284] Trial 680 finished with value: 0.0 and parameters: {'timeframe': 'M1', 'atr_period': 13, 'atr_threshold': 15.0, 'pt_mult': 1.0, 'sl_mult': 0.5, 'td_mins': 60}. Best is trial 337 with value: 2.318948203404773.
[I 2026-03-12 01:33:55,337] Trial 681 pruned. 
[I 2026-03-12 01:33:55,405] Trial 682 pruned. 
[I 2026-03-12 01:33:55,496] Trial 683 finished with value: 2.318948203404773 and parameters: {'timeframe': 'M1', 'atr_period': 13, 'atr_threshold': 2.0, 'pt_mult': 0.5, 'sl_mult': 5.0, 'td_mins': 5}. Best is trial 337 with value: 2.318948203404773.
[I 2026-03-12 01:33:55,544] Trial 684 finished with value: 0.0 and parameters: {'timeframe': 'M1', 'atr_period': 13, 'atr_threshold': 10.0, 'pt_mult': 0.5, 'sl_mult': 5.0, 'td_mins': 5}. Best is trial 337 with value: 2.318948203404773.
[I 2026-03-12 01:33:55,701] Trial 685 pruned. 
[I 2026-03-12 01:33:55,818] Trial 686 pruned. 
[I 2026-03-12 01:33:56,061] Trial 687 pruned. 
[I 2026-03-12 01:33:56,111] Trial 688 finished with value: 0.0 and parameters: {'timeframe': 'M1', 'atr_period': 13, 'atr_threshold': 5.0, 'pt_mult': 1.0, 'sl_mult': 5.0, 'td_mins': 5}. Best is trial 337 with value: 2.318948203404773.
[I 2026-03-12 01:33:57,106] Trial 689 pruned. 
[I 2026-03-12 01:33:57,158] Trial 690 finished with value: 0.0 and parameters: {'timeframe': 'M1', 'atr_period': 13, 'atr_threshold': 8.0, 'pt_mult': 0.5, 'sl_mult': 1.0, 'td_mins': 360}. Best is trial 337 with value: 2.318948203404773.
[I 2026-03-12 01:33:57,212] Trial 691 finished with value: 0.0 and parameters: {'timeframe': 'M1', 'atr_period': 13, 'atr_threshold': 10.0, 'pt_mult': 2.5, 'sl_mult': 2.5, 'td_mins': 1080}. Best is trial 337 with value: 2.318948203404773.
[I 2026-03-12 01:33:57,276] Trial 692 pruned. 
[I 2026-03-12 01:33:57,389] Trial 693 finished with value: 2.318948203404773 and parameters: {'timeframe': 'M1', 'atr_period': 13, 'atr_threshold': 2.0, 'pt_mult': 0.5, 'sl_mult': 5.0, 'td_mins': 5}. Best is trial 337 with value: 2.318948203404773.
[I 2026-03-12 01:33:57,453] Trial 694 pruned. 
[I 2026-03-12 01:33:57,624] Trial 695 pruned. 
[I 2026-03-12 01:33:57,680] Trial 696 finished with value: 0.0 and parameters: {'timeframe': 'M1', 'atr_period': 13, 'atr_threshold': 3.0, 'pt_mult': 0.5, 'sl_mult': 5.0, 'td_mins': 5}. Best is trial 337 with value: 2.318948203404773.
[I 2026-03-12 01:33:57,756] Trial 697 pruned. 
[I 2026-03-12 01:33:57,811] Trial 698 pruned. 
[I 2026-03-12 01:33:57,889] Trial 699 pruned. 
[I 2026-03-12 01:33:58,043] Trial 700 pruned. 
[I 2026-03-12 01:33:58,097] Trial 701 finished with value: 0.0 and parameters: {'timeframe': 'M1', 'atr_period': 13, 'atr_threshold': 15.0, 'pt_mult': 0.5, 'sl_mult': 1.0, 'td_mins': 120}. Best is trial 337 with value: 2.318948203404773.
[I 2026-03-12 01:33:58,179] Trial 702 pruned. 
[I 2026-03-12 01:33:58,741] Trial 703 pruned. 
[I 2026-03-12 01:33:58,862] Trial 704 pruned. 
[I 2026-03-12 01:33:58,951] Trial 705 finished with value: 2.318948203404773 and parameters: {'timeframe': 'M1', 'atr_period': 13, 'atr_threshold': 2.0, 'pt_mult': 0.5, 'sl_mult': 5.0, 'td_mins': 5}. Best is trial 337 with value: 2.318948203404773.
[I 2026-03-12 01:33:59,013] Trial 706 pruned. 
[I 2026-03-12 01:33:59,064] Trial 707 finished with value: 0.0 and parameters: {'timeframe': 'M1', 'atr_period': 13, 'atr_threshold': 15.0, 'pt_mult': 2.5, 'sl_mult': 0.5, 'td_mins': 1200}. Best is trial 337 with value: 2.318948203404773.
[I 2026-03-12 01:33:59,114] Trial 708 finished with value: 0.0 and parameters: {'timeframe': 'M1', 'atr_period': 13, 'atr_threshold': 5.0, 'pt_mult': 0.5, 'sl_mult': 5.0, 'td_mins': 5}. Best is trial 337 with value: 2.318948203404773.
[I 2026-03-12 01:33:59,705] Trial 709 pruned. 
[I 2026-03-12 01:33:59,802] Trial 710 finished with value: 2.318948203404773 and parameters: {'timeframe': 'M1', 'atr_period': 13, 'atr_threshold': 2.0, 'pt_mult': 0.5, 'sl_mult': 5.0, 'td_mins': 5}. Best is trial 337 with value: 2.318948203404773.
[I 2026-03-12 01:33:59,893] Trial 711 finished with value: 2.318948203404773 and parameters: {'timeframe': 'M1', 'atr_period': 13, 'atr_threshold': 2.0, 'pt_mult': 0.5, 'sl_mult': 5.0, 'td_mins': 5}. Best is trial 337 with value: 2.318948203404773.
[I 2026-03-12 01:33:59,946] Trial 712 finished with value: 0.0 and parameters: {'timeframe': 'M1', 'atr_period': 13, 'atr_threshold': 8.0, 'pt_mult': 0.5, 'sl_mult': 5.0, 'td_mins': 5}. Best is trial 337 with value: 2.318948203404773.
[I 2026-03-12 01:34:00,006] Trial 713 pruned. 
[I 2026-03-12 01:34:00,064] Trial 714 pruned. 
[I 2026-03-12 01:34:00,116] Trial 715 pruned. 
[I 2026-03-12 01:34:00,167] Trial 716 finished with value: 0.0 and parameters: {'timeframe': 'M1', 'atr_period': 13, 'atr_threshold': 10.0, 'pt_mult': 2.5, 'sl_mult': 0.5, 'td_mins': 360}. Best is trial 337 with value: 2.318948203404773.
[I 2026-03-12 01:34:00,218] Trial 717 finished with value: 0.0 and parameters: {'timeframe': 'M1', 'atr_period': 13, 'atr_threshold': 5.0, 'pt_mult': 2.5, 'sl_mult': 5.0, 'td_mins': 30}. Best is trial 337 with value: 2.318948203404773.
[I 2026-03-12 01:34:00,271] Trial 718 finished with value: 0.0 and parameters: {'timeframe': 'M1', 'atr_period': 13, 'atr_threshold': 8.0, 'pt_mult': 1.0, 'sl_mult': 5.0, 'td_mins': 720}. Best is trial 337 with value: 2.318948203404773.
[I 2026-03-12 01:34:00,320] Trial 719 finished with value: 0.0 and parameters: {'timeframe': 'M1', 'atr_period': 13, 'atr_threshold': 3.0, 'pt_mult': 0.5, 'sl_mult': 2.5, 'td_mins': 720}. Best is trial 337 with value: 2.318948203404773.
[I 2026-03-12 01:34:00,371] Trial 720 finished with value: 0.0 and parameters: {'timeframe': 'M1', 'atr_period': 13, 'atr_threshold': 8.0, 'pt_mult': 1.0, 'sl_mult': 0.5, 'td_mins': 180}. Best is trial 337 with value: 2.318948203404773.
[I 2026-03-12 01:34:00,461] Trial 721 finished with value: 2.318948203404773 and parameters: {'timeframe': 'M1', 'atr_period': 13, 'atr_threshold': 2.0, 'pt_mult': 0.5, 'sl_mult': 5.0, 'td_mins': 5}. Best is trial 337 with value: 2.318948203404773.
[I 2026-03-12 01:34:00,556] Trial 722 finished with value: 2.318948203404773 and parameters: {'timeframe': 'M1', 'atr_period': 13, 'atr_threshold': 2.0, 'pt_mult': 0.5, 'sl_mult': 5.0, 'td_mins': 5}. Best is trial 337 with value: 2.318948203404773.
[I 2026-03-12 01:34:00,622] Trial 723 pruned. 
[I 2026-03-12 01:34:00,729] Trial 724 pruned. 
[I 2026-03-12 01:34:00,779] Trial 725 finished with value: 0.0 and parameters: {'timeframe': 'M1', 'atr_period': 13, 'atr_threshold': 5.0, 'pt_mult': 0.5, 'sl_mult': 1.0, 'td_mins': 15}. Best is trial 337 with value: 2.318948203404773.
[I 2026-03-12 01:34:00,828] Trial 726 finished with value: 0.0 and parameters: {'timeframe': 'M1', 'atr_period': 13, 'atr_threshold': 15.0, 'pt_mult': 2.5, 'sl_mult': 1.0, 'td_mins': 1080}. Best is trial 337 with value: 2.318948203404773.
[I 2026-03-12 01:34:00,894] Trial 727 pruned. 
[I 2026-03-12 01:34:00,952] Trial 728 pruned. 
[I 2026-03-12 01:34:01,043] Trial 729 finished with value: 2.318948203404773 and parameters: {'timeframe': 'M1', 'atr_period': 13, 'atr_threshold': 2.0, 'pt_mult': 0.5, 'sl_mult': 5.0, 'td_mins': 5}. Best is trial 337 with value: 2.318948203404773.
[I 2026-03-12 01:34:01,132] Trial 730 finished with value: 2.318948203404773 and parameters: {'timeframe': 'M1', 'atr_period': 13, 'atr_threshold': 2.0, 'pt_mult': 0.5, 'sl_mult': 5.0, 'td_mins': 5}. Best is trial 337 with value: 2.318948203404773.
[I 2026-03-12 01:34:01,238] Trial 731 finished with value: 2.318948203404773 and parameters: {'timeframe': 'M1', 'atr_period': 13, 'atr_threshold': 2.0, 'pt_mult': 0.5, 'sl_mult': 5.0, 'td_mins': 5}. Best is trial 337 with value: 2.318948203404773.
[I 2026-03-12 01:34:01,327] Trial 732 finished with value: 2.318948203404773 and parameters: {'timeframe': 'M1', 'atr_period': 13, 'atr_threshold': 2.0, 'pt_mult': 0.5, 'sl_mult': 5.0, 'td_mins': 5}. Best is trial 337 with value: 2.318948203404773.
[I 2026-03-12 01:34:01,417] Trial 733 finished with value: 2.318948203404773 and parameters: {'timeframe': 'M1', 'atr_period': 13, 'atr_threshold': 2.0, 'pt_mult': 0.5, 'sl_mult': 5.0, 'td_mins': 5}. Best is trial 337 with value: 2.318948203404773.
[I 2026-03-12 01:34:01,505] Trial 734 finished with value: 2.318948203404773 and parameters: {'timeframe': 'M1', 'atr_period': 13, 'atr_threshold': 2.0, 'pt_mult': 0.5, 'sl_mult': 5.0, 'td_mins': 5}. Best is trial 337 with value: 2.318948203404773.
[I 2026-03-12 01:34:01,553] Trial 735 finished with value: 0.0 and parameters: {'timeframe': 'M1', 'atr_period': 13, 'atr_threshold': 15.0, 'pt_mult': 0.5, 'sl_mult': 5.0, 'td_mins': 60}. Best is trial 337 with value: 2.318948203404773.
[I 2026-03-12 01:34:01,602] Trial 736 finished with value: 0.0 and parameters: {'timeframe': 'M1', 'atr_period': 13, 'atr_threshold': 10.0, 'pt_mult': 1.0, 'sl_mult': 0.5, 'td_mins': 5}. Best is trial 337 with value: 2.318948203404773.
[I 2026-03-12 01:34:01,689] Trial 737 finished with value: 2.318948203404773 and parameters: {'timeframe': 'M1', 'atr_period': 13, 'atr_threshold': 2.0, 'pt_mult': 0.5, 'sl_mult': 5.0, 'td_mins': 5}. Best is trial 337 with value: 2.318948203404773.
[I 2026-03-12 01:34:01,779] Trial 738 finished with value: 2.318948203404773 and parameters: {'timeframe': 'M1', 'atr_period': 13, 'atr_threshold': 2.0, 'pt_mult': 0.5, 'sl_mult': 5.0, 'td_mins': 5}. Best is trial 337 with value: 2.318948203404773.
[I 2026-03-12 01:34:01,876] Trial 739 finished with value: 2.318948203404773 and parameters: {'timeframe': 'M1', 'atr_period': 13, 'atr_threshold': 2.0, 'pt_mult': 0.5, 'sl_mult': 5.0, 'td_mins': 5}. Best is trial 337 with value: 2.318948203404773.
[I 2026-03-12 01:34:01,966] Trial 740 finished with value: 2.318948203404773 and parameters: {'timeframe': 'M1', 'atr_period': 13, 'atr_threshold': 2.0, 'pt_mult': 0.5, 'sl_mult': 5.0, 'td_mins': 5}. Best is trial 337 with value: 2.318948203404773.
[I 2026-03-12 01:34:02,014] Trial 741 finished with value: 0.0 and parameters: {'timeframe': 'M1', 'atr_period': 13, 'atr_threshold': 8.0, 'pt_mult': 1.0, 'sl_mult': 0.5, 'td_mins': 15}. Best is trial 337 with value: 2.318948203404773.
[I 2026-03-12 01:34:02,062] Trial 742 finished with value: 0.0 and parameters: {'timeframe': 'M1', 'atr_period': 13, 'atr_threshold': 5.0, 'pt_mult': 0.5, 'sl_mult': 2.5, 'td_mins': 1200}. Best is trial 337 with value: 2.318948203404773.
[I 2026-03-12 01:34:02,110] Trial 743 finished with value: 0.0 and parameters: {'timeframe': 'M1', 'atr_period': 13, 'atr_threshold': 3.0, 'pt_mult': 5.0, 'sl_mult': 5.0, 'td_mins': 1080}. Best is trial 337 with value: 2.318948203404773.
[I 2026-03-12 01:34:02,196] Trial 744 finished with value: 2.318948203404773 and parameters: {'timeframe': 'M1', 'atr_period': 13, 'atr_threshold': 2.0, 'pt_mult': 0.5, 'sl_mult': 5.0, 'td_mins': 5}. Best is trial 337 with value: 2.318948203404773.
[I 2026-03-12 01:34:02,307] Trial 745 finished with value: 2.318948203404773 and parameters: {'timeframe': 'M1', 'atr_period': 13, 'atr_threshold': 2.0, 'pt_mult': 0.5, 'sl_mult': 5.0, 'td_mins': 5}. Best is trial 337 with value: 2.318948203404773.
[I 2026-03-12 01:34:02,408] Trial 746 pruned. 
[I 2026-03-12 01:34:03,079] Trial 747 pruned. 
[I 2026-03-12 01:34:03,171] Trial 748 finished with value: 2.318948203404773 and parameters: {'timeframe': 'M1', 'atr_period': 13, 'atr_threshold': 2.0, 'pt_mult': 0.5, 'sl_mult': 5.0, 'td_mins': 5}. Best is trial 337 with value: 2.318948203404773.
[I 2026-03-12 01:34:03,266] Trial 749 finished with value: 2.318948203404773 and parameters: {'timeframe': 'M1', 'atr_period': 13, 'atr_threshold': 2.0, 'pt_mult': 0.5, 'sl_mult': 5.0, 'td_mins': 5}. Best is trial 337 with value: 2.318948203404773.
[I 2026-03-12 01:34:03,321] Trial 750 finished with value: 0.0 and parameters: {'timeframe': 'M1', 'atr_period': 13, 'atr_threshold': 5.0, 'pt_mult': 0.5, 'sl_mult': 5.0, 'td_mins': 180}. Best is trial 337 with value: 2.318948203404773.
[I 2026-03-12 01:34:03,375] Trial 751 finished with value: 0.0 and parameters: {'timeframe': 'M1', 'atr_period': 13, 'atr_threshold': 15.0, 'pt_mult': 0.5, 'sl_mult': 5.0, 'td_mins': 120}. Best is trial 337 with value: 2.318948203404773.
[I 2026-03-12 01:34:03,426] Trial 752 finished with value: 0.0 and parameters: {'timeframe': 'M1', 'atr_period': 13, 'atr_threshold': 10.0, 'pt_mult': 2.5, 'sl_mult': 1.0, 'td_mins': 120}. Best is trial 337 with value: 2.318948203404773.
[I 2026-03-12 01:34:03,510] Trial 753 pruned. 
[I 2026-03-12 01:34:03,559] Trial 754 finished with value: 0.0 and parameters: {'timeframe': 'M1', 'atr_period': 13, 'atr_threshold': 15.0, 'pt_mult': 0.5, 'sl_mult': 5.0, 'td_mins': 5}. Best is trial 337 with value: 2.318948203404773.
[I 2026-03-12 01:34:03,647] Trial 755 finished with value: 2.318948203404773 and parameters: {'timeframe': 'M1', 'atr_period': 13, 'atr_threshold': 2.0, 'pt_mult': 0.5, 'sl_mult': 5.0, 'td_mins': 5}. Best is trial 337 with value: 2.318948203404773.
[I 2026-03-12 01:34:03,737] Trial 756 finished with value: 2.318948203404773 and parameters: {'timeframe': 'M1', 'atr_period': 13, 'atr_threshold': 2.0, 'pt_mult': 0.5, 'sl_mult': 5.0, 'td_mins': 5}. Best is trial 337 with value: 2.318948203404773.
[I 2026-03-12 01:34:03,789] Trial 757 finished with value: 0.0 and parameters: {'timeframe': 'M1', 'atr_period': 13, 'atr_threshold': 3.0, 'pt_mult': 0.5, 'sl_mult': 1.0, 'td_mins': 180}. Best is trial 337 with value: 2.318948203404773.
[I 2026-03-12 01:34:03,870] Trial 758 pruned. 
[I 2026-03-12 01:34:03,922] Trial 759 finished with value: 0.0 and parameters: {'timeframe': 'M1', 'atr_period': 13, 'atr_threshold': 3.0, 'pt_mult': 2.5, 'sl_mult': 5.0, 'td_mins': 60}. Best is trial 337 with value: 2.318948203404773.
[I 2026-03-12 01:34:04,012] Trial 760 finished with value: 2.318948203404773 and parameters: {'timeframe': 'M1', 'atr_period': 13, 'atr_threshold': 2.0, 'pt_mult': 0.5, 'sl_mult': 5.0, 'td_mins': 5}. Best is trial 337 with value: 2.318948203404773.
[I 2026-03-12 01:34:04,080] Trial 761 pruned. 
[I 2026-03-12 01:34:04,168] Trial 762 finished with value: 2.318948203404773 and parameters: {'timeframe': 'M1', 'atr_period': 13, 'atr_threshold': 2.0, 'pt_mult': 0.5, 'sl_mult': 5.0, 'td_mins': 5}. Best is trial 337 with value: 2.318948203404773.
[I 2026-03-12 01:34:04,218] Trial 763 finished with value: 0.0 and parameters: {'timeframe': 'M1', 'atr_period': 13, 'atr_threshold': 15.0, 'pt_mult': 5.0, 'sl_mult': 5.0, 'td_mins': 360}. Best is trial 337 with value: 2.318948203404773.
[I 2026-03-12 01:34:04,267] Trial 764 finished with value: 0.0 and parameters: {'timeframe': 'M1', 'atr_period': 13, 'atr_threshold': 10.0, 'pt_mult': 0.5, 'sl_mult': 5.0, 'td_mins': 1080}. Best is trial 337 with value: 2.318948203404773.
[I 2026-03-12 01:34:04,356] Trial 765 finished with value: 2.318948203404773 and parameters: {'timeframe': 'M1', 'atr_period': 13, 'atr_threshold': 2.0, 'pt_mult': 0.5, 'sl_mult': 5.0, 'td_mins': 5}. Best is trial 337 with value: 2.318948203404773.
[I 2026-03-12 01:34:04,443] Trial 766 pruned. 
[I 2026-03-12 01:34:04,504] Trial 767 pruned. 
[I 2026-03-12 01:34:04,561] Trial 768 pruned. 
[I 2026-03-12 01:34:04,614] Trial 769 finished with value: 0.0 and parameters: {'timeframe': 'M1', 'atr_period': 13, 'atr_threshold': 3.0, 'pt_mult': 2.5, 'sl_mult': 5.0, 'td_mins': 1200}. Best is trial 337 with value: 2.318948203404773.
[I 2026-03-12 01:34:04,664] Trial 770 finished with value: 0.0 and parameters: {'timeframe': 'M1', 'atr_period': 13, 'atr_threshold': 8.0, 'pt_mult': 0.5, 'sl_mult': 0.5, 'td_mins': 30}. Best is trial 337 with value: 2.318948203404773.
[I 2026-03-12 01:34:05,272] Trial 771 pruned. 
[I 2026-03-12 01:34:05,953] Trial 772 pruned. 
[I 2026-03-12 01:34:06,051] Trial 773 finished with value: 2.318948203404773 and parameters: {'timeframe': 'M1', 'atr_period': 13, 'atr_threshold': 2.0, 'pt_mult': 0.5, 'sl_mult': 5.0, 'td_mins': 5}. Best is trial 337 with value: 2.318948203404773.
[I 2026-03-12 01:34:06,104] Trial 774 pruned. 
[I 2026-03-12 01:34:06,154] Trial 775 finished with value: 0.0 and parameters: {'timeframe': 'M1', 'atr_period': 13, 'atr_threshold': 10.0, 'pt_mult': 5.0, 'sl_mult': 5.0, 'td_mins': 60}. Best is trial 337 with value: 2.318948203404773.
[I 2026-03-12 01:34:06,208] Trial 776 pruned. 
[I 2026-03-12 01:34:06,297] Trial 777 finished with value: 2.318948203404773 and parameters: {'timeframe': 'M1', 'atr_period': 13, 'atr_threshold': 2.0, 'pt_mult': 0.5, 'sl_mult': 5.0, 'td_mins': 5}. Best is trial 337 with value: 2.318948203404773.
[I 2026-03-12 01:34:06,760] Trial 778 pruned. 
[I 2026-03-12 01:34:06,813] Trial 779 finished with value: 0.0 and parameters: {'timeframe': 'M1', 'atr_period': 13, 'atr_threshold': 10.0, 'pt_mult': 0.5, 'sl_mult': 5.0, 'td_mins': 5}. Best is trial 337 with value: 2.318948203404773.
[I 2026-03-12 01:34:06,866] Trial 780 finished with value: 0.0 and parameters: {'timeframe': 'M1', 'atr_period': 13, 'atr_threshold': 5.0, 'pt_mult': 1.0, 'sl_mult': 2.5, 'td_mins': 360}. Best is trial 337 with value: 2.318948203404773.
