[I 2026-03-12 01:32:11,900] Trial 165 finished with value: 0.0 and parameters: {'timeframe': 'M1', 'atr_period': 13, 'atr_threshold': 3.0, 'pt_mult': 5.0, 'sl_mult': 0.5, 'td_mins': 1080}. Best is trial 96 with value: 1.9675745537951908.
[I 2026-03-12 01:32:12,415] Trial 166 finished with value: 1.6981361338358856 and parameters: {'timeframe': 'M1', 'atr_period': 13, 'atr_threshold': 1.0, 'pt_mult': 1.0, 'sl_mult': 5.0, 'td_mins': 15}. Best is trial 96 with value: 1.9675745537951908.
[I 2026-03-12 01:32:12,469] Trial 167 finished with value: 0.0 and parameters: {'timeframe': 'M1', 'atr_period': 13, 'atr_threshold': 8.0, 'pt_mult': 5.0, 'sl_mult': 5.0, 'td_mins': 1200}. Best is trial 96 with value: 1.9675745537951908.
[I 2026-03-12 01:32:12,525] Trial 168 finished with value: 0.0 and parameters: {'timeframe': 'M1', 'atr_period': 13, 'atr_threshold': 15.0, 'pt_mult': 5.0, 'sl_mult': 0.5, 'td_mins': 1080}. Best is trial 96 with value: 1.9675745537951908.
[I 2026-03-12 01:32:12,843] Trial 169 finished with value: 1.1667601274994768 and parameters: {'timeframe': 'M1', 'atr_period': 13, 'atr_threshold': 2.0, 'pt_mult': 2.5, 'sl_mult': 0.5, 'td_mins': 120}. Best is trial 96 with value: 1.9675745537951908.
[I 2026-03-12 01:32:12,944] Trial 170 pruned. 
[I 2026-03-12 01:32:13,016] Trial 171 finished with value: 0.0 and parameters: {'timeframe': 'M1', 'atr_period': 13, 'atr_threshold': 3.0, 'pt_mult': 2.5, 'sl_mult': 1.0, 'td_mins': 1200}. Best is trial 96 with value: 1.9675745537951908.
[I 2026-03-12 01:32:13,081] Trial 172 finished with value: 0.0 and parameters: {'timeframe': 'M1', 'atr_period': 13, 'atr_threshold': 3.0, 'pt_mult': 1.0, 'sl_mult': 2.5, 'td_mins': 60}. Best is trial 96 with value: 1.9675745537951908.
[I 2026-03-12 01:32:18,218] Trial 173 pruned. 
[I 2026-03-12 01:32:18,273] Trial 174 finished with value: 0.0 and parameters: {'timeframe': 'M1', 'atr_period': 13, 'atr_threshold': 10.0, 'pt_mult': 0.5, 'sl_mult': 2.5, 'td_mins': 180}. Best is trial 96 with value: 1.9675745537951908.
[I 2026-03-12 01:32:19,613] Trial 175 pruned. 
[I 2026-03-12 01:32:19,667] Trial 176 finished with value: 0.0 and parameters: {'timeframe': 'M1', 'atr_period': 13, 'atr_threshold': 8.0, 'pt_mult': 5.0, 'sl_mult': 2.5, 'td_mins': 360}. Best is trial 96 with value: 1.9675745537951908.
[I 2026-03-12 01:32:19,725] Trial 177 finished with value: 0.0 and parameters: {'timeframe': 'M1', 'atr_period': 13, 'atr_threshold': 5.0, 'pt_mult': 5.0, 'sl_mult': 5.0, 'td_mins': 1200}. Best is trial 96 with value: 1.9675745537951908.
[I 2026-03-12 01:32:20,845] Trial 178 pruned. 
[I 2026-03-12 01:32:22,837] Trial 179 finished with value: 1.0751982113487224 and parameters: {'timeframe': 'M1', 'atr_period': 13, 'atr_threshold': 1.0, 'pt_mult': 2.5, 'sl_mult': 0.5, 'td_mins': 360}. Best is trial 96 with value: 1.9675745537951908.
[I 2026-03-12 01:32:22,909] Trial 180 pruned. 
[I 2026-03-12 01:32:22,956] Trial 181 finished with value: 0.0 and parameters: {'timeframe': 'M1', 'atr_period': 13, 'atr_threshold': 8.0, 'pt_mult': 1.0, 'sl_mult': 5.0, 'td_mins': 15}. Best is trial 96 with value: 1.9675745537951908.
[I 2026-03-12 01:32:23,002] Trial 182 finished with value: 0.0 and parameters: {'timeframe': 'M1', 'atr_period': 13, 'atr_threshold': 3.0, 'pt_mult': 2.5, 'sl_mult': 1.0, 'td_mins': 15}. Best is trial 96 with value: 1.9675745537951908.
[I 2026-03-12 01:32:23,046] Trial 183 finished with value: 0.0 and parameters: {'timeframe': 'M1', 'atr_period': 13, 'atr_threshold': 15.0, 'pt_mult': 2.5, 'sl_mult': 5.0, 'td_mins': 1080}. Best is trial 96 with value: 1.9675745537951908.
[I 2026-03-12 01:32:23,091] Trial 184 finished with value: 0.0 and parameters: {'timeframe': 'M1', 'atr_period': 13, 'atr_threshold': 3.0, 'pt_mult': 5.0, 'sl_mult': 2.5, 'td_mins': 15}. Best is trial 96 with value: 1.9675745537951908.
[I 2026-03-12 01:32:23,136] Trial 185 finished with value: 0.0 and parameters: {'timeframe': 'M1', 'atr_period': 13, 'atr_threshold': 15.0, 'pt_mult': 2.5, 'sl_mult': 0.5, 'td_mins': 720}. Best is trial 96 with value: 1.9675745537951908.
[I 2026-03-12 01:32:23,221] Trial 186 pruned. 
[I 2026-03-12 01:32:23,266] Trial 187 finished with value: 0.0 and parameters: {'timeframe': 'M1', 'atr_period': 13, 'atr_threshold': 5.0, 'pt_mult': 2.5, 'sl_mult': 5.0, 'td_mins': 1080}. Best is trial 96 with value: 1.9675745537951908.
[I 2026-03-12 01:32:23,384] Trial 188 pruned. 
[I 2026-03-12 01:32:23,431] Trial 189 finished with value: 0.0 and parameters: {'timeframe': 'M1', 'atr_period': 13, 'atr_threshold': 8.0, 'pt_mult': 5.0, 'sl_mult': 2.5, 'td_mins': 60}. Best is trial 96 with value: 1.9675745537951908.
[I 2026-03-12 01:32:23,475] Trial 190 finished with value: 0.0 and parameters: {'timeframe': 'M1', 'atr_period': 13, 'atr_threshold': 3.0, 'pt_mult': 1.0, 'sl_mult': 2.5, 'td_mins': 30}. Best is trial 96 with value: 1.9675745537951908.
[I 2026-03-12 01:32:23,524] Trial 191 finished with value: 0.0 and parameters: {'timeframe': 'M1', 'atr_period': 13, 'atr_threshold': 15.0, 'pt_mult': 1.0, 'sl_mult': 1.0, 'td_mins': 1080}. Best is trial 96 with value: 1.9675745537951908.
[I 2026-03-12 01:32:23,569] Trial 192 finished with value: 0.0 and parameters: {'timeframe': 'M1', 'atr_period': 13, 'atr_threshold': 5.0, 'pt_mult': 5.0, 'sl_mult': 5.0, 'td_mins': 180}. Best is trial 96 with value: 1.9675745537951908.
[I 2026-03-12 01:32:23,613] Trial 193 finished with value: 0.0 and parameters: {'timeframe': 'M1', 'atr_period': 13, 'atr_threshold': 15.0, 'pt_mult': 5.0, 'sl_mult': 2.5, 'td_mins': 360}. Best is trial 96 with value: 1.9675745537951908.
[I 2026-03-12 01:32:23,662] Trial 194 finished with value: 0.0 and parameters: {'timeframe': 'M1', 'atr_period': 13, 'atr_threshold': 5.0, 'pt_mult': 1.0, 'sl_mult': 0.5, 'td_mins': 180}. Best is trial 96 with value: 1.9675745537951908.
[I 2026-03-12 01:32:24,183] Trial 195 pruned. 
[I 2026-03-12 01:32:24,233] Trial 196 finished with value: 0.0 and parameters: {'timeframe': 'M1', 'atr_period': 13, 'atr_threshold': 3.0, 'pt_mult': 2.5, 'sl_mult': 0.5, 'td_mins': 720}. Best is trial 96 with value: 1.9675745537951908.
[I 2026-03-12 01:32:24,279] Trial 197 finished with value: 0.0 and parameters: {'timeframe': 'M1', 'atr_period': 13, 'atr_threshold': 15.0, 'pt_mult': 0.5, 'sl_mult': 2.5, 'td_mins': 5}. Best is trial 96 with value: 1.9675745537951908.
[I 2026-03-12 01:32:24,328] Trial 198 finished with value: 0.0 and parameters: {'timeframe': 'M1', 'atr_period': 13, 'atr_threshold': 15.0, 'pt_mult': 5.0, 'sl_mult': 5.0, 'td_mins': 5}. Best is trial 96 with value: 1.9675745537951908.
[I 2026-03-12 01:32:24,373] Trial 199 finished with value: 0.0 and parameters: {'timeframe': 'M1', 'atr_period': 13, 'atr_threshold': 8.0, 'pt_mult': 0.5, 'sl_mult': 5.0, 'td_mins': 360}. Best is trial 96 with value: 1.9675745537951908.
[I 2026-03-12 01:32:24,416] Trial 200 finished with value: 0.0 and parameters: {'timeframe': 'M1', 'atr_period': 13, 'atr_threshold': 8.0, 'pt_mult': 1.0, 'sl_mult': 1.0, 'td_mins': 5}. Best is trial 96 with value: 1.9675745537951908.
[I 2026-03-12 01:32:24,461] Trial 201 finished with value: 0.0 and parameters: {'timeframe': 'M1', 'atr_period': 13, 'atr_threshold': 10.0, 'pt_mult': 5.0, 'sl_mult': 1.0, 'td_mins': 30}. Best is trial 96 with value: 1.9675745537951908.
[I 2026-03-12 01:32:24,505] Trial 202 finished with value: 0.0 and parameters: {'timeframe': 'M1', 'atr_period': 13, 'atr_threshold': 10.0, 'pt_mult': 5.0, 'sl_mult': 5.0, 'td_mins': 180}. Best is trial 96 with value: 1.9675745537951908.
[I 2026-03-12 01:32:24,749] Trial 203 pruned. 
[I 2026-03-12 01:32:26,921] Trial 204 pruned. 
[I 2026-03-12 01:32:26,976] Trial 205 finished with value: 0.0 and parameters: {'timeframe': 'M1', 'atr_period': 13, 'atr_threshold': 3.0, 'pt_mult': 2.5, 'sl_mult': 2.5, 'td_mins': 30}. Best is trial 96 with value: 1.9675745537951908.
[I 2026-03-12 01:32:27,229] Trial 206 pruned. 
[I 2026-03-12 01:32:27,275] Trial 207 finished with value: 0.0 and parameters: {'timeframe': 'M1', 'atr_period': 13, 'atr_threshold': 15.0, 'pt_mult': 2.5, 'sl_mult': 5.0, 'td_mins': 30}. Best is trial 96 with value: 1.9675745537951908.
[I 2026-03-12 01:32:27,321] Trial 208 finished with value: 0.0 and parameters: {'timeframe': 'M1', 'atr_period': 13, 'atr_threshold': 10.0, 'pt_mult': 5.0, 'sl_mult': 5.0, 'td_mins': 1200}. Best is trial 96 with value: 1.9675745537951908.
[I 2026-03-12 01:32:27,367] Trial 209 finished with value: 0.0 and parameters: {'timeframe': 'M1', 'atr_period': 13, 'atr_threshold': 8.0, 'pt_mult': 5.0, 'sl_mult': 1.0, 'td_mins': 15}. Best is trial 96 with value: 1.9675745537951908.
[I 2026-03-12 01:32:27,541] Trial 210 pruned. 
[I 2026-03-12 01:32:27,588] Trial 211 finished with value: 0.0 and parameters: {'timeframe': 'M1', 'atr_period': 13, 'atr_threshold': 10.0, 'pt_mult': 1.0, 'sl_mult': 2.5, 'td_mins': 60}. Best is trial 96 with value: 1.9675745537951908.
[I 2026-03-12 01:32:36,224] Trial 212 finished with value: 1.078314124986792 and parameters: {'timeframe': 'M1', 'atr_period': 13, 'atr_threshold': 0.5, 'pt_mult': 2.5, 'sl_mult': 0.5, 'td_mins': 1200}. Best is trial 96 with value: 1.9675745537951908.
[I 2026-03-12 01:32:36,274] Trial 213 finished with value: 0.0 and parameters: {'timeframe': 'M1', 'atr_period': 13, 'atr_threshold': 3.0, 'pt_mult': 1.0, 'sl_mult': 5.0, 'td_mins': 15}. Best is trial 96 with value: 1.9675745537951908.
[I 2026-03-12 01:32:38,948] Trial 214 pruned. 
[I 2026-03-12 01:32:39,284] Trial 215 pruned. 
[I 2026-03-12 01:32:39,947] Trial 216 finished with value: 1.2857308759893562 and parameters: {'timeframe': 'M1', 'atr_period': 13, 'atr_threshold': 1.0, 'pt_mult': 0.5, 'sl_mult': 5.0, 'td_mins': 30}. Best is trial 96 with value: 1.9675745537951908.
[I 2026-03-12 01:32:40,054] Trial 217 pruned. 
[I 2026-03-12 01:32:40,129] Trial 218 pruned. 
[I 2026-03-12 01:32:40,186] Trial 219 pruned. 
[I 2026-03-12 01:32:40,760] Trial 220 pruned. 
[I 2026-03-12 01:32:40,809] Trial 221 finished with value: 0.0 and parameters: {'timeframe': 'M1', 'atr_period': 13, 'atr_threshold': 3.0, 'pt_mult': 0.5, 'sl_mult': 5.0, 'td_mins': 180}. Best is trial 96 with value: 1.9675745537951908.
[I 2026-03-12 01:32:40,858] Trial 222 finished with value: 0.0 and parameters: {'timeframe': 'M1', 'atr_period': 13, 'atr_threshold': 8.0, 'pt_mult': 0.5, 'sl_mult': 5.0, 'td_mins': 15}. Best is trial 96 with value: 1.9675745537951908.
[I 2026-03-12 01:32:40,905] Trial 223 finished with value: 0.0 and parameters: {'timeframe': 'M1', 'atr_period': 13, 'atr_threshold': 15.0, 'pt_mult': 1.0, 'sl_mult': 0.5, 'td_mins': 180}. Best is trial 96 with value: 1.9675745537951908.
[I 2026-03-12 01:32:40,949] Trial 224 finished with value: 0.0 and parameters: {'timeframe': 'M1', 'atr_period': 13, 'atr_threshold': 5.0, 'pt_mult': 0.5, 'sl_mult': 1.0, 'td_mins': 60}. Best is trial 96 with value: 1.9675745537951908.
[I 2026-03-12 01:32:41,328] Trial 225 finished with value: 1.112569542667418 and parameters: {'timeframe': 'M1', 'atr_period': 13, 'atr_threshold': 2.0, 'pt_mult': 1.0, 'sl_mult': 0.5, 'td_mins': 720}. Best is trial 96 with value: 1.9675745537951908.
[I 2026-03-12 01:32:41,380] Trial 226 finished with value: 0.0 and parameters: {'timeframe': 'M1', 'atr_period': 13, 'atr_threshold': 15.0, 'pt_mult': 1.0, 'sl_mult': 0.5, 'td_mins': 720}. Best is trial 96 with value: 1.9675745537951908.
[I 2026-03-12 01:32:41,502] Trial 227 pruned. 
[I 2026-03-12 01:32:41,546] Trial 228 finished with value: 0.0 and parameters: {'timeframe': 'M1', 'atr_period': 13, 'atr_threshold': 5.0, 'pt_mult': 5.0, 'sl_mult': 5.0, 'td_mins': 360}. Best is trial 96 with value: 1.9675745537951908.
[I 2026-03-12 01:32:41,665] Trial 229 pruned. 
[I 2026-03-12 01:32:41,709] Trial 230 finished with value: 0.0 and parameters: {'timeframe': 'M1', 'atr_period': 13, 'atr_threshold': 10.0, 'pt_mult': 2.5, 'sl_mult': 1.0, 'td_mins': 720}. Best is trial 96 with value: 1.9675745537951908.
[I 2026-03-12 01:32:42,198] Trial 231 pruned. 
[I 2026-03-12 01:32:42,248] Trial 232 finished with value: 0.0 and parameters: {'timeframe': 'M1', 'atr_period': 13, 'atr_threshold': 15.0, 'pt_mult': 1.0, 'sl_mult': 1.0, 'td_mins': 15}. Best is trial 96 with value: 1.9675745537951908.
[I 2026-03-12 01:32:42,306] Trial 233 finished with value: 0.0 and parameters: {'timeframe': 'M1', 'atr_period': 13, 'atr_threshold': 15.0, 'pt_mult': 0.5, 'sl_mult': 2.5, 'td_mins': 120}. Best is trial 96 with value: 1.9675745537951908.
[I 2026-03-12 01:32:42,358] Trial 234 finished with value: 0.0 and parameters: {'timeframe': 'M1', 'atr_period': 13, 'atr_threshold': 5.0, 'pt_mult': 5.0, 'sl_mult': 5.0, 'td_mins': 30}. Best is trial 96 with value: 1.9675745537951908.
[I 2026-03-12 01:32:42,655] Trial 235 pruned. 
[I 2026-03-12 01:32:42,755] Trial 236 pruned. 
[I 2026-03-12 01:32:42,802] Trial 237 finished with value: 0.0 and parameters: {'timeframe': 'M1', 'atr_period': 13, 'atr_threshold': 5.0, 'pt_mult': 0.5, 'sl_mult': 5.0, 'td_mins': 15}. Best is trial 96 with value: 1.9675745537951908.
[I 2026-03-12 01:32:43,055] Trial 238 pruned. 
[I 2026-03-12 01:32:45,007] Trial 239 pruned. 
[I 2026-03-12 01:32:45,060] Trial 240 finished with value: 0.0 and parameters: {'timeframe': 'M1', 'atr_period': 13, 'atr_threshold': 3.0, 'pt_mult': 1.0, 'sl_mult': 5.0, 'td_mins': 60}. Best is trial 96 with value: 1.9675745537951908.
[I 2026-03-12 01:32:45,117] Trial 241 pruned. 
[I 2026-03-12 01:32:45,167] Trial 242 finished with value: 0.0 and parameters: {'timeframe': 'M1', 'atr_period': 13, 'atr_threshold': 10.0, 'pt_mult': 2.5, 'sl_mult': 5.0, 'td_mins': 1200}. Best is trial 96 with value: 1.9675745537951908.
[I 2026-03-12 01:32:45,217] Trial 243 finished with value: 0.0 and parameters: {'timeframe': 'M1', 'atr_period': 13, 'atr_threshold': 8.0, 'pt_mult': 2.5, 'sl_mult': 2.5, 'td_mins': 720}. Best is trial 96 with value: 1.9675745537951908.
[I 2026-03-12 01:32:45,266] Trial 244 finished with value: 0.0 and parameters: {'timeframe': 'M1', 'atr_period': 13, 'atr_threshold': 8.0, 'pt_mult': 1.0, 'sl_mult': 2.5, 'td_mins': 1080}. Best is trial 96 with value: 1.9675745537951908.
[I 2026-03-12 01:32:45,421] Trial 245 pruned. 
[I 2026-03-12 01:32:45,782] Trial 246 pruned. 
[I 2026-03-12 01:32:45,832] Trial 247 finished with value: 0.0 and parameters: {'timeframe': 'M1', 'atr_period': 13, 'atr_threshold': 8.0, 'pt_mult': 2.5, 'sl_mult': 1.0, 'td_mins': 30}. Best is trial 96 with value: 1.9675745537951908.
[I 2026-03-12 01:32:45,884] Trial 248 finished with value: 0.0 and parameters: {'timeframe': 'M1', 'atr_period': 13, 'atr_threshold': 8.0, 'pt_mult': 2.5, 'sl_mult': 2.5, 'td_mins': 15}. Best is trial 96 with value: 1.9675745537951908.
[I 2026-03-12 01:32:45,933] Trial 249 finished with value: 0.0 and parameters: {'timeframe': 'M1', 'atr_period': 13, 'atr_threshold': 10.0, 'pt_mult': 1.0, 'sl_mult': 1.0, 'td_mins': 1080}. Best is trial 96 with value: 1.9675745537951908.
[I 2026-03-12 01:32:45,982] Trial 250 finished with value: 0.0 and parameters: {'timeframe': 'M1', 'atr_period': 13, 'atr_threshold': 15.0, 'pt_mult': 5.0, 'sl_mult': 0.5, 'td_mins': 30}. Best is trial 96 with value: 1.9675745537951908.
[I 2026-03-12 01:32:46,027] Trial 251 finished with value: 0.0 and parameters: {'timeframe': 'M1', 'atr_period': 13, 'atr_threshold': 8.0, 'pt_mult': 5.0, 'sl_mult': 1.0, 'td_mins': 180}. Best is trial 96 with value: 1.9675745537951908.
[I 2026-03-12 01:32:46,069] Trial 252 finished with value: 0.0 and parameters: {'timeframe': 'M1', 'atr_period': 13, 'atr_threshold': 5.0, 'pt_mult': 5.0, 'sl_mult': 1.0, 'td_mins': 360}. Best is trial 96 with value: 1.9675745537951908.
[I 2026-03-12 01:32:46,114] Trial 253 finished with value: 0.0 and parameters: {'timeframe': 'M1', 'atr_period': 13, 'atr_threshold': 15.0, 'pt_mult': 1.0, 'sl_mult': 2.5, 'td_mins': 15}. Best is trial 96 with value: 1.9675745537951908.
[I 2026-03-12 01:32:46,300] Trial 254 pruned. 
[I 2026-03-12 01:32:47,397] Trial 255 pruned. 
[I 2026-03-12 01:32:47,522] Trial 256 pruned. 
[I 2026-03-12 01:32:52,069] Trial 257 finished with value: 1.078314124986792 and parameters: {'timeframe': 'M1', 'atr_period': 13, 'atr_threshold': 0.5, 'pt_mult': 2.5, 'sl_mult': 0.5, 'td_mins': 360}. Best is trial 96 with value: 1.9675745537951908.
[I 2026-03-12 01:32:52,235] Trial 258 pruned. 
[I 2026-03-12 01:32:52,291] Trial 259 finished with value: 0.0 and parameters: {'timeframe': 'M1', 'atr_period': 13, 'atr_threshold': 15.0, 'pt_mult': 5.0, 'sl_mult': 1.0, 'td_mins': 120}. Best is trial 96 with value: 1.9675745537951908.
[I 2026-03-12 01:32:52,354] Trial 260 finished with value: 0.0 and parameters: {'timeframe': 'M1', 'atr_period': 13, 'atr_threshold': 8.0, 'pt_mult': 5.0, 'sl_mult': 0.5, 'td_mins': 360}. Best is trial 96 with value: 1.9675745537951908.
[I 2026-03-12 01:32:52,416] Trial 261 finished with value: 0.0 and parameters: {'timeframe': 'M1', 'atr_period': 13, 'atr_threshold': 5.0, 'pt_mult': 0.5, 'sl_mult': 1.0, 'td_mins': 360}. Best is trial 96 with value: 1.9675745537951908.
[I 2026-03-12 01:32:53,134] Trial 262 pruned. 
[I 2026-03-12 01:32:53,185] Trial 263 finished with value: 0.0 and parameters: {'timeframe': 'M1', 'atr_period': 13, 'atr_threshold': 8.0, 'pt_mult': 2.5, 'sl_mult': 0.5, 'td_mins': 60}. Best is trial 96 with value: 1.9675745537951908.
[I 2026-03-12 01:32:53,274] Trial 264 pruned. 
[I 2026-03-12 01:32:53,321] Trial 265 finished with value: 0.0 and parameters: {'timeframe': 'M1', 'atr_period': 13, 'atr_threshold': 15.0, 'pt_mult': 0.5, 'sl_mult': 1.0, 'td_mins': 15}. Best is trial 96 with value: 1.9675745537951908.
[I 2026-03-12 01:32:53,365] Trial 266 finished with value: 0.0 and parameters: {'timeframe': 'M1', 'atr_period': 13, 'atr_threshold': 10.0, 'pt_mult': 2.5, 'sl_mult': 1.0, 'td_mins': 30}. Best is trial 96 with value: 1.9675745537951908.
[I 2026-03-12 01:32:53,412] Trial 267 finished with value: 0.0 and parameters: {'timeframe': 'M1', 'atr_period': 13, 'atr_threshold': 10.0, 'pt_mult': 1.0, 'sl_mult': 5.0, 'td_mins': 360}. Best is trial 96 with value: 1.9675745537951908.
[I 2026-03-12 01:32:53,466] Trial 268 pruned. 
[I 2026-03-12 01:32:53,979] Trial 269 pruned. 
[I 2026-03-12 01:32:54,244] Trial 270 pruned. 
[I 2026-03-12 01:32:54,473] Trial 271 pruned. 
[I 2026-03-12 01:32:54,520] Trial 272 finished with value: 0.0 and parameters: {'timeframe': 'M1', 'atr_period': 13, 'atr_threshold': 15.0, 'pt_mult': 0.5, 'sl_mult': 5.0, 'td_mins': 5}. Best is trial 96 with value: 1.9675745537951908.
[I 2026-03-12 01:32:54,568] Trial 273 finished with value: 0.0 and parameters: {'timeframe': 'M1', 'atr_period': 13, 'atr_threshold': 3.0, 'pt_mult': 1.0, 'sl_mult': 0.5, 'td_mins': 360}. Best is trial 96 with value: 1.9675745537951908.
[I 2026-03-12 01:32:54,654] Trial 274 finished with value: 1.8029492832408522 and parameters: {'timeframe': 'M1', 'atr_period': 13, 'atr_threshold': 2.0, 'pt_mult': 1.0, 'sl_mult': 5.0, 'td_mins': 5}. Best is trial 96 with value: 1.9675745537951908.
[I 2026-03-12 01:32:54,699] Trial 275 finished with value: 0.0 and parameters: {'timeframe': 'M1', 'atr_period': 13, 'atr_threshold': 5.0, 'pt_mult': 2.5, 'sl_mult': 2.5, 'td_mins': 1080}. Best is trial 96 with value: 1.9675745537951908.
[I 2026-03-12 01:32:54,895] Trial 276 pruned. 
[I 2026-03-12 01:32:55,740] Trial 277 pruned. 
[I 2026-03-12 01:32:56,545] Trial 278 pruned. 
[I 2026-03-12 01:32:57,143] Trial 279 pruned. 
[I 2026-03-12 01:32:57,191] Trial 280 finished with value: 0.0 and parameters: {'timeframe': 'M1', 'atr_period': 13, 'atr_threshold': 8.0, 'pt_mult': 2.5, 'sl_mult': 0.5, 'td_mins': 360}. Best is trial 96 with value: 1.9675745537951908.
[I 2026-03-12 01:32:57,245] Trial 281 finished with value: 0.0 and parameters: {'timeframe': 'M1', 'atr_period': 13, 'atr_threshold': 3.0, 'pt_mult': 1.0, 'sl_mult': 2.5, 'td_mins': 1200}. Best is trial 96 with value: 1.9675745537951908.
[I 2026-03-12 01:32:57,403] Trial 282 pruned. 
[I 2026-03-12 01:32:57,454] Trial 283 finished with value: 0.0 and parameters: {'timeframe': 'M1', 'atr_period': 13, 'atr_threshold': 5.0, 'pt_mult': 0.5, 'sl_mult': 5.0, 'td_mins': 360}. Best is trial 96 with value: 1.9675745537951908.
[I 2026-03-12 01:32:57,508] Trial 284 finished with value: 0.0 and parameters: {'timeframe': 'M1', 'atr_period': 13, 'atr_threshold': 5.0, 'pt_mult': 5.0, 'sl_mult': 1.0, 'td_mins': 1080}. Best is trial 96 with value: 1.9675745537951908.
[I 2026-03-12 01:32:58,076] Trial 285 finished with value: 1.112569542667418 and parameters: {'timeframe': 'M1', 'atr_period': 13, 'atr_threshold': 2.0, 'pt_mult': 1.0, 'sl_mult': 0.5, 'td_mins': 1200}. Best is trial 96 with value: 1.9675745537951908.
[I 2026-03-12 01:32:58,122] Trial 286 finished with value: 0.0 and parameters: {'timeframe': 'M1', 'atr_period': 13, 'atr_threshold': 3.0, 'pt_mult': 0.5, 'sl_mult': 1.0, 'td_mins': 1200}. Best is trial 96 with value: 1.9675745537951908.
[I 2026-03-12 01:32:58,168] Trial 287 finished with value: 0.0 and parameters: {'timeframe': 'M1', 'atr_period': 13, 'atr_threshold': 15.0, 'pt_mult': 2.5, 'sl_mult': 5.0, 'td_mins': 180}. Best is trial 96 with value: 1.9675745537951908.
[I 2026-03-12 01:32:58,847] Trial 288 pruned. 
[I 2026-03-12 01:32:58,896] Trial 289 finished with value: 0.0 and parameters: {'timeframe': 'M1', 'atr_period': 13, 'atr_threshold': 3.0, 'pt_mult': 0.5, 'sl_mult': 1.0, 'td_mins': 360}. Best is trial 96 with value: 1.9675745537951908.
[I 2026-03-12 01:32:58,944] Trial 290 finished with value: 0.0 and parameters: {'timeframe': 'M1', 'atr_period': 13, 'atr_threshold': 8.0, 'pt_mult': 0.5, 'sl_mult': 2.5, 'td_mins': 5}. Best is trial 96 with value: 1.9675745537951908.
[I 2026-03-12 01:32:59,085] Trial 291 pruned. 
[I 2026-03-12 01:32:59,133] Trial 292 finished with value: 0.0 and parameters: {'timeframe': 'M1', 'atr_period': 13, 'atr_threshold': 8.0, 'pt_mult': 2.5, 'sl_mult': 0.5, 'td_mins': 720}. Best is trial 96 with value: 1.9675745537951908.
