[I 2026-03-12 02:10:47,067] Trial 252 finished with value: 0.0 and parameters: {'timeframe': 'mixed', 'atr_period': 13, 'atr_threshold': 15.0, 'pt_mult': 0.5, 'sl_mult': 0.5, 'td_mins': 1200}. Best is trial 50 with value: 43.32685925026577.
[I 2026-03-12 02:10:47,165] Trial 253 pruned. 
[I 2026-03-12 02:10:47,346] Trial 254 finished with value: 0.0 and parameters: {'timeframe': 'mixed', 'atr_period': 13, 'atr_threshold': 10.0, 'pt_mult': 0.5, 'sl_mult': 2.5, 'td_mins': 120}. Best is trial 50 with value: 43.32685925026577.
[I 2026-03-12 02:10:47,452] Trial 255 pruned. 
[I 2026-03-12 02:10:47,605] Trial 256 pruned. 
[I 2026-03-12 02:10:47,722] Trial 257 pruned. 
[I 2026-03-12 02:10:48,768] Trial 258 pruned. 
[I 2026-03-12 02:10:48,917] Trial 259 pruned. 
[I 2026-03-12 02:10:49,062] Trial 260 pruned. 
[I 2026-03-12 02:10:49,337] Trial 261 pruned. 
[I 2026-03-12 02:10:50,595] Trial 262 pruned. 
[I 2026-03-12 02:10:50,719] Trial 263 pruned. 
[I 2026-03-12 02:10:50,879] Trial 264 pruned. 
[I 2026-03-12 02:10:51,652] Trial 265 pruned. 
[I 2026-03-12 02:10:51,824] Trial 266 finished with value: 0.0 and parameters: {'timeframe': 'mixed', 'atr_period': 13, 'atr_threshold': 10.0, 'pt_mult': 5.0, 'sl_mult': 1.0, 'td_mins': 120}. Best is trial 50 with value: 43.32685925026577.
[I 2026-03-12 02:10:51,987] Trial 267 finished with value: 0.0 and parameters: {'timeframe': 'mixed', 'atr_period': 13, 'atr_threshold': 15.0, 'pt_mult': 1.0, 'sl_mult': 5.0, 'td_mins': 15}. Best is trial 50 with value: 43.32685925026577.
[I 2026-03-12 02:10:52,097] Trial 268 pruned. 
[I 2026-03-12 02:10:52,252] Trial 269 pruned. 
[I 2026-03-12 02:10:54,018] Trial 270 finished with value: 1.6330475740451689 and parameters: {'timeframe': 'mixed', 'atr_period': 13, 'atr_threshold': 2.0, 'pt_mult': 1.0, 'sl_mult': 5.0, 'td_mins': 120}. Best is trial 50 with value: 43.32685925026577.
[I 2026-03-12 02:10:55,730] Trial 271 pruned. 
[I 2026-03-12 02:10:55,843] Trial 272 pruned. 
[I 2026-03-12 02:10:56,014] Trial 273 finished with value: 0.0 and parameters: {'timeframe': 'mixed', 'atr_period': 13, 'atr_threshold': 10.0, 'pt_mult': 5.0, 'sl_mult': 5.0, 'td_mins': 360}. Best is trial 50 with value: 43.32685925026577.
[I 2026-03-12 02:10:58,313] Trial 274 pruned. 
[I 2026-03-12 02:10:58,581] Trial 275 pruned. 
[I 2026-03-12 02:10:58,746] Trial 276 pruned. 
[I 2026-03-12 02:10:59,114] Trial 277 finished with value: 1.4075761296001226 and parameters: {'timeframe': 'mixed', 'atr_period': 13, 'atr_threshold': 3.0, 'pt_mult': 0.5, 'sl_mult': 2.5, 'td_mins': 30}. Best is trial 50 with value: 43.32685925026577.
[I 2026-03-12 02:10:59,236] Trial 278 pruned. 
[I 2026-03-12 02:10:59,416] Trial 279 finished with value: 0.0 and parameters: {'timeframe': 'mixed', 'atr_period': 13, 'atr_threshold': 15.0, 'pt_mult': 5.0, 'sl_mult': 1.0, 'td_mins': 60}. Best is trial 50 with value: 43.32685925026577.
[I 2026-03-12 02:10:59,560] Trial 280 pruned. 
[I 2026-03-12 02:10:59,708] Trial 281 pruned. 
[I 2026-03-12 02:10:59,879] Trial 282 pruned. 
[I 2026-03-12 02:11:05,381] Trial 283 pruned. 
[I 2026-03-12 02:11:05,551] Trial 284 finished with value: 0.0 and parameters: {'timeframe': 'mixed', 'atr_period': 13, 'atr_threshold': 10.0, 'pt_mult': 5.0, 'sl_mult': 5.0, 'td_mins': 5}. Best is trial 50 with value: 43.32685925026577.
[I 2026-03-12 02:11:05,694] Trial 285 pruned. 
[I 2026-03-12 02:11:05,860] Trial 286 finished with value: 0.0 and parameters: {'timeframe': 'mixed', 'atr_period': 13, 'atr_threshold': 10.0, 'pt_mult': 2.5, 'sl_mult': 1.0, 'td_mins': 720}. Best is trial 50 with value: 43.32685925026577.
[I 2026-03-12 02:11:07,604] Trial 287 pruned. 
[I 2026-03-12 02:11:07,766] Trial 288 pruned. 
[I 2026-03-12 02:11:07,920] Trial 289 pruned. 
[I 2026-03-12 02:11:10,816] Trial 290 pruned. 
[I 2026-03-12 02:11:12,199] Trial 291 finished with value: 1.5129899380659328 and parameters: {'timeframe': 'mixed', 'atr_period': 13, 'atr_threshold': 1.0, 'pt_mult': 0.5, 'sl_mult': 5.0, 'td_mins': 30}. Best is trial 50 with value: 43.32685925026577.
[I 2026-03-12 02:11:12,397] Trial 292 pruned. 
[I 2026-03-12 02:11:12,574] Trial 293 finished with value: 0.0 and parameters: {'timeframe': 'mixed', 'atr_period': 13, 'atr_threshold': 15.0, 'pt_mult': 0.5, 'sl_mult': 0.5, 'td_mins': 60}. Best is trial 50 with value: 43.32685925026577.
[I 2026-03-12 02:11:12,739] Trial 294 finished with value: 0.0 and parameters: {'timeframe': 'mixed', 'atr_period': 13, 'atr_threshold': 10.0, 'pt_mult': 0.5, 'sl_mult': 1.0, 'td_mins': 180}. Best is trial 50 with value: 43.32685925026577.
[I 2026-03-12 02:11:12,904] Trial 295 finished with value: 0.0 and parameters: {'timeframe': 'mixed', 'atr_period': 13, 'atr_threshold': 15.0, 'pt_mult': 1.0, 'sl_mult': 1.0, 'td_mins': 60}. Best is trial 50 with value: 43.32685925026577.
[I 2026-03-12 02:11:13,065] Trial 296 finished with value: 0.0 and parameters: {'timeframe': 'mixed', 'atr_period': 13, 'atr_threshold': 15.0, 'pt_mult': 5.0, 'sl_mult': 2.5, 'td_mins': 720}. Best is trial 50 with value: 43.32685925026577.
[I 2026-03-12 02:11:18,985] Trial 297 pruned. 
[I 2026-03-12 02:11:19,161] Trial 298 finished with value: 0.0 and parameters: {'timeframe': 'mixed', 'atr_period': 13, 'atr_threshold': 10.0, 'pt_mult': 0.5, 'sl_mult': 1.0, 'td_mins': 1080}. Best is trial 50 with value: 43.32685925026577.
[I 2026-03-12 02:11:21,274] Trial 299 finished with value: 1.4937372838742842 and parameters: {'timeframe': 'mixed', 'atr_period': 13, 'atr_threshold': 1.0, 'pt_mult': 0.5, 'sl_mult': 5.0, 'td_mins': 60}. Best is trial 50 with value: 43.32685925026577.
[I 2026-03-12 02:11:21,618] Trial 300 finished with value: 8.726119862620362 and parameters: {'timeframe': 'mixed', 'atr_period': 13, 'atr_threshold': 5.0, 'pt_mult': 0.5, 'sl_mult': 5.0, 'td_mins': 180}. Best is trial 50 with value: 43.32685925026577.
[I 2026-03-12 02:11:21,948] Trial 301 finished with value: 3.7555546595771974 and parameters: {'timeframe': 'mixed', 'atr_period': 13, 'atr_threshold': 5.0, 'pt_mult': 1.0, 'sl_mult': 5.0, 'td_mins': 120}. Best is trial 50 with value: 43.32685925026577.
[I 2026-03-12 02:11:22,265] Trial 302 finished with value: 3.7555546595771974 and parameters: {'timeframe': 'mixed', 'atr_period': 13, 'atr_threshold': 5.0, 'pt_mult': 1.0, 'sl_mult': 5.0, 'td_mins': 120}. Best is trial 50 with value: 43.32685925026577.
[I 2026-03-12 02:11:22,665] Trial 303 finished with value: 8.726119862620362 and parameters: {'timeframe': 'mixed', 'atr_period': 13, 'atr_threshold': 5.0, 'pt_mult': 0.5, 'sl_mult': 5.0, 'td_mins': 180}. Best is trial 50 with value: 43.32685925026577.
[I 2026-03-12 02:11:23,030] Trial 304 finished with value: 8.726119862620362 and parameters: {'timeframe': 'mixed', 'atr_period': 13, 'atr_threshold': 5.0, 'pt_mult': 0.5, 'sl_mult': 5.0, 'td_mins': 180}. Best is trial 50 with value: 43.32685925026577.
[I 2026-03-12 02:11:23,385] Trial 305 finished with value: 8.726119862620362 and parameters: {'timeframe': 'mixed', 'atr_period': 13, 'atr_threshold': 5.0, 'pt_mult': 0.5, 'sl_mult': 5.0, 'td_mins': 180}. Best is trial 50 with value: 43.32685925026577.
[I 2026-03-12 02:11:23,731] Trial 306 finished with value: 8.726119862620362 and parameters: {'timeframe': 'mixed', 'atr_period': 13, 'atr_threshold': 5.0, 'pt_mult': 0.5, 'sl_mult': 5.0, 'td_mins': 180}. Best is trial 50 with value: 43.32685925026577.
[I 2026-03-12 02:11:24,069] Trial 307 finished with value: 8.726119862620362 and parameters: {'timeframe': 'mixed', 'atr_period': 13, 'atr_threshold': 5.0, 'pt_mult': 0.5, 'sl_mult': 5.0, 'td_mins': 180}. Best is trial 50 with value: 43.32685925026577.
[I 2026-03-12 02:11:24,408] Trial 308 finished with value: 8.726119862620362 and parameters: {'timeframe': 'mixed', 'atr_period': 13, 'atr_threshold': 5.0, 'pt_mult': 0.5, 'sl_mult': 5.0, 'td_mins': 180}. Best is trial 50 with value: 43.32685925026577.
[I 2026-03-12 02:11:24,756] Trial 309 finished with value: 8.726119862620362 and parameters: {'timeframe': 'mixed', 'atr_period': 13, 'atr_threshold': 5.0, 'pt_mult': 0.5, 'sl_mult': 5.0, 'td_mins': 180}. Best is trial 50 with value: 43.32685925026577.
[I 2026-03-12 02:11:25,091] Trial 310 finished with value: 8.726119862620362 and parameters: {'timeframe': 'mixed', 'atr_period': 13, 'atr_threshold': 5.0, 'pt_mult': 0.5, 'sl_mult': 5.0, 'td_mins': 180}. Best is trial 50 with value: 43.32685925026577.
[I 2026-03-12 02:11:25,443] Trial 311 finished with value: 8.726119862620362 and parameters: {'timeframe': 'mixed', 'atr_period': 13, 'atr_threshold': 5.0, 'pt_mult': 0.5, 'sl_mult': 5.0, 'td_mins': 180}. Best is trial 50 with value: 43.32685925026577.
[I 2026-03-12 02:11:25,774] Trial 312 finished with value: 8.726119862620362 and parameters: {'timeframe': 'mixed', 'atr_period': 13, 'atr_threshold': 5.0, 'pt_mult': 0.5, 'sl_mult': 5.0, 'td_mins': 180}. Best is trial 50 with value: 43.32685925026577.
[I 2026-03-12 02:11:26,103] Trial 313 finished with value: 8.726119862620362 and parameters: {'timeframe': 'mixed', 'atr_period': 13, 'atr_threshold': 5.0, 'pt_mult': 0.5, 'sl_mult': 5.0, 'td_mins': 180}. Best is trial 50 with value: 43.32685925026577.
[I 2026-03-12 02:11:26,436] Trial 314 finished with value: 8.726119862620362 and parameters: {'timeframe': 'mixed', 'atr_period': 13, 'atr_threshold': 5.0, 'pt_mult': 0.5, 'sl_mult': 5.0, 'td_mins': 180}. Best is trial 50 with value: 43.32685925026577.
[I 2026-03-12 02:11:26,784] Trial 315 finished with value: 8.726119862620362 and parameters: {'timeframe': 'mixed', 'atr_period': 13, 'atr_threshold': 5.0, 'pt_mult': 0.5, 'sl_mult': 5.0, 'td_mins': 180}. Best is trial 50 with value: 43.32685925026577.
[I 2026-03-12 02:11:27,140] Trial 316 finished with value: 8.726119862620362 and parameters: {'timeframe': 'mixed', 'atr_period': 13, 'atr_threshold': 5.0, 'pt_mult': 0.5, 'sl_mult': 5.0, 'td_mins': 180}. Best is trial 50 with value: 43.32685925026577.
[I 2026-03-12 02:11:27,500] Trial 317 finished with value: 8.726119862620362 and parameters: {'timeframe': 'mixed', 'atr_period': 13, 'atr_threshold': 5.0, 'pt_mult': 0.5, 'sl_mult': 5.0, 'td_mins': 180}. Best is trial 50 with value: 43.32685925026577.
[I 2026-03-12 02:11:27,850] Trial 318 finished with value: 8.726119862620362 and parameters: {'timeframe': 'mixed', 'atr_period': 13, 'atr_threshold': 5.0, 'pt_mult': 0.5, 'sl_mult': 5.0, 'td_mins': 180}. Best is trial 50 with value: 43.32685925026577.
[I 2026-03-12 02:11:28,202] Trial 319 finished with value: 8.726119862620362 and parameters: {'timeframe': 'mixed', 'atr_period': 13, 'atr_threshold': 5.0, 'pt_mult': 0.5, 'sl_mult': 5.0, 'td_mins': 180}. Best is trial 50 with value: 43.32685925026577.
[I 2026-03-12 02:11:28,566] Trial 320 finished with value: 8.726119862620362 and parameters: {'timeframe': 'mixed', 'atr_period': 13, 'atr_threshold': 5.0, 'pt_mult': 0.5, 'sl_mult': 5.0, 'td_mins': 180}. Best is trial 50 with value: 43.32685925026577.
[I 2026-03-12 02:11:28,940] Trial 321 finished with value: 8.726119862620362 and parameters: {'timeframe': 'mixed', 'atr_period': 13, 'atr_threshold': 5.0, 'pt_mult': 0.5, 'sl_mult': 5.0, 'td_mins': 180}. Best is trial 50 with value: 43.32685925026577.
[I 2026-03-12 02:11:29,333] Trial 322 finished with value: 8.726119862620362 and parameters: {'timeframe': 'mixed', 'atr_period': 13, 'atr_threshold': 5.0, 'pt_mult': 0.5, 'sl_mult': 5.0, 'td_mins': 180}. Best is trial 50 with value: 43.32685925026577.
[I 2026-03-12 02:11:29,991] Trial 323 finished with value: 19.652491309745592 and parameters: {'timeframe': 'mixed', 'atr_period': 13, 'atr_threshold': 5.0, 'pt_mult': 2.5, 'sl_mult': 5.0, 'td_mins': 360}. Best is trial 50 with value: 43.32685925026577.
[I 2026-03-12 02:11:30,649] Trial 324 finished with value: 19.652491309745592 and parameters: {'timeframe': 'mixed', 'atr_period': 13, 'atr_threshold': 5.0, 'pt_mult': 2.5, 'sl_mult': 5.0, 'td_mins': 360}. Best is trial 50 with value: 43.32685925026577.
[I 2026-03-12 02:11:31,288] Trial 325 finished with value: 19.652491309745592 and parameters: {'timeframe': 'mixed', 'atr_period': 13, 'atr_threshold': 5.0, 'pt_mult': 2.5, 'sl_mult': 5.0, 'td_mins': 360}. Best is trial 50 with value: 43.32685925026577.
[I 2026-03-12 02:11:32,553] Trial 326 finished with value: 17.016304956723822 and parameters: {'timeframe': 'mixed', 'atr_period': 13, 'atr_threshold': 5.0, 'pt_mult': 1.0, 'sl_mult': 5.0, 'td_mins': 1080}. Best is trial 50 with value: 43.32685925026577.
[I 2026-03-12 02:11:33,121] Trial 327 finished with value: 19.652491309745592 and parameters: {'timeframe': 'mixed', 'atr_period': 13, 'atr_threshold': 5.0, 'pt_mult': 2.5, 'sl_mult': 5.0, 'td_mins': 360}. Best is trial 50 with value: 43.32685925026577.
[I 2026-03-12 02:11:34,306] Trial 328 finished with value: 17.016304956723822 and parameters: {'timeframe': 'mixed', 'atr_period': 13, 'atr_threshold': 5.0, 'pt_mult': 1.0, 'sl_mult': 5.0, 'td_mins': 1080}. Best is trial 50 with value: 43.32685925026577.
[I 2026-03-12 02:11:34,890] Trial 329 finished with value: 19.652491309745592 and parameters: {'timeframe': 'mixed', 'atr_period': 13, 'atr_threshold': 5.0, 'pt_mult': 2.5, 'sl_mult': 5.0, 'td_mins': 360}. Best is trial 50 with value: 43.32685925026577.
[I 2026-03-12 02:11:35,491] Trial 330 finished with value: 19.652491309745592 and parameters: {'timeframe': 'mixed', 'atr_period': 13, 'atr_threshold': 5.0, 'pt_mult': 2.5, 'sl_mult': 5.0, 'td_mins': 360}. Best is trial 50 with value: 43.32685925026577.
[I 2026-03-12 02:11:36,083] Trial 331 finished with value: 19.652491309745592 and parameters: {'timeframe': 'mixed', 'atr_period': 13, 'atr_threshold': 5.0, 'pt_mult': 2.5, 'sl_mult': 5.0, 'td_mins': 360}. Best is trial 50 with value: 43.32685925026577.
[I 2026-03-12 02:11:36,688] Trial 332 finished with value: 19.652491309745592 and parameters: {'timeframe': 'mixed', 'atr_period': 13, 'atr_threshold': 5.0, 'pt_mult': 2.5, 'sl_mult': 5.0, 'td_mins': 360}. Best is trial 50 with value: 43.32685925026577.
[I 2026-03-12 02:11:37,241] Trial 333 finished with value: 19.652491309745592 and parameters: {'timeframe': 'mixed', 'atr_period': 13, 'atr_threshold': 5.0, 'pt_mult': 2.5, 'sl_mult': 5.0, 'td_mins': 360}. Best is trial 50 with value: 43.32685925026577.
[I 2026-03-12 02:11:37,868] Trial 334 finished with value: 19.652491309745592 and parameters: {'timeframe': 'mixed', 'atr_period': 13, 'atr_threshold': 5.0, 'pt_mult': 2.5, 'sl_mult': 5.0, 'td_mins': 360}. Best is trial 50 with value: 43.32685925026577.
[I 2026-03-12 02:11:38,422] Trial 335 finished with value: 19.652491309745592 and parameters: {'timeframe': 'mixed', 'atr_period': 13, 'atr_threshold': 5.0, 'pt_mult': 2.5, 'sl_mult': 5.0, 'td_mins': 360}. Best is trial 50 with value: 43.32685925026577.
[I 2026-03-12 02:11:38,984] Trial 336 finished with value: 19.652491309745592 and parameters: {'timeframe': 'mixed', 'atr_period': 13, 'atr_threshold': 5.0, 'pt_mult': 2.5, 'sl_mult': 5.0, 'td_mins': 360}. Best is trial 50 with value: 43.32685925026577.
[I 2026-03-12 02:11:39,583] Trial 337 finished with value: 19.652491309745592 and parameters: {'timeframe': 'mixed', 'atr_period': 13, 'atr_threshold': 5.0, 'pt_mult': 2.5, 'sl_mult': 5.0, 'td_mins': 360}. Best is trial 50 with value: 43.32685925026577.
[I 2026-03-12 02:11:40,245] Trial 338 finished with value: 19.652491309745592 and parameters: {'timeframe': 'mixed', 'atr_period': 13, 'atr_threshold': 5.0, 'pt_mult': 2.5, 'sl_mult': 5.0, 'td_mins': 360}. Best is trial 50 with value: 43.32685925026577.
[I 2026-03-12 02:11:40,866] Trial 339 finished with value: 19.652491309745592 and parameters: {'timeframe': 'mixed', 'atr_period': 13, 'atr_threshold': 5.0, 'pt_mult': 2.5, 'sl_mult': 5.0, 'td_mins': 360}. Best is trial 50 with value: 43.32685925026577.
[I 2026-03-12 02:11:41,443] Trial 340 finished with value: 19.652491309745592 and parameters: {'timeframe': 'mixed', 'atr_period': 13, 'atr_threshold': 5.0, 'pt_mult': 2.5, 'sl_mult': 5.0, 'td_mins': 360}. Best is trial 50 with value: 43.32685925026577.
[I 2026-03-12 02:11:42,040] Trial 341 finished with value: 19.652491309745592 and parameters: {'timeframe': 'mixed', 'atr_period': 13, 'atr_threshold': 5.0, 'pt_mult': 2.5, 'sl_mult': 5.0, 'td_mins': 360}. Best is trial 50 with value: 43.32685925026577.
[I 2026-03-12 02:11:42,655] Trial 342 finished with value: 19.652491309745592 and parameters: {'timeframe': 'mixed', 'atr_period': 13, 'atr_threshold': 5.0, 'pt_mult': 2.5, 'sl_mult': 5.0, 'td_mins': 360}. Best is trial 50 with value: 43.32685925026577.
[I 2026-03-12 02:11:43,290] Trial 343 finished with value: 19.652491309745592 and parameters: {'timeframe': 'mixed', 'atr_period': 13, 'atr_threshold': 5.0, 'pt_mult': 2.5, 'sl_mult': 5.0, 'td_mins': 360}. Best is trial 50 with value: 43.32685925026577.
[I 2026-03-12 02:11:43,855] Trial 344 finished with value: 19.652491309745592 and parameters: {'timeframe': 'mixed', 'atr_period': 13, 'atr_threshold': 5.0, 'pt_mult': 2.5, 'sl_mult': 5.0, 'td_mins': 360}. Best is trial 50 with value: 43.32685925026577.
[I 2026-03-12 02:11:44,412] Trial 345 finished with value: 19.652491309745592 and parameters: {'timeframe': 'mixed', 'atr_period': 13, 'atr_threshold': 5.0, 'pt_mult': 2.5, 'sl_mult': 5.0, 'td_mins': 360}. Best is trial 50 with value: 43.32685925026577.
[I 2026-03-12 02:11:45,047] Trial 346 finished with value: 19.652491309745592 and parameters: {'timeframe': 'mixed', 'atr_period': 13, 'atr_threshold': 5.0, 'pt_mult': 2.5, 'sl_mult': 5.0, 'td_mins': 360}. Best is trial 50 with value: 43.32685925026577.
[I 2026-03-12 02:11:45,619] Trial 347 finished with value: 19.652491309745592 and parameters: {'timeframe': 'mixed', 'atr_period': 13, 'atr_threshold': 5.0, 'pt_mult': 2.5, 'sl_mult': 5.0, 'td_mins': 360}. Best is trial 50 with value: 43.32685925026577.
[I 2026-03-12 02:11:47,533] Trial 348 finished with value: 30.408273324481236 and parameters: {'timeframe': 'mixed', 'atr_period': 13, 'atr_threshold': 5.0, 'pt_mult': 5.0, 'sl_mult': 5.0, 'td_mins': 1200}. Best is trial 50 with value: 43.32685925026577.
[I 2026-03-12 02:11:49,332] Trial 349 finished with value: 30.408273324481236 and parameters: {'timeframe': 'mixed', 'atr_period': 13, 'atr_threshold': 5.0, 'pt_mult': 5.0, 'sl_mult': 5.0, 'td_mins': 1200}. Best is trial 50 with value: 43.32685925026577.
[I 2026-03-12 02:11:51,157] Trial 350 finished with value: 30.408273324481236 and parameters: {'timeframe': 'mixed', 'atr_period': 13, 'atr_threshold': 5.0, 'pt_mult': 5.0, 'sl_mult': 5.0, 'td_mins': 1200}. Best is trial 50 with value: 43.32685925026577.
[I 2026-03-12 02:11:51,305] Trial 351 pruned. 
[I 2026-03-12 02:11:53,242] Trial 352 finished with value: 30.408273324481236 and parameters: {'timeframe': 'mixed', 'atr_period': 13, 'atr_threshold': 5.0, 'pt_mult': 5.0, 'sl_mult': 5.0, 'td_mins': 1200}. Best is trial 50 with value: 43.32685925026577.
[I 2026-03-12 02:11:55,041] Trial 353 finished with value: 30.408273324481236 and parameters: {'timeframe': 'mixed', 'atr_period': 13, 'atr_threshold': 5.0, 'pt_mult': 5.0, 'sl_mult': 5.0, 'td_mins': 1200}. Best is trial 50 with value: 43.32685925026577.
[I 2026-03-12 02:11:56,856] Trial 354 finished with value: 30.408273324481236 and parameters: {'timeframe': 'mixed', 'atr_period': 13, 'atr_threshold': 5.0, 'pt_mult': 5.0, 'sl_mult': 5.0, 'td_mins': 1200}. Best is trial 50 with value: 43.32685925026577.
[I 2026-03-12 02:11:58,700] Trial 355 finished with value: 30.408273324481236 and parameters: {'timeframe': 'mixed', 'atr_period': 13, 'atr_threshold': 5.0, 'pt_mult': 5.0, 'sl_mult': 5.0, 'td_mins': 1200}. Best is trial 50 with value: 43.32685925026577.
[I 2026-03-12 02:12:00,482] Trial 356 finished with value: 30.408273324481236 and parameters: {'timeframe': 'mixed', 'atr_period': 13, 'atr_threshold': 5.0, 'pt_mult': 5.0, 'sl_mult': 5.0, 'td_mins': 1200}. Best is trial 50 with value: 43.32685925026577.
[I 2026-03-12 02:12:02,281] Trial 357 finished with value: 30.408273324481236 and parameters: {'timeframe': 'mixed', 'atr_period': 13, 'atr_threshold': 5.0, 'pt_mult': 5.0, 'sl_mult': 5.0, 'td_mins': 1200}. Best is trial 50 with value: 43.32685925026577.
[I 2026-03-12 02:12:04,114] Trial 358 finished with value: 30.408273324481236 and parameters: {'timeframe': 'mixed', 'atr_period': 13, 'atr_threshold': 5.0, 'pt_mult': 5.0, 'sl_mult': 5.0, 'td_mins': 1200}. Best is trial 50 with value: 43.32685925026577.
[I 2026-03-12 02:12:05,927] Trial 359 finished with value: 30.408273324481236 and parameters: {'timeframe': 'mixed', 'atr_period': 13, 'atr_threshold': 5.0, 'pt_mult': 5.0, 'sl_mult': 5.0, 'td_mins': 1200}. Best is trial 50 with value: 43.32685925026577.
[I 2026-03-12 02:12:07,761] Trial 360 finished with value: 30.408273324481236 and parameters: {'timeframe': 'mixed', 'atr_period': 13, 'atr_threshold': 5.0, 'pt_mult': 5.0, 'sl_mult': 5.0, 'td_mins': 1200}. Best is trial 50 with value: 43.32685925026577.
[I 2026-03-12 02:12:09,550] Trial 361 finished with value: 30.408273324481236 and parameters: {'timeframe': 'mixed', 'atr_period': 13, 'atr_threshold': 5.0, 'pt_mult': 5.0, 'sl_mult': 5.0, 'td_mins': 1200}. Best is trial 50 with value: 43.32685925026577.
[I 2026-03-12 02:12:11,391] Trial 362 finished with value: 30.408273324481236 and parameters: {'timeframe': 'mixed', 'atr_period': 13, 'atr_threshold': 5.0, 'pt_mult': 5.0, 'sl_mult': 5.0, 'td_mins': 1200}. Best is trial 50 with value: 43.32685925026577.
[I 2026-03-12 02:12:13,323] Trial 363 finished with value: 30.408273324481236 and parameters: {'timeframe': 'mixed', 'atr_period': 13, 'atr_threshold': 5.0, 'pt_mult': 5.0, 'sl_mult': 5.0, 'td_mins': 1200}. Best is trial 50 with value: 43.32685925026577.
[I 2026-03-12 02:12:15,255] Trial 364 finished with value: 30.408273324481236 and parameters: {'timeframe': 'mixed', 'atr_period': 13, 'atr_threshold': 5.0, 'pt_mult': 5.0, 'sl_mult': 5.0, 'td_mins': 1200}. Best is trial 50 with value: 43.32685925026577.
