[I 2026-03-12 01:53:04,930] Trial 24 pruned. 
[I 2026-03-12 01:53:04,992] Trial 25 pruned. 
[I 2026-03-12 01:53:05,036] Trial 26 finished with value: 0.0 and parameters: {'timeframe': 'M8', 'atr_period': 13, 'atr_threshold': 10.0, 'pt_mult': 0.5, 'sl_mult': 5.0, 'td_mins': 60}. Best is trial 15 with value: 1.8862471524777071.
[I 2026-03-12 01:53:05,079] Trial 27 finished with value: 0.0 and parameters: {'timeframe': 'M8', 'atr_period': 13, 'atr_threshold': 15.0, 'pt_mult': 1.0, 'sl_mult': 1.0, 'td_mins': 120}. Best is trial 15 with value: 1.8862471524777071.
[I 2026-03-12 01:53:05,715] Trial 28 finished with value: 0.9571707109742784 and parameters: {'timeframe': 'M8', 'atr_period': 13, 'atr_threshold': 2.0, 'pt_mult': 0.5, 'sl_mult': 1.0, 'td_mins': 360}. Best is trial 15 with value: 1.8862471524777071.
[I 2026-03-12 01:53:05,761] Trial 29 finished with value: 0.0 and parameters: {'timeframe': 'M8', 'atr_period': 13, 'atr_threshold': 8.0, 'pt_mult': 5.0, 'sl_mult': 0.5, 'td_mins': 360}. Best is trial 15 with value: 1.8862471524777071.
[I 2026-03-12 01:53:05,813] Trial 30 pruned. 
[I 2026-03-12 01:53:06,254] Trial 31 finished with value: 1.929337249915018 and parameters: {'timeframe': 'M8', 'atr_period': 13, 'atr_threshold': 1.0, 'pt_mult': 0.5, 'sl_mult': 5.0, 'td_mins': 60}. Best is trial 31 with value: 1.929337249915018.
[I 2026-03-12 01:53:06,308] Trial 32 pruned. 
[I 2026-03-12 01:53:06,982] Trial 33 finished with value: 0.9504713211817168 and parameters: {'timeframe': 'M8', 'atr_period': 13, 'atr_threshold': 1.0, 'pt_mult': 0.5, 'sl_mult': 1.0, 'td_mins': 180}. Best is trial 31 with value: 1.929337249915018.
[I 2026-03-12 01:53:07,310] Trial 34 pruned. 
[I 2026-03-12 01:53:07,361] Trial 35 finished with value: 0.0 and parameters: {'timeframe': 'M8', 'atr_period': 13, 'atr_threshold': 8.0, 'pt_mult': 1.0, 'sl_mult': 5.0, 'td_mins': 1080}. Best is trial 31 with value: 1.929337249915018.
[I 2026-03-12 01:53:10,713] Trial 36 finished with value: 1.0546502459466653 and parameters: {'timeframe': 'M8', 'atr_period': 13, 'atr_threshold': 0.5, 'pt_mult': 0.5, 'sl_mult': 5.0, 'td_mins': 720}. Best is trial 31 with value: 1.929337249915018.
[I 2026-03-12 01:53:11,114] Trial 37 finished with value: 1.0109343112735458 and parameters: {'timeframe': 'M8', 'atr_period': 13, 'atr_threshold': 3.0, 'pt_mult': 5.0, 'sl_mult': 5.0, 'td_mins': 180}. Best is trial 31 with value: 1.929337249915018.
[I 2026-03-12 01:53:11,164] Trial 38 pruned. 
[I 2026-03-12 01:53:11,261] Trial 39 pruned. 
[I 2026-03-12 01:53:11,306] Trial 40 finished with value: 0.0 and parameters: {'timeframe': 'M8', 'atr_period': 13, 'atr_threshold': 8.0, 'pt_mult': 5.0, 'sl_mult': 2.5, 'td_mins': 180}. Best is trial 31 with value: 1.929337249915018.
[I 2026-03-12 01:53:11,350] Trial 41 finished with value: 0.0 and parameters: {'timeframe': 'M8', 'atr_period': 13, 'atr_threshold': 15.0, 'pt_mult': 0.5, 'sl_mult': 0.5, 'td_mins': 1200}. Best is trial 31 with value: 1.929337249915018.
[I 2026-03-12 01:53:11,810] Trial 42 finished with value: 1.304014584796703 and parameters: {'timeframe': 'M8', 'atr_period': 13, 'atr_threshold': 5.0, 'pt_mult': 0.5, 'sl_mult': 5.0, 'td_mins': 1200}. Best is trial 31 with value: 1.929337249915018.
[I 2026-03-12 01:53:13,966] Trial 43 finished with value: 1.199921546338295 and parameters: {'timeframe': 'M8', 'atr_period': 13, 'atr_threshold': 0.5, 'pt_mult': 1.0, 'sl_mult': 5.0, 'td_mins': 360}. Best is trial 31 with value: 1.929337249915018.
[I 2026-03-12 01:53:16,893] Trial 44 finished with value: 1.1505842857654442 and parameters: {'timeframe': 'M8', 'atr_period': 13, 'atr_threshold': 3.0, 'pt_mult': 5.0, 'sl_mult': 5.0, 'td_mins': 1200}. Best is trial 31 with value: 1.929337249915018.
[I 2026-03-12 01:53:16,944] Trial 45 finished with value: 0.0 and parameters: {'timeframe': 'M8', 'atr_period': 13, 'atr_threshold': 10.0, 'pt_mult': 1.0, 'sl_mult': 0.5, 'td_mins': 1200}. Best is trial 31 with value: 1.929337249915018.
[I 2026-03-12 01:53:17,465] Trial 46 finished with value: 1.7454403254433006 and parameters: {'timeframe': 'M8', 'atr_period': 13, 'atr_threshold': 5.0, 'pt_mult': 2.5, 'sl_mult': 5.0, 'td_mins': 720}. Best is trial 31 with value: 1.929337249915018.
[I 2026-03-12 01:53:17,587] Trial 47 pruned. 
[I 2026-03-12 01:53:19,181] Trial 48 finished with value: 0.980422672290764 and parameters: {'timeframe': 'M8', 'atr_period': 13, 'atr_threshold': 0.5, 'pt_mult': 0.5, 'sl_mult': 0.5, 'td_mins': 1080}. Best is trial 31 with value: 1.929337249915018.
[I 2026-03-12 01:53:19,254] Trial 49 pruned. 
[I 2026-03-12 01:53:20,100] Trial 50 finished with value: 1.102878765761467 and parameters: {'timeframe': 'M8', 'atr_period': 13, 'atr_threshold': 3.0, 'pt_mult': 5.0, 'sl_mult': 5.0, 'td_mins': 360}. Best is trial 31 with value: 1.929337249915018.
[I 2026-03-12 01:53:20,160] Trial 51 pruned. 
[I 2026-03-12 01:53:20,207] Trial 52 finished with value: 0.0 and parameters: {'timeframe': 'M8', 'atr_period': 13, 'atr_threshold': 10.0, 'pt_mult': 5.0, 'sl_mult': 1.0, 'td_mins': 15}. Best is trial 31 with value: 1.929337249915018.
[I 2026-03-12 01:53:20,284] Trial 53 finished with value: 0.8581409329494892 and parameters: {'timeframe': 'M8', 'atr_period': 13, 'atr_threshold': 5.0, 'pt_mult': 1.0, 'sl_mult': 2.5, 'td_mins': 60}. Best is trial 31 with value: 1.929337249915018.
[I 2026-03-12 01:53:27,382] Trial 54 finished with value: 0.9678947360406502 and parameters: {'timeframe': 'M8', 'atr_period': 13, 'atr_threshold': 0.5, 'pt_mult': 2.5, 'sl_mult': 5.0, 'td_mins': 1200}. Best is trial 31 with value: 1.929337249915018.
[I 2026-03-12 01:53:27,777] Trial 55 pruned. 
[I 2026-03-12 01:53:27,824] Trial 56 finished with value: 0.0 and parameters: {'timeframe': 'M8', 'atr_period': 13, 'atr_threshold': 15.0, 'pt_mult': 1.0, 'sl_mult': 0.5, 'td_mins': 30}. Best is trial 31 with value: 1.929337249915018.
[I 2026-03-12 01:53:28,485] Trial 57 pruned. 
[I 2026-03-12 01:53:28,618] Trial 58 finished with value: 1.3520063852315152 and parameters: {'timeframe': 'M8', 'atr_period': 13, 'atr_threshold': 5.0, 'pt_mult': 5.0, 'sl_mult': 5.0, 'td_mins': 120}. Best is trial 31 with value: 1.929337249915018.
[I 2026-03-12 01:53:33,318] Trial 59 finished with value: 0.9505832920724586 and parameters: {'timeframe': 'M8', 'atr_period': 13, 'atr_threshold': 1.0, 'pt_mult': 2.5, 'sl_mult': 2.5, 'td_mins': 1080}. Best is trial 31 with value: 1.929337249915018.
[I 2026-03-12 01:53:33,386] Trial 60 pruned. 
[I 2026-03-12 01:53:33,481] Trial 61 pruned. 
[I 2026-03-12 01:53:35,542] Trial 62 finished with value: 0.9288421923784183 and parameters: {'timeframe': 'M8', 'atr_period': 13, 'atr_threshold': 3.0, 'pt_mult': 5.0, 'sl_mult': 2.5, 'td_mins': 1080}. Best is trial 31 with value: 1.929337249915018.
[I 2026-03-12 01:53:37,912] Trial 63 finished with value: 0.9353559295125695 and parameters: {'timeframe': 'M8', 'atr_period': 13, 'atr_threshold': 1.0, 'pt_mult': 2.5, 'sl_mult': 0.5, 'td_mins': 720}. Best is trial 31 with value: 1.929337249915018.
[I 2026-03-12 01:53:37,960] Trial 64 pruned. 
[I 2026-03-12 01:53:38,089] Trial 65 finished with value: 2.529776658950818 and parameters: {'timeframe': 'M8', 'atr_period': 13, 'atr_threshold': 5.0, 'pt_mult': 1.0, 'sl_mult': 5.0, 'td_mins': 180}. Best is trial 65 with value: 2.529776658950818.
[I 2026-03-12 01:53:38,136] Trial 66 pruned. 
[I 2026-03-12 01:53:39,276] Trial 67 finished with value: 1.0088098872571403 and parameters: {'timeframe': 'M8', 'atr_period': 13, 'atr_threshold': 0.5, 'pt_mult': 1.0, 'sl_mult': 2.5, 'td_mins': 180}. Best is trial 65 with value: 2.529776658950818.
[I 2026-03-12 01:53:39,345] Trial 68 pruned. 
[I 2026-03-12 01:53:39,401] Trial 69 finished with value: 0.0 and parameters: {'timeframe': 'M8', 'atr_period': 13, 'atr_threshold': 8.0, 'pt_mult': 1.0, 'sl_mult': 0.5, 'td_mins': 1080}. Best is trial 65 with value: 2.529776658950818.
[I 2026-03-12 01:53:39,464] Trial 70 pruned. 
[I 2026-03-12 01:53:39,517] Trial 71 finished with value: 0.0 and parameters: {'timeframe': 'M8', 'atr_period': 13, 'atr_threshold': 15.0, 'pt_mult': 2.5, 'sl_mult': 2.5, 'td_mins': 5}. Best is trial 65 with value: 2.529776658950818.
[I 2026-03-12 01:53:39,617] Trial 72 pruned. 
[I 2026-03-12 01:53:39,670] Trial 73 finished with value: 0.0 and parameters: {'timeframe': 'M8', 'atr_period': 13, 'atr_threshold': 10.0, 'pt_mult': 5.0, 'sl_mult': 1.0, 'td_mins': 180}. Best is trial 65 with value: 2.529776658950818.
[I 2026-03-12 01:53:41,947] Trial 74 finished with value: 1.2797515361944511 and parameters: {'timeframe': 'M8', 'atr_period': 13, 'atr_threshold': 3.0, 'pt_mult': 2.5, 'sl_mult': 5.0, 'td_mins': 1080}. Best is trial 65 with value: 2.529776658950818.
[I 2026-03-12 01:53:42,282] Trial 75 finished with value: 1.1706686327367097 and parameters: {'timeframe': 'M8', 'atr_period': 13, 'atr_threshold': 0.5, 'pt_mult': 0.5, 'sl_mult': 2.5, 'td_mins': 30}. Best is trial 65 with value: 2.529776658950818.
[I 2026-03-12 01:53:46,788] Trial 76 finished with value: 1.0388909980837826 and parameters: {'timeframe': 'M8', 'atr_period': 13, 'atr_threshold': 0.5, 'pt_mult': 2.5, 'sl_mult': 5.0, 'td_mins': 720}. Best is trial 65 with value: 2.529776658950818.
[I 2026-03-12 01:53:46,831] Trial 77 finished with value: 0.0 and parameters: {'timeframe': 'M8', 'atr_period': 13, 'atr_threshold': 10.0, 'pt_mult': 1.0, 'sl_mult': 0.5, 'td_mins': 15}. Best is trial 65 with value: 2.529776658950818.
[I 2026-03-12 01:53:46,877] Trial 78 finished with value: 0.0 and parameters: {'timeframe': 'M8', 'atr_period': 13, 'atr_threshold': 15.0, 'pt_mult': 0.5, 'sl_mult': 2.5, 'td_mins': 180}. Best is trial 65 with value: 2.529776658950818.
[I 2026-03-12 01:53:46,985] Trial 79 pruned. 
[I 2026-03-12 01:53:47,727] Trial 80 pruned. 
[I 2026-03-12 01:53:47,774] Trial 81 finished with value: 0.0 and parameters: {'timeframe': 'M8', 'atr_period': 13, 'atr_threshold': 15.0, 'pt_mult': 0.5, 'sl_mult': 0.5, 'td_mins': 180}. Best is trial 65 with value: 2.529776658950818.
[I 2026-03-12 01:53:47,827] Trial 82 pruned. 
[I 2026-03-12 01:53:47,871] Trial 83 finished with value: 0.0 and parameters: {'timeframe': 'M8', 'atr_period': 13, 'atr_threshold': 15.0, 'pt_mult': 1.0, 'sl_mult': 2.5, 'td_mins': 30}. Best is trial 65 with value: 2.529776658950818.
[I 2026-03-12 01:53:47,917] Trial 84 finished with value: 0.0 and parameters: {'timeframe': 'M8', 'atr_period': 13, 'atr_threshold': 10.0, 'pt_mult': 0.5, 'sl_mult': 0.5, 'td_mins': 60}. Best is trial 65 with value: 2.529776658950818.
[I 2026-03-12 01:53:47,960] Trial 85 finished with value: 0.0 and parameters: {'timeframe': 'M8', 'atr_period': 13, 'atr_threshold': 15.0, 'pt_mult': 1.0, 'sl_mult': 5.0, 'td_mins': 1080}. Best is trial 65 with value: 2.529776658950818.
[I 2026-03-12 01:53:48,014] Trial 86 pruned. 
[I 2026-03-12 01:53:48,328] Trial 87 pruned. 
[I 2026-03-12 01:53:48,377] Trial 88 pruned. 
[I 2026-03-12 01:53:48,428] Trial 89 finished with value: 0.0 and parameters: {'timeframe': 'M8', 'atr_period': 13, 'atr_threshold': 8.0, 'pt_mult': 5.0, 'sl_mult': 1.0, 'td_mins': 360}. Best is trial 65 with value: 2.529776658950818.
[I 2026-03-12 01:53:48,477] Trial 90 finished with value: 0.0 and parameters: {'timeframe': 'M8', 'atr_period': 13, 'atr_threshold': 10.0, 'pt_mult': 2.5, 'sl_mult': 0.5, 'td_mins': 15}. Best is trial 65 with value: 2.529776658950818.
[I 2026-03-12 01:53:48,545] Trial 91 pruned. 
[I 2026-03-12 01:53:48,599] Trial 92 pruned. 
[I 2026-03-12 01:53:48,655] Trial 93 pruned. 
[I 2026-03-12 01:53:48,816] Trial 94 pruned. 
[I 2026-03-12 01:53:49,993] Trial 95 finished with value: 0.9514012306954202 and parameters: {'timeframe': 'M8', 'atr_period': 13, 'atr_threshold': 1.0, 'pt_mult': 1.0, 'sl_mult': 1.0, 'td_mins': 360}. Best is trial 65 with value: 2.529776658950818.
[I 2026-03-12 01:53:50,048] Trial 96 pruned. 
[I 2026-03-12 01:53:50,103] Trial 97 pruned. 
[I 2026-03-12 01:53:50,148] Trial 98 pruned. 
[I 2026-03-12 01:53:50,193] Trial 99 finished with value: 0.0 and parameters: {'timeframe': 'M8', 'atr_period': 13, 'atr_threshold': 8.0, 'pt_mult': 5.0, 'sl_mult': 2.5, 'td_mins': 360}. Best is trial 65 with value: 2.529776658950818.
[I 2026-03-12 01:53:50,254] Trial 100 pruned. 
[I 2026-03-12 01:53:50,524] Trial 101 pruned. 
[I 2026-03-12 01:53:50,568] Trial 102 finished with value: 0.0 and parameters: {'timeframe': 'M8', 'atr_period': 13, 'atr_threshold': 15.0, 'pt_mult': 1.0, 'sl_mult': 5.0, 'td_mins': 15}. Best is trial 65 with value: 2.529776658950818.
[I 2026-03-12 01:53:51,544] Trial 103 finished with value: 0.9827126288030232 and parameters: {'timeframe': 'M8', 'atr_period': 13, 'atr_threshold': 2.0, 'pt_mult': 0.5, 'sl_mult': 0.5, 'td_mins': 1200}. Best is trial 65 with value: 2.529776658950818.
[I 2026-03-12 01:53:51,764] Trial 104 finished with value: 1.4205698196126304 and parameters: {'timeframe': 'M8', 'atr_period': 13, 'atr_threshold': 5.0, 'pt_mult': 2.5, 'sl_mult': 5.0, 'td_mins': 360}. Best is trial 65 with value: 2.529776658950818.
[I 2026-03-12 01:53:51,808] Trial 105 finished with value: 0.0 and parameters: {'timeframe': 'M8', 'atr_period': 13, 'atr_threshold': 15.0, 'pt_mult': 0.5, 'sl_mult': 5.0, 'td_mins': 30}. Best is trial 65 with value: 2.529776658950818.
[I 2026-03-12 01:53:51,852] Trial 106 finished with value: 0.0 and parameters: {'timeframe': 'M8', 'atr_period': 13, 'atr_threshold': 15.0, 'pt_mult': 0.5, 'sl_mult': 0.5, 'td_mins': 360}. Best is trial 65 with value: 2.529776658950818.
[I 2026-03-12 01:53:51,896] Trial 107 finished with value: 0.0 and parameters: {'timeframe': 'M8', 'atr_period': 13, 'atr_threshold': 10.0, 'pt_mult': 5.0, 'sl_mult': 1.0, 'td_mins': 120}. Best is trial 65 with value: 2.529776658950818.
[I 2026-03-12 01:53:51,942] Trial 108 finished with value: 0.0 and parameters: {'timeframe': 'M8', 'atr_period': 13, 'atr_threshold': 8.0, 'pt_mult': 2.5, 'sl_mult': 2.5, 'td_mins': 5}. Best is trial 65 with value: 2.529776658950818.
[I 2026-03-12 01:53:51,991] Trial 109 finished with value: 0.0 and parameters: {'timeframe': 'M8', 'atr_period': 13, 'atr_threshold': 15.0, 'pt_mult': 5.0, 'sl_mult': 0.5, 'td_mins': 360}. Best is trial 65 with value: 2.529776658950818.
[I 2026-03-12 01:53:52,036] Trial 110 pruned. 
[I 2026-03-12 01:53:55,599] Trial 111 finished with value: 0.9492387454593285 and parameters: {'timeframe': 'M8', 'atr_period': 13, 'atr_threshold': 0.5, 'pt_mult': 0.5, 'sl_mult': 2.5, 'td_mins': 1200}. Best is trial 65 with value: 2.529776658950818.
[I 2026-03-12 01:53:55,644] Trial 112 finished with value: 0.0 and parameters: {'timeframe': 'M8', 'atr_period': 13, 'atr_threshold': 10.0, 'pt_mult': 2.5, 'sl_mult': 1.0, 'td_mins': 60}. Best is trial 65 with value: 2.529776658950818.
[I 2026-03-12 01:53:56,223] Trial 113 pruned. 
[I 2026-03-12 01:53:56,269] Trial 114 finished with value: 0.0 and parameters: {'timeframe': 'M8', 'atr_period': 13, 'atr_threshold': 10.0, 'pt_mult': 5.0, 'sl_mult': 0.5, 'td_mins': 1200}. Best is trial 65 with value: 2.529776658950818.
[I 2026-03-12 01:53:56,316] Trial 115 finished with value: 0.0 and parameters: {'timeframe': 'M8', 'atr_period': 13, 'atr_threshold': 10.0, 'pt_mult': 1.0, 'sl_mult': 2.5, 'td_mins': 60}. Best is trial 65 with value: 2.529776658950818.
[I 2026-03-12 01:53:56,359] Trial 116 finished with value: 0.0 and parameters: {'timeframe': 'M8', 'atr_period': 13, 'atr_threshold': 8.0, 'pt_mult': 1.0, 'sl_mult': 2.5, 'td_mins': 15}. Best is trial 65 with value: 2.529776658950818.
[I 2026-03-12 01:53:57,012] Trial 117 pruned. 
[I 2026-03-12 01:53:57,124] Trial 118 pruned. 
[I 2026-03-12 01:53:57,176] Trial 119 pruned. 
[I 2026-03-12 01:53:57,500] Trial 120 finished with value: 1.8200930227480356 and parameters: {'timeframe': 'M8', 'atr_period': 13, 'atr_threshold': 2.0, 'pt_mult': 1.0, 'sl_mult': 5.0, 'td_mins': 60}. Best is trial 65 with value: 2.529776658950818.
[I 2026-03-12 01:53:57,568] Trial 121 pruned. 
[I 2026-03-12 01:53:57,616] Trial 122 finished with value: 0.0 and parameters: {'timeframe': 'M8', 'atr_period': 13, 'atr_threshold': 15.0, 'pt_mult': 5.0, 'sl_mult': 0.5, 'td_mins': 60}. Best is trial 65 with value: 2.529776658950818.
[I 2026-03-12 01:53:57,704] Trial 123 pruned. 
[I 2026-03-12 01:53:58,337] Trial 124 finished with value: 1.058943126544879 and parameters: {'timeframe': 'M8', 'atr_period': 13, 'atr_threshold': 2.0, 'pt_mult': 1.0, 'sl_mult': 2.5, 'td_mins': 180}. Best is trial 65 with value: 2.529776658950818.
[I 2026-03-12 01:53:58,383] Trial 125 finished with value: 0.0 and parameters: {'timeframe': 'M8', 'atr_period': 13, 'atr_threshold': 10.0, 'pt_mult': 2.5, 'sl_mult': 5.0, 'td_mins': 1200}. Best is trial 65 with value: 2.529776658950818.
[I 2026-03-12 01:53:58,457] Trial 126 pruned. 
[I 2026-03-12 01:53:58,509] Trial 127 finished with value: 0.0 and parameters: {'timeframe': 'M8', 'atr_period': 13, 'atr_threshold': 10.0, 'pt_mult': 5.0, 'sl_mult': 1.0, 'td_mins': 180}. Best is trial 65 with value: 2.529776658950818.
[I 2026-03-12 01:53:58,779] Trial 128 pruned. 
[I 2026-03-12 01:54:02,439] Trial 129 finished with value: 0.9282441736722327 and parameters: {'timeframe': 'M8', 'atr_period': 13, 'atr_threshold': 0.5, 'pt_mult': 2.5, 'sl_mult': 2.5, 'td_mins': 720}. Best is trial 65 with value: 2.529776658950818.
[I 2026-03-12 01:54:02,496] Trial 130 pruned. 
[I 2026-03-12 01:54:02,544] Trial 131 finished with value: 0.0 and parameters: {'timeframe': 'M8', 'atr_period': 13, 'atr_threshold': 8.0, 'pt_mult': 2.5, 'sl_mult': 5.0, 'td_mins': 720}. Best is trial 65 with value: 2.529776658950818.
[I 2026-03-12 01:54:02,714] Trial 132 finished with value: 2.8319342647562786 and parameters: {'timeframe': 'M8', 'atr_period': 13, 'atr_threshold': 3.0, 'pt_mult': 0.5, 'sl_mult': 5.0, 'td_mins': 60}. Best is trial 132 with value: 2.8319342647562786.
[I 2026-03-12 01:54:02,760] Trial 133 finished with value: 0.0 and parameters: {'timeframe': 'M8', 'atr_period': 13, 'atr_threshold': 10.0, 'pt_mult': 1.0, 'sl_mult': 2.5, 'td_mins': 1080}. Best is trial 132 with value: 2.8319342647562786.
[I 2026-03-12 01:54:05,382] Trial 134 finished with value: 0.9652348938273448 and parameters: {'timeframe': 'M8', 'atr_period': 13, 'atr_threshold': 1.0, 'pt_mult': 1.0, 'sl_mult': 2.5, 'td_mins': 720}. Best is trial 132 with value: 2.8319342647562786.
[I 2026-03-12 01:54:05,427] Trial 135 finished with value: 0.0 and parameters: {'timeframe': 'M8', 'atr_period': 13, 'atr_threshold': 15.0, 'pt_mult': 5.0, 'sl_mult': 5.0, 'td_mins': 120}. Best is trial 132 with value: 2.8319342647562786.
[I 2026-03-12 01:54:05,747] Trial 136 finished with value: 1.8200930227480356 and parameters: {'timeframe': 'M8', 'atr_period': 13, 'atr_threshold': 2.0, 'pt_mult': 1.0, 'sl_mult': 5.0, 'td_mins': 60}. Best is trial 132 with value: 2.8319342647562786.
[I 2026-03-12 01:54:06,077] Trial 137 finished with value: 1.1049231810450224 and parameters: {'timeframe': 'M8', 'atr_period': 13, 'atr_threshold': 3.0, 'pt_mult': 1.0, 'sl_mult': 2.5, 'td_mins': 180}. Best is trial 132 with value: 2.8319342647562786.
[I 2026-03-12 01:54:07,410] Trial 138 finished with value: 1.2062759412245783 and parameters: {'timeframe': 'M8', 'atr_period': 13, 'atr_threshold': 2.0, 'pt_mult': 2.5, 'sl_mult': 5.0, 'td_mins': 360}. Best is trial 132 with value: 2.8319342647562786.
[I 2026-03-12 01:54:07,455] Trial 139 finished with value: 0.0 and parameters: {'timeframe': 'M8', 'atr_period': 13, 'atr_threshold': 8.0, 'pt_mult': 2.5, 'sl_mult': 1.0, 'td_mins': 15}. Best is trial 132 with value: 2.8319342647562786.
[I 2026-03-12 01:54:07,505] Trial 140 pruned. 
[I 2026-03-12 01:54:07,549] Trial 141 finished with value: 0.0 and parameters: {'timeframe': 'M8', 'atr_period': 13, 'atr_threshold': 8.0, 'pt_mult': 2.5, 'sl_mult': 0.5, 'td_mins': 30}. Best is trial 132 with value: 2.8319342647562786.
[I 2026-03-12 01:54:09,512] Trial 142 finished with value: 1.0064249442231543 and parameters: {'timeframe': 'M8', 'atr_period': 13, 'atr_threshold': 3.0, 'pt_mult': 1.0, 'sl_mult': 5.0, 'td_mins': 1200}. Best is trial 132 with value: 2.8319342647562786.
[I 2026-03-12 01:54:09,559] Trial 143 finished with value: 0.0 and parameters: {'timeframe': 'M8', 'atr_period': 13, 'atr_threshold': 10.0, 'pt_mult': 0.5, 'sl_mult': 2.5, 'td_mins': 360}. Best is trial 132 with value: 2.8319342647562786.
[I 2026-03-12 01:54:09,609] Trial 144 finished with value: 0.0 and parameters: {'timeframe': 'M8', 'atr_period': 13, 'atr_threshold': 8.0, 'pt_mult': 0.5, 'sl_mult': 2.5, 'td_mins': 60}. Best is trial 132 with value: 2.8319342647562786.
[I 2026-03-12 01:54:09,939] Trial 145 pruned. 
[I 2026-03-12 01:54:09,987] Trial 146 finished with value: 0.0 and parameters: {'timeframe': 'M8', 'atr_period': 13, 'atr_threshold': 8.0, 'pt_mult': 5.0, 'sl_mult': 1.0, 'td_mins': 5}. Best is trial 132 with value: 2.8319342647562786.
[I 2026-03-12 01:54:10,084] Trial 147 pruned. 
[I 2026-03-12 01:54:10,133] Trial 148 finished with value: 0.0 and parameters: {'timeframe': 'M8', 'atr_period': 13, 'atr_threshold': 15.0, 'pt_mult': 0.5, 'sl_mult': 1.0, 'td_mins': 360}. Best is trial 132 with value: 2.8319342647562786.
[I 2026-03-12 01:54:10,180] Trial 149 finished with value: 0.0 and parameters: {'timeframe': 'M8', 'atr_period': 13, 'atr_threshold': 15.0, 'pt_mult': 2.5, 'sl_mult': 1.0, 'td_mins': 5}. Best is trial 132 with value: 2.8319342647562786.
[I 2026-03-12 01:54:10,286] Trial 150 pruned. 
[I 2026-03-12 01:54:10,336] Trial 151 finished with value: 0.0 and parameters: {'timeframe': 'M8', 'atr_period': 13, 'atr_threshold': 10.0, 'pt_mult': 1.0, 'sl_mult': 0.5, 'td_mins': 1080}. Best is trial 132 with value: 2.8319342647562786.
[I 2026-03-12 01:54:10,389] Trial 152 finished with value: 0.0 and parameters: {'timeframe': 'M8', 'atr_period': 13, 'atr_threshold': 10.0, 'pt_mult': 2.5, 'sl_mult': 2.5, 'td_mins': 1200}. Best is trial 132 with value: 2.8319342647562786.
[I 2026-03-12 01:54:10,449] Trial 153 pruned. 
[I 2026-03-12 01:54:10,518] Trial 154 pruned. 
