[I 2026-03-12 01:34:06,922] Trial 781 finished with value: 0.0 and parameters: {'timeframe': 'M1', 'atr_period': 13, 'atr_threshold': 5.0, 'pt_mult': 1.0, 'sl_mult': 5.0, 'td_mins': 60}. Best is trial 337 with value: 2.318948203404773.
[I 2026-03-12 01:34:06,973] Trial 782 finished with value: 0.0 and parameters: {'timeframe': 'M1', 'atr_period': 13, 'atr_threshold': 3.0, 'pt_mult': 2.5, 'sl_mult': 2.5, 'td_mins': 1080}. Best is trial 337 with value: 2.318948203404773.
[I 2026-03-12 01:34:07,023] Trial 783 finished with value: 0.0 and parameters: {'timeframe': 'M1', 'atr_period': 13, 'atr_threshold': 3.0, 'pt_mult': 0.5, 'sl_mult': 5.0, 'td_mins': 5}. Best is trial 337 with value: 2.318948203404773.
[I 2026-03-12 01:34:07,097] Trial 784 pruned. 
[I 2026-03-12 01:34:07,209] Trial 785 pruned. 
[I 2026-03-12 01:34:07,278] Trial 786 pruned. 
[I 2026-03-12 01:34:07,333] Trial 787 finished with value: 0.0 and parameters: {'timeframe': 'M1', 'atr_period': 13, 'atr_threshold': 8.0, 'pt_mult': 5.0, 'sl_mult': 1.0, 'td_mins': 120}. Best is trial 337 with value: 2.318948203404773.
[I 2026-03-12 01:34:07,426] Trial 788 pruned. 
[I 2026-03-12 01:34:07,538] Trial 789 finished with value: 2.318948203404773 and parameters: {'timeframe': 'M1', 'atr_period': 13, 'atr_threshold': 2.0, 'pt_mult': 0.5, 'sl_mult': 5.0, 'td_mins': 5}. Best is trial 337 with value: 2.318948203404773.
[I 2026-03-12 01:34:07,591] Trial 790 finished with value: 0.0 and parameters: {'timeframe': 'M1', 'atr_period': 13, 'atr_threshold': 5.0, 'pt_mult': 0.5, 'sl_mult': 5.0, 'td_mins': 5}. Best is trial 337 with value: 2.318948203404773.
[I 2026-03-12 01:34:07,647] Trial 791 finished with value: 0.0 and parameters: {'timeframe': 'M1', 'atr_period': 13, 'atr_threshold': 10.0, 'pt_mult': 0.5, 'sl_mult': 0.5, 'td_mins': 1080}. Best is trial 337 with value: 2.318948203404773.
[I 2026-03-12 01:34:07,729] Trial 792 pruned. 
[I 2026-03-12 01:34:07,883] Trial 793 pruned. 
[I 2026-03-12 01:34:07,975] Trial 794 finished with value: 2.318948203404773 and parameters: {'timeframe': 'M1', 'atr_period': 13, 'atr_threshold': 2.0, 'pt_mult': 0.5, 'sl_mult': 5.0, 'td_mins': 5}. Best is trial 337 with value: 2.318948203404773.
[I 2026-03-12 01:34:08,058] Trial 795 pruned. 
[I 2026-03-12 01:34:08,109] Trial 796 finished with value: 0.0 and parameters: {'timeframe': 'M1', 'atr_period': 13, 'atr_threshold': 3.0, 'pt_mult': 0.5, 'sl_mult': 0.5, 'td_mins': 60}. Best is trial 337 with value: 2.318948203404773.
[I 2026-03-12 01:34:08,159] Trial 797 finished with value: 0.0 and parameters: {'timeframe': 'M1', 'atr_period': 13, 'atr_threshold': 10.0, 'pt_mult': 1.0, 'sl_mult': 0.5, 'td_mins': 360}. Best is trial 337 with value: 2.318948203404773.
[I 2026-03-12 01:34:08,211] Trial 798 finished with value: 0.0 and parameters: {'timeframe': 'M1', 'atr_period': 13, 'atr_threshold': 10.0, 'pt_mult': 0.5, 'sl_mult': 5.0, 'td_mins': 30}. Best is trial 337 with value: 2.318948203404773.
[I 2026-03-12 01:34:08,264] Trial 799 pruned. 
[I 2026-03-12 01:34:08,316] Trial 800 finished with value: 0.0 and parameters: {'timeframe': 'M1', 'atr_period': 13, 'atr_threshold': 10.0, 'pt_mult': 1.0, 'sl_mult': 1.0, 'td_mins': 720}. Best is trial 337 with value: 2.318948203404773.
[I 2026-03-12 01:34:08,470] Trial 801 pruned. 
[I 2026-03-12 01:34:08,524] Trial 802 finished with value: 0.0 and parameters: {'timeframe': 'M1', 'atr_period': 13, 'atr_threshold': 15.0, 'pt_mult': 2.5, 'sl_mult': 1.0, 'td_mins': 5}. Best is trial 337 with value: 2.318948203404773.
[I 2026-03-12 01:34:08,654] Trial 803 pruned. 
[I 2026-03-12 01:34:08,748] Trial 804 finished with value: 2.318948203404773 and parameters: {'timeframe': 'M1', 'atr_period': 13, 'atr_threshold': 2.0, 'pt_mult': 0.5, 'sl_mult': 5.0, 'td_mins': 5}. Best is trial 337 with value: 2.318948203404773.
[I 2026-03-12 01:34:08,841] Trial 805 finished with value: 2.318948203404773 and parameters: {'timeframe': 'M1', 'atr_period': 13, 'atr_threshold': 2.0, 'pt_mult': 0.5, 'sl_mult': 5.0, 'td_mins': 5}. Best is trial 337 with value: 2.318948203404773.
[I 2026-03-12 01:34:09,009] Trial 806 pruned. 
[I 2026-03-12 01:34:09,102] Trial 807 finished with value: 2.318948203404773 and parameters: {'timeframe': 'M1', 'atr_period': 13, 'atr_threshold': 2.0, 'pt_mult': 0.5, 'sl_mult': 5.0, 'td_mins': 5}. Best is trial 337 with value: 2.318948203404773.
[I 2026-03-12 01:34:09,225] Trial 808 pruned. 
[I 2026-03-12 01:34:09,602] Trial 809 pruned. 
[I 2026-03-12 01:34:09,701] Trial 810 pruned. 
[I 2026-03-12 01:34:09,957] Trial 811 pruned. 
[I 2026-03-12 01:34:10,010] Trial 812 finished with value: 0.0 and parameters: {'timeframe': 'M1', 'atr_period': 13, 'atr_threshold': 5.0, 'pt_mult': 2.5, 'sl_mult': 1.0, 'td_mins': 720}. Best is trial 337 with value: 2.318948203404773.
[I 2026-03-12 01:34:10,129] Trial 813 pruned. 
[I 2026-03-12 01:34:10,178] Trial 814 finished with value: 0.0 and parameters: {'timeframe': 'M1', 'atr_period': 13, 'atr_threshold': 8.0, 'pt_mult': 0.5, 'sl_mult': 5.0, 'td_mins': 5}. Best is trial 337 with value: 2.318948203404773.
[I 2026-03-12 01:34:10,270] Trial 815 finished with value: 2.318948203404773 and parameters: {'timeframe': 'M1', 'atr_period': 13, 'atr_threshold': 2.0, 'pt_mult': 0.5, 'sl_mult': 5.0, 'td_mins': 5}. Best is trial 337 with value: 2.318948203404773.
[I 2026-03-12 01:34:10,326] Trial 816 pruned. 
[I 2026-03-12 01:34:10,376] Trial 817 finished with value: 0.0 and parameters: {'timeframe': 'M1', 'atr_period': 13, 'atr_threshold': 8.0, 'pt_mult': 1.0, 'sl_mult': 1.0, 'td_mins': 1200}. Best is trial 337 with value: 2.318948203404773.
[I 2026-03-12 01:34:10,426] Trial 818 finished with value: 0.0 and parameters: {'timeframe': 'M1', 'atr_period': 13, 'atr_threshold': 15.0, 'pt_mult': 2.5, 'sl_mult': 2.5, 'td_mins': 15}. Best is trial 337 with value: 2.318948203404773.
[I 2026-03-12 01:34:10,581] Trial 819 pruned. 
[I 2026-03-12 01:34:12,144] Trial 820 pruned. 
[I 2026-03-12 01:34:12,197] Trial 821 finished with value: 0.0 and parameters: {'timeframe': 'M1', 'atr_period': 13, 'atr_threshold': 8.0, 'pt_mult': 0.5, 'sl_mult': 2.5, 'td_mins': 180}. Best is trial 337 with value: 2.318948203404773.
[I 2026-03-12 01:34:12,317] Trial 822 finished with value: 2.318948203404773 and parameters: {'timeframe': 'M1', 'atr_period': 13, 'atr_threshold': 2.0, 'pt_mult': 0.5, 'sl_mult': 5.0, 'td_mins': 5}. Best is trial 337 with value: 2.318948203404773.
[I 2026-03-12 01:34:12,413] Trial 823 pruned. 
[I 2026-03-12 01:34:12,827] Trial 824 pruned. 
[I 2026-03-12 01:34:12,919] Trial 825 finished with value: 2.318948203404773 and parameters: {'timeframe': 'M1', 'atr_period': 13, 'atr_threshold': 2.0, 'pt_mult': 0.5, 'sl_mult': 5.0, 'td_mins': 5}. Best is trial 337 with value: 2.318948203404773.
[I 2026-03-12 01:34:12,976] Trial 826 finished with value: 0.0 and parameters: {'timeframe': 'M1', 'atr_period': 13, 'atr_threshold': 8.0, 'pt_mult': 0.5, 'sl_mult': 1.0, 'td_mins': 30}. Best is trial 337 with value: 2.318948203404773.
[I 2026-03-12 01:34:13,028] Trial 827 finished with value: 0.0 and parameters: {'timeframe': 'M1', 'atr_period': 13, 'atr_threshold': 8.0, 'pt_mult': 2.5, 'sl_mult': 0.5, 'td_mins': 5}. Best is trial 337 with value: 2.318948203404773.
[I 2026-03-12 01:34:13,091] Trial 828 pruned. 
[I 2026-03-12 01:34:13,191] Trial 829 finished with value: 2.318948203404773 and parameters: {'timeframe': 'M1', 'atr_period': 13, 'atr_threshold': 2.0, 'pt_mult': 0.5, 'sl_mult': 5.0, 'td_mins': 5}. Best is trial 337 with value: 2.318948203404773.
[I 2026-03-12 01:34:13,340] Trial 830 pruned. 
[I 2026-03-12 01:34:13,406] Trial 831 pruned. 
[I 2026-03-12 01:34:13,507] Trial 832 finished with value: 2.318948203404773 and parameters: {'timeframe': 'M1', 'atr_period': 13, 'atr_threshold': 2.0, 'pt_mult': 0.5, 'sl_mult': 5.0, 'td_mins': 5}. Best is trial 337 with value: 2.318948203404773.
[I 2026-03-12 01:34:16,161] Trial 833 pruned. 
[I 2026-03-12 01:34:16,256] Trial 834 finished with value: 2.318948203404773 and parameters: {'timeframe': 'M1', 'atr_period': 13, 'atr_threshold': 2.0, 'pt_mult': 0.5, 'sl_mult': 5.0, 'td_mins': 5}. Best is trial 337 with value: 2.318948203404773.
[I 2026-03-12 01:34:16,307] Trial 835 finished with value: 0.0 and parameters: {'timeframe': 'M1', 'atr_period': 13, 'atr_threshold': 10.0, 'pt_mult': 5.0, 'sl_mult': 0.5, 'td_mins': 5}. Best is trial 337 with value: 2.318948203404773.
[I 2026-03-12 01:34:16,454] Trial 836 pruned. 
[I 2026-03-12 01:34:16,506] Trial 837 finished with value: 0.0 and parameters: {'timeframe': 'M1', 'atr_period': 13, 'atr_threshold': 8.0, 'pt_mult': 0.5, 'sl_mult': 0.5, 'td_mins': 120}. Best is trial 337 with value: 2.318948203404773.
[I 2026-03-12 01:34:16,607] Trial 838 pruned. 
[I 2026-03-12 01:34:16,696] Trial 839 finished with value: 2.318948203404773 and parameters: {'timeframe': 'M1', 'atr_period': 13, 'atr_threshold': 2.0, 'pt_mult': 0.5, 'sl_mult': 5.0, 'td_mins': 5}. Best is trial 337 with value: 2.318948203404773.
[I 2026-03-12 01:34:16,792] Trial 840 finished with value: 2.318948203404773 and parameters: {'timeframe': 'M1', 'atr_period': 13, 'atr_threshold': 2.0, 'pt_mult': 0.5, 'sl_mult': 5.0, 'td_mins': 5}. Best is trial 337 with value: 2.318948203404773.
[I 2026-03-12 01:34:16,849] Trial 841 finished with value: 0.0 and parameters: {'timeframe': 'M1', 'atr_period': 13, 'atr_threshold': 10.0, 'pt_mult': 0.5, 'sl_mult': 2.5, 'td_mins': 360}. Best is trial 337 with value: 2.318948203404773.
[I 2026-03-12 01:34:16,940] Trial 842 finished with value: 2.318948203404773 and parameters: {'timeframe': 'M1', 'atr_period': 13, 'atr_threshold': 2.0, 'pt_mult': 0.5, 'sl_mult': 5.0, 'td_mins': 5}. Best is trial 337 with value: 2.318948203404773.
[I 2026-03-12 01:34:17,161] Trial 843 pruned. 
[I 2026-03-12 01:34:17,213] Trial 844 finished with value: 0.0 and parameters: {'timeframe': 'M1', 'atr_period': 13, 'atr_threshold': 5.0, 'pt_mult': 5.0, 'sl_mult': 2.5, 'td_mins': 60}. Best is trial 337 with value: 2.318948203404773.
[I 2026-03-12 01:34:17,338] Trial 845 finished with value: 2.318948203404773 and parameters: {'timeframe': 'M1', 'atr_period': 13, 'atr_threshold': 2.0, 'pt_mult': 0.5, 'sl_mult': 5.0, 'td_mins': 5}. Best is trial 337 with value: 2.318948203404773.
[I 2026-03-12 01:34:17,421] Trial 846 pruned. 
[I 2026-03-12 01:34:17,476] Trial 847 finished with value: 0.0 and parameters: {'timeframe': 'M1', 'atr_period': 13, 'atr_threshold': 8.0, 'pt_mult': 0.5, 'sl_mult': 5.0, 'td_mins': 30}. Best is trial 337 with value: 2.318948203404773.
[I 2026-03-12 01:34:17,595] Trial 848 finished with value: 2.318948203404773 and parameters: {'timeframe': 'M1', 'atr_period': 13, 'atr_threshold': 2.0, 'pt_mult': 0.5, 'sl_mult': 5.0, 'td_mins': 5}. Best is trial 337 with value: 2.318948203404773.
[I 2026-03-12 01:34:17,649] Trial 849 finished with value: 0.0 and parameters: {'timeframe': 'M1', 'atr_period': 13, 'atr_threshold': 8.0, 'pt_mult': 1.0, 'sl_mult': 0.5, 'td_mins': 60}. Best is trial 337 with value: 2.318948203404773.
[I 2026-03-12 01:34:17,741] Trial 850 finished with value: 2.318948203404773 and parameters: {'timeframe': 'M1', 'atr_period': 13, 'atr_threshold': 2.0, 'pt_mult': 0.5, 'sl_mult': 5.0, 'td_mins': 5}. Best is trial 337 with value: 2.318948203404773.
[I 2026-03-12 01:34:17,790] Trial 851 finished with value: 0.0 and parameters: {'timeframe': 'M1', 'atr_period': 13, 'atr_threshold': 10.0, 'pt_mult': 1.0, 'sl_mult': 2.5, 'td_mins': 120}. Best is trial 337 with value: 2.318948203404773.
[I 2026-03-12 01:34:17,839] Trial 852 finished with value: 0.0 and parameters: {'timeframe': 'M1', 'atr_period': 13, 'atr_threshold': 15.0, 'pt_mult': 1.0, 'sl_mult': 1.0, 'td_mins': 360}. Best is trial 337 with value: 2.318948203404773.
[I 2026-03-12 01:34:17,930] Trial 853 finished with value: 2.318948203404773 and parameters: {'timeframe': 'M1', 'atr_period': 13, 'atr_threshold': 2.0, 'pt_mult': 0.5, 'sl_mult': 5.0, 'td_mins': 5}. Best is trial 337 with value: 2.318948203404773.
[I 2026-03-12 01:34:18,079] Trial 854 pruned. 
[I 2026-03-12 01:34:18,172] Trial 855 finished with value: 2.318948203404773 and parameters: {'timeframe': 'M1', 'atr_period': 13, 'atr_threshold': 2.0, 'pt_mult': 0.5, 'sl_mult': 5.0, 'td_mins': 5}. Best is trial 337 with value: 2.318948203404773.
[I 2026-03-12 01:34:18,268] Trial 856 finished with value: 2.318948203404773 and parameters: {'timeframe': 'M1', 'atr_period': 13, 'atr_threshold': 2.0, 'pt_mult': 0.5, 'sl_mult': 5.0, 'td_mins': 5}. Best is trial 337 with value: 2.318948203404773.
[I 2026-03-12 01:34:18,322] Trial 857 finished with value: 0.0 and parameters: {'timeframe': 'M1', 'atr_period': 13, 'atr_threshold': 5.0, 'pt_mult': 0.5, 'sl_mult': 2.5, 'td_mins': 30}. Best is trial 337 with value: 2.318948203404773.
[I 2026-03-12 01:34:18,411] Trial 858 pruned. 
[I 2026-03-12 01:34:18,461] Trial 859 finished with value: 0.0 and parameters: {'timeframe': 'M1', 'atr_period': 13, 'atr_threshold': 15.0, 'pt_mult': 0.5, 'sl_mult': 5.0, 'td_mins': 5}. Best is trial 337 with value: 2.318948203404773.
[I 2026-03-12 01:34:18,549] Trial 860 finished with value: 2.318948203404773 and parameters: {'timeframe': 'M1', 'atr_period': 13, 'atr_threshold': 2.0, 'pt_mult': 0.5, 'sl_mult': 5.0, 'td_mins': 5}. Best is trial 337 with value: 2.318948203404773.
[I 2026-03-12 01:34:18,600] Trial 861 finished with value: 0.0 and parameters: {'timeframe': 'M1', 'atr_period': 13, 'atr_threshold': 5.0, 'pt_mult': 5.0, 'sl_mult': 0.5, 'td_mins': 1080}. Best is trial 337 with value: 2.318948203404773.
[I 2026-03-12 01:34:18,653] Trial 862 finished with value: 0.0 and parameters: {'timeframe': 'M1', 'atr_period': 13, 'atr_threshold': 15.0, 'pt_mult': 1.0, 'sl_mult': 2.5, 'td_mins': 30}. Best is trial 337 with value: 2.318948203404773.
[I 2026-03-12 01:34:18,710] Trial 863 finished with value: 0.0 and parameters: {'timeframe': 'M1', 'atr_period': 13, 'atr_threshold': 10.0, 'pt_mult': 5.0, 'sl_mult': 5.0, 'td_mins': 120}. Best is trial 337 with value: 2.318948203404773.
[I 2026-03-12 01:34:18,802] Trial 864 finished with value: 2.318948203404773 and parameters: {'timeframe': 'M1', 'atr_period': 13, 'atr_threshold': 2.0, 'pt_mult': 0.5, 'sl_mult': 5.0, 'td_mins': 5}. Best is trial 337 with value: 2.318948203404773.
[I 2026-03-12 01:34:18,892] Trial 865 finished with value: 2.318948203404773 and parameters: {'timeframe': 'M1', 'atr_period': 13, 'atr_threshold': 2.0, 'pt_mult': 0.5, 'sl_mult': 5.0, 'td_mins': 5}. Best is trial 337 with value: 2.318948203404773.
[I 2026-03-12 01:34:18,944] Trial 866 finished with value: 0.0 and parameters: {'timeframe': 'M1', 'atr_period': 13, 'atr_threshold': 8.0, 'pt_mult': 2.5, 'sl_mult': 2.5, 'td_mins': 120}. Best is trial 337 with value: 2.318948203404773.
[I 2026-03-12 01:34:18,999] Trial 867 pruned. 
[I 2026-03-12 01:34:19,050] Trial 868 finished with value: 0.0 and parameters: {'timeframe': 'M1', 'atr_period': 13, 'atr_threshold': 15.0, 'pt_mult': 0.5, 'sl_mult': 1.0, 'td_mins': 60}. Best is trial 337 with value: 2.318948203404773.
[I 2026-03-12 01:34:19,099] Trial 869 finished with value: 0.0 and parameters: {'timeframe': 'M1', 'atr_period': 13, 'atr_threshold': 10.0, 'pt_mult': 0.5, 'sl_mult': 0.5, 'td_mins': 15}. Best is trial 337 with value: 2.318948203404773.
[I 2026-03-12 01:34:19,215] Trial 870 pruned. 
[I 2026-03-12 01:34:19,333] Trial 871 pruned. 
[I 2026-03-12 01:34:19,425] Trial 872 pruned. 
[I 2026-03-12 01:34:19,489] Trial 873 pruned. 
[I 2026-03-12 01:34:19,581] Trial 874 finished with value: 2.318948203404773 and parameters: {'timeframe': 'M1', 'atr_period': 13, 'atr_threshold': 2.0, 'pt_mult': 0.5, 'sl_mult': 5.0, 'td_mins': 5}. Best is trial 337 with value: 2.318948203404773.
[I 2026-03-12 01:34:19,631] Trial 875 finished with value: 0.0 and parameters: {'timeframe': 'M1', 'atr_period': 13, 'atr_threshold': 3.0, 'pt_mult': 1.0, 'sl_mult': 0.5, 'td_mins': 180}. Best is trial 337 with value: 2.318948203404773.
[I 2026-03-12 01:34:19,682] Trial 876 finished with value: 0.0 and parameters: {'timeframe': 'M1', 'atr_period': 13, 'atr_threshold': 15.0, 'pt_mult': 0.5, 'sl_mult': 2.5, 'td_mins': 30}. Best is trial 337 with value: 2.318948203404773.
[I 2026-03-12 01:34:19,735] Trial 877 pruned. 
[I 2026-03-12 01:34:19,789] Trial 878 finished with value: 0.0 and parameters: {'timeframe': 'M1', 'atr_period': 13, 'atr_threshold': 3.0, 'pt_mult': 1.0, 'sl_mult': 1.0, 'td_mins': 1200}. Best is trial 337 with value: 2.318948203404773.
[I 2026-03-12 01:34:19,839] Trial 879 finished with value: 0.0 and parameters: {'timeframe': 'M1', 'atr_period': 13, 'atr_threshold': 15.0, 'pt_mult': 1.0, 'sl_mult': 0.5, 'td_mins': 5}. Best is trial 337 with value: 2.318948203404773.
[I 2026-03-12 01:34:20,447] Trial 880 pruned. 
[I 2026-03-12 01:34:20,539] Trial 881 finished with value: 2.318948203404773 and parameters: {'timeframe': 'M1', 'atr_period': 13, 'atr_threshold': 2.0, 'pt_mult': 0.5, 'sl_mult': 5.0, 'td_mins': 5}. Best is trial 337 with value: 2.318948203404773.
[I 2026-03-12 01:34:20,689] Trial 882 pruned. 
[I 2026-03-12 01:34:20,744] Trial 883 pruned. 
[I 2026-03-12 01:34:20,796] Trial 884 finished with value: 0.0 and parameters: {'timeframe': 'M1', 'atr_period': 13, 'atr_threshold': 15.0, 'pt_mult': 2.5, 'sl_mult': 5.0, 'td_mins': 720}. Best is trial 337 with value: 2.318948203404773.
[I 2026-03-12 01:34:20,850] Trial 885 finished with value: 0.0 and parameters: {'timeframe': 'M1', 'atr_period': 13, 'atr_threshold': 8.0, 'pt_mult': 2.5, 'sl_mult': 5.0, 'td_mins': 15}. Best is trial 337 with value: 2.318948203404773.
[I 2026-03-12 01:34:20,939] Trial 886 pruned. 
[I 2026-03-12 01:34:20,990] Trial 887 finished with value: 0.0 and parameters: {'timeframe': 'M1', 'atr_period': 13, 'atr_threshold': 3.0, 'pt_mult': 2.5, 'sl_mult': 1.0, 'td_mins': 180}. Best is trial 337 with value: 2.318948203404773.
[I 2026-03-12 01:34:22,053] Trial 888 pruned. 
[I 2026-03-12 01:34:22,106] Trial 889 finished with value: 0.0 and parameters: {'timeframe': 'M1', 'atr_period': 13, 'atr_threshold': 8.0, 'pt_mult': 2.5, 'sl_mult': 2.5, 'td_mins': 60}. Best is trial 337 with value: 2.318948203404773.
[I 2026-03-12 01:34:22,188] Trial 890 pruned. 
[I 2026-03-12 01:34:22,240] Trial 891 finished with value: 0.0 and parameters: {'timeframe': 'M1', 'atr_period': 13, 'atr_threshold': 3.0, 'pt_mult': 5.0, 'sl_mult': 1.0, 'td_mins': 120}. Best is trial 337 with value: 2.318948203404773.
[I 2026-03-12 01:34:22,295] Trial 892 finished with value: 0.0 and parameters: {'timeframe': 'M1', 'atr_period': 13, 'atr_threshold': 3.0, 'pt_mult': 0.5, 'sl_mult': 5.0, 'td_mins': 5}. Best is trial 337 with value: 2.318948203404773.
[I 2026-03-12 01:34:22,352] Trial 893 finished with value: 0.0 and parameters: {'timeframe': 'M1', 'atr_period': 13, 'atr_threshold': 3.0, 'pt_mult': 1.0, 'sl_mult': 0.5, 'td_mins': 5}. Best is trial 337 with value: 2.318948203404773.
[I 2026-03-12 01:34:22,487] Trial 894 pruned. 
[I 2026-03-12 01:34:22,541] Trial 895 finished with value: 0.0 and parameters: {'timeframe': 'M1', 'atr_period': 13, 'atr_threshold': 10.0, 'pt_mult': 2.5, 'sl_mult': 2.5, 'td_mins': 30}. Best is trial 337 with value: 2.318948203404773.
[I 2026-03-12 01:34:22,638] Trial 896 pruned. 
[I 2026-03-12 01:34:22,731] Trial 897 finished with value: 2.318948203404773 and parameters: {'timeframe': 'M1', 'atr_period': 13, 'atr_threshold': 2.0, 'pt_mult': 0.5, 'sl_mult': 5.0, 'td_mins': 5}. Best is trial 337 with value: 2.318948203404773.
[I 2026-03-12 01:34:22,795] Trial 898 pruned. 
[I 2026-03-12 01:34:22,871] Trial 899 pruned. 
[I 2026-03-12 01:34:22,922] Trial 900 finished with value: 0.0 and parameters: {'timeframe': 'M1', 'atr_period': 13, 'atr_threshold': 10.0, 'pt_mult': 0.5, 'sl_mult': 5.0, 'td_mins': 5}. Best is trial 337 with value: 2.318948203404773.
[I 2026-03-12 01:34:23,014] Trial 901 finished with value: 2.318948203404773 and parameters: {'timeframe': 'M1', 'atr_period': 13, 'atr_threshold': 2.0, 'pt_mult': 0.5, 'sl_mult': 5.0, 'td_mins': 5}. Best is trial 337 with value: 2.318948203404773.
[I 2026-03-12 01:34:23,093] Trial 902 pruned. 
[I 2026-03-12 01:34:24,588] Trial 903 pruned. 
[I 2026-03-12 01:34:25,568] Trial 904 pruned. 
[I 2026-03-12 01:34:25,634] Trial 905 pruned. 
[I 2026-03-12 01:34:25,754] Trial 906 pruned. 
[I 2026-03-12 01:34:25,911] Trial 907 pruned. 
[I 2026-03-12 01:34:26,033] Trial 908 pruned. 
[I 2026-03-12 01:34:26,086] Trial 909 finished with value: 0.0 and parameters: {'timeframe': 'M1', 'atr_period': 13, 'atr_threshold': 15.0, 'pt_mult': 1.0, 'sl_mult': 5.0, 'td_mins': 30}. Best is trial 337 with value: 2.318948203404773.
[I 2026-03-12 01:34:26,180] Trial 910 finished with value: 2.318948203404773 and parameters: {'timeframe': 'M1', 'atr_period': 13, 'atr_threshold': 2.0, 'pt_mult': 0.5, 'sl_mult': 5.0, 'td_mins': 5}. Best is trial 337 with value: 2.318948203404773.
[I 2026-03-12 01:34:26,482] Trial 911 pruned. 
[I 2026-03-12 01:34:26,572] Trial 912 finished with value: 2.318948203404773 and parameters: {'timeframe': 'M1', 'atr_period': 13, 'atr_threshold': 2.0, 'pt_mult': 0.5, 'sl_mult': 5.0, 'td_mins': 5}. Best is trial 337 with value: 2.318948203404773.
[I 2026-03-12 01:34:26,632] Trial 913 pruned. 
[I 2026-03-12 01:34:26,685] Trial 914 finished with value: 0.0 and parameters: {'timeframe': 'M1', 'atr_period': 13, 'atr_threshold': 8.0, 'pt_mult': 0.5, 'sl_mult': 5.0, 'td_mins': 5}. Best is trial 337 with value: 2.318948203404773.
[I 2026-03-12 01:34:26,776] Trial 915 finished with value: 2.318948203404773 and parameters: {'timeframe': 'M1', 'atr_period': 13, 'atr_threshold': 2.0, 'pt_mult': 0.5, 'sl_mult': 5.0, 'td_mins': 5}. Best is trial 337 with value: 2.318948203404773.
[I 2026-03-12 01:34:26,841] Trial 916 pruned. 
[I 2026-03-12 01:34:26,893] Trial 917 finished with value: 0.0 and parameters: {'timeframe': 'M1', 'atr_period': 13, 'atr_threshold': 5.0, 'pt_mult': 0.5, 'sl_mult': 5.0, 'td_mins': 5}. Best is trial 337 with value: 2.318948203404773.
