[I 2026-03-12 01:56:30,756] Trial 625 finished with value: 0.0 and parameters: {'timeframe': 'M8', 'atr_period': 13, 'atr_threshold': 10.0, 'pt_mult': 0.5, 'sl_mult': 1.0, 'td_mins': 120}. Best is trial 398 with value: 3.484125427035651.
[I 2026-03-12 01:56:30,826] Trial 626 pruned. 
[I 2026-03-12 01:56:30,882] Trial 627 pruned. 
[I 2026-03-12 01:56:30,930] Trial 628 finished with value: 0.0 and parameters: {'timeframe': 'M8', 'atr_period': 13, 'atr_threshold': 10.0, 'pt_mult': 0.5, 'sl_mult': 5.0, 'td_mins': 120}. Best is trial 398 with value: 3.484125427035651.
[I 2026-03-12 01:56:31,361] Trial 629 pruned. 
[I 2026-03-12 01:56:31,416] Trial 630 pruned. 
[I 2026-03-12 01:56:31,465] Trial 631 finished with value: 0.0 and parameters: {'timeframe': 'M8', 'atr_period': 13, 'atr_threshold': 15.0, 'pt_mult': 0.5, 'sl_mult': 5.0, 'td_mins': 120}. Best is trial 398 with value: 3.484125427035651.
[I 2026-03-12 01:56:31,737] Trial 632 finished with value: 2.5123680363096774 and parameters: {'timeframe': 'M8', 'atr_period': 13, 'atr_threshold': 3.0, 'pt_mult': 0.5, 'sl_mult': 5.0, 'td_mins': 120}. Best is trial 398 with value: 3.484125427035651.
[I 2026-03-12 01:56:31,795] Trial 633 finished with value: 0.0 and parameters: {'timeframe': 'M8', 'atr_period': 13, 'atr_threshold': 8.0, 'pt_mult': 5.0, 'sl_mult': 5.0, 'td_mins': 120}. Best is trial 398 with value: 3.484125427035651.
[I 2026-03-12 01:56:31,848] Trial 634 finished with value: 0.0 and parameters: {'timeframe': 'M8', 'atr_period': 13, 'atr_threshold': 10.0, 'pt_mult': 1.0, 'sl_mult': 1.0, 'td_mins': 1080}. Best is trial 398 with value: 3.484125427035651.
[I 2026-03-12 01:56:31,979] Trial 635 finished with value: 3.484125427035651 and parameters: {'timeframe': 'M8', 'atr_period': 13, 'atr_threshold': 5.0, 'pt_mult': 0.5, 'sl_mult': 5.0, 'td_mins': 120}. Best is trial 398 with value: 3.484125427035651.
[I 2026-03-12 01:56:32,031] Trial 636 finished with value: 0.0 and parameters: {'timeframe': 'M8', 'atr_period': 13, 'atr_threshold': 10.0, 'pt_mult': 5.0, 'sl_mult': 5.0, 'td_mins': 720}. Best is trial 398 with value: 3.484125427035651.
[I 2026-03-12 01:56:32,439] Trial 637 pruned. 
[I 2026-03-12 01:56:32,698] Trial 638 pruned. 
[I 2026-03-12 01:56:32,804] Trial 639 finished with value: 3.484125427035651 and parameters: {'timeframe': 'M8', 'atr_period': 13, 'atr_threshold': 5.0, 'pt_mult': 0.5, 'sl_mult': 5.0, 'td_mins': 120}. Best is trial 398 with value: 3.484125427035651.
[I 2026-03-12 01:56:32,853] Trial 640 finished with value: 0.0 and parameters: {'timeframe': 'M8', 'atr_period': 13, 'atr_threshold': 8.0, 'pt_mult': 0.5, 'sl_mult': 5.0, 'td_mins': 120}. Best is trial 398 with value: 3.484125427035651.
[I 2026-03-12 01:56:32,931] Trial 641 pruned. 
[I 2026-03-12 01:56:33,007] Trial 642 finished with value: 2.4896042006737558 and parameters: {'timeframe': 'M8', 'atr_period': 13, 'atr_threshold': 5.0, 'pt_mult': 0.5, 'sl_mult': 5.0, 'td_mins': 30}. Best is trial 398 with value: 3.484125427035651.
[I 2026-03-12 01:56:33,355] Trial 643 finished with value: 1.5146017913734133 and parameters: {'timeframe': 'M8', 'atr_period': 13, 'atr_threshold': 5.0, 'pt_mult': 0.5, 'sl_mult': 5.0, 'td_mins': 720}. Best is trial 398 with value: 3.484125427035651.
[I 2026-03-12 01:56:33,468] Trial 644 finished with value: 2.7985173655325846 and parameters: {'timeframe': 'M8', 'atr_period': 13, 'atr_threshold': 5.0, 'pt_mult': 1.0, 'sl_mult': 5.0, 'td_mins': 120}. Best is trial 398 with value: 3.484125427035651.
[I 2026-03-12 01:56:33,584] Trial 645 finished with value: 3.484125427035651 and parameters: {'timeframe': 'M8', 'atr_period': 13, 'atr_threshold': 5.0, 'pt_mult': 0.5, 'sl_mult': 5.0, 'td_mins': 120}. Best is trial 398 with value: 3.484125427035651.
[I 2026-03-12 01:56:33,637] Trial 646 finished with value: 0.0 and parameters: {'timeframe': 'M8', 'atr_period': 13, 'atr_threshold': 10.0, 'pt_mult': 0.5, 'sl_mult': 5.0, 'td_mins': 5}. Best is trial 398 with value: 3.484125427035651.
[I 2026-03-12 01:56:33,754] Trial 647 finished with value: 1.8479405007566938 and parameters: {'timeframe': 'M8', 'atr_period': 13, 'atr_threshold': 5.0, 'pt_mult': 2.5, 'sl_mult': 5.0, 'td_mins': 120}. Best is trial 398 with value: 3.484125427035651.
[I 2026-03-12 01:56:33,805] Trial 648 pruned. 
[I 2026-03-12 01:56:33,919] Trial 649 finished with value: 3.484125427035651 and parameters: {'timeframe': 'M8', 'atr_period': 13, 'atr_threshold': 5.0, 'pt_mult': 0.5, 'sl_mult': 5.0, 'td_mins': 120}. Best is trial 398 with value: 3.484125427035651.
[I 2026-03-12 01:56:34,024] Trial 650 finished with value: 3.484125427035651 and parameters: {'timeframe': 'M8', 'atr_period': 13, 'atr_threshold': 5.0, 'pt_mult': 0.5, 'sl_mult': 5.0, 'td_mins': 120}. Best is trial 398 with value: 3.484125427035651.
[I 2026-03-12 01:56:34,139] Trial 651 finished with value: 3.484125427035651 and parameters: {'timeframe': 'M8', 'atr_period': 13, 'atr_threshold': 5.0, 'pt_mult': 0.5, 'sl_mult': 5.0, 'td_mins': 120}. Best is trial 398 with value: 3.484125427035651.
[I 2026-03-12 01:56:34,187] Trial 652 finished with value: 0.0 and parameters: {'timeframe': 'M8', 'atr_period': 13, 'atr_threshold': 8.0, 'pt_mult': 5.0, 'sl_mult': 1.0, 'td_mins': 180}. Best is trial 398 with value: 3.484125427035651.
[I 2026-03-12 01:56:34,298] Trial 653 finished with value: 3.484125427035651 and parameters: {'timeframe': 'M8', 'atr_period': 13, 'atr_threshold': 5.0, 'pt_mult': 0.5, 'sl_mult': 5.0, 'td_mins': 120}. Best is trial 398 with value: 3.484125427035651.
[I 2026-03-12 01:56:34,450] Trial 654 finished with value: 3.484125427035651 and parameters: {'timeframe': 'M8', 'atr_period': 13, 'atr_threshold': 5.0, 'pt_mult': 0.5, 'sl_mult': 5.0, 'td_mins': 120}. Best is trial 398 with value: 3.484125427035651.
[I 2026-03-12 01:56:34,497] Trial 655 finished with value: 0.0 and parameters: {'timeframe': 'M8', 'atr_period': 13, 'atr_threshold': 15.0, 'pt_mult': 1.0, 'sl_mult': 2.5, 'td_mins': 1080}. Best is trial 398 with value: 3.484125427035651.
[I 2026-03-12 01:56:34,553] Trial 656 pruned. 
[I 2026-03-12 01:56:34,606] Trial 657 pruned. 
[I 2026-03-12 01:56:34,697] Trial 658 pruned. 
[I 2026-03-12 01:56:34,830] Trial 659 pruned. 
[I 2026-03-12 01:56:34,883] Trial 660 pruned. 
[I 2026-03-12 01:56:34,997] Trial 661 finished with value: 3.484125427035651 and parameters: {'timeframe': 'M8', 'atr_period': 13, 'atr_threshold': 5.0, 'pt_mult': 0.5, 'sl_mult': 5.0, 'td_mins': 120}. Best is trial 398 with value: 3.484125427035651.
[I 2026-03-12 01:56:35,108] Trial 662 finished with value: 3.484125427035651 and parameters: {'timeframe': 'M8', 'atr_period': 13, 'atr_threshold': 5.0, 'pt_mult': 0.5, 'sl_mult': 5.0, 'td_mins': 120}. Best is trial 398 with value: 3.484125427035651.
[I 2026-03-12 01:56:35,221] Trial 663 finished with value: 3.484125427035651 and parameters: {'timeframe': 'M8', 'atr_period': 13, 'atr_threshold': 5.0, 'pt_mult': 0.5, 'sl_mult': 5.0, 'td_mins': 120}. Best is trial 398 with value: 3.484125427035651.
[I 2026-03-12 01:56:35,329] Trial 664 finished with value: 3.484125427035651 and parameters: {'timeframe': 'M8', 'atr_period': 13, 'atr_threshold': 5.0, 'pt_mult': 0.5, 'sl_mult': 5.0, 'td_mins': 120}. Best is trial 398 with value: 3.484125427035651.
[I 2026-03-12 01:56:35,379] Trial 665 pruned. 
[I 2026-03-12 01:56:35,581] Trial 666 finished with value: 1.4967331369168109 and parameters: {'timeframe': 'M8', 'atr_period': 13, 'atr_threshold': 5.0, 'pt_mult': 0.5, 'sl_mult': 5.0, 'td_mins': 360}. Best is trial 398 with value: 3.484125427035651.
[I 2026-03-12 01:56:35,638] Trial 667 pruned. 
[I 2026-03-12 01:56:35,754] Trial 668 finished with value: 3.484125427035651 and parameters: {'timeframe': 'M8', 'atr_period': 13, 'atr_threshold': 5.0, 'pt_mult': 0.5, 'sl_mult': 5.0, 'td_mins': 120}. Best is trial 398 with value: 3.484125427035651.
[I 2026-03-12 01:56:36,323] Trial 669 finished with value: 1.5668979101552964 and parameters: {'timeframe': 'M8', 'atr_period': 13, 'atr_threshold': 5.0, 'pt_mult': 2.5, 'sl_mult': 5.0, 'td_mins': 1080}. Best is trial 398 with value: 3.484125427035651.
[I 2026-03-12 01:56:36,420] Trial 670 pruned. 
[I 2026-03-12 01:56:36,554] Trial 671 pruned. 
[I 2026-03-12 01:56:36,654] Trial 672 pruned. 
[I 2026-03-12 01:56:36,805] Trial 673 pruned. 
[I 2026-03-12 01:56:36,934] Trial 674 finished with value: 3.484125427035651 and parameters: {'timeframe': 'M8', 'atr_period': 13, 'atr_threshold': 5.0, 'pt_mult': 0.5, 'sl_mult': 5.0, 'td_mins': 120}. Best is trial 398 with value: 3.484125427035651.
[I 2026-03-12 01:56:36,996] Trial 675 pruned. 
[I 2026-03-12 01:56:37,112] Trial 676 pruned. 
[I 2026-03-12 01:56:37,231] Trial 677 finished with value: 3.484125427035651 and parameters: {'timeframe': 'M8', 'atr_period': 13, 'atr_threshold': 5.0, 'pt_mult': 0.5, 'sl_mult': 5.0, 'td_mins': 120}. Best is trial 398 with value: 3.484125427035651.
[I 2026-03-12 01:56:37,371] Trial 678 finished with value: 2.85002292450261 and parameters: {'timeframe': 'M8', 'atr_period': 13, 'atr_threshold': 5.0, 'pt_mult': 0.5, 'sl_mult': 5.0, 'td_mins': 180}. Best is trial 398 with value: 3.484125427035651.
[I 2026-03-12 01:56:37,424] Trial 679 pruned. 
[I 2026-03-12 01:56:37,479] Trial 680 pruned. 
[I 2026-03-12 01:56:37,574] Trial 681 pruned. 
[I 2026-03-12 01:56:37,628] Trial 682 pruned. 
[I 2026-03-12 01:56:37,738] Trial 683 finished with value: 3.484125427035651 and parameters: {'timeframe': 'M8', 'atr_period': 13, 'atr_threshold': 5.0, 'pt_mult': 0.5, 'sl_mult': 5.0, 'td_mins': 120}. Best is trial 398 with value: 3.484125427035651.
[I 2026-03-12 01:56:37,844] Trial 684 finished with value: 3.484125427035651 and parameters: {'timeframe': 'M8', 'atr_period': 13, 'atr_threshold': 5.0, 'pt_mult': 0.5, 'sl_mult': 5.0, 'td_mins': 120}. Best is trial 398 with value: 3.484125427035651.
[I 2026-03-12 01:56:37,895] Trial 685 finished with value: 0.0 and parameters: {'timeframe': 'M8', 'atr_period': 13, 'atr_threshold': 15.0, 'pt_mult': 0.5, 'sl_mult': 5.0, 'td_mins': 60}. Best is trial 398 with value: 3.484125427035651.
[I 2026-03-12 01:56:37,999] Trial 686 pruned. 
[I 2026-03-12 01:56:38,049] Trial 687 finished with value: 0.0 and parameters: {'timeframe': 'M8', 'atr_period': 13, 'atr_threshold': 15.0, 'pt_mult': 0.5, 'sl_mult': 2.5, 'td_mins': 1200}. Best is trial 398 with value: 3.484125427035651.
[I 2026-03-12 01:56:38,098] Trial 688 finished with value: 0.0 and parameters: {'timeframe': 'M8', 'atr_period': 13, 'atr_threshold': 15.0, 'pt_mult': 5.0, 'sl_mult': 5.0, 'td_mins': 720}. Best is trial 398 with value: 3.484125427035651.
[I 2026-03-12 01:56:38,213] Trial 689 finished with value: 3.484125427035651 and parameters: {'timeframe': 'M8', 'atr_period': 13, 'atr_threshold': 5.0, 'pt_mult': 0.5, 'sl_mult': 5.0, 'td_mins': 120}. Best is trial 398 with value: 3.484125427035651.
[I 2026-03-12 01:56:38,265] Trial 690 finished with value: 0.0 and parameters: {'timeframe': 'M8', 'atr_period': 13, 'atr_threshold': 8.0, 'pt_mult': 2.5, 'sl_mult': 2.5, 'td_mins': 720}. Best is trial 398 with value: 3.484125427035651.
[I 2026-03-12 01:56:38,377] Trial 691 finished with value: 3.484125427035651 and parameters: {'timeframe': 'M8', 'atr_period': 13, 'atr_threshold': 5.0, 'pt_mult': 0.5, 'sl_mult': 5.0, 'td_mins': 120}. Best is trial 398 with value: 3.484125427035651.
[I 2026-03-12 01:56:38,486] Trial 692 finished with value: 3.484125427035651 and parameters: {'timeframe': 'M8', 'atr_period': 13, 'atr_threshold': 5.0, 'pt_mult': 0.5, 'sl_mult': 5.0, 'td_mins': 120}. Best is trial 398 with value: 3.484125427035651.
[I 2026-03-12 01:56:39,152] Trial 693 pruned. 
[I 2026-03-12 01:56:39,202] Trial 694 finished with value: 0.0 and parameters: {'timeframe': 'M8', 'atr_period': 13, 'atr_threshold': 15.0, 'pt_mult': 2.5, 'sl_mult': 5.0, 'td_mins': 360}. Best is trial 398 with value: 3.484125427035651.
[I 2026-03-12 01:56:39,315] Trial 695 finished with value: 3.484125427035651 and parameters: {'timeframe': 'M8', 'atr_period': 13, 'atr_threshold': 5.0, 'pt_mult': 0.5, 'sl_mult': 5.0, 'td_mins': 120}. Best is trial 398 with value: 3.484125427035651.
[I 2026-03-12 01:56:39,611] Trial 696 pruned. 
[I 2026-03-12 01:56:39,817] Trial 697 pruned. 
[I 2026-03-12 01:56:39,928] Trial 698 finished with value: 3.484125427035651 and parameters: {'timeframe': 'M8', 'atr_period': 13, 'atr_threshold': 5.0, 'pt_mult': 0.5, 'sl_mult': 5.0, 'td_mins': 120}. Best is trial 398 with value: 3.484125427035651.
[I 2026-03-12 01:56:39,989] Trial 699 pruned. 
[I 2026-03-12 01:56:40,065] Trial 700 pruned. 
[I 2026-03-12 01:56:40,156] Trial 701 finished with value: 2.4109998442846625 and parameters: {'timeframe': 'M8', 'atr_period': 13, 'atr_threshold': 5.0, 'pt_mult': 1.0, 'sl_mult': 5.0, 'td_mins': 60}. Best is trial 398 with value: 3.484125427035651.
[I 2026-03-12 01:56:40,206] Trial 702 finished with value: 0.0 and parameters: {'timeframe': 'M8', 'atr_period': 13, 'atr_threshold': 8.0, 'pt_mult': 0.5, 'sl_mult': 2.5, 'td_mins': 5}. Best is trial 398 with value: 3.484125427035651.
[I 2026-03-12 01:56:40,559] Trial 703 pruned. 
[I 2026-03-12 01:56:42,859] Trial 704 pruned. 
[I 2026-03-12 01:56:42,919] Trial 705 finished with value: 0.0 and parameters: {'timeframe': 'M8', 'atr_period': 13, 'atr_threshold': 10.0, 'pt_mult': 0.5, 'sl_mult': 5.0, 'td_mins': 720}. Best is trial 398 with value: 3.484125427035651.
[I 2026-03-12 01:56:42,991] Trial 706 pruned. 
[I 2026-03-12 01:56:43,042] Trial 707 finished with value: 0.0 and parameters: {'timeframe': 'M8', 'atr_period': 13, 'atr_threshold': 15.0, 'pt_mult': 5.0, 'sl_mult': 2.5, 'td_mins': 15}. Best is trial 398 with value: 3.484125427035651.
[I 2026-03-12 01:56:43,238] Trial 708 pruned. 
[I 2026-03-12 01:56:44,357] Trial 709 pruned. 
[I 2026-03-12 01:56:44,569] Trial 710 pruned. 
[I 2026-03-12 01:56:44,632] Trial 711 pruned. 
[I 2026-03-12 01:56:44,757] Trial 712 finished with value: 3.484125427035651 and parameters: {'timeframe': 'M8', 'atr_period': 13, 'atr_threshold': 5.0, 'pt_mult': 0.5, 'sl_mult': 5.0, 'td_mins': 120}. Best is trial 398 with value: 3.484125427035651.
[I 2026-03-12 01:56:44,822] Trial 713 pruned. 
[I 2026-03-12 01:56:45,024] Trial 714 pruned. 
[I 2026-03-12 01:56:45,135] Trial 715 finished with value: 3.484125427035651 and parameters: {'timeframe': 'M8', 'atr_period': 13, 'atr_threshold': 5.0, 'pt_mult': 0.5, 'sl_mult': 5.0, 'td_mins': 120}. Best is trial 398 with value: 3.484125427035651.
[I 2026-03-12 01:56:45,798] Trial 716 pruned. 
[I 2026-03-12 01:56:45,910] Trial 717 finished with value: 3.484125427035651 and parameters: {'timeframe': 'M8', 'atr_period': 13, 'atr_threshold': 5.0, 'pt_mult': 0.5, 'sl_mult': 5.0, 'td_mins': 120}. Best is trial 398 with value: 3.484125427035651.
[I 2026-03-12 01:56:45,979] Trial 718 pruned. 
[I 2026-03-12 01:56:46,093] Trial 719 pruned. 
[I 2026-03-12 01:56:46,153] Trial 720 pruned. 
[I 2026-03-12 01:56:46,295] Trial 721 pruned. 
[I 2026-03-12 01:56:46,345] Trial 722 finished with value: 0.0 and parameters: {'timeframe': 'M8', 'atr_period': 13, 'atr_threshold': 15.0, 'pt_mult': 5.0, 'sl_mult': 2.5, 'td_mins': 5}. Best is trial 398 with value: 3.484125427035651.
[I 2026-03-12 01:56:46,460] Trial 723 finished with value: 3.484125427035651 and parameters: {'timeframe': 'M8', 'atr_period': 13, 'atr_threshold': 5.0, 'pt_mult': 0.5, 'sl_mult': 5.0, 'td_mins': 120}. Best is trial 398 with value: 3.484125427035651.
[I 2026-03-12 01:56:46,508] Trial 724 finished with value: 0.0 and parameters: {'timeframe': 'M8', 'atr_period': 13, 'atr_threshold': 8.0, 'pt_mult': 0.5, 'sl_mult': 1.0, 'td_mins': 180}. Best is trial 398 with value: 3.484125427035651.
[I 2026-03-12 01:56:46,619] Trial 725 finished with value: 3.484125427035651 and parameters: {'timeframe': 'M8', 'atr_period': 13, 'atr_threshold': 5.0, 'pt_mult': 0.5, 'sl_mult': 5.0, 'td_mins': 120}. Best is trial 398 with value: 3.484125427035651.
[I 2026-03-12 01:56:46,821] Trial 726 pruned. 
[I 2026-03-12 01:56:47,843] Trial 727 pruned. 
[I 2026-03-12 01:56:47,898] Trial 728 pruned. 
[I 2026-03-12 01:56:48,142] Trial 729 pruned. 
[I 2026-03-12 01:56:48,193] Trial 730 pruned. 
[I 2026-03-12 01:56:48,252] Trial 731 pruned. 
[I 2026-03-12 01:56:48,321] Trial 732 finished with value: 0.0 and parameters: {'timeframe': 'M8', 'atr_period': 13, 'atr_threshold': 15.0, 'pt_mult': 1.0, 'sl_mult': 5.0, 'td_mins': 720}. Best is trial 398 with value: 3.484125427035651.
[I 2026-03-12 01:56:48,387] Trial 733 pruned. 
[I 2026-03-12 01:56:48,438] Trial 734 finished with value: 0.0 and parameters: {'timeframe': 'M8', 'atr_period': 13, 'atr_threshold': 15.0, 'pt_mult': 0.5, 'sl_mult': 5.0, 'td_mins': 120}. Best is trial 398 with value: 3.484125427035651.
[I 2026-03-12 01:56:48,560] Trial 735 finished with value: 1.8479405007566938 and parameters: {'timeframe': 'M8', 'atr_period': 13, 'atr_threshold': 5.0, 'pt_mult': 2.5, 'sl_mult': 5.0, 'td_mins': 120}. Best is trial 398 with value: 3.484125427035651.
[I 2026-03-12 01:56:48,614] Trial 736 finished with value: 0.0 and parameters: {'timeframe': 'M8', 'atr_period': 13, 'atr_threshold': 10.0, 'pt_mult': 0.5, 'sl_mult': 5.0, 'td_mins': 120}. Best is trial 398 with value: 3.484125427035651.
[I 2026-03-12 01:56:48,705] Trial 737 finished with value: 2.4896042006737558 and parameters: {'timeframe': 'M8', 'atr_period': 13, 'atr_threshold': 5.0, 'pt_mult': 0.5, 'sl_mult': 5.0, 'td_mins': 30}. Best is trial 398 with value: 3.484125427035651.
[I 2026-03-12 01:56:49,072] Trial 738 pruned. 
[I 2026-03-12 01:56:49,525] Trial 739 pruned. 
[I 2026-03-12 01:56:49,652] Trial 740 finished with value: 3.484125427035651 and parameters: {'timeframe': 'M8', 'atr_period': 13, 'atr_threshold': 5.0, 'pt_mult': 0.5, 'sl_mult': 5.0, 'td_mins': 120}. Best is trial 398 with value: 3.484125427035651.
[I 2026-03-12 01:56:49,708] Trial 741 finished with value: 0.0 and parameters: {'timeframe': 'M8', 'atr_period': 13, 'atr_threshold': 10.0, 'pt_mult': 5.0, 'sl_mult': 5.0, 'td_mins': 180}. Best is trial 398 with value: 3.484125427035651.
[I 2026-03-12 01:56:49,910] Trial 742 pruned. 
[I 2026-03-12 01:56:50,120] Trial 743 pruned. 
[I 2026-03-12 01:56:50,398] Trial 744 pruned. 
[I 2026-03-12 01:56:50,589] Trial 745 pruned. 
[I 2026-03-12 01:56:51,302] Trial 746 pruned. 
[I 2026-03-12 01:56:51,359] Trial 747 finished with value: 0.0 and parameters: {'timeframe': 'M8', 'atr_period': 13, 'atr_threshold': 10.0, 'pt_mult': 2.5, 'sl_mult': 2.5, 'td_mins': 15}. Best is trial 398 with value: 3.484125427035651.
[I 2026-03-12 01:56:51,412] Trial 748 finished with value: 0.0 and parameters: {'timeframe': 'M8', 'atr_period': 13, 'atr_threshold': 15.0, 'pt_mult': 2.5, 'sl_mult': 0.5, 'td_mins': 1080}. Best is trial 398 with value: 3.484125427035651.
[I 2026-03-12 01:56:51,525] Trial 749 finished with value: 3.484125427035651 and parameters: {'timeframe': 'M8', 'atr_period': 13, 'atr_threshold': 5.0, 'pt_mult': 0.5, 'sl_mult': 5.0, 'td_mins': 120}. Best is trial 398 with value: 3.484125427035651.
[I 2026-03-12 01:56:51,774] Trial 750 pruned. 
[I 2026-03-12 01:56:51,831] Trial 751 finished with value: 0.0 and parameters: {'timeframe': 'M8', 'atr_period': 13, 'atr_threshold': 8.0, 'pt_mult': 0.5, 'sl_mult': 5.0, 'td_mins': 120}. Best is trial 398 with value: 3.484125427035651.
[I 2026-03-12 01:56:51,970] Trial 752 finished with value: 2.7985173655325846 and parameters: {'timeframe': 'M8', 'atr_period': 13, 'atr_threshold': 5.0, 'pt_mult': 1.0, 'sl_mult': 5.0, 'td_mins': 120}. Best is trial 398 with value: 3.484125427035651.
[I 2026-03-12 01:56:52,032] Trial 753 pruned. 
[I 2026-03-12 01:56:52,157] Trial 754 finished with value: 3.484125427035651 and parameters: {'timeframe': 'M8', 'atr_period': 13, 'atr_threshold': 5.0, 'pt_mult': 0.5, 'sl_mult': 5.0, 'td_mins': 120}. Best is trial 398 with value: 3.484125427035651.
[I 2026-03-12 01:56:52,495] Trial 755 finished with value: 1.5146017913734133 and parameters: {'timeframe': 'M8', 'atr_period': 13, 'atr_threshold': 5.0, 'pt_mult': 0.5, 'sl_mult': 5.0, 'td_mins': 720}. Best is trial 398 with value: 3.484125427035651.
[I 2026-03-12 01:56:52,652] Trial 756 pruned. 
[I 2026-03-12 01:56:52,704] Trial 757 pruned. 
[I 2026-03-12 01:56:52,812] Trial 758 finished with value: 3.484125427035651 and parameters: {'timeframe': 'M8', 'atr_period': 13, 'atr_threshold': 5.0, 'pt_mult': 0.5, 'sl_mult': 5.0, 'td_mins': 120}. Best is trial 398 with value: 3.484125427035651.
[I 2026-03-12 01:56:52,924] Trial 759 finished with value: 3.484125427035651 and parameters: {'timeframe': 'M8', 'atr_period': 13, 'atr_threshold': 5.0, 'pt_mult': 0.5, 'sl_mult': 5.0, 'td_mins': 120}. Best is trial 398 with value: 3.484125427035651.
[I 2026-03-12 01:56:54,845] Trial 760 pruned. 
[I 2026-03-12 01:56:54,960] Trial 761 pruned. 
[I 2026-03-12 01:56:55,071] Trial 762 finished with value: 3.484125427035651 and parameters: {'timeframe': 'M8', 'atr_period': 13, 'atr_threshold': 5.0, 'pt_mult': 0.5, 'sl_mult': 5.0, 'td_mins': 120}. Best is trial 398 with value: 3.484125427035651.
[I 2026-03-12 01:56:55,181] Trial 763 finished with value: 3.484125427035651 and parameters: {'timeframe': 'M8', 'atr_period': 13, 'atr_threshold': 5.0, 'pt_mult': 0.5, 'sl_mult': 5.0, 'td_mins': 120}. Best is trial 398 with value: 3.484125427035651.
[I 2026-03-12 01:56:55,287] Trial 764 pruned. 
[I 2026-03-12 01:56:56,071] Trial 765 pruned. 
[I 2026-03-12 01:56:56,181] Trial 766 finished with value: 3.484125427035651 and parameters: {'timeframe': 'M8', 'atr_period': 13, 'atr_threshold': 5.0, 'pt_mult': 0.5, 'sl_mult': 5.0, 'td_mins': 120}. Best is trial 398 with value: 3.484125427035651.
[I 2026-03-12 01:56:56,299] Trial 767 finished with value: 3.484125427035651 and parameters: {'timeframe': 'M8', 'atr_period': 13, 'atr_threshold': 5.0, 'pt_mult': 0.5, 'sl_mult': 5.0, 'td_mins': 120}. Best is trial 398 with value: 3.484125427035651.
[I 2026-03-12 01:56:56,546] Trial 768 pruned. 
