[I 2026-03-12 01:41:02,769] Trial 521 finished with value: 2.710569080288531 and parameters: {'timeframe': 'M3', 'atr_period': 13, 'atr_threshold': 3.0, 'pt_mult': 0.5, 'sl_mult': 5.0, 'td_mins': 30}. Best is trial 367 with value: 2.710569080288531.
[I 2026-03-12 01:41:02,884] Trial 522 finished with value: 2.710569080288531 and parameters: {'timeframe': 'M3', 'atr_period': 13, 'atr_threshold': 3.0, 'pt_mult': 0.5, 'sl_mult': 5.0, 'td_mins': 30}. Best is trial 367 with value: 2.710569080288531.
[I 2026-03-12 01:41:03,148] Trial 523 pruned. 
[I 2026-03-12 01:41:04,966] Trial 524 pruned. 
[I 2026-03-12 01:41:05,104] Trial 525 finished with value: 2.710569080288531 and parameters: {'timeframe': 'M3', 'atr_period': 13, 'atr_threshold': 3.0, 'pt_mult': 0.5, 'sl_mult': 5.0, 'td_mins': 30}. Best is trial 367 with value: 2.710569080288531.
[I 2026-03-12 01:41:05,162] Trial 526 pruned. 
[I 2026-03-12 01:41:05,233] Trial 527 pruned. 
[I 2026-03-12 01:41:05,298] Trial 528 pruned. 
[I 2026-03-12 01:41:05,448] Trial 529 finished with value: 2.710569080288531 and parameters: {'timeframe': 'M3', 'atr_period': 13, 'atr_threshold': 3.0, 'pt_mult': 0.5, 'sl_mult': 5.0, 'td_mins': 30}. Best is trial 367 with value: 2.710569080288531.
[I 2026-03-12 01:41:05,505] Trial 530 finished with value: 0.0 and parameters: {'timeframe': 'M3', 'atr_period': 13, 'atr_threshold': 10.0, 'pt_mult': 0.5, 'sl_mult': 5.0, 'td_mins': 30}. Best is trial 367 with value: 2.710569080288531.
[I 2026-03-12 01:41:05,626] Trial 531 finished with value: 2.710569080288531 and parameters: {'timeframe': 'M3', 'atr_period': 13, 'atr_threshold': 3.0, 'pt_mult': 0.5, 'sl_mult': 5.0, 'td_mins': 30}. Best is trial 367 with value: 2.710569080288531.
[I 2026-03-12 01:41:05,742] Trial 532 finished with value: 2.710569080288531 and parameters: {'timeframe': 'M3', 'atr_period': 13, 'atr_threshold': 3.0, 'pt_mult': 0.5, 'sl_mult': 5.0, 'td_mins': 30}. Best is trial 367 with value: 2.710569080288531.
[I 2026-03-12 01:41:05,795] Trial 533 pruned. 
[I 2026-03-12 01:41:05,922] Trial 534 finished with value: 2.710569080288531 and parameters: {'timeframe': 'M3', 'atr_period': 13, 'atr_threshold': 3.0, 'pt_mult': 0.5, 'sl_mult': 5.0, 'td_mins': 30}. Best is trial 367 with value: 2.710569080288531.
[I 2026-03-12 01:41:06,057] Trial 535 pruned. 
[I 2026-03-12 01:41:06,169] Trial 536 finished with value: 2.710569080288531 and parameters: {'timeframe': 'M3', 'atr_period': 13, 'atr_threshold': 3.0, 'pt_mult': 0.5, 'sl_mult': 5.0, 'td_mins': 30}. Best is trial 367 with value: 2.710569080288531.
[I 2026-03-12 01:41:06,289] Trial 537 finished with value: 2.710569080288531 and parameters: {'timeframe': 'M3', 'atr_period': 13, 'atr_threshold': 3.0, 'pt_mult': 0.5, 'sl_mult': 5.0, 'td_mins': 30}. Best is trial 367 with value: 2.710569080288531.
[I 2026-03-12 01:41:06,345] Trial 538 finished with value: 0.0 and parameters: {'timeframe': 'M3', 'atr_period': 13, 'atr_threshold': 8.0, 'pt_mult': 0.5, 'sl_mult': 5.0, 'td_mins': 720}. Best is trial 367 with value: 2.710569080288531.
[I 2026-03-12 01:41:06,394] Trial 539 finished with value: 0.0 and parameters: {'timeframe': 'M3', 'atr_period': 13, 'atr_threshold': 5.0, 'pt_mult': 0.5, 'sl_mult': 5.0, 'td_mins': 180}. Best is trial 367 with value: 2.710569080288531.
[I 2026-03-12 01:41:06,445] Trial 540 finished with value: 0.0 and parameters: {'timeframe': 'M3', 'atr_period': 13, 'atr_threshold': 8.0, 'pt_mult': 5.0, 'sl_mult': 5.0, 'td_mins': 30}. Best is trial 367 with value: 2.710569080288531.
[I 2026-03-12 01:41:06,496] Trial 541 pruned. 
[I 2026-03-12 01:41:06,546] Trial 542 finished with value: 0.0 and parameters: {'timeframe': 'M3', 'atr_period': 13, 'atr_threshold': 10.0, 'pt_mult': 1.0, 'sl_mult': 5.0, 'td_mins': 30}. Best is trial 367 with value: 2.710569080288531.
[I 2026-03-12 01:41:06,595] Trial 543 pruned. 
[I 2026-03-12 01:41:06,834] Trial 544 pruned. 
[I 2026-03-12 01:41:06,896] Trial 545 pruned. 
[I 2026-03-12 01:41:07,017] Trial 546 finished with value: 2.710569080288531 and parameters: {'timeframe': 'M3', 'atr_period': 13, 'atr_threshold': 3.0, 'pt_mult': 0.5, 'sl_mult': 5.0, 'td_mins': 30}. Best is trial 367 with value: 2.710569080288531.
[I 2026-03-12 01:41:07,350] Trial 547 finished with value: 2.124793000662821 and parameters: {'timeframe': 'M3', 'atr_period': 13, 'atr_threshold': 2.0, 'pt_mult': 0.5, 'sl_mult': 5.0, 'td_mins': 60}. Best is trial 367 with value: 2.710569080288531.
[I 2026-03-12 01:41:07,479] Trial 548 finished with value: 2.710569080288531 and parameters: {'timeframe': 'M3', 'atr_period': 13, 'atr_threshold': 3.0, 'pt_mult': 0.5, 'sl_mult': 5.0, 'td_mins': 30}. Best is trial 367 with value: 2.710569080288531.
[I 2026-03-12 01:41:07,530] Trial 549 finished with value: 0.0 and parameters: {'timeframe': 'M3', 'atr_period': 13, 'atr_threshold': 10.0, 'pt_mult': 5.0, 'sl_mult': 5.0, 'td_mins': 30}. Best is trial 367 with value: 2.710569080288531.
[I 2026-03-12 01:41:07,982] Trial 550 pruned. 
[I 2026-03-12 01:41:08,069] Trial 551 pruned. 
[I 2026-03-12 01:41:08,119] Trial 552 finished with value: 0.0 and parameters: {'timeframe': 'M3', 'atr_period': 13, 'atr_threshold': 15.0, 'pt_mult': 0.5, 'sl_mult': 5.0, 'td_mins': 360}. Best is trial 367 with value: 2.710569080288531.
[I 2026-03-12 01:41:08,238] Trial 553 finished with value: 2.710569080288531 and parameters: {'timeframe': 'M3', 'atr_period': 13, 'atr_threshold': 3.0, 'pt_mult': 0.5, 'sl_mult': 5.0, 'td_mins': 30}. Best is trial 367 with value: 2.710569080288531.
[I 2026-03-12 01:41:08,355] Trial 554 finished with value: 2.710569080288531 and parameters: {'timeframe': 'M3', 'atr_period': 13, 'atr_threshold': 3.0, 'pt_mult': 0.5, 'sl_mult': 5.0, 'td_mins': 30}. Best is trial 367 with value: 2.710569080288531.
[I 2026-03-12 01:41:11,029] Trial 555 pruned. 
[I 2026-03-12 01:41:11,091] Trial 556 finished with value: 0.0 and parameters: {'timeframe': 'M3', 'atr_period': 13, 'atr_threshold': 5.0, 'pt_mult': 1.0, 'sl_mult': 1.0, 'td_mins': 30}. Best is trial 367 with value: 2.710569080288531.
[I 2026-03-12 01:41:11,148] Trial 557 finished with value: 0.0 and parameters: {'timeframe': 'M3', 'atr_period': 13, 'atr_threshold': 8.0, 'pt_mult': 0.5, 'sl_mult': 5.0, 'td_mins': 60}. Best is trial 367 with value: 2.710569080288531.
[I 2026-03-12 01:41:11,205] Trial 558 finished with value: 0.0 and parameters: {'timeframe': 'M3', 'atr_period': 13, 'atr_threshold': 10.0, 'pt_mult': 0.5, 'sl_mult': 5.0, 'td_mins': 5}. Best is trial 367 with value: 2.710569080288531.
[I 2026-03-12 01:41:11,343] Trial 559 finished with value: 2.710569080288531 and parameters: {'timeframe': 'M3', 'atr_period': 13, 'atr_threshold': 3.0, 'pt_mult': 0.5, 'sl_mult': 5.0, 'td_mins': 30}. Best is trial 367 with value: 2.710569080288531.
[I 2026-03-12 01:41:11,483] Trial 560 finished with value: 2.710569080288531 and parameters: {'timeframe': 'M3', 'atr_period': 13, 'atr_threshold': 3.0, 'pt_mult': 0.5, 'sl_mult': 5.0, 'td_mins': 30}. Best is trial 367 with value: 2.710569080288531.
[I 2026-03-12 01:41:11,541] Trial 561 finished with value: 0.0 and parameters: {'timeframe': 'M3', 'atr_period': 13, 'atr_threshold': 10.0, 'pt_mult': 0.5, 'sl_mult': 5.0, 'td_mins': 60}. Best is trial 367 with value: 2.710569080288531.
[I 2026-03-12 01:41:11,600] Trial 562 finished with value: 0.0 and parameters: {'timeframe': 'M3', 'atr_period': 13, 'atr_threshold': 8.0, 'pt_mult': 0.5, 'sl_mult': 5.0, 'td_mins': 30}. Best is trial 367 with value: 2.710569080288531.
[I 2026-03-12 01:41:11,685] Trial 563 pruned. 
[I 2026-03-12 01:41:11,742] Trial 564 finished with value: 0.0 and parameters: {'timeframe': 'M3', 'atr_period': 13, 'atr_threshold': 5.0, 'pt_mult': 0.5, 'sl_mult': 5.0, 'td_mins': 60}. Best is trial 367 with value: 2.710569080288531.
[I 2026-03-12 01:41:11,804] Trial 565 finished with value: 0.0 and parameters: {'timeframe': 'M3', 'atr_period': 13, 'atr_threshold': 15.0, 'pt_mult': 2.5, 'sl_mult': 5.0, 'td_mins': 30}. Best is trial 367 with value: 2.710569080288531.
[I 2026-03-12 01:41:11,995] Trial 566 pruned. 
[I 2026-03-12 01:41:12,059] Trial 567 finished with value: 0.0 and parameters: {'timeframe': 'M3', 'atr_period': 13, 'atr_threshold': 15.0, 'pt_mult': 0.5, 'sl_mult': 5.0, 'td_mins': 720}. Best is trial 367 with value: 2.710569080288531.
[I 2026-03-12 01:41:12,622] Trial 568 pruned. 
[I 2026-03-12 01:41:12,762] Trial 569 finished with value: 2.710569080288531 and parameters: {'timeframe': 'M3', 'atr_period': 13, 'atr_threshold': 3.0, 'pt_mult': 0.5, 'sl_mult': 5.0, 'td_mins': 30}. Best is trial 367 with value: 2.710569080288531.
[I 2026-03-12 01:41:12,834] Trial 570 pruned. 
[I 2026-03-12 01:41:12,901] Trial 571 pruned. 
[I 2026-03-12 01:41:13,016] Trial 572 finished with value: 2.710569080288531 and parameters: {'timeframe': 'M3', 'atr_period': 13, 'atr_threshold': 3.0, 'pt_mult': 0.5, 'sl_mult': 5.0, 'td_mins': 30}. Best is trial 367 with value: 2.710569080288531.
[I 2026-03-12 01:41:13,092] Trial 573 pruned. 
[I 2026-03-12 01:41:13,206] Trial 574 finished with value: 2.710569080288531 and parameters: {'timeframe': 'M3', 'atr_period': 13, 'atr_threshold': 3.0, 'pt_mult': 0.5, 'sl_mult': 5.0, 'td_mins': 30}. Best is trial 367 with value: 2.710569080288531.
[I 2026-03-12 01:41:13,263] Trial 575 pruned. 
[I 2026-03-12 01:41:13,381] Trial 576 finished with value: 2.710569080288531 and parameters: {'timeframe': 'M3', 'atr_period': 13, 'atr_threshold': 3.0, 'pt_mult': 0.5, 'sl_mult': 5.0, 'td_mins': 30}. Best is trial 367 with value: 2.710569080288531.
[I 2026-03-12 01:41:13,499] Trial 577 finished with value: 2.710569080288531 and parameters: {'timeframe': 'M3', 'atr_period': 13, 'atr_threshold': 3.0, 'pt_mult': 0.5, 'sl_mult': 5.0, 'td_mins': 30}. Best is trial 367 with value: 2.710569080288531.
[I 2026-03-12 01:41:13,550] Trial 578 finished with value: 0.0 and parameters: {'timeframe': 'M3', 'atr_period': 13, 'atr_threshold': 5.0, 'pt_mult': 0.5, 'sl_mult': 5.0, 'td_mins': 30}. Best is trial 367 with value: 2.710569080288531.
[I 2026-03-12 01:41:13,626] Trial 579 pruned. 
[I 2026-03-12 01:41:13,765] Trial 580 finished with value: 2.710569080288531 and parameters: {'timeframe': 'M3', 'atr_period': 13, 'atr_threshold': 3.0, 'pt_mult': 0.5, 'sl_mult': 5.0, 'td_mins': 30}. Best is trial 367 with value: 2.710569080288531.
[I 2026-03-12 01:41:13,894] Trial 581 finished with value: 2.710569080288531 and parameters: {'timeframe': 'M3', 'atr_period': 13, 'atr_threshold': 3.0, 'pt_mult': 0.5, 'sl_mult': 5.0, 'td_mins': 30}. Best is trial 367 with value: 2.710569080288531.
[I 2026-03-12 01:41:14,014] Trial 582 finished with value: 2.710569080288531 and parameters: {'timeframe': 'M3', 'atr_period': 13, 'atr_threshold': 3.0, 'pt_mult': 0.5, 'sl_mult': 5.0, 'td_mins': 30}. Best is trial 367 with value: 2.710569080288531.
[I 2026-03-12 01:41:14,136] Trial 583 finished with value: 2.710569080288531 and parameters: {'timeframe': 'M3', 'atr_period': 13, 'atr_threshold': 3.0, 'pt_mult': 0.5, 'sl_mult': 5.0, 'td_mins': 30}. Best is trial 367 with value: 2.710569080288531.
[I 2026-03-12 01:41:14,192] Trial 584 pruned. 
[I 2026-03-12 01:41:14,326] Trial 585 finished with value: 2.387929099905751 and parameters: {'timeframe': 'M3', 'atr_period': 13, 'atr_threshold': 3.0, 'pt_mult': 1.0, 'sl_mult': 5.0, 'td_mins': 30}. Best is trial 367 with value: 2.710569080288531.
[I 2026-03-12 01:41:14,624] Trial 586 pruned. 
[I 2026-03-12 01:41:14,724] Trial 587 finished with value: 2.613255170260378 and parameters: {'timeframe': 'M3', 'atr_period': 13, 'atr_threshold': 3.0, 'pt_mult': 0.5, 'sl_mult': 5.0, 'td_mins': 15}. Best is trial 367 with value: 2.710569080288531.
[I 2026-03-12 01:41:14,782] Trial 588 finished with value: 0.0 and parameters: {'timeframe': 'M3', 'atr_period': 13, 'atr_threshold': 5.0, 'pt_mult': 1.0, 'sl_mult': 5.0, 'td_mins': 30}. Best is trial 367 with value: 2.710569080288531.
[I 2026-03-12 01:41:15,098] Trial 589 pruned. 
[I 2026-03-12 01:41:15,154] Trial 590 finished with value: 0.0 and parameters: {'timeframe': 'M3', 'atr_period': 13, 'atr_threshold': 15.0, 'pt_mult': 0.5, 'sl_mult': 5.0, 'td_mins': 1080}. Best is trial 367 with value: 2.710569080288531.
[I 2026-03-12 01:41:15,218] Trial 591 finished with value: 0.0 and parameters: {'timeframe': 'M3', 'atr_period': 13, 'atr_threshold': 10.0, 'pt_mult': 2.5, 'sl_mult': 5.0, 'td_mins': 30}. Best is trial 367 with value: 2.710569080288531.
[I 2026-03-12 01:41:15,285] Trial 592 pruned. 
[I 2026-03-12 01:41:15,354] Trial 593 pruned. 
[I 2026-03-12 01:41:15,721] Trial 594 pruned. 
[I 2026-03-12 01:41:16,473] Trial 595 pruned. 
[I 2026-03-12 01:41:16,528] Trial 596 pruned. 
[I 2026-03-12 01:41:16,583] Trial 597 finished with value: 0.0 and parameters: {'timeframe': 'M3', 'atr_period': 13, 'atr_threshold': 10.0, 'pt_mult': 1.0, 'sl_mult': 0.5, 'td_mins': 720}. Best is trial 367 with value: 2.710569080288531.
[I 2026-03-12 01:41:16,633] Trial 598 finished with value: 0.0 and parameters: {'timeframe': 'M3', 'atr_period': 13, 'atr_threshold': 15.0, 'pt_mult': 5.0, 'sl_mult': 5.0, 'td_mins': 60}. Best is trial 367 with value: 2.710569080288531.
[I 2026-03-12 01:41:16,684] Trial 599 finished with value: 0.0 and parameters: {'timeframe': 'M3', 'atr_period': 13, 'atr_threshold': 10.0, 'pt_mult': 0.5, 'sl_mult': 1.0, 'td_mins': 1200}. Best is trial 367 with value: 2.710569080288531.
[I 2026-03-12 01:41:16,734] Trial 600 finished with value: 0.0 and parameters: {'timeframe': 'M3', 'atr_period': 13, 'atr_threshold': 8.0, 'pt_mult': 0.5, 'sl_mult': 2.5, 'td_mins': 30}. Best is trial 367 with value: 2.710569080288531.
[I 2026-03-12 01:41:16,851] Trial 601 finished with value: 2.710569080288531 and parameters: {'timeframe': 'M3', 'atr_period': 13, 'atr_threshold': 3.0, 'pt_mult': 0.5, 'sl_mult': 5.0, 'td_mins': 30}. Best is trial 367 with value: 2.710569080288531.
[I 2026-03-12 01:41:16,954] Trial 602 pruned. 
[I 2026-03-12 01:41:17,017] Trial 603 pruned. 
[I 2026-03-12 01:41:17,121] Trial 604 pruned. 
[I 2026-03-12 01:41:17,174] Trial 605 pruned. 
[I 2026-03-12 01:41:17,265] Trial 606 pruned. 
[I 2026-03-12 01:41:17,490] Trial 607 finished with value: 2.561287763012388 and parameters: {'timeframe': 'M3', 'atr_period': 13, 'atr_threshold': 2.0, 'pt_mult': 0.5, 'sl_mult': 5.0, 'td_mins': 30}. Best is trial 367 with value: 2.710569080288531.
[I 2026-03-12 01:41:17,576] Trial 608 pruned. 
[I 2026-03-12 01:41:17,666] Trial 609 pruned. 
[I 2026-03-12 01:41:17,782] Trial 610 finished with value: 2.710569080288531 and parameters: {'timeframe': 'M3', 'atr_period': 13, 'atr_threshold': 3.0, 'pt_mult': 0.5, 'sl_mult': 5.0, 'td_mins': 30}. Best is trial 367 with value: 2.710569080288531.
[I 2026-03-12 01:41:18,018] Trial 611 pruned. 
[I 2026-03-12 01:41:18,068] Trial 612 finished with value: 0.0 and parameters: {'timeframe': 'M3', 'atr_period': 13, 'atr_threshold': 8.0, 'pt_mult': 5.0, 'sl_mult': 1.0, 'td_mins': 30}. Best is trial 367 with value: 2.710569080288531.
[I 2026-03-12 01:41:18,204] Trial 613 pruned. 
[I 2026-03-12 01:41:18,257] Trial 614 finished with value: 0.0 and parameters: {'timeframe': 'M3', 'atr_period': 13, 'atr_threshold': 8.0, 'pt_mult': 0.5, 'sl_mult': 5.0, 'td_mins': 1200}. Best is trial 367 with value: 2.710569080288531.
[I 2026-03-12 01:41:18,311] Trial 615 finished with value: 0.0 and parameters: {'timeframe': 'M3', 'atr_period': 13, 'atr_threshold': 5.0, 'pt_mult': 0.5, 'sl_mult': 1.0, 'td_mins': 30}. Best is trial 367 with value: 2.710569080288531.
[I 2026-03-12 01:41:20,015] Trial 616 pruned. 
[I 2026-03-12 01:41:20,111] Trial 617 pruned. 
[I 2026-03-12 01:41:20,165] Trial 618 finished with value: 0.0 and parameters: {'timeframe': 'M3', 'atr_period': 13, 'atr_threshold': 15.0, 'pt_mult': 1.0, 'sl_mult': 1.0, 'td_mins': 720}. Best is trial 367 with value: 2.710569080288531.
[I 2026-03-12 01:41:20,282] Trial 619 finished with value: 2.710569080288531 and parameters: {'timeframe': 'M3', 'atr_period': 13, 'atr_threshold': 3.0, 'pt_mult': 0.5, 'sl_mult': 5.0, 'td_mins': 30}. Best is trial 367 with value: 2.710569080288531.
[I 2026-03-12 01:41:20,333] Trial 620 finished with value: 0.0 and parameters: {'timeframe': 'M3', 'atr_period': 13, 'atr_threshold': 8.0, 'pt_mult': 0.5, 'sl_mult': 5.0, 'td_mins': 180}. Best is trial 367 with value: 2.710569080288531.
[I 2026-03-12 01:41:20,398] Trial 621 pruned. 
[I 2026-03-12 01:41:20,446] Trial 622 finished with value: 0.0 and parameters: {'timeframe': 'M3', 'atr_period': 13, 'atr_threshold': 10.0, 'pt_mult': 1.0, 'sl_mult': 2.5, 'td_mins': 180}. Best is trial 367 with value: 2.710569080288531.
[I 2026-03-12 01:41:20,492] Trial 623 finished with value: 0.0 and parameters: {'timeframe': 'M3', 'atr_period': 13, 'atr_threshold': 15.0, 'pt_mult': 0.5, 'sl_mult': 5.0, 'td_mins': 30}. Best is trial 367 with value: 2.710569080288531.
[I 2026-03-12 01:41:20,539] Trial 624 finished with value: 0.0 and parameters: {'timeframe': 'M3', 'atr_period': 13, 'atr_threshold': 10.0, 'pt_mult': 0.5, 'sl_mult': 5.0, 'td_mins': 720}. Best is trial 367 with value: 2.710569080288531.
[I 2026-03-12 01:41:20,653] Trial 625 finished with value: 2.710569080288531 and parameters: {'timeframe': 'M3', 'atr_period': 13, 'atr_threshold': 3.0, 'pt_mult': 0.5, 'sl_mult': 5.0, 'td_mins': 30}. Best is trial 367 with value: 2.710569080288531.
[I 2026-03-12 01:41:20,706] Trial 626 finished with value: 0.0 and parameters: {'timeframe': 'M3', 'atr_period': 13, 'atr_threshold': 8.0, 'pt_mult': 0.5, 'sl_mult': 5.0, 'td_mins': 5}. Best is trial 367 with value: 2.710569080288531.
[I 2026-03-12 01:41:20,949] Trial 627 pruned. 
[I 2026-03-12 01:41:21,040] Trial 628 pruned. 
[I 2026-03-12 01:41:21,099] Trial 629 pruned. 
[I 2026-03-12 01:41:21,153] Trial 630 pruned. 
[I 2026-03-12 01:41:21,270] Trial 631 finished with value: 2.710569080288531 and parameters: {'timeframe': 'M3', 'atr_period': 13, 'atr_threshold': 3.0, 'pt_mult': 0.5, 'sl_mult': 5.0, 'td_mins': 30}. Best is trial 367 with value: 2.710569080288531.
[I 2026-03-12 01:41:21,329] Trial 632 pruned. 
[I 2026-03-12 01:41:21,380] Trial 633 finished with value: 0.0 and parameters: {'timeframe': 'M3', 'atr_period': 13, 'atr_threshold': 10.0, 'pt_mult': 0.5, 'sl_mult': 5.0, 'td_mins': 30}. Best is trial 367 with value: 2.710569080288531.
[I 2026-03-12 01:41:21,428] Trial 634 finished with value: 0.0 and parameters: {'timeframe': 'M3', 'atr_period': 13, 'atr_threshold': 10.0, 'pt_mult': 5.0, 'sl_mult': 0.5, 'td_mins': 1080}. Best is trial 367 with value: 2.710569080288531.
[I 2026-03-12 01:41:21,540] Trial 635 finished with value: 2.710569080288531 and parameters: {'timeframe': 'M3', 'atr_period': 13, 'atr_threshold': 3.0, 'pt_mult': 0.5, 'sl_mult': 5.0, 'td_mins': 30}. Best is trial 367 with value: 2.710569080288531.
[I 2026-03-12 01:41:21,609] Trial 636 pruned. 
[I 2026-03-12 01:41:21,726] Trial 637 finished with value: 2.710569080288531 and parameters: {'timeframe': 'M3', 'atr_period': 13, 'atr_threshold': 3.0, 'pt_mult': 0.5, 'sl_mult': 5.0, 'td_mins': 30}. Best is trial 367 with value: 2.710569080288531.
[I 2026-03-12 01:41:21,837] Trial 638 finished with value: 2.710569080288531 and parameters: {'timeframe': 'M3', 'atr_period': 13, 'atr_threshold': 3.0, 'pt_mult': 0.5, 'sl_mult': 5.0, 'td_mins': 30}. Best is trial 367 with value: 2.710569080288531.
[I 2026-03-12 01:41:21,955] Trial 639 finished with value: 2.710569080288531 and parameters: {'timeframe': 'M3', 'atr_period': 13, 'atr_threshold': 3.0, 'pt_mult': 0.5, 'sl_mult': 5.0, 'td_mins': 30}. Best is trial 367 with value: 2.710569080288531.
[I 2026-03-12 01:41:22,110] Trial 640 pruned. 
[I 2026-03-12 01:41:22,173] Trial 641 pruned. 
[I 2026-03-12 01:41:22,297] Trial 642 finished with value: 2.710569080288531 and parameters: {'timeframe': 'M3', 'atr_period': 13, 'atr_threshold': 3.0, 'pt_mult': 0.5, 'sl_mult': 5.0, 'td_mins': 30}. Best is trial 367 with value: 2.710569080288531.
[I 2026-03-12 01:41:22,419] Trial 643 finished with value: 2.710569080288531 and parameters: {'timeframe': 'M3', 'atr_period': 13, 'atr_threshold': 3.0, 'pt_mult': 0.5, 'sl_mult': 5.0, 'td_mins': 30}. Best is trial 367 with value: 2.710569080288531.
[I 2026-03-12 01:41:22,563] Trial 644 finished with value: 2.710569080288531 and parameters: {'timeframe': 'M3', 'atr_period': 13, 'atr_threshold': 3.0, 'pt_mult': 0.5, 'sl_mult': 5.0, 'td_mins': 30}. Best is trial 367 with value: 2.710569080288531.
[I 2026-03-12 01:41:22,703] Trial 645 pruned. 
[I 2026-03-12 01:41:22,829] Trial 646 pruned. 
[I 2026-03-12 01:41:23,197] Trial 647 pruned. 
[I 2026-03-12 01:41:23,253] Trial 648 pruned. 
[I 2026-03-12 01:41:23,305] Trial 649 finished with value: 0.0 and parameters: {'timeframe': 'M3', 'atr_period': 13, 'atr_threshold': 15.0, 'pt_mult': 1.0, 'sl_mult': 0.5, 'td_mins': 1200}. Best is trial 367 with value: 2.710569080288531.
[I 2026-03-12 01:41:23,357] Trial 650 pruned. 
[I 2026-03-12 01:41:25,105] Trial 651 pruned. 
[I 2026-03-12 01:41:25,167] Trial 652 pruned. 
[I 2026-03-12 01:41:25,313] Trial 653 finished with value: 2.710569080288531 and parameters: {'timeframe': 'M3', 'atr_period': 13, 'atr_threshold': 3.0, 'pt_mult': 0.5, 'sl_mult': 5.0, 'td_mins': 30}. Best is trial 367 with value: 2.710569080288531.
[I 2026-03-12 01:41:25,617] Trial 654 pruned. 
[I 2026-03-12 01:41:25,666] Trial 655 finished with value: 0.0 and parameters: {'timeframe': 'M3', 'atr_period': 13, 'atr_threshold': 8.0, 'pt_mult': 0.5, 'sl_mult': 5.0, 'td_mins': 30}. Best is trial 367 with value: 2.710569080288531.
[I 2026-03-12 01:41:25,788] Trial 656 finished with value: 2.710569080288531 and parameters: {'timeframe': 'M3', 'atr_period': 13, 'atr_threshold': 3.0, 'pt_mult': 0.5, 'sl_mult': 5.0, 'td_mins': 30}. Best is trial 367 with value: 2.710569080288531.
[I 2026-03-12 01:41:25,841] Trial 657 finished with value: 0.0 and parameters: {'timeframe': 'M3', 'atr_period': 13, 'atr_threshold': 5.0, 'pt_mult': 5.0, 'sl_mult': 0.5, 'td_mins': 360}. Best is trial 367 with value: 2.710569080288531.
