[I 2026-03-12 01:49:08,324] Trial 770 finished with value: 0.0 and parameters: {'timeframe': 'M5', 'atr_period': 13, 'atr_threshold': 8.0, 'pt_mult': 2.5, 'sl_mult': 2.5, 'td_mins': 5}. Best is trial 537 with value: 2.8555764149575955.
[I 2026-03-12 01:49:08,386] Trial 771 pruned. 
[I 2026-03-12 01:49:08,437] Trial 772 finished with value: 0.0 and parameters: {'timeframe': 'M5', 'atr_period': 13, 'atr_threshold': 15.0, 'pt_mult': 1.0, 'sl_mult': 1.0, 'td_mins': 1080}. Best is trial 537 with value: 2.8555764149575955.
[I 2026-03-12 01:49:08,532] Trial 773 pruned. 
[I 2026-03-12 01:49:08,701] Trial 774 finished with value: 2.8555764149575955 and parameters: {'timeframe': 'M5', 'atr_period': 13, 'atr_threshold': 3.0, 'pt_mult': 0.5, 'sl_mult': 5.0, 'td_mins': 60}. Best is trial 537 with value: 2.8555764149575955.
[I 2026-03-12 01:49:08,751] Trial 775 finished with value: 0.0 and parameters: {'timeframe': 'M5', 'atr_period': 13, 'atr_threshold': 8.0, 'pt_mult': 5.0, 'sl_mult': 5.0, 'td_mins': 180}. Best is trial 537 with value: 2.8555764149575955.
[I 2026-03-12 01:49:08,801] Trial 776 finished with value: 0.0 and parameters: {'timeframe': 'M5', 'atr_period': 13, 'atr_threshold': 15.0, 'pt_mult': 1.0, 'sl_mult': 0.5, 'td_mins': 5}. Best is trial 537 with value: 2.8555764149575955.
[I 2026-03-12 01:49:08,877] Trial 777 pruned. 
[I 2026-03-12 01:49:08,928] Trial 778 finished with value: 0.0 and parameters: {'timeframe': 'M5', 'atr_period': 13, 'atr_threshold': 10.0, 'pt_mult': 0.5, 'sl_mult': 2.5, 'td_mins': 5}. Best is trial 537 with value: 2.8555764149575955.
[I 2026-03-12 01:49:09,126] Trial 779 pruned. 
[I 2026-03-12 01:49:10,552] Trial 780 pruned. 
[I 2026-03-12 01:49:10,653] Trial 781 pruned. 
[I 2026-03-12 01:49:10,704] Trial 782 finished with value: 0.0 and parameters: {'timeframe': 'M5', 'atr_period': 13, 'atr_threshold': 15.0, 'pt_mult': 0.5, 'sl_mult': 5.0, 'td_mins': 60}. Best is trial 537 with value: 2.8555764149575955.
[I 2026-03-12 01:49:10,755] Trial 783 finished with value: 0.0 and parameters: {'timeframe': 'M5', 'atr_period': 13, 'atr_threshold': 8.0, 'pt_mult': 0.5, 'sl_mult': 0.5, 'td_mins': 60}. Best is trial 537 with value: 2.8555764149575955.
[I 2026-03-12 01:49:10,807] Trial 784 finished with value: 0.0 and parameters: {'timeframe': 'M5', 'atr_period': 13, 'atr_threshold': 15.0, 'pt_mult': 0.5, 'sl_mult': 2.5, 'td_mins': 720}. Best is trial 537 with value: 2.8555764149575955.
[I 2026-03-12 01:49:10,856] Trial 785 finished with value: 0.0 and parameters: {'timeframe': 'M5', 'atr_period': 13, 'atr_threshold': 10.0, 'pt_mult': 0.5, 'sl_mult': 1.0, 'td_mins': 5}. Best is trial 537 with value: 2.8555764149575955.
[I 2026-03-12 01:49:11,027] Trial 786 finished with value: 2.8555764149575955 and parameters: {'timeframe': 'M5', 'atr_period': 13, 'atr_threshold': 3.0, 'pt_mult': 0.5, 'sl_mult': 5.0, 'td_mins': 60}. Best is trial 537 with value: 2.8555764149575955.
[I 2026-03-12 01:49:11,078] Trial 787 finished with value: 0.0 and parameters: {'timeframe': 'M5', 'atr_period': 13, 'atr_threshold': 5.0, 'pt_mult': 1.0, 'sl_mult': 5.0, 'td_mins': 360}. Best is trial 537 with value: 2.8555764149575955.
[I 2026-03-12 01:49:11,259] Trial 788 finished with value: 2.8555764149575955 and parameters: {'timeframe': 'M5', 'atr_period': 13, 'atr_threshold': 3.0, 'pt_mult': 0.5, 'sl_mult': 5.0, 'td_mins': 60}. Best is trial 537 with value: 2.8555764149575955.
[I 2026-03-12 01:49:11,310] Trial 789 finished with value: 0.0 and parameters: {'timeframe': 'M5', 'atr_period': 13, 'atr_threshold': 8.0, 'pt_mult': 0.5, 'sl_mult': 1.0, 'td_mins': 180}. Best is trial 537 with value: 2.8555764149575955.
[I 2026-03-12 01:49:11,518] Trial 790 pruned. 
[I 2026-03-12 01:49:12,549] Trial 791 pruned. 
[I 2026-03-12 01:49:12,602] Trial 792 finished with value: 0.0 and parameters: {'timeframe': 'M5', 'atr_period': 13, 'atr_threshold': 15.0, 'pt_mult': 1.0, 'sl_mult': 2.5, 'td_mins': 1200}. Best is trial 537 with value: 2.8555764149575955.
[I 2026-03-12 01:49:12,778] Trial 793 finished with value: 2.8555764149575955 and parameters: {'timeframe': 'M5', 'atr_period': 13, 'atr_threshold': 3.0, 'pt_mult': 0.5, 'sl_mult': 5.0, 'td_mins': 60}. Best is trial 537 with value: 2.8555764149575955.
[I 2026-03-12 01:49:13,167] Trial 794 pruned. 
[I 2026-03-12 01:49:13,343] Trial 795 finished with value: 2.8555764149575955 and parameters: {'timeframe': 'M5', 'atr_period': 13, 'atr_threshold': 3.0, 'pt_mult': 0.5, 'sl_mult': 5.0, 'td_mins': 60}. Best is trial 537 with value: 2.8555764149575955.
[I 2026-03-12 01:49:13,514] Trial 796 finished with value: 2.8555764149575955 and parameters: {'timeframe': 'M5', 'atr_period': 13, 'atr_threshold': 3.0, 'pt_mult': 0.5, 'sl_mult': 5.0, 'td_mins': 60}. Best is trial 537 with value: 2.8555764149575955.
[I 2026-03-12 01:49:13,681] Trial 797 finished with value: 2.8555764149575955 and parameters: {'timeframe': 'M5', 'atr_period': 13, 'atr_threshold': 3.0, 'pt_mult': 0.5, 'sl_mult': 5.0, 'td_mins': 60}. Best is trial 537 with value: 2.8555764149575955.
[I 2026-03-12 01:49:13,736] Trial 798 finished with value: 0.0 and parameters: {'timeframe': 'M5', 'atr_period': 13, 'atr_threshold': 5.0, 'pt_mult': 2.5, 'sl_mult': 2.5, 'td_mins': 720}. Best is trial 537 with value: 2.8555764149575955.
[I 2026-03-12 01:49:13,912] Trial 799 finished with value: 2.8555764149575955 and parameters: {'timeframe': 'M5', 'atr_period': 13, 'atr_threshold': 3.0, 'pt_mult': 0.5, 'sl_mult': 5.0, 'td_mins': 60}. Best is trial 537 with value: 2.8555764149575955.
[I 2026-03-12 01:49:14,082] Trial 800 finished with value: 2.8555764149575955 and parameters: {'timeframe': 'M5', 'atr_period': 13, 'atr_threshold': 3.0, 'pt_mult': 0.5, 'sl_mult': 5.0, 'td_mins': 60}. Best is trial 537 with value: 2.8555764149575955.
[I 2026-03-12 01:49:14,257] Trial 801 finished with value: 2.8555764149575955 and parameters: {'timeframe': 'M5', 'atr_period': 13, 'atr_threshold': 3.0, 'pt_mult': 0.5, 'sl_mult': 5.0, 'td_mins': 60}. Best is trial 537 with value: 2.8555764149575955.
[I 2026-03-12 01:49:14,425] Trial 802 finished with value: 2.8555764149575955 and parameters: {'timeframe': 'M5', 'atr_period': 13, 'atr_threshold': 3.0, 'pt_mult': 0.5, 'sl_mult': 5.0, 'td_mins': 60}. Best is trial 537 with value: 2.8555764149575955.
[I 2026-03-12 01:49:14,474] Trial 803 finished with value: 0.0 and parameters: {'timeframe': 'M5', 'atr_period': 13, 'atr_threshold': 15.0, 'pt_mult': 2.5, 'sl_mult': 5.0, 'td_mins': 30}. Best is trial 537 with value: 2.8555764149575955.
[I 2026-03-12 01:49:14,679] Trial 804 finished with value: 2.8555764149575955 and parameters: {'timeframe': 'M5', 'atr_period': 13, 'atr_threshold': 3.0, 'pt_mult': 0.5, 'sl_mult': 5.0, 'td_mins': 60}. Best is trial 537 with value: 2.8555764149575955.
[I 2026-03-12 01:49:14,834] Trial 805 pruned. 
[I 2026-03-12 01:49:15,028] Trial 806 pruned. 
[I 2026-03-12 01:49:15,141] Trial 807 pruned. 
[I 2026-03-12 01:49:15,322] Trial 808 finished with value: 2.8555764149575955 and parameters: {'timeframe': 'M5', 'atr_period': 13, 'atr_threshold': 3.0, 'pt_mult': 0.5, 'sl_mult': 5.0, 'td_mins': 60}. Best is trial 537 with value: 2.8555764149575955.
[I 2026-03-12 01:49:15,522] Trial 809 pruned. 
[I 2026-03-12 01:49:15,572] Trial 810 finished with value: 0.0 and parameters: {'timeframe': 'M5', 'atr_period': 13, 'atr_threshold': 8.0, 'pt_mult': 0.5, 'sl_mult': 5.0, 'td_mins': 60}. Best is trial 537 with value: 2.8555764149575955.
[I 2026-03-12 01:49:15,637] Trial 811 pruned. 
[I 2026-03-12 01:49:15,688] Trial 812 finished with value: 0.0 and parameters: {'timeframe': 'M5', 'atr_period': 13, 'atr_threshold': 15.0, 'pt_mult': 5.0, 'sl_mult': 0.5, 'td_mins': 1080}. Best is trial 537 with value: 2.8555764149575955.
[I 2026-03-12 01:49:15,740] Trial 813 finished with value: 0.0 and parameters: {'timeframe': 'M5', 'atr_period': 13, 'atr_threshold': 5.0, 'pt_mult': 5.0, 'sl_mult': 5.0, 'td_mins': 120}. Best is trial 537 with value: 2.8555764149575955.
[I 2026-03-12 01:49:15,794] Trial 814 finished with value: 0.0 and parameters: {'timeframe': 'M5', 'atr_period': 13, 'atr_threshold': 10.0, 'pt_mult': 0.5, 'sl_mult': 5.0, 'td_mins': 5}. Best is trial 537 with value: 2.8555764149575955.
[I 2026-03-12 01:49:15,957] Trial 815 pruned. 
[I 2026-03-12 01:49:16,013] Trial 816 pruned. 
[I 2026-03-12 01:49:16,066] Trial 817 finished with value: 0.0 and parameters: {'timeframe': 'M5', 'atr_period': 13, 'atr_threshold': 8.0, 'pt_mult': 1.0, 'sl_mult': 2.5, 'td_mins': 15}. Best is trial 537 with value: 2.8555764149575955.
[I 2026-03-12 01:49:16,246] Trial 818 finished with value: 2.8555764149575955 and parameters: {'timeframe': 'M5', 'atr_period': 13, 'atr_threshold': 3.0, 'pt_mult': 0.5, 'sl_mult': 5.0, 'td_mins': 60}. Best is trial 537 with value: 2.8555764149575955.
[I 2026-03-12 01:49:16,295] Trial 819 finished with value: 0.0 and parameters: {'timeframe': 'M5', 'atr_period': 13, 'atr_threshold': 10.0, 'pt_mult': 2.5, 'sl_mult': 5.0, 'td_mins': 30}. Best is trial 537 with value: 2.8555764149575955.
[I 2026-03-12 01:49:16,348] Trial 820 finished with value: 0.0 and parameters: {'timeframe': 'M5', 'atr_period': 13, 'atr_threshold': 5.0, 'pt_mult': 0.5, 'sl_mult': 5.0, 'td_mins': 15}. Best is trial 537 with value: 2.8555764149575955.
[I 2026-03-12 01:49:16,521] Trial 821 finished with value: 2.8555764149575955 and parameters: {'timeframe': 'M5', 'atr_period': 13, 'atr_threshold': 3.0, 'pt_mult': 0.5, 'sl_mult': 5.0, 'td_mins': 60}. Best is trial 537 with value: 2.8555764149575955.
[I 2026-03-12 01:49:16,691] Trial 822 finished with value: 2.8555764149575955 and parameters: {'timeframe': 'M5', 'atr_period': 13, 'atr_threshold': 3.0, 'pt_mult': 0.5, 'sl_mult': 5.0, 'td_mins': 60}. Best is trial 537 with value: 2.8555764149575955.
[I 2026-03-12 01:49:16,860] Trial 823 finished with value: 2.8555764149575955 and parameters: {'timeframe': 'M5', 'atr_period': 13, 'atr_threshold': 3.0, 'pt_mult': 0.5, 'sl_mult': 5.0, 'td_mins': 60}. Best is trial 537 with value: 2.8555764149575955.
[I 2026-03-12 01:49:17,032] Trial 824 finished with value: 2.8555764149575955 and parameters: {'timeframe': 'M5', 'atr_period': 13, 'atr_threshold': 3.0, 'pt_mult': 0.5, 'sl_mult': 5.0, 'td_mins': 60}. Best is trial 537 with value: 2.8555764149575955.
[I 2026-03-12 01:49:17,214] Trial 825 finished with value: 2.8555764149575955 and parameters: {'timeframe': 'M5', 'atr_period': 13, 'atr_threshold': 3.0, 'pt_mult': 0.5, 'sl_mult': 5.0, 'td_mins': 60}. Best is trial 537 with value: 2.8555764149575955.
[I 2026-03-12 01:49:17,414] Trial 826 pruned. 
[I 2026-03-12 01:49:17,478] Trial 827 pruned. 
[I 2026-03-12 01:49:17,655] Trial 828 finished with value: 2.8555764149575955 and parameters: {'timeframe': 'M5', 'atr_period': 13, 'atr_threshold': 3.0, 'pt_mult': 0.5, 'sl_mult': 5.0, 'td_mins': 60}. Best is trial 537 with value: 2.8555764149575955.
[I 2026-03-12 01:49:17,707] Trial 829 finished with value: 0.0 and parameters: {'timeframe': 'M5', 'atr_period': 13, 'atr_threshold': 5.0, 'pt_mult': 1.0, 'sl_mult': 2.5, 'td_mins': 5}. Best is trial 537 with value: 2.8555764149575955.
[I 2026-03-12 01:49:17,890] Trial 830 finished with value: 2.8555764149575955 and parameters: {'timeframe': 'M5', 'atr_period': 13, 'atr_threshold': 3.0, 'pt_mult': 0.5, 'sl_mult': 5.0, 'td_mins': 60}. Best is trial 537 with value: 2.8555764149575955.
[I 2026-03-12 01:49:18,064] Trial 831 finished with value: 2.8555764149575955 and parameters: {'timeframe': 'M5', 'atr_period': 13, 'atr_threshold': 3.0, 'pt_mult': 0.5, 'sl_mult': 5.0, 'td_mins': 60}. Best is trial 537 with value: 2.8555764149575955.
[I 2026-03-12 01:49:18,114] Trial 832 finished with value: 0.0 and parameters: {'timeframe': 'M5', 'atr_period': 13, 'atr_threshold': 5.0, 'pt_mult': 5.0, 'sl_mult': 0.5, 'td_mins': 5}. Best is trial 537 with value: 2.8555764149575955.
[I 2026-03-12 01:49:19,561] Trial 833 pruned. 
[I 2026-03-12 01:49:19,781] Trial 834 finished with value: 2.8555764149575955 and parameters: {'timeframe': 'M5', 'atr_period': 13, 'atr_threshold': 3.0, 'pt_mult': 0.5, 'sl_mult': 5.0, 'td_mins': 60}. Best is trial 537 with value: 2.8555764149575955.
[I 2026-03-12 01:49:19,837] Trial 835 finished with value: 0.0 and parameters: {'timeframe': 'M5', 'atr_period': 13, 'atr_threshold': 15.0, 'pt_mult': 5.0, 'sl_mult': 5.0, 'td_mins': 180}. Best is trial 537 with value: 2.8555764149575955.
[I 2026-03-12 01:49:19,931] Trial 836 pruned. 
[I 2026-03-12 01:49:19,988] Trial 837 finished with value: 0.0 and parameters: {'timeframe': 'M5', 'atr_period': 13, 'atr_threshold': 10.0, 'pt_mult': 2.5, 'sl_mult': 2.5, 'td_mins': 1080}. Best is trial 537 with value: 2.8555764149575955.
[I 2026-03-12 01:49:20,054] Trial 838 pruned. 
[I 2026-03-12 01:49:20,252] Trial 839 finished with value: 2.8555764149575955 and parameters: {'timeframe': 'M5', 'atr_period': 13, 'atr_threshold': 3.0, 'pt_mult': 0.5, 'sl_mult': 5.0, 'td_mins': 60}. Best is trial 537 with value: 2.8555764149575955.
[I 2026-03-12 01:49:20,384] Trial 840 pruned. 
[I 2026-03-12 01:49:20,511] Trial 841 pruned. 
[I 2026-03-12 01:49:20,806] Trial 842 pruned. 
[I 2026-03-12 01:49:20,881] Trial 843 pruned. 
[I 2026-03-12 01:49:20,936] Trial 844 finished with value: 0.0 and parameters: {'timeframe': 'M5', 'atr_period': 13, 'atr_threshold': 10.0, 'pt_mult': 0.5, 'sl_mult': 5.0, 'td_mins': 60}. Best is trial 537 with value: 2.8555764149575955.
[I 2026-03-12 01:49:20,999] Trial 845 finished with value: 0.0 and parameters: {'timeframe': 'M5', 'atr_period': 13, 'atr_threshold': 5.0, 'pt_mult': 0.5, 'sl_mult': 1.0, 'td_mins': 720}. Best is trial 537 with value: 2.8555764149575955.
[I 2026-03-12 01:49:21,172] Trial 846 pruned. 
[I 2026-03-12 01:49:21,548] Trial 847 pruned. 
[I 2026-03-12 01:49:21,629] Trial 848 pruned. 
[I 2026-03-12 01:49:21,705] Trial 849 pruned. 
[I 2026-03-12 01:49:21,809] Trial 850 pruned. 
[I 2026-03-12 01:49:21,875] Trial 851 pruned. 
[I 2026-03-12 01:49:22,049] Trial 852 finished with value: 2.8555764149575955 and parameters: {'timeframe': 'M5', 'atr_period': 13, 'atr_threshold': 3.0, 'pt_mult': 0.5, 'sl_mult': 5.0, 'td_mins': 60}. Best is trial 537 with value: 2.8555764149575955.
[I 2026-03-12 01:49:22,121] Trial 853 pruned. 
[I 2026-03-12 01:49:22,455] Trial 854 pruned. 
[I 2026-03-12 01:49:22,585] Trial 855 pruned. 
[I 2026-03-12 01:49:22,731] Trial 856 pruned. 
[I 2026-03-12 01:49:22,786] Trial 857 pruned. 
[I 2026-03-12 01:49:22,847] Trial 858 pruned. 
[I 2026-03-12 01:49:23,022] Trial 859 finished with value: 2.8555764149575955 and parameters: {'timeframe': 'M5', 'atr_period': 13, 'atr_threshold': 3.0, 'pt_mult': 0.5, 'sl_mult': 5.0, 'td_mins': 60}. Best is trial 537 with value: 2.8555764149575955.
[I 2026-03-12 01:49:23,072] Trial 860 finished with value: 0.0 and parameters: {'timeframe': 'M5', 'atr_period': 13, 'atr_threshold': 10.0, 'pt_mult': 0.5, 'sl_mult': 0.5, 'td_mins': 5}. Best is trial 537 with value: 2.8555764149575955.
[I 2026-03-12 01:49:23,398] Trial 861 finished with value: 2.406101417633213 and parameters: {'timeframe': 'M5', 'atr_period': 13, 'atr_threshold': 2.0, 'pt_mult': 0.5, 'sl_mult': 5.0, 'td_mins': 60}. Best is trial 537 with value: 2.8555764149575955.
[I 2026-03-12 01:49:24,073] Trial 862 pruned. 
[I 2026-03-12 01:49:24,125] Trial 863 finished with value: 0.0 and parameters: {'timeframe': 'M5', 'atr_period': 13, 'atr_threshold': 5.0, 'pt_mult': 0.5, 'sl_mult': 5.0, 'td_mins': 60}. Best is trial 537 with value: 2.8555764149575955.
[I 2026-03-12 01:49:24,307] Trial 864 finished with value: 2.8555764149575955 and parameters: {'timeframe': 'M5', 'atr_period': 13, 'atr_threshold': 3.0, 'pt_mult': 0.5, 'sl_mult': 5.0, 'td_mins': 60}. Best is trial 537 with value: 2.8555764149575955.
[I 2026-03-12 01:49:24,386] Trial 865 pruned. 
[I 2026-03-12 01:49:24,438] Trial 866 finished with value: 0.0 and parameters: {'timeframe': 'M5', 'atr_period': 13, 'atr_threshold': 8.0, 'pt_mult': 5.0, 'sl_mult': 0.5, 'td_mins': 180}. Best is trial 537 with value: 2.8555764149575955.
[I 2026-03-12 01:49:24,491] Trial 867 finished with value: 0.0 and parameters: {'timeframe': 'M5', 'atr_period': 13, 'atr_threshold': 15.0, 'pt_mult': 0.5, 'sl_mult': 5.0, 'td_mins': 60}. Best is trial 537 with value: 2.8555764149575955.
[I 2026-03-12 01:49:25,104] Trial 868 pruned. 
[I 2026-03-12 01:49:25,406] Trial 869 pruned. 
[I 2026-03-12 01:49:25,554] Trial 870 pruned. 
[I 2026-03-12 01:49:25,726] Trial 871 finished with value: 2.8555764149575955 and parameters: {'timeframe': 'M5', 'atr_period': 13, 'atr_threshold': 3.0, 'pt_mult': 0.5, 'sl_mult': 5.0, 'td_mins': 60}. Best is trial 537 with value: 2.8555764149575955.
[I 2026-03-12 01:49:25,775] Trial 872 finished with value: 0.0 and parameters: {'timeframe': 'M5', 'atr_period': 13, 'atr_threshold': 10.0, 'pt_mult': 0.5, 'sl_mult': 5.0, 'td_mins': 720}. Best is trial 537 with value: 2.8555764149575955.
[I 2026-03-12 01:49:26,407] Trial 873 pruned. 
[I 2026-03-12 01:49:26,460] Trial 874 finished with value: 0.0 and parameters: {'timeframe': 'M5', 'atr_period': 13, 'atr_threshold': 15.0, 'pt_mult': 0.5, 'sl_mult': 0.5, 'td_mins': 120}. Best is trial 537 with value: 2.8555764149575955.
[I 2026-03-12 01:49:26,517] Trial 875 finished with value: 0.0 and parameters: {'timeframe': 'M5', 'atr_period': 13, 'atr_threshold': 15.0, 'pt_mult': 1.0, 'sl_mult': 0.5, 'td_mins': 60}. Best is trial 537 with value: 2.8555764149575955.
[I 2026-03-12 01:49:26,590] Trial 876 pruned. 
[I 2026-03-12 01:49:26,640] Trial 877 finished with value: 0.0 and parameters: {'timeframe': 'M5', 'atr_period': 13, 'atr_threshold': 8.0, 'pt_mult': 0.5, 'sl_mult': 5.0, 'td_mins': 1200}. Best is trial 537 with value: 2.8555764149575955.
[I 2026-03-12 01:49:26,698] Trial 878 pruned. 
[I 2026-03-12 01:49:29,289] Trial 879 pruned. 
[I 2026-03-12 01:49:29,461] Trial 880 finished with value: 2.8555764149575955 and parameters: {'timeframe': 'M5', 'atr_period': 13, 'atr_threshold': 3.0, 'pt_mult': 0.5, 'sl_mult': 5.0, 'td_mins': 60}. Best is trial 537 with value: 2.8555764149575955.
[I 2026-03-12 01:49:29,704] Trial 881 pruned. 
[I 2026-03-12 01:49:29,942] Trial 882 finished with value: 2.8555764149575955 and parameters: {'timeframe': 'M5', 'atr_period': 13, 'atr_threshold': 3.0, 'pt_mult': 0.5, 'sl_mult': 5.0, 'td_mins': 60}. Best is trial 537 with value: 2.8555764149575955.
[I 2026-03-12 01:49:30,149] Trial 883 finished with value: 2.8555764149575955 and parameters: {'timeframe': 'M5', 'atr_period': 13, 'atr_threshold': 3.0, 'pt_mult': 0.5, 'sl_mult': 5.0, 'td_mins': 60}. Best is trial 537 with value: 2.8555764149575955.
[I 2026-03-12 01:49:30,351] Trial 884 pruned. 
[I 2026-03-12 01:49:30,427] Trial 885 pruned. 
[I 2026-03-12 01:49:30,600] Trial 886 finished with value: 2.8555764149575955 and parameters: {'timeframe': 'M5', 'atr_period': 13, 'atr_threshold': 3.0, 'pt_mult': 0.5, 'sl_mult': 5.0, 'td_mins': 60}. Best is trial 537 with value: 2.8555764149575955.
[I 2026-03-12 01:49:30,772] Trial 887 finished with value: 2.8555764149575955 and parameters: {'timeframe': 'M5', 'atr_period': 13, 'atr_threshold': 3.0, 'pt_mult': 0.5, 'sl_mult': 5.0, 'td_mins': 60}. Best is trial 537 with value: 2.8555764149575955.
[I 2026-03-12 01:49:30,962] Trial 888 finished with value: 2.8555764149575955 and parameters: {'timeframe': 'M5', 'atr_period': 13, 'atr_threshold': 3.0, 'pt_mult': 0.5, 'sl_mult': 5.0, 'td_mins': 60}. Best is trial 537 with value: 2.8555764149575955.
[I 2026-03-12 01:49:31,278] Trial 889 pruned. 
[I 2026-03-12 01:49:31,495] Trial 890 pruned. 
[I 2026-03-12 01:49:31,698] Trial 891 finished with value: 2.8555764149575955 and parameters: {'timeframe': 'M5', 'atr_period': 13, 'atr_threshold': 3.0, 'pt_mult': 0.5, 'sl_mult': 5.0, 'td_mins': 60}. Best is trial 537 with value: 2.8555764149575955.
[I 2026-03-12 01:49:31,901] Trial 892 finished with value: 2.8555764149575955 and parameters: {'timeframe': 'M5', 'atr_period': 13, 'atr_threshold': 3.0, 'pt_mult': 0.5, 'sl_mult': 5.0, 'td_mins': 60}. Best is trial 537 with value: 2.8555764149575955.
[I 2026-03-12 01:49:32,033] Trial 893 pruned. 
[I 2026-03-12 01:49:32,091] Trial 894 finished with value: 0.0 and parameters: {'timeframe': 'M5', 'atr_period': 13, 'atr_threshold': 5.0, 'pt_mult': 5.0, 'sl_mult': 1.0, 'td_mins': 60}. Best is trial 537 with value: 2.8555764149575955.
[I 2026-03-12 01:49:32,291] Trial 895 finished with value: 2.8555764149575955 and parameters: {'timeframe': 'M5', 'atr_period': 13, 'atr_threshold': 3.0, 'pt_mult': 0.5, 'sl_mult': 5.0, 'td_mins': 60}. Best is trial 537 with value: 2.8555764149575955.
[I 2026-03-12 01:49:32,375] Trial 896 pruned. 
[I 2026-03-12 01:49:32,575] Trial 897 finished with value: 2.8555764149575955 and parameters: {'timeframe': 'M5', 'atr_period': 13, 'atr_threshold': 3.0, 'pt_mult': 0.5, 'sl_mult': 5.0, 'td_mins': 60}. Best is trial 537 with value: 2.8555764149575955.
[I 2026-03-12 01:49:32,632] Trial 898 finished with value: 0.0 and parameters: {'timeframe': 'M5', 'atr_period': 13, 'atr_threshold': 8.0, 'pt_mult': 0.5, 'sl_mult': 5.0, 'td_mins': 60}. Best is trial 537 with value: 2.8555764149575955.
[I 2026-03-12 01:49:32,694] Trial 899 finished with value: 0.0 and parameters: {'timeframe': 'M5', 'atr_period': 13, 'atr_threshold': 10.0, 'pt_mult': 2.5, 'sl_mult': 1.0, 'td_mins': 180}. Best is trial 537 with value: 2.8555764149575955.
[I 2026-03-12 01:49:32,895] Trial 900 finished with value: 2.8555764149575955 and parameters: {'timeframe': 'M5', 'atr_period': 13, 'atr_threshold': 3.0, 'pt_mult': 0.5, 'sl_mult': 5.0, 'td_mins': 60}. Best is trial 537 with value: 2.8555764149575955.
[I 2026-03-12 01:49:32,956] Trial 901 finished with value: 0.0 and parameters: {'timeframe': 'M5', 'atr_period': 13, 'atr_threshold': 8.0, 'pt_mult': 2.5, 'sl_mult': 0.5, 'td_mins': 15}. Best is trial 537 with value: 2.8555764149575955.
