[I 2026-03-12 01:01:50,653] Trial 17 finished with value: 0.0 and parameters: {'timeframe': 'M8', 'atr_period': 13, 'atr_threshold': 15.0, 'pt_mult': 0.5, 'sl_mult': 0.5, 'td_mins': 15}. Best is trial 9 with value: 1.5207294803215412.
[I 2026-03-12 01:01:54,688] Trial 18 finished with value: 1.0173337805860019 and parameters: {'timeframe': 'M8', 'atr_period': 13, 'atr_threshold': 0.5, 'pt_mult': 2.5, 'sl_mult': 1.0, 'td_mins': 1080}. Best is trial 9 with value: 1.5207294803215412.
[I 2026-03-12 01:01:54,930] Trial 19 finished with value: 0.15450317017884937 and parameters: {'timeframe': 'M8', 'atr_period': 13, 'atr_threshold': 0.5, 'pt_mult': 2.5, 'sl_mult': 5.0, 'td_mins': 15}. Best is trial 9 with value: 1.5207294803215412.
[I 2026-03-12 01:01:55,949] Trial 20 finished with value: 1.096036554614653 and parameters: {'timeframe': 'M8', 'atr_period': 13, 'atr_threshold': 2.0, 'pt_mult': 1.0, 'sl_mult': 2.5, 'td_mins': 360}. Best is trial 9 with value: 1.5207294803215412.
[I 2026-03-12 01:01:55,993] Trial 21 finished with value: 0.0 and parameters: {'timeframe': 'M8', 'atr_period': 13, 'atr_threshold': 8.0, 'pt_mult': 5.0, 'sl_mult': 5.0, 'td_mins': 180}. Best is trial 9 with value: 1.5207294803215412.
[I 2026-03-12 01:01:56,039] Trial 22 finished with value: 0.0 and parameters: {'timeframe': 'M8', 'atr_period': 13, 'atr_threshold': 15.0, 'pt_mult': 0.5, 'sl_mult': 0.5, 'td_mins': 1080}. Best is trial 9 with value: 1.5207294803215412.
[I 2026-03-12 01:01:56,292] Trial 23 finished with value: 0.6994943839620602 and parameters: {'timeframe': 'M8', 'atr_period': 13, 'atr_threshold': 5.0, 'pt_mult': 1.0, 'sl_mult': 1.0, 'td_mins': 1080}. Best is trial 9 with value: 1.5207294803215412.
[I 2026-03-12 01:01:56,335] Trial 24 finished with value: 0.0 and parameters: {'timeframe': 'M8', 'atr_period': 13, 'atr_threshold': 10.0, 'pt_mult': 2.5, 'sl_mult': 0.5, 'td_mins': 120}. Best is trial 9 with value: 1.5207294803215412.
[I 2026-03-12 01:01:56,400] Trial 25 finished with value: 0.9406440884627421 and parameters: {'timeframe': 'M8', 'atr_period': 13, 'atr_threshold': 5.0, 'pt_mult': 0.5, 'sl_mult': 2.5, 'td_mins': 30}. Best is trial 9 with value: 1.5207294803215412.
[I 2026-03-12 01:01:56,972] Trial 26 finished with value: 1.5573886641453658 and parameters: {'timeframe': 'M8', 'atr_period': 13, 'atr_threshold': 3.0, 'pt_mult': 0.5, 'sl_mult': 5.0, 'td_mins': 360}. Best is trial 26 with value: 1.5573886641453658.
[I 2026-03-12 01:01:57,528] Trial 27 pruned. 
[I 2026-03-12 01:01:57,576] Trial 28 finished with value: 0.0 and parameters: {'timeframe': 'M8', 'atr_period': 13, 'atr_threshold': 8.0, 'pt_mult': 2.5, 'sl_mult': 1.0, 'td_mins': 720}. Best is trial 26 with value: 1.5573886641453658.
[I 2026-03-12 01:01:58,086] Trial 29 finished with value: 1.5016543358486985 and parameters: {'timeframe': 'M8', 'atr_period': 13, 'atr_threshold': 0.5, 'pt_mult': 1.0, 'sl_mult': 5.0, 'td_mins': 60}. Best is trial 26 with value: 1.5573886641453658.
[I 2026-03-12 01:01:58,128] Trial 30 finished with value: 0.0 and parameters: {'timeframe': 'M8', 'atr_period': 13, 'atr_threshold': 8.0, 'pt_mult': 1.0, 'sl_mult': 2.5, 'td_mins': 15}. Best is trial 26 with value: 1.5573886641453658.
[I 2026-03-12 01:01:58,376] Trial 31 finished with value: 0.6950867450260593 and parameters: {'timeframe': 'M8', 'atr_period': 13, 'atr_threshold': 5.0, 'pt_mult': 0.5, 'sl_mult': 2.5, 'td_mins': 720}. Best is trial 26 with value: 1.5573886641453658.
[I 2026-03-12 01:01:58,424] Trial 32 pruned. 
[I 2026-03-12 01:02:02,086] Trial 33 finished with value: 1.022882107695174 and parameters: {'timeframe': 'M8', 'atr_period': 13, 'atr_threshold': 0.5, 'pt_mult': 2.5, 'sl_mult': 0.5, 'td_mins': 1200}. Best is trial 26 with value: 1.5573886641453658.
[I 2026-03-12 01:02:02,132] Trial 34 finished with value: 0.0 and parameters: {'timeframe': 'M8', 'atr_period': 13, 'atr_threshold': 15.0, 'pt_mult': 5.0, 'sl_mult': 1.0, 'td_mins': 60}. Best is trial 26 with value: 1.5573886641453658.
[I 2026-03-12 01:02:03,315] Trial 35 finished with value: 1.0228144777574173 and parameters: {'timeframe': 'M8', 'atr_period': 13, 'atr_threshold': 2.0, 'pt_mult': 1.0, 'sl_mult': 1.0, 'td_mins': 720}. Best is trial 26 with value: 1.5573886641453658.
[I 2026-03-12 01:02:03,358] Trial 36 finished with value: 0.0 and parameters: {'timeframe': 'M8', 'atr_period': 13, 'atr_threshold': 15.0, 'pt_mult': 5.0, 'sl_mult': 5.0, 'td_mins': 30}. Best is trial 26 with value: 1.5573886641453658.
[I 2026-03-12 01:02:03,403] Trial 37 finished with value: 0.0 and parameters: {'timeframe': 'M8', 'atr_period': 13, 'atr_threshold': 15.0, 'pt_mult': 0.5, 'sl_mult': 5.0, 'td_mins': 60}. Best is trial 26 with value: 1.5573886641453658.
[I 2026-03-12 01:02:03,473] Trial 38 pruned. 
[I 2026-03-12 01:02:04,173] Trial 39 finished with value: 1.4677088780028034 and parameters: {'timeframe': 'M8', 'atr_period': 13, 'atr_threshold': 2.0, 'pt_mult': 1.0, 'sl_mult': 5.0, 'td_mins': 180}. Best is trial 26 with value: 1.5573886641453658.
[I 2026-03-12 01:02:04,221] Trial 40 finished with value: 0.0 and parameters: {'timeframe': 'M8', 'atr_period': 13, 'atr_threshold': 15.0, 'pt_mult': 2.5, 'sl_mult': 2.5, 'td_mins': 120}. Best is trial 26 with value: 1.5573886641453658.
[I 2026-03-12 01:02:04,470] Trial 41 finished with value: 0.6950867450260593 and parameters: {'timeframe': 'M8', 'atr_period': 13, 'atr_threshold': 5.0, 'pt_mult': 0.5, 'sl_mult': 2.5, 'td_mins': 720}. Best is trial 26 with value: 1.5573886641453658.
[I 2026-03-12 01:02:04,514] Trial 42 finished with value: 0.0 and parameters: {'timeframe': 'M8', 'atr_period': 13, 'atr_threshold': 8.0, 'pt_mult': 1.0, 'sl_mult': 1.0, 'td_mins': 5}. Best is trial 26 with value: 1.5573886641453658.
[I 2026-03-12 01:02:05,096] Trial 43 finished with value: 1.1313430262176245 and parameters: {'timeframe': 'M8', 'atr_period': 13, 'atr_threshold': 2.0, 'pt_mult': 0.5, 'sl_mult': 2.5, 'td_mins': 180}. Best is trial 26 with value: 1.5573886641453658.
[I 2026-03-12 01:02:05,139] Trial 44 finished with value: 0.0 and parameters: {'timeframe': 'M8', 'atr_period': 13, 'atr_threshold': 8.0, 'pt_mult': 1.0, 'sl_mult': 0.5, 'td_mins': 120}. Best is trial 26 with value: 1.5573886641453658.
[I 2026-03-12 01:02:06,338] Trial 45 finished with value: 1.0228144777574173 and parameters: {'timeframe': 'M8', 'atr_period': 13, 'atr_threshold': 2.0, 'pt_mult': 1.0, 'sl_mult': 1.0, 'td_mins': 720}. Best is trial 26 with value: 1.5573886641453658.
[I 2026-03-12 01:02:07,461] Trial 46 finished with value: 1.0599497881362436 and parameters: {'timeframe': 'M8', 'atr_period': 13, 'atr_threshold': 3.0, 'pt_mult': 2.5, 'sl_mult': 0.5, 'td_mins': 1080}. Best is trial 26 with value: 1.5573886641453658.
[I 2026-03-12 01:02:07,510] Trial 47 finished with value: 0.0 and parameters: {'timeframe': 'M8', 'atr_period': 13, 'atr_threshold': 15.0, 'pt_mult': 5.0, 'sl_mult': 0.5, 'td_mins': 60}. Best is trial 26 with value: 1.5573886641453658.
[I 2026-03-12 01:02:07,556] Trial 48 finished with value: 0.0 and parameters: {'timeframe': 'M8', 'atr_period': 13, 'atr_threshold': 15.0, 'pt_mult': 0.5, 'sl_mult': 2.5, 'td_mins': 120}. Best is trial 26 with value: 1.5573886641453658.
[I 2026-03-12 01:02:07,674] Trial 49 pruned. 
[I 2026-03-12 01:02:07,828] Trial 50 pruned. 
[I 2026-03-12 01:02:07,870] Trial 51 finished with value: 0.0 and parameters: {'timeframe': 'M8', 'atr_period': 13, 'atr_threshold': 8.0, 'pt_mult': 5.0, 'sl_mult': 0.5, 'td_mins': 360}. Best is trial 26 with value: 1.5573886641453658.
[I 2026-03-12 01:02:07,912] Trial 52 finished with value: 0.0 and parameters: {'timeframe': 'M8', 'atr_period': 13, 'atr_threshold': 8.0, 'pt_mult': 0.5, 'sl_mult': 0.5, 'td_mins': 60}. Best is trial 26 with value: 1.5573886641453658.
[I 2026-03-12 01:02:07,958] Trial 53 finished with value: 0.0 and parameters: {'timeframe': 'M8', 'atr_period': 13, 'atr_threshold': 10.0, 'pt_mult': 1.0, 'sl_mult': 5.0, 'td_mins': 120}. Best is trial 26 with value: 1.5573886641453658.
[I 2026-03-12 01:02:08,006] Trial 54 finished with value: 0.0 and parameters: {'timeframe': 'M8', 'atr_period': 13, 'atr_threshold': 15.0, 'pt_mult': 0.5, 'sl_mult': 2.5, 'td_mins': 360}. Best is trial 26 with value: 1.5573886641453658.
[I 2026-03-12 01:02:08,052] Trial 55 pruned. 
[I 2026-03-12 01:02:08,162] Trial 56 pruned. 
[I 2026-03-12 01:02:08,337] Trial 57 finished with value: 2.2537359686354455 and parameters: {'timeframe': 'M8', 'atr_period': 13, 'atr_threshold': 3.0, 'pt_mult': 0.5, 'sl_mult': 5.0, 'td_mins': 60}. Best is trial 57 with value: 2.2537359686354455.
[I 2026-03-12 01:02:08,380] Trial 58 finished with value: 0.0 and parameters: {'timeframe': 'M8', 'atr_period': 13, 'atr_threshold': 10.0, 'pt_mult': 2.5, 'sl_mult': 2.5, 'td_mins': 360}. Best is trial 57 with value: 2.2537359686354455.
[I 2026-03-12 01:02:08,655] Trial 59 pruned. 
[I 2026-03-12 01:02:08,698] Trial 60 finished with value: 0.0 and parameters: {'timeframe': 'M8', 'atr_period': 13, 'atr_threshold': 10.0, 'pt_mult': 5.0, 'sl_mult': 5.0, 'td_mins': 5}. Best is trial 57 with value: 2.2537359686354455.
[I 2026-03-12 01:02:08,744] Trial 61 finished with value: 0.0 and parameters: {'timeframe': 'M8', 'atr_period': 13, 'atr_threshold': 15.0, 'pt_mult': 1.0, 'sl_mult': 0.5, 'td_mins': 30}. Best is trial 57 with value: 2.2537359686354455.
[I 2026-03-12 01:02:08,791] Trial 62 finished with value: 0.0 and parameters: {'timeframe': 'M8', 'atr_period': 13, 'atr_threshold': 10.0, 'pt_mult': 5.0, 'sl_mult': 1.0, 'td_mins': 5}. Best is trial 57 with value: 2.2537359686354455.
[I 2026-03-12 01:02:08,887] Trial 63 pruned. 
[I 2026-03-12 01:02:09,252] Trial 64 finished with value: 0.7225642866839485 and parameters: {'timeframe': 'M8', 'atr_period': 13, 'atr_threshold': 5.0, 'pt_mult': 1.0, 'sl_mult': 2.5, 'td_mins': 1080}. Best is trial 57 with value: 2.2537359686354455.
[I 2026-03-12 01:02:09,319] Trial 65 finished with value: 1.6737396374757434 and parameters: {'timeframe': 'M8', 'atr_period': 13, 'atr_threshold': 5.0, 'pt_mult': 0.5, 'sl_mult': 5.0, 'td_mins': 30}. Best is trial 57 with value: 2.2537359686354455.
[I 2026-03-12 01:02:09,362] Trial 66 finished with value: 0.0 and parameters: {'timeframe': 'M8', 'atr_period': 13, 'atr_threshold': 15.0, 'pt_mult': 0.5, 'sl_mult': 5.0, 'td_mins': 1200}. Best is trial 57 with value: 2.2537359686354455.
[I 2026-03-12 01:02:09,478] Trial 67 pruned. 
[I 2026-03-12 01:02:09,522] Trial 68 finished with value: 0.0 and parameters: {'timeframe': 'M8', 'atr_period': 13, 'atr_threshold': 8.0, 'pt_mult': 0.5, 'sl_mult': 5.0, 'td_mins': 180}. Best is trial 57 with value: 2.2537359686354455.
[I 2026-03-12 01:02:09,611] Trial 69 pruned. 
[I 2026-03-12 01:02:09,687] Trial 70 finished with value: 0.8664312518818449 and parameters: {'timeframe': 'M8', 'atr_period': 13, 'atr_threshold': 5.0, 'pt_mult': 0.5, 'sl_mult': 2.5, 'td_mins': 60}. Best is trial 57 with value: 2.2537359686354455.
[I 2026-03-12 01:02:09,729] Trial 71 finished with value: 0.0 and parameters: {'timeframe': 'M8', 'atr_period': 13, 'atr_threshold': 10.0, 'pt_mult': 1.0, 'sl_mult': 1.0, 'td_mins': 1200}. Best is trial 57 with value: 2.2537359686354455.
[I 2026-03-12 01:02:09,772] Trial 72 finished with value: 0.0 and parameters: {'timeframe': 'M8', 'atr_period': 13, 'atr_threshold': 15.0, 'pt_mult': 2.5, 'sl_mult': 5.0, 'td_mins': 1200}. Best is trial 57 with value: 2.2537359686354455.
[I 2026-03-12 01:02:10,075] Trial 73 pruned. 
[I 2026-03-12 01:02:10,200] Trial 74 pruned. 
[I 2026-03-12 01:02:10,299] Trial 75 finished with value: 0.6455941666675893 and parameters: {'timeframe': 'M8', 'atr_period': 13, 'atr_threshold': 5.0, 'pt_mult': 1.0, 'sl_mult': 0.5, 'td_mins': 180}. Best is trial 57 with value: 2.2537359686354455.
[I 2026-03-12 01:02:10,342] Trial 76 finished with value: 0.0 and parameters: {'timeframe': 'M8', 'atr_period': 13, 'atr_threshold': 10.0, 'pt_mult': 5.0, 'sl_mult': 5.0, 'td_mins': 5}. Best is trial 57 with value: 2.2537359686354455.
[I 2026-03-12 01:02:10,384] Trial 77 finished with value: 0.0 and parameters: {'timeframe': 'M8', 'atr_period': 13, 'atr_threshold': 10.0, 'pt_mult': 5.0, 'sl_mult': 2.5, 'td_mins': 360}. Best is trial 57 with value: 2.2537359686354455.
[I 2026-03-12 01:02:10,427] Trial 78 finished with value: 0.0 and parameters: {'timeframe': 'M8', 'atr_period': 13, 'atr_threshold': 10.0, 'pt_mult': 2.5, 'sl_mult': 2.5, 'td_mins': 1080}. Best is trial 57 with value: 2.2537359686354455.
[I 2026-03-12 01:02:10,663] Trial 79 finished with value: 1.0456905409637123 and parameters: {'timeframe': 'M8', 'atr_period': 13, 'atr_threshold': 3.0, 'pt_mult': 1.0, 'sl_mult': 0.5, 'td_mins': 180}. Best is trial 57 with value: 2.2537359686354455.
[I 2026-03-12 01:02:10,705] Trial 80 finished with value: 0.0 and parameters: {'timeframe': 'M8', 'atr_period': 13, 'atr_threshold': 8.0, 'pt_mult': 2.5, 'sl_mult': 2.5, 'td_mins': 1080}. Best is trial 57 with value: 2.2537359686354455.
[I 2026-03-12 01:02:10,997] Trial 81 finished with value: 0.7225642866839485 and parameters: {'timeframe': 'M8', 'atr_period': 13, 'atr_threshold': 5.0, 'pt_mult': 1.0, 'sl_mult': 2.5, 'td_mins': 720}. Best is trial 57 with value: 2.2537359686354455.
[I 2026-03-12 01:02:11,040] Trial 82 finished with value: 0.0 and parameters: {'timeframe': 'M8', 'atr_period': 13, 'atr_threshold': 15.0, 'pt_mult': 1.0, 'sl_mult': 5.0, 'td_mins': 1200}. Best is trial 57 with value: 2.2537359686354455.
[I 2026-03-12 01:02:11,163] Trial 83 finished with value: 0.9596860002007999 and parameters: {'timeframe': 'M8', 'atr_period': 13, 'atr_threshold': 3.0, 'pt_mult': 1.0, 'sl_mult': 2.5, 'td_mins': 30}. Best is trial 57 with value: 2.2537359686354455.
[I 2026-03-12 01:02:11,700] Trial 84 pruned. 
[I 2026-03-12 01:02:11,743] Trial 85 finished with value: 0.0 and parameters: {'timeframe': 'M8', 'atr_period': 13, 'atr_threshold': 10.0, 'pt_mult': 1.0, 'sl_mult': 1.0, 'td_mins': 120}. Best is trial 57 with value: 2.2537359686354455.
[I 2026-03-12 01:02:12,041] Trial 86 pruned. 
[I 2026-03-12 01:02:12,090] Trial 87 finished with value: 0.0 and parameters: {'timeframe': 'M8', 'atr_period': 13, 'atr_threshold': 10.0, 'pt_mult': 1.0, 'sl_mult': 0.5, 'td_mins': 30}. Best is trial 57 with value: 2.2537359686354455.
[I 2026-03-12 01:02:12,204] Trial 88 pruned. 
[I 2026-03-12 01:02:12,252] Trial 89 finished with value: 0.0 and parameters: {'timeframe': 'M8', 'atr_period': 13, 'atr_threshold': 10.0, 'pt_mult': 1.0, 'sl_mult': 2.5, 'td_mins': 60}. Best is trial 57 with value: 2.2537359686354455.
[I 2026-03-12 01:02:12,302] Trial 90 pruned. 
[I 2026-03-12 01:02:12,348] Trial 91 finished with value: 0.0 and parameters: {'timeframe': 'M8', 'atr_period': 13, 'atr_threshold': 15.0, 'pt_mult': 1.0, 'sl_mult': 0.5, 'td_mins': 15}. Best is trial 57 with value: 2.2537359686354455.
[I 2026-03-12 01:02:12,434] Trial 92 finished with value: 0.6318904012208983 and parameters: {'timeframe': 'M8', 'atr_period': 13, 'atr_threshold': 5.0, 'pt_mult': 0.5, 'sl_mult': 1.0, 'td_mins': 120}. Best is trial 57 with value: 2.2537359686354455.
[I 2026-03-12 01:02:12,480] Trial 93 pruned. 
[I 2026-03-12 01:02:12,523] Trial 94 finished with value: 0.0 and parameters: {'timeframe': 'M8', 'atr_period': 13, 'atr_threshold': 15.0, 'pt_mult': 1.0, 'sl_mult': 0.5, 'td_mins': 60}. Best is trial 57 with value: 2.2537359686354455.
[I 2026-03-12 01:02:12,591] Trial 95 pruned. 
[I 2026-03-12 01:02:12,646] Trial 96 pruned. 
[I 2026-03-12 01:02:12,722] Trial 97 pruned. 
[I 2026-03-12 01:02:12,764] Trial 98 finished with value: 0.0 and parameters: {'timeframe': 'M8', 'atr_period': 13, 'atr_threshold': 15.0, 'pt_mult': 2.5, 'sl_mult': 0.5, 'td_mins': 360}. Best is trial 57 with value: 2.2537359686354455.
[I 2026-03-12 01:02:12,883] Trial 99 finished with value: 1.361586610904409 and parameters: {'timeframe': 'M8', 'atr_period': 13, 'atr_threshold': 3.0, 'pt_mult': 0.5, 'sl_mult': 2.5, 'td_mins': 30}. Best is trial 57 with value: 2.2537359686354455.
[I 2026-03-12 01:02:13,075] Trial 100 finished with value: 0.8732873853582142 and parameters: {'timeframe': 'M8', 'atr_period': 13, 'atr_threshold': 5.0, 'pt_mult': 1.0, 'sl_mult': 5.0, 'td_mins': 360}. Best is trial 57 with value: 2.2537359686354455.
[I 2026-03-12 01:02:13,119] Trial 101 finished with value: 0.0 and parameters: {'timeframe': 'M8', 'atr_period': 13, 'atr_threshold': 15.0, 'pt_mult': 2.5, 'sl_mult': 2.5, 'td_mins': 180}. Best is trial 57 with value: 2.2537359686354455.
[I 2026-03-12 01:02:13,161] Trial 102 finished with value: 0.0 and parameters: {'timeframe': 'M8', 'atr_period': 13, 'atr_threshold': 10.0, 'pt_mult': 2.5, 'sl_mult': 5.0, 'td_mins': 5}. Best is trial 57 with value: 2.2537359686354455.
[I 2026-03-12 01:02:13,251] Trial 103 pruned. 
[I 2026-03-12 01:02:13,387] Trial 104 pruned. 
[I 2026-03-12 01:02:13,430] Trial 105 finished with value: 0.0 and parameters: {'timeframe': 'M8', 'atr_period': 13, 'atr_threshold': 15.0, 'pt_mult': 0.5, 'sl_mult': 2.5, 'td_mins': 30}. Best is trial 57 with value: 2.2537359686354455.
[I 2026-03-12 01:02:13,474] Trial 106 finished with value: 0.0 and parameters: {'timeframe': 'M8', 'atr_period': 13, 'atr_threshold': 10.0, 'pt_mult': 1.0, 'sl_mult': 1.0, 'td_mins': 1080}. Best is trial 57 with value: 2.2537359686354455.
[I 2026-03-12 01:02:14,270] Trial 107 pruned. 
[I 2026-03-12 01:02:14,395] Trial 108 pruned. 
[I 2026-03-12 01:02:14,462] Trial 109 pruned. 
[I 2026-03-12 01:02:15,404] Trial 110 pruned. 
[I 2026-03-12 01:02:15,452] Trial 111 pruned. 
[I 2026-03-12 01:02:15,560] Trial 112 pruned. 
[I 2026-03-12 01:02:17,540] Trial 113 pruned. 
[I 2026-03-12 01:02:17,655] Trial 114 pruned. 
[I 2026-03-12 01:02:17,698] Trial 115 finished with value: 0.0 and parameters: {'timeframe': 'M8', 'atr_period': 13, 'atr_threshold': 15.0, 'pt_mult': 2.5, 'sl_mult': 0.5, 'td_mins': 1200}. Best is trial 57 with value: 2.2537359686354455.
[I 2026-03-12 01:02:17,802] Trial 116 pruned. 
[I 2026-03-12 01:02:18,007] Trial 117 finished with value: 0.6994943839620602 and parameters: {'timeframe': 'M8', 'atr_period': 13, 'atr_threshold': 5.0, 'pt_mult': 1.0, 'sl_mult': 1.0, 'td_mins': 720}. Best is trial 57 with value: 2.2537359686354455.
[I 2026-03-12 01:02:18,053] Trial 118 pruned. 
[I 2026-03-12 01:02:18,165] Trial 119 pruned. 
[I 2026-03-12 01:02:18,299] Trial 120 pruned. 
[I 2026-03-12 01:02:18,418] Trial 121 finished with value: 0.6211813070345068 and parameters: {'timeframe': 'M8', 'atr_period': 13, 'atr_threshold': 5.0, 'pt_mult': 2.5, 'sl_mult': 5.0, 'td_mins': 120}. Best is trial 57 with value: 2.2537359686354455.
[I 2026-03-12 01:02:18,464] Trial 122 finished with value: 0.0 and parameters: {'timeframe': 'M8', 'atr_period': 13, 'atr_threshold': 10.0, 'pt_mult': 2.5, 'sl_mult': 2.5, 'td_mins': 360}. Best is trial 57 with value: 2.2537359686354455.
[I 2026-03-12 01:02:18,561] Trial 123 pruned. 
[I 2026-03-12 01:02:18,607] Trial 124 finished with value: 0.0 and parameters: {'timeframe': 'M8', 'atr_period': 13, 'atr_threshold': 8.0, 'pt_mult': 0.5, 'sl_mult': 5.0, 'td_mins': 15}. Best is trial 57 with value: 2.2537359686354455.
[I 2026-03-12 01:02:18,649] Trial 125 finished with value: 0.0 and parameters: {'timeframe': 'M8', 'atr_period': 13, 'atr_threshold': 8.0, 'pt_mult': 1.0, 'sl_mult': 1.0, 'td_mins': 60}. Best is trial 57 with value: 2.2537359686354455.
[I 2026-03-12 01:02:18,691] Trial 126 finished with value: 0.0 and parameters: {'timeframe': 'M8', 'atr_period': 13, 'atr_threshold': 10.0, 'pt_mult': 5.0, 'sl_mult': 1.0, 'td_mins': 60}. Best is trial 57 with value: 2.2537359686354455.
[I 2026-03-12 01:02:19,057] Trial 127 pruned. 
[I 2026-03-12 01:02:19,118] Trial 128 finished with value: 0.0 and parameters: {'timeframe': 'M8', 'atr_period': 13, 'atr_threshold': 10.0, 'pt_mult': 5.0, 'sl_mult': 5.0, 'td_mins': 180}. Best is trial 57 with value: 2.2537359686354455.
[I 2026-03-12 01:02:19,196] Trial 129 pruned. 
[I 2026-03-12 01:02:19,320] Trial 130 finished with value: 0.640840375106685 and parameters: {'timeframe': 'M8', 'atr_period': 13, 'atr_threshold': 5.0, 'pt_mult': 0.5, 'sl_mult': 1.0, 'td_mins': 360}. Best is trial 57 with value: 2.2537359686354455.
[I 2026-03-12 01:02:19,367] Trial 131 pruned. 
[I 2026-03-12 01:02:19,410] Trial 132 finished with value: 0.0 and parameters: {'timeframe': 'M8', 'atr_period': 13, 'atr_threshold': 15.0, 'pt_mult': 0.5, 'sl_mult': 1.0, 'td_mins': 360}. Best is trial 57 with value: 2.2537359686354455.
[I 2026-03-12 01:02:19,459] Trial 133 pruned. 
[I 2026-03-12 01:02:25,105] Trial 134 finished with value: 1.0705227832059372 and parameters: {'timeframe': 'M8', 'atr_period': 13, 'atr_threshold': 0.5, 'pt_mult': 0.5, 'sl_mult': 5.0, 'td_mins': 1200}. Best is trial 57 with value: 2.2537359686354455.
[I 2026-03-12 01:02:25,149] Trial 135 finished with value: 0.0 and parameters: {'timeframe': 'M8', 'atr_period': 13, 'atr_threshold': 10.0, 'pt_mult': 1.0, 'sl_mult': 1.0, 'td_mins': 120}. Best is trial 57 with value: 2.2537359686354455.
[I 2026-03-12 01:02:25,194] Trial 136 finished with value: 0.0 and parameters: {'timeframe': 'M8', 'atr_period': 13, 'atr_threshold': 15.0, 'pt_mult': 1.0, 'sl_mult': 2.5, 'td_mins': 360}. Best is trial 57 with value: 2.2537359686354455.
[I 2026-03-12 01:02:26,220] Trial 137 finished with value: 1.3293830725443108 and parameters: {'timeframe': 'M8', 'atr_period': 13, 'atr_threshold': 3.0, 'pt_mult': 0.5, 'sl_mult': 5.0, 'td_mins': 720}. Best is trial 57 with value: 2.2537359686354455.
[I 2026-03-12 01:02:26,269] Trial 138 pruned. 
[I 2026-03-12 01:02:26,654] Trial 139 finished with value: 0.5988181425798004 and parameters: {'timeframe': 'M8', 'atr_period': 13, 'atr_threshold': 5.0, 'pt_mult': 2.5, 'sl_mult': 1.0, 'td_mins': 1080}. Best is trial 57 with value: 2.2537359686354455.
[I 2026-03-12 01:02:26,774] Trial 140 pruned. 
