[I 2026-03-12 02:00:44,580] Trial 34 finished with value: 0.9116675365143353 and parameters: {'timeframe': 'M15', 'atr_period': 13, 'atr_threshold': 3.0, 'pt_mult': 0.5, 'sl_mult': 1.0, 'td_mins': 360}. Best is trial 33 with value: 1.4985832147843308.
[I 2026-03-12 02:00:45,088] Trial 35 finished with value: 0.8753358027790334 and parameters: {'timeframe': 'M15', 'atr_period': 13, 'atr_threshold': 1.0, 'pt_mult': 1.0, 'sl_mult': 0.5, 'td_mins': 120}. Best is trial 33 with value: 1.4985832147843308.
[I 2026-03-12 02:00:45,200] Trial 36 pruned. 
[I 2026-03-12 02:00:45,246] Trial 37 finished with value: 0.0 and parameters: {'timeframe': 'M15', 'atr_period': 13, 'atr_threshold': 15.0, 'pt_mult': 5.0, 'sl_mult': 5.0, 'td_mins': 180}. Best is trial 33 with value: 1.4985832147843308.
[I 2026-03-12 02:00:45,288] Trial 38 finished with value: 0.0 and parameters: {'timeframe': 'M15', 'atr_period': 13, 'atr_threshold': 10.0, 'pt_mult': 1.0, 'sl_mult': 2.5, 'td_mins': 1200}. Best is trial 33 with value: 1.4985832147843308.
[I 2026-03-12 02:00:45,355] Trial 39 finished with value: 0.6463443025535494 and parameters: {'timeframe': 'M15', 'atr_period': 13, 'atr_threshold': 5.0, 'pt_mult': 0.5, 'sl_mult': 1.0, 'td_mins': 15}. Best is trial 33 with value: 1.4985832147843308.
[I 2026-03-12 02:00:46,091] Trial 40 finished with value: 0.9506927947537889 and parameters: {'timeframe': 'M15', 'atr_period': 13, 'atr_threshold': 0.5, 'pt_mult': 0.5, 'sl_mult': 1.0, 'td_mins': 360}. Best is trial 33 with value: 1.4985832147843308.
[I 2026-03-12 02:00:46,138] Trial 41 pruned. 
[I 2026-03-12 02:00:46,328] Trial 42 pruned. 
[I 2026-03-12 02:00:46,745] Trial 43 finished with value: 1.9602391734825715 and parameters: {'timeframe': 'M15', 'atr_period': 13, 'atr_threshold': 2.0, 'pt_mult': 1.0, 'sl_mult': 5.0, 'td_mins': 120}. Best is trial 43 with value: 1.9602391734825715.
[I 2026-03-12 02:00:48,519] Trial 44 finished with value: 0.7398592450970155 and parameters: {'timeframe': 'M15', 'atr_period': 13, 'atr_threshold': 2.0, 'pt_mult': 5.0, 'sl_mult': 0.5, 'td_mins': 720}. Best is trial 43 with value: 1.9602391734825715.
[I 2026-03-12 02:00:48,563] Trial 45 finished with value: 0.0 and parameters: {'timeframe': 'M15', 'atr_period': 13, 'atr_threshold': 10.0, 'pt_mult': 0.5, 'sl_mult': 1.0, 'td_mins': 360}. Best is trial 43 with value: 1.9602391734825715.
[I 2026-03-12 02:00:48,606] Trial 46 finished with value: 0.0 and parameters: {'timeframe': 'M15', 'atr_period': 13, 'atr_threshold': 10.0, 'pt_mult': 0.5, 'sl_mult': 0.5, 'td_mins': 1080}. Best is trial 43 with value: 1.9602391734825715.
[I 2026-03-12 02:00:48,649] Trial 47 pruned. 
[I 2026-03-12 02:00:48,692] Trial 48 pruned. 
[I 2026-03-12 02:00:49,049] Trial 49 finished with value: 0.8464312456044834 and parameters: {'timeframe': 'M15', 'atr_period': 13, 'atr_threshold': 2.0, 'pt_mult': 1.0, 'sl_mult': 1.0, 'td_mins': 120}. Best is trial 43 with value: 1.9602391734825715.
[I 2026-03-12 02:00:49,095] Trial 50 finished with value: 0.0 and parameters: {'timeframe': 'M15', 'atr_period': 13, 'atr_threshold': 10.0, 'pt_mult': 0.5, 'sl_mult': 2.5, 'td_mins': 5}. Best is trial 43 with value: 1.9602391734825715.
[I 2026-03-12 02:00:50,114] Trial 51 finished with value: 0.9638728747519366 and parameters: {'timeframe': 'M15', 'atr_period': 13, 'atr_threshold': 2.0, 'pt_mult': 1.0, 'sl_mult': 0.5, 'td_mins': 720}. Best is trial 43 with value: 1.9602391734825715.
[I 2026-03-12 02:00:50,165] Trial 52 finished with value: 0.0 and parameters: {'timeframe': 'M15', 'atr_period': 13, 'atr_threshold': 15.0, 'pt_mult': 2.5, 'sl_mult': 1.0, 'td_mins': 15}. Best is trial 43 with value: 1.9602391734825715.
[I 2026-03-12 02:00:50,419] Trial 53 pruned. 
[I 2026-03-12 02:00:50,466] Trial 54 pruned. 
[I 2026-03-12 02:00:50,602] Trial 55 pruned. 
[I 2026-03-12 02:00:50,937] Trial 56 finished with value: 0.9560760816241409 and parameters: {'timeframe': 'M15', 'atr_period': 13, 'atr_threshold': 2.0, 'pt_mult': 0.5, 'sl_mult': 0.5, 'td_mins': 180}. Best is trial 43 with value: 1.9602391734825715.
[I 2026-03-12 02:00:52,965] Trial 57 finished with value: 0.9116294262988113 and parameters: {'timeframe': 'M15', 'atr_period': 13, 'atr_threshold': 0.5, 'pt_mult': 2.5, 'sl_mult': 1.0, 'td_mins': 720}. Best is trial 43 with value: 1.9602391734825715.
[I 2026-03-12 02:00:56,281] Trial 58 finished with value: 0.8821865678801547 and parameters: {'timeframe': 'M15', 'atr_period': 13, 'atr_threshold': 1.0, 'pt_mult': 5.0, 'sl_mult': 0.5, 'td_mins': 1080}. Best is trial 43 with value: 1.9602391734825715.
[I 2026-03-12 02:00:56,325] Trial 59 finished with value: 0.0 and parameters: {'timeframe': 'M15', 'atr_period': 13, 'atr_threshold': 15.0, 'pt_mult': 1.0, 'sl_mult': 5.0, 'td_mins': 1080}. Best is trial 43 with value: 1.9602391734825715.
[I 2026-03-12 02:00:56,372] Trial 60 finished with value: 0.0 and parameters: {'timeframe': 'M15', 'atr_period': 13, 'atr_threshold': 15.0, 'pt_mult': 2.5, 'sl_mult': 1.0, 'td_mins': 1200}. Best is trial 43 with value: 1.9602391734825715.
[I 2026-03-12 02:01:00,759] Trial 61 finished with value: 0.885356425681836 and parameters: {'timeframe': 'M15', 'atr_period': 13, 'atr_threshold': 0.5, 'pt_mult': 5.0, 'sl_mult': 1.0, 'td_mins': 1200}. Best is trial 43 with value: 1.9602391734825715.
[I 2026-03-12 02:01:00,873] Trial 62 pruned. 
[I 2026-03-12 02:01:00,922] Trial 63 finished with value: 0.0 and parameters: {'timeframe': 'M15', 'atr_period': 13, 'atr_threshold': 15.0, 'pt_mult': 0.5, 'sl_mult': 5.0, 'td_mins': 1200}. Best is trial 43 with value: 1.9602391734825715.
[I 2026-03-12 02:01:01,007] Trial 64 pruned. 
[I 2026-03-12 02:01:01,051] Trial 65 finished with value: 0.0 and parameters: {'timeframe': 'M15', 'atr_period': 13, 'atr_threshold': 15.0, 'pt_mult': 2.5, 'sl_mult': 1.0, 'td_mins': 15}. Best is trial 43 with value: 1.9602391734825715.
[I 2026-03-12 02:01:04,636] Trial 66 finished with value: 1.013608448670958 and parameters: {'timeframe': 'M15', 'atr_period': 13, 'atr_threshold': 1.0, 'pt_mult': 1.0, 'sl_mult': 5.0, 'td_mins': 1080}. Best is trial 43 with value: 1.9602391734825715.
[I 2026-03-12 02:01:05,350] Trial 67 finished with value: 1.977309488674108 and parameters: {'timeframe': 'M15', 'atr_period': 13, 'atr_threshold': 3.0, 'pt_mult': 1.0, 'sl_mult': 5.0, 'td_mins': 360}. Best is trial 67 with value: 1.977309488674108.
[I 2026-03-12 02:01:05,401] Trial 68 pruned. 
[I 2026-03-12 02:01:05,448] Trial 69 finished with value: 0.0 and parameters: {'timeframe': 'M15', 'atr_period': 13, 'atr_threshold': 15.0, 'pt_mult': 2.5, 'sl_mult': 5.0, 'td_mins': 5}. Best is trial 67 with value: 1.977309488674108.
[I 2026-03-12 02:01:05,491] Trial 70 finished with value: 0.0 and parameters: {'timeframe': 'M15', 'atr_period': 13, 'atr_threshold': 10.0, 'pt_mult': 2.5, 'sl_mult': 2.5, 'td_mins': 30}. Best is trial 67 with value: 1.977309488674108.
[I 2026-03-12 02:01:08,039] Trial 71 finished with value: 0.9735018361076795 and parameters: {'timeframe': 'M15', 'atr_period': 13, 'atr_threshold': 2.0, 'pt_mult': 1.0, 'sl_mult': 2.5, 'td_mins': 1200}. Best is trial 67 with value: 1.977309488674108.
[I 2026-03-12 02:01:08,679] Trial 72 finished with value: 1.977309488674108 and parameters: {'timeframe': 'M15', 'atr_period': 13, 'atr_threshold': 3.0, 'pt_mult': 1.0, 'sl_mult': 5.0, 'td_mins': 360}. Best is trial 67 with value: 1.977309488674108.
[I 2026-03-12 02:01:08,768] Trial 73 pruned. 
[I 2026-03-12 02:01:08,842] Trial 74 pruned. 
[I 2026-03-12 02:01:10,453] Trial 75 finished with value: 0.9504028234487814 and parameters: {'timeframe': 'M15', 'atr_period': 13, 'atr_threshold': 0.5, 'pt_mult': 0.5, 'sl_mult': 1.0, 'td_mins': 1080}. Best is trial 67 with value: 1.977309488674108.
[I 2026-03-12 02:01:10,499] Trial 76 pruned. 
[I 2026-03-12 02:01:10,684] Trial 77 pruned. 
[I 2026-03-12 02:01:10,729] Trial 78 finished with value: 0.0 and parameters: {'timeframe': 'M15', 'atr_period': 13, 'atr_threshold': 10.0, 'pt_mult': 0.5, 'sl_mult': 2.5, 'td_mins': 360}. Best is trial 67 with value: 1.977309488674108.
[I 2026-03-12 02:01:10,774] Trial 79 finished with value: 0.0 and parameters: {'timeframe': 'M15', 'atr_period': 13, 'atr_threshold': 10.0, 'pt_mult': 5.0, 'sl_mult': 5.0, 'td_mins': 1200}. Best is trial 67 with value: 1.977309488674108.
[I 2026-03-12 02:01:10,818] Trial 80 finished with value: 0.0 and parameters: {'timeframe': 'M15', 'atr_period': 13, 'atr_threshold': 15.0, 'pt_mult': 2.5, 'sl_mult': 0.5, 'td_mins': 60}. Best is trial 67 with value: 1.977309488674108.
[I 2026-03-12 02:01:11,024] Trial 81 pruned. 
[I 2026-03-12 02:01:11,069] Trial 82 finished with value: 0.0 and parameters: {'timeframe': 'M15', 'atr_period': 13, 'atr_threshold': 15.0, 'pt_mult': 1.0, 'sl_mult': 2.5, 'td_mins': 5}. Best is trial 67 with value: 1.977309488674108.
[I 2026-03-12 02:01:13,221] Trial 83 finished with value: 0.948177191293707 and parameters: {'timeframe': 'M15', 'atr_period': 13, 'atr_threshold': 2.0, 'pt_mult': 0.5, 'sl_mult': 2.5, 'td_mins': 1200}. Best is trial 67 with value: 1.977309488674108.
[I 2026-03-12 02:01:13,268] Trial 84 pruned. 
[I 2026-03-12 02:01:13,643] Trial 85 pruned. 
[I 2026-03-12 02:01:16,444] Trial 86 finished with value: 1.1251657412308638 and parameters: {'timeframe': 'M15', 'atr_period': 13, 'atr_threshold': 0.5, 'pt_mult': 2.5, 'sl_mult': 5.0, 'td_mins': 720}. Best is trial 67 with value: 1.977309488674108.
[I 2026-03-12 02:01:16,772] Trial 87 finished with value: 0.9503976560372169 and parameters: {'timeframe': 'M15', 'atr_period': 13, 'atr_threshold': 0.5, 'pt_mult': 0.5, 'sl_mult': 0.5, 'td_mins': 120}. Best is trial 67 with value: 1.977309488674108.
[I 2026-03-12 02:01:16,816] Trial 88 finished with value: 0.0 and parameters: {'timeframe': 'M15', 'atr_period': 13, 'atr_threshold': 10.0, 'pt_mult': 1.0, 'sl_mult': 5.0, 'td_mins': 15}. Best is trial 67 with value: 1.977309488674108.
[I 2026-03-12 02:01:16,890] Trial 89 pruned. 
[I 2026-03-12 02:01:17,797] Trial 90 finished with value: 0.9408276975302025 and parameters: {'timeframe': 'M15', 'atr_period': 13, 'atr_threshold': 1.0, 'pt_mult': 1.0, 'sl_mult': 1.0, 'td_mins': 360}. Best is trial 67 with value: 1.977309488674108.
[I 2026-03-12 02:01:17,856] Trial 91 pruned. 
[I 2026-03-12 02:01:17,975] Trial 92 pruned. 
[I 2026-03-12 02:01:23,315] Trial 93 finished with value: 1.0002037963282249 and parameters: {'timeframe': 'M15', 'atr_period': 13, 'atr_threshold': 0.5, 'pt_mult': 2.5, 'sl_mult': 5.0, 'td_mins': 1200}. Best is trial 67 with value: 1.977309488674108.
[I 2026-03-12 02:01:23,378] Trial 94 pruned. 
[I 2026-03-12 02:01:23,825] Trial 95 finished with value: 1.08926017845721 and parameters: {'timeframe': 'M15', 'atr_period': 13, 'atr_threshold': 2.0, 'pt_mult': 2.5, 'sl_mult': 5.0, 'td_mins': 120}. Best is trial 67 with value: 1.977309488674108.
[I 2026-03-12 02:01:23,869] Trial 96 finished with value: 0.0 and parameters: {'timeframe': 'M15', 'atr_period': 13, 'atr_threshold': 10.0, 'pt_mult': 2.5, 'sl_mult': 2.5, 'td_mins': 1080}. Best is trial 67 with value: 1.977309488674108.
[I 2026-03-12 02:01:23,915] Trial 97 finished with value: 0.0 and parameters: {'timeframe': 'M15', 'atr_period': 13, 'atr_threshold': 10.0, 'pt_mult': 5.0, 'sl_mult': 1.0, 'td_mins': 360}. Best is trial 67 with value: 1.977309488674108.
[I 2026-03-12 02:01:23,990] Trial 98 pruned. 
[I 2026-03-12 02:01:24,037] Trial 99 pruned. 
[I 2026-03-12 02:01:24,082] Trial 100 finished with value: 0.0 and parameters: {'timeframe': 'M15', 'atr_period': 13, 'atr_threshold': 15.0, 'pt_mult': 2.5, 'sl_mult': 5.0, 'td_mins': 5}. Best is trial 67 with value: 1.977309488674108.
[I 2026-03-12 02:01:24,178] Trial 101 pruned. 
[I 2026-03-12 02:01:24,356] Trial 102 pruned. 
[I 2026-03-12 02:01:24,451] Trial 103 pruned. 
[I 2026-03-12 02:01:24,501] Trial 104 pruned. 
[I 2026-03-12 02:01:25,332] Trial 105 finished with value: 1.5846337637083558 and parameters: {'timeframe': 'M15', 'atr_period': 13, 'atr_threshold': 3.0, 'pt_mult': 2.5, 'sl_mult': 5.0, 'td_mins': 360}. Best is trial 67 with value: 1.977309488674108.
[I 2026-03-12 02:01:25,379] Trial 106 pruned. 
[I 2026-03-12 02:01:25,425] Trial 107 finished with value: 0.0 and parameters: {'timeframe': 'M15', 'atr_period': 13, 'atr_threshold': 15.0, 'pt_mult': 5.0, 'sl_mult': 1.0, 'td_mins': 15}. Best is trial 67 with value: 1.977309488674108.
[I 2026-03-12 02:01:30,241] Trial 108 finished with value: 1.0002037963282249 and parameters: {'timeframe': 'M15', 'atr_period': 13, 'atr_threshold': 1.0, 'pt_mult': 2.5, 'sl_mult': 5.0, 'td_mins': 1200}. Best is trial 67 with value: 1.977309488674108.
[I 2026-03-12 02:01:31,227] Trial 109 finished with value: 0.9170859584019941 and parameters: {'timeframe': 'M15', 'atr_period': 13, 'atr_threshold': 3.0, 'pt_mult': 1.0, 'sl_mult': 0.5, 'td_mins': 1200}. Best is trial 67 with value: 1.977309488674108.
[I 2026-03-12 02:01:31,272] Trial 110 pruned. 
[I 2026-03-12 02:01:31,928] Trial 111 pruned. 
[I 2026-03-12 02:01:31,973] Trial 112 pruned. 
[I 2026-03-12 02:01:32,555] Trial 113 finished with value: 0.9748098393649345 and parameters: {'timeframe': 'M15', 'atr_period': 13, 'atr_threshold': 0.5, 'pt_mult': 0.5, 'sl_mult': 0.5, 'td_mins': 360}. Best is trial 67 with value: 1.977309488674108.
[I 2026-03-12 02:01:32,598] Trial 114 finished with value: 0.0 and parameters: {'timeframe': 'M15', 'atr_period': 13, 'atr_threshold': 15.0, 'pt_mult': 0.5, 'sl_mult': 2.5, 'td_mins': 360}. Best is trial 67 with value: 1.977309488674108.
[I 2026-03-12 02:01:33,111] Trial 115 finished with value: 0.9164407236923985 and parameters: {'timeframe': 'M15', 'atr_period': 13, 'atr_threshold': 1.0, 'pt_mult': 1.0, 'sl_mult': 0.5, 'td_mins': 180}. Best is trial 67 with value: 1.977309488674108.
[I 2026-03-12 02:01:33,199] Trial 116 pruned. 
[I 2026-03-12 02:01:33,297] Trial 117 pruned. 
[I 2026-03-12 02:01:35,095] Trial 118 finished with value: 0.9321509825393234 and parameters: {'timeframe': 'M15', 'atr_period': 13, 'atr_threshold': 0.5, 'pt_mult': 2.5, 'sl_mult': 0.5, 'td_mins': 720}. Best is trial 67 with value: 1.977309488674108.
[I 2026-03-12 02:01:36,471] Trial 119 finished with value: 0.9472043125705436 and parameters: {'timeframe': 'M15', 'atr_period': 13, 'atr_threshold': 2.0, 'pt_mult': 0.5, 'sl_mult': 1.0, 'td_mins': 1200}. Best is trial 67 with value: 1.977309488674108.
[I 2026-03-12 02:01:36,516] Trial 120 finished with value: 0.0 and parameters: {'timeframe': 'M15', 'atr_period': 13, 'atr_threshold': 15.0, 'pt_mult': 2.5, 'sl_mult': 5.0, 'td_mins': 1080}. Best is trial 67 with value: 1.977309488674108.
[I 2026-03-12 02:01:36,781] Trial 121 pruned. 
[I 2026-03-12 02:01:37,143] Trial 122 pruned. 
[I 2026-03-12 02:01:37,190] Trial 123 finished with value: 0.0 and parameters: {'timeframe': 'M15', 'atr_period': 13, 'atr_threshold': 15.0, 'pt_mult': 0.5, 'sl_mult': 1.0, 'td_mins': 720}. Best is trial 67 with value: 1.977309488674108.
[I 2026-03-12 02:01:37,239] Trial 124 pruned. 
[I 2026-03-12 02:01:37,285] Trial 125 finished with value: 0.0 and parameters: {'timeframe': 'M15', 'atr_period': 13, 'atr_threshold': 15.0, 'pt_mult': 5.0, 'sl_mult': 0.5, 'td_mins': 180}. Best is trial 67 with value: 1.977309488674108.
[I 2026-03-12 02:01:37,327] Trial 126 pruned. 
[I 2026-03-12 02:01:37,369] Trial 127 finished with value: 0.0 and parameters: {'timeframe': 'M15', 'atr_period': 13, 'atr_threshold': 15.0, 'pt_mult': 1.0, 'sl_mult': 5.0, 'td_mins': 30}. Best is trial 67 with value: 1.977309488674108.
[I 2026-03-12 02:01:37,605] Trial 128 finished with value: 0.6446468337019603 and parameters: {'timeframe': 'M15', 'atr_period': 13, 'atr_threshold': 5.0, 'pt_mult': 2.5, 'sl_mult': 1.0, 'td_mins': 360}. Best is trial 67 with value: 1.977309488674108.
[I 2026-03-12 02:01:37,757] Trial 129 finished with value: 2.123964189095941 and parameters: {'timeframe': 'M15', 'atr_period': 13, 'atr_threshold': 5.0, 'pt_mult': 0.5, 'sl_mult': 5.0, 'td_mins': 180}. Best is trial 129 with value: 2.123964189095941.
[I 2026-03-12 02:01:37,913] Trial 130 finished with value: 0.805426469525135 and parameters: {'timeframe': 'M15', 'atr_period': 13, 'atr_threshold': 5.0, 'pt_mult': 2.5, 'sl_mult': 2.5, 'td_mins': 180}. Best is trial 129 with value: 2.123964189095941.
[I 2026-03-12 02:01:39,955] Trial 131 finished with value: 1.0782945748986512 and parameters: {'timeframe': 'M15', 'atr_period': 13, 'atr_threshold': 3.0, 'pt_mult': 1.0, 'sl_mult': 5.0, 'td_mins': 1080}. Best is trial 129 with value: 2.123964189095941.
[I 2026-03-12 02:01:40,005] Trial 132 pruned. 
[I 2026-03-12 02:01:40,054] Trial 133 pruned. 
[I 2026-03-12 02:01:40,098] Trial 134 finished with value: 0.0 and parameters: {'timeframe': 'M15', 'atr_period': 13, 'atr_threshold': 10.0, 'pt_mult': 2.5, 'sl_mult': 0.5, 'td_mins': 180}. Best is trial 129 with value: 2.123964189095941.
[I 2026-03-12 02:01:40,141] Trial 135 pruned. 
[I 2026-03-12 02:01:40,212] Trial 136 pruned. 
[I 2026-03-12 02:01:40,260] Trial 137 pruned. 
[I 2026-03-12 02:01:40,304] Trial 138 finished with value: 0.0 and parameters: {'timeframe': 'M15', 'atr_period': 13, 'atr_threshold': 10.0, 'pt_mult': 1.0, 'sl_mult': 0.5, 'td_mins': 5}. Best is trial 129 with value: 2.123964189095941.
[I 2026-03-12 02:01:43,032] Trial 139 finished with value: 0.9486733711718985 and parameters: {'timeframe': 'M15', 'atr_period': 13, 'atr_threshold': 0.5, 'pt_mult': 2.5, 'sl_mult': 0.5, 'td_mins': 1200}. Best is trial 129 with value: 2.123964189095941.
[I 2026-03-12 02:01:43,076] Trial 140 pruned. 
[I 2026-03-12 02:01:43,341] Trial 141 pruned. 
[I 2026-03-12 02:01:43,436] Trial 142 pruned. 
[I 2026-03-12 02:01:44,372] Trial 143 finished with value: 0.947154903915483 and parameters: {'timeframe': 'M15', 'atr_period': 13, 'atr_threshold': 2.0, 'pt_mult': 0.5, 'sl_mult': 1.0, 'td_mins': 720}. Best is trial 129 with value: 2.123964189095941.
[I 2026-03-12 02:01:44,797] Trial 144 finished with value: 0.8251658542369412 and parameters: {'timeframe': 'M15', 'atr_period': 13, 'atr_threshold': 5.0, 'pt_mult': 2.5, 'sl_mult': 1.0, 'td_mins': 720}. Best is trial 129 with value: 2.123964189095941.
[I 2026-03-12 02:01:45,296] Trial 145 finished with value: 1.08926017845721 and parameters: {'timeframe': 'M15', 'atr_period': 13, 'atr_threshold': 2.0, 'pt_mult': 2.5, 'sl_mult': 5.0, 'td_mins': 120}. Best is trial 129 with value: 2.123964189095941.
[I 2026-03-12 02:01:45,357] Trial 146 pruned. 
[I 2026-03-12 02:01:45,419] Trial 147 finished with value: 0.0 and parameters: {'timeframe': 'M15', 'atr_period': 13, 'atr_threshold': 15.0, 'pt_mult': 0.5, 'sl_mult': 2.5, 'td_mins': 360}. Best is trial 129 with value: 2.123964189095941.
[I 2026-03-12 02:01:45,463] Trial 148 finished with value: 0.0 and parameters: {'timeframe': 'M15', 'atr_period': 13, 'atr_threshold': 10.0, 'pt_mult': 0.5, 'sl_mult': 1.0, 'td_mins': 30}. Best is trial 129 with value: 2.123964189095941.
[I 2026-03-12 02:01:45,506] Trial 149 finished with value: 0.0 and parameters: {'timeframe': 'M15', 'atr_period': 13, 'atr_threshold': 15.0, 'pt_mult': 1.0, 'sl_mult': 0.5, 'td_mins': 5}. Best is trial 129 with value: 2.123964189095941.
[I 2026-03-12 02:01:45,550] Trial 150 finished with value: 0.0 and parameters: {'timeframe': 'M15', 'atr_period': 13, 'atr_threshold': 15.0, 'pt_mult': 5.0, 'sl_mult': 0.5, 'td_mins': 5}. Best is trial 129 with value: 2.123964189095941.
[I 2026-03-12 02:01:45,595] Trial 151 finished with value: 0.0 and parameters: {'timeframe': 'M15', 'atr_period': 13, 'atr_threshold': 10.0, 'pt_mult': 0.5, 'sl_mult': 1.0, 'td_mins': 60}. Best is trial 129 with value: 2.123964189095941.
[I 2026-03-12 02:01:45,638] Trial 152 pruned. 
[I 2026-03-12 02:01:47,873] Trial 153 finished with value: 1.035218101722228 and parameters: {'timeframe': 'M15', 'atr_period': 13, 'atr_threshold': 3.0, 'pt_mult': 2.5, 'sl_mult': 2.5, 'td_mins': 1200}. Best is trial 129 with value: 2.123964189095941.
[I 2026-03-12 02:01:47,917] Trial 154 finished with value: 0.0 and parameters: {'timeframe': 'M15', 'atr_period': 13, 'atr_threshold': 10.0, 'pt_mult': 0.5, 'sl_mult': 2.5, 'td_mins': 1080}. Best is trial 129 with value: 2.123964189095941.
[I 2026-03-12 02:01:47,976] Trial 155 pruned. 
[I 2026-03-12 02:01:48,996] Trial 156 finished with value: 0.9468797943388513 and parameters: {'timeframe': 'M15', 'atr_period': 13, 'atr_threshold': 5.0, 'pt_mult': 5.0, 'sl_mult': 5.0, 'td_mins': 1200}. Best is trial 129 with value: 2.123964189095941.
[I 2026-03-12 02:01:49,044] Trial 157 finished with value: 0.0 and parameters: {'timeframe': 'M15', 'atr_period': 13, 'atr_threshold': 15.0, 'pt_mult': 2.5, 'sl_mult': 2.5, 'td_mins': 180}. Best is trial 129 with value: 2.123964189095941.
[I 2026-03-12 02:01:49,099] Trial 158 pruned. 
[I 2026-03-12 02:01:49,251] Trial 159 pruned. 
[I 2026-03-12 02:01:49,295] Trial 160 pruned. 
[I 2026-03-12 02:01:49,397] Trial 161 pruned. 
[I 2026-03-12 02:01:49,463] Trial 162 pruned. 
[I 2026-03-12 02:01:49,511] Trial 163 finished with value: 0.0 and parameters: {'timeframe': 'M15', 'atr_period': 13, 'atr_threshold': 15.0, 'pt_mult': 1.0, 'sl_mult': 5.0, 'td_mins': 1080}. Best is trial 129 with value: 2.123964189095941.
[I 2026-03-12 02:01:49,935] Trial 164 finished with value: 0.9641899660577191 and parameters: {'timeframe': 'M15', 'atr_period': 13, 'atr_threshold': 1.0, 'pt_mult': 0.5, 'sl_mult': 0.5, 'td_mins': 180}. Best is trial 129 with value: 2.123964189095941.
[I 2026-03-12 02:01:50,656] Trial 165 finished with value: 1.7928241414816344 and parameters: {'timeframe': 'M15', 'atr_period': 13, 'atr_threshold': 1.0, 'pt_mult': 1.0, 'sl_mult': 5.0, 'td_mins': 180}. Best is trial 129 with value: 2.123964189095941.
[I 2026-03-12 02:01:51,679] Trial 166 finished with value: 0.9468797943388513 and parameters: {'timeframe': 'M15', 'atr_period': 13, 'atr_threshold': 5.0, 'pt_mult': 5.0, 'sl_mult': 5.0, 'td_mins': 1200}. Best is trial 129 with value: 2.123964189095941.
