[I 2026-03-12 00:50:07,344] Trial 332 finished with value: 1.7907020647597356 and parameters: {'timeframe': 'M3', 'atr_period': 13, 'atr_threshold': 3.0, 'pt_mult': 0.5, 'sl_mult': 5.0, 'td_mins': 120}. Best is trial 226 with value: 2.6610758639085312.
[I 2026-03-12 00:50:07,628] Trial 333 finished with value: 1.7907020647597356 and parameters: {'timeframe': 'M3', 'atr_period': 13, 'atr_threshold': 3.0, 'pt_mult': 0.5, 'sl_mult': 5.0, 'td_mins': 120}. Best is trial 226 with value: 2.6610758639085312.
[I 2026-03-12 00:50:07,916] Trial 334 finished with value: 1.7907020647597356 and parameters: {'timeframe': 'M3', 'atr_period': 13, 'atr_threshold': 3.0, 'pt_mult': 0.5, 'sl_mult': 5.0, 'td_mins': 120}. Best is trial 226 with value: 2.6610758639085312.
[I 2026-03-12 00:50:08,170] Trial 335 finished with value: 1.7907020647597356 and parameters: {'timeframe': 'M3', 'atr_period': 13, 'atr_threshold': 3.0, 'pt_mult': 0.5, 'sl_mult': 5.0, 'td_mins': 120}. Best is trial 226 with value: 2.6610758639085312.
[I 2026-03-12 00:50:08,434] Trial 336 finished with value: 1.7907020647597356 and parameters: {'timeframe': 'M3', 'atr_period': 13, 'atr_threshold': 3.0, 'pt_mult': 0.5, 'sl_mult': 5.0, 'td_mins': 120}. Best is trial 226 with value: 2.6610758639085312.
[I 2026-03-12 00:50:08,683] Trial 337 finished with value: 1.7907020647597356 and parameters: {'timeframe': 'M3', 'atr_period': 13, 'atr_threshold': 3.0, 'pt_mult': 0.5, 'sl_mult': 5.0, 'td_mins': 120}. Best is trial 226 with value: 2.6610758639085312.
[I 2026-03-12 00:50:08,799] Trial 338 finished with value: 2.6610758639085312 and parameters: {'timeframe': 'M3', 'atr_period': 13, 'atr_threshold': 3.0, 'pt_mult': 0.5, 'sl_mult': 5.0, 'td_mins': 30}. Best is trial 226 with value: 2.6610758639085312.
[I 2026-03-12 00:50:08,925] Trial 339 finished with value: 2.6610758639085312 and parameters: {'timeframe': 'M3', 'atr_period': 13, 'atr_threshold': 3.0, 'pt_mult': 0.5, 'sl_mult': 5.0, 'td_mins': 30}. Best is trial 226 with value: 2.6610758639085312.
[I 2026-03-12 00:50:09,073] Trial 340 finished with value: 2.6610758639085312 and parameters: {'timeframe': 'M3', 'atr_period': 13, 'atr_threshold': 3.0, 'pt_mult': 0.5, 'sl_mult': 5.0, 'td_mins': 30}. Best is trial 226 with value: 2.6610758639085312.
[I 2026-03-12 00:50:09,216] Trial 341 finished with value: 2.6610758639085312 and parameters: {'timeframe': 'M3', 'atr_period': 13, 'atr_threshold': 3.0, 'pt_mult': 0.5, 'sl_mult': 5.0, 'td_mins': 30}. Best is trial 226 with value: 2.6610758639085312.
[I 2026-03-12 00:50:09,357] Trial 342 finished with value: 2.6610758639085312 and parameters: {'timeframe': 'M3', 'atr_period': 13, 'atr_threshold': 3.0, 'pt_mult': 0.5, 'sl_mult': 5.0, 'td_mins': 30}. Best is trial 226 with value: 2.6610758639085312.
[I 2026-03-12 00:50:09,482] Trial 343 finished with value: 2.6610758639085312 and parameters: {'timeframe': 'M3', 'atr_period': 13, 'atr_threshold': 3.0, 'pt_mult': 0.5, 'sl_mult': 5.0, 'td_mins': 30}. Best is trial 226 with value: 2.6610758639085312.
[I 2026-03-12 00:50:09,605] Trial 344 finished with value: 2.6610758639085312 and parameters: {'timeframe': 'M3', 'atr_period': 13, 'atr_threshold': 3.0, 'pt_mult': 0.5, 'sl_mult': 5.0, 'td_mins': 30}. Best is trial 226 with value: 2.6610758639085312.
[I 2026-03-12 00:50:09,727] Trial 345 finished with value: 2.6610758639085312 and parameters: {'timeframe': 'M3', 'atr_period': 13, 'atr_threshold': 3.0, 'pt_mult': 0.5, 'sl_mult': 5.0, 'td_mins': 30}. Best is trial 226 with value: 2.6610758639085312.
[I 2026-03-12 00:50:09,847] Trial 346 finished with value: 2.6610758639085312 and parameters: {'timeframe': 'M3', 'atr_period': 13, 'atr_threshold': 3.0, 'pt_mult': 0.5, 'sl_mult': 5.0, 'td_mins': 30}. Best is trial 226 with value: 2.6610758639085312.
[I 2026-03-12 00:50:09,968] Trial 347 finished with value: 2.6610758639085312 and parameters: {'timeframe': 'M3', 'atr_period': 13, 'atr_threshold': 3.0, 'pt_mult': 0.5, 'sl_mult': 5.0, 'td_mins': 30}. Best is trial 226 with value: 2.6610758639085312.
[I 2026-03-12 00:50:10,085] Trial 348 finished with value: 2.6610758639085312 and parameters: {'timeframe': 'M3', 'atr_period': 13, 'atr_threshold': 3.0, 'pt_mult': 0.5, 'sl_mult': 5.0, 'td_mins': 30}. Best is trial 226 with value: 2.6610758639085312.
[I 2026-03-12 00:50:10,205] Trial 349 finished with value: 2.6610758639085312 and parameters: {'timeframe': 'M3', 'atr_period': 13, 'atr_threshold': 3.0, 'pt_mult': 0.5, 'sl_mult': 5.0, 'td_mins': 30}. Best is trial 226 with value: 2.6610758639085312.
[I 2026-03-12 00:50:10,327] Trial 350 finished with value: 2.6610758639085312 and parameters: {'timeframe': 'M3', 'atr_period': 13, 'atr_threshold': 3.0, 'pt_mult': 0.5, 'sl_mult': 5.0, 'td_mins': 30}. Best is trial 226 with value: 2.6610758639085312.
[I 2026-03-12 00:50:10,466] Trial 351 finished with value: 2.6610758639085312 and parameters: {'timeframe': 'M3', 'atr_period': 13, 'atr_threshold': 3.0, 'pt_mult': 0.5, 'sl_mult': 5.0, 'td_mins': 30}. Best is trial 226 with value: 2.6610758639085312.
[I 2026-03-12 00:50:10,619] Trial 352 finished with value: 2.6610758639085312 and parameters: {'timeframe': 'M3', 'atr_period': 13, 'atr_threshold': 3.0, 'pt_mult': 0.5, 'sl_mult': 5.0, 'td_mins': 30}. Best is trial 226 with value: 2.6610758639085312.
[I 2026-03-12 00:50:10,755] Trial 353 finished with value: 2.6610758639085312 and parameters: {'timeframe': 'M3', 'atr_period': 13, 'atr_threshold': 3.0, 'pt_mult': 0.5, 'sl_mult': 5.0, 'td_mins': 30}. Best is trial 226 with value: 2.6610758639085312.
[I 2026-03-12 00:50:10,900] Trial 354 finished with value: 2.6610758639085312 and parameters: {'timeframe': 'M3', 'atr_period': 13, 'atr_threshold': 3.0, 'pt_mult': 0.5, 'sl_mult': 5.0, 'td_mins': 30}. Best is trial 226 with value: 2.6610758639085312.
[I 2026-03-12 00:50:11,043] Trial 355 finished with value: 2.6610758639085312 and parameters: {'timeframe': 'M3', 'atr_period': 13, 'atr_threshold': 3.0, 'pt_mult': 0.5, 'sl_mult': 5.0, 'td_mins': 30}. Best is trial 226 with value: 2.6610758639085312.
[I 2026-03-12 00:50:11,167] Trial 356 finished with value: 2.6610758639085312 and parameters: {'timeframe': 'M3', 'atr_period': 13, 'atr_threshold': 3.0, 'pt_mult': 0.5, 'sl_mult': 5.0, 'td_mins': 30}. Best is trial 226 with value: 2.6610758639085312.
[I 2026-03-12 00:50:11,288] Trial 357 finished with value: 2.6610758639085312 and parameters: {'timeframe': 'M3', 'atr_period': 13, 'atr_threshold': 3.0, 'pt_mult': 0.5, 'sl_mult': 5.0, 'td_mins': 30}. Best is trial 226 with value: 2.6610758639085312.
[I 2026-03-12 00:50:11,404] Trial 358 finished with value: 2.6610758639085312 and parameters: {'timeframe': 'M3', 'atr_period': 13, 'atr_threshold': 3.0, 'pt_mult': 0.5, 'sl_mult': 5.0, 'td_mins': 30}. Best is trial 226 with value: 2.6610758639085312.
[I 2026-03-12 00:50:11,524] Trial 359 finished with value: 2.6610758639085312 and parameters: {'timeframe': 'M3', 'atr_period': 13, 'atr_threshold': 3.0, 'pt_mult': 0.5, 'sl_mult': 5.0, 'td_mins': 30}. Best is trial 226 with value: 2.6610758639085312.
[I 2026-03-12 00:50:11,652] Trial 360 finished with value: 2.6610758639085312 and parameters: {'timeframe': 'M3', 'atr_period': 13, 'atr_threshold': 3.0, 'pt_mult': 0.5, 'sl_mult': 5.0, 'td_mins': 30}. Best is trial 226 with value: 2.6610758639085312.
[I 2026-03-12 00:50:11,788] Trial 361 finished with value: 2.6610758639085312 and parameters: {'timeframe': 'M3', 'atr_period': 13, 'atr_threshold': 3.0, 'pt_mult': 0.5, 'sl_mult': 5.0, 'td_mins': 30}. Best is trial 226 with value: 2.6610758639085312.
[I 2026-03-12 00:50:11,913] Trial 362 finished with value: 2.6610758639085312 and parameters: {'timeframe': 'M3', 'atr_period': 13, 'atr_threshold': 3.0, 'pt_mult': 0.5, 'sl_mult': 5.0, 'td_mins': 30}. Best is trial 226 with value: 2.6610758639085312.
[I 2026-03-12 00:50:11,965] Trial 363 pruned. 
[I 2026-03-12 00:50:12,200] Trial 364 finished with value: 2.268830132624994 and parameters: {'timeframe': 'M3', 'atr_period': 13, 'atr_threshold': 2.0, 'pt_mult': 0.5, 'sl_mult': 5.0, 'td_mins': 30}. Best is trial 226 with value: 2.6610758639085312.
[I 2026-03-12 00:50:12,697] Trial 365 finished with value: 1.7661289961368716 and parameters: {'timeframe': 'M3', 'atr_period': 13, 'atr_threshold': 1.0, 'pt_mult': 0.5, 'sl_mult': 5.0, 'td_mins': 30}. Best is trial 226 with value: 2.6610758639085312.
[I 2026-03-12 00:50:12,814] Trial 366 finished with value: 1.3544922222032336 and parameters: {'timeframe': 'M3', 'atr_period': 13, 'atr_threshold': 3.0, 'pt_mult': 0.5, 'sl_mult': 2.5, 'td_mins': 30}. Best is trial 226 with value: 2.6610758639085312.
[I 2026-03-12 00:50:13,063] Trial 367 pruned. 
[I 2026-03-12 00:50:13,115] Trial 368 pruned. 
[I 2026-03-12 00:50:13,166] Trial 369 finished with value: 0.0 and parameters: {'timeframe': 'M3', 'atr_period': 13, 'atr_threshold': 5.0, 'pt_mult': 0.5, 'sl_mult': 5.0, 'td_mins': 30}. Best is trial 226 with value: 2.6610758639085312.
[I 2026-03-12 00:50:13,287] Trial 370 finished with value: 2.6610758639085312 and parameters: {'timeframe': 'M3', 'atr_period': 13, 'atr_threshold': 3.0, 'pt_mult': 0.5, 'sl_mult': 5.0, 'td_mins': 30}. Best is trial 226 with value: 2.6610758639085312.
[I 2026-03-12 00:50:14,049] Trial 371 finished with value: 1.1155005823760924 and parameters: {'timeframe': 'M3', 'atr_period': 13, 'atr_threshold': 3.0, 'pt_mult': 0.5, 'sl_mult': 5.0, 'td_mins': 720}. Best is trial 226 with value: 2.6610758639085312.
[I 2026-03-12 00:50:14,179] Trial 372 finished with value: 2.6610758639085312 and parameters: {'timeframe': 'M3', 'atr_period': 13, 'atr_threshold': 3.0, 'pt_mult': 0.5, 'sl_mult': 5.0, 'td_mins': 30}. Best is trial 226 with value: 2.6610758639085312.
[I 2026-03-12 00:50:14,341] Trial 373 finished with value: 2.4718369634519943 and parameters: {'timeframe': 'M3', 'atr_period': 13, 'atr_threshold': 3.0, 'pt_mult': 0.5, 'sl_mult': 5.0, 'td_mins': 60}. Best is trial 226 with value: 2.6610758639085312.
[I 2026-03-12 00:50:14,496] Trial 374 finished with value: 2.6610758639085312 and parameters: {'timeframe': 'M3', 'atr_period': 13, 'atr_threshold': 3.0, 'pt_mult': 0.5, 'sl_mult': 5.0, 'td_mins': 30}. Best is trial 226 with value: 2.6610758639085312.
[I 2026-03-12 00:50:14,572] Trial 375 finished with value: 1.5783144337040433 and parameters: {'timeframe': 'M3', 'atr_period': 13, 'atr_threshold': 3.0, 'pt_mult': 0.5, 'sl_mult': 5.0, 'td_mins': 5}. Best is trial 226 with value: 2.6610758639085312.
[I 2026-03-12 00:50:14,988] Trial 376 finished with value: 1.2327014019512406 and parameters: {'timeframe': 'M3', 'atr_period': 13, 'atr_threshold': 3.0, 'pt_mult': 0.5, 'sl_mult': 5.0, 'td_mins': 360}. Best is trial 226 with value: 2.6610758639085312.
[I 2026-03-12 00:50:15,118] Trial 377 finished with value: 1.9600482462895854 and parameters: {'timeframe': 'M3', 'atr_period': 13, 'atr_threshold': 3.0, 'pt_mult': 1.0, 'sl_mult': 5.0, 'td_mins': 30}. Best is trial 226 with value: 2.6610758639085312.
[I 2026-03-12 00:50:16,260] Trial 378 finished with value: 1.0772653179037008 and parameters: {'timeframe': 'M3', 'atr_period': 13, 'atr_threshold': 3.0, 'pt_mult': 0.5, 'sl_mult': 5.0, 'td_mins': 1080}. Best is trial 226 with value: 2.6610758639085312.
[I 2026-03-12 00:50:16,376] Trial 379 finished with value: 2.6610758639085312 and parameters: {'timeframe': 'M3', 'atr_period': 13, 'atr_threshold': 3.0, 'pt_mult': 0.5, 'sl_mult': 5.0, 'td_mins': 30}. Best is trial 226 with value: 2.6610758639085312.
[I 2026-03-12 00:50:16,490] Trial 380 finished with value: 2.6610758639085312 and parameters: {'timeframe': 'M3', 'atr_period': 13, 'atr_threshold': 3.0, 'pt_mult': 0.5, 'sl_mult': 5.0, 'td_mins': 30}. Best is trial 226 with value: 2.6610758639085312.
[I 2026-03-12 00:50:16,782] Trial 381 finished with value: 1.6986001089155351 and parameters: {'timeframe': 'M3', 'atr_period': 13, 'atr_threshold': 3.0, 'pt_mult': 0.5, 'sl_mult': 5.0, 'td_mins': 180}. Best is trial 226 with value: 2.6610758639085312.
[I 2026-03-12 00:50:16,905] Trial 382 finished with value: 2.6610758639085312 and parameters: {'timeframe': 'M3', 'atr_period': 13, 'atr_threshold': 3.0, 'pt_mult': 0.5, 'sl_mult': 5.0, 'td_mins': 30}. Best is trial 226 with value: 2.6610758639085312.
[I 2026-03-12 00:50:17,032] Trial 383 finished with value: 2.6610758639085312 and parameters: {'timeframe': 'M3', 'atr_period': 13, 'atr_threshold': 3.0, 'pt_mult': 0.5, 'sl_mult': 5.0, 'td_mins': 30}. Best is trial 226 with value: 2.6610758639085312.
[I 2026-03-12 00:50:17,863] Trial 384 finished with value: 1.0879901992092258 and parameters: {'timeframe': 'M3', 'atr_period': 13, 'atr_threshold': 3.0, 'pt_mult': 1.0, 'sl_mult': 5.0, 'td_mins': 720}. Best is trial 226 with value: 2.6610758639085312.
[I 2026-03-12 00:50:18,142] Trial 385 pruned. 
[I 2026-03-12 00:50:18,270] Trial 386 finished with value: 2.6610758639085312 and parameters: {'timeframe': 'M3', 'atr_period': 13, 'atr_threshold': 3.0, 'pt_mult': 0.5, 'sl_mult': 5.0, 'td_mins': 30}. Best is trial 226 with value: 2.6610758639085312.
[I 2026-03-12 00:50:18,464] Trial 387 pruned. 
[I 2026-03-12 00:50:18,629] Trial 388 pruned. 
[I 2026-03-12 00:50:18,743] Trial 389 finished with value: 2.6610758639085312 and parameters: {'timeframe': 'M3', 'atr_period': 13, 'atr_threshold': 3.0, 'pt_mult': 0.5, 'sl_mult': 5.0, 'td_mins': 30}. Best is trial 226 with value: 2.6610758639085312.
[I 2026-03-12 00:50:18,801] Trial 390 pruned. 
[I 2026-03-12 00:50:18,897] Trial 391 finished with value: 1.6750712956097895 and parameters: {'timeframe': 'M3', 'atr_period': 13, 'atr_threshold': 3.0, 'pt_mult': 0.5, 'sl_mult': 2.5, 'td_mins': 15}. Best is trial 226 with value: 2.6610758639085312.
[I 2026-03-12 00:50:18,946] Trial 392 finished with value: 0.0 and parameters: {'timeframe': 'M3', 'atr_period': 13, 'atr_threshold': 8.0, 'pt_mult': 0.5, 'sl_mult': 5.0, 'td_mins': 30}. Best is trial 226 with value: 2.6610758639085312.
[I 2026-03-12 00:50:18,993] Trial 393 finished with value: 0.0 and parameters: {'timeframe': 'M3', 'atr_period': 13, 'atr_threshold': 8.0, 'pt_mult': 5.0, 'sl_mult': 5.0, 'td_mins': 30}. Best is trial 226 with value: 2.6610758639085312.
[I 2026-03-12 00:50:19,167] Trial 394 finished with value: 2.095929740241373 and parameters: {'timeframe': 'M3', 'atr_period': 13, 'atr_threshold': 3.0, 'pt_mult': 1.0, 'sl_mult': 5.0, 'td_mins': 60}. Best is trial 226 with value: 2.6610758639085312.
[I 2026-03-12 00:50:19,215] Trial 395 finished with value: 0.0 and parameters: {'timeframe': 'M3', 'atr_period': 13, 'atr_threshold': 5.0, 'pt_mult': 0.5, 'sl_mult': 5.0, 'td_mins': 60}. Best is trial 226 with value: 2.6610758639085312.
[I 2026-03-12 00:50:19,330] Trial 396 finished with value: 2.6610758639085312 and parameters: {'timeframe': 'M3', 'atr_period': 13, 'atr_threshold': 3.0, 'pt_mult': 0.5, 'sl_mult': 5.0, 'td_mins': 30}. Best is trial 226 with value: 2.6610758639085312.
[I 2026-03-12 00:50:19,382] Trial 397 pruned. 
[I 2026-03-12 00:50:19,429] Trial 398 finished with value: 0.0 and parameters: {'timeframe': 'M3', 'atr_period': 13, 'atr_threshold': 10.0, 'pt_mult': 0.5, 'sl_mult': 0.5, 'td_mins': 30}. Best is trial 226 with value: 2.6610758639085312.
[I 2026-03-12 00:50:19,486] Trial 399 pruned. 
[I 2026-03-12 00:50:19,539] Trial 400 pruned. 
[I 2026-03-12 00:50:21,998] Trial 401 pruned. 
[I 2026-03-12 00:50:22,046] Trial 402 finished with value: 0.0 and parameters: {'timeframe': 'M3', 'atr_period': 13, 'atr_threshold': 10.0, 'pt_mult': 0.5, 'sl_mult': 5.0, 'td_mins': 1200}. Best is trial 226 with value: 2.6610758639085312.
[I 2026-03-12 00:50:22,096] Trial 403 finished with value: 0.0 and parameters: {'timeframe': 'M3', 'atr_period': 13, 'atr_threshold': 5.0, 'pt_mult': 0.5, 'sl_mult': 1.0, 'td_mins': 30}. Best is trial 226 with value: 2.6610758639085312.
[I 2026-03-12 00:50:22,144] Trial 404 finished with value: 0.0 and parameters: {'timeframe': 'M3', 'atr_period': 13, 'atr_threshold': 15.0, 'pt_mult': 0.5, 'sl_mult': 5.0, 'td_mins': 30}. Best is trial 226 with value: 2.6610758639085312.
[I 2026-03-12 00:50:22,275] Trial 405 pruned. 
[I 2026-03-12 00:50:22,348] Trial 406 pruned. 
[I 2026-03-12 00:50:22,473] Trial 407 finished with value: 2.6610758639085312 and parameters: {'timeframe': 'M3', 'atr_period': 13, 'atr_threshold': 3.0, 'pt_mult': 0.5, 'sl_mult': 5.0, 'td_mins': 30}. Best is trial 226 with value: 2.6610758639085312.
[I 2026-03-12 00:50:22,590] Trial 408 finished with value: 2.6610758639085312 and parameters: {'timeframe': 'M3', 'atr_period': 13, 'atr_threshold': 3.0, 'pt_mult': 0.5, 'sl_mult': 5.0, 'td_mins': 30}. Best is trial 226 with value: 2.6610758639085312.
[I 2026-03-12 00:50:22,796] Trial 409 pruned. 
[I 2026-03-12 00:50:22,886] Trial 410 pruned. 
[I 2026-03-12 00:50:22,932] Trial 411 finished with value: 0.0 and parameters: {'timeframe': 'M3', 'atr_period': 13, 'atr_threshold': 8.0, 'pt_mult': 0.5, 'sl_mult': 5.0, 'td_mins': 15}. Best is trial 226 with value: 2.6610758639085312.
[I 2026-03-12 00:50:23,050] Trial 412 finished with value: 2.6610758639085312 and parameters: {'timeframe': 'M3', 'atr_period': 13, 'atr_threshold': 3.0, 'pt_mult': 0.5, 'sl_mult': 5.0, 'td_mins': 30}. Best is trial 226 with value: 2.6610758639085312.
[I 2026-03-12 00:50:23,182] Trial 413 finished with value: 2.6610758639085312 and parameters: {'timeframe': 'M3', 'atr_period': 13, 'atr_threshold': 3.0, 'pt_mult': 0.5, 'sl_mult': 5.0, 'td_mins': 30}. Best is trial 226 with value: 2.6610758639085312.
[I 2026-03-12 00:50:23,233] Trial 414 finished with value: 0.0 and parameters: {'timeframe': 'M3', 'atr_period': 13, 'atr_threshold': 15.0, 'pt_mult': 0.5, 'sl_mult': 5.0, 'td_mins': 720}. Best is trial 226 with value: 2.6610758639085312.
[I 2026-03-12 00:50:23,283] Trial 415 finished with value: 0.0 and parameters: {'timeframe': 'M3', 'atr_period': 13, 'atr_threshold': 8.0, 'pt_mult': 0.5, 'sl_mult': 5.0, 'td_mins': 60}. Best is trial 226 with value: 2.6610758639085312.
[I 2026-03-12 00:50:23,406] Trial 416 finished with value: 2.6610758639085312 and parameters: {'timeframe': 'M3', 'atr_period': 13, 'atr_threshold': 3.0, 'pt_mult': 0.5, 'sl_mult': 5.0, 'td_mins': 30}. Best is trial 226 with value: 2.6610758639085312.
[I 2026-03-12 00:50:23,631] Trial 417 pruned. 
[I 2026-03-12 00:50:23,680] Trial 418 pruned. 
[I 2026-03-12 00:50:23,911] Trial 419 finished with value: 1.9325838948816343 and parameters: {'timeframe': 'M3', 'atr_period': 13, 'atr_threshold': 2.0, 'pt_mult': 1.0, 'sl_mult': 5.0, 'td_mins': 30}. Best is trial 226 with value: 2.6610758639085312.
[I 2026-03-12 00:50:23,980] Trial 420 finished with value: 0.0 and parameters: {'timeframe': 'M3', 'atr_period': 13, 'atr_threshold': 10.0, 'pt_mult': 2.5, 'sl_mult': 5.0, 'td_mins': 30}. Best is trial 226 with value: 2.6610758639085312.
[I 2026-03-12 00:50:24,037] Trial 421 finished with value: 0.0 and parameters: {'timeframe': 'M3', 'atr_period': 13, 'atr_threshold': 8.0, 'pt_mult': 0.5, 'sl_mult': 5.0, 'td_mins': 720}. Best is trial 226 with value: 2.6610758639085312.
[I 2026-03-12 00:50:24,095] Trial 422 pruned. 
[I 2026-03-12 00:50:24,410] Trial 423 finished with value: 1.61221013891353 and parameters: {'timeframe': 'M3', 'atr_period': 13, 'atr_threshold': 3.0, 'pt_mult': 1.0, 'sl_mult': 5.0, 'td_mins': 180}. Best is trial 226 with value: 2.6610758639085312.
[I 2026-03-12 00:50:24,477] Trial 424 pruned. 
[I 2026-03-12 00:50:25,411] Trial 425 pruned. 
[I 2026-03-12 00:50:25,534] Trial 426 finished with value: 2.6610758639085312 and parameters: {'timeframe': 'M3', 'atr_period': 13, 'atr_threshold': 3.0, 'pt_mult': 0.5, 'sl_mult': 5.0, 'td_mins': 30}. Best is trial 226 with value: 2.6610758639085312.
[I 2026-03-12 00:50:25,601] Trial 427 pruned. 
[I 2026-03-12 00:50:25,801] Trial 428 pruned. 
[I 2026-03-12 00:50:25,955] Trial 429 pruned. 
[I 2026-03-12 00:50:26,071] Trial 430 finished with value: 2.6610758639085312 and parameters: {'timeframe': 'M3', 'atr_period': 13, 'atr_threshold': 3.0, 'pt_mult': 0.5, 'sl_mult': 5.0, 'td_mins': 30}. Best is trial 226 with value: 2.6610758639085312.
[I 2026-03-12 00:50:26,118] Trial 431 finished with value: 0.0 and parameters: {'timeframe': 'M3', 'atr_period': 13, 'atr_threshold': 15.0, 'pt_mult': 2.5, 'sl_mult': 5.0, 'td_mins': 30}. Best is trial 226 with value: 2.6610758639085312.
[I 2026-03-12 00:50:26,168] Trial 432 finished with value: 0.0 and parameters: {'timeframe': 'M3', 'atr_period': 13, 'atr_threshold': 10.0, 'pt_mult': 0.5, 'sl_mult': 2.5, 'td_mins': 30}. Best is trial 226 with value: 2.6610758639085312.
[I 2026-03-12 00:50:26,218] Trial 433 finished with value: 0.0 and parameters: {'timeframe': 'M3', 'atr_period': 13, 'atr_threshold': 10.0, 'pt_mult': 0.5, 'sl_mult': 5.0, 'td_mins': 15}. Best is trial 226 with value: 2.6610758639085312.
[I 2026-03-12 00:50:26,270] Trial 434 finished with value: 0.0 and parameters: {'timeframe': 'M3', 'atr_period': 13, 'atr_threshold': 5.0, 'pt_mult': 0.5, 'sl_mult': 5.0, 'td_mins': 180}. Best is trial 226 with value: 2.6610758639085312.
[I 2026-03-12 00:50:26,317] Trial 435 finished with value: 0.0 and parameters: {'timeframe': 'M3', 'atr_period': 13, 'atr_threshold': 5.0, 'pt_mult': 5.0, 'sl_mult': 5.0, 'td_mins': 30}. Best is trial 226 with value: 2.6610758639085312.
[I 2026-03-12 00:50:26,467] Trial 436 pruned. 
[I 2026-03-12 00:50:26,514] Trial 437 finished with value: 0.0 and parameters: {'timeframe': 'M3', 'atr_period': 13, 'atr_threshold': 5.0, 'pt_mult': 0.5, 'sl_mult': 5.0, 'td_mins': 360}. Best is trial 226 with value: 2.6610758639085312.
[I 2026-03-12 00:50:26,576] Trial 438 pruned. 
[I 2026-03-12 00:50:26,665] Trial 439 pruned. 
[I 2026-03-12 00:50:26,711] Trial 440 finished with value: 0.0 and parameters: {'timeframe': 'M3', 'atr_period': 13, 'atr_threshold': 15.0, 'pt_mult': 0.5, 'sl_mult': 1.0, 'td_mins': 30}. Best is trial 226 with value: 2.6610758639085312.
[I 2026-03-12 00:50:26,772] Trial 441 pruned. 
[I 2026-03-12 00:50:26,951] Trial 442 pruned. 
