[I 2026-03-12 01:39:06,137] Trial 157 pruned. 
[I 2026-03-12 01:39:06,190] Trial 158 finished with value: 0.0 and parameters: {'timeframe': 'M3', 'atr_period': 13, 'atr_threshold': 8.0, 'pt_mult': 5.0, 'sl_mult': 2.5, 'td_mins': 30}. Best is trial 129 with value: 1.5987933377428867.
[I 2026-03-12 01:39:06,261] Trial 159 pruned. 
[I 2026-03-12 01:39:06,330] Trial 160 pruned. 
[I 2026-03-12 01:39:16,142] Trial 161 finished with value: 0.9896208528318458 and parameters: {'timeframe': 'M3', 'atr_period': 13, 'atr_threshold': 0.5, 'pt_mult': 2.5, 'sl_mult': 5.0, 'td_mins': 720}. Best is trial 129 with value: 1.5987933377428867.
[I 2026-03-12 01:39:16,188] Trial 162 finished with value: 0.0 and parameters: {'timeframe': 'M3', 'atr_period': 13, 'atr_threshold': 8.0, 'pt_mult': 1.0, 'sl_mult': 5.0, 'td_mins': 30}. Best is trial 129 with value: 1.5987933377428867.
[I 2026-03-12 01:39:16,366] Trial 163 pruned. 
[I 2026-03-12 01:39:19,001] Trial 164 pruned. 
[I 2026-03-12 01:39:19,235] Trial 165 pruned. 
[I 2026-03-12 01:39:19,284] Trial 166 finished with value: 0.0 and parameters: {'timeframe': 'M3', 'atr_period': 13, 'atr_threshold': 15.0, 'pt_mult': 2.5, 'sl_mult': 0.5, 'td_mins': 5}. Best is trial 129 with value: 1.5987933377428867.
[I 2026-03-12 01:39:19,333] Trial 167 finished with value: 0.0 and parameters: {'timeframe': 'M3', 'atr_period': 13, 'atr_threshold': 10.0, 'pt_mult': 2.5, 'sl_mult': 5.0, 'td_mins': 1080}. Best is trial 129 with value: 1.5987933377428867.
[I 2026-03-12 01:39:19,381] Trial 168 finished with value: 0.0 and parameters: {'timeframe': 'M3', 'atr_period': 13, 'atr_threshold': 10.0, 'pt_mult': 0.5, 'sl_mult': 2.5, 'td_mins': 720}. Best is trial 129 with value: 1.5987933377428867.
[I 2026-03-12 01:39:19,427] Trial 169 finished with value: 0.0 and parameters: {'timeframe': 'M3', 'atr_period': 13, 'atr_threshold': 5.0, 'pt_mult': 5.0, 'sl_mult': 5.0, 'td_mins': 30}. Best is trial 129 with value: 1.5987933377428867.
[I 2026-03-12 01:39:19,903] Trial 170 finished with value: 1.883712408176234 and parameters: {'timeframe': 'M3', 'atr_period': 13, 'atr_threshold': 1.0, 'pt_mult': 0.5, 'sl_mult': 5.0, 'td_mins': 30}. Best is trial 170 with value: 1.883712408176234.
[I 2026-03-12 01:39:19,992] Trial 171 pruned. 
[I 2026-03-12 01:39:20,101] Trial 172 pruned. 
[I 2026-03-12 01:39:20,149] Trial 173 finished with value: 0.0 and parameters: {'timeframe': 'M3', 'atr_period': 13, 'atr_threshold': 5.0, 'pt_mult': 2.5, 'sl_mult': 5.0, 'td_mins': 360}. Best is trial 170 with value: 1.883712408176234.
[I 2026-03-12 01:39:21,471] Trial 174 pruned. 
[I 2026-03-12 01:39:21,521] Trial 175 finished with value: 0.0 and parameters: {'timeframe': 'M3', 'atr_period': 13, 'atr_threshold': 8.0, 'pt_mult': 1.0, 'sl_mult': 1.0, 'td_mins': 720}. Best is trial 170 with value: 1.883712408176234.
[I 2026-03-12 01:39:21,584] Trial 176 pruned. 
[I 2026-03-12 01:39:21,891] Trial 177 pruned. 
[I 2026-03-12 01:39:21,936] Trial 178 finished with value: 0.0 and parameters: {'timeframe': 'M3', 'atr_period': 13, 'atr_threshold': 5.0, 'pt_mult': 1.0, 'sl_mult': 5.0, 'td_mins': 360}. Best is trial 170 with value: 1.883712408176234.
[I 2026-03-12 01:39:22,004] Trial 179 finished with value: 0.0 and parameters: {'timeframe': 'M3', 'atr_period': 13, 'atr_threshold': 5.0, 'pt_mult': 5.0, 'sl_mult': 2.5, 'td_mins': 360}. Best is trial 170 with value: 1.883712408176234.
[I 2026-03-12 01:39:22,459] Trial 180 finished with value: 1.125505967631105 and parameters: {'timeframe': 'M3', 'atr_period': 13, 'atr_threshold': 3.0, 'pt_mult': 0.5, 'sl_mult': 1.0, 'td_mins': 1080}. Best is trial 170 with value: 1.883712408176234.
[I 2026-03-12 01:39:23,696] Trial 181 pruned. 
[I 2026-03-12 01:39:23,815] Trial 182 pruned. 
[I 2026-03-12 01:39:25,230] Trial 183 pruned. 
[I 2026-03-12 01:39:25,276] Trial 184 finished with value: 0.0 and parameters: {'timeframe': 'M3', 'atr_period': 13, 'atr_threshold': 15.0, 'pt_mult': 0.5, 'sl_mult': 2.5, 'td_mins': 1080}. Best is trial 170 with value: 1.883712408176234.
[I 2026-03-12 01:39:25,324] Trial 185 finished with value: 0.0 and parameters: {'timeframe': 'M3', 'atr_period': 13, 'atr_threshold': 8.0, 'pt_mult': 5.0, 'sl_mult': 1.0, 'td_mins': 720}. Best is trial 170 with value: 1.883712408176234.
[I 2026-03-12 01:39:25,384] Trial 186 pruned. 
[I 2026-03-12 01:39:25,433] Trial 187 pruned. 
[I 2026-03-12 01:39:25,480] Trial 188 pruned. 
[I 2026-03-12 01:39:25,584] Trial 189 pruned. 
[I 2026-03-12 01:39:25,631] Trial 190 finished with value: 0.0 and parameters: {'timeframe': 'M3', 'atr_period': 13, 'atr_threshold': 8.0, 'pt_mult': 1.0, 'sl_mult': 2.5, 'td_mins': 720}. Best is trial 170 with value: 1.883712408176234.
[I 2026-03-12 01:39:25,675] Trial 191 finished with value: 0.0 and parameters: {'timeframe': 'M3', 'atr_period': 13, 'atr_threshold': 10.0, 'pt_mult': 2.5, 'sl_mult': 0.5, 'td_mins': 120}. Best is trial 170 with value: 1.883712408176234.
[I 2026-03-12 01:39:25,718] Trial 192 finished with value: 0.0 and parameters: {'timeframe': 'M3', 'atr_period': 13, 'atr_threshold': 5.0, 'pt_mult': 2.5, 'sl_mult': 1.0, 'td_mins': 120}. Best is trial 170 with value: 1.883712408176234.
[I 2026-03-12 01:39:25,952] Trial 193 finished with value: 1.9904789321248746 and parameters: {'timeframe': 'M3', 'atr_period': 13, 'atr_threshold': 3.0, 'pt_mult': 0.5, 'sl_mult': 5.0, 'td_mins': 120}. Best is trial 193 with value: 1.9904789321248746.
[I 2026-03-12 01:39:26,002] Trial 194 finished with value: 0.0 and parameters: {'timeframe': 'M3', 'atr_period': 13, 'atr_threshold': 5.0, 'pt_mult': 2.5, 'sl_mult': 0.5, 'td_mins': 15}. Best is trial 193 with value: 1.9904789321248746.
[I 2026-03-12 01:39:26,070] Trial 195 pruned. 
[I 2026-03-12 01:39:26,122] Trial 196 finished with value: 0.0 and parameters: {'timeframe': 'M3', 'atr_period': 13, 'atr_threshold': 15.0, 'pt_mult': 2.5, 'sl_mult': 5.0, 'td_mins': 360}. Best is trial 193 with value: 1.9904789321248746.
[I 2026-03-12 01:39:26,179] Trial 197 pruned. 
[I 2026-03-12 01:39:26,226] Trial 198 finished with value: 0.0 and parameters: {'timeframe': 'M3', 'atr_period': 13, 'atr_threshold': 10.0, 'pt_mult': 1.0, 'sl_mult': 5.0, 'td_mins': 360}. Best is trial 193 with value: 1.9904789321248746.
[I 2026-03-12 01:39:26,273] Trial 199 finished with value: 0.0 and parameters: {'timeframe': 'M3', 'atr_period': 13, 'atr_threshold': 8.0, 'pt_mult': 2.5, 'sl_mult': 1.0, 'td_mins': 720}. Best is trial 193 with value: 1.9904789321248746.
[I 2026-03-12 01:39:26,321] Trial 200 finished with value: 0.0 and parameters: {'timeframe': 'M3', 'atr_period': 13, 'atr_threshold': 8.0, 'pt_mult': 1.0, 'sl_mult': 0.5, 'td_mins': 60}. Best is trial 193 with value: 1.9904789321248746.
[I 2026-03-12 01:39:26,503] Trial 201 pruned. 
[I 2026-03-12 01:39:26,554] Trial 202 finished with value: 0.0 and parameters: {'timeframe': 'M3', 'atr_period': 13, 'atr_threshold': 15.0, 'pt_mult': 2.5, 'sl_mult': 2.5, 'td_mins': 60}. Best is trial 193 with value: 1.9904789321248746.
[I 2026-03-12 01:39:26,777] Trial 203 pruned. 
[I 2026-03-12 01:39:27,163] Trial 204 pruned. 
[I 2026-03-12 01:39:27,217] Trial 205 finished with value: 0.0 and parameters: {'timeframe': 'M3', 'atr_period': 13, 'atr_threshold': 8.0, 'pt_mult': 5.0, 'sl_mult': 5.0, 'td_mins': 120}. Best is trial 193 with value: 1.9904789321248746.
[I 2026-03-12 01:39:29,808] Trial 206 pruned. 
[I 2026-03-12 01:39:29,865] Trial 207 finished with value: 0.0 and parameters: {'timeframe': 'M3', 'atr_period': 13, 'atr_threshold': 15.0, 'pt_mult': 5.0, 'sl_mult': 0.5, 'td_mins': 30}. Best is trial 193 with value: 1.9904789321248746.
[I 2026-03-12 01:39:29,912] Trial 208 finished with value: 0.0 and parameters: {'timeframe': 'M3', 'atr_period': 13, 'atr_threshold': 5.0, 'pt_mult': 0.5, 'sl_mult': 1.0, 'td_mins': 60}. Best is trial 193 with value: 1.9904789321248746.
[I 2026-03-12 01:39:29,957] Trial 209 finished with value: 0.0 and parameters: {'timeframe': 'M3', 'atr_period': 13, 'atr_threshold': 15.0, 'pt_mult': 0.5, 'sl_mult': 5.0, 'td_mins': 5}. Best is trial 193 with value: 1.9904789321248746.
[I 2026-03-12 01:39:31,481] Trial 210 finished with value: 1.171872164120272 and parameters: {'timeframe': 'M3', 'atr_period': 13, 'atr_threshold': 1.0, 'pt_mult': 2.5, 'sl_mult': 5.0, 'td_mins': 120}. Best is trial 193 with value: 1.9904789321248746.
[I 2026-03-12 01:39:31,525] Trial 211 finished with value: 0.0 and parameters: {'timeframe': 'M3', 'atr_period': 13, 'atr_threshold': 5.0, 'pt_mult': 5.0, 'sl_mult': 2.5, 'td_mins': 120}. Best is trial 193 with value: 1.9904789321248746.
[I 2026-03-12 01:39:31,775] Trial 212 finished with value: 1.9962537038611405 and parameters: {'timeframe': 'M3', 'atr_period': 13, 'atr_threshold': 3.0, 'pt_mult': 1.0, 'sl_mult': 5.0, 'td_mins': 120}. Best is trial 212 with value: 1.9962537038611405.
[I 2026-03-12 01:39:31,820] Trial 213 finished with value: 0.0 and parameters: {'timeframe': 'M3', 'atr_period': 13, 'atr_threshold': 5.0, 'pt_mult': 5.0, 'sl_mult': 5.0, 'td_mins': 1200}. Best is trial 212 with value: 1.9962537038611405.
[I 2026-03-12 01:39:31,863] Trial 214 finished with value: 0.0 and parameters: {'timeframe': 'M3', 'atr_period': 13, 'atr_threshold': 5.0, 'pt_mult': 5.0, 'sl_mult': 2.5, 'td_mins': 60}. Best is trial 212 with value: 1.9962537038611405.
[I 2026-03-12 01:39:31,907] Trial 215 finished with value: 0.0 and parameters: {'timeframe': 'M3', 'atr_period': 13, 'atr_threshold': 8.0, 'pt_mult': 1.0, 'sl_mult': 2.5, 'td_mins': 1080}. Best is trial 212 with value: 1.9962537038611405.
[I 2026-03-12 01:39:32,131] Trial 216 pruned. 
[I 2026-03-12 01:39:34,601] Trial 217 pruned. 
[I 2026-03-12 01:39:34,653] Trial 218 finished with value: 0.0 and parameters: {'timeframe': 'M3', 'atr_period': 13, 'atr_threshold': 10.0, 'pt_mult': 5.0, 'sl_mult': 5.0, 'td_mins': 120}. Best is trial 212 with value: 1.9962537038611405.
[I 2026-03-12 01:39:37,047] Trial 219 finished with value: 1.0211144480982515 and parameters: {'timeframe': 'M3', 'atr_period': 13, 'atr_threshold': 2.0, 'pt_mult': 2.5, 'sl_mult': 5.0, 'td_mins': 720}. Best is trial 212 with value: 1.9962537038611405.
[I 2026-03-12 01:39:37,093] Trial 220 finished with value: 0.0 and parameters: {'timeframe': 'M3', 'atr_period': 13, 'atr_threshold': 8.0, 'pt_mult': 2.5, 'sl_mult': 2.5, 'td_mins': 360}. Best is trial 212 with value: 1.9962537038611405.
[I 2026-03-12 01:39:37,140] Trial 221 finished with value: 0.0 and parameters: {'timeframe': 'M3', 'atr_period': 13, 'atr_threshold': 8.0, 'pt_mult': 5.0, 'sl_mult': 5.0, 'td_mins': 15}. Best is trial 212 with value: 1.9962537038611405.
[I 2026-03-12 01:39:37,192] Trial 222 finished with value: 0.0 and parameters: {'timeframe': 'M3', 'atr_period': 13, 'atr_threshold': 10.0, 'pt_mult': 2.5, 'sl_mult': 0.5, 'td_mins': 30}. Best is trial 212 with value: 1.9962537038611405.
[I 2026-03-12 01:39:37,288] Trial 223 pruned. 
[I 2026-03-12 01:39:37,383] Trial 224 finished with value: 0.0 and parameters: {'timeframe': 'M3', 'atr_period': 13, 'atr_threshold': 5.0, 'pt_mult': 0.5, 'sl_mult': 0.5, 'td_mins': 1200}. Best is trial 212 with value: 1.9962537038611405.
[I 2026-03-12 01:39:37,448] Trial 225 finished with value: 0.0 and parameters: {'timeframe': 'M3', 'atr_period': 13, 'atr_threshold': 10.0, 'pt_mult': 5.0, 'sl_mult': 1.0, 'td_mins': 30}. Best is trial 212 with value: 1.9962537038611405.
[I 2026-03-12 01:39:37,496] Trial 226 finished with value: 0.0 and parameters: {'timeframe': 'M3', 'atr_period': 13, 'atr_threshold': 10.0, 'pt_mult': 5.0, 'sl_mult': 5.0, 'td_mins': 5}. Best is trial 212 with value: 1.9962537038611405.
[I 2026-03-12 01:39:37,550] Trial 227 finished with value: 0.0 and parameters: {'timeframe': 'M3', 'atr_period': 13, 'atr_threshold': 8.0, 'pt_mult': 1.0, 'sl_mult': 0.5, 'td_mins': 5}. Best is trial 212 with value: 1.9962537038611405.
[I 2026-03-12 01:39:37,820] Trial 228 pruned. 
[I 2026-03-12 01:39:37,866] Trial 229 finished with value: 0.0 and parameters: {'timeframe': 'M3', 'atr_period': 13, 'atr_threshold': 10.0, 'pt_mult': 1.0, 'sl_mult': 1.0, 'td_mins': 5}. Best is trial 212 with value: 1.9962537038611405.
[I 2026-03-12 01:39:38,154] Trial 230 pruned. 
[I 2026-03-12 01:39:38,334] Trial 231 finished with value: 1.1133396630309327 and parameters: {'timeframe': 'M3', 'atr_period': 13, 'atr_threshold': 3.0, 'pt_mult': 0.5, 'sl_mult': 1.0, 'td_mins': 180}. Best is trial 212 with value: 1.9962537038611405.
[I 2026-03-12 01:39:39,336] Trial 232 pruned. 
[I 2026-03-12 01:39:39,386] Trial 233 finished with value: 0.0 and parameters: {'timeframe': 'M3', 'atr_period': 13, 'atr_threshold': 5.0, 'pt_mult': 2.5, 'sl_mult': 1.0, 'td_mins': 720}. Best is trial 212 with value: 1.9962537038611405.
[I 2026-03-12 01:39:40,917] Trial 234 finished with value: 1.2234124441859133 and parameters: {'timeframe': 'M3', 'atr_period': 13, 'atr_threshold': 3.0, 'pt_mult': 5.0, 'sl_mult': 1.0, 'td_mins': 1080}. Best is trial 212 with value: 1.9962537038611405.
[I 2026-03-12 01:39:40,979] Trial 235 finished with value: 0.0 and parameters: {'timeframe': 'M3', 'atr_period': 13, 'atr_threshold': 10.0, 'pt_mult': 0.5, 'sl_mult': 5.0, 'td_mins': 1080}. Best is trial 212 with value: 1.9962537038611405.
[I 2026-03-12 01:39:41,072] Trial 236 pruned. 
[I 2026-03-12 01:39:41,149] Trial 237 pruned. 
[I 2026-03-12 01:39:41,266] Trial 238 pruned. 
[I 2026-03-12 01:39:41,323] Trial 239 finished with value: 0.0 and parameters: {'timeframe': 'M3', 'atr_period': 13, 'atr_threshold': 8.0, 'pt_mult': 0.5, 'sl_mult': 5.0, 'td_mins': 1080}. Best is trial 212 with value: 1.9962537038611405.
[I 2026-03-12 01:39:41,381] Trial 240 finished with value: 0.0 and parameters: {'timeframe': 'M3', 'atr_period': 13, 'atr_threshold': 5.0, 'pt_mult': 2.5, 'sl_mult': 0.5, 'td_mins': 120}. Best is trial 212 with value: 1.9962537038611405.
[I 2026-03-12 01:39:41,482] Trial 241 pruned. 
[I 2026-03-12 01:39:42,975] Trial 242 pruned. 
[I 2026-03-12 01:39:43,023] Trial 243 finished with value: 0.0 and parameters: {'timeframe': 'M3', 'atr_period': 13, 'atr_threshold': 10.0, 'pt_mult': 5.0, 'sl_mult': 5.0, 'td_mins': 15}. Best is trial 212 with value: 1.9962537038611405.
[I 2026-03-12 01:39:43,071] Trial 244 finished with value: 0.0 and parameters: {'timeframe': 'M3', 'atr_period': 13, 'atr_threshold': 15.0, 'pt_mult': 0.5, 'sl_mult': 0.5, 'td_mins': 720}. Best is trial 212 with value: 1.9962537038611405.
[I 2026-03-12 01:39:43,138] Trial 245 pruned. 
[I 2026-03-12 01:39:43,185] Trial 246 finished with value: 0.0 and parameters: {'timeframe': 'M3', 'atr_period': 13, 'atr_threshold': 15.0, 'pt_mult': 1.0, 'sl_mult': 5.0, 'td_mins': 720}. Best is trial 212 with value: 1.9962537038611405.
[I 2026-03-12 01:39:43,245] Trial 247 pruned. 
[I 2026-03-12 01:39:43,291] Trial 248 finished with value: 0.0 and parameters: {'timeframe': 'M3', 'atr_period': 13, 'atr_threshold': 5.0, 'pt_mult': 0.5, 'sl_mult': 1.0, 'td_mins': 360}. Best is trial 212 with value: 1.9962537038611405.
[I 2026-03-12 01:39:43,984] Trial 249 pruned. 
[I 2026-03-12 01:39:44,036] Trial 250 pruned. 
[I 2026-03-12 01:39:44,525] Trial 251 pruned. 
[I 2026-03-12 01:39:44,574] Trial 252 finished with value: 0.0 and parameters: {'timeframe': 'M3', 'atr_period': 13, 'atr_threshold': 15.0, 'pt_mult': 2.5, 'sl_mult': 2.5, 'td_mins': 30}. Best is trial 212 with value: 1.9962537038611405.
[I 2026-03-12 01:39:44,818] Trial 253 pruned. 
[I 2026-03-12 01:39:44,872] Trial 254 finished with value: 0.0 and parameters: {'timeframe': 'M3', 'atr_period': 13, 'atr_threshold': 10.0, 'pt_mult': 0.5, 'sl_mult': 0.5, 'td_mins': 120}. Best is trial 212 with value: 1.9962537038611405.
[I 2026-03-12 01:39:44,920] Trial 255 finished with value: 0.0 and parameters: {'timeframe': 'M3', 'atr_period': 13, 'atr_threshold': 15.0, 'pt_mult': 0.5, 'sl_mult': 0.5, 'td_mins': 1080}. Best is trial 212 with value: 1.9962537038611405.
[I 2026-03-12 01:39:44,991] Trial 256 pruned. 
[I 2026-03-12 01:39:45,037] Trial 257 finished with value: 0.0 and parameters: {'timeframe': 'M3', 'atr_period': 13, 'atr_threshold': 10.0, 'pt_mult': 5.0, 'sl_mult': 5.0, 'td_mins': 120}. Best is trial 212 with value: 1.9962537038611405.
[I 2026-03-12 01:39:45,084] Trial 258 finished with value: 0.0 and parameters: {'timeframe': 'M3', 'atr_period': 13, 'atr_threshold': 15.0, 'pt_mult': 0.5, 'sl_mult': 1.0, 'td_mins': 120}. Best is trial 212 with value: 1.9962537038611405.
[I 2026-03-12 01:39:45,130] Trial 259 finished with value: 0.0 and parameters: {'timeframe': 'M3', 'atr_period': 13, 'atr_threshold': 8.0, 'pt_mult': 0.5, 'sl_mult': 2.5, 'td_mins': 60}. Best is trial 212 with value: 1.9962537038611405.
[I 2026-03-12 01:39:45,234] Trial 260 pruned. 
[I 2026-03-12 01:39:45,377] Trial 261 pruned. 
[I 2026-03-12 01:39:45,441] Trial 262 finished with value: 0.0 and parameters: {'timeframe': 'M3', 'atr_period': 13, 'atr_threshold': 15.0, 'pt_mult': 2.5, 'sl_mult': 1.0, 'td_mins': 60}. Best is trial 212 with value: 1.9962537038611405.
[I 2026-03-12 01:39:45,597] Trial 263 pruned. 
[I 2026-03-12 01:39:47,697] Trial 264 pruned. 
[I 2026-03-12 01:39:47,860] Trial 265 pruned. 
[I 2026-03-12 01:39:47,906] Trial 266 finished with value: 0.0 and parameters: {'timeframe': 'M3', 'atr_period': 13, 'atr_threshold': 10.0, 'pt_mult': 5.0, 'sl_mult': 1.0, 'td_mins': 1200}. Best is trial 212 with value: 1.9962537038611405.
[I 2026-03-12 01:39:47,952] Trial 267 finished with value: 0.0 and parameters: {'timeframe': 'M3', 'atr_period': 13, 'atr_threshold': 8.0, 'pt_mult': 1.0, 'sl_mult': 5.0, 'td_mins': 360}. Best is trial 212 with value: 1.9962537038611405.
[I 2026-03-12 01:39:49,346] Trial 268 pruned. 
[I 2026-03-12 01:39:49,582] Trial 269 finished with value: 1.1226234669557307 and parameters: {'timeframe': 'M3', 'atr_period': 13, 'atr_threshold': 2.0, 'pt_mult': 2.5, 'sl_mult': 5.0, 'td_mins': 30}. Best is trial 212 with value: 1.9962537038611405.
[I 2026-03-12 01:39:49,628] Trial 270 finished with value: 0.0 and parameters: {'timeframe': 'M3', 'atr_period': 13, 'atr_threshold': 8.0, 'pt_mult': 5.0, 'sl_mult': 0.5, 'td_mins': 180}. Best is trial 212 with value: 1.9962537038611405.
[I 2026-03-12 01:39:50,141] Trial 271 finished with value: 1.1296337674026444 and parameters: {'timeframe': 'M3', 'atr_period': 13, 'atr_threshold': 3.0, 'pt_mult': 2.5, 'sl_mult': 0.5, 'td_mins': 720}. Best is trial 212 with value: 1.9962537038611405.
[I 2026-03-12 01:39:50,187] Trial 272 finished with value: 0.0 and parameters: {'timeframe': 'M3', 'atr_period': 13, 'atr_threshold': 8.0, 'pt_mult': 2.5, 'sl_mult': 1.0, 'td_mins': 120}. Best is trial 212 with value: 1.9962537038611405.
[I 2026-03-12 01:39:50,235] Trial 273 pruned. 
[I 2026-03-12 01:39:50,285] Trial 274 finished with value: 0.0 and parameters: {'timeframe': 'M3', 'atr_period': 13, 'atr_threshold': 8.0, 'pt_mult': 2.5, 'sl_mult': 5.0, 'td_mins': 1200}. Best is trial 212 with value: 1.9962537038611405.
[I 2026-03-12 01:39:50,542] Trial 275 pruned. 
[I 2026-03-12 01:39:50,590] Trial 276 finished with value: 0.0 and parameters: {'timeframe': 'M3', 'atr_period': 13, 'atr_threshold': 5.0, 'pt_mult': 0.5, 'sl_mult': 1.0, 'td_mins': 5}. Best is trial 212 with value: 1.9962537038611405.
[I 2026-03-12 01:39:50,635] Trial 277 finished with value: 0.0 and parameters: {'timeframe': 'M3', 'atr_period': 13, 'atr_threshold': 8.0, 'pt_mult': 2.5, 'sl_mult': 0.5, 'td_mins': 180}. Best is trial 212 with value: 1.9962537038611405.
[I 2026-03-12 01:39:50,681] Trial 278 finished with value: 0.0 and parameters: {'timeframe': 'M3', 'atr_period': 13, 'atr_threshold': 15.0, 'pt_mult': 5.0, 'sl_mult': 2.5, 'td_mins': 5}. Best is trial 212 with value: 1.9962537038611405.
[I 2026-03-12 01:39:50,725] Trial 279 finished with value: 0.0 and parameters: {'timeframe': 'M3', 'atr_period': 13, 'atr_threshold': 5.0, 'pt_mult': 1.0, 'sl_mult': 1.0, 'td_mins': 120}. Best is trial 212 with value: 1.9962537038611405.
[I 2026-03-12 01:39:51,956] Trial 280 finished with value: 1.2233997533598024 and parameters: {'timeframe': 'M3', 'atr_period': 13, 'atr_threshold': 3.0, 'pt_mult': 5.0, 'sl_mult': 1.0, 'td_mins': 1200}. Best is trial 212 with value: 1.9962537038611405.
[I 2026-03-12 01:39:52,393] Trial 281 pruned. 
[I 2026-03-12 01:39:52,491] Trial 282 finished with value: 0.0 and parameters: {'timeframe': 'M3', 'atr_period': 13, 'atr_threshold': 10.0, 'pt_mult': 1.0, 'sl_mult': 1.0, 'td_mins': 1080}. Best is trial 212 with value: 1.9962537038611405.
[I 2026-03-12 01:39:52,554] Trial 283 finished with value: 0.0 and parameters: {'timeframe': 'M3', 'atr_period': 13, 'atr_threshold': 8.0, 'pt_mult': 2.5, 'sl_mult': 1.0, 'td_mins': 720}. Best is trial 212 with value: 1.9962537038611405.
[I 2026-03-12 01:39:52,604] Trial 284 finished with value: 0.0 and parameters: {'timeframe': 'M3', 'atr_period': 13, 'atr_threshold': 5.0, 'pt_mult': 0.5, 'sl_mult': 5.0, 'td_mins': 30}. Best is trial 212 with value: 1.9962537038611405.
[I 2026-03-12 01:39:52,659] Trial 285 finished with value: 0.0 and parameters: {'timeframe': 'M3', 'atr_period': 13, 'atr_threshold': 10.0, 'pt_mult': 0.5, 'sl_mult': 5.0, 'td_mins': 1200}. Best is trial 212 with value: 1.9962537038611405.
[I 2026-03-12 01:39:52,791] Trial 286 pruned. 
[I 2026-03-12 01:40:03,750] Trial 287 finished with value: 0.9443848565207456 and parameters: {'timeframe': 'M3', 'atr_period': 13, 'atr_threshold': 1.0, 'pt_mult': 5.0, 'sl_mult': 5.0, 'td_mins': 1080}. Best is trial 212 with value: 1.9962537038611405.
[I 2026-03-12 01:40:04,339] Trial 288 finished with value: 1.5593286804083646 and parameters: {'timeframe': 'M3', 'atr_period': 13, 'atr_threshold': 2.0, 'pt_mult': 1.0, 'sl_mult': 5.0, 'td_mins': 120}. Best is trial 212 with value: 1.9962537038611405.
[I 2026-03-12 01:40:04,383] Trial 289 finished with value: 0.0 and parameters: {'timeframe': 'M3', 'atr_period': 13, 'atr_threshold': 15.0, 'pt_mult': 5.0, 'sl_mult': 2.5, 'td_mins': 120}. Best is trial 212 with value: 1.9962537038611405.
