[I 2026-03-12 01:05:12,583] Trial 971 finished with value: 0.0 and parameters: {'timeframe': 'M8', 'atr_period': 13, 'atr_threshold': 8.0, 'pt_mult': 0.5, 'sl_mult': 0.5, 'td_mins': 120}. Best is trial 57 with value: 2.2537359686354455.
[I 2026-03-12 01:05:12,751] Trial 972 pruned. 
[I 2026-03-12 01:05:13,035] Trial 973 pruned. 
[I 2026-03-12 01:05:13,191] Trial 974 pruned. 
[I 2026-03-12 01:05:13,391] Trial 975 pruned. 
[I 2026-03-12 01:05:13,579] Trial 976 finished with value: 2.2537359686354455 and parameters: {'timeframe': 'M8', 'atr_period': 13, 'atr_threshold': 3.0, 'pt_mult': 0.5, 'sl_mult': 5.0, 'td_mins': 60}. Best is trial 57 with value: 2.2537359686354455.
[I 2026-03-12 01:05:13,634] Trial 977 pruned. 
[I 2026-03-12 01:05:13,717] Trial 978 pruned. 
[I 2026-03-12 01:05:13,789] Trial 979 pruned. 
[I 2026-03-12 01:05:14,158] Trial 980 pruned. 
[I 2026-03-12 01:05:14,507] Trial 981 pruned. 
[I 2026-03-12 01:05:14,556] Trial 982 finished with value: 0.0 and parameters: {'timeframe': 'M8', 'atr_period': 13, 'atr_threshold': 15.0, 'pt_mult': 2.5, 'sl_mult': 5.0, 'td_mins': 180}. Best is trial 57 with value: 2.2537359686354455.
[I 2026-03-12 01:05:15,792] Trial 983 pruned. 
[I 2026-03-12 01:05:15,854] Trial 984 pruned. 
[I 2026-03-12 01:05:15,930] Trial 985 pruned. 
[I 2026-03-12 01:05:16,106] Trial 986 pruned. 
[I 2026-03-12 01:05:16,293] Trial 987 finished with value: 2.2537359686354455 and parameters: {'timeframe': 'M8', 'atr_period': 13, 'atr_threshold': 3.0, 'pt_mult': 0.5, 'sl_mult': 5.0, 'td_mins': 60}. Best is trial 57 with value: 2.2537359686354455.
[I 2026-03-12 01:05:16,341] Trial 988 finished with value: 0.0 and parameters: {'timeframe': 'M8', 'atr_period': 13, 'atr_threshold': 8.0, 'pt_mult': 5.0, 'sl_mult': 0.5, 'td_mins': 60}. Best is trial 57 with value: 2.2537359686354455.
[I 2026-03-12 01:05:16,530] Trial 989 finished with value: 2.2537359686354455 and parameters: {'timeframe': 'M8', 'atr_period': 13, 'atr_threshold': 3.0, 'pt_mult': 0.5, 'sl_mult': 5.0, 'td_mins': 60}. Best is trial 57 with value: 2.2537359686354455.
[I 2026-03-12 01:05:16,749] Trial 990 finished with value: 2.2537359686354455 and parameters: {'timeframe': 'M8', 'atr_period': 13, 'atr_threshold': 3.0, 'pt_mult': 0.5, 'sl_mult': 5.0, 'td_mins': 60}. Best is trial 57 with value: 2.2537359686354455.
[I 2026-03-12 01:05:16,974] Trial 991 pruned. 
[I 2026-03-12 01:05:17,196] Trial 992 finished with value: 2.2537359686354455 and parameters: {'timeframe': 'M8', 'atr_period': 13, 'atr_threshold': 3.0, 'pt_mult': 0.5, 'sl_mult': 5.0, 'td_mins': 60}. Best is trial 57 with value: 2.2537359686354455.
[I 2026-03-12 01:05:17,773] Trial 993 pruned. 
[I 2026-03-12 01:05:17,955] Trial 994 finished with value: 2.2537359686354455 and parameters: {'timeframe': 'M8', 'atr_period': 13, 'atr_threshold': 3.0, 'pt_mult': 0.5, 'sl_mult': 5.0, 'td_mins': 60}. Best is trial 57 with value: 2.2537359686354455.
[I 2026-03-12 01:05:19,495] Trial 995 pruned. 
[I 2026-03-12 01:05:19,547] Trial 996 finished with value: 0.0 and parameters: {'timeframe': 'M8', 'atr_period': 13, 'atr_threshold': 15.0, 'pt_mult': 5.0, 'sl_mult': 0.5, 'td_mins': 15}. Best is trial 57 with value: 2.2537359686354455.
[I 2026-03-12 01:05:19,745] Trial 997 finished with value: 2.2537359686354455 and parameters: {'timeframe': 'M8', 'atr_period': 13, 'atr_threshold': 3.0, 'pt_mult': 0.5, 'sl_mult': 5.0, 'td_mins': 60}. Best is trial 57 with value: 2.2537359686354455.
[I 2026-03-12 01:05:19,935] Trial 998 finished with value: 2.2537359686354455 and parameters: {'timeframe': 'M8', 'atr_period': 13, 'atr_threshold': 3.0, 'pt_mult': 0.5, 'sl_mult': 5.0, 'td_mins': 60}. Best is trial 57 with value: 2.2537359686354455.
[I 2026-03-12 01:05:20,115] Trial 999 finished with value: 2.2537359686354455 and parameters: {'timeframe': 'M8', 'atr_period': 13, 'atr_threshold': 3.0, 'pt_mult': 0.5, 'sl_mult': 5.0, 'td_mins': 60}. Best is trial 57 with value: 2.2537359686354455.
2026-03-12 01:05:20,171 - INFO - === Starting Optuna Optimization for M15 (Trials: 1000) ===
/home/hephaestus-zero/.local/lib/python3.11/site-packages/optuna/_experimental.py:32: ExperimentalWarning: Argument ``multivariate`` is an experimental feature. The interface can change in the future.
  warnings.warn(
[I 2026-03-12 01:05:20,172] A new study created in memory with name: no-name-8a179ee0-a211-42ca-8798-1cf95cecebe1
2026-03-12 01:05:20,174 - INFO -     [Cache Miss] Loading Signal Data for M15, ATR=13...
2026-03-12 01:05:57,569 - INFO -     [Cache Miss] Loading Signal Data for M15, ATR=13...
2026-03-12 01:06:33,784 - INFO -     [Cache Miss] Loading Signal Data for M15, ATR=13...
2026-03-12 01:07:10,846 - INFO -     [Cache Miss] Loading Signal Data for M15, ATR=13...
2026-03-12 01:07:48,103 - INFO -     [Cache Miss] Loading Signal Data for M15, ATR=13...
[I 2026-03-12 01:08:24,731] Trial 0 finished with value: 0.5629627555458497 and parameters: {'timeframe': 'M15', 'atr_period': 13, 'atr_threshold': 5.0, 'pt_mult': 1.0, 'sl_mult': 5.0, 'td_mins': 1200}. Best is trial 0 with value: 0.5629627555458497.
[I 2026-03-12 01:08:24,781] Trial 1 finished with value: 0.0 and parameters: {'timeframe': 'M15', 'atr_period': 13, 'atr_threshold': 15.0, 'pt_mult': 2.5, 'sl_mult': 1.0, 'td_mins': 360}. Best is trial 0 with value: 0.5629627555458497.
[I 2026-03-12 01:08:25,219] Trial 2 finished with value: 0.9752545928401377 and parameters: {'timeframe': 'M15', 'atr_period': 13, 'atr_threshold': 0.5, 'pt_mult': 0.5, 'sl_mult': 0.5, 'td_mins': 120}. Best is trial 2 with value: 0.9752545928401377.
[I 2026-03-12 01:08:25,264] Trial 3 finished with value: 0.0 and parameters: {'timeframe': 'M15', 'atr_period': 13, 'atr_threshold': 15.0, 'pt_mult': 0.5, 'sl_mult': 5.0, 'td_mins': 360}. Best is trial 2 with value: 0.9752545928401377.
[I 2026-03-12 01:08:25,467] Trial 4 finished with value: 0.3252640120412381 and parameters: {'timeframe': 'M15', 'atr_period': 13, 'atr_threshold': 0.5, 'pt_mult': 1.0, 'sl_mult': 0.5, 'td_mins': 15}. Best is trial 2 with value: 0.9752545928401377.
[I 2026-03-12 01:08:25,696] Trial 5 finished with value: 0.5326114674827946 and parameters: {'timeframe': 'M15', 'atr_period': 13, 'atr_threshold': 5.0, 'pt_mult': 1.0, 'sl_mult': 2.5, 'td_mins': 360}. Best is trial 2 with value: 0.9752545928401377.
[I 2026-03-12 01:08:25,743] Trial 6 finished with value: 0.0 and parameters: {'timeframe': 'M15', 'atr_period': 13, 'atr_threshold': 15.0, 'pt_mult': 1.0, 'sl_mult': 1.0, 'td_mins': 15}. Best is trial 2 with value: 0.9752545928401377.
[I 2026-03-12 01:08:25,818] Trial 7 finished with value: 0.34058624489149497 and parameters: {'timeframe': 'M15', 'atr_period': 13, 'atr_threshold': 8.0, 'pt_mult': 0.5, 'sl_mult': 5.0, 'td_mins': 120}. Best is trial 2 with value: 0.9752545928401377.
[I 2026-03-12 01:08:25,866] Trial 8 finished with value: 0.0 and parameters: {'timeframe': 'M15', 'atr_period': 13, 'atr_threshold': 10.0, 'pt_mult': 2.5, 'sl_mult': 2.5, 'td_mins': 30}. Best is trial 2 with value: 0.9752545928401377.
[I 2026-03-12 01:08:25,914] Trial 9 finished with value: 0.0 and parameters: {'timeframe': 'M15', 'atr_period': 13, 'atr_threshold': 15.0, 'pt_mult': 1.0, 'sl_mult': 5.0, 'td_mins': 15}. Best is trial 2 with value: 0.9752545928401377.
[I 2026-03-12 01:08:25,960] Trial 10 finished with value: 0.0 and parameters: {'timeframe': 'M15', 'atr_period': 13, 'atr_threshold': 10.0, 'pt_mult': 0.5, 'sl_mult': 0.5, 'td_mins': 60}. Best is trial 2 with value: 0.9752545928401377.
[I 2026-03-12 01:08:26,122] Trial 11 finished with value: 0.12036472752045131 and parameters: {'timeframe': 'M15', 'atr_period': 13, 'atr_threshold': 3.0, 'pt_mult': 2.5, 'sl_mult': 0.5, 'td_mins': 30}. Best is trial 2 with value: 0.9752545928401377.
[I 2026-03-12 01:08:27,193] Trial 12 finished with value: 1.0163786580614884 and parameters: {'timeframe': 'M15', 'atr_period': 13, 'atr_threshold': 2.0, 'pt_mult': 0.5, 'sl_mult': 0.5, 'td_mins': 1200}. Best is trial 12 with value: 1.0163786580614884.
[I 2026-03-12 01:08:27,240] Trial 13 finished with value: 0.0 and parameters: {'timeframe': 'M15', 'atr_period': 13, 'atr_threshold': 15.0, 'pt_mult': 0.5, 'sl_mult': 1.0, 'td_mins': 360}. Best is trial 12 with value: 1.0163786580614884.
[I 2026-03-12 01:08:27,287] Trial 14 finished with value: 0.0 and parameters: {'timeframe': 'M15', 'atr_period': 13, 'atr_threshold': 15.0, 'pt_mult': 0.5, 'sl_mult': 5.0, 'td_mins': 1200}. Best is trial 12 with value: 1.0163786580614884.
[I 2026-03-12 01:08:27,362] Trial 15 finished with value: 0.5373051776714122 and parameters: {'timeframe': 'M15', 'atr_period': 13, 'atr_threshold': 5.0, 'pt_mult': 0.5, 'sl_mult': 0.5, 'td_mins': 60}. Best is trial 12 with value: 1.0163786580614884.
[I 2026-03-12 01:08:27,425] Trial 16 finished with value: 0.04544581152837367 and parameters: {'timeframe': 'M15', 'atr_period': 13, 'atr_threshold': 8.0, 'pt_mult': 5.0, 'sl_mult': 2.5, 'td_mins': 120}. Best is trial 12 with value: 1.0163786580614884.
[I 2026-03-12 01:08:29,580] Trial 17 finished with value: 1.0246066308189015 and parameters: {'timeframe': 'M15', 'atr_period': 13, 'atr_threshold': 2.0, 'pt_mult': 2.5, 'sl_mult': 0.5, 'td_mins': 1200}. Best is trial 17 with value: 1.0246066308189015.
[I 2026-03-12 01:08:29,755] Trial 18 finished with value: 0.059347247950719086 and parameters: {'timeframe': 'M15', 'atr_period': 13, 'atr_threshold': 3.0, 'pt_mult': 5.0, 'sl_mult': 0.5, 'td_mins': 60}. Best is trial 17 with value: 1.0246066308189015.
[I 2026-03-12 01:08:30,352] Trial 19 finished with value: 1.0129798826343912 and parameters: {'timeframe': 'M15', 'atr_period': 13, 'atr_threshold': 0.5, 'pt_mult': 0.5, 'sl_mult': 0.5, 'td_mins': 360}. Best is trial 17 with value: 1.0246066308189015.
[I 2026-03-12 01:08:30,692] Trial 20 finished with value: 0.8755912232789221 and parameters: {'timeframe': 'M15', 'atr_period': 13, 'atr_threshold': 2.0, 'pt_mult': 1.0, 'sl_mult': 0.5, 'td_mins': 120}. Best is trial 17 with value: 1.0246066308189015.
[I 2026-03-12 01:08:30,763] Trial 21 pruned. 
[I 2026-03-12 01:08:30,873] Trial 22 pruned. 
[I 2026-03-12 01:08:30,920] Trial 23 finished with value: 0.0 and parameters: {'timeframe': 'M15', 'atr_period': 13, 'atr_threshold': 15.0, 'pt_mult': 1.0, 'sl_mult': 1.0, 'td_mins': 15}. Best is trial 17 with value: 1.0246066308189015.
[I 2026-03-12 01:08:30,973] Trial 24 finished with value: 0.0 and parameters: {'timeframe': 'M15', 'atr_period': 13, 'atr_threshold': 10.0, 'pt_mult': 0.5, 'sl_mult': 0.5, 'td_mins': 1200}. Best is trial 17 with value: 1.0246066308189015.
[I 2026-03-12 01:08:31,024] Trial 25 finished with value: 0.0 and parameters: {'timeframe': 'M15', 'atr_period': 13, 'atr_threshold': 15.0, 'pt_mult': 5.0, 'sl_mult': 2.5, 'td_mins': 720}. Best is trial 17 with value: 1.0246066308189015.
[I 2026-03-12 01:08:31,075] Trial 26 finished with value: 0.0 and parameters: {'timeframe': 'M15', 'atr_period': 13, 'atr_threshold': 10.0, 'pt_mult': 0.5, 'sl_mult': 1.0, 'td_mins': 15}. Best is trial 17 with value: 1.0246066308189015.
[I 2026-03-12 01:08:31,567] Trial 27 finished with value: 1.2339200030523159 and parameters: {'timeframe': 'M15', 'atr_period': 13, 'atr_threshold': 1.0, 'pt_mult': 0.5, 'sl_mult': 2.5, 'td_mins': 120}. Best is trial 27 with value: 1.2339200030523159.
[I 2026-03-12 01:08:35,302] Trial 28 finished with value: 1.0176374847651677 and parameters: {'timeframe': 'M15', 'atr_period': 13, 'atr_threshold': 1.0, 'pt_mult': 5.0, 'sl_mult': 0.5, 'td_mins': 1200}. Best is trial 27 with value: 1.2339200030523159.
[I 2026-03-12 01:08:35,548] Trial 29 pruned. 
[I 2026-03-12 01:08:35,590] Trial 30 pruned. 
[I 2026-03-12 01:08:35,649] Trial 31 pruned. 
[I 2026-03-12 01:08:35,984] Trial 32 finished with value: 1.0066477358806494 and parameters: {'timeframe': 'M15', 'atr_period': 13, 'atr_threshold': 1.0, 'pt_mult': 1.0, 'sl_mult': 2.5, 'td_mins': 60}. Best is trial 27 with value: 1.2339200030523159.
[I 2026-03-12 01:08:36,031] Trial 33 pruned. 
[I 2026-03-12 01:08:36,085] Trial 34 pruned. 
[I 2026-03-12 01:08:36,135] Trial 35 finished with value: 0.0 and parameters: {'timeframe': 'M15', 'atr_period': 13, 'atr_threshold': 10.0, 'pt_mult': 5.0, 'sl_mult': 1.0, 'td_mins': 5}. Best is trial 27 with value: 1.2339200030523159.
[I 2026-03-12 01:08:36,182] Trial 36 finished with value: 0.0 and parameters: {'timeframe': 'M15', 'atr_period': 13, 'atr_threshold': 10.0, 'pt_mult': 0.5, 'sl_mult': 1.0, 'td_mins': 720}. Best is trial 27 with value: 1.2339200030523159.
[I 2026-03-12 01:08:37,359] Trial 37 finished with value: 1.0130976267032223 and parameters: {'timeframe': 'M15', 'atr_period': 13, 'atr_threshold': 0.5, 'pt_mult': 0.5, 'sl_mult': 1.0, 'td_mins': 720}. Best is trial 27 with value: 1.2339200030523159.
[I 2026-03-12 01:08:37,403] Trial 38 pruned. 
[I 2026-03-12 01:08:37,522] Trial 39 finished with value: 0.5721950813338008 and parameters: {'timeframe': 'M15', 'atr_period': 13, 'atr_threshold': 5.0, 'pt_mult': 0.5, 'sl_mult': 1.0, 'td_mins': 180}. Best is trial 27 with value: 1.2339200030523159.
[I 2026-03-12 01:08:37,598] Trial 40 pruned. 
[I 2026-03-12 01:08:37,796] Trial 41 pruned. 
[I 2026-03-12 01:08:37,871] Trial 42 pruned. 
[I 2026-03-12 01:08:37,916] Trial 43 finished with value: 0.0 and parameters: {'timeframe': 'M15', 'atr_period': 13, 'atr_threshold': 15.0, 'pt_mult': 5.0, 'sl_mult': 1.0, 'td_mins': 720}. Best is trial 27 with value: 1.2339200030523159.
[I 2026-03-12 01:08:38,010] Trial 44 pruned. 
[I 2026-03-12 01:08:38,424] Trial 45 pruned. 
[I 2026-03-12 01:08:38,469] Trial 46 finished with value: 0.0 and parameters: {'timeframe': 'M15', 'atr_period': 13, 'atr_threshold': 15.0, 'pt_mult': 1.0, 'sl_mult': 1.0, 'td_mins': 720}. Best is trial 27 with value: 1.2339200030523159.
[I 2026-03-12 01:08:38,703] Trial 47 pruned. 
[I 2026-03-12 01:08:38,748] Trial 48 finished with value: 0.0 and parameters: {'timeframe': 'M15', 'atr_period': 13, 'atr_threshold': 10.0, 'pt_mult': 5.0, 'sl_mult': 5.0, 'td_mins': 1080}. Best is trial 27 with value: 1.2339200030523159.
[I 2026-03-12 01:08:38,793] Trial 49 finished with value: 0.0 and parameters: {'timeframe': 'M15', 'atr_period': 13, 'atr_threshold': 15.0, 'pt_mult': 2.5, 'sl_mult': 2.5, 'td_mins': 15}. Best is trial 27 with value: 1.2339200030523159.
[I 2026-03-12 01:08:38,837] Trial 50 finished with value: 0.0 and parameters: {'timeframe': 'M15', 'atr_period': 13, 'atr_threshold': 10.0, 'pt_mult': 5.0, 'sl_mult': 0.5, 'td_mins': 30}. Best is trial 27 with value: 1.2339200030523159.
[I 2026-03-12 01:08:38,881] Trial 51 finished with value: 0.0 and parameters: {'timeframe': 'M15', 'atr_period': 13, 'atr_threshold': 10.0, 'pt_mult': 2.5, 'sl_mult': 5.0, 'td_mins': 1080}. Best is trial 27 with value: 1.2339200030523159.
[I 2026-03-12 01:08:39,484] Trial 52 finished with value: 0.9622585014199982 and parameters: {'timeframe': 'M15', 'atr_period': 13, 'atr_threshold': 1.0, 'pt_mult': 1.0, 'sl_mult': 0.5, 'td_mins': 180}. Best is trial 27 with value: 1.2339200030523159.
[I 2026-03-12 01:08:39,557] Trial 53 pruned. 
[I 2026-03-12 01:08:39,625] Trial 54 pruned. 
[I 2026-03-12 01:08:40,016] Trial 55 finished with value: 1.1451607010132716 and parameters: {'timeframe': 'M15', 'atr_period': 13, 'atr_threshold': 3.0, 'pt_mult': 1.0, 'sl_mult': 2.5, 'td_mins': 180}. Best is trial 27 with value: 1.2339200030523159.
[I 2026-03-12 01:08:40,303] Trial 56 finished with value: 2.1409708515998753 and parameters: {'timeframe': 'M15', 'atr_period': 13, 'atr_threshold': 2.0, 'pt_mult': 0.5, 'sl_mult': 5.0, 'td_mins': 60}. Best is trial 56 with value: 2.1409708515998753.
[I 2026-03-12 01:08:40,346] Trial 57 finished with value: 0.0 and parameters: {'timeframe': 'M15', 'atr_period': 13, 'atr_threshold': 15.0, 'pt_mult': 1.0, 'sl_mult': 5.0, 'td_mins': 1080}. Best is trial 56 with value: 2.1409708515998753.
[I 2026-03-12 01:08:40,391] Trial 58 pruned. 
[I 2026-03-12 01:08:40,436] Trial 59 pruned. 
[I 2026-03-12 01:08:40,480] Trial 60 pruned. 
[I 2026-03-12 01:08:40,528] Trial 61 pruned. 
[I 2026-03-12 01:08:40,570] Trial 62 finished with value: 0.0 and parameters: {'timeframe': 'M15', 'atr_period': 13, 'atr_threshold': 15.0, 'pt_mult': 2.5, 'sl_mult': 1.0, 'td_mins': 5}. Best is trial 56 with value: 2.1409708515998753.
[I 2026-03-12 01:08:40,613] Trial 63 finished with value: 0.0 and parameters: {'timeframe': 'M15', 'atr_period': 13, 'atr_threshold': 15.0, 'pt_mult': 1.0, 'sl_mult': 0.5, 'td_mins': 180}. Best is trial 56 with value: 2.1409708515998753.
[I 2026-03-12 01:08:40,988] Trial 64 finished with value: 1.5329072099888823 and parameters: {'timeframe': 'M15', 'atr_period': 13, 'atr_threshold': 1.0, 'pt_mult': 1.0, 'sl_mult': 5.0, 'td_mins': 60}. Best is trial 56 with value: 2.1409708515998753.
[I 2026-03-12 01:08:41,035] Trial 65 finished with value: 0.0 and parameters: {'timeframe': 'M15', 'atr_period': 13, 'atr_threshold': 10.0, 'pt_mult': 5.0, 'sl_mult': 2.5, 'td_mins': 180}. Best is trial 56 with value: 2.1409708515998753.
[I 2026-03-12 01:08:41,150] Trial 66 pruned. 
[I 2026-03-12 01:08:45,506] Trial 67 finished with value: 1.1142944676032434 and parameters: {'timeframe': 'M15', 'atr_period': 13, 'atr_threshold': 0.5, 'pt_mult': 1.0, 'sl_mult': 5.0, 'td_mins': 1080}. Best is trial 56 with value: 2.1409708515998753.
[I 2026-03-12 01:08:45,586] Trial 68 pruned. 
[I 2026-03-12 01:08:45,631] Trial 69 pruned. 
[I 2026-03-12 01:08:45,693] Trial 70 pruned. 
[I 2026-03-12 01:08:45,737] Trial 71 pruned. 
[I 2026-03-12 01:08:45,792] Trial 72 pruned. 
[I 2026-03-12 01:08:45,926] Trial 73 pruned. 
[I 2026-03-12 01:08:48,729] Trial 74 finished with value: 1.030658331635526 and parameters: {'timeframe': 'M15', 'atr_period': 13, 'atr_threshold': 1.0, 'pt_mult': 0.5, 'sl_mult': 2.5, 'td_mins': 1200}. Best is trial 56 with value: 2.1409708515998753.
[I 2026-03-12 01:08:48,781] Trial 75 finished with value: 0.0 and parameters: {'timeframe': 'M15', 'atr_period': 13, 'atr_threshold': 15.0, 'pt_mult': 0.5, 'sl_mult': 0.5, 'td_mins': 15}. Best is trial 56 with value: 2.1409708515998753.
[I 2026-03-12 01:08:48,850] Trial 76 pruned. 
[I 2026-03-12 01:08:49,680] Trial 77 finished with value: 1.0824807299118322 and parameters: {'timeframe': 'M15', 'atr_period': 13, 'atr_threshold': 0.5, 'pt_mult': 2.5, 'sl_mult': 5.0, 'td_mins': 180}. Best is trial 56 with value: 2.1409708515998753.
[I 2026-03-12 01:08:50,032] Trial 78 finished with value: 1.5329072099888823 and parameters: {'timeframe': 'M15', 'atr_period': 13, 'atr_threshold': 0.5, 'pt_mult': 1.0, 'sl_mult': 5.0, 'td_mins': 60}. Best is trial 56 with value: 2.1409708515998753.
[I 2026-03-12 01:08:50,116] Trial 79 pruned. 
[I 2026-03-12 01:08:50,169] Trial 80 finished with value: 0.0 and parameters: {'timeframe': 'M15', 'atr_period': 13, 'atr_threshold': 10.0, 'pt_mult': 1.0, 'sl_mult': 2.5, 'td_mins': 1080}. Best is trial 56 with value: 2.1409708515998753.
[I 2026-03-12 01:08:50,220] Trial 81 pruned. 
[I 2026-03-12 01:08:50,512] Trial 82 finished with value: 2.454517025102679 and parameters: {'timeframe': 'M15', 'atr_period': 13, 'atr_threshold': 3.0, 'pt_mult': 0.5, 'sl_mult': 5.0, 'td_mins': 120}. Best is trial 82 with value: 2.454517025102679.
[I 2026-03-12 01:08:50,563] Trial 83 finished with value: 0.0 and parameters: {'timeframe': 'M15', 'atr_period': 13, 'atr_threshold': 15.0, 'pt_mult': 1.0, 'sl_mult': 0.5, 'td_mins': 5}. Best is trial 82 with value: 2.454517025102679.
[I 2026-03-12 01:08:50,653] Trial 84 pruned. 
[I 2026-03-12 01:08:50,736] Trial 85 pruned. 
[I 2026-03-12 01:08:50,898] Trial 86 pruned. 
[I 2026-03-12 01:08:50,951] Trial 87 pruned. 
[I 2026-03-12 01:08:53,689] Trial 88 finished with value: 1.030658331635526 and parameters: {'timeframe': 'M15', 'atr_period': 13, 'atr_threshold': 0.5, 'pt_mult': 0.5, 'sl_mult': 2.5, 'td_mins': 1200}. Best is trial 82 with value: 2.454517025102679.
[I 2026-03-12 01:08:53,796] Trial 89 pruned. 
[I 2026-03-12 01:08:53,856] Trial 90 pruned. 
[I 2026-03-12 01:08:54,185] Trial 91 pruned. 
[I 2026-03-12 01:08:54,548] Trial 92 pruned. 
[I 2026-03-12 01:08:54,594] Trial 93 pruned. 
[I 2026-03-12 01:08:54,640] Trial 94 finished with value: 0.0 and parameters: {'timeframe': 'M15', 'atr_period': 13, 'atr_threshold': 15.0, 'pt_mult': 2.5, 'sl_mult': 2.5, 'td_mins': 60}. Best is trial 82 with value: 2.454517025102679.
[I 2026-03-12 01:08:54,684] Trial 95 pruned. 
[I 2026-03-12 01:08:55,384] Trial 96 pruned. 
[I 2026-03-12 01:08:55,433] Trial 97 pruned. 
[I 2026-03-12 01:08:55,522] Trial 98 pruned. 
[I 2026-03-12 01:08:55,627] Trial 99 pruned. 
[I 2026-03-12 01:08:56,721] Trial 100 pruned. 
[I 2026-03-12 01:08:56,777] Trial 101 pruned. 
[I 2026-03-12 01:08:56,878] Trial 102 pruned. 
[I 2026-03-12 01:08:56,931] Trial 103 pruned. 
[I 2026-03-12 01:08:56,995] Trial 104 pruned. 
[I 2026-03-12 01:08:57,097] Trial 105 pruned. 
[I 2026-03-12 01:08:57,426] Trial 106 finished with value: 1.5329072099888823 and parameters: {'timeframe': 'M15', 'atr_period': 13, 'atr_threshold': 1.0, 'pt_mult': 1.0, 'sl_mult': 5.0, 'td_mins': 60}. Best is trial 82 with value: 2.454517025102679.
[I 2026-03-12 01:09:00,120] Trial 107 finished with value: 1.030658331635526 and parameters: {'timeframe': 'M15', 'atr_period': 13, 'atr_threshold': 1.0, 'pt_mult': 0.5, 'sl_mult': 2.5, 'td_mins': 1200}. Best is trial 82 with value: 2.454517025102679.
[I 2026-03-12 01:09:00,420] Trial 108 pruned. 
[I 2026-03-12 01:09:00,517] Trial 109 pruned. 
[I 2026-03-12 01:09:00,563] Trial 110 pruned. 
[I 2026-03-12 01:09:02,601] Trial 111 finished with value: 1.271278600530214 and parameters: {'timeframe': 'M15', 'atr_period': 13, 'atr_threshold': 2.0, 'pt_mult': 1.0, 'sl_mult': 5.0, 'td_mins': 720}. Best is trial 82 with value: 2.454517025102679.
[I 2026-03-12 01:09:02,644] Trial 112 pruned. 
