[I 2026-03-12 01:55:50,762] Trial 371 finished with value: 2.9979644789811193 and parameters: {'timeframe': 'M8', 'atr_period': 13, 'atr_threshold': 5.0, 'pt_mult': 0.5, 'sl_mult': 5.0, 'td_mins': 60}. Best is trial 207 with value: 2.9979644789811193.
[I 2026-03-12 01:55:50,851] Trial 372 finished with value: 2.9979644789811193 and parameters: {'timeframe': 'M8', 'atr_period': 13, 'atr_threshold': 5.0, 'pt_mult': 0.5, 'sl_mult': 5.0, 'td_mins': 60}. Best is trial 207 with value: 2.9979644789811193.
[I 2026-03-12 01:55:50,934] Trial 373 finished with value: 2.9979644789811193 and parameters: {'timeframe': 'M8', 'atr_period': 13, 'atr_threshold': 5.0, 'pt_mult': 0.5, 'sl_mult': 5.0, 'td_mins': 60}. Best is trial 207 with value: 2.9979644789811193.
[I 2026-03-12 01:55:51,027] Trial 374 finished with value: 2.9979644789811193 and parameters: {'timeframe': 'M8', 'atr_period': 13, 'atr_threshold': 5.0, 'pt_mult': 0.5, 'sl_mult': 5.0, 'td_mins': 60}. Best is trial 207 with value: 2.9979644789811193.
[I 2026-03-12 01:55:51,124] Trial 375 finished with value: 2.9979644789811193 and parameters: {'timeframe': 'M8', 'atr_period': 13, 'atr_threshold': 5.0, 'pt_mult': 0.5, 'sl_mult': 5.0, 'td_mins': 60}. Best is trial 207 with value: 2.9979644789811193.
[I 2026-03-12 01:55:51,210] Trial 376 finished with value: 2.9979644789811193 and parameters: {'timeframe': 'M8', 'atr_period': 13, 'atr_threshold': 5.0, 'pt_mult': 0.5, 'sl_mult': 5.0, 'td_mins': 60}. Best is trial 207 with value: 2.9979644789811193.
[I 2026-03-12 01:55:51,296] Trial 377 finished with value: 2.9979644789811193 and parameters: {'timeframe': 'M8', 'atr_period': 13, 'atr_threshold': 5.0, 'pt_mult': 0.5, 'sl_mult': 5.0, 'td_mins': 60}. Best is trial 207 with value: 2.9979644789811193.
[I 2026-03-12 01:55:51,381] Trial 378 finished with value: 2.9979644789811193 and parameters: {'timeframe': 'M8', 'atr_period': 13, 'atr_threshold': 5.0, 'pt_mult': 0.5, 'sl_mult': 5.0, 'td_mins': 60}. Best is trial 207 with value: 2.9979644789811193.
[I 2026-03-12 01:55:51,465] Trial 379 finished with value: 2.9979644789811193 and parameters: {'timeframe': 'M8', 'atr_period': 13, 'atr_threshold': 5.0, 'pt_mult': 0.5, 'sl_mult': 5.0, 'td_mins': 60}. Best is trial 207 with value: 2.9979644789811193.
[I 2026-03-12 01:55:51,549] Trial 380 finished with value: 2.9979644789811193 and parameters: {'timeframe': 'M8', 'atr_period': 13, 'atr_threshold': 5.0, 'pt_mult': 0.5, 'sl_mult': 5.0, 'td_mins': 60}. Best is trial 207 with value: 2.9979644789811193.
[I 2026-03-12 01:55:51,635] Trial 381 finished with value: 2.9979644789811193 and parameters: {'timeframe': 'M8', 'atr_period': 13, 'atr_threshold': 5.0, 'pt_mult': 0.5, 'sl_mult': 5.0, 'td_mins': 60}. Best is trial 207 with value: 2.9979644789811193.
[I 2026-03-12 01:55:51,739] Trial 382 finished with value: 2.9979644789811193 and parameters: {'timeframe': 'M8', 'atr_period': 13, 'atr_threshold': 5.0, 'pt_mult': 0.5, 'sl_mult': 5.0, 'td_mins': 60}. Best is trial 207 with value: 2.9979644789811193.
[I 2026-03-12 01:55:51,834] Trial 383 finished with value: 2.9979644789811193 and parameters: {'timeframe': 'M8', 'atr_period': 13, 'atr_threshold': 5.0, 'pt_mult': 0.5, 'sl_mult': 5.0, 'td_mins': 60}. Best is trial 207 with value: 2.9979644789811193.
[I 2026-03-12 01:55:51,932] Trial 384 finished with value: 2.9979644789811193 and parameters: {'timeframe': 'M8', 'atr_period': 13, 'atr_threshold': 5.0, 'pt_mult': 0.5, 'sl_mult': 5.0, 'td_mins': 60}. Best is trial 207 with value: 2.9979644789811193.
[I 2026-03-12 01:55:52,028] Trial 385 finished with value: 2.9979644789811193 and parameters: {'timeframe': 'M8', 'atr_period': 13, 'atr_threshold': 5.0, 'pt_mult': 0.5, 'sl_mult': 5.0, 'td_mins': 60}. Best is trial 207 with value: 2.9979644789811193.
[I 2026-03-12 01:55:52,123] Trial 386 finished with value: 2.9979644789811193 and parameters: {'timeframe': 'M8', 'atr_period': 13, 'atr_threshold': 5.0, 'pt_mult': 0.5, 'sl_mult': 5.0, 'td_mins': 60}. Best is trial 207 with value: 2.9979644789811193.
[I 2026-03-12 01:55:52,209] Trial 387 finished with value: 2.9979644789811193 and parameters: {'timeframe': 'M8', 'atr_period': 13, 'atr_threshold': 5.0, 'pt_mult': 0.5, 'sl_mult': 5.0, 'td_mins': 60}. Best is trial 207 with value: 2.9979644789811193.
[I 2026-03-12 01:55:52,294] Trial 388 finished with value: 2.9979644789811193 and parameters: {'timeframe': 'M8', 'atr_period': 13, 'atr_threshold': 5.0, 'pt_mult': 0.5, 'sl_mult': 5.0, 'td_mins': 60}. Best is trial 207 with value: 2.9979644789811193.
[I 2026-03-12 01:55:52,382] Trial 389 finished with value: 2.9979644789811193 and parameters: {'timeframe': 'M8', 'atr_period': 13, 'atr_threshold': 5.0, 'pt_mult': 0.5, 'sl_mult': 5.0, 'td_mins': 60}. Best is trial 207 with value: 2.9979644789811193.
[I 2026-03-12 01:55:52,434] Trial 390 pruned. 
[I 2026-03-12 01:55:52,504] Trial 391 finished with value: 2.4896042006737558 and parameters: {'timeframe': 'M8', 'atr_period': 13, 'atr_threshold': 5.0, 'pt_mult': 0.5, 'sl_mult': 5.0, 'td_mins': 30}. Best is trial 207 with value: 2.9979644789811193.
[I 2026-03-12 01:55:52,595] Trial 392 finished with value: 1.3391324017552748 and parameters: {'timeframe': 'M8', 'atr_period': 13, 'atr_threshold': 5.0, 'pt_mult': 2.5, 'sl_mult': 5.0, 'td_mins': 60}. Best is trial 207 with value: 2.9979644789811193.
[I 2026-03-12 01:55:52,658] Trial 393 finished with value: 1.6440747052362912 and parameters: {'timeframe': 'M8', 'atr_period': 13, 'atr_threshold': 5.0, 'pt_mult': 0.5, 'sl_mult': 5.0, 'td_mins': 15}. Best is trial 207 with value: 2.9979644789811193.
[I 2026-03-12 01:55:52,742] Trial 394 finished with value: 2.9979644789811193 and parameters: {'timeframe': 'M8', 'atr_period': 13, 'atr_threshold': 5.0, 'pt_mult': 0.5, 'sl_mult': 5.0, 'td_mins': 60}. Best is trial 207 with value: 2.9979644789811193.
[I 2026-03-12 01:55:53,094] Trial 395 finished with value: 1.5146017913734133 and parameters: {'timeframe': 'M8', 'atr_period': 13, 'atr_threshold': 5.0, 'pt_mult': 0.5, 'sl_mult': 5.0, 'td_mins': 720}. Best is trial 207 with value: 2.9979644789811193.
[I 2026-03-12 01:55:53,199] Trial 396 finished with value: 2.9979644789811193 and parameters: {'timeframe': 'M8', 'atr_period': 13, 'atr_threshold': 5.0, 'pt_mult': 0.5, 'sl_mult': 5.0, 'td_mins': 60}. Best is trial 207 with value: 2.9979644789811193.
[I 2026-03-12 01:55:53,284] Trial 397 pruned. 
[I 2026-03-12 01:55:53,398] Trial 398 finished with value: 3.484125427035651 and parameters: {'timeframe': 'M8', 'atr_period': 13, 'atr_threshold': 5.0, 'pt_mult': 0.5, 'sl_mult': 5.0, 'td_mins': 120}. Best is trial 398 with value: 3.484125427035651.
[I 2026-03-12 01:55:53,507] Trial 399 finished with value: 3.484125427035651 and parameters: {'timeframe': 'M8', 'atr_period': 13, 'atr_threshold': 5.0, 'pt_mult': 0.5, 'sl_mult': 5.0, 'td_mins': 120}. Best is trial 398 with value: 3.484125427035651.
[I 2026-03-12 01:55:53,830] Trial 400 finished with value: 2.252844823219391 and parameters: {'timeframe': 'M8', 'atr_period': 13, 'atr_threshold': 2.0, 'pt_mult': 0.5, 'sl_mult': 5.0, 'td_mins': 60}. Best is trial 398 with value: 3.484125427035651.
[I 2026-03-12 01:55:53,940] Trial 401 finished with value: 3.484125427035651 and parameters: {'timeframe': 'M8', 'atr_period': 13, 'atr_threshold': 5.0, 'pt_mult': 0.5, 'sl_mult': 5.0, 'td_mins': 120}. Best is trial 398 with value: 3.484125427035651.
[I 2026-03-12 01:55:54,049] Trial 402 finished with value: 3.484125427035651 and parameters: {'timeframe': 'M8', 'atr_period': 13, 'atr_threshold': 5.0, 'pt_mult': 0.5, 'sl_mult': 5.0, 'td_mins': 120}. Best is trial 398 with value: 3.484125427035651.
[I 2026-03-12 01:55:54,095] Trial 403 finished with value: 0.0 and parameters: {'timeframe': 'M8', 'atr_period': 13, 'atr_threshold': 10.0, 'pt_mult': 0.5, 'sl_mult': 5.0, 'td_mins': 120}. Best is trial 398 with value: 3.484125427035651.
[I 2026-03-12 01:55:54,150] Trial 404 pruned. 
[I 2026-03-12 01:55:54,302] Trial 405 finished with value: 3.484125427035651 and parameters: {'timeframe': 'M8', 'atr_period': 13, 'atr_threshold': 5.0, 'pt_mult': 0.5, 'sl_mult': 5.0, 'td_mins': 120}. Best is trial 398 with value: 3.484125427035651.
[I 2026-03-12 01:55:54,409] Trial 406 finished with value: 3.484125427035651 and parameters: {'timeframe': 'M8', 'atr_period': 13, 'atr_threshold': 5.0, 'pt_mult': 0.5, 'sl_mult': 5.0, 'td_mins': 120}. Best is trial 398 with value: 3.484125427035651.
[I 2026-03-12 01:55:54,516] Trial 407 finished with value: 3.484125427035651 and parameters: {'timeframe': 'M8', 'atr_period': 13, 'atr_threshold': 5.0, 'pt_mult': 0.5, 'sl_mult': 5.0, 'td_mins': 120}. Best is trial 398 with value: 3.484125427035651.
[I 2026-03-12 01:55:54,625] Trial 408 finished with value: 3.484125427035651 and parameters: {'timeframe': 'M8', 'atr_period': 13, 'atr_threshold': 5.0, 'pt_mult': 0.5, 'sl_mult': 5.0, 'td_mins': 120}. Best is trial 398 with value: 3.484125427035651.
[I 2026-03-12 01:55:54,732] Trial 409 finished with value: 3.484125427035651 and parameters: {'timeframe': 'M8', 'atr_period': 13, 'atr_threshold': 5.0, 'pt_mult': 0.5, 'sl_mult': 5.0, 'td_mins': 120}. Best is trial 398 with value: 3.484125427035651.
[I 2026-03-12 01:55:54,850] Trial 410 finished with value: 3.484125427035651 and parameters: {'timeframe': 'M8', 'atr_period': 13, 'atr_threshold': 5.0, 'pt_mult': 0.5, 'sl_mult': 5.0, 'td_mins': 120}. Best is trial 398 with value: 3.484125427035651.
[I 2026-03-12 01:55:54,956] Trial 411 finished with value: 3.484125427035651 and parameters: {'timeframe': 'M8', 'atr_period': 13, 'atr_threshold': 5.0, 'pt_mult': 0.5, 'sl_mult': 5.0, 'td_mins': 120}. Best is trial 398 with value: 3.484125427035651.
[I 2026-03-12 01:55:55,066] Trial 412 finished with value: 3.484125427035651 and parameters: {'timeframe': 'M8', 'atr_period': 13, 'atr_threshold': 5.0, 'pt_mult': 0.5, 'sl_mult': 5.0, 'td_mins': 120}. Best is trial 398 with value: 3.484125427035651.
[I 2026-03-12 01:55:55,175] Trial 413 finished with value: 3.484125427035651 and parameters: {'timeframe': 'M8', 'atr_period': 13, 'atr_threshold': 5.0, 'pt_mult': 0.5, 'sl_mult': 5.0, 'td_mins': 120}. Best is trial 398 with value: 3.484125427035651.
[I 2026-03-12 01:55:55,295] Trial 414 finished with value: 3.484125427035651 and parameters: {'timeframe': 'M8', 'atr_period': 13, 'atr_threshold': 5.0, 'pt_mult': 0.5, 'sl_mult': 5.0, 'td_mins': 120}. Best is trial 398 with value: 3.484125427035651.
[I 2026-03-12 01:55:55,405] Trial 415 finished with value: 3.484125427035651 and parameters: {'timeframe': 'M8', 'atr_period': 13, 'atr_threshold': 5.0, 'pt_mult': 0.5, 'sl_mult': 5.0, 'td_mins': 120}. Best is trial 398 with value: 3.484125427035651.
[I 2026-03-12 01:55:55,517] Trial 416 finished with value: 3.484125427035651 and parameters: {'timeframe': 'M8', 'atr_period': 13, 'atr_threshold': 5.0, 'pt_mult': 0.5, 'sl_mult': 5.0, 'td_mins': 120}. Best is trial 398 with value: 3.484125427035651.
[I 2026-03-12 01:55:55,624] Trial 417 finished with value: 3.484125427035651 and parameters: {'timeframe': 'M8', 'atr_period': 13, 'atr_threshold': 5.0, 'pt_mult': 0.5, 'sl_mult': 5.0, 'td_mins': 120}. Best is trial 398 with value: 3.484125427035651.
[I 2026-03-12 01:55:55,732] Trial 418 finished with value: 3.484125427035651 and parameters: {'timeframe': 'M8', 'atr_period': 13, 'atr_threshold': 5.0, 'pt_mult': 0.5, 'sl_mult': 5.0, 'td_mins': 120}. Best is trial 398 with value: 3.484125427035651.
[I 2026-03-12 01:55:55,838] Trial 419 finished with value: 3.484125427035651 and parameters: {'timeframe': 'M8', 'atr_period': 13, 'atr_threshold': 5.0, 'pt_mult': 0.5, 'sl_mult': 5.0, 'td_mins': 120}. Best is trial 398 with value: 3.484125427035651.
[I 2026-03-12 01:55:55,951] Trial 420 finished with value: 3.484125427035651 and parameters: {'timeframe': 'M8', 'atr_period': 13, 'atr_threshold': 5.0, 'pt_mult': 0.5, 'sl_mult': 5.0, 'td_mins': 120}. Best is trial 398 with value: 3.484125427035651.
[I 2026-03-12 01:55:56,059] Trial 421 finished with value: 3.484125427035651 and parameters: {'timeframe': 'M8', 'atr_period': 13, 'atr_threshold': 5.0, 'pt_mult': 0.5, 'sl_mult': 5.0, 'td_mins': 120}. Best is trial 398 with value: 3.484125427035651.
[I 2026-03-12 01:55:56,164] Trial 422 finished with value: 3.484125427035651 and parameters: {'timeframe': 'M8', 'atr_period': 13, 'atr_threshold': 5.0, 'pt_mult': 0.5, 'sl_mult': 5.0, 'td_mins': 120}. Best is trial 398 with value: 3.484125427035651.
[I 2026-03-12 01:55:56,279] Trial 423 finished with value: 3.484125427035651 and parameters: {'timeframe': 'M8', 'atr_period': 13, 'atr_threshold': 5.0, 'pt_mult': 0.5, 'sl_mult': 5.0, 'td_mins': 120}. Best is trial 398 with value: 3.484125427035651.
[I 2026-03-12 01:55:56,384] Trial 424 finished with value: 3.484125427035651 and parameters: {'timeframe': 'M8', 'atr_period': 13, 'atr_threshold': 5.0, 'pt_mult': 0.5, 'sl_mult': 5.0, 'td_mins': 120}. Best is trial 398 with value: 3.484125427035651.
[I 2026-03-12 01:55:56,492] Trial 425 finished with value: 3.484125427035651 and parameters: {'timeframe': 'M8', 'atr_period': 13, 'atr_threshold': 5.0, 'pt_mult': 0.5, 'sl_mult': 5.0, 'td_mins': 120}. Best is trial 398 with value: 3.484125427035651.
[I 2026-03-12 01:55:56,598] Trial 426 finished with value: 3.484125427035651 and parameters: {'timeframe': 'M8', 'atr_period': 13, 'atr_threshold': 5.0, 'pt_mult': 0.5, 'sl_mult': 5.0, 'td_mins': 120}. Best is trial 398 with value: 3.484125427035651.
[I 2026-03-12 01:55:56,650] Trial 427 pruned. 
[I 2026-03-12 01:55:57,024] Trial 428 pruned. 
[I 2026-03-12 01:55:57,084] Trial 429 pruned. 
[I 2026-03-12 01:55:57,140] Trial 430 finished with value: 0.0 and parameters: {'timeframe': 'M8', 'atr_period': 13, 'atr_threshold': 15.0, 'pt_mult': 0.5, 'sl_mult': 5.0, 'td_mins': 120}. Best is trial 398 with value: 3.484125427035651.
[I 2026-03-12 01:55:57,258] Trial 431 finished with value: 1.8479405007566938 and parameters: {'timeframe': 'M8', 'atr_period': 13, 'atr_threshold': 5.0, 'pt_mult': 2.5, 'sl_mult': 5.0, 'td_mins': 120}. Best is trial 398 with value: 3.484125427035651.
[I 2026-03-12 01:55:57,371] Trial 432 finished with value: 3.484125427035651 and parameters: {'timeframe': 'M8', 'atr_period': 13, 'atr_threshold': 5.0, 'pt_mult': 0.5, 'sl_mult': 5.0, 'td_mins': 120}. Best is trial 398 with value: 3.484125427035651.
[I 2026-03-12 01:55:57,887] Trial 433 finished with value: 1.9986353847356042 and parameters: {'timeframe': 'M8', 'atr_period': 13, 'atr_threshold': 2.0, 'pt_mult': 0.5, 'sl_mult': 5.0, 'td_mins': 120}. Best is trial 398 with value: 3.484125427035651.
[I 2026-03-12 01:55:58,455] Trial 434 pruned. 
[I 2026-03-12 01:55:58,610] Trial 435 finished with value: 3.484125427035651 and parameters: {'timeframe': 'M8', 'atr_period': 13, 'atr_threshold': 5.0, 'pt_mult': 0.5, 'sl_mult': 5.0, 'td_mins': 120}. Best is trial 398 with value: 3.484125427035651.
[I 2026-03-12 01:55:58,764] Trial 436 finished with value: 3.484125427035651 and parameters: {'timeframe': 'M8', 'atr_period': 13, 'atr_threshold': 5.0, 'pt_mult': 0.5, 'sl_mult': 5.0, 'td_mins': 120}. Best is trial 398 with value: 3.484125427035651.
[I 2026-03-12 01:55:58,920] Trial 437 finished with value: 2.7985173655325846 and parameters: {'timeframe': 'M8', 'atr_period': 13, 'atr_threshold': 5.0, 'pt_mult': 1.0, 'sl_mult': 5.0, 'td_mins': 120}. Best is trial 398 with value: 3.484125427035651.
[I 2026-03-12 01:55:58,980] Trial 438 finished with value: 0.0 and parameters: {'timeframe': 'M8', 'atr_period': 13, 'atr_threshold': 8.0, 'pt_mult': 0.5, 'sl_mult': 5.0, 'td_mins': 120}. Best is trial 398 with value: 3.484125427035651.
[I 2026-03-12 01:55:59,144] Trial 439 finished with value: 3.484125427035651 and parameters: {'timeframe': 'M8', 'atr_period': 13, 'atr_threshold': 5.0, 'pt_mult': 0.5, 'sl_mult': 5.0, 'td_mins': 120}. Best is trial 398 with value: 3.484125427035651.
[I 2026-03-12 01:55:59,353] Trial 440 finished with value: 3.484125427035651 and parameters: {'timeframe': 'M8', 'atr_period': 13, 'atr_threshold': 5.0, 'pt_mult': 0.5, 'sl_mult': 5.0, 'td_mins': 120}. Best is trial 398 with value: 3.484125427035651.
[I 2026-03-12 01:55:59,566] Trial 441 finished with value: 3.484125427035651 and parameters: {'timeframe': 'M8', 'atr_period': 13, 'atr_threshold': 5.0, 'pt_mult': 0.5, 'sl_mult': 5.0, 'td_mins': 120}. Best is trial 398 with value: 3.484125427035651.
[I 2026-03-12 01:55:59,729] Trial 442 finished with value: 3.484125427035651 and parameters: {'timeframe': 'M8', 'atr_period': 13, 'atr_threshold': 5.0, 'pt_mult': 0.5, 'sl_mult': 5.0, 'td_mins': 120}. Best is trial 398 with value: 3.484125427035651.
[I 2026-03-12 01:55:59,791] Trial 443 pruned. 
[I 2026-03-12 01:56:00,250] Trial 444 pruned. 
[I 2026-03-12 01:56:00,317] Trial 445 pruned. 
[I 2026-03-12 01:56:00,369] Trial 446 finished with value: 0.0 and parameters: {'timeframe': 'M8', 'atr_period': 13, 'atr_threshold': 8.0, 'pt_mult': 0.5, 'sl_mult': 2.5, 'td_mins': 120}. Best is trial 398 with value: 3.484125427035651.
[I 2026-03-12 01:56:00,498] Trial 447 finished with value: 3.484125427035651 and parameters: {'timeframe': 'M8', 'atr_period': 13, 'atr_threshold': 5.0, 'pt_mult': 0.5, 'sl_mult': 5.0, 'td_mins': 120}. Best is trial 398 with value: 3.484125427035651.
[I 2026-03-12 01:56:00,618] Trial 448 finished with value: 3.484125427035651 and parameters: {'timeframe': 'M8', 'atr_period': 13, 'atr_threshold': 5.0, 'pt_mult': 0.5, 'sl_mult': 5.0, 'td_mins': 120}. Best is trial 398 with value: 3.484125427035651.
[I 2026-03-12 01:56:00,704] Trial 449 pruned. 
[I 2026-03-12 01:56:00,757] Trial 450 finished with value: 0.0 and parameters: {'timeframe': 'M8', 'atr_period': 13, 'atr_threshold': 10.0, 'pt_mult': 0.5, 'sl_mult': 5.0, 'td_mins': 1080}. Best is trial 398 with value: 3.484125427035651.
[I 2026-03-12 01:56:00,804] Trial 451 finished with value: 0.0 and parameters: {'timeframe': 'M8', 'atr_period': 13, 'atr_threshold': 15.0, 'pt_mult': 0.5, 'sl_mult': 5.0, 'td_mins': 5}. Best is trial 398 with value: 3.484125427035651.
[I 2026-03-12 01:56:00,961] Trial 452 pruned. 
[I 2026-03-12 01:56:01,043] Trial 453 pruned. 
[I 2026-03-12 01:56:01,162] Trial 454 finished with value: 3.484125427035651 and parameters: {'timeframe': 'M8', 'atr_period': 13, 'atr_threshold': 5.0, 'pt_mult': 0.5, 'sl_mult': 5.0, 'td_mins': 120}. Best is trial 398 with value: 3.484125427035651.
[I 2026-03-12 01:56:01,219] Trial 455 pruned. 
[I 2026-03-12 01:56:01,341] Trial 456 finished with value: 3.484125427035651 and parameters: {'timeframe': 'M8', 'atr_period': 13, 'atr_threshold': 5.0, 'pt_mult': 0.5, 'sl_mult': 5.0, 'td_mins': 120}. Best is trial 398 with value: 3.484125427035651.
[I 2026-03-12 01:56:01,393] Trial 457 pruned. 
[I 2026-03-12 01:56:02,095] Trial 458 finished with value: 1.3702600871846264 and parameters: {'timeframe': 'M8', 'atr_period': 13, 'atr_threshold': 5.0, 'pt_mult': 5.0, 'sl_mult': 5.0, 'td_mins': 1080}. Best is trial 398 with value: 3.484125427035651.
[I 2026-03-12 01:56:02,154] Trial 459 pruned. 
[I 2026-03-12 01:56:02,207] Trial 460 finished with value: 0.0 and parameters: {'timeframe': 'M8', 'atr_period': 13, 'atr_threshold': 15.0, 'pt_mult': 2.5, 'sl_mult': 5.0, 'td_mins': 120}. Best is trial 398 with value: 3.484125427035651.
[I 2026-03-12 01:56:02,301] Trial 461 pruned. 
[I 2026-03-12 01:56:02,352] Trial 462 pruned. 
[I 2026-03-12 01:56:02,402] Trial 463 pruned. 
[I 2026-03-12 01:56:02,457] Trial 464 pruned. 
[I 2026-03-12 01:56:02,568] Trial 465 finished with value: 3.484125427035651 and parameters: {'timeframe': 'M8', 'atr_period': 13, 'atr_threshold': 5.0, 'pt_mult': 0.5, 'sl_mult': 5.0, 'td_mins': 120}. Best is trial 398 with value: 3.484125427035651.
[I 2026-03-12 01:56:02,676] Trial 466 finished with value: 3.484125427035651 and parameters: {'timeframe': 'M8', 'atr_period': 13, 'atr_threshold': 5.0, 'pt_mult': 0.5, 'sl_mult': 5.0, 'td_mins': 120}. Best is trial 398 with value: 3.484125427035651.
[I 2026-03-12 01:56:04,094] Trial 467 pruned. 
[I 2026-03-12 01:56:04,310] Trial 468 pruned. 
[I 2026-03-12 01:56:04,382] Trial 469 pruned. 
[I 2026-03-12 01:56:04,605] Trial 470 finished with value: 1.4967331369168109 and parameters: {'timeframe': 'M8', 'atr_period': 13, 'atr_threshold': 5.0, 'pt_mult': 0.5, 'sl_mult': 5.0, 'td_mins': 360}. Best is trial 398 with value: 3.484125427035651.
[I 2026-03-12 01:56:05,491] Trial 471 pruned. 
[I 2026-03-12 01:56:05,673] Trial 472 pruned. 
[I 2026-03-12 01:56:05,729] Trial 473 pruned. 
[I 2026-03-12 01:56:05,783] Trial 474 pruned. 
[I 2026-03-12 01:56:05,835] Trial 475 pruned. 
[I 2026-03-12 01:56:05,889] Trial 476 pruned. 
[I 2026-03-12 01:56:05,946] Trial 477 pruned. 
[I 2026-03-12 01:56:06,557] Trial 478 finished with value: 1.6322274230889722 and parameters: {'timeframe': 'M8', 'atr_period': 13, 'atr_threshold': 5.0, 'pt_mult': 2.5, 'sl_mult': 5.0, 'td_mins': 1200}. Best is trial 398 with value: 3.484125427035651.
[I 2026-03-12 01:56:06,656] Trial 479 pruned. 
[I 2026-03-12 01:56:06,711] Trial 480 finished with value: 0.0 and parameters: {'timeframe': 'M8', 'atr_period': 13, 'atr_threshold': 8.0, 'pt_mult': 2.5, 'sl_mult': 5.0, 'td_mins': 120}. Best is trial 398 with value: 3.484125427035651.
[I 2026-03-12 01:56:06,834] Trial 481 finished with value: 3.484125427035651 and parameters: {'timeframe': 'M8', 'atr_period': 13, 'atr_threshold': 5.0, 'pt_mult': 0.5, 'sl_mult': 5.0, 'td_mins': 120}. Best is trial 398 with value: 3.484125427035651.
[I 2026-03-12 01:56:06,939] Trial 482 pruned. 
[I 2026-03-12 01:56:07,076] Trial 483 finished with value: 3.484125427035651 and parameters: {'timeframe': 'M8', 'atr_period': 13, 'atr_threshold': 5.0, 'pt_mult': 0.5, 'sl_mult': 5.0, 'td_mins': 120}. Best is trial 398 with value: 3.484125427035651.
[I 2026-03-12 01:56:07,363] Trial 484 pruned. 
[I 2026-03-12 01:56:07,416] Trial 485 pruned. 
[I 2026-03-12 01:56:07,470] Trial 486 pruned. 
