[I 2026-03-12 01:55:15,123] Trial 279 finished with value: 1.1455757525932313 and parameters: {'timeframe': 'M8', 'atr_period': 13, 'atr_threshold': 2.0, 'pt_mult': 0.5, 'sl_mult': 2.5, 'td_mins': 15}. Best is trial 207 with value: 2.9979644789811193.
[I 2026-03-12 01:55:19,972] Trial 280 finished with value: 0.9714855076879815 and parameters: {'timeframe': 'M8', 'atr_period': 13, 'atr_threshold': 0.5, 'pt_mult': 0.5, 'sl_mult': 5.0, 'td_mins': 1080}. Best is trial 207 with value: 2.9979644789811193.
[I 2026-03-12 01:55:20,017] Trial 281 finished with value: 0.0 and parameters: {'timeframe': 'M8', 'atr_period': 13, 'atr_threshold': 10.0, 'pt_mult': 0.5, 'sl_mult': 5.0, 'td_mins': 30}. Best is trial 207 with value: 2.9979644789811193.
[I 2026-03-12 01:55:23,316] Trial 282 finished with value: 1.0775117935311926 and parameters: {'timeframe': 'M8', 'atr_period': 13, 'atr_threshold': 1.0, 'pt_mult': 0.5, 'sl_mult': 5.0, 'td_mins': 720}. Best is trial 207 with value: 2.9979644789811193.
[I 2026-03-12 01:55:23,367] Trial 283 finished with value: 0.0 and parameters: {'timeframe': 'M8', 'atr_period': 13, 'atr_threshold': 15.0, 'pt_mult': 1.0, 'sl_mult': 1.0, 'td_mins': 180}. Best is trial 207 with value: 2.9979644789811193.
[I 2026-03-12 01:55:23,446] Trial 284 finished with value: 0.9961784883138138 and parameters: {'timeframe': 'M8', 'atr_period': 13, 'atr_threshold': 5.0, 'pt_mult': 1.0, 'sl_mult': 5.0, 'td_mins': 15}. Best is trial 207 with value: 2.9979644789811193.
[I 2026-03-12 01:55:23,565] Trial 285 pruned. 
[I 2026-03-12 01:55:30,063] Trial 286 finished with value: 0.9912004261914735 and parameters: {'timeframe': 'M8', 'atr_period': 13, 'atr_threshold': 1.0, 'pt_mult': 2.5, 'sl_mult': 5.0, 'td_mins': 1080}. Best is trial 207 with value: 2.9979644789811193.
[I 2026-03-12 01:55:30,133] Trial 287 pruned. 
[I 2026-03-12 01:55:30,179] Trial 288 finished with value: 0.0 and parameters: {'timeframe': 'M8', 'atr_period': 13, 'atr_threshold': 8.0, 'pt_mult': 5.0, 'sl_mult': 2.5, 'td_mins': 360}. Best is trial 207 with value: 2.9979644789811193.
[I 2026-03-12 01:55:30,222] Trial 289 finished with value: 0.0 and parameters: {'timeframe': 'M8', 'atr_period': 13, 'atr_threshold': 8.0, 'pt_mult': 0.5, 'sl_mult': 0.5, 'td_mins': 1080}. Best is trial 207 with value: 2.9979644789811193.
[I 2026-03-12 01:55:30,267] Trial 290 finished with value: 0.0 and parameters: {'timeframe': 'M8', 'atr_period': 13, 'atr_threshold': 10.0, 'pt_mult': 1.0, 'sl_mult': 5.0, 'td_mins': 1080}. Best is trial 207 with value: 2.9979644789811193.
[I 2026-03-12 01:55:30,310] Trial 291 finished with value: 0.0 and parameters: {'timeframe': 'M8', 'atr_period': 13, 'atr_threshold': 10.0, 'pt_mult': 2.5, 'sl_mult': 0.5, 'td_mins': 180}. Best is trial 207 with value: 2.9979644789811193.
[I 2026-03-12 01:55:30,354] Trial 292 finished with value: 0.0 and parameters: {'timeframe': 'M8', 'atr_period': 13, 'atr_threshold': 10.0, 'pt_mult': 2.5, 'sl_mult': 1.0, 'td_mins': 15}. Best is trial 207 with value: 2.9979644789811193.
[I 2026-03-12 01:55:35,656] Trial 293 finished with value: 0.938707894060658 and parameters: {'timeframe': 'M8', 'atr_period': 13, 'atr_threshold': 2.0, 'pt_mult': 5.0, 'sl_mult': 5.0, 'td_mins': 1200}. Best is trial 207 with value: 2.9979644789811193.
[I 2026-03-12 01:55:35,701] Trial 294 finished with value: 0.0 and parameters: {'timeframe': 'M8', 'atr_period': 13, 'atr_threshold': 8.0, 'pt_mult': 0.5, 'sl_mult': 5.0, 'td_mins': 15}. Best is trial 207 with value: 2.9979644789811193.
[I 2026-03-12 01:55:35,790] Trial 295 finished with value: 0.660100170702666 and parameters: {'timeframe': 'M8', 'atr_period': 13, 'atr_threshold': 5.0, 'pt_mult': 5.0, 'sl_mult': 5.0, 'td_mins': 60}. Best is trial 207 with value: 2.9979644789811193.
[I 2026-03-12 01:55:35,835] Trial 296 finished with value: 0.0 and parameters: {'timeframe': 'M8', 'atr_period': 13, 'atr_threshold': 8.0, 'pt_mult': 0.5, 'sl_mult': 0.5, 'td_mins': 180}. Best is trial 207 with value: 2.9979644789811193.
[I 2026-03-12 01:55:36,022] Trial 297 pruned. 
[I 2026-03-12 01:55:36,130] Trial 298 pruned. 
[I 2026-03-12 01:55:36,175] Trial 299 finished with value: 0.0 and parameters: {'timeframe': 'M8', 'atr_period': 13, 'atr_threshold': 8.0, 'pt_mult': 2.5, 'sl_mult': 2.5, 'td_mins': 15}. Best is trial 207 with value: 2.9979644789811193.
[I 2026-03-12 01:55:36,649] Trial 300 finished with value: 1.304014584796703 and parameters: {'timeframe': 'M8', 'atr_period': 13, 'atr_threshold': 5.0, 'pt_mult': 0.5, 'sl_mult': 5.0, 'td_mins': 1200}. Best is trial 207 with value: 2.9979644789811193.
[I 2026-03-12 01:55:36,994] Trial 301 finished with value: 1.8200930227480356 and parameters: {'timeframe': 'M8', 'atr_period': 13, 'atr_threshold': 2.0, 'pt_mult': 1.0, 'sl_mult': 5.0, 'td_mins': 60}. Best is trial 207 with value: 2.9979644789811193.
[I 2026-03-12 01:55:37,494] Trial 302 finished with value: 1.304014584796703 and parameters: {'timeframe': 'M8', 'atr_period': 13, 'atr_threshold': 5.0, 'pt_mult': 0.5, 'sl_mult': 5.0, 'td_mins': 1200}. Best is trial 207 with value: 2.9979644789811193.
[I 2026-03-12 01:55:37,822] Trial 303 finished with value: 1.8200930227480356 and parameters: {'timeframe': 'M8', 'atr_period': 13, 'atr_threshold': 2.0, 'pt_mult': 1.0, 'sl_mult': 5.0, 'td_mins': 60}. Best is trial 207 with value: 2.9979644789811193.
[I 2026-03-12 01:55:38,140] Trial 304 finished with value: 1.8200930227480356 and parameters: {'timeframe': 'M8', 'atr_period': 13, 'atr_threshold': 2.0, 'pt_mult': 1.0, 'sl_mult': 5.0, 'td_mins': 60}. Best is trial 207 with value: 2.9979644789811193.
[I 2026-03-12 01:55:38,275] Trial 305 finished with value: 2.529776658950818 and parameters: {'timeframe': 'M8', 'atr_period': 13, 'atr_threshold': 5.0, 'pt_mult': 1.0, 'sl_mult': 5.0, 'td_mins': 180}. Best is trial 207 with value: 2.9979644789811193.
[I 2026-03-12 01:55:38,604] Trial 306 finished with value: 1.8200930227480356 and parameters: {'timeframe': 'M8', 'atr_period': 13, 'atr_threshold': 2.0, 'pt_mult': 1.0, 'sl_mult': 5.0, 'td_mins': 60}. Best is trial 207 with value: 2.9979644789811193.
[I 2026-03-12 01:55:38,920] Trial 307 finished with value: 1.8200930227480356 and parameters: {'timeframe': 'M8', 'atr_period': 13, 'atr_threshold': 2.0, 'pt_mult': 1.0, 'sl_mult': 5.0, 'td_mins': 60}. Best is trial 207 with value: 2.9979644789811193.
[I 2026-03-12 01:55:39,322] Trial 308 finished with value: 1.8200930227480356 and parameters: {'timeframe': 'M8', 'atr_period': 13, 'atr_threshold': 2.0, 'pt_mult': 1.0, 'sl_mult': 5.0, 'td_mins': 60}. Best is trial 207 with value: 2.9979644789811193.
[I 2026-03-12 01:55:39,647] Trial 309 finished with value: 1.8200930227480356 and parameters: {'timeframe': 'M8', 'atr_period': 13, 'atr_threshold': 2.0, 'pt_mult': 1.0, 'sl_mult': 5.0, 'td_mins': 60}. Best is trial 207 with value: 2.9979644789811193.
[I 2026-03-12 01:55:39,968] Trial 310 finished with value: 1.8200930227480356 and parameters: {'timeframe': 'M8', 'atr_period': 13, 'atr_threshold': 2.0, 'pt_mult': 1.0, 'sl_mult': 5.0, 'td_mins': 60}. Best is trial 207 with value: 2.9979644789811193.
[I 2026-03-12 01:55:40,284] Trial 311 finished with value: 1.8200930227480356 and parameters: {'timeframe': 'M8', 'atr_period': 13, 'atr_threshold': 2.0, 'pt_mult': 1.0, 'sl_mult': 5.0, 'td_mins': 60}. Best is trial 207 with value: 2.9979644789811193.
[I 2026-03-12 01:55:40,632] Trial 312 finished with value: 1.8200930227480356 and parameters: {'timeframe': 'M8', 'atr_period': 13, 'atr_threshold': 2.0, 'pt_mult': 1.0, 'sl_mult': 5.0, 'td_mins': 60}. Best is trial 207 with value: 2.9979644789811193.
[I 2026-03-12 01:55:40,973] Trial 313 finished with value: 1.8200930227480356 and parameters: {'timeframe': 'M8', 'atr_period': 13, 'atr_threshold': 2.0, 'pt_mult': 1.0, 'sl_mult': 5.0, 'td_mins': 60}. Best is trial 207 with value: 2.9979644789811193.
[I 2026-03-12 01:55:41,304] Trial 314 finished with value: 1.8200930227480356 and parameters: {'timeframe': 'M8', 'atr_period': 13, 'atr_threshold': 2.0, 'pt_mult': 1.0, 'sl_mult': 5.0, 'td_mins': 60}. Best is trial 207 with value: 2.9979644789811193.
[I 2026-03-12 01:55:41,626] Trial 315 finished with value: 1.8200930227480356 and parameters: {'timeframe': 'M8', 'atr_period': 13, 'atr_threshold': 2.0, 'pt_mult': 1.0, 'sl_mult': 5.0, 'td_mins': 60}. Best is trial 207 with value: 2.9979644789811193.
[I 2026-03-12 01:55:41,963] Trial 316 finished with value: 1.8200930227480356 and parameters: {'timeframe': 'M8', 'atr_period': 13, 'atr_threshold': 2.0, 'pt_mult': 1.0, 'sl_mult': 5.0, 'td_mins': 60}. Best is trial 207 with value: 2.9979644789811193.
[I 2026-03-12 01:55:42,325] Trial 317 finished with value: 1.8200930227480356 and parameters: {'timeframe': 'M8', 'atr_period': 13, 'atr_threshold': 2.0, 'pt_mult': 1.0, 'sl_mult': 5.0, 'td_mins': 60}. Best is trial 207 with value: 2.9979644789811193.
[I 2026-03-12 01:55:42,641] Trial 318 finished with value: 1.8200930227480356 and parameters: {'timeframe': 'M8', 'atr_period': 13, 'atr_threshold': 2.0, 'pt_mult': 1.0, 'sl_mult': 5.0, 'td_mins': 60}. Best is trial 207 with value: 2.9979644789811193.
[I 2026-03-12 01:55:42,774] Trial 319 finished with value: 2.529776658950818 and parameters: {'timeframe': 'M8', 'atr_period': 13, 'atr_threshold': 5.0, 'pt_mult': 1.0, 'sl_mult': 5.0, 'td_mins': 180}. Best is trial 207 with value: 2.9979644789811193.
[I 2026-03-12 01:55:42,950] Trial 320 finished with value: 2.8319342647562786 and parameters: {'timeframe': 'M8', 'atr_period': 13, 'atr_threshold': 3.0, 'pt_mult': 0.5, 'sl_mult': 5.0, 'td_mins': 60}. Best is trial 207 with value: 2.9979644789811193.
[I 2026-03-12 01:55:43,073] Trial 321 finished with value: 2.529776658950818 and parameters: {'timeframe': 'M8', 'atr_period': 13, 'atr_threshold': 5.0, 'pt_mult': 1.0, 'sl_mult': 5.0, 'td_mins': 180}. Best is trial 207 with value: 2.9979644789811193.
[I 2026-03-12 01:55:43,205] Trial 322 finished with value: 2.529776658950818 and parameters: {'timeframe': 'M8', 'atr_period': 13, 'atr_threshold': 5.0, 'pt_mult': 1.0, 'sl_mult': 5.0, 'td_mins': 180}. Best is trial 207 with value: 2.9979644789811193.
[I 2026-03-12 01:55:43,348] Trial 323 finished with value: 2.529776658950818 and parameters: {'timeframe': 'M8', 'atr_period': 13, 'atr_threshold': 5.0, 'pt_mult': 1.0, 'sl_mult': 5.0, 'td_mins': 180}. Best is trial 207 with value: 2.9979644789811193.
[I 2026-03-12 01:55:43,482] Trial 324 finished with value: 2.529776658950818 and parameters: {'timeframe': 'M8', 'atr_period': 13, 'atr_threshold': 5.0, 'pt_mult': 1.0, 'sl_mult': 5.0, 'td_mins': 180}. Best is trial 207 with value: 2.9979644789811193.
[I 2026-03-12 01:55:43,613] Trial 325 finished with value: 2.529776658950818 and parameters: {'timeframe': 'M8', 'atr_period': 13, 'atr_threshold': 5.0, 'pt_mult': 1.0, 'sl_mult': 5.0, 'td_mins': 180}. Best is trial 207 with value: 2.9979644789811193.
[I 2026-03-12 01:55:43,751] Trial 326 finished with value: 2.529776658950818 and parameters: {'timeframe': 'M8', 'atr_period': 13, 'atr_threshold': 5.0, 'pt_mult': 1.0, 'sl_mult': 5.0, 'td_mins': 180}. Best is trial 207 with value: 2.9979644789811193.
[I 2026-03-12 01:55:43,891] Trial 327 finished with value: 2.529776658950818 and parameters: {'timeframe': 'M8', 'atr_period': 13, 'atr_threshold': 5.0, 'pt_mult': 1.0, 'sl_mult': 5.0, 'td_mins': 180}. Best is trial 207 with value: 2.9979644789811193.
[I 2026-03-12 01:55:44,020] Trial 328 finished with value: 2.529776658950818 and parameters: {'timeframe': 'M8', 'atr_period': 13, 'atr_threshold': 5.0, 'pt_mult': 1.0, 'sl_mult': 5.0, 'td_mins': 180}. Best is trial 207 with value: 2.9979644789811193.
[I 2026-03-12 01:55:44,152] Trial 329 finished with value: 2.529776658950818 and parameters: {'timeframe': 'M8', 'atr_period': 13, 'atr_threshold': 5.0, 'pt_mult': 1.0, 'sl_mult': 5.0, 'td_mins': 180}. Best is trial 207 with value: 2.9979644789811193.
[I 2026-03-12 01:55:44,285] Trial 330 finished with value: 2.529776658950818 and parameters: {'timeframe': 'M8', 'atr_period': 13, 'atr_threshold': 5.0, 'pt_mult': 1.0, 'sl_mult': 5.0, 'td_mins': 180}. Best is trial 207 with value: 2.9979644789811193.
[I 2026-03-12 01:55:44,447] Trial 331 finished with value: 2.529776658950818 and parameters: {'timeframe': 'M8', 'atr_period': 13, 'atr_threshold': 5.0, 'pt_mult': 1.0, 'sl_mult': 5.0, 'td_mins': 180}. Best is trial 207 with value: 2.9979644789811193.
[I 2026-03-12 01:55:44,587] Trial 332 finished with value: 2.529776658950818 and parameters: {'timeframe': 'M8', 'atr_period': 13, 'atr_threshold': 5.0, 'pt_mult': 1.0, 'sl_mult': 5.0, 'td_mins': 180}. Best is trial 207 with value: 2.9979644789811193.
[I 2026-03-12 01:55:44,726] Trial 333 finished with value: 2.529776658950818 and parameters: {'timeframe': 'M8', 'atr_period': 13, 'atr_threshold': 5.0, 'pt_mult': 1.0, 'sl_mult': 5.0, 'td_mins': 180}. Best is trial 207 with value: 2.9979644789811193.
[I 2026-03-12 01:55:44,856] Trial 334 finished with value: 2.529776658950818 and parameters: {'timeframe': 'M8', 'atr_period': 13, 'atr_threshold': 5.0, 'pt_mult': 1.0, 'sl_mult': 5.0, 'td_mins': 180}. Best is trial 207 with value: 2.9979644789811193.
[I 2026-03-12 01:55:44,990] Trial 335 finished with value: 2.529776658950818 and parameters: {'timeframe': 'M8', 'atr_period': 13, 'atr_threshold': 5.0, 'pt_mult': 1.0, 'sl_mult': 5.0, 'td_mins': 180}. Best is trial 207 with value: 2.9979644789811193.
[I 2026-03-12 01:55:45,122] Trial 336 finished with value: 2.529776658950818 and parameters: {'timeframe': 'M8', 'atr_period': 13, 'atr_threshold': 5.0, 'pt_mult': 1.0, 'sl_mult': 5.0, 'td_mins': 180}. Best is trial 207 with value: 2.9979644789811193.
[I 2026-03-12 01:55:45,263] Trial 337 finished with value: 2.529776658950818 and parameters: {'timeframe': 'M8', 'atr_period': 13, 'atr_threshold': 5.0, 'pt_mult': 1.0, 'sl_mult': 5.0, 'td_mins': 180}. Best is trial 207 with value: 2.9979644789811193.
[I 2026-03-12 01:55:45,397] Trial 338 finished with value: 2.529776658950818 and parameters: {'timeframe': 'M8', 'atr_period': 13, 'atr_threshold': 5.0, 'pt_mult': 1.0, 'sl_mult': 5.0, 'td_mins': 180}. Best is trial 207 with value: 2.9979644789811193.
[I 2026-03-12 01:55:45,525] Trial 339 finished with value: 2.529776658950818 and parameters: {'timeframe': 'M8', 'atr_period': 13, 'atr_threshold': 5.0, 'pt_mult': 1.0, 'sl_mult': 5.0, 'td_mins': 180}. Best is trial 207 with value: 2.9979644789811193.
[I 2026-03-12 01:55:45,577] Trial 340 pruned. 
[I 2026-03-12 01:55:45,753] Trial 341 finished with value: 2.8319342647562786 and parameters: {'timeframe': 'M8', 'atr_period': 13, 'atr_threshold': 3.0, 'pt_mult': 0.5, 'sl_mult': 5.0, 'td_mins': 60}. Best is trial 207 with value: 2.9979644789811193.
[I 2026-03-12 01:55:45,931] Trial 342 finished with value: 2.8319342647562786 and parameters: {'timeframe': 'M8', 'atr_period': 13, 'atr_threshold': 3.0, 'pt_mult': 0.5, 'sl_mult': 5.0, 'td_mins': 60}. Best is trial 207 with value: 2.9979644789811193.
[I 2026-03-12 01:55:46,131] Trial 343 finished with value: 2.8319342647562786 and parameters: {'timeframe': 'M8', 'atr_period': 13, 'atr_threshold': 3.0, 'pt_mult': 0.5, 'sl_mult': 5.0, 'td_mins': 60}. Best is trial 207 with value: 2.9979644789811193.
[I 2026-03-12 01:55:46,344] Trial 344 finished with value: 2.8319342647562786 and parameters: {'timeframe': 'M8', 'atr_period': 13, 'atr_threshold': 3.0, 'pt_mult': 0.5, 'sl_mult': 5.0, 'td_mins': 60}. Best is trial 207 with value: 2.9979644789811193.
[I 2026-03-12 01:55:46,540] Trial 345 finished with value: 2.8319342647562786 and parameters: {'timeframe': 'M8', 'atr_period': 13, 'atr_threshold': 3.0, 'pt_mult': 0.5, 'sl_mult': 5.0, 'td_mins': 60}. Best is trial 207 with value: 2.9979644789811193.
[I 2026-03-12 01:55:46,733] Trial 346 finished with value: 2.8319342647562786 and parameters: {'timeframe': 'M8', 'atr_period': 13, 'atr_threshold': 3.0, 'pt_mult': 0.5, 'sl_mult': 5.0, 'td_mins': 60}. Best is trial 207 with value: 2.9979644789811193.
[I 2026-03-12 01:55:46,954] Trial 347 finished with value: 2.8319342647562786 and parameters: {'timeframe': 'M8', 'atr_period': 13, 'atr_threshold': 3.0, 'pt_mult': 0.5, 'sl_mult': 5.0, 'td_mins': 60}. Best is trial 207 with value: 2.9979644789811193.
[I 2026-03-12 01:55:47,171] Trial 348 finished with value: 2.8319342647562786 and parameters: {'timeframe': 'M8', 'atr_period': 13, 'atr_threshold': 3.0, 'pt_mult': 0.5, 'sl_mult': 5.0, 'td_mins': 60}. Best is trial 207 with value: 2.9979644789811193.
[I 2026-03-12 01:55:47,379] Trial 349 finished with value: 2.8319342647562786 and parameters: {'timeframe': 'M8', 'atr_period': 13, 'atr_threshold': 3.0, 'pt_mult': 0.5, 'sl_mult': 5.0, 'td_mins': 60}. Best is trial 207 with value: 2.9979644789811193.
[I 2026-03-12 01:55:47,584] Trial 350 finished with value: 2.8319342647562786 and parameters: {'timeframe': 'M8', 'atr_period': 13, 'atr_threshold': 3.0, 'pt_mult': 0.5, 'sl_mult': 5.0, 'td_mins': 60}. Best is trial 207 with value: 2.9979644789811193.
[I 2026-03-12 01:55:47,780] Trial 351 finished with value: 2.8319342647562786 and parameters: {'timeframe': 'M8', 'atr_period': 13, 'atr_threshold': 3.0, 'pt_mult': 0.5, 'sl_mult': 5.0, 'td_mins': 60}. Best is trial 207 with value: 2.9979644789811193.
[I 2026-03-12 01:55:47,983] Trial 352 finished with value: 2.8319342647562786 and parameters: {'timeframe': 'M8', 'atr_period': 13, 'atr_threshold': 3.0, 'pt_mult': 0.5, 'sl_mult': 5.0, 'td_mins': 60}. Best is trial 207 with value: 2.9979644789811193.
[I 2026-03-12 01:55:48,194] Trial 353 finished with value: 2.8319342647562786 and parameters: {'timeframe': 'M8', 'atr_period': 13, 'atr_threshold': 3.0, 'pt_mult': 0.5, 'sl_mult': 5.0, 'td_mins': 60}. Best is trial 207 with value: 2.9979644789811193.
[I 2026-03-12 01:55:48,401] Trial 354 finished with value: 2.8319342647562786 and parameters: {'timeframe': 'M8', 'atr_period': 13, 'atr_threshold': 3.0, 'pt_mult': 0.5, 'sl_mult': 5.0, 'td_mins': 60}. Best is trial 207 with value: 2.9979644789811193.
[I 2026-03-12 01:55:48,604] Trial 355 finished with value: 2.8319342647562786 and parameters: {'timeframe': 'M8', 'atr_period': 13, 'atr_threshold': 3.0, 'pt_mult': 0.5, 'sl_mult': 5.0, 'td_mins': 60}. Best is trial 207 with value: 2.9979644789811193.
[I 2026-03-12 01:55:48,784] Trial 356 finished with value: 2.8319342647562786 and parameters: {'timeframe': 'M8', 'atr_period': 13, 'atr_threshold': 3.0, 'pt_mult': 0.5, 'sl_mult': 5.0, 'td_mins': 60}. Best is trial 207 with value: 2.9979644789811193.
[I 2026-03-12 01:55:48,953] Trial 357 finished with value: 2.8319342647562786 and parameters: {'timeframe': 'M8', 'atr_period': 13, 'atr_threshold': 3.0, 'pt_mult': 0.5, 'sl_mult': 5.0, 'td_mins': 60}. Best is trial 207 with value: 2.9979644789811193.
[I 2026-03-12 01:55:49,144] Trial 358 finished with value: 2.8319342647562786 and parameters: {'timeframe': 'M8', 'atr_period': 13, 'atr_threshold': 3.0, 'pt_mult': 0.5, 'sl_mult': 5.0, 'td_mins': 60}. Best is trial 207 with value: 2.9979644789811193.
[I 2026-03-12 01:55:49,318] Trial 359 finished with value: 2.8319342647562786 and parameters: {'timeframe': 'M8', 'atr_period': 13, 'atr_threshold': 3.0, 'pt_mult': 0.5, 'sl_mult': 5.0, 'td_mins': 60}. Best is trial 207 with value: 2.9979644789811193.
[I 2026-03-12 01:55:49,494] Trial 360 finished with value: 2.8319342647562786 and parameters: {'timeframe': 'M8', 'atr_period': 13, 'atr_threshold': 3.0, 'pt_mult': 0.5, 'sl_mult': 5.0, 'td_mins': 60}. Best is trial 207 with value: 2.9979644789811193.
[I 2026-03-12 01:55:49,669] Trial 361 finished with value: 2.8319342647562786 and parameters: {'timeframe': 'M8', 'atr_period': 13, 'atr_threshold': 3.0, 'pt_mult': 0.5, 'sl_mult': 5.0, 'td_mins': 60}. Best is trial 207 with value: 2.9979644789811193.
[I 2026-03-12 01:55:49,841] Trial 362 finished with value: 2.8319342647562786 and parameters: {'timeframe': 'M8', 'atr_period': 13, 'atr_threshold': 3.0, 'pt_mult': 0.5, 'sl_mult': 5.0, 'td_mins': 60}. Best is trial 207 with value: 2.9979644789811193.
[I 2026-03-12 01:55:50,104] Trial 363 finished with value: 2.5123680363096774 and parameters: {'timeframe': 'M8', 'atr_period': 13, 'atr_threshold': 3.0, 'pt_mult': 0.5, 'sl_mult': 5.0, 'td_mins': 120}. Best is trial 207 with value: 2.9979644789811193.
[I 2026-03-12 01:55:50,189] Trial 364 finished with value: 2.9979644789811193 and parameters: {'timeframe': 'M8', 'atr_period': 13, 'atr_threshold': 5.0, 'pt_mult': 0.5, 'sl_mult': 5.0, 'td_mins': 60}. Best is trial 207 with value: 2.9979644789811193.
[I 2026-03-12 01:55:50,257] Trial 365 pruned. 
[I 2026-03-12 01:55:50,344] Trial 366 finished with value: 2.9979644789811193 and parameters: {'timeframe': 'M8', 'atr_period': 13, 'atr_threshold': 5.0, 'pt_mult': 0.5, 'sl_mult': 5.0, 'td_mins': 60}. Best is trial 207 with value: 2.9979644789811193.
[I 2026-03-12 01:55:50,426] Trial 367 finished with value: 2.9979644789811193 and parameters: {'timeframe': 'M8', 'atr_period': 13, 'atr_threshold': 5.0, 'pt_mult': 0.5, 'sl_mult': 5.0, 'td_mins': 60}. Best is trial 207 with value: 2.9979644789811193.
[I 2026-03-12 01:55:50,509] Trial 368 finished with value: 2.9979644789811193 and parameters: {'timeframe': 'M8', 'atr_period': 13, 'atr_threshold': 5.0, 'pt_mult': 0.5, 'sl_mult': 5.0, 'td_mins': 60}. Best is trial 207 with value: 2.9979644789811193.
[I 2026-03-12 01:55:50,595] Trial 369 finished with value: 2.9979644789811193 and parameters: {'timeframe': 'M8', 'atr_period': 13, 'atr_threshold': 5.0, 'pt_mult': 0.5, 'sl_mult': 5.0, 'td_mins': 60}. Best is trial 207 with value: 2.9979644789811193.
[I 2026-03-12 01:55:50,679] Trial 370 finished with value: 2.9979644789811193 and parameters: {'timeframe': 'M8', 'atr_period': 13, 'atr_threshold': 5.0, 'pt_mult': 0.5, 'sl_mult': 5.0, 'td_mins': 60}. Best is trial 207 with value: 2.9979644789811193.
