[I 2026-03-12 01:20:37,829] Trial 478 finished with value: 2.1354320678443623 and parameters: {'timeframe': 'mixed', 'atr_period': 13, 'atr_threshold': 3.0, 'pt_mult': 0.5, 'sl_mult': 5.0, 'td_mins': 60}. Best is trial 404 with value: 2.1354320678443623.
[I 2026-03-12 01:20:38,370] Trial 479 finished with value: 2.1354320678443623 and parameters: {'timeframe': 'mixed', 'atr_period': 13, 'atr_threshold': 3.0, 'pt_mult': 0.5, 'sl_mult': 5.0, 'td_mins': 60}. Best is trial 404 with value: 2.1354320678443623.
[I 2026-03-12 01:20:38,479] Trial 480 pruned. 
[I 2026-03-12 01:20:38,588] Trial 481 pruned. 
[I 2026-03-12 01:20:39,142] Trial 482 finished with value: 2.1354320678443623 and parameters: {'timeframe': 'mixed', 'atr_period': 13, 'atr_threshold': 3.0, 'pt_mult': 0.5, 'sl_mult': 5.0, 'td_mins': 60}. Best is trial 404 with value: 2.1354320678443623.
[I 2026-03-12 01:20:39,703] Trial 483 finished with value: 2.1354320678443623 and parameters: {'timeframe': 'mixed', 'atr_period': 13, 'atr_threshold': 3.0, 'pt_mult': 0.5, 'sl_mult': 5.0, 'td_mins': 60}. Best is trial 404 with value: 2.1354320678443623.
[I 2026-03-12 01:20:43,789] Trial 484 pruned. 
[I 2026-03-12 01:20:44,010] Trial 485 pruned. 
[I 2026-03-12 01:20:44,561] Trial 486 finished with value: 2.1354320678443623 and parameters: {'timeframe': 'mixed', 'atr_period': 13, 'atr_threshold': 3.0, 'pt_mult': 0.5, 'sl_mult': 5.0, 'td_mins': 60}. Best is trial 404 with value: 2.1354320678443623.
[I 2026-03-12 01:20:44,725] Trial 487 finished with value: 0.0 and parameters: {'timeframe': 'mixed', 'atr_period': 13, 'atr_threshold': 15.0, 'pt_mult': 0.5, 'sl_mult': 2.5, 'td_mins': 60}. Best is trial 404 with value: 2.1354320678443623.
[I 2026-03-12 01:20:45,270] Trial 488 finished with value: 2.1354320678443623 and parameters: {'timeframe': 'mixed', 'atr_period': 13, 'atr_threshold': 3.0, 'pt_mult': 0.5, 'sl_mult': 5.0, 'td_mins': 60}. Best is trial 404 with value: 2.1354320678443623.
[I 2026-03-12 01:20:45,460] Trial 489 pruned. 
[I 2026-03-12 01:20:45,595] Trial 490 pruned. 
[I 2026-03-12 01:20:46,242] Trial 491 pruned. 
[I 2026-03-12 01:20:46,792] Trial 492 finished with value: 2.1354320678443623 and parameters: {'timeframe': 'mixed', 'atr_period': 13, 'atr_threshold': 3.0, 'pt_mult': 0.5, 'sl_mult': 5.0, 'td_mins': 60}. Best is trial 404 with value: 2.1354320678443623.
[I 2026-03-12 01:20:46,924] Trial 493 pruned. 
[I 2026-03-12 01:20:47,483] Trial 494 finished with value: 2.1354320678443623 and parameters: {'timeframe': 'mixed', 'atr_period': 13, 'atr_threshold': 3.0, 'pt_mult': 0.5, 'sl_mult': 5.0, 'td_mins': 60}. Best is trial 404 with value: 2.1354320678443623.
[I 2026-03-12 01:20:47,737] Trial 495 pruned. 
[I 2026-03-12 01:20:47,893] Trial 496 pruned. 
[I 2026-03-12 01:20:48,432] Trial 497 finished with value: 2.1354320678443623 and parameters: {'timeframe': 'mixed', 'atr_period': 13, 'atr_threshold': 3.0, 'pt_mult': 0.5, 'sl_mult': 5.0, 'td_mins': 60}. Best is trial 404 with value: 2.1354320678443623.
[I 2026-03-12 01:20:48,597] Trial 498 finished with value: 0.0 and parameters: {'timeframe': 'mixed', 'atr_period': 13, 'atr_threshold': 10.0, 'pt_mult': 0.5, 'sl_mult': 5.0, 'td_mins': 5}. Best is trial 404 with value: 2.1354320678443623.
[I 2026-03-12 01:20:50,546] Trial 499 pruned. 
[I 2026-03-12 01:20:50,740] Trial 500 pruned. 
[I 2026-03-12 01:20:53,754] Trial 501 pruned. 
[I 2026-03-12 01:20:54,382] Trial 502 pruned. 
[I 2026-03-12 01:20:54,953] Trial 503 finished with value: 2.1354320678443623 and parameters: {'timeframe': 'mixed', 'atr_period': 13, 'atr_threshold': 3.0, 'pt_mult': 0.5, 'sl_mult': 5.0, 'td_mins': 60}. Best is trial 404 with value: 2.1354320678443623.
[I 2026-03-12 01:20:55,502] Trial 504 finished with value: 2.1354320678443623 and parameters: {'timeframe': 'mixed', 'atr_period': 13, 'atr_threshold': 3.0, 'pt_mult': 0.5, 'sl_mult': 5.0, 'td_mins': 60}. Best is trial 404 with value: 2.1354320678443623.
[I 2026-03-12 01:21:01,450] Trial 505 pruned. 
[I 2026-03-12 01:21:01,620] Trial 506 finished with value: 0.0 and parameters: {'timeframe': 'mixed', 'atr_period': 13, 'atr_threshold': 10.0, 'pt_mult': 0.5, 'sl_mult': 5.0, 'td_mins': 30}. Best is trial 404 with value: 2.1354320678443623.
[I 2026-03-12 01:21:01,797] Trial 507 finished with value: 0.0 and parameters: {'timeframe': 'mixed', 'atr_period': 13, 'atr_threshold': 10.0, 'pt_mult': 0.5, 'sl_mult': 5.0, 'td_mins': 360}. Best is trial 404 with value: 2.1354320678443623.
[I 2026-03-12 01:21:02,367] Trial 508 finished with value: 2.1354320678443623 and parameters: {'timeframe': 'mixed', 'atr_period': 13, 'atr_threshold': 3.0, 'pt_mult': 0.5, 'sl_mult': 5.0, 'td_mins': 60}. Best is trial 404 with value: 2.1354320678443623.
[I 2026-03-12 01:21:02,493] Trial 509 pruned. 
[I 2026-03-12 01:21:03,114] Trial 510 finished with value: 2.1354320678443623 and parameters: {'timeframe': 'mixed', 'atr_period': 13, 'atr_threshold': 3.0, 'pt_mult': 0.5, 'sl_mult': 5.0, 'td_mins': 60}. Best is trial 404 with value: 2.1354320678443623.
[I 2026-03-12 01:21:04,094] Trial 511 pruned. 
[I 2026-03-12 01:21:04,686] Trial 512 finished with value: 2.1354320678443623 and parameters: {'timeframe': 'mixed', 'atr_period': 13, 'atr_threshold': 3.0, 'pt_mult': 0.5, 'sl_mult': 5.0, 'td_mins': 60}. Best is trial 404 with value: 2.1354320678443623.
[I 2026-03-12 01:21:04,973] Trial 513 pruned. 
[I 2026-03-12 01:21:05,272] Trial 514 pruned. 
[I 2026-03-12 01:21:05,870] Trial 515 finished with value: 2.1354320678443623 and parameters: {'timeframe': 'mixed', 'atr_period': 13, 'atr_threshold': 3.0, 'pt_mult': 0.5, 'sl_mult': 5.0, 'td_mins': 60}. Best is trial 404 with value: 2.1354320678443623.
[I 2026-03-12 01:21:06,036] Trial 516 finished with value: 0.0 and parameters: {'timeframe': 'mixed', 'atr_period': 13, 'atr_threshold': 15.0, 'pt_mult': 0.5, 'sl_mult': 1.0, 'td_mins': 60}. Best is trial 404 with value: 2.1354320678443623.
[I 2026-03-12 01:21:06,181] Trial 517 pruned. 
[I 2026-03-12 01:21:06,349] Trial 518 finished with value: 0.0 and parameters: {'timeframe': 'mixed', 'atr_period': 13, 'atr_threshold': 10.0, 'pt_mult': 0.5, 'sl_mult': 5.0, 'td_mins': 60}. Best is trial 404 with value: 2.1354320678443623.
[I 2026-03-12 01:21:06,478] Trial 519 pruned. 
[I 2026-03-12 01:21:06,742] Trial 520 pruned. 
[I 2026-03-12 01:21:06,914] Trial 521 finished with value: 0.0 and parameters: {'timeframe': 'mixed', 'atr_period': 13, 'atr_threshold': 15.0, 'pt_mult': 0.5, 'sl_mult': 5.0, 'td_mins': 60}. Best is trial 404 with value: 2.1354320678443623.
[I 2026-03-12 01:21:08,031] Trial 522 pruned. 
[I 2026-03-12 01:21:08,146] Trial 523 pruned. 
[I 2026-03-12 01:21:08,290] Trial 524 pruned. 
[I 2026-03-12 01:21:08,459] Trial 525 finished with value: 0.0 and parameters: {'timeframe': 'mixed', 'atr_period': 13, 'atr_threshold': 10.0, 'pt_mult': 0.5, 'sl_mult': 5.0, 'td_mins': 720}. Best is trial 404 with value: 2.1354320678443623.
[I 2026-03-12 01:21:08,582] Trial 526 pruned. 
[I 2026-03-12 01:21:12,820] Trial 527 pruned. 
[I 2026-03-12 01:21:12,961] Trial 528 pruned. 
[I 2026-03-12 01:21:13,125] Trial 529 finished with value: 0.0 and parameters: {'timeframe': 'mixed', 'atr_period': 13, 'atr_threshold': 15.0, 'pt_mult': 0.5, 'sl_mult': 5.0, 'td_mins': 1200}. Best is trial 404 with value: 2.1354320678443623.
[I 2026-03-12 01:21:13,271] Trial 530 pruned. 
[I 2026-03-12 01:21:13,417] Trial 531 pruned. 
[I 2026-03-12 01:21:14,806] Trial 532 pruned. 
[I 2026-03-12 01:21:15,030] Trial 533 pruned. 
[I 2026-03-12 01:21:15,171] Trial 534 pruned. 
[I 2026-03-12 01:21:15,885] Trial 535 finished with value: 1.6684996182162777 and parameters: {'timeframe': 'mixed', 'atr_period': 13, 'atr_threshold': 2.0, 'pt_mult': 0.5, 'sl_mult': 5.0, 'td_mins': 30}. Best is trial 404 with value: 2.1354320678443623.
[I 2026-03-12 01:21:16,418] Trial 536 pruned. 
[I 2026-03-12 01:21:16,918] Trial 537 pruned. 
[I 2026-03-12 01:21:18,055] Trial 538 finished with value: 1.763842190550027 and parameters: {'timeframe': 'mixed', 'atr_period': 13, 'atr_threshold': 2.0, 'pt_mult': 0.5, 'sl_mult': 5.0, 'td_mins': 60}. Best is trial 404 with value: 2.1354320678443623.
[I 2026-03-12 01:21:18,601] Trial 539 finished with value: 2.1354320678443623 and parameters: {'timeframe': 'mixed', 'atr_period': 13, 'atr_threshold': 3.0, 'pt_mult': 0.5, 'sl_mult': 5.0, 'td_mins': 60}. Best is trial 404 with value: 2.1354320678443623.
[I 2026-03-12 01:21:18,748] Trial 540 pruned. 
[I 2026-03-12 01:21:19,665] Trial 541 pruned. 
[I 2026-03-12 01:21:19,837] Trial 542 finished with value: 0.0 and parameters: {'timeframe': 'mixed', 'atr_period': 13, 'atr_threshold': 15.0, 'pt_mult': 0.5, 'sl_mult': 0.5, 'td_mins': 60}. Best is trial 404 with value: 2.1354320678443623.
[I 2026-03-12 01:21:19,950] Trial 543 pruned. 
[I 2026-03-12 01:21:20,630] Trial 544 pruned. 
[I 2026-03-12 01:21:21,233] Trial 545 finished with value: 2.1354320678443623 and parameters: {'timeframe': 'mixed', 'atr_period': 13, 'atr_threshold': 3.0, 'pt_mult': 0.5, 'sl_mult': 5.0, 'td_mins': 60}. Best is trial 404 with value: 2.1354320678443623.
[I 2026-03-12 01:21:21,435] Trial 546 pruned. 
[I 2026-03-12 01:21:21,582] Trial 547 pruned. 
[I 2026-03-12 01:21:21,728] Trial 548 pruned. 
[I 2026-03-12 01:21:22,185] Trial 549 pruned. 
[I 2026-03-12 01:21:24,016] Trial 550 finished with value: 1.5267182676010331 and parameters: {'timeframe': 'mixed', 'atr_period': 13, 'atr_threshold': 3.0, 'pt_mult': 0.5, 'sl_mult': 5.0, 'td_mins': 360}. Best is trial 404 with value: 2.1354320678443623.
[I 2026-03-12 01:21:24,726] Trial 551 pruned. 
[I 2026-03-12 01:21:25,145] Trial 552 pruned. 
[I 2026-03-12 01:21:25,585] Trial 553 pruned. 
[I 2026-03-12 01:21:26,194] Trial 554 finished with value: 1.6158139878770883 and parameters: {'timeframe': 'mixed', 'atr_period': 13, 'atr_threshold': 3.0, 'pt_mult': 1.0, 'sl_mult': 5.0, 'td_mins': 60}. Best is trial 404 with value: 2.1354320678443623.
[I 2026-03-12 01:21:27,481] Trial 555 pruned. 
[I 2026-03-12 01:21:27,743] Trial 556 finished with value: 1.851061453289293 and parameters: {'timeframe': 'mixed', 'atr_period': 13, 'atr_threshold': 5.0, 'pt_mult': 0.5, 'sl_mult': 5.0, 'td_mins': 60}. Best is trial 404 with value: 2.1354320678443623.
[I 2026-03-12 01:21:27,917] Trial 557 finished with value: 0.0 and parameters: {'timeframe': 'mixed', 'atr_period': 13, 'atr_threshold': 15.0, 'pt_mult': 1.0, 'sl_mult': 5.0, 'td_mins': 60}. Best is trial 404 with value: 2.1354320678443623.
[I 2026-03-12 01:21:30,896] Trial 558 pruned. 
[I 2026-03-12 01:21:31,065] Trial 559 finished with value: 0.0 and parameters: {'timeframe': 'mixed', 'atr_period': 13, 'atr_threshold': 15.0, 'pt_mult': 0.5, 'sl_mult': 5.0, 'td_mins': 120}. Best is trial 404 with value: 2.1354320678443623.
[I 2026-03-12 01:21:31,795] Trial 560 pruned. 
[I 2026-03-12 01:21:33,517] Trial 561 finished with value: 1.6611702635566565 and parameters: {'timeframe': 'mixed', 'atr_period': 13, 'atr_threshold': 2.0, 'pt_mult': 0.5, 'sl_mult': 5.0, 'td_mins': 120}. Best is trial 404 with value: 2.1354320678443623.
[I 2026-03-12 01:21:33,628] Trial 562 pruned. 
[I 2026-03-12 01:21:33,971] Trial 563 pruned. 
[I 2026-03-12 01:21:34,520] Trial 564 finished with value: 2.1354320678443623 and parameters: {'timeframe': 'mixed', 'atr_period': 13, 'atr_threshold': 3.0, 'pt_mult': 0.5, 'sl_mult': 5.0, 'td_mins': 60}. Best is trial 404 with value: 2.1354320678443623.
[I 2026-03-12 01:21:34,668] Trial 565 pruned. 
[I 2026-03-12 01:21:34,816] Trial 566 pruned. 
[I 2026-03-12 01:21:35,375] Trial 567 finished with value: 2.1354320678443623 and parameters: {'timeframe': 'mixed', 'atr_period': 13, 'atr_threshold': 3.0, 'pt_mult': 0.5, 'sl_mult': 5.0, 'td_mins': 60}. Best is trial 404 with value: 2.1354320678443623.
[I 2026-03-12 01:21:35,933] Trial 568 finished with value: 2.1354320678443623 and parameters: {'timeframe': 'mixed', 'atr_period': 13, 'atr_threshold': 3.0, 'pt_mult': 0.5, 'sl_mult': 5.0, 'td_mins': 60}. Best is trial 404 with value: 2.1354320678443623.
[I 2026-03-12 01:21:36,323] Trial 569 finished with value: 1.9468260827108126 and parameters: {'timeframe': 'mixed', 'atr_period': 13, 'atr_threshold': 3.0, 'pt_mult': 0.5, 'sl_mult': 5.0, 'td_mins': 30}. Best is trial 404 with value: 2.1354320678443623.
[I 2026-03-12 01:21:36,491] Trial 570 finished with value: 0.0 and parameters: {'timeframe': 'mixed', 'atr_period': 13, 'atr_threshold': 15.0, 'pt_mult': 0.5, 'sl_mult': 5.0, 'td_mins': 15}. Best is trial 404 with value: 2.1354320678443623.
[I 2026-03-12 01:21:37,053] Trial 571 finished with value: 2.1354320678443623 and parameters: {'timeframe': 'mixed', 'atr_period': 13, 'atr_threshold': 3.0, 'pt_mult': 0.5, 'sl_mult': 5.0, 'td_mins': 60}. Best is trial 404 with value: 2.1354320678443623.
[I 2026-03-12 01:21:37,186] Trial 572 pruned. 
[I 2026-03-12 01:21:38,093] Trial 573 finished with value: 2.0147840062204914 and parameters: {'timeframe': 'mixed', 'atr_period': 13, 'atr_threshold': 3.0, 'pt_mult': 0.5, 'sl_mult': 5.0, 'td_mins': 120}. Best is trial 404 with value: 2.1354320678443623.
[I 2026-03-12 01:21:38,690] Trial 574 finished with value: 2.1354320678443623 and parameters: {'timeframe': 'mixed', 'atr_period': 13, 'atr_threshold': 3.0, 'pt_mult': 0.5, 'sl_mult': 5.0, 'td_mins': 60}. Best is trial 404 with value: 2.1354320678443623.
[I 2026-03-12 01:21:39,293] Trial 575 finished with value: 2.1354320678443623 and parameters: {'timeframe': 'mixed', 'atr_period': 13, 'atr_threshold': 3.0, 'pt_mult': 0.5, 'sl_mult': 5.0, 'td_mins': 60}. Best is trial 404 with value: 2.1354320678443623.
[I 2026-03-12 01:21:39,856] Trial 576 finished with value: 2.1354320678443623 and parameters: {'timeframe': 'mixed', 'atr_period': 13, 'atr_threshold': 3.0, 'pt_mult': 0.5, 'sl_mult': 5.0, 'td_mins': 60}. Best is trial 404 with value: 2.1354320678443623.
[I 2026-03-12 01:21:40,000] Trial 577 pruned. 
[I 2026-03-12 01:21:40,424] Trial 578 pruned. 
[I 2026-03-12 01:21:40,527] Trial 579 pruned. 
[I 2026-03-12 01:21:40,644] Trial 580 pruned. 
[I 2026-03-12 01:21:42,131] Trial 581 pruned. 
[I 2026-03-12 01:21:42,297] Trial 582 pruned. 
[I 2026-03-12 01:21:42,470] Trial 583 finished with value: 0.0 and parameters: {'timeframe': 'mixed', 'atr_period': 13, 'atr_threshold': 15.0, 'pt_mult': 0.5, 'sl_mult': 5.0, 'td_mins': 360}. Best is trial 404 with value: 2.1354320678443623.
[I 2026-03-12 01:21:42,752] Trial 584 pruned. 
[I 2026-03-12 01:21:43,006] Trial 585 pruned. 
[I 2026-03-12 01:21:43,137] Trial 586 pruned. 
[I 2026-03-12 01:21:43,252] Trial 587 pruned. 
[I 2026-03-12 01:21:43,868] Trial 588 finished with value: 2.1354320678443623 and parameters: {'timeframe': 'mixed', 'atr_period': 13, 'atr_threshold': 3.0, 'pt_mult': 0.5, 'sl_mult': 5.0, 'td_mins': 60}. Best is trial 404 with value: 2.1354320678443623.
[I 2026-03-12 01:21:44,020] Trial 589 pruned. 
[I 2026-03-12 01:21:44,593] Trial 590 finished with value: 2.1354320678443623 and parameters: {'timeframe': 'mixed', 'atr_period': 13, 'atr_threshold': 3.0, 'pt_mult': 0.5, 'sl_mult': 5.0, 'td_mins': 60}. Best is trial 404 with value: 2.1354320678443623.
[I 2026-03-12 01:21:44,714] Trial 591 pruned. 
[I 2026-03-12 01:21:44,856] Trial 592 pruned. 
[I 2026-03-12 01:21:45,191] Trial 593 pruned. 
[I 2026-03-12 01:21:45,368] Trial 594 pruned. 
[I 2026-03-12 01:21:46,007] Trial 595 finished with value: 2.1354320678443623 and parameters: {'timeframe': 'mixed', 'atr_period': 13, 'atr_threshold': 3.0, 'pt_mult': 0.5, 'sl_mult': 5.0, 'td_mins': 60}. Best is trial 404 with value: 2.1354320678443623.
[I 2026-03-12 01:21:46,589] Trial 596 finished with value: 2.1354320678443623 and parameters: {'timeframe': 'mixed', 'atr_period': 13, 'atr_threshold': 3.0, 'pt_mult': 0.5, 'sl_mult': 5.0, 'td_mins': 60}. Best is trial 404 with value: 2.1354320678443623.
[I 2026-03-12 01:21:47,142] Trial 597 finished with value: 2.1354320678443623 and parameters: {'timeframe': 'mixed', 'atr_period': 13, 'atr_threshold': 3.0, 'pt_mult': 0.5, 'sl_mult': 5.0, 'td_mins': 60}. Best is trial 404 with value: 2.1354320678443623.
[I 2026-03-12 01:21:47,702] Trial 598 finished with value: 2.1354320678443623 and parameters: {'timeframe': 'mixed', 'atr_period': 13, 'atr_threshold': 3.0, 'pt_mult': 0.5, 'sl_mult': 5.0, 'td_mins': 60}. Best is trial 404 with value: 2.1354320678443623.
[I 2026-03-12 01:21:48,312] Trial 599 finished with value: 2.1354320678443623 and parameters: {'timeframe': 'mixed', 'atr_period': 13, 'atr_threshold': 3.0, 'pt_mult': 0.5, 'sl_mult': 5.0, 'td_mins': 60}. Best is trial 404 with value: 2.1354320678443623.
[I 2026-03-12 01:21:48,489] Trial 600 finished with value: 0.0 and parameters: {'timeframe': 'mixed', 'atr_period': 13, 'atr_threshold': 10.0, 'pt_mult': 0.5, 'sl_mult': 2.5, 'td_mins': 60}. Best is trial 404 with value: 2.1354320678443623.
[I 2026-03-12 01:21:48,642] Trial 601 pruned. 
[I 2026-03-12 01:21:48,933] Trial 602 pruned. 
[I 2026-03-12 01:21:49,084] Trial 603 pruned. 
[I 2026-03-12 01:21:49,276] Trial 604 pruned. 
[I 2026-03-12 01:21:49,808] Trial 605 finished with value: 2.1354320678443623 and parameters: {'timeframe': 'mixed', 'atr_period': 13, 'atr_threshold': 3.0, 'pt_mult': 0.5, 'sl_mult': 5.0, 'td_mins': 60}. Best is trial 404 with value: 2.1354320678443623.
[I 2026-03-12 01:21:50,402] Trial 606 finished with value: 2.1354320678443623 and parameters: {'timeframe': 'mixed', 'atr_period': 13, 'atr_threshold': 3.0, 'pt_mult': 0.5, 'sl_mult': 5.0, 'td_mins': 60}. Best is trial 404 with value: 2.1354320678443623.
[I 2026-03-12 01:21:50,569] Trial 607 pruned. 
[I 2026-03-12 01:21:51,200] Trial 608 finished with value: 2.1354320678443623 and parameters: {'timeframe': 'mixed', 'atr_period': 13, 'atr_threshold': 3.0, 'pt_mult': 0.5, 'sl_mult': 5.0, 'td_mins': 60}. Best is trial 404 with value: 2.1354320678443623.
[I 2026-03-12 01:21:51,811] Trial 609 pruned. 
[I 2026-03-12 01:21:51,961] Trial 610 pruned. 
[I 2026-03-12 01:21:52,715] Trial 611 pruned. 
[I 2026-03-12 01:21:52,927] Trial 612 finished with value: 0.0 and parameters: {'timeframe': 'mixed', 'atr_period': 13, 'atr_threshold': 10.0, 'pt_mult': 0.5, 'sl_mult': 5.0, 'td_mins': 60}. Best is trial 404 with value: 2.1354320678443623.
[I 2026-03-12 01:21:53,098] Trial 613 finished with value: 0.0 and parameters: {'timeframe': 'mixed', 'atr_period': 13, 'atr_threshold': 10.0, 'pt_mult': 0.5, 'sl_mult': 1.0, 'td_mins': 15}. Best is trial 404 with value: 2.1354320678443623.
[I 2026-03-12 01:21:53,242] Trial 614 pruned. 
[I 2026-03-12 01:21:53,635] Trial 615 pruned. 
[I 2026-03-12 01:21:54,295] Trial 616 finished with value: 2.1354320678443623 and parameters: {'timeframe': 'mixed', 'atr_period': 13, 'atr_threshold': 3.0, 'pt_mult': 0.5, 'sl_mult': 5.0, 'td_mins': 60}. Best is trial 404 with value: 2.1354320678443623.
[I 2026-03-12 01:21:54,456] Trial 617 pruned. 
[I 2026-03-12 01:21:54,625] Trial 618 pruned. 
[I 2026-03-12 01:21:54,803] Trial 619 finished with value: 0.0 and parameters: {'timeframe': 'mixed', 'atr_period': 13, 'atr_threshold': 10.0, 'pt_mult': 2.5, 'sl_mult': 0.5, 'td_mins': 360}. Best is trial 404 with value: 2.1354320678443623.
[I 2026-03-12 01:21:55,355] Trial 620 pruned. 
[I 2026-03-12 01:21:55,687] Trial 621 finished with value: 1.2340170927426757 and parameters: {'timeframe': 'mixed', 'atr_period': 13, 'atr_threshold': 5.0, 'pt_mult': 0.5, 'sl_mult': 5.0, 'td_mins': 120}. Best is trial 404 with value: 2.1354320678443623.
[I 2026-03-12 01:21:57,656] Trial 622 pruned. 
[I 2026-03-12 01:21:58,269] Trial 623 finished with value: 2.1354320678443623 and parameters: {'timeframe': 'mixed', 'atr_period': 13, 'atr_threshold': 3.0, 'pt_mult': 0.5, 'sl_mult': 5.0, 'td_mins': 60}. Best is trial 404 with value: 2.1354320678443623.
[I 2026-03-12 01:21:58,867] Trial 624 finished with value: 2.1354320678443623 and parameters: {'timeframe': 'mixed', 'atr_period': 13, 'atr_threshold': 3.0, 'pt_mult': 0.5, 'sl_mult': 5.0, 'td_mins': 60}. Best is trial 404 with value: 2.1354320678443623.
[I 2026-03-12 01:21:59,473] Trial 625 finished with value: 2.1354320678443623 and parameters: {'timeframe': 'mixed', 'atr_period': 13, 'atr_threshold': 3.0, 'pt_mult': 0.5, 'sl_mult': 5.0, 'td_mins': 60}. Best is trial 404 with value: 2.1354320678443623.
[I 2026-03-12 01:21:59,606] Trial 626 pruned. 
[I 2026-03-12 01:21:59,733] Trial 627 pruned. 
[I 2026-03-12 01:22:00,315] Trial 628 finished with value: 2.1354320678443623 and parameters: {'timeframe': 'mixed', 'atr_period': 13, 'atr_threshold': 3.0, 'pt_mult': 0.5, 'sl_mult': 5.0, 'td_mins': 60}. Best is trial 404 with value: 2.1354320678443623.
[I 2026-03-12 01:22:00,903] Trial 629 finished with value: 2.1354320678443623 and parameters: {'timeframe': 'mixed', 'atr_period': 13, 'atr_threshold': 3.0, 'pt_mult': 0.5, 'sl_mult': 5.0, 'td_mins': 60}. Best is trial 404 with value: 2.1354320678443623.
[I 2026-03-12 01:22:01,102] Trial 630 pruned. 
[I 2026-03-12 01:22:01,263] Trial 631 pruned. 
[I 2026-03-12 01:22:01,444] Trial 632 finished with value: 0.0 and parameters: {'timeframe': 'mixed', 'atr_period': 13, 'atr_threshold': 15.0, 'pt_mult': 5.0, 'sl_mult': 2.5, 'td_mins': 1200}. Best is trial 404 with value: 2.1354320678443623.
[I 2026-03-12 01:22:01,623] Trial 633 finished with value: 0.0 and parameters: {'timeframe': 'mixed', 'atr_period': 13, 'atr_threshold': 15.0, 'pt_mult': 2.5, 'sl_mult': 5.0, 'td_mins': 60}. Best is trial 404 with value: 2.1354320678443623.
[I 2026-03-12 01:22:01,769] Trial 634 pruned. 
[I 2026-03-12 01:22:01,915] Trial 635 pruned. 
[I 2026-03-12 01:22:02,038] Trial 636 pruned. 
[I 2026-03-12 01:22:03,095] Trial 637 pruned. 
[I 2026-03-12 01:22:03,297] Trial 638 finished with value: 0.0 and parameters: {'timeframe': 'mixed', 'atr_period': 13, 'atr_threshold': 15.0, 'pt_mult': 0.5, 'sl_mult': 5.0, 'td_mins': 60}. Best is trial 404 with value: 2.1354320678443623.
