[I 2026-03-12 02:04:30,811] Trial 689 finished with value: 2.627710256873383 and parameters: {'timeframe': 'M15', 'atr_period': 13, 'atr_threshold': 3.0, 'pt_mult': 0.5, 'sl_mult': 5.0, 'td_mins': 120}. Best is trial 393 with value: 2.627710256873383.
[I 2026-03-12 02:04:30,898] Trial 690 pruned. 
[I 2026-03-12 02:04:31,175] Trial 691 finished with value: 2.627710256873383 and parameters: {'timeframe': 'M15', 'atr_period': 13, 'atr_threshold': 3.0, 'pt_mult': 0.5, 'sl_mult': 5.0, 'td_mins': 120}. Best is trial 393 with value: 2.627710256873383.
[I 2026-03-12 02:04:32,088] Trial 692 pruned. 
[I 2026-03-12 02:04:32,138] Trial 693 pruned. 
[I 2026-03-12 02:04:32,207] Trial 694 pruned. 
[I 2026-03-12 02:04:33,032] Trial 695 pruned. 
[I 2026-03-12 02:04:33,370] Trial 696 finished with value: 2.627710256873383 and parameters: {'timeframe': 'M15', 'atr_period': 13, 'atr_threshold': 3.0, 'pt_mult': 0.5, 'sl_mult': 5.0, 'td_mins': 120}. Best is trial 393 with value: 2.627710256873383.
[I 2026-03-12 02:04:33,515] Trial 697 pruned. 
[I 2026-03-12 02:04:33,572] Trial 698 pruned. 
[I 2026-03-12 02:04:33,630] Trial 699 pruned. 
[I 2026-03-12 02:04:33,929] Trial 700 finished with value: 2.627710256873383 and parameters: {'timeframe': 'M15', 'atr_period': 13, 'atr_threshold': 3.0, 'pt_mult': 0.5, 'sl_mult': 5.0, 'td_mins': 120}. Best is trial 393 with value: 2.627710256873383.
[I 2026-03-12 02:04:34,201] Trial 701 finished with value: 2.627710256873383 and parameters: {'timeframe': 'M15', 'atr_period': 13, 'atr_threshold': 3.0, 'pt_mult': 0.5, 'sl_mult': 5.0, 'td_mins': 120}. Best is trial 393 with value: 2.627710256873383.
[I 2026-03-12 02:04:34,265] Trial 702 pruned. 
[I 2026-03-12 02:04:34,542] Trial 703 finished with value: 2.627710256873383 and parameters: {'timeframe': 'M15', 'atr_period': 13, 'atr_threshold': 3.0, 'pt_mult': 0.5, 'sl_mult': 5.0, 'td_mins': 120}. Best is trial 393 with value: 2.627710256873383.
[I 2026-03-12 02:04:34,867] Trial 704 finished with value: 2.627710256873383 and parameters: {'timeframe': 'M15', 'atr_period': 13, 'atr_threshold': 3.0, 'pt_mult': 0.5, 'sl_mult': 5.0, 'td_mins': 120}. Best is trial 393 with value: 2.627710256873383.
[I 2026-03-12 02:04:34,922] Trial 705 finished with value: 0.0 and parameters: {'timeframe': 'M15', 'atr_period': 13, 'atr_threshold': 15.0, 'pt_mult': 0.5, 'sl_mult': 5.0, 'td_mins': 15}. Best is trial 393 with value: 2.627710256873383.
[I 2026-03-12 02:04:35,017] Trial 706 pruned. 
[I 2026-03-12 02:04:35,071] Trial 707 finished with value: 0.0 and parameters: {'timeframe': 'M15', 'atr_period': 13, 'atr_threshold': 10.0, 'pt_mult': 1.0, 'sl_mult': 1.0, 'td_mins': 120}. Best is trial 393 with value: 2.627710256873383.
[I 2026-03-12 02:04:35,133] Trial 708 pruned. 
[I 2026-03-12 02:04:35,284] Trial 709 pruned. 
[I 2026-03-12 02:04:35,365] Trial 710 finished with value: 0.0 and parameters: {'timeframe': 'M15', 'atr_period': 13, 'atr_threshold': 10.0, 'pt_mult': 0.5, 'sl_mult': 0.5, 'td_mins': 720}. Best is trial 393 with value: 2.627710256873383.
[I 2026-03-12 02:04:35,627] Trial 711 pruned. 
[I 2026-03-12 02:04:36,332] Trial 712 pruned. 
[I 2026-03-12 02:04:36,400] Trial 713 pruned. 
[I 2026-03-12 02:04:36,538] Trial 714 pruned. 
[I 2026-03-12 02:04:36,590] Trial 715 finished with value: 0.0 and parameters: {'timeframe': 'M15', 'atr_period': 13, 'atr_threshold': 15.0, 'pt_mult': 0.5, 'sl_mult': 5.0, 'td_mins': 120}. Best is trial 393 with value: 2.627710256873383.
[I 2026-03-12 02:04:36,784] Trial 716 finished with value: 2.4190348657869114 and parameters: {'timeframe': 'M15', 'atr_period': 13, 'atr_threshold': 3.0, 'pt_mult': 0.5, 'sl_mult': 5.0, 'td_mins': 60}. Best is trial 393 with value: 2.627710256873383.
[I 2026-03-12 02:04:36,836] Trial 717 finished with value: 0.0 and parameters: {'timeframe': 'M15', 'atr_period': 13, 'atr_threshold': 10.0, 'pt_mult': 1.0, 'sl_mult': 5.0, 'td_mins': 1200}. Best is trial 393 with value: 2.627710256873383.
[I 2026-03-12 02:04:36,924] Trial 718 pruned. 
[I 2026-03-12 02:04:36,976] Trial 719 finished with value: 0.0 and parameters: {'timeframe': 'M15', 'atr_period': 13, 'atr_threshold': 10.0, 'pt_mult': 2.5, 'sl_mult': 5.0, 'td_mins': 30}. Best is trial 393 with value: 2.627710256873383.
[I 2026-03-12 02:04:37,999] Trial 720 pruned. 
[I 2026-03-12 02:04:38,087] Trial 721 pruned. 
[I 2026-03-12 02:04:38,378] Trial 722 finished with value: 2.627710256873383 and parameters: {'timeframe': 'M15', 'atr_period': 13, 'atr_threshold': 3.0, 'pt_mult': 0.5, 'sl_mult': 5.0, 'td_mins': 120}. Best is trial 393 with value: 2.627710256873383.
[I 2026-03-12 02:04:38,430] Trial 723 finished with value: 0.0 and parameters: {'timeframe': 'M15', 'atr_period': 13, 'atr_threshold': 15.0, 'pt_mult': 5.0, 'sl_mult': 0.5, 'td_mins': 120}. Best is trial 393 with value: 2.627710256873383.
[I 2026-03-12 02:04:38,513] Trial 724 pruned. 
[I 2026-03-12 02:04:38,712] Trial 725 pruned. 
[I 2026-03-12 02:04:38,811] Trial 726 pruned. 
[I 2026-03-12 02:04:39,225] Trial 727 finished with value: 2.4490491384580553 and parameters: {'timeframe': 'M15', 'atr_period': 13, 'atr_threshold': 3.0, 'pt_mult': 0.5, 'sl_mult': 5.0, 'td_mins': 180}. Best is trial 393 with value: 2.627710256873383.
[I 2026-03-12 02:04:39,294] Trial 728 pruned. 
[I 2026-03-12 02:04:39,564] Trial 729 pruned. 
[I 2026-03-12 02:04:39,621] Trial 730 finished with value: 0.0 and parameters: {'timeframe': 'M15', 'atr_period': 13, 'atr_threshold': 15.0, 'pt_mult': 2.5, 'sl_mult': 1.0, 'td_mins': 180}. Best is trial 393 with value: 2.627710256873383.
[I 2026-03-12 02:04:39,892] Trial 731 pruned. 
[I 2026-03-12 02:04:39,956] Trial 732 pruned. 
[I 2026-03-12 02:04:40,014] Trial 733 pruned. 
[I 2026-03-12 02:04:40,079] Trial 734 pruned. 
[I 2026-03-12 02:04:40,181] Trial 735 pruned. 
[I 2026-03-12 02:04:40,232] Trial 736 finished with value: 0.0 and parameters: {'timeframe': 'M15', 'atr_period': 13, 'atr_threshold': 10.0, 'pt_mult': 0.5, 'sl_mult': 5.0, 'td_mins': 120}. Best is trial 393 with value: 2.627710256873383.
[I 2026-03-12 02:04:40,816] Trial 737 pruned. 
[I 2026-03-12 02:04:40,867] Trial 738 pruned. 
[I 2026-03-12 02:04:41,173] Trial 739 pruned. 
[I 2026-03-12 02:04:41,382] Trial 740 pruned. 
[I 2026-03-12 02:04:41,432] Trial 741 finished with value: 0.0 and parameters: {'timeframe': 'M15', 'atr_period': 13, 'atr_threshold': 15.0, 'pt_mult': 1.0, 'sl_mult': 2.5, 'td_mins': 15}. Best is trial 393 with value: 2.627710256873383.
[I 2026-03-12 02:04:41,521] Trial 742 pruned. 
[I 2026-03-12 02:04:42,563] Trial 743 finished with value: 1.3814263831771734 and parameters: {'timeframe': 'M15', 'atr_period': 13, 'atr_threshold': 5.0, 'pt_mult': 2.5, 'sl_mult': 5.0, 'td_mins': 1200}. Best is trial 393 with value: 2.627710256873383.
[I 2026-03-12 02:04:42,856] Trial 744 finished with value: 2.627710256873383 and parameters: {'timeframe': 'M15', 'atr_period': 13, 'atr_threshold': 3.0, 'pt_mult': 0.5, 'sl_mult': 5.0, 'td_mins': 120}. Best is trial 393 with value: 2.627710256873383.
[I 2026-03-12 02:04:43,125] Trial 745 finished with value: 2.627710256873383 and parameters: {'timeframe': 'M15', 'atr_period': 13, 'atr_threshold': 3.0, 'pt_mult': 0.5, 'sl_mult': 5.0, 'td_mins': 120}. Best is trial 393 with value: 2.627710256873383.
[I 2026-03-12 02:04:43,395] Trial 746 pruned. 
[I 2026-03-12 02:04:44,387] Trial 747 finished with value: 0.7796945836188781 and parameters: {'timeframe': 'M15', 'atr_period': 13, 'atr_threshold': 5.0, 'pt_mult': 5.0, 'sl_mult': 2.5, 'td_mins': 1200}. Best is trial 393 with value: 2.627710256873383.
[I 2026-03-12 02:04:44,554] Trial 748 pruned. 
[I 2026-03-12 02:04:44,604] Trial 749 pruned. 
[I 2026-03-12 02:04:44,712] Trial 750 pruned. 
[I 2026-03-12 02:04:45,026] Trial 751 finished with value: 2.627710256873383 and parameters: {'timeframe': 'M15', 'atr_period': 13, 'atr_threshold': 3.0, 'pt_mult': 0.5, 'sl_mult': 5.0, 'td_mins': 120}. Best is trial 393 with value: 2.627710256873383.
[I 2026-03-12 02:04:45,342] Trial 752 finished with value: 2.1318723590746487 and parameters: {'timeframe': 'M15', 'atr_period': 13, 'atr_threshold': 3.0, 'pt_mult': 1.0, 'sl_mult': 5.0, 'td_mins': 120}. Best is trial 393 with value: 2.627710256873383.
[I 2026-03-12 02:04:45,475] Trial 753 pruned. 
[I 2026-03-12 02:04:45,927] Trial 754 finished with value: 2.3274688702958795 and parameters: {'timeframe': 'M15', 'atr_period': 13, 'atr_threshold': 2.0, 'pt_mult': 0.5, 'sl_mult': 5.0, 'td_mins': 120}. Best is trial 393 with value: 2.627710256873383.
[I 2026-03-12 02:04:46,618] Trial 755 pruned. 
[I 2026-03-12 02:04:47,037] Trial 756 pruned. 
[I 2026-03-12 02:04:47,304] Trial 757 finished with value: 2.627710256873383 and parameters: {'timeframe': 'M15', 'atr_period': 13, 'atr_threshold': 3.0, 'pt_mult': 0.5, 'sl_mult': 5.0, 'td_mins': 120}. Best is trial 393 with value: 2.627710256873383.
[I 2026-03-12 02:04:47,385] Trial 758 pruned. 
[I 2026-03-12 02:04:47,466] Trial 759 pruned. 
[I 2026-03-12 02:04:47,516] Trial 760 finished with value: 0.0 and parameters: {'timeframe': 'M15', 'atr_period': 13, 'atr_threshold': 15.0, 'pt_mult': 1.0, 'sl_mult': 1.0, 'td_mins': 60}. Best is trial 393 with value: 2.627710256873383.
[I 2026-03-12 02:04:47,791] Trial 761 finished with value: 2.627710256873383 and parameters: {'timeframe': 'M15', 'atr_period': 13, 'atr_threshold': 3.0, 'pt_mult': 0.5, 'sl_mult': 5.0, 'td_mins': 120}. Best is trial 393 with value: 2.627710256873383.
[I 2026-03-12 02:04:48,057] Trial 762 finished with value: 2.627710256873383 and parameters: {'timeframe': 'M15', 'atr_period': 13, 'atr_threshold': 3.0, 'pt_mult': 0.5, 'sl_mult': 5.0, 'td_mins': 120}. Best is trial 393 with value: 2.627710256873383.
[I 2026-03-12 02:04:48,126] Trial 763 pruned. 
[I 2026-03-12 02:04:48,408] Trial 764 finished with value: 2.627710256873383 and parameters: {'timeframe': 'M15', 'atr_period': 13, 'atr_threshold': 3.0, 'pt_mult': 0.5, 'sl_mult': 5.0, 'td_mins': 120}. Best is trial 393 with value: 2.627710256873383.
[I 2026-03-12 02:04:48,681] Trial 765 finished with value: 2.627710256873383 and parameters: {'timeframe': 'M15', 'atr_period': 13, 'atr_threshold': 3.0, 'pt_mult': 0.5, 'sl_mult': 5.0, 'td_mins': 120}. Best is trial 393 with value: 2.627710256873383.
[I 2026-03-12 02:04:48,963] Trial 766 finished with value: 2.627710256873383 and parameters: {'timeframe': 'M15', 'atr_period': 13, 'atr_threshold': 3.0, 'pt_mult': 0.5, 'sl_mult': 5.0, 'td_mins': 120}. Best is trial 393 with value: 2.627710256873383.
[I 2026-03-12 02:04:49,235] Trial 767 finished with value: 2.627710256873383 and parameters: {'timeframe': 'M15', 'atr_period': 13, 'atr_threshold': 3.0, 'pt_mult': 0.5, 'sl_mult': 5.0, 'td_mins': 120}. Best is trial 393 with value: 2.627710256873383.
[I 2026-03-12 02:04:49,513] Trial 768 finished with value: 2.627710256873383 and parameters: {'timeframe': 'M15', 'atr_period': 13, 'atr_threshold': 3.0, 'pt_mult': 0.5, 'sl_mult': 5.0, 'td_mins': 120}. Best is trial 393 with value: 2.627710256873383.
[I 2026-03-12 02:04:49,791] Trial 769 finished with value: 2.627710256873383 and parameters: {'timeframe': 'M15', 'atr_period': 13, 'atr_threshold': 3.0, 'pt_mult': 0.5, 'sl_mult': 5.0, 'td_mins': 120}. Best is trial 393 with value: 2.627710256873383.
[I 2026-03-12 02:04:49,848] Trial 770 pruned. 
[I 2026-03-12 02:04:49,967] Trial 771 pruned. 
[I 2026-03-12 02:04:50,263] Trial 772 finished with value: 2.627710256873383 and parameters: {'timeframe': 'M15', 'atr_period': 13, 'atr_threshold': 3.0, 'pt_mult': 0.5, 'sl_mult': 5.0, 'td_mins': 120}. Best is trial 393 with value: 2.627710256873383.
[I 2026-03-12 02:04:50,886] Trial 773 finished with value: 2.0428449374313256 and parameters: {'timeframe': 'M15', 'atr_period': 13, 'atr_threshold': 3.0, 'pt_mult': 0.5, 'sl_mult': 5.0, 'td_mins': 360}. Best is trial 393 with value: 2.627710256873383.
[I 2026-03-12 02:04:50,938] Trial 774 pruned. 
[I 2026-03-12 02:04:51,129] Trial 775 pruned. 
[I 2026-03-12 02:04:51,409] Trial 776 finished with value: 2.627710256873383 and parameters: {'timeframe': 'M15', 'atr_period': 13, 'atr_threshold': 3.0, 'pt_mult': 0.5, 'sl_mult': 5.0, 'td_mins': 120}. Best is trial 393 with value: 2.627710256873383.
[I 2026-03-12 02:04:51,727] Trial 777 finished with value: 2.627710256873383 and parameters: {'timeframe': 'M15', 'atr_period': 13, 'atr_threshold': 3.0, 'pt_mult': 0.5, 'sl_mult': 5.0, 'td_mins': 120}. Best is trial 393 with value: 2.627710256873383.
[I 2026-03-12 02:04:52,025] Trial 778 finished with value: 2.627710256873383 and parameters: {'timeframe': 'M15', 'atr_period': 13, 'atr_threshold': 3.0, 'pt_mult': 0.5, 'sl_mult': 5.0, 'td_mins': 120}. Best is trial 393 with value: 2.627710256873383.
[I 2026-03-12 02:04:52,153] Trial 779 pruned. 
[I 2026-03-12 02:04:52,254] Trial 780 finished with value: 2.3304526166289325 and parameters: {'timeframe': 'M15', 'atr_period': 13, 'atr_threshold': 5.0, 'pt_mult': 0.5, 'sl_mult': 5.0, 'td_mins': 60}. Best is trial 393 with value: 2.627710256873383.
[I 2026-03-12 02:04:52,532] Trial 781 finished with value: 2.627710256873383 and parameters: {'timeframe': 'M15', 'atr_period': 13, 'atr_threshold': 3.0, 'pt_mult': 0.5, 'sl_mult': 5.0, 'td_mins': 120}. Best is trial 393 with value: 2.627710256873383.
[I 2026-03-12 02:04:52,837] Trial 782 finished with value: 2.627710256873383 and parameters: {'timeframe': 'M15', 'atr_period': 13, 'atr_threshold': 3.0, 'pt_mult': 0.5, 'sl_mult': 5.0, 'td_mins': 120}. Best is trial 393 with value: 2.627710256873383.
[I 2026-03-12 02:04:53,127] Trial 783 finished with value: 2.627710256873383 and parameters: {'timeframe': 'M15', 'atr_period': 13, 'atr_threshold': 3.0, 'pt_mult': 0.5, 'sl_mult': 5.0, 'td_mins': 120}. Best is trial 393 with value: 2.627710256873383.
[I 2026-03-12 02:04:53,406] Trial 784 finished with value: 2.627710256873383 and parameters: {'timeframe': 'M15', 'atr_period': 13, 'atr_threshold': 3.0, 'pt_mult': 0.5, 'sl_mult': 5.0, 'td_mins': 120}. Best is trial 393 with value: 2.627710256873383.
[I 2026-03-12 02:04:53,457] Trial 785 finished with value: 0.0 and parameters: {'timeframe': 'M15', 'atr_period': 13, 'atr_threshold': 10.0, 'pt_mult': 1.0, 'sl_mult': 2.5, 'td_mins': 15}. Best is trial 393 with value: 2.627710256873383.
[I 2026-03-12 02:04:54,298] Trial 786 pruned. 
[I 2026-03-12 02:04:54,580] Trial 787 finished with value: 2.627710256873383 and parameters: {'timeframe': 'M15', 'atr_period': 13, 'atr_threshold': 3.0, 'pt_mult': 0.5, 'sl_mult': 5.0, 'td_mins': 120}. Best is trial 393 with value: 2.627710256873383.
[I 2026-03-12 02:04:54,885] Trial 788 finished with value: 2.627710256873383 and parameters: {'timeframe': 'M15', 'atr_period': 13, 'atr_threshold': 3.0, 'pt_mult': 0.5, 'sl_mult': 5.0, 'td_mins': 120}. Best is trial 393 with value: 2.627710256873383.
[I 2026-03-12 02:04:55,038] Trial 789 pruned. 
[I 2026-03-12 02:04:55,110] Trial 790 pruned. 
[I 2026-03-12 02:04:55,438] Trial 791 finished with value: 2.627710256873383 and parameters: {'timeframe': 'M15', 'atr_period': 13, 'atr_threshold': 3.0, 'pt_mult': 0.5, 'sl_mult': 5.0, 'td_mins': 120}. Best is trial 393 with value: 2.627710256873383.
[I 2026-03-12 02:04:55,489] Trial 792 finished with value: 0.0 and parameters: {'timeframe': 'M15', 'atr_period': 13, 'atr_threshold': 15.0, 'pt_mult': 0.5, 'sl_mult': 2.5, 'td_mins': 30}. Best is trial 393 with value: 2.627710256873383.
[I 2026-03-12 02:04:55,541] Trial 793 finished with value: 0.0 and parameters: {'timeframe': 'M15', 'atr_period': 13, 'atr_threshold': 15.0, 'pt_mult': 2.5, 'sl_mult': 1.0, 'td_mins': 5}. Best is trial 393 with value: 2.627710256873383.
[I 2026-03-12 02:04:56,669] Trial 794 pruned. 
[I 2026-03-12 02:04:56,957] Trial 795 finished with value: 2.627710256873383 and parameters: {'timeframe': 'M15', 'atr_period': 13, 'atr_threshold': 3.0, 'pt_mult': 0.5, 'sl_mult': 5.0, 'td_mins': 120}. Best is trial 393 with value: 2.627710256873383.
[I 2026-03-12 02:04:57,008] Trial 796 finished with value: 0.0 and parameters: {'timeframe': 'M15', 'atr_period': 13, 'atr_threshold': 10.0, 'pt_mult': 5.0, 'sl_mult': 0.5, 'td_mins': 5}. Best is trial 393 with value: 2.627710256873383.
[I 2026-03-12 02:04:57,340] Trial 797 pruned. 
[I 2026-03-12 02:04:57,419] Trial 798 pruned. 
[I 2026-03-12 02:04:57,599] Trial 799 finished with value: 1.2256445818569872 and parameters: {'timeframe': 'M15', 'atr_period': 13, 'atr_threshold': 5.0, 'pt_mult': 5.0, 'sl_mult': 5.0, 'td_mins': 180}. Best is trial 393 with value: 2.627710256873383.
[I 2026-03-12 02:04:57,674] Trial 800 pruned. 
[I 2026-03-12 02:04:57,725] Trial 801 pruned. 
[I 2026-03-12 02:04:58,008] Trial 802 finished with value: 2.627710256873383 and parameters: {'timeframe': 'M15', 'atr_period': 13, 'atr_threshold': 3.0, 'pt_mult': 0.5, 'sl_mult': 5.0, 'td_mins': 120}. Best is trial 393 with value: 2.627710256873383.
[I 2026-03-12 02:04:58,073] Trial 803 pruned. 
[I 2026-03-12 02:04:58,126] Trial 804 finished with value: 0.0 and parameters: {'timeframe': 'M15', 'atr_period': 13, 'atr_threshold': 15.0, 'pt_mult': 0.5, 'sl_mult': 5.0, 'td_mins': 120}. Best is trial 393 with value: 2.627710256873383.
[I 2026-03-12 02:04:58,393] Trial 805 finished with value: 2.627710256873383 and parameters: {'timeframe': 'M15', 'atr_period': 13, 'atr_threshold': 3.0, 'pt_mult': 0.5, 'sl_mult': 5.0, 'td_mins': 120}. Best is trial 393 with value: 2.627710256873383.
[I 2026-03-12 02:04:58,579] Trial 806 finished with value: 2.4190348657869114 and parameters: {'timeframe': 'M15', 'atr_period': 13, 'atr_threshold': 3.0, 'pt_mult': 0.5, 'sl_mult': 5.0, 'td_mins': 60}. Best is trial 393 with value: 2.627710256873383.
[I 2026-03-12 02:04:58,631] Trial 807 finished with value: 0.0 and parameters: {'timeframe': 'M15', 'atr_period': 13, 'atr_threshold': 15.0, 'pt_mult': 5.0, 'sl_mult': 0.5, 'td_mins': 15}. Best is trial 393 with value: 2.627710256873383.
[I 2026-03-12 02:04:58,827] Trial 808 pruned. 
[I 2026-03-12 02:04:58,876] Trial 809 finished with value: 0.0 and parameters: {'timeframe': 'M15', 'atr_period': 13, 'atr_threshold': 15.0, 'pt_mult': 0.5, 'sl_mult': 2.5, 'td_mins': 60}. Best is trial 393 with value: 2.627710256873383.
[I 2026-03-12 02:04:58,962] Trial 810 pruned. 
[I 2026-03-12 02:04:59,038] Trial 811 pruned. 
[I 2026-03-12 02:04:59,121] Trial 812 pruned. 
[I 2026-03-12 02:04:59,368] Trial 813 finished with value: 1.4691821545141823 and parameters: {'timeframe': 'M15', 'atr_period': 13, 'atr_threshold': 5.0, 'pt_mult': 0.5, 'sl_mult': 5.0, 'td_mins': 360}. Best is trial 393 with value: 2.627710256873383.
[I 2026-03-12 02:04:59,442] Trial 814 pruned. 
[I 2026-03-12 02:04:59,719] Trial 815 pruned. 
[I 2026-03-12 02:04:59,794] Trial 816 pruned. 
[I 2026-03-12 02:04:59,848] Trial 817 finished with value: 0.0 and parameters: {'timeframe': 'M15', 'atr_period': 13, 'atr_threshold': 10.0, 'pt_mult': 2.5, 'sl_mult': 0.5, 'td_mins': 720}. Best is trial 393 with value: 2.627710256873383.
[I 2026-03-12 02:05:00,250] Trial 818 pruned. 
[I 2026-03-12 02:05:00,430] Trial 819 finished with value: 1.4934353363723771 and parameters: {'timeframe': 'M15', 'atr_period': 13, 'atr_threshold': 5.0, 'pt_mult': 2.5, 'sl_mult': 5.0, 'td_mins': 120}. Best is trial 393 with value: 2.627710256873383.
[I 2026-03-12 02:05:00,566] Trial 820 pruned. 
[I 2026-03-12 02:05:00,616] Trial 821 finished with value: 0.0 and parameters: {'timeframe': 'M15', 'atr_period': 13, 'atr_threshold': 15.0, 'pt_mult': 2.5, 'sl_mult': 2.5, 'td_mins': 60}. Best is trial 393 with value: 2.627710256873383.
[I 2026-03-12 02:05:00,679] Trial 822 pruned. 
[I 2026-03-12 02:05:00,955] Trial 823 finished with value: 2.627710256873383 and parameters: {'timeframe': 'M15', 'atr_period': 13, 'atr_threshold': 3.0, 'pt_mult': 0.5, 'sl_mult': 5.0, 'td_mins': 120}. Best is trial 393 with value: 2.627710256873383.
[I 2026-03-12 02:05:01,021] Trial 824 pruned. 
[I 2026-03-12 02:05:01,257] Trial 825 pruned. 
[I 2026-03-12 02:05:01,469] Trial 826 pruned. 
[I 2026-03-12 02:05:01,520] Trial 827 pruned. 
[I 2026-03-12 02:05:01,576] Trial 828 finished with value: 0.0 and parameters: {'timeframe': 'M15', 'atr_period': 13, 'atr_threshold': 10.0, 'pt_mult': 0.5, 'sl_mult': 5.0, 'td_mins': 120}. Best is trial 393 with value: 2.627710256873383.
[I 2026-03-12 02:05:01,629] Trial 829 finished with value: 0.0 and parameters: {'timeframe': 'M15', 'atr_period': 13, 'atr_threshold': 15.0, 'pt_mult': 1.0, 'sl_mult': 5.0, 'td_mins': 15}. Best is trial 393 with value: 2.627710256873383.
[I 2026-03-12 02:05:01,983] Trial 830 finished with value: 2.4490491384580553 and parameters: {'timeframe': 'M15', 'atr_period': 13, 'atr_threshold': 3.0, 'pt_mult': 0.5, 'sl_mult': 5.0, 'td_mins': 180}. Best is trial 393 with value: 2.627710256873383.
[I 2026-03-12 02:05:02,034] Trial 831 finished with value: 0.0 and parameters: {'timeframe': 'M15', 'atr_period': 13, 'atr_threshold': 10.0, 'pt_mult': 5.0, 'sl_mult': 1.0, 'td_mins': 1080}. Best is trial 393 with value: 2.627710256873383.
[I 2026-03-12 02:05:02,091] Trial 832 pruned. 
[I 2026-03-12 02:05:02,205] Trial 833 pruned. 
[I 2026-03-12 02:05:02,481] Trial 834 finished with value: 2.627710256873383 and parameters: {'timeframe': 'M15', 'atr_period': 13, 'atr_threshold': 3.0, 'pt_mult': 0.5, 'sl_mult': 5.0, 'td_mins': 120}. Best is trial 393 with value: 2.627710256873383.
[I 2026-03-12 02:05:02,533] Trial 835 finished with value: 0.0 and parameters: {'timeframe': 'M15', 'atr_period': 13, 'atr_threshold': 10.0, 'pt_mult': 5.0, 'sl_mult': 0.5, 'td_mins': 360}. Best is trial 393 with value: 2.627710256873383.
[I 2026-03-12 02:05:02,815] Trial 836 pruned. 
[I 2026-03-12 02:05:02,888] Trial 837 pruned. 
[I 2026-03-12 02:05:02,947] Trial 838 pruned. 
[I 2026-03-12 02:05:03,058] Trial 839 pruned. 
[I 2026-03-12 02:05:03,108] Trial 840 finished with value: 0.0 and parameters: {'timeframe': 'M15', 'atr_period': 13, 'atr_threshold': 10.0, 'pt_mult': 5.0, 'sl_mult': 0.5, 'td_mins': 30}. Best is trial 393 with value: 2.627710256873383.
