[I 2026-03-12 01:03:53,555] Trial 529 finished with value: 2.2537359686354455 and parameters: {'timeframe': 'M8', 'atr_period': 13, 'atr_threshold': 3.0, 'pt_mult': 0.5, 'sl_mult': 5.0, 'td_mins': 60}. Best is trial 57 with value: 2.2537359686354455.
[I 2026-03-12 01:03:53,601] Trial 530 finished with value: 0.0 and parameters: {'timeframe': 'M8', 'atr_period': 13, 'atr_threshold': 10.0, 'pt_mult': 0.5, 'sl_mult': 5.0, 'td_mins': 180}. Best is trial 57 with value: 2.2537359686354455.
[I 2026-03-12 01:03:53,660] Trial 531 finished with value: 0.0 and parameters: {'timeframe': 'M8', 'atr_period': 13, 'atr_threshold': 8.0, 'pt_mult': 5.0, 'sl_mult': 5.0, 'td_mins': 60}. Best is trial 57 with value: 2.2537359686354455.
[I 2026-03-12 01:03:53,714] Trial 532 finished with value: 0.0 and parameters: {'timeframe': 'M8', 'atr_period': 13, 'atr_threshold': 15.0, 'pt_mult': 2.5, 'sl_mult': 5.0, 'td_mins': 60}. Best is trial 57 with value: 2.2537359686354455.
[I 2026-03-12 01:03:53,904] Trial 533 finished with value: 2.2537359686354455 and parameters: {'timeframe': 'M8', 'atr_period': 13, 'atr_threshold': 3.0, 'pt_mult': 0.5, 'sl_mult': 5.0, 'td_mins': 60}. Best is trial 57 with value: 2.2537359686354455.
[I 2026-03-12 01:03:54,471] Trial 534 pruned. 
[I 2026-03-12 01:03:54,678] Trial 535 finished with value: 2.2537359686354455 and parameters: {'timeframe': 'M8', 'atr_period': 13, 'atr_threshold': 3.0, 'pt_mult': 0.5, 'sl_mult': 5.0, 'td_mins': 60}. Best is trial 57 with value: 2.2537359686354455.
[I 2026-03-12 01:03:54,778] Trial 536 pruned. 
[I 2026-03-12 01:03:54,914] Trial 537 pruned. 
[I 2026-03-12 01:03:55,123] Trial 538 finished with value: 2.2537359686354455 and parameters: {'timeframe': 'M8', 'atr_period': 13, 'atr_threshold': 3.0, 'pt_mult': 0.5, 'sl_mult': 5.0, 'td_mins': 60}. Best is trial 57 with value: 2.2537359686354455.
[I 2026-03-12 01:03:55,327] Trial 539 finished with value: 2.2537359686354455 and parameters: {'timeframe': 'M8', 'atr_period': 13, 'atr_threshold': 3.0, 'pt_mult': 0.5, 'sl_mult': 5.0, 'td_mins': 60}. Best is trial 57 with value: 2.2537359686354455.
[I 2026-03-12 01:03:55,381] Trial 540 pruned. 
[I 2026-03-12 01:03:55,595] Trial 541 finished with value: 2.2537359686354455 and parameters: {'timeframe': 'M8', 'atr_period': 13, 'atr_threshold': 3.0, 'pt_mult': 0.5, 'sl_mult': 5.0, 'td_mins': 60}. Best is trial 57 with value: 2.2537359686354455.
[I 2026-03-12 01:03:55,704] Trial 542 pruned. 
[I 2026-03-12 01:03:55,766] Trial 543 finished with value: 0.0 and parameters: {'timeframe': 'M8', 'atr_period': 13, 'atr_threshold': 10.0, 'pt_mult': 0.5, 'sl_mult': 5.0, 'td_mins': 60}. Best is trial 57 with value: 2.2537359686354455.
[I 2026-03-12 01:03:55,830] Trial 544 pruned. 
[I 2026-03-12 01:03:56,022] Trial 545 finished with value: 2.2537359686354455 and parameters: {'timeframe': 'M8', 'atr_period': 13, 'atr_threshold': 3.0, 'pt_mult': 0.5, 'sl_mult': 5.0, 'td_mins': 60}. Best is trial 57 with value: 2.2537359686354455.
[I 2026-03-12 01:03:56,227] Trial 546 pruned. 
[I 2026-03-12 01:03:56,405] Trial 547 finished with value: 2.2537359686354455 and parameters: {'timeframe': 'M8', 'atr_period': 13, 'atr_threshold': 3.0, 'pt_mult': 0.5, 'sl_mult': 5.0, 'td_mins': 60}. Best is trial 57 with value: 2.2537359686354455.
[I 2026-03-12 01:03:56,452] Trial 548 finished with value: 0.0 and parameters: {'timeframe': 'M8', 'atr_period': 13, 'atr_threshold': 8.0, 'pt_mult': 0.5, 'sl_mult': 5.0, 'td_mins': 5}. Best is trial 57 with value: 2.2537359686354455.
[I 2026-03-12 01:03:56,518] Trial 549 finished with value: 1.6077355067038568 and parameters: {'timeframe': 'M8', 'atr_period': 13, 'atr_threshold': 5.0, 'pt_mult': 0.5, 'sl_mult': 5.0, 'td_mins': 15}. Best is trial 57 with value: 2.2537359686354455.
[I 2026-03-12 01:03:56,566] Trial 550 finished with value: 0.0 and parameters: {'timeframe': 'M8', 'atr_period': 13, 'atr_threshold': 8.0, 'pt_mult': 1.0, 'sl_mult': 5.0, 'td_mins': 60}. Best is trial 57 with value: 2.2537359686354455.
[I 2026-03-12 01:03:56,615] Trial 551 finished with value: 0.0 and parameters: {'timeframe': 'M8', 'atr_period': 13, 'atr_threshold': 10.0, 'pt_mult': 0.5, 'sl_mult': 5.0, 'td_mins': 30}. Best is trial 57 with value: 2.2537359686354455.
[I 2026-03-12 01:03:56,661] Trial 552 finished with value: 0.0 and parameters: {'timeframe': 'M8', 'atr_period': 13, 'atr_threshold': 15.0, 'pt_mult': 0.5, 'sl_mult': 1.0, 'td_mins': 60}. Best is trial 57 with value: 2.2537359686354455.
[I 2026-03-12 01:03:56,853] Trial 553 pruned. 
[I 2026-03-12 01:03:57,053] Trial 554 finished with value: 2.2537359686354455 and parameters: {'timeframe': 'M8', 'atr_period': 13, 'atr_threshold': 3.0, 'pt_mult': 0.5, 'sl_mult': 5.0, 'td_mins': 60}. Best is trial 57 with value: 2.2537359686354455.
[I 2026-03-12 01:03:57,257] Trial 555 finished with value: 2.2537359686354455 and parameters: {'timeframe': 'M8', 'atr_period': 13, 'atr_threshold': 3.0, 'pt_mult': 0.5, 'sl_mult': 5.0, 'td_mins': 60}. Best is trial 57 with value: 2.2537359686354455.
[I 2026-03-12 01:03:57,306] Trial 556 finished with value: 0.0 and parameters: {'timeframe': 'M8', 'atr_period': 13, 'atr_threshold': 15.0, 'pt_mult': 0.5, 'sl_mult': 5.0, 'td_mins': 30}. Best is trial 57 with value: 2.2537359686354455.
[I 2026-03-12 01:03:57,355] Trial 557 finished with value: 0.0 and parameters: {'timeframe': 'M8', 'atr_period': 13, 'atr_threshold': 8.0, 'pt_mult': 0.5, 'sl_mult': 5.0, 'td_mins': 360}. Best is trial 57 with value: 2.2537359686354455.
[I 2026-03-12 01:03:57,404] Trial 558 finished with value: 0.0 and parameters: {'timeframe': 'M8', 'atr_period': 13, 'atr_threshold': 8.0, 'pt_mult': 0.5, 'sl_mult': 2.5, 'td_mins': 60}. Best is trial 57 with value: 2.2537359686354455.
[I 2026-03-12 01:03:57,566] Trial 559 pruned. 
[I 2026-03-12 01:03:57,990] Trial 560 pruned. 
[I 2026-03-12 01:03:58,922] Trial 561 pruned. 
[I 2026-03-12 01:03:59,102] Trial 562 finished with value: 2.2537359686354455 and parameters: {'timeframe': 'M8', 'atr_period': 13, 'atr_threshold': 3.0, 'pt_mult': 0.5, 'sl_mult': 5.0, 'td_mins': 60}. Best is trial 57 with value: 2.2537359686354455.
[I 2026-03-12 01:03:59,189] Trial 563 pruned. 
[I 2026-03-12 01:03:59,249] Trial 564 pruned. 
[I 2026-03-12 01:03:59,444] Trial 565 pruned. 
[I 2026-03-12 01:03:59,517] Trial 566 pruned. 
[I 2026-03-12 01:03:59,565] Trial 567 finished with value: 0.0 and parameters: {'timeframe': 'M8', 'atr_period': 13, 'atr_threshold': 10.0, 'pt_mult': 5.0, 'sl_mult': 5.0, 'td_mins': 60}. Best is trial 57 with value: 2.2537359686354455.
[I 2026-03-12 01:03:59,899] Trial 568 pruned. 
[I 2026-03-12 01:04:00,070] Trial 569 pruned. 
[I 2026-03-12 01:04:00,260] Trial 570 finished with value: 2.2537359686354455 and parameters: {'timeframe': 'M8', 'atr_period': 13, 'atr_threshold': 3.0, 'pt_mult': 0.5, 'sl_mult': 5.0, 'td_mins': 60}. Best is trial 57 with value: 2.2537359686354455.
[I 2026-03-12 01:04:00,437] Trial 571 finished with value: 2.2537359686354455 and parameters: {'timeframe': 'M8', 'atr_period': 13, 'atr_threshold': 3.0, 'pt_mult': 0.5, 'sl_mult': 5.0, 'td_mins': 60}. Best is trial 57 with value: 2.2537359686354455.
[I 2026-03-12 01:04:00,487] Trial 572 pruned. 
[I 2026-03-12 01:04:00,549] Trial 573 pruned. 
[I 2026-03-12 01:04:00,742] Trial 574 finished with value: 2.2537359686354455 and parameters: {'timeframe': 'M8', 'atr_period': 13, 'atr_threshold': 3.0, 'pt_mult': 0.5, 'sl_mult': 5.0, 'td_mins': 60}. Best is trial 57 with value: 2.2537359686354455.
[I 2026-03-12 01:04:00,806] Trial 575 pruned. 
[I 2026-03-12 01:04:00,856] Trial 576 finished with value: 0.0 and parameters: {'timeframe': 'M8', 'atr_period': 13, 'atr_threshold': 8.0, 'pt_mult': 0.5, 'sl_mult': 5.0, 'td_mins': 1200}. Best is trial 57 with value: 2.2537359686354455.
[I 2026-03-12 01:04:01,008] Trial 577 pruned. 
[I 2026-03-12 01:04:01,130] Trial 578 pruned. 
[I 2026-03-12 01:04:01,319] Trial 579 finished with value: 2.2537359686354455 and parameters: {'timeframe': 'M8', 'atr_period': 13, 'atr_threshold': 3.0, 'pt_mult': 0.5, 'sl_mult': 5.0, 'td_mins': 60}. Best is trial 57 with value: 2.2537359686354455.
[I 2026-03-12 01:04:01,675] Trial 580 finished with value: 1.873475734000655 and parameters: {'timeframe': 'M8', 'atr_period': 13, 'atr_threshold': 3.0, 'pt_mult': 0.5, 'sl_mult': 5.0, 'td_mins': 180}. Best is trial 57 with value: 2.2537359686354455.
[I 2026-03-12 01:04:01,737] Trial 581 pruned. 
[I 2026-03-12 01:04:01,809] Trial 582 pruned. 
[I 2026-03-12 01:04:01,861] Trial 583 finished with value: 0.0 and parameters: {'timeframe': 'M8', 'atr_period': 13, 'atr_threshold': 8.0, 'pt_mult': 0.5, 'sl_mult': 5.0, 'td_mins': 60}. Best is trial 57 with value: 2.2537359686354455.
[I 2026-03-12 01:04:01,930] Trial 584 pruned. 
[I 2026-03-12 01:04:01,981] Trial 585 finished with value: 0.0 and parameters: {'timeframe': 'M8', 'atr_period': 13, 'atr_threshold': 8.0, 'pt_mult': 1.0, 'sl_mult': 2.5, 'td_mins': 360}. Best is trial 57 with value: 2.2537359686354455.
[I 2026-03-12 01:04:02,212] Trial 586 pruned. 
[I 2026-03-12 01:04:02,287] Trial 587 pruned. 
[I 2026-03-12 01:04:02,340] Trial 588 finished with value: 0.0 and parameters: {'timeframe': 'M8', 'atr_period': 13, 'atr_threshold': 8.0, 'pt_mult': 1.0, 'sl_mult': 2.5, 'td_mins': 180}. Best is trial 57 with value: 2.2537359686354455.
[I 2026-03-12 01:04:02,405] Trial 589 pruned. 
[I 2026-03-12 01:04:02,468] Trial 590 pruned. 
[I 2026-03-12 01:04:02,648] Trial 591 finished with value: 2.2537359686354455 and parameters: {'timeframe': 'M8', 'atr_period': 13, 'atr_threshold': 3.0, 'pt_mult': 0.5, 'sl_mult': 5.0, 'td_mins': 60}. Best is trial 57 with value: 2.2537359686354455.
[I 2026-03-12 01:04:03,717] Trial 592 pruned. 
[I 2026-03-12 01:04:03,820] Trial 593 pruned. 
[I 2026-03-12 01:04:03,999] Trial 594 finished with value: 0.95006934726715 and parameters: {'timeframe': 'M8', 'atr_period': 13, 'atr_threshold': 5.0, 'pt_mult': 0.5, 'sl_mult': 5.0, 'td_mins': 360}. Best is trial 57 with value: 2.2537359686354455.
[I 2026-03-12 01:04:04,149] Trial 595 pruned. 
[I 2026-03-12 01:04:04,277] Trial 596 finished with value: 2.1772538297610624 and parameters: {'timeframe': 'M8', 'atr_period': 13, 'atr_threshold': 3.0, 'pt_mult': 0.5, 'sl_mult': 5.0, 'td_mins': 30}. Best is trial 57 with value: 2.2537359686354455.
[I 2026-03-12 01:04:04,329] Trial 597 pruned. 
[I 2026-03-12 01:04:04,511] Trial 598 finished with value: 2.2537359686354455 and parameters: {'timeframe': 'M8', 'atr_period': 13, 'atr_threshold': 3.0, 'pt_mult': 0.5, 'sl_mult': 5.0, 'td_mins': 60}. Best is trial 57 with value: 2.2537359686354455.
[I 2026-03-12 01:04:04,699] Trial 599 pruned. 
[I 2026-03-12 01:04:04,746] Trial 600 finished with value: 0.0 and parameters: {'timeframe': 'M8', 'atr_period': 13, 'atr_threshold': 10.0, 'pt_mult': 0.5, 'sl_mult': 5.0, 'td_mins': 360}. Best is trial 57 with value: 2.2537359686354455.
[I 2026-03-12 01:04:04,921] Trial 601 pruned. 
[I 2026-03-12 01:04:04,981] Trial 602 pruned. 
[I 2026-03-12 01:04:05,031] Trial 603 finished with value: 0.0 and parameters: {'timeframe': 'M8', 'atr_period': 13, 'atr_threshold': 8.0, 'pt_mult': 1.0, 'sl_mult': 0.5, 'td_mins': 5}. Best is trial 57 with value: 2.2537359686354455.
[I 2026-03-12 01:04:05,219] Trial 604 finished with value: 2.2537359686354455 and parameters: {'timeframe': 'M8', 'atr_period': 13, 'atr_threshold': 3.0, 'pt_mult': 0.5, 'sl_mult': 5.0, 'td_mins': 60}. Best is trial 57 with value: 2.2537359686354455.
[I 2026-03-12 01:04:05,278] Trial 605 pruned. 
[I 2026-03-12 01:04:05,333] Trial 606 finished with value: 0.0 and parameters: {'timeframe': 'M8', 'atr_period': 13, 'atr_threshold': 10.0, 'pt_mult': 0.5, 'sl_mult': 5.0, 'td_mins': 1200}. Best is trial 57 with value: 2.2537359686354455.
[I 2026-03-12 01:04:05,416] Trial 607 pruned. 
[I 2026-03-12 01:04:05,477] Trial 608 finished with value: 0.0 and parameters: {'timeframe': 'M8', 'atr_period': 13, 'atr_threshold': 10.0, 'pt_mult': 0.5, 'sl_mult': 2.5, 'td_mins': 120}. Best is trial 57 with value: 2.2537359686354455.
[I 2026-03-12 01:04:05,776] Trial 609 finished with value: 2.0351127905379403 and parameters: {'timeframe': 'M8', 'atr_period': 13, 'atr_threshold': 3.0, 'pt_mult': 0.5, 'sl_mult': 5.0, 'td_mins': 120}. Best is trial 57 with value: 2.2537359686354455.
[I 2026-03-12 01:04:05,826] Trial 610 finished with value: 0.0 and parameters: {'timeframe': 'M8', 'atr_period': 13, 'atr_threshold': 15.0, 'pt_mult': 0.5, 'sl_mult': 5.0, 'td_mins': 15}. Best is trial 57 with value: 2.2537359686354455.
[I 2026-03-12 01:04:06,010] Trial 611 finished with value: 2.2537359686354455 and parameters: {'timeframe': 'M8', 'atr_period': 13, 'atr_threshold': 3.0, 'pt_mult': 0.5, 'sl_mult': 5.0, 'td_mins': 60}. Best is trial 57 with value: 2.2537359686354455.
[I 2026-03-12 01:04:06,205] Trial 612 finished with value: 2.2537359686354455 and parameters: {'timeframe': 'M8', 'atr_period': 13, 'atr_threshold': 3.0, 'pt_mult': 0.5, 'sl_mult': 5.0, 'td_mins': 60}. Best is trial 57 with value: 2.2537359686354455.
[I 2026-03-12 01:04:06,300] Trial 613 pruned. 
[I 2026-03-12 01:04:06,495] Trial 614 finished with value: 2.2537359686354455 and parameters: {'timeframe': 'M8', 'atr_period': 13, 'atr_threshold': 3.0, 'pt_mult': 0.5, 'sl_mult': 5.0, 'td_mins': 60}. Best is trial 57 with value: 2.2537359686354455.
[I 2026-03-12 01:04:06,546] Trial 615 finished with value: 0.0 and parameters: {'timeframe': 'M8', 'atr_period': 13, 'atr_threshold': 15.0, 'pt_mult': 0.5, 'sl_mult': 5.0, 'td_mins': 60}. Best is trial 57 with value: 2.2537359686354455.
[I 2026-03-12 01:04:06,820] Trial 616 pruned. 
[I 2026-03-12 01:04:07,036] Trial 617 finished with value: 2.2537359686354455 and parameters: {'timeframe': 'M8', 'atr_period': 13, 'atr_threshold': 3.0, 'pt_mult': 0.5, 'sl_mult': 5.0, 'td_mins': 60}. Best is trial 57 with value: 2.2537359686354455.
[I 2026-03-12 01:04:07,239] Trial 618 finished with value: 2.2537359686354455 and parameters: {'timeframe': 'M8', 'atr_period': 13, 'atr_threshold': 3.0, 'pt_mult': 0.5, 'sl_mult': 5.0, 'td_mins': 60}. Best is trial 57 with value: 2.2537359686354455.
[I 2026-03-12 01:04:07,331] Trial 619 finished with value: 1.4188342665491664 and parameters: {'timeframe': 'M8', 'atr_period': 13, 'atr_threshold': 5.0, 'pt_mult': 0.5, 'sl_mult': 5.0, 'td_mins': 60}. Best is trial 57 with value: 2.2537359686354455.
[I 2026-03-12 01:04:07,518] Trial 620 finished with value: 2.2537359686354455 and parameters: {'timeframe': 'M8', 'atr_period': 13, 'atr_threshold': 3.0, 'pt_mult': 0.5, 'sl_mult': 5.0, 'td_mins': 60}. Best is trial 57 with value: 2.2537359686354455.
[I 2026-03-12 01:04:07,593] Trial 621 pruned. 
[I 2026-03-12 01:04:07,771] Trial 622 pruned. 
[I 2026-03-12 01:04:07,974] Trial 623 finished with value: 2.2537359686354455 and parameters: {'timeframe': 'M8', 'atr_period': 13, 'atr_threshold': 3.0, 'pt_mult': 0.5, 'sl_mult': 5.0, 'td_mins': 60}. Best is trial 57 with value: 2.2537359686354455.
[I 2026-03-12 01:04:08,166] Trial 624 finished with value: 2.2537359686354455 and parameters: {'timeframe': 'M8', 'atr_period': 13, 'atr_threshold': 3.0, 'pt_mult': 0.5, 'sl_mult': 5.0, 'td_mins': 60}. Best is trial 57 with value: 2.2537359686354455.
[I 2026-03-12 01:04:08,348] Trial 625 finished with value: 2.2537359686354455 and parameters: {'timeframe': 'M8', 'atr_period': 13, 'atr_threshold': 3.0, 'pt_mult': 0.5, 'sl_mult': 5.0, 'td_mins': 60}. Best is trial 57 with value: 2.2537359686354455.
[I 2026-03-12 01:04:08,534] Trial 626 pruned. 
[I 2026-03-12 01:04:08,840] Trial 627 pruned. 
[I 2026-03-12 01:04:08,947] Trial 628 pruned. 
[I 2026-03-12 01:04:09,134] Trial 629 finished with value: 2.2537359686354455 and parameters: {'timeframe': 'M8', 'atr_period': 13, 'atr_threshold': 3.0, 'pt_mult': 0.5, 'sl_mult': 5.0, 'td_mins': 60}. Best is trial 57 with value: 2.2537359686354455.
[I 2026-03-12 01:04:09,185] Trial 630 finished with value: 0.0 and parameters: {'timeframe': 'M8', 'atr_period': 13, 'atr_threshold': 15.0, 'pt_mult': 0.5, 'sl_mult': 5.0, 'td_mins': 120}. Best is trial 57 with value: 2.2537359686354455.
[I 2026-03-12 01:04:09,370] Trial 631 finished with value: 2.2537359686354455 and parameters: {'timeframe': 'M8', 'atr_period': 13, 'atr_threshold': 3.0, 'pt_mult': 0.5, 'sl_mult': 5.0, 'td_mins': 60}. Best is trial 57 with value: 2.2537359686354455.
[I 2026-03-12 01:04:09,500] Trial 632 pruned. 
[I 2026-03-12 01:04:09,562] Trial 633 pruned. 
[I 2026-03-12 01:04:09,616] Trial 634 finished with value: 0.0 and parameters: {'timeframe': 'M8', 'atr_period': 13, 'atr_threshold': 8.0, 'pt_mult': 2.5, 'sl_mult': 0.5, 'td_mins': 60}. Best is trial 57 with value: 2.2537359686354455.
[I 2026-03-12 01:04:09,791] Trial 635 pruned. 
[I 2026-03-12 01:04:09,844] Trial 636 pruned. 
[I 2026-03-12 01:04:09,898] Trial 637 finished with value: 0.0 and parameters: {'timeframe': 'M8', 'atr_period': 13, 'atr_threshold': 10.0, 'pt_mult': 2.5, 'sl_mult': 1.0, 'td_mins': 720}. Best is trial 57 with value: 2.2537359686354455.
[I 2026-03-12 01:04:10,083] Trial 638 finished with value: 2.2537359686354455 and parameters: {'timeframe': 'M8', 'atr_period': 13, 'atr_threshold': 3.0, 'pt_mult': 0.5, 'sl_mult': 5.0, 'td_mins': 60}. Best is trial 57 with value: 2.2537359686354455.
[I 2026-03-12 01:04:10,878] Trial 639 pruned. 
[I 2026-03-12 01:04:10,929] Trial 640 finished with value: 0.0 and parameters: {'timeframe': 'M8', 'atr_period': 13, 'atr_threshold': 15.0, 'pt_mult': 5.0, 'sl_mult': 2.5, 'td_mins': 180}. Best is trial 57 with value: 2.2537359686354455.
[I 2026-03-12 01:04:11,973] Trial 641 pruned. 
[I 2026-03-12 01:04:12,180] Trial 642 finished with value: 2.2537359686354455 and parameters: {'timeframe': 'M8', 'atr_period': 13, 'atr_threshold': 3.0, 'pt_mult': 0.5, 'sl_mult': 5.0, 'td_mins': 60}. Best is trial 57 with value: 2.2537359686354455.
[I 2026-03-12 01:04:12,372] Trial 643 finished with value: 2.2537359686354455 and parameters: {'timeframe': 'M8', 'atr_period': 13, 'atr_threshold': 3.0, 'pt_mult': 0.5, 'sl_mult': 5.0, 'td_mins': 60}. Best is trial 57 with value: 2.2537359686354455.
[I 2026-03-12 01:04:12,420] Trial 644 finished with value: 0.0 and parameters: {'timeframe': 'M8', 'atr_period': 13, 'atr_threshold': 10.0, 'pt_mult': 0.5, 'sl_mult': 5.0, 'td_mins': 60}. Best is trial 57 with value: 2.2537359686354455.
[I 2026-03-12 01:04:12,492] Trial 645 pruned. 
[I 2026-03-12 01:04:12,542] Trial 646 finished with value: 0.0 and parameters: {'timeframe': 'M8', 'atr_period': 13, 'atr_threshold': 10.0, 'pt_mult': 2.5, 'sl_mult': 1.0, 'td_mins': 15}. Best is trial 57 with value: 2.2537359686354455.
[I 2026-03-12 01:04:12,603] Trial 647 pruned. 
[I 2026-03-12 01:04:12,812] Trial 648 finished with value: 2.2537359686354455 and parameters: {'timeframe': 'M8', 'atr_period': 13, 'atr_threshold': 3.0, 'pt_mult': 0.5, 'sl_mult': 5.0, 'td_mins': 60}. Best is trial 57 with value: 2.2537359686354455.
[I 2026-03-12 01:04:12,998] Trial 649 finished with value: 2.2537359686354455 and parameters: {'timeframe': 'M8', 'atr_period': 13, 'atr_threshold': 3.0, 'pt_mult': 0.5, 'sl_mult': 5.0, 'td_mins': 60}. Best is trial 57 with value: 2.2537359686354455.
[I 2026-03-12 01:04:13,177] Trial 650 finished with value: 2.2537359686354455 and parameters: {'timeframe': 'M8', 'atr_period': 13, 'atr_threshold': 3.0, 'pt_mult': 0.5, 'sl_mult': 5.0, 'td_mins': 60}. Best is trial 57 with value: 2.2537359686354455.
[I 2026-03-12 01:04:13,702] Trial 651 pruned. 
[I 2026-03-12 01:04:13,882] Trial 652 pruned. 
[I 2026-03-12 01:04:14,518] Trial 653 pruned. 
[I 2026-03-12 01:04:14,639] Trial 654 pruned. 
[I 2026-03-12 01:04:14,866] Trial 655 finished with value: 2.2537359686354455 and parameters: {'timeframe': 'M8', 'atr_period': 13, 'atr_threshold': 3.0, 'pt_mult': 0.5, 'sl_mult': 5.0, 'td_mins': 60}. Best is trial 57 with value: 2.2537359686354455.
[I 2026-03-12 01:04:15,072] Trial 656 finished with value: 2.2537359686354455 and parameters: {'timeframe': 'M8', 'atr_period': 13, 'atr_threshold': 3.0, 'pt_mult': 0.5, 'sl_mult': 5.0, 'td_mins': 60}. Best is trial 57 with value: 2.2537359686354455.
[I 2026-03-12 01:04:15,286] Trial 657 finished with value: 2.2537359686354455 and parameters: {'timeframe': 'M8', 'atr_period': 13, 'atr_threshold': 3.0, 'pt_mult': 0.5, 'sl_mult': 5.0, 'td_mins': 60}. Best is trial 57 with value: 2.2537359686354455.
[I 2026-03-12 01:04:15,525] Trial 658 pruned. 
[I 2026-03-12 01:04:15,572] Trial 659 finished with value: 0.0 and parameters: {'timeframe': 'M8', 'atr_period': 13, 'atr_threshold': 8.0, 'pt_mult': 5.0, 'sl_mult': 2.5, 'td_mins': 1080}. Best is trial 57 with value: 2.2537359686354455.
[I 2026-03-12 01:04:15,759] Trial 660 finished with value: 2.2537359686354455 and parameters: {'timeframe': 'M8', 'atr_period': 13, 'atr_threshold': 3.0, 'pt_mult': 0.5, 'sl_mult': 5.0, 'td_mins': 60}. Best is trial 57 with value: 2.2537359686354455.
[I 2026-03-12 01:04:15,814] Trial 661 finished with value: 0.0 and parameters: {'timeframe': 'M8', 'atr_period': 13, 'atr_threshold': 10.0, 'pt_mult': 5.0, 'sl_mult': 0.5, 'td_mins': 5}. Best is trial 57 with value: 2.2537359686354455.
[I 2026-03-12 01:04:16,017] Trial 662 finished with value: 2.2537359686354455 and parameters: {'timeframe': 'M8', 'atr_period': 13, 'atr_threshold': 3.0, 'pt_mult': 0.5, 'sl_mult': 5.0, 'td_mins': 60}. Best is trial 57 with value: 2.2537359686354455.
[I 2026-03-12 01:04:16,228] Trial 663 finished with value: 2.2537359686354455 and parameters: {'timeframe': 'M8', 'atr_period': 13, 'atr_threshold': 3.0, 'pt_mult': 0.5, 'sl_mult': 5.0, 'td_mins': 60}. Best is trial 57 with value: 2.2537359686354455.
[I 2026-03-12 01:04:16,285] Trial 664 finished with value: 0.0 and parameters: {'timeframe': 'M8', 'atr_period': 13, 'atr_threshold': 15.0, 'pt_mult': 0.5, 'sl_mult': 2.5, 'td_mins': 15}. Best is trial 57 with value: 2.2537359686354455.
[I 2026-03-12 01:04:16,363] Trial 665 pruned. 
[I 2026-03-12 01:04:16,428] Trial 666 pruned. 
