[I 2026-03-12 02:14:46,549] Trial 482 pruned. 
[I 2026-03-12 02:14:46,720] Trial 483 pruned. 
[I 2026-03-12 02:14:46,845] Trial 484 pruned. 
[I 2026-03-12 02:14:48,083] Trial 485 finished with value: 43.32685925026577 and parameters: {'timeframe': 'mixed', 'atr_period': 13, 'atr_threshold': 5.0, 'pt_mult': 0.5, 'sl_mult': 5.0, 'td_mins': 1080}. Best is trial 50 with value: 43.32685925026577.
[I 2026-03-12 02:14:48,266] Trial 486 pruned. 
[I 2026-03-12 02:14:48,431] Trial 487 pruned. 
[I 2026-03-12 02:14:48,617] Trial 488 finished with value: 0.0 and parameters: {'timeframe': 'mixed', 'atr_period': 13, 'atr_threshold': 10.0, 'pt_mult': 0.5, 'sl_mult': 0.5, 'td_mins': 1080}. Best is trial 50 with value: 43.32685925026577.
[I 2026-03-12 02:14:49,858] Trial 489 finished with value: 43.32685925026577 and parameters: {'timeframe': 'mixed', 'atr_period': 13, 'atr_threshold': 5.0, 'pt_mult': 0.5, 'sl_mult': 5.0, 'td_mins': 1080}. Best is trial 50 with value: 43.32685925026577.
[I 2026-03-12 02:14:50,978] Trial 490 finished with value: 43.32685925026577 and parameters: {'timeframe': 'mixed', 'atr_period': 13, 'atr_threshold': 5.0, 'pt_mult': 0.5, 'sl_mult': 5.0, 'td_mins': 1080}. Best is trial 50 with value: 43.32685925026577.
[I 2026-03-12 02:14:51,152] Trial 491 finished with value: 0.0 and parameters: {'timeframe': 'mixed', 'atr_period': 13, 'atr_threshold': 10.0, 'pt_mult': 0.5, 'sl_mult': 5.0, 'td_mins': 60}. Best is trial 50 with value: 43.32685925026577.
[I 2026-03-12 02:14:51,305] Trial 492 pruned. 
[I 2026-03-12 02:14:51,438] Trial 493 pruned. 
[I 2026-03-12 02:14:52,585] Trial 494 finished with value: 43.32685925026577 and parameters: {'timeframe': 'mixed', 'atr_period': 13, 'atr_threshold': 5.0, 'pt_mult': 0.5, 'sl_mult': 5.0, 'td_mins': 1080}. Best is trial 50 with value: 43.32685925026577.
[I 2026-03-12 02:14:53,754] Trial 495 finished with value: 43.32685925026577 and parameters: {'timeframe': 'mixed', 'atr_period': 13, 'atr_threshold': 5.0, 'pt_mult': 0.5, 'sl_mult': 5.0, 'td_mins': 1080}. Best is trial 50 with value: 43.32685925026577.
[I 2026-03-12 02:14:55,049] Trial 496 finished with value: 43.32685925026577 and parameters: {'timeframe': 'mixed', 'atr_period': 13, 'atr_threshold': 5.0, 'pt_mult': 0.5, 'sl_mult': 5.0, 'td_mins': 1080}. Best is trial 50 with value: 43.32685925026577.
[I 2026-03-12 02:14:55,192] Trial 497 pruned. 
[I 2026-03-12 02:14:55,366] Trial 498 finished with value: 0.0 and parameters: {'timeframe': 'mixed', 'atr_period': 13, 'atr_threshold': 10.0, 'pt_mult': 0.5, 'sl_mult': 5.0, 'td_mins': 120}. Best is trial 50 with value: 43.32685925026577.
[I 2026-03-12 02:14:55,532] Trial 499 finished with value: 0.0 and parameters: {'timeframe': 'mixed', 'atr_period': 13, 'atr_threshold': 15.0, 'pt_mult': 0.5, 'sl_mult': 5.0, 'td_mins': 60}. Best is trial 50 with value: 43.32685925026577.
[I 2026-03-12 02:14:55,635] Trial 500 pruned. 
[I 2026-03-12 02:14:57,769] Trial 501 pruned. 
[I 2026-03-12 02:14:57,940] Trial 502 finished with value: 0.0 and parameters: {'timeframe': 'mixed', 'atr_period': 13, 'atr_threshold': 15.0, 'pt_mult': 0.5, 'sl_mult': 1.0, 'td_mins': 1080}. Best is trial 50 with value: 43.32685925026577.
[I 2026-03-12 02:14:58,110] Trial 503 finished with value: 0.0 and parameters: {'timeframe': 'mixed', 'atr_period': 13, 'atr_threshold': 15.0, 'pt_mult': 1.0, 'sl_mult': 5.0, 'td_mins': 1080}. Best is trial 50 with value: 43.32685925026577.
[I 2026-03-12 02:14:59,343] Trial 504 finished with value: 43.32685925026577 and parameters: {'timeframe': 'mixed', 'atr_period': 13, 'atr_threshold': 5.0, 'pt_mult': 0.5, 'sl_mult': 5.0, 'td_mins': 1080}. Best is trial 50 with value: 43.32685925026577.
[I 2026-03-12 02:14:59,514] Trial 505 finished with value: 0.0 and parameters: {'timeframe': 'mixed', 'atr_period': 13, 'atr_threshold': 10.0, 'pt_mult': 0.5, 'sl_mult': 5.0, 'td_mins': 15}. Best is trial 50 with value: 43.32685925026577.
[I 2026-03-12 02:15:05,579] Trial 506 pruned. 
[I 2026-03-12 02:15:06,734] Trial 507 finished with value: 43.32685925026577 and parameters: {'timeframe': 'mixed', 'atr_period': 13, 'atr_threshold': 5.0, 'pt_mult': 0.5, 'sl_mult': 5.0, 'td_mins': 1080}. Best is trial 50 with value: 43.32685925026577.
[I 2026-03-12 02:15:07,934] Trial 508 finished with value: 43.32685925026577 and parameters: {'timeframe': 'mixed', 'atr_period': 13, 'atr_threshold': 5.0, 'pt_mult': 0.5, 'sl_mult': 5.0, 'td_mins': 1080}. Best is trial 50 with value: 43.32685925026577.
[I 2026-03-12 02:15:08,115] Trial 509 finished with value: 0.0 and parameters: {'timeframe': 'mixed', 'atr_period': 13, 'atr_threshold': 10.0, 'pt_mult': 0.5, 'sl_mult': 5.0, 'td_mins': 5}. Best is trial 50 with value: 43.32685925026577.
[I 2026-03-12 02:15:08,235] Trial 510 pruned. 
[I 2026-03-12 02:15:09,505] Trial 511 finished with value: 43.32685925026577 and parameters: {'timeframe': 'mixed', 'atr_period': 13, 'atr_threshold': 5.0, 'pt_mult': 0.5, 'sl_mult': 5.0, 'td_mins': 1080}. Best is trial 50 with value: 43.32685925026577.
[I 2026-03-12 02:15:11,431] Trial 512 pruned. 
[I 2026-03-12 02:15:17,750] Trial 513 pruned. 
[I 2026-03-12 02:15:19,386] Trial 514 pruned. 
[I 2026-03-12 02:15:19,962] Trial 515 pruned. 
[I 2026-03-12 02:15:21,172] Trial 516 finished with value: 43.32685925026577 and parameters: {'timeframe': 'mixed', 'atr_period': 13, 'atr_threshold': 5.0, 'pt_mult': 0.5, 'sl_mult': 5.0, 'td_mins': 1080}. Best is trial 50 with value: 43.32685925026577.
[I 2026-03-12 02:15:21,289] Trial 517 pruned. 
[I 2026-03-12 02:15:21,469] Trial 518 pruned. 
[I 2026-03-12 02:15:22,749] Trial 519 finished with value: 43.32685925026577 and parameters: {'timeframe': 'mixed', 'atr_period': 13, 'atr_threshold': 5.0, 'pt_mult': 0.5, 'sl_mult': 5.0, 'td_mins': 1080}. Best is trial 50 with value: 43.32685925026577.
[I 2026-03-12 02:15:22,924] Trial 520 finished with value: 0.0 and parameters: {'timeframe': 'mixed', 'atr_period': 13, 'atr_threshold': 15.0, 'pt_mult': 0.5, 'sl_mult': 5.0, 'td_mins': 120}. Best is trial 50 with value: 43.32685925026577.
[I 2026-03-12 02:15:23,089] Trial 521 pruned. 
[I 2026-03-12 02:15:23,410] Trial 522 pruned. 
[I 2026-03-12 02:15:23,595] Trial 523 finished with value: 0.0 and parameters: {'timeframe': 'mixed', 'atr_period': 13, 'atr_threshold': 10.0, 'pt_mult': 0.5, 'sl_mult': 5.0, 'td_mins': 1200}. Best is trial 50 with value: 43.32685925026577.
[I 2026-03-12 02:15:24,700] Trial 524 pruned. 
[I 2026-03-12 02:15:28,980] Trial 525 pruned. 
[I 2026-03-12 02:15:29,182] Trial 526 finished with value: 0.0 and parameters: {'timeframe': 'mixed', 'atr_period': 13, 'atr_threshold': 15.0, 'pt_mult': 0.5, 'sl_mult': 5.0, 'td_mins': 360}. Best is trial 50 with value: 43.32685925026577.
[I 2026-03-12 02:15:30,379] Trial 527 finished with value: 43.32685925026577 and parameters: {'timeframe': 'mixed', 'atr_period': 13, 'atr_threshold': 5.0, 'pt_mult': 0.5, 'sl_mult': 5.0, 'td_mins': 1080}. Best is trial 50 with value: 43.32685925026577.
[I 2026-03-12 02:15:31,530] Trial 528 finished with value: 43.32685925026577 and parameters: {'timeframe': 'mixed', 'atr_period': 13, 'atr_threshold': 5.0, 'pt_mult': 0.5, 'sl_mult': 5.0, 'td_mins': 1080}. Best is trial 50 with value: 43.32685925026577.
[I 2026-03-12 02:15:31,715] Trial 529 finished with value: 0.0 and parameters: {'timeframe': 'mixed', 'atr_period': 13, 'atr_threshold': 10.0, 'pt_mult': 1.0, 'sl_mult': 5.0, 'td_mins': 1080}. Best is trial 50 with value: 43.32685925026577.
[I 2026-03-12 02:15:33,076] Trial 530 pruned. 
[I 2026-03-12 02:15:34,325] Trial 531 finished with value: 43.32685925026577 and parameters: {'timeframe': 'mixed', 'atr_period': 13, 'atr_threshold': 5.0, 'pt_mult': 0.5, 'sl_mult': 5.0, 'td_mins': 1080}. Best is trial 50 with value: 43.32685925026577.
[I 2026-03-12 02:15:34,452] Trial 532 pruned. 
[I 2026-03-12 02:15:34,558] Trial 533 pruned. 
[I 2026-03-12 02:15:35,717] Trial 534 finished with value: 43.32685925026577 and parameters: {'timeframe': 'mixed', 'atr_period': 13, 'atr_threshold': 5.0, 'pt_mult': 0.5, 'sl_mult': 5.0, 'td_mins': 1080}. Best is trial 50 with value: 43.32685925026577.
[I 2026-03-12 02:15:35,850] Trial 535 pruned. 
[I 2026-03-12 02:15:35,966] Trial 536 pruned. 
[I 2026-03-12 02:15:39,879] Trial 537 pruned. 
[I 2026-03-12 02:15:40,038] Trial 538 pruned. 
[I 2026-03-12 02:15:40,520] Trial 539 pruned. 
[I 2026-03-12 02:15:40,699] Trial 540 finished with value: 0.0 and parameters: {'timeframe': 'mixed', 'atr_period': 13, 'atr_threshold': 10.0, 'pt_mult': 0.5, 'sl_mult': 5.0, 'td_mins': 720}. Best is trial 50 with value: 43.32685925026577.
[I 2026-03-12 02:15:40,838] Trial 541 pruned. 
[I 2026-03-12 02:15:41,009] Trial 542 pruned. 
[I 2026-03-12 02:15:41,129] Trial 543 pruned. 
[I 2026-03-12 02:15:41,263] Trial 544 pruned. 
[I 2026-03-12 02:15:47,190] Trial 545 pruned. 
[I 2026-03-12 02:15:47,303] Trial 546 pruned. 
[I 2026-03-12 02:15:48,913] Trial 547 pruned. 
[I 2026-03-12 02:15:50,722] Trial 548 pruned. 
[I 2026-03-12 02:15:52,622] Trial 549 pruned. 
[I 2026-03-12 02:15:52,806] Trial 550 finished with value: 0.0 and parameters: {'timeframe': 'mixed', 'atr_period': 13, 'atr_threshold': 10.0, 'pt_mult': 0.5, 'sl_mult': 5.0, 'td_mins': 1080}. Best is trial 50 with value: 43.32685925026577.
[I 2026-03-12 02:15:52,958] Trial 551 pruned. 
[I 2026-03-12 02:15:53,131] Trial 552 finished with value: 0.0 and parameters: {'timeframe': 'mixed', 'atr_period': 13, 'atr_threshold': 15.0, 'pt_mult': 0.5, 'sl_mult': 0.5, 'td_mins': 1080}. Best is trial 50 with value: 43.32685925026577.
[I 2026-03-12 02:15:53,281] Trial 553 pruned. 
[I 2026-03-12 02:15:53,461] Trial 554 finished with value: 0.0 and parameters: {'timeframe': 'mixed', 'atr_period': 13, 'atr_threshold': 15.0, 'pt_mult': 0.5, 'sl_mult': 5.0, 'td_mins': 1080}. Best is trial 50 with value: 43.32685925026577.
[I 2026-03-12 02:15:54,088] Trial 555 pruned. 
[I 2026-03-12 02:15:56,515] Trial 556 pruned. 
[I 2026-03-12 02:15:56,621] Trial 557 pruned. 
[I 2026-03-12 02:15:57,859] Trial 558 finished with value: 43.32685925026577 and parameters: {'timeframe': 'mixed', 'atr_period': 13, 'atr_threshold': 5.0, 'pt_mult': 0.5, 'sl_mult': 5.0, 'td_mins': 1080}. Best is trial 50 with value: 43.32685925026577.
[I 2026-03-12 02:15:58,012] Trial 559 pruned. 
[I 2026-03-12 02:15:58,180] Trial 560 pruned. 
[I 2026-03-12 02:15:58,289] Trial 561 pruned. 
[I 2026-03-12 02:15:58,883] Trial 562 pruned. 
[I 2026-03-12 02:15:59,097] Trial 563 pruned. 
[I 2026-03-12 02:16:00,039] Trial 564 pruned. 
[I 2026-03-12 02:16:01,410] Trial 565 pruned. 
[I 2026-03-12 02:16:02,775] Trial 566 finished with value: 43.313027464575086 and parameters: {'timeframe': 'mixed', 'atr_period': 13, 'atr_threshold': 5.0, 'pt_mult': 0.5, 'sl_mult': 5.0, 'td_mins': 1200}. Best is trial 50 with value: 43.32685925026577.
[I 2026-03-12 02:16:02,959] Trial 567 pruned. 
[I 2026-03-12 02:16:03,475] Trial 568 pruned. 
[I 2026-03-12 02:16:08,780] Trial 569 pruned. 
[I 2026-03-12 02:16:08,918] Trial 570 pruned. 
[I 2026-03-12 02:16:09,098] Trial 571 pruned. 
[I 2026-03-12 02:16:10,307] Trial 572 finished with value: 43.32685925026577 and parameters: {'timeframe': 'mixed', 'atr_period': 13, 'atr_threshold': 5.0, 'pt_mult': 0.5, 'sl_mult': 5.0, 'td_mins': 1080}. Best is trial 50 with value: 43.32685925026577.
[I 2026-03-12 02:16:11,799] Trial 573 pruned. 
[I 2026-03-12 02:16:13,873] Trial 574 pruned. 
[I 2026-03-12 02:16:14,041] Trial 575 pruned. 
[I 2026-03-12 02:16:14,276] Trial 576 pruned. 
[I 2026-03-12 02:16:14,448] Trial 577 pruned. 
[I 2026-03-12 02:16:14,652] Trial 578 pruned. 
[I 2026-03-12 02:16:14,897] Trial 579 pruned. 
[I 2026-03-12 02:16:15,079] Trial 580 pruned. 
[I 2026-03-12 02:16:15,207] Trial 581 pruned. 
[I 2026-03-12 02:16:15,365] Trial 582 pruned. 
[I 2026-03-12 02:16:16,804] Trial 583 finished with value: 43.32685925026577 and parameters: {'timeframe': 'mixed', 'atr_period': 13, 'atr_threshold': 5.0, 'pt_mult': 0.5, 'sl_mult': 5.0, 'td_mins': 1080}. Best is trial 50 with value: 43.32685925026577.
[I 2026-03-12 02:16:18,251] Trial 584 pruned. 
[I 2026-03-12 02:16:18,390] Trial 585 pruned. 
[I 2026-03-12 02:16:19,569] Trial 586 finished with value: 43.32685925026577 and parameters: {'timeframe': 'mixed', 'atr_period': 13, 'atr_threshold': 5.0, 'pt_mult': 0.5, 'sl_mult': 5.0, 'td_mins': 1080}. Best is trial 50 with value: 43.32685925026577.
[I 2026-03-12 02:16:19,678] Trial 587 pruned. 
[I 2026-03-12 02:16:20,771] Trial 588 finished with value: 43.32685925026577 and parameters: {'timeframe': 'mixed', 'atr_period': 13, 'atr_threshold': 5.0, 'pt_mult': 0.5, 'sl_mult': 5.0, 'td_mins': 1080}. Best is trial 50 with value: 43.32685925026577.
[I 2026-03-12 02:16:21,870] Trial 589 finished with value: 43.32685925026577 and parameters: {'timeframe': 'mixed', 'atr_period': 13, 'atr_threshold': 5.0, 'pt_mult': 0.5, 'sl_mult': 5.0, 'td_mins': 1080}. Best is trial 50 with value: 43.32685925026577.
[I 2026-03-12 02:16:21,975] Trial 590 pruned. 
[I 2026-03-12 02:16:22,114] Trial 591 pruned. 
[I 2026-03-12 02:16:23,277] Trial 592 finished with value: 43.32685925026577 and parameters: {'timeframe': 'mixed', 'atr_period': 13, 'atr_threshold': 5.0, 'pt_mult': 0.5, 'sl_mult': 5.0, 'td_mins': 1080}. Best is trial 50 with value: 43.32685925026577.
[I 2026-03-12 02:16:24,495] Trial 593 finished with value: 43.32685925026577 and parameters: {'timeframe': 'mixed', 'atr_period': 13, 'atr_threshold': 5.0, 'pt_mult': 0.5, 'sl_mult': 5.0, 'td_mins': 1080}. Best is trial 50 with value: 43.32685925026577.
[I 2026-03-12 02:16:24,629] Trial 594 pruned. 
[I 2026-03-12 02:16:25,717] Trial 595 finished with value: 43.32685925026577 and parameters: {'timeframe': 'mixed', 'atr_period': 13, 'atr_threshold': 5.0, 'pt_mult': 0.5, 'sl_mult': 5.0, 'td_mins': 1080}. Best is trial 50 with value: 43.32685925026577.
[I 2026-03-12 02:16:25,974] Trial 596 pruned. 
[I 2026-03-12 02:16:27,072] Trial 597 finished with value: 43.32685925026577 and parameters: {'timeframe': 'mixed', 'atr_period': 13, 'atr_threshold': 5.0, 'pt_mult': 0.5, 'sl_mult': 5.0, 'td_mins': 1080}. Best is trial 50 with value: 43.32685925026577.
[I 2026-03-12 02:16:27,298] Trial 598 pruned. 
[I 2026-03-12 02:16:27,428] Trial 599 pruned. 
[I 2026-03-12 02:16:28,584] Trial 600 finished with value: 43.32685925026577 and parameters: {'timeframe': 'mixed', 'atr_period': 13, 'atr_threshold': 5.0, 'pt_mult': 0.5, 'sl_mult': 5.0, 'td_mins': 1080}. Best is trial 50 with value: 43.32685925026577.
[I 2026-03-12 02:16:29,930] Trial 601 finished with value: 43.32685925026577 and parameters: {'timeframe': 'mixed', 'atr_period': 13, 'atr_threshold': 5.0, 'pt_mult': 0.5, 'sl_mult': 5.0, 'td_mins': 1080}. Best is trial 50 with value: 43.32685925026577.
[I 2026-03-12 02:16:31,303] Trial 602 finished with value: 43.32685925026577 and parameters: {'timeframe': 'mixed', 'atr_period': 13, 'atr_threshold': 5.0, 'pt_mult': 0.5, 'sl_mult': 5.0, 'td_mins': 1080}. Best is trial 50 with value: 43.32685925026577.
[I 2026-03-12 02:16:31,442] Trial 603 pruned. 
[I 2026-03-12 02:16:32,569] Trial 604 finished with value: 43.32685925026577 and parameters: {'timeframe': 'mixed', 'atr_period': 13, 'atr_threshold': 5.0, 'pt_mult': 0.5, 'sl_mult': 5.0, 'td_mins': 1080}. Best is trial 50 with value: 43.32685925026577.
[I 2026-03-12 02:16:33,338] Trial 605 pruned. 
[I 2026-03-12 02:16:33,481] Trial 606 pruned. 
[I 2026-03-12 02:16:33,608] Trial 607 pruned. 
[I 2026-03-12 02:16:33,712] Trial 608 pruned. 
[I 2026-03-12 02:16:33,931] Trial 609 finished with value: 0.0 and parameters: {'timeframe': 'mixed', 'atr_period': 13, 'atr_threshold': 10.0, 'pt_mult': 0.5, 'sl_mult': 2.5, 'td_mins': 1080}. Best is trial 50 with value: 43.32685925026577.
[I 2026-03-12 02:16:34,057] Trial 610 pruned. 
[I 2026-03-12 02:16:35,158] Trial 611 finished with value: 43.32685925026577 and parameters: {'timeframe': 'mixed', 'atr_period': 13, 'atr_threshold': 5.0, 'pt_mult': 0.5, 'sl_mult': 5.0, 'td_mins': 1080}. Best is trial 50 with value: 43.32685925026577.
[I 2026-03-12 02:16:35,289] Trial 612 pruned. 
[I 2026-03-12 02:16:36,578] Trial 613 finished with value: 43.32685925026577 and parameters: {'timeframe': 'mixed', 'atr_period': 13, 'atr_threshold': 5.0, 'pt_mult': 0.5, 'sl_mult': 5.0, 'td_mins': 1080}. Best is trial 50 with value: 43.32685925026577.
[I 2026-03-12 02:16:36,767] Trial 614 finished with value: 0.0 and parameters: {'timeframe': 'mixed', 'atr_period': 13, 'atr_threshold': 10.0, 'pt_mult': 0.5, 'sl_mult': 5.0, 'td_mins': 360}. Best is trial 50 with value: 43.32685925026577.
[I 2026-03-12 02:16:36,905] Trial 615 pruned. 
[I 2026-03-12 02:16:38,005] Trial 616 finished with value: 43.32685925026577 and parameters: {'timeframe': 'mixed', 'atr_period': 13, 'atr_threshold': 5.0, 'pt_mult': 0.5, 'sl_mult': 5.0, 'td_mins': 1080}. Best is trial 50 with value: 43.32685925026577.
[I 2026-03-12 02:16:39,138] Trial 617 finished with value: 43.32685925026577 and parameters: {'timeframe': 'mixed', 'atr_period': 13, 'atr_threshold': 5.0, 'pt_mult': 0.5, 'sl_mult': 5.0, 'td_mins': 1080}. Best is trial 50 with value: 43.32685925026577.
[I 2026-03-12 02:16:40,297] Trial 618 finished with value: 43.32685925026577 and parameters: {'timeframe': 'mixed', 'atr_period': 13, 'atr_threshold': 5.0, 'pt_mult': 0.5, 'sl_mult': 5.0, 'td_mins': 1080}. Best is trial 50 with value: 43.32685925026577.
[I 2026-03-12 02:16:40,427] Trial 619 pruned. 
[I 2026-03-12 02:16:40,543] Trial 620 pruned. 
[I 2026-03-12 02:16:41,783] Trial 621 finished with value: 43.32685925026577 and parameters: {'timeframe': 'mixed', 'atr_period': 13, 'atr_threshold': 5.0, 'pt_mult': 0.5, 'sl_mult': 5.0, 'td_mins': 1080}. Best is trial 50 with value: 43.32685925026577.
[I 2026-03-12 02:16:42,028] Trial 622 pruned. 
[I 2026-03-12 02:16:43,266] Trial 623 finished with value: 43.32685925026577 and parameters: {'timeframe': 'mixed', 'atr_period': 13, 'atr_threshold': 5.0, 'pt_mult': 0.5, 'sl_mult': 5.0, 'td_mins': 1080}. Best is trial 50 with value: 43.32685925026577.
[I 2026-03-12 02:16:44,443] Trial 624 finished with value: 43.32685925026577 and parameters: {'timeframe': 'mixed', 'atr_period': 13, 'atr_threshold': 5.0, 'pt_mult': 0.5, 'sl_mult': 5.0, 'td_mins': 1080}. Best is trial 50 with value: 43.32685925026577.
[I 2026-03-12 02:16:44,616] Trial 625 finished with value: 0.0 and parameters: {'timeframe': 'mixed', 'atr_period': 13, 'atr_threshold': 15.0, 'pt_mult': 0.5, 'sl_mult': 5.0, 'td_mins': 15}. Best is trial 50 with value: 43.32685925026577.
[I 2026-03-12 02:16:44,783] Trial 626 finished with value: 0.0 and parameters: {'timeframe': 'mixed', 'atr_period': 13, 'atr_threshold': 10.0, 'pt_mult': 2.5, 'sl_mult': 1.0, 'td_mins': 5}. Best is trial 50 with value: 43.32685925026577.
[I 2026-03-12 02:16:46,269] Trial 627 finished with value: 43.32685925026577 and parameters: {'timeframe': 'mixed', 'atr_period': 13, 'atr_threshold': 5.0, 'pt_mult': 0.5, 'sl_mult': 5.0, 'td_mins': 1080}. Best is trial 50 with value: 43.32685925026577.
[I 2026-03-12 02:16:47,694] Trial 628 finished with value: 43.32685925026577 and parameters: {'timeframe': 'mixed', 'atr_period': 13, 'atr_threshold': 5.0, 'pt_mult': 0.5, 'sl_mult': 5.0, 'td_mins': 1080}. Best is trial 50 with value: 43.32685925026577.
[I 2026-03-12 02:16:47,875] Trial 629 pruned. 
[I 2026-03-12 02:16:49,244] Trial 630 finished with value: 43.32685925026577 and parameters: {'timeframe': 'mixed', 'atr_period': 13, 'atr_threshold': 5.0, 'pt_mult': 0.5, 'sl_mult': 5.0, 'td_mins': 1080}. Best is trial 50 with value: 43.32685925026577.
[I 2026-03-12 02:16:50,414] Trial 631 finished with value: 43.32685925026577 and parameters: {'timeframe': 'mixed', 'atr_period': 13, 'atr_threshold': 5.0, 'pt_mult': 0.5, 'sl_mult': 5.0, 'td_mins': 1080}. Best is trial 50 with value: 43.32685925026577.
[I 2026-03-12 02:16:51,651] Trial 632 pruned. 
[I 2026-03-12 02:16:51,811] Trial 633 pruned. 
[I 2026-03-12 02:16:52,541] Trial 634 pruned. 
[I 2026-03-12 02:16:52,738] Trial 635 finished with value: 0.0 and parameters: {'timeframe': 'mixed', 'atr_period': 13, 'atr_threshold': 10.0, 'pt_mult': 2.5, 'sl_mult': 5.0, 'td_mins': 1080}. Best is trial 50 with value: 43.32685925026577.
[I 2026-03-12 02:16:52,901] Trial 636 pruned. 
[I 2026-03-12 02:16:56,802] Trial 637 pruned. 
[I 2026-03-12 02:16:57,790] Trial 638 pruned. 
[I 2026-03-12 02:16:58,187] Trial 639 pruned. 
[I 2026-03-12 02:16:58,465] Trial 640 pruned. 
[I 2026-03-12 02:16:59,963] Trial 641 pruned. 
[I 2026-03-12 02:17:00,170] Trial 642 finished with value: 0.0 and parameters: {'timeframe': 'mixed', 'atr_period': 13, 'atr_threshold': 10.0, 'pt_mult': 1.0, 'sl_mult': 1.0, 'td_mins': 30}. Best is trial 50 with value: 43.32685925026577.
[I 2026-03-12 02:17:00,353] Trial 643 pruned. 
[I 2026-03-12 02:17:06,375] Trial 644 pruned. 
[I 2026-03-12 02:17:06,489] Trial 645 pruned. 
[I 2026-03-12 02:17:08,007] Trial 646 finished with value: 43.313027464575086 and parameters: {'timeframe': 'mixed', 'atr_period': 13, 'atr_threshold': 5.0, 'pt_mult': 0.5, 'sl_mult': 5.0, 'td_mins': 1200}. Best is trial 50 with value: 43.32685925026577.
[I 2026-03-12 02:17:08,128] Trial 647 pruned. 
[I 2026-03-12 02:17:08,247] Trial 648 pruned. 
[I 2026-03-12 02:17:08,388] Trial 649 pruned. 
[I 2026-03-12 02:17:08,926] Trial 650 pruned. 
[I 2026-03-12 02:17:09,101] Trial 651 pruned. 
[I 2026-03-12 02:17:09,237] Trial 652 pruned. 
[I 2026-03-12 02:17:09,401] Trial 653 pruned. 
[I 2026-03-12 02:17:09,732] Trial 654 pruned. 
[I 2026-03-12 02:17:11,038] Trial 655 finished with value: 43.32685925026577 and parameters: {'timeframe': 'mixed', 'atr_period': 13, 'atr_threshold': 5.0, 'pt_mult': 0.5, 'sl_mult': 5.0, 'td_mins': 1080}. Best is trial 50 with value: 43.32685925026577.
[I 2026-03-12 02:17:11,202] Trial 656 finished with value: 0.0 and parameters: {'timeframe': 'mixed', 'atr_period': 13, 'atr_threshold': 10.0, 'pt_mult': 0.5, 'sl_mult': 5.0, 'td_mins': 1080}. Best is trial 50 with value: 43.32685925026577.
