[I 2026-03-12 01:40:04,433] Trial 290 finished with value: 0.0 and parameters: {'timeframe': 'M3', 'atr_period': 13, 'atr_threshold': 10.0, 'pt_mult': 1.0, 'sl_mult': 5.0, 'td_mins': 60}. Best is trial 212 with value: 1.9962537038611405.
[I 2026-03-12 01:40:04,595] Trial 291 pruned. 
[I 2026-03-12 01:40:04,642] Trial 292 finished with value: 0.0 and parameters: {'timeframe': 'M3', 'atr_period': 13, 'atr_threshold': 10.0, 'pt_mult': 5.0, 'sl_mult': 2.5, 'td_mins': 1080}. Best is trial 212 with value: 1.9962537038611405.
[I 2026-03-12 01:40:04,687] Trial 293 finished with value: 0.0 and parameters: {'timeframe': 'M3', 'atr_period': 13, 'atr_threshold': 10.0, 'pt_mult': 0.5, 'sl_mult': 0.5, 'td_mins': 180}. Best is trial 212 with value: 1.9962537038611405.
[I 2026-03-12 01:40:06,046] Trial 294 pruned. 
[I 2026-03-12 01:40:06,094] Trial 295 finished with value: 0.0 and parameters: {'timeframe': 'M3', 'atr_period': 13, 'atr_threshold': 15.0, 'pt_mult': 2.5, 'sl_mult': 2.5, 'td_mins': 5}. Best is trial 212 with value: 1.9962537038611405.
[I 2026-03-12 01:40:06,418] Trial 296 pruned. 
[I 2026-03-12 01:40:06,466] Trial 297 finished with value: 0.0 and parameters: {'timeframe': 'M3', 'atr_period': 13, 'atr_threshold': 10.0, 'pt_mult': 2.5, 'sl_mult': 5.0, 'td_mins': 720}. Best is trial 212 with value: 1.9962537038611405.
[I 2026-03-12 01:40:06,565] Trial 298 pruned. 
[I 2026-03-12 01:40:06,613] Trial 299 finished with value: 0.0 and parameters: {'timeframe': 'M3', 'atr_period': 13, 'atr_threshold': 8.0, 'pt_mult': 2.5, 'sl_mult': 0.5, 'td_mins': 5}. Best is trial 212 with value: 1.9962537038611405.
[I 2026-03-12 01:40:07,167] Trial 300 finished with value: 1.5593286804083646 and parameters: {'timeframe': 'M3', 'atr_period': 13, 'atr_threshold': 2.0, 'pt_mult': 1.0, 'sl_mult': 5.0, 'td_mins': 120}. Best is trial 212 with value: 1.9962537038611405.
[I 2026-03-12 01:40:07,760] Trial 301 finished with value: 1.5593286804083646 and parameters: {'timeframe': 'M3', 'atr_period': 13, 'atr_threshold': 2.0, 'pt_mult': 1.0, 'sl_mult': 5.0, 'td_mins': 120}. Best is trial 212 with value: 1.9962537038611405.
[I 2026-03-12 01:40:08,386] Trial 302 finished with value: 1.5593286804083646 and parameters: {'timeframe': 'M3', 'atr_period': 13, 'atr_threshold': 2.0, 'pt_mult': 1.0, 'sl_mult': 5.0, 'td_mins': 120}. Best is trial 212 with value: 1.9962537038611405.
[I 2026-03-12 01:40:09,009] Trial 303 finished with value: 1.5593286804083646 and parameters: {'timeframe': 'M3', 'atr_period': 13, 'atr_threshold': 2.0, 'pt_mult': 1.0, 'sl_mult': 5.0, 'td_mins': 120}. Best is trial 212 with value: 1.9962537038611405.
[I 2026-03-12 01:40:09,621] Trial 304 finished with value: 1.5593286804083646 and parameters: {'timeframe': 'M3', 'atr_period': 13, 'atr_threshold': 2.0, 'pt_mult': 1.0, 'sl_mult': 5.0, 'td_mins': 120}. Best is trial 212 with value: 1.9962537038611405.
[I 2026-03-12 01:40:10,224] Trial 305 finished with value: 1.5593286804083646 and parameters: {'timeframe': 'M3', 'atr_period': 13, 'atr_threshold': 2.0, 'pt_mult': 1.0, 'sl_mult': 5.0, 'td_mins': 120}. Best is trial 212 with value: 1.9962537038611405.
[I 2026-03-12 01:40:10,795] Trial 306 finished with value: 1.5593286804083646 and parameters: {'timeframe': 'M3', 'atr_period': 13, 'atr_threshold': 2.0, 'pt_mult': 1.0, 'sl_mult': 5.0, 'td_mins': 120}. Best is trial 212 with value: 1.9962537038611405.
[I 2026-03-12 01:40:11,353] Trial 307 finished with value: 1.5593286804083646 and parameters: {'timeframe': 'M3', 'atr_period': 13, 'atr_threshold': 2.0, 'pt_mult': 1.0, 'sl_mult': 5.0, 'td_mins': 120}. Best is trial 212 with value: 1.9962537038611405.
[I 2026-03-12 01:40:11,972] Trial 308 finished with value: 1.5593286804083646 and parameters: {'timeframe': 'M3', 'atr_period': 13, 'atr_threshold': 2.0, 'pt_mult': 1.0, 'sl_mult': 5.0, 'td_mins': 120}. Best is trial 212 with value: 1.9962537038611405.
[I 2026-03-12 01:40:12,527] Trial 309 finished with value: 1.5593286804083646 and parameters: {'timeframe': 'M3', 'atr_period': 13, 'atr_threshold': 2.0, 'pt_mult': 1.0, 'sl_mult': 5.0, 'td_mins': 120}. Best is trial 212 with value: 1.9962537038611405.
[I 2026-03-12 01:40:13,073] Trial 310 finished with value: 1.5593286804083646 and parameters: {'timeframe': 'M3', 'atr_period': 13, 'atr_threshold': 2.0, 'pt_mult': 1.0, 'sl_mult': 5.0, 'td_mins': 120}. Best is trial 212 with value: 1.9962537038611405.
[I 2026-03-12 01:40:13,625] Trial 311 finished with value: 1.5593286804083646 and parameters: {'timeframe': 'M3', 'atr_period': 13, 'atr_threshold': 2.0, 'pt_mult': 1.0, 'sl_mult': 5.0, 'td_mins': 120}. Best is trial 212 with value: 1.9962537038611405.
[I 2026-03-12 01:40:14,181] Trial 312 finished with value: 1.5593286804083646 and parameters: {'timeframe': 'M3', 'atr_period': 13, 'atr_threshold': 2.0, 'pt_mult': 1.0, 'sl_mult': 5.0, 'td_mins': 120}. Best is trial 212 with value: 1.9962537038611405.
[I 2026-03-12 01:40:14,747] Trial 313 finished with value: 1.5593286804083646 and parameters: {'timeframe': 'M3', 'atr_period': 13, 'atr_threshold': 2.0, 'pt_mult': 1.0, 'sl_mult': 5.0, 'td_mins': 120}. Best is trial 212 with value: 1.9962537038611405.
[I 2026-03-12 01:40:15,375] Trial 314 finished with value: 1.5593286804083646 and parameters: {'timeframe': 'M3', 'atr_period': 13, 'atr_threshold': 2.0, 'pt_mult': 1.0, 'sl_mult': 5.0, 'td_mins': 120}. Best is trial 212 with value: 1.9962537038611405.
[I 2026-03-12 01:40:15,949] Trial 315 finished with value: 1.5593286804083646 and parameters: {'timeframe': 'M3', 'atr_period': 13, 'atr_threshold': 2.0, 'pt_mult': 1.0, 'sl_mult': 5.0, 'td_mins': 120}. Best is trial 212 with value: 1.9962537038611405.
[I 2026-03-12 01:40:16,549] Trial 316 finished with value: 1.5593286804083646 and parameters: {'timeframe': 'M3', 'atr_period': 13, 'atr_threshold': 2.0, 'pt_mult': 1.0, 'sl_mult': 5.0, 'td_mins': 120}. Best is trial 212 with value: 1.9962537038611405.
[I 2026-03-12 01:40:17,141] Trial 317 finished with value: 1.5593286804083646 and parameters: {'timeframe': 'M3', 'atr_period': 13, 'atr_threshold': 2.0, 'pt_mult': 1.0, 'sl_mult': 5.0, 'td_mins': 120}. Best is trial 212 with value: 1.9962537038611405.
[I 2026-03-12 01:40:17,793] Trial 318 finished with value: 1.5593286804083646 and parameters: {'timeframe': 'M3', 'atr_period': 13, 'atr_threshold': 2.0, 'pt_mult': 1.0, 'sl_mult': 5.0, 'td_mins': 120}. Best is trial 212 with value: 1.9962537038611405.
[I 2026-03-12 01:40:18,413] Trial 319 finished with value: 1.5593286804083646 and parameters: {'timeframe': 'M3', 'atr_period': 13, 'atr_threshold': 2.0, 'pt_mult': 1.0, 'sl_mult': 5.0, 'td_mins': 120}. Best is trial 212 with value: 1.9962537038611405.
[I 2026-03-12 01:40:18,524] Trial 320 pruned. 
[I 2026-03-12 01:40:18,584] Trial 321 pruned. 
[I 2026-03-12 01:40:18,739] Trial 322 finished with value: 1.7681070791049158 and parameters: {'timeframe': 'M3', 'atr_period': 13, 'atr_threshold': 2.0, 'pt_mult': 1.0, 'sl_mult': 5.0, 'td_mins': 15}. Best is trial 212 with value: 1.9962537038611405.
[I 2026-03-12 01:40:18,891] Trial 323 finished with value: 1.7681070791049158 and parameters: {'timeframe': 'M3', 'atr_period': 13, 'atr_threshold': 2.0, 'pt_mult': 1.0, 'sl_mult': 5.0, 'td_mins': 15}. Best is trial 212 with value: 1.9962537038611405.
[I 2026-03-12 01:40:19,042] Trial 324 finished with value: 1.7681070791049158 and parameters: {'timeframe': 'M3', 'atr_period': 13, 'atr_threshold': 2.0, 'pt_mult': 1.0, 'sl_mult': 5.0, 'td_mins': 15}. Best is trial 212 with value: 1.9962537038611405.
[I 2026-03-12 01:40:19,930] Trial 325 finished with value: 1.5987933377428867 and parameters: {'timeframe': 'M3', 'atr_period': 13, 'atr_threshold': 1.0, 'pt_mult': 0.5, 'sl_mult': 5.0, 'td_mins': 60}. Best is trial 212 with value: 1.9962537038611405.
[I 2026-03-12 01:40:20,819] Trial 326 finished with value: 1.5987933377428867 and parameters: {'timeframe': 'M3', 'atr_period': 13, 'atr_threshold': 1.0, 'pt_mult': 0.5, 'sl_mult': 5.0, 'td_mins': 60}. Best is trial 212 with value: 1.9962537038611405.
[I 2026-03-12 01:40:21,632] Trial 327 finished with value: 1.5987933377428867 and parameters: {'timeframe': 'M3', 'atr_period': 13, 'atr_threshold': 1.0, 'pt_mult': 0.5, 'sl_mult': 5.0, 'td_mins': 60}. Best is trial 212 with value: 1.9962537038611405.
[I 2026-03-12 01:40:22,419] Trial 328 finished with value: 1.5987933377428867 and parameters: {'timeframe': 'M3', 'atr_period': 13, 'atr_threshold': 1.0, 'pt_mult': 0.5, 'sl_mult': 5.0, 'td_mins': 60}. Best is trial 212 with value: 1.9962537038611405.
[I 2026-03-12 01:40:23,221] Trial 329 finished with value: 1.5987933377428867 and parameters: {'timeframe': 'M3', 'atr_period': 13, 'atr_threshold': 1.0, 'pt_mult': 0.5, 'sl_mult': 5.0, 'td_mins': 60}. Best is trial 212 with value: 1.9962537038611405.
[I 2026-03-12 01:40:24,089] Trial 330 finished with value: 1.5987933377428867 and parameters: {'timeframe': 'M3', 'atr_period': 13, 'atr_threshold': 1.0, 'pt_mult': 0.5, 'sl_mult': 5.0, 'td_mins': 60}. Best is trial 212 with value: 1.9962537038611405.
[I 2026-03-12 01:40:24,899] Trial 331 finished with value: 1.5987933377428867 and parameters: {'timeframe': 'M3', 'atr_period': 13, 'atr_threshold': 1.0, 'pt_mult': 0.5, 'sl_mult': 5.0, 'td_mins': 60}. Best is trial 212 with value: 1.9962537038611405.
[I 2026-03-12 01:40:25,749] Trial 332 finished with value: 1.5987933377428867 and parameters: {'timeframe': 'M3', 'atr_period': 13, 'atr_threshold': 1.0, 'pt_mult': 0.5, 'sl_mult': 5.0, 'td_mins': 60}. Best is trial 212 with value: 1.9962537038611405.
[I 2026-03-12 01:40:26,561] Trial 333 finished with value: 1.5987933377428867 and parameters: {'timeframe': 'M3', 'atr_period': 13, 'atr_threshold': 1.0, 'pt_mult': 0.5, 'sl_mult': 5.0, 'td_mins': 60}. Best is trial 212 with value: 1.9962537038611405.
[I 2026-03-12 01:40:27,376] Trial 334 finished with value: 1.5987933377428867 and parameters: {'timeframe': 'M3', 'atr_period': 13, 'atr_threshold': 1.0, 'pt_mult': 0.5, 'sl_mult': 5.0, 'td_mins': 60}. Best is trial 212 with value: 1.9962537038611405.
[I 2026-03-12 01:40:28,170] Trial 335 finished with value: 1.5987933377428867 and parameters: {'timeframe': 'M3', 'atr_period': 13, 'atr_threshold': 1.0, 'pt_mult': 0.5, 'sl_mult': 5.0, 'td_mins': 60}. Best is trial 212 with value: 1.9962537038611405.
[I 2026-03-12 01:40:28,978] Trial 336 finished with value: 1.5987933377428867 and parameters: {'timeframe': 'M3', 'atr_period': 13, 'atr_threshold': 1.0, 'pt_mult': 0.5, 'sl_mult': 5.0, 'td_mins': 60}. Best is trial 212 with value: 1.9962537038611405.
[I 2026-03-12 01:40:29,797] Trial 337 finished with value: 1.5987933377428867 and parameters: {'timeframe': 'M3', 'atr_period': 13, 'atr_threshold': 1.0, 'pt_mult': 0.5, 'sl_mult': 5.0, 'td_mins': 60}. Best is trial 212 with value: 1.9962537038611405.
[I 2026-03-12 01:40:30,616] Trial 338 finished with value: 1.5987933377428867 and parameters: {'timeframe': 'M3', 'atr_period': 13, 'atr_threshold': 1.0, 'pt_mult': 0.5, 'sl_mult': 5.0, 'td_mins': 60}. Best is trial 212 with value: 1.9962537038611405.
[I 2026-03-12 01:40:31,386] Trial 339 finished with value: 1.5987933377428867 and parameters: {'timeframe': 'M3', 'atr_period': 13, 'atr_threshold': 1.0, 'pt_mult': 0.5, 'sl_mult': 5.0, 'td_mins': 60}. Best is trial 212 with value: 1.9962537038611405.
[I 2026-03-12 01:40:32,178] Trial 340 finished with value: 1.5987933377428867 and parameters: {'timeframe': 'M3', 'atr_period': 13, 'atr_threshold': 1.0, 'pt_mult': 0.5, 'sl_mult': 5.0, 'td_mins': 60}. Best is trial 212 with value: 1.9962537038611405.
[I 2026-03-12 01:40:33,046] Trial 341 finished with value: 1.5987933377428867 and parameters: {'timeframe': 'M3', 'atr_period': 13, 'atr_threshold': 1.0, 'pt_mult': 0.5, 'sl_mult': 5.0, 'td_mins': 60}. Best is trial 212 with value: 1.9962537038611405.
[I 2026-03-12 01:40:33,858] Trial 342 finished with value: 1.5987933377428867 and parameters: {'timeframe': 'M3', 'atr_period': 13, 'atr_threshold': 1.0, 'pt_mult': 0.5, 'sl_mult': 5.0, 'td_mins': 60}. Best is trial 212 with value: 1.9962537038611405.
[I 2026-03-12 01:40:34,710] Trial 343 finished with value: 1.5987933377428867 and parameters: {'timeframe': 'M3', 'atr_period': 13, 'atr_threshold': 1.0, 'pt_mult': 0.5, 'sl_mult': 5.0, 'td_mins': 60}. Best is trial 212 with value: 1.9962537038611405.
[I 2026-03-12 01:40:35,265] Trial 344 finished with value: 1.883712408176234 and parameters: {'timeframe': 'M3', 'atr_period': 13, 'atr_threshold': 1.0, 'pt_mult': 0.5, 'sl_mult': 5.0, 'td_mins': 30}. Best is trial 212 with value: 1.9962537038611405.
[I 2026-03-12 01:40:35,748] Trial 345 finished with value: 1.883712408176234 and parameters: {'timeframe': 'M3', 'atr_period': 13, 'atr_threshold': 1.0, 'pt_mult': 0.5, 'sl_mult': 5.0, 'td_mins': 30}. Best is trial 212 with value: 1.9962537038611405.
[I 2026-03-12 01:40:36,248] Trial 346 finished with value: 1.883712408176234 and parameters: {'timeframe': 'M3', 'atr_period': 13, 'atr_threshold': 1.0, 'pt_mult': 0.5, 'sl_mult': 5.0, 'td_mins': 30}. Best is trial 212 with value: 1.9962537038611405.
[I 2026-03-12 01:40:36,752] Trial 347 finished with value: 1.883712408176234 and parameters: {'timeframe': 'M3', 'atr_period': 13, 'atr_threshold': 1.0, 'pt_mult': 0.5, 'sl_mult': 5.0, 'td_mins': 30}. Best is trial 212 with value: 1.9962537038611405.
[I 2026-03-12 01:40:37,242] Trial 348 finished with value: 1.883712408176234 and parameters: {'timeframe': 'M3', 'atr_period': 13, 'atr_threshold': 1.0, 'pt_mult': 0.5, 'sl_mult': 5.0, 'td_mins': 30}. Best is trial 212 with value: 1.9962537038611405.
[I 2026-03-12 01:40:37,763] Trial 349 finished with value: 1.883712408176234 and parameters: {'timeframe': 'M3', 'atr_period': 13, 'atr_threshold': 1.0, 'pt_mult': 0.5, 'sl_mult': 5.0, 'td_mins': 30}. Best is trial 212 with value: 1.9962537038611405.
[I 2026-03-12 01:40:38,271] Trial 350 finished with value: 1.883712408176234 and parameters: {'timeframe': 'M3', 'atr_period': 13, 'atr_threshold': 1.0, 'pt_mult': 0.5, 'sl_mult': 5.0, 'td_mins': 30}. Best is trial 212 with value: 1.9962537038611405.
[I 2026-03-12 01:40:38,754] Trial 351 finished with value: 1.883712408176234 and parameters: {'timeframe': 'M3', 'atr_period': 13, 'atr_threshold': 1.0, 'pt_mult': 0.5, 'sl_mult': 5.0, 'td_mins': 30}. Best is trial 212 with value: 1.9962537038611405.
[I 2026-03-12 01:40:39,244] Trial 352 finished with value: 1.883712408176234 and parameters: {'timeframe': 'M3', 'atr_period': 13, 'atr_threshold': 1.0, 'pt_mult': 0.5, 'sl_mult': 5.0, 'td_mins': 30}. Best is trial 212 with value: 1.9962537038611405.
[I 2026-03-12 01:40:39,725] Trial 353 finished with value: 1.883712408176234 and parameters: {'timeframe': 'M3', 'atr_period': 13, 'atr_threshold': 1.0, 'pt_mult': 0.5, 'sl_mult': 5.0, 'td_mins': 30}. Best is trial 212 with value: 1.9962537038611405.
[I 2026-03-12 01:40:40,241] Trial 354 finished with value: 1.883712408176234 and parameters: {'timeframe': 'M3', 'atr_period': 13, 'atr_threshold': 1.0, 'pt_mult': 0.5, 'sl_mult': 5.0, 'td_mins': 30}. Best is trial 212 with value: 1.9962537038611405.
[I 2026-03-12 01:40:40,728] Trial 355 finished with value: 1.883712408176234 and parameters: {'timeframe': 'M3', 'atr_period': 13, 'atr_threshold': 1.0, 'pt_mult': 0.5, 'sl_mult': 5.0, 'td_mins': 30}. Best is trial 212 with value: 1.9962537038611405.
[I 2026-03-12 01:40:41,199] Trial 356 finished with value: 1.883712408176234 and parameters: {'timeframe': 'M3', 'atr_period': 13, 'atr_threshold': 1.0, 'pt_mult': 0.5, 'sl_mult': 5.0, 'td_mins': 30}. Best is trial 212 with value: 1.9962537038611405.
[I 2026-03-12 01:40:41,702] Trial 357 finished with value: 1.883712408176234 and parameters: {'timeframe': 'M3', 'atr_period': 13, 'atr_threshold': 1.0, 'pt_mult': 0.5, 'sl_mult': 5.0, 'td_mins': 30}. Best is trial 212 with value: 1.9962537038611405.
[I 2026-03-12 01:40:42,194] Trial 358 finished with value: 1.883712408176234 and parameters: {'timeframe': 'M3', 'atr_period': 13, 'atr_threshold': 1.0, 'pt_mult': 0.5, 'sl_mult': 5.0, 'td_mins': 30}. Best is trial 212 with value: 1.9962537038611405.
[I 2026-03-12 01:40:42,681] Trial 359 finished with value: 1.883712408176234 and parameters: {'timeframe': 'M3', 'atr_period': 13, 'atr_threshold': 1.0, 'pt_mult': 0.5, 'sl_mult': 5.0, 'td_mins': 30}. Best is trial 212 with value: 1.9962537038611405.
[I 2026-03-12 01:40:43,165] Trial 360 finished with value: 1.883712408176234 and parameters: {'timeframe': 'M3', 'atr_period': 13, 'atr_threshold': 1.0, 'pt_mult': 0.5, 'sl_mult': 5.0, 'td_mins': 30}. Best is trial 212 with value: 1.9962537038611405.
[I 2026-03-12 01:40:43,657] Trial 361 finished with value: 1.883712408176234 and parameters: {'timeframe': 'M3', 'atr_period': 13, 'atr_threshold': 1.0, 'pt_mult': 0.5, 'sl_mult': 5.0, 'td_mins': 30}. Best is trial 212 with value: 1.9962537038611405.
[I 2026-03-12 01:40:44,133] Trial 362 finished with value: 1.883712408176234 and parameters: {'timeframe': 'M3', 'atr_period': 13, 'atr_threshold': 1.0, 'pt_mult': 0.5, 'sl_mult': 5.0, 'td_mins': 30}. Best is trial 212 with value: 1.9962537038611405.
[I 2026-03-12 01:40:44,599] Trial 363 finished with value: 1.883712408176234 and parameters: {'timeframe': 'M3', 'atr_period': 13, 'atr_threshold': 1.0, 'pt_mult': 0.5, 'sl_mult': 5.0, 'td_mins': 30}. Best is trial 212 with value: 1.9962537038611405.
[I 2026-03-12 01:40:45,085] Trial 364 finished with value: 1.883712408176234 and parameters: {'timeframe': 'M3', 'atr_period': 13, 'atr_threshold': 1.0, 'pt_mult': 0.5, 'sl_mult': 5.0, 'td_mins': 30}. Best is trial 212 with value: 1.9962537038611405.
[I 2026-03-12 01:40:45,589] Trial 365 finished with value: 1.883712408176234 and parameters: {'timeframe': 'M3', 'atr_period': 13, 'atr_threshold': 1.0, 'pt_mult': 0.5, 'sl_mult': 5.0, 'td_mins': 30}. Best is trial 212 with value: 1.9962537038611405.
[I 2026-03-12 01:40:46,077] Trial 366 finished with value: 1.883712408176234 and parameters: {'timeframe': 'M3', 'atr_period': 13, 'atr_threshold': 1.0, 'pt_mult': 0.5, 'sl_mult': 5.0, 'td_mins': 30}. Best is trial 212 with value: 1.9962537038611405.
[I 2026-03-12 01:40:46,194] Trial 367 finished with value: 2.710569080288531 and parameters: {'timeframe': 'M3', 'atr_period': 13, 'atr_threshold': 3.0, 'pt_mult': 0.5, 'sl_mult': 5.0, 'td_mins': 30}. Best is trial 367 with value: 2.710569080288531.
[I 2026-03-12 01:40:46,309] Trial 368 finished with value: 2.710569080288531 and parameters: {'timeframe': 'M3', 'atr_period': 13, 'atr_threshold': 3.0, 'pt_mult': 0.5, 'sl_mult': 5.0, 'td_mins': 30}. Best is trial 367 with value: 2.710569080288531.
[I 2026-03-12 01:40:46,422] Trial 369 finished with value: 2.710569080288531 and parameters: {'timeframe': 'M3', 'atr_period': 13, 'atr_threshold': 3.0, 'pt_mult': 0.5, 'sl_mult': 5.0, 'td_mins': 30}. Best is trial 367 with value: 2.710569080288531.
[I 2026-03-12 01:40:46,536] Trial 370 finished with value: 2.710569080288531 and parameters: {'timeframe': 'M3', 'atr_period': 13, 'atr_threshold': 3.0, 'pt_mult': 0.5, 'sl_mult': 5.0, 'td_mins': 30}. Best is trial 367 with value: 2.710569080288531.
[I 2026-03-12 01:40:47,050] Trial 371 finished with value: 1.6578810306290854 and parameters: {'timeframe': 'M3', 'atr_period': 13, 'atr_threshold': 1.0, 'pt_mult': 1.0, 'sl_mult': 5.0, 'td_mins': 30}. Best is trial 367 with value: 2.710569080288531.
[I 2026-03-12 01:40:47,175] Trial 372 finished with value: 2.710569080288531 and parameters: {'timeframe': 'M3', 'atr_period': 13, 'atr_threshold': 3.0, 'pt_mult': 0.5, 'sl_mult': 5.0, 'td_mins': 30}. Best is trial 367 with value: 2.710569080288531.
[I 2026-03-12 01:40:47,304] Trial 373 finished with value: 2.710569080288531 and parameters: {'timeframe': 'M3', 'atr_period': 13, 'atr_threshold': 3.0, 'pt_mult': 0.5, 'sl_mult': 5.0, 'td_mins': 30}. Best is trial 367 with value: 2.710569080288531.
[I 2026-03-12 01:40:47,420] Trial 374 finished with value: 2.710569080288531 and parameters: {'timeframe': 'M3', 'atr_period': 13, 'atr_threshold': 3.0, 'pt_mult': 0.5, 'sl_mult': 5.0, 'td_mins': 30}. Best is trial 367 with value: 2.710569080288531.
[I 2026-03-12 01:40:47,560] Trial 375 finished with value: 2.710569080288531 and parameters: {'timeframe': 'M3', 'atr_period': 13, 'atr_threshold': 3.0, 'pt_mult': 0.5, 'sl_mult': 5.0, 'td_mins': 30}. Best is trial 367 with value: 2.710569080288531.
[I 2026-03-12 01:40:47,671] Trial 376 finished with value: 2.710569080288531 and parameters: {'timeframe': 'M3', 'atr_period': 13, 'atr_threshold': 3.0, 'pt_mult': 0.5, 'sl_mult': 5.0, 'td_mins': 30}. Best is trial 367 with value: 2.710569080288531.
[I 2026-03-12 01:40:47,789] Trial 377 finished with value: 2.710569080288531 and parameters: {'timeframe': 'M3', 'atr_period': 13, 'atr_threshold': 3.0, 'pt_mult': 0.5, 'sl_mult': 5.0, 'td_mins': 30}. Best is trial 367 with value: 2.710569080288531.
[I 2026-03-12 01:40:47,904] Trial 378 finished with value: 2.710569080288531 and parameters: {'timeframe': 'M3', 'atr_period': 13, 'atr_threshold': 3.0, 'pt_mult': 0.5, 'sl_mult': 5.0, 'td_mins': 30}. Best is trial 367 with value: 2.710569080288531.
[I 2026-03-12 01:40:48,017] Trial 379 finished with value: 2.710569080288531 and parameters: {'timeframe': 'M3', 'atr_period': 13, 'atr_threshold': 3.0, 'pt_mult': 0.5, 'sl_mult': 5.0, 'td_mins': 30}. Best is trial 367 with value: 2.710569080288531.
[I 2026-03-12 01:40:48,130] Trial 380 finished with value: 2.710569080288531 and parameters: {'timeframe': 'M3', 'atr_period': 13, 'atr_threshold': 3.0, 'pt_mult': 0.5, 'sl_mult': 5.0, 'td_mins': 30}. Best is trial 367 with value: 2.710569080288531.
[I 2026-03-12 01:40:48,246] Trial 381 finished with value: 2.710569080288531 and parameters: {'timeframe': 'M3', 'atr_period': 13, 'atr_threshold': 3.0, 'pt_mult': 0.5, 'sl_mult': 5.0, 'td_mins': 30}. Best is trial 367 with value: 2.710569080288531.
