[I 2026-03-12 01:41:26,068] Trial 658 finished with value: 2.2331593327437322 and parameters: {'timeframe': 'M3', 'atr_period': 13, 'atr_threshold': 2.0, 'pt_mult': 1.0, 'sl_mult': 5.0, 'td_mins': 30}. Best is trial 367 with value: 2.710569080288531.
[I 2026-03-12 01:41:26,192] Trial 659 finished with value: 2.710569080288531 and parameters: {'timeframe': 'M3', 'atr_period': 13, 'atr_threshold': 3.0, 'pt_mult': 0.5, 'sl_mult': 5.0, 'td_mins': 30}. Best is trial 367 with value: 2.710569080288531.
[I 2026-03-12 01:41:26,267] Trial 660 pruned. 
[I 2026-03-12 01:41:26,391] Trial 661 finished with value: 2.710569080288531 and parameters: {'timeframe': 'M3', 'atr_period': 13, 'atr_threshold': 3.0, 'pt_mult': 0.5, 'sl_mult': 5.0, 'td_mins': 30}. Best is trial 367 with value: 2.710569080288531.
[I 2026-03-12 01:41:26,919] Trial 662 pruned. 
[I 2026-03-12 01:41:26,980] Trial 663 pruned. 
[I 2026-03-12 01:41:27,128] Trial 664 finished with value: 2.710569080288531 and parameters: {'timeframe': 'M3', 'atr_period': 13, 'atr_threshold': 3.0, 'pt_mult': 0.5, 'sl_mult': 5.0, 'td_mins': 30}. Best is trial 367 with value: 2.710569080288531.
[I 2026-03-12 01:41:27,286] Trial 665 finished with value: 2.393487005244829 and parameters: {'timeframe': 'M3', 'atr_period': 13, 'atr_threshold': 2.0, 'pt_mult': 0.5, 'sl_mult': 5.0, 'td_mins': 15}. Best is trial 367 with value: 2.710569080288531.
[I 2026-03-12 01:41:28,756] Trial 666 pruned. 
[I 2026-03-12 01:41:28,997] Trial 667 pruned. 
[I 2026-03-12 01:41:30,270] Trial 668 pruned. 
[I 2026-03-12 01:41:30,348] Trial 669 pruned. 
[I 2026-03-12 01:41:30,489] Trial 670 finished with value: 2.710569080288531 and parameters: {'timeframe': 'M3', 'atr_period': 13, 'atr_threshold': 3.0, 'pt_mult': 0.5, 'sl_mult': 5.0, 'td_mins': 30}. Best is trial 367 with value: 2.710569080288531.
[I 2026-03-12 01:41:30,612] Trial 671 finished with value: 2.710569080288531 and parameters: {'timeframe': 'M3', 'atr_period': 13, 'atr_threshold': 3.0, 'pt_mult': 0.5, 'sl_mult': 5.0, 'td_mins': 30}. Best is trial 367 with value: 2.710569080288531.
[I 2026-03-12 01:41:30,756] Trial 672 pruned. 
[I 2026-03-12 01:41:30,873] Trial 673 finished with value: 2.710569080288531 and parameters: {'timeframe': 'M3', 'atr_period': 13, 'atr_threshold': 3.0, 'pt_mult': 0.5, 'sl_mult': 5.0, 'td_mins': 30}. Best is trial 367 with value: 2.710569080288531.
[I 2026-03-12 01:41:31,006] Trial 674 finished with value: 2.710569080288531 and parameters: {'timeframe': 'M3', 'atr_period': 13, 'atr_threshold': 3.0, 'pt_mult': 0.5, 'sl_mult': 5.0, 'td_mins': 30}. Best is trial 367 with value: 2.710569080288531.
[I 2026-03-12 01:41:31,131] Trial 675 finished with value: 2.710569080288531 and parameters: {'timeframe': 'M3', 'atr_period': 13, 'atr_threshold': 3.0, 'pt_mult': 0.5, 'sl_mult': 5.0, 'td_mins': 30}. Best is trial 367 with value: 2.710569080288531.
[I 2026-03-12 01:41:31,254] Trial 676 finished with value: 2.710569080288531 and parameters: {'timeframe': 'M3', 'atr_period': 13, 'atr_threshold': 3.0, 'pt_mult': 0.5, 'sl_mult': 5.0, 'td_mins': 30}. Best is trial 367 with value: 2.710569080288531.
[I 2026-03-12 01:41:31,640] Trial 677 pruned. 
[I 2026-03-12 01:41:31,759] Trial 678 pruned. 
[I 2026-03-12 01:41:31,813] Trial 679 finished with value: 0.0 and parameters: {'timeframe': 'M3', 'atr_period': 13, 'atr_threshold': 8.0, 'pt_mult': 1.0, 'sl_mult': 2.5, 'td_mins': 30}. Best is trial 367 with value: 2.710569080288531.
[I 2026-03-12 01:41:31,965] Trial 680 pruned. 
[I 2026-03-12 01:41:32,149] Trial 681 finished with value: 2.710569080288531 and parameters: {'timeframe': 'M3', 'atr_period': 13, 'atr_threshold': 3.0, 'pt_mult': 0.5, 'sl_mult': 5.0, 'td_mins': 30}. Best is trial 367 with value: 2.710569080288531.
[I 2026-03-12 01:41:32,316] Trial 682 pruned. 
[I 2026-03-12 01:41:32,691] Trial 683 pruned. 
[I 2026-03-12 01:41:32,747] Trial 684 pruned. 
[I 2026-03-12 01:41:32,891] Trial 685 finished with value: 2.710569080288531 and parameters: {'timeframe': 'M3', 'atr_period': 13, 'atr_threshold': 3.0, 'pt_mult': 0.5, 'sl_mult': 5.0, 'td_mins': 30}. Best is trial 367 with value: 2.710569080288531.
[I 2026-03-12 01:41:32,941] Trial 686 finished with value: 0.0 and parameters: {'timeframe': 'M3', 'atr_period': 13, 'atr_threshold': 5.0, 'pt_mult': 0.5, 'sl_mult': 5.0, 'td_mins': 30}. Best is trial 367 with value: 2.710569080288531.
[I 2026-03-12 01:41:33,088] Trial 687 finished with value: 2.710569080288531 and parameters: {'timeframe': 'M3', 'atr_period': 13, 'atr_threshold': 3.0, 'pt_mult': 0.5, 'sl_mult': 5.0, 'td_mins': 30}. Best is trial 367 with value: 2.710569080288531.
[I 2026-03-12 01:41:33,141] Trial 688 finished with value: 0.0 and parameters: {'timeframe': 'M3', 'atr_period': 13, 'atr_threshold': 10.0, 'pt_mult': 0.5, 'sl_mult': 1.0, 'td_mins': 60}. Best is trial 367 with value: 2.710569080288531.
[I 2026-03-12 01:41:33,277] Trial 689 finished with value: 2.387929099905751 and parameters: {'timeframe': 'M3', 'atr_period': 13, 'atr_threshold': 3.0, 'pt_mult': 1.0, 'sl_mult': 5.0, 'td_mins': 30}. Best is trial 367 with value: 2.710569080288531.
[I 2026-03-12 01:41:33,392] Trial 690 finished with value: 2.613255170260378 and parameters: {'timeframe': 'M3', 'atr_period': 13, 'atr_threshold': 3.0, 'pt_mult': 0.5, 'sl_mult': 5.0, 'td_mins': 15}. Best is trial 367 with value: 2.710569080288531.
[I 2026-03-12 01:41:33,443] Trial 691 finished with value: 0.0 and parameters: {'timeframe': 'M3', 'atr_period': 13, 'atr_threshold': 8.0, 'pt_mult': 0.5, 'sl_mult': 1.0, 'td_mins': 720}. Best is trial 367 with value: 2.710569080288531.
[I 2026-03-12 01:41:33,494] Trial 692 finished with value: 0.0 and parameters: {'timeframe': 'M3', 'atr_period': 13, 'atr_threshold': 15.0, 'pt_mult': 0.5, 'sl_mult': 5.0, 'td_mins': 60}. Best is trial 367 with value: 2.710569080288531.
[I 2026-03-12 01:41:33,544] Trial 693 finished with value: 0.0 and parameters: {'timeframe': 'M3', 'atr_period': 13, 'atr_threshold': 8.0, 'pt_mult': 1.0, 'sl_mult': 1.0, 'td_mins': 360}. Best is trial 367 with value: 2.710569080288531.
[I 2026-03-12 01:41:33,593] Trial 694 finished with value: 0.0 and parameters: {'timeframe': 'M3', 'atr_period': 13, 'atr_threshold': 8.0, 'pt_mult': 1.0, 'sl_mult': 5.0, 'td_mins': 1200}. Best is trial 367 with value: 2.710569080288531.
[I 2026-03-12 01:41:33,647] Trial 695 pruned. 
[I 2026-03-12 01:41:33,736] Trial 696 pruned. 
[I 2026-03-12 01:41:33,785] Trial 697 finished with value: 0.0 and parameters: {'timeframe': 'M3', 'atr_period': 13, 'atr_threshold': 15.0, 'pt_mult': 1.0, 'sl_mult': 0.5, 'td_mins': 5}. Best is trial 367 with value: 2.710569080288531.
[I 2026-03-12 01:41:33,863] Trial 698 pruned. 
[I 2026-03-12 01:41:33,921] Trial 699 finished with value: 0.0 and parameters: {'timeframe': 'M3', 'atr_period': 13, 'atr_threshold': 10.0, 'pt_mult': 2.5, 'sl_mult': 1.0, 'td_mins': 720}. Best is trial 367 with value: 2.710569080288531.
[I 2026-03-12 01:41:34,047] Trial 700 finished with value: 2.710569080288531 and parameters: {'timeframe': 'M3', 'atr_period': 13, 'atr_threshold': 3.0, 'pt_mult': 0.5, 'sl_mult': 5.0, 'td_mins': 30}. Best is trial 367 with value: 2.710569080288531.
[I 2026-03-12 01:41:34,102] Trial 701 pruned. 
[I 2026-03-12 01:41:34,154] Trial 702 finished with value: 0.0 and parameters: {'timeframe': 'M3', 'atr_period': 13, 'atr_threshold': 5.0, 'pt_mult': 5.0, 'sl_mult': 0.5, 'td_mins': 30}. Best is trial 367 with value: 2.710569080288531.
[I 2026-03-12 01:41:34,212] Trial 703 pruned. 
[I 2026-03-12 01:41:34,261] Trial 704 finished with value: 0.0 and parameters: {'timeframe': 'M3', 'atr_period': 13, 'atr_threshold': 15.0, 'pt_mult': 5.0, 'sl_mult': 1.0, 'td_mins': 180}. Best is trial 367 with value: 2.710569080288531.
[I 2026-03-12 01:41:34,350] Trial 705 pruned. 
[I 2026-03-12 01:41:34,416] Trial 706 pruned. 
[I 2026-03-12 01:41:34,471] Trial 707 finished with value: 0.0 and parameters: {'timeframe': 'M3', 'atr_period': 13, 'atr_threshold': 5.0, 'pt_mult': 2.5, 'sl_mult': 1.0, 'td_mins': 5}. Best is trial 367 with value: 2.710569080288531.
[I 2026-03-12 01:41:34,539] Trial 708 pruned. 
[I 2026-03-12 01:41:34,601] Trial 709 pruned. 
[I 2026-03-12 01:41:34,656] Trial 710 finished with value: 0.0 and parameters: {'timeframe': 'M3', 'atr_period': 13, 'atr_threshold': 8.0, 'pt_mult': 5.0, 'sl_mult': 5.0, 'td_mins': 60}. Best is trial 367 with value: 2.710569080288531.
[I 2026-03-12 01:41:34,710] Trial 711 pruned. 
[I 2026-03-12 01:41:34,827] Trial 712 pruned. 
[I 2026-03-12 01:41:35,101] Trial 713 finished with value: 2.561287763012388 and parameters: {'timeframe': 'M3', 'atr_period': 13, 'atr_threshold': 2.0, 'pt_mult': 0.5, 'sl_mult': 5.0, 'td_mins': 30}. Best is trial 367 with value: 2.710569080288531.
[I 2026-03-12 01:41:35,207] Trial 714 pruned. 
[I 2026-03-12 01:41:35,343] Trial 715 pruned. 
[I 2026-03-12 01:41:35,521] Trial 716 finished with value: 2.710569080288531 and parameters: {'timeframe': 'M3', 'atr_period': 13, 'atr_threshold': 3.0, 'pt_mult': 0.5, 'sl_mult': 5.0, 'td_mins': 30}. Best is trial 367 with value: 2.710569080288531.
[I 2026-03-12 01:41:35,576] Trial 717 finished with value: 0.0 and parameters: {'timeframe': 'M3', 'atr_period': 13, 'atr_threshold': 15.0, 'pt_mult': 1.0, 'sl_mult': 1.0, 'td_mins': 30}. Best is trial 367 with value: 2.710569080288531.
[I 2026-03-12 01:41:35,838] Trial 718 pruned. 
[I 2026-03-12 01:41:35,895] Trial 719 pruned. 
[I 2026-03-12 01:41:36,023] Trial 720 finished with value: 2.710569080288531 and parameters: {'timeframe': 'M3', 'atr_period': 13, 'atr_threshold': 3.0, 'pt_mult': 0.5, 'sl_mult': 5.0, 'td_mins': 30}. Best is trial 367 with value: 2.710569080288531.
[I 2026-03-12 01:41:36,073] Trial 721 finished with value: 0.0 and parameters: {'timeframe': 'M3', 'atr_period': 13, 'atr_threshold': 10.0, 'pt_mult': 2.5, 'sl_mult': 2.5, 'td_mins': 30}. Best is trial 367 with value: 2.710569080288531.
[I 2026-03-12 01:41:36,132] Trial 722 pruned. 
[I 2026-03-12 01:41:36,247] Trial 723 finished with value: 2.710569080288531 and parameters: {'timeframe': 'M3', 'atr_period': 13, 'atr_threshold': 3.0, 'pt_mult': 0.5, 'sl_mult': 5.0, 'td_mins': 30}. Best is trial 367 with value: 2.710569080288531.
[I 2026-03-12 01:41:36,296] Trial 724 finished with value: 0.0 and parameters: {'timeframe': 'M3', 'atr_period': 13, 'atr_threshold': 15.0, 'pt_mult': 0.5, 'sl_mult': 5.0, 'td_mins': 30}. Best is trial 367 with value: 2.710569080288531.
[I 2026-03-12 01:41:36,426] Trial 725 finished with value: 2.710569080288531 and parameters: {'timeframe': 'M3', 'atr_period': 13, 'atr_threshold': 3.0, 'pt_mult': 0.5, 'sl_mult': 5.0, 'td_mins': 30}. Best is trial 367 with value: 2.710569080288531.
[I 2026-03-12 01:41:36,478] Trial 726 finished with value: 0.0 and parameters: {'timeframe': 'M3', 'atr_period': 13, 'atr_threshold': 15.0, 'pt_mult': 0.5, 'sl_mult': 1.0, 'td_mins': 360}. Best is trial 367 with value: 2.710569080288531.
[I 2026-03-12 01:41:37,358] Trial 727 pruned. 
[I 2026-03-12 01:41:37,741] Trial 728 pruned. 
[I 2026-03-12 01:41:37,801] Trial 729 finished with value: 0.0 and parameters: {'timeframe': 'M3', 'atr_period': 13, 'atr_threshold': 5.0, 'pt_mult': 5.0, 'sl_mult': 1.0, 'td_mins': 1080}. Best is trial 367 with value: 2.710569080288531.
[I 2026-03-12 01:41:37,864] Trial 730 finished with value: 0.0 and parameters: {'timeframe': 'M3', 'atr_period': 13, 'atr_threshold': 10.0, 'pt_mult': 0.5, 'sl_mult': 0.5, 'td_mins': 1200}. Best is trial 367 with value: 2.710569080288531.
[I 2026-03-12 01:41:37,925] Trial 731 finished with value: 0.0 and parameters: {'timeframe': 'M3', 'atr_period': 13, 'atr_threshold': 10.0, 'pt_mult': 0.5, 'sl_mult': 5.0, 'td_mins': 30}. Best is trial 367 with value: 2.710569080288531.
[I 2026-03-12 01:41:38,001] Trial 732 pruned. 
[I 2026-03-12 01:41:38,129] Trial 733 finished with value: 2.710569080288531 and parameters: {'timeframe': 'M3', 'atr_period': 13, 'atr_threshold': 3.0, 'pt_mult': 0.5, 'sl_mult': 5.0, 'td_mins': 30}. Best is trial 367 with value: 2.710569080288531.
[I 2026-03-12 01:41:38,267] Trial 734 finished with value: 2.710569080288531 and parameters: {'timeframe': 'M3', 'atr_period': 13, 'atr_threshold': 3.0, 'pt_mult': 0.5, 'sl_mult': 5.0, 'td_mins': 30}. Best is trial 367 with value: 2.710569080288531.
[I 2026-03-12 01:41:38,383] Trial 735 finished with value: 2.710569080288531 and parameters: {'timeframe': 'M3', 'atr_period': 13, 'atr_threshold': 3.0, 'pt_mult': 0.5, 'sl_mult': 5.0, 'td_mins': 30}. Best is trial 367 with value: 2.710569080288531.
[I 2026-03-12 01:41:38,435] Trial 736 finished with value: 0.0 and parameters: {'timeframe': 'M3', 'atr_period': 13, 'atr_threshold': 15.0, 'pt_mult': 0.5, 'sl_mult': 1.0, 'td_mins': 1080}. Best is trial 367 with value: 2.710569080288531.
[I 2026-03-12 01:41:38,562] Trial 737 finished with value: 2.710569080288531 and parameters: {'timeframe': 'M3', 'atr_period': 13, 'atr_threshold': 3.0, 'pt_mult': 0.5, 'sl_mult': 5.0, 'td_mins': 30}. Best is trial 367 with value: 2.710569080288531.
[I 2026-03-12 01:41:38,676] Trial 738 finished with value: 2.710569080288531 and parameters: {'timeframe': 'M3', 'atr_period': 13, 'atr_threshold': 3.0, 'pt_mult': 0.5, 'sl_mult': 5.0, 'td_mins': 30}. Best is trial 367 with value: 2.710569080288531.
[I 2026-03-12 01:41:38,796] Trial 739 finished with value: 2.710569080288531 and parameters: {'timeframe': 'M3', 'atr_period': 13, 'atr_threshold': 3.0, 'pt_mult': 0.5, 'sl_mult': 5.0, 'td_mins': 30}. Best is trial 367 with value: 2.710569080288531.
[I 2026-03-12 01:41:38,851] Trial 740 pruned. 
[I 2026-03-12 01:41:38,975] Trial 741 finished with value: 2.710569080288531 and parameters: {'timeframe': 'M3', 'atr_period': 13, 'atr_threshold': 3.0, 'pt_mult': 0.5, 'sl_mult': 5.0, 'td_mins': 30}. Best is trial 367 with value: 2.710569080288531.
[I 2026-03-12 01:41:43,114] Trial 742 pruned. 
[I 2026-03-12 01:41:43,347] Trial 743 pruned. 
[I 2026-03-12 01:41:43,396] Trial 744 finished with value: 0.0 and parameters: {'timeframe': 'M3', 'atr_period': 13, 'atr_threshold': 15.0, 'pt_mult': 2.5, 'sl_mult': 0.5, 'td_mins': 1080}. Best is trial 367 with value: 2.710569080288531.
[I 2026-03-12 01:41:43,446] Trial 745 finished with value: 0.0 and parameters: {'timeframe': 'M3', 'atr_period': 13, 'atr_threshold': 10.0, 'pt_mult': 5.0, 'sl_mult': 2.5, 'td_mins': 120}. Best is trial 367 with value: 2.710569080288531.
[I 2026-03-12 01:41:43,569] Trial 746 finished with value: 2.710569080288531 and parameters: {'timeframe': 'M3', 'atr_period': 13, 'atr_threshold': 3.0, 'pt_mult': 0.5, 'sl_mult': 5.0, 'td_mins': 30}. Best is trial 367 with value: 2.710569080288531.
[I 2026-03-12 01:41:43,619] Trial 747 finished with value: 0.0 and parameters: {'timeframe': 'M3', 'atr_period': 13, 'atr_threshold': 8.0, 'pt_mult': 5.0, 'sl_mult': 0.5, 'td_mins': 1200}. Best is trial 367 with value: 2.710569080288531.
[I 2026-03-12 01:41:43,682] Trial 748 pruned. 
[I 2026-03-12 01:41:43,736] Trial 749 finished with value: 0.0 and parameters: {'timeframe': 'M3', 'atr_period': 13, 'atr_threshold': 5.0, 'pt_mult': 1.0, 'sl_mult': 0.5, 'td_mins': 15}. Best is trial 367 with value: 2.710569080288531.
[I 2026-03-12 01:41:43,784] Trial 750 finished with value: 0.0 and parameters: {'timeframe': 'M3', 'atr_period': 13, 'atr_threshold': 8.0, 'pt_mult': 0.5, 'sl_mult': 5.0, 'td_mins': 30}. Best is trial 367 with value: 2.710569080288531.
[I 2026-03-12 01:41:44,094] Trial 751 pruned. 
[I 2026-03-12 01:41:44,143] Trial 752 finished with value: 0.0 and parameters: {'timeframe': 'M3', 'atr_period': 13, 'atr_threshold': 5.0, 'pt_mult': 1.0, 'sl_mult': 1.0, 'td_mins': 1200}. Best is trial 367 with value: 2.710569080288531.
[I 2026-03-12 01:41:44,264] Trial 753 finished with value: 2.710569080288531 and parameters: {'timeframe': 'M3', 'atr_period': 13, 'atr_threshold': 3.0, 'pt_mult': 0.5, 'sl_mult': 5.0, 'td_mins': 30}. Best is trial 367 with value: 2.710569080288531.
[I 2026-03-12 01:41:44,341] Trial 754 pruned. 
[I 2026-03-12 01:41:44,785] Trial 755 pruned. 
[I 2026-03-12 01:41:44,980] Trial 756 pruned. 
[I 2026-03-12 01:41:45,132] Trial 757 finished with value: 2.710569080288531 and parameters: {'timeframe': 'M3', 'atr_period': 13, 'atr_threshold': 3.0, 'pt_mult': 0.5, 'sl_mult': 5.0, 'td_mins': 30}. Best is trial 367 with value: 2.710569080288531.
[I 2026-03-12 01:41:45,293] Trial 758 finished with value: 2.710569080288531 and parameters: {'timeframe': 'M3', 'atr_period': 13, 'atr_threshold': 3.0, 'pt_mult': 0.5, 'sl_mult': 5.0, 'td_mins': 30}. Best is trial 367 with value: 2.710569080288531.
[I 2026-03-12 01:41:45,380] Trial 759 pruned. 
[I 2026-03-12 01:41:45,507] Trial 760 finished with value: 2.710569080288531 and parameters: {'timeframe': 'M3', 'atr_period': 13, 'atr_threshold': 3.0, 'pt_mult': 0.5, 'sl_mult': 5.0, 'td_mins': 30}. Best is trial 367 with value: 2.710569080288531.
[I 2026-03-12 01:41:45,559] Trial 761 finished with value: 0.0 and parameters: {'timeframe': 'M3', 'atr_period': 13, 'atr_threshold': 15.0, 'pt_mult': 2.5, 'sl_mult': 1.0, 'td_mins': 180}. Best is trial 367 with value: 2.710569080288531.
[I 2026-03-12 01:41:45,641] Trial 762 pruned. 
[I 2026-03-12 01:41:45,760] Trial 763 finished with value: 2.710569080288531 and parameters: {'timeframe': 'M3', 'atr_period': 13, 'atr_threshold': 3.0, 'pt_mult': 0.5, 'sl_mult': 5.0, 'td_mins': 30}. Best is trial 367 with value: 2.710569080288531.
[I 2026-03-12 01:41:45,885] Trial 764 finished with value: 2.710569080288531 and parameters: {'timeframe': 'M3', 'atr_period': 13, 'atr_threshold': 3.0, 'pt_mult': 0.5, 'sl_mult': 5.0, 'td_mins': 30}. Best is trial 367 with value: 2.710569080288531.
[I 2026-03-12 01:41:46,036] Trial 765 finished with value: 2.710569080288531 and parameters: {'timeframe': 'M3', 'atr_period': 13, 'atr_threshold': 3.0, 'pt_mult': 0.5, 'sl_mult': 5.0, 'td_mins': 30}. Best is trial 367 with value: 2.710569080288531.
[I 2026-03-12 01:41:46,208] Trial 766 pruned. 
[I 2026-03-12 01:41:46,336] Trial 767 finished with value: 2.710569080288531 and parameters: {'timeframe': 'M3', 'atr_period': 13, 'atr_threshold': 3.0, 'pt_mult': 0.5, 'sl_mult': 5.0, 'td_mins': 30}. Best is trial 367 with value: 2.710569080288531.
[I 2026-03-12 01:41:46,454] Trial 768 finished with value: 2.710569080288531 and parameters: {'timeframe': 'M3', 'atr_period': 13, 'atr_threshold': 3.0, 'pt_mult': 0.5, 'sl_mult': 5.0, 'td_mins': 30}. Best is trial 367 with value: 2.710569080288531.
[I 2026-03-12 01:41:47,771] Trial 769 pruned. 
[I 2026-03-12 01:41:47,922] Trial 770 finished with value: 2.710569080288531 and parameters: {'timeframe': 'M3', 'atr_period': 13, 'atr_threshold': 3.0, 'pt_mult': 0.5, 'sl_mult': 5.0, 'td_mins': 30}. Best is trial 367 with value: 2.710569080288531.
[I 2026-03-12 01:41:47,983] Trial 771 finished with value: 0.0 and parameters: {'timeframe': 'M3', 'atr_period': 13, 'atr_threshold': 15.0, 'pt_mult': 5.0, 'sl_mult': 2.5, 'td_mins': 30}. Best is trial 367 with value: 2.710569080288531.
[I 2026-03-12 01:41:48,063] Trial 772 pruned. 
[I 2026-03-12 01:41:48,123] Trial 773 pruned. 
[I 2026-03-12 01:41:48,173] Trial 774 finished with value: 0.0 and parameters: {'timeframe': 'M3', 'atr_period': 13, 'atr_threshold': 10.0, 'pt_mult': 0.5, 'sl_mult': 1.0, 'td_mins': 30}. Best is trial 367 with value: 2.710569080288531.
[I 2026-03-12 01:41:50,280] Trial 775 pruned. 
[I 2026-03-12 01:41:50,366] Trial 776 pruned. 
[I 2026-03-12 01:41:50,511] Trial 777 finished with value: 2.710569080288531 and parameters: {'timeframe': 'M3', 'atr_period': 13, 'atr_threshold': 3.0, 'pt_mult': 0.5, 'sl_mult': 5.0, 'td_mins': 30}. Best is trial 367 with value: 2.710569080288531.
[I 2026-03-12 01:41:50,758] Trial 778 pruned. 
[I 2026-03-12 01:41:50,815] Trial 779 pruned. 
[I 2026-03-12 01:41:51,646] Trial 780 pruned. 
[I 2026-03-12 01:41:51,724] Trial 781 pruned. 
[I 2026-03-12 01:41:51,873] Trial 782 pruned. 
[I 2026-03-12 01:41:52,022] Trial 783 finished with value: 2.710569080288531 and parameters: {'timeframe': 'M3', 'atr_period': 13, 'atr_threshold': 3.0, 'pt_mult': 0.5, 'sl_mult': 5.0, 'td_mins': 30}. Best is trial 367 with value: 2.710569080288531.
[I 2026-03-12 01:41:52,096] Trial 784 pruned. 
[I 2026-03-12 01:41:52,155] Trial 785 finished with value: 0.0 and parameters: {'timeframe': 'M3', 'atr_period': 13, 'atr_threshold': 8.0, 'pt_mult': 1.0, 'sl_mult': 5.0, 'td_mins': 180}. Best is trial 367 with value: 2.710569080288531.
[I 2026-03-12 01:41:52,212] Trial 786 finished with value: 0.0 and parameters: {'timeframe': 'M3', 'atr_period': 13, 'atr_threshold': 5.0, 'pt_mult': 0.5, 'sl_mult': 5.0, 'td_mins': 30}. Best is trial 367 with value: 2.710569080288531.
[I 2026-03-12 01:41:53,277] Trial 787 pruned. 
[I 2026-03-12 01:41:53,332] Trial 788 pruned. 
[I 2026-03-12 01:41:53,391] Trial 789 pruned. 
[I 2026-03-12 01:41:53,508] Trial 790 finished with value: 2.710569080288531 and parameters: {'timeframe': 'M3', 'atr_period': 13, 'atr_threshold': 3.0, 'pt_mult': 0.5, 'sl_mult': 5.0, 'td_mins': 30}. Best is trial 367 with value: 2.710569080288531.
[I 2026-03-12 01:41:53,563] Trial 791 pruned. 
[I 2026-03-12 01:41:53,618] Trial 792 pruned. 
[I 2026-03-12 01:41:53,735] Trial 793 finished with value: 2.710569080288531 and parameters: {'timeframe': 'M3', 'atr_period': 13, 'atr_threshold': 3.0, 'pt_mult': 0.5, 'sl_mult': 5.0, 'td_mins': 30}. Best is trial 367 with value: 2.710569080288531.
[I 2026-03-12 01:41:53,843] Trial 794 pruned. 
[I 2026-03-12 01:41:53,945] Trial 795 pruned. 
[I 2026-03-12 01:41:54,040] Trial 796 pruned. 
[I 2026-03-12 01:41:54,093] Trial 797 finished with value: 0.0 and parameters: {'timeframe': 'M3', 'atr_period': 13, 'atr_threshold': 8.0, 'pt_mult': 0.5, 'sl_mult': 1.0, 'td_mins': 180}. Best is trial 367 with value: 2.710569080288531.
[I 2026-03-12 01:41:54,377] Trial 798 pruned. 
[I 2026-03-12 01:41:54,434] Trial 799 pruned. 
[I 2026-03-12 01:41:54,494] Trial 800 pruned. 
[I 2026-03-12 01:41:54,610] Trial 801 pruned. 
