[I 2026-03-12 01:49:33,152] Trial 902 finished with value: 2.8555764149575955 and parameters: {'timeframe': 'M5', 'atr_period': 13, 'atr_threshold': 3.0, 'pt_mult': 0.5, 'sl_mult': 5.0, 'td_mins': 60}. Best is trial 537 with value: 2.8555764149575955.
[I 2026-03-12 01:49:33,226] Trial 903 pruned. 
[I 2026-03-12 01:49:34,324] Trial 904 pruned. 
[I 2026-03-12 01:49:34,377] Trial 905 finished with value: 0.0 and parameters: {'timeframe': 'M5', 'atr_period': 13, 'atr_threshold': 15.0, 'pt_mult': 5.0, 'sl_mult': 5.0, 'td_mins': 15}. Best is trial 537 with value: 2.8555764149575955.
[I 2026-03-12 01:49:34,555] Trial 906 finished with value: 2.8555764149575955 and parameters: {'timeframe': 'M5', 'atr_period': 13, 'atr_threshold': 3.0, 'pt_mult': 0.5, 'sl_mult': 5.0, 'td_mins': 60}. Best is trial 537 with value: 2.8555764149575955.
[I 2026-03-12 01:49:34,758] Trial 907 finished with value: 2.8555764149575955 and parameters: {'timeframe': 'M5', 'atr_period': 13, 'atr_threshold': 3.0, 'pt_mult': 0.5, 'sl_mult': 5.0, 'td_mins': 60}. Best is trial 537 with value: 2.8555764149575955.
[I 2026-03-12 01:49:34,812] Trial 908 finished with value: 0.0 and parameters: {'timeframe': 'M5', 'atr_period': 13, 'atr_threshold': 5.0, 'pt_mult': 1.0, 'sl_mult': 2.5, 'td_mins': 1080}. Best is trial 537 with value: 2.8555764149575955.
[I 2026-03-12 01:49:35,006] Trial 909 finished with value: 2.8555764149575955 and parameters: {'timeframe': 'M5', 'atr_period': 13, 'atr_threshold': 3.0, 'pt_mult': 0.5, 'sl_mult': 5.0, 'td_mins': 60}. Best is trial 537 with value: 2.8555764149575955.
[I 2026-03-12 01:49:35,183] Trial 910 finished with value: 2.8555764149575955 and parameters: {'timeframe': 'M5', 'atr_period': 13, 'atr_threshold': 3.0, 'pt_mult': 0.5, 'sl_mult': 5.0, 'td_mins': 60}. Best is trial 537 with value: 2.8555764149575955.
[I 2026-03-12 01:49:35,247] Trial 911 pruned. 
[I 2026-03-12 01:49:35,301] Trial 912 finished with value: 0.0 and parameters: {'timeframe': 'M5', 'atr_period': 13, 'atr_threshold': 10.0, 'pt_mult': 1.0, 'sl_mult': 0.5, 'td_mins': 30}. Best is trial 537 with value: 2.8555764149575955.
[I 2026-03-12 01:49:35,475] Trial 913 finished with value: 2.8555764149575955 and parameters: {'timeframe': 'M5', 'atr_period': 13, 'atr_threshold': 3.0, 'pt_mult': 0.5, 'sl_mult': 5.0, 'td_mins': 60}. Best is trial 537 with value: 2.8555764149575955.
[I 2026-03-12 01:49:35,678] Trial 914 pruned. 
[I 2026-03-12 01:49:35,727] Trial 915 finished with value: 0.0 and parameters: {'timeframe': 'M5', 'atr_period': 13, 'atr_threshold': 15.0, 'pt_mult': 2.5, 'sl_mult': 1.0, 'td_mins': 1080}. Best is trial 537 with value: 2.8555764149575955.
[I 2026-03-12 01:49:35,909] Trial 916 finished with value: 2.8555764149575955 and parameters: {'timeframe': 'M5', 'atr_period': 13, 'atr_threshold': 3.0, 'pt_mult': 0.5, 'sl_mult': 5.0, 'td_mins': 60}. Best is trial 537 with value: 2.8555764149575955.
[I 2026-03-12 01:49:36,084] Trial 917 finished with value: 2.8555764149575955 and parameters: {'timeframe': 'M5', 'atr_period': 13, 'atr_threshold': 3.0, 'pt_mult': 0.5, 'sl_mult': 5.0, 'td_mins': 60}. Best is trial 537 with value: 2.8555764149575955.
[I 2026-03-12 01:49:36,156] Trial 918 pruned. 
[I 2026-03-12 01:49:36,213] Trial 919 pruned. 
[I 2026-03-12 01:49:36,392] Trial 920 finished with value: 2.8555764149575955 and parameters: {'timeframe': 'M5', 'atr_period': 13, 'atr_threshold': 3.0, 'pt_mult': 0.5, 'sl_mult': 5.0, 'td_mins': 60}. Best is trial 537 with value: 2.8555764149575955.
[I 2026-03-12 01:49:37,356] Trial 921 pruned. 
[I 2026-03-12 01:49:37,531] Trial 922 finished with value: 2.8555764149575955 and parameters: {'timeframe': 'M5', 'atr_period': 13, 'atr_threshold': 3.0, 'pt_mult': 0.5, 'sl_mult': 5.0, 'td_mins': 60}. Best is trial 537 with value: 2.8555764149575955.
[I 2026-03-12 01:49:37,704] Trial 923 finished with value: 2.8555764149575955 and parameters: {'timeframe': 'M5', 'atr_period': 13, 'atr_threshold': 3.0, 'pt_mult': 0.5, 'sl_mult': 5.0, 'td_mins': 60}. Best is trial 537 with value: 2.8555764149575955.
[I 2026-03-12 01:49:37,754] Trial 924 finished with value: 0.0 and parameters: {'timeframe': 'M5', 'atr_period': 13, 'atr_threshold': 10.0, 'pt_mult': 2.5, 'sl_mult': 1.0, 'td_mins': 360}. Best is trial 537 with value: 2.8555764149575955.
[I 2026-03-12 01:49:38,178] Trial 925 pruned. 
[I 2026-03-12 01:49:38,233] Trial 926 finished with value: 0.0 and parameters: {'timeframe': 'M5', 'atr_period': 13, 'atr_threshold': 10.0, 'pt_mult': 0.5, 'sl_mult': 0.5, 'td_mins': 180}. Best is trial 537 with value: 2.8555764149575955.
[I 2026-03-12 01:49:38,518] Trial 927 pruned. 
[I 2026-03-12 01:49:38,576] Trial 928 finished with value: 0.0 and parameters: {'timeframe': 'M5', 'atr_period': 13, 'atr_threshold': 5.0, 'pt_mult': 5.0, 'sl_mult': 0.5, 'td_mins': 720}. Best is trial 537 with value: 2.8555764149575955.
[I 2026-03-12 01:49:38,851] Trial 929 pruned. 
[I 2026-03-12 01:49:38,902] Trial 930 finished with value: 0.0 and parameters: {'timeframe': 'M5', 'atr_period': 13, 'atr_threshold': 10.0, 'pt_mult': 2.5, 'sl_mult': 5.0, 'td_mins': 1200}. Best is trial 537 with value: 2.8555764149575955.
[I 2026-03-12 01:49:38,954] Trial 931 finished with value: 0.0 and parameters: {'timeframe': 'M5', 'atr_period': 13, 'atr_threshold': 5.0, 'pt_mult': 2.5, 'sl_mult': 2.5, 'td_mins': 1200}. Best is trial 537 with value: 2.8555764149575955.
[I 2026-03-12 01:49:39,154] Trial 932 finished with value: 2.8555764149575955 and parameters: {'timeframe': 'M5', 'atr_period': 13, 'atr_threshold': 3.0, 'pt_mult': 0.5, 'sl_mult': 5.0, 'td_mins': 60}. Best is trial 537 with value: 2.8555764149575955.
[I 2026-03-12 01:49:39,280] Trial 933 pruned. 
[I 2026-03-12 01:49:39,333] Trial 934 finished with value: 0.0 and parameters: {'timeframe': 'M5', 'atr_period': 13, 'atr_threshold': 10.0, 'pt_mult': 2.5, 'sl_mult': 1.0, 'td_mins': 1200}. Best is trial 537 with value: 2.8555764149575955.
[I 2026-03-12 01:49:39,384] Trial 935 finished with value: 0.0 and parameters: {'timeframe': 'M5', 'atr_period': 13, 'atr_threshold': 5.0, 'pt_mult': 2.5, 'sl_mult': 5.0, 'td_mins': 15}. Best is trial 537 with value: 2.8555764149575955.
[I 2026-03-12 01:49:39,493] Trial 936 pruned. 
[I 2026-03-12 01:49:39,547] Trial 937 finished with value: 0.0 and parameters: {'timeframe': 'M5', 'atr_period': 13, 'atr_threshold': 10.0, 'pt_mult': 5.0, 'sl_mult': 5.0, 'td_mins': 1080}. Best is trial 537 with value: 2.8555764149575955.
[I 2026-03-12 01:49:39,603] Trial 938 finished with value: 0.0 and parameters: {'timeframe': 'M5', 'atr_period': 13, 'atr_threshold': 15.0, 'pt_mult': 1.0, 'sl_mult': 0.5, 'td_mins': 180}. Best is trial 537 with value: 2.8555764149575955.
[I 2026-03-12 01:49:39,659] Trial 939 finished with value: 0.0 and parameters: {'timeframe': 'M5', 'atr_period': 13, 'atr_threshold': 10.0, 'pt_mult': 0.5, 'sl_mult': 5.0, 'td_mins': 60}. Best is trial 537 with value: 2.8555764149575955.
[I 2026-03-12 01:49:40,795] Trial 940 pruned. 
[I 2026-03-12 01:49:41,367] Trial 941 pruned. 
[I 2026-03-12 01:49:41,448] Trial 942 pruned. 
[I 2026-03-12 01:49:42,146] Trial 943 pruned. 
[I 2026-03-12 01:49:42,215] Trial 944 pruned. 
[I 2026-03-12 01:49:42,274] Trial 945 pruned. 
[I 2026-03-12 01:49:42,421] Trial 946 pruned. 
[I 2026-03-12 01:49:42,518] Trial 947 pruned. 
[I 2026-03-12 01:49:42,861] Trial 948 pruned. 
[I 2026-03-12 01:49:42,970] Trial 949 pruned. 
[I 2026-03-12 01:49:43,023] Trial 950 finished with value: 0.0 and parameters: {'timeframe': 'M5', 'atr_period': 13, 'atr_threshold': 8.0, 'pt_mult': 0.5, 'sl_mult': 5.0, 'td_mins': 180}. Best is trial 537 with value: 2.8555764149575955.
[I 2026-03-12 01:49:43,075] Trial 951 finished with value: 0.0 and parameters: {'timeframe': 'M5', 'atr_period': 13, 'atr_threshold': 10.0, 'pt_mult': 5.0, 'sl_mult': 2.5, 'td_mins': 5}. Best is trial 537 with value: 2.8555764149575955.
[I 2026-03-12 01:49:43,127] Trial 952 finished with value: 0.0 and parameters: {'timeframe': 'M5', 'atr_period': 13, 'atr_threshold': 15.0, 'pt_mult': 2.5, 'sl_mult': 0.5, 'td_mins': 5}. Best is trial 537 with value: 2.8555764149575955.
[I 2026-03-12 01:49:43,177] Trial 953 finished with value: 0.0 and parameters: {'timeframe': 'M5', 'atr_period': 13, 'atr_threshold': 15.0, 'pt_mult': 0.5, 'sl_mult': 1.0, 'td_mins': 1080}. Best is trial 537 with value: 2.8555764149575955.
[I 2026-03-12 01:49:43,236] Trial 954 pruned. 
[I 2026-03-12 01:49:43,525] Trial 955 pruned. 
[I 2026-03-12 01:49:43,583] Trial 956 finished with value: 0.0 and parameters: {'timeframe': 'M5', 'atr_period': 13, 'atr_threshold': 8.0, 'pt_mult': 0.5, 'sl_mult': 0.5, 'td_mins': 5}. Best is trial 537 with value: 2.8555764149575955.
[I 2026-03-12 01:49:45,152] Trial 957 pruned. 
[I 2026-03-12 01:49:45,216] Trial 958 finished with value: 0.0 and parameters: {'timeframe': 'M5', 'atr_period': 13, 'atr_threshold': 8.0, 'pt_mult': 5.0, 'sl_mult': 5.0, 'td_mins': 15}. Best is trial 537 with value: 2.8555764149575955.
[I 2026-03-12 01:49:45,430] Trial 959 pruned. 
[I 2026-03-12 01:49:45,603] Trial 960 finished with value: 2.8555764149575955 and parameters: {'timeframe': 'M5', 'atr_period': 13, 'atr_threshold': 3.0, 'pt_mult': 0.5, 'sl_mult': 5.0, 'td_mins': 60}. Best is trial 537 with value: 2.8555764149575955.
[I 2026-03-12 01:49:45,708] Trial 961 pruned. 
[I 2026-03-12 01:49:45,777] Trial 962 pruned. 
[I 2026-03-12 01:49:46,053] Trial 963 pruned. 
[I 2026-03-12 01:49:46,392] Trial 964 pruned. 
[I 2026-03-12 01:49:46,453] Trial 965 finished with value: 0.0 and parameters: {'timeframe': 'M5', 'atr_period': 13, 'atr_threshold': 5.0, 'pt_mult': 0.5, 'sl_mult': 1.0, 'td_mins': 1080}. Best is trial 537 with value: 2.8555764149575955.
[I 2026-03-12 01:49:46,507] Trial 966 finished with value: 0.0 and parameters: {'timeframe': 'M5', 'atr_period': 13, 'atr_threshold': 8.0, 'pt_mult': 2.5, 'sl_mult': 2.5, 'td_mins': 720}. Best is trial 537 with value: 2.8555764149575955.
[I 2026-03-12 01:49:46,557] Trial 967 finished with value: 0.0 and parameters: {'timeframe': 'M5', 'atr_period': 13, 'atr_threshold': 8.0, 'pt_mult': 5.0, 'sl_mult': 0.5, 'td_mins': 30}. Best is trial 537 with value: 2.8555764149575955.
[I 2026-03-12 01:49:46,607] Trial 968 finished with value: 0.0 and parameters: {'timeframe': 'M5', 'atr_period': 13, 'atr_threshold': 5.0, 'pt_mult': 0.5, 'sl_mult': 1.0, 'td_mins': 1200}. Best is trial 537 with value: 2.8555764149575955.
[I 2026-03-12 01:49:46,664] Trial 969 pruned. 
[I 2026-03-12 01:49:46,724] Trial 970 pruned. 
[I 2026-03-12 01:49:46,775] Trial 971 finished with value: 0.0 and parameters: {'timeframe': 'M5', 'atr_period': 13, 'atr_threshold': 10.0, 'pt_mult': 2.5, 'sl_mult': 1.0, 'td_mins': 720}. Best is trial 537 with value: 2.8555764149575955.
[I 2026-03-12 01:49:46,944] Trial 972 finished with value: 2.8555764149575955 and parameters: {'timeframe': 'M5', 'atr_period': 13, 'atr_threshold': 3.0, 'pt_mult': 0.5, 'sl_mult': 5.0, 'td_mins': 60}. Best is trial 537 with value: 2.8555764149575955.
[I 2026-03-12 01:49:46,995] Trial 973 finished with value: 0.0 and parameters: {'timeframe': 'M5', 'atr_period': 13, 'atr_threshold': 15.0, 'pt_mult': 0.5, 'sl_mult': 5.0, 'td_mins': 60}. Best is trial 537 with value: 2.8555764149575955.
[I 2026-03-12 01:49:47,173] Trial 974 finished with value: 2.8555764149575955 and parameters: {'timeframe': 'M5', 'atr_period': 13, 'atr_threshold': 3.0, 'pt_mult': 0.5, 'sl_mult': 5.0, 'td_mins': 60}. Best is trial 537 with value: 2.8555764149575955.
[I 2026-03-12 01:49:47,224] Trial 975 finished with value: 0.0 and parameters: {'timeframe': 'M5', 'atr_period': 13, 'atr_threshold': 5.0, 'pt_mult': 0.5, 'sl_mult': 5.0, 'td_mins': 60}. Best is trial 537 with value: 2.8555764149575955.
[I 2026-03-12 01:49:47,928] Trial 976 pruned. 
[I 2026-03-12 01:49:47,981] Trial 977 finished with value: 0.0 and parameters: {'timeframe': 'M5', 'atr_period': 13, 'atr_threshold': 15.0, 'pt_mult': 5.0, 'sl_mult': 2.5, 'td_mins': 1200}. Best is trial 537 with value: 2.8555764149575955.
[I 2026-03-12 01:49:48,360] Trial 978 pruned. 
[I 2026-03-12 01:49:48,416] Trial 979 finished with value: 0.0 and parameters: {'timeframe': 'M5', 'atr_period': 13, 'atr_threshold': 10.0, 'pt_mult': 5.0, 'sl_mult': 5.0, 'td_mins': 720}. Best is trial 537 with value: 2.8555764149575955.
[I 2026-03-12 01:49:48,774] Trial 980 pruned. 
[I 2026-03-12 01:49:48,958] Trial 981 finished with value: 2.8555764149575955 and parameters: {'timeframe': 'M5', 'atr_period': 13, 'atr_threshold': 3.0, 'pt_mult': 0.5, 'sl_mult': 5.0, 'td_mins': 60}. Best is trial 537 with value: 2.8555764149575955.
[I 2026-03-12 01:49:49,195] Trial 982 pruned. 
[I 2026-03-12 01:49:49,251] Trial 983 finished with value: 0.0 and parameters: {'timeframe': 'M5', 'atr_period': 13, 'atr_threshold': 10.0, 'pt_mult': 2.5, 'sl_mult': 5.0, 'td_mins': 15}. Best is trial 537 with value: 2.8555764149575955.
[I 2026-03-12 01:49:49,316] Trial 984 pruned. 
[I 2026-03-12 01:49:49,369] Trial 985 finished with value: 0.0 and parameters: {'timeframe': 'M5', 'atr_period': 13, 'atr_threshold': 8.0, 'pt_mult': 5.0, 'sl_mult': 2.5, 'td_mins': 60}. Best is trial 537 with value: 2.8555764149575955.
[I 2026-03-12 01:49:49,545] Trial 986 finished with value: 2.8555764149575955 and parameters: {'timeframe': 'M5', 'atr_period': 13, 'atr_threshold': 3.0, 'pt_mult': 0.5, 'sl_mult': 5.0, 'td_mins': 60}. Best is trial 537 with value: 2.8555764149575955.
[I 2026-03-12 01:49:49,605] Trial 987 finished with value: 0.0 and parameters: {'timeframe': 'M5', 'atr_period': 13, 'atr_threshold': 8.0, 'pt_mult': 0.5, 'sl_mult': 1.0, 'td_mins': 5}. Best is trial 537 with value: 2.8555764149575955.
[I 2026-03-12 01:49:49,662] Trial 988 finished with value: 0.0 and parameters: {'timeframe': 'M5', 'atr_period': 13, 'atr_threshold': 8.0, 'pt_mult': 1.0, 'sl_mult': 5.0, 'td_mins': 1080}. Best is trial 537 with value: 2.8555764149575955.
[I 2026-03-12 01:49:49,863] Trial 989 finished with value: 2.8555764149575955 and parameters: {'timeframe': 'M5', 'atr_period': 13, 'atr_threshold': 3.0, 'pt_mult': 0.5, 'sl_mult': 5.0, 'td_mins': 60}. Best is trial 537 with value: 2.8555764149575955.
[I 2026-03-12 01:49:49,977] Trial 990 pruned. 
[I 2026-03-12 01:49:50,032] Trial 991 finished with value: 0.0 and parameters: {'timeframe': 'M5', 'atr_period': 13, 'atr_threshold': 15.0, 'pt_mult': 1.0, 'sl_mult': 2.5, 'td_mins': 30}. Best is trial 537 with value: 2.8555764149575955.
[I 2026-03-12 01:49:50,106] Trial 992 pruned. 
[I 2026-03-12 01:49:50,176] Trial 993 pruned. 
[I 2026-03-12 01:49:50,226] Trial 994 finished with value: 0.0 and parameters: {'timeframe': 'M5', 'atr_period': 13, 'atr_threshold': 10.0, 'pt_mult': 0.5, 'sl_mult': 1.0, 'td_mins': 720}. Best is trial 537 with value: 2.8555764149575955.
[I 2026-03-12 01:49:50,546] Trial 995 pruned. 
[I 2026-03-12 01:49:50,727] Trial 996 finished with value: 2.8555764149575955 and parameters: {'timeframe': 'M5', 'atr_period': 13, 'atr_threshold': 3.0, 'pt_mult': 0.5, 'sl_mult': 5.0, 'td_mins': 60}. Best is trial 537 with value: 2.8555764149575955.
[I 2026-03-12 01:49:50,901] Trial 997 finished with value: 2.8555764149575955 and parameters: {'timeframe': 'M5', 'atr_period': 13, 'atr_threshold': 3.0, 'pt_mult': 0.5, 'sl_mult': 5.0, 'td_mins': 60}. Best is trial 537 with value: 2.8555764149575955.
[I 2026-03-12 01:49:50,984] Trial 998 pruned. 
[I 2026-03-12 01:49:51,167] Trial 999 finished with value: 2.8555764149575955 and parameters: {'timeframe': 'M5', 'atr_period': 13, 'atr_threshold': 3.0, 'pt_mult': 0.5, 'sl_mult': 5.0, 'td_mins': 60}. Best is trial 537 with value: 2.8555764149575955.
2026-03-12 01:49:51,226 - INFO - === Starting Optuna Optimization for M8 [SHORT_ONLY] (Trials: 1000) ===
/home/hephaestus-zero/.local/lib/python3.11/site-packages/optuna/_experimental.py:32: ExperimentalWarning: Argument ``multivariate`` is an experimental feature. The interface can change in the future.
  warnings.warn(
[I 2026-03-12 01:49:51,226] A new study created in memory with name: no-name-e6d69eec-2498-490c-a41c-cc05f1cc85e1
2026-03-12 01:49:51,229 - INFO -     [Cache Miss] Loading Signal Data for M8, ATR=13...
2026-03-12 01:50:27,603 - INFO -     [Cache Miss] Loading Signal Data for M8, ATR=13...
2026-03-12 01:51:03,277 - INFO -     [Cache Miss] Loading Signal Data for M8, ATR=13...
2026-03-12 01:51:39,421 - INFO -     [Cache Miss] Loading Signal Data for M8, ATR=13...
2026-03-12 01:52:14,879 - INFO -     [Cache Miss] Loading Signal Data for M8, ATR=13...
[I 2026-03-12 01:52:50,926] Trial 0 finished with value: 0.029001728170458548 and parameters: {'timeframe': 'M8', 'atr_period': 13, 'atr_threshold': 3.0, 'pt_mult': 5.0, 'sl_mult': 0.5, 'td_mins': 15}. Best is trial 0 with value: 0.029001728170458548.
[I 2026-03-12 01:52:51,036] Trial 1 finished with value: 0.6756674408632405 and parameters: {'timeframe': 'M8', 'atr_period': 13, 'atr_threshold': 5.0, 'pt_mult': 1.0, 'sl_mult': 2.5, 'td_mins': 120}. Best is trial 1 with value: 0.6756674408632405.
[I 2026-03-12 01:52:51,080] Trial 2 finished with value: 0.0 and parameters: {'timeframe': 'M8', 'atr_period': 13, 'atr_threshold': 15.0, 'pt_mult': 5.0, 'sl_mult': 0.5, 'td_mins': 15}. Best is trial 1 with value: 0.6756674408632405.
[I 2026-03-12 01:52:52,618] Trial 3 finished with value: 0.981025323564013 and parameters: {'timeframe': 'M8', 'atr_period': 13, 'atr_threshold': 1.0, 'pt_mult': 0.5, 'sl_mult': 0.5, 'td_mins': 1200}. Best is trial 3 with value: 0.981025323564013.
[I 2026-03-12 01:52:52,893] Trial 4 finished with value: 0.8160662427545395 and parameters: {'timeframe': 'M8', 'atr_period': 13, 'atr_threshold': 2.0, 'pt_mult': 1.0, 'sl_mult': 1.0, 'td_mins': 60}. Best is trial 3 with value: 0.981025323564013.
[I 2026-03-12 01:52:52,937] Trial 5 finished with value: 0.0 and parameters: {'timeframe': 'M8', 'atr_period': 13, 'atr_threshold': 15.0, 'pt_mult': 0.5, 'sl_mult': 1.0, 'td_mins': 180}. Best is trial 3 with value: 0.981025323564013.
[I 2026-03-12 01:52:53,173] Trial 6 finished with value: 0.8980213212325461 and parameters: {'timeframe': 'M8', 'atr_period': 13, 'atr_threshold': 3.0, 'pt_mult': 0.5, 'sl_mult': 1.0, 'td_mins': 180}. Best is trial 3 with value: 0.981025323564013.
[I 2026-03-12 01:52:53,520] Trial 7 finished with value: 0.579939627295297 and parameters: {'timeframe': 'M8', 'atr_period': 13, 'atr_threshold': 5.0, 'pt_mult': 2.5, 'sl_mult': 0.5, 'td_mins': 1200}. Best is trial 3 with value: 0.981025323564013.
[I 2026-03-12 01:52:53,569] Trial 8 finished with value: 0.0 and parameters: {'timeframe': 'M8', 'atr_period': 13, 'atr_threshold': 15.0, 'pt_mult': 5.0, 'sl_mult': 1.0, 'td_mins': 5}. Best is trial 3 with value: 0.981025323564013.
[I 2026-03-12 01:52:54,710] Trial 9 finished with value: 0.7964769628826398 and parameters: {'timeframe': 'M8', 'atr_period': 13, 'atr_threshold': 3.0, 'pt_mult': 5.0, 'sl_mult': 1.0, 'td_mins': 720}. Best is trial 3 with value: 0.981025323564013.
[I 2026-03-12 01:52:56,179] Trial 10 finished with value: 1.2062759412245783 and parameters: {'timeframe': 'M8', 'atr_period': 13, 'atr_threshold': 2.0, 'pt_mult': 2.5, 'sl_mult': 5.0, 'td_mins': 360}. Best is trial 10 with value: 1.2062759412245783.
[I 2026-03-12 01:52:58,129] Trial 11 finished with value: 1.0003818970156082 and parameters: {'timeframe': 'M8', 'atr_period': 13, 'atr_threshold': 3.0, 'pt_mult': 0.5, 'sl_mult': 5.0, 'td_mins': 1200}. Best is trial 10 with value: 1.2062759412245783.
[I 2026-03-12 01:53:00,253] Trial 12 finished with value: 0.956805493821461 and parameters: {'timeframe': 'M8', 'atr_period': 13, 'atr_threshold': 1.0, 'pt_mult': 0.5, 'sl_mult': 1.0, 'td_mins': 1200}. Best is trial 10 with value: 1.2062759412245783.
[I 2026-03-12 01:53:00,665] Trial 13 finished with value: 0.8411515864501494 and parameters: {'timeframe': 'M8', 'atr_period': 13, 'atr_threshold': 1.0, 'pt_mult': 1.0, 'sl_mult': 1.0, 'td_mins': 60}. Best is trial 10 with value: 1.2062759412245783.
[I 2026-03-12 01:53:02,653] Trial 14 finished with value: 0.6770185068524281 and parameters: {'timeframe': 'M8', 'atr_period': 13, 'atr_threshold': 1.0, 'pt_mult': 5.0, 'sl_mult': 1.0, 'td_mins': 360}. Best is trial 10 with value: 1.2062759412245783.
[I 2026-03-12 01:53:03,158] Trial 15 finished with value: 1.8862471524777071 and parameters: {'timeframe': 'M8', 'atr_period': 13, 'atr_threshold': 0.5, 'pt_mult': 0.5, 'sl_mult': 5.0, 'td_mins': 60}. Best is trial 15 with value: 1.8862471524777071.
[I 2026-03-12 01:53:03,202] Trial 16 finished with value: 0.0 and parameters: {'timeframe': 'M8', 'atr_period': 13, 'atr_threshold': 15.0, 'pt_mult': 1.0, 'sl_mult': 2.5, 'td_mins': 1200}. Best is trial 15 with value: 1.8862471524777071.
[I 2026-03-12 01:53:04,186] Trial 17 finished with value: 0.609029895139271 and parameters: {'timeframe': 'M8', 'atr_period': 13, 'atr_threshold': 0.5, 'pt_mult': 5.0, 'sl_mult': 5.0, 'td_mins': 120}. Best is trial 15 with value: 1.8862471524777071.
[I 2026-03-12 01:53:04,281] Trial 18 finished with value: 0.761824982897175 and parameters: {'timeframe': 'M8', 'atr_period': 13, 'atr_threshold': 3.0, 'pt_mult': 0.5, 'sl_mult': 0.5, 'td_mins': 15}. Best is trial 15 with value: 1.8862471524777071.
[I 2026-03-12 01:53:04,347] Trial 19 finished with value: 0.0 and parameters: {'timeframe': 'M8', 'atr_period': 13, 'atr_threshold': 10.0, 'pt_mult': 5.0, 'sl_mult': 0.5, 'td_mins': 120}. Best is trial 15 with value: 1.8862471524777071.
[I 2026-03-12 01:53:04,401] Trial 20 finished with value: 0.0 and parameters: {'timeframe': 'M8', 'atr_period': 13, 'atr_threshold': 10.0, 'pt_mult': 1.0, 'sl_mult': 0.5, 'td_mins': 1080}. Best is trial 15 with value: 1.8862471524777071.
[I 2026-03-12 01:53:04,675] Trial 21 pruned. 
[I 2026-03-12 01:53:04,772] Trial 22 pruned. 
[I 2026-03-12 01:53:04,820] Trial 23 finished with value: 0.0 and parameters: {'timeframe': 'M8', 'atr_period': 13, 'atr_threshold': 8.0, 'pt_mult': 1.0, 'sl_mult': 0.5, 'td_mins': 1200}. Best is trial 15 with value: 1.8862471524777071.
