[I 2026-03-12 01:57:16,953] Trial 907 finished with value: 0.0 and parameters: {'timeframe': 'M8', 'atr_period': 13, 'atr_threshold': 10.0, 'pt_mult': 2.5, 'sl_mult': 2.5, 'td_mins': 1080}. Best is trial 398 with value: 3.484125427035651.
[I 2026-03-12 01:57:17,019] Trial 908 pruned. 
[I 2026-03-12 01:57:17,145] Trial 909 finished with value: 3.484125427035651 and parameters: {'timeframe': 'M8', 'atr_period': 13, 'atr_threshold': 5.0, 'pt_mult': 0.5, 'sl_mult': 5.0, 'td_mins': 120}. Best is trial 398 with value: 3.484125427035651.
[I 2026-03-12 01:57:17,264] Trial 910 finished with value: 3.484125427035651 and parameters: {'timeframe': 'M8', 'atr_period': 13, 'atr_threshold': 5.0, 'pt_mult': 0.5, 'sl_mult': 5.0, 'td_mins': 120}. Best is trial 398 with value: 3.484125427035651.
[I 2026-03-12 01:57:17,384] Trial 911 finished with value: 3.484125427035651 and parameters: {'timeframe': 'M8', 'atr_period': 13, 'atr_threshold': 5.0, 'pt_mult': 0.5, 'sl_mult': 5.0, 'td_mins': 120}. Best is trial 398 with value: 3.484125427035651.
[I 2026-03-12 01:57:17,508] Trial 912 finished with value: 3.484125427035651 and parameters: {'timeframe': 'M8', 'atr_period': 13, 'atr_threshold': 5.0, 'pt_mult': 0.5, 'sl_mult': 5.0, 'td_mins': 120}. Best is trial 398 with value: 3.484125427035651.
[I 2026-03-12 01:57:17,772] Trial 913 pruned. 
[I 2026-03-12 01:57:17,891] Trial 914 finished with value: 3.484125427035651 and parameters: {'timeframe': 'M8', 'atr_period': 13, 'atr_threshold': 5.0, 'pt_mult': 0.5, 'sl_mult': 5.0, 'td_mins': 120}. Best is trial 398 with value: 3.484125427035651.
[I 2026-03-12 01:57:18,001] Trial 915 finished with value: 3.484125427035651 and parameters: {'timeframe': 'M8', 'atr_period': 13, 'atr_threshold': 5.0, 'pt_mult': 0.5, 'sl_mult': 5.0, 'td_mins': 120}. Best is trial 398 with value: 3.484125427035651.
[I 2026-03-12 01:57:18,122] Trial 916 finished with value: 3.484125427035651 and parameters: {'timeframe': 'M8', 'atr_period': 13, 'atr_threshold': 5.0, 'pt_mult': 0.5, 'sl_mult': 5.0, 'td_mins': 120}. Best is trial 398 with value: 3.484125427035651.
[I 2026-03-12 01:57:18,239] Trial 917 pruned. 
[I 2026-03-12 01:57:18,358] Trial 918 finished with value: 3.484125427035651 and parameters: {'timeframe': 'M8', 'atr_period': 13, 'atr_threshold': 5.0, 'pt_mult': 0.5, 'sl_mult': 5.0, 'td_mins': 120}. Best is trial 398 with value: 3.484125427035651.
[I 2026-03-12 01:57:18,415] Trial 919 pruned. 
[I 2026-03-12 01:57:18,530] Trial 920 pruned. 
[I 2026-03-12 01:57:18,584] Trial 921 pruned. 
[I 2026-03-12 01:57:18,655] Trial 922 pruned. 
[I 2026-03-12 01:57:18,768] Trial 923 finished with value: 3.484125427035651 and parameters: {'timeframe': 'M8', 'atr_period': 13, 'atr_threshold': 5.0, 'pt_mult': 0.5, 'sl_mult': 5.0, 'td_mins': 120}. Best is trial 398 with value: 3.484125427035651.
[I 2026-03-12 01:57:18,822] Trial 924 pruned. 
[I 2026-03-12 01:57:19,260] Trial 925 pruned. 
[I 2026-03-12 01:57:19,365] Trial 926 pruned. 
[I 2026-03-12 01:57:19,418] Trial 927 finished with value: 0.0 and parameters: {'timeframe': 'M8', 'atr_period': 13, 'atr_threshold': 10.0, 'pt_mult': 0.5, 'sl_mult': 5.0, 'td_mins': 120}. Best is trial 398 with value: 3.484125427035651.
[I 2026-03-12 01:57:19,468] Trial 928 finished with value: 0.0 and parameters: {'timeframe': 'M8', 'atr_period': 13, 'atr_threshold': 15.0, 'pt_mult': 0.5, 'sl_mult': 0.5, 'td_mins': 30}. Best is trial 398 with value: 3.484125427035651.
[I 2026-03-12 01:57:19,520] Trial 929 finished with value: 0.0 and parameters: {'timeframe': 'M8', 'atr_period': 13, 'atr_threshold': 15.0, 'pt_mult': 0.5, 'sl_mult': 5.0, 'td_mins': 120}. Best is trial 398 with value: 3.484125427035651.
[I 2026-03-12 01:57:19,665] Trial 930 pruned. 
[I 2026-03-12 01:57:19,760] Trial 931 pruned. 
[I 2026-03-12 01:57:19,828] Trial 932 pruned. 
[I 2026-03-12 01:57:20,168] Trial 933 pruned. 
[I 2026-03-12 01:57:20,280] Trial 934 finished with value: 3.484125427035651 and parameters: {'timeframe': 'M8', 'atr_period': 13, 'atr_threshold': 5.0, 'pt_mult': 0.5, 'sl_mult': 5.0, 'td_mins': 120}. Best is trial 398 with value: 3.484125427035651.
[I 2026-03-12 01:57:20,334] Trial 935 pruned. 
[I 2026-03-12 01:57:20,466] Trial 936 finished with value: 3.484125427035651 and parameters: {'timeframe': 'M8', 'atr_period': 13, 'atr_threshold': 5.0, 'pt_mult': 0.5, 'sl_mult': 5.0, 'td_mins': 120}. Best is trial 398 with value: 3.484125427035651.
[I 2026-03-12 01:57:20,581] Trial 937 finished with value: 1.8479405007566938 and parameters: {'timeframe': 'M8', 'atr_period': 13, 'atr_threshold': 5.0, 'pt_mult': 2.5, 'sl_mult': 5.0, 'td_mins': 120}. Best is trial 398 with value: 3.484125427035651.
[I 2026-03-12 01:57:20,676] Trial 938 pruned. 
[I 2026-03-12 01:57:21,042] Trial 939 pruned. 
[I 2026-03-12 01:57:21,095] Trial 940 finished with value: 0.0 and parameters: {'timeframe': 'M8', 'atr_period': 13, 'atr_threshold': 10.0, 'pt_mult': 5.0, 'sl_mult': 5.0, 'td_mins': 15}. Best is trial 398 with value: 3.484125427035651.
[I 2026-03-12 01:57:21,227] Trial 941 pruned. 
[I 2026-03-12 01:57:21,304] Trial 942 finished with value: 2.4896042006737558 and parameters: {'timeframe': 'M8', 'atr_period': 13, 'atr_threshold': 5.0, 'pt_mult': 0.5, 'sl_mult': 5.0, 'td_mins': 30}. Best is trial 398 with value: 3.484125427035651.
[I 2026-03-12 01:57:21,384] Trial 943 pruned. 
[I 2026-03-12 01:57:21,496] Trial 944 finished with value: 3.484125427035651 and parameters: {'timeframe': 'M8', 'atr_period': 13, 'atr_threshold': 5.0, 'pt_mult': 0.5, 'sl_mult': 5.0, 'td_mins': 120}. Best is trial 398 with value: 3.484125427035651.
[I 2026-03-12 01:57:21,916] Trial 945 pruned. 
[I 2026-03-12 01:57:22,047] Trial 946 pruned. 
[I 2026-03-12 01:57:22,122] Trial 947 pruned. 
[I 2026-03-12 01:57:22,365] Trial 948 pruned. 
[I 2026-03-12 01:57:22,415] Trial 949 finished with value: 0.0 and parameters: {'timeframe': 'M8', 'atr_period': 13, 'atr_threshold': 8.0, 'pt_mult': 2.5, 'sl_mult': 5.0, 'td_mins': 60}. Best is trial 398 with value: 3.484125427035651.
[I 2026-03-12 01:57:22,579] Trial 950 pruned. 
[I 2026-03-12 01:57:22,692] Trial 951 finished with value: 3.484125427035651 and parameters: {'timeframe': 'M8', 'atr_period': 13, 'atr_threshold': 5.0, 'pt_mult': 0.5, 'sl_mult': 5.0, 'td_mins': 120}. Best is trial 398 with value: 3.484125427035651.
[I 2026-03-12 01:57:22,742] Trial 952 finished with value: 0.0 and parameters: {'timeframe': 'M8', 'atr_period': 13, 'atr_threshold': 15.0, 'pt_mult': 2.5, 'sl_mult': 1.0, 'td_mins': 120}. Best is trial 398 with value: 3.484125427035651.
[I 2026-03-12 01:57:23,104] Trial 953 finished with value: 1.5146017913734133 and parameters: {'timeframe': 'M8', 'atr_period': 13, 'atr_threshold': 5.0, 'pt_mult': 0.5, 'sl_mult': 5.0, 'td_mins': 720}. Best is trial 398 with value: 3.484125427035651.
[I 2026-03-12 01:57:23,247] Trial 954 pruned. 
[I 2026-03-12 01:57:23,753] Trial 955 pruned. 
[I 2026-03-12 01:57:23,806] Trial 956 finished with value: 0.0 and parameters: {'timeframe': 'M8', 'atr_period': 13, 'atr_threshold': 8.0, 'pt_mult': 0.5, 'sl_mult': 2.5, 'td_mins': 30}. Best is trial 398 with value: 3.484125427035651.
[I 2026-03-12 01:57:23,869] Trial 957 pruned. 
[I 2026-03-12 01:57:23,935] Trial 958 pruned. 
[I 2026-03-12 01:57:23,985] Trial 959 finished with value: 0.0 and parameters: {'timeframe': 'M8', 'atr_period': 13, 'atr_threshold': 8.0, 'pt_mult': 1.0, 'sl_mult': 0.5, 'td_mins': 30}. Best is trial 398 with value: 3.484125427035651.
[I 2026-03-12 01:57:24,310] Trial 960 pruned. 
[I 2026-03-12 01:57:24,363] Trial 961 finished with value: 0.0 and parameters: {'timeframe': 'M8', 'atr_period': 13, 'atr_threshold': 8.0, 'pt_mult': 0.5, 'sl_mult': 5.0, 'td_mins': 120}. Best is trial 398 with value: 3.484125427035651.
[I 2026-03-12 01:57:24,419] Trial 962 pruned. 
[I 2026-03-12 01:57:24,540] Trial 963 finished with value: 2.7985173655325846 and parameters: {'timeframe': 'M8', 'atr_period': 13, 'atr_threshold': 5.0, 'pt_mult': 1.0, 'sl_mult': 5.0, 'td_mins': 120}. Best is trial 398 with value: 3.484125427035651.
[I 2026-03-12 01:57:24,662] Trial 964 finished with value: 3.484125427035651 and parameters: {'timeframe': 'M8', 'atr_period': 13, 'atr_threshold': 5.0, 'pt_mult': 0.5, 'sl_mult': 5.0, 'td_mins': 120}. Best is trial 398 with value: 3.484125427035651.
[I 2026-03-12 01:57:24,714] Trial 965 finished with value: 0.0 and parameters: {'timeframe': 'M8', 'atr_period': 13, 'atr_threshold': 8.0, 'pt_mult': 0.5, 'sl_mult': 0.5, 'td_mins': 5}. Best is trial 398 with value: 3.484125427035651.
[I 2026-03-12 01:57:25,198] Trial 966 pruned. 
[I 2026-03-12 01:57:25,315] Trial 967 finished with value: 3.484125427035651 and parameters: {'timeframe': 'M8', 'atr_period': 13, 'atr_threshold': 5.0, 'pt_mult': 0.5, 'sl_mult': 5.0, 'td_mins': 120}. Best is trial 398 with value: 3.484125427035651.
[I 2026-03-12 01:57:25,374] Trial 968 pruned. 
[I 2026-03-12 01:57:25,498] Trial 969 finished with value: 3.484125427035651 and parameters: {'timeframe': 'M8', 'atr_period': 13, 'atr_threshold': 5.0, 'pt_mult': 0.5, 'sl_mult': 5.0, 'td_mins': 120}. Best is trial 398 with value: 3.484125427035651.
[I 2026-03-12 01:57:25,548] Trial 970 finished with value: 0.0 and parameters: {'timeframe': 'M8', 'atr_period': 13, 'atr_threshold': 10.0, 'pt_mult': 5.0, 'sl_mult': 5.0, 'td_mins': 1080}. Best is trial 398 with value: 3.484125427035651.
[I 2026-03-12 01:57:25,599] Trial 971 finished with value: 0.0 and parameters: {'timeframe': 'M8', 'atr_period': 13, 'atr_threshold': 15.0, 'pt_mult': 0.5, 'sl_mult': 2.5, 'td_mins': 60}. Best is trial 398 with value: 3.484125427035651.
[I 2026-03-12 01:57:25,659] Trial 972 pruned. 
[I 2026-03-12 01:57:25,771] Trial 973 finished with value: 3.484125427035651 and parameters: {'timeframe': 'M8', 'atr_period': 13, 'atr_threshold': 5.0, 'pt_mult': 0.5, 'sl_mult': 5.0, 'td_mins': 120}. Best is trial 398 with value: 3.484125427035651.
[I 2026-03-12 01:57:25,825] Trial 974 pruned. 
[I 2026-03-12 01:57:25,940] Trial 975 finished with value: 3.484125427035651 and parameters: {'timeframe': 'M8', 'atr_period': 13, 'atr_threshold': 5.0, 'pt_mult': 0.5, 'sl_mult': 5.0, 'td_mins': 120}. Best is trial 398 with value: 3.484125427035651.
[I 2026-03-12 01:57:26,042] Trial 976 pruned. 
[I 2026-03-12 01:57:26,272] Trial 977 pruned. 
[I 2026-03-12 01:57:26,422] Trial 978 finished with value: 3.484125427035651 and parameters: {'timeframe': 'M8', 'atr_period': 13, 'atr_threshold': 5.0, 'pt_mult': 0.5, 'sl_mult': 5.0, 'td_mins': 120}. Best is trial 398 with value: 3.484125427035651.
[I 2026-03-12 01:57:26,534] Trial 979 finished with value: 3.484125427035651 and parameters: {'timeframe': 'M8', 'atr_period': 13, 'atr_threshold': 5.0, 'pt_mult': 0.5, 'sl_mult': 5.0, 'td_mins': 120}. Best is trial 398 with value: 3.484125427035651.
[I 2026-03-12 01:57:26,587] Trial 980 pruned. 
[I 2026-03-12 01:57:26,640] Trial 981 finished with value: 0.0 and parameters: {'timeframe': 'M8', 'atr_period': 13, 'atr_threshold': 8.0, 'pt_mult': 1.0, 'sl_mult': 0.5, 'td_mins': 720}. Best is trial 398 with value: 3.484125427035651.
[I 2026-03-12 01:57:26,699] Trial 982 finished with value: 0.0 and parameters: {'timeframe': 'M8', 'atr_period': 13, 'atr_threshold': 10.0, 'pt_mult': 5.0, 'sl_mult': 2.5, 'td_mins': 15}. Best is trial 398 with value: 3.484125427035651.
[I 2026-03-12 01:57:26,834] Trial 983 finished with value: 3.484125427035651 and parameters: {'timeframe': 'M8', 'atr_period': 13, 'atr_threshold': 5.0, 'pt_mult': 0.5, 'sl_mult': 5.0, 'td_mins': 120}. Best is trial 398 with value: 3.484125427035651.
[I 2026-03-12 01:57:26,908] Trial 984 pruned. 
[I 2026-03-12 01:57:26,963] Trial 985 finished with value: 0.0 and parameters: {'timeframe': 'M8', 'atr_period': 13, 'atr_threshold': 15.0, 'pt_mult': 0.5, 'sl_mult': 2.5, 'td_mins': 30}. Best is trial 398 with value: 3.484125427035651.
[I 2026-03-12 01:57:27,073] Trial 986 pruned. 
[I 2026-03-12 01:57:27,131] Trial 987 pruned. 
[I 2026-03-12 01:57:27,328] Trial 988 finished with value: 1.4967331369168109 and parameters: {'timeframe': 'M8', 'atr_period': 13, 'atr_threshold': 5.0, 'pt_mult': 0.5, 'sl_mult': 5.0, 'td_mins': 360}. Best is trial 398 with value: 3.484125427035651.
[I 2026-03-12 01:57:27,441] Trial 989 finished with value: 3.484125427035651 and parameters: {'timeframe': 'M8', 'atr_period': 13, 'atr_threshold': 5.0, 'pt_mult': 0.5, 'sl_mult': 5.0, 'td_mins': 120}. Best is trial 398 with value: 3.484125427035651.
[I 2026-03-12 01:57:27,495] Trial 990 finished with value: 0.0 and parameters: {'timeframe': 'M8', 'atr_period': 13, 'atr_threshold': 10.0, 'pt_mult': 1.0, 'sl_mult': 5.0, 'td_mins': 60}. Best is trial 398 with value: 3.484125427035651.
[I 2026-03-12 01:57:27,563] Trial 991 pruned. 
[I 2026-03-12 01:57:27,620] Trial 992 pruned. 
[I 2026-03-12 01:57:27,717] Trial 993 pruned. 
[I 2026-03-12 01:57:27,835] Trial 994 finished with value: 3.484125427035651 and parameters: {'timeframe': 'M8', 'atr_period': 13, 'atr_threshold': 5.0, 'pt_mult': 0.5, 'sl_mult': 5.0, 'td_mins': 120}. Best is trial 398 with value: 3.484125427035651.
[I 2026-03-12 01:57:27,889] Trial 995 pruned. 
[I 2026-03-12 01:57:27,940] Trial 996 finished with value: 0.0 and parameters: {'timeframe': 'M8', 'atr_period': 13, 'atr_threshold': 15.0, 'pt_mult': 0.5, 'sl_mult': 5.0, 'td_mins': 30}. Best is trial 398 with value: 3.484125427035651.
[I 2026-03-12 01:57:28,037] Trial 997 pruned. 
[I 2026-03-12 01:57:28,188] Trial 998 pruned. 
[I 2026-03-12 01:57:28,780] Trial 999 pruned. 
2026-03-12 01:57:28,839 - INFO - === Starting Optuna Optimization for M15 [SHORT_ONLY] (Trials: 1000) ===
/home/hephaestus-zero/.local/lib/python3.11/site-packages/optuna/_experimental.py:32: ExperimentalWarning: Argument ``multivariate`` is an experimental feature. The interface can change in the future.
  warnings.warn(
[I 2026-03-12 01:57:28,839] A new study created in memory with name: no-name-c9d003cd-820d-469a-b29c-2a16b05223d3
2026-03-12 01:57:28,841 - INFO -     [Cache Miss] Loading Signal Data for M15, ATR=13...
2026-03-12 01:58:04,979 - INFO -     [Cache Miss] Loading Signal Data for M15, ATR=13...
2026-03-12 01:58:40,682 - INFO -     [Cache Miss] Loading Signal Data for M15, ATR=13...
2026-03-12 01:59:16,637 - INFO -     [Cache Miss] Loading Signal Data for M15, ATR=13...
2026-03-12 01:59:52,634 - INFO -     [Cache Miss] Loading Signal Data for M15, ATR=13...
[I 2026-03-12 02:00:28,587] Trial 0 finished with value: 0.19704688930605538 and parameters: {'timeframe': 'M15', 'atr_period': 13, 'atr_threshold': 8.0, 'pt_mult': 2.5, 'sl_mult': 0.5, 'td_mins': 1200}. Best is trial 0 with value: 0.19704688930605538.
[I 2026-03-12 02:00:28,631] Trial 1 finished with value: 0.0 and parameters: {'timeframe': 'M15', 'atr_period': 13, 'atr_threshold': 15.0, 'pt_mult': 2.5, 'sl_mult': 2.5, 'td_mins': 1200}. Best is trial 0 with value: 0.19704688930605538.
[I 2026-03-12 02:00:29,075] Trial 2 finished with value: 0.6255712425223138 and parameters: {'timeframe': 'M15', 'atr_period': 13, 'atr_threshold': 5.0, 'pt_mult': 5.0, 'sl_mult': 0.5, 'td_mins': 720}. Best is trial 2 with value: 0.6255712425223138.
[I 2026-03-12 02:00:29,120] Trial 3 finished with value: 0.0 and parameters: {'timeframe': 'M15', 'atr_period': 13, 'atr_threshold': 10.0, 'pt_mult': 5.0, 'sl_mult': 0.5, 'td_mins': 60}. Best is trial 2 with value: 0.6255712425223138.
[I 2026-03-12 02:00:29,163] Trial 4 finished with value: 0.0 and parameters: {'timeframe': 'M15', 'atr_period': 13, 'atr_threshold': 10.0, 'pt_mult': 2.5, 'sl_mult': 0.5, 'td_mins': 30}. Best is trial 2 with value: 0.6255712425223138.
[I 2026-03-12 02:00:29,207] Trial 5 finished with value: 0.0 and parameters: {'timeframe': 'M15', 'atr_period': 13, 'atr_threshold': 10.0, 'pt_mult': 5.0, 'sl_mult': 5.0, 'td_mins': 360}. Best is trial 2 with value: 0.6255712425223138.
[I 2026-03-12 02:00:29,774] Trial 6 finished with value: 0.6067812122198597 and parameters: {'timeframe': 'M15', 'atr_period': 13, 'atr_threshold': 2.0, 'pt_mult': 2.5, 'sl_mult': 1.0, 'td_mins': 180}. Best is trial 2 with value: 0.6255712425223138.
[I 2026-03-12 02:00:30,426] Trial 7 finished with value: 0.45749914948453635 and parameters: {'timeframe': 'M15', 'atr_period': 13, 'atr_threshold': 0.5, 'pt_mult': 5.0, 'sl_mult': 5.0, 'td_mins': 120}. Best is trial 2 with value: 0.6255712425223138.
[I 2026-03-12 02:00:30,534] Trial 8 finished with value: 0.5629394750773307 and parameters: {'timeframe': 'M15', 'atr_period': 13, 'atr_threshold': 5.0, 'pt_mult': 1.0, 'sl_mult': 1.0, 'td_mins': 120}. Best is trial 2 with value: 0.6255712425223138.
[I 2026-03-12 02:00:30,650] Trial 9 finished with value: 0.32777748710421994 and parameters: {'timeframe': 'M15', 'atr_period': 13, 'atr_threshold': 3.0, 'pt_mult': 1.0, 'sl_mult': 0.5, 'td_mins': 15}. Best is trial 2 with value: 0.6255712425223138.
[I 2026-03-12 02:00:30,777] Trial 10 finished with value: 0.3086562071723614 and parameters: {'timeframe': 'M15', 'atr_period': 13, 'atr_threshold': 1.0, 'pt_mult': 0.5, 'sl_mult': 0.5, 'td_mins': 5}. Best is trial 2 with value: 0.6255712425223138.
[I 2026-03-12 02:00:30,820] Trial 11 finished with value: 0.0 and parameters: {'timeframe': 'M15', 'atr_period': 13, 'atr_threshold': 10.0, 'pt_mult': 1.0, 'sl_mult': 1.0, 'td_mins': 720}. Best is trial 2 with value: 0.6255712425223138.
[I 2026-03-12 02:00:31,394] Trial 12 finished with value: 0.2840706244614825 and parameters: {'timeframe': 'M15', 'atr_period': 13, 'atr_threshold': 2.0, 'pt_mult': 5.0, 'sl_mult': 1.0, 'td_mins': 180}. Best is trial 2 with value: 0.6255712425223138.
[I 2026-03-12 02:00:31,514] Trial 13 finished with value: 0.33931604827417944 and parameters: {'timeframe': 'M15', 'atr_period': 13, 'atr_threshold': 8.0, 'pt_mult': 5.0, 'sl_mult': 5.0, 'td_mins': 360}. Best is trial 2 with value: 0.6255712425223138.
[I 2026-03-12 02:00:34,528] Trial 14 finished with value: 0.8824797869071368 and parameters: {'timeframe': 'M15', 'atr_period': 13, 'atr_threshold': 2.0, 'pt_mult': 5.0, 'sl_mult': 0.5, 'td_mins': 1200}. Best is trial 14 with value: 0.8824797869071368.
[I 2026-03-12 02:00:34,572] Trial 15 finished with value: 0.0 and parameters: {'timeframe': 'M15', 'atr_period': 13, 'atr_threshold': 10.0, 'pt_mult': 0.5, 'sl_mult': 2.5, 'td_mins': 120}. Best is trial 14 with value: 0.8824797869071368.
[I 2026-03-12 02:00:34,980] Trial 16 finished with value: 0.8241257289716757 and parameters: {'timeframe': 'M15', 'atr_period': 13, 'atr_threshold': 5.0, 'pt_mult': 2.5, 'sl_mult': 0.5, 'td_mins': 720}. Best is trial 14 with value: 0.8824797869071368.
[I 2026-03-12 02:00:35,033] Trial 17 finished with value: 0.0 and parameters: {'timeframe': 'M15', 'atr_period': 13, 'atr_threshold': 10.0, 'pt_mult': 1.0, 'sl_mult': 0.5, 'td_mins': 120}. Best is trial 14 with value: 0.8824797869071368.
[I 2026-03-12 02:00:35,120] Trial 18 finished with value: 0.6049607296154583 and parameters: {'timeframe': 'M15', 'atr_period': 13, 'atr_threshold': 5.0, 'pt_mult': 1.0, 'sl_mult': 2.5, 'td_mins': 15}. Best is trial 14 with value: 0.8824797869071368.
[I 2026-03-12 02:00:35,209] Trial 19 finished with value: 0.004581060865053192 and parameters: {'timeframe': 'M15', 'atr_period': 13, 'atr_threshold': 3.0, 'pt_mult': 5.0, 'sl_mult': 1.0, 'td_mins': 5}. Best is trial 14 with value: 0.8824797869071368.
[I 2026-03-12 02:00:35,253] Trial 20 pruned. 
[I 2026-03-12 02:00:36,891] Trial 21 finished with value: 0.9716273569542473 and parameters: {'timeframe': 'M15', 'atr_period': 13, 'atr_threshold': 0.5, 'pt_mult': 1.0, 'sl_mult': 0.5, 'td_mins': 1200}. Best is trial 21 with value: 0.9716273569542473.
[I 2026-03-12 02:00:36,934] Trial 22 pruned. 
[I 2026-03-12 02:00:37,154] Trial 23 finished with value: 0.5447643862284983 and parameters: {'timeframe': 'M15', 'atr_period': 13, 'atr_threshold': 1.0, 'pt_mult': 1.0, 'sl_mult': 0.5, 'td_mins': 30}. Best is trial 21 with value: 0.9716273569542473.
[I 2026-03-12 02:00:39,200] Trial 24 finished with value: 0.9531844621897119 and parameters: {'timeframe': 'M15', 'atr_period': 13, 'atr_threshold': 0.5, 'pt_mult': 1.0, 'sl_mult': 1.0, 'td_mins': 1200}. Best is trial 21 with value: 0.9716273569542473.
[I 2026-03-12 02:00:39,243] Trial 25 finished with value: 0.0 and parameters: {'timeframe': 'M15', 'atr_period': 13, 'atr_threshold': 15.0, 'pt_mult': 2.5, 'sl_mult': 1.0, 'td_mins': 30}. Best is trial 21 with value: 0.9716273569542473.
[I 2026-03-12 02:00:39,288] Trial 26 finished with value: 0.0 and parameters: {'timeframe': 'M15', 'atr_period': 13, 'atr_threshold': 10.0, 'pt_mult': 0.5, 'sl_mult': 2.5, 'td_mins': 5}. Best is trial 21 with value: 0.9716273569542473.
[I 2026-03-12 02:00:39,387] Trial 27 pruned. 
[I 2026-03-12 02:00:42,481] Trial 28 finished with value: 0.940599213970232 and parameters: {'timeframe': 'M15', 'atr_period': 13, 'atr_threshold': 0.5, 'pt_mult': 2.5, 'sl_mult': 1.0, 'td_mins': 1200}. Best is trial 21 with value: 0.9716273569542473.
[I 2026-03-12 02:00:42,527] Trial 29 finished with value: 0.0 and parameters: {'timeframe': 'M15', 'atr_period': 13, 'atr_threshold': 10.0, 'pt_mult': 1.0, 'sl_mult': 2.5, 'td_mins': 180}. Best is trial 21 with value: 0.9716273569542473.
[I 2026-03-12 02:00:42,791] Trial 30 finished with value: 0.6375306663325941 and parameters: {'timeframe': 'M15', 'atr_period': 13, 'atr_threshold': 5.0, 'pt_mult': 0.5, 'sl_mult': 0.5, 'td_mins': 1200}. Best is trial 21 with value: 0.9716273569542473.
[I 2026-03-12 02:00:42,855] Trial 31 pruned. 
[I 2026-03-12 02:00:42,900] Trial 32 finished with value: 0.0 and parameters: {'timeframe': 'M15', 'atr_period': 13, 'atr_threshold': 10.0, 'pt_mult': 2.5, 'sl_mult': 2.5, 'td_mins': 1200}. Best is trial 21 with value: 0.9716273569542473.
[I 2026-03-12 02:00:44,167] Trial 33 finished with value: 1.4985832147843308 and parameters: {'timeframe': 'M15', 'atr_period': 13, 'atr_threshold': 0.5, 'pt_mult': 1.0, 'sl_mult': 5.0, 'td_mins': 360}. Best is trial 33 with value: 1.4985832147843308.
