[I 2026-03-12 01:12:34,694] Trial 999 pruned. 

==========================================================================================
🏆 M1 Top 10 Configurations 🏆
==========================================================================================
timeframe  atr_period  atr_threshold  pt_mult  sl_mult  td_mins  Total_Bets     Wins  Losses  Timeouts  Avg_ATR  Avg_Payoff     Total_NP    Timeout_NP  Adjusted_PF
       M1          13            2.0      0.5      5.0        5     30134.0  21412.0   279.0    8443.0   2.2746         0.1  216281317.0 -1.013160e+08     2.153336
       M1          13            2.0      1.0      5.0       15     30134.0  20162.0  1849.0    8123.0   2.2746         0.2  273832210.0 -9.747600e+07     1.778026
       M1          13            2.0      0.5      5.0       15     30134.0  24903.0  1258.0    3973.0   2.2746         0.1  161609693.0 -4.767600e+07     1.754491
       M1          13            2.0      1.0      5.0        5     30134.0  14241.0   367.0   15526.0   2.2746         0.2  237936166.0 -1.863120e+08     1.716502
       M1          13            1.0      1.0      5.0       15    238327.0 158210.0 12646.0   67471.0   1.4413         0.2 1222006142.0 -8.096520e+08     1.534582
       M1          13            2.0      1.0      5.0       30     30134.0  22574.0  3392.0    4168.0   2.2746         0.2  140544838.0 -5.001600e+07     1.263396
       M1          13            1.0      1.0      5.0        5    238327.0 108717.0  2284.0  127326.0   1.4413         0.2  573901872.0 -1.527912e+09     1.220084
       M1          13            2.0      0.5      5.0       30     30134.0  26163.0  2124.0    1847.0   2.2746         0.1   61252638.0 -2.216400e+07     1.188412
       M1          13            2.0      2.5      5.0       15     30134.0   8943.0  2437.0   18754.0   2.2746         0.5  122726126.0 -2.250480e+08     1.182511
       M1          13            2.0      2.5      5.0       30     30134.0  13095.0  4979.0   12060.0   2.2746         0.5  123607009.0 -1.447200e+08     1.135995

==========================================================================================
🏆 M3 Top 10 Configurations 🏆
==========================================================================================
timeframe  atr_period  atr_threshold  pt_mult  sl_mult  td_mins  Total_Bets     Wins  Losses  Timeouts  Avg_ATR  Avg_Payoff     Total_NP   Timeout_NP  Adjusted_PF
       M3          13            3.0      0.5      5.0       30     15584.0  11863.0   379.0    3342.0   3.5680         0.1  174337370.0  -40104000.0     2.661076
       M3          13            3.0      0.5      5.0       15     15584.0  10512.0   150.0    4922.0   3.5680         0.1  181868048.0  -59064000.0     2.568082
       M3          13            3.0      0.5      5.0       60     15584.0  12850.0   673.0    2061.0   3.5680         0.1  134159060.0  -24732000.0     2.471837
       M3          13            2.0      0.5      5.0       30     58411.0  44573.0  1250.0   12588.0   2.7034         0.1  493939036.0 -151056000.0     2.268830
       M3          13            2.0      0.5      5.0       15     58411.0  39391.0   491.0   18529.0   2.7034         0.1  474912304.0 -222348000.0     2.255482
       M3          13            3.0      1.0      5.0       60     15584.0  10280.0  1018.0    4286.0   3.5680         0.2  219661605.0  -51432000.0     2.095930
       M3          13            3.0      1.0      5.0       30     15584.0   8461.0   536.0    6587.0   3.5680         0.2  228928977.0  -79044000.0     1.960048
       M3          13            2.0      1.0      5.0       30     58411.0  31917.0  1807.0   24687.0   2.7034         0.2  624778831.0 -296244000.0     1.932584
       M3          13            3.0      0.5      5.0      120     15584.0  13491.0   889.0    1204.0   3.5680         0.1  103673063.0  -14448000.0     1.790702
       M3          13            1.0      0.5      5.0       30    235514.0 182032.0  5402.0   48080.0   1.7140         0.1 1068102407.0 -576960000.0     1.766129

==========================================================================================
🏆 M5 Top 10 Configurations 🏆
==========================================================================================
timeframe  atr_period  atr_threshold  pt_mult  sl_mult  td_mins  Total_Bets    Wins  Losses  Timeouts  Avg_ATR  Avg_Payoff    Total_NP   Timeout_NP  Adjusted_PF
       M5          13            3.0      0.5      5.0       30     20812.0 14281.0   268.0    6263.0   3.8332         0.1 257813213.0  -75156000.0     2.387065
       M5          13            3.0      0.5      5.0       60     20812.0 16095.0   572.0    4145.0   3.8332         0.1 245314649.0  -49740000.0     2.146003
       M5          13            3.0      0.5      5.0       15     20812.0 11961.0    88.0    8763.0   3.8332         0.1 214222194.0 -105156000.0     2.130923
       M5          13            2.0      0.5      5.0       30     66076.0 45054.0   868.0   20154.0   2.8553         0.1 539832129.0 -241848000.0     2.094834
       M5          13            2.0      0.5      5.0       60     66076.0 50629.0  1841.0   13606.0   2.8553         0.1 529344622.0 -163272000.0     1.991640
       M5          13            3.0      1.0      5.0       60     20812.0 11707.0   832.0    8273.0   3.8332         0.2 328935134.0  -99276000.0     1.860939
       M5          13            3.0      0.5      5.0      180     20812.0 17938.0  1096.0    1778.0   3.8332         0.1 175966449.0  -21336000.0     1.783955
       M5          13            3.0      0.5      5.0      120     20812.0 17404.0   904.0    2504.0   3.8332         0.1 206119248.0  -30048000.0     1.769412
       M5          13            3.0      1.0      5.0       30     20812.0  8825.0   353.0   11634.0   3.8332         0.2 266069510.0 -139608000.0     1.727953
       M5          13            3.0      1.0      5.0      120     20812.0 14116.0  1416.0    5280.0   3.8332         0.2 331939030.0  -63360000.0     1.705485

==========================================================================================
🏆 M8 Top 10 Configurations 🏆
==========================================================================================
timeframe  atr_period  atr_threshold  pt_mult  sl_mult  td_mins  Total_Bets     Wins  Losses  Timeouts  Avg_ATR  Avg_Payoff    Total_NP   Timeout_NP  Adjusted_PF
       M8          13            3.0      0.5      5.0       60     25684.0  17839.0   472.0    7373.0   4.0197         0.1 303669091.0  -88476000.0     2.253736
       M8          13            3.0      0.5      5.0       30     25684.0  15183.0   186.0   10315.0   4.0197         0.1 278391135.0 -123780000.0     2.177254
       M8          13            3.0      0.5      5.0      120     25684.0  19901.0   832.0    4951.0   4.0197         0.1 282059727.0  -59412000.0     2.035113
       M8          13            2.0      0.5      5.0       60     69919.0  48317.0  1236.0   20366.0   3.0101         0.1 562657360.0 -244392000.0     1.918958
       M8          13            3.0      0.5      5.0      180     25684.0  20782.0  1087.0    3815.0   4.0197         0.1 243798671.0  -45780000.0     1.873476
       M8          13            3.0      1.0      5.0      120     25684.0  15000.0  1250.0    9434.0   4.0197         0.2 409931657.0 -113208000.0     1.789019
       M8          13            1.0      0.5      5.0       60    155617.0 111393.0  3096.0   41128.0   2.1646         0.1 805631149.0 -493536000.0     1.756591
       M8          13            3.0      1.0      5.0       60     25684.0  11693.0   651.0   13340.0   4.0197         0.2 350172184.0 -160080000.0     1.754279
       M8          13            5.0      0.5      5.0       30      4314.0   2635.0    39.0    1640.0   5.6988         0.1  76518997.0  -19680000.0     1.673740
       M8          13            5.0      0.5      5.0       15      4314.0   2111.0     6.0    2197.0   5.6988         0.1  61484258.0  -26364000.0     1.607736

==========================================================================================
🏆 M15 Top 10 Configurations 🏆
==========================================================================================2026-03-12 01:12:34,758 - INFO - === Starting Optuna Optimization for mixed (Trials: 1000) ===
/home/hephaestus-zero/.local/lib/python3.11/site-packages/optuna/_experimental.py:32: ExperimentalWarning: Argument ``multivariate`` is an experimental feature. The interface can change in the future.
  warnings.warn(
[I 2026-03-12 01:12:34,759] A new study created in memory with name: no-name-ed1ca15b-96b8-49c6-9ff4-7b7f21d022f6
[I 2026-03-12 01:12:35,510] Trial 0 finished with value: 0.5640985701720334 and parameters: {'timeframe': 'mixed', 'atr_period': 13, 'atr_threshold': 3.0, 'pt_mult': 2.5, 'sl_mult': 0.5, 'td_mins': 120}. Best is trial 0 with value: 0.5640985701720334.
[I 2026-03-12 01:12:41,648] Trial 1 finished with value: 1.0356422487982657 and parameters: {'timeframe': 'mixed', 'atr_period': 13, 'atr_threshold': 0.5, 'pt_mult': 1.0, 'sl_mult': 0.5, 'td_mins': 720}. Best is trial 1 with value: 1.0356422487982657.
[I 2026-03-12 01:13:01,871] Trial 2 finished with value: 0.955921160602435 and parameters: {'timeframe': 'mixed', 'atr_period': 13, 'atr_threshold': 0.5, 'pt_mult': 5.0, 'sl_mult': 2.5, 'td_mins': 720}. Best is trial 1 with value: 1.0356422487982657.
[I 2026-03-12 01:13:02,044] Trial 3 finished with value: 0.0 and parameters: {'timeframe': 'mixed', 'atr_period': 13, 'atr_threshold': 15.0, 'pt_mult': 2.5, 'sl_mult': 5.0, 'td_mins': 5}. Best is trial 1 with value: 1.0356422487982657.
[I 2026-03-12 01:13:02,216] Trial 4 finished with value: 0.0 and parameters: {'timeframe': 'mixed', 'atr_period': 13, 'atr_threshold': 10.0, 'pt_mult': 2.5, 'sl_mult': 5.0, 'td_mins': 360}. Best is trial 1 with value: 1.0356422487982657.
[I 2026-03-12 01:13:03,404] Trial 5 finished with value: 0.28890506092865936 and parameters: {'timeframe': 'mixed', 'atr_period': 13, 'atr_threshold': 3.0, 'pt_mult': 5.0, 'sl_mult': 0.5, 'td_mins': 180}. Best is trial 1 with value: 1.0356422487982657.
[I 2026-03-12 01:13:03,771] Trial 6 finished with value: 0.6146147919806336 and parameters: {'timeframe': 'mixed', 'atr_period': 13, 'atr_threshold': 3.0, 'pt_mult': 1.0, 'sl_mult': 0.5, 'td_mins': 30}. Best is trial 1 with value: 1.0356422487982657.
[I 2026-03-12 01:13:23,328] Trial 7 finished with value: 1.0191673017200682 and parameters: {'timeframe': 'mixed', 'atr_period': 13, 'atr_threshold': 1.0, 'pt_mult': 5.0, 'sl_mult': 0.5, 'td_mins': 1200}. Best is trial 1 with value: 1.0356422487982657.
[I 2026-03-12 01:13:24,341] Trial 8 finished with value: 1.0212202573294316 and parameters: {'timeframe': 'mixed', 'atr_period': 13, 'atr_threshold': 2.0, 'pt_mult': 1.0, 'sl_mult': 2.5, 'td_mins': 60}. Best is trial 1 with value: 1.0356422487982657.
[I 2026-03-12 01:13:24,713] Trial 9 finished with value: 1.0347033830461596 and parameters: {'timeframe': 'mixed', 'atr_period': 13, 'atr_threshold': 5.0, 'pt_mult': 0.5, 'sl_mult': 5.0, 'td_mins': 180}. Best is trial 1 with value: 1.0356422487982657.
[I 2026-03-12 01:13:30,158] Trial 10 finished with value: 1.0023796593696406 and parameters: {'timeframe': 'mixed', 'atr_period': 13, 'atr_threshold': 0.5, 'pt_mult': 1.0, 'sl_mult': 1.0, 'td_mins': 360}. Best is trial 1 with value: 1.0356422487982657.
[I 2026-03-12 01:13:31,760] Trial 11 finished with value: 0.6421683148069564 and parameters: {'timeframe': 'mixed', 'atr_period': 13, 'atr_threshold': 2.0, 'pt_mult': 2.5, 'sl_mult': 1.0, 'td_mins': 120}. Best is trial 1 with value: 1.0356422487982657.
[I 2026-03-12 01:13:32,428] Trial 12 finished with value: 0.30611841485556923 and parameters: {'timeframe': 'mixed', 'atr_period': 13, 'atr_threshold': 2.0, 'pt_mult': 2.5, 'sl_mult': 0.5, 'td_mins': 30}. Best is trial 1 with value: 1.0356422487982657.
[I 2026-03-12 01:13:32,681] Trial 13 finished with value: 0.6791283214249544 and parameters: {'timeframe': 'mixed', 'atr_period': 13, 'atr_threshold': 5.0, 'pt_mult': 1.0, 'sl_mult': 1.0, 'td_mins': 120}. Best is trial 1 with value: 1.0356422487982657.
[I 2026-03-12 01:13:40,176] Trial 14 finished with value: 1.013432426741543 and parameters: {'timeframe': 'mixed', 'atr_period': 13, 'atr_threshold': 2.0, 'pt_mult': 2.5, 'sl_mult': 1.0, 'td_mins': 1200}. Best is trial 1 with value: 1.0356422487982657.
[I 2026-03-12 01:13:40,332] Trial 15 finished with value: 0.0 and parameters: {'timeframe': 'mixed', 'atr_period': 13, 'atr_threshold': 15.0, 'pt_mult': 2.5, 'sl_mult': 1.0, 'td_mins': 1200}. Best is trial 1 with value: 1.0356422487982657.
[I 2026-03-12 01:13:44,818] Trial 16 finished with value: 1.0269317296080884 and parameters: {'timeframe': 'mixed', 'atr_period': 13, 'atr_threshold': 2.0, 'pt_mult': 0.5, 'sl_mult': 2.5, 'td_mins': 720}. Best is trial 1 with value: 1.0356422487982657.
[I 2026-03-12 01:13:44,975] Trial 17 finished with value: 0.0 and parameters: {'timeframe': 'mixed', 'atr_period': 13, 'atr_threshold': 10.0, 'pt_mult': 2.5, 'sl_mult': 0.5, 'td_mins': 180}. Best is trial 1 with value: 1.0356422487982657.
[I 2026-03-12 01:13:45,132] Trial 18 finished with value: 0.0 and parameters: {'timeframe': 'mixed', 'atr_period': 13, 'atr_threshold': 10.0, 'pt_mult': 0.5, 'sl_mult': 1.0, 'td_mins': 30}. Best is trial 1 with value: 1.0356422487982657.
[I 2026-03-12 01:13:45,293] Trial 19 finished with value: 0.0 and parameters: {'timeframe': 'mixed', 'atr_period': 13, 'atr_threshold': 10.0, 'pt_mult': 0.5, 'sl_mult': 1.0, 'td_mins': 180}. Best is trial 1 with value: 1.0356422487982657.
[I 2026-03-12 01:13:45,450] Trial 20 finished with value: 0.0 and parameters: {'timeframe': 'mixed', 'atr_period': 13, 'atr_threshold': 10.0, 'pt_mult': 2.5, 'sl_mult': 2.5, 'td_mins': 15}. Best is trial 1 with value: 1.0356422487982657.
[I 2026-03-12 01:13:46,935] Trial 21 finished with value: 1.0100355900003373 and parameters: {'timeframe': 'mixed', 'atr_period': 13, 'atr_threshold': 2.0, 'pt_mult': 0.5, 'sl_mult': 0.5, 'td_mins': 360}. Best is trial 1 with value: 1.0356422487982657.
[I 2026-03-12 01:13:47,553] Trial 22 pruned. 
[I 2026-03-12 01:13:47,697] Trial 23 pruned. 
[I 2026-03-12 01:13:49,552] Trial 24 pruned. 
[I 2026-03-12 01:13:58,880] Trial 25 finished with value: 1.0064715600355751 and parameters: {'timeframe': 'mixed', 'atr_period': 13, 'atr_threshold': 1.0, 'pt_mult': 2.5, 'sl_mult': 1.0, 'td_mins': 720}. Best is trial 1 with value: 1.0356422487982657.
[I 2026-03-12 01:13:59,108] Trial 26 pruned. 
[I 2026-03-12 01:13:59,912] Trial 27 pruned. 
[I 2026-03-12 01:14:02,823] Trial 28 finished with value: 1.4736445410959171 and parameters: {'timeframe': 'mixed', 'atr_period': 13, 'atr_threshold': 2.0, 'pt_mult': 1.0, 'sl_mult': 5.0, 'td_mins': 180}. Best is trial 28 with value: 1.4736445410959171.
[I 2026-03-12 01:14:03,737] Trial 29 pruned. 
[I 2026-03-12 01:14:03,929] Trial 30 pruned. 
[I 2026-03-12 01:14:04,102] Trial 31 pruned. 
[I 2026-03-12 01:14:04,307] Trial 32 pruned. 
[I 2026-03-12 01:14:04,431] Trial 33 pruned. 
[I 2026-03-12 01:14:05,819] Trial 34 pruned. 
[I 2026-03-12 01:14:05,943] Trial 35 pruned. 
[I 2026-03-12 01:14:06,099] Trial 36 pruned. 
[I 2026-03-12 01:14:10,716] Trial 37 finished with value: 1.2293213348763312 and parameters: {'timeframe': 'mixed', 'atr_period': 13, 'atr_threshold': 1.0, 'pt_mult': 0.5, 'sl_mult': 5.0, 'td_mins': 180}. Best is trial 28 with value: 1.4736445410959171.
[I 2026-03-12 01:14:10,887] Trial 38 finished with value: 0.0 and parameters: {'timeframe': 'mixed', 'atr_period': 13, 'atr_threshold': 15.0, 'pt_mult': 1.0, 'sl_mult': 5.0, 'td_mins': 360}. Best is trial 28 with value: 1.4736445410959171.
[I 2026-03-12 01:14:12,964] Trial 39 pruned. 
[I 2026-03-12 01:14:13,131] Trial 40 finished with value: 0.0 and parameters: {'timeframe': 'mixed', 'atr_period': 13, 'atr_threshold': 10.0, 'pt_mult': 0.5, 'sl_mult': 2.5, 'td_mins': 720}. Best is trial 28 with value: 1.4736445410959171.
[I 2026-03-12 01:14:13,736] Trial 41 finished with value: 1.036628295281955 and parameters: {'timeframe': 'mixed', 'atr_period': 13, 'atr_threshold': 3.0, 'pt_mult': 0.5, 'sl_mult': 0.5, 'td_mins': 180}. Best is trial 28 with value: 1.4736445410959171.
[I 2026-03-12 01:14:13,873] Trial 42 pruned. 
[I 2026-03-12 01:14:19,210] Trial 43 pruned. 
[I 2026-03-12 01:14:19,375] Trial 44 finished with value: 0.0 and parameters: {'timeframe': 'mixed', 'atr_period': 13, 'atr_threshold': 10.0, 'pt_mult': 0.5, 'sl_mult': 0.5, 'td_mins': 720}. Best is trial 28 with value: 1.4736445410959171.
[I 2026-03-12 01:14:19,606] Trial 45 finished with value: 0.7563163309272246 and parameters: {'timeframe': 'mixed', 'atr_period': 13, 'atr_threshold': 5.0, 'pt_mult': 1.0, 'sl_mult': 2.5, 'td_mins': 60}. Best is trial 28 with value: 1.4736445410959171.
[I 2026-03-12 01:14:19,767] Trial 46 finished with value: 0.0 and parameters: {'timeframe': 'mixed', 'atr_period': 13, 'atr_threshold': 10.0, 'pt_mult': 2.5, 'sl_mult': 2.5, 'td_mins': 360}. Best is trial 28 with value: 1.4736445410959171.
[I 2026-03-12 01:14:20,550] Trial 47 pruned. 
[I 2026-03-12 01:14:22,011] Trial 48 finished with value: 1.1329563433534147 and parameters: {'timeframe': 'mixed', 'atr_period': 13, 'atr_threshold': 2.0, 'pt_mult': 0.5, 'sl_mult': 2.5, 'td_mins': 120}. Best is trial 28 with value: 1.4736445410959171.
[I 2026-03-12 01:14:22,290] Trial 49 pruned. 
[I 2026-03-12 01:14:32,039] Trial 50 finished with value: 1.0707657216867168 and parameters: {'timeframe': 'mixed', 'atr_period': 13, 'atr_threshold': 2.0, 'pt_mult': 0.5, 'sl_mult': 5.0, 'td_mins': 1200}. Best is trial 28 with value: 1.4736445410959171.
[I 2026-03-12 01:14:32,176] Trial 51 pruned. 
[I 2026-03-12 01:14:32,617] Trial 52 pruned. 
[I 2026-03-12 01:14:34,041] Trial 53 pruned. 
[I 2026-03-12 01:14:34,202] Trial 54 finished with value: 0.0 and parameters: {'timeframe': 'mixed', 'atr_period': 13, 'atr_threshold': 10.0, 'pt_mult': 0.5, 'sl_mult': 0.5, 'td_mins': 1080}. Best is trial 28 with value: 1.4736445410959171.
[I 2026-03-12 01:14:34,344] Trial 55 pruned. 
[I 2026-03-12 01:14:35,110] Trial 56 finished with value: 1.161882455721618 and parameters: {'timeframe': 'mixed', 'atr_period': 13, 'atr_threshold': 2.0, 'pt_mult': 0.5, 'sl_mult': 2.5, 'td_mins': 30}. Best is trial 28 with value: 1.4736445410959171.
[I 2026-03-12 01:14:35,539] Trial 57 pruned. 
[I 2026-03-12 01:14:39,732] Trial 58 pruned. 
[I 2026-03-12 01:14:39,900] Trial 59 finished with value: 0.0 and parameters: {'timeframe': 'mixed', 'atr_period': 13, 'atr_threshold': 15.0, 'pt_mult': 2.5, 'sl_mult': 1.0, 'td_mins': 360}. Best is trial 28 with value: 1.4736445410959171.
[I 2026-03-12 01:14:40,040] Trial 60 pruned. 
[I 2026-03-12 01:14:40,204] Trial 61 finished with value: 0.0 and parameters: {'timeframe': 'mixed', 'atr_period': 13, 'atr_threshold': 15.0, 'pt_mult': 0.5, 'sl_mult': 0.5, 'td_mins': 1080}. Best is trial 28 with value: 1.4736445410959171.
[I 2026-03-12 01:14:40,921] Trial 62 finished with value: 1.2509770181810493 and parameters: {'timeframe': 'mixed', 'atr_period': 13, 'atr_threshold': 3.0, 'pt_mult': 0.5, 'sl_mult': 2.5, 'td_mins': 120}. Best is trial 28 with value: 1.4736445410959171.
[I 2026-03-12 01:14:41,838] Trial 63 pruned. 
[I 2026-03-12 01:14:42,018] Trial 64 pruned. 
[I 2026-03-12 01:14:42,178] Trial 65 finished with value: 0.0 and parameters: {'timeframe': 'mixed', 'atr_period': 13, 'atr_threshold': 10.0, 'pt_mult': 5.0, 'sl_mult': 2.5, 'td_mins': 15}. Best is trial 28 with value: 1.4736445410959171.
[I 2026-03-12 01:14:42,470] Trial 66 finished with value: 1.4386754512980953 and parameters: {'timeframe': 'mixed', 'atr_period': 13, 'atr_threshold': 3.0, 'pt_mult': 0.5, 'sl_mult': 5.0, 'td_mins': 15}. Best is trial 28 with value: 1.4736445410959171.
[I 2026-03-12 01:14:42,573] Trial 67 pruned. 
[I 2026-03-12 01:14:42,716] Trial 68 pruned. 
[I 2026-03-12 01:14:43,648] Trial 69 pruned. 
[I 2026-03-12 01:14:45,672] Trial 70 pruned. 
[I 2026-03-12 01:14:45,836] Trial 71 finished with value: 0.0 and parameters: {'timeframe': 'mixed', 'atr_period': 13, 'atr_threshold': 15.0, 'pt_mult': 5.0, 'sl_mult': 1.0, 'td_mins': 1200}. Best is trial 28 with value: 1.4736445410959171.
[I 2026-03-12 01:14:47,819] Trial 72 finished with value: 1.067751434968795 and parameters: {'timeframe': 'mixed', 'atr_period': 13, 'atr_threshold': 3.0, 'pt_mult': 1.0, 'sl_mult': 0.5, 'td_mins': 1200}. Best is trial 28 with value: 1.4736445410959171.
[I 2026-03-12 01:14:47,978] Trial 73 finished with value: 0.0 and parameters: {'timeframe': 'mixed', 'atr_period': 13, 'atr_threshold': 15.0, 'pt_mult': 0.5, 'sl_mult': 5.0, 'td_mins': 720}. Best is trial 28 with value: 1.4736445410959171.
[I 2026-03-12 01:14:48,121] Trial 74 pruned. 
[I 2026-03-12 01:14:48,262] Trial 75 pruned. 
[I 2026-03-12 01:14:48,553] Trial 76 pruned. 
[I 2026-03-12 01:14:50,786] Trial 77 pruned. 
[I 2026-03-12 01:14:50,949] Trial 78 finished with value: 0.0 and parameters: {'timeframe': 'mixed', 'atr_period': 13, 'atr_threshold': 10.0, 'pt_mult': 2.5, 'sl_mult': 5.0, 'td_mins': 5}. Best is trial 28 with value: 1.4736445410959171.
[I 2026-03-12 01:14:51,106] Trial 79 finished with value: 0.0 and parameters: {'timeframe': 'mixed', 'atr_period': 13, 'atr_threshold': 15.0, 'pt_mult': 1.0, 'sl_mult': 2.5, 'td_mins': 120}. Best is trial 28 with value: 1.4736445410959171.
[I 2026-03-12 01:14:52,369] Trial 80 pruned. 
[I 2026-03-12 01:14:52,475] Trial 81 pruned. 
[I 2026-03-12 01:14:54,086] Trial 82 finished with value: 1.069610892890855 and parameters: {'timeframe': 'mixed', 'atr_period': 13, 'atr_threshold': 2.0, 'pt_mult': 1.0, 'sl_mult': 2.5, 'td_mins': 120}. Best is trial 28 with value: 1.4736445410959171.
[I 2026-03-12 01:14:54,181] Trial 83 pruned. 
[I 2026-03-12 01:14:55,808] Trial 84 pruned. 
