[I 2026-03-12 00:41:37,293] Trial 204 pruned. 
[I 2026-03-12 00:41:37,733] Trial 205 pruned. 
[I 2026-03-12 00:41:37,778] Trial 206 finished with value: 0.0 and parameters: {'timeframe': 'M1', 'atr_period': 13, 'atr_threshold': 10.0, 'pt_mult': 0.5, 'sl_mult': 2.5, 'td_mins': 180}. Best is trial 32 with value: 1.7165018600651565.
[I 2026-03-12 00:41:41,261] Trial 207 finished with value: 1.0187772296873603 and parameters: {'timeframe': 'M1', 'atr_period': 13, 'atr_threshold': 1.0, 'pt_mult': 5.0, 'sl_mult': 1.0, 'td_mins': 360}. Best is trial 32 with value: 1.7165018600651565.
[I 2026-03-12 00:41:41,310] Trial 208 finished with value: 0.0 and parameters: {'timeframe': 'M1', 'atr_period': 13, 'atr_threshold': 5.0, 'pt_mult': 0.5, 'sl_mult': 5.0, 'td_mins': 720}. Best is trial 32 with value: 1.7165018600651565.
[I 2026-03-12 00:41:41,513] Trial 209 pruned. 
[I 2026-03-12 00:41:41,557] Trial 210 finished with value: 0.0 and parameters: {'timeframe': 'M1', 'atr_period': 13, 'atr_threshold': 3.0, 'pt_mult': 5.0, 'sl_mult': 0.5, 'td_mins': 1080}. Best is trial 32 with value: 1.7165018600651565.
[I 2026-03-12 00:41:41,634] Trial 211 pruned. 
[I 2026-03-12 00:41:41,679] Trial 212 finished with value: 0.0 and parameters: {'timeframe': 'M1', 'atr_period': 13, 'atr_threshold': 5.0, 'pt_mult': 5.0, 'sl_mult': 1.0, 'td_mins': 720}. Best is trial 32 with value: 1.7165018600651565.
[I 2026-03-12 00:41:41,724] Trial 213 finished with value: 0.0 and parameters: {'timeframe': 'M1', 'atr_period': 13, 'atr_threshold': 15.0, 'pt_mult': 0.5, 'sl_mult': 5.0, 'td_mins': 120}. Best is trial 32 with value: 1.7165018600651565.
[I 2026-03-12 00:41:41,767] Trial 214 finished with value: 0.0 and parameters: {'timeframe': 'M1', 'atr_period': 13, 'atr_threshold': 10.0, 'pt_mult': 1.0, 'sl_mult': 5.0, 'td_mins': 30}. Best is trial 32 with value: 1.7165018600651565.
[I 2026-03-12 00:41:41,811] Trial 215 finished with value: 0.0 and parameters: {'timeframe': 'M1', 'atr_period': 13, 'atr_threshold': 3.0, 'pt_mult': 2.5, 'sl_mult': 5.0, 'td_mins': 120}. Best is trial 32 with value: 1.7165018600651565.
[I 2026-03-12 00:41:43,593] Trial 216 finished with value: 1.0860763931567599 and parameters: {'timeframe': 'M1', 'atr_period': 13, 'atr_threshold': 2.0, 'pt_mult': 5.0, 'sl_mult': 1.0, 'td_mins': 1200}. Best is trial 32 with value: 1.7165018600651565.
[I 2026-03-12 00:41:44,444] Trial 217 finished with value: 1.0516141178998866 and parameters: {'timeframe': 'M1', 'atr_period': 13, 'atr_threshold': 1.0, 'pt_mult': 1.0, 'sl_mult': 0.5, 'td_mins': 120}. Best is trial 32 with value: 1.7165018600651565.
[I 2026-03-12 00:41:44,597] Trial 218 pruned. 
[I 2026-03-12 00:41:44,644] Trial 219 finished with value: 0.0 and parameters: {'timeframe': 'M1', 'atr_period': 13, 'atr_threshold': 8.0, 'pt_mult': 0.5, 'sl_mult': 5.0, 'td_mins': 1200}. Best is trial 32 with value: 1.7165018600651565.
[I 2026-03-12 00:41:44,688] Trial 220 finished with value: 0.0 and parameters: {'timeframe': 'M1', 'atr_period': 13, 'atr_threshold': 3.0, 'pt_mult': 5.0, 'sl_mult': 0.5, 'td_mins': 120}. Best is trial 32 with value: 1.7165018600651565.
[I 2026-03-12 00:41:44,731] Trial 221 finished with value: 0.0 and parameters: {'timeframe': 'M1', 'atr_period': 13, 'atr_threshold': 8.0, 'pt_mult': 0.5, 'sl_mult': 0.5, 'td_mins': 15}. Best is trial 32 with value: 1.7165018600651565.
[I 2026-03-12 00:41:45,103] Trial 222 pruned. 
[I 2026-03-12 00:41:45,149] Trial 223 finished with value: 0.0 and parameters: {'timeframe': 'M1', 'atr_period': 13, 'atr_threshold': 10.0, 'pt_mult': 0.5, 'sl_mult': 5.0, 'td_mins': 1200}. Best is trial 32 with value: 1.7165018600651565.
[I 2026-03-12 00:41:45,197] Trial 224 finished with value: 0.0 and parameters: {'timeframe': 'M1', 'atr_period': 13, 'atr_threshold': 15.0, 'pt_mult': 0.5, 'sl_mult': 0.5, 'td_mins': 360}. Best is trial 32 with value: 1.7165018600651565.
[I 2026-03-12 00:41:46,203] Trial 225 pruned. 
[I 2026-03-12 00:41:46,252] Trial 226 finished with value: 0.0 and parameters: {'timeframe': 'M1', 'atr_period': 13, 'atr_threshold': 5.0, 'pt_mult': 2.5, 'sl_mult': 1.0, 'td_mins': 60}. Best is trial 32 with value: 1.7165018600651565.
[I 2026-03-12 00:41:49,354] Trial 227 pruned. 
[I 2026-03-12 00:41:49,410] Trial 228 finished with value: 0.0 and parameters: {'timeframe': 'M1', 'atr_period': 13, 'atr_threshold': 3.0, 'pt_mult': 5.0, 'sl_mult': 5.0, 'td_mins': 15}. Best is trial 32 with value: 1.7165018600651565.
[I 2026-03-12 00:41:49,455] Trial 229 finished with value: 0.0 and parameters: {'timeframe': 'M1', 'atr_period': 13, 'atr_threshold': 5.0, 'pt_mult': 2.5, 'sl_mult': 1.0, 'td_mins': 30}. Best is trial 32 with value: 1.7165018600651565.
[I 2026-03-12 00:41:49,517] Trial 230 pruned. 
[I 2026-03-12 00:41:49,562] Trial 231 finished with value: 0.0 and parameters: {'timeframe': 'M1', 'atr_period': 13, 'atr_threshold': 5.0, 'pt_mult': 1.0, 'sl_mult': 0.5, 'td_mins': 180}. Best is trial 32 with value: 1.7165018600651565.
[I 2026-03-12 00:41:49,608] Trial 232 finished with value: 0.0 and parameters: {'timeframe': 'M1', 'atr_period': 13, 'atr_threshold': 3.0, 'pt_mult': 1.0, 'sl_mult': 0.5, 'td_mins': 120}. Best is trial 32 with value: 1.7165018600651565.
[I 2026-03-12 00:41:49,652] Trial 233 finished with value: 0.0 and parameters: {'timeframe': 'M1', 'atr_period': 13, 'atr_threshold': 8.0, 'pt_mult': 5.0, 'sl_mult': 0.5, 'td_mins': 60}. Best is trial 32 with value: 1.7165018600651565.
[I 2026-03-12 00:41:49,697] Trial 234 finished with value: 0.0 and parameters: {'timeframe': 'M1', 'atr_period': 13, 'atr_threshold': 3.0, 'pt_mult': 1.0, 'sl_mult': 5.0, 'td_mins': 30}. Best is trial 32 with value: 1.7165018600651565.
[I 2026-03-12 00:41:49,922] Trial 235 finished with value: 1.2200842129517249 and parameters: {'timeframe': 'M1', 'atr_period': 13, 'atr_threshold': 1.0, 'pt_mult': 1.0, 'sl_mult': 5.0, 'td_mins': 5}. Best is trial 32 with value: 1.7165018600651565.
[I 2026-03-12 00:41:49,965] Trial 236 finished with value: 0.0 and parameters: {'timeframe': 'M1', 'atr_period': 13, 'atr_threshold': 5.0, 'pt_mult': 5.0, 'sl_mult': 2.5, 'td_mins': 120}. Best is trial 32 with value: 1.7165018600651565.
[I 2026-03-12 00:41:56,447] Trial 237 finished with value: 1.0007651958955484 and parameters: {'timeframe': 'M1', 'atr_period': 13, 'atr_threshold': 1.0, 'pt_mult': 2.5, 'sl_mult': 2.5, 'td_mins': 1200}. Best is trial 32 with value: 1.7165018600651565.
[I 2026-03-12 00:41:56,494] Trial 238 finished with value: 0.0 and parameters: {'timeframe': 'M1', 'atr_period': 13, 'atr_threshold': 15.0, 'pt_mult': 0.5, 'sl_mult': 5.0, 'td_mins': 720}. Best is trial 32 with value: 1.7165018600651565.
[I 2026-03-12 00:41:56,542] Trial 239 finished with value: 0.0 and parameters: {'timeframe': 'M1', 'atr_period': 13, 'atr_threshold': 10.0, 'pt_mult': 2.5, 'sl_mult': 5.0, 'td_mins': 180}. Best is trial 32 with value: 1.7165018600651565.
[I 2026-03-12 00:41:57,185] Trial 240 pruned. 
[I 2026-03-12 00:41:57,232] Trial 241 finished with value: 0.0 and parameters: {'timeframe': 'M1', 'atr_period': 13, 'atr_threshold': 10.0, 'pt_mult': 2.5, 'sl_mult': 0.5, 'td_mins': 5}. Best is trial 32 with value: 1.7165018600651565.
[I 2026-03-12 00:41:58,407] Trial 242 finished with value: 1.0725742746697482 and parameters: {'timeframe': 'M1', 'atr_period': 13, 'atr_threshold': 2.0, 'pt_mult': 5.0, 'sl_mult': 1.0, 'td_mins': 720}. Best is trial 32 with value: 1.7165018600651565.
[I 2026-03-12 00:41:58,507] Trial 243 pruned. 
[I 2026-03-12 00:41:58,715] Trial 244 finished with value: 1.2633955128037777 and parameters: {'timeframe': 'M1', 'atr_period': 13, 'atr_threshold': 2.0, 'pt_mult': 1.0, 'sl_mult': 5.0, 'td_mins': 30}. Best is trial 32 with value: 1.7165018600651565.
[I 2026-03-12 00:41:58,765] Trial 245 finished with value: 0.0 and parameters: {'timeframe': 'M1', 'atr_period': 13, 'atr_threshold': 10.0, 'pt_mult': 1.0, 'sl_mult': 2.5, 'td_mins': 30}. Best is trial 32 with value: 1.7165018600651565.
[I 2026-03-12 00:41:58,843] Trial 246 pruned. 
[I 2026-03-12 00:41:58,890] Trial 247 finished with value: 0.0 and parameters: {'timeframe': 'M1', 'atr_period': 13, 'atr_threshold': 15.0, 'pt_mult': 1.0, 'sl_mult': 5.0, 'td_mins': 360}. Best is trial 32 with value: 1.7165018600651565.
[I 2026-03-12 00:41:58,938] Trial 248 finished with value: 0.0 and parameters: {'timeframe': 'M1', 'atr_period': 13, 'atr_threshold': 15.0, 'pt_mult': 1.0, 'sl_mult': 2.5, 'td_mins': 5}. Best is trial 32 with value: 1.7165018600651565.
[I 2026-03-12 00:41:58,985] Trial 249 finished with value: 0.0 and parameters: {'timeframe': 'M1', 'atr_period': 13, 'atr_threshold': 15.0, 'pt_mult': 0.5, 'sl_mult': 0.5, 'td_mins': 360}. Best is trial 32 with value: 1.7165018600651565.
[I 2026-03-12 00:41:59,032] Trial 250 finished with value: 0.0 and parameters: {'timeframe': 'M1', 'atr_period': 13, 'atr_threshold': 15.0, 'pt_mult': 1.0, 'sl_mult': 2.5, 'td_mins': 1080}. Best is trial 32 with value: 1.7165018600651565.
[I 2026-03-12 00:41:59,279] Trial 251 pruned. 
[I 2026-03-12 00:42:06,312] Trial 252 finished with value: 1.04053379390494 and parameters: {'timeframe': 'M1', 'atr_period': 13, 'atr_threshold': 1.0, 'pt_mult': 5.0, 'sl_mult': 1.0, 'td_mins': 1080}. Best is trial 32 with value: 1.7165018600651565.
[I 2026-03-12 00:42:06,358] Trial 253 finished with value: 0.0 and parameters: {'timeframe': 'M1', 'atr_period': 13, 'atr_threshold': 10.0, 'pt_mult': 5.0, 'sl_mult': 1.0, 'td_mins': 180}. Best is trial 32 with value: 1.7165018600651565.
[I 2026-03-12 00:42:06,405] Trial 254 finished with value: 0.0 and parameters: {'timeframe': 'M1', 'atr_period': 13, 'atr_threshold': 8.0, 'pt_mult': 2.5, 'sl_mult': 1.0, 'td_mins': 30}. Best is trial 32 with value: 1.7165018600651565.
[I 2026-03-12 00:42:06,451] Trial 255 finished with value: 0.0 and parameters: {'timeframe': 'M1', 'atr_period': 13, 'atr_threshold': 15.0, 'pt_mult': 2.5, 'sl_mult': 2.5, 'td_mins': 15}. Best is trial 32 with value: 1.7165018600651565.
[I 2026-03-12 00:42:06,496] Trial 256 finished with value: 0.0 and parameters: {'timeframe': 'M1', 'atr_period': 13, 'atr_threshold': 5.0, 'pt_mult': 1.0, 'sl_mult': 0.5, 'td_mins': 60}. Best is trial 32 with value: 1.7165018600651565.
[I 2026-03-12 00:42:11,295] Trial 257 finished with value: 1.015918464522263 and parameters: {'timeframe': 'M1', 'atr_period': 13, 'atr_threshold': 1.0, 'pt_mult': 2.5, 'sl_mult': 1.0, 'td_mins': 1200}. Best is trial 32 with value: 1.7165018600651565.
[I 2026-03-12 00:42:11,342] Trial 258 finished with value: 0.0 and parameters: {'timeframe': 'M1', 'atr_period': 13, 'atr_threshold': 15.0, 'pt_mult': 0.5, 'sl_mult': 0.5, 'td_mins': 15}. Best is trial 32 with value: 1.7165018600651565.
[I 2026-03-12 00:42:11,391] Trial 259 finished with value: 0.0 and parameters: {'timeframe': 'M1', 'atr_period': 13, 'atr_threshold': 10.0, 'pt_mult': 5.0, 'sl_mult': 1.0, 'td_mins': 60}. Best is trial 32 with value: 1.7165018600651565.
[I 2026-03-12 00:42:11,436] Trial 260 finished with value: 0.0 and parameters: {'timeframe': 'M1', 'atr_period': 13, 'atr_threshold': 5.0, 'pt_mult': 5.0, 'sl_mult': 2.5, 'td_mins': 60}. Best is trial 32 with value: 1.7165018600651565.
[I 2026-03-12 00:42:11,483] Trial 261 finished with value: 0.0 and parameters: {'timeframe': 'M1', 'atr_period': 13, 'atr_threshold': 3.0, 'pt_mult': 2.5, 'sl_mult': 2.5, 'td_mins': 5}. Best is trial 32 with value: 1.7165018600651565.
[I 2026-03-12 00:42:11,526] Trial 262 finished with value: 0.0 and parameters: {'timeframe': 'M1', 'atr_period': 13, 'atr_threshold': 15.0, 'pt_mult': 5.0, 'sl_mult': 2.5, 'td_mins': 5}. Best is trial 32 with value: 1.7165018600651565.
[I 2026-03-12 00:42:11,570] Trial 263 finished with value: 0.0 and parameters: {'timeframe': 'M1', 'atr_period': 13, 'atr_threshold': 15.0, 'pt_mult': 1.0, 'sl_mult': 5.0, 'td_mins': 180}. Best is trial 32 with value: 1.7165018600651565.
[I 2026-03-12 00:42:11,613] Trial 264 finished with value: 0.0 and parameters: {'timeframe': 'M1', 'atr_period': 13, 'atr_threshold': 8.0, 'pt_mult': 0.5, 'sl_mult': 5.0, 'td_mins': 180}. Best is trial 32 with value: 1.7165018600651565.
[I 2026-03-12 00:42:12,670] Trial 265 pruned. 
[I 2026-03-12 00:42:12,724] Trial 266 finished with value: 0.0 and parameters: {'timeframe': 'M1', 'atr_period': 13, 'atr_threshold': 3.0, 'pt_mult': 1.0, 'sl_mult': 1.0, 'td_mins': 180}. Best is trial 32 with value: 1.7165018600651565.
[I 2026-03-12 00:42:24,116] Trial 267 finished with value: 1.0291509937916363 and parameters: {'timeframe': 'M1', 'atr_period': 13, 'atr_threshold': 1.0, 'pt_mult': 5.0, 'sl_mult': 5.0, 'td_mins': 1200}. Best is trial 32 with value: 1.7165018600651565.
[I 2026-03-12 00:42:25,915] Trial 268 finished with value: 1.04237379134204 and parameters: {'timeframe': 'M1', 'atr_period': 13, 'atr_threshold': 2.0, 'pt_mult': 5.0, 'sl_mult': 5.0, 'td_mins': 720}. Best is trial 32 with value: 1.7165018600651565.
[I 2026-03-12 00:42:33,479] Trial 269 finished with value: 1.0752288213217893 and parameters: {'timeframe': 'M1', 'atr_period': 13, 'atr_threshold': 0.5, 'pt_mult': 2.5, 'sl_mult': 0.5, 'td_mins': 1080}. Best is trial 32 with value: 1.7165018600651565.
[I 2026-03-12 00:42:33,526] Trial 270 finished with value: 0.0 and parameters: {'timeframe': 'M1', 'atr_period': 13, 'atr_threshold': 10.0, 'pt_mult': 1.0, 'sl_mult': 1.0, 'td_mins': 120}. Best is trial 32 with value: 1.7165018600651565.
[I 2026-03-12 00:42:34,302] Trial 271 finished with value: 1.0516141178998866 and parameters: {'timeframe': 'M1', 'atr_period': 13, 'atr_threshold': 1.0, 'pt_mult': 1.0, 'sl_mult': 0.5, 'td_mins': 120}. Best is trial 32 with value: 1.7165018600651565.
[I 2026-03-12 00:42:34,510] Trial 272 pruned. 
[I 2026-03-12 00:42:38,113] Trial 273 finished with value: 1.074875387600439 and parameters: {'timeframe': 'M1', 'atr_period': 13, 'atr_threshold': 0.5, 'pt_mult': 2.5, 'sl_mult': 0.5, 'td_mins': 180}. Best is trial 32 with value: 1.7165018600651565.
[I 2026-03-12 00:42:38,186] Trial 274 pruned. 
[I 2026-03-12 00:42:38,239] Trial 275 finished with value: 0.0 and parameters: {'timeframe': 'M1', 'atr_period': 13, 'atr_threshold': 5.0, 'pt_mult': 1.0, 'sl_mult': 0.5, 'td_mins': 30}. Best is trial 32 with value: 1.7165018600651565.
[I 2026-03-12 00:42:42,758] Trial 276 finished with value: 1.070578969974273 and parameters: {'timeframe': 'M1', 'atr_period': 13, 'atr_threshold': 1.0, 'pt_mult': 2.5, 'sl_mult': 0.5, 'td_mins': 1080}. Best is trial 32 with value: 1.7165018600651565.
[I 2026-03-12 00:42:42,914] Trial 277 pruned. 
[I 2026-03-12 00:42:42,963] Trial 278 finished with value: 0.0 and parameters: {'timeframe': 'M1', 'atr_period': 13, 'atr_threshold': 10.0, 'pt_mult': 1.0, 'sl_mult': 5.0, 'td_mins': 120}. Best is trial 32 with value: 1.7165018600651565.
[I 2026-03-12 00:42:46,736] Trial 279 pruned. 
[I 2026-03-12 00:42:46,784] Trial 280 finished with value: 0.0 and parameters: {'timeframe': 'M1', 'atr_period': 13, 'atr_threshold': 3.0, 'pt_mult': 2.5, 'sl_mult': 2.5, 'td_mins': 1080}. Best is trial 32 with value: 1.7165018600651565.
[I 2026-03-12 00:42:46,831] Trial 281 finished with value: 0.0 and parameters: {'timeframe': 'M1', 'atr_period': 13, 'atr_threshold': 3.0, 'pt_mult': 2.5, 'sl_mult': 5.0, 'td_mins': 1080}. Best is trial 32 with value: 1.7165018600651565.
[I 2026-03-12 00:42:46,874] Trial 282 finished with value: 0.0 and parameters: {'timeframe': 'M1', 'atr_period': 13, 'atr_threshold': 5.0, 'pt_mult': 2.5, 'sl_mult': 5.0, 'td_mins': 15}. Best is trial 32 with value: 1.7165018600651565.
[I 2026-03-12 00:42:47,086] Trial 283 pruned. 
[I 2026-03-12 00:42:47,134] Trial 284 finished with value: 0.0 and parameters: {'timeframe': 'M1', 'atr_period': 13, 'atr_threshold': 5.0, 'pt_mult': 2.5, 'sl_mult': 2.5, 'td_mins': 30}. Best is trial 32 with value: 1.7165018600651565.
[I 2026-03-12 00:42:47,179] Trial 285 finished with value: 0.0 and parameters: {'timeframe': 'M1', 'atr_period': 13, 'atr_threshold': 15.0, 'pt_mult': 5.0, 'sl_mult': 1.0, 'td_mins': 5}. Best is trial 32 with value: 1.7165018600651565.
[I 2026-03-12 00:42:50,698] Trial 286 finished with value: 1.070578969974273 and parameters: {'timeframe': 'M1', 'atr_period': 13, 'atr_threshold': 1.0, 'pt_mult': 2.5, 'sl_mult': 0.5, 'td_mins': 720}. Best is trial 32 with value: 1.7165018600651565.
[I 2026-03-12 00:42:50,758] Trial 287 finished with value: 0.0 and parameters: {'timeframe': 'M1', 'atr_period': 13, 'atr_threshold': 5.0, 'pt_mult': 0.5, 'sl_mult': 0.5, 'td_mins': 5}. Best is trial 32 with value: 1.7165018600651565.
[I 2026-03-12 00:42:50,814] Trial 288 finished with value: 0.0 and parameters: {'timeframe': 'M1', 'atr_period': 13, 'atr_threshold': 10.0, 'pt_mult': 0.5, 'sl_mult': 2.5, 'td_mins': 60}. Best is trial 32 with value: 1.7165018600651565.
[I 2026-03-12 00:42:50,867] Trial 289 finished with value: 0.0 and parameters: {'timeframe': 'M1', 'atr_period': 13, 'atr_threshold': 10.0, 'pt_mult': 1.0, 'sl_mult': 5.0, 'td_mins': 180}. Best is trial 32 with value: 1.7165018600651565.
[I 2026-03-12 00:42:50,918] Trial 290 finished with value: 0.0 and parameters: {'timeframe': 'M1', 'atr_period': 13, 'atr_threshold': 3.0, 'pt_mult': 1.0, 'sl_mult': 5.0, 'td_mins': 15}. Best is trial 32 with value: 1.7165018600651565.
[I 2026-03-12 00:42:50,968] Trial 291 finished with value: 0.0 and parameters: {'timeframe': 'M1', 'atr_period': 13, 'atr_threshold': 3.0, 'pt_mult': 0.5, 'sl_mult': 2.5, 'td_mins': 5}. Best is trial 32 with value: 1.7165018600651565.
[I 2026-03-12 00:42:51,017] Trial 292 finished with value: 0.0 and parameters: {'timeframe': 'M1', 'atr_period': 13, 'atr_threshold': 10.0, 'pt_mult': 0.5, 'sl_mult': 5.0, 'td_mins': 180}. Best is trial 32 with value: 1.7165018600651565.
[I 2026-03-12 00:42:51,325] Trial 293 pruned. 
[I 2026-03-12 00:42:51,377] Trial 294 finished with value: 0.0 and parameters: {'timeframe': 'M1', 'atr_period': 13, 'atr_threshold': 8.0, 'pt_mult': 0.5, 'sl_mult': 0.5, 'td_mins': 60}. Best is trial 32 with value: 1.7165018600651565.
[I 2026-03-12 00:42:51,468] Trial 295 pruned. 
[I 2026-03-12 00:42:51,518] Trial 296 finished with value: 0.0 and parameters: {'timeframe': 'M1', 'atr_period': 13, 'atr_threshold': 5.0, 'pt_mult': 0.5, 'sl_mult': 0.5, 'td_mins': 720}. Best is trial 32 with value: 1.7165018600651565.
[I 2026-03-12 00:42:51,568] Trial 297 finished with value: 0.0 and parameters: {'timeframe': 'M1', 'atr_period': 13, 'atr_threshold': 15.0, 'pt_mult': 1.0, 'sl_mult': 2.5, 'td_mins': 1200}. Best is trial 32 with value: 1.7165018600651565.
[I 2026-03-12 00:42:51,618] Trial 298 finished with value: 0.0 and parameters: {'timeframe': 'M1', 'atr_period': 13, 'atr_threshold': 3.0, 'pt_mult': 1.0, 'sl_mult': 1.0, 'td_mins': 720}. Best is trial 32 with value: 1.7165018600651565.
[I 2026-03-12 00:42:51,840] Trial 299 pruned. 
[I 2026-03-12 00:42:54,343] Trial 300 finished with value: 1.0736071542692716 and parameters: {'timeframe': 'M1', 'atr_period': 13, 'atr_threshold': 0.5, 'pt_mult': 2.5, 'sl_mult': 0.5, 'td_mins': 120}. Best is trial 32 with value: 1.7165018600651565.
[I 2026-03-12 00:42:54,694] Trial 301 finished with value: 1.094956881706024 and parameters: {'timeframe': 'M1', 'atr_period': 13, 'atr_threshold': 2.0, 'pt_mult': 2.5, 'sl_mult': 0.5, 'td_mins': 120}. Best is trial 32 with value: 1.7165018600651565.
[I 2026-03-12 00:42:55,015] Trial 302 finished with value: 1.094956881706024 and parameters: {'timeframe': 'M1', 'atr_period': 13, 'atr_threshold': 2.0, 'pt_mult': 2.5, 'sl_mult': 0.5, 'td_mins': 120}. Best is trial 32 with value: 1.7165018600651565.
[I 2026-03-12 00:42:55,321] Trial 303 finished with value: 1.094956881706024 and parameters: {'timeframe': 'M1', 'atr_period': 13, 'atr_threshold': 2.0, 'pt_mult': 2.5, 'sl_mult': 0.5, 'td_mins': 120}. Best is trial 32 with value: 1.7165018600651565.
[I 2026-03-12 00:42:55,649] Trial 304 finished with value: 1.094956881706024 and parameters: {'timeframe': 'M1', 'atr_period': 13, 'atr_threshold': 2.0, 'pt_mult': 2.5, 'sl_mult': 0.5, 'td_mins': 120}. Best is trial 32 with value: 1.7165018600651565.
[I 2026-03-12 00:42:55,986] Trial 305 finished with value: 1.094956881706024 and parameters: {'timeframe': 'M1', 'atr_period': 13, 'atr_threshold': 2.0, 'pt_mult': 2.5, 'sl_mult': 0.5, 'td_mins': 120}. Best is trial 32 with value: 1.7165018600651565.
[I 2026-03-12 00:42:58,501] Trial 306 finished with value: 1.0736071542692716 and parameters: {'timeframe': 'M1', 'atr_period': 13, 'atr_threshold': 0.5, 'pt_mult': 2.5, 'sl_mult': 0.5, 'td_mins': 120}. Best is trial 32 with value: 1.7165018600651565.
[I 2026-03-12 00:42:58,814] Trial 307 finished with value: 1.094956881706024 and parameters: {'timeframe': 'M1', 'atr_period': 13, 'atr_threshold': 2.0, 'pt_mult': 2.5, 'sl_mult': 0.5, 'td_mins': 120}. Best is trial 32 with value: 1.7165018600651565.
[I 2026-03-12 00:42:59,141] Trial 308 finished with value: 1.094956881706024 and parameters: {'timeframe': 'M1', 'atr_period': 13, 'atr_threshold': 2.0, 'pt_mult': 2.5, 'sl_mult': 0.5, 'td_mins': 120}. Best is trial 32 with value: 1.7165018600651565.
[I 2026-03-12 00:43:01,859] Trial 309 finished with value: 1.0736071542692716 and parameters: {'timeframe': 'M1', 'atr_period': 13, 'atr_threshold': 0.5, 'pt_mult': 2.5, 'sl_mult': 0.5, 'td_mins': 120}. Best is trial 32 with value: 1.7165018600651565.
[I 2026-03-12 00:43:02,223] Trial 310 finished with value: 1.094956881706024 and parameters: {'timeframe': 'M1', 'atr_period': 13, 'atr_threshold': 2.0, 'pt_mult': 2.5, 'sl_mult': 0.5, 'td_mins': 120}. Best is trial 32 with value: 1.7165018600651565.
[I 2026-03-12 00:43:02,553] Trial 311 finished with value: 1.094956881706024 and parameters: {'timeframe': 'M1', 'atr_period': 13, 'atr_threshold': 2.0, 'pt_mult': 2.5, 'sl_mult': 0.5, 'td_mins': 120}. Best is trial 32 with value: 1.7165018600651565.
