[I 2026-03-12 01:11:39,443] Trial 728 finished with value: 2.454517025102679 and parameters: {'timeframe': 'M15', 'atr_period': 13, 'atr_threshold': 3.0, 'pt_mult': 0.5, 'sl_mult': 5.0, 'td_mins': 120}. Best is trial 82 with value: 2.454517025102679.
[I 2026-03-12 01:11:39,645] Trial 729 pruned. 
[I 2026-03-12 01:11:40,249] Trial 730 pruned. 
[I 2026-03-12 01:11:40,546] Trial 731 finished with value: 2.454517025102679 and parameters: {'timeframe': 'M15', 'atr_period': 13, 'atr_threshold': 3.0, 'pt_mult': 0.5, 'sl_mult': 5.0, 'td_mins': 120}. Best is trial 82 with value: 2.454517025102679.
[I 2026-03-12 01:11:41,494] Trial 732 pruned. 
[I 2026-03-12 01:11:41,544] Trial 733 pruned. 
[I 2026-03-12 01:11:41,692] Trial 734 pruned. 
[I 2026-03-12 01:11:41,755] Trial 735 pruned. 
[I 2026-03-12 01:11:41,839] Trial 736 pruned. 
[I 2026-03-12 01:11:42,119] Trial 737 finished with value: 2.454517025102679 and parameters: {'timeframe': 'M15', 'atr_period': 13, 'atr_threshold': 3.0, 'pt_mult': 0.5, 'sl_mult': 5.0, 'td_mins': 120}. Best is trial 82 with value: 2.454517025102679.
[I 2026-03-12 01:11:42,416] Trial 738 finished with value: 2.454517025102679 and parameters: {'timeframe': 'M15', 'atr_period': 13, 'atr_threshold': 3.0, 'pt_mult': 0.5, 'sl_mult': 5.0, 'td_mins': 120}. Best is trial 82 with value: 2.454517025102679.
[I 2026-03-12 01:11:42,938] Trial 739 pruned. 
[I 2026-03-12 01:11:43,168] Trial 740 pruned. 
[I 2026-03-12 01:11:43,288] Trial 741 pruned. 
[I 2026-03-12 01:11:43,559] Trial 742 finished with value: 2.454517025102679 and parameters: {'timeframe': 'M15', 'atr_period': 13, 'atr_threshold': 3.0, 'pt_mult': 0.5, 'sl_mult': 5.0, 'td_mins': 120}. Best is trial 82 with value: 2.454517025102679.
[I 2026-03-12 01:11:43,678] Trial 743 pruned. 
[I 2026-03-12 01:11:44,037] Trial 744 finished with value: 2.292744804194478 and parameters: {'timeframe': 'M15', 'atr_period': 13, 'atr_threshold': 3.0, 'pt_mult': 0.5, 'sl_mult': 5.0, 'td_mins': 180}. Best is trial 82 with value: 2.454517025102679.
[I 2026-03-12 01:11:44,321] Trial 745 finished with value: 2.454517025102679 and parameters: {'timeframe': 'M15', 'atr_period': 13, 'atr_threshold': 3.0, 'pt_mult': 0.5, 'sl_mult': 5.0, 'td_mins': 120}. Best is trial 82 with value: 2.454517025102679.
[I 2026-03-12 01:11:44,370] Trial 746 pruned. 
[I 2026-03-12 01:11:44,423] Trial 747 finished with value: 0.0 and parameters: {'timeframe': 'M15', 'atr_period': 13, 'atr_threshold': 15.0, 'pt_mult': 2.5, 'sl_mult': 1.0, 'td_mins': 60}. Best is trial 82 with value: 2.454517025102679.
[I 2026-03-12 01:11:44,471] Trial 748 finished with value: 0.0 and parameters: {'timeframe': 'M15', 'atr_period': 13, 'atr_threshold': 15.0, 'pt_mult': 1.0, 'sl_mult': 1.0, 'td_mins': 1080}. Best is trial 82 with value: 2.454517025102679.
[I 2026-03-12 01:11:44,759] Trial 749 finished with value: 2.454517025102679 and parameters: {'timeframe': 'M15', 'atr_period': 13, 'atr_threshold': 3.0, 'pt_mult': 0.5, 'sl_mult': 5.0, 'td_mins': 120}. Best is trial 82 with value: 2.454517025102679.
[I 2026-03-12 01:11:44,819] Trial 750 pruned. 
[I 2026-03-12 01:11:45,106] Trial 751 finished with value: 2.454517025102679 and parameters: {'timeframe': 'M15', 'atr_period': 13, 'atr_threshold': 3.0, 'pt_mult': 0.5, 'sl_mult': 5.0, 'td_mins': 120}. Best is trial 82 with value: 2.454517025102679.
[I 2026-03-12 01:11:45,379] Trial 752 finished with value: 2.454517025102679 and parameters: {'timeframe': 'M15', 'atr_period': 13, 'atr_threshold': 3.0, 'pt_mult': 0.5, 'sl_mult': 5.0, 'td_mins': 120}. Best is trial 82 with value: 2.454517025102679.
[I 2026-03-12 01:11:45,624] Trial 753 pruned. 
[I 2026-03-12 01:11:45,672] Trial 754 finished with value: 0.0 and parameters: {'timeframe': 'M15', 'atr_period': 13, 'atr_threshold': 15.0, 'pt_mult': 0.5, 'sl_mult': 2.5, 'td_mins': 360}. Best is trial 82 with value: 2.454517025102679.
[I 2026-03-12 01:11:45,724] Trial 755 finished with value: 0.0 and parameters: {'timeframe': 'M15', 'atr_period': 13, 'atr_threshold': 10.0, 'pt_mult': 0.5, 'sl_mult': 5.0, 'td_mins': 120}. Best is trial 82 with value: 2.454517025102679.
[I 2026-03-12 01:11:46,025] Trial 756 finished with value: 2.454517025102679 and parameters: {'timeframe': 'M15', 'atr_period': 13, 'atr_threshold': 3.0, 'pt_mult': 0.5, 'sl_mult': 5.0, 'td_mins': 120}. Best is trial 82 with value: 2.454517025102679.
[I 2026-03-12 01:11:46,118] Trial 757 pruned. 
[I 2026-03-12 01:11:46,197] Trial 758 pruned. 
[I 2026-03-12 01:11:46,252] Trial 759 finished with value: 0.0 and parameters: {'timeframe': 'M15', 'atr_period': 13, 'atr_threshold': 10.0, 'pt_mult': 0.5, 'sl_mult': 5.0, 'td_mins': 60}. Best is trial 82 with value: 2.454517025102679.
[I 2026-03-12 01:11:46,557] Trial 760 finished with value: 2.454517025102679 and parameters: {'timeframe': 'M15', 'atr_period': 13, 'atr_threshold': 3.0, 'pt_mult': 0.5, 'sl_mult': 5.0, 'td_mins': 120}. Best is trial 82 with value: 2.454517025102679.
[I 2026-03-12 01:11:46,838] Trial 761 finished with value: 2.454517025102679 and parameters: {'timeframe': 'M15', 'atr_period': 13, 'atr_threshold': 3.0, 'pt_mult': 0.5, 'sl_mult': 5.0, 'td_mins': 120}. Best is trial 82 with value: 2.454517025102679.
[I 2026-03-12 01:11:47,115] Trial 762 finished with value: 2.454517025102679 and parameters: {'timeframe': 'M15', 'atr_period': 13, 'atr_threshold': 3.0, 'pt_mult': 0.5, 'sl_mult': 5.0, 'td_mins': 120}. Best is trial 82 with value: 2.454517025102679.
[I 2026-03-12 01:11:47,215] Trial 763 pruned. 
[I 2026-03-12 01:11:47,269] Trial 764 finished with value: 0.0 and parameters: {'timeframe': 'M15', 'atr_period': 13, 'atr_threshold': 10.0, 'pt_mult': 5.0, 'sl_mult': 0.5, 'td_mins': 120}. Best is trial 82 with value: 2.454517025102679.
[I 2026-03-12 01:11:47,324] Trial 765 finished with value: 0.0 and parameters: {'timeframe': 'M15', 'atr_period': 13, 'atr_threshold': 10.0, 'pt_mult': 2.5, 'sl_mult': 0.5, 'td_mins': 180}. Best is trial 82 with value: 2.454517025102679.
[I 2026-03-12 01:11:47,446] Trial 766 pruned. 
[I 2026-03-12 01:11:47,527] Trial 767 pruned. 
[I 2026-03-12 01:11:47,853] Trial 768 finished with value: 2.454517025102679 and parameters: {'timeframe': 'M15', 'atr_period': 13, 'atr_threshold': 3.0, 'pt_mult': 0.5, 'sl_mult': 5.0, 'td_mins': 120}. Best is trial 82 with value: 2.454517025102679.
[I 2026-03-12 01:11:48,096] Trial 769 pruned. 
[I 2026-03-12 01:11:48,427] Trial 770 finished with value: 2.454517025102679 and parameters: {'timeframe': 'M15', 'atr_period': 13, 'atr_threshold': 3.0, 'pt_mult': 0.5, 'sl_mult': 5.0, 'td_mins': 120}. Best is trial 82 with value: 2.454517025102679.
[I 2026-03-12 01:11:48,541] Trial 771 pruned. 
[I 2026-03-12 01:11:48,821] Trial 772 finished with value: 2.454517025102679 and parameters: {'timeframe': 'M15', 'atr_period': 13, 'atr_threshold': 3.0, 'pt_mult': 0.5, 'sl_mult': 5.0, 'td_mins': 120}. Best is trial 82 with value: 2.454517025102679.
[I 2026-03-12 01:11:48,933] Trial 773 pruned. 
[I 2026-03-12 01:11:49,215] Trial 774 finished with value: 2.454517025102679 and parameters: {'timeframe': 'M15', 'atr_period': 13, 'atr_threshold': 3.0, 'pt_mult': 0.5, 'sl_mult': 5.0, 'td_mins': 120}. Best is trial 82 with value: 2.454517025102679.
[I 2026-03-12 01:11:49,529] Trial 775 finished with value: 2.454517025102679 and parameters: {'timeframe': 'M15', 'atr_period': 13, 'atr_threshold': 3.0, 'pt_mult': 0.5, 'sl_mult': 5.0, 'td_mins': 120}. Best is trial 82 with value: 2.454517025102679.
[I 2026-03-12 01:11:49,584] Trial 776 pruned. 
[I 2026-03-12 01:11:50,962] Trial 777 pruned. 
[I 2026-03-12 01:11:51,283] Trial 778 finished with value: 2.454517025102679 and parameters: {'timeframe': 'M15', 'atr_period': 13, 'atr_threshold': 3.0, 'pt_mult': 0.5, 'sl_mult': 5.0, 'td_mins': 120}. Best is trial 82 with value: 2.454517025102679.
[I 2026-03-12 01:11:51,338] Trial 779 pruned. 
[I 2026-03-12 01:11:51,627] Trial 780 finished with value: 2.454517025102679 and parameters: {'timeframe': 'M15', 'atr_period': 13, 'atr_threshold': 3.0, 'pt_mult': 0.5, 'sl_mult': 5.0, 'td_mins': 120}. Best is trial 82 with value: 2.454517025102679.
[I 2026-03-12 01:11:51,708] Trial 781 pruned. 
[I 2026-03-12 01:11:51,759] Trial 782 pruned. 
[I 2026-03-12 01:11:52,047] Trial 783 finished with value: 2.454517025102679 and parameters: {'timeframe': 'M15', 'atr_period': 13, 'atr_threshold': 3.0, 'pt_mult': 0.5, 'sl_mult': 5.0, 'td_mins': 120}. Best is trial 82 with value: 2.454517025102679.
[I 2026-03-12 01:11:52,098] Trial 784 finished with value: 0.0 and parameters: {'timeframe': 'M15', 'atr_period': 13, 'atr_threshold': 15.0, 'pt_mult': 0.5, 'sl_mult': 5.0, 'td_mins': 120}. Best is trial 82 with value: 2.454517025102679.
[I 2026-03-12 01:11:52,164] Trial 785 pruned. 
[I 2026-03-12 01:11:52,362] Trial 786 pruned. 
[I 2026-03-12 01:11:52,417] Trial 787 pruned. 
[I 2026-03-12 01:11:52,500] Trial 788 pruned. 
[I 2026-03-12 01:11:52,582] Trial 789 pruned. 
[I 2026-03-12 01:11:52,883] Trial 790 finished with value: 2.454517025102679 and parameters: {'timeframe': 'M15', 'atr_period': 13, 'atr_threshold': 3.0, 'pt_mult': 0.5, 'sl_mult': 5.0, 'td_mins': 120}. Best is trial 82 with value: 2.454517025102679.
[I 2026-03-12 01:11:52,991] Trial 791 pruned. 
[I 2026-03-12 01:11:53,043] Trial 792 finished with value: 0.0 and parameters: {'timeframe': 'M15', 'atr_period': 13, 'atr_threshold': 15.0, 'pt_mult': 5.0, 'sl_mult': 5.0, 'td_mins': 60}. Best is trial 82 with value: 2.454517025102679.
[I 2026-03-12 01:11:53,543] Trial 793 pruned. 
[I 2026-03-12 01:11:53,651] Trial 794 pruned. 
[I 2026-03-12 01:11:53,704] Trial 795 finished with value: 0.0 and parameters: {'timeframe': 'M15', 'atr_period': 13, 'atr_threshold': 10.0, 'pt_mult': 2.5, 'sl_mult': 2.5, 'td_mins': 15}. Best is trial 82 with value: 2.454517025102679.
[I 2026-03-12 01:11:53,764] Trial 796 pruned. 
[I 2026-03-12 01:11:53,843] Trial 797 pruned. 
[I 2026-03-12 01:11:54,258] Trial 798 pruned. 
[I 2026-03-12 01:11:54,314] Trial 799 finished with value: 0.0 and parameters: {'timeframe': 'M15', 'atr_period': 13, 'atr_threshold': 15.0, 'pt_mult': 2.5, 'sl_mult': 0.5, 'td_mins': 60}. Best is trial 82 with value: 2.454517025102679.
[I 2026-03-12 01:11:54,586] Trial 800 pruned. 
[I 2026-03-12 01:11:54,716] Trial 801 pruned. 
[I 2026-03-12 01:11:54,771] Trial 802 finished with value: 0.0 and parameters: {'timeframe': 'M15', 'atr_period': 13, 'atr_threshold': 10.0, 'pt_mult': 1.0, 'sl_mult': 2.5, 'td_mins': 1200}. Best is trial 82 with value: 2.454517025102679.
[I 2026-03-12 01:11:55,069] Trial 803 finished with value: 2.454517025102679 and parameters: {'timeframe': 'M15', 'atr_period': 13, 'atr_threshold': 3.0, 'pt_mult': 0.5, 'sl_mult': 5.0, 'td_mins': 120}. Best is trial 82 with value: 2.454517025102679.
[I 2026-03-12 01:11:55,374] Trial 804 finished with value: 2.454517025102679 and parameters: {'timeframe': 'M15', 'atr_period': 13, 'atr_threshold': 3.0, 'pt_mult': 0.5, 'sl_mult': 5.0, 'td_mins': 120}. Best is trial 82 with value: 2.454517025102679.
[I 2026-03-12 01:11:55,424] Trial 805 finished with value: 0.0 and parameters: {'timeframe': 'M15', 'atr_period': 13, 'atr_threshold': 10.0, 'pt_mult': 2.5, 'sl_mult': 1.0, 'td_mins': 30}. Best is trial 82 with value: 2.454517025102679.
[I 2026-03-12 01:11:55,570] Trial 806 pruned. 
[I 2026-03-12 01:11:55,625] Trial 807 pruned. 
[I 2026-03-12 01:11:55,917] Trial 808 finished with value: 2.454517025102679 and parameters: {'timeframe': 'M15', 'atr_period': 13, 'atr_threshold': 3.0, 'pt_mult': 0.5, 'sl_mult': 5.0, 'td_mins': 120}. Best is trial 82 with value: 2.454517025102679.
[I 2026-03-12 01:11:56,236] Trial 809 finished with value: 2.454517025102679 and parameters: {'timeframe': 'M15', 'atr_period': 13, 'atr_threshold': 3.0, 'pt_mult': 0.5, 'sl_mult': 5.0, 'td_mins': 120}. Best is trial 82 with value: 2.454517025102679.
[I 2026-03-12 01:11:56,351] Trial 810 pruned. 
[I 2026-03-12 01:11:56,406] Trial 811 pruned. 
[I 2026-03-12 01:11:56,455] Trial 812 finished with value: 0.0 and parameters: {'timeframe': 'M15', 'atr_period': 13, 'atr_threshold': 10.0, 'pt_mult': 1.0, 'sl_mult': 0.5, 'td_mins': 360}. Best is trial 82 with value: 2.454517025102679.
[I 2026-03-12 01:11:56,504] Trial 813 pruned. 
[I 2026-03-12 01:11:56,614] Trial 814 pruned. 
[I 2026-03-12 01:11:56,681] Trial 815 pruned. 
[I 2026-03-12 01:11:56,792] Trial 816 pruned. 
[I 2026-03-12 01:11:57,094] Trial 817 finished with value: 2.454517025102679 and parameters: {'timeframe': 'M15', 'atr_period': 13, 'atr_threshold': 3.0, 'pt_mult': 0.5, 'sl_mult': 5.0, 'td_mins': 120}. Best is trial 82 with value: 2.454517025102679.
[I 2026-03-12 01:11:57,159] Trial 818 pruned. 
[I 2026-03-12 01:11:57,212] Trial 819 pruned. 
[I 2026-03-12 01:11:57,479] Trial 820 pruned. 
[I 2026-03-12 01:11:57,534] Trial 821 pruned. 
[I 2026-03-12 01:11:57,607] Trial 822 finished with value: 0.0 and parameters: {'timeframe': 'M15', 'atr_period': 13, 'atr_threshold': 15.0, 'pt_mult': 0.5, 'sl_mult': 1.0, 'td_mins': 60}. Best is trial 82 with value: 2.454517025102679.
[I 2026-03-12 01:11:58,617] Trial 823 pruned. 
[I 2026-03-12 01:11:58,682] Trial 824 pruned. 
[I 2026-03-12 01:11:58,751] Trial 825 pruned. 
[I 2026-03-12 01:11:58,837] Trial 826 pruned. 
[I 2026-03-12 01:11:59,026] Trial 827 pruned. 
[I 2026-03-12 01:11:59,367] Trial 828 finished with value: 2.454517025102679 and parameters: {'timeframe': 'M15', 'atr_period': 13, 'atr_threshold': 3.0, 'pt_mult': 0.5, 'sl_mult': 5.0, 'td_mins': 120}. Best is trial 82 with value: 2.454517025102679.
[I 2026-03-12 01:11:59,423] Trial 829 pruned. 
[I 2026-03-12 01:11:59,484] Trial 830 pruned. 
[I 2026-03-12 01:11:59,802] Trial 831 finished with value: 2.454517025102679 and parameters: {'timeframe': 'M15', 'atr_period': 13, 'atr_threshold': 3.0, 'pt_mult': 0.5, 'sl_mult': 5.0, 'td_mins': 120}. Best is trial 82 with value: 2.454517025102679.
[I 2026-03-12 01:11:59,861] Trial 832 finished with value: 0.0 and parameters: {'timeframe': 'M15', 'atr_period': 13, 'atr_threshold': 15.0, 'pt_mult': 5.0, 'sl_mult': 0.5, 'td_mins': 720}. Best is trial 82 with value: 2.454517025102679.
[I 2026-03-12 01:12:00,068] Trial 833 pruned. 
[I 2026-03-12 01:12:00,125] Trial 834 finished with value: 0.0 and parameters: {'timeframe': 'M15', 'atr_period': 13, 'atr_threshold': 10.0, 'pt_mult': 0.5, 'sl_mult': 2.5, 'td_mins': 30}. Best is trial 82 with value: 2.454517025102679.
[I 2026-03-12 01:12:00,232] Trial 835 pruned. 
[I 2026-03-12 01:12:00,549] Trial 836 finished with value: 2.454517025102679 and parameters: {'timeframe': 'M15', 'atr_period': 13, 'atr_threshold': 3.0, 'pt_mult': 0.5, 'sl_mult': 5.0, 'td_mins': 120}. Best is trial 82 with value: 2.454517025102679.
[I 2026-03-12 01:12:00,643] Trial 837 pruned. 
[I 2026-03-12 01:12:00,977] Trial 838 finished with value: 2.454517025102679 and parameters: {'timeframe': 'M15', 'atr_period': 13, 'atr_threshold': 3.0, 'pt_mult': 0.5, 'sl_mult': 5.0, 'td_mins': 120}. Best is trial 82 with value: 2.454517025102679.
[I 2026-03-12 01:12:01,605] Trial 839 pruned. 
[I 2026-03-12 01:12:01,881] Trial 840 finished with value: 2.454517025102679 and parameters: {'timeframe': 'M15', 'atr_period': 13, 'atr_threshold': 3.0, 'pt_mult': 0.5, 'sl_mult': 5.0, 'td_mins': 120}. Best is trial 82 with value: 2.454517025102679.
[I 2026-03-12 01:12:02,174] Trial 841 finished with value: 2.454517025102679 and parameters: {'timeframe': 'M15', 'atr_period': 13, 'atr_threshold': 3.0, 'pt_mult': 0.5, 'sl_mult': 5.0, 'td_mins': 120}. Best is trial 82 with value: 2.454517025102679.
[I 2026-03-12 01:12:02,232] Trial 842 finished with value: 0.0 and parameters: {'timeframe': 'M15', 'atr_period': 13, 'atr_threshold': 10.0, 'pt_mult': 0.5, 'sl_mult': 5.0, 'td_mins': 120}. Best is trial 82 with value: 2.454517025102679.
[I 2026-03-12 01:12:02,295] Trial 843 pruned. 
[I 2026-03-12 01:12:02,349] Trial 844 finished with value: 0.0 and parameters: {'timeframe': 'M15', 'atr_period': 13, 'atr_threshold': 15.0, 'pt_mult': 0.5, 'sl_mult': 0.5, 'td_mins': 30}. Best is trial 82 with value: 2.454517025102679.
[I 2026-03-12 01:12:02,781] Trial 845 finished with value: 2.454517025102679 and parameters: {'timeframe': 'M15', 'atr_period': 13, 'atr_threshold': 3.0, 'pt_mult': 0.5, 'sl_mult': 5.0, 'td_mins': 120}. Best is trial 82 with value: 2.454517025102679.
[I 2026-03-12 01:12:02,975] Trial 846 pruned. 
[I 2026-03-12 01:12:03,051] Trial 847 finished with value: 0.0 and parameters: {'timeframe': 'M15', 'atr_period': 13, 'atr_threshold': 15.0, 'pt_mult': 5.0, 'sl_mult': 5.0, 'td_mins': 1080}. Best is trial 82 with value: 2.454517025102679.
[I 2026-03-12 01:12:03,319] Trial 848 pruned. 
[I 2026-03-12 01:12:03,777] Trial 849 pruned. 
[I 2026-03-12 01:12:04,107] Trial 850 finished with value: 2.454517025102679 and parameters: {'timeframe': 'M15', 'atr_period': 13, 'atr_threshold': 3.0, 'pt_mult': 0.5, 'sl_mult': 5.0, 'td_mins': 120}. Best is trial 82 with value: 2.454517025102679.
[I 2026-03-12 01:12:04,202] Trial 851 pruned. 
[I 2026-03-12 01:12:04,555] Trial 852 finished with value: 2.454517025102679 and parameters: {'timeframe': 'M15', 'atr_period': 13, 'atr_threshold': 3.0, 'pt_mult': 0.5, 'sl_mult': 5.0, 'td_mins': 120}. Best is trial 82 with value: 2.454517025102679.
[I 2026-03-12 01:12:04,639] Trial 853 pruned. 
[I 2026-03-12 01:12:04,694] Trial 854 pruned. 
[I 2026-03-12 01:12:04,755] Trial 855 pruned. 
[I 2026-03-12 01:12:05,031] Trial 856 finished with value: 2.454517025102679 and parameters: {'timeframe': 'M15', 'atr_period': 13, 'atr_threshold': 3.0, 'pt_mult': 0.5, 'sl_mult': 5.0, 'td_mins': 120}. Best is trial 82 with value: 2.454517025102679.
[I 2026-03-12 01:12:05,324] Trial 857 finished with value: 2.454517025102679 and parameters: {'timeframe': 'M15', 'atr_period': 13, 'atr_threshold': 3.0, 'pt_mult': 0.5, 'sl_mult': 5.0, 'td_mins': 120}. Best is trial 82 with value: 2.454517025102679.
[I 2026-03-12 01:12:05,378] Trial 858 finished with value: 0.0 and parameters: {'timeframe': 'M15', 'atr_period': 13, 'atr_threshold': 15.0, 'pt_mult': 5.0, 'sl_mult': 1.0, 'td_mins': 30}. Best is trial 82 with value: 2.454517025102679.
[I 2026-03-12 01:12:05,663] Trial 859 finished with value: 2.454517025102679 and parameters: {'timeframe': 'M15', 'atr_period': 13, 'atr_threshold': 3.0, 'pt_mult': 0.5, 'sl_mult': 5.0, 'td_mins': 120}. Best is trial 82 with value: 2.454517025102679.
[I 2026-03-12 01:12:05,951] Trial 860 finished with value: 2.454517025102679 and parameters: {'timeframe': 'M15', 'atr_period': 13, 'atr_threshold': 3.0, 'pt_mult': 0.5, 'sl_mult': 5.0, 'td_mins': 120}. Best is trial 82 with value: 2.454517025102679.
[I 2026-03-12 01:12:06,183] Trial 861 pruned. 
[I 2026-03-12 01:12:06,475] Trial 862 finished with value: 2.454517025102679 and parameters: {'timeframe': 'M15', 'atr_period': 13, 'atr_threshold': 3.0, 'pt_mult': 0.5, 'sl_mult': 5.0, 'td_mins': 120}. Best is trial 82 with value: 2.454517025102679.
[I 2026-03-12 01:12:07,616] Trial 863 pruned. 
[I 2026-03-12 01:12:08,414] Trial 864 pruned. 
[I 2026-03-12 01:12:08,494] Trial 865 pruned. 
[I 2026-03-12 01:12:08,956] Trial 866 pruned. 
[I 2026-03-12 01:12:09,074] Trial 867 pruned. 
[I 2026-03-12 01:12:09,127] Trial 868 finished with value: 0.0 and parameters: {'timeframe': 'M15', 'atr_period': 13, 'atr_threshold': 10.0, 'pt_mult': 0.5, 'sl_mult': 2.5, 'td_mins': 5}. Best is trial 82 with value: 2.454517025102679.
[I 2026-03-12 01:12:09,210] Trial 869 pruned. 
[I 2026-03-12 01:12:09,299] Trial 870 pruned. 
[I 2026-03-12 01:12:09,396] Trial 871 pruned. 
[I 2026-03-12 01:12:09,467] Trial 872 finished with value: 0.0 and parameters: {'timeframe': 'M15', 'atr_period': 13, 'atr_threshold': 10.0, 'pt_mult': 1.0, 'sl_mult': 5.0, 'td_mins': 180}. Best is trial 82 with value: 2.454517025102679.
[I 2026-03-12 01:12:09,534] Trial 873 pruned. 
[I 2026-03-12 01:12:09,585] Trial 874 finished with value: 0.0 and parameters: {'timeframe': 'M15', 'atr_period': 13, 'atr_threshold': 10.0, 'pt_mult': 2.5, 'sl_mult': 1.0, 'td_mins': 120}. Best is trial 82 with value: 2.454517025102679.
[I 2026-03-12 01:12:09,954] Trial 875 pruned. 
[I 2026-03-12 01:12:10,026] Trial 876 pruned. 
[I 2026-03-12 01:12:10,079] Trial 877 finished with value: 0.0 and parameters: {'timeframe': 'M15', 'atr_period': 13, 'atr_threshold': 15.0, 'pt_mult': 2.5, 'sl_mult': 5.0, 'td_mins': 720}. Best is trial 82 with value: 2.454517025102679.
[I 2026-03-12 01:12:10,129] Trial 878 finished with value: 0.0 and parameters: {'timeframe': 'M15', 'atr_period': 13, 'atr_threshold': 15.0, 'pt_mult': 1.0, 'sl_mult': 5.0, 'td_mins': 180}. Best is trial 82 with value: 2.454517025102679.
[I 2026-03-12 01:12:10,418] Trial 879 finished with value: 2.454517025102679 and parameters: {'timeframe': 'M15', 'atr_period': 13, 'atr_threshold': 3.0, 'pt_mult': 0.5, 'sl_mult': 5.0, 'td_mins': 120}. Best is trial 82 with value: 2.454517025102679.
[I 2026-03-12 01:12:10,697] Trial 880 finished with value: 2.454517025102679 and parameters: {'timeframe': 'M15', 'atr_period': 13, 'atr_threshold': 3.0, 'pt_mult': 0.5, 'sl_mult': 5.0, 'td_mins': 120}. Best is trial 82 with value: 2.454517025102679.
[I 2026-03-12 01:12:11,028] Trial 881 finished with value: 2.454517025102679 and parameters: {'timeframe': 'M15', 'atr_period': 13, 'atr_threshold': 3.0, 'pt_mult': 0.5, 'sl_mult': 5.0, 'td_mins': 120}. Best is trial 82 with value: 2.454517025102679.
[I 2026-03-12 01:12:11,303] Trial 882 pruned. 
[I 2026-03-12 01:12:11,601] Trial 883 finished with value: 2.454517025102679 and parameters: {'timeframe': 'M15', 'atr_period': 13, 'atr_threshold': 3.0, 'pt_mult': 0.5, 'sl_mult': 5.0, 'td_mins': 120}. Best is trial 82 with value: 2.454517025102679.
[I 2026-03-12 01:12:11,652] Trial 884 finished with value: 0.0 and parameters: {'timeframe': 'M15', 'atr_period': 13, 'atr_threshold': 10.0, 'pt_mult': 2.5, 'sl_mult': 0.5, 'td_mins': 5}. Best is trial 82 with value: 2.454517025102679.
