[I 2026-03-12 00:57:05,261] Trial 354 finished with value: 2.1460025462423253 and parameters: {'timeframe': 'M5', 'atr_period': 13, 'atr_threshold': 3.0, 'pt_mult': 0.5, 'sl_mult': 5.0, 'td_mins': 60}. Best is trial 337 with value: 2.1460025462423253.
[I 2026-03-12 00:57:05,435] Trial 355 finished with value: 2.1460025462423253 and parameters: {'timeframe': 'M5', 'atr_period': 13, 'atr_threshold': 3.0, 'pt_mult': 0.5, 'sl_mult': 5.0, 'td_mins': 60}. Best is trial 337 with value: 2.1460025462423253.
[I 2026-03-12 00:57:05,609] Trial 356 finished with value: 2.1460025462423253 and parameters: {'timeframe': 'M5', 'atr_period': 13, 'atr_threshold': 3.0, 'pt_mult': 0.5, 'sl_mult': 5.0, 'td_mins': 60}. Best is trial 337 with value: 2.1460025462423253.
[I 2026-03-12 00:57:05,782] Trial 357 finished with value: 2.1460025462423253 and parameters: {'timeframe': 'M5', 'atr_period': 13, 'atr_threshold': 3.0, 'pt_mult': 0.5, 'sl_mult': 5.0, 'td_mins': 60}. Best is trial 337 with value: 2.1460025462423253.
[I 2026-03-12 00:57:05,955] Trial 358 finished with value: 2.1460025462423253 and parameters: {'timeframe': 'M5', 'atr_period': 13, 'atr_threshold': 3.0, 'pt_mult': 0.5, 'sl_mult': 5.0, 'td_mins': 60}. Best is trial 337 with value: 2.1460025462423253.
[I 2026-03-12 00:57:06,139] Trial 359 finished with value: 2.1460025462423253 and parameters: {'timeframe': 'M5', 'atr_period': 13, 'atr_threshold': 3.0, 'pt_mult': 0.5, 'sl_mult': 5.0, 'td_mins': 60}. Best is trial 337 with value: 2.1460025462423253.
[I 2026-03-12 00:57:06,336] Trial 360 finished with value: 2.1460025462423253 and parameters: {'timeframe': 'M5', 'atr_period': 13, 'atr_threshold': 3.0, 'pt_mult': 0.5, 'sl_mult': 5.0, 'td_mins': 60}. Best is trial 337 with value: 2.1460025462423253.
[I 2026-03-12 00:57:06,532] Trial 361 finished with value: 2.1460025462423253 and parameters: {'timeframe': 'M5', 'atr_period': 13, 'atr_threshold': 3.0, 'pt_mult': 0.5, 'sl_mult': 5.0, 'td_mins': 60}. Best is trial 337 with value: 2.1460025462423253.
[I 2026-03-12 00:57:06,706] Trial 362 finished with value: 2.1460025462423253 and parameters: {'timeframe': 'M5', 'atr_period': 13, 'atr_threshold': 3.0, 'pt_mult': 0.5, 'sl_mult': 5.0, 'td_mins': 60}. Best is trial 337 with value: 2.1460025462423253.
[I 2026-03-12 00:57:07,032] Trial 363 finished with value: 1.991639624004351 and parameters: {'timeframe': 'M5', 'atr_period': 13, 'atr_threshold': 2.0, 'pt_mult': 0.5, 'sl_mult': 5.0, 'td_mins': 60}. Best is trial 337 with value: 2.1460025462423253.
[I 2026-03-12 00:57:07,079] Trial 364 finished with value: 0.0 and parameters: {'timeframe': 'M5', 'atr_period': 13, 'atr_threshold': 5.0, 'pt_mult': 0.5, 'sl_mult': 5.0, 'td_mins': 60}. Best is trial 337 with value: 2.1460025462423253.
[I 2026-03-12 00:57:07,141] Trial 365 pruned. 
[I 2026-03-12 00:57:07,187] Trial 366 finished with value: 0.0 and parameters: {'timeframe': 'M5', 'atr_period': 13, 'atr_threshold': 10.0, 'pt_mult': 0.5, 'sl_mult': 5.0, 'td_mins': 60}. Best is trial 337 with value: 2.1460025462423253.
[I 2026-03-12 00:57:07,366] Trial 367 finished with value: 1.8609391157045274 and parameters: {'timeframe': 'M5', 'atr_period': 13, 'atr_threshold': 3.0, 'pt_mult': 1.0, 'sl_mult': 5.0, 'td_mins': 60}. Best is trial 337 with value: 2.1460025462423253.
[I 2026-03-12 00:57:07,410] Trial 368 finished with value: 0.0 and parameters: {'timeframe': 'M5', 'atr_period': 13, 'atr_threshold': 15.0, 'pt_mult': 0.5, 'sl_mult': 5.0, 'td_mins': 60}. Best is trial 337 with value: 2.1460025462423253.
[I 2026-03-12 00:57:07,580] Trial 369 finished with value: 2.1460025462423253 and parameters: {'timeframe': 'M5', 'atr_period': 13, 'atr_threshold': 3.0, 'pt_mult': 0.5, 'sl_mult': 5.0, 'td_mins': 60}. Best is trial 337 with value: 2.1460025462423253.
[I 2026-03-12 00:57:07,635] Trial 370 pruned. 
[I 2026-03-12 00:57:07,914] Trial 371 pruned. 
[I 2026-03-12 00:57:07,960] Trial 372 finished with value: 0.0 and parameters: {'timeframe': 'M5', 'atr_period': 13, 'atr_threshold': 8.0, 'pt_mult': 0.5, 'sl_mult': 5.0, 'td_mins': 60}. Best is trial 337 with value: 2.1460025462423253.
[I 2026-03-12 00:57:08,017] Trial 373 pruned. 
[I 2026-03-12 00:57:08,190] Trial 374 finished with value: 2.1460025462423253 and parameters: {'timeframe': 'M5', 'atr_period': 13, 'atr_threshold': 3.0, 'pt_mult': 0.5, 'sl_mult': 5.0, 'td_mins': 60}. Best is trial 337 with value: 2.1460025462423253.
[I 2026-03-12 00:57:08,311] Trial 375 pruned. 
[I 2026-03-12 00:57:08,405] Trial 376 finished with value: 2.1309226830196697 and parameters: {'timeframe': 'M5', 'atr_period': 13, 'atr_threshold': 3.0, 'pt_mult': 0.5, 'sl_mult': 5.0, 'td_mins': 15}. Best is trial 337 with value: 2.1460025462423253.
[I 2026-03-12 00:57:08,577] Trial 377 finished with value: 2.1460025462423253 and parameters: {'timeframe': 'M5', 'atr_period': 13, 'atr_threshold': 3.0, 'pt_mult': 0.5, 'sl_mult': 5.0, 'td_mins': 60}. Best is trial 337 with value: 2.1460025462423253.
[I 2026-03-12 00:57:08,698] Trial 378 finished with value: 2.3870654100539324 and parameters: {'timeframe': 'M5', 'atr_period': 13, 'atr_threshold': 3.0, 'pt_mult': 0.5, 'sl_mult': 5.0, 'td_mins': 30}. Best is trial 378 with value: 2.3870654100539324.
[I 2026-03-12 00:57:08,820] Trial 379 finished with value: 2.3870654100539324 and parameters: {'timeframe': 'M5', 'atr_period': 13, 'atr_threshold': 3.0, 'pt_mult': 0.5, 'sl_mult': 5.0, 'td_mins': 30}. Best is trial 378 with value: 2.3870654100539324.
[I 2026-03-12 00:57:08,940] Trial 380 finished with value: 2.3870654100539324 and parameters: {'timeframe': 'M5', 'atr_period': 13, 'atr_threshold': 3.0, 'pt_mult': 0.5, 'sl_mult': 5.0, 'td_mins': 30}. Best is trial 378 with value: 2.3870654100539324.
[I 2026-03-12 00:57:09,061] Trial 381 finished with value: 2.3870654100539324 and parameters: {'timeframe': 'M5', 'atr_period': 13, 'atr_threshold': 3.0, 'pt_mult': 0.5, 'sl_mult': 5.0, 'td_mins': 30}. Best is trial 378 with value: 2.3870654100539324.
[I 2026-03-12 00:57:09,181] Trial 382 finished with value: 2.3870654100539324 and parameters: {'timeframe': 'M5', 'atr_period': 13, 'atr_threshold': 3.0, 'pt_mult': 0.5, 'sl_mult': 5.0, 'td_mins': 30}. Best is trial 378 with value: 2.3870654100539324.
[I 2026-03-12 00:57:09,300] Trial 383 finished with value: 2.3870654100539324 and parameters: {'timeframe': 'M5', 'atr_period': 13, 'atr_threshold': 3.0, 'pt_mult': 0.5, 'sl_mult': 5.0, 'td_mins': 30}. Best is trial 378 with value: 2.3870654100539324.
[I 2026-03-12 00:57:09,416] Trial 384 finished with value: 2.3870654100539324 and parameters: {'timeframe': 'M5', 'atr_period': 13, 'atr_threshold': 3.0, 'pt_mult': 0.5, 'sl_mult': 5.0, 'td_mins': 30}. Best is trial 378 with value: 2.3870654100539324.
[I 2026-03-12 00:57:09,532] Trial 385 finished with value: 2.3870654100539324 and parameters: {'timeframe': 'M5', 'atr_period': 13, 'atr_threshold': 3.0, 'pt_mult': 0.5, 'sl_mult': 5.0, 'td_mins': 30}. Best is trial 378 with value: 2.3870654100539324.
[I 2026-03-12 00:57:09,654] Trial 386 finished with value: 2.3870654100539324 and parameters: {'timeframe': 'M5', 'atr_period': 13, 'atr_threshold': 3.0, 'pt_mult': 0.5, 'sl_mult': 5.0, 'td_mins': 30}. Best is trial 378 with value: 2.3870654100539324.
[I 2026-03-12 00:57:09,771] Trial 387 finished with value: 2.3870654100539324 and parameters: {'timeframe': 'M5', 'atr_period': 13, 'atr_threshold': 3.0, 'pt_mult': 0.5, 'sl_mult': 5.0, 'td_mins': 30}. Best is trial 378 with value: 2.3870654100539324.
[I 2026-03-12 00:57:09,892] Trial 388 finished with value: 2.3870654100539324 and parameters: {'timeframe': 'M5', 'atr_period': 13, 'atr_threshold': 3.0, 'pt_mult': 0.5, 'sl_mult': 5.0, 'td_mins': 30}. Best is trial 378 with value: 2.3870654100539324.
[I 2026-03-12 00:57:10,008] Trial 389 finished with value: 2.3870654100539324 and parameters: {'timeframe': 'M5', 'atr_period': 13, 'atr_threshold': 3.0, 'pt_mult': 0.5, 'sl_mult': 5.0, 'td_mins': 30}. Best is trial 378 with value: 2.3870654100539324.
[I 2026-03-12 00:57:10,133] Trial 390 finished with value: 2.3870654100539324 and parameters: {'timeframe': 'M5', 'atr_period': 13, 'atr_threshold': 3.0, 'pt_mult': 0.5, 'sl_mult': 5.0, 'td_mins': 30}. Best is trial 378 with value: 2.3870654100539324.
[I 2026-03-12 00:57:10,292] Trial 391 finished with value: 2.3870654100539324 and parameters: {'timeframe': 'M5', 'atr_period': 13, 'atr_threshold': 3.0, 'pt_mult': 0.5, 'sl_mult': 5.0, 'td_mins': 30}. Best is trial 378 with value: 2.3870654100539324.
[I 2026-03-12 00:57:10,410] Trial 392 finished with value: 2.3870654100539324 and parameters: {'timeframe': 'M5', 'atr_period': 13, 'atr_threshold': 3.0, 'pt_mult': 0.5, 'sl_mult': 5.0, 'td_mins': 30}. Best is trial 378 with value: 2.3870654100539324.
[I 2026-03-12 00:57:10,465] Trial 393 pruned. 
[I 2026-03-12 00:57:10,591] Trial 394 finished with value: 2.3870654100539324 and parameters: {'timeframe': 'M5', 'atr_period': 13, 'atr_threshold': 3.0, 'pt_mult': 0.5, 'sl_mult': 5.0, 'td_mins': 30}. Best is trial 378 with value: 2.3870654100539324.
[I 2026-03-12 00:57:10,724] Trial 395 finished with value: 2.3870654100539324 and parameters: {'timeframe': 'M5', 'atr_period': 13, 'atr_threshold': 3.0, 'pt_mult': 0.5, 'sl_mult': 5.0, 'td_mins': 30}. Best is trial 378 with value: 2.3870654100539324.
[I 2026-03-12 00:57:10,844] Trial 396 finished with value: 2.3870654100539324 and parameters: {'timeframe': 'M5', 'atr_period': 13, 'atr_threshold': 3.0, 'pt_mult': 0.5, 'sl_mult': 5.0, 'td_mins': 30}. Best is trial 378 with value: 2.3870654100539324.
[I 2026-03-12 00:57:10,985] Trial 397 finished with value: 2.3870654100539324 and parameters: {'timeframe': 'M5', 'atr_period': 13, 'atr_threshold': 3.0, 'pt_mult': 0.5, 'sl_mult': 5.0, 'td_mins': 30}. Best is trial 378 with value: 2.3870654100539324.
[I 2026-03-12 00:57:11,138] Trial 398 finished with value: 2.3870654100539324 and parameters: {'timeframe': 'M5', 'atr_period': 13, 'atr_threshold': 3.0, 'pt_mult': 0.5, 'sl_mult': 5.0, 'td_mins': 30}. Best is trial 378 with value: 2.3870654100539324.
[I 2026-03-12 00:57:11,280] Trial 399 finished with value: 2.3870654100539324 and parameters: {'timeframe': 'M5', 'atr_period': 13, 'atr_threshold': 3.0, 'pt_mult': 0.5, 'sl_mult': 5.0, 'td_mins': 30}. Best is trial 378 with value: 2.3870654100539324.
[I 2026-03-12 00:57:11,414] Trial 400 finished with value: 2.3870654100539324 and parameters: {'timeframe': 'M5', 'atr_period': 13, 'atr_threshold': 3.0, 'pt_mult': 0.5, 'sl_mult': 5.0, 'td_mins': 30}. Best is trial 378 with value: 2.3870654100539324.
[I 2026-03-12 00:57:11,536] Trial 401 finished with value: 2.3870654100539324 and parameters: {'timeframe': 'M5', 'atr_period': 13, 'atr_threshold': 3.0, 'pt_mult': 0.5, 'sl_mult': 5.0, 'td_mins': 30}. Best is trial 378 with value: 2.3870654100539324.
[I 2026-03-12 00:57:11,657] Trial 402 finished with value: 2.3870654100539324 and parameters: {'timeframe': 'M5', 'atr_period': 13, 'atr_threshold': 3.0, 'pt_mult': 0.5, 'sl_mult': 5.0, 'td_mins': 30}. Best is trial 378 with value: 2.3870654100539324.
[I 2026-03-12 00:57:11,775] Trial 403 finished with value: 2.3870654100539324 and parameters: {'timeframe': 'M5', 'atr_period': 13, 'atr_threshold': 3.0, 'pt_mult': 0.5, 'sl_mult': 5.0, 'td_mins': 30}. Best is trial 378 with value: 2.3870654100539324.
[I 2026-03-12 00:57:11,896] Trial 404 finished with value: 2.3870654100539324 and parameters: {'timeframe': 'M5', 'atr_period': 13, 'atr_threshold': 3.0, 'pt_mult': 0.5, 'sl_mult': 5.0, 'td_mins': 30}. Best is trial 378 with value: 2.3870654100539324.
[I 2026-03-12 00:57:12,034] Trial 405 pruned. 
[I 2026-03-12 00:57:12,159] Trial 406 finished with value: 2.3870654100539324 and parameters: {'timeframe': 'M5', 'atr_period': 13, 'atr_threshold': 3.0, 'pt_mult': 0.5, 'sl_mult': 5.0, 'td_mins': 30}. Best is trial 378 with value: 2.3870654100539324.
[I 2026-03-12 00:57:12,213] Trial 407 pruned. 
[I 2026-03-12 00:57:12,390] Trial 408 pruned. 
[I 2026-03-12 00:57:12,596] Trial 409 finished with value: 2.0948339996133756 and parameters: {'timeframe': 'M5', 'atr_period': 13, 'atr_threshold': 2.0, 'pt_mult': 0.5, 'sl_mult': 5.0, 'td_mins': 30}. Best is trial 378 with value: 2.3870654100539324.
[I 2026-03-12 00:57:12,723] Trial 410 finished with value: 1.72795301336934 and parameters: {'timeframe': 'M5', 'atr_period': 13, 'atr_threshold': 3.0, 'pt_mult': 1.0, 'sl_mult': 5.0, 'td_mins': 30}. Best is trial 378 with value: 2.3870654100539324.
[I 2026-03-12 00:57:12,770] Trial 411 finished with value: 0.0 and parameters: {'timeframe': 'M5', 'atr_period': 13, 'atr_threshold': 5.0, 'pt_mult': 0.5, 'sl_mult': 5.0, 'td_mins': 30}. Best is trial 378 with value: 2.3870654100539324.
[I 2026-03-12 00:57:12,826] Trial 412 pruned. 
[I 2026-03-12 00:57:12,874] Trial 413 finished with value: 0.0 and parameters: {'timeframe': 'M5', 'atr_period': 13, 'atr_threshold': 10.0, 'pt_mult': 0.5, 'sl_mult': 5.0, 'td_mins': 30}. Best is trial 378 with value: 2.3870654100539324.
[I 2026-03-12 00:57:12,992] Trial 414 finished with value: 2.3870654100539324 and parameters: {'timeframe': 'M5', 'atr_period': 13, 'atr_threshold': 3.0, 'pt_mult': 0.5, 'sl_mult': 5.0, 'td_mins': 30}. Best is trial 378 with value: 2.3870654100539324.
[I 2026-03-12 00:57:13,046] Trial 415 pruned. 
[I 2026-03-12 00:57:13,173] Trial 416 finished with value: 2.3870654100539324 and parameters: {'timeframe': 'M5', 'atr_period': 13, 'atr_threshold': 3.0, 'pt_mult': 0.5, 'sl_mult': 5.0, 'td_mins': 30}. Best is trial 378 with value: 2.3870654100539324.
[I 2026-03-12 00:57:13,294] Trial 417 finished with value: 2.3870654100539324 and parameters: {'timeframe': 'M5', 'atr_period': 13, 'atr_threshold': 3.0, 'pt_mult': 0.5, 'sl_mult': 5.0, 'td_mins': 30}. Best is trial 378 with value: 2.3870654100539324.
[I 2026-03-12 00:57:13,461] Trial 418 finished with value: 2.3870654100539324 and parameters: {'timeframe': 'M5', 'atr_period': 13, 'atr_threshold': 3.0, 'pt_mult': 0.5, 'sl_mult': 5.0, 'td_mins': 30}. Best is trial 378 with value: 2.3870654100539324.
[I 2026-03-12 00:57:13,506] Trial 419 finished with value: 0.0 and parameters: {'timeframe': 'M5', 'atr_period': 13, 'atr_threshold': 8.0, 'pt_mult': 0.5, 'sl_mult': 5.0, 'td_mins': 30}. Best is trial 378 with value: 2.3870654100539324.
[I 2026-03-12 00:57:13,629] Trial 420 finished with value: 2.3870654100539324 and parameters: {'timeframe': 'M5', 'atr_period': 13, 'atr_threshold': 3.0, 'pt_mult': 0.5, 'sl_mult': 5.0, 'td_mins': 30}. Best is trial 378 with value: 2.3870654100539324.
[I 2026-03-12 00:57:13,676] Trial 421 finished with value: 0.0 and parameters: {'timeframe': 'M5', 'atr_period': 13, 'atr_threshold': 5.0, 'pt_mult': 2.5, 'sl_mult': 5.0, 'td_mins': 30}. Best is trial 378 with value: 2.3870654100539324.
[I 2026-03-12 00:57:13,759] Trial 422 pruned. 
[I 2026-03-12 00:57:13,876] Trial 423 finished with value: 2.3870654100539324 and parameters: {'timeframe': 'M5', 'atr_period': 13, 'atr_threshold': 3.0, 'pt_mult': 0.5, 'sl_mult': 5.0, 'td_mins': 30}. Best is trial 378 with value: 2.3870654100539324.
[I 2026-03-12 00:57:13,994] Trial 424 finished with value: 2.3870654100539324 and parameters: {'timeframe': 'M5', 'atr_period': 13, 'atr_threshold': 3.0, 'pt_mult': 0.5, 'sl_mult': 5.0, 'td_mins': 30}. Best is trial 378 with value: 2.3870654100539324.
[I 2026-03-12 00:57:14,050] Trial 425 pruned. 
[I 2026-03-12 00:57:14,174] Trial 426 finished with value: 2.3870654100539324 and parameters: {'timeframe': 'M5', 'atr_period': 13, 'atr_threshold': 3.0, 'pt_mult': 0.5, 'sl_mult': 5.0, 'td_mins': 30}. Best is trial 378 with value: 2.3870654100539324.
[I 2026-03-12 00:57:14,248] Trial 427 pruned. 
[I 2026-03-12 00:57:14,371] Trial 428 finished with value: 2.3870654100539324 and parameters: {'timeframe': 'M5', 'atr_period': 13, 'atr_threshold': 3.0, 'pt_mult': 0.5, 'sl_mult': 5.0, 'td_mins': 30}. Best is trial 378 with value: 2.3870654100539324.
[I 2026-03-12 00:57:14,464] Trial 429 pruned. 
[I 2026-03-12 00:57:14,520] Trial 430 pruned. 
[I 2026-03-12 00:57:14,651] Trial 431 finished with value: 2.3870654100539324 and parameters: {'timeframe': 'M5', 'atr_period': 13, 'atr_threshold': 3.0, 'pt_mult': 0.5, 'sl_mult': 5.0, 'td_mins': 30}. Best is trial 378 with value: 2.3870654100539324.
[I 2026-03-12 00:57:14,697] Trial 432 finished with value: 0.0 and parameters: {'timeframe': 'M5', 'atr_period': 13, 'atr_threshold': 5.0, 'pt_mult': 0.5, 'sl_mult': 2.5, 'td_mins': 30}. Best is trial 378 with value: 2.3870654100539324.
[I 2026-03-12 00:57:14,814] Trial 433 pruned. 
[I 2026-03-12 00:57:14,861] Trial 434 finished with value: 0.0 and parameters: {'timeframe': 'M5', 'atr_period': 13, 'atr_threshold': 15.0, 'pt_mult': 0.5, 'sl_mult': 5.0, 'td_mins': 1200}. Best is trial 378 with value: 2.3870654100539324.
[I 2026-03-12 00:57:14,907] Trial 435 finished with value: 0.0 and parameters: {'timeframe': 'M5', 'atr_period': 13, 'atr_threshold': 5.0, 'pt_mult': 0.5, 'sl_mult': 0.5, 'td_mins': 30}. Best is trial 378 with value: 2.3870654100539324.
[I 2026-03-12 00:57:15,035] Trial 436 finished with value: 2.3870654100539324 and parameters: {'timeframe': 'M5', 'atr_period': 13, 'atr_threshold': 3.0, 'pt_mult': 0.5, 'sl_mult': 5.0, 'td_mins': 30}. Best is trial 378 with value: 2.3870654100539324.
[I 2026-03-12 00:57:15,086] Trial 437 pruned. 
[I 2026-03-12 00:57:15,180] Trial 438 pruned. 
[I 2026-03-12 00:57:15,298] Trial 439 finished with value: 2.3870654100539324 and parameters: {'timeframe': 'M5', 'atr_period': 13, 'atr_threshold': 3.0, 'pt_mult': 0.5, 'sl_mult': 5.0, 'td_mins': 30}. Best is trial 378 with value: 2.3870654100539324.
[I 2026-03-12 00:57:15,355] Trial 440 pruned. 
[I 2026-03-12 00:57:15,481] Trial 441 finished with value: 2.3870654100539324 and parameters: {'timeframe': 'M5', 'atr_period': 13, 'atr_threshold': 3.0, 'pt_mult': 0.5, 'sl_mult': 5.0, 'td_mins': 30}. Best is trial 378 with value: 2.3870654100539324.
[I 2026-03-12 00:57:15,595] Trial 442 pruned. 
[I 2026-03-12 00:57:15,717] Trial 443 finished with value: 2.3870654100539324 and parameters: {'timeframe': 'M5', 'atr_period': 13, 'atr_threshold': 3.0, 'pt_mult': 0.5, 'sl_mult': 5.0, 'td_mins': 30}. Best is trial 378 with value: 2.3870654100539324.
[I 2026-03-12 00:57:15,784] Trial 444 pruned. 
[I 2026-03-12 00:57:15,830] Trial 445 finished with value: 0.0 and parameters: {'timeframe': 'M5', 'atr_period': 13, 'atr_threshold': 15.0, 'pt_mult': 0.5, 'sl_mult': 5.0, 'td_mins': 720}. Best is trial 378 with value: 2.3870654100539324.
[I 2026-03-12 00:57:15,987] Trial 446 pruned. 
[I 2026-03-12 00:57:16,038] Trial 447 finished with value: 0.0 and parameters: {'timeframe': 'M5', 'atr_period': 13, 'atr_threshold': 10.0, 'pt_mult': 0.5, 'sl_mult': 0.5, 'td_mins': 30}. Best is trial 378 with value: 2.3870654100539324.
[I 2026-03-12 00:57:16,195] Trial 448 pruned. 
[I 2026-03-12 00:57:16,272] Trial 449 pruned. 
[I 2026-03-12 00:57:16,410] Trial 450 pruned. 
[I 2026-03-12 00:57:16,462] Trial 451 pruned. 
[I 2026-03-12 00:57:16,514] Trial 452 pruned. 
[I 2026-03-12 00:57:16,562] Trial 453 finished with value: 0.0 and parameters: {'timeframe': 'M5', 'atr_period': 13, 'atr_threshold': 8.0, 'pt_mult': 2.5, 'sl_mult': 5.0, 'td_mins': 30}. Best is trial 378 with value: 2.3870654100539324.
[I 2026-03-12 00:57:16,708] Trial 454 pruned. 
[I 2026-03-12 00:57:17,111] Trial 455 pruned. 
[I 2026-03-12 00:57:17,162] Trial 456 finished with value: 0.0 and parameters: {'timeframe': 'M5', 'atr_period': 13, 'atr_threshold': 15.0, 'pt_mult': 0.5, 'sl_mult': 0.5, 'td_mins': 30}. Best is trial 378 with value: 2.3870654100539324.
[I 2026-03-12 00:57:17,212] Trial 457 finished with value: 0.0 and parameters: {'timeframe': 'M5', 'atr_period': 13, 'atr_threshold': 8.0, 'pt_mult': 0.5, 'sl_mult': 5.0, 'td_mins': 1080}. Best is trial 378 with value: 2.3870654100539324.
[I 2026-03-12 00:57:17,334] Trial 458 finished with value: 2.3870654100539324 and parameters: {'timeframe': 'M5', 'atr_period': 13, 'atr_threshold': 3.0, 'pt_mult': 0.5, 'sl_mult': 5.0, 'td_mins': 30}. Best is trial 378 with value: 2.3870654100539324.
[I 2026-03-12 00:57:17,479] Trial 459 pruned. 
[I 2026-03-12 00:57:17,803] Trial 460 finished with value: 1.783955378354149 and parameters: {'timeframe': 'M5', 'atr_period': 13, 'atr_threshold': 3.0, 'pt_mult': 0.5, 'sl_mult': 5.0, 'td_mins': 180}. Best is trial 378 with value: 2.3870654100539324.
[I 2026-03-12 00:57:17,850] Trial 461 finished with value: 0.0 and parameters: {'timeframe': 'M5', 'atr_period': 13, 'atr_threshold': 8.0, 'pt_mult': 0.5, 'sl_mult': 1.0, 'td_mins': 30}. Best is trial 378 with value: 2.3870654100539324.
[I 2026-03-12 00:57:17,973] Trial 462 finished with value: 2.3870654100539324 and parameters: {'timeframe': 'M5', 'atr_period': 13, 'atr_threshold': 3.0, 'pt_mult': 0.5, 'sl_mult': 5.0, 'td_mins': 30}. Best is trial 378 with value: 2.3870654100539324.
[I 2026-03-12 00:57:18,093] Trial 463 finished with value: 2.3870654100539324 and parameters: {'timeframe': 'M5', 'atr_period': 13, 'atr_threshold': 3.0, 'pt_mult': 0.5, 'sl_mult': 5.0, 'td_mins': 30}. Best is trial 378 with value: 2.3870654100539324.
[I 2026-03-12 00:57:18,163] Trial 464 pruned. 
[I 2026-03-12 00:57:18,247] Trial 465 pruned. 
[I 2026-03-12 00:57:18,296] Trial 466 pruned. 
[I 2026-03-12 00:57:18,370] Trial 467 pruned. 
[I 2026-03-12 00:57:19,310] Trial 468 pruned. 
[I 2026-03-12 00:57:19,432] Trial 469 finished with value: 2.3870654100539324 and parameters: {'timeframe': 'M5', 'atr_period': 13, 'atr_threshold': 3.0, 'pt_mult': 0.5, 'sl_mult': 5.0, 'td_mins': 30}. Best is trial 378 with value: 2.3870654100539324.
[I 2026-03-12 00:57:19,618] Trial 470 pruned. 
[I 2026-03-12 00:57:19,668] Trial 471 pruned. 
[I 2026-03-12 00:57:19,793] Trial 472 finished with value: 2.3870654100539324 and parameters: {'timeframe': 'M5', 'atr_period': 13, 'atr_threshold': 3.0, 'pt_mult': 0.5, 'sl_mult': 5.0, 'td_mins': 30}. Best is trial 378 with value: 2.3870654100539324.
