[I 2026-03-12 01:12:11,937] Trial 885 finished with value: 2.454517025102679 and parameters: {'timeframe': 'M15', 'atr_period': 13, 'atr_threshold': 3.0, 'pt_mult': 0.5, 'sl_mult': 5.0, 'td_mins': 120}. Best is trial 82 with value: 2.454517025102679.
[I 2026-03-12 01:12:11,991] Trial 886 finished with value: 0.0 and parameters: {'timeframe': 'M15', 'atr_period': 13, 'atr_threshold': 10.0, 'pt_mult': 2.5, 'sl_mult': 5.0, 'td_mins': 15}. Best is trial 82 with value: 2.454517025102679.
[I 2026-03-12 01:12:12,171] Trial 887 pruned. 
[I 2026-03-12 01:12:12,250] Trial 888 pruned. 
[I 2026-03-12 01:12:12,396] Trial 889 pruned. 
[I 2026-03-12 01:12:12,578] Trial 890 pruned. 
[I 2026-03-12 01:12:12,818] Trial 891 pruned. 
[I 2026-03-12 01:12:12,867] Trial 892 pruned. 
[I 2026-03-12 01:12:13,092] Trial 893 pruned. 
[I 2026-03-12 01:12:13,142] Trial 894 finished with value: 0.0 and parameters: {'timeframe': 'M15', 'atr_period': 13, 'atr_threshold': 15.0, 'pt_mult': 0.5, 'sl_mult': 5.0, 'td_mins': 120}. Best is trial 82 with value: 2.454517025102679.
[I 2026-03-12 01:12:13,436] Trial 895 finished with value: 2.454517025102679 and parameters: {'timeframe': 'M15', 'atr_period': 13, 'atr_threshold': 3.0, 'pt_mult': 0.5, 'sl_mult': 5.0, 'td_mins': 120}. Best is trial 82 with value: 2.454517025102679.
[I 2026-03-12 01:12:13,524] Trial 896 pruned. 
[I 2026-03-12 01:12:13,630] Trial 897 pruned. 
[I 2026-03-12 01:12:13,898] Trial 898 finished with value: 2.454517025102679 and parameters: {'timeframe': 'M15', 'atr_period': 13, 'atr_threshold': 3.0, 'pt_mult': 0.5, 'sl_mult': 5.0, 'td_mins': 120}. Best is trial 82 with value: 2.454517025102679.
[I 2026-03-12 01:12:14,098] Trial 899 pruned. 
[I 2026-03-12 01:12:14,147] Trial 900 pruned. 
[I 2026-03-12 01:12:14,199] Trial 901 finished with value: 0.0 and parameters: {'timeframe': 'M15', 'atr_period': 13, 'atr_threshold': 10.0, 'pt_mult': 1.0, 'sl_mult': 0.5, 'td_mins': 120}. Best is trial 82 with value: 2.454517025102679.
[I 2026-03-12 01:12:14,257] Trial 902 pruned. 
[I 2026-03-12 01:12:14,311] Trial 903 finished with value: 0.0 and parameters: {'timeframe': 'M15', 'atr_period': 13, 'atr_threshold': 10.0, 'pt_mult': 5.0, 'sl_mult': 0.5, 'td_mins': 15}. Best is trial 82 with value: 2.454517025102679.
[I 2026-03-12 01:12:14,360] Trial 904 finished with value: 0.0 and parameters: {'timeframe': 'M15', 'atr_period': 13, 'atr_threshold': 10.0, 'pt_mult': 5.0, 'sl_mult': 5.0, 'td_mins': 15}. Best is trial 82 with value: 2.454517025102679.
[I 2026-03-12 01:12:14,577] Trial 905 pruned. 
[I 2026-03-12 01:12:14,654] Trial 906 pruned. 
[I 2026-03-12 01:12:14,785] Trial 907 pruned. 
[I 2026-03-12 01:12:14,971] Trial 908 pruned. 
[I 2026-03-12 01:12:15,257] Trial 909 finished with value: 2.454517025102679 and parameters: {'timeframe': 'M15', 'atr_period': 13, 'atr_threshold': 3.0, 'pt_mult': 0.5, 'sl_mult': 5.0, 'td_mins': 120}. Best is trial 82 with value: 2.454517025102679.
[I 2026-03-12 01:12:15,341] Trial 910 pruned. 
[I 2026-03-12 01:12:15,623] Trial 911 finished with value: 2.454517025102679 and parameters: {'timeframe': 'M15', 'atr_period': 13, 'atr_threshold': 3.0, 'pt_mult': 0.5, 'sl_mult': 5.0, 'td_mins': 120}. Best is trial 82 with value: 2.454517025102679.
[I 2026-03-12 01:12:15,676] Trial 912 finished with value: 0.0 and parameters: {'timeframe': 'M15', 'atr_period': 13, 'atr_threshold': 15.0, 'pt_mult': 0.5, 'sl_mult': 2.5, 'td_mins': 720}. Best is trial 82 with value: 2.454517025102679.
[I 2026-03-12 01:12:15,729] Trial 913 finished with value: 0.0 and parameters: {'timeframe': 'M15', 'atr_period': 13, 'atr_threshold': 10.0, 'pt_mult': 1.0, 'sl_mult': 2.5, 'td_mins': 60}. Best is trial 82 with value: 2.454517025102679.
[I 2026-03-12 01:12:16,496] Trial 914 pruned. 
[I 2026-03-12 01:12:17,227] Trial 915 pruned. 
[I 2026-03-12 01:12:18,238] Trial 916 pruned. 
[I 2026-03-12 01:12:18,625] Trial 917 pruned. 
[I 2026-03-12 01:12:18,814] Trial 918 pruned. 
[I 2026-03-12 01:12:18,890] Trial 919 pruned. 
[I 2026-03-12 01:12:18,959] Trial 920 pruned. 
[I 2026-03-12 01:12:19,355] Trial 921 pruned. 
[I 2026-03-12 01:12:19,778] Trial 922 finished with value: 2.454517025102679 and parameters: {'timeframe': 'M15', 'atr_period': 13, 'atr_threshold': 3.0, 'pt_mult': 0.5, 'sl_mult': 5.0, 'td_mins': 120}. Best is trial 82 with value: 2.454517025102679.
[I 2026-03-12 01:12:19,881] Trial 923 pruned. 
[I 2026-03-12 01:12:19,963] Trial 924 pruned. 
[I 2026-03-12 01:12:20,021] Trial 925 finished with value: 0.0 and parameters: {'timeframe': 'M15', 'atr_period': 13, 'atr_threshold': 10.0, 'pt_mult': 0.5, 'sl_mult': 1.0, 'td_mins': 5}. Best is trial 82 with value: 2.454517025102679.
[I 2026-03-12 01:12:20,140] Trial 926 pruned. 
[I 2026-03-12 01:12:20,261] Trial 927 pruned. 
[I 2026-03-12 01:12:20,459] Trial 928 pruned. 
[I 2026-03-12 01:12:20,750] Trial 929 pruned. 
[I 2026-03-12 01:12:21,058] Trial 930 finished with value: 2.454517025102679 and parameters: {'timeframe': 'M15', 'atr_period': 13, 'atr_threshold': 3.0, 'pt_mult': 0.5, 'sl_mult': 5.0, 'td_mins': 120}. Best is trial 82 with value: 2.454517025102679.
[I 2026-03-12 01:12:21,375] Trial 931 finished with value: 2.454517025102679 and parameters: {'timeframe': 'M15', 'atr_period': 13, 'atr_threshold': 3.0, 'pt_mult': 0.5, 'sl_mult': 5.0, 'td_mins': 120}. Best is trial 82 with value: 2.454517025102679.
[I 2026-03-12 01:12:21,663] Trial 932 finished with value: 2.454517025102679 and parameters: {'timeframe': 'M15', 'atr_period': 13, 'atr_threshold': 3.0, 'pt_mult': 0.5, 'sl_mult': 5.0, 'td_mins': 120}. Best is trial 82 with value: 2.454517025102679.
[I 2026-03-12 01:12:21,956] Trial 933 finished with value: 2.454517025102679 and parameters: {'timeframe': 'M15', 'atr_period': 13, 'atr_threshold': 3.0, 'pt_mult': 0.5, 'sl_mult': 5.0, 'td_mins': 120}. Best is trial 82 with value: 2.454517025102679.
[I 2026-03-12 01:12:22,021] Trial 934 pruned. 
[I 2026-03-12 01:12:22,110] Trial 935 pruned. 
[I 2026-03-12 01:12:22,557] Trial 936 pruned. 
[I 2026-03-12 01:12:22,607] Trial 937 finished with value: 0.0 and parameters: {'timeframe': 'M15', 'atr_period': 13, 'atr_threshold': 15.0, 'pt_mult': 5.0, 'sl_mult': 1.0, 'td_mins': 360}. Best is trial 82 with value: 2.454517025102679.
[I 2026-03-12 01:12:22,887] Trial 938 finished with value: 2.454517025102679 and parameters: {'timeframe': 'M15', 'atr_period': 13, 'atr_threshold': 3.0, 'pt_mult': 0.5, 'sl_mult': 5.0, 'td_mins': 120}. Best is trial 82 with value: 2.454517025102679.
[I 2026-03-12 01:12:22,940] Trial 939 pruned. 
[I 2026-03-12 01:12:23,026] Trial 940 pruned. 
[I 2026-03-12 01:12:23,075] Trial 941 finished with value: 0.0 and parameters: {'timeframe': 'M15', 'atr_period': 13, 'atr_threshold': 15.0, 'pt_mult': 1.0, 'sl_mult': 2.5, 'td_mins': 60}. Best is trial 82 with value: 2.454517025102679.
[I 2026-03-12 01:12:24,189] Trial 942 pruned. 
[I 2026-03-12 01:12:24,481] Trial 943 pruned. 
[I 2026-03-12 01:12:24,764] Trial 944 finished with value: 2.454517025102679 and parameters: {'timeframe': 'M15', 'atr_period': 13, 'atr_threshold': 3.0, 'pt_mult': 0.5, 'sl_mult': 5.0, 'td_mins': 120}. Best is trial 82 with value: 2.454517025102679.
[I 2026-03-12 01:12:24,819] Trial 945 pruned. 
[I 2026-03-12 01:12:25,106] Trial 946 finished with value: 2.454517025102679 and parameters: {'timeframe': 'M15', 'atr_period': 13, 'atr_threshold': 3.0, 'pt_mult': 0.5, 'sl_mult': 5.0, 'td_mins': 120}. Best is trial 82 with value: 2.454517025102679.
[I 2026-03-12 01:12:25,391] Trial 947 finished with value: 2.454517025102679 and parameters: {'timeframe': 'M15', 'atr_period': 13, 'atr_threshold': 3.0, 'pt_mult': 0.5, 'sl_mult': 5.0, 'td_mins': 120}. Best is trial 82 with value: 2.454517025102679.
[I 2026-03-12 01:12:25,449] Trial 948 pruned. 
[I 2026-03-12 01:12:25,504] Trial 949 pruned. 
[I 2026-03-12 01:12:25,563] Trial 950 pruned. 
[I 2026-03-12 01:12:25,616] Trial 951 pruned. 
[I 2026-03-12 01:12:25,667] Trial 952 pruned. 
[I 2026-03-12 01:12:25,718] Trial 953 finished with value: 0.0 and parameters: {'timeframe': 'M15', 'atr_period': 13, 'atr_threshold': 10.0, 'pt_mult': 5.0, 'sl_mult': 0.5, 'td_mins': 5}. Best is trial 82 with value: 2.454517025102679.
[I 2026-03-12 01:12:26,036] Trial 954 finished with value: 2.454517025102679 and parameters: {'timeframe': 'M15', 'atr_period': 13, 'atr_threshold': 3.0, 'pt_mult': 0.5, 'sl_mult': 5.0, 'td_mins': 120}. Best is trial 82 with value: 2.454517025102679.
[I 2026-03-12 01:12:26,343] Trial 955 finished with value: 2.454517025102679 and parameters: {'timeframe': 'M15', 'atr_period': 13, 'atr_threshold': 3.0, 'pt_mult': 0.5, 'sl_mult': 5.0, 'td_mins': 120}. Best is trial 82 with value: 2.454517025102679.
[I 2026-03-12 01:12:26,395] Trial 956 finished with value: 0.0 and parameters: {'timeframe': 'M15', 'atr_period': 13, 'atr_threshold': 15.0, 'pt_mult': 5.0, 'sl_mult': 0.5, 'td_mins': 120}. Best is trial 82 with value: 2.454517025102679.
[I 2026-03-12 01:12:26,591] Trial 957 pruned. 
[I 2026-03-12 01:12:26,677] Trial 958 pruned. 
[I 2026-03-12 01:12:26,728] Trial 959 finished with value: 0.0 and parameters: {'timeframe': 'M15', 'atr_period': 13, 'atr_threshold': 10.0, 'pt_mult': 0.5, 'sl_mult': 5.0, 'td_mins': 120}. Best is trial 82 with value: 2.454517025102679.
[I 2026-03-12 01:12:27,023] Trial 960 finished with value: 2.454517025102679 and parameters: {'timeframe': 'M15', 'atr_period': 13, 'atr_threshold': 3.0, 'pt_mult': 0.5, 'sl_mult': 5.0, 'td_mins': 120}. Best is trial 82 with value: 2.454517025102679.
[I 2026-03-12 01:12:27,075] Trial 961 pruned. 
[I 2026-03-12 01:12:27,130] Trial 962 finished with value: 0.0 and parameters: {'timeframe': 'M15', 'atr_period': 13, 'atr_threshold': 10.0, 'pt_mult': 1.0, 'sl_mult': 5.0, 'td_mins': 30}. Best is trial 82 with value: 2.454517025102679.
[I 2026-03-12 01:12:27,501] Trial 963 pruned. 
[I 2026-03-12 01:12:27,553] Trial 964 finished with value: 0.0 and parameters: {'timeframe': 'M15', 'atr_period': 13, 'atr_threshold': 15.0, 'pt_mult': 2.5, 'sl_mult': 5.0, 'td_mins': 60}. Best is trial 82 with value: 2.454517025102679.
[I 2026-03-12 01:12:27,843] Trial 965 finished with value: 2.454517025102679 and parameters: {'timeframe': 'M15', 'atr_period': 13, 'atr_threshold': 3.0, 'pt_mult': 0.5, 'sl_mult': 5.0, 'td_mins': 120}. Best is trial 82 with value: 2.454517025102679.
[I 2026-03-12 01:12:27,934] Trial 966 pruned. 
[I 2026-03-12 01:12:28,233] Trial 967 finished with value: 2.454517025102679 and parameters: {'timeframe': 'M15', 'atr_period': 13, 'atr_threshold': 3.0, 'pt_mult': 0.5, 'sl_mult': 5.0, 'td_mins': 120}. Best is trial 82 with value: 2.454517025102679.
[I 2026-03-12 01:12:28,519] Trial 968 finished with value: 2.454517025102679 and parameters: {'timeframe': 'M15', 'atr_period': 13, 'atr_threshold': 3.0, 'pt_mult': 0.5, 'sl_mult': 5.0, 'td_mins': 120}. Best is trial 82 with value: 2.454517025102679.
[I 2026-03-12 01:12:28,791] Trial 969 finished with value: 2.454517025102679 and parameters: {'timeframe': 'M15', 'atr_period': 13, 'atr_threshold': 3.0, 'pt_mult': 0.5, 'sl_mult': 5.0, 'td_mins': 120}. Best is trial 82 with value: 2.454517025102679.
[I 2026-03-12 01:12:29,072] Trial 970 finished with value: 2.454517025102679 and parameters: {'timeframe': 'M15', 'atr_period': 13, 'atr_threshold': 3.0, 'pt_mult': 0.5, 'sl_mult': 5.0, 'td_mins': 120}. Best is trial 82 with value: 2.454517025102679.
[I 2026-03-12 01:12:29,254] Trial 971 pruned. 
[I 2026-03-12 01:12:29,577] Trial 972 finished with value: 2.454517025102679 and parameters: {'timeframe': 'M15', 'atr_period': 13, 'atr_threshold': 3.0, 'pt_mult': 0.5, 'sl_mult': 5.0, 'td_mins': 120}. Best is trial 82 with value: 2.454517025102679.
[I 2026-03-12 01:12:29,631] Trial 973 pruned. 
[I 2026-03-12 01:12:29,954] Trial 974 finished with value: 2.454517025102679 and parameters: {'timeframe': 'M15', 'atr_period': 13, 'atr_threshold': 3.0, 'pt_mult': 0.5, 'sl_mult': 5.0, 'td_mins': 120}. Best is trial 82 with value: 2.454517025102679.
[I 2026-03-12 01:12:30,049] Trial 975 pruned. 
[I 2026-03-12 01:12:30,344] Trial 976 pruned. 
[I 2026-03-12 01:12:30,439] Trial 977 pruned. 
[I 2026-03-12 01:12:30,740] Trial 978 finished with value: 2.454517025102679 and parameters: {'timeframe': 'M15', 'atr_period': 13, 'atr_threshold': 3.0, 'pt_mult': 0.5, 'sl_mult': 5.0, 'td_mins': 120}. Best is trial 82 with value: 2.454517025102679.
[I 2026-03-12 01:12:31,055] Trial 979 finished with value: 2.454517025102679 and parameters: {'timeframe': 'M15', 'atr_period': 13, 'atr_threshold': 3.0, 'pt_mult': 0.5, 'sl_mult': 5.0, 'td_mins': 120}. Best is trial 82 with value: 2.454517025102679.
[I 2026-03-12 01:12:31,366] Trial 980 finished with value: 2.454517025102679 and parameters: {'timeframe': 'M15', 'atr_period': 13, 'atr_threshold': 3.0, 'pt_mult': 0.5, 'sl_mult': 5.0, 'td_mins': 120}. Best is trial 82 with value: 2.454517025102679.
[I 2026-03-12 01:12:31,654] Trial 981 finished with value: 2.454517025102679 and parameters: {'timeframe': 'M15', 'atr_period': 13, 'atr_threshold': 3.0, 'pt_mult': 0.5, 'sl_mult': 5.0, 'td_mins': 120}. Best is trial 82 with value: 2.454517025102679.
[I 2026-03-12 01:12:31,738] Trial 982 pruned. 
[I 2026-03-12 01:12:31,792] Trial 983 finished with value: 0.0 and parameters: {'timeframe': 'M15', 'atr_period': 13, 'atr_threshold': 15.0, 'pt_mult': 0.5, 'sl_mult': 5.0, 'td_mins': 120}. Best is trial 82 with value: 2.454517025102679.
[I 2026-03-12 01:12:31,992] Trial 984 pruned. 
[I 2026-03-12 01:12:32,050] Trial 985 pruned. 
[I 2026-03-12 01:12:32,105] Trial 986 finished with value: 0.0 and parameters: {'timeframe': 'M15', 'atr_period': 13, 'atr_threshold': 10.0, 'pt_mult': 1.0, 'sl_mult': 2.5, 'td_mins': 120}. Best is trial 82 with value: 2.454517025102679.
[I 2026-03-12 01:12:32,392] Trial 987 finished with value: 2.454517025102679 and parameters: {'timeframe': 'M15', 'atr_period': 13, 'atr_threshold': 3.0, 'pt_mult': 0.5, 'sl_mult': 5.0, 'td_mins': 120}. Best is trial 82 with value: 2.454517025102679.
[I 2026-03-12 01:12:32,494] Trial 988 pruned. 
[I 2026-03-12 01:12:32,569] Trial 989 pruned. 
[I 2026-03-12 01:12:32,619] Trial 990 finished with value: 0.0 and parameters: {'timeframe': 'M15', 'atr_period': 13, 'atr_threshold': 10.0, 'pt_mult': 1.0, 'sl_mult': 0.5, 'td_mins': 1080}. Best is trial 82 with value: 2.454517025102679.
[I 2026-03-12 01:12:32,902] Trial 991 finished with value: 2.454517025102679 and parameters: {'timeframe': 'M15', 'atr_period': 13, 'atr_threshold': 3.0, 'pt_mult': 0.5, 'sl_mult': 5.0, 'td_mins': 120}. Best is trial 82 with value: 2.454517025102679.
[I 2026-03-12 01:12:33,319] Trial 992 pruned. 
[I 2026-03-12 01:12:33,377] Trial 993 pruned. 
[I 2026-03-12 01:12:33,583] Trial 994 pruned. 
[I 2026-03-12 01:12:33,700] Trial 995 pruned. 
[I 2026-03-12 01:12:33,753] Trial 996 pruned. 
[I 2026-03-12 01:12:34,045] Trial 997 finished with value: 2.454517025102679 and parameters: {'timeframe': 'M15', 'atr_period': 13, 'atr_threshold': 3.0, 'pt_mult': 0.5, 'sl_mult': 5.0, 'td_mins': 120}. Best is trial 82 with value: 2.454517025102679.
[I 2026-03-12 01:12:34,122] Trial 998 pruned. 
