[I 2026-03-12 02:03:32,033] Trial 397 finished with value: 1.4254510662859525 and parameters: {'timeframe': 'M15', 'atr_period': 13, 'atr_threshold': 3.0, 'pt_mult': 0.5, 'sl_mult': 2.5, 'td_mins': 120}. Best is trial 393 with value: 2.627710256873383.
[I 2026-03-12 02:03:32,299] Trial 398 finished with value: 2.627710256873383 and parameters: {'timeframe': 'M15', 'atr_period': 13, 'atr_threshold': 3.0, 'pt_mult': 0.5, 'sl_mult': 5.0, 'td_mins': 120}. Best is trial 393 with value: 2.627710256873383.
[I 2026-03-12 02:03:32,569] Trial 399 finished with value: 2.627710256873383 and parameters: {'timeframe': 'M15', 'atr_period': 13, 'atr_threshold': 3.0, 'pt_mult': 0.5, 'sl_mult': 5.0, 'td_mins': 120}. Best is trial 393 with value: 2.627710256873383.
[I 2026-03-12 02:03:32,851] Trial 400 finished with value: 2.627710256873383 and parameters: {'timeframe': 'M15', 'atr_period': 13, 'atr_threshold': 3.0, 'pt_mult': 0.5, 'sl_mult': 5.0, 'td_mins': 120}. Best is trial 393 with value: 2.627710256873383.
[I 2026-03-12 02:03:33,119] Trial 401 finished with value: 2.627710256873383 and parameters: {'timeframe': 'M15', 'atr_period': 13, 'atr_threshold': 3.0, 'pt_mult': 0.5, 'sl_mult': 5.0, 'td_mins': 120}. Best is trial 393 with value: 2.627710256873383.
[I 2026-03-12 02:03:33,428] Trial 402 finished with value: 2.627710256873383 and parameters: {'timeframe': 'M15', 'atr_period': 13, 'atr_threshold': 3.0, 'pt_mult': 0.5, 'sl_mult': 5.0, 'td_mins': 120}. Best is trial 393 with value: 2.627710256873383.
[I 2026-03-12 02:03:33,710] Trial 403 finished with value: 2.627710256873383 and parameters: {'timeframe': 'M15', 'atr_period': 13, 'atr_threshold': 3.0, 'pt_mult': 0.5, 'sl_mult': 5.0, 'td_mins': 120}. Best is trial 393 with value: 2.627710256873383.
[I 2026-03-12 02:03:33,986] Trial 404 finished with value: 2.627710256873383 and parameters: {'timeframe': 'M15', 'atr_period': 13, 'atr_threshold': 3.0, 'pt_mult': 0.5, 'sl_mult': 5.0, 'td_mins': 120}. Best is trial 393 with value: 2.627710256873383.
[I 2026-03-12 02:03:34,267] Trial 405 finished with value: 2.627710256873383 and parameters: {'timeframe': 'M15', 'atr_period': 13, 'atr_threshold': 3.0, 'pt_mult': 0.5, 'sl_mult': 5.0, 'td_mins': 120}. Best is trial 393 with value: 2.627710256873383.
[I 2026-03-12 02:03:34,542] Trial 406 finished with value: 2.627710256873383 and parameters: {'timeframe': 'M15', 'atr_period': 13, 'atr_threshold': 3.0, 'pt_mult': 0.5, 'sl_mult': 5.0, 'td_mins': 120}. Best is trial 393 with value: 2.627710256873383.
[I 2026-03-12 02:03:34,847] Trial 407 finished with value: 2.627710256873383 and parameters: {'timeframe': 'M15', 'atr_period': 13, 'atr_threshold': 3.0, 'pt_mult': 0.5, 'sl_mult': 5.0, 'td_mins': 120}. Best is trial 393 with value: 2.627710256873383.
[I 2026-03-12 02:03:35,148] Trial 408 finished with value: 2.627710256873383 and parameters: {'timeframe': 'M15', 'atr_period': 13, 'atr_threshold': 3.0, 'pt_mult': 0.5, 'sl_mult': 5.0, 'td_mins': 120}. Best is trial 393 with value: 2.627710256873383.
[I 2026-03-12 02:03:35,425] Trial 409 finished with value: 2.627710256873383 and parameters: {'timeframe': 'M15', 'atr_period': 13, 'atr_threshold': 3.0, 'pt_mult': 0.5, 'sl_mult': 5.0, 'td_mins': 120}. Best is trial 393 with value: 2.627710256873383.
[I 2026-03-12 02:03:35,718] Trial 410 finished with value: 2.627710256873383 and parameters: {'timeframe': 'M15', 'atr_period': 13, 'atr_threshold': 3.0, 'pt_mult': 0.5, 'sl_mult': 5.0, 'td_mins': 120}. Best is trial 393 with value: 2.627710256873383.
[I 2026-03-12 02:03:36,001] Trial 411 finished with value: 2.627710256873383 and parameters: {'timeframe': 'M15', 'atr_period': 13, 'atr_threshold': 3.0, 'pt_mult': 0.5, 'sl_mult': 5.0, 'td_mins': 120}. Best is trial 393 with value: 2.627710256873383.
[I 2026-03-12 02:03:36,276] Trial 412 finished with value: 2.627710256873383 and parameters: {'timeframe': 'M15', 'atr_period': 13, 'atr_threshold': 3.0, 'pt_mult': 0.5, 'sl_mult': 5.0, 'td_mins': 120}. Best is trial 393 with value: 2.627710256873383.
[I 2026-03-12 02:03:36,551] Trial 413 finished with value: 2.627710256873383 and parameters: {'timeframe': 'M15', 'atr_period': 13, 'atr_threshold': 3.0, 'pt_mult': 0.5, 'sl_mult': 5.0, 'td_mins': 120}. Best is trial 393 with value: 2.627710256873383.
[I 2026-03-12 02:03:36,817] Trial 414 finished with value: 2.627710256873383 and parameters: {'timeframe': 'M15', 'atr_period': 13, 'atr_threshold': 3.0, 'pt_mult': 0.5, 'sl_mult': 5.0, 'td_mins': 120}. Best is trial 393 with value: 2.627710256873383.
[I 2026-03-12 02:03:37,087] Trial 415 finished with value: 2.627710256873383 and parameters: {'timeframe': 'M15', 'atr_period': 13, 'atr_threshold': 3.0, 'pt_mult': 0.5, 'sl_mult': 5.0, 'td_mins': 120}. Best is trial 393 with value: 2.627710256873383.
[I 2026-03-12 02:03:37,356] Trial 416 finished with value: 2.627710256873383 and parameters: {'timeframe': 'M15', 'atr_period': 13, 'atr_threshold': 3.0, 'pt_mult': 0.5, 'sl_mult': 5.0, 'td_mins': 120}. Best is trial 393 with value: 2.627710256873383.
[I 2026-03-12 02:03:37,643] Trial 417 finished with value: 2.627710256873383 and parameters: {'timeframe': 'M15', 'atr_period': 13, 'atr_threshold': 3.0, 'pt_mult': 0.5, 'sl_mult': 5.0, 'td_mins': 120}. Best is trial 393 with value: 2.627710256873383.
[I 2026-03-12 02:03:37,913] Trial 418 finished with value: 2.627710256873383 and parameters: {'timeframe': 'M15', 'atr_period': 13, 'atr_threshold': 3.0, 'pt_mult': 0.5, 'sl_mult': 5.0, 'td_mins': 120}. Best is trial 393 with value: 2.627710256873383.
[I 2026-03-12 02:03:38,199] Trial 419 finished with value: 2.627710256873383 and parameters: {'timeframe': 'M15', 'atr_period': 13, 'atr_threshold': 3.0, 'pt_mult': 0.5, 'sl_mult': 5.0, 'td_mins': 120}. Best is trial 393 with value: 2.627710256873383.
[I 2026-03-12 02:03:38,481] Trial 420 finished with value: 2.627710256873383 and parameters: {'timeframe': 'M15', 'atr_period': 13, 'atr_threshold': 3.0, 'pt_mult': 0.5, 'sl_mult': 5.0, 'td_mins': 120}. Best is trial 393 with value: 2.627710256873383.
[I 2026-03-12 02:03:38,570] Trial 421 pruned. 
[I 2026-03-12 02:03:38,755] Trial 422 finished with value: 2.4190348657869114 and parameters: {'timeframe': 'M15', 'atr_period': 13, 'atr_threshold': 3.0, 'pt_mult': 0.5, 'sl_mult': 5.0, 'td_mins': 60}. Best is trial 393 with value: 2.627710256873383.
[I 2026-03-12 02:03:38,810] Trial 423 pruned. 
[I 2026-03-12 02:03:38,882] Trial 424 pruned. 
[I 2026-03-12 02:03:38,962] Trial 425 pruned. 
[I 2026-03-12 02:03:39,240] Trial 426 pruned. 
[I 2026-03-12 02:03:39,312] Trial 427 pruned. 
[I 2026-03-12 02:03:39,697] Trial 428 finished with value: 2.4490491384580553 and parameters: {'timeframe': 'M15', 'atr_period': 13, 'atr_threshold': 3.0, 'pt_mult': 0.5, 'sl_mult': 5.0, 'td_mins': 180}. Best is trial 393 with value: 2.627710256873383.
[I 2026-03-12 02:03:40,017] Trial 429 pruned. 
[I 2026-03-12 02:03:40,184] Trial 430 pruned. 
[I 2026-03-12 02:03:40,518] Trial 431 finished with value: 2.627710256873383 and parameters: {'timeframe': 'M15', 'atr_period': 13, 'atr_threshold': 3.0, 'pt_mult': 0.5, 'sl_mult': 5.0, 'td_mins': 120}. Best is trial 393 with value: 2.627710256873383.
[I 2026-03-12 02:03:40,848] Trial 432 finished with value: 2.627710256873383 and parameters: {'timeframe': 'M15', 'atr_period': 13, 'atr_threshold': 3.0, 'pt_mult': 0.5, 'sl_mult': 5.0, 'td_mins': 120}. Best is trial 393 with value: 2.627710256873383.
[I 2026-03-12 02:03:41,054] Trial 433 pruned. 
[I 2026-03-12 02:03:41,504] Trial 434 finished with value: 2.3274688702958795 and parameters: {'timeframe': 'M15', 'atr_period': 13, 'atr_threshold': 2.0, 'pt_mult': 0.5, 'sl_mult': 5.0, 'td_mins': 120}. Best is trial 393 with value: 2.627710256873383.
[I 2026-03-12 02:03:41,826] Trial 435 finished with value: 2.627710256873383 and parameters: {'timeframe': 'M15', 'atr_period': 13, 'atr_threshold': 3.0, 'pt_mult': 0.5, 'sl_mult': 5.0, 'td_mins': 120}. Best is trial 393 with value: 2.627710256873383.
[I 2026-03-12 02:03:42,135] Trial 436 finished with value: 2.627710256873383 and parameters: {'timeframe': 'M15', 'atr_period': 13, 'atr_threshold': 3.0, 'pt_mult': 0.5, 'sl_mult': 5.0, 'td_mins': 120}. Best is trial 393 with value: 2.627710256873383.
[I 2026-03-12 02:03:42,434] Trial 437 finished with value: 2.627710256873383 and parameters: {'timeframe': 'M15', 'atr_period': 13, 'atr_threshold': 3.0, 'pt_mult': 0.5, 'sl_mult': 5.0, 'td_mins': 120}. Best is trial 393 with value: 2.627710256873383.
[I 2026-03-12 02:03:42,754] Trial 438 finished with value: 2.1318723590746487 and parameters: {'timeframe': 'M15', 'atr_period': 13, 'atr_threshold': 3.0, 'pt_mult': 1.0, 'sl_mult': 5.0, 'td_mins': 120}. Best is trial 393 with value: 2.627710256873383.
[I 2026-03-12 02:03:43,064] Trial 439 finished with value: 2.627710256873383 and parameters: {'timeframe': 'M15', 'atr_period': 13, 'atr_threshold': 3.0, 'pt_mult': 0.5, 'sl_mult': 5.0, 'td_mins': 120}. Best is trial 393 with value: 2.627710256873383.
[I 2026-03-12 02:03:43,160] Trial 440 pruned. 
[I 2026-03-12 02:03:43,489] Trial 441 finished with value: 2.627710256873383 and parameters: {'timeframe': 'M15', 'atr_period': 13, 'atr_threshold': 3.0, 'pt_mult': 0.5, 'sl_mult': 5.0, 'td_mins': 120}. Best is trial 393 with value: 2.627710256873383.
[I 2026-03-12 02:03:43,539] Trial 442 finished with value: 0.0 and parameters: {'timeframe': 'M15', 'atr_period': 13, 'atr_threshold': 15.0, 'pt_mult': 0.5, 'sl_mult': 1.0, 'td_mins': 120}. Best is trial 393 with value: 2.627710256873383.
[I 2026-03-12 02:03:43,590] Trial 443 pruned. 
[I 2026-03-12 02:03:43,654] Trial 444 pruned. 
[I 2026-03-12 02:03:43,925] Trial 445 finished with value: 2.627710256873383 and parameters: {'timeframe': 'M15', 'atr_period': 13, 'atr_threshold': 3.0, 'pt_mult': 0.5, 'sl_mult': 5.0, 'td_mins': 120}. Best is trial 393 with value: 2.627710256873383.
[I 2026-03-12 02:03:44,211] Trial 446 finished with value: 2.627710256873383 and parameters: {'timeframe': 'M15', 'atr_period': 13, 'atr_threshold': 3.0, 'pt_mult': 0.5, 'sl_mult': 5.0, 'td_mins': 120}. Best is trial 393 with value: 2.627710256873383.
[I 2026-03-12 02:03:44,488] Trial 447 finished with value: 2.627710256873383 and parameters: {'timeframe': 'M15', 'atr_period': 13, 'atr_threshold': 3.0, 'pt_mult': 0.5, 'sl_mult': 5.0, 'td_mins': 120}. Best is trial 393 with value: 2.627710256873383.
[I 2026-03-12 02:03:44,770] Trial 448 finished with value: 2.627710256873383 and parameters: {'timeframe': 'M15', 'atr_period': 13, 'atr_threshold': 3.0, 'pt_mult': 0.5, 'sl_mult': 5.0, 'td_mins': 120}. Best is trial 393 with value: 2.627710256873383.
[I 2026-03-12 02:03:44,994] Trial 449 pruned. 
[I 2026-03-12 02:03:45,299] Trial 450 finished with value: 2.627710256873383 and parameters: {'timeframe': 'M15', 'atr_period': 13, 'atr_threshold': 3.0, 'pt_mult': 0.5, 'sl_mult': 5.0, 'td_mins': 120}. Best is trial 393 with value: 2.627710256873383.
[I 2026-03-12 02:03:45,350] Trial 451 pruned. 
[I 2026-03-12 02:03:45,458] Trial 452 pruned. 
[I 2026-03-12 02:03:45,733] Trial 453 finished with value: 2.627710256873383 and parameters: {'timeframe': 'M15', 'atr_period': 13, 'atr_threshold': 3.0, 'pt_mult': 0.5, 'sl_mult': 5.0, 'td_mins': 120}. Best is trial 393 with value: 2.627710256873383.
[I 2026-03-12 02:03:45,818] Trial 454 pruned. 
[I 2026-03-12 02:03:45,878] Trial 455 pruned. 
[I 2026-03-12 02:03:46,033] Trial 456 pruned. 
[I 2026-03-12 02:03:46,096] Trial 457 pruned. 
[I 2026-03-12 02:03:46,171] Trial 458 pruned. 
[I 2026-03-12 02:03:46,225] Trial 459 pruned. 
[I 2026-03-12 02:03:46,375] Trial 460 pruned. 
[I 2026-03-12 02:03:46,681] Trial 461 finished with value: 2.627710256873383 and parameters: {'timeframe': 'M15', 'atr_period': 13, 'atr_threshold': 3.0, 'pt_mult': 0.5, 'sl_mult': 5.0, 'td_mins': 120}. Best is trial 393 with value: 2.627710256873383.
[I 2026-03-12 02:03:46,934] Trial 462 finished with value: 2.2458594648250663 and parameters: {'timeframe': 'M15', 'atr_period': 13, 'atr_threshold': 2.0, 'pt_mult': 0.5, 'sl_mult': 5.0, 'td_mins': 60}. Best is trial 393 with value: 2.627710256873383.
[I 2026-03-12 02:03:47,117] Trial 463 pruned. 
[I 2026-03-12 02:03:47,164] Trial 464 finished with value: 0.0 and parameters: {'timeframe': 'M15', 'atr_period': 13, 'atr_threshold': 15.0, 'pt_mult': 0.5, 'sl_mult': 5.0, 'td_mins': 360}. Best is trial 393 with value: 2.627710256873383.
[I 2026-03-12 02:03:47,250] Trial 465 pruned. 
[I 2026-03-12 02:03:47,912] Trial 466 pruned. 
[I 2026-03-12 02:03:47,992] Trial 467 pruned. 
[I 2026-03-12 02:03:48,041] Trial 468 finished with value: 0.0 and parameters: {'timeframe': 'M15', 'atr_period': 13, 'atr_threshold': 15.0, 'pt_mult': 0.5, 'sl_mult': 5.0, 'td_mins': 60}. Best is trial 393 with value: 2.627710256873383.
[I 2026-03-12 02:03:48,311] Trial 469 finished with value: 2.627710256873383 and parameters: {'timeframe': 'M15', 'atr_period': 13, 'atr_threshold': 3.0, 'pt_mult': 0.5, 'sl_mult': 5.0, 'td_mins': 120}. Best is trial 393 with value: 2.627710256873383.
[I 2026-03-12 02:03:48,402] Trial 470 pruned. 
[I 2026-03-12 02:03:48,682] Trial 471 finished with value: 2.627710256873383 and parameters: {'timeframe': 'M15', 'atr_period': 13, 'atr_threshold': 3.0, 'pt_mult': 0.5, 'sl_mult': 5.0, 'td_mins': 120}. Best is trial 393 with value: 2.627710256873383.
[I 2026-03-12 02:03:48,751] Trial 472 pruned. 
[I 2026-03-12 02:03:49,066] Trial 473 finished with value: 2.627710256873383 and parameters: {'timeframe': 'M15', 'atr_period': 13, 'atr_threshold': 3.0, 'pt_mult': 0.5, 'sl_mult': 5.0, 'td_mins': 120}. Best is trial 393 with value: 2.627710256873383.
[I 2026-03-12 02:03:49,175] Trial 474 pruned. 
[I 2026-03-12 02:03:49,228] Trial 475 pruned. 
[I 2026-03-12 02:03:50,334] Trial 476 finished with value: 1.7384158806022785 and parameters: {'timeframe': 'M15', 'atr_period': 13, 'atr_threshold': 2.0, 'pt_mult': 0.5, 'sl_mult': 5.0, 'td_mins': 360}. Best is trial 393 with value: 2.627710256873383.
[I 2026-03-12 02:03:50,448] Trial 477 pruned. 
[I 2026-03-12 02:03:50,513] Trial 478 pruned. 
[I 2026-03-12 02:03:50,599] Trial 479 pruned. 
[I 2026-03-12 02:03:50,864] Trial 480 finished with value: 2.627710256873383 and parameters: {'timeframe': 'M15', 'atr_period': 13, 'atr_threshold': 3.0, 'pt_mult': 0.5, 'sl_mult': 5.0, 'td_mins': 120}. Best is trial 393 with value: 2.627710256873383.
[I 2026-03-12 02:03:50,972] Trial 481 pruned. 
[I 2026-03-12 02:03:51,158] Trial 482 pruned. 
[I 2026-03-12 02:03:51,467] Trial 483 pruned. 
[I 2026-03-12 02:03:51,518] Trial 484 finished with value: 0.0 and parameters: {'timeframe': 'M15', 'atr_period': 13, 'atr_threshold': 10.0, 'pt_mult': 0.5, 'sl_mult': 5.0, 'td_mins': 720}. Best is trial 393 with value: 2.627710256873383.
[I 2026-03-12 02:03:51,576] Trial 485 finished with value: 0.0 and parameters: {'timeframe': 'M15', 'atr_period': 13, 'atr_threshold': 10.0, 'pt_mult': 5.0, 'sl_mult': 5.0, 'td_mins': 120}. Best is trial 393 with value: 2.627710256873383.
[I 2026-03-12 02:03:51,789] Trial 486 pruned. 
[I 2026-03-12 02:03:51,855] Trial 487 pruned. 
[I 2026-03-12 02:03:51,911] Trial 488 finished with value: 0.0 and parameters: {'timeframe': 'M15', 'atr_period': 13, 'atr_threshold': 15.0, 'pt_mult': 2.5, 'sl_mult': 5.0, 'td_mins': 120}. Best is trial 393 with value: 2.627710256873383.
[I 2026-03-12 02:03:51,984] Trial 489 pruned. 
[I 2026-03-12 02:03:52,391] Trial 490 pruned. 
[I 2026-03-12 02:03:52,455] Trial 491 pruned. 
[I 2026-03-12 02:03:52,579] Trial 492 pruned. 
[I 2026-03-12 02:03:52,629] Trial 493 finished with value: 0.0 and parameters: {'timeframe': 'M15', 'atr_period': 13, 'atr_threshold': 10.0, 'pt_mult': 0.5, 'sl_mult': 5.0, 'td_mins': 180}. Best is trial 393 with value: 2.627710256873383.
[I 2026-03-12 02:03:52,702] Trial 494 pruned. 
[I 2026-03-12 02:03:52,766] Trial 495 pruned. 
[I 2026-03-12 02:03:52,813] Trial 496 finished with value: 0.0 and parameters: {'timeframe': 'M15', 'atr_period': 13, 'atr_threshold': 10.0, 'pt_mult': 2.5, 'sl_mult': 5.0, 'td_mins': 120}. Best is trial 393 with value: 2.627710256873383.
[I 2026-03-12 02:03:52,860] Trial 497 finished with value: 0.0 and parameters: {'timeframe': 'M15', 'atr_period': 13, 'atr_threshold': 15.0, 'pt_mult': 0.5, 'sl_mult': 2.5, 'td_mins': 120}. Best is trial 393 with value: 2.627710256873383.
[I 2026-03-12 02:03:52,907] Trial 498 pruned. 
[I 2026-03-12 02:03:52,956] Trial 499 pruned. 
[I 2026-03-12 02:03:53,947] Trial 500 pruned. 
[I 2026-03-12 02:03:54,020] Trial 501 pruned. 
[I 2026-03-12 02:03:54,477] Trial 502 pruned. 
[I 2026-03-12 02:03:54,768] Trial 503 finished with value: 2.627710256873383 and parameters: {'timeframe': 'M15', 'atr_period': 13, 'atr_threshold': 3.0, 'pt_mult': 0.5, 'sl_mult': 5.0, 'td_mins': 120}. Best is trial 393 with value: 2.627710256873383.
[I 2026-03-12 02:03:55,508] Trial 504 pruned. 
[I 2026-03-12 02:03:55,782] Trial 505 finished with value: 2.627710256873383 and parameters: {'timeframe': 'M15', 'atr_period': 13, 'atr_threshold': 3.0, 'pt_mult': 0.5, 'sl_mult': 5.0, 'td_mins': 120}. Best is trial 393 with value: 2.627710256873383.
[I 2026-03-12 02:03:56,131] Trial 506 pruned. 
[I 2026-03-12 02:03:56,412] Trial 507 finished with value: 2.627710256873383 and parameters: {'timeframe': 'M15', 'atr_period': 13, 'atr_threshold': 3.0, 'pt_mult': 0.5, 'sl_mult': 5.0, 'td_mins': 120}. Best is trial 393 with value: 2.627710256873383.
[I 2026-03-12 02:03:56,489] Trial 508 pruned. 
[I 2026-03-12 02:03:56,764] Trial 509 finished with value: 2.627710256873383 and parameters: {'timeframe': 'M15', 'atr_period': 13, 'atr_threshold': 3.0, 'pt_mult': 0.5, 'sl_mult': 5.0, 'td_mins': 120}. Best is trial 393 with value: 2.627710256873383.
[I 2026-03-12 02:03:56,813] Trial 510 pruned. 
[I 2026-03-12 02:03:57,088] Trial 511 finished with value: 2.627710256873383 and parameters: {'timeframe': 'M15', 'atr_period': 13, 'atr_threshold': 3.0, 'pt_mult': 0.5, 'sl_mult': 5.0, 'td_mins': 120}. Best is trial 393 with value: 2.627710256873383.
[I 2026-03-12 02:03:57,139] Trial 512 pruned. 
[I 2026-03-12 02:03:57,343] Trial 513 pruned. 
[I 2026-03-12 02:03:57,392] Trial 514 pruned. 
[I 2026-03-12 02:03:57,665] Trial 515 finished with value: 2.627710256873383 and parameters: {'timeframe': 'M15', 'atr_period': 13, 'atr_threshold': 3.0, 'pt_mult': 0.5, 'sl_mult': 5.0, 'td_mins': 120}. Best is trial 393 with value: 2.627710256873383.
[I 2026-03-12 02:03:57,871] Trial 516 pruned. 
[I 2026-03-12 02:03:58,142] Trial 517 finished with value: 2.627710256873383 and parameters: {'timeframe': 'M15', 'atr_period': 13, 'atr_threshold': 3.0, 'pt_mult': 0.5, 'sl_mult': 5.0, 'td_mins': 120}. Best is trial 393 with value: 2.627710256873383.
[I 2026-03-12 02:03:58,417] Trial 518 finished with value: 2.627710256873383 and parameters: {'timeframe': 'M15', 'atr_period': 13, 'atr_threshold': 3.0, 'pt_mult': 0.5, 'sl_mult': 5.0, 'td_mins': 120}. Best is trial 393 with value: 2.627710256873383.
[I 2026-03-12 02:03:58,663] Trial 519 pruned. 
[I 2026-03-12 02:03:58,721] Trial 520 pruned. 
[I 2026-03-12 02:03:59,013] Trial 521 finished with value: 2.627710256873383 and parameters: {'timeframe': 'M15', 'atr_period': 13, 'atr_threshold': 3.0, 'pt_mult': 0.5, 'sl_mult': 5.0, 'td_mins': 120}. Best is trial 393 with value: 2.627710256873383.
[I 2026-03-12 02:03:59,908] Trial 522 pruned. 
[I 2026-03-12 02:03:59,990] Trial 523 pruned. 
[I 2026-03-12 02:04:00,223] Trial 524 finished with value: 2.4190348657869114 and parameters: {'timeframe': 'M15', 'atr_period': 13, 'atr_threshold': 3.0, 'pt_mult': 0.5, 'sl_mult': 5.0, 'td_mins': 60}. Best is trial 393 with value: 2.627710256873383.
[I 2026-03-12 02:04:00,272] Trial 525 finished with value: 0.0 and parameters: {'timeframe': 'M15', 'atr_period': 13, 'atr_threshold': 15.0, 'pt_mult': 0.5, 'sl_mult': 0.5, 'td_mins': 120}. Best is trial 393 with value: 2.627710256873383.
[I 2026-03-12 02:04:00,354] Trial 526 pruned. 
[I 2026-03-12 02:04:00,441] Trial 527 pruned. 
[I 2026-03-12 02:04:00,502] Trial 528 pruned. 
[I 2026-03-12 02:04:00,578] Trial 529 pruned. 
[I 2026-03-12 02:04:00,649] Trial 530 pruned. 
[I 2026-03-12 02:04:00,703] Trial 531 pruned. 
[I 2026-03-12 02:04:00,897] Trial 532 pruned. 
[I 2026-03-12 02:04:00,946] Trial 533 finished with value: 0.0 and parameters: {'timeframe': 'M15', 'atr_period': 13, 'atr_threshold': 15.0, 'pt_mult': 0.5, 'sl_mult': 5.0, 'td_mins': 120}. Best is trial 393 with value: 2.627710256873383.
[I 2026-03-12 02:04:00,993] Trial 534 finished with value: 0.0 and parameters: {'timeframe': 'M15', 'atr_period': 13, 'atr_threshold': 10.0, 'pt_mult': 0.5, 'sl_mult': 5.0, 'td_mins': 360}. Best is trial 393 with value: 2.627710256873383.
[I 2026-03-12 02:04:01,272] Trial 535 pruned. 
[I 2026-03-12 02:04:01,355] Trial 536 pruned. 
[I 2026-03-12 02:04:01,435] Trial 537 pruned. 
[I 2026-03-12 02:04:01,799] Trial 538 finished with value: 2.4490491384580553 and parameters: {'timeframe': 'M15', 'atr_period': 13, 'atr_threshold': 3.0, 'pt_mult': 0.5, 'sl_mult': 5.0, 'td_mins': 180}. Best is trial 393 with value: 2.627710256873383.
[I 2026-03-12 02:04:01,858] Trial 539 finished with value: 0.0 and parameters: {'timeframe': 'M15', 'atr_period': 13, 'atr_threshold': 10.0, 'pt_mult': 0.5, 'sl_mult': 5.0, 'td_mins': 120}. Best is trial 393 with value: 2.627710256873383.
[I 2026-03-12 02:04:02,011] Trial 540 pruned. 
[I 2026-03-12 02:04:02,147] Trial 541 pruned. 
[I 2026-03-12 02:04:02,207] Trial 542 pruned. 
[I 2026-03-12 02:04:02,462] Trial 543 pruned. 
[I 2026-03-12 02:04:02,515] Trial 544 pruned. 
[I 2026-03-12 02:04:02,669] Trial 545 pruned. 
[I 2026-03-12 02:04:02,749] Trial 546 pruned. 
[I 2026-03-12 02:04:03,012] Trial 547 finished with value: 2.627710256873383 and parameters: {'timeframe': 'M15', 'atr_period': 13, 'atr_threshold': 3.0, 'pt_mult': 0.5, 'sl_mult': 5.0, 'td_mins': 120}. Best is trial 393 with value: 2.627710256873383.
