[I 2026-03-12 01:56:07,521] Trial 487 finished with value: 0.0 and parameters: {'timeframe': 'M8', 'atr_period': 13, 'atr_threshold': 15.0, 'pt_mult': 0.5, 'sl_mult': 0.5, 'td_mins': 120}. Best is trial 398 with value: 3.484125427035651.
[I 2026-03-12 01:56:08,204] Trial 488 pruned. 
[I 2026-03-12 01:56:08,250] Trial 489 finished with value: 0.0 and parameters: {'timeframe': 'M8', 'atr_period': 13, 'atr_threshold': 10.0, 'pt_mult': 5.0, 'sl_mult': 5.0, 'td_mins': 120}. Best is trial 398 with value: 3.484125427035651.
[I 2026-03-12 01:56:08,582] Trial 490 pruned. 
[I 2026-03-12 01:56:08,688] Trial 491 finished with value: 3.484125427035651 and parameters: {'timeframe': 'M8', 'atr_period': 13, 'atr_threshold': 5.0, 'pt_mult': 0.5, 'sl_mult': 5.0, 'td_mins': 120}. Best is trial 398 with value: 3.484125427035651.
[I 2026-03-12 01:56:08,739] Trial 492 finished with value: 0.0 and parameters: {'timeframe': 'M8', 'atr_period': 13, 'atr_threshold': 10.0, 'pt_mult': 0.5, 'sl_mult': 5.0, 'td_mins': 15}. Best is trial 398 with value: 3.484125427035651.
[I 2026-03-12 01:56:08,789] Trial 493 finished with value: 0.0 and parameters: {'timeframe': 'M8', 'atr_period': 13, 'atr_threshold': 10.0, 'pt_mult': 0.5, 'sl_mult': 5.0, 'td_mins': 180}. Best is trial 398 with value: 3.484125427035651.
[I 2026-03-12 01:56:08,841] Trial 494 pruned. 
[I 2026-03-12 01:56:08,973] Trial 495 finished with value: 2.85002292450261 and parameters: {'timeframe': 'M8', 'atr_period': 13, 'atr_threshold': 5.0, 'pt_mult': 0.5, 'sl_mult': 5.0, 'td_mins': 180}. Best is trial 398 with value: 3.484125427035651.
[I 2026-03-12 01:56:09,023] Trial 496 pruned. 
[I 2026-03-12 01:56:09,134] Trial 497 finished with value: 3.484125427035651 and parameters: {'timeframe': 'M8', 'atr_period': 13, 'atr_threshold': 5.0, 'pt_mult': 0.5, 'sl_mult': 5.0, 'td_mins': 120}. Best is trial 398 with value: 3.484125427035651.
[I 2026-03-12 01:56:09,467] Trial 498 pruned. 
[I 2026-03-12 01:56:09,514] Trial 499 finished with value: 0.0 and parameters: {'timeframe': 'M8', 'atr_period': 13, 'atr_threshold': 10.0, 'pt_mult': 0.5, 'sl_mult': 5.0, 'td_mins': 360}. Best is trial 398 with value: 3.484125427035651.
[I 2026-03-12 01:56:09,577] Trial 500 pruned. 
[I 2026-03-12 01:56:09,625] Trial 501 finished with value: 0.0 and parameters: {'timeframe': 'M8', 'atr_period': 13, 'atr_threshold': 10.0, 'pt_mult': 1.0, 'sl_mult': 5.0, 'td_mins': 120}. Best is trial 398 with value: 3.484125427035651.
[I 2026-03-12 01:56:09,680] Trial 502 pruned. 
[I 2026-03-12 01:56:10,282] Trial 503 pruned. 
[I 2026-03-12 01:56:10,329] Trial 504 finished with value: 0.0 and parameters: {'timeframe': 'M8', 'atr_period': 13, 'atr_threshold': 15.0, 'pt_mult': 0.5, 'sl_mult': 5.0, 'td_mins': 720}. Best is trial 398 with value: 3.484125427035651.
[I 2026-03-12 01:56:10,385] Trial 505 finished with value: 0.0 and parameters: {'timeframe': 'M8', 'atr_period': 13, 'atr_threshold': 10.0, 'pt_mult': 0.5, 'sl_mult': 0.5, 'td_mins': 120}. Best is trial 398 with value: 3.484125427035651.
[I 2026-03-12 01:56:10,807] Trial 506 pruned. 
[I 2026-03-12 01:56:10,856] Trial 507 pruned. 
[I 2026-03-12 01:56:11,327] Trial 508 finished with value: 1.439251928643071 and parameters: {'timeframe': 'M8', 'atr_period': 13, 'atr_threshold': 5.0, 'pt_mult': 5.0, 'sl_mult': 5.0, 'td_mins': 720}. Best is trial 398 with value: 3.484125427035651.
[I 2026-03-12 01:56:11,441] Trial 509 finished with value: 3.484125427035651 and parameters: {'timeframe': 'M8', 'atr_period': 13, 'atr_threshold': 5.0, 'pt_mult': 0.5, 'sl_mult': 5.0, 'td_mins': 120}. Best is trial 398 with value: 3.484125427035651.
[I 2026-03-12 01:56:11,549] Trial 510 finished with value: 3.484125427035651 and parameters: {'timeframe': 'M8', 'atr_period': 13, 'atr_threshold': 5.0, 'pt_mult': 0.5, 'sl_mult': 5.0, 'td_mins': 120}. Best is trial 398 with value: 3.484125427035651.
[I 2026-03-12 01:56:11,660] Trial 511 finished with value: 3.484125427035651 and parameters: {'timeframe': 'M8', 'atr_period': 13, 'atr_threshold': 5.0, 'pt_mult': 0.5, 'sl_mult': 5.0, 'td_mins': 120}. Best is trial 398 with value: 3.484125427035651.
[I 2026-03-12 01:56:11,720] Trial 512 pruned. 
[I 2026-03-12 01:56:11,780] Trial 513 finished with value: 0.0 and parameters: {'timeframe': 'M8', 'atr_period': 13, 'atr_threshold': 8.0, 'pt_mult': 0.5, 'sl_mult': 1.0, 'td_mins': 120}. Best is trial 398 with value: 3.484125427035651.
[I 2026-03-12 01:56:11,907] Trial 514 finished with value: 3.484125427035651 and parameters: {'timeframe': 'M8', 'atr_period': 13, 'atr_threshold': 5.0, 'pt_mult': 0.5, 'sl_mult': 5.0, 'td_mins': 120}. Best is trial 398 with value: 3.484125427035651.
[I 2026-03-12 01:56:11,962] Trial 515 finished with value: 0.0 and parameters: {'timeframe': 'M8', 'atr_period': 13, 'atr_threshold': 8.0, 'pt_mult': 0.5, 'sl_mult': 5.0, 'td_mins': 360}. Best is trial 398 with value: 3.484125427035651.
[I 2026-03-12 01:56:12,044] Trial 516 finished with value: 0.0 and parameters: {'timeframe': 'M8', 'atr_period': 13, 'atr_threshold': 10.0, 'pt_mult': 0.5, 'sl_mult': 2.5, 'td_mins': 120}. Best is trial 398 with value: 3.484125427035651.
[I 2026-03-12 01:56:12,211] Trial 517 pruned. 
[I 2026-03-12 01:56:12,320] Trial 518 finished with value: 3.484125427035651 and parameters: {'timeframe': 'M8', 'atr_period': 13, 'atr_threshold': 5.0, 'pt_mult': 0.5, 'sl_mult': 5.0, 'td_mins': 120}. Best is trial 398 with value: 3.484125427035651.
[I 2026-03-12 01:56:12,428] Trial 519 finished with value: 3.484125427035651 and parameters: {'timeframe': 'M8', 'atr_period': 13, 'atr_threshold': 5.0, 'pt_mult': 0.5, 'sl_mult': 5.0, 'td_mins': 120}. Best is trial 398 with value: 3.484125427035651.
[I 2026-03-12 01:56:12,543] Trial 520 finished with value: 3.484125427035651 and parameters: {'timeframe': 'M8', 'atr_period': 13, 'atr_threshold': 5.0, 'pt_mult': 0.5, 'sl_mult': 5.0, 'td_mins': 120}. Best is trial 398 with value: 3.484125427035651.
[I 2026-03-12 01:56:12,592] Trial 521 pruned. 
[I 2026-03-12 01:56:12,864] Trial 522 finished with value: 2.5123680363096774 and parameters: {'timeframe': 'M8', 'atr_period': 13, 'atr_threshold': 3.0, 'pt_mult': 0.5, 'sl_mult': 5.0, 'td_mins': 120}. Best is trial 398 with value: 3.484125427035651.
[I 2026-03-12 01:56:12,987] Trial 523 pruned. 
[I 2026-03-12 01:56:13,252] Trial 524 pruned. 
[I 2026-03-12 01:56:13,305] Trial 525 pruned. 
[I 2026-03-12 01:56:13,418] Trial 526 finished with value: 3.484125427035651 and parameters: {'timeframe': 'M8', 'atr_period': 13, 'atr_threshold': 5.0, 'pt_mult': 0.5, 'sl_mult': 5.0, 'td_mins': 120}. Best is trial 398 with value: 3.484125427035651.
[I 2026-03-12 01:56:13,465] Trial 527 finished with value: 0.0 and parameters: {'timeframe': 'M8', 'atr_period': 13, 'atr_threshold': 15.0, 'pt_mult': 0.5, 'sl_mult': 5.0, 'td_mins': 180}. Best is trial 398 with value: 3.484125427035651.
[I 2026-03-12 01:56:13,514] Trial 528 pruned. 
[I 2026-03-12 01:56:13,622] Trial 529 finished with value: 3.484125427035651 and parameters: {'timeframe': 'M8', 'atr_period': 13, 'atr_threshold': 5.0, 'pt_mult': 0.5, 'sl_mult': 5.0, 'td_mins': 120}. Best is trial 398 with value: 3.484125427035651.
[I 2026-03-12 01:56:13,673] Trial 530 finished with value: 0.0 and parameters: {'timeframe': 'M8', 'atr_period': 13, 'atr_threshold': 10.0, 'pt_mult': 0.5, 'sl_mult': 5.0, 'td_mins': 120}. Best is trial 398 with value: 3.484125427035651.
[I 2026-03-12 01:56:13,726] Trial 531 pruned. 
[I 2026-03-12 01:56:13,785] Trial 532 pruned. 
[I 2026-03-12 01:56:13,836] Trial 533 pruned. 
[I 2026-03-12 01:56:13,949] Trial 534 finished with value: 3.484125427035651 and parameters: {'timeframe': 'M8', 'atr_period': 13, 'atr_threshold': 5.0, 'pt_mult': 0.5, 'sl_mult': 5.0, 'td_mins': 120}. Best is trial 398 with value: 3.484125427035651.
[I 2026-03-12 01:56:13,999] Trial 535 finished with value: 0.0 and parameters: {'timeframe': 'M8', 'atr_period': 13, 'atr_threshold': 15.0, 'pt_mult': 0.5, 'sl_mult': 5.0, 'td_mins': 15}. Best is trial 398 with value: 3.484125427035651.
[I 2026-03-12 01:56:14,046] Trial 536 finished with value: 0.0 and parameters: {'timeframe': 'M8', 'atr_period': 13, 'atr_threshold': 15.0, 'pt_mult': 0.5, 'sl_mult': 5.0, 'td_mins': 120}. Best is trial 398 with value: 3.484125427035651.
[I 2026-03-12 01:56:14,095] Trial 537 pruned. 
[I 2026-03-12 01:56:14,172] Trial 538 pruned. 
[I 2026-03-12 01:56:14,314] Trial 539 pruned. 
[I 2026-03-12 01:56:14,665] Trial 540 pruned. 
[I 2026-03-12 01:56:14,784] Trial 541 finished with value: 1.8479405007566938 and parameters: {'timeframe': 'M8', 'atr_period': 13, 'atr_threshold': 5.0, 'pt_mult': 2.5, 'sl_mult': 5.0, 'td_mins': 120}. Best is trial 398 with value: 3.484125427035651.
[I 2026-03-12 01:56:14,839] Trial 542 pruned. 
[I 2026-03-12 01:56:14,889] Trial 543 finished with value: 0.0 and parameters: {'timeframe': 'M8', 'atr_period': 13, 'atr_threshold': 8.0, 'pt_mult': 0.5, 'sl_mult': 5.0, 'td_mins': 5}. Best is trial 398 with value: 3.484125427035651.
[I 2026-03-12 01:56:15,140] Trial 544 pruned. 
[I 2026-03-12 01:56:15,195] Trial 545 finished with value: 0.0 and parameters: {'timeframe': 'M8', 'atr_period': 13, 'atr_threshold': 8.0, 'pt_mult': 0.5, 'sl_mult': 5.0, 'td_mins': 1200}. Best is trial 398 with value: 3.484125427035651.
[I 2026-03-12 01:56:15,366] Trial 546 pruned. 
[I 2026-03-12 01:56:15,416] Trial 547 finished with value: 0.0 and parameters: {'timeframe': 'M8', 'atr_period': 13, 'atr_threshold': 10.0, 'pt_mult': 2.5, 'sl_mult': 5.0, 'td_mins': 120}. Best is trial 398 with value: 3.484125427035651.
[I 2026-03-12 01:56:15,469] Trial 548 pruned. 
[I 2026-03-12 01:56:15,542] Trial 549 finished with value: 2.4896042006737558 and parameters: {'timeframe': 'M8', 'atr_period': 13, 'atr_threshold': 5.0, 'pt_mult': 0.5, 'sl_mult': 5.0, 'td_mins': 30}. Best is trial 398 with value: 3.484125427035651.
[I 2026-03-12 01:56:15,937] Trial 550 pruned. 
[I 2026-03-12 01:56:15,986] Trial 551 finished with value: 0.0 and parameters: {'timeframe': 'M8', 'atr_period': 13, 'atr_threshold': 15.0, 'pt_mult': 0.5, 'sl_mult': 5.0, 'td_mins': 1200}. Best is trial 398 with value: 3.484125427035651.
[I 2026-03-12 01:56:16,121] Trial 552 pruned. 
[I 2026-03-12 01:56:16,569] Trial 553 pruned. 
[I 2026-03-12 01:56:16,830] Trial 554 pruned. 
[I 2026-03-12 01:56:16,883] Trial 555 finished with value: 0.0 and parameters: {'timeframe': 'M8', 'atr_period': 13, 'atr_threshold': 8.0, 'pt_mult': 0.5, 'sl_mult': 5.0, 'td_mins': 120}. Best is trial 398 with value: 3.484125427035651.
[I 2026-03-12 01:56:17,017] Trial 556 finished with value: 3.484125427035651 and parameters: {'timeframe': 'M8', 'atr_period': 13, 'atr_threshold': 5.0, 'pt_mult': 0.5, 'sl_mult': 5.0, 'td_mins': 120}. Best is trial 398 with value: 3.484125427035651.
[I 2026-03-12 01:56:17,137] Trial 557 finished with value: 3.484125427035651 and parameters: {'timeframe': 'M8', 'atr_period': 13, 'atr_threshold': 5.0, 'pt_mult': 0.5, 'sl_mult': 5.0, 'td_mins': 120}. Best is trial 398 with value: 3.484125427035651.
[I 2026-03-12 01:56:17,190] Trial 558 finished with value: 0.0 and parameters: {'timeframe': 'M8', 'atr_period': 13, 'atr_threshold': 15.0, 'pt_mult': 0.5, 'sl_mult': 1.0, 'td_mins': 120}. Best is trial 398 with value: 3.484125427035651.
[I 2026-03-12 01:56:17,309] Trial 559 finished with value: 3.484125427035651 and parameters: {'timeframe': 'M8', 'atr_period': 13, 'atr_threshold': 5.0, 'pt_mult': 0.5, 'sl_mult': 5.0, 'td_mins': 120}. Best is trial 398 with value: 3.484125427035651.
[I 2026-03-12 01:56:17,358] Trial 560 pruned. 
[I 2026-03-12 01:56:17,404] Trial 561 finished with value: 0.0 and parameters: {'timeframe': 'M8', 'atr_period': 13, 'atr_threshold': 8.0, 'pt_mult': 0.5, 'sl_mult': 5.0, 'td_mins': 30}. Best is trial 398 with value: 3.484125427035651.
[I 2026-03-12 01:56:18,630] Trial 562 pruned. 
[I 2026-03-12 01:56:18,750] Trial 563 finished with value: 2.7985173655325846 and parameters: {'timeframe': 'M8', 'atr_period': 13, 'atr_threshold': 5.0, 'pt_mult': 1.0, 'sl_mult': 5.0, 'td_mins': 120}. Best is trial 398 with value: 3.484125427035651.
[I 2026-03-12 01:56:18,914] Trial 564 pruned. 
[I 2026-03-12 01:56:19,244] Trial 565 finished with value: 1.5146017913734133 and parameters: {'timeframe': 'M8', 'atr_period': 13, 'atr_threshold': 5.0, 'pt_mult': 0.5, 'sl_mult': 5.0, 'td_mins': 720}. Best is trial 398 with value: 3.484125427035651.
[I 2026-03-12 01:56:19,405] Trial 566 finished with value: 3.484125427035651 and parameters: {'timeframe': 'M8', 'atr_period': 13, 'atr_threshold': 5.0, 'pt_mult': 0.5, 'sl_mult': 5.0, 'td_mins': 120}. Best is trial 398 with value: 3.484125427035651.
[I 2026-03-12 01:56:19,509] Trial 567 finished with value: 3.484125427035651 and parameters: {'timeframe': 'M8', 'atr_period': 13, 'atr_threshold': 5.0, 'pt_mult': 0.5, 'sl_mult': 5.0, 'td_mins': 120}. Best is trial 398 with value: 3.484125427035651.
[I 2026-03-12 01:56:19,560] Trial 568 pruned. 
[I 2026-03-12 01:56:19,703] Trial 569 finished with value: 3.484125427035651 and parameters: {'timeframe': 'M8', 'atr_period': 13, 'atr_threshold': 5.0, 'pt_mult': 0.5, 'sl_mult': 5.0, 'td_mins': 120}. Best is trial 398 with value: 3.484125427035651.
[I 2026-03-12 01:56:19,821] Trial 570 finished with value: 3.484125427035651 and parameters: {'timeframe': 'M8', 'atr_period': 13, 'atr_threshold': 5.0, 'pt_mult': 0.5, 'sl_mult': 5.0, 'td_mins': 120}. Best is trial 398 with value: 3.484125427035651.
[I 2026-03-12 01:56:19,992] Trial 571 pruned. 
[I 2026-03-12 01:56:20,100] Trial 572 finished with value: 3.484125427035651 and parameters: {'timeframe': 'M8', 'atr_period': 13, 'atr_threshold': 5.0, 'pt_mult': 0.5, 'sl_mult': 5.0, 'td_mins': 120}. Best is trial 398 with value: 3.484125427035651.
[I 2026-03-12 01:56:20,212] Trial 573 finished with value: 3.484125427035651 and parameters: {'timeframe': 'M8', 'atr_period': 13, 'atr_threshold': 5.0, 'pt_mult': 0.5, 'sl_mult': 5.0, 'td_mins': 120}. Best is trial 398 with value: 3.484125427035651.
[I 2026-03-12 01:56:20,653] Trial 574 pruned. 
[I 2026-03-12 01:56:20,700] Trial 575 pruned. 
[I 2026-03-12 01:56:20,810] Trial 576 finished with value: 3.484125427035651 and parameters: {'timeframe': 'M8', 'atr_period': 13, 'atr_threshold': 5.0, 'pt_mult': 0.5, 'sl_mult': 5.0, 'td_mins': 120}. Best is trial 398 with value: 3.484125427035651.
[I 2026-03-12 01:56:21,546] Trial 577 pruned. 
[I 2026-03-12 01:56:21,659] Trial 578 finished with value: 3.484125427035651 and parameters: {'timeframe': 'M8', 'atr_period': 13, 'atr_threshold': 5.0, 'pt_mult': 0.5, 'sl_mult': 5.0, 'td_mins': 120}. Best is trial 398 with value: 3.484125427035651.
[I 2026-03-12 01:56:21,714] Trial 579 finished with value: 0.0 and parameters: {'timeframe': 'M8', 'atr_period': 13, 'atr_threshold': 15.0, 'pt_mult': 2.5, 'sl_mult': 0.5, 'td_mins': 30}. Best is trial 398 with value: 3.484125427035651.
[I 2026-03-12 01:56:21,946] Trial 580 finished with value: 1.4967331369168109 and parameters: {'timeframe': 'M8', 'atr_period': 13, 'atr_threshold': 5.0, 'pt_mult': 0.5, 'sl_mult': 5.0, 'td_mins': 360}. Best is trial 398 with value: 3.484125427035651.
[I 2026-03-12 01:56:22,000] Trial 581 finished with value: 0.0 and parameters: {'timeframe': 'M8', 'atr_period': 13, 'atr_threshold': 10.0, 'pt_mult': 0.5, 'sl_mult': 5.0, 'td_mins': 1200}. Best is trial 398 with value: 3.484125427035651.
[I 2026-03-12 01:56:22,379] Trial 582 pruned. 
[I 2026-03-12 01:56:22,493] Trial 583 finished with value: 3.484125427035651 and parameters: {'timeframe': 'M8', 'atr_period': 13, 'atr_threshold': 5.0, 'pt_mult': 0.5, 'sl_mult': 5.0, 'td_mins': 120}. Best is trial 398 with value: 3.484125427035651.
[I 2026-03-12 01:56:22,605] Trial 584 finished with value: 3.484125427035651 and parameters: {'timeframe': 'M8', 'atr_period': 13, 'atr_threshold': 5.0, 'pt_mult': 0.5, 'sl_mult': 5.0, 'td_mins': 120}. Best is trial 398 with value: 3.484125427035651.
[I 2026-03-12 01:56:22,850] Trial 585 pruned. 
[I 2026-03-12 01:56:22,965] Trial 586 finished with value: 3.484125427035651 and parameters: {'timeframe': 'M8', 'atr_period': 13, 'atr_threshold': 5.0, 'pt_mult': 0.5, 'sl_mult': 5.0, 'td_mins': 120}. Best is trial 398 with value: 3.484125427035651.
[I 2026-03-12 01:56:23,095] Trial 587 finished with value: 2.85002292450261 and parameters: {'timeframe': 'M8', 'atr_period': 13, 'atr_threshold': 5.0, 'pt_mult': 0.5, 'sl_mult': 5.0, 'td_mins': 180}. Best is trial 398 with value: 3.484125427035651.
[I 2026-03-12 01:56:23,202] Trial 588 finished with value: 3.484125427035651 and parameters: {'timeframe': 'M8', 'atr_period': 13, 'atr_threshold': 5.0, 'pt_mult': 0.5, 'sl_mult': 5.0, 'td_mins': 120}. Best is trial 398 with value: 3.484125427035651.
[I 2026-03-12 01:56:23,254] Trial 589 pruned. 
[I 2026-03-12 01:56:23,376] Trial 590 pruned. 
[I 2026-03-12 01:56:23,439] Trial 591 pruned. 
[I 2026-03-12 01:56:23,520] Trial 592 pruned. 
[I 2026-03-12 01:56:23,629] Trial 593 finished with value: 3.484125427035651 and parameters: {'timeframe': 'M8', 'atr_period': 13, 'atr_threshold': 5.0, 'pt_mult': 0.5, 'sl_mult': 5.0, 'td_mins': 120}. Best is trial 398 with value: 3.484125427035651.
[I 2026-03-12 01:56:23,722] Trial 594 pruned. 
[I 2026-03-12 01:56:25,063] Trial 595 pruned. 
[I 2026-03-12 01:56:25,114] Trial 596 finished with value: 0.0 and parameters: {'timeframe': 'M8', 'atr_period': 13, 'atr_threshold': 15.0, 'pt_mult': 1.0, 'sl_mult': 5.0, 'td_mins': 360}. Best is trial 398 with value: 3.484125427035651.
[I 2026-03-12 01:56:25,211] Trial 597 pruned. 
[I 2026-03-12 01:56:25,365] Trial 598 finished with value: 1.5856804762177235 and parameters: {'timeframe': 'M8', 'atr_period': 13, 'atr_threshold': 5.0, 'pt_mult': 5.0, 'sl_mult': 5.0, 'td_mins': 180}. Best is trial 398 with value: 3.484125427035651.
[I 2026-03-12 01:56:25,476] Trial 599 finished with value: 3.484125427035651 and parameters: {'timeframe': 'M8', 'atr_period': 13, 'atr_threshold': 5.0, 'pt_mult': 0.5, 'sl_mult': 5.0, 'td_mins': 120}. Best is trial 398 with value: 3.484125427035651.
[I 2026-03-12 01:56:25,602] Trial 600 pruned. 
[I 2026-03-12 01:56:25,712] Trial 601 finished with value: 3.484125427035651 and parameters: {'timeframe': 'M8', 'atr_period': 13, 'atr_threshold': 5.0, 'pt_mult': 0.5, 'sl_mult': 5.0, 'td_mins': 120}. Best is trial 398 with value: 3.484125427035651.
[I 2026-03-12 01:56:25,820] Trial 602 finished with value: 3.484125427035651 and parameters: {'timeframe': 'M8', 'atr_period': 13, 'atr_threshold': 5.0, 'pt_mult': 0.5, 'sl_mult': 5.0, 'td_mins': 120}. Best is trial 398 with value: 3.484125427035651.
[I 2026-03-12 01:56:25,868] Trial 603 finished with value: 0.0 and parameters: {'timeframe': 'M8', 'atr_period': 13, 'atr_threshold': 15.0, 'pt_mult': 0.5, 'sl_mult': 2.5, 'td_mins': 120}. Best is trial 398 with value: 3.484125427035651.
[I 2026-03-12 01:56:25,972] Trial 604 finished with value: 3.484125427035651 and parameters: {'timeframe': 'M8', 'atr_period': 13, 'atr_threshold': 5.0, 'pt_mult': 0.5, 'sl_mult': 5.0, 'td_mins': 120}. Best is trial 398 with value: 3.484125427035651.
[I 2026-03-12 01:56:27,051] Trial 605 pruned. 
[I 2026-03-12 01:56:27,270] Trial 606 pruned. 
[I 2026-03-12 01:56:27,420] Trial 607 finished with value: 1.8791170824376746 and parameters: {'timeframe': 'M8', 'atr_period': 13, 'atr_threshold': 5.0, 'pt_mult': 2.5, 'sl_mult': 5.0, 'td_mins': 180}. Best is trial 398 with value: 3.484125427035651.
[I 2026-03-12 01:56:27,534] Trial 608 finished with value: 3.484125427035651 and parameters: {'timeframe': 'M8', 'atr_period': 13, 'atr_threshold': 5.0, 'pt_mult': 0.5, 'sl_mult': 5.0, 'td_mins': 120}. Best is trial 398 with value: 3.484125427035651.
[I 2026-03-12 01:56:27,582] Trial 609 finished with value: 0.0 and parameters: {'timeframe': 'M8', 'atr_period': 13, 'atr_threshold': 8.0, 'pt_mult': 1.0, 'sl_mult': 5.0, 'td_mins': 120}. Best is trial 398 with value: 3.484125427035651.
[I 2026-03-12 01:56:27,635] Trial 610 pruned. 
[I 2026-03-12 01:56:27,748] Trial 611 finished with value: 3.484125427035651 and parameters: {'timeframe': 'M8', 'atr_period': 13, 'atr_threshold': 5.0, 'pt_mult': 0.5, 'sl_mult': 5.0, 'td_mins': 120}. Best is trial 398 with value: 3.484125427035651.
[I 2026-03-12 01:56:27,801] Trial 612 pruned. 
[I 2026-03-12 01:56:27,865] Trial 613 pruned. 
[I 2026-03-12 01:56:27,974] Trial 614 finished with value: 3.484125427035651 and parameters: {'timeframe': 'M8', 'atr_period': 13, 'atr_threshold': 5.0, 'pt_mult': 0.5, 'sl_mult': 5.0, 'td_mins': 120}. Best is trial 398 with value: 3.484125427035651.
[I 2026-03-12 01:56:28,486] Trial 615 pruned. 
[I 2026-03-12 01:56:28,603] Trial 616 finished with value: 3.484125427035651 and parameters: {'timeframe': 'M8', 'atr_period': 13, 'atr_threshold': 5.0, 'pt_mult': 0.5, 'sl_mult': 5.0, 'td_mins': 120}. Best is trial 398 with value: 3.484125427035651.
[I 2026-03-12 01:56:28,651] Trial 617 finished with value: 0.0 and parameters: {'timeframe': 'M8', 'atr_period': 13, 'atr_threshold': 8.0, 'pt_mult': 2.5, 'sl_mult': 0.5, 'td_mins': 180}. Best is trial 398 with value: 3.484125427035651.
[I 2026-03-12 01:56:28,762] Trial 618 finished with value: 3.484125427035651 and parameters: {'timeframe': 'M8', 'atr_period': 13, 'atr_threshold': 5.0, 'pt_mult': 0.5, 'sl_mult': 5.0, 'td_mins': 120}. Best is trial 398 with value: 3.484125427035651.
[I 2026-03-12 01:56:28,817] Trial 619 pruned. 
[I 2026-03-12 01:56:29,183] Trial 620 pruned. 
[I 2026-03-12 01:56:29,287] Trial 621 pruned. 
[I 2026-03-12 01:56:29,523] Trial 622 finished with value: 1.665593021982494 and parameters: {'timeframe': 'M8', 'atr_period': 13, 'atr_threshold': 5.0, 'pt_mult': 1.0, 'sl_mult': 5.0, 'td_mins': 360}. Best is trial 398 with value: 3.484125427035651.
[I 2026-03-12 01:56:30,646] Trial 623 pruned. 
[I 2026-03-12 01:56:30,704] Trial 624 pruned. 
