[I 2026-03-12 01:38:17,787] Trial 30 finished with value: 0.0 and parameters: {'timeframe': 'M3', 'atr_period': 13, 'atr_threshold': 8.0, 'pt_mult': 2.5, 'sl_mult': 5.0, 'td_mins': 120}. Best is trial 5 with value: 1.5593286804083646.
[I 2026-03-12 01:38:17,831] Trial 31 finished with value: 0.0 and parameters: {'timeframe': 'M3', 'atr_period': 13, 'atr_threshold': 10.0, 'pt_mult': 5.0, 'sl_mult': 2.5, 'td_mins': 5}. Best is trial 5 with value: 1.5593286804083646.
[I 2026-03-12 01:38:17,874] Trial 32 finished with value: 0.0 and parameters: {'timeframe': 'M3', 'atr_period': 13, 'atr_threshold': 5.0, 'pt_mult': 5.0, 'sl_mult': 5.0, 'td_mins': 720}. Best is trial 5 with value: 1.5593286804083646.
[I 2026-03-12 01:38:19,754] Trial 33 finished with value: 0.9174607029527705 and parameters: {'timeframe': 'M3', 'atr_period': 13, 'atr_threshold': 1.0, 'pt_mult': 2.5, 'sl_mult': 2.5, 'td_mins': 180}. Best is trial 5 with value: 1.5593286804083646.
[I 2026-03-12 01:38:20,176] Trial 34 finished with value: 1.0267856918382097 and parameters: {'timeframe': 'M3', 'atr_period': 13, 'atr_threshold': 3.0, 'pt_mult': 1.0, 'sl_mult': 0.5, 'td_mins': 1200}. Best is trial 5 with value: 1.5593286804083646.
[I 2026-03-12 01:38:20,483] Trial 35 finished with value: 1.062279745503615 and parameters: {'timeframe': 'M3', 'atr_period': 13, 'atr_threshold': 2.0, 'pt_mult': 0.5, 'sl_mult': 2.5, 'td_mins': 60}. Best is trial 5 with value: 1.5593286804083646.
[I 2026-03-12 01:38:20,690] Trial 36 finished with value: 1.248211166127 and parameters: {'timeframe': 'M3', 'atr_period': 13, 'atr_threshold': 2.0, 'pt_mult': 0.5, 'sl_mult': 2.5, 'td_mins': 30}. Best is trial 5 with value: 1.5593286804083646.
[I 2026-03-12 01:38:20,737] Trial 37 pruned. 
[I 2026-03-12 01:38:21,064] Trial 38 finished with value: 1.0952548962894728 and parameters: {'timeframe': 'M3', 'atr_period': 13, 'atr_threshold': 3.0, 'pt_mult': 2.5, 'sl_mult': 0.5, 'td_mins': 360}. Best is trial 5 with value: 1.5593286804083646.
[I 2026-03-12 01:38:21,109] Trial 39 finished with value: 0.0 and parameters: {'timeframe': 'M3', 'atr_period': 13, 'atr_threshold': 5.0, 'pt_mult': 2.5, 'sl_mult': 2.5, 'td_mins': 360}. Best is trial 5 with value: 1.5593286804083646.
[I 2026-03-12 01:38:21,165] Trial 40 pruned. 
[I 2026-03-12 01:38:22,571] Trial 41 finished with value: 1.335993159142203 and parameters: {'timeframe': 'M3', 'atr_period': 13, 'atr_threshold': 1.0, 'pt_mult': 1.0, 'sl_mult': 5.0, 'td_mins': 120}. Best is trial 5 with value: 1.5593286804083646.
[I 2026-03-12 01:38:22,961] Trial 42 finished with value: 0.9742360076453359 and parameters: {'timeframe': 'M3', 'atr_period': 13, 'atr_threshold': 1.0, 'pt_mult': 1.0, 'sl_mult': 0.5, 'td_mins': 30}. Best is trial 5 with value: 1.5593286804083646.
[I 2026-03-12 01:38:23,070] Trial 43 pruned. 
[I 2026-03-12 01:38:23,218] Trial 44 pruned. 
[I 2026-03-12 01:38:23,323] Trial 45 pruned. 
[I 2026-03-12 01:38:23,463] Trial 46 pruned. 
[I 2026-03-12 01:38:23,513] Trial 47 finished with value: 0.0 and parameters: {'timeframe': 'M3', 'atr_period': 13, 'atr_threshold': 15.0, 'pt_mult': 1.0, 'sl_mult': 1.0, 'td_mins': 1080}. Best is trial 5 with value: 1.5593286804083646.
[I 2026-03-12 01:38:23,697] Trial 48 pruned. 
[I 2026-03-12 01:38:23,747] Trial 49 finished with value: 0.0 and parameters: {'timeframe': 'M3', 'atr_period': 13, 'atr_threshold': 15.0, 'pt_mult': 2.5, 'sl_mult': 5.0, 'td_mins': 1200}. Best is trial 5 with value: 1.5593286804083646.
[I 2026-03-12 01:38:23,985] Trial 50 finished with value: 1.248211166127 and parameters: {'timeframe': 'M3', 'atr_period': 13, 'atr_threshold': 2.0, 'pt_mult': 0.5, 'sl_mult': 2.5, 'td_mins': 30}. Best is trial 5 with value: 1.5593286804083646.
[I 2026-03-12 01:38:28,421] Trial 51 finished with value: 1.030154335482192 and parameters: {'timeframe': 'M3', 'atr_period': 13, 'atr_threshold': 0.5, 'pt_mult': 2.5, 'sl_mult': 0.5, 'td_mins': 720}. Best is trial 5 with value: 1.5593286804083646.
[I 2026-03-12 01:38:28,466] Trial 52 finished with value: 0.0 and parameters: {'timeframe': 'M3', 'atr_period': 13, 'atr_threshold': 10.0, 'pt_mult': 1.0, 'sl_mult': 0.5, 'td_mins': 15}. Best is trial 5 with value: 1.5593286804083646.
[I 2026-03-12 01:38:28,532] Trial 53 pruned. 
[I 2026-03-12 01:38:28,581] Trial 54 finished with value: 0.0 and parameters: {'timeframe': 'M3', 'atr_period': 13, 'atr_threshold': 5.0, 'pt_mult': 2.5, 'sl_mult': 5.0, 'td_mins': 180}. Best is trial 5 with value: 1.5593286804083646.
[I 2026-03-12 01:38:28,656] Trial 55 pruned. 
[I 2026-03-12 01:38:28,738] Trial 56 pruned. 
[I 2026-03-12 01:38:28,787] Trial 57 finished with value: 0.0 and parameters: {'timeframe': 'M3', 'atr_period': 13, 'atr_threshold': 5.0, 'pt_mult': 2.5, 'sl_mult': 0.5, 'td_mins': 120}. Best is trial 5 with value: 1.5593286804083646.
[I 2026-03-12 01:38:28,838] Trial 58 finished with value: 0.0 and parameters: {'timeframe': 'M3', 'atr_period': 13, 'atr_threshold': 10.0, 'pt_mult': 0.5, 'sl_mult': 5.0, 'td_mins': 120}. Best is trial 5 with value: 1.5593286804083646.
[I 2026-03-12 01:38:28,888] Trial 59 finished with value: 0.0 and parameters: {'timeframe': 'M3', 'atr_period': 13, 'atr_threshold': 8.0, 'pt_mult': 0.5, 'sl_mult': 5.0, 'td_mins': 1080}. Best is trial 5 with value: 1.5593286804083646.
[I 2026-03-12 01:38:28,981] Trial 60 pruned. 
[I 2026-03-12 01:38:29,053] Trial 61 pruned. 
[I 2026-03-12 01:38:29,148] Trial 62 pruned. 
[I 2026-03-12 01:38:29,220] Trial 63 pruned. 
[I 2026-03-12 01:38:30,529] Trial 64 finished with value: 1.0682048774953063 and parameters: {'timeframe': 'M3', 'atr_period': 13, 'atr_threshold': 3.0, 'pt_mult': 5.0, 'sl_mult': 2.5, 'td_mins': 1080}. Best is trial 5 with value: 1.5593286804083646.
[I 2026-03-12 01:38:30,574] Trial 65 finished with value: 0.0 and parameters: {'timeframe': 'M3', 'atr_period': 13, 'atr_threshold': 15.0, 'pt_mult': 1.0, 'sl_mult': 0.5, 'td_mins': 30}. Best is trial 5 with value: 1.5593286804083646.
[I 2026-03-12 01:38:30,645] Trial 66 pruned. 
[I 2026-03-12 01:38:30,701] Trial 67 pruned. 
[I 2026-03-12 01:38:30,747] Trial 68 finished with value: 0.0 and parameters: {'timeframe': 'M3', 'atr_period': 13, 'atr_threshold': 15.0, 'pt_mult': 5.0, 'sl_mult': 0.5, 'td_mins': 1200}. Best is trial 5 with value: 1.5593286804083646.
[I 2026-03-12 01:38:30,977] Trial 69 pruned. 
[I 2026-03-12 01:38:31,022] Trial 70 finished with value: 0.0 and parameters: {'timeframe': 'M3', 'atr_period': 13, 'atr_threshold': 15.0, 'pt_mult': 2.5, 'sl_mult': 5.0, 'td_mins': 15}. Best is trial 5 with value: 1.5593286804083646.
[I 2026-03-12 01:38:31,067] Trial 71 finished with value: 0.0 and parameters: {'timeframe': 'M3', 'atr_period': 13, 'atr_threshold': 15.0, 'pt_mult': 2.5, 'sl_mult': 0.5, 'td_mins': 120}. Best is trial 5 with value: 1.5593286804083646.
[I 2026-03-12 01:38:31,119] Trial 72 pruned. 
[I 2026-03-12 01:38:31,163] Trial 73 finished with value: 0.0 and parameters: {'timeframe': 'M3', 'atr_period': 13, 'atr_threshold': 15.0, 'pt_mult': 0.5, 'sl_mult': 1.0, 'td_mins': 30}. Best is trial 5 with value: 1.5593286804083646.
[I 2026-03-12 01:38:31,293] Trial 74 pruned. 
[I 2026-03-12 01:38:31,352] Trial 75 pruned. 
[I 2026-03-12 01:38:31,491] Trial 76 pruned. 
[I 2026-03-12 01:38:31,537] Trial 77 finished with value: 0.0 and parameters: {'timeframe': 'M3', 'atr_period': 13, 'atr_threshold': 10.0, 'pt_mult': 1.0, 'sl_mult': 1.0, 'td_mins': 180}. Best is trial 5 with value: 1.5593286804083646.
[I 2026-03-12 01:38:31,596] Trial 78 pruned. 
[I 2026-03-12 01:38:31,640] Trial 79 finished with value: 0.0 and parameters: {'timeframe': 'M3', 'atr_period': 13, 'atr_threshold': 5.0, 'pt_mult': 0.5, 'sl_mult': 0.5, 'td_mins': 120}. Best is trial 5 with value: 1.5593286804083646.
[I 2026-03-12 01:38:31,685] Trial 80 finished with value: 0.0 and parameters: {'timeframe': 'M3', 'atr_period': 13, 'atr_threshold': 5.0, 'pt_mult': 0.5, 'sl_mult': 5.0, 'td_mins': 5}. Best is trial 5 with value: 1.5593286804083646.
[I 2026-03-12 01:38:31,756] Trial 81 pruned. 
[I 2026-03-12 01:38:31,883] Trial 82 finished with value: 1.019571328771739 and parameters: {'timeframe': 'M3', 'atr_period': 13, 'atr_threshold': 3.0, 'pt_mult': 0.5, 'sl_mult': 0.5, 'td_mins': 120}. Best is trial 5 with value: 1.5593286804083646.
[I 2026-03-12 01:38:32,662] Trial 83 finished with value: 1.1296337674026444 and parameters: {'timeframe': 'M3', 'atr_period': 13, 'atr_threshold': 3.0, 'pt_mult': 2.5, 'sl_mult': 0.5, 'td_mins': 1200}. Best is trial 5 with value: 1.5593286804083646.
[I 2026-03-12 01:38:32,707] Trial 84 finished with value: 0.0 and parameters: {'timeframe': 'M3', 'atr_period': 13, 'atr_threshold': 5.0, 'pt_mult': 5.0, 'sl_mult': 0.5, 'td_mins': 15}. Best is trial 5 with value: 1.5593286804083646.
[I 2026-03-12 01:38:33,328] Trial 85 finished with value: 1.2956195779935422 and parameters: {'timeframe': 'M3', 'atr_period': 13, 'atr_threshold': 2.0, 'pt_mult': 2.5, 'sl_mult': 5.0, 'td_mins': 120}. Best is trial 5 with value: 1.5593286804083646.
[I 2026-03-12 01:38:33,374] Trial 86 finished with value: 0.0 and parameters: {'timeframe': 'M3', 'atr_period': 13, 'atr_threshold': 8.0, 'pt_mult': 0.5, 'sl_mult': 1.0, 'td_mins': 5}. Best is trial 5 with value: 1.5593286804083646.
[I 2026-03-12 01:38:33,419] Trial 87 finished with value: 0.0 and parameters: {'timeframe': 'M3', 'atr_period': 13, 'atr_threshold': 5.0, 'pt_mult': 5.0, 'sl_mult': 0.5, 'td_mins': 1080}. Best is trial 5 with value: 1.5593286804083646.
[I 2026-03-12 01:38:33,462] Trial 88 finished with value: 0.0 and parameters: {'timeframe': 'M3', 'atr_period': 13, 'atr_threshold': 5.0, 'pt_mult': 1.0, 'sl_mult': 0.5, 'td_mins': 360}. Best is trial 5 with value: 1.5593286804083646.
[I 2026-03-12 01:38:33,510] Trial 89 finished with value: 0.0 and parameters: {'timeframe': 'M3', 'atr_period': 13, 'atr_threshold': 5.0, 'pt_mult': 0.5, 'sl_mult': 0.5, 'td_mins': 5}. Best is trial 5 with value: 1.5593286804083646.
[I 2026-03-12 01:38:35,337] Trial 90 finished with value: 1.1735200763862212 and parameters: {'timeframe': 'M3', 'atr_period': 13, 'atr_threshold': 1.0, 'pt_mult': 0.5, 'sl_mult': 5.0, 'td_mins': 180}. Best is trial 5 with value: 1.5593286804083646.
[I 2026-03-12 01:38:35,525] Trial 91 finished with value: 1.025026033500119 and parameters: {'timeframe': 'M3', 'atr_period': 13, 'atr_threshold': 3.0, 'pt_mult': 0.5, 'sl_mult': 0.5, 'td_mins': 360}. Best is trial 5 with value: 1.5593286804083646.
[I 2026-03-12 01:38:35,572] Trial 92 finished with value: 0.0 and parameters: {'timeframe': 'M3', 'atr_period': 13, 'atr_threshold': 8.0, 'pt_mult': 2.5, 'sl_mult': 5.0, 'td_mins': 180}. Best is trial 5 with value: 1.5593286804083646.
[I 2026-03-12 01:38:35,616] Trial 93 finished with value: 0.0 and parameters: {'timeframe': 'M3', 'atr_period': 13, 'atr_threshold': 8.0, 'pt_mult': 1.0, 'sl_mult': 0.5, 'td_mins': 60}. Best is trial 5 with value: 1.5593286804083646.
[I 2026-03-12 01:38:35,725] Trial 94 pruned. 
[I 2026-03-12 01:38:35,858] Trial 95 pruned. 
[I 2026-03-12 01:38:35,901] Trial 96 finished with value: 0.0 and parameters: {'timeframe': 'M3', 'atr_period': 13, 'atr_threshold': 5.0, 'pt_mult': 5.0, 'sl_mult': 5.0, 'td_mins': 5}. Best is trial 5 with value: 1.5593286804083646.
[I 2026-03-12 01:38:35,945] Trial 97 finished with value: 0.0 and parameters: {'timeframe': 'M3', 'atr_period': 13, 'atr_threshold': 15.0, 'pt_mult': 1.0, 'sl_mult': 2.5, 'td_mins': 15}. Best is trial 5 with value: 1.5593286804083646.
[I 2026-03-12 01:38:36,143] Trial 98 pruned. 
[I 2026-03-12 01:38:36,255] Trial 99 pruned. 
[I 2026-03-12 01:38:36,302] Trial 100 finished with value: 0.0 and parameters: {'timeframe': 'M3', 'atr_period': 13, 'atr_threshold': 10.0, 'pt_mult': 2.5, 'sl_mult': 5.0, 'td_mins': 720}. Best is trial 5 with value: 1.5593286804083646.
[I 2026-03-12 01:38:36,445] Trial 101 pruned. 
[I 2026-03-12 01:38:38,486] Trial 102 finished with value: 1.0885404461749308 and parameters: {'timeframe': 'M3', 'atr_period': 13, 'atr_threshold': 0.5, 'pt_mult': 2.5, 'sl_mult': 5.0, 'td_mins': 120}. Best is trial 5 with value: 1.5593286804083646.
[I 2026-03-12 01:38:39,139] Trial 103 pruned. 
[I 2026-03-12 01:38:39,187] Trial 104 finished with value: 0.0 and parameters: {'timeframe': 'M3', 'atr_period': 13, 'atr_threshold': 8.0, 'pt_mult': 0.5, 'sl_mult': 2.5, 'td_mins': 5}. Best is trial 5 with value: 1.5593286804083646.
[I 2026-03-12 01:38:39,235] Trial 105 finished with value: 0.0 and parameters: {'timeframe': 'M3', 'atr_period': 13, 'atr_threshold': 15.0, 'pt_mult': 0.5, 'sl_mult': 5.0, 'td_mins': 1200}. Best is trial 5 with value: 1.5593286804083646.
[I 2026-03-12 01:38:39,333] Trial 106 pruned. 
[I 2026-03-12 01:38:39,768] Trial 107 finished with value: 1.460065312101566 and parameters: {'timeframe': 'M3', 'atr_period': 13, 'atr_threshold': 0.5, 'pt_mult': 0.5, 'sl_mult': 5.0, 'td_mins': 15}. Best is trial 5 with value: 1.5593286804083646.
[I 2026-03-12 01:38:39,812] Trial 108 finished with value: 0.0 and parameters: {'timeframe': 'M3', 'atr_period': 13, 'atr_threshold': 10.0, 'pt_mult': 5.0, 'sl_mult': 1.0, 'td_mins': 60}. Best is trial 5 with value: 1.5593286804083646.
[I 2026-03-12 01:38:39,916] Trial 109 pruned. 
[I 2026-03-12 01:38:39,964] Trial 110 finished with value: 0.0 and parameters: {'timeframe': 'M3', 'atr_period': 13, 'atr_threshold': 5.0, 'pt_mult': 2.5, 'sl_mult': 1.0, 'td_mins': 1200}. Best is trial 5 with value: 1.5593286804083646.
[I 2026-03-12 01:38:40,015] Trial 111 pruned. 
[I 2026-03-12 01:38:40,059] Trial 112 finished with value: 0.0 and parameters: {'timeframe': 'M3', 'atr_period': 13, 'atr_threshold': 10.0, 'pt_mult': 1.0, 'sl_mult': 2.5, 'td_mins': 30}. Best is trial 5 with value: 1.5593286804083646.
[I 2026-03-12 01:38:40,113] Trial 113 pruned. 
[I 2026-03-12 01:38:40,252] Trial 114 pruned. 
[I 2026-03-12 01:38:41,189] Trial 115 pruned. 
[I 2026-03-12 01:38:41,235] Trial 116 finished with value: 0.0 and parameters: {'timeframe': 'M3', 'atr_period': 13, 'atr_threshold': 8.0, 'pt_mult': 0.5, 'sl_mult': 1.0, 'td_mins': 60}. Best is trial 5 with value: 1.5593286804083646.
[I 2026-03-12 01:38:41,286] Trial 117 finished with value: 0.0 and parameters: {'timeframe': 'M3', 'atr_period': 13, 'atr_threshold': 8.0, 'pt_mult': 0.5, 'sl_mult': 0.5, 'td_mins': 180}. Best is trial 5 with value: 1.5593286804083646.
[I 2026-03-12 01:38:41,329] Trial 118 finished with value: 0.0 and parameters: {'timeframe': 'M3', 'atr_period': 13, 'atr_threshold': 8.0, 'pt_mult': 2.5, 'sl_mult': 5.0, 'td_mins': 1200}. Best is trial 5 with value: 1.5593286804083646.
[I 2026-03-12 01:38:41,377] Trial 119 finished with value: 0.0 and parameters: {'timeframe': 'M3', 'atr_period': 13, 'atr_threshold': 10.0, 'pt_mult': 1.0, 'sl_mult': 5.0, 'td_mins': 120}. Best is trial 5 with value: 1.5593286804083646.
[I 2026-03-12 01:38:41,423] Trial 120 finished with value: 0.0 and parameters: {'timeframe': 'M3', 'atr_period': 13, 'atr_threshold': 5.0, 'pt_mult': 0.5, 'sl_mult': 1.0, 'td_mins': 120}. Best is trial 5 with value: 1.5593286804083646.
[I 2026-03-12 01:38:42,073] Trial 121 pruned. 
[I 2026-03-12 01:38:42,122] Trial 122 finished with value: 0.0 and parameters: {'timeframe': 'M3', 'atr_period': 13, 'atr_threshold': 15.0, 'pt_mult': 2.5, 'sl_mult': 1.0, 'td_mins': 1200}. Best is trial 5 with value: 1.5593286804083646.
[I 2026-03-12 01:38:42,174] Trial 123 finished with value: 0.0 and parameters: {'timeframe': 'M3', 'atr_period': 13, 'atr_threshold': 10.0, 'pt_mult': 1.0, 'sl_mult': 5.0, 'td_mins': 5}. Best is trial 5 with value: 1.5593286804083646.
[I 2026-03-12 01:38:42,250] Trial 124 pruned. 
[I 2026-03-12 01:38:42,299] Trial 125 finished with value: 0.0 and parameters: {'timeframe': 'M3', 'atr_period': 13, 'atr_threshold': 8.0, 'pt_mult': 1.0, 'sl_mult': 0.5, 'td_mins': 1200}. Best is trial 5 with value: 1.5593286804083646.
[I 2026-03-12 01:38:42,347] Trial 126 finished with value: 0.0 and parameters: {'timeframe': 'M3', 'atr_period': 13, 'atr_threshold': 15.0, 'pt_mult': 2.5, 'sl_mult': 2.5, 'td_mins': 30}. Best is trial 5 with value: 1.5593286804083646.
[I 2026-03-12 01:38:47,519] Trial 127 finished with value: 1.030154335482192 and parameters: {'timeframe': 'M3', 'atr_period': 13, 'atr_threshold': 0.5, 'pt_mult': 2.5, 'sl_mult': 0.5, 'td_mins': 720}. Best is trial 5 with value: 1.5593286804083646.
[I 2026-03-12 01:38:47,574] Trial 128 finished with value: 0.0 and parameters: {'timeframe': 'M3', 'atr_period': 13, 'atr_threshold': 5.0, 'pt_mult': 1.0, 'sl_mult': 0.5, 'td_mins': 120}. Best is trial 5 with value: 1.5593286804083646.
[I 2026-03-12 01:38:48,759] Trial 129 finished with value: 1.5987933377428867 and parameters: {'timeframe': 'M3', 'atr_period': 13, 'atr_threshold': 1.0, 'pt_mult': 0.5, 'sl_mult': 5.0, 'td_mins': 60}. Best is trial 129 with value: 1.5987933377428867.
[I 2026-03-12 01:38:48,824] Trial 130 finished with value: 0.0 and parameters: {'timeframe': 'M3', 'atr_period': 13, 'atr_threshold': 5.0, 'pt_mult': 2.5, 'sl_mult': 1.0, 'td_mins': 30}. Best is trial 129 with value: 1.5987933377428867.
[I 2026-03-12 01:38:51,342] Trial 131 finished with value: 1.204667072829398 and parameters: {'timeframe': 'M3', 'atr_period': 13, 'atr_threshold': 3.0, 'pt_mult': 5.0, 'sl_mult': 5.0, 'td_mins': 1200}. Best is trial 129 with value: 1.5987933377428867.
[I 2026-03-12 01:38:51,516] Trial 132 finished with value: 1.550363692242269 and parameters: {'timeframe': 'M3', 'atr_period': 13, 'atr_threshold': 3.0, 'pt_mult': 2.5, 'sl_mult': 5.0, 'td_mins': 60}. Best is trial 129 with value: 1.5987933377428867.
[I 2026-03-12 01:38:51,563] Trial 133 finished with value: 0.0 and parameters: {'timeframe': 'M3', 'atr_period': 13, 'atr_threshold': 15.0, 'pt_mult': 1.0, 'sl_mult': 1.0, 'td_mins': 360}. Best is trial 129 with value: 1.5987933377428867.
[I 2026-03-12 01:39:03,245] Trial 134 finished with value: 0.9720128584171063 and parameters: {'timeframe': 'M3', 'atr_period': 13, 'atr_threshold': 0.5, 'pt_mult': 2.5, 'sl_mult': 5.0, 'td_mins': 1080}. Best is trial 129 with value: 1.5987933377428867.
[I 2026-03-12 01:39:03,294] Trial 135 finished with value: 0.0 and parameters: {'timeframe': 'M3', 'atr_period': 13, 'atr_threshold': 15.0, 'pt_mult': 5.0, 'sl_mult': 0.5, 'td_mins': 180}. Best is trial 129 with value: 1.5987933377428867.
[I 2026-03-12 01:39:03,381] Trial 136 pruned. 
[I 2026-03-12 01:39:03,454] Trial 137 pruned. 
[I 2026-03-12 01:39:03,504] Trial 138 finished with value: 0.0 and parameters: {'timeframe': 'M3', 'atr_period': 13, 'atr_threshold': 10.0, 'pt_mult': 2.5, 'sl_mult': 5.0, 'td_mins': 15}. Best is trial 129 with value: 1.5987933377428867.
[I 2026-03-12 01:39:03,735] Trial 139 pruned. 
[I 2026-03-12 01:39:03,789] Trial 140 pruned. 
[I 2026-03-12 01:39:03,834] Trial 141 finished with value: 0.0 and parameters: {'timeframe': 'M3', 'atr_period': 13, 'atr_threshold': 5.0, 'pt_mult': 0.5, 'sl_mult': 2.5, 'td_mins': 180}. Best is trial 129 with value: 1.5987933377428867.
[I 2026-03-12 01:39:03,918] Trial 142 pruned. 
[I 2026-03-12 01:39:03,961] Trial 143 finished with value: 0.0 and parameters: {'timeframe': 'M3', 'atr_period': 13, 'atr_threshold': 10.0, 'pt_mult': 1.0, 'sl_mult': 0.5, 'td_mins': 360}. Best is trial 129 with value: 1.5987933377428867.
[I 2026-03-12 01:39:05,224] Trial 144 pruned. 
[I 2026-03-12 01:39:05,279] Trial 145 finished with value: 0.0 and parameters: {'timeframe': 'M3', 'atr_period': 13, 'atr_threshold': 10.0, 'pt_mult': 0.5, 'sl_mult': 1.0, 'td_mins': 180}. Best is trial 129 with value: 1.5987933377428867.
[I 2026-03-12 01:39:05,334] Trial 146 finished with value: 0.0 and parameters: {'timeframe': 'M3', 'atr_period': 13, 'atr_threshold': 10.0, 'pt_mult': 1.0, 'sl_mult': 2.5, 'td_mins': 1080}. Best is trial 129 with value: 1.5987933377428867.
[I 2026-03-12 01:39:05,386] Trial 147 finished with value: 0.0 and parameters: {'timeframe': 'M3', 'atr_period': 13, 'atr_threshold': 8.0, 'pt_mult': 0.5, 'sl_mult': 5.0, 'td_mins': 30}. Best is trial 129 with value: 1.5987933377428867.
[I 2026-03-12 01:39:05,437] Trial 148 finished with value: 0.0 and parameters: {'timeframe': 'M3', 'atr_period': 13, 'atr_threshold': 15.0, 'pt_mult': 0.5, 'sl_mult': 2.5, 'td_mins': 120}. Best is trial 129 with value: 1.5987933377428867.
[I 2026-03-12 01:39:05,520] Trial 149 finished with value: 1.4992870789578903 and parameters: {'timeframe': 'M3', 'atr_period': 13, 'atr_threshold': 3.0, 'pt_mult': 0.5, 'sl_mult': 5.0, 'td_mins': 5}. Best is trial 129 with value: 1.5987933377428867.
[I 2026-03-12 01:39:05,661] Trial 150 pruned. 
[I 2026-03-12 01:39:05,718] Trial 151 finished with value: 0.0 and parameters: {'timeframe': 'M3', 'atr_period': 13, 'atr_threshold': 10.0, 'pt_mult': 1.0, 'sl_mult': 2.5, 'td_mins': 30}. Best is trial 129 with value: 1.5987933377428867.
[I 2026-03-12 01:39:05,768] Trial 152 finished with value: 0.0 and parameters: {'timeframe': 'M3', 'atr_period': 13, 'atr_threshold': 8.0, 'pt_mult': 0.5, 'sl_mult': 1.0, 'td_mins': 5}. Best is trial 129 with value: 1.5987933377428867.
[I 2026-03-12 01:39:05,824] Trial 153 finished with value: 0.0 and parameters: {'timeframe': 'M3', 'atr_period': 13, 'atr_threshold': 5.0, 'pt_mult': 5.0, 'sl_mult': 0.5, 'td_mins': 720}. Best is trial 129 with value: 1.5987933377428867.
[I 2026-03-12 01:39:05,880] Trial 154 finished with value: 0.0 and parameters: {'timeframe': 'M3', 'atr_period': 13, 'atr_threshold': 10.0, 'pt_mult': 1.0, 'sl_mult': 2.5, 'td_mins': 1200}. Best is trial 129 with value: 1.5987933377428867.
[I 2026-03-12 01:39:05,932] Trial 155 finished with value: 0.0 and parameters: {'timeframe': 'M3', 'atr_period': 13, 'atr_threshold': 15.0, 'pt_mult': 0.5, 'sl_mult': 2.5, 'td_mins': 180}. Best is trial 129 with value: 1.5987933377428867.
[I 2026-03-12 01:39:05,984] Trial 156 finished with value: 0.0 and parameters: {'timeframe': 'M3', 'atr_period': 13, 'atr_threshold': 10.0, 'pt_mult': 5.0, 'sl_mult': 0.5, 'td_mins': 60}. Best is trial 129 with value: 1.5987933377428867.
