[I 2026-03-12 00:48:58,618] Trial 110 finished with value: 0.0 and parameters: {'timeframe': 'M3', 'atr_period': 13, 'atr_threshold': 10.0, 'pt_mult': 0.5, 'sl_mult': 5.0, 'td_mins': 360}. Best is trial 29 with value: 1.9600482462895854.
[I 2026-03-12 00:48:58,660] Trial 111 finished with value: 0.0 and parameters: {'timeframe': 'M3', 'atr_period': 13, 'atr_threshold': 8.0, 'pt_mult': 1.0, 'sl_mult': 5.0, 'td_mins': 15}. Best is trial 29 with value: 1.9600482462895854.
[I 2026-03-12 00:48:58,701] Trial 112 finished with value: 0.0 and parameters: {'timeframe': 'M3', 'atr_period': 13, 'atr_threshold': 15.0, 'pt_mult': 0.5, 'sl_mult': 5.0, 'td_mins': 30}. Best is trial 29 with value: 1.9600482462895854.
[I 2026-03-12 00:48:59,033] Trial 113 pruned. 
[I 2026-03-12 00:48:59,075] Trial 114 finished with value: 0.0 and parameters: {'timeframe': 'M3', 'atr_period': 13, 'atr_threshold': 5.0, 'pt_mult': 1.0, 'sl_mult': 2.5, 'td_mins': 120}. Best is trial 29 with value: 1.9600482462895854.
[I 2026-03-12 00:48:59,462] Trial 115 finished with value: 1.00515359504851 and parameters: {'timeframe': 'M3', 'atr_period': 13, 'atr_threshold': 2.0, 'pt_mult': 1.0, 'sl_mult': 1.0, 'td_mins': 120}. Best is trial 29 with value: 1.9600482462895854.
[I 2026-03-12 00:48:59,876] Trial 116 finished with value: 0.9940538934395127 and parameters: {'timeframe': 'M3', 'atr_period': 13, 'atr_threshold': 3.0, 'pt_mult': 0.5, 'sl_mult': 1.0, 'td_mins': 1080}. Best is trial 29 with value: 1.9600482462895854.
[I 2026-03-12 00:48:59,920] Trial 117 finished with value: 0.0 and parameters: {'timeframe': 'M3', 'atr_period': 13, 'atr_threshold': 15.0, 'pt_mult': 2.5, 'sl_mult': 5.0, 'td_mins': 60}. Best is trial 29 with value: 1.9600482462895854.
[I 2026-03-12 00:49:00,709] Trial 118 pruned. 
[I 2026-03-12 00:49:00,851] Trial 119 finished with value: 0.9516730922538919 and parameters: {'timeframe': 'M3', 'atr_period': 13, 'atr_threshold': 3.0, 'pt_mult': 2.5, 'sl_mult': 5.0, 'td_mins': 30}. Best is trial 29 with value: 1.9600482462895854.
[I 2026-03-12 00:49:02,226] Trial 120 pruned. 
[I 2026-03-12 00:49:02,273] Trial 121 finished with value: 0.0 and parameters: {'timeframe': 'M3', 'atr_period': 13, 'atr_threshold': 8.0, 'pt_mult': 2.5, 'sl_mult': 1.0, 'td_mins': 120}. Best is trial 29 with value: 1.9600482462895854.
[I 2026-03-12 00:49:02,317] Trial 122 finished with value: 0.0 and parameters: {'timeframe': 'M3', 'atr_period': 13, 'atr_threshold': 5.0, 'pt_mult': 5.0, 'sl_mult': 0.5, 'td_mins': 180}. Best is trial 29 with value: 1.9600482462895854.
[I 2026-03-12 00:49:02,586] Trial 123 finished with value: 1.0486779300243438 and parameters: {'timeframe': 'M3', 'atr_period': 13, 'atr_threshold': 3.0, 'pt_mult': 2.5, 'sl_mult': 1.0, 'td_mins': 180}. Best is trial 29 with value: 1.9600482462895854.
[I 2026-03-12 00:49:02,712] Trial 124 pruned. 
[I 2026-03-12 00:49:02,760] Trial 125 finished with value: 0.0 and parameters: {'timeframe': 'M3', 'atr_period': 13, 'atr_threshold': 15.0, 'pt_mult': 5.0, 'sl_mult': 2.5, 'td_mins': 15}. Best is trial 29 with value: 1.9600482462895854.
[I 2026-03-12 00:49:03,480] Trial 126 pruned. 
[I 2026-03-12 00:49:03,534] Trial 127 finished with value: 0.0 and parameters: {'timeframe': 'M3', 'atr_period': 13, 'atr_threshold': 15.0, 'pt_mult': 2.5, 'sl_mult': 2.5, 'td_mins': 15}. Best is trial 29 with value: 1.9600482462895854.
[I 2026-03-12 00:49:03,585] Trial 128 finished with value: 0.0 and parameters: {'timeframe': 'M3', 'atr_period': 13, 'atr_threshold': 5.0, 'pt_mult': 0.5, 'sl_mult': 5.0, 'td_mins': 15}. Best is trial 29 with value: 1.9600482462895854.
[I 2026-03-12 00:49:04,398] Trial 129 finished with value: 1.0230274812538167 and parameters: {'timeframe': 'M3', 'atr_period': 13, 'atr_threshold': 2.0, 'pt_mult': 0.5, 'sl_mult': 0.5, 'td_mins': 1080}. Best is trial 29 with value: 1.9600482462895854.
[I 2026-03-12 00:49:04,449] Trial 130 finished with value: 0.0 and parameters: {'timeframe': 'M3', 'atr_period': 13, 'atr_threshold': 5.0, 'pt_mult': 0.5, 'sl_mult': 0.5, 'td_mins': 720}. Best is trial 29 with value: 1.9600482462895854.
[I 2026-03-12 00:49:04,503] Trial 131 finished with value: 0.0 and parameters: {'timeframe': 'M3', 'atr_period': 13, 'atr_threshold': 8.0, 'pt_mult': 1.0, 'sl_mult': 2.5, 'td_mins': 1080}. Best is trial 29 with value: 1.9600482462895854.
[I 2026-03-12 00:49:04,551] Trial 132 finished with value: 0.0 and parameters: {'timeframe': 'M3', 'atr_period': 13, 'atr_threshold': 5.0, 'pt_mult': 5.0, 'sl_mult': 1.0, 'td_mins': 15}. Best is trial 29 with value: 1.9600482462895854.
[I 2026-03-12 00:49:04,995] Trial 133 finished with value: 0.9940538934395127 and parameters: {'timeframe': 'M3', 'atr_period': 13, 'atr_threshold': 3.0, 'pt_mult': 0.5, 'sl_mult': 1.0, 'td_mins': 1080}. Best is trial 29 with value: 1.9600482462895854.
[I 2026-03-12 00:49:05,408] Trial 134 finished with value: 1.1815368930178622 and parameters: {'timeframe': 'M3', 'atr_period': 13, 'atr_threshold': 2.0, 'pt_mult': 2.5, 'sl_mult': 5.0, 'td_mins': 60}. Best is trial 29 with value: 1.9600482462895854.
[I 2026-03-12 00:49:05,460] Trial 135 finished with value: 0.0 and parameters: {'timeframe': 'M3', 'atr_period': 13, 'atr_threshold': 15.0, 'pt_mult': 0.5, 'sl_mult': 2.5, 'td_mins': 120}. Best is trial 29 with value: 1.9600482462895854.
[I 2026-03-12 00:49:05,518] Trial 136 finished with value: 0.0 and parameters: {'timeframe': 'M3', 'atr_period': 13, 'atr_threshold': 15.0, 'pt_mult': 5.0, 'sl_mult': 0.5, 'td_mins': 720}. Best is trial 29 with value: 1.9600482462895854.
[I 2026-03-12 00:49:05,710] Trial 137 pruned. 
[I 2026-03-12 00:49:05,763] Trial 138 finished with value: 0.0 and parameters: {'timeframe': 'M3', 'atr_period': 13, 'atr_threshold': 5.0, 'pt_mult': 1.0, 'sl_mult': 0.5, 'td_mins': 180}. Best is trial 29 with value: 1.9600482462895854.
[I 2026-03-12 00:49:05,816] Trial 139 finished with value: 0.0 and parameters: {'timeframe': 'M3', 'atr_period': 13, 'atr_threshold': 5.0, 'pt_mult': 2.5, 'sl_mult': 2.5, 'td_mins': 720}. Best is trial 29 with value: 1.9600482462895854.
[I 2026-03-12 00:49:06,022] Trial 140 pruned. 
[I 2026-03-12 00:49:06,334] Trial 141 pruned. 
[I 2026-03-12 00:49:06,378] Trial 142 finished with value: 0.0 and parameters: {'timeframe': 'M3', 'atr_period': 13, 'atr_threshold': 10.0, 'pt_mult': 0.5, 'sl_mult': 0.5, 'td_mins': 360}. Best is trial 29 with value: 1.9600482462895854.
[I 2026-03-12 00:49:06,425] Trial 143 finished with value: 0.0 and parameters: {'timeframe': 'M3', 'atr_period': 13, 'atr_threshold': 8.0, 'pt_mult': 1.0, 'sl_mult': 5.0, 'td_mins': 30}. Best is trial 29 with value: 1.9600482462895854.
[I 2026-03-12 00:49:06,469] Trial 144 finished with value: 0.0 and parameters: {'timeframe': 'M3', 'atr_period': 13, 'atr_threshold': 15.0, 'pt_mult': 1.0, 'sl_mult': 2.5, 'td_mins': 15}. Best is trial 29 with value: 1.9600482462895854.
[I 2026-03-12 00:49:06,513] Trial 145 finished with value: 0.0 and parameters: {'timeframe': 'M3', 'atr_period': 13, 'atr_threshold': 15.0, 'pt_mult': 1.0, 'sl_mult': 0.5, 'td_mins': 180}. Best is trial 29 with value: 1.9600482462895854.
[I 2026-03-12 00:49:08,528] Trial 146 finished with value: 1.1889508239635067 and parameters: {'timeframe': 'M3', 'atr_period': 13, 'atr_threshold': 1.0, 'pt_mult': 1.0, 'sl_mult': 5.0, 'td_mins': 180}. Best is trial 29 with value: 1.9600482462895854.
[I 2026-03-12 00:49:09,831] Trial 147 pruned. 
[I 2026-03-12 00:49:10,388] Trial 148 pruned. 
[I 2026-03-12 00:49:11,167] Trial 149 finished with value: 0.9605893631791573 and parameters: {'timeframe': 'M3', 'atr_period': 13, 'atr_threshold': 3.0, 'pt_mult': 0.5, 'sl_mult': 2.5, 'td_mins': 1080}. Best is trial 29 with value: 1.9600482462895854.
[I 2026-03-12 00:49:11,324] Trial 150 pruned. 
[I 2026-03-12 00:49:11,767] Trial 151 finished with value: 1.135938861566835 and parameters: {'timeframe': 'M3', 'atr_period': 13, 'atr_threshold': 3.0, 'pt_mult': 2.5, 'sl_mult': 1.0, 'td_mins': 360}. Best is trial 29 with value: 1.9600482462895854.
[I 2026-03-12 00:49:11,907] Trial 152 pruned. 
[I 2026-03-12 00:49:11,950] Trial 153 finished with value: 0.0 and parameters: {'timeframe': 'M3', 'atr_period': 13, 'atr_threshold': 8.0, 'pt_mult': 1.0, 'sl_mult': 2.5, 'td_mins': 360}. Best is trial 29 with value: 1.9600482462895854.
[I 2026-03-12 00:49:14,677] Trial 154 finished with value: 1.08928709105566 and parameters: {'timeframe': 'M3', 'atr_period': 13, 'atr_threshold': 2.0, 'pt_mult': 1.0, 'sl_mult': 5.0, 'td_mins': 1080}. Best is trial 29 with value: 1.9600482462895854.
[I 2026-03-12 00:49:15,033] Trial 155 pruned. 
[I 2026-03-12 00:49:15,076] Trial 156 finished with value: 0.0 and parameters: {'timeframe': 'M3', 'atr_period': 13, 'atr_threshold': 15.0, 'pt_mult': 5.0, 'sl_mult': 0.5, 'td_mins': 720}. Best is trial 29 with value: 1.9600482462895854.
[I 2026-03-12 00:49:15,121] Trial 157 finished with value: 0.0 and parameters: {'timeframe': 'M3', 'atr_period': 13, 'atr_threshold': 5.0, 'pt_mult': 5.0, 'sl_mult': 0.5, 'td_mins': 120}. Best is trial 29 with value: 1.9600482462895854.
[I 2026-03-12 00:49:15,163] Trial 158 finished with value: 0.0 and parameters: {'timeframe': 'M3', 'atr_period': 13, 'atr_threshold': 15.0, 'pt_mult': 0.5, 'sl_mult': 0.5, 'td_mins': 720}. Best is trial 29 with value: 1.9600482462895854.
[I 2026-03-12 00:49:15,206] Trial 159 finished with value: 0.0 and parameters: {'timeframe': 'M3', 'atr_period': 13, 'atr_threshold': 5.0, 'pt_mult': 2.5, 'sl_mult': 2.5, 'td_mins': 30}. Best is trial 29 with value: 1.9600482462895854.
[I 2026-03-12 00:49:15,252] Trial 160 finished with value: 0.0 and parameters: {'timeframe': 'M3', 'atr_period': 13, 'atr_threshold': 5.0, 'pt_mult': 1.0, 'sl_mult': 1.0, 'td_mins': 180}. Best is trial 29 with value: 1.9600482462895854.
[I 2026-03-12 00:49:15,380] Trial 161 pruned. 
[I 2026-03-12 00:49:15,428] Trial 162 finished with value: 0.0 and parameters: {'timeframe': 'M3', 'atr_period': 13, 'atr_threshold': 10.0, 'pt_mult': 5.0, 'sl_mult': 0.5, 'td_mins': 120}. Best is trial 29 with value: 1.9600482462895854.
[I 2026-03-12 00:49:15,606] Trial 163 pruned. 
[I 2026-03-12 00:49:15,656] Trial 164 finished with value: 0.0 and parameters: {'timeframe': 'M3', 'atr_period': 13, 'atr_threshold': 10.0, 'pt_mult': 5.0, 'sl_mult': 5.0, 'td_mins': 1200}. Best is trial 29 with value: 1.9600482462895854.
[I 2026-03-12 00:49:15,703] Trial 165 finished with value: 0.0 and parameters: {'timeframe': 'M3', 'atr_period': 13, 'atr_threshold': 5.0, 'pt_mult': 1.0, 'sl_mult': 2.5, 'td_mins': 180}. Best is trial 29 with value: 1.9600482462895854.
[I 2026-03-12 00:49:15,750] Trial 166 finished with value: 0.0 and parameters: {'timeframe': 'M3', 'atr_period': 13, 'atr_threshold': 8.0, 'pt_mult': 1.0, 'sl_mult': 2.5, 'td_mins': 720}. Best is trial 29 with value: 1.9600482462895854.
[I 2026-03-12 00:49:16,310] Trial 167 pruned. 
[I 2026-03-12 00:49:16,357] Trial 168 finished with value: 0.0 and parameters: {'timeframe': 'M3', 'atr_period': 13, 'atr_threshold': 15.0, 'pt_mult': 0.5, 'sl_mult': 2.5, 'td_mins': 1080}. Best is trial 29 with value: 1.9600482462895854.
[I 2026-03-12 00:49:16,498] Trial 169 pruned. 
[I 2026-03-12 00:49:16,544] Trial 170 finished with value: 0.0 and parameters: {'timeframe': 'M3', 'atr_period': 13, 'atr_threshold': 8.0, 'pt_mult': 0.5, 'sl_mult': 0.5, 'td_mins': 180}. Best is trial 29 with value: 1.9600482462895854.
[I 2026-03-12 00:49:16,670] Trial 171 pruned. 
[I 2026-03-12 00:49:17,210] Trial 172 finished with value: 0.9605893631791573 and parameters: {'timeframe': 'M3', 'atr_period': 13, 'atr_threshold': 3.0, 'pt_mult': 0.5, 'sl_mult': 2.5, 'td_mins': 720}. Best is trial 29 with value: 1.9600482462895854.
[I 2026-03-12 00:49:17,263] Trial 173 finished with value: 0.0 and parameters: {'timeframe': 'M3', 'atr_period': 13, 'atr_threshold': 5.0, 'pt_mult': 2.5, 'sl_mult': 2.5, 'td_mins': 1080}. Best is trial 29 with value: 1.9600482462895854.
[I 2026-03-12 00:49:17,566] Trial 174 finished with value: 1.0232406681918491 and parameters: {'timeframe': 'M3', 'atr_period': 13, 'atr_threshold': 2.0, 'pt_mult': 0.5, 'sl_mult': 0.5, 'td_mins': 180}. Best is trial 29 with value: 1.9600482462895854.
[I 2026-03-12 00:49:18,531] Trial 175 finished with value: 1.0442269021530788 and parameters: {'timeframe': 'M3', 'atr_period': 13, 'atr_threshold': 2.0, 'pt_mult': 1.0, 'sl_mult': 0.5, 'td_mins': 1080}. Best is trial 29 with value: 1.9600482462895854.
[I 2026-03-12 00:49:18,576] Trial 176 finished with value: 0.0 and parameters: {'timeframe': 'M3', 'atr_period': 13, 'atr_threshold': 5.0, 'pt_mult': 1.0, 'sl_mult': 2.5, 'td_mins': 15}. Best is trial 29 with value: 1.9600482462895854.
[I 2026-03-12 00:49:18,686] Trial 177 pruned. 
[I 2026-03-12 00:49:18,731] Trial 178 finished with value: 0.0 and parameters: {'timeframe': 'M3', 'atr_period': 13, 'atr_threshold': 5.0, 'pt_mult': 0.5, 'sl_mult': 1.0, 'td_mins': 720}. Best is trial 29 with value: 1.9600482462895854.
[I 2026-03-12 00:49:18,775] Trial 179 finished with value: 0.0 and parameters: {'timeframe': 'M3', 'atr_period': 13, 'atr_threshold': 10.0, 'pt_mult': 2.5, 'sl_mult': 0.5, 'td_mins': 30}. Best is trial 29 with value: 1.9600482462895854.
[I 2026-03-12 00:49:18,819] Trial 180 pruned. 
[I 2026-03-12 00:49:18,862] Trial 181 finished with value: 0.0 and parameters: {'timeframe': 'M3', 'atr_period': 13, 'atr_threshold': 15.0, 'pt_mult': 0.5, 'sl_mult': 0.5, 'td_mins': 120}. Best is trial 29 with value: 1.9600482462895854.
[I 2026-03-12 00:49:18,906] Trial 182 finished with value: 0.0 and parameters: {'timeframe': 'M3', 'atr_period': 13, 'atr_threshold': 15.0, 'pt_mult': 0.5, 'sl_mult': 5.0, 'td_mins': 5}. Best is trial 29 with value: 1.9600482462895854.
[I 2026-03-12 00:49:19,152] Trial 183 finished with value: 1.018591447722128 and parameters: {'timeframe': 'M3', 'atr_period': 13, 'atr_threshold': 2.0, 'pt_mult': 1.0, 'sl_mult': 0.5, 'td_mins': 60}. Best is trial 29 with value: 1.9600482462895854.
[I 2026-03-12 00:49:19,252] Trial 184 finished with value: 0.8793859233298319 and parameters: {'timeframe': 'M3', 'atr_period': 13, 'atr_threshold': 3.0, 'pt_mult': 1.0, 'sl_mult': 0.5, 'td_mins': 30}. Best is trial 29 with value: 1.9600482462895854.
[I 2026-03-12 00:49:19,297] Trial 185 finished with value: 0.0 and parameters: {'timeframe': 'M3', 'atr_period': 13, 'atr_threshold': 5.0, 'pt_mult': 1.0, 'sl_mult': 1.0, 'td_mins': 5}. Best is trial 29 with value: 1.9600482462895854.
[I 2026-03-12 00:49:19,342] Trial 186 finished with value: 0.0 and parameters: {'timeframe': 'M3', 'atr_period': 13, 'atr_threshold': 15.0, 'pt_mult': 5.0, 'sl_mult': 2.5, 'td_mins': 1200}. Best is trial 29 with value: 1.9600482462895854.
[I 2026-03-12 00:49:20,286] Trial 187 pruned. 
[I 2026-03-12 00:49:20,331] Trial 188 finished with value: 0.0 and parameters: {'timeframe': 'M3', 'atr_period': 13, 'atr_threshold': 10.0, 'pt_mult': 2.5, 'sl_mult': 5.0, 'td_mins': 120}. Best is trial 29 with value: 1.9600482462895854.
[I 2026-03-12 00:49:20,679] Trial 189 pruned. 
[I 2026-03-12 00:49:20,730] Trial 190 finished with value: 0.0 and parameters: {'timeframe': 'M3', 'atr_period': 13, 'atr_threshold': 5.0, 'pt_mult': 1.0, 'sl_mult': 0.5, 'td_mins': 15}. Best is trial 29 with value: 1.9600482462895854.
[I 2026-03-12 00:49:20,784] Trial 191 finished with value: 0.0 and parameters: {'timeframe': 'M3', 'atr_period': 13, 'atr_threshold': 5.0, 'pt_mult': 2.5, 'sl_mult': 1.0, 'td_mins': 180}. Best is trial 29 with value: 1.9600482462895854.
[I 2026-03-12 00:49:21,182] Trial 192 pruned. 
[I 2026-03-12 00:49:21,327] Trial 193 pruned. 
[I 2026-03-12 00:49:21,959] Trial 194 finished with value: 1.0946098042259618 and parameters: {'timeframe': 'M3', 'atr_period': 13, 'atr_threshold': 2.0, 'pt_mult': 1.0, 'sl_mult': 2.5, 'td_mins': 180}. Best is trial 29 with value: 1.9600482462895854.
[I 2026-03-12 00:49:22,006] Trial 195 finished with value: 0.0 and parameters: {'timeframe': 'M3', 'atr_period': 13, 'atr_threshold': 10.0, 'pt_mult': 1.0, 'sl_mult': 1.0, 'td_mins': 360}. Best is trial 29 with value: 1.9600482462895854.
[I 2026-03-12 00:49:22,052] Trial 196 finished with value: 0.0 and parameters: {'timeframe': 'M3', 'atr_period': 13, 'atr_threshold': 15.0, 'pt_mult': 0.5, 'sl_mult': 2.5, 'td_mins': 120}. Best is trial 29 with value: 1.9600482462895854.
[I 2026-03-12 00:49:24,075] Trial 197 pruned. 
[I 2026-03-12 00:49:24,121] Trial 198 finished with value: 0.0 and parameters: {'timeframe': 'M3', 'atr_period': 13, 'atr_threshold': 5.0, 'pt_mult': 1.0, 'sl_mult': 1.0, 'td_mins': 15}. Best is trial 29 with value: 1.9600482462895854.
[I 2026-03-12 00:49:24,450] Trial 199 finished with value: 0.9881118967047968 and parameters: {'timeframe': 'M3', 'atr_period': 13, 'atr_threshold': 3.0, 'pt_mult': 0.5, 'sl_mult': 0.5, 'td_mins': 1200}. Best is trial 29 with value: 1.9600482462895854.
[I 2026-03-12 00:49:24,496] Trial 200 finished with value: 0.0 and parameters: {'timeframe': 'M3', 'atr_period': 13, 'atr_threshold': 15.0, 'pt_mult': 2.5, 'sl_mult': 2.5, 'td_mins': 5}. Best is trial 29 with value: 1.9600482462895854.
[I 2026-03-12 00:49:25,025] Trial 201 pruned. 
[I 2026-03-12 00:49:25,070] Trial 202 finished with value: 0.0 and parameters: {'timeframe': 'M3', 'atr_period': 13, 'atr_threshold': 5.0, 'pt_mult': 0.5, 'sl_mult': 2.5, 'td_mins': 360}. Best is trial 29 with value: 1.9600482462895854.
[I 2026-03-12 00:49:25,318] Trial 203 pruned. 
[I 2026-03-12 00:49:25,635] Trial 204 finished with value: 1.0831122039962209 and parameters: {'timeframe': 'M3', 'atr_period': 13, 'atr_threshold': 2.0, 'pt_mult': 0.5, 'sl_mult': 2.5, 'td_mins': 60}. Best is trial 29 with value: 1.9600482462895854.
[I 2026-03-12 00:49:26,659] Trial 205 finished with value: 1.0442269021530788 and parameters: {'timeframe': 'M3', 'atr_period': 13, 'atr_threshold': 2.0, 'pt_mult': 1.0, 'sl_mult': 0.5, 'td_mins': 1080}. Best is trial 29 with value: 1.9600482462895854.
[I 2026-03-12 00:49:26,702] Trial 206 finished with value: 0.0 and parameters: {'timeframe': 'M3', 'atr_period': 13, 'atr_threshold': 15.0, 'pt_mult': 1.0, 'sl_mult': 2.5, 'td_mins': 60}. Best is trial 29 with value: 1.9600482462895854.
[I 2026-03-12 00:49:26,748] Trial 207 finished with value: 0.0 and parameters: {'timeframe': 'M3', 'atr_period': 13, 'atr_threshold': 8.0, 'pt_mult': 2.5, 'sl_mult': 5.0, 'td_mins': 180}. Best is trial 29 with value: 1.9600482462895854.
[I 2026-03-12 00:49:26,967] Trial 208 pruned. 
[I 2026-03-12 00:49:27,901] Trial 209 pruned. 
[I 2026-03-12 00:49:28,441] Trial 210 finished with value: 1.2582788722172804 and parameters: {'timeframe': 'M3', 'atr_period': 13, 'atr_threshold': 3.0, 'pt_mult': 2.5, 'sl_mult': 5.0, 'td_mins': 360}. Best is trial 29 with value: 1.9600482462895854.
[I 2026-03-12 00:49:28,486] Trial 211 finished with value: 0.0 and parameters: {'timeframe': 'M3', 'atr_period': 13, 'atr_threshold': 15.0, 'pt_mult': 2.5, 'sl_mult': 2.5, 'td_mins': 1080}. Best is trial 29 with value: 1.9600482462895854.
[I 2026-03-12 00:49:29,175] Trial 212 finished with value: 1.0860216303874286 and parameters: {'timeframe': 'M3', 'atr_period': 13, 'atr_threshold': 3.0, 'pt_mult': 2.5, 'sl_mult': 0.5, 'td_mins': 1080}. Best is trial 29 with value: 1.9600482462895854.
[I 2026-03-12 00:49:29,220] Trial 213 finished with value: 0.0 and parameters: {'timeframe': 'M3', 'atr_period': 13, 'atr_threshold': 10.0, 'pt_mult': 0.5, 'sl_mult': 5.0, 'td_mins': 30}. Best is trial 29 with value: 1.9600482462895854.
[I 2026-03-12 00:49:29,324] Trial 214 pruned. 
[I 2026-03-12 00:49:30,123] Trial 215 pruned. 
[I 2026-03-12 00:49:30,169] Trial 216 finished with value: 0.0 and parameters: {'timeframe': 'M3', 'atr_period': 13, 'atr_threshold': 8.0, 'pt_mult': 0.5, 'sl_mult': 0.5, 'td_mins': 120}. Best is trial 29 with value: 1.9600482462895854.
[I 2026-03-12 00:49:30,567] Trial 217 finished with value: 1.0447012709534917 and parameters: {'timeframe': 'M3', 'atr_period': 13, 'atr_threshold': 2.0, 'pt_mult': 1.0, 'sl_mult': 0.5, 'td_mins': 180}. Best is trial 29 with value: 1.9600482462895854.
[I 2026-03-12 00:49:30,860] Trial 218 pruned. 
[I 2026-03-12 00:49:30,921] Trial 219 pruned. 
[I 2026-03-12 00:49:30,971] Trial 220 finished with value: 0.0 and parameters: {'timeframe': 'M3', 'atr_period': 13, 'atr_threshold': 15.0, 'pt_mult': 2.5, 'sl_mult': 0.5, 'td_mins': 30}. Best is trial 29 with value: 1.9600482462895854.
[I 2026-03-12 00:49:31,304] Trial 221 finished with value: 1.040704285719099 and parameters: {'timeframe': 'M3', 'atr_period': 13, 'atr_threshold': 2.0, 'pt_mult': 1.0, 'sl_mult': 0.5, 'td_mins': 120}. Best is trial 29 with value: 1.9600482462895854.
[I 2026-03-12 00:49:31,346] Trial 222 finished with value: 0.0 and parameters: {'timeframe': 'M3', 'atr_period': 13, 'atr_threshold': 8.0, 'pt_mult': 5.0, 'sl_mult': 2.5, 'td_mins': 720}. Best is trial 29 with value: 1.9600482462895854.
[I 2026-03-12 00:49:31,391] Trial 223 finished with value: 0.0 and parameters: {'timeframe': 'M3', 'atr_period': 13, 'atr_threshold': 8.0, 'pt_mult': 0.5, 'sl_mult': 1.0, 'td_mins': 1080}. Best is trial 29 with value: 1.9600482462895854.
[I 2026-03-12 00:49:31,497] Trial 224 pruned. 
[I 2026-03-12 00:49:31,546] Trial 225 finished with value: 0.0 and parameters: {'timeframe': 'M3', 'atr_period': 13, 'atr_threshold': 5.0, 'pt_mult': 2.5, 'sl_mult': 5.0, 'td_mins': 720}. Best is trial 29 with value: 1.9600482462895854.
[I 2026-03-12 00:49:31,659] Trial 226 finished with value: 2.6610758639085312 and parameters: {'timeframe': 'M3', 'atr_period': 13, 'atr_threshold': 3.0, 'pt_mult': 0.5, 'sl_mult': 5.0, 'td_mins': 30}. Best is trial 226 with value: 2.6610758639085312.
[I 2026-03-12 00:49:31,700] Trial 227 finished with value: 0.0 and parameters: {'timeframe': 'M3', 'atr_period': 13, 'atr_threshold': 10.0, 'pt_mult': 5.0, 'sl_mult': 0.5, 'td_mins': 1080}. Best is trial 226 with value: 2.6610758639085312.
[I 2026-03-12 00:49:32,055] Trial 228 pruned. 
