[I 2026-03-12 01:02:26,849] Trial 141 finished with value: 0.5531095800455945 and parameters: {'timeframe': 'M8', 'atr_period': 13, 'atr_threshold': 5.0, 'pt_mult': 0.5, 'sl_mult': 0.5, 'td_mins': 30}. Best is trial 57 with value: 2.2537359686354455.
[I 2026-03-12 01:02:26,954] Trial 142 pruned. 
[I 2026-03-12 01:02:27,009] Trial 143 pruned. 
[I 2026-03-12 01:02:27,479] Trial 144 pruned. 
[I 2026-03-12 01:02:27,568] Trial 145 pruned. 
[I 2026-03-12 01:02:27,613] Trial 146 finished with value: 0.0 and parameters: {'timeframe': 'M8', 'atr_period': 13, 'atr_threshold': 10.0, 'pt_mult': 0.5, 'sl_mult': 0.5, 'td_mins': 360}. Best is trial 57 with value: 2.2537359686354455.
[I 2026-03-12 01:02:27,657] Trial 147 finished with value: 0.0 and parameters: {'timeframe': 'M8', 'atr_period': 13, 'atr_threshold': 8.0, 'pt_mult': 0.5, 'sl_mult': 2.5, 'td_mins': 5}. Best is trial 57 with value: 2.2537359686354455.
[I 2026-03-12 01:02:28,175] Trial 148 pruned. 
[I 2026-03-12 01:02:28,324] Trial 149 pruned. 
[I 2026-03-12 01:02:28,389] Trial 150 finished with value: 0.6098125126760727 and parameters: {'timeframe': 'M8', 'atr_period': 13, 'atr_threshold': 5.0, 'pt_mult': 0.5, 'sl_mult': 1.0, 'td_mins': 30}. Best is trial 57 with value: 2.2537359686354455.
[I 2026-03-12 01:02:28,674] Trial 151 finished with value: 1.7890188082679814 and parameters: {'timeframe': 'M8', 'atr_period': 13, 'atr_threshold': 3.0, 'pt_mult': 1.0, 'sl_mult': 5.0, 'td_mins': 120}. Best is trial 57 with value: 2.2537359686354455.
[I 2026-03-12 01:02:28,840] Trial 152 pruned. 
[I 2026-03-12 01:02:28,928] Trial 153 finished with value: 0.6315791983181811 and parameters: {'timeframe': 'M8', 'atr_period': 13, 'atr_threshold': 5.0, 'pt_mult': 0.5, 'sl_mult': 0.5, 'td_mins': 180}. Best is trial 57 with value: 2.2537359686354455.
[I 2026-03-12 01:02:28,972] Trial 154 finished with value: 0.0 and parameters: {'timeframe': 'M8', 'atr_period': 13, 'atr_threshold': 10.0, 'pt_mult': 5.0, 'sl_mult': 5.0, 'td_mins': 1200}. Best is trial 57 with value: 2.2537359686354455.
[I 2026-03-12 01:02:29,065] Trial 155 pruned. 
[I 2026-03-12 01:02:29,240] Trial 156 pruned. 
[I 2026-03-12 01:02:29,547] Trial 157 finished with value: 1.1872056933314095 and parameters: {'timeframe': 'M8', 'atr_period': 13, 'atr_threshold': 3.0, 'pt_mult': 0.5, 'sl_mult': 2.5, 'td_mins': 180}. Best is trial 57 with value: 2.2537359686354455.
[I 2026-03-12 01:02:29,593] Trial 158 finished with value: 0.0 and parameters: {'timeframe': 'M8', 'atr_period': 13, 'atr_threshold': 15.0, 'pt_mult': 1.0, 'sl_mult': 0.5, 'td_mins': 1200}. Best is trial 57 with value: 2.2537359686354455.
[I 2026-03-12 01:02:29,639] Trial 159 finished with value: 0.0 and parameters: {'timeframe': 'M8', 'atr_period': 13, 'atr_threshold': 15.0, 'pt_mult': 1.0, 'sl_mult': 0.5, 'td_mins': 120}. Best is trial 57 with value: 2.2537359686354455.
[I 2026-03-12 01:02:31,107] Trial 160 pruned. 
[I 2026-03-12 01:02:31,190] Trial 161 finished with value: 1.4188342665491664 and parameters: {'timeframe': 'M8', 'atr_period': 13, 'atr_threshold': 5.0, 'pt_mult': 0.5, 'sl_mult': 5.0, 'td_mins': 60}. Best is trial 57 with value: 2.2537359686354455.
[I 2026-03-12 01:02:31,366] Trial 162 finished with value: 2.2537359686354455 and parameters: {'timeframe': 'M8', 'atr_period': 13, 'atr_threshold': 3.0, 'pt_mult': 0.5, 'sl_mult': 5.0, 'td_mins': 60}. Best is trial 57 with value: 2.2537359686354455.
[I 2026-03-12 01:02:31,410] Trial 163 finished with value: 0.0 and parameters: {'timeframe': 'M8', 'atr_period': 13, 'atr_threshold': 10.0, 'pt_mult': 1.0, 'sl_mult': 0.5, 'td_mins': 180}. Best is trial 57 with value: 2.2537359686354455.
[I 2026-03-12 01:02:31,454] Trial 164 finished with value: 0.0 and parameters: {'timeframe': 'M8', 'atr_period': 13, 'atr_threshold': 10.0, 'pt_mult': 5.0, 'sl_mult': 0.5, 'td_mins': 1200}. Best is trial 57 with value: 2.2537359686354455.
[I 2026-03-12 01:02:31,498] Trial 165 finished with value: 0.0 and parameters: {'timeframe': 'M8', 'atr_period': 13, 'atr_threshold': 15.0, 'pt_mult': 2.5, 'sl_mult': 2.5, 'td_mins': 120}. Best is trial 57 with value: 2.2537359686354455.
[I 2026-03-12 01:02:31,700] Trial 166 pruned. 
[I 2026-03-12 01:02:31,777] Trial 167 finished with value: 0.5414205482915604 and parameters: {'timeframe': 'M8', 'atr_period': 13, 'atr_threshold': 5.0, 'pt_mult': 1.0, 'sl_mult': 0.5, 'td_mins': 60}. Best is trial 57 with value: 2.2537359686354455.
[I 2026-03-12 01:02:31,825] Trial 168 finished with value: 0.0 and parameters: {'timeframe': 'M8', 'atr_period': 13, 'atr_threshold': 8.0, 'pt_mult': 0.5, 'sl_mult': 0.5, 'td_mins': 1200}. Best is trial 57 with value: 2.2537359686354455.
[I 2026-03-12 01:02:31,897] Trial 169 pruned. 
[I 2026-03-12 01:02:31,968] Trial 170 finished with value: 0.8866452532216755 and parameters: {'timeframe': 'M8', 'atr_period': 13, 'atr_threshold': 5.0, 'pt_mult': 1.0, 'sl_mult': 5.0, 'td_mins': 15}. Best is trial 57 with value: 2.2537359686354455.
[I 2026-03-12 01:02:32,016] Trial 171 finished with value: 0.0 and parameters: {'timeframe': 'M8', 'atr_period': 13, 'atr_threshold': 10.0, 'pt_mult': 0.5, 'sl_mult': 1.0, 'td_mins': 1200}. Best is trial 57 with value: 2.2537359686354455.
[I 2026-03-12 01:02:32,706] Trial 172 pruned. 
[I 2026-03-12 01:02:32,750] Trial 173 finished with value: 0.0 and parameters: {'timeframe': 'M8', 'atr_period': 13, 'atr_threshold': 10.0, 'pt_mult': 1.0, 'sl_mult': 2.5, 'td_mins': 30}. Best is trial 57 with value: 2.2537359686354455.
[I 2026-03-12 01:02:32,841] Trial 174 pruned. 
[I 2026-03-12 01:02:32,912] Trial 175 pruned. 
[I 2026-03-12 01:02:36,366] Trial 176 finished with value: 1.1019825220396504 and parameters: {'timeframe': 'M8', 'atr_period': 13, 'atr_threshold': 2.0, 'pt_mult': 0.5, 'sl_mult': 5.0, 'td_mins': 1200}. Best is trial 57 with value: 2.2537359686354455.
[I 2026-03-12 01:02:36,414] Trial 177 finished with value: 0.0 and parameters: {'timeframe': 'M8', 'atr_period': 13, 'atr_threshold': 10.0, 'pt_mult': 1.0, 'sl_mult': 5.0, 'td_mins': 1080}. Best is trial 57 with value: 2.2537359686354455.
[I 2026-03-12 01:02:36,462] Trial 178 finished with value: 0.0 and parameters: {'timeframe': 'M8', 'atr_period': 13, 'atr_threshold': 10.0, 'pt_mult': 0.5, 'sl_mult': 2.5, 'td_mins': 5}. Best is trial 57 with value: 2.2537359686354455.
[I 2026-03-12 01:02:36,594] Trial 179 pruned. 
[I 2026-03-12 01:02:36,646] Trial 180 finished with value: 0.0 and parameters: {'timeframe': 'M8', 'atr_period': 13, 'atr_threshold': 15.0, 'pt_mult': 1.0, 'sl_mult': 1.0, 'td_mins': 720}. Best is trial 57 with value: 2.2537359686354455.
[I 2026-03-12 01:02:36,702] Trial 181 finished with value: 0.0 and parameters: {'timeframe': 'M8', 'atr_period': 13, 'atr_threshold': 15.0, 'pt_mult': 1.0, 'sl_mult': 5.0, 'td_mins': 30}. Best is trial 57 with value: 2.2537359686354455.
[I 2026-03-12 01:02:36,753] Trial 182 finished with value: 0.0 and parameters: {'timeframe': 'M8', 'atr_period': 13, 'atr_threshold': 8.0, 'pt_mult': 5.0, 'sl_mult': 2.5, 'td_mins': 720}. Best is trial 57 with value: 2.2537359686354455.
[I 2026-03-12 01:02:38,078] Trial 183 finished with value: 1.3866949191051645 and parameters: {'timeframe': 'M8', 'atr_period': 13, 'atr_threshold': 2.0, 'pt_mult': 1.0, 'sl_mult': 5.0, 'td_mins': 360}. Best is trial 57 with value: 2.2537359686354455.
[I 2026-03-12 01:02:38,142] Trial 184 pruned. 
[I 2026-03-12 01:02:38,214] Trial 185 pruned. 
[I 2026-03-12 01:02:38,919] Trial 186 finished with value: 1.080305450124016 and parameters: {'timeframe': 'M8', 'atr_period': 13, 'atr_threshold': 3.0, 'pt_mult': 2.5, 'sl_mult': 5.0, 'td_mins': 360}. Best is trial 57 with value: 2.2537359686354455.
[I 2026-03-12 01:02:38,970] Trial 187 pruned. 
[I 2026-03-12 01:02:39,018] Trial 188 finished with value: 0.0 and parameters: {'timeframe': 'M8', 'atr_period': 13, 'atr_threshold': 10.0, 'pt_mult': 5.0, 'sl_mult': 5.0, 'td_mins': 180}. Best is trial 57 with value: 2.2537359686354455.
[I 2026-03-12 01:02:39,085] Trial 189 pruned. 
[I 2026-03-12 01:02:39,128] Trial 190 finished with value: 0.0 and parameters: {'timeframe': 'M8', 'atr_period': 13, 'atr_threshold': 15.0, 'pt_mult': 1.0, 'sl_mult': 0.5, 'td_mins': 30}. Best is trial 57 with value: 2.2537359686354455.
[I 2026-03-12 01:02:39,320] Trial 191 finished with value: 0.6315791983181811 and parameters: {'timeframe': 'M8', 'atr_period': 13, 'atr_threshold': 5.0, 'pt_mult': 0.5, 'sl_mult': 0.5, 'td_mins': 1200}. Best is trial 57 with value: 2.2537359686354455.
[I 2026-03-12 01:02:39,366] Trial 192 finished with value: 0.0 and parameters: {'timeframe': 'M8', 'atr_period': 13, 'atr_threshold': 15.0, 'pt_mult': 1.0, 'sl_mult': 1.0, 'td_mins': 1200}. Best is trial 57 with value: 2.2537359686354455.
[I 2026-03-12 01:02:39,412] Trial 193 finished with value: 0.0 and parameters: {'timeframe': 'M8', 'atr_period': 13, 'atr_threshold': 15.0, 'pt_mult': 0.5, 'sl_mult': 2.5, 'td_mins': 60}. Best is trial 57 with value: 2.2537359686354455.
[I 2026-03-12 01:02:39,453] Trial 194 finished with value: 0.0 and parameters: {'timeframe': 'M8', 'atr_period': 13, 'atr_threshold': 15.0, 'pt_mult': 1.0, 'sl_mult': 2.5, 'td_mins': 720}. Best is trial 57 with value: 2.2537359686354455.
[I 2026-03-12 01:02:39,495] Trial 195 finished with value: 0.0 and parameters: {'timeframe': 'M8', 'atr_period': 13, 'atr_threshold': 15.0, 'pt_mult': 1.0, 'sl_mult': 5.0, 'td_mins': 360}. Best is trial 57 with value: 2.2537359686354455.
[I 2026-03-12 01:02:39,551] Trial 196 pruned. 
[I 2026-03-12 01:02:39,594] Trial 197 finished with value: 0.0 and parameters: {'timeframe': 'M8', 'atr_period': 13, 'atr_threshold': 10.0, 'pt_mult': 0.5, 'sl_mult': 2.5, 'td_mins': 60}. Best is trial 57 with value: 2.2537359686354455.
[I 2026-03-12 01:02:40,005] Trial 198 pruned. 
[I 2026-03-12 01:02:40,136] Trial 199 finished with value: 0.6480238775357912 and parameters: {'timeframe': 'M8', 'atr_period': 13, 'atr_threshold': 5.0, 'pt_mult': 1.0, 'sl_mult': 0.5, 'td_mins': 360}. Best is trial 57 with value: 2.2537359686354455.
[I 2026-03-12 01:02:41,172] Trial 200 pruned. 
[I 2026-03-12 01:02:41,793] Trial 201 finished with value: 1.4921559295483433 and parameters: {'timeframe': 'M8', 'atr_period': 13, 'atr_threshold': 3.0, 'pt_mult': 1.0, 'sl_mult': 5.0, 'td_mins': 360}. Best is trial 57 with value: 2.2537359686354455.
[I 2026-03-12 01:02:41,862] Trial 202 pruned. 
[I 2026-03-12 01:02:41,914] Trial 203 finished with value: 0.0 and parameters: {'timeframe': 'M8', 'atr_period': 13, 'atr_threshold': 10.0, 'pt_mult': 5.0, 'sl_mult': 0.5, 'td_mins': 360}. Best is trial 57 with value: 2.2537359686354455.
[I 2026-03-12 01:02:43,130] Trial 204 finished with value: 1.048430897067708 and parameters: {'timeframe': 'M8', 'atr_period': 13, 'atr_threshold': 3.0, 'pt_mult': 0.5, 'sl_mult': 2.5, 'td_mins': 1200}. Best is trial 57 with value: 2.2537359686354455.
[I 2026-03-12 01:02:43,288] Trial 205 pruned. 
[I 2026-03-12 01:02:43,642] Trial 206 pruned. 
[I 2026-03-12 01:02:44,059] Trial 207 pruned. 
[I 2026-03-12 01:02:44,105] Trial 208 finished with value: 0.0 and parameters: {'timeframe': 'M8', 'atr_period': 13, 'atr_threshold': 8.0, 'pt_mult': 5.0, 'sl_mult': 2.5, 'td_mins': 15}. Best is trial 57 with value: 2.2537359686354455.
[I 2026-03-12 01:02:44,148] Trial 209 finished with value: 0.0 and parameters: {'timeframe': 'M8', 'atr_period': 13, 'atr_threshold': 15.0, 'pt_mult': 5.0, 'sl_mult': 1.0, 'td_mins': 30}. Best is trial 57 with value: 2.2537359686354455.
[I 2026-03-12 01:02:44,244] Trial 210 pruned. 
[I 2026-03-12 01:02:44,293] Trial 211 pruned. 
[I 2026-03-12 01:02:44,360] Trial 212 pruned. 
[I 2026-03-12 01:02:44,403] Trial 213 finished with value: 0.0 and parameters: {'timeframe': 'M8', 'atr_period': 13, 'atr_threshold': 15.0, 'pt_mult': 2.5, 'sl_mult': 1.0, 'td_mins': 60}. Best is trial 57 with value: 2.2537359686354455.
[I 2026-03-12 01:02:44,929] Trial 214 finished with value: 1.5016543358486985 and parameters: {'timeframe': 'M8', 'atr_period': 13, 'atr_threshold': 0.5, 'pt_mult': 1.0, 'sl_mult': 5.0, 'td_mins': 60}. Best is trial 57 with value: 2.2537359686354455.
[I 2026-03-12 01:02:46,525] Trial 215 pruned. 
[I 2026-03-12 01:02:46,570] Trial 216 finished with value: 0.0 and parameters: {'timeframe': 'M8', 'atr_period': 13, 'atr_threshold': 15.0, 'pt_mult': 5.0, 'sl_mult': 5.0, 'td_mins': 720}. Best is trial 57 with value: 2.2537359686354455.
[I 2026-03-12 01:02:46,737] Trial 217 pruned. 
[I 2026-03-12 01:02:46,789] Trial 218 finished with value: 0.0 and parameters: {'timeframe': 'M8', 'atr_period': 13, 'atr_threshold': 10.0, 'pt_mult': 5.0, 'sl_mult': 5.0, 'td_mins': 360}. Best is trial 57 with value: 2.2537359686354455.
[I 2026-03-12 01:02:47,684] Trial 219 finished with value: 1.141997452037134 and parameters: {'timeframe': 'M8', 'atr_period': 13, 'atr_threshold': 3.0, 'pt_mult': 1.0, 'sl_mult': 1.0, 'td_mins': 1080}. Best is trial 57 with value: 2.2537359686354455.
[I 2026-03-12 01:02:47,727] Trial 220 finished with value: 0.0 and parameters: {'timeframe': 'M8', 'atr_period': 13, 'atr_threshold': 8.0, 'pt_mult': 5.0, 'sl_mult': 1.0, 'td_mins': 1200}. Best is trial 57 with value: 2.2537359686354455.
[I 2026-03-12 01:02:47,772] Trial 221 finished with value: 0.0 and parameters: {'timeframe': 'M8', 'atr_period': 13, 'atr_threshold': 8.0, 'pt_mult': 0.5, 'sl_mult': 2.5, 'td_mins': 5}. Best is trial 57 with value: 2.2537359686354455.
[I 2026-03-12 01:02:47,816] Trial 222 finished with value: 0.0 and parameters: {'timeframe': 'M8', 'atr_period': 13, 'atr_threshold': 15.0, 'pt_mult': 1.0, 'sl_mult': 5.0, 'td_mins': 720}. Best is trial 57 with value: 2.2537359686354455.
[I 2026-03-12 01:02:48,354] Trial 223 pruned. 
[I 2026-03-12 01:02:48,566] Trial 224 finished with value: 1.2272810136109047 and parameters: {'timeframe': 'M8', 'atr_period': 13, 'atr_threshold': 2.0, 'pt_mult': 0.5, 'sl_mult': 2.5, 'td_mins': 30}. Best is trial 57 with value: 2.2537359686354455.
[I 2026-03-12 01:02:48,709] Trial 225 pruned. 
[I 2026-03-12 01:02:48,926] Trial 226 finished with value: 0.6480238775357912 and parameters: {'timeframe': 'M8', 'atr_period': 13, 'atr_threshold': 5.0, 'pt_mult': 1.0, 'sl_mult': 0.5, 'td_mins': 1080}. Best is trial 57 with value: 2.2537359686354455.
[I 2026-03-12 01:02:48,969] Trial 227 finished with value: 0.0 and parameters: {'timeframe': 'M8', 'atr_period': 13, 'atr_threshold': 15.0, 'pt_mult': 1.0, 'sl_mult': 0.5, 'td_mins': 360}. Best is trial 57 with value: 2.2537359686354455.
[I 2026-03-12 01:02:49,065] Trial 228 pruned. 
[I 2026-03-12 01:02:49,647] Trial 229 pruned. 
[I 2026-03-12 01:02:49,697] Trial 230 finished with value: 0.0 and parameters: {'timeframe': 'M8', 'atr_period': 13, 'atr_threshold': 10.0, 'pt_mult': 0.5, 'sl_mult': 5.0, 'td_mins': 60}. Best is trial 57 with value: 2.2537359686354455.
[I 2026-03-12 01:02:49,912] Trial 231 finished with value: 0.6480238775357912 and parameters: {'timeframe': 'M8', 'atr_period': 13, 'atr_threshold': 5.0, 'pt_mult': 1.0, 'sl_mult': 0.5, 'td_mins': 1080}. Best is trial 57 with value: 2.2537359686354455.
[I 2026-03-12 01:02:50,044] Trial 232 pruned. 
[I 2026-03-12 01:02:50,755] Trial 233 pruned. 
[I 2026-03-12 01:02:51,042] Trial 234 finished with value: 0.6033837323509215 and parameters: {'timeframe': 'M8', 'atr_period': 13, 'atr_threshold': 5.0, 'pt_mult': 2.5, 'sl_mult': 1.0, 'td_mins': 720}. Best is trial 57 with value: 2.2537359686354455.
[I 2026-03-12 01:02:52,272] Trial 235 pruned. 
[I 2026-03-12 01:02:52,321] Trial 236 finished with value: 0.0 and parameters: {'timeframe': 'M8', 'atr_period': 13, 'atr_threshold': 10.0, 'pt_mult': 1.0, 'sl_mult': 0.5, 'td_mins': 120}. Best is trial 57 with value: 2.2537359686354455.
[I 2026-03-12 01:02:52,368] Trial 237 finished with value: 0.0 and parameters: {'timeframe': 'M8', 'atr_period': 13, 'atr_threshold': 15.0, 'pt_mult': 0.5, 'sl_mult': 1.0, 'td_mins': 30}. Best is trial 57 with value: 2.2537359686354455.
[I 2026-03-12 01:02:52,460] Trial 238 pruned. 
[I 2026-03-12 01:02:52,506] Trial 239 finished with value: 0.0 and parameters: {'timeframe': 'M8', 'atr_period': 13, 'atr_threshold': 10.0, 'pt_mult': 5.0, 'sl_mult': 2.5, 'td_mins': 5}. Best is trial 57 with value: 2.2537359686354455.
[I 2026-03-12 01:02:52,550] Trial 240 finished with value: 0.0 and parameters: {'timeframe': 'M8', 'atr_period': 13, 'atr_threshold': 10.0, 'pt_mult': 5.0, 'sl_mult': 2.5, 'td_mins': 60}. Best is trial 57 with value: 2.2537359686354455.
[I 2026-03-12 01:02:52,593] Trial 241 finished with value: 0.0 and parameters: {'timeframe': 'M8', 'atr_period': 13, 'atr_threshold': 10.0, 'pt_mult': 1.0, 'sl_mult': 2.5, 'td_mins': 5}. Best is trial 57 with value: 2.2537359686354455.
[I 2026-03-12 01:02:52,635] Trial 242 finished with value: 0.0 and parameters: {'timeframe': 'M8', 'atr_period': 13, 'atr_threshold': 8.0, 'pt_mult': 5.0, 'sl_mult': 1.0, 'td_mins': 120}. Best is trial 57 with value: 2.2537359686354455.
[I 2026-03-12 01:02:53,464] Trial 243 pruned. 
[I 2026-03-12 01:02:53,597] Trial 244 pruned. 
[I 2026-03-12 01:02:53,761] Trial 245 pruned. 
[I 2026-03-12 01:02:53,853] Trial 246 pruned. 
[I 2026-03-12 01:02:53,895] Trial 247 finished with value: 0.0 and parameters: {'timeframe': 'M8', 'atr_period': 13, 'atr_threshold': 15.0, 'pt_mult': 5.0, 'sl_mult': 1.0, 'td_mins': 720}. Best is trial 57 with value: 2.2537359686354455.
[I 2026-03-12 01:02:53,939] Trial 248 finished with value: 0.0 and parameters: {'timeframe': 'M8', 'atr_period': 13, 'atr_threshold': 8.0, 'pt_mult': 5.0, 'sl_mult': 0.5, 'td_mins': 120}. Best is trial 57 with value: 2.2537359686354455.
[I 2026-03-12 01:02:54,233] Trial 249 pruned. 
[I 2026-03-12 01:02:54,289] Trial 250 pruned. 
[I 2026-03-12 01:02:54,725] Trial 251 pruned. 
[I 2026-03-12 01:02:54,778] Trial 252 pruned. 
[I 2026-03-12 01:02:54,844] Trial 253 pruned. 
[I 2026-03-12 01:02:54,887] Trial 254 finished with value: 0.0 and parameters: {'timeframe': 'M8', 'atr_period': 13, 'atr_threshold': 15.0, 'pt_mult': 2.5, 'sl_mult': 0.5, 'td_mins': 720}. Best is trial 57 with value: 2.2537359686354455.
[I 2026-03-12 01:02:55,086] Trial 255 pruned. 
[I 2026-03-12 01:02:55,129] Trial 256 finished with value: 0.0 and parameters: {'timeframe': 'M8', 'atr_period': 13, 'atr_threshold': 15.0, 'pt_mult': 0.5, 'sl_mult': 2.5, 'td_mins': 60}. Best is trial 57 with value: 2.2537359686354455.
[I 2026-03-12 01:02:55,186] Trial 257 pruned. 
[I 2026-03-12 01:02:55,825] Trial 258 pruned. 
[I 2026-03-12 01:02:55,873] Trial 259 finished with value: 0.0 and parameters: {'timeframe': 'M8', 'atr_period': 13, 'atr_threshold': 15.0, 'pt_mult': 2.5, 'sl_mult': 2.5, 'td_mins': 720}. Best is trial 57 with value: 2.2537359686354455.
[I 2026-03-12 01:02:55,971] Trial 260 pruned. 
[I 2026-03-12 01:02:56,049] Trial 261 pruned. 
[I 2026-03-12 01:02:56,095] Trial 262 finished with value: 0.0 and parameters: {'timeframe': 'M8', 'atr_period': 13, 'atr_threshold': 8.0, 'pt_mult': 5.0, 'sl_mult': 5.0, 'td_mins': 5}. Best is trial 57 with value: 2.2537359686354455.
[I 2026-03-12 01:02:56,144] Trial 263 finished with value: 0.0 and parameters: {'timeframe': 'M8', 'atr_period': 13, 'atr_threshold': 8.0, 'pt_mult': 1.0, 'sl_mult': 1.0, 'td_mins': 60}. Best is trial 57 with value: 2.2537359686354455.
[I 2026-03-12 01:02:56,206] Trial 264 pruned. 
[I 2026-03-12 01:02:56,298] Trial 265 pruned. 
[I 2026-03-12 01:02:56,573] Trial 266 pruned. 
[I 2026-03-12 01:02:57,305] Trial 267 pruned. 
[I 2026-03-12 01:02:57,364] Trial 268 finished with value: 0.0 and parameters: {'timeframe': 'M8', 'atr_period': 13, 'atr_threshold': 10.0, 'pt_mult': 5.0, 'sl_mult': 2.5, 'td_mins': 120}. Best is trial 57 with value: 2.2537359686354455.
[I 2026-03-12 01:02:57,417] Trial 269 finished with value: 0.0 and parameters: {'timeframe': 'M8', 'atr_period': 13, 'atr_threshold': 10.0, 'pt_mult': 2.5, 'sl_mult': 2.5, 'td_mins': 720}. Best is trial 57 with value: 2.2537359686354455.
[I 2026-03-12 01:02:57,518] Trial 270 pruned. 
[I 2026-03-12 01:02:57,569] Trial 271 finished with value: 0.0 and parameters: {'timeframe': 'M8', 'atr_period': 13, 'atr_threshold': 10.0, 'pt_mult': 5.0, 'sl_mult': 0.5, 'td_mins': 720}. Best is trial 57 with value: 2.2537359686354455.
[I 2026-03-12 01:02:59,440] Trial 272 finished with value: 1.0526348110676307 and parameters: {'timeframe': 'M8', 'atr_period': 13, 'atr_threshold': 3.0, 'pt_mult': 0.5, 'sl_mult': 5.0, 'td_mins': 1200}. Best is trial 57 with value: 2.2537359686354455.
[I 2026-03-12 01:02:59,606] Trial 273 pruned. 
[I 2026-03-12 01:02:59,737] Trial 274 pruned. 
[I 2026-03-12 01:02:59,898] Trial 275 pruned. 
[I 2026-03-12 01:02:59,972] Trial 276 pruned. 
[I 2026-03-12 01:03:00,026] Trial 277 finished with value: 0.0 and parameters: {'timeframe': 'M8', 'atr_period': 13, 'atr_threshold': 8.0, 'pt_mult': 0.5, 'sl_mult': 2.5, 'td_mins': 360}. Best is trial 57 with value: 2.2537359686354455.
[I 2026-03-12 01:03:00,076] Trial 278 finished with value: 0.0 and parameters: {'timeframe': 'M8', 'atr_period': 13, 'atr_threshold': 15.0, 'pt_mult': 0.5, 'sl_mult': 5.0, 'td_mins': 360}. Best is trial 57 with value: 2.2537359686354455.
[I 2026-03-12 01:03:00,136] Trial 279 finished with value: 0.568784134734875 and parameters: {'timeframe': 'M8', 'atr_period': 13, 'atr_threshold': 5.0, 'pt_mult': 0.5, 'sl_mult': 1.0, 'td_mins': 15}. Best is trial 57 with value: 2.2537359686354455.
[I 2026-03-12 01:03:00,182] Trial 280 finished with value: 0.0 and parameters: {'timeframe': 'M8', 'atr_period': 13, 'atr_threshold': 10.0, 'pt_mult': 1.0, 'sl_mult': 1.0, 'td_mins': 5}. Best is trial 57 with value: 2.2537359686354455.
[I 2026-03-12 01:03:00,241] Trial 281 pruned. 
[I 2026-03-12 01:03:00,611] Trial 282 pruned. 
[I 2026-03-12 01:03:00,662] Trial 283 finished with value: 0.0 and parameters: {'timeframe': 'M8', 'atr_period': 13, 'atr_threshold': 10.0, 'pt_mult': 1.0, 'sl_mult': 1.0, 'td_mins': 1200}. Best is trial 57 with value: 2.2537359686354455.
