[I 2026-03-12 00:52:07,832] Trial 993 finished with value: 2.6610758639085312 and parameters: {'timeframe': 'M3', 'atr_period': 13, 'atr_threshold': 3.0, 'pt_mult': 0.5, 'sl_mult': 5.0, 'td_mins': 30}. Best is trial 226 with value: 2.6610758639085312.
[I 2026-03-12 00:52:07,949] Trial 994 pruned. 
[I 2026-03-12 00:52:08,014] Trial 995 finished with value: 0.0 and parameters: {'timeframe': 'M3', 'atr_period': 13, 'atr_threshold': 15.0, 'pt_mult': 0.5, 'sl_mult': 5.0, 'td_mins': 30}. Best is trial 226 with value: 2.6610758639085312.
[I 2026-03-12 00:52:08,071] Trial 996 finished with value: 0.0 and parameters: {'timeframe': 'M3', 'atr_period': 13, 'atr_threshold': 15.0, 'pt_mult': 0.5, 'sl_mult': 1.0, 'td_mins': 360}. Best is trial 226 with value: 2.6610758639085312.
[I 2026-03-12 00:52:08,130] Trial 997 finished with value: 0.0 and parameters: {'timeframe': 'M3', 'atr_period': 13, 'atr_threshold': 5.0, 'pt_mult': 1.0, 'sl_mult': 5.0, 'td_mins': 360}. Best is trial 226 with value: 2.6610758639085312.
[I 2026-03-12 00:52:08,253] Trial 998 finished with value: 2.6610758639085312 and parameters: {'timeframe': 'M3', 'atr_period': 13, 'atr_threshold': 3.0, 'pt_mult': 0.5, 'sl_mult': 5.0, 'td_mins': 30}. Best is trial 226 with value: 2.6610758639085312.
[I 2026-03-12 00:52:08,303] Trial 999 finished with value: 0.0 and parameters: {'timeframe': 'M3', 'atr_period': 13, 'atr_threshold': 5.0, 'pt_mult': 0.5, 'sl_mult': 2.5, 'td_mins': 1080}. Best is trial 226 with value: 2.6610758639085312.
2026-03-12 00:52:08,361 - INFO - === Starting Optuna Optimization for M5 (Trials: 1000) ===
/home/hephaestus-zero/.local/lib/python3.11/site-packages/optuna/_experimental.py:32: ExperimentalWarning: Argument ``multivariate`` is an experimental feature. The interface can change in the future.
  warnings.warn(
[I 2026-03-12 00:52:08,361] A new study created in memory with name: no-name-50bd33b2-2385-43f5-ad4e-37f0e9712e8b
2026-03-12 00:52:08,363 - INFO -     [Cache Miss] Loading Signal Data for M5, ATR=13...
2026-03-12 00:52:46,199 - INFO -     [Cache Miss] Loading Signal Data for M5, ATR=13...
2026-03-12 00:53:23,104 - INFO -     [Cache Miss] Loading Signal Data for M5, ATR=13...
2026-03-12 00:54:00,294 - INFO -     [Cache Miss] Loading Signal Data for M5, ATR=13...
2026-03-12 00:54:38,101 - INFO -     [Cache Miss] Loading Signal Data for M5, ATR=13...
[I 2026-03-12 00:55:14,872] Trial 0 finished with value: 0.0 and parameters: {'timeframe': 'M5', 'atr_period': 13, 'atr_threshold': 5.0, 'pt_mult': 2.5, 'sl_mult': 2.5, 'td_mins': 180}. Best is trial 0 with value: 0.0.
[I 2026-03-12 00:55:14,915] Trial 1 finished with value: 0.0 and parameters: {'timeframe': 'M5', 'atr_period': 13, 'atr_threshold': 8.0, 'pt_mult': 0.5, 'sl_mult': 0.5, 'td_mins': 15}. Best is trial 0 with value: 0.0.
[I 2026-03-12 00:55:14,962] Trial 2 finished with value: 0.0 and parameters: {'timeframe': 'M5', 'atr_period': 13, 'atr_threshold': 15.0, 'pt_mult': 5.0, 'sl_mult': 2.5, 'td_mins': 360}. Best is trial 0 with value: 0.0.
[I 2026-03-12 00:55:15,017] Trial 3 finished with value: 0.0 and parameters: {'timeframe': 'M5', 'atr_period': 13, 'atr_threshold': 8.0, 'pt_mult': 1.0, 'sl_mult': 0.5, 'td_mins': 1200}. Best is trial 0 with value: 0.0.
[I 2026-03-12 00:55:16,433] Trial 4 finished with value: 0.5510758436274821 and parameters: {'timeframe': 'M5', 'atr_period': 13, 'atr_threshold': 2.0, 'pt_mult': 5.0, 'sl_mult': 1.0, 'td_mins': 360}. Best is trial 4 with value: 0.5510758436274821.
[I 2026-03-12 00:55:16,480] Trial 5 finished with value: 0.0 and parameters: {'timeframe': 'M5', 'atr_period': 13, 'atr_threshold': 8.0, 'pt_mult': 1.0, 'sl_mult': 1.0, 'td_mins': 1080}. Best is trial 4 with value: 0.5510758436274821.
[I 2026-03-12 00:55:16,524] Trial 6 finished with value: 0.0 and parameters: {'timeframe': 'M5', 'atr_period': 13, 'atr_threshold': 15.0, 'pt_mult': 5.0, 'sl_mult': 5.0, 'td_mins': 720}. Best is trial 4 with value: 0.5510758436274821.
[I 2026-03-12 00:55:18,308] Trial 7 finished with value: 0.9862771427371241 and parameters: {'timeframe': 'M5', 'atr_period': 13, 'atr_threshold': 3.0, 'pt_mult': 5.0, 'sl_mult': 0.5, 'td_mins': 1200}. Best is trial 7 with value: 0.9862771427371241.
[I 2026-03-12 00:55:18,363] Trial 8 finished with value: 0.0 and parameters: {'timeframe': 'M5', 'atr_period': 13, 'atr_threshold': 15.0, 'pt_mult': 1.0, 'sl_mult': 2.5, 'td_mins': 360}. Best is trial 7 with value: 0.9862771427371241.
[I 2026-03-12 00:55:18,423] Trial 9 finished with value: 0.0 and parameters: {'timeframe': 'M5', 'atr_period': 13, 'atr_threshold': 10.0, 'pt_mult': 2.5, 'sl_mult': 5.0, 'td_mins': 1080}. Best is trial 7 with value: 0.9862771427371241.
[I 2026-03-12 00:55:20,628] Trial 10 finished with value: 1.0118305736976947 and parameters: {'timeframe': 'M5', 'atr_period': 13, 'atr_threshold': 1.0, 'pt_mult': 0.5, 'sl_mult': 2.5, 'td_mins': 360}. Best is trial 10 with value: 1.0118305736976947.
[I 2026-03-12 00:55:24,888] Trial 11 finished with value: 1.006117561079299 and parameters: {'timeframe': 'M5', 'atr_period': 13, 'atr_threshold': 0.5, 'pt_mult': 1.0, 'sl_mult': 1.0, 'td_mins': 1200}. Best is trial 10 with value: 1.0118305736976947.
[I 2026-03-12 00:55:26,101] Trial 12 finished with value: 0.45437098089606687 and parameters: {'timeframe': 'M5', 'atr_period': 13, 'atr_threshold': 1.0, 'pt_mult': 5.0, 'sl_mult': 0.5, 'td_mins': 120}. Best is trial 10 with value: 1.0118305736976947.
[I 2026-03-12 00:55:26,348] Trial 13 finished with value: 0.16325155701701943 and parameters: {'timeframe': 'M5', 'atr_period': 13, 'atr_threshold': 2.0, 'pt_mult': 2.5, 'sl_mult': 0.5, 'td_mins': 15}. Best is trial 10 with value: 1.0118305736976947.
[I 2026-03-12 00:55:27,121] Trial 14 finished with value: 0.49973156703086286 and parameters: {'timeframe': 'M5', 'atr_period': 13, 'atr_threshold': 3.0, 'pt_mult': 5.0, 'sl_mult': 5.0, 'td_mins': 360}. Best is trial 10 with value: 1.0118305736976947.
[I 2026-03-12 00:55:27,632] Trial 15 finished with value: 1.0662424837261235 and parameters: {'timeframe': 'M5', 'atr_period': 13, 'atr_threshold': 3.0, 'pt_mult': 0.5, 'sl_mult': 2.5, 'td_mins': 360}. Best is trial 15 with value: 1.0662424837261235.
[I 2026-03-12 00:55:28,914] Trial 16 finished with value: 1.29264323878274 and parameters: {'timeframe': 'M5', 'atr_period': 13, 'atr_threshold': 2.0, 'pt_mult': 0.5, 'sl_mult': 5.0, 'td_mins': 360}. Best is trial 16 with value: 1.29264323878274.
[I 2026-03-12 00:55:29,376] Trial 17 finished with value: 1.0662424837261235 and parameters: {'timeframe': 'M5', 'atr_period': 13, 'atr_threshold': 3.0, 'pt_mult': 0.5, 'sl_mult': 2.5, 'td_mins': 360}. Best is trial 16 with value: 1.29264323878274.
[I 2026-03-12 00:55:29,425] Trial 18 finished with value: 0.0 and parameters: {'timeframe': 'M5', 'atr_period': 13, 'atr_threshold': 10.0, 'pt_mult': 0.5, 'sl_mult': 1.0, 'td_mins': 30}. Best is trial 16 with value: 1.29264323878274.
[I 2026-03-12 00:55:30,524] Trial 19 finished with value: 1.0170343175909982 and parameters: {'timeframe': 'M5', 'atr_period': 13, 'atr_threshold': 2.0, 'pt_mult': 0.5, 'sl_mult': 0.5, 'td_mins': 1200}. Best is trial 16 with value: 1.29264323878274.
[I 2026-03-12 00:55:30,575] Trial 20 finished with value: 0.0 and parameters: {'timeframe': 'M5', 'atr_period': 13, 'atr_threshold': 8.0, 'pt_mult': 2.5, 'sl_mult': 5.0, 'td_mins': 180}. Best is trial 16 with value: 1.29264323878274.
[I 2026-03-12 00:55:31,340] Trial 21 pruned. 
[I 2026-03-12 00:55:31,782] Trial 22 finished with value: 1.3713859874610388 and parameters: {'timeframe': 'M5', 'atr_period': 13, 'atr_threshold': 1.0, 'pt_mult': 1.0, 'sl_mult': 5.0, 'td_mins': 30}. Best is trial 22 with value: 1.3713859874610388.
[I 2026-03-12 00:55:31,828] Trial 23 finished with value: 0.0 and parameters: {'timeframe': 'M5', 'atr_period': 13, 'atr_threshold': 10.0, 'pt_mult': 1.0, 'sl_mult': 1.0, 'td_mins': 360}. Best is trial 22 with value: 1.3713859874610388.
[I 2026-03-12 00:55:31,878] Trial 24 finished with value: 0.0 and parameters: {'timeframe': 'M5', 'atr_period': 13, 'atr_threshold': 8.0, 'pt_mult': 0.5, 'sl_mult': 0.5, 'td_mins': 120}. Best is trial 22 with value: 1.3713859874610388.
[I 2026-03-12 00:55:31,951] Trial 25 pruned. 
[I 2026-03-12 00:55:31,999] Trial 26 finished with value: 0.0 and parameters: {'timeframe': 'M5', 'atr_period': 13, 'atr_threshold': 15.0, 'pt_mult': 1.0, 'sl_mult': 0.5, 'td_mins': 120}. Best is trial 22 with value: 1.3713859874610388.
[I 2026-03-12 00:55:32,139] Trial 27 finished with value: 1.0914760502837044 and parameters: {'timeframe': 'M5', 'atr_period': 13, 'atr_threshold': 3.0, 'pt_mult': 1.0, 'sl_mult': 2.5, 'td_mins': 30}. Best is trial 22 with value: 1.3713859874610388.
[I 2026-03-12 00:55:32,205] Trial 28 finished with value: 0.0 and parameters: {'timeframe': 'M5', 'atr_period': 13, 'atr_threshold': 15.0, 'pt_mult': 1.0, 'sl_mult': 2.5, 'td_mins': 180}. Best is trial 22 with value: 1.3713859874610388.
[I 2026-03-12 00:55:32,264] Trial 29 finished with value: 0.0 and parameters: {'timeframe': 'M5', 'atr_period': 13, 'atr_threshold': 8.0, 'pt_mult': 1.0, 'sl_mult': 0.5, 'td_mins': 30}. Best is trial 22 with value: 1.3713859874610388.
[I 2026-03-12 00:55:35,899] Trial 30 finished with value: 1.1575126260194044 and parameters: {'timeframe': 'M5', 'atr_period': 13, 'atr_threshold': 0.5, 'pt_mult': 1.0, 'sl_mult': 5.0, 'td_mins': 360}. Best is trial 22 with value: 1.3713859874610388.
[I 2026-03-12 00:55:35,948] Trial 31 finished with value: 0.0 and parameters: {'timeframe': 'M5', 'atr_period': 13, 'atr_threshold': 10.0, 'pt_mult': 5.0, 'sl_mult': 2.5, 'td_mins': 180}. Best is trial 22 with value: 1.3713859874610388.
[I 2026-03-12 00:55:36,003] Trial 32 finished with value: 0.0 and parameters: {'timeframe': 'M5', 'atr_period': 13, 'atr_threshold': 10.0, 'pt_mult': 1.0, 'sl_mult': 2.5, 'td_mins': 15}. Best is trial 22 with value: 1.3713859874610388.
[I 2026-03-12 00:55:36,053] Trial 33 finished with value: 0.0 and parameters: {'timeframe': 'M5', 'atr_period': 13, 'atr_threshold': 5.0, 'pt_mult': 1.0, 'sl_mult': 0.5, 'td_mins': 1080}. Best is trial 22 with value: 1.3713859874610388.
[I 2026-03-12 00:55:37,145] Trial 34 finished with value: 1.0654988140116148 and parameters: {'timeframe': 'M5', 'atr_period': 13, 'atr_threshold': 2.0, 'pt_mult': 1.0, 'sl_mult': 2.5, 'td_mins': 360}. Best is trial 22 with value: 1.3713859874610388.
[I 2026-03-12 00:55:37,406] Trial 35 finished with value: 1.0525613709739794 and parameters: {'timeframe': 'M5', 'atr_period': 13, 'atr_threshold': 3.0, 'pt_mult': 0.5, 'sl_mult': 1.0, 'td_mins': 120}. Best is trial 22 with value: 1.3713859874610388.
[I 2026-03-12 00:55:38,293] Trial 36 pruned. 
[I 2026-03-12 00:55:38,866] Trial 37 finished with value: 1.1035408439825674 and parameters: {'timeframe': 'M5', 'atr_period': 13, 'atr_threshold': 2.0, 'pt_mult': 1.0, 'sl_mult': 2.5, 'td_mins': 120}. Best is trial 22 with value: 1.3713859874610388.
[I 2026-03-12 00:55:38,917] Trial 38 finished with value: 0.0 and parameters: {'timeframe': 'M5', 'atr_period': 13, 'atr_threshold': 15.0, 'pt_mult': 2.5, 'sl_mult': 2.5, 'td_mins': 720}. Best is trial 22 with value: 1.3713859874610388.
[I 2026-03-12 00:55:39,168] Trial 39 pruned. 
[I 2026-03-12 00:55:39,241] Trial 40 pruned. 
[I 2026-03-12 00:55:39,294] Trial 41 finished with value: 0.0 and parameters: {'timeframe': 'M5', 'atr_period': 13, 'atr_threshold': 15.0, 'pt_mult': 1.0, 'sl_mult': 5.0, 'td_mins': 180}. Best is trial 22 with value: 1.3713859874610388.
[I 2026-03-12 00:55:40,016] Trial 42 finished with value: 1.641470502456864 and parameters: {'timeframe': 'M5', 'atr_period': 13, 'atr_threshold': 1.0, 'pt_mult': 0.5, 'sl_mult': 5.0, 'td_mins': 60}. Best is trial 42 with value: 1.641470502456864.
[I 2026-03-12 00:55:40,063] Trial 43 finished with value: 0.0 and parameters: {'timeframe': 'M5', 'atr_period': 13, 'atr_threshold': 5.0, 'pt_mult': 0.5, 'sl_mult': 1.0, 'td_mins': 60}. Best is trial 42 with value: 1.641470502456864.
[I 2026-03-12 00:55:40,119] Trial 44 finished with value: 0.0 and parameters: {'timeframe': 'M5', 'atr_period': 13, 'atr_threshold': 10.0, 'pt_mult': 5.0, 'sl_mult': 0.5, 'td_mins': 30}. Best is trial 42 with value: 1.641470502456864.
[I 2026-03-12 00:55:40,164] Trial 45 finished with value: 0.0 and parameters: {'timeframe': 'M5', 'atr_period': 13, 'atr_threshold': 15.0, 'pt_mult': 1.0, 'sl_mult': 2.5, 'td_mins': 5}. Best is trial 42 with value: 1.641470502456864.
[I 2026-03-12 00:55:40,979] Trial 46 finished with value: 1.0857474902969555 and parameters: {'timeframe': 'M5', 'atr_period': 13, 'atr_threshold': 2.0, 'pt_mult': 1.0, 'sl_mult': 2.5, 'td_mins': 180}. Best is trial 42 with value: 1.641470502456864.
[I 2026-03-12 00:55:41,073] Trial 47 finished with value: 0.0 and parameters: {'timeframe': 'M5', 'atr_period': 13, 'atr_threshold': 5.0, 'pt_mult': 0.5, 'sl_mult': 1.0, 'td_mins': 60}. Best is trial 42 with value: 1.641470502456864.
[I 2026-03-12 00:55:41,223] Trial 48 pruned. 
[I 2026-03-12 00:55:41,296] Trial 49 pruned. 
[I 2026-03-12 00:55:41,608] Trial 50 pruned. 
[I 2026-03-12 00:55:41,655] Trial 51 finished with value: 0.0 and parameters: {'timeframe': 'M5', 'atr_period': 13, 'atr_threshold': 5.0, 'pt_mult': 5.0, 'sl_mult': 5.0, 'td_mins': 180}. Best is trial 42 with value: 1.641470502456864.
[I 2026-03-12 00:55:42,983] Trial 52 pruned. 
[I 2026-03-12 00:55:43,040] Trial 53 finished with value: 0.0 and parameters: {'timeframe': 'M5', 'atr_period': 13, 'atr_threshold': 15.0, 'pt_mult': 2.5, 'sl_mult': 0.5, 'td_mins': 180}. Best is trial 42 with value: 1.641470502456864.
[I 2026-03-12 00:55:43,255] Trial 54 pruned. 
[I 2026-03-12 00:55:43,303] Trial 55 finished with value: 0.0 and parameters: {'timeframe': 'M5', 'atr_period': 13, 'atr_threshold': 15.0, 'pt_mult': 2.5, 'sl_mult': 2.5, 'td_mins': 360}. Best is trial 42 with value: 1.641470502456864.
[I 2026-03-12 00:55:43,353] Trial 56 finished with value: 0.0 and parameters: {'timeframe': 'M5', 'atr_period': 13, 'atr_threshold': 15.0, 'pt_mult': 2.5, 'sl_mult': 5.0, 'td_mins': 360}. Best is trial 42 with value: 1.641470502456864.
[I 2026-03-12 00:55:43,404] Trial 57 finished with value: 0.0 and parameters: {'timeframe': 'M5', 'atr_period': 13, 'atr_threshold': 8.0, 'pt_mult': 1.0, 'sl_mult': 2.5, 'td_mins': 5}. Best is trial 42 with value: 1.641470502456864.
[I 2026-03-12 00:55:43,952] Trial 58 pruned. 
[I 2026-03-12 00:55:44,089] Trial 59 pruned. 
[I 2026-03-12 00:55:44,216] Trial 60 pruned. 
[I 2026-03-12 00:55:45,774] Trial 61 pruned. 
[I 2026-03-12 00:55:45,822] Trial 62 finished with value: 0.0 and parameters: {'timeframe': 'M5', 'atr_period': 13, 'atr_threshold': 15.0, 'pt_mult': 0.5, 'sl_mult': 1.0, 'td_mins': 1200}. Best is trial 42 with value: 1.641470502456864.
[I 2026-03-12 00:55:45,875] Trial 63 finished with value: 0.0 and parameters: {'timeframe': 'M5', 'atr_period': 13, 'atr_threshold': 8.0, 'pt_mult': 5.0, 'sl_mult': 2.5, 'td_mins': 120}. Best is trial 42 with value: 1.641470502456864.
[I 2026-03-12 00:55:45,931] Trial 64 finished with value: 0.0 and parameters: {'timeframe': 'M5', 'atr_period': 13, 'atr_threshold': 8.0, 'pt_mult': 0.5, 'sl_mult': 0.5, 'td_mins': 60}. Best is trial 42 with value: 1.641470502456864.
[I 2026-03-12 00:55:45,981] Trial 65 finished with value: 0.0 and parameters: {'timeframe': 'M5', 'atr_period': 13, 'atr_threshold': 10.0, 'pt_mult': 5.0, 'sl_mult': 0.5, 'td_mins': 15}. Best is trial 42 with value: 1.641470502456864.
[I 2026-03-12 00:55:46,592] Trial 66 pruned. 
[I 2026-03-12 00:55:46,651] Trial 67 finished with value: 0.0 and parameters: {'timeframe': 'M5', 'atr_period': 13, 'atr_threshold': 15.0, 'pt_mult': 2.5, 'sl_mult': 5.0, 'td_mins': 1080}. Best is trial 42 with value: 1.641470502456864.
[I 2026-03-12 00:55:46,712] Trial 68 finished with value: 0.0 and parameters: {'timeframe': 'M5', 'atr_period': 13, 'atr_threshold': 15.0, 'pt_mult': 1.0, 'sl_mult': 5.0, 'td_mins': 720}. Best is trial 42 with value: 1.641470502456864.
[I 2026-03-12 00:55:46,762] Trial 69 finished with value: 0.0 and parameters: {'timeframe': 'M5', 'atr_period': 13, 'atr_threshold': 8.0, 'pt_mult': 2.5, 'sl_mult': 2.5, 'td_mins': 360}. Best is trial 42 with value: 1.641470502456864.
[I 2026-03-12 00:55:46,866] Trial 70 pruned. 
[I 2026-03-12 00:55:48,434] Trial 71 pruned. 
[I 2026-03-12 00:55:48,664] Trial 72 pruned. 
[I 2026-03-12 00:55:48,720] Trial 73 pruned. 
[I 2026-03-12 00:55:48,956] Trial 74 pruned. 
[I 2026-03-12 00:55:49,003] Trial 75 finished with value: 0.0 and parameters: {'timeframe': 'M5', 'atr_period': 13, 'atr_threshold': 15.0, 'pt_mult': 5.0, 'sl_mult': 0.5, 'td_mins': 360}. Best is trial 42 with value: 1.641470502456864.
[I 2026-03-12 00:55:49,147] Trial 76 pruned. 
[I 2026-03-12 00:55:49,199] Trial 77 finished with value: 0.0 and parameters: {'timeframe': 'M5', 'atr_period': 13, 'atr_threshold': 8.0, 'pt_mult': 0.5, 'sl_mult': 1.0, 'td_mins': 360}. Best is trial 42 with value: 1.641470502456864.
[I 2026-03-12 00:55:49,250] Trial 78 finished with value: 0.0 and parameters: {'timeframe': 'M5', 'atr_period': 13, 'atr_threshold': 5.0, 'pt_mult': 1.0, 'sl_mult': 1.0, 'td_mins': 1080}. Best is trial 42 with value: 1.641470502456864.
[I 2026-03-12 00:55:49,303] Trial 79 finished with value: 0.0 and parameters: {'timeframe': 'M5', 'atr_period': 13, 'atr_threshold': 8.0, 'pt_mult': 0.5, 'sl_mult': 5.0, 'td_mins': 180}. Best is trial 42 with value: 1.641470502456864.
[I 2026-03-12 00:55:49,351] Trial 80 finished with value: 0.0 and parameters: {'timeframe': 'M5', 'atr_period': 13, 'atr_threshold': 10.0, 'pt_mult': 2.5, 'sl_mult': 2.5, 'td_mins': 1200}. Best is trial 42 with value: 1.641470502456864.
[I 2026-03-12 00:55:49,398] Trial 81 finished with value: 0.0 and parameters: {'timeframe': 'M5', 'atr_period': 13, 'atr_threshold': 10.0, 'pt_mult': 5.0, 'sl_mult': 5.0, 'td_mins': 5}. Best is trial 42 with value: 1.641470502456864.
[I 2026-03-12 00:55:51,164] Trial 82 finished with value: 0.9347411191941248 and parameters: {'timeframe': 'M5', 'atr_period': 13, 'atr_threshold': 3.0, 'pt_mult': 1.0, 'sl_mult': 5.0, 'td_mins': 1080}. Best is trial 42 with value: 1.641470502456864.
[I 2026-03-12 00:55:51,309] Trial 83 pruned. 
[I 2026-03-12 00:55:51,363] Trial 84 finished with value: 0.0 and parameters: {'timeframe': 'M5', 'atr_period': 13, 'atr_threshold': 5.0, 'pt_mult': 5.0, 'sl_mult': 0.5, 'td_mins': 15}. Best is trial 42 with value: 1.641470502456864.
[I 2026-03-12 00:55:51,436] Trial 85 finished with value: 0.0 and parameters: {'timeframe': 'M5', 'atr_period': 13, 'atr_threshold': 10.0, 'pt_mult': 0.5, 'sl_mult': 1.0, 'td_mins': 1080}. Best is trial 42 with value: 1.641470502456864.
[I 2026-03-12 00:55:52,756] Trial 86 pruned. 
[I 2026-03-12 00:55:52,811] Trial 87 finished with value: 0.0 and parameters: {'timeframe': 'M5', 'atr_period': 13, 'atr_threshold': 10.0, 'pt_mult': 1.0, 'sl_mult': 2.5, 'td_mins': 5}. Best is trial 42 with value: 1.641470502456864.
[I 2026-03-12 00:55:52,863] Trial 88 finished with value: 0.0 and parameters: {'timeframe': 'M5', 'atr_period': 13, 'atr_threshold': 15.0, 'pt_mult': 5.0, 'sl_mult': 1.0, 'td_mins': 5}. Best is trial 42 with value: 1.641470502456864.
[I 2026-03-12 00:55:52,915] Trial 89 finished with value: 0.0 and parameters: {'timeframe': 'M5', 'atr_period': 13, 'atr_threshold': 5.0, 'pt_mult': 0.5, 'sl_mult': 0.5, 'td_mins': 15}. Best is trial 42 with value: 1.641470502456864.
[I 2026-03-12 00:55:55,306] Trial 90 pruned. 
[I 2026-03-12 00:55:56,166] Trial 91 pruned. 
[I 2026-03-12 00:55:56,461] Trial 92 pruned. 
[I 2026-03-12 00:55:57,694] Trial 93 pruned. 
[I 2026-03-12 00:55:58,015] Trial 94 pruned. 
[I 2026-03-12 00:55:58,062] Trial 95 finished with value: 0.0 and parameters: {'timeframe': 'M5', 'atr_period': 13, 'atr_threshold': 5.0, 'pt_mult': 5.0, 'sl_mult': 2.5, 'td_mins': 1080}. Best is trial 42 with value: 1.641470502456864.
[I 2026-03-12 00:55:58,111] Trial 96 finished with value: 0.0 and parameters: {'timeframe': 'M5', 'atr_period': 13, 'atr_threshold': 8.0, 'pt_mult': 0.5, 'sl_mult': 0.5, 'td_mins': 720}. Best is trial 42 with value: 1.641470502456864.
[I 2026-03-12 00:55:58,161] Trial 97 finished with value: 0.0 and parameters: {'timeframe': 'M5', 'atr_period': 13, 'atr_threshold': 5.0, 'pt_mult': 5.0, 'sl_mult': 0.5, 'td_mins': 30}. Best is trial 42 with value: 1.641470502456864.
[I 2026-03-12 00:55:58,270] Trial 98 pruned. 
[I 2026-03-12 00:55:58,332] Trial 99 finished with value: 0.0 and parameters: {'timeframe': 'M5', 'atr_period': 13, 'atr_threshold': 5.0, 'pt_mult': 5.0, 'sl_mult': 0.5, 'td_mins': 5}. Best is trial 42 with value: 1.641470502456864.
[I 2026-03-12 00:55:58,382] Trial 100 finished with value: 0.0 and parameters: {'timeframe': 'M5', 'atr_period': 13, 'atr_threshold': 5.0, 'pt_mult': 5.0, 'sl_mult': 5.0, 'td_mins': 15}. Best is trial 42 with value: 1.641470502456864.
[I 2026-03-12 00:55:58,432] Trial 101 finished with value: 0.0 and parameters: {'timeframe': 'M5', 'atr_period': 13, 'atr_threshold': 8.0, 'pt_mult': 2.5, 'sl_mult': 5.0, 'td_mins': 5}. Best is trial 42 with value: 1.641470502456864.
[I 2026-03-12 00:55:58,479] Trial 102 finished with value: 0.0 and parameters: {'timeframe': 'M5', 'atr_period': 13, 'atr_threshold': 15.0, 'pt_mult': 5.0, 'sl_mult': 2.5, 'td_mins': 720}. Best is trial 42 with value: 1.641470502456864.
[I 2026-03-12 00:55:58,524] Trial 103 finished with value: 0.0 and parameters: {'timeframe': 'M5', 'atr_period': 13, 'atr_threshold': 10.0, 'pt_mult': 0.5, 'sl_mult': 5.0, 'td_mins': 15}. Best is trial 42 with value: 1.641470502456864.
[I 2026-03-12 00:55:58,571] Trial 104 finished with value: 0.0 and parameters: {'timeframe': 'M5', 'atr_period': 13, 'atr_threshold': 5.0, 'pt_mult': 2.5, 'sl_mult': 5.0, 'td_mins': 1200}. Best is trial 42 with value: 1.641470502456864.
[I 2026-03-12 00:55:58,628] Trial 105 pruned. 
