[I 2026-03-12 01:46:20,462] Trial 177 pruned. 
[I 2026-03-12 01:46:20,641] Trial 178 pruned. 
[I 2026-03-12 01:46:20,687] Trial 179 finished with value: 0.0 and parameters: {'timeframe': 'M5', 'atr_period': 13, 'atr_threshold': 5.0, 'pt_mult': 5.0, 'sl_mult': 0.5, 'td_mins': 1080}. Best is trial 17 with value: 2.3323020644376053.
[I 2026-03-12 01:46:20,731] Trial 180 finished with value: 0.0 and parameters: {'timeframe': 'M5', 'atr_period': 13, 'atr_threshold': 8.0, 'pt_mult': 1.0, 'sl_mult': 1.0, 'td_mins': 1200}. Best is trial 17 with value: 2.3323020644376053.
[I 2026-03-12 01:46:21,002] Trial 181 pruned. 
[I 2026-03-12 01:46:21,137] Trial 182 pruned. 
[I 2026-03-12 01:46:21,184] Trial 183 finished with value: 0.0 and parameters: {'timeframe': 'M5', 'atr_period': 13, 'atr_threshold': 8.0, 'pt_mult': 2.5, 'sl_mult': 2.5, 'td_mins': 15}. Best is trial 17 with value: 2.3323020644376053.
[I 2026-03-12 01:46:21,323] Trial 184 pruned. 
[I 2026-03-12 01:46:21,755] Trial 185 pruned. 
[I 2026-03-12 01:46:21,918] Trial 186 pruned. 
[I 2026-03-12 01:46:21,971] Trial 187 finished with value: 0.0 and parameters: {'timeframe': 'M5', 'atr_period': 13, 'atr_threshold': 8.0, 'pt_mult': 2.5, 'sl_mult': 1.0, 'td_mins': 120}. Best is trial 17 with value: 2.3323020644376053.
[I 2026-03-12 01:46:22,096] Trial 188 pruned. 
[I 2026-03-12 01:46:22,147] Trial 189 finished with value: 0.0 and parameters: {'timeframe': 'M5', 'atr_period': 13, 'atr_threshold': 15.0, 'pt_mult': 5.0, 'sl_mult': 1.0, 'td_mins': 1080}. Best is trial 17 with value: 2.3323020644376053.
[I 2026-03-12 01:46:22,199] Trial 190 finished with value: 0.0 and parameters: {'timeframe': 'M5', 'atr_period': 13, 'atr_threshold': 15.0, 'pt_mult': 0.5, 'sl_mult': 2.5, 'td_mins': 180}. Best is trial 17 with value: 2.3323020644376053.
[I 2026-03-12 01:46:22,355] Trial 191 pruned. 
[I 2026-03-12 01:46:23,041] Trial 192 finished with value: 1.9878745074088404 and parameters: {'timeframe': 'M5', 'atr_period': 13, 'atr_threshold': 3.0, 'pt_mult': 2.5, 'sl_mult': 5.0, 'td_mins': 360}. Best is trial 17 with value: 2.3323020644376053.
[I 2026-03-12 01:46:23,094] Trial 193 finished with value: 0.0 and parameters: {'timeframe': 'M5', 'atr_period': 13, 'atr_threshold': 10.0, 'pt_mult': 0.5, 'sl_mult': 0.5, 'td_mins': 720}. Best is trial 17 with value: 2.3323020644376053.
[I 2026-03-12 01:46:27,433] Trial 194 finished with value: 1.0857610488190874 and parameters: {'timeframe': 'M5', 'atr_period': 13, 'atr_threshold': 1.0, 'pt_mult': 1.0, 'sl_mult': 5.0, 'td_mins': 720}. Best is trial 17 with value: 2.3323020644376053.
[I 2026-03-12 01:46:29,360] Trial 195 pruned. 
[I 2026-03-12 01:46:29,764] Trial 196 finished with value: 1.0802831783128903 and parameters: {'timeframe': 'M5', 'atr_period': 13, 'atr_threshold': 3.0, 'pt_mult': 5.0, 'sl_mult': 5.0, 'td_mins': 180}. Best is trial 17 with value: 2.3323020644376053.
[I 2026-03-12 01:46:30,350] Trial 197 pruned. 
[I 2026-03-12 01:46:30,397] Trial 198 finished with value: 0.0 and parameters: {'timeframe': 'M5', 'atr_period': 13, 'atr_threshold': 5.0, 'pt_mult': 5.0, 'sl_mult': 2.5, 'td_mins': 180}. Best is trial 17 with value: 2.3323020644376053.
[I 2026-03-12 01:46:30,460] Trial 199 pruned. 
[I 2026-03-12 01:46:30,512] Trial 200 pruned. 
[I 2026-03-12 01:46:30,556] Trial 201 finished with value: 0.0 and parameters: {'timeframe': 'M5', 'atr_period': 13, 'atr_threshold': 8.0, 'pt_mult': 1.0, 'sl_mult': 0.5, 'td_mins': 60}. Best is trial 17 with value: 2.3323020644376053.
[I 2026-03-12 01:46:30,598] Trial 202 finished with value: 0.0 and parameters: {'timeframe': 'M5', 'atr_period': 13, 'atr_threshold': 8.0, 'pt_mult': 1.0, 'sl_mult': 5.0, 'td_mins': 360}. Best is trial 17 with value: 2.3323020644376053.
[I 2026-03-12 01:46:32,045] Trial 203 pruned. 
[I 2026-03-12 01:46:32,744] Trial 204 pruned. 
[I 2026-03-12 01:46:32,790] Trial 205 finished with value: 0.0 and parameters: {'timeframe': 'M5', 'atr_period': 13, 'atr_threshold': 5.0, 'pt_mult': 2.5, 'sl_mult': 2.5, 'td_mins': 120}. Best is trial 17 with value: 2.3323020644376053.
[I 2026-03-12 01:46:32,854] Trial 206 pruned. 
[I 2026-03-12 01:46:33,907] Trial 207 pruned. 
[I 2026-03-12 01:46:33,952] Trial 208 finished with value: 0.0 and parameters: {'timeframe': 'M5', 'atr_period': 13, 'atr_threshold': 15.0, 'pt_mult': 5.0, 'sl_mult': 1.0, 'td_mins': 1200}. Best is trial 17 with value: 2.3323020644376053.
[I 2026-03-12 01:46:34,400] Trial 209 finished with value: 1.7232334696153742 and parameters: {'timeframe': 'M5', 'atr_period': 13, 'atr_threshold': 0.5, 'pt_mult': 0.5, 'sl_mult': 5.0, 'td_mins': 30}. Best is trial 17 with value: 2.3323020644376053.
[I 2026-03-12 01:46:34,472] Trial 210 pruned. 
[I 2026-03-12 01:46:34,571] Trial 211 pruned. 
[I 2026-03-12 01:46:34,638] Trial 212 pruned. 
[I 2026-03-12 01:46:34,686] Trial 213 finished with value: 0.0 and parameters: {'timeframe': 'M5', 'atr_period': 13, 'atr_threshold': 10.0, 'pt_mult': 2.5, 'sl_mult': 0.5, 'td_mins': 30}. Best is trial 17 with value: 2.3323020644376053.
[I 2026-03-12 01:46:34,868] Trial 214 pruned. 
[I 2026-03-12 01:46:35,193] Trial 215 pruned. 
[I 2026-03-12 01:46:35,251] Trial 216 pruned. 
[I 2026-03-12 01:46:35,301] Trial 217 finished with value: 0.0 and parameters: {'timeframe': 'M5', 'atr_period': 13, 'atr_threshold': 10.0, 'pt_mult': 2.5, 'sl_mult': 0.5, 'td_mins': 60}. Best is trial 17 with value: 2.3323020644376053.
[I 2026-03-12 01:46:35,345] Trial 218 finished with value: 0.0 and parameters: {'timeframe': 'M5', 'atr_period': 13, 'atr_threshold': 8.0, 'pt_mult': 1.0, 'sl_mult': 5.0, 'td_mins': 1200}. Best is trial 17 with value: 2.3323020644376053.
[I 2026-03-12 01:46:35,966] Trial 219 finished with value: 1.8283701818560025 and parameters: {'timeframe': 'M5', 'atr_period': 13, 'atr_threshold': 1.0, 'pt_mult': 0.5, 'sl_mult': 5.0, 'td_mins': 60}. Best is trial 17 with value: 2.3323020644376053.
[I 2026-03-12 01:46:36,024] Trial 220 pruned. 
[I 2026-03-12 01:46:36,103] Trial 221 pruned. 
[I 2026-03-12 01:46:36,147] Trial 222 finished with value: 0.0 and parameters: {'timeframe': 'M5', 'atr_period': 13, 'atr_threshold': 5.0, 'pt_mult': 1.0, 'sl_mult': 0.5, 'td_mins': 1200}. Best is trial 17 with value: 2.3323020644376053.
[I 2026-03-12 01:46:36,192] Trial 223 finished with value: 0.0 and parameters: {'timeframe': 'M5', 'atr_period': 13, 'atr_threshold': 5.0, 'pt_mult': 5.0, 'sl_mult': 1.0, 'td_mins': 360}. Best is trial 17 with value: 2.3323020644376053.
[I 2026-03-12 01:46:36,237] Trial 224 finished with value: 0.0 and parameters: {'timeframe': 'M5', 'atr_period': 13, 'atr_threshold': 15.0, 'pt_mult': 2.5, 'sl_mult': 0.5, 'td_mins': 60}. Best is trial 17 with value: 2.3323020644376053.
[I 2026-03-12 01:46:36,613] Trial 225 finished with value: 1.8893132556849117 and parameters: {'timeframe': 'M5', 'atr_period': 13, 'atr_threshold': 1.0, 'pt_mult': 0.5, 'sl_mult': 5.0, 'td_mins': 30}. Best is trial 17 with value: 2.3323020644376053.
[I 2026-03-12 01:46:36,658] Trial 226 finished with value: 0.0 and parameters: {'timeframe': 'M5', 'atr_period': 13, 'atr_threshold': 15.0, 'pt_mult': 2.5, 'sl_mult': 0.5, 'td_mins': 120}. Best is trial 17 with value: 2.3323020644376053.
[I 2026-03-12 01:46:36,727] Trial 227 pruned. 
[I 2026-03-12 01:46:37,477] Trial 228 finished with value: 1.5157474605289696 and parameters: {'timeframe': 'M5', 'atr_period': 13, 'atr_threshold': 0.5, 'pt_mult': 1.0, 'sl_mult': 5.0, 'td_mins': 60}. Best is trial 17 with value: 2.3323020644376053.
[I 2026-03-12 01:46:37,527] Trial 229 pruned. 
[I 2026-03-12 01:46:37,596] Trial 230 pruned. 
[I 2026-03-12 01:46:40,211] Trial 231 pruned. 
[I 2026-03-12 01:46:40,259] Trial 232 finished with value: 0.0 and parameters: {'timeframe': 'M5', 'atr_period': 13, 'atr_threshold': 15.0, 'pt_mult': 0.5, 'sl_mult': 2.5, 'td_mins': 60}. Best is trial 17 with value: 2.3323020644376053.
[I 2026-03-12 01:46:40,309] Trial 233 finished with value: 0.0 and parameters: {'timeframe': 'M5', 'atr_period': 13, 'atr_threshold': 5.0, 'pt_mult': 1.0, 'sl_mult': 0.5, 'td_mins': 5}. Best is trial 17 with value: 2.3323020644376053.
[I 2026-03-12 01:46:40,395] Trial 234 pruned. 
[I 2026-03-12 01:46:40,443] Trial 235 pruned. 
[I 2026-03-12 01:46:40,487] Trial 236 finished with value: 0.0 and parameters: {'timeframe': 'M5', 'atr_period': 13, 'atr_threshold': 5.0, 'pt_mult': 0.5, 'sl_mult': 2.5, 'td_mins': 1080}. Best is trial 17 with value: 2.3323020644376053.
[I 2026-03-12 01:46:40,531] Trial 237 finished with value: 0.0 and parameters: {'timeframe': 'M5', 'atr_period': 13, 'atr_threshold': 5.0, 'pt_mult': 0.5, 'sl_mult': 5.0, 'td_mins': 720}. Best is trial 17 with value: 2.3323020644376053.
[I 2026-03-12 01:46:40,574] Trial 238 finished with value: 0.0 and parameters: {'timeframe': 'M5', 'atr_period': 13, 'atr_threshold': 8.0, 'pt_mult': 0.5, 'sl_mult': 0.5, 'td_mins': 1080}. Best is trial 17 with value: 2.3323020644376053.
[I 2026-03-12 01:46:40,617] Trial 239 finished with value: 0.0 and parameters: {'timeframe': 'M5', 'atr_period': 13, 'atr_threshold': 8.0, 'pt_mult': 5.0, 'sl_mult': 1.0, 'td_mins': 1200}. Best is trial 17 with value: 2.3323020644376053.
[I 2026-03-12 01:46:40,752] Trial 240 pruned. 
[I 2026-03-12 01:46:41,080] Trial 241 pruned. 
[I 2026-03-12 01:46:41,125] Trial 242 finished with value: 0.0 and parameters: {'timeframe': 'M5', 'atr_period': 13, 'atr_threshold': 10.0, 'pt_mult': 5.0, 'sl_mult': 2.5, 'td_mins': 30}. Best is trial 17 with value: 2.3323020644376053.
[I 2026-03-12 01:46:41,632] Trial 243 pruned. 
[I 2026-03-12 01:46:41,683] Trial 244 finished with value: 0.0 and parameters: {'timeframe': 'M5', 'atr_period': 13, 'atr_threshold': 8.0, 'pt_mult': 0.5, 'sl_mult': 5.0, 'td_mins': 60}. Best is trial 17 with value: 2.3323020644376053.
[I 2026-03-12 01:46:41,815] Trial 245 pruned. 
[I 2026-03-12 01:46:41,858] Trial 246 finished with value: 0.0 and parameters: {'timeframe': 'M5', 'atr_period': 13, 'atr_threshold': 10.0, 'pt_mult': 1.0, 'sl_mult': 5.0, 'td_mins': 5}. Best is trial 17 with value: 2.3323020644376053.
[I 2026-03-12 01:46:42,035] Trial 247 pruned. 
[I 2026-03-12 01:46:42,081] Trial 248 finished with value: 0.0 and parameters: {'timeframe': 'M5', 'atr_period': 13, 'atr_threshold': 5.0, 'pt_mult': 2.5, 'sl_mult': 5.0, 'td_mins': 1080}. Best is trial 17 with value: 2.3323020644376053.
[I 2026-03-12 01:46:42,214] Trial 249 pruned. 
[I 2026-03-12 01:46:42,262] Trial 250 finished with value: 0.0 and parameters: {'timeframe': 'M5', 'atr_period': 13, 'atr_threshold': 15.0, 'pt_mult': 1.0, 'sl_mult': 5.0, 'td_mins': 120}. Best is trial 17 with value: 2.3323020644376053.
[I 2026-03-12 01:46:42,321] Trial 251 pruned. 
[I 2026-03-12 01:46:42,378] Trial 252 pruned. 
[I 2026-03-12 01:46:46,547] Trial 253 finished with value: 1.0857610488190874 and parameters: {'timeframe': 'M5', 'atr_period': 13, 'atr_threshold': 1.0, 'pt_mult': 1.0, 'sl_mult': 5.0, 'td_mins': 720}. Best is trial 17 with value: 2.3323020644376053.
[I 2026-03-12 01:46:46,592] Trial 254 finished with value: 0.0 and parameters: {'timeframe': 'M5', 'atr_period': 13, 'atr_threshold': 8.0, 'pt_mult': 2.5, 'sl_mult': 2.5, 'td_mins': 1200}. Best is trial 17 with value: 2.3323020644376053.
[I 2026-03-12 01:46:47,380] Trial 255 pruned. 
[I 2026-03-12 01:46:47,425] Trial 256 finished with value: 0.0 and parameters: {'timeframe': 'M5', 'atr_period': 13, 'atr_threshold': 5.0, 'pt_mult': 5.0, 'sl_mult': 0.5, 'td_mins': 30}. Best is trial 17 with value: 2.3323020644376053.
[I 2026-03-12 01:46:47,478] Trial 257 finished with value: 0.0 and parameters: {'timeframe': 'M5', 'atr_period': 13, 'atr_threshold': 8.0, 'pt_mult': 1.0, 'sl_mult': 5.0, 'td_mins': 180}. Best is trial 17 with value: 2.3323020644376053.
[I 2026-03-12 01:46:47,523] Trial 258 finished with value: 0.0 and parameters: {'timeframe': 'M5', 'atr_period': 13, 'atr_threshold': 5.0, 'pt_mult': 2.5, 'sl_mult': 2.5, 'td_mins': 180}. Best is trial 17 with value: 2.3323020644376053.
[I 2026-03-12 01:46:49,441] Trial 259 finished with value: 1.214802905159012 and parameters: {'timeframe': 'M5', 'atr_period': 13, 'atr_threshold': 2.0, 'pt_mult': 0.5, 'sl_mult': 5.0, 'td_mins': 720}. Best is trial 17 with value: 2.3323020644376053.
[I 2026-03-12 01:46:49,487] Trial 260 finished with value: 0.0 and parameters: {'timeframe': 'M5', 'atr_period': 13, 'atr_threshold': 8.0, 'pt_mult': 0.5, 'sl_mult': 1.0, 'td_mins': 120}. Best is trial 17 with value: 2.3323020644376053.
[I 2026-03-12 01:46:49,594] Trial 261 pruned. 
[I 2026-03-12 01:46:49,643] Trial 262 finished with value: 0.0 and parameters: {'timeframe': 'M5', 'atr_period': 13, 'atr_threshold': 10.0, 'pt_mult': 5.0, 'sl_mult': 1.0, 'td_mins': 5}. Best is trial 17 with value: 2.3323020644376053.
[I 2026-03-12 01:46:49,691] Trial 263 finished with value: 0.0 and parameters: {'timeframe': 'M5', 'atr_period': 13, 'atr_threshold': 5.0, 'pt_mult': 2.5, 'sl_mult': 0.5, 'td_mins': 1200}. Best is trial 17 with value: 2.3323020644376053.
[I 2026-03-12 01:46:49,751] Trial 264 pruned. 
[I 2026-03-12 01:46:49,899] Trial 265 pruned. 
[I 2026-03-12 01:46:51,890] Trial 266 pruned. 
[I 2026-03-12 01:46:51,936] Trial 267 finished with value: 0.0 and parameters: {'timeframe': 'M5', 'atr_period': 13, 'atr_threshold': 15.0, 'pt_mult': 2.5, 'sl_mult': 5.0, 'td_mins': 1200}. Best is trial 17 with value: 2.3323020644376053.
[I 2026-03-12 01:46:52,072] Trial 268 pruned. 
[I 2026-03-12 01:46:52,119] Trial 269 finished with value: 0.0 and parameters: {'timeframe': 'M5', 'atr_period': 13, 'atr_threshold': 5.0, 'pt_mult': 2.5, 'sl_mult': 1.0, 'td_mins': 120}. Best is trial 17 with value: 2.3323020644376053.
[I 2026-03-12 01:46:52,165] Trial 270 finished with value: 0.0 and parameters: {'timeframe': 'M5', 'atr_period': 13, 'atr_threshold': 8.0, 'pt_mult': 5.0, 'sl_mult': 1.0, 'td_mins': 180}. Best is trial 17 with value: 2.3323020644376053.
[I 2026-03-12 01:46:52,269] Trial 271 pruned. 
[I 2026-03-12 01:46:53,135] Trial 272 pruned. 
[I 2026-03-12 01:46:53,430] Trial 273 pruned. 
[I 2026-03-12 01:46:53,476] Trial 274 finished with value: 0.0 and parameters: {'timeframe': 'M5', 'atr_period': 13, 'atr_threshold': 10.0, 'pt_mult': 1.0, 'sl_mult': 2.5, 'td_mins': 1200}. Best is trial 17 with value: 2.3323020644376053.
[I 2026-03-12 01:46:53,521] Trial 275 finished with value: 0.0 and parameters: {'timeframe': 'M5', 'atr_period': 13, 'atr_threshold': 15.0, 'pt_mult': 1.0, 'sl_mult': 2.5, 'td_mins': 15}. Best is trial 17 with value: 2.3323020644376053.
[I 2026-03-12 01:46:53,639] Trial 276 pruned. 
[I 2026-03-12 01:46:54,016] Trial 277 pruned. 
[I 2026-03-12 01:46:54,131] Trial 278 pruned. 
[I 2026-03-12 01:46:54,277] Trial 279 pruned. 
[I 2026-03-12 01:46:54,720] Trial 280 pruned. 
[I 2026-03-12 01:46:54,774] Trial 281 finished with value: 0.0 and parameters: {'timeframe': 'M5', 'atr_period': 13, 'atr_threshold': 15.0, 'pt_mult': 1.0, 'sl_mult': 1.0, 'td_mins': 15}. Best is trial 17 with value: 2.3323020644376053.
[I 2026-03-12 01:46:54,826] Trial 282 finished with value: 0.0 and parameters: {'timeframe': 'M5', 'atr_period': 13, 'atr_threshold': 8.0, 'pt_mult': 1.0, 'sl_mult': 1.0, 'td_mins': 5}. Best is trial 17 with value: 2.3323020644376053.
[I 2026-03-12 01:46:54,877] Trial 283 finished with value: 0.0 and parameters: {'timeframe': 'M5', 'atr_period': 13, 'atr_threshold': 5.0, 'pt_mult': 1.0, 'sl_mult': 0.5, 'td_mins': 120}. Best is trial 17 with value: 2.3323020644376053.
[I 2026-03-12 01:46:54,925] Trial 284 finished with value: 0.0 and parameters: {'timeframe': 'M5', 'atr_period': 13, 'atr_threshold': 15.0, 'pt_mult': 1.0, 'sl_mult': 1.0, 'td_mins': 720}. Best is trial 17 with value: 2.3323020644376053.
[I 2026-03-12 01:46:54,974] Trial 285 finished with value: 0.0 and parameters: {'timeframe': 'M5', 'atr_period': 13, 'atr_threshold': 10.0, 'pt_mult': 5.0, 'sl_mult': 2.5, 'td_mins': 30}. Best is trial 17 with value: 2.3323020644376053.
[I 2026-03-12 01:46:55,021] Trial 286 pruned. 
[I 2026-03-12 01:46:55,356] Trial 287 pruned. 
[I 2026-03-12 01:46:55,402] Trial 288 finished with value: 0.0 and parameters: {'timeframe': 'M5', 'atr_period': 13, 'atr_threshold': 10.0, 'pt_mult': 2.5, 'sl_mult': 5.0, 'td_mins': 360}. Best is trial 17 with value: 2.3323020644376053.
[I 2026-03-12 01:46:55,690] Trial 289 pruned. 
[I 2026-03-12 01:46:56,030] Trial 290 pruned. 
[I 2026-03-12 01:46:56,074] Trial 291 finished with value: 0.0 and parameters: {'timeframe': 'M5', 'atr_period': 13, 'atr_threshold': 10.0, 'pt_mult': 2.5, 'sl_mult': 0.5, 'td_mins': 15}. Best is trial 17 with value: 2.3323020644376053.
[I 2026-03-12 01:46:56,120] Trial 292 finished with value: 0.0 and parameters: {'timeframe': 'M5', 'atr_period': 13, 'atr_threshold': 15.0, 'pt_mult': 0.5, 'sl_mult': 1.0, 'td_mins': 15}. Best is trial 17 with value: 2.3323020644376053.
[I 2026-03-12 01:46:56,165] Trial 293 finished with value: 0.0 and parameters: {'timeframe': 'M5', 'atr_period': 13, 'atr_threshold': 10.0, 'pt_mult': 5.0, 'sl_mult': 1.0, 'td_mins': 360}. Best is trial 17 with value: 2.3323020644376053.
[I 2026-03-12 01:46:56,725] Trial 294 pruned. 
[I 2026-03-12 01:46:56,791] Trial 295 pruned. 
[I 2026-03-12 01:46:56,886] Trial 296 pruned. 
[I 2026-03-12 01:46:58,377] Trial 297 finished with value: 0.934068341167498 and parameters: {'timeframe': 'M5', 'atr_period': 13, 'atr_threshold': 2.0, 'pt_mult': 5.0, 'sl_mult': 5.0, 'td_mins': 360}. Best is trial 17 with value: 2.3323020644376053.
[I 2026-03-12 01:46:58,436] Trial 298 pruned. 
[I 2026-03-12 01:46:58,484] Trial 299 finished with value: 0.0 and parameters: {'timeframe': 'M5', 'atr_period': 13, 'atr_threshold': 8.0, 'pt_mult': 5.0, 'sl_mult': 0.5, 'td_mins': 1200}. Best is trial 17 with value: 2.3323020644376053.
[I 2026-03-12 01:47:02,747] Trial 300 finished with value: 1.0857610488190874 and parameters: {'timeframe': 'M5', 'atr_period': 13, 'atr_threshold': 1.0, 'pt_mult': 1.0, 'sl_mult': 5.0, 'td_mins': 720}. Best is trial 17 with value: 2.3323020644376053.
[I 2026-03-12 01:47:07,011] Trial 301 finished with value: 1.0857610488190874 and parameters: {'timeframe': 'M5', 'atr_period': 13, 'atr_threshold': 1.0, 'pt_mult': 1.0, 'sl_mult': 5.0, 'td_mins': 720}. Best is trial 17 with value: 2.3323020644376053.
[I 2026-03-12 01:47:11,581] Trial 302 finished with value: 1.0857610488190874 and parameters: {'timeframe': 'M5', 'atr_period': 13, 'atr_threshold': 1.0, 'pt_mult': 1.0, 'sl_mult': 5.0, 'td_mins': 720}. Best is trial 17 with value: 2.3323020644376053.
[I 2026-03-12 01:47:15,888] Trial 303 finished with value: 1.0857610488190874 and parameters: {'timeframe': 'M5', 'atr_period': 13, 'atr_threshold': 1.0, 'pt_mult': 1.0, 'sl_mult': 5.0, 'td_mins': 720}. Best is trial 17 with value: 2.3323020644376053.
[I 2026-03-12 01:47:20,161] Trial 304 finished with value: 1.0857610488190874 and parameters: {'timeframe': 'M5', 'atr_period': 13, 'atr_threshold': 1.0, 'pt_mult': 1.0, 'sl_mult': 5.0, 'td_mins': 720}. Best is trial 17 with value: 2.3323020644376053.
[I 2026-03-12 01:47:24,361] Trial 305 finished with value: 1.0857610488190874 and parameters: {'timeframe': 'M5', 'atr_period': 13, 'atr_threshold': 1.0, 'pt_mult': 1.0, 'sl_mult': 5.0, 'td_mins': 720}. Best is trial 17 with value: 2.3323020644376053.
[I 2026-03-12 01:47:28,860] Trial 306 finished with value: 1.0857610488190874 and parameters: {'timeframe': 'M5', 'atr_period': 13, 'atr_threshold': 1.0, 'pt_mult': 1.0, 'sl_mult': 5.0, 'td_mins': 720}. Best is trial 17 with value: 2.3323020644376053.
[I 2026-03-12 01:47:33,132] Trial 307 finished with value: 1.0857610488190874 and parameters: {'timeframe': 'M5', 'atr_period': 13, 'atr_threshold': 1.0, 'pt_mult': 1.0, 'sl_mult': 5.0, 'td_mins': 720}. Best is trial 17 with value: 2.3323020644376053.
[I 2026-03-12 01:47:33,666] Trial 308 finished with value: 1.879311938277294 and parameters: {'timeframe': 'M5', 'atr_period': 13, 'atr_threshold': 3.0, 'pt_mult': 0.5, 'sl_mult': 5.0, 'td_mins': 360}. Best is trial 17 with value: 2.3323020644376053.
[I 2026-03-12 01:47:34,035] Trial 309 finished with value: 1.8893132556849117 and parameters: {'timeframe': 'M5', 'atr_period': 13, 'atr_threshold': 1.0, 'pt_mult': 0.5, 'sl_mult': 5.0, 'td_mins': 30}. Best is trial 17 with value: 2.3323020644376053.
[I 2026-03-12 01:47:34,565] Trial 310 finished with value: 1.879311938277294 and parameters: {'timeframe': 'M5', 'atr_period': 13, 'atr_threshold': 3.0, 'pt_mult': 0.5, 'sl_mult': 5.0, 'td_mins': 360}. Best is trial 17 with value: 2.3323020644376053.
[I 2026-03-12 01:47:35,132] Trial 311 finished with value: 1.879311938277294 and parameters: {'timeframe': 'M5', 'atr_period': 13, 'atr_threshold': 3.0, 'pt_mult': 0.5, 'sl_mult': 5.0, 'td_mins': 360}. Best is trial 17 with value: 2.3323020644376053.
[I 2026-03-12 01:47:35,655] Trial 312 finished with value: 1.879311938277294 and parameters: {'timeframe': 'M5', 'atr_period': 13, 'atr_threshold': 3.0, 'pt_mult': 0.5, 'sl_mult': 5.0, 'td_mins': 360}. Best is trial 17 with value: 2.3323020644376053.
[I 2026-03-12 01:47:36,192] Trial 313 finished with value: 1.879311938277294 and parameters: {'timeframe': 'M5', 'atr_period': 13, 'atr_threshold': 3.0, 'pt_mult': 0.5, 'sl_mult': 5.0, 'td_mins': 360}. Best is trial 17 with value: 2.3323020644376053.
[I 2026-03-12 01:47:36,712] Trial 314 finished with value: 1.879311938277294 and parameters: {'timeframe': 'M5', 'atr_period': 13, 'atr_threshold': 3.0, 'pt_mult': 0.5, 'sl_mult': 5.0, 'td_mins': 360}. Best is trial 17 with value: 2.3323020644376053.
[I 2026-03-12 01:47:37,227] Trial 315 finished with value: 1.879311938277294 and parameters: {'timeframe': 'M5', 'atr_period': 13, 'atr_threshold': 3.0, 'pt_mult': 0.5, 'sl_mult': 5.0, 'td_mins': 360}. Best is trial 17 with value: 2.3323020644376053.
[I 2026-03-12 01:47:37,738] Trial 316 finished with value: 1.879311938277294 and parameters: {'timeframe': 'M5', 'atr_period': 13, 'atr_threshold': 3.0, 'pt_mult': 0.5, 'sl_mult': 5.0, 'td_mins': 360}. Best is trial 17 with value: 2.3323020644376053.
